A1: 観測カンソク数スウ | D1: 「使用する前に必ずお読みください」
A2: AABBCCDD | B2: AABBCCDd | C2: AABBCCdd | D2: AABBCcDD | E2: AABBCcDd | F2: AABBCcdd | G2: AABBccDD | H2: AABBccDd | I2: AABBccdd | J2: AABbCCDD | K2: AABbCCDd | L2: AABbCCdd | M2: AABbCcDD | N2: AABbCcDd | O2: AABbCcdd | P2: AABbccDD | Q2: AABbccDd | R2: AABbccdd | S2: AAbbCCDD | T2: AAbbCCDd | U2: AAbbCCdd | V2: AAbbCcDD | W2: AAbbCcDd | X2: AAbbCcdd | Y2: AAbbccDD | Z2: AAbbccDd | AA2: AAbbccdd | AB2: sum
A3: 100 | B3: 30 | C3: 200 | D3: 2 | E3: 4 | F3: 1 | G3: 1 | H3: 2 | I3: 1 | J3: 2 | K3: 4 | L3: 2 | M3: 4 | N3: 8 | O3: 4 | P3: 2 | Q3: 4 | R3: 2 | S3: 1 | T3: 2 | U3: 1 | V3: 2 | W3: 4 | X3: 2 | Y3: 1 | Z3: 2 | AA3: 1 | AB3: =SUM(A3:AA3) -> 389
A4: 観測カンソク数スウ | AT4: =AC4+E4*s!AT3*s!AW3/(s!AT3*s!AW3+s!AU3*s!AV3)+K4*s!AT3*s!AY3/(s!AT3*s!AY3+s!AU3*s!AX3)+M4*s!AT3*s!AZ3/(s!AT3*s!AZ3+s!AV3*s!AX3)+N4*s!AT3*s!BA3/(s!AT3*s!BA3+s!AU3*s!AZ3+s!AV3*s!AY3+s!AW3*s!AX3) -> 0
A5: AaBBCCDD | B5: AaBBCCDd | C5: AaBBCCdd | D5: AaBBCcDD | E5: AaBBCcDd | F5: AaBBCcdd | G5: AaBBccDD | H5: AaBBccDd | I5: AaBBccdd | J5: AaBbCCDD | K5: AaBbCCDd | L5: AaBbCCdd | M5: AaBbCcDD | N5: AaBbCcDd | O5: AaBbCcdd | P5: AaBbccDD | Q5: AaBbccDd | R5: AaBbccdd | S5: AabbCCDD | T5: AabbCCDd | U5: AabbCCdd | V5: AabbCcDD | W5: AabbCcDd | X5: AabbCcdd | Y5: AabbccDD | Z5: AabbccDd | AA5: Aabbccdd | AB5: sum
A6: 100 | B6: 3 | C6: 30 | D6: 4 | E6: 9 | F6: 4 | G6: 2 | H6: 4 | I6: 2 | J6: 4 | K6: 2 | L6: 2 | M6: 2 | N6: 50 | O6: 3 | P6: 4 | Q6: 8 | R6: 4 | S6: 2 | T6: 4 | U6: 2 | V6: 4 | W6: 8 | X6: 4 | Y6: 2 | Z6: 4 | AA6: 2 | AB6: =SUM(A6:AA6) -> 269
A7: 観測カンソク数スウ
A8: aaBBCCDD | B8: aaBBCCDd | C8: aaBBCCdd | D8: aaBBCcDD | E8: aaBBCcDd | F8: aaBBCcdd | G8: aaBBccDD | H8: aaBBccDd | I8: aaBBccdd | J8: aaBbCCDD | K8: aaBbCCDd | L8: aaBbCCdd | M8: aaBbCcDD | N8: aaBbCcDd | O8: aaBbCcdd | P8: aaBbccDD | Q8: aaBbccDd | R8: aaBbccdd | S8: aabbCCDD | T8: aabbCCDd | U8: aabbCCdd | V8: aabbCcDD | W8: aabbCcDd | X8: aabbCcdd | Y8: aabbccDD | Z8: aabbccDd | AA8: aabbccdd | AB8: sum
A9: 100 | B9: 1 | C9: 1 | D9: 2 | E9: 5 | F9: 2 | G9: 1 | H9: 2 | I9: 1 | J9: 2 | K9: 4 | L9: 2 | M9: 4 | N9: 8 | O9: 4 | P9: 2 | Q9: 4 | R9: 2 | S9: 1 | T9: 2 | U9: 1 | V9: 2 | W9: 4 | X9: 2 | Y9: 1 | Z9: 2 | AA9: 1 | AB9: =SUM(A9:AA9) -> 163
AB10: =AB3+AB6+AB9 -> 821
A13: Haplotype頻度ヒンド
A14: ABCD | B14: ABCd | C14: ABcD | D14: ABcd | E14: AbCD | F14: AbCd | G14: AbcD | H14: Abcd | I14: aBCD | J14: aBCd | K14: aBcD | L14: aBcd | M14: abCD | N14: abCd | O14: abcD | P14: abcd
A15: =s!BK102 -> 0.22363773559684258 | B15: =s!BL102 -> 0.31192159461984797 | C15: =s!BM102 -> 1.6476406937291469E-2 | D15: =s!BN102 -> 1.1216170111377455E-2 | E15: =s!BO102 -> 1.6705934411329094E-2 | F15: =s!BP102 -> 1.1189308960900422E-2 | G15: =s!BQ102 -> 1.6884770072809946E-2 | H15: =s!BR102 -> 2.9605107304217299E-2 | I15: =s!BS102 -> 0.2111261017153109 | J15: =s!BT102 -> 2.6483827345060183E-2 | K15: =s!BU102 -> 1.3330039206286549E-2 | L15: =s!BV102 -> 2.0765493530102205E-2 | M15: =s!BW102 -> 1.1559696334412131E-2 | N15: =s!BX102 -> 1.6852049493763174E-2 | O15: =s!BY102 -> 3.3519267004645512E-2 | P15: =s!BZ102 -> 2.8726497355803085E-2 | Q15: =s!CA102 -> 1
A16: =s!BK102-s!BK101 -> 0 | B16: =s!BL102-s!BL101 -> 0 | C16: =s!BM102-s!BM101 -> 0 | D16: =s!BN102-s!BN101 -> 0 | E16: =s!BO102-s!BO101 -> 0 | F16: =s!BP102-s!BP101 -> 0 | G16: =s!BQ102-s!BQ101 -> 0 | H16: =s!BR102-s!BR101 -> 0 | I16: =s!BS102-s!BS101 -> 0 | J16: =s!BT102-s!BT101 -> 0 | K16: =s!BU102-s!BU101 -> 0 | L16: =s!BV102-s!BV101 -> 0 | M16: =s!BW102-s!BW101 -> 0 | N16: =s!BX102-s!BX101 -> 0 | O16: =s!BY102-s!BY101 -> 0 | P16: =s!BZ102-s!BZ101 -> 0 | Q16: =SUM(A16:P16) -> 0