AC1: 確定カクテイ分ブン | AT1: 確定カクテイ＋推定スイテイ分ブン | BK1: Haplotype頻度ヒンド
AC2: ABCD | AD2: AB Cd | AE2: ABcD | AF2: ABcd | AG2: AbCD | AH2: AbCd | AI2: AbcD | AJ2: Abcd | AK2: aBCD | AL2: aB Cd | AM2: aBcD | AN2: aBcd | AO2: abCD | AP2: abCd | AQ2: abcD | AR2: abcd | AT2: ABCD | AU2: AB Cd | AV2: ABcD | AW2: ABcd | AX2: AbCD | AY2: AbCd | AZ2: AbcD | BA2: Abcd | BB2: aBCD | BC2: aB Cd | BD2: aBcD | BE2: aBcd | BF2: abCD | BG2: abCd | BH2: abcD | BI2: abcd | BJ2: sum | BK2: ABCD | BL2: ABCd | BM2: ABcD | BN2: ABcd | BO2: AbCD | BP2: AbCd | BQ2: AbcD | BR2: Abcd | BS2: aBCD | BT2: aBCd | BU2: aBcD | BV2: aBcd | BW2: abCD | BX2: abCd | BY2: abcD | BZ2: abcd
AC3: =AA!AC3+'A-hetero'!AC3+'a-homo'!AC3 -> 334 | AD3: =AA!AD3+'A-hetero'!AD3+'a-homo'!AD3 -> 463 | AE3: =AA!AE3+'A-hetero'!AE3+'a-homo'!AE3 -> 10 | AF3: =AA!AF3+'A-hetero'!AF3+'a-homo'!AF3 -> 9 | AG3: =AA!AG3+'A-hetero'!AG3+'a-homo'!AG3 -> 10 | AH3: =AA!AH3+'A-hetero'!AH3+'a-homo'!AH3 -> 10 | AI3: =AA!AI3+'A-hetero'!AI3+'a-homo'!AI3 -> 10 | AJ3: =AA!AJ3+'A-hetero'!AJ3+'a-homo'!AJ3 -> 10 | AK3: =AA!AK3+'A-hetero'!AK3+'a-homo'!AK3 -> 305 | AL3: =AA!AL3+'A-hetero'!AL3+'a-homo'!AL3 -> 37 | AM3: =AA!AM3+'A-hetero'!AM3+'a-homo'!AM3 -> 10 | AN3: =AA!AN3+'A-hetero'!AN3+'a-homo'!AN3 -> 10 | AO3: =AA!AO3+'A-hetero'!AO3+'a-homo'!AO3 -> 10 | AP3: =AA!AP3+'A-hetero'!AP3+'a-homo'!AP3 -> 10 | AQ3: =AA!AQ3+'A-hetero'!AQ3+'a-homo'!AQ3 -> 10 | AR3: =AA!AR3+'A-hetero'!AR3+'a-homo'!AR3 -> 10 | AS3: =SUM(AC3:AJ3) -> 856 | AT3: =AA!AT3+'A-hetero'!AT3+'a-homo'!AT3 -> 357 | AU3: =AA!AU3+'A-hetero'!AU3+'a-homo'!AU3 -> 485.25 | AV3: =AA!AV3+'A-hetero'!AV3+'a-homo'!AV3 -> 35 | AW3: =AA!AW3+'A-hetero'!AW3+'a-homo'!AW3 -> 34.25 | AX3: =AA!AX3+'A-hetero'!AX3+'a-homo'!AX3 -> 33.25 | AY3: =AA!AY3+'A-hetero'!AY3+'a-homo'!AY3 -> 32.5 | AZ3: =AA!AZ3+'A-hetero'!AZ3+'a-homo'!AZ3 -> 34.75 | BA3: =AA!BA3+'A-hetero'!BA3+'a-homo'!BA3 -> 35 | BB3: =AA!BB3+'A-hetero'!BB3+'a-homo'!BB3 -> 328.5 | BC3: =AA!BC3+'A-hetero'!BC3+'a-homo'!BC3 -> 59.75 | BD3: =AA!BD3+'A-hetero'!BD3+'a-homo'!BD3 -> 35.5 | BE3: =AA!BE3+'A-hetero'!BE3+'a-homo'!BE3 -> 35.75 | BF3: =AA!BF3+'A-hetero'!BF3+'a-homo'!BF3 -> 33.25 | BG3: =AA!BG3+'A-hetero'!BG3+'a-homo'!BG3 -> 32.5 | BH3: =AA!BH3+'A-hetero'!BH3+'a-homo'!BH3 -> 34.75 | BI3: =AA!BI3+'A-hetero'!BI3+'a-homo'!BI3 -> 35 | BJ3: =SUM(AT3:BI3) -> 1642 | BK3: =AT3/BJ3 -> 0.2174177831912302 | BL3: =AU3/BJ3 -> 0.29552375152253352 | BM3: =AV3/BJ3 -> 2.1315468940316686E-2 | BN3: =AW3/BJ3 -> 2.0858708891595613E-2 | BO3: =AX3/BJ3 -> 2.0249695493300853E-2 | BP3: =AY3/BJ3 -> 1.979293544457978E-2 | BQ3: =AZ3/BJ3 -> 2.1163215590742995E-2 | BR3: =BA3/BJ3 -> 2.1315468940316686E-2 | BS3: =BB3/BJ3 -> 0.20006090133982948 | BT3: =BC3/BJ3 -> 3.6388550548112061E-2 | BU3: =BD3/BJ3 -> 2.1619975639464068E-2 | BV3: =BE3/BJ3 -> 2.1772228989037759E-2 | BW3: =BF3/BJ3 -> 2.0249695493300853E-2 | BX3: =BG3/BJ3 -> 1.979293544457978E-2 | BY3: =BH3/BJ3 -> 2.1163215590742995E-2 | BZ3: =BI3/BJ3 -> 2.1315468940316686E-2 | CA3: =SUM(BK3:BZ3) -> 1
AC4: =AA!AC4+'A-hetero'!AC4+'a-homo'!AC4 -> 334 | AD4: =AA!AD4+'A-hetero'!AD4+'a-homo'!AD4 -> 463 | AE4: =AA!AE4+'A-hetero'!AE4+'a-homo'!AE4 -> 10 | AF4: =AA!AF4+'A-hetero'!AF4+'a-homo'!AF4 -> 9 | AG4: =AA!AG4+'A-hetero'!AG4+'a-homo'!AG4 -> 10 | AH4: =AA!AH4+'A-hetero'!AH4+'a-homo'!AH4 -> 10 | AI4: =AA!AI4+'A-hetero'!AI4+'a-homo'!AI4 -> 10 | AJ4: =AA!AJ4+'A-hetero'!AJ4+'a-homo'!AJ4 -> 10 | AK4: =AA!AK4+'A-hetero'!AK4+'a-homo'!AK4 -> 305 | AL4: =AA!AL4+'A-hetero'!AL4+'a-homo'!AL4 -> 37 | AM4: =AA!AM4+'A-hetero'!AM4+'a-homo'!AM4 -> 10 | AN4: =AA!AN4+'A-hetero'!AN4+'a-homo'!AN4 -> 10 | AO4: =AA!AO4+'A-hetero'!AO4+'a-homo'!AO4 -> 10 | AP4: =AA!AP4+'A-hetero'!AP4+'a-homo'!AP4 -> 10 | AQ4: =AA!AQ4+'A-hetero'!AQ4+'a-homo'!AQ4 -> 10 | AR4: =AA!AR4+'A-hetero'!AR4+'a-homo'!AR4 -> 10 | AS4: =SUM(AC4:AJ4) -> 856 | AT4: =AA!AT4+'A-hetero'!AT4+'a-homo'!AT4 -> 366.0112197999436 | AU4: =AA!AU4+'A-hetero'!AU4+'a-homo'!AU4 -> 508.16984953580811 | AV4: =AA!AV4+'A-hetero'!AV4+'a-homo'!AV4 -> 24.621813322648077 | AW4: =AA!AW4+'A-hetero'!AW4+'a-homo'!AW4 -> 23.164017531208216 | AX4: =AA!AX4+'A-hetero'!AX4+'a-homo'!AX4 -> 24.37315623937754 | AY4: =AA!AY4+'A-hetero'!AY4+'a-homo'!AY4 -> 22.271206108470039 | AZ4: =AA!AZ4+'A-hetero'!AZ4+'a-homo'!AZ4 -> 34.930881962496677 | BA4: =AA!BA4+'A-hetero'!BA4+'a-homo'!BA4 -> 43.457855500047657 | BB4: =AA!BB4+'A-hetero'!BB4+'a-homo'!BB4 -> 344.30501025434341 | BC4: =AA!BC4+'A-hetero'!BC4+'a-homo'!BC4 -> 46.012730928608143 | BD4: =AA!BD4+'A-hetero'!BD4+'a-homo'!BD4 -> 26.712574336439896 | BE4: =AA!BE4+'A-hetero'!BE4+'a-homo'!BE4 -> 32.002784291000417 | BF4: =AA!BF4+'A-hetero'!BF4+'a-homo'!BF4 -> 23.828176446085838 | BG4: =AA!BG4+'A-hetero'!BG4+'a-homo'!BG4 -> 27.028650687363189 | BH4: =AA!BH4+'A-hetero'!BH4+'a-homo'!BH4 -> 47.217167638664876 | BI4: =AA!BI4+'A-hetero'!BI4+'a-homo'!BI4 -> 47.892905417494184 | BJ4: =SUM(AT4:BI4) -> 1642 | BK4: =AT4/BJ4 -> 0.22290573678437497 | BL4: =AU4/BJ4 -> 0.3094822469767407 | BM4: =AV4/BJ4 -> 1.4995014203805166E-2 | BN4: =AW4/BJ4 -> 1.4107197034840575E-2 | BO4: =AX4/BJ4 -> 1.4843578708512514E-2 | BP4: =AY4/BJ4 -> 1.3563462916242415E-2 | BQ4: =AZ4/BJ4 -> 2.1273375129413328E-2 | BR4: =BA4/BJ4 -> 2.6466416260686767E-2 | BS4: =BB4/BJ4 -> 0.20968636434491078 | BT4: =BC4/BJ4 -> 2.8022369627654174E-2 | BU4: =BD4/BJ4 -> 1.6268315673836724E-2 | BV4: =BE4/BJ4 -> 1.9490124415956409E-2 | BW4: =BF4/BJ4 -> 1.4511678712597956E-2 | BX4: =BG4/BJ4 -> 1.646081040643313E-2 | BY4: =BH4/BJ4 -> 2.8755887721476789E-2 | BZ4: =BI4/BJ4 -> 2.9167421082517783E-2 | CA4: =SUM(BK4:BZ4) -> 1
AC5: =AA!AC5+'A-hetero'!AC5+'a-homo'!AC5 -> 334 | AD5: =AA!AD5+'A-hetero'!AD5+'a-homo'!AD5 -> 463 | AE5: =AA!AE5+'A-hetero'!AE5+'a-homo'!AE5 -> 10 | AF5: =AA!AF5+'A-hetero'!AF5+'a-homo'!AF5 -> 9 | AG5: =AA!AG5+'A-hetero'!AG5+'a-homo'!AG5 -> 10 | AH5: =AA!AH5+'A-hetero'!AH5+'a-homo'!AH5 -> 10 | AI5: =AA!AI5+'A-hetero'!AI5+'a-homo'!AI5 -> 10 | AJ5: =AA!AJ5+'A-hetero'!AJ5+'a-homo'!AJ5 -> 10 | AK5: =AA!AK5+'A-hetero'!AK5+'a-homo'!AK5 -> 305 | AL5: =AA!AL5+'A-hetero'!AL5+'a-homo'!AL5 -> 37 | AM5: =AA!AM5+'A-hetero'!AM5+'a-homo'!AM5 -> 10 | AN5: =AA!AN5+'A-hetero'!AN5+'a-homo'!AN5 -> 10 | AO5: =AA!AO5+'A-hetero'!AO5+'a-homo'!AO5 -> 10 | AP5: =AA!AP5+'A-hetero'!AP5+'a-homo'!AP5 -> 10 | AQ5: =AA!AQ5+'A-hetero'!AQ5+'a-homo'!AQ5 -> 10 | AR5: =AA!AR5+'A-hetero'!AR5+'a-homo'!AR5 -> 10 | AS5: =SUM(AC5:AJ5) -> 856 | AT5: =AA!AT5+'A-hetero'!AT5+'a-homo'!AT5 -> 368.4096400572505 | AU5: =AA!AU5+'A-hetero'!AU5+'a-homo'!AU5 -> 510.88699360372823 | AV5: =AA!AV5+'A-hetero'!AV5+'a-homo'!AV5 -> 24.240371452200314 | AW5: =AA!AW5+'A-hetero'!AW5+'a-homo'!AW5 -> 20.871405453776383 | AX5: =AA!AX5+'A-hetero'!AX5+'a-homo'!AX5 -> 24.508151930086314 | AY5: =AA!AY5+'A-hetero'!AY5+'a-homo'!AY5 -> 20.395283629296447 | AZ5: =AA!AZ5+'A-hetero'!AZ5+'a-homo'!AZ5 -> 32.452764130732582 | BA5: =AA!BA5+'A-hetero'!BA5+'a-homo'!BA5 -> 45.235389742929215 | BB5: =AA!BB5+'A-hetero'!BB5+'a-homo'!BB5 -> 345.72975509383775 | BC5: =AA!BC5+'A-hetero'!BC5+'a-homo'!BC5 -> 44.217116710014757 | BD5: =AA!BD5+'A-hetero'!BD5+'a-homo'!BD5 -> 24.580896736303117 | BE5: =AA!BE5+'A-hetero'!BE5+'a-homo'!BE5 -> 32.063820892888899 | BF5: =AA!BF5+'A-hetero'!BF5+'a-homo'!BF5 -> 21.518140222363442 | BG5: =AA!BG5+'A-hetero'!BG5+'a-homo'!BG5 -> 26.334918753422514 | BH5: =AA!BH5+'A-hetero'!BH5+'a-homo'!BH5 -> 50.560280377225986 | BI5: =AA!BI5+'A-hetero'!BI5+'a-homo'!BI5 -> 49.995071213943497 | BJ5: =SUM(AT5:BI5) -> 1642 | BK5: =AT5/BJ5 -> 0.22436640685581635 | BL5: =AU5/BJ5 -> 0.31113702411920108 | BM5: =AV5/BJ5 -> 1.4762710994031859E-2 | BN5: =AW5/BJ5 -> 1.2710965562592193E-2 | BO5: =AX5/BJ5 -> 1.4925792892866207E-2 | BP5: =AY5/BJ5 -> 1.2421000992263365E-2 | BQ5: =AZ5/BJ5 -> 1.976416816731582E-2 | BR5: =BA5/BJ5 -> 2.7548958430529361E-2 | BS5: =BB5/BJ5 -> 0.21055405304131408 | BT5: =BC5/BJ5 -> 2.6928816510362212E-2 | BU5: =BD5/BJ5 -> 1.4970095454508595E-2 | BV5: =BE5/BJ5 -> 1.9527296524292873E-2 | BW5: =BF5/BJ5 -> 1.3104835701804774E-2 | BX5: =BG5/BJ5 -> 1.6038318363838313E-2 | BY5: =BH5/BJ5 -> 3.079188817127039E-2 | BZ5: =BI5/BJ5 -> 3.0447668217992382E-2 | CA5: =SUM(BK5:BZ5) -> 1
AC6: =AA!AC6+'A-hetero'!AC6+'a-homo'!AC6 -> 334 | AD6: =AA!AD6+'A-hetero'!AD6+'a-homo'!AD6 -> 463 | AE6: =AA!AE6+'A-hetero'!AE6+'a-homo'!AE6 -> 10 | AF6: =AA!AF6+'A-hetero'!AF6+'a-homo'!AF6 -> 9 | AG6: =AA!AG6+'A-hetero'!AG6+'a-homo'!AG6 -> 10 | AH6: =AA!AH6+'A-hetero'!AH6+'a-homo'!AH6 -> 10 | AI6: =AA!AI6+'A-hetero'!AI6+'a-homo'!AI6 -> 10 | AJ6: =AA!AJ6+'A-hetero'!AJ6+'a-homo'!AJ6 -> 10 | AK6: =AA!AK6+'A-hetero'!AK6+'a-homo'!AK6 -> 305 | AL6: =AA!AL6+'A-hetero'!AL6+'a-homo'!AL6 -> 37 | AM6: =AA!AM6+'A-hetero'!AM6+'a-homo'!AM6 -> 10 | AN6: =AA!AN6+'A-hetero'!AN6+'a-homo'!AN6 -> 10 | AO6: =AA!AO6+'A-hetero'!AO6+'a-homo'!AO6 -> 10 | AP6: =AA!AP6+'A-hetero'!AP6+'a-homo'!AP6 -> 10 | AQ6: =AA!AQ6+'A-hetero'!AQ6+'a-homo'!AQ6 -> 10 | AR6: =AA!AR6+'A-hetero'!AR6+'a-homo'!AR6 -> 10 | AS6: =SUM(AC6:AJ6) -> 856 | AT6: =AA!AT6+'A-hetero'!AT6+'a-homo'!AT6 -> 368.5887849144994 | AU6: =AA!AU6+'A-hetero'!AU6+'a-homo'!AU6 -> 511.34033458358124 | AV6: =AA!AV6+'A-hetero'!AV6+'a-homo'!AV6 -> 25.024060227974104 | AW6: =AA!AW6+'A-hetero'!AW6+'a-homo'!AW6 -> 20.037446443977405 | AX6: =AA!AX6+'A-hetero'!AX6+'a-homo'!AX6 -> 25.449924540343464 | AY6: =AA!AY6+'A-hetero'!AY6+'a-homo'!AY6 -> 19.743380063139785 | AZ6: =AA!AZ6+'A-hetero'!AZ6+'a-homo'!AZ6 -> 30.793045122567033 | BA6: =AA!BA6+'A-hetero'!BA6+'a-homo'!BA6 -> 46.023024103917614 | BB6: =AA!BB6+'A-hetero'!BB6+'a-homo'!BB6 -> 345.90127854299305 | BC6: =AA!BC6+'A-hetero'!BC6+'a-homo'!BC6 -> 43.874790969979337 | BD6: =AA!BD6+'A-hetero'!BD6+'a-homo'!BD6 -> 23.687834612754578 | BE6: =AA!BE6+'A-hetero'!BE6+'a-homo'!BE6 -> 32.545469704240986 | BF6: =AA!BF6+'A-hetero'!BF6+'a-homo'!BF6 -> 20.597656493720915 | BG6: =AA!BG6+'A-hetero'!BG6+'a-homo'!BG6 -> 26.503849891742906 | BH6: =AA!BH6+'A-hetero'!BH6+'a-homo'!BH6 -> 51.957415545147512 | BI6: =AA!BI6+'A-hetero'!BI6+'a-homo'!BI6 -> 49.931704239420782 | BJ6: =SUM(AT6:BI6) -> 1642 | BK6: =AT6/BJ6 -> 0.22447550847411654 | BL6: =AU6/BJ6 -> 0.31141311484992762 | BM6: =AV6/BJ6 -> 1.5239987958571316E-2 | BN6: =AW6/BJ6 -> 1.2203073351995983E-2 | BO6: =AX6/BJ6 -> 1.5499345030659842E-2 | BP6: =AY6/BJ6 -> 1.2023982986077821E-2 | BQ6: =AZ6/BJ6 -> 1.8753377053938508E-2 | BR6: =BA6/BJ6 -> 2.8028638309328627E-2 | BS6: =BB6/BJ6 -> 0.21065851311997139 | BT6: =BC6/BJ6 -> 2.672033554809947E-2 | BU6: =BD6/BJ6 -> 1.4426208655757963E-2 | BV6: =BE6/BJ6 -> 1.9820627103679038E-2 | BW6: =BF6/BJ6 -> 1.2544248778149155E-2 | BX6: =BG6/BJ6 -> 1.6141199690464618E-2 | BY6: =BH6/BJ6 -> 3.1642762207763402E-2 | BZ6: =BI6/BJ6 -> 3.0409076881498645E-2 | CA6: =SUM(BK6:BZ6) -> 1
AC7: =AA!AC7+'A-hetero'!AC7+'a-homo'!AC7 -> 334 | AD7: =AA!AD7+'A-hetero'!AD7+'a-homo'!AD7 -> 463 | AE7: =AA!AE7+'A-hetero'!AE7+'a-homo'!AE7 -> 10 | AF7: =AA!AF7+'A-hetero'!AF7+'a-homo'!AF7 -> 9 | AG7: =AA!AG7+'A-hetero'!AG7+'a-homo'!AG7 -> 10 | AH7: =AA!AH7+'A-hetero'!AH7+'a-homo'!AH7 -> 10 | AI7: =AA!AI7+'A-hetero'!AI7+'a-homo'!AI7 -> 10 | AJ7: =AA!AJ7+'A-hetero'!AJ7+'a-homo'!AJ7 -> 10 | AK7: =AA!AK7+'A-hetero'!AK7+'a-homo'!AK7 -> 305 | AL7: =AA!AL7+'A-hetero'!AL7+'a-homo'!AL7 -> 37 | AM7: =AA!AM7+'A-hetero'!AM7+'a-homo'!AM7 -> 10 | AN7: =AA!AN7+'A-hetero'!AN7+'a-homo'!AN7 -> 10 | AO7: =AA!AO7+'A-hetero'!AO7+'a-homo'!AO7 -> 10 | AP7: =AA!AP7+'A-hetero'!AP7+'a-homo'!AP7 -> 10 | AQ7: =AA!AQ7+'A-hetero'!AQ7+'a-homo'!AQ7 -> 10 | AR7: =AA!AR7+'A-hetero'!AR7+'a-homo'!AR7 -> 10 | AS7: =SUM(AC7:AJ7) -> 856 | AT7: =AA!AT7+'A-hetero'!AT7+'a-homo'!AT7 -> 368.354901221761 | AU7: =AA!AU7+'A-hetero'!AU7+'a-homo'!AU7 -> 511.56279019281061 | AV7: =AA!AV7+'A-hetero'!AV7+'a-homo'!AV7 -> 25.68614417016606 | AW7: =AA!AW7+'A-hetero'!AW7+'a-homo'!AW7 -> 19.537900439601295 | AX7: =AA!AX7+'A-hetero'!AX7+'a-homo'!AX7 -> 26.141234325190247 | AY7: =AA!AY7+'A-hetero'!AY7+'a-homo'!AY7 -> 19.330764488274674 | AZ7: =AA!AZ7+'A-hetero'!AZ7+'a-homo'!AZ7 -> 29.75722808202589 | BA7: =AA!BA7+'A-hetero'!BA7+'a-homo'!BA7 -> 46.629037080170193 | BB7: =AA!BB7+'A-hetero'!BB7+'a-homo'!BB7 -> 346.0599550294707 | BC7: =AA!BC7+'A-hetero'!BC7+'a-homo'!BC7 -> 43.741251765104302 | BD7: =AA!BD7+'A-hetero'!BD7+'a-homo'!BD7 -> 23.117422735531015 | BE7: =AA!BE7+'A-hetero'!BE7+'a-homo'!BE7 -> 32.939634445555001 | BF7: =AA!BF7+'A-hetero'!BF7+'a-homo'!BF7 -> 20.051553059009265 | BG7: =AA!BG7+'A-hetero'!BG7+'a-homo'!BG7 -> 26.75754991837918 | BH7: =AA!BH7+'A-hetero'!BH7+'a-homo'!BH7 -> 52.831561376845826 | BI7: =AA!BI7+'A-hetero'!BI7+'a-homo'!BI7 -> 49.501071670104707 | BJ7: =SUM(AT7:BI7) -> 1642 | BK7: =AT7/BJ7 -> 0.22433307017159623 | BL7: =AU7/BJ7 -> 0.31154859329647416 | BM7: =AV7/BJ7 -> 1.5643205950162033E-2 | BN7: =AW7/BJ7 -> 1.1898843142266318E-2 | BO7: =AX7/BJ7 -> 1.5920361952003803E-2 | BP7: =AY7/BJ7 -> 1.1772694572639875E-2 | BQ7: =AZ7/BJ7 -> 1.8122550598066924E-2 | BR7: =BA7/BJ7 -> 2.8397708331406937E-2 | BS7: =BB7/BJ7 -> 0.21075514922623062 | BT7: =BC7/BJ7 -> 2.6639008383132948E-2 | BU7: =BD7/BJ7 -> 1.4078820179982347E-2 | BV7: =BE7/BJ7 -> 2.0060678712274665E-2 | BW7: =BF7/BJ7 -> 1.2211664469554974E-2 | BX7: =BG7/BJ7 -> 1.6295706405833849E-2 | BY7: =BH7/BJ7 -> 3.2175128731331194E-2 | BZ7: =BI7/BJ7 -> 3.014681587704306E-2 | CA7: =SUM(BK7:BZ7) -> 1
AC8: =AA!AC8+'A-hetero'!AC8+'a-homo'!AC8 -> 334 | AD8: =AA!AD8+'A-hetero'!AD8+'a-homo'!AD8 -> 463 | AE8: =AA!AE8+'A-hetero'!AE8+'a-homo'!AE8 -> 10 | AF8: =AA!AF8+'A-hetero'!AF8+'a-homo'!AF8 -> 9 | AG8: =AA!AG8+'A-hetero'!AG8+'a-homo'!AG8 -> 10 | AH8: =AA!AH8+'A-hetero'!AH8+'a-homo'!AH8 -> 10 | AI8: =AA!AI8+'A-hetero'!AI8+'a-homo'!AI8 -> 10 | AJ8: =AA!AJ8+'A-hetero'!AJ8+'a-homo'!AJ8 -> 10 | AK8: =AA!AK8+'A-hetero'!AK8+'a-homo'!AK8 -> 305 | AL8: =AA!AL8+'A-hetero'!AL8+'a-homo'!AL8 -> 37 | AM8: =AA!AM8+'A-hetero'!AM8+'a-homo'!AM8 -> 10 | AN8: =AA!AN8+'A-hetero'!AN8+'a-homo'!AN8 -> 10 | AO8: =AA!AO8+'A-hetero'!AO8+'a-homo'!AO8 -> 10 | AP8: =AA!AP8+'A-hetero'!AP8+'a-homo'!AP8 -> 10 | AQ8: =AA!AQ8+'A-hetero'!AQ8+'a-homo'!AQ8 -> 10 | AR8: =AA!AR8+'A-hetero'!AR8+'a-homo'!AR8 -> 10 | AS8: =SUM(AC8:AJ8) -> 856 | AT8: =AA!AT8+'A-hetero'!AT8+'a-homo'!AT8 -> 368.09573465917117 | AU8: =AA!AU8+'A-hetero'!AU8+'a-homo'!AU8 -> 511.72037910632349 | AV8: =AA!AV8+'A-hetero'!AV8+'a-homo'!AV8 -> 26.143241858355452 | AW8: =AA!AW8+'A-hetero'!AW8+'a-homo'!AW8 -> 19.198114192308282 | AX8: =AA!AX8+'A-hetero'!AX8+'a-homo'!AX8 -> 26.590763351190255 | AY8: =AA!AY8+'A-hetero'!AY8+'a-homo'!AY8 -> 19.040399229631177 | AZ8: =AA!AZ8+'A-hetero'!AZ8+'a-homo'!AZ8 -> 29.092177223865288 | BA8: =AA!BA8+'A-hetero'!BA8+'a-homo'!BA8 -> 47.119190379154887 | BB8: =AA!BB8+'A-hetero'!BB8+'a-homo'!BB8 -> 346.2092135435683 | BC8: =AA!BC8+'A-hetero'!BC8+'a-homo'!BC8 -> 43.662058525918539 | BD8: =AA!BD8+'A-hetero'!BD8+'a-homo'!BD8 -> 22.728565962190924 | BE8: =AA!BE8+'A-hetero'!BE8+'a-homo'!BE8 -> 33.242692152163855 | BF8: =AA!BF8+'A-hetero'!BF8+'a-homo'!BF8 -> 19.697843857366539 | BG8: =AA!BG8+'A-hetero'!BG8+'a-homo'!BG8 -> 26.983607726830549 | BH8: =AA!BH8+'A-hetero'!BH8+'a-homo'!BH8 -> 53.442459544292078 | BI8: =AA!BI8+'A-hetero'!BI8+'a-homo'!BI8 -> 49.033558687669228 | BJ8: =SUM(AT8:BI8) -> 1642 | BK8: =AT8/BJ8 -> 0.22417523426258901 | BL8: =AU8/BJ8 -> 0.31164456705622623 | BM8: =AV8/BJ8 -> 1.5921584566598937E-2 | BN8: =AW8/BJ8 -> 1.1691908765108576E-2 | BO8: =AX8/BJ8 -> 1.6194131151760202E-2 | BP8: =AY8/BJ8 -> 1.1595858239726661E-2 | BQ8: =AZ8/BJ8 -> 1.7717525714899689E-2 | BR8: =BA8/BJ8 -> 2.8696218257706997E-2 | BS8: =BB8/BJ8 -> 0.21084604966112563 | BT8: =BC8/BJ8 -> 2.6590778639414458E-2 | BU8: =BD8/BJ8 -> 1.3842001195000562E-2 | BV8: =BE8/BJ8 -> 2.0245244916055942E-2 | BW8: =BF8/BJ8 -> 1.1996250826654408E-2 | BX8: =BG8/BJ8 -> 1.6433378639969885E-2 | BY8: =BH8/BJ8 -> 3.2547173900299681E-2 | BZ8: =BI8/BJ8 -> 2.9862094206863112E-2 | CA8: =SUM(BK8:BZ8) -> 1
AC9: =AA!AC9+'A-hetero'!AC9+'a-homo'!AC9 -> 334 | AD9: =AA!AD9+'A-hetero'!AD9+'a-homo'!AD9 -> 463 | AE9: =AA!AE9+'A-hetero'!AE9+'a-homo'!AE9 -> 10 | AF9: =AA!AF9+'A-hetero'!AF9+'a-homo'!AF9 -> 9 | AG9: =AA!AG9+'A-hetero'!AG9+'a-homo'!AG9 -> 10 | AH9: =AA!AH9+'A-hetero'!AH9+'a-homo'!AH9 -> 10 | AI9: =AA!AI9+'A-hetero'!AI9+'a-homo'!AI9 -> 10 | AJ9: =AA!AJ9+'A-hetero'!AJ9+'a-homo'!AJ9 -> 10 | AK9: =AA!AK9+'A-hetero'!AK9+'a-homo'!AK9 -> 305 | AL9: =AA!AL9+'A-hetero'!AL9+'a-homo'!AL9 -> 37 | AM9: =AA!AM9+'A-hetero'!AM9+'a-homo'!AM9 -> 10 | AN9: =AA!AN9+'A-hetero'!AN9+'a-homo'!AN9 -> 10 | AO9: =AA!AO9+'A-hetero'!AO9+'a-homo'!AO9 -> 10 | AP9: =AA!AP9+'A-hetero'!AP9+'a-homo'!AP9 -> 10 | AQ9: =AA!AQ9+'A-hetero'!AQ9+'a-homo'!AQ9 -> 10 | AR9: =AA!AR9+'A-hetero'!AR9+'a-homo'!AR9 -> 10 | AS9: =SUM(AC9:AJ9) -> 856 | AT9: =AA!AT9+'A-hetero'!AT9+'a-homo'!AT9 -> 367.87864926853479 | AU9: =AA!AU9+'A-hetero'!AU9+'a-homo'!AU9 -> 511.83678612217085 | AV9: =AA!AV9+'A-hetero'!AV9+'a-homo'!AV9 -> 26.446977338947029 | AW9: =AA!AW9+'A-hetero'!AW9+'a-homo'!AW9 -> 18.961900171531809 | AX9: =AA!AX9+'A-hetero'!AX9+'a-homo'!AX9 -> 26.87972859082991 | AY9: =AA!AY9+'A-hetero'!AY9+'a-homo'!AY9 -> 18.836547009088946 | AZ9: =AA!AZ9+'A-hetero'!AZ9+'a-homo'!AZ9 -> 28.655054190422923 | BA9: =AA!BA9+'A-hetero'!BA9+'a-homo'!BA9 -> 47.504357308473757 | BB9: =AA!BB9+'A-hetero'!BB9+'a-homo'!BB9 -> 346.33071164634993 | BC9: =AA!BC9+'A-hetero'!BC9+'a-homo'!BC9 -> 43.608816827340519 | BD9: =AA!BD9+'A-hetero'!BD9+'a-homo'!BD9 -> 22.463426823771659 | BE9: =AA!BE9+'A-hetero'!BE9+'a-homo'!BE9 -> 33.47273180135344 | BF9: =AA!BF9+'A-hetero'!BF9+'a-homo'!BF9 -> 19.464741615245604 | BG9: =AA!BG9+'A-hetero'!BG9+'a-homo'!BG9 -> 27.164018920439474 | BH9: =AA!BH9+'A-hetero'!BH9+'a-homo'!BH9 -> 53.88071052589823 | BI9: =AA!BI9+'A-hetero'!BI9+'a-homo'!BI9 -> 48.614841839601155 | BJ9: =SUM(AT9:BI9) -> 1642 | BK9: =AT9/BJ9 -> 0.22404302635111742 | BL9: =AU9/BJ9 -> 0.31171546048853277 | BM9: =AV9/BJ9 -> 1.6106563543816704E-2 | BN9: =AW9/BJ9 -> 1.1548051261590626E-2 | BO9: =AX9/BJ9 -> 1.637011485434221E-2 | BP9: =AY9/BJ9 -> 1.1471709506144304E-2 | BQ9: =AZ9/BJ9 -> 1.7451311930830039E-2 | BR9: =BA9/BJ9 -> 2.893079007824224E-2 | BS9: =BB9/BJ9 -> 0.21092004363358705 | BT9: =BC9/BJ9 -> 2.6558353731632473E-2 | BU9: =BD9/BJ9 -> 1.36805279072909E-2 | BV9: =BE9/BJ9 -> 2.0385342144551424E-2 | BW9: =BF9/BJ9 -> 1.1854288438030209E-2 | BX9: =BG9/BJ9 -> 1.6543251474080069E-2 | BY9: =BH9/BJ9 -> 3.2814074619913661E-2 | BZ9: =BI9/BJ9 -> 2.9607090036297901E-2 | CA9: =SUM(BK9:BZ9) -> 1
AC10: =AA!AC10+'A-hetero'!AC10+'a-homo'!AC10 -> 334 | AD10: =AA!AD10+'A-hetero'!AD10+'a-homo'!AD10 -> 463 | AE10: =AA!AE10+'A-hetero'!AE10+'a-homo'!AE10 -> 10 | AF10: =AA!AF10+'A-hetero'!AF10+'a-homo'!AF10 -> 9 | AG10: =AA!AG10+'A-hetero'!AG10+'a-homo'!AG10 -> 10 | AH10: =AA!AH10+'A-hetero'!AH10+'a-homo'!AH10 -> 10 | AI10: =AA!AI10+'A-hetero'!AI10+'a-homo'!AI10 -> 10 | AJ10: =AA!AJ10+'A-hetero'!AJ10+'a-homo'!AJ10 -> 10 | AK10: =AA!AK10+'A-hetero'!AK10+'a-homo'!AK10 -> 305 | AL10: =AA!AL10+'A-hetero'!AL10+'a-homo'!AL10 -> 37 | AM10: =AA!AM10+'A-hetero'!AM10+'a-homo'!AM10 -> 10 | AN10: =AA!AN10+'A-hetero'!AN10+'a-homo'!AN10 -> 10 | AO10: =AA!AO10+'A-hetero'!AO10+'a-homo'!AO10 -> 10 | AP10: =AA!AP10+'A-hetero'!AP10+'a-homo'!AP10 -> 10 | AQ10: =AA!AQ10+'A-hetero'!AQ10+'a-homo'!AQ10 -> 10 | AR10: =AA!AR10+'A-hetero'!AR10+'a-homo'!AR10 -> 10 | AS10: =SUM(AC10:AJ10) -> 856 | AT10: =AA!AT10+'A-hetero'!AT10+'a-homo'!AT10 -> 367.70858859344133 | AU10: =AA!AU10+'A-hetero'!AU10+'a-homo'!AU10 -> 511.92351612452478 | AV10: =AA!AV10+'A-hetero'!AV10+'a-homo'!AV10 -> 26.647481688665337 | AW10: =AA!AW10+'A-hetero'!AW10+'a-homo'!AW10 -> 18.797233399363762 | AX10: =AA!AX10+'A-hetero'!AX10+'a-homo'!AX10 -> 27.066402643597584 | AY10: =AA!AY10+'A-hetero'!AY10+'a-homo'!AY10 -> 18.694675355336685 | AZ10: =AA!AZ10+'A-hetero'!AZ10+'a-homo'!AZ10 -> 28.363139474906728 | BA10: =AA!BA10+'A-hetero'!BA10+'a-homo'!BA10 -> 47.798962720163715 | BB10: =AA!BB10+'A-hetero'!BB10+'a-homo'!BB10 -> 346.42361468529896 | BC10: =AA!BC10+'A-hetero'!BC10+'a-homo'!BC10 -> 43.571949929780047 | BD10: =AA!BD10+'A-hetero'!BD10+'a-homo'!BD10 -> 22.283098383684049 | BE10: =AA!BE10+'A-hetero'!BE10+'a-homo'!BE10 -> 33.644517195241647 | BF10: =AA!BF10+'A-hetero'!BF10+'a-homo'!BF10 -> 19.309894608086342 | BG10: =AA!BG10+'A-hetero'!BG10+'a-homo'!BG10 -> 27.301358059934181 | BH10: =AA!BH10+'A-hetero'!BH10+'a-homo'!BH10 -> 54.19777992231964 | BI10: =AA!BI10+'A-hetero'!BI10+'a-homo'!BI10 -> 48.267787215655112 | BJ10: =SUM(AT10:BI10) -> 1642 | BK10: =AT10/BJ10 -> 0.22393945712146243 | BL10: =AU10/BJ10 -> 0.31176828022200048 | BM10: =AV10/BJ10 -> 1.6228673379211533E-2 | BN10: =AW10/BJ10 -> 1.1447766991086334E-2 | BO10: =AX10/BJ10 -> 1.6483801853591707E-2 | BP10: =AY10/BJ10 -> 1.1385307768170941E-2 | BQ10: =AZ10/BJ10 -> 1.7273531957921272E-2 | BR10: =BA10/BJ10 -> 2.9110208721171569E-2 | BS10: =BB10/BJ10 -> 0.2109766228290493 | BT10: =BC10/BJ10 -> 2.6535901297064585E-2 | BU10: =BD10/BJ10 -> 1.3570705471183952E-2 | BV10: =BE10/BJ10 -> 2.0489961751060687E-2 | BW10: =BF10/BJ10 -> 1.1759984535984374E-2 | BX10: =BG10/BJ10 -> 1.662689285014262E-2 | BY10: =BH10/BJ10 -> 3.300717413052353E-2 | BZ10: =BI10/BJ10 -> 2.9395729120374612E-2 | CA10: =SUM(BK10:BZ10) -> 1
AC11: =AA!AC11+'A-hetero'!AC11+'a-homo'!AC11 -> 334 | AD11: =AA!AD11+'A-hetero'!AD11+'a-homo'!AD11 -> 463 | AE11: =AA!AE11+'A-hetero'!AE11+'a-homo'!AE11 -> 10 | AF11: =AA!AF11+'A-hetero'!AF11+'a-homo'!AF11 -> 9 | AG11: =AA!AG11+'A-hetero'!AG11+'a-homo'!AG11 -> 10 | AH11: =AA!AH11+'A-hetero'!AH11+'a-homo'!AH11 -> 10 | AI11: =AA!AI11+'A-hetero'!AI11+'a-homo'!AI11 -> 10 | AJ11: =AA!AJ11+'A-hetero'!AJ11+'a-homo'!AJ11 -> 10 | AK11: =AA!AK11+'A-hetero'!AK11+'a-homo'!AK11 -> 305 | AL11: =AA!AL11+'A-hetero'!AL11+'a-homo'!AL11 -> 37 | AM11: =AA!AM11+'A-hetero'!AM11+'a-homo'!AM11 -> 10 | AN11: =AA!AN11+'A-hetero'!AN11+'a-homo'!AN11 -> 10 | AO11: =AA!AO11+'A-hetero'!AO11+'a-homo'!AO11 -> 10 | AP11: =AA!AP11+'A-hetero'!AP11+'a-homo'!AP11 -> 10 | AQ11: =AA!AQ11+'A-hetero'!AQ11+'a-homo'!AQ11 -> 10 | AR11: =AA!AR11+'A-hetero'!AR11+'a-homo'!AR11 -> 10 | AS11: =SUM(AC11:AJ11) -> 856 | AT11: =AA!AT11+'A-hetero'!AT11+'a-homo'!AT11 -> 367.57889439086455 | AU11: =AA!AU11+'A-hetero'!AU11+'a-homo'!AU11 -> 511.98838769365261 | AV11: =AA!AV11+'A-hetero'!AV11+'a-homo'!AV11 -> 26.780141003202285 | AW11: =AA!AW11+'A-hetero'!AW11+'a-homo'!AW11 -> 18.682476078721734 | AX11: =AA!AX11+'A-hetero'!AX11+'a-homo'!AX11 -> 27.187908639811255 | AY11: =AA!AY11+'A-hetero'!AY11+'a-homo'!AY11 -> 18.596397908981729 | AZ11: =AA!AZ11+'A-hetero'!AZ11+'a-homo'!AZ11 -> 28.165887684892091 | BA11: =AA!BA11+'A-hetero'!BA11+'a-homo'!BA11 -> 48.019906599873615 | BB11: =AA!BB11+'A-hetero'!BB11+'a-homo'!BB11 -> 346.49253677100364 | BC11: =AA!BC11+'A-hetero'!BC11+'a-homo'!BC11 -> 43.546270358512054 | BD11: =AA!BD11+'A-hetero'!BD11+'a-homo'!BD11 -> 22.160375309217059 | BE11: =AA!BE11+'A-hetero'!BE11+'a-homo'!BE11 -> 33.770918394825927 | BF11: =AA!BF11+'A-hetero'!BF11+'a-homo'!BF11 -> 19.206256352321802 | BG11: =AA!BG11+'A-hetero'!BG11+'a-homo'!BG11 -> 27.40334788485222 | BH11: =AA!BH11+'A-hetero'!BH11+'a-homo'!BH11 -> 54.42799984868725 | BI11: =AA!BI11+'A-hetero'!BI11+'a-homo'!BI11 -> 47.99229508058005 | BJ11: =SUM(AT11:BI11) -> 1642 | BK11: =AT11/BJ11 -> 0.22386047161441205 | BL11: =AU11/BJ11 -> 0.31180778787676777 | BM11: =AV11/BJ11 -> 1.6309464679173137E-2 | BN11: =AW11/BJ11 -> 1.1377878245262934E-2 | BO11: =AX11/BJ11 -> 1.6557800633258988E-2 | BP11: =AY11/BJ11 -> 1.1325455486590578E-2 | BQ11: =AZ11/BJ11 -> 1.7153402974964736E-2 | BR11: =BA11/BJ11 -> 2.9244766504186129E-2 | BS11: =BB11/BJ11 -> 0.21101859730268191 | BT11: =BC11/BJ11 -> 2.6520262094099915E-2 | BU11: =BD11/BJ11 -> 1.3495965474553631E-2 | BV11: =BE11/BJ11 -> 2.0566941775168046E-2 | BW11: =BF11/BJ11 -> 1.1696867449647871E-2 | BX11: =BG11/BJ11 -> 1.6689006020007443E-2 | BY11: =BH11/BJ11 -> 3.3147381150235848E-2 | BZ11: =BI11/BJ11 -> 2.9227950718989072E-2 | CA11: =SUM(BK11:BZ11) -> 1
AC12: =AA!AC12+'A-hetero'!AC12+'a-homo'!AC12 -> 334 | AD12: =AA!AD12+'A-hetero'!AD12+'a-homo'!AD12 -> 463 | AE12: =AA!AE12+'A-hetero'!AE12+'a-homo'!AE12 -> 10 | AF12: =AA!AF12+'A-hetero'!AF12+'a-homo'!AF12 -> 9 | AG12: =AA!AG12+'A-hetero'!AG12+'a-homo'!AG12 -> 10 | AH12: =AA!AH12+'A-hetero'!AH12+'a-homo'!AH12 -> 10 | AI12: =AA!AI12+'A-hetero'!AI12+'a-homo'!AI12 -> 10 | AJ12: =AA!AJ12+'A-hetero'!AJ12+'a-homo'!AJ12 -> 10 | AK12: =AA!AK12+'A-hetero'!AK12+'a-homo'!AK12 -> 305 | AL12: =AA!AL12+'A-hetero'!AL12+'a-homo'!AL12 -> 37 | AM12: =AA!AM12+'A-hetero'!AM12+'a-homo'!AM12 -> 10 | AN12: =AA!AN12+'A-hetero'!AN12+'a-homo'!AN12 -> 10 | AO12: =AA!AO12+'A-hetero'!AO12+'a-homo'!AO12 -> 10 | AP12: =AA!AP12+'A-hetero'!AP12+'a-homo'!AP12 -> 10 | AQ12: =AA!AQ12+'A-hetero'!AQ12+'a-homo'!AQ12 -> 10 | AR12: =AA!AR12+'A-hetero'!AR12+'a-homo'!AR12 -> 10 | AS12: =SUM(AC12:AJ12) -> 856 | AT12: =AA!AT12+'A-hetero'!AT12+'a-homo'!AT12 -> 367.48148434755569 | AU12: =AA!AU12+'A-hetero'!AU12+'a-homo'!AU12 -> 512.03693348457296 | AV12: =AA!AV12+'A-hetero'!AV12+'a-homo'!AV12 -> 26.86837560339529 | AW12: =AA!AW12+'A-hetero'!AW12+'a-homo'!AW12 -> 18.60252723870682 | AX12: =AA!AX12+'A-hetero'!AX12+'a-homo'!AX12 -> 27.267638291065097 | AY12: =AA!AY12+'A-hetero'!AY12+'a-homo'!AY12 -> 18.528410501212257 | AZ12: =AA!AZ12+'A-hetero'!AZ12+'a-homo'!AZ12 -> 28.031343241084134 | BA12: =AA!BA12+'A-hetero'!BA12+'a-homo'!BA12 -> 48.183287292407826 | BB12: =AA!BB12+'A-hetero'!BB12+'a-homo'!BB12 -> 346.54280069426733 | BC12: =AA!BC12+'A-hetero'!BC12+'a-homo'!BC12 -> 43.528363943688916 | BD12: =AA!BD12+'A-hetero'!BD12+'a-homo'!BD12 -> 22.076606272109004 | BE12: =AA!BE12+'A-hetero'!BE12+'a-homo'!BE12 -> 33.862908415704084 | BF12: =AA!BF12+'A-hetero'!BF12+'a-homo'!BF12 -> 19.136343653745691 | BG12: =AA!BG12+'A-hetero'!BG12+'a-homo'!BG12 -> 27.478025083892149 | BH12: =AA!BH12+'A-hetero'!BH12+'a-homo'!BH12 -> 54.595407896777807 | BI12: =AA!BI12+'A-hetero'!BI12+'a-homo'!BI12 -> 47.77954403981505 | BJ12: =SUM(AT12:BI12) -> 1642 | BK12: =AT12/BJ12 -> 0.22380114759290845 | BL12: =AU12/BJ12 -> 0.31183735291386905 | BM12: =AV12/BJ12 -> 1.6363200732883856E-2 | BN12: =AW12/BJ12 -> 1.1329188330515725E-2 | BO12: =AX12/BJ12 -> 1.6606357059113945E-2 | BP12: =AY12/BJ12 -> 1.1284050244343639E-2 | BQ12: =AZ12/BJ12 -> 1.707146360601957E-2 | BR12: =BA12/BJ12 -> 2.9344267534962134E-2 | BS12: =BB12/BJ12 -> 0.21104920870540031 | BT12: =BC12/BJ12 -> 2.6509356847557196E-2 | BU12: =BD12/BJ12 -> 1.3444949008592572E-2 | BV12: =BE12/BJ12 -> 2.0622964930392257E-2 | BW12: =BF12/BJ12 -> 1.1654289679504075E-2 | BX12: =BG12/BJ12 -> 1.6734485434769884E-2 | BY12: =BH12/BJ12 -> 3.3249334894505364E-2 | BZ12: =BI12/BJ12 -> 2.9098382484662028E-2 | CA12: =SUM(BK12:BZ12) -> 1
AC13: =AA!AC13+'A-hetero'!AC13+'a-homo'!AC13 -> 334 | AD13: =AA!AD13+'A-hetero'!AD13+'a-homo'!AD13 -> 463 | AE13: =AA!AE13+'A-hetero'!AE13+'a-homo'!AE13 -> 10 | AF13: =AA!AF13+'A-hetero'!AF13+'a-homo'!AF13 -> 9 | AG13: =AA!AG13+'A-hetero'!AG13+'a-homo'!AG13 -> 10 | AH13: =AA!AH13+'A-hetero'!AH13+'a-homo'!AH13 -> 10 | AI13: =AA!AI13+'A-hetero'!AI13+'a-homo'!AI13 -> 10 | AJ13: =AA!AJ13+'A-hetero'!AJ13+'a-homo'!AJ13 -> 10 | AK13: =AA!AK13+'A-hetero'!AK13+'a-homo'!AK13 -> 305 | AL13: =AA!AL13+'A-hetero'!AL13+'a-homo'!AL13 -> 37 | AM13: =AA!AM13+'A-hetero'!AM13+'a-homo'!AM13 -> 10 | AN13: =AA!AN13+'A-hetero'!AN13+'a-homo'!AN13 -> 10 | AO13: =AA!AO13+'A-hetero'!AO13+'a-homo'!AO13 -> 10 | AP13: =AA!AP13+'A-hetero'!AP13+'a-homo'!AP13 -> 10 | AQ13: =AA!AQ13+'A-hetero'!AQ13+'a-homo'!AQ13 -> 10 | AR13: =AA!AR13+'A-hetero'!AR13+'a-homo'!AR13 -> 10 | AS13: =SUM(AC13:AJ13) -> 856 | AT13: =AA!AT13+'A-hetero'!AT13+'a-homo'!AT13 -> 367.40908265270565 | AU13: =AA!AU13+'A-hetero'!AU13+'a-homo'!AU13 -> 512.0731926440626 | AV13: =AA!AV13+'A-hetero'!AV13+'a-homo'!AV13 -> 26.927435104651188 | AW13: =AA!AW13+'A-hetero'!AW13+'a-homo'!AW13 -> 18.546817216777342 | AX13: =AA!AX13+'A-hetero'!AX13+'a-homo'!AX13 -> 27.320390431419359 | AY13: =AA!AY13+'A-hetero'!AY13+'a-homo'!AY13 -> 18.481345643458489 | AZ13: =AA!AZ13+'A-hetero'!AZ13+'a-homo'!AZ13 -> 27.938856361037917 | BA13: =AA!BA13+'A-hetero'!BA13+'a-homo'!BA13 -> 48.302879945887412 | BB13: =AA!BB13+'A-hetero'!BB13+'a-homo'!BB13 -> 346.57907028568678 | BC13: =AA!BC13+'A-hetero'!BC13+'a-homo'!BC13 -> 43.51586804518476 | BD13: =AA!BD13+'A-hetero'!BD13+'a-homo'!BD13 -> 22.019180297000549 | BE13: =AA!BE13+'A-hetero'!BE13+'a-homo'!BE13 -> 33.929353753931068 | BF13: =AA!BF13+'A-hetero'!BF13+'a-homo'!BF13 -> 19.088805604213789 | BG13: =AA!BG13+'A-hetero'!BG13+'a-homo'!BG13 -> 27.53224469326851 | BH13: =AA!BH13+'A-hetero'!BH13+'a-homo'!BH13 -> 54.717179263284748 | BI13: =AA!BI13+'A-hetero'!BI13+'a-homo'!BI13 -> 47.618298057429769 | BJ13: =SUM(AT13:BI13) -> 1642 | BK13: =AT13/BJ13 -> 0.22375705399068557 | BL13: =AU13/BJ13 -> 0.31185943522780918 | BM13: =AV13/BJ13 -> 1.6399168760445306E-2 | BN13: =AW13/BJ13 -> 1.1295260180741378E-2 | BO13: =AX13/BJ13 -> 1.6638483819378418E-2 | BP13: =AY13/BJ13 -> 1.1255387115382759E-2 | BQ13: =AZ13/BJ13 -> 1.7015137856904946E-2 | BR13: =BA13/BJ13 -> 2.9417101063268829E-2 | BS13: =BB13/BJ13 -> 0.21107129737252547 | BT13: =BC13/BJ13 -> 2.6501746677944436E-2 | BU13: =BD13/BJ13 -> 1.3409975820341384E-2 | BV13: =BE13/BJ13 -> 2.0663431031626718E-2 | BW13: =BF13/BJ13 -> 1.1625338370410349E-2 | BX13: =BG13/BJ13 -> 1.6767505903330399E-2 | BY13: =BH13/BJ13 -> 3.3323495288236755E-2 | BZ13: =BI13/BJ13 -> 2.9000181520968196E-2 | CA13: =SUM(BK13:BZ13) -> 1
AC14: =AA!AC14+'A-hetero'!AC14+'a-homo'!AC14 -> 334 | AD14: =AA!AD14+'A-hetero'!AD14+'a-homo'!AD14 -> 463 | AE14: =AA!AE14+'A-hetero'!AE14+'a-homo'!AE14 -> 10 | AF14: =AA!AF14+'A-hetero'!AF14+'a-homo'!AF14 -> 9 | AG14: =AA!AG14+'A-hetero'!AG14+'a-homo'!AG14 -> 10 | AH14: =AA!AH14+'A-hetero'!AH14+'a-homo'!AH14 -> 10 | AI14: =AA!AI14+'A-hetero'!AI14+'a-homo'!AI14 -> 10 | AJ14: =AA!AJ14+'A-hetero'!AJ14+'a-homo'!AJ14 -> 10 | AK14: =AA!AK14+'A-hetero'!AK14+'a-homo'!AK14 -> 305 | AL14: =AA!AL14+'A-hetero'!AL14+'a-homo'!AL14 -> 37 | AM14: =AA!AM14+'A-hetero'!AM14+'a-homo'!AM14 -> 10 | AN14: =AA!AN14+'A-hetero'!AN14+'a-homo'!AN14 -> 10 | AO14: =AA!AO14+'A-hetero'!AO14+'a-homo'!AO14 -> 10 | AP14: =AA!AP14+'A-hetero'!AP14+'a-homo'!AP14 -> 10 | AQ14: =AA!AQ14+'A-hetero'!AQ14+'a-homo'!AQ14 -> 10 | AR14: =AA!AR14+'A-hetero'!AR14+'a-homo'!AR14 -> 10 | AS14: =SUM(AC14:AJ14) -> 856 | AT14: =AA!AT14+'A-hetero'!AT14+'a-homo'!AT14 -> 367.35568310236647 | AU14: =AA!AU14+'A-hetero'!AU14+'a-homo'!AU14 -> 512.10018798552733 | AV14: =AA!AV14+'A-hetero'!AV14+'a-homo'!AV14 -> 26.967228875613607 | AW14: =AA!AW14+'A-hetero'!AW14+'a-homo'!AW14 -> 18.507967737622302 | AX14: =AA!AX14+'A-hetero'!AX14+'a-homo'!AX14 -> 27.355584281155526 | AY14: =AA!AY14+'A-hetero'!AY14+'a-homo'!AY14 -> 18.448705278351706 | AZ14: =AA!AZ14+'A-hetero'!AZ14+'a-homo'!AZ14 -> 27.874866665874244 | BA14: =AA!BA14+'A-hetero'!BA14+'a-homo'!BA14 -> 48.389776073488839 | BB14: =AA!BB14+'A-hetero'!BB14+'a-homo'!BB14 -> 346.60506314452766 | BC14: =AA!BC14+'A-hetero'!BC14+'a-homo'!BC14 -> 43.507136352458204 | BD14: =AA!BD14+'A-hetero'!BD14+'a-homo'!BD14 -> 21.97962039918751 | BE14: =AA!BE14+'A-hetero'!BE14+'a-homo'!BE14 -> 33.977112402696974 | BF14: =AA!BF14+'A-hetero'!BF14+'a-homo'!BF14 -> 19.056233214353583 | BG14: =AA!BG14+'A-hetero'!BG14+'a-homo'!BG14 -> 27.571406641259586 | BH14: =AA!BH14+'A-hetero'!BH14+'a-homo'!BH14 -> 54.805720316921423 | BI14: =AA!BI14+'A-hetero'!BI14+'a-homo'!BI14 -> 47.497707528595086 | BJ14: =SUM(AT14:BI14) -> 1642 | BK14: =AT14/BJ14 -> 0.22372453294906602 | BL14: =AU14/BJ14 -> 0.31187587575245268 | BM14: =AV14/BJ14 -> 1.6423403700130089E-2 | BN14: =AW14/BJ14 -> 1.1271600327419183E-2 | BO14: =AX14/BJ14 -> 1.6659917345405312E-2 | BP14: =AY14/BJ14 -> 1.1235508695707493E-2 | BQ14: =AZ14/BJ14 -> 1.6976167275197466E-2 | BR14: =BA14/BJ14 -> 2.9470021969238022E-2 | BS14: =BB14/BJ14 -> 0.21108712737181951 | BT14: =BC14/BJ14 -> 2.6496428960084164E-2 | BU14: =BD14/BJ14 -> 1.3385883312538068E-2 | BV14: =BE14/BJ14 -> 2.0692516688609604E-2 | BW14: =BF14/BJ14 -> 1.1605501348570999E-2 | BX14: =BG14/BJ14 -> 1.6791356054360281E-2 | BY14: =BH14/BJ14 -> 3.337741797620062E-2 | BZ14: =BI14/BJ14 -> 2.8926740273200413E-2 | CA14: =SUM(BK14:BZ14) -> 1
AC15: =AA!AC15+'A-hetero'!AC15+'a-homo'!AC15 -> 334 | AD15: =AA!AD15+'A-hetero'!AD15+'a-homo'!AD15 -> 463 | AE15: =AA!AE15+'A-hetero'!AE15+'a-homo'!AE15 -> 10 | AF15: =AA!AF15+'A-hetero'!AF15+'a-homo'!AF15 -> 9 | AG15: =AA!AG15+'A-hetero'!AG15+'a-homo'!AG15 -> 10 | AH15: =AA!AH15+'A-hetero'!AH15+'a-homo'!AH15 -> 10 | AI15: =AA!AI15+'A-hetero'!AI15+'a-homo'!AI15 -> 10 | AJ15: =AA!AJ15+'A-hetero'!AJ15+'a-homo'!AJ15 -> 10 | AK15: =AA!AK15+'A-hetero'!AK15+'a-homo'!AK15 -> 305 | AL15: =AA!AL15+'A-hetero'!AL15+'a-homo'!AL15 -> 37 | AM15: =AA!AM15+'A-hetero'!AM15+'a-homo'!AM15 -> 10 | AN15: =AA!AN15+'A-hetero'!AN15+'a-homo'!AN15 -> 10 | AO15: =AA!AO15+'A-hetero'!AO15+'a-homo'!AO15 -> 10 | AP15: =AA!AP15+'A-hetero'!AP15+'a-homo'!AP15 -> 10 | AQ15: =AA!AQ15+'A-hetero'!AQ15+'a-homo'!AQ15 -> 10 | AR15: =AA!AR15+'A-hetero'!AR15+'a-homo'!AR15 -> 10 | AS15: =SUM(AC15:AJ15) -> 856 | AT15: =AA!AT15+'A-hetero'!AT15+'a-homo'!AT15 -> 367.31653058305676 | AU15: =AA!AU15+'A-hetero'!AU15+'a-homo'!AU15 -> 512.12021148160272 | AV15: =AA!AV15+'A-hetero'!AV15+'a-homo'!AV15 -> 26.994217317568904 | AW15: =AA!AW15+'A-hetero'!AW15+'a-homo'!AW15 -> 18.480843410720063 | AX15: =AA!AX15+'A-hetero'!AX15+'a-homo'!AX15 -> 27.379255362690955 | AY15: =AA!AY15+'A-hetero'!AY15+'a-homo'!AY15 -> 18.426013924299131 | AZ15: =AA!AZ15+'A-hetero'!AZ15+'a-homo'!AZ15 -> 27.83035252975079 | BA15: =AA!BA15+'A-hetero'!BA15+'a-homo'!BA15 -> 48.452575390310699 | BB15: =AA!BB15+'A-hetero'!BB15+'a-homo'!BB15 -> 346.62360839896473 | BC15: =AA!BC15+'A-hetero'!BC15+'a-homo'!BC15 -> 43.501023965552918 | BD15: =AA!BD15+'A-hetero'!BD15+'a-homo'!BD15 -> 21.952231789220033 | BE15: =AA!BE15+'A-hetero'!BE15+'a-homo'!BE15 -> 34.011333053313919 | BF15: =AA!BF15+'A-hetero'!BF15+'a-homo'!BF15 -> 19.033756304721415 | BG15: =AA!BG15+'A-hetero'!BG15+'a-homo'!BG15 -> 27.599599979111417 | BH15: =AA!BH15+'A-hetero'!BH15+'a-homo'!BH15 -> 54.870047714026441 | BI15: =AA!BI15+'A-hetero'!BI15+'a-homo'!BI15 -> 47.408398795089141 | BJ15: =SUM(AT15:BI15) -> 1642 | BK15: =AT15/BJ15 -> 0.22370068854022945 | BL15: =AU15/BJ15 -> 0.31188807032984334 | BM15: =AV15/BJ15 -> 1.6439840022879966E-2 | BN15: =AW15/BJ15 -> 1.1255081248915994E-2 | BO15: =AX15/BJ15 -> 1.6674333351212517E-2 | BP15: =AY15/BJ15 -> 1.1221689357064026E-2 | BQ15: =AZ15/BJ15 -> 1.6949057569884768E-2 | BR15: =BA15/BJ15 -> 2.9508267594586298E-2 | BS15: =BB15/BJ15 -> 0.21109842168024648 | BT15: =BC15/BJ15 -> 2.6492706434563286E-2 | BU15: =BD15/BJ15 -> 1.3369203282107207E-2 | BV15: =BE15/BJ15 -> 2.0713357523333691E-2 | BW15: =BF15/BJ15 -> 1.1591812609452749E-2 | BX15: =BG15/BJ15 -> 1.6808526174854701E-2 | BY15: =BH15/BJ15 -> 3.3416594222915007E-2 | BZ15: =BI15/BJ15 -> 2.887235005791056E-2 | CA15: =SUM(BK15:BZ15) -> 1
AC16: =AA!AC16+'A-hetero'!AC16+'a-homo'!AC16 -> 334 | AD16: =AA!AD16+'A-hetero'!AD16+'a-homo'!AD16 -> 463 | AE16: =AA!AE16+'A-hetero'!AE16+'a-homo'!AE16 -> 10 | AF16: =AA!AF16+'A-hetero'!AF16+'a-homo'!AF16 -> 9 | AG16: =AA!AG16+'A-hetero'!AG16+'a-homo'!AG16 -> 10 | AH16: =AA!AH16+'A-hetero'!AH16+'a-homo'!AH16 -> 10 | AI16: =AA!AI16+'A-hetero'!AI16+'a-homo'!AI16 -> 10 | AJ16: =AA!AJ16+'A-hetero'!AJ16+'a-homo'!AJ16 -> 10 | AK16: =AA!AK16+'A-hetero'!AK16+'a-homo'!AK16 -> 305 | AL16: =AA!AL16+'A-hetero'!AL16+'a-homo'!AL16 -> 37 | AM16: =AA!AM16+'A-hetero'!AM16+'a-homo'!AM16 -> 10 | AN16: =AA!AN16+'A-hetero'!AN16+'a-homo'!AN16 -> 10 | AO16: =AA!AO16+'A-hetero'!AO16+'a-homo'!AO16 -> 10 | AP16: =AA!AP16+'A-hetero'!AP16+'a-homo'!AP16 -> 10 | AQ16: =AA!AQ16+'A-hetero'!AQ16+'a-homo'!AQ16 -> 10 | AR16: =AA!AR16+'A-hetero'!AR16+'a-homo'!AR16 -> 10 | AS16: =SUM(AC16:AJ16) -> 856 | AT16: =AA!AT16+'A-hetero'!AT16+'a-homo'!AT16 -> 367.28795575649451 | AU16: =AA!AU16+'A-hetero'!AU16+'a-homo'!AU16 -> 512.13500749476896 | AV16: =AA!AV16+'A-hetero'!AV16+'a-homo'!AV16 -> 27.0126357012021 | AW16: =AA!AW16+'A-hetero'!AW16+'a-homo'!AW16 -> 18.461876952494237 | AX16: =AA!AX16+'A-hetero'!AX16+'a-homo'!AX16 -> 27.395299888005603 | AY16: =AA!AY16+'A-hetero'!AY16+'a-homo'!AY16 -> 18.410197058110381 | AZ16: =AA!AZ16+'A-hetero'!AZ16+'a-homo'!AZ16 -> 27.799245484070219 | BA16: =AA!BA16+'A-hetero'!BA16+'a-homo'!BA16 -> 48.497781664853903 | BB16: =AA!BB16+'A-hetero'!BB16+'a-homo'!BB16 -> 346.63680233111376 | BC16: =AA!BC16+'A-hetero'!BC16+'a-homo'!BC16 -> 43.49673630090652 | BD16: =AA!BD16+'A-hetero'!BD16+'a-homo'!BD16 -> 21.933178602017172 | BE16: =AA!BE16+'A-hetero'!BE16+'a-homo'!BE16 -> 34.035806861002683 | BF16: =AA!BF16+'A-hetero'!BF16+'a-homo'!BF16 -> 19.018146904888518 | BG16: =AA!BG16+'A-hetero'!BG16+'a-homo'!BG16 -> 27.619854265711687 | BH16: =AA!BH16+'A-hetero'!BH16+'a-homo'!BH16 -> 54.916735332208091 | BI16: =AA!BI16+'A-hetero'!BI16+'a-homo'!BI16 -> 47.342739402151594 | BJ16: =SUM(AT16:BI16) -> 1642 | BK16: =AT16/BJ16 -> 0.22368328608799906 | BL16: =AU16/BJ16 -> 0.31189708130010285 | BM16: =AV16/BJ16 -> 1.6451057065287513E-2 | BN16: =AW16/BJ16 -> 1.1243530421738267E-2 | BO16: =AX16/BJ16 -> 1.6684104682098418E-2 | BP16: =AY16/BJ16 -> 1.1212056673636041E-2 | BQ16: =AZ16/BJ16 -> 1.693011296228393E-2 | BR16: =BA16/BJ16 -> 2.9535798821470095E-2 | BS16: =BB16/BJ16 -> 0.21110645696170141 | BT16: =BC16/BJ16 -> 2.6490095189346231E-2 | BU16: =BD16/BJ16 -> 1.3357599635820444E-2 | BV16: =BE16/BJ16 -> 2.0728262400123435E-2 | BW16: =BF16/BJ16 -> 1.1582306275815173E-2 | BX16: =BG16/BJ16 -> 1.6820861306767163E-2 | BY16: =BH16/BJ16 -> 3.3445027607922097E-2 | BZ16: =BI16/BJ16 -> 2.8832362607887688E-2 | CA16: =SUM(BK16:BZ16) -> 1
AC17: =AA!AC17+'A-hetero'!AC17+'a-homo'!AC17 -> 334 | AD17: =AA!AD17+'A-hetero'!AD17+'a-homo'!AD17 -> 463 | AE17: =AA!AE17+'A-hetero'!AE17+'a-homo'!AE17 -> 10 | AF17: =AA!AF17+'A-hetero'!AF17+'a-homo'!AF17 -> 9 | AG17: =AA!AG17+'A-hetero'!AG17+'a-homo'!AG17 -> 10 | AH17: =AA!AH17+'A-hetero'!AH17+'a-homo'!AH17 -> 10 | AI17: =AA!AI17+'A-hetero'!AI17+'a-homo'!AI17 -> 10 | AJ17: =AA!AJ17+'A-hetero'!AJ17+'a-homo'!AJ17 -> 10 | AK17: =AA!AK17+'A-hetero'!AK17+'a-homo'!AK17 -> 305 | AL17: =AA!AL17+'A-hetero'!AL17+'a-homo'!AL17 -> 37 | AM17: =AA!AM17+'A-hetero'!AM17+'a-homo'!AM17 -> 10 | AN17: =AA!AN17+'A-hetero'!AN17+'a-homo'!AN17 -> 10 | AO17: =AA!AO17+'A-hetero'!AO17+'a-homo'!AO17 -> 10 | AP17: =AA!AP17+'A-hetero'!AP17+'a-homo'!AP17 -> 10 | AQ17: =AA!AQ17+'A-hetero'!AQ17+'a-homo'!AQ17 -> 10 | AR17: =AA!AR17+'A-hetero'!AR17+'a-homo'!AR17 -> 10 | AS17: =SUM(AC17:AJ17) -> 856 | AT17: =AA!AT17+'A-hetero'!AT17+'a-homo'!AT17 -> 367.26717635382204 | AU17: =AA!AU17+'A-hetero'!AU17+'a-homo'!AU17 -> 512.14590132163187 | AV17: =AA!AV17+'A-hetero'!AV17+'a-homo'!AV17 -> 27.025278898881893 | AW17: =AA!AW17+'A-hetero'!AW17+'a-homo'!AW17 -> 18.448592455398334 | AX17: =AA!AX17+'A-hetero'!AX17+'a-homo'!AX17 -> 27.406253539217005 | AY17: =AA!AY17+'A-hetero'!AY17+'a-homo'!AY17 -> 18.399142293181008 | AZ17: =AA!AZ17+'A-hetero'!AZ17+'a-homo'!AZ17 -> 27.777424843831056 | BA17: =AA!BA17+'A-hetero'!BA17+'a-homo'!BA17 -> 48.530230294036791 | BB17: =AA!BB17+'A-hetero'!BB17+'a-homo'!BB17 -> 346.64617262813061 | BC17: =AA!BC17+'A-hetero'!BC17+'a-homo'!BC17 -> 43.493722165012223 | BD17: =AA!BD17+'A-hetero'!BD17+'a-homo'!BD17 -> 21.919865306786868 | BE17: =AA!BE17+'A-hetero'!BE17+'a-homo'!BE17 -> 34.05329087033617 | BF17: =AA!BF17+'A-hetero'!BF17+'a-homo'!BF17 -> 19.007246304075245 | BG17: =AA!BG17+'A-hetero'!BG17+'a-homo'!BG17 -> 27.634385394930007 | BH17: =AA!BH17+'A-hetero'!BH17+'a-homo'!BH17 -> 54.950582125255288 | BI17: =AA!BI17+'A-hetero'!BI17+'a-homo'!BI17 -> 47.294735205473593 | BJ17: =SUM(AT17:BI17) -> 1642 | BK17: =AT17/BJ17 -> 0.22367063115336294 | BL17: =AU17/BJ17 -> 0.31190371578662102 | BM17: =AV17/BJ17 -> 1.6458756942071794E-2 | BN17: =AW17/BJ17 -> 1.1235439985017253E-2 | BO17: =AX17/BJ17 -> 1.6690775602446407E-2 | BP17: =AY17/BJ17 -> 1.1205324173679051E-2 | BQ17: =AZ17/BJ17 -> 1.6916823900018908E-2 | BR17: =BA17/BJ17 -> 2.9555560471398769E-2 | BS17: =BB17/BJ17 -> 0.21111216359813065 | BT17: =BC17/BJ17 -> 2.648825954020232E-2 | BU17: =BD17/BJ17 -> 1.3349491660649733E-2 | BV17: =BE17/BJ17 -> 2.0738910396063435E-2 | BW17: =BF17/BJ17 -> 1.1575667663870427E-2 | BX17: =BG17/BJ17 -> 1.682971095915347E-2 | BY17: =BH17/BJ17 -> 3.3465640758377144E-2 | BZ17: =BI17/BJ17 -> 2.8803127408936407E-2 | CA17: =SUM(BK17:BZ17) -> 1
AC18: =AA!AC18+'A-hetero'!AC18+'a-homo'!AC18 -> 334 | AD18: =AA!AD18+'A-hetero'!AD18+'a-homo'!AD18 -> 463 | AE18: =AA!AE18+'A-hetero'!AE18+'a-homo'!AE18 -> 10 | AF18: =AA!AF18+'A-hetero'!AF18+'a-homo'!AF18 -> 9 | AG18: =AA!AG18+'A-hetero'!AG18+'a-homo'!AG18 -> 10 | AH18: =AA!AH18+'A-hetero'!AH18+'a-homo'!AH18 -> 10 | AI18: =AA!AI18+'A-hetero'!AI18+'a-homo'!AI18 -> 10 | AJ18: =AA!AJ18+'A-hetero'!AJ18+'a-homo'!AJ18 -> 10 | AK18: =AA!AK18+'A-hetero'!AK18+'a-homo'!AK18 -> 305 | AL18: =AA!AL18+'A-hetero'!AL18+'a-homo'!AL18 -> 37 | AM18: =AA!AM18+'A-hetero'!AM18+'a-homo'!AM18 -> 10 | AN18: =AA!AN18+'A-hetero'!AN18+'a-homo'!AN18 -> 10 | AO18: =AA!AO18+'A-hetero'!AO18+'a-homo'!AO18 -> 10 | AP18: =AA!AP18+'A-hetero'!AP18+'a-homo'!AP18 -> 10 | AQ18: =AA!AQ18+'A-hetero'!AQ18+'a-homo'!AQ18 -> 10 | AR18: =AA!AR18+'A-hetero'!AR18+'a-homo'!AR18 -> 10 | AS18: =SUM(AC18:AJ18) -> 856 | AT18: =AA!AT18+'A-hetero'!AT18+'a-homo'!AT18 -> 367.25210924197364 | AU18: =AA!AU18+'A-hetero'!AU18+'a-homo'!AU18 -> 512.15389546017309 | AV18: =AA!AV18+'A-hetero'!AV18+'a-homo'!AV18 -> 27.034004282285938 | AW18: =AA!AW18+'A-hetero'!AW18+'a-homo'!AW18 -> 18.439271281622784 | AX18: =AA!AX18+'A-hetero'!AX18+'a-homo'!AX18 -> 27.413780788459917 | AY18: =AA!AY18+'A-hetero'!AY18+'a-homo'!AY18 -> 18.391395789014389 | AZ18: =AA!AZ18+'A-hetero'!AZ18+'a-homo'!AZ18 -> 27.76206981617711 | BA18: =AA!BA18+'A-hetero'!BA18+'a-homo'!BA18 -> 48.553473340293102 | BB18: =AA!BB18+'A-hetero'!BB18+'a-homo'!BB18 -> 346.652820741825 | BC18: =AA!BC18+'A-hetero'!BC18+'a-homo'!BC18 -> 43.491598848018 | BD18: =AA!BD18+'A-hetero'!BD18+'a-homo'!BD18 -> 21.910525844364617 | BE18: =AA!BE18+'A-hetero'!BE18+'a-homo'!BE18 -> 34.065774299736901 | BF18: =AA!BF18+'A-hetero'!BF18+'a-homo'!BF18 -> 18.999597745520017 | BG18: =AA!BG18+'A-hetero'!BG18+'a-homo'!BG18 -> 27.644801385015914 | BH18: =AA!BH18+'A-hetero'!BH18+'a-homo'!BH18 -> 54.975091539393752 | BI18: =AA!BI18+'A-hetero'!BI18+'a-homo'!BI18 -> 47.259789596125799 | BJ18: =SUM(AT18:BI18) -> 1642 | BK18: =AT18/BJ18 -> 0.22366145508037372 | BL18: =AU18/BJ18 -> 0.31190858432410057 | BM18: =AV18/BJ18 -> 1.646407081747012E-2 | BN18: =AW18/BJ18 -> 1.1229763265300112E-2 | BO18: =AX18/BJ18 -> 1.6695359798087648E-2 | BP18: =AY18/BJ18 -> 1.1200606448851638E-2 | BQ18: =AZ18/BJ18 -> 1.6907472482446475E-2 | BR18: =BA18/BJ18 -> 2.9569715797986056E-2 | BS18: =BB18/BJ18 -> 0.21111621238844397 | BT18: =BC18/BJ18 -> 2.6486966411704019E-2 | BU18: =BD18/BJ18 -> 1.3343803802901715E-2 | BV18: =BE18/BJ18 -> 2.0746512971825153E-2 | BW18: =BF18/BJ18 -> 1.1571009589232654E-2 | BX18: =BG18/BJ18 -> 1.6836054436672299E-2 | BY18: =BH18/BJ18 -> 3.3480567319971836E-2 | BZ18: =BI18/BJ18 -> 2.8781845064632033E-2 | CA18: =SUM(BK18:BZ18) -> 1
AC19: =AA!AC19+'A-hetero'!AC19+'a-homo'!AC19 -> 334 | AD19: =AA!AD19+'A-hetero'!AD19+'a-homo'!AD19 -> 463 | AE19: =AA!AE19+'A-hetero'!AE19+'a-homo'!AE19 -> 10 | AF19: =AA!AF19+'A-hetero'!AF19+'a-homo'!AF19 -> 9 | AG19: =AA!AG19+'A-hetero'!AG19+'a-homo'!AG19 -> 10 | AH19: =AA!AH19+'A-hetero'!AH19+'a-homo'!AH19 -> 10 | AI19: =AA!AI19+'A-hetero'!AI19+'a-homo'!AI19 -> 10 | AJ19: =AA!AJ19+'A-hetero'!AJ19+'a-homo'!AJ19 -> 10 | AK19: =AA!AK19+'A-hetero'!AK19+'a-homo'!AK19 -> 305 | AL19: =AA!AL19+'A-hetero'!AL19+'a-homo'!AL19 -> 37 | AM19: =AA!AM19+'A-hetero'!AM19+'a-homo'!AM19 -> 10 | AN19: =AA!AN19+'A-hetero'!AN19+'a-homo'!AN19 -> 10 | AO19: =AA!AO19+'A-hetero'!AO19+'a-homo'!AO19 -> 10 | AP19: =AA!AP19+'A-hetero'!AP19+'a-homo'!AP19 -> 10 | AQ19: =AA!AQ19+'A-hetero'!AQ19+'a-homo'!AQ19 -> 10 | AR19: =AA!AR19+'A-hetero'!AR19+'a-homo'!AR19 -> 10 | AS19: =SUM(AC19:AJ19) -> 856 | AT19: =AA!AT19+'A-hetero'!AT19+'a-homo'!AT19 -> 367.24120934789869 | AU19: =AA!AU19+'A-hetero'!AU19+'a-homo'!AU19 -> 512.159744155765 | AV19: =AA!AV19+'A-hetero'!AV19+'a-homo'!AV19 -> 27.040055051193026 | AW19: =AA!AW19+'A-hetero'!AW19+'a-homo'!AW19 -> 18.432719413701232 | AX19: =AA!AX19+'A-hetero'!AX19+'a-homo'!AX19 -> 27.41898385939793 | AY19: =AA!AY19+'A-hetero'!AY19+'a-homo'!AY19 -> 18.385954331047159 | AZ19: =AA!AZ19+'A-hetero'!AZ19+'a-homo'!AZ19 -> 27.751236063405916 | BA19: =AA!BA19+'A-hetero'!BA19+'a-homo'!BA19 -> 48.570097777591016 | BB19: =AA!BB19+'A-hetero'!BB19+'a-homo'!BB19 -> 346.65753526150962 | BC19: =AA!BC19+'A-hetero'!BC19+'a-homo'!BC19 -> 43.490100128376369 | BD19: =AA!BD19+'A-hetero'!BD19+'a-homo'!BD19 -> 21.903951366605774 | BE19: =AA!BE19+'A-hetero'!BE19+'a-homo'!BE19 -> 34.074685274950255 | BF19: =AA!BF19+'A-hetero'!BF19+'a-homo'!BF19 -> 18.994209557178827 | BG19: =AA!BG19+'A-hetero'!BG19+'a-homo'!BG19 -> 27.652263358826364 | BH19: =AA!BH19+'A-hetero'!BH19+'a-homo'!BH19 -> 54.992819492810199 | BI19: =AA!BI19+'A-hetero'!BI19+'a-homo'!BI19 -> 47.234435559742572 | BJ19: =SUM(AT19:BI19) -> 1642 | BK19: =AT19/BJ19 -> 0.22365481689884206 | BL19: =AU19/BJ19 -> 0.31191214625807856 | BM19: =AV19/BJ19 -> 1.6467755816804524E-2 | BN19: =AW19/BJ19 -> 1.122577308995203E-2 | BO19: =AX19/BJ19 -> 1.6698528538001176E-2 | BP19: =AY19/BJ19 -> 1.1197292528043338E-2 | BQ19: =AZ19/BJ19 -> 1.6900874581855005E-2 | BR19: =BA19/BJ19 -> 2.9579840303039596E-2 | BS19: =BB19/BJ19 -> 0.21111908359409842 | BT19: =BC19/BJ19 -> 2.6486053671361979E-2 | BU19: =BD19/BJ19 -> 1.333979985785979E-2 | BV19: =BE19/BJ19 -> 2.0751939875121958E-2 | BW19: =BF19/BJ19 -> 1.1567728110340333E-2 | BX19: =BG19/BJ19 -> 1.6840598878700586E-2 | BY19: =BH19/BJ19 -> 3.3491363881126793E-2 | BZ19: =BI19/BJ19 -> 2.8766404116773794E-2 | CA19: =SUM(BK19:BZ19) -> 1
AC20: =AA!AC20+'A-hetero'!AC20+'a-homo'!AC20 -> 334 | AD20: =AA!AD20+'A-hetero'!AD20+'a-homo'!AD20 -> 463 | AE20: =AA!AE20+'A-hetero'!AE20+'a-homo'!AE20 -> 10 | AF20: =AA!AF20+'A-hetero'!AF20+'a-homo'!AF20 -> 9 | AG20: =AA!AG20+'A-hetero'!AG20+'a-homo'!AG20 -> 10 | AH20: =AA!AH20+'A-hetero'!AH20+'a-homo'!AH20 -> 10 | AI20: =AA!AI20+'A-hetero'!AI20+'a-homo'!AI20 -> 10 | AJ20: =AA!AJ20+'A-hetero'!AJ20+'a-homo'!AJ20 -> 10 | AK20: =AA!AK20+'A-hetero'!AK20+'a-homo'!AK20 -> 305 | AL20: =AA!AL20+'A-hetero'!AL20+'a-homo'!AL20 -> 37 | AM20: =AA!AM20+'A-hetero'!AM20+'a-homo'!AM20 -> 10 | AN20: =AA!AN20+'A-hetero'!AN20+'a-homo'!AN20 -> 10 | AO20: =AA!AO20+'A-hetero'!AO20+'a-homo'!AO20 -> 10 | AP20: =AA!AP20+'A-hetero'!AP20+'a-homo'!AP20 -> 10 | AQ20: =AA!AQ20+'A-hetero'!AQ20+'a-homo'!AQ20 -> 10 | AR20: =AA!AR20+'A-hetero'!AR20+'a-homo'!AR20 -> 10 | AS20: =SUM(AC20:AJ20) -> 856 | AT20: =AA!AT20+'A-hetero'!AT20+'a-homo'!AT20 -> 367.23333884112429 | AU20: =AA!AU20+'A-hetero'!AU20+'a-homo'!AU20 -> 512.16401175089163 | AV20: =AA!AV20+'A-hetero'!AV20+'a-homo'!AV20 -> 27.044269192976646 | AW20: =AA!AW20+'A-hetero'!AW20+'a-homo'!AW20 -> 18.428106154552736 | AX20: =AA!AX20+'A-hetero'!AX20+'a-homo'!AX20 -> 27.422599016186986 | AY20: =AA!AY20+'A-hetero'!AY20+'a-homo'!AY20 -> 18.382123542962695 | AZ20: =AA!AZ20+'A-hetero'!AZ20+'a-homo'!AZ20 -> 27.743575491527139 | BA20: =AA!BA20+'A-hetero'!BA20+'a-homo'!BA20 -> 48.581976009777925 | BB20: =AA!BB20+'A-hetero'!BB20+'a-homo'!BB20 -> 346.660878199867 | BC20: =AA!BC20+'A-hetero'!BC20+'a-homo'!BC20 -> 43.489040374655708 | BD20: =AA!BD20+'A-hetero'!BD20+'a-homo'!BD20 -> 21.899309508148043 | BE20: =AA!BE20+'A-hetero'!BE20+'a-homo'!BE20 -> 34.081045977783994 | BF20: =AA!BF20+'A-hetero'!BF20+'a-homo'!BF20 -> 18.990401180424733 | BG20: =AA!BG20+'A-hetero'!BG20+'a-homo'!BG20 -> 27.657607093887009 | BH20: =AA!BH20+'A-hetero'!BH20+'a-homo'!BH20 -> 55.005628569745184 | BI20: =AA!BI20+'A-hetero'!BI20+'a-homo'!BI20 -> 47.216089095488343 | BJ20: =SUM(AT20:BI20) -> 1642 | BK20: =AT20/BJ20 -> 0.22365002365476508 | BL20: =AU20/BJ20 -> 0.31191474528068913 | BM20: =AV20/BJ20 -> 1.647032228561306E-2 | BN20: =AW20/BJ20 -> 1.1222963553320787E-2 | BO20: =AX20/BJ20 -> 1.6700730216922643E-2 | BP20: =AY20/BJ20 -> 1.1194959526773868E-2 | BQ20: =AZ20/BJ20 -> 1.6896209190942226E-2 | BR20: =BA20/BJ20 -> 2.9587074305589475E-2 | BS20: =BB20/BJ20 -> 0.21112111948834772 | BT20: =BC20/BJ20 -> 2.6485408267147199E-2 | BU20: =BD20/BJ20 -> 1.3336972903866042E-2 | BV20: =BE20/BJ20 -> 2.0755813628370274E-2 | BW20: =BF20/BJ20 -> 1.1565408757871334E-2 | BX20: =BG20/BJ20 -> 1.6843853284949455E-2 | BY20: =BH20/BJ20 -> 3.3499164780599985E-2 | BZ20: =BI20/BJ20 -> 2.8755230874231631E-2 | CA20: =SUM(BK20:BZ20) -> 1
AC21: =AA!AC21+'A-hetero'!AC21+'a-homo'!AC21 -> 334 | AD21: =AA!AD21+'A-hetero'!AD21+'a-homo'!AD21 -> 463 | AE21: =AA!AE21+'A-hetero'!AE21+'a-homo'!AE21 -> 10 | AF21: =AA!AF21+'A-hetero'!AF21+'a-homo'!AF21 -> 9 | AG21: =AA!AG21+'A-hetero'!AG21+'a-homo'!AG21 -> 10 | AH21: =AA!AH21+'A-hetero'!AH21+'a-homo'!AH21 -> 10 | AI21: =AA!AI21+'A-hetero'!AI21+'a-homo'!AI21 -> 10 | AJ21: =AA!AJ21+'A-hetero'!AJ21+'a-homo'!AJ21 -> 10 | AK21: =AA!AK21+'A-hetero'!AK21+'a-homo'!AK21 -> 305 | AL21: =AA!AL21+'A-hetero'!AL21+'a-homo'!AL21 -> 37 | AM21: =AA!AM21+'A-hetero'!AM21+'a-homo'!AM21 -> 10 | AN21: =AA!AN21+'A-hetero'!AN21+'a-homo'!AN21 -> 10 | AO21: =AA!AO21+'A-hetero'!AO21+'a-homo'!AO21 -> 10 | AP21: =AA!AP21+'A-hetero'!AP21+'a-homo'!AP21 -> 10 | AQ21: =AA!AQ21+'A-hetero'!AQ21+'a-homo'!AQ21 -> 10 | AR21: =AA!AR21+'A-hetero'!AR21+'a-homo'!AR21 -> 10 | AS21: =SUM(AC21:AJ21) -> 856 | AT21: =AA!AT21+'A-hetero'!AT21+'a-homo'!AT21 -> 367.22766440421844 | AU21: =AA!AU21+'A-hetero'!AU21+'a-homo'!AU21 -> 512.16711829135465 | AV21: =AA!AV21+'A-hetero'!AV21+'a-homo'!AV21 -> 27.047215383861609 | AW21: =AA!AW21+'A-hetero'!AW21+'a-homo'!AW21 -> 18.424852569203189 | AX21: =AA!AX21+'A-hetero'!AX21+'a-homo'!AX21 -> 27.425122190849258 | AY21: =AA!AY21+'A-hetero'!AY21+'a-homo'!AY21 -> 18.379421273195799 | AZ21: =AA!AZ21+'A-hetero'!AZ21+'a-homo'!AZ21 -> 27.738148759644467 | BA21: =AA!BA21+'A-hetero'!BA21+'a-homo'!BA21 -> 48.590457127672607 | BB21: =AA!BB21+'A-hetero'!BB21+'a-homo'!BB21 -> 346.66324891621042 | BC21: =AA!BC21+'A-hetero'!BC21+'a-homo'!BC21 -> 43.488289812347553 | BD21: =AA!BD21+'A-hetero'!BD21+'a-homo'!BD21 -> 21.896023900198866 | BE21: =AA!BE21+'A-hetero'!BE21+'a-homo'!BE21 -> 34.085586722605292 | BF21: =AA!BF21+'A-hetero'!BF21+'a-homo'!BF21 -> 18.987702151759656 | BG21: =AA!BG21+'A-hetero'!BG21+'a-homo'!BG21 -> 27.661432960064239 | BH21: =AA!BH21+'A-hetero'!BH21+'a-homo'!BH21 -> 55.014874293257236 | BI21: =AA!BI21+'A-hetero'!BI21+'a-homo'!BI21 -> 47.202841243556719 | BJ21: =SUM(AT21:BI21) -> 1642 | BK21: =AT21/BJ21 -> 0.22364656784666165 | BL21: =AU21/BJ21 -> 0.31191663720545348 | BM21: =AV21/BJ21 -> 1.6472116555335935E-2 | BN21: =AW21/BJ21 -> 1.122098207625042E-2 | BO21: =AX21/BJ21 -> 1.670226686409821E-2 | BP21: =AY21/BJ21 -> 1.1193313808280024E-2 | BQ21: =AZ21/BJ21 -> 1.6892904238516727E-2 | BR21: =BA21/BJ21 -> 2.9592239420019859E-2 | BS21: =BB21/BJ21 -> 0.21112256328636445 | BT21: =BC21/BJ21 -> 2.6484951164645283E-2 | BU21: =BD21/BJ21 -> 1.333497192460345E-2 | BV21: =BE21/BJ21 -> 2.0758579002804686E-2 | BW21: =BF21/BJ21 -> 1.1563765013251922E-2 | BX21: =BG21/BJ21 -> 1.6846183288711472E-2 | BY21: =BH21/BJ21 -> 3.3504795550095758E-2 | BZ21: =BI21/BJ21 -> 2.8747162754906651E-2 | CA21: =SUM(BK21:BZ21) -> 1
AC22: =AA!AC22+'A-hetero'!AC22+'a-homo'!AC22 -> 334 | AD22: =AA!AD22+'A-hetero'!AD22+'a-homo'!AD22 -> 463 | AE22: =AA!AE22+'A-hetero'!AE22+'a-homo'!AE22 -> 10 | AF22: =AA!AF22+'A-hetero'!AF22+'a-homo'!AF22 -> 9 | AG22: =AA!AG22+'A-hetero'!AG22+'a-homo'!AG22 -> 10 | AH22: =AA!AH22+'A-hetero'!AH22+'a-homo'!AH22 -> 10 | AI22: =AA!AI22+'A-hetero'!AI22+'a-homo'!AI22 -> 10 | AJ22: =AA!AJ22+'A-hetero'!AJ22+'a-homo'!AJ22 -> 10 | AK22: =AA!AK22+'A-hetero'!AK22+'a-homo'!AK22 -> 305 | AL22: =AA!AL22+'A-hetero'!AL22+'a-homo'!AL22 -> 37 | AM22: =AA!AM22+'A-hetero'!AM22+'a-homo'!AM22 -> 10 | AN22: =AA!AN22+'A-hetero'!AN22+'a-homo'!AN22 -> 10 | AO22: =AA!AO22+'A-hetero'!AO22+'a-homo'!AO22 -> 10 | AP22: =AA!AP22+'A-hetero'!AP22+'a-homo'!AP22 -> 10 | AQ22: =AA!AQ22+'A-hetero'!AQ22+'a-homo'!AQ22 -> 10 | AR22: =AA!AR22+'A-hetero'!AR22+'a-homo'!AR22 -> 10 | AS22: =SUM(AC22:AJ22) -> 856 | AT22: =AA!AT22+'A-hetero'!AT22+'a-homo'!AT22 -> 367.22357836485867 | AU22: =AA!AU22+'A-hetero'!AU22+'a-homo'!AU22 -> 512.16937492916691 | AV22: =AA!AV22+'A-hetero'!AV22+'a-homo'!AV22 -> 27.049281996146981 | AW22: =AA!AW22+'A-hetero'!AW22+'a-homo'!AW22 -> 18.422554400631519 | AX22: =AA!AX22+'A-hetero'!AX22+'a-homo'!AX22 -> 27.426890056589738 | AY22: =AA!AY22+'A-hetero'!AY22+'a-homo'!AY22 -> 18.377511673777022 | AZ22: =AA!AZ22+'A-hetero'!AZ22+'a-homo'!AZ22 -> 27.734298602176342 | BA22: =AA!BA22+'A-hetero'!BA22+'a-homo'!BA22 -> 48.596509976652882 | BB22: =AA!BB22+'A-hetero'!BB22+'a-homo'!BB22 -> 346.66493067636895 | BC22: =AA!BC22+'A-hetero'!BC22+'a-homo'!BC22 -> 43.487757478746644 | BD22: =AA!BD22+'A-hetero'!BD22+'a-homo'!BD22 -> 21.893693373755742 | BE22: =AA!BE22+'A-hetero'!BE22+'a-homo'!BE22 -> 34.088828780324626 | BF22: =AA!BF22+'A-hetero'!BF22+'a-homo'!BF22 -> 18.985785162278063 | BG22: =AA!BG22+'A-hetero'!BG22+'a-homo'!BG22 -> 27.664171658214041 | BH22: =AA!BH22+'A-hetero'!BH22+'a-homo'!BH22 -> 55.021541767825468 | BI22: =AA!BI22+'A-hetero'!BI22+'a-homo'!BI22 -> 47.193291102486434 | BJ22: =SUM(AT22:BI22) -> 1642 | BK22: =AT22/BJ22 -> 0.22364407939394562 | BL22: =AU22/BJ22 -> 0.31191801152811632 | BM22: =AV22/BJ22 -> 1.6473375149906811E-2 | BN22: =AW22/BJ22 -> 1.1219582460798735E-2 | BO22: =AX22/BJ22 -> 1.6703343518020549E-2 | BP22: =AY22/BJ22 -> 1.1192150836648615E-2 | BQ22: =AZ22/BJ22 -> 1.6890559441033098E-2 | BR22: =BA22/BJ22 -> 2.9595925686146704E-2 | BS22: =BB22/BJ22 -> 0.21112358750083374 | BT22: =BC22/BJ22 -> 2.6484626966349969E-2 | BU22: =BD22/BJ22 -> 1.3333552602774509E-2 | BV22: =BE22/BJ22 -> 2.0760553459393805E-2 | BW22: =BF22/BJ22 -> 1.1562597540973243E-2 | BX22: =BG22/BJ22 -> 1.6847851192578589E-2 | BY22: =BH22/BJ22 -> 3.3508856131440605E-2 | BZ22: =BI22/BJ22 -> 2.8741346591039246E-2 | CA22: =SUM(BK22:BZ22) -> 1
AC23: =AA!AC23+'A-hetero'!AC23+'a-homo'!AC23 -> 334 | AD23: =AA!AD23+'A-hetero'!AD23+'a-homo'!AD23 -> 463 | AE23: =AA!AE23+'A-hetero'!AE23+'a-homo'!AE23 -> 10 | AF23: =AA!AF23+'A-hetero'!AF23+'a-homo'!AF23 -> 9 | AG23: =AA!AG23+'A-hetero'!AG23+'a-homo'!AG23 -> 10 | AH23: =AA!AH23+'A-hetero'!AH23+'a-homo'!AH23 -> 10 | AI23: =AA!AI23+'A-hetero'!AI23+'a-homo'!AI23 -> 10 | AJ23: =AA!AJ23+'A-hetero'!AJ23+'a-homo'!AJ23 -> 10 | AK23: =AA!AK23+'A-hetero'!AK23+'a-homo'!AK23 -> 305 | AL23: =AA!AL23+'A-hetero'!AL23+'a-homo'!AL23 -> 37 | AM23: =AA!AM23+'A-hetero'!AM23+'a-homo'!AM23 -> 10 | AN23: =AA!AN23+'A-hetero'!AN23+'a-homo'!AN23 -> 10 | AO23: =AA!AO23+'A-hetero'!AO23+'a-homo'!AO23 -> 10 | AP23: =AA!AP23+'A-hetero'!AP23+'a-homo'!AP23 -> 10 | AQ23: =AA!AQ23+'A-hetero'!AQ23+'a-homo'!AQ23 -> 10 | AR23: =AA!AR23+'A-hetero'!AR23+'a-homo'!AR23 -> 10 | AS23: =SUM(AC23:AJ23) -> 856 | AT23: =AA!AT23+'A-hetero'!AT23+'a-homo'!AT23 -> 367.22063910571092 | AU23: =AA!AU23+'A-hetero'!AU23+'a-homo'!AU23 -> 512.17101116852655 | AV23: =AA!AV23+'A-hetero'!AV23+'a-homo'!AV23 -> 27.050735824357862 | AW23: =AA!AW23+'A-hetero'!AW23+'a-homo'!AW23 -> 18.420928794554591 | AX23: =AA!AX23+'A-hetero'!AX23+'a-homo'!AX23 -> 27.428132817093843 | AY23: =AA!AY23+'A-hetero'!AY23+'a-homo'!AY23 -> 18.376160102692463 | AZ23: =AA!AZ23+'A-hetero'!AZ23+'a-homo'!AZ23 -> 27.731563508037912 | BA23: =AA!BA23+'A-hetero'!BA23+'a-homo'!BA23 -> 48.600828679025867 | BB23: =AA!BB23+'A-hetero'!BB23+'a-homo'!BB23 -> 346.66612419468976 | BC23: =AA!BC23+'A-hetero'!BC23+'a-homo'!BC23 -> 43.487379455598777 | BD23: =AA!BD23+'A-hetero'!BD23+'a-homo'!BD23 -> 21.892037415039745 | BE23: =AA!BE23+'A-hetero'!BE23+'a-homo'!BE23 -> 34.091144041521829 | BF23: =AA!BF23+'A-hetero'!BF23+'a-homo'!BF23 -> 18.984421248855114 | BG23: =AA!BG23+'A-hetero'!BG23+'a-homo'!BG23 -> 27.666131906832593 | BH23: =AA!BH23+'A-hetero'!BH23+'a-homo'!BH23 -> 55.026345886214791 | BI23: =AA!BI23+'A-hetero'!BI23+'a-homo'!BI23 -> 47.186415851247411 | BJ23: =SUM(AT23:BI23) -> 1642 | BK23: =AT23/BJ23 -> 0.22364228934574359 | BL23: =AU23/BJ23 -> 0.31191900801980915 | BM23: =AV23/BJ23 -> 1.6474260550766055E-2 | BN23: =AW23/BJ23 -> 1.1218592444917536E-2 | BO23: =AX23/BJ23 -> 1.6704100375818421E-2 | BP23: =AY23/BJ23 -> 1.119132771174937E-2 | BQ23: =AZ23/BJ23 -> 1.6888893732057195E-2 | BR23: =BA23/BJ23 -> 2.9598555833755098E-2 | BS23: =BB23/BJ23 -> 0.21112431436948223 | BT23: =BC23/BJ23 -> 2.6484396745188054E-2 | BU23: =BD23/BJ23 -> 1.3332544101729444E-2 | BV23: =BE23/BJ23 -> 2.0761963484483455E-2 | BW23: =BF23/BJ23 -> 1.1561766899424553E-2 | BX23: =BG23/BJ23 -> 1.6849045010251276E-2 | BY23: =BH23/BJ23 -> 3.3511781903906697E-2 | BZ23: =BI23/BJ23 -> 2.8737159470918039E-2 | CA23: =SUM(BK23:BZ23) -> 1
AC24: =AA!AC24+'A-hetero'!AC24+'a-homo'!AC24 -> 334 | AD24: =AA!AD24+'A-hetero'!AD24+'a-homo'!AD24 -> 463 | AE24: =AA!AE24+'A-hetero'!AE24+'a-homo'!AE24 -> 10 | AF24: =AA!AF24+'A-hetero'!AF24+'a-homo'!AF24 -> 9 | AG24: =AA!AG24+'A-hetero'!AG24+'a-homo'!AG24 -> 10 | AH24: =AA!AH24+'A-hetero'!AH24+'a-homo'!AH24 -> 10 | AI24: =AA!AI24+'A-hetero'!AI24+'a-homo'!AI24 -> 10 | AJ24: =AA!AJ24+'A-hetero'!AJ24+'a-homo'!AJ24 -> 10 | AK24: =AA!AK24+'A-hetero'!AK24+'a-homo'!AK24 -> 305 | AL24: =AA!AL24+'A-hetero'!AL24+'a-homo'!AL24 -> 37 | AM24: =AA!AM24+'A-hetero'!AM24+'a-homo'!AM24 -> 10 | AN24: =AA!AN24+'A-hetero'!AN24+'a-homo'!AN24 -> 10 | AO24: =AA!AO24+'A-hetero'!AO24+'a-homo'!AO24 -> 10 | AP24: =AA!AP24+'A-hetero'!AP24+'a-homo'!AP24 -> 10 | AQ24: =AA!AQ24+'A-hetero'!AQ24+'a-homo'!AQ24 -> 10 | AR24: =AA!AR24+'A-hetero'!AR24+'a-homo'!AR24 -> 10 | AS24: =SUM(AC24:AJ24) -> 856 | AT24: =AA!AT24+'A-hetero'!AT24+'a-homo'!AT24 -> 367.21852656128772 | AU24: =AA!AU24+'A-hetero'!AU24+'a-homo'!AU24 -> 512.17219565170763 | AV24: =AA!AV24+'A-hetero'!AV24+'a-homo'!AV24 -> 27.051761124432666 | AW24: =AA!AW24+'A-hetero'!AW24+'a-homo'!AW24 -> 18.419777440322676 | AX24: =AA!AX24+'A-hetero'!AX24+'a-homo'!AX24 -> 27.429008897242618 | AY24: =AA!AY24+'A-hetero'!AY24+'a-homo'!AY24 -> 18.375202168865499 | AZ24: =AA!AZ24+'A-hetero'!AZ24+'a-homo'!AZ24 -> 27.729618464815328 | BA24: =AA!BA24+'A-hetero'!BA24+'a-homo'!BA24 -> 48.603909691325896 | BB24: =AA!BB24+'A-hetero'!BB24+'a-homo'!BB24 -> 346.66697162393228 | BC24: =AA!BC24+'A-hetero'!BC24+'a-homo'!BC24 -> 43.487110724089405 | BD24: =AA!BD24+'A-hetero'!BD24+'a-homo'!BD24 -> 21.8908590862838 | BE24: =AA!BE24+'A-hetero'!BE24+'a-homo'!BE24 -> 34.092797787943852 | BF24: =AA!BF24+'A-hetero'!BF24+'a-homo'!BF24 -> 18.983449505366846 | BG24: =AA!BG24+'A-hetero'!BG24+'a-homo'!BG24 -> 27.667534867508024 | BH24: =AA!BH24+'A-hetero'!BH24+'a-homo'!BH24 -> 55.029804736638781 | BI24: =AA!BI24+'A-hetero'!BI24+'a-homo'!BI24 -> 47.181471668237016 | BJ24: =SUM(AT24:BI24) -> 1642 | BK24: =AT24/BJ24 -> 0.22364100277788526 | BL24: =AU24/BJ24 -> 0.31191972938593637 | BM24: =AV24/BJ24 -> 1.6474884972248877E-2 | BN24: =AW24/BJ24 -> 1.1217891254764112E-2 | BO24: =AX24/BJ24 -> 1.6704633920366998E-2 | BP24: =AY24/BJ24 -> 1.1190744317214065E-2 | BQ24: =AZ24/BJ24 -> 1.6887709174674373E-2 | BR24: =BA24/BJ24 -> 2.9600432211526116E-2 | BS24: =BB24/BJ24 -> 0.21112483046524494 | BT24: =BC24/BJ24 -> 2.648423308409829E-2 | BU24: =BD24/BJ24 -> 1.3331826483729473E-2 | BV24: =BE24/BJ24 -> 2.076297063821184E-2 | BW24: =BF24/BJ24 -> 1.1561175094620487E-2 | BX24: =BG24/BJ24 -> 1.6849899432099889E-2 | BY24: =BH24/BJ24 -> 3.3513888390157592E-2 | BZ24: =BI24/BJ24 -> 2.8734148397221073E-2 | CA24: =SUM(BK24:BZ24) -> 1
AC25: =AA!AC25+'A-hetero'!AC25+'a-homo'!AC25 -> 334 | AD25: =AA!AD25+'A-hetero'!AD25+'a-homo'!AD25 -> 463 | AE25: =AA!AE25+'A-hetero'!AE25+'a-homo'!AE25 -> 10 | AF25: =AA!AF25+'A-hetero'!AF25+'a-homo'!AF25 -> 9 | AG25: =AA!AG25+'A-hetero'!AG25+'a-homo'!AG25 -> 10 | AH25: =AA!AH25+'A-hetero'!AH25+'a-homo'!AH25 -> 10 | AI25: =AA!AI25+'A-hetero'!AI25+'a-homo'!AI25 -> 10 | AJ25: =AA!AJ25+'A-hetero'!AJ25+'a-homo'!AJ25 -> 10 | AK25: =AA!AK25+'A-hetero'!AK25+'a-homo'!AK25 -> 305 | AL25: =AA!AL25+'A-hetero'!AL25+'a-homo'!AL25 -> 37 | AM25: =AA!AM25+'A-hetero'!AM25+'a-homo'!AM25 -> 10 | AN25: =AA!AN25+'A-hetero'!AN25+'a-homo'!AN25 -> 10 | AO25: =AA!AO25+'A-hetero'!AO25+'a-homo'!AO25 -> 10 | AP25: =AA!AP25+'A-hetero'!AP25+'a-homo'!AP25 -> 10 | AQ25: =AA!AQ25+'A-hetero'!AQ25+'a-homo'!AQ25 -> 10 | AR25: =AA!AR25+'A-hetero'!AR25+'a-homo'!AR25 -> 10 | AS25: =SUM(AC25:AJ25) -> 856 | AT25: =AA!AT25+'A-hetero'!AT25+'a-homo'!AT25 -> 367.21700927045663 | AU25: =AA!AU25+'A-hetero'!AU25+'a-homo'!AU25 -> 512.17305188810519 | AV25: =AA!AV25+'A-hetero'!AV25+'a-homo'!AV25 -> 27.052485759565851 | AW25: =AA!AW25+'A-hetero'!AW25+'a-homo'!AW25 -> 18.418961027843729 | AX25: =AA!AX25+'A-hetero'!AX25+'a-homo'!AX25 -> 27.429627950734449 | AY25: =AA!AY25+'A-hetero'!AY25+'a-homo'!AY25 -> 18.374522406787271 | AZ25: =AA!AZ25+'A-hetero'!AZ25+'a-homo'!AZ25 -> 27.728234023550414 | BA25: =AA!BA25+'A-hetero'!BA25+'a-homo'!BA25 -> 48.606107672956625 | BB25: =AA!BB25+'A-hetero'!BB25+'a-homo'!BB25 -> 346.66757363217056 | BC25: =AA!BC25+'A-hetero'!BC25+'a-homo'!BC25 -> 43.486919509946659 | BD25: =AA!BD25+'A-hetero'!BD25+'a-homo'!BD25 -> 21.890019646231217 | BE25: =AA!BE25+'A-hetero'!BE25+'a-homo'!BE25 -> 34.093979265680289 | BF25: =AA!BF25+'A-hetero'!BF25+'a-homo'!BF25 -> 18.982756421366926 | BG25: =AA!BG25+'A-hetero'!BG25+'a-homo'!BG25 -> 27.668538920432425 | BH25: =AA!BH25+'A-hetero'!BH25+'a-homo'!BH25 -> 55.032293295923949 | BI25: =AA!BI25+'A-hetero'!BI25+'a-homo'!BI25 -> 47.177919308247937 | BJ25: =SUM(AT25:BI25) -> 1642 | BK25: =AT25/BJ25 -> 0.22364007872744013 | BL25: =AU25/BJ25 -> 0.31192025084537472 | BM25: =AV25/BJ25 -> 1.6475326284753872E-2 | BN25: =AW25/BJ25 -> 1.1217394048625902E-2 | BO25: =AX25/BJ25 -> 1.670501093223779E-2 | BP25: =AY25/BJ25 -> 1.1190330333000776E-2 | BQ25: =AZ25/BJ25 -> 1.6886866031394894E-2 | BR25: =BA25/BJ25 -> 2.9601770811788448E-2 | BS25: =BB25/BJ25 -> 0.21112519709632802 | BT25: =BC25/BJ25 -> 2.6484116632123425E-2 | BU25: =BD25/BJ25 -> 1.333131525349039E-2 | BV25: =BE25/BJ25 -> 2.0763690173983128E-2 | BW25: =BF25/BJ25 -> 1.1560752997178398E-2 | BX25: =BG25/BJ25 -> 1.6850510913783454E-2 | BY25: =BH25/BJ25 -> 3.3515403956104722E-2 | BZ25: =BI25/BJ25 -> 2.8731984962392172E-2 | CA25: =SUM(BK25:BZ25) -> 1
AC26: =AA!AC26+'A-hetero'!AC26+'a-homo'!AC26 -> 334 | AD26: =AA!AD26+'A-hetero'!AD26+'a-homo'!AD26 -> 463 | AE26: =AA!AE26+'A-hetero'!AE26+'a-homo'!AE26 -> 10 | AF26: =AA!AF26+'A-hetero'!AF26+'a-homo'!AF26 -> 9 | AG26: =AA!AG26+'A-hetero'!AG26+'a-homo'!AG26 -> 10 | AH26: =AA!AH26+'A-hetero'!AH26+'a-homo'!AH26 -> 10 | AI26: =AA!AI26+'A-hetero'!AI26+'a-homo'!AI26 -> 10 | AJ26: =AA!AJ26+'A-hetero'!AJ26+'a-homo'!AJ26 -> 10 | AK26: =AA!AK26+'A-hetero'!AK26+'a-homo'!AK26 -> 305 | AL26: =AA!AL26+'A-hetero'!AL26+'a-homo'!AL26 -> 37 | AM26: =AA!AM26+'A-hetero'!AM26+'a-homo'!AM26 -> 10 | AN26: =AA!AN26+'A-hetero'!AN26+'a-homo'!AN26 -> 10 | AO26: =AA!AO26+'A-hetero'!AO26+'a-homo'!AO26 -> 10 | AP26: =AA!AP26+'A-hetero'!AP26+'a-homo'!AP26 -> 10 | AQ26: =AA!AQ26+'A-hetero'!AQ26+'a-homo'!AQ26 -> 10 | AR26: =AA!AR26+'A-hetero'!AR26+'a-homo'!AR26 -> 10 | AS26: =SUM(AC26:AJ26) -> 856 | AT26: =AA!AT26+'A-hetero'!AT26+'a-homo'!AT26 -> 367.21592014580665 | AU26: =AA!AU26+'A-hetero'!AU26+'a-homo'!AU26 -> 512.17367007037308 | AV26: =AA!AV26+'A-hetero'!AV26+'a-homo'!AV26 -> 27.052998837563951 | AW26: =AA!AW26+'A-hetero'!AW26+'a-homo'!AW26 -> 18.41838151099801 | AX26: =AA!AX26+'A-hetero'!AX26+'a-homo'!AX26 -> 27.430066255768928 | AY26: =AA!AY26+'A-hetero'!AY26+'a-homo'!AY26 -> 18.374039530342106 | AZ26: =AA!AZ26+'A-hetero'!AZ26+'a-homo'!AZ26 -> 27.727247866517217 | BA26: =AA!BA26+'A-hetero'!BA26+'a-homo'!BA26 -> 48.607675782630096 | BB26: =AA!BB26+'A-hetero'!BB26+'a-homo'!BB26 -> 346.6680015216931 | BC26: =AA!BC26+'A-hetero'!BC26+'a-homo'!BC26 -> 43.486783344896757 | BD26: =AA!BD26+'A-hetero'!BD26+'a-homo'!BD26 -> 21.889421065933028 | BE26: =AA!BE26+'A-hetero'!BE26+'a-homo'!BE26 -> 34.094823502735494 | BF26: =AA!BF26+'A-hetero'!BF26+'a-homo'!BF26 -> 18.982261671476778 | BG26: =AA!BG26+'A-hetero'!BG26+'a-homo'!BG26 -> 27.669257459642672 | BH26: =AA!BH26+'A-hetero'!BH26+'a-homo'!BH26 -> 55.034082635240374 | BI26: =AA!BI26+'A-hetero'!BI26+'a-homo'!BI26 -> 47.175368798381839 | BJ26: =SUM(AT26:BI26) -> 1642 | BK26: =AT26/BJ26 -> 0.22363941543593585 | BL26: =AU26/BJ26 -> 0.31192062732665837 | BM26: =AV26/BJ26 -> 1.647563875612908E-2 | BN26: =AW26/BJ26 -> 1.1217041115102321E-2 | BO26: =AX26/BJ26 -> 1.6705277865876327E-2 | BP26: =AY26/BJ26 -> 1.1190036254775947E-2 | BQ26: =AZ26/BJ26 -> 1.6886265448548852E-2 | BR26: =BA26/BJ26 -> 2.9602725811589584E-2 | BS26: =BB26/BJ26 -> 0.2111254576867802 | BT26: =BC26/BJ26 -> 2.6484033705783651E-2 | BU26: =BD26/BJ26 -> 1.3330950710068836E-2 | BV26: =BE26/BJ26 -> 2.0764204325661079E-2 | BW26: =BF26/BJ26 -> 1.1560451687866491E-2 | BX26: =BG26/BJ26 -> 1.6850948513789692E-2 | BY26: =BH26/BJ26 -> 3.3516493687722519E-2 | BZ26: =BI26/BJ26 -> 2.8730431667711231E-2 | CA26: =SUM(BK26:BZ26) -> 1
AC27: =AA!AC27+'A-hetero'!AC27+'a-homo'!AC27 -> 334 | AD27: =AA!AD27+'A-hetero'!AD27+'a-homo'!AD27 -> 463 | AE27: =AA!AE27+'A-hetero'!AE27+'a-homo'!AE27 -> 10 | AF27: =AA!AF27+'A-hetero'!AF27+'a-homo'!AF27 -> 9 | AG27: =AA!AG27+'A-hetero'!AG27+'a-homo'!AG27 -> 10 | AH27: =AA!AH27+'A-hetero'!AH27+'a-homo'!AH27 -> 10 | AI27: =AA!AI27+'A-hetero'!AI27+'a-homo'!AI27 -> 10 | AJ27: =AA!AJ27+'A-hetero'!AJ27+'a-homo'!AJ27 -> 10 | AK27: =AA!AK27+'A-hetero'!AK27+'a-homo'!AK27 -> 305 | AL27: =AA!AL27+'A-hetero'!AL27+'a-homo'!AL27 -> 37 | AM27: =AA!AM27+'A-hetero'!AM27+'a-homo'!AM27 -> 10 | AN27: =AA!AN27+'A-hetero'!AN27+'a-homo'!AN27 -> 10 | AO27: =AA!AO27+'A-hetero'!AO27+'a-homo'!AO27 -> 10 | AP27: =AA!AP27+'A-hetero'!AP27+'a-homo'!AP27 -> 10 | AQ27: =AA!AQ27+'A-hetero'!AQ27+'a-homo'!AQ27 -> 10 | AR27: =AA!AR27+'A-hetero'!AR27+'a-homo'!AR27 -> 10 | AS27: =SUM(AC27:AJ27) -> 856 | AT27: =AA!AT27+'A-hetero'!AT27+'a-homo'!AT27 -> 367.21513874539625 | AU27: =AA!AU27+'A-hetero'!AU27+'a-homo'!AU27 -> 512.17411589456083 | AV27: =AA!AV27+'A-hetero'!AV27+'a-homo'!AV27 -> 27.053362690158608 | AW27: =AA!AW27+'A-hetero'!AW27+'a-homo'!AW27 -> 18.417969764507937 | AX27: =AA!AX27+'A-hetero'!AX27+'a-homo'!AX27 -> 27.430377104272914 | AY27: =AA!AY27+'A-hetero'!AY27+'a-homo'!AY27 -> 18.373696199022461 | AZ27: =AA!AZ27+'A-hetero'!AZ27+'a-homo'!AZ27 -> 27.726544968332298 | BA27: =AA!BA27+'A-hetero'!BA27+'a-homo'!BA27 -> 48.608794633748587 | BB27: =AA!BB27+'A-hetero'!BB27+'a-homo'!BB27 -> 346.66830581315696 | BC27: =AA!BC27+'A-hetero'!BC27+'a-homo'!BC27 -> 43.486686314970051 | BD27: =AA!BD27+'A-hetero'!BD27+'a-homo'!BD27 -> 21.888993912084473 | BE27: =AA!BE27+'A-hetero'!BE27+'a-homo'!BE27 -> 34.095426865164768 | BF27: =AA!BF27+'A-hetero'!BF27+'a-homo'!BF27 -> 18.981908270332266 | BG27: =AA!BG27+'A-hetero'!BG27+'a-homo'!BG27 -> 27.669771658288145 | BH27: =AA!BH27+'A-hetero'!BH27+'a-homo'!BH27 -> 55.035368496266209 | BI27: =AA!BI27+'A-hetero'!BI27+'a-homo'!BI27 -> 47.173538669737113 | BJ27: =SUM(AT27:BI27) -> 1642 | BK27: =AT27/BJ27 -> 0.22363893955261646 | BL27: =AU27/BJ27 -> 0.31192089883956203 | BM27: =AV27/BJ27 -> 1.6475860347234233E-2 | BN27: =AW27/BJ27 -> 1.1216790355973165E-2 | BO27: =AX27/BJ27 -> 1.6705467176780092E-2 | BP27: =AY27/BJ27 -> 1.118982716140223E-2 | BQ27: =AZ27/BJ27 -> 1.6885837374136601E-2 | BR27: =BA27/BJ27 -> 2.9603407206911441E-2 | BS27: =BB27/BJ27 -> 0.21112564300435868 | BT27: =BC27/BJ27 -> 2.6483974613258254E-2 | BU27: =BD27/BJ27 -> 1.3330690567651932E-2 | BV27: =BE27/BJ27 -> 2.0764571781464534E-2 | BW27: =BF27/BJ27 -> 1.156023646183451E-2 | BX27: =BG27/BJ27 -> 1.6851261667654167E-2 | BY27: =BH27/BJ27 -> 3.3517276794315598E-2 | BZ27: =BI27/BJ27 -> 2.8729317094845989E-2 | CA27: =SUM(BK27:BZ27) -> 1
AC28: =AA!AC28+'A-hetero'!AC28+'a-homo'!AC28 -> 334 | AD28: =AA!AD28+'A-hetero'!AD28+'a-homo'!AD28 -> 463 | AE28: =AA!AE28+'A-hetero'!AE28+'a-homo'!AE28 -> 10 | AF28: =AA!AF28+'A-hetero'!AF28+'a-homo'!AF28 -> 9 | AG28: =AA!AG28+'A-hetero'!AG28+'a-homo'!AG28 -> 10 | AH28: =AA!AH28+'A-hetero'!AH28+'a-homo'!AH28 -> 10 | AI28: =AA!AI28+'A-hetero'!AI28+'a-homo'!AI28 -> 10 | AJ28: =AA!AJ28+'A-hetero'!AJ28+'a-homo'!AJ28 -> 10 | AK28: =AA!AK28+'A-hetero'!AK28+'a-homo'!AK28 -> 305 | AL28: =AA!AL28+'A-hetero'!AL28+'a-homo'!AL28 -> 37 | AM28: =AA!AM28+'A-hetero'!AM28+'a-homo'!AM28 -> 10 | AN28: =AA!AN28+'A-hetero'!AN28+'a-homo'!AN28 -> 10 | AO28: =AA!AO28+'A-hetero'!AO28+'a-homo'!AO28 -> 10 | AP28: =AA!AP28+'A-hetero'!AP28+'a-homo'!AP28 -> 10 | AQ28: =AA!AQ28+'A-hetero'!AQ28+'a-homo'!AQ28 -> 10 | AR28: =AA!AR28+'A-hetero'!AR28+'a-homo'!AR28 -> 10 | AS28: =SUM(AC28:AJ28) -> 856 | AT28: =AA!AT28+'A-hetero'!AT28+'a-homo'!AT28 -> 367.21457835445841 | AU28: =AA!AU28+'A-hetero'!AU28+'a-homo'!AU28 -> 512.17443710744078 | AV28: =AA!AV28+'A-hetero'!AV28+'a-homo'!AV28 -> 27.053621061327597 | AW28: =AA!AW28+'A-hetero'!AW28+'a-homo'!AW28 -> 18.417676974464086 | AX28: =AA!AX28+'A-hetero'!AX28+'a-homo'!AX28 -> 27.430597867504034 | AY28: =AA!AY28+'A-hetero'!AY28+'a-homo'!AY28 -> 18.373451891377556 | AZ28: =AA!AZ28+'A-hetero'!AZ28+'a-homo'!AZ28 -> 27.726043699366148 | BA28: =AA!BA28+'A-hetero'!BA28+'a-homo'!BA28 -> 48.609593044061427 | BB28: =AA!BB28+'A-hetero'!BB28+'a-homo'!BB28 -> 346.66852231949076 | BC28: =AA!BC28+'A-hetero'!BC28+'a-homo'!BC28 -> 43.486617132343866 | BD28: =AA!BD28+'A-hetero'!BD28+'a-homo'!BD28 -> 21.888688905498224 | BE28: =AA!BE28+'A-hetero'!BE28+'a-homo'!BE28 -> 34.09585814497629 | BF28: =AA!BF28+'A-hetero'!BF28+'a-homo'!BF28 -> 18.981655709232687 | BG28: =AA!BG28+'A-hetero'!BG28+'a-homo'!BG28 -> 27.670139618151921 | BH28: =AA!BH28+'A-hetero'!BH28+'a-homo'!BH28 -> 55.036292083122149 | BI28: =AA!BI28+'A-hetero'!BI28+'a-homo'!BI28 -> 47.172226087184072 | BJ28: =SUM(AT28:BI28) -> 1642 | BK28: =AT28/BJ28 -> 0.22363859826702703 | BL28: =AU28/BJ28 -> 0.3119210944625096 | BM28: =AV28/BJ28 -> 1.6476017698737879E-2 | BN28: =AW28/BJ28 -> 1.1216612042913573E-2 | BO28: =AX28/BJ28 -> 1.6705601624545697E-2 | BP28: =AY28/BJ28 -> 1.1189678374773176E-2 | BQ28: =AZ28/BJ28 -> 1.6885532094620067E-2 | BR28: =BA28/BJ28 -> 2.9603893449489299E-2 | BS28: =BB28/BJ28 -> 0.21112577485961678 | BT28: =BC28/BJ28 -> 2.6483932480111976E-2 | BU28: =BD28/BJ28 -> 1.3330504814554339E-2 | BV28: =BE28/BJ28 -> 2.0764834436648168E-2 | BW28: =BF28/BJ28 -> 1.1560082648740979E-2 | BX28: =BG28/BJ28 -> 1.6851485760141244E-2 | BY28: =BH28/BJ28 -> 3.3517839271085349E-2 | BZ28: =BI28/BJ28 -> 2.8728517714484817E-2 | CA28: =SUM(BK28:BZ28) -> 1
AC29: =AA!AC29+'A-hetero'!AC29+'a-homo'!AC29 -> 334 | AD29: =AA!AD29+'A-hetero'!AD29+'a-homo'!AD29 -> 463 | AE29: =AA!AE29+'A-hetero'!AE29+'a-homo'!AE29 -> 10 | AF29: =AA!AF29+'A-hetero'!AF29+'a-homo'!AF29 -> 9 | AG29: =AA!AG29+'A-hetero'!AG29+'a-homo'!AG29 -> 10 | AH29: =AA!AH29+'A-hetero'!AH29+'a-homo'!AH29 -> 10 | AI29: =AA!AI29+'A-hetero'!AI29+'a-homo'!AI29 -> 10 | AJ29: =AA!AJ29+'A-hetero'!AJ29+'a-homo'!AJ29 -> 10 | AK29: =AA!AK29+'A-hetero'!AK29+'a-homo'!AK29 -> 305 | AL29: =AA!AL29+'A-hetero'!AL29+'a-homo'!AL29 -> 37 | AM29: =AA!AM29+'A-hetero'!AM29+'a-homo'!AM29 -> 10 | AN29: =AA!AN29+'A-hetero'!AN29+'a-homo'!AN29 -> 10 | AO29: =AA!AO29+'A-hetero'!AO29+'a-homo'!AO29 -> 10 | AP29: =AA!AP29+'A-hetero'!AP29+'a-homo'!AP29 -> 10 | AQ29: =AA!AQ29+'A-hetero'!AQ29+'a-homo'!AQ29 -> 10 | AR29: =AA!AR29+'A-hetero'!AR29+'a-homo'!AR29 -> 10 | AS29: =SUM(AC29:AJ29) -> 856 | AT29: =AA!AT29+'A-hetero'!AT29+'a-homo'!AT29 -> 367.21417660234954 | AU29: =AA!AU29+'A-hetero'!AU29+'a-homo'!AU29 -> 512.17466834339814 | AV29: =AA!AV29+'A-hetero'!AV29+'a-homo'!AV29 -> 27.053804737092022 | AW29: =AA!AW29+'A-hetero'!AW29+'a-homo'!AW29 -> 18.417468619346202 | AX29: =AA!AX29+'A-hetero'!AX29+'a-homo'!AX29 -> 27.43075483536596 | AY29: =AA!AY29+'A-hetero'!AY29+'a-homo'!AY29 -> 18.37327792654602 | AZ29: =AA!AZ29+'A-hetero'!AZ29+'a-homo'!AZ29 -> 27.725686059709016 | BA29: =AA!BA29+'A-hetero'!BA29+'a-homo'!BA29 -> 48.610162876193144 | BB29: =AA!BB29+'A-hetero'!BB29+'a-homo'!BB29 -> 346.66867644150949 | BC29: =AA!BC29+'A-hetero'!BC29+'a-homo'!BC29 -> 43.48656778059221 | BD29: =AA!BD29+'A-hetero'!BD29+'a-homo'!BD29 -> 21.888471012653206 | BE29: =AA!BE29+'A-hetero'!BE29+'a-homo'!BE29 -> 34.096166463059227 | BF29: =AA!BF29+'A-hetero'!BF29+'a-homo'!BF29 -> 18.98147514613396 | BG29: =AA!BG29+'A-hetero'!BG29+'a-homo'!BG29 -> 27.670402924104721 | BH29: =AA!BH29+'A-hetero'!BH29+'a-homo'!BH29 -> 55.036955165186782 | BI29: =AA!BI29+'A-hetero'!BI29+'a-homo'!BI29 -> 47.171285066760404 | BJ29: =SUM(AT29:BI29) -> 1642 | BK29: =AT29/BJ29 -> 0.22363835359460996 | BL29: =AU29/BJ29 -> 0.31192123528830579 | BM29: =AV29/BJ29 -> 1.6476129559739355E-2 | BN29: =AW29/BJ29 -> 1.1216485151855178E-2 | BO29: =AX29/BJ29 -> 1.6705697220076712E-2 | BP29: =AY29/BJ29 -> 1.1189572427859939E-2 | BQ29: =AZ29/BJ29 -> 1.688531428727711E-2 | BR29: =BA29/BJ29 -> 2.9604240484892293E-2 | BS29: =BB29/BJ29 -> 0.21112586872199116 | BT29: =BC29/BJ29 -> 2.6483902424233988E-2 | BU29: =BD29/BJ29 -> 1.333037211489233E-2 | BV29: =BE29/BJ29 -> 2.0765022206491613E-2 | BW29: =BF29/BJ29 -> 1.1559972683394617E-2 | BX29: =BG29/BJ29 -> 1.685164611699435E-2 | BY29: =BH29/BJ29 -> 3.3518243096946884E-2 | BZ29: =BI29/BJ29 -> 2.8727944620438737E-2 | CA29: =SUM(BK29:BZ29) -> 1
AC30: =AA!AC30+'A-hetero'!AC30+'a-homo'!AC30 -> 334 | AD30: =AA!AD30+'A-hetero'!AD30+'a-homo'!AD30 -> 463 | AE30: =AA!AE30+'A-hetero'!AE30+'a-homo'!AE30 -> 10 | AF30: =AA!AF30+'A-hetero'!AF30+'a-homo'!AF30 -> 9 | AG30: =AA!AG30+'A-hetero'!AG30+'a-homo'!AG30 -> 10 | AH30: =AA!AH30+'A-hetero'!AH30+'a-homo'!AH30 -> 10 | AI30: =AA!AI30+'A-hetero'!AI30+'a-homo'!AI30 -> 10 | AJ30: =AA!AJ30+'A-hetero'!AJ30+'a-homo'!AJ30 -> 10 | AK30: =AA!AK30+'A-hetero'!AK30+'a-homo'!AK30 -> 305 | AL30: =AA!AL30+'A-hetero'!AL30+'a-homo'!AL30 -> 37 | AM30: =AA!AM30+'A-hetero'!AM30+'a-homo'!AM30 -> 10 | AN30: =AA!AN30+'A-hetero'!AN30+'a-homo'!AN30 -> 10 | AO30: =AA!AO30+'A-hetero'!AO30+'a-homo'!AO30 -> 10 | AP30: =AA!AP30+'A-hetero'!AP30+'a-homo'!AP30 -> 10 | AQ30: =AA!AQ30+'A-hetero'!AQ30+'a-homo'!AQ30 -> 10 | AR30: =AA!AR30+'A-hetero'!AR30+'a-homo'!AR30 -> 10 | AS30: =SUM(AC30:AJ30) -> 856 | AT30: =AA!AT30+'A-hetero'!AT30+'a-homo'!AT30 -> 367.21388866489065 | AU30: =AA!AU30+'A-hetero'!AU30+'a-homo'!AU30 -> 512.17483468291971 | AV30: =AA!AV30+'A-hetero'!AV30+'a-homo'!AV30 -> 27.053935436712273 | AW30: =AA!AW30+'A-hetero'!AW30+'a-homo'!AW30 -> 18.417320252714557 | AX30: =AA!AX30+'A-hetero'!AX30+'a-homo'!AX30 -> 27.430866551884051 | AY30: =AA!AY30+'A-hetero'!AY30+'a-homo'!AY30 -> 18.373153976385446 | AZ30: =AA!AZ30+'A-hetero'!AZ30+'a-homo'!AZ30 -> 27.725430797059225 | BA30: =AA!BA30+'A-hetero'!BA30+'a-homo'!BA30 -> 48.610569637434104 | BB30: =AA!BB30+'A-hetero'!BB30+'a-homo'!BB30 -> 346.668786205635 | BC30: =AA!BC30+'A-hetero'!BC30+'a-homo'!BC30 -> 43.486532560496606 | BD30: =AA!BD30+'A-hetero'!BD30+'a-homo'!BD30 -> 21.888315293660767 | BE30: =AA!BE30+'A-hetero'!BE30+'a-homo'!BE30 -> 34.096386902970465 | BF30: =AA!BF30+'A-hetero'!BF30+'a-homo'!BF30 -> 18.981346019866052 | BG30: =AA!BG30+'A-hetero'!BG30+'a-homo'!BG30 -> 27.670591337922509 | BH30: =AA!BH30+'A-hetero'!BH30+'a-homo'!BH30 -> 55.037431030291991 | BI30: =AA!BI30+'A-hetero'!BI30+'a-homo'!BI30 -> 47.170610649156629 | BJ30: =SUM(AT30:BI30) -> 1642 | BK30: =AT30/BJ30 -> 0.22363817823683954 | BL30: =AU30/BJ30 -> 0.311921336591303 | BM30: =AV30/BJ30 -> 1.6476209157559235E-2 | BN30: =AW30/BJ30 -> 1.1216394794588642E-2 | BO30: =AX30/BJ30 -> 1.6705765256933035E-2 | BP30: =AY30/BJ30 -> 1.1189496940551425E-2 | BQ30: =AZ30/BJ30 -> 1.6885158828903301E-2 | BR30: =BA30/BJ30 -> 2.9604488207937936E-2 | BS30: =BB30/BJ30 -> 0.21112593556981418 | BT30: =BC30/BJ30 -> 2.6483880974723869E-2 | BU30: =BD30/BJ30 -> 1.3330277279939563E-2 | BV30: =BE30/BJ30 -> 2.076515645735107E-2 | BW30: =BF30/BJ30 -> 1.1559894043767385E-2 | BX30: =BG30/BJ30 -> 1.68517608635338E-2 | BY30: =BH30/BJ30 -> 3.3518532905171726E-2 | BZ30: =BI30/BJ30 -> 2.8727533891081982E-2 | CA30: =SUM(BK30:BZ30) -> 1
AC31: =AA!AC31+'A-hetero'!AC31+'a-homo'!AC31 -> 334 | AD31: =AA!AD31+'A-hetero'!AD31+'a-homo'!AD31 -> 463 | AE31: =AA!AE31+'A-hetero'!AE31+'a-homo'!AE31 -> 10 | AF31: =AA!AF31+'A-hetero'!AF31+'a-homo'!AF31 -> 9 | AG31: =AA!AG31+'A-hetero'!AG31+'a-homo'!AG31 -> 10 | AH31: =AA!AH31+'A-hetero'!AH31+'a-homo'!AH31 -> 10 | AI31: =AA!AI31+'A-hetero'!AI31+'a-homo'!AI31 -> 10 | AJ31: =AA!AJ31+'A-hetero'!AJ31+'a-homo'!AJ31 -> 10 | AK31: =AA!AK31+'A-hetero'!AK31+'a-homo'!AK31 -> 305 | AL31: =AA!AL31+'A-hetero'!AL31+'a-homo'!AL31 -> 37 | AM31: =AA!AM31+'A-hetero'!AM31+'a-homo'!AM31 -> 10 | AN31: =AA!AN31+'A-hetero'!AN31+'a-homo'!AN31 -> 10 | AO31: =AA!AO31+'A-hetero'!AO31+'a-homo'!AO31 -> 10 | AP31: =AA!AP31+'A-hetero'!AP31+'a-homo'!AP31 -> 10 | AQ31: =AA!AQ31+'A-hetero'!AQ31+'a-homo'!AQ31 -> 10 | AR31: =AA!AR31+'A-hetero'!AR31+'a-homo'!AR31 -> 10 | AS31: =SUM(AC31:AJ31) -> 856 | AT31: =AA!AT31+'A-hetero'!AT31+'a-homo'!AT31 -> 367.21368235001887 | AU31: =AA!AU31+'A-hetero'!AU31+'a-homo'!AU31 -> 512.17495426118853 | AV31: =AA!AV31+'A-hetero'!AV31+'a-homo'!AV31 -> 27.05402851491489 | AW31: =AA!AW31+'A-hetero'!AW31+'a-homo'!AW31 -> 18.417214542014012 | AX31: =AA!AX31+'A-hetero'!AX31+'a-homo'!AX31 -> 27.430946126966315 | AY31: =AA!AY31+'A-hetero'!AY31+'a-homo'!AY31 -> 18.373065615582739 | AZ31: =AA!AZ31+'A-hetero'!AZ31+'a-homo'!AZ31 -> 27.725248545699486 | BA31: =AA!BA31+'A-hetero'!BA31+'a-homo'!BA31 -> 48.610860043615233 | BB31: =AA!BB31+'A-hetero'!BB31+'a-homo'!BB31 -> 346.66886441251461 | BC31: =AA!BC31+'A-hetero'!BC31+'a-homo'!BC31 -> 43.48650741652753 | BD31: =AA!BD31+'A-hetero'!BD31+'a-homo'!BD31 -> 21.888203974606604 | BE31: =AA!BE31+'A-hetero'!BE31+'a-homo'!BE31 -> 34.096544528215006 | BF31: =AA!BF31+'A-hetero'!BF31+'a-homo'!BF31 -> 18.98125365829236 | BG31: =AA!BG31+'A-hetero'!BG31+'a-homo'!BG31 -> 27.670726158909094 | BH31: =AA!BH31+'A-hetero'!BH31+'a-homo'!BH31 -> 55.037772416986869 | BI31: =AA!BI31+'A-hetero'!BI31+'a-homo'!BI31 -> 47.170127433947904 | BJ31: =SUM(AT31:BI31) -> 1642 | BK31: =AT31/BJ31 -> 0.22363805258831843 | BL31: =AU31/BJ31 -> 0.31192140941607099 | BM31: =AV31/BJ31 -> 1.6476265843431724E-2 | BN31: =AW31/BJ31 -> 1.1216330415355672E-2 | BO31: =AX31/BJ31 -> 1.6705813719224308E-2 | BP31: =AY31/BJ31 -> 1.1189443127638697E-2 | BQ31: =AZ31/BJ31 -> 1.6885047835383367E-2 | BR31: =BA31/BJ31 -> 2.9604665069193199E-2 | BS31: =BB31/BJ31 -> 0.21112598319885176 | BT31: =BC31/BJ31 -> 2.6483865661709825E-2 | BU31: =BD31/BJ31 -> 1.3330209485144096E-2 | BV31: =BE31/BJ31 -> 2.0765252453236911E-2 | BW31: =BF31/BJ31 -> 1.1559837794331522E-2 | BX31: =BG31/BJ31 -> 1.6851842971321009E-2 | BY31: =BH31/BJ31 -> 3.3518740814242914E-2 | BZ31: =BI31/BJ31 -> 2.8727239606545617E-2 | CA31: =SUM(BK31:BZ31) -> 1
AC32: =AA!AC32+'A-hetero'!AC32+'a-homo'!AC32 -> 334 | AD32: =AA!AD32+'A-hetero'!AD32+'a-homo'!AD32 -> 463 | AE32: =AA!AE32+'A-hetero'!AE32+'a-homo'!AE32 -> 10 | AF32: =AA!AF32+'A-hetero'!AF32+'a-homo'!AF32 -> 9 | AG32: =AA!AG32+'A-hetero'!AG32+'a-homo'!AG32 -> 10 | AH32: =AA!AH32+'A-hetero'!AH32+'a-homo'!AH32 -> 10 | AI32: =AA!AI32+'A-hetero'!AI32+'a-homo'!AI32 -> 10 | AJ32: =AA!AJ32+'A-hetero'!AJ32+'a-homo'!AJ32 -> 10 | AK32: =AA!AK32+'A-hetero'!AK32+'a-homo'!AK32 -> 305 | AL32: =AA!AL32+'A-hetero'!AL32+'a-homo'!AL32 -> 37 | AM32: =AA!AM32+'A-hetero'!AM32+'a-homo'!AM32 -> 10 | AN32: =AA!AN32+'A-hetero'!AN32+'a-homo'!AN32 -> 10 | AO32: =AA!AO32+'A-hetero'!AO32+'a-homo'!AO32 -> 10 | AP32: =AA!AP32+'A-hetero'!AP32+'a-homo'!AP32 -> 10 | AQ32: =AA!AQ32+'A-hetero'!AQ32+'a-homo'!AQ32 -> 10 | AR32: =AA!AR32+'A-hetero'!AR32+'a-homo'!AR32 -> 10 | AS32: =SUM(AC32:AJ32) -> 856 | AT32: =AA!AT32+'A-hetero'!AT32+'a-homo'!AT32 -> 367.21353455102434 | AU32: =AA!AU32+'A-hetero'!AU32+'a-homo'!AU32 -> 512.17504017442252 | AV32: =AA!AV32+'A-hetero'!AV32+'a-homo'!AV32 -> 27.054094846287306 | AW32: =AA!AW32+'A-hetero'!AW32+'a-homo'!AW32 -> 18.417139185238401 | AX32: =AA!AX32+'A-hetero'!AX32+'a-homo'!AX32 -> 27.431002846404034 | AY32: =AA!AY32+'A-hetero'!AY32+'a-homo'!AY32 -> 18.373002596885165 | AZ32: =AA!AZ32+'A-hetero'!AZ32+'a-homo'!AZ32 -> 27.725118386360034 | BA32: =AA!BA32+'A-hetero'!BA32+'a-homo'!BA32 -> 48.611067413378237 | BB32: =AA!BB32+'A-hetero'!BB32+'a-homo'!BB32 -> 346.66892015737756 | BC32: =AA!BC32+'A-hetero'!BC32+'a-homo'!BC32 -> 43.486489460534074 | BD32: =AA!BD32+'A-hetero'!BD32+'a-homo'!BD32 -> 21.888124377340979 | BE32: =AA!BE32+'A-hetero'!BE32+'a-homo'!BE32 -> 34.096657247774857 | BF32: =AA!BF32+'A-hetero'!BF32+'a-homo'!BF32 -> 18.981187583707552 | BG32: =AA!BG32+'A-hetero'!BG32+'a-homo'!BG32 -> 27.670822629644803 | BH32: =AA!BH32+'A-hetero'!BH32+'a-homo'!BH32 -> 55.038017251498196 | BI32: =AA!BI32+'A-hetero'!BI32+'a-homo'!BI32 -> 47.169781292121982 | BJ32: =SUM(AT32:BI32) -> 1642 | BK32: =AT32/BJ32 -> 0.22363796257675048 | BL32: =AU32/BJ32 -> 0.31192146173838153 | BM32: =AV32/BJ32 -> 1.6476306240126248E-2 | BN32: =AW32/BJ32 -> 1.121628452206967E-2 | BO32: =AX32/BJ32 -> 1.670584826212182E-2 | BP32: =AY32/BJ32 -> 1.1189404748407529E-2 | BQ32: =AZ32/BJ32 -> 1.6884968566601724E-2 | BR32: =BA32/BJ32 -> 2.9604791360157267E-2 | BS32: =BB32/BJ32 -> 0.21112601714822016 | BT32: =BC32/BJ32 -> 2.6483854726269226E-2 | BU32: =BD32/BJ32 -> 1.333016100934286E-2 | BV32: =BE32/BJ32 -> 2.0765321100959105E-2 | BW32: =BF32/BJ32 -> 1.1559797554024085E-2 | BX32: =BG32/BJ32 -> 1.6851901723291596E-2 | BY32: =BH32/BJ32 -> 3.3518889921740673E-2 | BZ32: =BI32/BJ32 -> 2.8727028801535916E-2 | CA32: =SUM(BK32:BZ32) -> 1
AC33: =AA!AC33+'A-hetero'!AC33+'a-homo'!AC33 -> 334 | AD33: =AA!AD33+'A-hetero'!AD33+'a-homo'!AD33 -> 463 | AE33: =AA!AE33+'A-hetero'!AE33+'a-homo'!AE33 -> 10 | AF33: =AA!AF33+'A-hetero'!AF33+'a-homo'!AF33 -> 9 | AG33: =AA!AG33+'A-hetero'!AG33+'a-homo'!AG33 -> 10 | AH33: =AA!AH33+'A-hetero'!AH33+'a-homo'!AH33 -> 10 | AI33: =AA!AI33+'A-hetero'!AI33+'a-homo'!AI33 -> 10 | AJ33: =AA!AJ33+'A-hetero'!AJ33+'a-homo'!AJ33 -> 10 | AK33: =AA!AK33+'A-hetero'!AK33+'a-homo'!AK33 -> 305 | AL33: =AA!AL33+'A-hetero'!AL33+'a-homo'!AL33 -> 37 | AM33: =AA!AM33+'A-hetero'!AM33+'a-homo'!AM33 -> 10 | AN33: =AA!AN33+'A-hetero'!AN33+'a-homo'!AN33 -> 10 | AO33: =AA!AO33+'A-hetero'!AO33+'a-homo'!AO33 -> 10 | AP33: =AA!AP33+'A-hetero'!AP33+'a-homo'!AP33 -> 10 | AQ33: =AA!AQ33+'A-hetero'!AQ33+'a-homo'!AQ33 -> 10 | AR33: =AA!AR33+'A-hetero'!AR33+'a-homo'!AR33 -> 10 | AS33: =SUM(AC33:AJ33) -> 856 | AT33: =AA!AT33+'A-hetero'!AT33+'a-homo'!AT33 -> 367.21342869036795 | AU33: =AA!AU33+'A-hetero'!AU33+'a-homo'!AU33 -> 512.17510186927313 | AV33: =AA!AV33+'A-hetero'!AV33+'a-homo'!AV33 -> 27.054142144171102 | AW33: =AA!AW33+'A-hetero'!AW33+'a-homo'!AW33 -> 18.417085442523657 | AX33: =AA!AX33+'A-hetero'!AX33+'a-homo'!AX33 -> 27.431043297815705 | AY33: =AA!AY33+'A-hetero'!AY33+'a-homo'!AY33 -> 18.372957634360588 | AZ33: =AA!AZ33+'A-hetero'!AZ33+'a-homo'!AZ33 -> 27.725025407671758 | BA33: =AA!BA33+'A-hetero'!BA33+'a-homo'!BA33 -> 48.61121551381612 | BB33: =AA!BB33+'A-hetero'!BB33+'a-homo'!BB33 -> 346.668959906407 | BC33: =AA!BC33+'A-hetero'!BC33+'a-homo'!BC33 -> 43.486476634340988 | BD33: =AA!BD33+'A-hetero'!BD33+'a-homo'!BD33 -> 21.888067452131835 | BE33: =AA!BE33+'A-hetero'!BE33+'a-homo'!BE33 -> 34.096737860784344 | BF33: =AA!BF33+'A-hetero'!BF33+'a-homo'!BF33 -> 18.98114030942665 | BG33: =AA!BG33+'A-hetero'!BG33+'a-homo'!BG33 -> 27.670891658007996 | BH33: =AA!BH33+'A-hetero'!BH33+'a-homo'!BH33 -> 55.03819279200799 | BI33: =AA!BI33+'A-hetero'!BI33+'a-homo'!BI33 -> 47.169533386893178 | BJ33: =SUM(AT33:BI33) -> 1642 | BK33: =AT33/BJ33 -> 0.22363789810619245 | BL33: =AU33/BJ33 -> 0.31192149931137225 | BM33: =AV33/BJ33 -> 1.6476335045171198E-2 | BN33: =AW33/BJ33 -> 1.1216251792036334E-2 | BO33: =AX33/BJ33 -> 1.6705872897573512E-2 | BP33: =AY33/BJ33 -> 1.1189377365627643E-2 | BQ33: =AZ33/BJ33 -> 1.6884911941334811E-2 | BR33: =BA33/BJ33 -> 2.9604881555308236E-2 | BS33: =BB33/BJ33 -> 0.21112604135591173 | BT33: =BC33/BJ33 -> 2.6483846914945795E-2 | BU33: =BD33/BJ33 -> 1.3330126341127794E-2 | BV33: =BE33/BJ33 -> 2.0765370195361968E-2 | BW33: =BF33/BJ33 -> 1.1559768763353625E-2 | BX33: =BG33/BJ33 -> 1.6851943762489646E-2 | BY33: =BH33/BJ33 -> 3.3518996828263092E-2 | BZ33: =BI33/BJ33 -> 2.8726877823930075E-2 | CA33: =SUM(BK33:BZ33) -> 1
AC34: =AA!AC34+'A-hetero'!AC34+'a-homo'!AC34 -> 334 | AD34: =AA!AD34+'A-hetero'!AD34+'a-homo'!AD34 -> 463 | AE34: =AA!AE34+'A-hetero'!AE34+'a-homo'!AE34 -> 10 | AF34: =AA!AF34+'A-hetero'!AF34+'a-homo'!AF34 -> 9 | AG34: =AA!AG34+'A-hetero'!AG34+'a-homo'!AG34 -> 10 | AH34: =AA!AH34+'A-hetero'!AH34+'a-homo'!AH34 -> 10 | AI34: =AA!AI34+'A-hetero'!AI34+'a-homo'!AI34 -> 10 | AJ34: =AA!AJ34+'A-hetero'!AJ34+'a-homo'!AJ34 -> 10 | AK34: =AA!AK34+'A-hetero'!AK34+'a-homo'!AK34 -> 305 | AL34: =AA!AL34+'A-hetero'!AL34+'a-homo'!AL34 -> 37 | AM34: =AA!AM34+'A-hetero'!AM34+'a-homo'!AM34 -> 10 | AN34: =AA!AN34+'A-hetero'!AN34+'a-homo'!AN34 -> 10 | AO34: =AA!AO34+'A-hetero'!AO34+'a-homo'!AO34 -> 10 | AP34: =AA!AP34+'A-hetero'!AP34+'a-homo'!AP34 -> 10 | AQ34: =AA!AQ34+'A-hetero'!AQ34+'a-homo'!AQ34 -> 10 | AR34: =AA!AR34+'A-hetero'!AR34+'a-homo'!AR34 -> 10 | AS34: =SUM(AC34:AJ34) -> 856 | AT34: =AA!AT34+'A-hetero'!AT34+'a-homo'!AT34 -> 367.21335287953787 | AU34: =AA!AU34+'A-hetero'!AU34+'a-homo'!AU34 -> 512.17514615310392 | AV34: =AA!AV34+'A-hetero'!AV34+'a-homo'!AV34 -> 27.054175886699763 | AW34: =AA!AW34+'A-hetero'!AW34+'a-homo'!AW34 -> 18.417047099429471 | AX34: =AA!AX34+'A-hetero'!AX34+'a-homo'!AX34 -> 27.431072160875644 | AY34: =AA!AY34+'A-hetero'!AY34+'a-homo'!AY34 -> 18.372925543512522 | AZ34: =AA!AZ34+'A-hetero'!AZ34+'a-homo'!AZ34 -> 27.724958975228688 | BA34: =AA!BA34+'A-hetero'!BA34+'a-homo'!BA34 -> 48.611321301612023 | BB34: =AA!BB34+'A-hetero'!BB34+'a-homo'!BB34 -> 346.66898825925136 | BC34: =AA!BC34+'A-hetero'!BC34+'a-homo'!BC34 -> 43.486467470401053 | BD34: =AA!BD34+'A-hetero'!BD34+'a-homo'!BD34 -> 21.888026735602459 | BE34: =AA!BE34+'A-hetero'!BE34+'a-homo'!BE34 -> 34.09679551597403 | BF34: =AA!BF34+'A-hetero'!BF34+'a-homo'!BF34 -> 18.981106483612102 | BG34: =AA!BG34+'A-hetero'!BG34+'a-homo'!BG34 -> 27.670941049705462 | BH34: =AA!BH34+'A-hetero'!BH34+'a-homo'!BH34 -> 55.038318619192125 | BI34: =AA!BI34+'A-hetero'!BI34+'a-homo'!BI34 -> 47.169355866261455 | BJ34: =SUM(AT34:BI34) -> 1642 | BK34: =AT34/BJ34 -> 0.22363785193638117 | BL34: =AU34/BJ34 -> 0.31192152628081848 | BM34: =AV34/BJ34 -> 1.6476355594823241E-2 | BN34: =AW34/BJ34 -> 1.1216228440578241E-2 | BO34: =AX34/BJ34 -> 1.6705890475563728E-2 | BP34: =AY34/BJ34 -> 1.1189357821871207E-2 | BQ34: =AZ34/BJ34 -> 1.68848714830869E-2 | BR34: =BA34/BJ34 -> 2.9604945981493314E-2 | BS34: =BB34/BJ34 -> 0.2111260586231738 | BT34: =BC34/BJ34 -> 2.6483841333983588E-2 | BU34: =BD34/BJ34 -> 1.3330101544215871E-2 | BV34: =BE34/BJ34 -> 2.0765405308144965E-2 | BW34: =BF34/BJ34 -> 1.1559748162979356E-2 | BX34: =BG34/BJ34 -> 1.6851973842695166E-2 | BY34: =BH34/BJ34 -> 3.3519073458704099E-2 | BZ34: =BI34/BJ34 -> 2.8726769711486879E-2 | CA34: =SUM(BK34:BZ34) -> 1
AC35: =AA!AC35+'A-hetero'!AC35+'a-homo'!AC35 -> 334 | AD35: =AA!AD35+'A-hetero'!AD35+'a-homo'!AD35 -> 463 | AE35: =AA!AE35+'A-hetero'!AE35+'a-homo'!AE35 -> 10 | AF35: =AA!AF35+'A-hetero'!AF35+'a-homo'!AF35 -> 9 | AG35: =AA!AG35+'A-hetero'!AG35+'a-homo'!AG35 -> 10 | AH35: =AA!AH35+'A-hetero'!AH35+'a-homo'!AH35 -> 10 | AI35: =AA!AI35+'A-hetero'!AI35+'a-homo'!AI35 -> 10 | AJ35: =AA!AJ35+'A-hetero'!AJ35+'a-homo'!AJ35 -> 10 | AK35: =AA!AK35+'A-hetero'!AK35+'a-homo'!AK35 -> 305 | AL35: =AA!AL35+'A-hetero'!AL35+'a-homo'!AL35 -> 37 | AM35: =AA!AM35+'A-hetero'!AM35+'a-homo'!AM35 -> 10 | AN35: =AA!AN35+'A-hetero'!AN35+'a-homo'!AN35 -> 10 | AO35: =AA!AO35+'A-hetero'!AO35+'a-homo'!AO35 -> 10 | AP35: =AA!AP35+'A-hetero'!AP35+'a-homo'!AP35 -> 10 | AQ35: =AA!AQ35+'A-hetero'!AQ35+'a-homo'!AQ35 -> 10 | AR35: =AA!AR35+'A-hetero'!AR35+'a-homo'!AR35 -> 10 | AS35: =SUM(AC35:AJ35) -> 856 | AT35: =AA!AT35+'A-hetero'!AT35+'a-homo'!AT35 -> 367.21329859563082 | AU35: =AA!AU35+'A-hetero'!AU35+'a-homo'!AU35 -> 512.1751779271134 | AV35: =AA!AV35+'A-hetero'!AV35+'a-homo'!AV35 -> 27.054199968790414 | AW35: =AA!AW35+'A-hetero'!AW35+'a-homo'!AW35 -> 18.417019733887297 | AX35: =AA!AX35+'A-hetero'!AX35+'a-homo'!AX35 -> 27.431092763603992 | AY35: =AA!AY35+'A-hetero'!AY35+'a-homo'!AY35 -> 18.372902632637135 | AZ35: =AA!AZ35+'A-hetero'!AZ35+'a-homo'!AZ35 -> 27.724911501509837 | BA35: =AA!BA35+'A-hetero'!BA35+'a-homo'!BA35 -> 48.611396876827229 | BB35: =AA!BB35+'A-hetero'!BB35+'a-homo'!BB35 -> 346.66900848954862 | BC35: =AA!BC35+'A-hetero'!BC35+'a-homo'!BC35 -> 43.486460921796905 | BD35: =AA!BD35+'A-hetero'!BD35+'a-homo'!BD35 -> 21.88799760952044 | BE35: =AA!BE35+'A-hetero'!BE35+'a-homo'!BE35 -> 34.096836753712232 | BF35: =AA!BF35+'A-hetero'!BF35+'a-homo'!BF35 -> 18.981082279261273 | BG35: =AA!BG35+'A-hetero'!BG35+'a-homo'!BG35 -> 27.670976390407986 | BH35: =AA!BH35+'A-hetero'!BH35+'a-homo'!BH35 -> 55.038408792134646 | BI35: =AA!BI35+'A-hetero'!BI35+'a-homo'!BI35 -> 47.169228763617902 | BJ35: =SUM(AT35:BI35) -> 1642 | BK35: =AT35/BJ35 -> 0.22363781887675446 | BL35: =AU35/BJ35 -> 0.31192154563161595 | BM35: =AV35/BJ35 -> 1.6476370261139107E-2 | BN35: =AW35/BJ35 -> 1.1216211774596405E-2 | BO35: =AX35/BJ35 -> 1.6705903022901335E-2 | BP35: =AY35/BJ35 -> 1.118934386884113E-2 | BQ35: =AZ35/BJ35 -> 1.688484257095605E-2 | BR35: =BA35/BJ35 -> 2.9604992007811953E-2 | BS35: =BB35/BJ35 -> 0.21112607094369587 | BT35: =BC35/BJ35 -> 2.6483837345795923E-2 | BU35: =BD35/BJ35 -> 1.3330083806041681E-2 | BV35: =BE35/BJ35 -> 2.0765430422480045E-2 | BW35: =BF35/BJ35 -> 1.1559733422205403E-2 | BX35: =BG35/BJ35 -> 1.6851995365656507E-2 | BY35: =BH35/BJ35 -> 3.3519128375234256E-2 | BZ35: =BI35/BJ35 -> 2.8726692304273996E-2 | CA35: =SUM(BK35:BZ35) -> 1
AC36: =AA!AC36+'A-hetero'!AC36+'a-homo'!AC36 -> 334 | AD36: =AA!AD36+'A-hetero'!AD36+'a-homo'!AD36 -> 463 | AE36: =AA!AE36+'A-hetero'!AE36+'a-homo'!AE36 -> 10 | AF36: =AA!AF36+'A-hetero'!AF36+'a-homo'!AF36 -> 9 | AG36: =AA!AG36+'A-hetero'!AG36+'a-homo'!AG36 -> 10 | AH36: =AA!AH36+'A-hetero'!AH36+'a-homo'!AH36 -> 10 | AI36: =AA!AI36+'A-hetero'!AI36+'a-homo'!AI36 -> 10 | AJ36: =AA!AJ36+'A-hetero'!AJ36+'a-homo'!AJ36 -> 10 | AK36: =AA!AK36+'A-hetero'!AK36+'a-homo'!AK36 -> 305 | AL36: =AA!AL36+'A-hetero'!AL36+'a-homo'!AL36 -> 37 | AM36: =AA!AM36+'A-hetero'!AM36+'a-homo'!AM36 -> 10 | AN36: =AA!AN36+'A-hetero'!AN36+'a-homo'!AN36 -> 10 | AO36: =AA!AO36+'A-hetero'!AO36+'a-homo'!AO36 -> 10 | AP36: =AA!AP36+'A-hetero'!AP36+'a-homo'!AP36 -> 10 | AQ36: =AA!AQ36+'A-hetero'!AQ36+'a-homo'!AQ36 -> 10 | AR36: =AA!AR36+'A-hetero'!AR36+'a-homo'!AR36 -> 10 | AS36: =SUM(AC36:AJ36) -> 856 | AT36: =AA!AT36+'A-hetero'!AT36+'a-homo'!AT36 -> 367.21325973031111 | AU36: =AA!AU36+'A-hetero'!AU36+'a-homo'!AU36 -> 512.17520071739841 | AV36: =AA!AV36+'A-hetero'!AV36+'a-homo'!AV36 -> 27.054217162276228 | AW36: =AA!AW36+'A-hetero'!AW36+'a-homo'!AW36 -> 18.417000197157662 | AX36: =AA!AX36+'A-hetero'!AX36+'a-homo'!AX36 -> 27.431107474974873 | AY36: =AA!AY36+'A-hetero'!AY36+'a-homo'!AY36 -> 18.372886271424839 | AZ36: =AA!AZ36+'A-hetero'!AZ36+'a-homo'!AZ36 -> 27.724877570882228 | BA36: =AA!BA36+'A-hetero'!BA36+'a-homo'!BA36 -> 48.611450875574647 | BB36: =AA!BB36+'A-hetero'!BB36+'a-homo'!BB36 -> 346.66902292834993 | BC36: =AA!BC36+'A-hetero'!BC36+'a-homo'!BC36 -> 43.486456241371314 | BD36: =AA!BD36+'A-hetero'!BD36+'a-homo'!BD36 -> 21.887976772903698 | BE36: =AA!BE36+'A-hetero'!BE36+'a-homo'!BE36 -> 34.096866250231642 | BF36: =AA!BF36+'A-hetero'!BF36+'a-homo'!BF36 -> 18.98106495908889 | BG36: =AA!BG36+'A-hetero'!BG36+'a-homo'!BG36 -> 27.671001677080628 | BH36: =AA!BH36+'A-hetero'!BH36+'a-homo'!BH36 -> 55.038473401213068 | BI36: =AA!BI36+'A-hetero'!BI36+'a-homo'!BI36 -> 47.169137769760823 | BJ36: =SUM(AT36:BI36) -> 1642 | BK36: =AT36/BJ36 -> 0.22363779520725408 | BL36: =AU36/BJ36 -> 0.31192155951120498 | BM36: =AV36/BJ36 -> 1.6476380732202336E-2 | BN36: =AW36/BJ36 -> 1.1216199876466302E-2 | BO36: =AX36/BJ36 -> 1.6705911982323313E-2 | BP36: =AY36/BJ36 -> 1.1189333904643632E-2 | BQ36: =AZ36/BJ36 -> 1.6884821906749229E-2 | BR36: =BA36/BJ36 -> 2.9605024893772633E-2 | BS36: =BB36/BJ36 -> 0.21112607973711939 | BT36: =BC36/BJ36 -> 2.6483834495354037E-2 | BU36: =BD36/BJ36 -> 1.3330071116262913E-2 | BV36: =BE36/BJ36 -> 2.0765448386255575E-2 | BW36: =BF36/BJ36 -> 1.1559722873988366E-2 | BX36: =BG36/BJ36 -> 1.6852010765578952E-2 | BY36: =BH36/BJ36 -> 3.3519167723028674E-2 | BZ36: =BI36/BJ36 -> 2.8726636887795882E-2 | CA36: =SUM(BK36:BZ36) -> 1
AC37: =AA!AC37+'A-hetero'!AC37+'a-homo'!AC37 -> 334 | AD37: =AA!AD37+'A-hetero'!AD37+'a-homo'!AD37 -> 463 | AE37: =AA!AE37+'A-hetero'!AE37+'a-homo'!AE37 -> 10 | AF37: =AA!AF37+'A-hetero'!AF37+'a-homo'!AF37 -> 9 | AG37: =AA!AG37+'A-hetero'!AG37+'a-homo'!AG37 -> 10 | AH37: =AA!AH37+'A-hetero'!AH37+'a-homo'!AH37 -> 10 | AI37: =AA!AI37+'A-hetero'!AI37+'a-homo'!AI37 -> 10 | AJ37: =AA!AJ37+'A-hetero'!AJ37+'a-homo'!AJ37 -> 10 | AK37: =AA!AK37+'A-hetero'!AK37+'a-homo'!AK37 -> 305 | AL37: =AA!AL37+'A-hetero'!AL37+'a-homo'!AL37 -> 37 | AM37: =AA!AM37+'A-hetero'!AM37+'a-homo'!AM37 -> 10 | AN37: =AA!AN37+'A-hetero'!AN37+'a-homo'!AN37 -> 10 | AO37: =AA!AO37+'A-hetero'!AO37+'a-homo'!AO37 -> 10 | AP37: =AA!AP37+'A-hetero'!AP37+'a-homo'!AP37 -> 10 | AQ37: =AA!AQ37+'A-hetero'!AQ37+'a-homo'!AQ37 -> 10 | AR37: =AA!AR37+'A-hetero'!AR37+'a-homo'!AR37 -> 10 | AS37: =SUM(AC37:AJ37) -> 856 | AT37: =AA!AT37+'A-hetero'!AT37+'a-homo'!AT37 -> 367.21323190682335 | AU37: =AA!AU37+'A-hetero'!AU37+'a-homo'!AU37 -> 512.17521705906222 | AV37: =AA!AV37+'A-hetero'!AV37+'a-homo'!AV37 -> 27.054229441296172 | AW37: =AA!AW37+'A-hetero'!AW37+'a-homo'!AW37 -> 18.416986245867566 | AX37: =AA!AX37+'A-hetero'!AX37+'a-homo'!AX37 -> 27.431117982600938 | AY37: =AA!AY37+'A-hetero'!AY37+'a-homo'!AY37 -> 18.372874584826022 | AZ37: =AA!AZ37+'A-hetero'!AZ37+'a-homo'!AZ37 -> 27.724853316673034 | BA37: =AA!BA37+'A-hetero'!BA37+'a-homo'!BA37 -> 48.611489462850713 | BB37: =AA!BB37+'A-hetero'!BB37+'a-homo'!BB37 -> 346.6690332362856 | BC37: =AA!BC37+'A-hetero'!BC37+'a-homo'!BC37 -> 43.486452895710372 | BD37: =AA!BD37+'A-hetero'!BD37+'a-homo'!BD37 -> 21.887961865663961 | BE37: =AA!BE37+'A-hetero'!BE37+'a-homo'!BE37 -> 34.096887349290775 | BF37: =AA!BF37+'A-hetero'!BF37+'a-homo'!BF37 -> 18.981052564889939 | BG37: =AA!BG37+'A-hetero'!BG37+'a-homo'!BG37 -> 27.671019769801578 | BH37: =AA!BH37+'A-hetero'!BH37+'a-homo'!BH37 -> 55.038519685766985 | BI37: =AA!BI37+'A-hetero'!BI37+'a-homo'!BI37 -> 47.169072632590783 | BJ37: =SUM(AT37:BI37) -> 1642 | BK37: =AT37/BJ37 -> 0.22363777826237721 | BL37: =AU37/BJ37 -> 0.31192156946349714 | BM37: =AV37/BJ37 -> 1.6476388210289999E-2 | BN37: =AW37/BJ37 -> 1.1216191379943709E-2 | BO37: =AX37/BJ37 -> 1.670591838160837E-2 | BP37: =AY37/BJ37 -> 1.118932678734837E-2 | BQ37: =AZ37/BJ37 -> 1.6884807135610864E-2 | BR37: =BA37/BJ37 -> 2.9605048393940753E-2 | BS37: =BB37/BJ37 -> 0.2111260860147903 | BT37: =BC37/BJ37 -> 2.6483832457801691E-2 | BU37: =BD37/BJ37 -> 1.333006203755418E-2 | BV37: =BE37/BJ37 -> 2.0765461235865274E-2 | BW37: =BF37/BJ37 -> 1.1559715325755142E-2 | BX37: =BG37/BJ37 -> 1.6852021784288417E-2 | BY37: =BH37/BJ37 -> 3.3519195910942143E-2 | BZ37: =BI37/BJ37 -> 2.8726597218386597E-2 | CA37: =SUM(BK37:BZ37) -> 1
AC38: =AA!AC38+'A-hetero'!AC38+'a-homo'!AC38 -> 334 | AD38: =AA!AD38+'A-hetero'!AD38+'a-homo'!AD38 -> 463 | AE38: =AA!AE38+'A-hetero'!AE38+'a-homo'!AE38 -> 10 | AF38: =AA!AF38+'A-hetero'!AF38+'a-homo'!AF38 -> 9 | AG38: =AA!AG38+'A-hetero'!AG38+'a-homo'!AG38 -> 10 | AH38: =AA!AH38+'A-hetero'!AH38+'a-homo'!AH38 -> 10 | AI38: =AA!AI38+'A-hetero'!AI38+'a-homo'!AI38 -> 10 | AJ38: =AA!AJ38+'A-hetero'!AJ38+'a-homo'!AJ38 -> 10 | AK38: =AA!AK38+'A-hetero'!AK38+'a-homo'!AK38 -> 305 | AL38: =AA!AL38+'A-hetero'!AL38+'a-homo'!AL38 -> 37 | AM38: =AA!AM38+'A-hetero'!AM38+'a-homo'!AM38 -> 10 | AN38: =AA!AN38+'A-hetero'!AN38+'a-homo'!AN38 -> 10 | AO38: =AA!AO38+'A-hetero'!AO38+'a-homo'!AO38 -> 10 | AP38: =AA!AP38+'A-hetero'!AP38+'a-homo'!AP38 -> 10 | AQ38: =AA!AQ38+'A-hetero'!AQ38+'a-homo'!AQ38 -> 10 | AR38: =AA!AR38+'A-hetero'!AR38+'a-homo'!AR38 -> 10 | AS38: =SUM(AC38:AJ38) -> 856 | AT38: =AA!AT38+'A-hetero'!AT38+'a-homo'!AT38 -> 367.21321198977807 | AU38: =AA!AU38+'A-hetero'!AU38+'a-homo'!AU38 -> 512.17522877365661 | AV38: =AA!AV38+'A-hetero'!AV38+'a-homo'!AV38 -> 27.054238212797923 | AW38: =AA!AW38+'A-hetero'!AW38+'a-homo'!AW38 -> 18.416976280867026 | AX38: =AA!AX38+'A-hetero'!AX38+'a-homo'!AX38 -> 27.431125489489752 | AY38: =AA!AY38+'A-hetero'!AY38+'a-homo'!AY38 -> 18.372866235582663 | AZ38: =AA!AZ38+'A-hetero'!AZ38+'a-homo'!AZ38 -> 27.724835977385858 | BA38: =AA!BA38+'A-hetero'!BA38+'a-homo'!BA38 -> 48.611517040442116 | BB38: =AA!BB38+'A-hetero'!BB38+'a-homo'!BB38 -> 346.66904059688449 | BC38: =AA!BC38+'A-hetero'!BC38+'a-homo'!BC38 -> 43.486450503882743 | BD38: =AA!BD38+'A-hetero'!BD38+'a-homo'!BD38 -> 21.887951200065988 | BE38: =AA!BE38+'A-hetero'!BE38+'a-homo'!BE38 -> 34.096902442067169 | BF38: =AA!BF38+'A-hetero'!BF38+'a-homo'!BF38 -> 18.981043695622837 | BG38: =AA!BG38+'A-hetero'!BG38+'a-homo'!BG38 -> 27.671032715102854 | BH38: =AA!BH38+'A-hetero'!BH38+'a-homo'!BH38 -> 55.038552837975089 | BI38: =AA!BI38+'A-hetero'!BI38+'a-homo'!BI38 -> 47.169026008398816 | BJ38: =SUM(AT38:BI38) -> 1642 | BK38: =AT38/BJ38 -> 0.2236377661326297 | BL38: =AU38/BJ38 -> 0.31192157659784192 | BM38: =AV38/BJ38 -> 1.647639355225208E-2 | BN38: =AW38/BJ38 -> 1.121618531112486E-2 | BO38: =AX38/BJ38 -> 1.6705922953404229E-2 | BP38: =AY38/BJ38 -> 1.1189321702547295E-2 | BQ38: =AZ38/BJ38 -> 1.6884796575752651E-2 | BR38: =BA38/BJ38 -> 2.96050651890634E-2 | BS38: =BB38/BJ38 -> 0.21112609049749353 | BT38: =BC38/BJ38 -> 2.648383100114661E-2 | BU38: =BD38/BJ38 -> 1.3330055542062109E-2 | BV38: =BE38/BJ38 -> 2.0765470427568305E-2 | BW38: =BF38/BJ38 -> 1.1559709924252638E-2 | BX38: =BG38/BJ38 -> 1.6852029668150331E-2 | BY38: =BH38/BJ38 -> 3.3519216101081044E-2 | BZ38: =BI38/BJ38 -> 2.8726568823628992E-2 | CA38: =SUM(BK38:BZ38) -> 1
AC39: =AA!AC39+'A-hetero'!AC39+'a-homo'!AC39 -> 334 | AD39: =AA!AD39+'A-hetero'!AD39+'a-homo'!AD39 -> 463 | AE39: =AA!AE39+'A-hetero'!AE39+'a-homo'!AE39 -> 10 | AF39: =AA!AF39+'A-hetero'!AF39+'a-homo'!AF39 -> 9 | AG39: =AA!AG39+'A-hetero'!AG39+'a-homo'!AG39 -> 10 | AH39: =AA!AH39+'A-hetero'!AH39+'a-homo'!AH39 -> 10 | AI39: =AA!AI39+'A-hetero'!AI39+'a-homo'!AI39 -> 10 | AJ39: =AA!AJ39+'A-hetero'!AJ39+'a-homo'!AJ39 -> 10 | AK39: =AA!AK39+'A-hetero'!AK39+'a-homo'!AK39 -> 305 | AL39: =AA!AL39+'A-hetero'!AL39+'a-homo'!AL39 -> 37 | AM39: =AA!AM39+'A-hetero'!AM39+'a-homo'!AM39 -> 10 | AN39: =AA!AN39+'A-hetero'!AN39+'a-homo'!AN39 -> 10 | AO39: =AA!AO39+'A-hetero'!AO39+'a-homo'!AO39 -> 10 | AP39: =AA!AP39+'A-hetero'!AP39+'a-homo'!AP39 -> 10 | AQ39: =AA!AQ39+'A-hetero'!AQ39+'a-homo'!AQ39 -> 10 | AR39: =AA!AR39+'A-hetero'!AR39+'a-homo'!AR39 -> 10 | AS39: =SUM(AC39:AJ39) -> 856 | AT39: =AA!AT39+'A-hetero'!AT39+'a-homo'!AT39 -> 367.21319773346426 | AU39: =AA!AU39+'A-hetero'!AU39+'a-homo'!AU39 -> 512.1752371693492 | AV39: =AA!AV39+'A-hetero'!AV39+'a-homo'!AV39 -> 27.054244480064803 | AW39: =AA!AW39+'A-hetero'!AW39+'a-homo'!AW39 -> 18.416969161715286 | AX39: =AA!AX39+'A-hetero'!AX39+'a-homo'!AX39 -> 27.431130853669188 | AY39: =AA!AY39+'A-hetero'!AY39+'a-homo'!AY39 -> 18.372860269605955 | AZ39: =AA!AZ39+'A-hetero'!AZ39+'a-homo'!AZ39 -> 27.724823580355114 | BA39: =AA!BA39+'A-hetero'!BA39+'a-homo'!BA39 -> 48.611536751776228 | BB39: =AA!BB39+'A-hetero'!BB39+'a-homo'!BB39 -> 346.66904585397566 | BC39: =AA!BC39+'A-hetero'!BC39+'a-homo'!BC39 -> 43.4864487937812 | BD39: =AA!BD39+'A-hetero'!BD39+'a-homo'!BD39 -> 21.8879435689907 | BE39: =AA!BE39+'A-hetero'!BE39+'a-homo'!BE39 -> 34.096913238658885 | BF39: =AA!BF39+'A-hetero'!BF39+'a-homo'!BF39 -> 18.98103734879345 | BG39: =AA!BG39+'A-hetero'!BG39+'a-homo'!BG39 -> 27.671041977361092 | BH39: =AA!BH39+'A-hetero'!BH39+'a-homo'!BH39 -> 55.038576580686801 | BI39: =AA!BI39+'A-hetero'!BI39+'a-homo'!BI39 -> 47.168992637752169 | BJ39: =SUM(AT39:BI39) -> 1642 | BK39: =AT39/BJ39 -> 0.22363775745034367 | BL39: =AU39/BJ39 -> 0.31192158171093137 | BM39: =AV39/BJ39 -> 1.6476397369101586E-2 | BN39: =AW39/BJ39 -> 1.1216180975466072E-2 | BO39: =AX39/BJ39 -> 1.6705926220261385E-2 | BP39: =AY39/BJ39 -> 1.118931806918755E-2 | BQ39: =AZ39/BJ39 -> 1.6884789025794836E-2 | BR39: =BA39/BJ39 -> 2.9605077193529984E-2 | BS39: =BB39/BJ39 -> 0.2111260936991326 | BT39: =BC39/BJ39 -> 2.6483829959671867E-2 | BU39: =BD39/BJ39 -> 1.333005089463502E-2 | BV39: =BE39/BJ39 -> 2.0765477002837325E-2 | BW39: =BF39/BJ39 -> 1.1559706058948509E-2 | BX39: =BG39/BJ39 -> 1.6852035308989707E-2 | BY39: =BH39/BJ39 -> 3.35192305607106E-2 | BZ39: =BI39/BJ39 -> 2.8726548500458086E-2 | CA39: =SUM(BK39:BZ39) -> 1
AC40: =AA!AC40+'A-hetero'!AC40+'a-homo'!AC40 -> 334 | AD40: =AA!AD40+'A-hetero'!AD40+'a-homo'!AD40 -> 463 | AE40: =AA!AE40+'A-hetero'!AE40+'a-homo'!AE40 -> 10 | AF40: =AA!AF40+'A-hetero'!AF40+'a-homo'!AF40 -> 9 | AG40: =AA!AG40+'A-hetero'!AG40+'a-homo'!AG40 -> 10 | AH40: =AA!AH40+'A-hetero'!AH40+'a-homo'!AH40 -> 10 | AI40: =AA!AI40+'A-hetero'!AI40+'a-homo'!AI40 -> 10 | AJ40: =AA!AJ40+'A-hetero'!AJ40+'a-homo'!AJ40 -> 10 | AK40: =AA!AK40+'A-hetero'!AK40+'a-homo'!AK40 -> 305 | AL40: =AA!AL40+'A-hetero'!AL40+'a-homo'!AL40 -> 37 | AM40: =AA!AM40+'A-hetero'!AM40+'a-homo'!AM40 -> 10 | AN40: =AA!AN40+'A-hetero'!AN40+'a-homo'!AN40 -> 10 | AO40: =AA!AO40+'A-hetero'!AO40+'a-homo'!AO40 -> 10 | AP40: =AA!AP40+'A-hetero'!AP40+'a-homo'!AP40 -> 10 | AQ40: =AA!AQ40+'A-hetero'!AQ40+'a-homo'!AQ40 -> 10 | AR40: =AA!AR40+'A-hetero'!AR40+'a-homo'!AR40 -> 10 | AS40: =SUM(AC40:AJ40) -> 856 | AT40: =AA!AT40+'A-hetero'!AT40+'a-homo'!AT40 -> 367.21318752964362 | AU40: =AA!AU40+'A-hetero'!AU40+'a-homo'!AU40 -> 512.17524318518849 | AV40: =AA!AV40+'A-hetero'!AV40+'a-homo'!AV40 -> 27.054248958873146 | AW40: =AA!AW40+'A-hetero'!AW40+'a-homo'!AW40 -> 18.416964074780196 | AX40: =AA!AX40+'A-hetero'!AX40+'a-homo'!AX40 -> 27.43113468739633 | AY40: =AA!AY40+'A-hetero'!AY40+'a-homo'!AY40 -> 18.372856005951661 | AZ40: =AA!AZ40+'A-hetero'!AZ40+'a-homo'!AZ40 -> 27.724814716129472 | BA40: =AA!BA40+'A-hetero'!BA40+'a-homo'!BA40 -> 48.611550842037062 | BB40: =AA!BB40+'A-hetero'!BB40+'a-homo'!BB40 -> 346.66904960940496 | BC40: =AA!BC40+'A-hetero'!BC40+'a-homo'!BC40 -> 43.486447570991501 | BD40: =AA!BD40+'A-hetero'!BD40+'a-homo'!BD40 -> 21.88793810896501 | BE40: =AA!BE40+'A-hetero'!BE40+'a-homo'!BE40 -> 34.096920962153071 | BF40: =AA!BF40+'A-hetero'!BF40+'a-homo'!BF40 -> 18.981032807040563 | BG40: =AA!BG40+'A-hetero'!BG40+'a-homo'!BG40 -> 27.671048604382868 | BH40: =AA!BH40+'A-hetero'!BH40+'a-homo'!BH40 -> 55.038593582546888 | BI40: =AA!BI40+'A-hetero'!BI40+'a-homo'!BI40 -> 47.168968754515163 | BJ40: =SUM(AT40:BI40) -> 1642 | BK40: =AT40/BJ40 -> 0.22363775123608018 | BL40: =AU40/BJ40 -> 0.31192158537465808 | BM40: =AV40/BJ40 -> 1.6476400096755876E-2 | BN40: =AW40/BJ40 -> 1.1216177877454445E-2 | BO40: =AX40/BJ40 -> 1.6705928555052579E-2 | BP40: =AY40/BJ40 -> 1.1189315472564959E-2 | BQ40: =AZ40/BJ40 -> 1.6884783627362652E-2 | BR40: =BA40/BJ40 -> 2.9605085774687619E-2 | BS40: =BB40/BJ40 -> 0.21112609598623935 | BT40: =BC40/BJ40 -> 2.6483829214976558E-2 | BU40: =BD40/BJ40 -> 1.3330047569406219E-2 | BV40: =BE40/BJ40 -> 2.0765481706548766E-2 | BW40: =BF40/BJ40 -> 1.155970329296015E-2 | BX40: =BG40/BJ40 -> 1.6852039344934757E-2 | BY40: =BH40/BJ40 -> 3.3519240915071191E-2 | BZ40: =BI40/BJ40 -> 2.8726533955246755E-2 | CA40: =SUM(BK40:BZ40) -> 1
AC41: =AA!AC41+'A-hetero'!AC41+'a-homo'!AC41 -> 334 | AD41: =AA!AD41+'A-hetero'!AD41+'a-homo'!AD41 -> 463 | AE41: =AA!AE41+'A-hetero'!AE41+'a-homo'!AE41 -> 10 | AF41: =AA!AF41+'A-hetero'!AF41+'a-homo'!AF41 -> 9 | AG41: =AA!AG41+'A-hetero'!AG41+'a-homo'!AG41 -> 10 | AH41: =AA!AH41+'A-hetero'!AH41+'a-homo'!AH41 -> 10 | AI41: =AA!AI41+'A-hetero'!AI41+'a-homo'!AI41 -> 10 | AJ41: =AA!AJ41+'A-hetero'!AJ41+'a-homo'!AJ41 -> 10 | AK41: =AA!AK41+'A-hetero'!AK41+'a-homo'!AK41 -> 305 | AL41: =AA!AL41+'A-hetero'!AL41+'a-homo'!AL41 -> 37 | AM41: =AA!AM41+'A-hetero'!AM41+'a-homo'!AM41 -> 10 | AN41: =AA!AN41+'A-hetero'!AN41+'a-homo'!AN41 -> 10 | AO41: =AA!AO41+'A-hetero'!AO41+'a-homo'!AO41 -> 10 | AP41: =AA!AP41+'A-hetero'!AP41+'a-homo'!AP41 -> 10 | AQ41: =AA!AQ41+'A-hetero'!AQ41+'a-homo'!AQ41 -> 10 | AR41: =AA!AR41+'A-hetero'!AR41+'a-homo'!AR41 -> 10 | AS41: =SUM(AC41:AJ41) -> 856 | AT41: =AA!AT41+'A-hetero'!AT41+'a-homo'!AT41 -> 367.21318022674552 | AU41: =AA!AU41+'A-hetero'!AU41+'a-homo'!AU41 -> 512.17524749498762 | AV41: =AA!AV41+'A-hetero'!AV41+'a-homo'!AV41 -> 27.054252160089675 | AW41: =AA!AW41+'A-hetero'!AW41+'a-homo'!AW41 -> 18.416960439385377 | AX41: =AA!AX41+'A-hetero'!AX41+'a-homo'!AX41 -> 27.431137427724117 | AY41: =AA!AY41+'A-hetero'!AY41+'a-homo'!AY41 -> 18.372852958476425 | AZ41: =AA!AZ41+'A-hetero'!AZ41+'a-homo'!AZ41 -> 27.724808377494028 | BA41: =AA!BA41+'A-hetero'!BA41+'a-homo'!BA41 -> 48.611560915097144 | BB41: =AA!BB41+'A-hetero'!BB41+'a-homo'!BB41 -> 346.66905229256736 | BC41: =AA!BC41+'A-hetero'!BC41+'a-homo'!BC41 -> 43.486446696583329 | BD41: =AA!BD41+'A-hetero'!BD41+'a-homo'!BD41 -> 21.887934202275446 | BE41: =AA!BE41+'A-hetero'!BE41+'a-homo'!BE41 -> 34.096926487365593 | BF41: =AA!BF41+'A-hetero'!BF41+'a-homo'!BF41 -> 18.981029557018857 | BG41: =AA!BG41+'A-hetero'!BG41+'a-homo'!BG41 -> 27.671053345896688 | BH41: =AA!BH41+'A-hetero'!BH41+'a-homo'!BH41 -> 55.038605756085005 | BI41: =AA!BI41+'A-hetero'!BI41+'a-homo'!BI41 -> 47.168951662207732 | BJ41: =SUM(AT41:BI41) -> 1642 | BK41: =AT41/BJ41 -> 0.22363774678851736 | BL41: =AU41/BJ41 -> 0.31192158799938347 | BM41: =AV41/BJ41 -> 1.6476402046339631E-2 | BN41: =AW41/BJ41 -> 1.1216175663450291E-2 | BO41: =AX41/BJ41 -> 1.6705930223948916E-2 | BP41: =AY41/BJ41 -> 1.1189313616611709E-2 | BQ41: =AZ41/BJ41 -> 1.688477976704874E-2 | BR41: =BA41/BJ41 -> 2.9605091909316164E-2 | BS41: =BB41/BJ41 -> 0.21112609762032117 | BT41: =BC41/BJ41 -> 2.648382868245026E-2 | BU41: =BD41/BJ41 -> 1.3330045190179931E-2 | BV41: =BE41/BJ41 -> 2.076548507147722E-2 | BW41: =BF41/BJ41 -> 1.1559701313653385E-2 | BX41: =BG41/BJ41 -> 1.6852042232580199E-2 | BY41: =BH41/BJ41 -> 3.3519248328919005E-2 | BZ41: =BI41/BJ41 -> 2.8726523545802518E-2 | CA41: =SUM(BK41:BZ41) -> 1
AC42: =AA!AC42+'A-hetero'!AC42+'a-homo'!AC42 -> 334 | AD42: =AA!AD42+'A-hetero'!AD42+'a-homo'!AD42 -> 463 | AE42: =AA!AE42+'A-hetero'!AE42+'a-homo'!AE42 -> 10 | AF42: =AA!AF42+'A-hetero'!AF42+'a-homo'!AF42 -> 9 | AG42: =AA!AG42+'A-hetero'!AG42+'a-homo'!AG42 -> 10 | AH42: =AA!AH42+'A-hetero'!AH42+'a-homo'!AH42 -> 10 | AI42: =AA!AI42+'A-hetero'!AI42+'a-homo'!AI42 -> 10 | AJ42: =AA!AJ42+'A-hetero'!AJ42+'a-homo'!AJ42 -> 10 | AK42: =AA!AK42+'A-hetero'!AK42+'a-homo'!AK42 -> 305 | AL42: =AA!AL42+'A-hetero'!AL42+'a-homo'!AL42 -> 37 | AM42: =AA!AM42+'A-hetero'!AM42+'a-homo'!AM42 -> 10 | AN42: =AA!AN42+'A-hetero'!AN42+'a-homo'!AN42 -> 10 | AO42: =AA!AO42+'A-hetero'!AO42+'a-homo'!AO42 -> 10 | AP42: =AA!AP42+'A-hetero'!AP42+'a-homo'!AP42 -> 10 | AQ42: =AA!AQ42+'A-hetero'!AQ42+'a-homo'!AQ42 -> 10 | AR42: =AA!AR42+'A-hetero'!AR42+'a-homo'!AR42 -> 10 | AS42: =SUM(AC42:AJ42) -> 856 | AT42: =AA!AT42+'A-hetero'!AT42+'a-homo'!AT42 -> 367.21317500028545 | AU42: =AA!AU42+'A-hetero'!AU42+'a-homo'!AU42 -> 512.17525058207116 | AV42: =AA!AV42+'A-hetero'!AV42+'a-homo'!AV42 -> 27.054254448458071 | AW42: =AA!AW42+'A-hetero'!AW42+'a-homo'!AW42 -> 18.416957840985265 | AX42: =AA!AX42+'A-hetero'!AX42+'a-homo'!AX42 -> 27.431139386739581 | AY42: =AA!AY42+'A-hetero'!AY42+'a-homo'!AY42 -> 18.372850780019419 | AZ42: =AA!AZ42+'A-hetero'!AZ42+'a-homo'!AZ42 -> 27.724803844570076 | BA42: =AA!BA42+'A-hetero'!BA42+'a-homo'!BA42 -> 48.611568116871041 | BB42: =AA!BB42+'A-hetero'!BB42+'a-homo'!BB42 -> 346.66905420991105 | BC42: =AA!BC42+'A-hetero'!BC42+'a-homo'!BC42 -> 43.48644607125992 | BD42: =AA!BD42+'A-hetero'!BD42+'a-homo'!BD42 -> 21.887931406990948 | BE42: =AA!BE42+'A-hetero'!BE42+'a-homo'!BE42 -> 34.096930440038193 | BF42: =AA!BF42+'A-hetero'!BF42+'a-homo'!BF42 -> 18.981027231369946 | BG42: =AA!BG42+'A-hetero'!BG42+'a-homo'!BG42 -> 27.671056738343527 | BH42: =AA!BH42+'A-hetero'!BH42+'a-homo'!BH42 -> 55.03861447167489 | BI42: =AA!BI42+'A-hetero'!BI42+'a-homo'!BI42 -> 47.168939430411513 | BJ42: =SUM(AT42:BI42) -> 1642 | BK42: =AT42/BJ42 -> 0.22363774360553312 | BL42: =AU42/BJ42 -> 0.31192158987945862 | BM42: =AV42/BJ42 -> 1.6476403439986641E-2 | BN42: =AW42/BJ42 -> 1.1216174080989808E-2 | BO42: =AX42/BJ42 -> 1.6705931417015575E-2 | BP42: =AY42/BJ42 -> 1.1189312289902203E-2 | BQ42: =AZ42/BJ42 -> 1.6884777006437316E-2 | BR42: =BA42/BJ42 -> 2.9605096295292958E-2 | BS42: =BB42/BJ42 -> 0.21112609878800914 | BT42: =BC42/BJ42 -> 2.6483828301619924E-2 | BU42: =BD42/BJ42 -> 1.3330043487814218E-2 | BV42: =BE42/BJ42 -> 2.0765487478707788E-2 | BW42: =BF42/BJ42 -> 1.1559699897302036E-2 | BX42: =BG42/BJ42 -> 1.6852044298625777E-2 | BY42: =BH42/BJ42 -> 3.3519253636830011E-2 | BZ42: =BI42/BJ42 -> 2.8726516096474728E-2 | CA42: =SUM(BK42:BZ42) -> 1
AC43: =AA!AC43+'A-hetero'!AC43+'a-homo'!AC43 -> 334 | AD43: =AA!AD43+'A-hetero'!AD43+'a-homo'!AD43 -> 463 | AE43: =AA!AE43+'A-hetero'!AE43+'a-homo'!AE43 -> 10 | AF43: =AA!AF43+'A-hetero'!AF43+'a-homo'!AF43 -> 9 | AG43: =AA!AG43+'A-hetero'!AG43+'a-homo'!AG43 -> 10 | AH43: =AA!AH43+'A-hetero'!AH43+'a-homo'!AH43 -> 10 | AI43: =AA!AI43+'A-hetero'!AI43+'a-homo'!AI43 -> 10 | AJ43: =AA!AJ43+'A-hetero'!AJ43+'a-homo'!AJ43 -> 10 | AK43: =AA!AK43+'A-hetero'!AK43+'a-homo'!AK43 -> 305 | AL43: =AA!AL43+'A-hetero'!AL43+'a-homo'!AL43 -> 37 | AM43: =AA!AM43+'A-hetero'!AM43+'a-homo'!AM43 -> 10 | AN43: =AA!AN43+'A-hetero'!AN43+'a-homo'!AN43 -> 10 | AO43: =AA!AO43+'A-hetero'!AO43+'a-homo'!AO43 -> 10 | AP43: =AA!AP43+'A-hetero'!AP43+'a-homo'!AP43 -> 10 | AQ43: =AA!AQ43+'A-hetero'!AQ43+'a-homo'!AQ43 -> 10 | AR43: =AA!AR43+'A-hetero'!AR43+'a-homo'!AR43 -> 10 | AS43: =SUM(AC43:AJ43) -> 856 | AT43: =AA!AT43+'A-hetero'!AT43+'a-homo'!AT43 -> 367.21317126001793 | AU43: =AA!AU43+'A-hetero'!AU43+'a-homo'!AU43 -> 512.1752527930189 | AV43: =AA!AV43+'A-hetero'!AV43+'a-homo'!AV43 -> 27.054256084470939 | AW43: =AA!AW43+'A-hetero'!AW43+'a-homo'!AW43 -> 18.416955983556409 | AX43: =AA!AX43+'A-hetero'!AX43+'a-homo'!AX43 -> 27.431140787356444 | AY43: =AA!AY43+'A-hetero'!AY43+'a-homo'!AY43 -> 18.372849222612267 | AZ43: =AA!AZ43+'A-hetero'!AZ43+'a-homo'!AZ43 -> 27.724800602777758 | BA43: =AA!BA43+'A-hetero'!BA43+'a-homo'!BA43 -> 48.61157326618941 | BB43: =AA!BB43+'A-hetero'!BB43+'a-homo'!BB43 -> 346.66905558019846 | BC43: =AA!BC43+'A-hetero'!BC43+'a-homo'!BC43 -> 43.486445624041828 | BD43: =AA!BD43+'A-hetero'!BD43+'a-homo'!BD43 -> 21.887929406925217 | BE43: =AA!BE43+'A-hetero'!BE43+'a-homo'!BE43 -> 34.096933267770396 | BF43: =AA!BF43+'A-hetero'!BF43+'a-homo'!BF43 -> 18.981025567204021 | BG43: =AA!BG43+'A-hetero'!BG43+'a-homo'!BG43 -> 27.671059165550233 | BH43: =AA!BH43+'A-hetero'!BH43+'a-homo'!BH43 -> 55.03862071104929 | BI43: =AA!BI43+'A-hetero'!BI43+'a-homo'!BI43 -> 47.168930677260576 | BJ43: =SUM(AT43:BI43) -> 1642 | BK43: =AT43/BJ43 -> 0.22363774132766015 | BL43: =AU43/BJ43 -> 0.31192159122595553 | BM43: =AV43/BJ43 -> 1.6476404436340405E-2 | BN43: =AW43/BJ43 -> 1.1216172949790749E-2 | BO43: =AX43/BJ43 -> 1.6705932270010018E-2 | BP43: =AY43/BJ43 -> 1.1189311341420384E-2 | BQ43: =AZ43/BJ43 -> 1.6884775032142363E-2 | BR43: =BA43/BJ43 -> 2.9605099431296845E-2 | BS43: =BB43/BJ43 -> 0.21112609962253259 | BT43: =BC43/BJ43 -> 2.6483828029258121E-2 | BU43: =BD43/BJ43 -> 1.3330042269747393E-2 | BV43: =BE43/BJ43 -> 2.0765489200834594E-2 | BW43: =BF43/BJ43 -> 1.1559698883802694E-2 | BX43: =BG43/BJ43 -> 1.6852045776827185E-2 | BY43: =BH43/BJ43 -> 3.351925743669263E-2 | BZ43: =BI43/BJ43 -> 2.8726510765688541E-2 | CA43: =SUM(BK43:BZ43) -> 1
AC44: =AA!AC44+'A-hetero'!AC44+'a-homo'!AC44 -> 334 | AD44: =AA!AD44+'A-hetero'!AD44+'a-homo'!AD44 -> 463 | AE44: =AA!AE44+'A-hetero'!AE44+'a-homo'!AE44 -> 10 | AF44: =AA!AF44+'A-hetero'!AF44+'a-homo'!AF44 -> 9 | AG44: =AA!AG44+'A-hetero'!AG44+'a-homo'!AG44 -> 10 | AH44: =AA!AH44+'A-hetero'!AH44+'a-homo'!AH44 -> 10 | AI44: =AA!AI44+'A-hetero'!AI44+'a-homo'!AI44 -> 10 | AJ44: =AA!AJ44+'A-hetero'!AJ44+'a-homo'!AJ44 -> 10 | AK44: =AA!AK44+'A-hetero'!AK44+'a-homo'!AK44 -> 305 | AL44: =AA!AL44+'A-hetero'!AL44+'a-homo'!AL44 -> 37 | AM44: =AA!AM44+'A-hetero'!AM44+'a-homo'!AM44 -> 10 | AN44: =AA!AN44+'A-hetero'!AN44+'a-homo'!AN44 -> 10 | AO44: =AA!AO44+'A-hetero'!AO44+'a-homo'!AO44 -> 10 | AP44: =AA!AP44+'A-hetero'!AP44+'a-homo'!AP44 -> 10 | AQ44: =AA!AQ44+'A-hetero'!AQ44+'a-homo'!AQ44 -> 10 | AR44: =AA!AR44+'A-hetero'!AR44+'a-homo'!AR44 -> 10 | AS44: =SUM(AC44:AJ44) -> 856 | AT44: =AA!AT44+'A-hetero'!AT44+'a-homo'!AT44 -> 367.21316858342317 | AU44: =AA!AU44+'A-hetero'!AU44+'a-homo'!AU44 -> 512.17525437628774 | AV44: =AA!AV44+'A-hetero'!AV44+'a-homo'!AV44 -> 27.054257254213297 | AW44: =AA!AW44+'A-hetero'!AW44+'a-homo'!AW44 -> 18.416954655661666 | AX44: =AA!AX44+'A-hetero'!AX44+'a-homo'!AX44 -> 27.431141788831944 | AY44: =AA!AY44+'A-hetero'!AY44+'a-homo'!AY44 -> 18.372848109101945 | AZ44: =AA!AZ44+'A-hetero'!AZ44+'a-homo'!AZ44 -> 27.724798284246567 | BA44: =AA!BA44+'A-hetero'!BA44+'a-homo'!BA44 -> 48.611576948233683 | BB44: =AA!BB44+'A-hetero'!BB44+'a-homo'!BB44 -> 346.66905655963365 | BC44: =AA!BC44+'A-hetero'!BC44+'a-homo'!BC44 -> 43.486445304185501 | BD44: =AA!BD44+'A-hetero'!BD44+'a-homo'!BD44 -> 21.887927975850275 | BE44: =AA!BE44+'A-hetero'!BE44+'a-homo'!BE44 -> 34.096935290744703 | BF44: =AA!BF44+'A-hetero'!BF44+'a-homo'!BF44 -> 18.981024376391389 | BG44: =AA!BG44+'A-hetero'!BG44+'a-homo'!BG44 -> 27.671060902144671 | BH44: =AA!BH44+'A-hetero'!BH44+'a-homo'!BH44 -> 55.038625177409727 | BI44: =AA!BI44+'A-hetero'!BI44+'a-homo'!BI44 -> 47.168924413640077 | BJ44: =SUM(AT44:BI44) -> 1642 | BK44: =AT44/BJ44 -> 0.22363773969757803 | BL44: =AU44/BJ44 -> 0.31192159219018739 | BM44: =AV44/BJ44 -> 1.6476405148729167E-2 | BN44: =AW44/BJ44 -> 1.1216172141085057E-2 | BO44: =AX44/BJ44 -> 1.670593287992201E-2 | BP44: =AY44/BJ44 -> 1.1189310663277675E-2 | BQ44: =AZ44/BJ44 -> 1.68847736201258E-2 | BR44: =BA44/BJ44 -> 2.960510167371113E-2 | BS44: =BB44/BJ44 -> 0.21112610021902167 | BT44: =BC44/BJ44 -> 2.6483827834461324E-2 | BU44: =BD44/BJ44 -> 1.3330041398203575E-2 | BV44: =BE44/BJ44 -> 2.0765490432853043E-2 | BW44: =BF44/BJ44 -> 1.1559698158581842E-2 | BX44: =BG44/BJ44 -> 1.685204683443646E-2 | BY44: =BH44/BJ44 -> 3.351926015676597E-2 | BZ44: =BI44/BJ44 -> 2.8726506951059726E-2 | CA44: =SUM(BK44:BZ44) -> 1
AC45: =AA!AC45+'A-hetero'!AC45+'a-homo'!AC45 -> 334 | AD45: =AA!AD45+'A-hetero'!AD45+'a-homo'!AD45 -> 463 | AE45: =AA!AE45+'A-hetero'!AE45+'a-homo'!AE45 -> 10 | AF45: =AA!AF45+'A-hetero'!AF45+'a-homo'!AF45 -> 9 | AG45: =AA!AG45+'A-hetero'!AG45+'a-homo'!AG45 -> 10 | AH45: =AA!AH45+'A-hetero'!AH45+'a-homo'!AH45 -> 10 | AI45: =AA!AI45+'A-hetero'!AI45+'a-homo'!AI45 -> 10 | AJ45: =AA!AJ45+'A-hetero'!AJ45+'a-homo'!AJ45 -> 10 | AK45: =AA!AK45+'A-hetero'!AK45+'a-homo'!AK45 -> 305 | AL45: =AA!AL45+'A-hetero'!AL45+'a-homo'!AL45 -> 37 | AM45: =AA!AM45+'A-hetero'!AM45+'a-homo'!AM45 -> 10 | AN45: =AA!AN45+'A-hetero'!AN45+'a-homo'!AN45 -> 10 | AO45: =AA!AO45+'A-hetero'!AO45+'a-homo'!AO45 -> 10 | AP45: =AA!AP45+'A-hetero'!AP45+'a-homo'!AP45 -> 10 | AQ45: =AA!AQ45+'A-hetero'!AQ45+'a-homo'!AQ45 -> 10 | AR45: =AA!AR45+'A-hetero'!AR45+'a-homo'!AR45 -> 10 | AS45: =SUM(AC45:AJ45) -> 856 | AT45: =AA!AT45+'A-hetero'!AT45+'a-homo'!AT45 -> 367.21316666806729 | AU45: =AA!AU45+'A-hetero'!AU45+'a-homo'!AU45 -> 512.17525550994912 | AV45: =AA!AV45+'A-hetero'!AV45+'a-homo'!AV45 -> 27.05425809064478 | AW45: =AA!AW45+'A-hetero'!AW45+'a-homo'!AW45 -> 18.41695370624948 | AX45: =AA!AX45+'A-hetero'!AX45+'a-homo'!AX45 -> 27.431142504967397 | AY45: =AA!AY45+'A-hetero'!AY45+'a-homo'!AY45 -> 18.372847312905055 | AZ45: =AA!AZ45+'A-hetero'!AZ45+'a-homo'!AZ45 -> 27.724796625962178 | BA45: =AA!BA45+'A-hetero'!BA45+'a-homo'!BA45 -> 48.611579581254716 | BB45: =AA!BB45+'A-hetero'!BB45+'a-homo'!BB45 -> 346.6690572597762 | BC45: =AA!BC45+'A-hetero'!BC45+'a-homo'!BC45 -> 43.486445075410487 | BD45: =AA!BD45+'A-hetero'!BD45+'a-homo'!BD45 -> 21.887926951898685 | BE45: =AA!BE45+'A-hetero'!BE45+'a-homo'!BE45 -> 34.096936738003947 | BF45: =AA!BF45+'A-hetero'!BF45+'a-homo'!BF45 -> 18.981023524303211 | BG45: =AA!BG45+'A-hetero'!BG45+'a-homo'!BG45 -> 27.671062144621239 | BH45: =AA!BH45+'A-hetero'!BH45+'a-homo'!BH45 -> 55.038628374380259 | BI45: =AA!BI45+'A-hetero'!BI45+'a-homo'!BI45 -> 47.168919931605942 | BJ45: =SUM(AT45:BI45) -> 1642 | BK45: =AT45/BJ45 -> 0.22363773853110067 | BL45: =AU45/BJ45 -> 0.31192159288060239 | BM45: =AV45/BJ45 -> 1.647640565812715E-2 | BN45: =AW45/BJ45 -> 1.1216171562880316E-2 | BO45: =AX45/BJ45 -> 1.6705933316058099E-2 | BP45: =AY45/BJ45 -> 1.1189310178383103E-2 | BQ45: =AZ45/BJ45 -> 1.688477261020839E-2 | BR45: =BA45/BJ45 -> 2.9605103277256222E-2 | BS45: =BB45/BJ45 -> 0.2111261006454179 | BT45: =BC45/BJ45 -> 2.6483827695134278E-2 | BU45: =BD45/BJ45 -> 1.3330040774603339E-2 | BV45: =BE45/BJ45 -> 2.0765491314253318E-2 | BW45: =BF45/BJ45 -> 1.1559697639648727E-2 | BX45: =BG45/BJ45 -> 1.6852047591121338E-2 | BY45: =BH45/BJ45 -> 3.351926210376386E-2 | BZ45: =BI45/BJ45 -> 2.872650422144089E-2 | CA45: =SUM(BK45:BZ45) -> 1
AC46: =AA!AC46+'A-hetero'!AC46+'a-homo'!AC46 -> 334 | AD46: =AA!AD46+'A-hetero'!AD46+'a-homo'!AD46 -> 463 | AE46: =AA!AE46+'A-hetero'!AE46+'a-homo'!AE46 -> 10 | AF46: =AA!AF46+'A-hetero'!AF46+'a-homo'!AF46 -> 9 | AG46: =AA!AG46+'A-hetero'!AG46+'a-homo'!AG46 -> 10 | AH46: =AA!AH46+'A-hetero'!AH46+'a-homo'!AH46 -> 10 | AI46: =AA!AI46+'A-hetero'!AI46+'a-homo'!AI46 -> 10 | AJ46: =AA!AJ46+'A-hetero'!AJ46+'a-homo'!AJ46 -> 10 | AK46: =AA!AK46+'A-hetero'!AK46+'a-homo'!AK46 -> 305 | AL46: =AA!AL46+'A-hetero'!AL46+'a-homo'!AL46 -> 37 | AM46: =AA!AM46+'A-hetero'!AM46+'a-homo'!AM46 -> 10 | AN46: =AA!AN46+'A-hetero'!AN46+'a-homo'!AN46 -> 10 | AO46: =AA!AO46+'A-hetero'!AO46+'a-homo'!AO46 -> 10 | AP46: =AA!AP46+'A-hetero'!AP46+'a-homo'!AP46 -> 10 | AQ46: =AA!AQ46+'A-hetero'!AQ46+'a-homo'!AQ46 -> 10 | AR46: =AA!AR46+'A-hetero'!AR46+'a-homo'!AR46 -> 10 | AS46: =SUM(AC46:AJ46) -> 856 | AT46: =AA!AT46+'A-hetero'!AT46+'a-homo'!AT46 -> 367.21316529748549 | AU46: =AA!AU46+'A-hetero'!AU46+'a-homo'!AU46 -> 512.17525632160164 | AV46: =AA!AV46+'A-hetero'!AV46+'a-homo'!AV46 -> 27.054258688783626 | AW46: =AA!AW46+'A-hetero'!AW46+'a-homo'!AW46 -> 18.416953027388686 | AX46: =AA!AX46+'A-hetero'!AX46+'a-homo'!AX46 -> 27.431143017096105 | AY46: =AA!AY46+'A-hetero'!AY46+'a-homo'!AY46 -> 18.372846743558501 | AZ46: =AA!AZ46+'A-hetero'!AZ46+'a-homo'!AZ46 -> 27.72479543986281 | BA46: =AA!BA46+'A-hetero'!BA46+'a-homo'!BA46 -> 48.611581464223043 | BB46: =AA!BB46+'A-hetero'!BB46+'a-homo'!BB46 -> 346.66905776031626 | BC46: =AA!BC46+'A-hetero'!BC46+'a-homo'!BC46 -> 43.486444911774839 | BD46: =AA!BD46+'A-hetero'!BD46+'a-homo'!BD46 -> 21.887926219251661 | BE46: =AA!BE46+'A-hetero'!BE46+'a-homo'!BE46 -> 34.096937773397684 | BF46: =AA!BF46+'A-hetero'!BF46+'a-homo'!BF46 -> 18.98102291459778 | BG46: =AA!BG46+'A-hetero'!BG46+'a-homo'!BG46 -> 27.671063033569268 | BH46: =AA!BH46+'A-hetero'!BH46+'a-homo'!BH46 -> 55.038630662606224 | BI46: =AA!BI46+'A-hetero'!BI46+'a-homo'!BI46 -> 47.168916724486266 | BJ46: =SUM(AT46:BI46) -> 1642 | BK46: =AT46/BJ46 -> 0.22363773769639794 | BL46: =AU46/BJ46 -> 0.3119215933749096 | BM46: =AV46/BJ46 -> 1.6476406022401718E-2 | BN46: =AW46/BJ46 -> 1.1216171149444997E-2 | BO46: =AX46/BJ46 -> 1.6705933627951339E-2 | BP46: =AY46/BJ46 -> 1.1189309831643422E-2 | BQ46: =AZ46/BJ46 -> 1.6884771887857981E-2 | BR46: =BA46/BJ46 -> 2.9605104424009158E-2 | BS46: =BB46/BJ46 -> 0.21112610095025347 | BT46: =BC46/BJ46 -> 2.6483827595477974E-2 | BU46: =BD46/BJ46 -> 1.3330040328411485E-2 | BV46: =BE46/BJ46 -> 2.0765491944821971E-2 | BW46: =BF46/BJ46 -> 1.1559697268329949E-2 | BX46: =BG46/BJ46 -> 1.6852048132502597E-2 | BY46: =BH46/BJ46 -> 3.3519263497324127E-2 | BZ46: =BI46/BJ46 -> 2.8726502268262035E-2 | CA46: =SUM(BK46:BZ46) -> 1
AC47: =AA!AC47+'A-hetero'!AC47+'a-homo'!AC47 -> 334 | AD47: =AA!AD47+'A-hetero'!AD47+'a-homo'!AD47 -> 463 | AE47: =AA!AE47+'A-hetero'!AE47+'a-homo'!AE47 -> 10 | AF47: =AA!AF47+'A-hetero'!AF47+'a-homo'!AF47 -> 9 | AG47: =AA!AG47+'A-hetero'!AG47+'a-homo'!AG47 -> 10 | AH47: =AA!AH47+'A-hetero'!AH47+'a-homo'!AH47 -> 10 | AI47: =AA!AI47+'A-hetero'!AI47+'a-homo'!AI47 -> 10 | AJ47: =AA!AJ47+'A-hetero'!AJ47+'a-homo'!AJ47 -> 10 | AK47: =AA!AK47+'A-hetero'!AK47+'a-homo'!AK47 -> 305 | AL47: =AA!AL47+'A-hetero'!AL47+'a-homo'!AL47 -> 37 | AM47: =AA!AM47+'A-hetero'!AM47+'a-homo'!AM47 -> 10 | AN47: =AA!AN47+'A-hetero'!AN47+'a-homo'!AN47 -> 10 | AO47: =AA!AO47+'A-hetero'!AO47+'a-homo'!AO47 -> 10 | AP47: =AA!AP47+'A-hetero'!AP47+'a-homo'!AP47 -> 10 | AQ47: =AA!AQ47+'A-hetero'!AQ47+'a-homo'!AQ47 -> 10 | AR47: =AA!AR47+'A-hetero'!AR47+'a-homo'!AR47 -> 10 | AS47: =SUM(AC47:AJ47) -> 856 | AT47: =AA!AT47+'A-hetero'!AT47+'a-homo'!AT47 -> 367.21316431675325 | AU47: =AA!AU47+'A-hetero'!AU47+'a-homo'!AU47 -> 512.17525690266052 | AV47: =AA!AV47+'A-hetero'!AV47+'a-homo'!AV47 -> 27.054259116544173 | AW47: =AA!AW47+'A-hetero'!AW47+'a-homo'!AW47 -> 18.41695254194692 | AX47: =AA!AX47+'A-hetero'!AX47+'a-homo'!AX47 -> 27.431143383354957 | AY47: =AA!AY47+'A-hetero'!AY47+'a-homo'!AY47 -> 18.372846336403988 | AZ47: =AA!AZ47+'A-hetero'!AZ47+'a-homo'!AZ47 -> 27.724794591469745 | BA47: =AA!BA47+'A-hetero'!BA47+'a-homo'!BA47 -> 48.611582810866473 | BB47: =AA!BB47+'A-hetero'!BB47+'a-homo'!BB47 -> 346.66905811818862 | BC47: =AA!BC47+'A-hetero'!BC47+'a-homo'!BC47 -> 43.486444794727717 | BD47: =AA!BD47+'A-hetero'!BD47+'a-homo'!BD47 -> 21.887925695038327 | BE47: =AA!BE47+'A-hetero'!BE47+'a-homo'!BE47 -> 34.096938514140476 | BF47: =AA!BF47+'A-hetero'!BF47+'a-homo'!BF47 -> 18.981022478332935 | BG47: =AA!BG47+'A-hetero'!BG47+'a-homo'!BG47 -> 27.671063669578018 | BH47: =AA!BH47+'A-hetero'!BH47+'a-homo'!BH47 -> 55.038632300318 | BI47: =AA!BI47+'A-hetero'!BI47+'a-homo'!BI47 -> 47.16891442967588 | BJ47: =SUM(AT47:BI47) -> 1642 | BK47: =AT47/BJ47 -> 0.22363773709911894 | BL47: =AU47/BJ47 -> 0.31192159372878231 | BM47: =AV47/BJ47 -> 1.6476406282913629E-2 | BN47: =AW47/BJ47 -> 1.1216170853804459E-2 | BO47: =AX47/BJ47 -> 1.6705933851007892E-2 | BP47: =AY47/BJ47 -> 1.1189309583680871E-2 | BQ47: =AZ47/BJ47 -> 1.6884771371175243E-2 | BR47: =BA47/BJ47 -> 2.9605105244133057E-2 | BS47: =BB47/BJ47 -> 0.2111261011682026 | BT47: =BC47/BJ47 -> 2.6483827524194717E-2 | BU47: =BD47/BJ47 -> 1.3330040009158545E-2 | BV47: =BE47/BJ47 -> 2.0765492395944263E-2 | BW47: =BF47/BJ47 -> 1.1559697002638817E-2 | BX47: =BG47/BJ47 -> 1.6852048519840453E-2 | BY47: =BH47/BJ47 -> 3.3519264494712549E-2 | BZ47: =BI47/BJ47 -> 2.8726500870691771E-2 | CA47: =SUM(BK47:BZ47) -> 1
AC48: =AA!AC48+'A-hetero'!AC48+'a-homo'!AC48 -> 334 | AD48: =AA!AD48+'A-hetero'!AD48+'a-homo'!AD48 -> 463 | AE48: =AA!AE48+'A-hetero'!AE48+'a-homo'!AE48 -> 10 | AF48: =AA!AF48+'A-hetero'!AF48+'a-homo'!AF48 -> 9 | AG48: =AA!AG48+'A-hetero'!AG48+'a-homo'!AG48 -> 10 | AH48: =AA!AH48+'A-hetero'!AH48+'a-homo'!AH48 -> 10 | AI48: =AA!AI48+'A-hetero'!AI48+'a-homo'!AI48 -> 10 | AJ48: =AA!AJ48+'A-hetero'!AJ48+'a-homo'!AJ48 -> 10 | AK48: =AA!AK48+'A-hetero'!AK48+'a-homo'!AK48 -> 305 | AL48: =AA!AL48+'A-hetero'!AL48+'a-homo'!AL48 -> 37 | AM48: =AA!AM48+'A-hetero'!AM48+'a-homo'!AM48 -> 10 | AN48: =AA!AN48+'A-hetero'!AN48+'a-homo'!AN48 -> 10 | AO48: =AA!AO48+'A-hetero'!AO48+'a-homo'!AO48 -> 10 | AP48: =AA!AP48+'A-hetero'!AP48+'a-homo'!AP48 -> 10 | AQ48: =AA!AQ48+'A-hetero'!AQ48+'a-homo'!AQ48 -> 10 | AR48: =AA!AR48+'A-hetero'!AR48+'a-homo'!AR48 -> 10 | AS48: =SUM(AC48:AJ48) -> 856 | AT48: =AA!AT48+'A-hetero'!AT48+'a-homo'!AT48 -> 367.21316361499527 | AU48: =AA!AU48+'A-hetero'!AU48+'a-homo'!AU48 -> 512.17525731860701 | AV48: =AA!AV48+'A-hetero'!AV48+'a-homo'!AV48 -> 27.054259422474669 | AW48: =AA!AW48+'A-hetero'!AW48+'a-homo'!AW48 -> 18.41695219479444 | AX48: =AA!AX48+'A-hetero'!AX48+'a-homo'!AX48 -> 27.431143645305163 | AY48: =AA!AY48+'A-hetero'!AY48+'a-homo'!AY48 -> 18.372846045221696 | AZ48: =AA!AZ48+'A-hetero'!AZ48+'a-homo'!AZ48 -> 27.724793984614131 | BA48: =AA!BA48+'A-hetero'!BA48+'a-homo'!BA48 -> 48.611583773987583 | BB48: =AA!BB48+'A-hetero'!BB48+'a-homo'!BB48 -> 346.66905837407694 | BC48: =AA!BC48+'A-hetero'!BC48+'a-homo'!BC48 -> 43.486444711002662 | BD48: =AA!BD48+'A-hetero'!BD48+'a-homo'!BD48 -> 21.887925319962577 | BE48: =AA!BE48+'A-hetero'!BE48+'a-homo'!BE48 -> 34.096939044086426 | BF48: =AA!BF48+'A-hetero'!BF48+'a-homo'!BF48 -> 18.981022166174338 | BG48: =AA!BG48+'A-hetero'!BG48+'a-homo'!BG48 -> 27.671064124616912 | BH48: =AA!BH48+'A-hetero'!BH48+'a-homo'!BH48 -> 55.038633472396967 | BI48: =AA!BI48+'A-hetero'!BI48+'a-homo'!BI48 -> 47.168912787683198 | BJ48: =SUM(AT48:BI48) -> 1642 | BK48: =AT48/BJ48 -> 0.22363773667173895 | BL48: =AU48/BJ48 -> 0.31192159398209934 | BM48: =AV48/BJ48 -> 1.6476406469229401E-2 | BN48: =AW48/BJ48 -> 1.1216170642383949E-2 | BO48: =AX48/BJ48 -> 1.6705934010539082E-2 | BP48: =AY48/BJ48 -> 1.1189309406346956E-2 | BQ48: =AZ48/BJ48 -> 1.6884771001592046E-2 | BR48: =BA48/BJ48 -> 2.960510583068672E-2 | BS48: =BB48/BJ48 -> 0.21112610132404205 | BT48: =BC48/BJ48 -> 2.6483827473205039E-2 | BU48: =BD48/BJ48 -> 1.3330039780732389E-2 | BV48: =BE48/BJ48 -> 2.0765492718688449E-2 | BW48: =BF48/BJ48 -> 1.155969681253005E-2 | BX48: =BG48/BJ48 -> 1.6852048796965238E-2 | BY48: =BH48/BJ48 -> 3.351926520852435E-2 | BZ48: =BI48/BJ48 -> 2.8726499870696229E-2 | CA48: =SUM(BK48:BZ48) -> 1
AC49: =AA!AC49+'A-hetero'!AC49+'a-homo'!AC49 -> 334 | AD49: =AA!AD49+'A-hetero'!AD49+'a-homo'!AD49 -> 463 | AE49: =AA!AE49+'A-hetero'!AE49+'a-homo'!AE49 -> 10 | AF49: =AA!AF49+'A-hetero'!AF49+'a-homo'!AF49 -> 9 | AG49: =AA!AG49+'A-hetero'!AG49+'a-homo'!AG49 -> 10 | AH49: =AA!AH49+'A-hetero'!AH49+'a-homo'!AH49 -> 10 | AI49: =AA!AI49+'A-hetero'!AI49+'a-homo'!AI49 -> 10 | AJ49: =AA!AJ49+'A-hetero'!AJ49+'a-homo'!AJ49 -> 10 | AK49: =AA!AK49+'A-hetero'!AK49+'a-homo'!AK49 -> 305 | AL49: =AA!AL49+'A-hetero'!AL49+'a-homo'!AL49 -> 37 | AM49: =AA!AM49+'A-hetero'!AM49+'a-homo'!AM49 -> 10 | AN49: =AA!AN49+'A-hetero'!AN49+'a-homo'!AN49 -> 10 | AO49: =AA!AO49+'A-hetero'!AO49+'a-homo'!AO49 -> 10 | AP49: =AA!AP49+'A-hetero'!AP49+'a-homo'!AP49 -> 10 | AQ49: =AA!AQ49+'A-hetero'!AQ49+'a-homo'!AQ49 -> 10 | AR49: =AA!AR49+'A-hetero'!AR49+'a-homo'!AR49 -> 10 | AS49: =SUM(AC49:AJ49) -> 856 | AT49: =AA!AT49+'A-hetero'!AT49+'a-homo'!AT49 -> 367.21316311286455 | AU49: =AA!AU49+'A-hetero'!AU49+'a-homo'!AU49 -> 512.17525761633965 | AV49: =AA!AV49+'A-hetero'!AV49+'a-homo'!AV49 -> 27.054259641283551 | AW49: =AA!AW49+'A-hetero'!AW49+'a-homo'!AW49 -> 18.416951946522961 | AX49: =AA!AX49+'A-hetero'!AX49+'a-homo'!AX49 -> 27.431143832661355 | AY49: =AA!AY49+'A-hetero'!AY49+'a-homo'!AY49 -> 18.372845836968821 | AZ49: =AA!AZ49+'A-hetero'!AZ49+'a-homo'!AZ49 -> 27.724793550519585 | BA49: =AA!BA49+'A-hetero'!BA49+'a-homo'!BA49 -> 48.611584462839502 | BB49: =AA!BB49+'A-hetero'!BB49+'a-homo'!BB49 -> 346.66905855705613 | BC49: =AA!BC49+'A-hetero'!BC49+'a-homo'!BC49 -> 43.486444651111825 | BD49: =AA!BD49+'A-hetero'!BD49+'a-homo'!BD49 -> 21.887925051596596 | BE49: =AA!BE49+'A-hetero'!BE49+'a-homo'!BE49 -> 34.096939423224683 | BF49: =AA!BF49+'A-hetero'!BF49+'a-homo'!BF49 -> 18.981021942819375 | BG49: =AA!BG49+'A-hetero'!BG49+'a-homo'!BG49 -> 27.67106445017825 | BH49: =AA!BH49+'A-hetero'!BH49+'a-homo'!BH49 -> 55.03863431119877 | BI49: =AA!BI49+'A-hetero'!BI49+'a-homo'!BI49 -> 47.168911612814348 | BJ49: =SUM(AT49:BI49) -> 1642 | BK49: =AT49/BJ49 -> 0.22363773636593454 | BL49: =AU49/BJ49 -> 0.31192159416342241 | BM49: =AV49/BJ49 -> 1.6476406602486934E-2 | BN49: =AW49/BJ49 -> 1.1216170491183288E-2 | BO49: =AX49/BJ49 -> 1.6705934124641504E-2 | BP49: =AY49/BJ49 -> 1.118930927951816E-2 | BQ49: =AZ49/BJ49 -> 1.6884770737222644E-2 | BR49: =BA49/BJ49 -> 2.9605106250206757E-2 | BS49: =BB49/BJ49 -> 0.21112610143547875 | BT49: =BC49/BJ49 -> 2.6483827436730705E-2 | BU49: =BD49/BJ49 -> 1.3330039617293905E-2 | BV49: =BE49/BJ49 -> 2.076549294958872E-2 | BW49: =BF49/BJ49 -> 1.155969667650388E-2 | BX49: =BG49/BJ49 -> 1.6852048995236447E-2 | BY49: =BH49/BJ49 -> 3.3519265719365872E-2 | BZ49: =BI49/BJ49 -> 2.872649915518535E-2 | CA49: =SUM(BK49:BZ49) -> 1
AC50: =AA!AC50+'A-hetero'!AC50+'a-homo'!AC50 -> 334 | AD50: =AA!AD50+'A-hetero'!AD50+'a-homo'!AD50 -> 463 | AE50: =AA!AE50+'A-hetero'!AE50+'a-homo'!AE50 -> 10 | AF50: =AA!AF50+'A-hetero'!AF50+'a-homo'!AF50 -> 9 | AG50: =AA!AG50+'A-hetero'!AG50+'a-homo'!AG50 -> 10 | AH50: =AA!AH50+'A-hetero'!AH50+'a-homo'!AH50 -> 10 | AI50: =AA!AI50+'A-hetero'!AI50+'a-homo'!AI50 -> 10 | AJ50: =AA!AJ50+'A-hetero'!AJ50+'a-homo'!AJ50 -> 10 | AK50: =AA!AK50+'A-hetero'!AK50+'a-homo'!AK50 -> 305 | AL50: =AA!AL50+'A-hetero'!AL50+'a-homo'!AL50 -> 37 | AM50: =AA!AM50+'A-hetero'!AM50+'a-homo'!AM50 -> 10 | AN50: =AA!AN50+'A-hetero'!AN50+'a-homo'!AN50 -> 10 | AO50: =AA!AO50+'A-hetero'!AO50+'a-homo'!AO50 -> 10 | AP50: =AA!AP50+'A-hetero'!AP50+'a-homo'!AP50 -> 10 | AQ50: =AA!AQ50+'A-hetero'!AQ50+'a-homo'!AQ50 -> 10 | AR50: =AA!AR50+'A-hetero'!AR50+'a-homo'!AR50 -> 10 | AS50: =SUM(AC50:AJ50) -> 856 | AT50: =AA!AT50+'A-hetero'!AT50+'a-homo'!AT50 -> 367.21316275357924 | AU50: =AA!AU50+'A-hetero'!AU50+'a-homo'!AU50 -> 512.17525782944278 | AV50: =AA!AV50+'A-hetero'!AV50+'a-homo'!AV50 -> 27.054259797787211 | AW50: =AA!AW50+'A-hetero'!AW50+'a-homo'!AW50 -> 18.416951768959354 | AX50: =AA!AX50+'A-hetero'!AX50+'a-homo'!AX50 -> 27.43114396667022 | AY50: =AA!AY50+'A-hetero'!AY50+'a-homo'!AY50 -> 18.372845688020714 | AZ50: =AA!AZ50+'A-hetero'!AZ50+'a-homo'!AZ50 -> 27.724793239997393 | BA50: =AA!BA50+'A-hetero'!BA50+'a-homo'!BA50 -> 48.611584955543066 | BB50: =AA!BB50+'A-hetero'!BB50+'a-homo'!BB50 -> 346.66905868790775 | BC50: =AA!BC50+'A-hetero'!BC50+'a-homo'!BC50 -> 43.486444608269395 | BD50: =AA!BD50+'A-hetero'!BD50+'a-homo'!BD50 -> 21.887924859582355 | BE50: =AA!BE50+'A-hetero'!BE50+'a-homo'!BE50 -> 34.096939694471857 | BF50: =AA!BF50+'A-hetero'!BF50+'a-homo'!BF50 -> 18.981021783006589 | BG50: =AA!BG50+'A-hetero'!BG50+'a-homo'!BG50 -> 27.671064683103253 | BH50: =AA!BH50+'A-hetero'!BH50+'a-homo'!BH50 -> 55.038634911469153 | BI50: =AA!BI50+'A-hetero'!BI50+'a-homo'!BI50 -> 47.168910772189619 | BJ50: =SUM(AT50:BI50) -> 1642 | BK50: =AT50/BJ50 -> 0.22363773614712504 | BL50: =AU50/BJ50 -> 0.31192159429320515 | BM50: =AV50/BJ50 -> 1.6476406697799765E-2 | BN50: =AW50/BJ50 -> 1.1216170383044675E-2 | BO50: =AX50/BJ50 -> 1.6705934206254703E-2 | BP50: =AY50/BJ50 -> 1.118930918880677E-2 | BQ50: =AZ50/BJ50 -> 1.6884770548110474E-2 | BR50: =BA50/BJ50 -> 2.9605106550269836E-2 | BS50: =BB50/BJ50 -> 0.2111261015151692 | BT50: =BC50/BJ50 -> 2.6483827410639101E-2 | BU50: =BD50/BJ50 -> 1.3330039500354664E-2 | BV50: =BE50/BJ50 -> 2.0765493114781888E-2 | BW50: =BF50/BJ50 -> 1.1559696579175757E-2 | BX50: =BG50/BJ50 -> 1.6852049137090899E-2 | BY50: =BH50/BJ50 -> 3.351926608493859E-2 | BZ50: =BI50/BJ50 -> 2.8726498643233633E-2 | CA50: =SUM(BK50:BZ50) -> 1
AC51: =AA!AC51+'A-hetero'!AC51+'a-homo'!AC51 -> 334 | AD51: =AA!AD51+'A-hetero'!AD51+'a-homo'!AD51 -> 463 | AE51: =AA!AE51+'A-hetero'!AE51+'a-homo'!AE51 -> 10 | AF51: =AA!AF51+'A-hetero'!AF51+'a-homo'!AF51 -> 9 | AG51: =AA!AG51+'A-hetero'!AG51+'a-homo'!AG51 -> 10 | AH51: =AA!AH51+'A-hetero'!AH51+'a-homo'!AH51 -> 10 | AI51: =AA!AI51+'A-hetero'!AI51+'a-homo'!AI51 -> 10 | AJ51: =AA!AJ51+'A-hetero'!AJ51+'a-homo'!AJ51 -> 10 | AK51: =AA!AK51+'A-hetero'!AK51+'a-homo'!AK51 -> 305 | AL51: =AA!AL51+'A-hetero'!AL51+'a-homo'!AL51 -> 37 | AM51: =AA!AM51+'A-hetero'!AM51+'a-homo'!AM51 -> 10 | AN51: =AA!AN51+'A-hetero'!AN51+'a-homo'!AN51 -> 10 | AO51: =AA!AO51+'A-hetero'!AO51+'a-homo'!AO51 -> 10 | AP51: =AA!AP51+'A-hetero'!AP51+'a-homo'!AP51 -> 10 | AQ51: =AA!AQ51+'A-hetero'!AQ51+'a-homo'!AQ51 -> 10 | AR51: =AA!AR51+'A-hetero'!AR51+'a-homo'!AR51 -> 10 | AS51: =SUM(AC51:AJ51) -> 856 | AT51: =AA!AT51+'A-hetero'!AT51+'a-homo'!AT51 -> 367.21316249650624 | AU51: =AA!AU51+'A-hetero'!AU51+'a-homo'!AU51 -> 512.17525798196425 | AV51: =AA!AV51+'A-hetero'!AV51+'a-homo'!AV51 -> 27.054259909730764 | AW51: =AA!AW51+'A-hetero'!AW51+'a-homo'!AW51 -> 18.416951641960701 | AX51: =AA!AX51+'A-hetero'!AX51+'a-homo'!AX51 -> 27.431144062524826 | AY51: =AA!AY51+'A-hetero'!AY51+'a-homo'!AY51 -> 18.37284558148513 | AZ51: =AA!AZ51+'A-hetero'!AZ51+'a-homo'!AZ51 -> 27.724793017866386 | BA51: =AA!BA51+'A-hetero'!BA51+'a-homo'!BA51 -> 48.611585307961633 | BB51: =AA!BB51+'A-hetero'!BB51+'a-homo'!BB51 -> 346.66905878148702 | BC51: =AA!BC51+'A-hetero'!BC51+'a-homo'!BC51 -> 43.486444577621839 | BD51: =AA!BD51+'A-hetero'!BD51+'a-homo'!BD51 -> 21.887924722198107 | BE51: =AA!BE51+'A-hetero'!BE51+'a-homo'!BE51 -> 34.096939888530997 | BF51: =AA!BF51+'A-hetero'!BF51+'a-homo'!BF51 -> 18.981021668659963 | BG51: =AA!BG51+'A-hetero'!BG51+'a-homo'!BG51 -> 27.67106484975065 | BH51: =AA!BH51+'A-hetero'!BH51+'a-homo'!BH51 -> 55.038635341026641 | BI51: =AA!BI51+'A-hetero'!BI51+'a-homo'!BI51 -> 47.168910170724772 | BJ51: =SUM(AT51:BI51) -> 1642 | BK51: =AT51/BJ51 -> 0.22363773599056413 | BL51: =AU51/BJ51 -> 0.31192159438609279 | BM51: =AV51/BJ51 -> 1.647640676597489E-2 | BN51: =AW51/BJ51 -> 1.1216170305700794E-2 | BO51: =AX51/BJ51 -> 1.6705934264631444E-2 | BP51: =AY51/BJ51 -> 1.1189309123925172E-2 | BQ51: =AZ51/BJ51 -> 1.6884770412829715E-2 | BR51: =BA51/BJ51 -> 2.9605106764897467E-2 | BS51: =BB51/BJ51 -> 0.21112610157216022 | BT51: =BC51/BJ51 -> 2.6483827391974326E-2 | BU51: =BD51/BJ51 -> 1.3330039416685816E-2 | BV51: =BE51/BJ51 -> 2.0765493232966507E-2 | BW51: =BF51/BJ51 -> 1.1559696509537129E-2 | BX51: =BG51/BJ51 -> 1.6852049238581395E-2 | BY51: =BH51/BJ51 -> 3.3519266346544854E-2 | BZ51: =BI51/BJ51 -> 2.8726498276933483E-2 | CA51: =SUM(BK51:BZ51) -> 1
AC52: =AA!AC52+'A-hetero'!AC52+'a-homo'!AC52 -> 334 | AD52: =AA!AD52+'A-hetero'!AD52+'a-homo'!AD52 -> 463 | AE52: =AA!AE52+'A-hetero'!AE52+'a-homo'!AE52 -> 10 | AF52: =AA!AF52+'A-hetero'!AF52+'a-homo'!AF52 -> 9 | AG52: =AA!AG52+'A-hetero'!AG52+'a-homo'!AG52 -> 10 | AH52: =AA!AH52+'A-hetero'!AH52+'a-homo'!AH52 -> 10 | AI52: =AA!AI52+'A-hetero'!AI52+'a-homo'!AI52 -> 10 | AJ52: =AA!AJ52+'A-hetero'!AJ52+'a-homo'!AJ52 -> 10 | AK52: =AA!AK52+'A-hetero'!AK52+'a-homo'!AK52 -> 305 | AL52: =AA!AL52+'A-hetero'!AL52+'a-homo'!AL52 -> 37 | AM52: =AA!AM52+'A-hetero'!AM52+'a-homo'!AM52 -> 10 | AN52: =AA!AN52+'A-hetero'!AN52+'a-homo'!AN52 -> 10 | AO52: =AA!AO52+'A-hetero'!AO52+'a-homo'!AO52 -> 10 | AP52: =AA!AP52+'A-hetero'!AP52+'a-homo'!AP52 -> 10 | AQ52: =AA!AQ52+'A-hetero'!AQ52+'a-homo'!AQ52 -> 10 | AR52: =AA!AR52+'A-hetero'!AR52+'a-homo'!AR52 -> 10 | AS52: =SUM(AC52:AJ52) -> 856 | AT52: =AA!AT52+'A-hetero'!AT52+'a-homo'!AT52 -> 367.21316231256958 | AU52: =AA!AU52+'A-hetero'!AU52+'a-homo'!AU52 -> 512.17525809112158 | AV52: =AA!AV52+'A-hetero'!AV52+'a-homo'!AV52 -> 27.054259989803867 | AW52: =AA!AW52+'A-hetero'!AW52+'a-homo'!AW52 -> 18.41695155112426 | AX52: =AA!AX52+'A-hetero'!AX52+'a-homo'!AX52 -> 27.431144131090164 | AY52: =AA!AY52+'A-hetero'!AY52+'a-homo'!AY52 -> 18.3728455052828 | AZ52: =AA!AZ52+'A-hetero'!AZ52+'a-homo'!AZ52 -> 27.724792858963085 | BA52: =AA!BA52+'A-hetero'!BA52+'a-homo'!BA52 -> 48.611585560044659 | BB52: =AA!BB52+'A-hetero'!BB52+'a-homo'!BB52 -> 346.66905884841384 | BC52: =AA!BC52+'A-hetero'!BC52+'a-homo'!BC52 -> 43.486444555697631 | BD52: =AA!BD52+'A-hetero'!BD52+'a-homo'!BD52 -> 21.887924623901604 | BE52: =AA!BE52+'A-hetero'!BE52+'a-homo'!BE52 -> 34.096940027367644 | BF52: =AA!BF52+'A-hetero'!BF52+'a-homo'!BF52 -> 18.981021586845237 | BG52: =AA!BG52+'A-hetero'!BG52+'a-homo'!BG52 -> 27.671064968979174 | BH52: =AA!BH52+'A-hetero'!BH52+'a-homo'!BH52 -> 55.03863564841263 | BI52: =AA!BI52+'A-hetero'!BI52+'a-homo'!BI52 -> 47.168909740382247 | BJ52: =SUM(AT52:BI52) -> 1642 | BK52: =AT52/BJ52 -> 0.22363773587854416 | BL52: =AU52/BJ52 -> 0.31192159445257095 | BM52: =AV52/BJ52 -> 1.6476406814740479E-2 | BN52: =AW52/BJ52 -> 1.1216170250380181E-2 | BO52: =AX52/BJ52 -> 1.6705934306388649E-2 | BP52: =AY52/BJ52 -> 1.118930907751693E-2 | BQ52: =AZ52/BJ52 -> 1.688477031605547E-2 | BR52: =BA52/BJ52 -> 2.9605106918419399E-2 | BS52: =BB52/BJ52 -> 0.21112610161291948 | BT52: =BC52/BJ52 -> 2.6483827378622184E-2 | BU52: =BD52/BJ52 -> 1.3330039356821925E-2 | BV52: =BE52/BJ52 -> 2.0765493317519878E-2 | BW52: =BF52/BJ52 -> 1.1559696459710861E-2 | BX52: =BG52/BJ52 -> 1.6852049311193162E-2 | BY52: =BH52/BJ52 -> 3.3519266533747032E-2 | BZ52: =BI52/BJ52 -> 2.8726498014849111E-2 | CA52: =SUM(BK52:BZ52) -> 1
AC53: =AA!AC53+'A-hetero'!AC53+'a-homo'!AC53 -> 334 | AD53: =AA!AD53+'A-hetero'!AD53+'a-homo'!AD53 -> 463 | AE53: =AA!AE53+'A-hetero'!AE53+'a-homo'!AE53 -> 10 | AF53: =AA!AF53+'A-hetero'!AF53+'a-homo'!AF53 -> 9 | AG53: =AA!AG53+'A-hetero'!AG53+'a-homo'!AG53 -> 10 | AH53: =AA!AH53+'A-hetero'!AH53+'a-homo'!AH53 -> 10 | AI53: =AA!AI53+'A-hetero'!AI53+'a-homo'!AI53 -> 10 | AJ53: =AA!AJ53+'A-hetero'!AJ53+'a-homo'!AJ53 -> 10 | AK53: =AA!AK53+'A-hetero'!AK53+'a-homo'!AK53 -> 305 | AL53: =AA!AL53+'A-hetero'!AL53+'a-homo'!AL53 -> 37 | AM53: =AA!AM53+'A-hetero'!AM53+'a-homo'!AM53 -> 10 | AN53: =AA!AN53+'A-hetero'!AN53+'a-homo'!AN53 -> 10 | AO53: =AA!AO53+'A-hetero'!AO53+'a-homo'!AO53 -> 10 | AP53: =AA!AP53+'A-hetero'!AP53+'a-homo'!AP53 -> 10 | AQ53: =AA!AQ53+'A-hetero'!AQ53+'a-homo'!AQ53 -> 10 | AR53: =AA!AR53+'A-hetero'!AR53+'a-homo'!AR53 -> 10 | AS53: =SUM(AC53:AJ53) -> 856 | AT53: =AA!AT53+'A-hetero'!AT53+'a-homo'!AT53 -> 367.21316218096348 | AU53: =AA!AU53+'A-hetero'!AU53+'a-homo'!AU53 -> 512.17525816924069 | AV53: =AA!AV53+'A-hetero'!AV53+'a-homo'!AV53 -> 27.054260047081563 | AW53: =AA!AW53+'A-hetero'!AW53+'a-homo'!AW53 -> 18.41695148615095 | AX53: =AA!AX53+'A-hetero'!AX53+'a-homo'!AX53 -> 27.431144180136531 | AY53: =AA!AY53+'A-hetero'!AY53+'a-homo'!AY53 -> 18.372845450775589 | AZ53: =AA!AZ53+'A-hetero'!AZ53+'a-homo'!AZ53 -> 27.72479274528861 | BA53: =AA!BA53+'A-hetero'!BA53+'a-homo'!BA53 -> 48.611585740362599 | BB53: =AA!BB53+'A-hetero'!BB53+'a-homo'!BB53 -> 346.66905889628117 | BC53: =AA!BC53+'A-hetero'!BC53+'a-homo'!BC53 -> 43.486444540013579 | BD53: =AA!BD53+'A-hetero'!BD53+'a-homo'!BD53 -> 21.887924553572198 | BE53: =AA!BE53+'A-hetero'!BE53+'a-homo'!BE53 -> 34.096940126696417 | BF53: =AA!BF53+'A-hetero'!BF53+'a-homo'!BF53 -> 18.981021528307462 | BG53: =AA!BG53+'A-hetero'!BG53+'a-homo'!BG53 -> 27.671065054281545 | BH53: =AA!BH53+'A-hetero'!BH53+'a-homo'!BH53 -> 55.038635868368999 | BI53: =AA!BI53+'A-hetero'!BI53+'a-homo'!BI53 -> 47.16890943247865 | BJ53: =SUM(AT53:BI53) -> 1642 | BK53: =AT53/BJ53 -> 0.22363773579839433 | BL53: =AU53/BJ53 -> 0.31192159450014656 | BM53: =AV53/BJ53 -> 1.6476406849623364E-2 | BN53: =AW53/BJ53 -> 1.1216170210810566E-2 | BO53: =AX53/BJ53 -> 1.6705934336258544E-2 | BP53: =AY53/BJ53 -> 1.1189309044321308E-2 | BQ53: =AZ53/BJ53 -> 1.6884770246826195E-2 | BR53: =BA53/BJ53 -> 2.9605107028235444E-2 | BS53: =BB53/BJ53 -> 0.21112610164207135 | BT53: =BC53/BJ53 -> 2.648382736907039E-2 | BU53: =BD53/BJ53 -> 1.3330039313990375E-2 | BV53: =BE53/BJ53 -> 2.0765493378012433E-2 | BW53: =BF53/BJ53 -> 1.1559696424060574E-2 | BX53: =BG53/BJ53 -> 1.685204936314345E-2 | BY53: =BH53/BJ53 -> 3.3519266667703412E-2 | BZ53: =BI53/BJ53 -> 2.87264978273317E-2 | CA53: =SUM(BK53:BZ53) -> 1
AC54: =AA!AC54+'A-hetero'!AC54+'a-homo'!AC54 -> 334 | AD54: =AA!AD54+'A-hetero'!AD54+'a-homo'!AD54 -> 463 | AE54: =AA!AE54+'A-hetero'!AE54+'a-homo'!AE54 -> 10 | AF54: =AA!AF54+'A-hetero'!AF54+'a-homo'!AF54 -> 9 | AG54: =AA!AG54+'A-hetero'!AG54+'a-homo'!AG54 -> 10 | AH54: =AA!AH54+'A-hetero'!AH54+'a-homo'!AH54 -> 10 | AI54: =AA!AI54+'A-hetero'!AI54+'a-homo'!AI54 -> 10 | AJ54: =AA!AJ54+'A-hetero'!AJ54+'a-homo'!AJ54 -> 10 | AK54: =AA!AK54+'A-hetero'!AK54+'a-homo'!AK54 -> 305 | AL54: =AA!AL54+'A-hetero'!AL54+'a-homo'!AL54 -> 37 | AM54: =AA!AM54+'A-hetero'!AM54+'a-homo'!AM54 -> 10 | AN54: =AA!AN54+'A-hetero'!AN54+'a-homo'!AN54 -> 10 | AO54: =AA!AO54+'A-hetero'!AO54+'a-homo'!AO54 -> 10 | AP54: =AA!AP54+'A-hetero'!AP54+'a-homo'!AP54 -> 10 | AQ54: =AA!AQ54+'A-hetero'!AQ54+'a-homo'!AQ54 -> 10 | AR54: =AA!AR54+'A-hetero'!AR54+'a-homo'!AR54 -> 10 | AS54: =SUM(AC54:AJ54) -> 856 | AT54: =AA!AT54+'A-hetero'!AT54+'a-homo'!AT54 -> 367.21316208680065 | AU54: =AA!AU54+'A-hetero'!AU54+'a-homo'!AU54 -> 512.17525822514517 | AV54: =AA!AV54+'A-hetero'!AV54+'a-homo'!AV54 -> 27.054260088054228 | AW54: =AA!AW54+'A-hetero'!AW54+'a-homo'!AW54 -> 18.416951439675664 | AX54: =AA!AX54+'A-hetero'!AX54+'a-homo'!AX54 -> 27.431144215221273 | AY54: =AA!AY54+'A-hetero'!AY54+'a-homo'!AY54 -> 18.372845411785836 | AZ54: =AA!AZ54+'A-hetero'!AZ54+'a-homo'!AZ54 -> 27.724792663968394 | BA54: =AA!BA54+'A-hetero'!BA54+'a-homo'!BA54 -> 48.611585869348879 | BB54: =AA!BB54+'A-hetero'!BB54+'a-homo'!BB54 -> 346.66905893051796 | BC54: =AA!BC54+'A-hetero'!BC54+'a-homo'!BC54 -> 43.486444528793456 | BD54: =AA!BD54+'A-hetero'!BD54+'a-homo'!BD54 -> 21.887924503253004 | BE54: =AA!BE54+'A-hetero'!BE54+'a-homo'!BE54 -> 34.096940197759949 | BF54: =AA!BF54+'A-hetero'!BF54+'a-homo'!BF54 -> 18.981021486424453 | BG54: =AA!BG54+'A-hetero'!BG54+'a-homo'!BG54 -> 27.671065115311279 | BH54: =AA!BH54+'A-hetero'!BH54+'a-homo'!BH54 -> 55.038636025760042 | BI54: =AA!BI54+'A-hetero'!BI54+'a-homo'!BI54 -> 47.168909212179841 | BJ54: =SUM(AT54:BI54) -> 1642 | BK54: =AT54/BJ54 -> 0.22363773574104787 | BL54: =AU54/BJ54 -> 0.3119215945341931 | BM54: =AV54/BJ54 -> 1.6476406874576265E-2 | BN54: =AW54/BJ54 -> 1.1216170182506494E-2 | BO54: =AX54/BJ54 -> 1.6705934357625622E-2 | BP54: =AY54/BJ54 -> 1.1189309020576025E-2 | BQ54: =AZ54/BJ54 -> 1.6884770197301089E-2 | BR54: =BA54/BJ54 -> 2.9605107106789812E-2 | BS54: =BB54/BJ54 -> 0.21112610166292201 | BT54: =BC54/BJ54 -> 2.6483827362237179E-2 | BU54: =BD54/BJ54 -> 1.3330039283345311E-2 | BV54: =BE54/BJ54 -> 2.0765493421291074E-2 | BW54: =BF54/BJ54 -> 1.1559696398553258E-2 | BX54: =BG54/BJ54 -> 1.6852049400311375E-2 | BY54: =BH54/BJ54 -> 3.3519266763556661E-2 | BZ54: =BI54/BJ54 -> 2.8726497693166767E-2 | CA54: =SUM(BK54:BZ54) -> 1
AC55: =AA!AC55+'A-hetero'!AC55+'a-homo'!AC55 -> 334 | AD55: =AA!AD55+'A-hetero'!AD55+'a-homo'!AD55 -> 463 | AE55: =AA!AE55+'A-hetero'!AE55+'a-homo'!AE55 -> 10 | AF55: =AA!AF55+'A-hetero'!AF55+'a-homo'!AF55 -> 9 | AG55: =AA!AG55+'A-hetero'!AG55+'a-homo'!AG55 -> 10 | AH55: =AA!AH55+'A-hetero'!AH55+'a-homo'!AH55 -> 10 | AI55: =AA!AI55+'A-hetero'!AI55+'a-homo'!AI55 -> 10 | AJ55: =AA!AJ55+'A-hetero'!AJ55+'a-homo'!AJ55 -> 10 | AK55: =AA!AK55+'A-hetero'!AK55+'a-homo'!AK55 -> 305 | AL55: =AA!AL55+'A-hetero'!AL55+'a-homo'!AL55 -> 37 | AM55: =AA!AM55+'A-hetero'!AM55+'a-homo'!AM55 -> 10 | AN55: =AA!AN55+'A-hetero'!AN55+'a-homo'!AN55 -> 10 | AO55: =AA!AO55+'A-hetero'!AO55+'a-homo'!AO55 -> 10 | AP55: =AA!AP55+'A-hetero'!AP55+'a-homo'!AP55 -> 10 | AQ55: =AA!AQ55+'A-hetero'!AQ55+'a-homo'!AQ55 -> 10 | AR55: =AA!AR55+'A-hetero'!AR55+'a-homo'!AR55 -> 10 | AS55: =SUM(AC55:AJ55) -> 856 | AT55: =AA!AT55+'A-hetero'!AT55+'a-homo'!AT55 -> 367.21316201942852 | AU55: =AA!AU55+'A-hetero'!AU55+'a-homo'!AU55 -> 512.17525826515077 | AV55: =AA!AV55+'A-hetero'!AV55+'a-homo'!AV55 -> 27.054260117363931 | AW55: =AA!AW55+'A-hetero'!AW55+'a-homo'!AW55 -> 18.41695140643116 | AX55: =AA!AX55+'A-hetero'!AX55+'a-homo'!AX55 -> 27.431144240319192 | AY55: =AA!AY55+'A-hetero'!AY55+'a-homo'!AY55 -> 18.372845383895328 | AZ55: =AA!AZ55+'A-hetero'!AZ55+'a-homo'!AZ55 -> 27.724792605793048 | BA55: =AA!BA55+'A-hetero'!BA55+'a-homo'!BA55 -> 48.61158596161799 | BB55: =AA!BB55+'A-hetero'!BB55+'a-homo'!BB55 -> 346.66905895500651 | BC55: =AA!BC55+'A-hetero'!BC55+'a-homo'!BC55 -> 43.486444520766668 | BD55: =AA!BD55+'A-hetero'!BD55+'a-homo'!BD55 -> 21.887924467250855 | BE55: =AA!BE55+'A-hetero'!BE55+'a-homo'!BE55 -> 34.096940248601527 | BF55: =AA!BF55+'A-hetero'!BF55+'a-homo'!BF55 -> 18.981021456457906 | BG55: =AA!BG55+'A-hetero'!BG55+'a-homo'!BG55 -> 27.671065158975054 | BH55: =AA!BH55+'A-hetero'!BH55+'a-homo'!BH55 -> 55.038636138380056 | BI55: =AA!BI55+'A-hetero'!BI55+'a-homo'!BI55 -> 47.168909054561439 | BJ55: =SUM(AT55:BI55) -> 1642 | BK55: =AT55/BJ55 -> 0.22363773570001738 | BL55: =AU55/BJ55 -> 0.31192159455855711 | BM55: =AV55/BJ55 -> 1.6476406892426267E-2 | BN55: =AW55/BJ55 -> 1.1216170162260146E-2 | BO55: =AX55/BJ55 -> 1.6705934372910593E-2 | BP55: =AY55/BJ55 -> 1.1189309003590334E-2 | BQ55: =AZ55/BJ55 -> 1.6884770161871527E-2 | BR55: =BA55/BJ55 -> 2.9605107162982942E-2 | BS55: =BB55/BJ55 -> 0.21112610167783588 | BT55: =BC55/BJ55 -> 2.6483827357348763E-2 | BU55: =BD55/BJ55 -> 1.3330039261419522E-2 | BV55: =BE55/BJ55 -> 2.0765493452254279E-2 | BW55: =BF55/BJ55 -> 1.1559696380303231E-2 | BX55: =BG55/BJ55 -> 1.6852049426903201E-2 | BY55: =BH55/BJ55 -> 3.3519266832143763E-2 | BZ55: =BI55/BJ55 -> 2.8726497597175053E-2 | CA55: =SUM(BK55:BZ55) -> 1
AC56: =AA!AC56+'A-hetero'!AC56+'a-homo'!AC56 -> 334 | AD56: =AA!AD56+'A-hetero'!AD56+'a-homo'!AD56 -> 463 | AE56: =AA!AE56+'A-hetero'!AE56+'a-homo'!AE56 -> 10 | AF56: =AA!AF56+'A-hetero'!AF56+'a-homo'!AF56 -> 9 | AG56: =AA!AG56+'A-hetero'!AG56+'a-homo'!AG56 -> 10 | AH56: =AA!AH56+'A-hetero'!AH56+'a-homo'!AH56 -> 10 | AI56: =AA!AI56+'A-hetero'!AI56+'a-homo'!AI56 -> 10 | AJ56: =AA!AJ56+'A-hetero'!AJ56+'a-homo'!AJ56 -> 10 | AK56: =AA!AK56+'A-hetero'!AK56+'a-homo'!AK56 -> 305 | AL56: =AA!AL56+'A-hetero'!AL56+'a-homo'!AL56 -> 37 | AM56: =AA!AM56+'A-hetero'!AM56+'a-homo'!AM56 -> 10 | AN56: =AA!AN56+'A-hetero'!AN56+'a-homo'!AN56 -> 10 | AO56: =AA!AO56+'A-hetero'!AO56+'a-homo'!AO56 -> 10 | AP56: =AA!AP56+'A-hetero'!AP56+'a-homo'!AP56 -> 10 | AQ56: =AA!AQ56+'A-hetero'!AQ56+'a-homo'!AQ56 -> 10 | AR56: =AA!AR56+'A-hetero'!AR56+'a-homo'!AR56 -> 10 | AS56: =SUM(AC56:AJ56) -> 856 | AT56: =AA!AT56+'A-hetero'!AT56+'a-homo'!AT56 -> 367.21316197122519 | AU56: =AA!AU56+'A-hetero'!AU56+'a-homo'!AU56 -> 512.17525829377848 | AV56: =AA!AV56+'A-hetero'!AV56+'a-homo'!AV56 -> 27.05426013833091 | AW56: =AA!AW56+'A-hetero'!AW56+'a-homo'!AW56 -> 18.416951382650325 | AX56: =AA!AX56+'A-hetero'!AX56+'a-homo'!AX56 -> 27.431144258273306 | AY56: =AA!AY56+'A-hetero'!AY56+'a-homo'!AY56 -> 18.372845363944048 | AZ56: =AA!AZ56+'A-hetero'!AZ56+'a-homo'!AZ56 -> 27.724792564174813 | BA56: =AA!BA56+'A-hetero'!BA56+'a-homo'!BA56 -> 48.611586027622934 | BB56: =AA!BB56+'A-hetero'!BB56+'a-homo'!BB56 -> 346.66905897252281 | BC56: =AA!BC56+'A-hetero'!BC56+'a-homo'!BC56 -> 43.486444515024324 | BD56: =AA!BD56+'A-hetero'!BD56+'a-homo'!BD56 -> 21.887924441492313 | BE56: =AA!BE56+'A-hetero'!BE56+'a-homo'!BE56 -> 34.096940284975602 | BF56: =AA!BF56+'A-hetero'!BF56+'a-homo'!BF56 -> 18.981021435017496 | BG56: =AA!BG56+'A-hetero'!BG56+'a-homo'!BG56 -> 27.671065190214303 | BH56: =AA!BH56+'A-hetero'!BH56+'a-homo'!BH56 -> 55.038636218963148 | BI56: =AA!BI56+'A-hetero'!BI56+'a-homo'!BI56 -> 47.168908941789944 | BJ56: =SUM(AT56:BI56) -> 1642 | BK56: =AT56/BJ56 -> 0.22363773567066092 | BL56: =AU56/BJ56 -> 0.31192159457599183 | BM56: =AV56/BJ56 -> 1.6476406905195442E-2 | BN56: =AW56/BJ56 -> 1.12161701477773E-2 | BO56: =AX56/BJ56 -> 1.6705934383844892E-2 | BP56: =AY56/BJ56 -> 1.1189308991439738E-2 | BQ56: =AZ56/BJ56 -> 1.6884770136525468E-2 | BR56: =BA56/BJ56 -> 2.9605107203180842E-2 | BS56: =BB56/BJ56 -> 0.21112610168850357 | BT56: =BC56/BJ56 -> 2.6483827353851602E-2 | BU56: =BD56/BJ56 -> 1.3330039245732226E-2 | BV56: =BE56/BJ56 -> 2.0765493474406583E-2 | BW56: =BF56/BJ56 -> 1.1559696367245737E-2 | BX56: =BG56/BJ56 -> 1.6852049445928323E-2 | BY56: =BH56/BJ56 -> 3.351926688121995E-2 | BZ56: =BI56/BJ56 -> 2.8726497528495706E-2 | CA56: =SUM(BK56:BZ56) -> 1
AC57: =AA!AC57+'A-hetero'!AC57+'a-homo'!AC57 -> 334 | AD57: =AA!AD57+'A-hetero'!AD57+'a-homo'!AD57 -> 463 | AE57: =AA!AE57+'A-hetero'!AE57+'a-homo'!AE57 -> 10 | AF57: =AA!AF57+'A-hetero'!AF57+'a-homo'!AF57 -> 9 | AG57: =AA!AG57+'A-hetero'!AG57+'a-homo'!AG57 -> 10 | AH57: =AA!AH57+'A-hetero'!AH57+'a-homo'!AH57 -> 10 | AI57: =AA!AI57+'A-hetero'!AI57+'a-homo'!AI57 -> 10 | AJ57: =AA!AJ57+'A-hetero'!AJ57+'a-homo'!AJ57 -> 10 | AK57: =AA!AK57+'A-hetero'!AK57+'a-homo'!AK57 -> 305 | AL57: =AA!AL57+'A-hetero'!AL57+'a-homo'!AL57 -> 37 | AM57: =AA!AM57+'A-hetero'!AM57+'a-homo'!AM57 -> 10 | AN57: =AA!AN57+'A-hetero'!AN57+'a-homo'!AN57 -> 10 | AO57: =AA!AO57+'A-hetero'!AO57+'a-homo'!AO57 -> 10 | AP57: =AA!AP57+'A-hetero'!AP57+'a-homo'!AP57 -> 10 | AQ57: =AA!AQ57+'A-hetero'!AQ57+'a-homo'!AQ57 -> 10 | AR57: =AA!AR57+'A-hetero'!AR57+'a-homo'!AR57 -> 10 | AS57: =SUM(AC57:AJ57) -> 856 | AT57: =AA!AT57+'A-hetero'!AT57+'a-homo'!AT57 -> 367.21316193673681 | AU57: =AA!AU57+'A-hetero'!AU57+'a-homo'!AU57 -> 512.1752583142636 | AV57: =AA!AV57+'A-hetero'!AV57+'a-homo'!AV57 -> 27.05426015333007 | AW57: =AA!AW57+'A-hetero'!AW57+'a-homo'!AW57 -> 18.41695136563883 | AX57: =AA!AX57+'A-hetero'!AX57+'a-homo'!AX57 -> 27.431144271117198 | AY57: =AA!AY57+'A-hetero'!AY57+'a-homo'!AY57 -> 18.372845349671806 | AZ57: =AA!AZ57+'A-hetero'!AZ57+'a-homo'!AZ57 -> 27.724792534401153 | BA57: =AA!BA57+'A-hetero'!BA57+'a-homo'!BA57 -> 48.611586074840446 | BB57: =AA!BB57+'A-hetero'!BB57+'a-homo'!BB57 -> 346.6690589850524 | BC57: =AA!BC57+'A-hetero'!BC57+'a-homo'!BC57 -> 43.486444510916229 | BD57: =AA!BD57+'A-hetero'!BD57+'a-homo'!BD57 -> 21.887924423062856 | BE57: =AA!BE57+'A-hetero'!BE57+'a-homo'!BE57 -> 34.096940310999088 | BF57: =AA!BF57+'A-hetero'!BF57+'a-homo'!BF57 -> 18.981021419677433 | BG57: =AA!BG57+'A-hetero'!BG57+'a-homo'!BG57 -> 27.671065212564411 | BH57: =AA!BH57+'A-hetero'!BH57+'a-homo'!BH57 -> 55.038636276622043 | BI57: =AA!BI57+'A-hetero'!BI57+'a-homo'!BI57 -> 47.168908861105521 | BJ57: =SUM(AT57:BI57) -> 1642 | BK57: =AT57/BJ57 -> 0.22363773564965697 | BL57: =AU57/BJ57 -> 0.31192159458846741 | BM57: =AV57/BJ57 -> 1.6476406914330124E-2 | BN57: =AW57/BJ57 -> 1.121617013741707E-2 | BO57: =AX57/BJ57 -> 1.6705934391666989E-2 | BP57: =AY57/BJ57 -> 1.1189308982747748E-2 | BQ57: =AZ57/BJ57 -> 1.6884770118392903E-2 | BR57: =BA57/BJ57 -> 2.960510723193693E-2 | BS57: =BB57/BJ57 -> 0.21112610169613419 | BT57: =BC57/BJ57 -> 2.6483827351349711E-2 | BU57: =BD57/BJ57 -> 1.3330039234508437E-2 | BV57: =BE57/BJ57 -> 2.0765493490255228E-2 | BW57: =BF57/BJ57 -> 1.1559696357903429E-2 | BX57: =BG57/BJ57 -> 1.6852049459539834E-2 | BY57: =BH57/BJ57 -> 3.3519266916334979E-2 | BZ57: =BI57/BJ57 -> 2.8726497479357804E-2 | CA57: =SUM(BK57:BZ57) -> 1
AC58: =AA!AC58+'A-hetero'!AC58+'a-homo'!AC58 -> 334 | AD58: =AA!AD58+'A-hetero'!AD58+'a-homo'!AD58 -> 463 | AE58: =AA!AE58+'A-hetero'!AE58+'a-homo'!AE58 -> 10 | AF58: =AA!AF58+'A-hetero'!AF58+'a-homo'!AF58 -> 9 | AG58: =AA!AG58+'A-hetero'!AG58+'a-homo'!AG58 -> 10 | AH58: =AA!AH58+'A-hetero'!AH58+'a-homo'!AH58 -> 10 | AI58: =AA!AI58+'A-hetero'!AI58+'a-homo'!AI58 -> 10 | AJ58: =AA!AJ58+'A-hetero'!AJ58+'a-homo'!AJ58 -> 10 | AK58: =AA!AK58+'A-hetero'!AK58+'a-homo'!AK58 -> 305 | AL58: =AA!AL58+'A-hetero'!AL58+'a-homo'!AL58 -> 37 | AM58: =AA!AM58+'A-hetero'!AM58+'a-homo'!AM58 -> 10 | AN58: =AA!AN58+'A-hetero'!AN58+'a-homo'!AN58 -> 10 | AO58: =AA!AO58+'A-hetero'!AO58+'a-homo'!AO58 -> 10 | AP58: =AA!AP58+'A-hetero'!AP58+'a-homo'!AP58 -> 10 | AQ58: =AA!AQ58+'A-hetero'!AQ58+'a-homo'!AQ58 -> 10 | AR58: =AA!AR58+'A-hetero'!AR58+'a-homo'!AR58 -> 10 | AS58: =SUM(AC58:AJ58) -> 856 | AT58: =AA!AT58+'A-hetero'!AT58+'a-homo'!AT58 -> 367.21316191206142 | AU58: =AA!AU58+'A-hetero'!AU58+'a-homo'!AU58 -> 512.17525832892193 | AV58: =AA!AV58+'A-hetero'!AV58+'a-homo'!AV58 -> 27.054260164060167 | AW58: =AA!AW58+'A-hetero'!AW58+'a-homo'!AW58 -> 18.416951353469543 | AX58: =AA!AX58+'A-hetero'!AX58+'a-homo'!AX58 -> 27.431144280305482 | AY58: =AA!AY58+'A-hetero'!AY58+'a-homo'!AY58 -> 18.372845339461932 | AZ58: =AA!AZ58+'A-hetero'!AZ58+'a-homo'!AZ58 -> 27.72479251310094 | BA58: =AA!BA58+'A-hetero'!BA58+'a-homo'!BA58 -> 48.61158610861856 | BB58: =AA!BB58+'A-hetero'!BB58+'a-homo'!BB58 -> 346.66905899401513 | BC58: =AA!BC58+'A-hetero'!BC58+'a-homo'!BC58 -> 43.486444507977261 | BD58: =AA!BD58+'A-hetero'!BD58+'a-homo'!BD58 -> 21.887924409877193 | BE58: =AA!BE58+'A-hetero'!BE58+'a-homo'!BE58 -> 34.096940329617347 | BF58: =AA!BF58+'A-hetero'!BF58+'a-homo'!BF58 -> 18.981021408702063 | BG58: =AA!BG58+'A-hetero'!BG58+'a-homo'!BG58 -> 27.671065228554767 | BH58: =AA!BH58+'A-hetero'!BH58+'a-homo'!BH58 -> 55.038636317877646 | BI58: =AA!BI58+'A-hetero'!BI58+'a-homo'!BI58 -> 47.168908803378613 | BJ58: =SUM(AT58:BI58) -> 1642 | BK58: =AT58/BJ58 -> 0.22363773563462938 | BL58: =AU58/BJ58 -> 0.3119215945973946 | BM58: =AV58/BJ58 -> 1.6476406920864901E-2 | BN58: =AW58/BJ58 -> 1.1216170130005811E-2 | BO58: =AX58/BJ58 -> 1.6705934397262777E-2 | BP58: =AY58/BJ58 -> 1.11893089765298E-2 | BQ58: =AZ58/BJ58 -> 1.688477010542079E-2 | BR58: =BA58/BJ58 -> 2.9605107252508259E-2 | BS58: =BB58/BJ58 -> 0.21112610170159266 | BT58: =BC58/BJ58 -> 2.6483827349559841E-2 | BU58: =BD58/BJ58 -> 1.3330039226478194E-2 | BV58: =BE58/BJ58 -> 2.0765493501593998E-2 | BW58: =BF58/BJ58 -> 1.1559696351219282E-2 | BX58: =BG58/BJ58 -> 1.6852049469278176E-2 | BY58: =BH58/BJ58 -> 3.35192669414602E-2 | BZ58: =BI58/BJ58 -> 2.8726497444201349E-2 | CA58: =SUM(BK58:BZ58) -> 1
AC59: =AA!AC59+'A-hetero'!AC59+'a-homo'!AC59 -> 334 | AD59: =AA!AD59+'A-hetero'!AD59+'a-homo'!AD59 -> 463 | AE59: =AA!AE59+'A-hetero'!AE59+'a-homo'!AE59 -> 10 | AF59: =AA!AF59+'A-hetero'!AF59+'a-homo'!AF59 -> 9 | AG59: =AA!AG59+'A-hetero'!AG59+'a-homo'!AG59 -> 10 | AH59: =AA!AH59+'A-hetero'!AH59+'a-homo'!AH59 -> 10 | AI59: =AA!AI59+'A-hetero'!AI59+'a-homo'!AI59 -> 10 | AJ59: =AA!AJ59+'A-hetero'!AJ59+'a-homo'!AJ59 -> 10 | AK59: =AA!AK59+'A-hetero'!AK59+'a-homo'!AK59 -> 305 | AL59: =AA!AL59+'A-hetero'!AL59+'a-homo'!AL59 -> 37 | AM59: =AA!AM59+'A-hetero'!AM59+'a-homo'!AM59 -> 10 | AN59: =AA!AN59+'A-hetero'!AN59+'a-homo'!AN59 -> 10 | AO59: =AA!AO59+'A-hetero'!AO59+'a-homo'!AO59 -> 10 | AP59: =AA!AP59+'A-hetero'!AP59+'a-homo'!AP59 -> 10 | AQ59: =AA!AQ59+'A-hetero'!AQ59+'a-homo'!AQ59 -> 10 | AR59: =AA!AR59+'A-hetero'!AR59+'a-homo'!AR59 -> 10 | AS59: =SUM(AC59:AJ59) -> 856 | AT59: =AA!AT59+'A-hetero'!AT59+'a-homo'!AT59 -> 367.21316189440688 | AU59: =AA!AU59+'A-hetero'!AU59+'a-homo'!AU59 -> 512.17525833941068 | AV59: =AA!AV59+'A-hetero'!AV59+'a-homo'!AV59 -> 27.054260171736345 | AW59: =AA!AW59+'A-hetero'!AW59+'a-homo'!AW59 -> 18.416951344764026 | AX59: =AA!AX59+'A-hetero'!AX59+'a-homo'!AX59 -> 27.431144286878688 | AY59: =AA!AY59+'A-hetero'!AY59+'a-homo'!AY59 -> 18.372845332158043 | AZ59: =AA!AZ59+'A-hetero'!AZ59+'a-homo'!AZ59 -> 27.724792497862566 | BA59: =AA!BA59+'A-hetero'!BA59+'a-homo'!BA59 -> 48.611586132782783 | BB59: =AA!BB59+'A-hetero'!BB59+'a-homo'!BB59 -> 346.6690590004265 | BC59: =AA!BC59+'A-hetero'!BC59+'a-homo'!BC59 -> 43.48644450587468 | BD59: =AA!BD59+'A-hetero'!BD59+'a-homo'!BD59 -> 21.887924400443303 | BE59: =AA!BE59+'A-hetero'!BE59+'a-homo'!BE59 -> 34.096940342937614 | BF59: =AA!BF59+'A-hetero'!BF59+'a-homo'!BF59 -> 18.981021400849528 | BG59: =AA!BG59+'A-hetero'!BG59+'a-homo'!BG59 -> 27.671065239995038 | BH59: =AA!BH59+'A-hetero'!BH59+'a-homo'!BH59 -> 55.038636347396185 | BI59: =AA!BI59+'A-hetero'!BI59+'a-homo'!BI59 -> 47.168908762077159 | BJ59: =SUM(AT59:BI59) -> 1642 | BK59: =AT59/BJ59 -> 0.22363773562387751 | BL59: =AU59/BJ59 -> 0.31192159460378238 | BM59: =AV59/BJ59 -> 1.6476406925539797E-2 | BN59: =AW59/BJ59 -> 1.1216170124704036E-2 | BO59: =AX59/BJ59 -> 1.670593440126595E-2 | BP59: =AY59/BJ59 -> 1.1189308972081634E-2 | BQ59: =AZ59/BJ59 -> 1.6884770096140419E-2 | BR59: =BA59/BJ59 -> 2.9605107267224595E-2 | BS59: =BB59/BJ59 -> 0.21112610170549725 | BT59: =BC59/BJ59 -> 2.6483827348279341E-2 | BU59: =BD59/BJ59 -> 1.3330039220732828E-2 | BV59: =BE59/BJ59 -> 2.0765493509706221E-2 | BW59: =BF59/BJ59 -> 1.1559696346436985E-2 | BX59: =BG59/BJ59 -> 1.6852049476245454E-2 | BY59: =BH59/BJ59 -> 3.3519266959437383E-2 | BZ59: =BI59/BJ59 -> 2.8726497419048209E-2 | CA59: =SUM(BK59:BZ59) -> 1
AC60: =AA!AC60+'A-hetero'!AC60+'a-homo'!AC60 -> 334 | AD60: =AA!AD60+'A-hetero'!AD60+'a-homo'!AD60 -> 463 | AE60: =AA!AE60+'A-hetero'!AE60+'a-homo'!AE60 -> 10 | AF60: =AA!AF60+'A-hetero'!AF60+'a-homo'!AF60 -> 9 | AG60: =AA!AG60+'A-hetero'!AG60+'a-homo'!AG60 -> 10 | AH60: =AA!AH60+'A-hetero'!AH60+'a-homo'!AH60 -> 10 | AI60: =AA!AI60+'A-hetero'!AI60+'a-homo'!AI60 -> 10 | AJ60: =AA!AJ60+'A-hetero'!AJ60+'a-homo'!AJ60 -> 10 | AK60: =AA!AK60+'A-hetero'!AK60+'a-homo'!AK60 -> 305 | AL60: =AA!AL60+'A-hetero'!AL60+'a-homo'!AL60 -> 37 | AM60: =AA!AM60+'A-hetero'!AM60+'a-homo'!AM60 -> 10 | AN60: =AA!AN60+'A-hetero'!AN60+'a-homo'!AN60 -> 10 | AO60: =AA!AO60+'A-hetero'!AO60+'a-homo'!AO60 -> 10 | AP60: =AA!AP60+'A-hetero'!AP60+'a-homo'!AP60 -> 10 | AQ60: =AA!AQ60+'A-hetero'!AQ60+'a-homo'!AQ60 -> 10 | AR60: =AA!AR60+'A-hetero'!AR60+'a-homo'!AR60 -> 10 | AS60: =SUM(AC60:AJ60) -> 856 | AT60: =AA!AT60+'A-hetero'!AT60+'a-homo'!AT60 -> 367.2131618817757 | AU60: =AA!AU60+'A-hetero'!AU60+'a-homo'!AU60 -> 512.17525834691571 | AV60: =AA!AV60+'A-hetero'!AV60+'a-homo'!AV60 -> 27.054260177227846 | AW60: =AA!AW60+'A-hetero'!AW60+'a-homo'!AW60 -> 18.416951338536304 | AX60: =AA!AX60+'A-hetero'!AX60+'a-homo'!AX60 -> 27.431144291581134 | AY60: =AA!AY60+'A-hetero'!AY60+'a-homo'!AY60 -> 18.372845326932964 | AZ60: =AA!AZ60+'A-hetero'!AZ60+'a-homo'!AZ60 -> 27.724792486960823 | BA60: =AA!BA60+'A-hetero'!BA60+'a-homo'!BA60 -> 48.611586150069598 | BB60: =AA!BB60+'A-hetero'!BB60+'a-homo'!BB60 -> 346.66905900501285 | BC60: =AA!BC60+'A-hetero'!BC60+'a-homo'!BC60 -> 43.486444504370461 | BD60: =AA!BD60+'A-hetero'!BD60+'a-homo'!BD60 -> 21.887924393693723 | BE60: =AA!BE60+'A-hetero'!BE60+'a-homo'!BE60 -> 34.096940352467499 | BF60: =AA!BF60+'A-hetero'!BF60+'a-homo'!BF60 -> 18.981021395231316 | BG60: =AA!BG60+'A-hetero'!BG60+'a-homo'!BG60 -> 27.671065248179957 | BH60: =AA!BH60+'A-hetero'!BH60+'a-homo'!BH60 -> 55.03863636851662 | BI60: =AA!BI60+'A-hetero'!BI60+'a-homo'!BI60 -> 47.168908732527612 | BJ60: =SUM(AT60:BI60) -> 1642 | BK60: =AT60/BJ60 -> 0.22363773561618497 | BL60: =AU60/BJ60 -> 0.31192159460835306 | BM60: =AV60/BJ60 -> 1.6476406928884194E-2 | BN60: =AW60/BJ60 -> 1.121617012091127E-2 | BO60: =AX60/BJ60 -> 1.6705934404129801E-2 | BP60: =AY60/BJ60 -> 1.118930896889949E-2 | BQ60: =AZ60/BJ60 -> 1.6884770089501112E-2 | BR60: =BA60/BJ60 -> 2.9605107277752497E-2 | BS60: =BB60/BJ60 -> 0.21112610170829041 | BT60: =BC60/BJ60 -> 2.6483827347363254E-2 | BU60: =BD60/BJ60 -> 1.3330039216622243E-2 | BV60: =BE60/BJ60 -> 2.0765493515510047E-2 | BW60: =BF60/BJ60 -> 1.1559696343015418E-2 | BX60: =BG60/BJ60 -> 1.6852049481230182E-2 | BY60: =BH60/BJ60 -> 3.351926697230001E-2 | BZ60: =BI60/BJ60 -> 2.872649740105214E-2 | CA60: =SUM(BK60:BZ60) -> 1
AC61: =AA!AC61+'A-hetero'!AC61+'a-homo'!AC61 -> 334 | AD61: =AA!AD61+'A-hetero'!AD61+'a-homo'!AD61 -> 463 | AE61: =AA!AE61+'A-hetero'!AE61+'a-homo'!AE61 -> 10 | AF61: =AA!AF61+'A-hetero'!AF61+'a-homo'!AF61 -> 9 | AG61: =AA!AG61+'A-hetero'!AG61+'a-homo'!AG61 -> 10 | AH61: =AA!AH61+'A-hetero'!AH61+'a-homo'!AH61 -> 10 | AI61: =AA!AI61+'A-hetero'!AI61+'a-homo'!AI61 -> 10 | AJ61: =AA!AJ61+'A-hetero'!AJ61+'a-homo'!AJ61 -> 10 | AK61: =AA!AK61+'A-hetero'!AK61+'a-homo'!AK61 -> 305 | AL61: =AA!AL61+'A-hetero'!AL61+'a-homo'!AL61 -> 37 | AM61: =AA!AM61+'A-hetero'!AM61+'a-homo'!AM61 -> 10 | AN61: =AA!AN61+'A-hetero'!AN61+'a-homo'!AN61 -> 10 | AO61: =AA!AO61+'A-hetero'!AO61+'a-homo'!AO61 -> 10 | AP61: =AA!AP61+'A-hetero'!AP61+'a-homo'!AP61 -> 10 | AQ61: =AA!AQ61+'A-hetero'!AQ61+'a-homo'!AQ61 -> 10 | AR61: =AA!AR61+'A-hetero'!AR61+'a-homo'!AR61 -> 10 | AS61: =SUM(AC61:AJ61) -> 856 | AT61: =AA!AT61+'A-hetero'!AT61+'a-homo'!AT61 -> 367.21316187273862 | AU61: =AA!AU61+'A-hetero'!AU61+'a-homo'!AU61 -> 512.1752583522856 | AV61: =AA!AV61+'A-hetero'!AV61+'a-homo'!AV61 -> 27.054260181156472 | AW61: =AA!AW61+'A-hetero'!AW61+'a-homo'!AW61 -> 18.416951334081084 | AX61: =AA!AX61+'A-hetero'!AX61+'a-homo'!AX61 -> 27.43114429494527 | AY61: =AA!AY61+'A-hetero'!AY61+'a-homo'!AY61 -> 18.372845323194994 | AZ61: =AA!AZ61+'A-hetero'!AZ61+'a-homo'!AZ61 -> 27.724792479161525 | BA61: =AA!BA61+'A-hetero'!BA61+'a-homo'!BA61 -> 48.611586162436488 | BB61: =AA!BB61+'A-hetero'!BB61+'a-homo'!BB61 -> 346.66905900829374 | BC61: =AA!BC61+'A-hetero'!BC61+'a-homo'!BC61 -> 43.486444503294322 | BD61: =AA!BD61+'A-hetero'!BD61+'a-homo'!BD61 -> 21.887924388864658 | BE61: =AA!BE61+'A-hetero'!BE61+'a-homo'!BE61 -> 34.096940359285583 | BF61: =AA!BF61+'A-hetero'!BF61+'a-homo'!BF61 -> 18.981021391211691 | BG61: =AA!BG61+'A-hetero'!BG61+'a-homo'!BG61 -> 27.671065254035838 | BH61: =AA!BH61+'A-hetero'!BH61+'a-homo'!BH61 -> 55.038636383628074 | BI61: =AA!BI61+'A-hetero'!BI61+'a-homo'!BI61 -> 47.168908711386109 | BJ61: =SUM(AT61:BI61) -> 1642 | BK61: =AT61/BJ61 -> 0.22363773561068129 | BL61: =AU61/BJ61 -> 0.31192159461162344 | BM61: =AV61/BJ61 -> 1.647640693127678E-2 | BN61: =AW61/BJ61 -> 1.1216170118197982E-2 | BO61: =AX61/BJ61 -> 1.6705934406178607E-2 | BP61: =AY61/BJ61 -> 1.1189308966623018E-2 | BQ61: =AZ61/BJ61 -> 1.6884770084751234E-2 | BR61: =BA61/BJ61 -> 2.96051072852841E-2 | BS61: =BB61/BJ61 -> 0.21112610171028853 | BT61: =BC61/BJ61 -> 2.6483827346707872E-2 | BU61: =BD61/BJ61 -> 1.3330039213681279E-2 | BV61: =BE61/BJ61 -> 2.0765493519662354E-2 | BW61: =BF61/BJ61 -> 1.1559696340567414E-2 | BX61: =BG61/BJ61 -> 1.6852049484796492E-2 | BY61: =BH61/BJ61 -> 3.3519266981503093E-2 | BZ61: =BI61/BJ61 -> 2.8726497388176685E-2 | CA61: =SUM(BK61:BZ61) -> 1
AC62: =AA!AC62+'A-hetero'!AC62+'a-homo'!AC62 -> 334 | AD62: =AA!AD62+'A-hetero'!AD62+'a-homo'!AD62 -> 463 | AE62: =AA!AE62+'A-hetero'!AE62+'a-homo'!AE62 -> 10 | AF62: =AA!AF62+'A-hetero'!AF62+'a-homo'!AF62 -> 9 | AG62: =AA!AG62+'A-hetero'!AG62+'a-homo'!AG62 -> 10 | AH62: =AA!AH62+'A-hetero'!AH62+'a-homo'!AH62 -> 10 | AI62: =AA!AI62+'A-hetero'!AI62+'a-homo'!AI62 -> 10 | AJ62: =AA!AJ62+'A-hetero'!AJ62+'a-homo'!AJ62 -> 10 | AK62: =AA!AK62+'A-hetero'!AK62+'a-homo'!AK62 -> 305 | AL62: =AA!AL62+'A-hetero'!AL62+'a-homo'!AL62 -> 37 | AM62: =AA!AM62+'A-hetero'!AM62+'a-homo'!AM62 -> 10 | AN62: =AA!AN62+'A-hetero'!AN62+'a-homo'!AN62 -> 10 | AO62: =AA!AO62+'A-hetero'!AO62+'a-homo'!AO62 -> 10 | AP62: =AA!AP62+'A-hetero'!AP62+'a-homo'!AP62 -> 10 | AQ62: =AA!AQ62+'A-hetero'!AQ62+'a-homo'!AQ62 -> 10 | AR62: =AA!AR62+'A-hetero'!AR62+'a-homo'!AR62 -> 10 | AS62: =SUM(AC62:AJ62) -> 856 | AT62: =AA!AT62+'A-hetero'!AT62+'a-homo'!AT62 -> 367.21316186627286 | AU62: =AA!AU62+'A-hetero'!AU62+'a-homo'!AU62 -> 512.17525835612787 | AV62: =AA!AV62+'A-hetero'!AV62+'a-homo'!AV62 -> 27.054260183967031 | AW62: =AA!AW62+'A-hetero'!AW62+'a-homo'!AW62 -> 18.416951330893855 | AX62: =AA!AX62+'A-hetero'!AX62+'a-homo'!AX62 -> 27.431144297351999 | AY62: =AA!AY62+'A-hetero'!AY62+'a-homo'!AY62 -> 18.37284532052086 | AZ62: =AA!AZ62+'A-hetero'!AZ62+'a-homo'!AZ62 -> 27.724792473581754 | BA62: =AA!BA62+'A-hetero'!BA62+'a-homo'!BA62 -> 48.611586171283776 | BB62: =AA!BB62+'A-hetero'!BB62+'a-homo'!BB62 -> 346.66905901064081 | BC62: =AA!BC62+'A-hetero'!BC62+'a-homo'!BC62 -> 43.486444502524414 | BD62: =AA!BD62+'A-hetero'!BD62+'a-homo'!BD62 -> 21.887924385409658 | BE62: =AA!BE62+'A-hetero'!BE62+'a-homo'!BE62 -> 34.09694036416353 | BF62: =AA!BF62+'A-hetero'!BF62+'a-homo'!BF62 -> 18.981021388335805 | BG62: =AA!BG62+'A-hetero'!BG62+'a-homo'!BG62 -> 27.671065258225404 | BH62: =AA!BH62+'A-hetero'!BH62+'a-homo'!BH62 -> 55.038636394440104 | BI62: =AA!BI62+'A-hetero'!BI62+'a-homo'!BI62 -> 47.168908696260289 | BJ62: =SUM(AT62:BI62) -> 1642 | BK62: =AT62/BJ62 -> 0.22363773560674349 | BL62: =AU62/BJ62 -> 0.31192159461396335 | BM62: =AV62/BJ62 -> 1.6476406932988446E-2 | BN62: =AW62/BJ62 -> 1.1216170116256915E-2 | BO62: =AX62/BJ62 -> 1.6705934407644334E-2 | BP62: =AY62/BJ62 -> 1.1189308964994432E-2 | BQ62: =AZ62/BJ62 -> 1.6884770081353077E-2 | BR62: =BA62/BJ62 -> 2.9605107290672211E-2 | BS62: =BB62/BJ62 -> 0.21112610171171789 | BT62: =BC62/BJ62 -> 2.648382734623898E-2 | BU62: =BD62/BJ62 -> 1.3330039211577134E-2 | BV62: =BE62/BJ62 -> 2.0765493522633086E-2 | BW62: =BF62/BJ62 -> 1.1559696338815957E-2 | BX62: =BG62/BJ62 -> 1.6852049487347989E-2 | BY62: =BH62/BJ62 -> 3.3519266988087756E-2 | BZ62: =BI62/BJ62 -> 2.8726497378964849E-2 | CA62: =SUM(BK62:BZ62) -> 1
AC63: =AA!AC63+'A-hetero'!AC63+'a-homo'!AC63 -> 334 | AD63: =AA!AD63+'A-hetero'!AD63+'a-homo'!AD63 -> 463 | AE63: =AA!AE63+'A-hetero'!AE63+'a-homo'!AE63 -> 10 | AF63: =AA!AF63+'A-hetero'!AF63+'a-homo'!AF63 -> 9 | AG63: =AA!AG63+'A-hetero'!AG63+'a-homo'!AG63 -> 10 | AH63: =AA!AH63+'A-hetero'!AH63+'a-homo'!AH63 -> 10 | AI63: =AA!AI63+'A-hetero'!AI63+'a-homo'!AI63 -> 10 | AJ63: =AA!AJ63+'A-hetero'!AJ63+'a-homo'!AJ63 -> 10 | AK63: =AA!AK63+'A-hetero'!AK63+'a-homo'!AK63 -> 305 | AL63: =AA!AL63+'A-hetero'!AL63+'a-homo'!AL63 -> 37 | AM63: =AA!AM63+'A-hetero'!AM63+'a-homo'!AM63 -> 10 | AN63: =AA!AN63+'A-hetero'!AN63+'a-homo'!AN63 -> 10 | AO63: =AA!AO63+'A-hetero'!AO63+'a-homo'!AO63 -> 10 | AP63: =AA!AP63+'A-hetero'!AP63+'a-homo'!AP63 -> 10 | AQ63: =AA!AQ63+'A-hetero'!AQ63+'a-homo'!AQ63 -> 10 | AR63: =AA!AR63+'A-hetero'!AR63+'a-homo'!AR63 -> 10 | AS63: =SUM(AC63:AJ63) -> 856 | AT63: =AA!AT63+'A-hetero'!AT63+'a-homo'!AT63 -> 367.21316186164694 | AU63: =AA!AU63+'A-hetero'!AU63+'a-homo'!AU63 -> 512.17525835887704 | AV63: =AA!AV63+'A-hetero'!AV63+'a-homo'!AV63 -> 27.054260185977732 | AW63: =AA!AW63+'A-hetero'!AW63+'a-homo'!AW63 -> 18.41695132861372 | AX63: =AA!AX63+'A-hetero'!AX63+'a-homo'!AX63 -> 27.4311442990738 | AY63: =AA!AY63+'A-hetero'!AY63+'a-homo'!AY63 -> 18.37284531860778 | AZ63: =AA!AZ63+'A-hetero'!AZ63+'a-homo'!AZ63 -> 27.724792469589858 | BA63: =AA!BA63+'A-hetero'!BA63+'a-homo'!BA63 -> 48.611586177613177 | BB63: =AA!BB63+'A-hetero'!BB63+'a-homo'!BB63 -> 346.66905901231985 | BC63: =AA!BC63+'A-hetero'!BC63+'a-homo'!BC63 -> 43.486444501973608 | BD63: =AA!BD63+'A-hetero'!BD63+'a-homo'!BD63 -> 21.887924382937754 | BE63: =AA!BE63+'A-hetero'!BE63+'a-homo'!BE63 -> 34.096940367653417 | BF63: =AA!BF63+'A-hetero'!BF63+'a-homo'!BF63 -> 18.981021386278229 | BG63: =AA!BG63+'A-hetero'!BG63+'a-homo'!BG63 -> 27.671065261222822 | BH63: =AA!BH63+'A-hetero'!BH63+'a-homo'!BH63 -> 55.038636402175896 | BI63: =AA!BI63+'A-hetero'!BI63+'a-homo'!BI63 -> 47.168908685438439 | BJ63: =SUM(AT63:BI63) -> 1642 | BK63: =AT63/BJ63 -> 0.22363773560392625 | BL63: =AU63/BJ63 -> 0.31192159461563762 | BM63: =AV63/BJ63 -> 1.6476406934212991E-2 | BN63: =AW63/BJ63 -> 1.1216170114868281E-2 | BO63: =AX63/BJ63 -> 1.6705934408692932E-2 | BP63: =AY63/BJ63 -> 1.1189308963829341E-2 | BQ63: =AZ63/BJ63 -> 1.6884770078921956E-2 | BR63: =BA63/BJ63 -> 2.9605107294526901E-2 | BS63: =BB63/BJ63 -> 0.21112610171274043 | BT63: =BC63/BJ63 -> 2.6483827345903533E-2 | BU63: =BD63/BJ63 -> 1.3330039210071712E-2 | BV63: =BE63/BJ63 -> 2.0765493524758472E-2 | BW63: =BF63/BJ63 -> 1.1559696337562866E-2 | BX63: =BG63/BJ63 -> 1.685204948917346E-2 | BY63: =BH63/BJ63 -> 3.351926699279896E-2 | BZ63: =BI63/BJ63 -> 2.8726497372374198E-2 | CA63: =SUM(BK63:BZ63) -> 1
AC64: =AA!AC64+'A-hetero'!AC64+'a-homo'!AC64 -> 334 | AD64: =AA!AD64+'A-hetero'!AD64+'a-homo'!AD64 -> 463 | AE64: =AA!AE64+'A-hetero'!AE64+'a-homo'!AE64 -> 10 | AF64: =AA!AF64+'A-hetero'!AF64+'a-homo'!AF64 -> 9 | AG64: =AA!AG64+'A-hetero'!AG64+'a-homo'!AG64 -> 10 | AH64: =AA!AH64+'A-hetero'!AH64+'a-homo'!AH64 -> 10 | AI64: =AA!AI64+'A-hetero'!AI64+'a-homo'!AI64 -> 10 | AJ64: =AA!AJ64+'A-hetero'!AJ64+'a-homo'!AJ64 -> 10 | AK64: =AA!AK64+'A-hetero'!AK64+'a-homo'!AK64 -> 305 | AL64: =AA!AL64+'A-hetero'!AL64+'a-homo'!AL64 -> 37 | AM64: =AA!AM64+'A-hetero'!AM64+'a-homo'!AM64 -> 10 | AN64: =AA!AN64+'A-hetero'!AN64+'a-homo'!AN64 -> 10 | AO64: =AA!AO64+'A-hetero'!AO64+'a-homo'!AO64 -> 10 | AP64: =AA!AP64+'A-hetero'!AP64+'a-homo'!AP64 -> 10 | AQ64: =AA!AQ64+'A-hetero'!AQ64+'a-homo'!AQ64 -> 10 | AR64: =AA!AR64+'A-hetero'!AR64+'a-homo'!AR64 -> 10 | AS64: =SUM(AC64:AJ64) -> 856 | AT64: =AA!AT64+'A-hetero'!AT64+'a-homo'!AT64 -> 367.21316185833723 | AU64: =AA!AU64+'A-hetero'!AU64+'a-homo'!AU64 -> 512.17525836084405 | AV64: =AA!AV64+'A-hetero'!AV64+'a-homo'!AV64 -> 27.054260187416222 | AW64: =AA!AW64+'A-hetero'!AW64+'a-homo'!AW64 -> 18.416951326982506 | AX64: =AA!AX64+'A-hetero'!AX64+'a-homo'!AX64 -> 27.431144300305604 | AY64: =AA!AY64+'A-hetero'!AY64+'a-homo'!AY64 -> 18.372845317239147 | AZ64: =AA!AZ64+'A-hetero'!AZ64+'a-homo'!AZ64 -> 27.724792466733945 | BA64: =AA!BA64+'A-hetero'!BA64+'a-homo'!BA64 -> 48.611586182141302 | BB64: =AA!BB64+'A-hetero'!BB64+'a-homo'!BB64 -> 346.66905901352101 | BC64: =AA!BC64+'A-hetero'!BC64+'a-homo'!BC64 -> 43.486444501579534 | BD64: =AA!BD64+'A-hetero'!BD64+'a-homo'!BD64 -> 21.887924381169217 | BE64: =AA!BE64+'A-hetero'!BE64+'a-homo'!BE64 -> 34.096940370150236 | BF64: =AA!BF64+'A-hetero'!BF64+'a-homo'!BF64 -> 18.98102138480612 | BG64: =AA!BG64+'A-hetero'!BG64+'a-homo'!BG64 -> 27.671065263367318 | BH64: =AA!BH64+'A-hetero'!BH64+'a-homo'!BH64 -> 55.038636407710669 | BI64: =AA!BI64+'A-hetero'!BI64+'a-homo'!BI64 -> 47.168908677695903 | BJ64: =SUM(AT64:BI64) -> 1642 | BK64: =AT64/BJ64 -> 0.22363773560191061 | BL64: =AU64/BJ64 -> 0.31192159461683561 | BM64: =AV64/BJ64 -> 1.647640693508905E-2 | BN64: =AW64/BJ64 -> 1.1216170113874852E-2 | BO64: =AX64/BJ64 -> 1.670593440944312E-2 | BP64: =AY64/BJ64 -> 1.1189308962995826E-2 | BQ64: =AZ64/BJ64 -> 1.688477007718267E-2 | BR64: =BA64/BJ64 -> 2.9605107297284595E-2 | BS64: =BB64/BJ64 -> 0.21112610171347199 | BT64: =BC64/BJ64 -> 2.6483827345663541E-2 | BU64: =BD64/BJ64 -> 1.3330039208994652E-2 | BV64: =BE64/BJ64 -> 2.0765493526279072E-2 | BW64: =BF64/BJ64 -> 1.1559696336666333E-2 | BX64: =BG64/BJ64 -> 1.6852049490479488E-2 | BY64: =BH64/BJ64 -> 3.3519266996169715E-2 | BZ64: =BI64/BJ64 -> 2.8726497367658893E-2 | CA64: =SUM(BK64:BZ64) -> 1
AC65: =AA!AC65+'A-hetero'!AC65+'a-homo'!AC65 -> 334 | AD65: =AA!AD65+'A-hetero'!AD65+'a-homo'!AD65 -> 463 | AE65: =AA!AE65+'A-hetero'!AE65+'a-homo'!AE65 -> 10 | AF65: =AA!AF65+'A-hetero'!AF65+'a-homo'!AF65 -> 9 | AG65: =AA!AG65+'A-hetero'!AG65+'a-homo'!AG65 -> 10 | AH65: =AA!AH65+'A-hetero'!AH65+'a-homo'!AH65 -> 10 | AI65: =AA!AI65+'A-hetero'!AI65+'a-homo'!AI65 -> 10 | AJ65: =AA!AJ65+'A-hetero'!AJ65+'a-homo'!AJ65 -> 10 | AK65: =AA!AK65+'A-hetero'!AK65+'a-homo'!AK65 -> 305 | AL65: =AA!AL65+'A-hetero'!AL65+'a-homo'!AL65 -> 37 | AM65: =AA!AM65+'A-hetero'!AM65+'a-homo'!AM65 -> 10 | AN65: =AA!AN65+'A-hetero'!AN65+'a-homo'!AN65 -> 10 | AO65: =AA!AO65+'A-hetero'!AO65+'a-homo'!AO65 -> 10 | AP65: =AA!AP65+'A-hetero'!AP65+'a-homo'!AP65 -> 10 | AQ65: =AA!AQ65+'A-hetero'!AQ65+'a-homo'!AQ65 -> 10 | AR65: =AA!AR65+'A-hetero'!AR65+'a-homo'!AR65 -> 10 | AS65: =SUM(AC65:AJ65) -> 856 | AT65: =AA!AT65+'A-hetero'!AT65+'a-homo'!AT65 -> 367.2131618559693 | AU65: =AA!AU65+'A-hetero'!AU65+'a-homo'!AU65 -> 512.1752583622515 | AV65: =AA!AV65+'A-hetero'!AV65+'a-homo'!AV65 -> 27.054260188445348 | AW65: =AA!AW65+'A-hetero'!AW65+'a-homo'!AW65 -> 18.416951325815518 | AX65: =AA!AX65+'A-hetero'!AX65+'a-homo'!AX65 -> 27.431144301186855 | AY65: =AA!AY65+'A-hetero'!AY65+'a-homo'!AY65 -> 18.372845316260005 | AZ65: =AA!AZ65+'A-hetero'!AZ65+'a-homo'!AZ65 -> 27.724792464690747 | BA65: =AA!BA65+'A-hetero'!BA65+'a-homo'!BA65 -> 48.611586185380773 | BB65: =AA!BB65+'A-hetero'!BB65+'a-homo'!BB65 -> 346.66905901438031 | BC65: =AA!BC65+'A-hetero'!BC65+'a-homo'!BC65 -> 43.486444501297612 | BD65: =AA!BD65+'A-hetero'!BD65+'a-homo'!BD65 -> 21.887924379903907 | BE65: =AA!BE65+'A-hetero'!BE65+'a-homo'!BE65 -> 34.096940371936569 | BF65: =AA!BF65+'A-hetero'!BF65+'a-homo'!BF65 -> 18.981021383752889 | BG65: =AA!BG65+'A-hetero'!BG65+'a-homo'!BG65 -> 27.671065264901586 | BH65: =AA!BH65+'A-hetero'!BH65+'a-homo'!BH65 -> 55.038636411670652 | BI65: =AA!BI65+'A-hetero'!BI65+'a-homo'!BI65 -> 47.168908672156483 | BJ65: =SUM(AT65:BI65) -> 1642 | BK65: =AT65/BJ65 -> 0.22363773560046848 | BL65: =AU65/BJ65 -> 0.3119215946176927 | BM65: =AV65/BJ65 -> 1.6476406935715799E-2 | BN65: =AW65/BJ65 -> 1.1216170113164139E-2 | BO65: =AX65/BJ65 -> 1.6705934409979813E-2 | BP65: =AY65/BJ65 -> 1.1189308962399514E-2 | BQ65: =AZ65/BJ65 -> 1.6884770075938332E-2 | BR65: =BA65/BJ65 -> 2.9605107299257472E-2 | BS65: =BB65/BJ65 -> 0.21112610171399529 | BT65: =BC65/BJ65 -> 2.6483827345491841E-2 | BU65: =BD65/BJ65 -> 1.3330039208224058E-2 | BV65: =BE65/BJ65 -> 2.0765493527366969E-2 | BW65: =BF65/BJ65 -> 1.15596963360249E-2 | BX65: =BG65/BJ65 -> 1.6852049491413876E-2 | BY65: =BH65/BJ65 -> 3.351926699858139E-2 | BZ65: =BI65/BJ65 -> 2.872649736428531E-2 | CA65: =SUM(BK65:BZ65) -> 1
AC66: =AA!AC66+'A-hetero'!AC66+'a-homo'!AC66 -> 334 | AD66: =AA!AD66+'A-hetero'!AD66+'a-homo'!AD66 -> 463 | AE66: =AA!AE66+'A-hetero'!AE66+'a-homo'!AE66 -> 10 | AF66: =AA!AF66+'A-hetero'!AF66+'a-homo'!AF66 -> 9 | AG66: =AA!AG66+'A-hetero'!AG66+'a-homo'!AG66 -> 10 | AH66: =AA!AH66+'A-hetero'!AH66+'a-homo'!AH66 -> 10 | AI66: =AA!AI66+'A-hetero'!AI66+'a-homo'!AI66 -> 10 | AJ66: =AA!AJ66+'A-hetero'!AJ66+'a-homo'!AJ66 -> 10 | AK66: =AA!AK66+'A-hetero'!AK66+'a-homo'!AK66 -> 305 | AL66: =AA!AL66+'A-hetero'!AL66+'a-homo'!AL66 -> 37 | AM66: =AA!AM66+'A-hetero'!AM66+'a-homo'!AM66 -> 10 | AN66: =AA!AN66+'A-hetero'!AN66+'a-homo'!AN66 -> 10 | AO66: =AA!AO66+'A-hetero'!AO66+'a-homo'!AO66 -> 10 | AP66: =AA!AP66+'A-hetero'!AP66+'a-homo'!AP66 -> 10 | AQ66: =AA!AQ66+'A-hetero'!AQ66+'a-homo'!AQ66 -> 10 | AR66: =AA!AR66+'A-hetero'!AR66+'a-homo'!AR66 -> 10 | AS66: =SUM(AC66:AJ66) -> 856 | AT66: =AA!AT66+'A-hetero'!AT66+'a-homo'!AT66 -> 367.21316185427514 | AU66: =AA!AU66+'A-hetero'!AU66+'a-homo'!AU66 -> 512.17525836325842 | AV66: =AA!AV66+'A-hetero'!AV66+'a-homo'!AV66 -> 27.054260189181605 | AW66: =AA!AW66+'A-hetero'!AW66+'a-homo'!AW66 -> 18.416951324980637 | AX66: =AA!AX66+'A-hetero'!AX66+'a-homo'!AX66 -> 27.431144301817326 | AY66: =AA!AY66+'A-hetero'!AY66+'a-homo'!AY66 -> 18.372845315559516 | AZ66: =AA!AZ66+'A-hetero'!AZ66+'a-homo'!AZ66 -> 27.724792463228976 | BA66: =AA!BA66+'A-hetero'!BA66+'a-homo'!BA66 -> 48.611586187698364 | BB66: =AA!BB66+'A-hetero'!BB66+'a-homo'!BB66 -> 346.66905901499501 | BC66: =AA!BC66+'A-hetero'!BC66+'a-homo'!BC66 -> 43.486444501095917 | BD66: =AA!BD66+'A-hetero'!BD66+'a-homo'!BD66 -> 21.88792437899864 | BE66: =AA!BE66+'A-hetero'!BE66+'a-homo'!BE66 -> 34.096940373214593 | BF66: =AA!BF66+'A-hetero'!BF66+'a-homo'!BF66 -> 18.981021382999351 | BG66: =AA!BG66+'A-hetero'!BG66+'a-homo'!BG66 -> 27.671065265999271 | BH66: =AA!BH66+'A-hetero'!BH66+'a-homo'!BH66 -> 55.038636414503898 | BI66: =AA!BI66+'A-hetero'!BI66+'a-homo'!BI66 -> 47.168908668193289 | BJ66: =SUM(AT66:BI66) -> 1642 | BK66: =AT66/BJ66 -> 0.22363773559943673 | BL66: =AU66/BJ66 -> 0.31192159461830593 | BM66: =AV66/BJ66 -> 1.647640693616419E-2 | BN66: =AW66/BJ66 -> 1.1216170112655684E-2 | BO66: =AX66/BJ66 -> 1.6705934410363776E-2 | BP66: =AY66/BJ66 -> 1.1189308961972908E-2 | BQ66: =AZ66/BJ66 -> 1.6884770075048097E-2 | BR66: =BA66/BJ66 -> 2.9605107300668915E-2 | BS66: =BB66/BJ66 -> 0.21112610171436966 | BT66: =BC66/BJ66 -> 2.6483827345369009E-2 | BU66: =BD66/BJ66 -> 1.3330039207672739E-2 | BV66: =BE66/BJ66 -> 2.0765493528145305E-2 | BW66: =BF66/BJ66 -> 1.1559696335565986E-2 | BX66: =BG66/BJ66 -> 1.6852049492082379E-2 | BY66: =BH66/BJ66 -> 3.3519267000306878E-2 | BZ66: =BI66/BJ66 -> 2.8726497361871672E-2 | CA66: =SUM(BK66:BZ66) -> 1
AC67: =AA!AC67+'A-hetero'!AC67+'a-homo'!AC67 -> 334 | AD67: =AA!AD67+'A-hetero'!AD67+'a-homo'!AD67 -> 463 | AE67: =AA!AE67+'A-hetero'!AE67+'a-homo'!AE67 -> 10 | AF67: =AA!AF67+'A-hetero'!AF67+'a-homo'!AF67 -> 9 | AG67: =AA!AG67+'A-hetero'!AG67+'a-homo'!AG67 -> 10 | AH67: =AA!AH67+'A-hetero'!AH67+'a-homo'!AH67 -> 10 | AI67: =AA!AI67+'A-hetero'!AI67+'a-homo'!AI67 -> 10 | AJ67: =AA!AJ67+'A-hetero'!AJ67+'a-homo'!AJ67 -> 10 | AK67: =AA!AK67+'A-hetero'!AK67+'a-homo'!AK67 -> 305 | AL67: =AA!AL67+'A-hetero'!AL67+'a-homo'!AL67 -> 37 | AM67: =AA!AM67+'A-hetero'!AM67+'a-homo'!AM67 -> 10 | AN67: =AA!AN67+'A-hetero'!AN67+'a-homo'!AN67 -> 10 | AO67: =AA!AO67+'A-hetero'!AO67+'a-homo'!AO67 -> 10 | AP67: =AA!AP67+'A-hetero'!AP67+'a-homo'!AP67 -> 10 | AQ67: =AA!AQ67+'A-hetero'!AQ67+'a-homo'!AQ67 -> 10 | AR67: =AA!AR67+'A-hetero'!AR67+'a-homo'!AR67 -> 10 | AS67: =SUM(AC67:AJ67) -> 856 | AT67: =AA!AT67+'A-hetero'!AT67+'a-homo'!AT67 -> 367.21316185306307 | AU67: =AA!AU67+'A-hetero'!AU67+'a-homo'!AU67 -> 512.17525836397886 | AV67: =AA!AV67+'A-hetero'!AV67+'a-homo'!AV67 -> 27.054260189708341 | AW67: =AA!AW67+'A-hetero'!AW67+'a-homo'!AW67 -> 18.416951324383348 | AX67: =AA!AX67+'A-hetero'!AX67+'a-homo'!AX67 -> 27.431144302268386 | AY67: =AA!AY67+'A-hetero'!AY67+'a-homo'!AY67 -> 18.372845315058377 | AZ67: =AA!AZ67+'A-hetero'!AZ67+'a-homo'!AZ67 -> 27.724792462183188 | BA67: =AA!BA67+'A-hetero'!BA67+'a-homo'!BA67 -> 48.611586189356416 | BB67: =AA!BB67+'A-hetero'!BB67+'a-homo'!BB67 -> 346.66905901543487 | BC67: =AA!BC67+'A-hetero'!BC67+'a-homo'!BC67 -> 43.48644450095162 | BD67: =AA!BD67+'A-hetero'!BD67+'a-homo'!BD67 -> 21.887924378350963 | BE67: =AA!BE67+'A-hetero'!BE67+'a-homo'!BE67 -> 34.096940374128941 | BF67: =AA!BF67+'A-hetero'!BF67+'a-homo'!BF67 -> 18.981021382460234 | BG67: =AA!BG67+'A-hetero'!BG67+'a-homo'!BG67 -> 27.671065266784602 | BH67: =AA!BH67+'A-hetero'!BH67+'a-homo'!BH67 -> 55.038636416530991 | BI67: =AA!BI67+'A-hetero'!BI67+'a-homo'!BI67 -> 47.168908665357826 | BJ67: =SUM(AT67:BI67) -> 1642 | BK67: =AT67/BJ67 -> 0.22363773559869854 | BL67: =AU67/BJ67 -> 0.31192159461874469 | BM67: =AV67/BJ67 -> 1.6476406936484979E-2 | BN67: =AW67/BJ67 -> 1.1216170112291928E-2 | BO67: =AX67/BJ67 -> 1.670593441063848E-2 | BP67: =AY67/BJ67 -> 1.1189308961667708E-2 | BQ67: =AZ67/BJ67 -> 1.6884770074411196E-2 | BR67: =BA67/BJ67 -> 2.9605107301678691E-2 | BS67: =BB67/BJ67 -> 0.21112610171463753 | BT67: =BC67/BJ67 -> 2.6483827345281128E-2 | BU67: =BD67/BJ67 -> 1.3330039207278295E-2 | BV67: =BE67/BJ67 -> 2.0765493528702154E-2 | BW67: =BF67/BJ67 -> 1.1559696335237657E-2 | BX67: =BG67/BJ67 -> 1.6852049492560656E-2 | BY67: =BH67/BJ67 -> 3.3519267001541404E-2 | BZ67: =BI67/BJ67 -> 2.8726497360144834E-2 | CA67: =SUM(BK67:BZ67) -> 1
AC68: =AA!AC68+'A-hetero'!AC68+'a-homo'!AC68 -> 334 | AD68: =AA!AD68+'A-hetero'!AD68+'a-homo'!AD68 -> 463 | AE68: =AA!AE68+'A-hetero'!AE68+'a-homo'!AE68 -> 10 | AF68: =AA!AF68+'A-hetero'!AF68+'a-homo'!AF68 -> 9 | AG68: =AA!AG68+'A-hetero'!AG68+'a-homo'!AG68 -> 10 | AH68: =AA!AH68+'A-hetero'!AH68+'a-homo'!AH68 -> 10 | AI68: =AA!AI68+'A-hetero'!AI68+'a-homo'!AI68 -> 10 | AJ68: =AA!AJ68+'A-hetero'!AJ68+'a-homo'!AJ68 -> 10 | AK68: =AA!AK68+'A-hetero'!AK68+'a-homo'!AK68 -> 305 | AL68: =AA!AL68+'A-hetero'!AL68+'a-homo'!AL68 -> 37 | AM68: =AA!AM68+'A-hetero'!AM68+'a-homo'!AM68 -> 10 | AN68: =AA!AN68+'A-hetero'!AN68+'a-homo'!AN68 -> 10 | AO68: =AA!AO68+'A-hetero'!AO68+'a-homo'!AO68 -> 10 | AP68: =AA!AP68+'A-hetero'!AP68+'a-homo'!AP68 -> 10 | AQ68: =AA!AQ68+'A-hetero'!AQ68+'a-homo'!AQ68 -> 10 | AR68: =AA!AR68+'A-hetero'!AR68+'a-homo'!AR68 -> 10 | AS68: =SUM(AC68:AJ68) -> 856 | AT68: =AA!AT68+'A-hetero'!AT68+'a-homo'!AT68 -> 367.21316185219587 | AU68: =AA!AU68+'A-hetero'!AU68+'a-homo'!AU68 -> 512.17525836449431 | AV68: =AA!AV68+'A-hetero'!AV68+'a-homo'!AV68 -> 27.054260190085181 | AW68: =AA!AW68+'A-hetero'!AW68+'a-homo'!AW68 -> 18.416951323956042 | AX68: =AA!AX68+'A-hetero'!AX68+'a-homo'!AX68 -> 27.431144302591079 | AY68: =AA!AY68+'A-hetero'!AY68+'a-homo'!AY68 -> 18.372845314699848 | AZ68: =AA!AZ68+'A-hetero'!AZ68+'a-homo'!AZ68 -> 27.724792461434987 | BA68: =AA!BA68+'A-hetero'!BA68+'a-homo'!BA68 -> 48.611586190542617 | BB68: =AA!BB68+'A-hetero'!BB68+'a-homo'!BB68 -> 346.66905901574944 | BC68: =AA!BC68+'A-hetero'!BC68+'a-homo'!BC68 -> 43.486444500848386 | BD68: =AA!BD68+'A-hetero'!BD68+'a-homo'!BD68 -> 21.887924377887579 | BE68: =AA!BE68+'A-hetero'!BE68+'a-homo'!BE68 -> 34.096940374783102 | BF68: =AA!BF68+'A-hetero'!BF68+'a-homo'!BF68 -> 18.981021382074516 | BG68: =AA!BG68+'A-hetero'!BG68+'a-homo'!BG68 -> 27.671065267346471 | BH68: =AA!BH68+'A-hetero'!BH68+'a-homo'!BH68 -> 55.038636417981294 | BI68: =AA!BI68+'A-hetero'!BI68+'a-homo'!BI68 -> 47.168908663329191 | BJ68: =SUM(AT68:BI68) -> 1642 | BK68: =AT68/BJ68 -> 0.22363773559817052 | BL68: =AU68/BJ68 -> 0.31192159461905872 | BM68: =AV68/BJ68 -> 1.6476406936714486E-2 | BN68: =AW68/BJ68 -> 1.1216170112031697E-2 | BO68: =AX68/BJ68 -> 1.6705934410835011E-2 | BP68: =AY68/BJ68 -> 1.1189308961449363E-2 | BQ68: =AZ68/BJ68 -> 1.688477007395554E-2 | BR68: =BA68/BJ68 -> 2.9605107302401117E-2 | BS68: =BB68/BJ68 -> 0.21112610171482921 | BT68: =BC68/BJ68 -> 2.6483827345218269E-2 | BU68: =BD68/BJ68 -> 1.3330039206996094E-2 | BV68: =BE68/BJ68 -> 2.0765493529100554E-2 | BW68: =BF68/BJ68 -> 1.1559696335002754E-2 | BX68: =BG68/BJ68 -> 1.6852049492902848E-2 | BY68: =BH68/BJ68 -> 3.351926700242467E-2 | BZ68: =BI68/BJ68 -> 2.8726497358909382E-2 | CA68: =SUM(BK68:BZ68) -> 1
AC69: =AA!AC69+'A-hetero'!AC69+'a-homo'!AC69 -> 334 | AD69: =AA!AD69+'A-hetero'!AD69+'a-homo'!AD69 -> 463 | AE69: =AA!AE69+'A-hetero'!AE69+'a-homo'!AE69 -> 10 | AF69: =AA!AF69+'A-hetero'!AF69+'a-homo'!AF69 -> 9 | AG69: =AA!AG69+'A-hetero'!AG69+'a-homo'!AG69 -> 10 | AH69: =AA!AH69+'A-hetero'!AH69+'a-homo'!AH69 -> 10 | AI69: =AA!AI69+'A-hetero'!AI69+'a-homo'!AI69 -> 10 | AJ69: =AA!AJ69+'A-hetero'!AJ69+'a-homo'!AJ69 -> 10 | AK69: =AA!AK69+'A-hetero'!AK69+'a-homo'!AK69 -> 305 | AL69: =AA!AL69+'A-hetero'!AL69+'a-homo'!AL69 -> 37 | AM69: =AA!AM69+'A-hetero'!AM69+'a-homo'!AM69 -> 10 | AN69: =AA!AN69+'A-hetero'!AN69+'a-homo'!AN69 -> 10 | AO69: =AA!AO69+'A-hetero'!AO69+'a-homo'!AO69 -> 10 | AP69: =AA!AP69+'A-hetero'!AP69+'a-homo'!AP69 -> 10 | AQ69: =AA!AQ69+'A-hetero'!AQ69+'a-homo'!AQ69 -> 10 | AR69: =AA!AR69+'A-hetero'!AR69+'a-homo'!AR69 -> 10 | AS69: =SUM(AC69:AJ69) -> 856 | AT69: =AA!AT69+'A-hetero'!AT69+'a-homo'!AT69 -> 367.21316185157548 | AU69: =AA!AU69+'A-hetero'!AU69+'a-homo'!AU69 -> 512.17525836486311 | AV69: =AA!AV69+'A-hetero'!AV69+'a-homo'!AV69 -> 27.054260190354785 | AW69: =AA!AW69+'A-hetero'!AW69+'a-homo'!AW69 -> 18.416951323650338 | AX69: =AA!AX69+'A-hetero'!AX69+'a-homo'!AX69 -> 27.431144302821945 | AY69: =AA!AY69+'A-hetero'!AY69+'a-homo'!AY69 -> 18.372845314443346 | AZ69: =AA!AZ69+'A-hetero'!AZ69+'a-homo'!AZ69 -> 27.724792460899703 | BA69: =AA!BA69+'A-hetero'!BA69+'a-homo'!BA69 -> 48.611586191391268 | BB69: =AA!BB69+'A-hetero'!BB69+'a-homo'!BB69 -> 346.66905901597454 | BC69: =AA!BC69+'A-hetero'!BC69+'a-homo'!BC69 -> 43.486444500774525 | BD69: =AA!BD69+'A-hetero'!BD69+'a-homo'!BD69 -> 21.887924377556054 | BE69: =AA!BE69+'A-hetero'!BE69+'a-homo'!BE69 -> 34.096940375251123 | BF69: =AA!BF69+'A-hetero'!BF69+'a-homo'!BF69 -> 18.981021381798556 | BG69: =AA!BG69+'A-hetero'!BG69+'a-homo'!BG69 -> 27.671065267748453 | BH69: =AA!BH69+'A-hetero'!BH69+'a-homo'!BH69 -> 55.038636419018928 | BI69: =AA!BI69+'A-hetero'!BI69+'a-homo'!BI69 -> 47.168908661877801 | BJ69: =SUM(AT69:BI69) -> 1642 | BK69: =AT69/BJ69 -> 0.2236377355977926 | BL69: =AU69/BJ69 -> 0.3119215946192832 | BM69: =AV69/BJ69 -> 1.6476406936878674E-2 | BN69: =AW69/BJ69 -> 1.1216170111845515E-2 | BO69: =AX69/BJ69 -> 1.6705934410975603E-2 | BP69: =AY69/BJ69 -> 1.1189308961293144E-2 | BQ69: =AZ69/BJ69 -> 1.6884770073629537E-2 | BR69: =BA69/BJ69 -> 2.9605107302917943E-2 | BS69: =BB69/BJ69 -> 0.21112610171496621 | BT69: =BC69/BJ69 -> 2.6483827345173277E-2 | BU69: =BD69/BJ69 -> 1.3330039206794184E-2 | BV69: =BE69/BJ69 -> 2.0765493529385576E-2 | BW69: =BF69/BJ69 -> 1.1559696334834686E-2 | BX69: =BG69/BJ69 -> 1.6852049493147656E-2 | BY69: =BH69/BJ69 -> 3.3519267003056588E-2 | BZ69: =BI69/BJ69 -> 2.8726497358025453E-2 | CA69: =SUM(BK69:BZ69) -> 1
AC70: =AA!AC70+'A-hetero'!AC70+'a-homo'!AC70 -> 334 | AD70: =AA!AD70+'A-hetero'!AD70+'a-homo'!AD70 -> 463 | AE70: =AA!AE70+'A-hetero'!AE70+'a-homo'!AE70 -> 10 | AF70: =AA!AF70+'A-hetero'!AF70+'a-homo'!AF70 -> 9 | AG70: =AA!AG70+'A-hetero'!AG70+'a-homo'!AG70 -> 10 | AH70: =AA!AH70+'A-hetero'!AH70+'a-homo'!AH70 -> 10 | AI70: =AA!AI70+'A-hetero'!AI70+'a-homo'!AI70 -> 10 | AJ70: =AA!AJ70+'A-hetero'!AJ70+'a-homo'!AJ70 -> 10 | AK70: =AA!AK70+'A-hetero'!AK70+'a-homo'!AK70 -> 305 | AL70: =AA!AL70+'A-hetero'!AL70+'a-homo'!AL70 -> 37 | AM70: =AA!AM70+'A-hetero'!AM70+'a-homo'!AM70 -> 10 | AN70: =AA!AN70+'A-hetero'!AN70+'a-homo'!AN70 -> 10 | AO70: =AA!AO70+'A-hetero'!AO70+'a-homo'!AO70 -> 10 | AP70: =AA!AP70+'A-hetero'!AP70+'a-homo'!AP70 -> 10 | AQ70: =AA!AQ70+'A-hetero'!AQ70+'a-homo'!AQ70 -> 10 | AR70: =AA!AR70+'A-hetero'!AR70+'a-homo'!AR70 -> 10 | AS70: =SUM(AC70:AJ70) -> 856 | AT70: =AA!AT70+'A-hetero'!AT70+'a-homo'!AT70 -> 367.21316185113159 | AU70: =AA!AU70+'A-hetero'!AU70+'a-homo'!AU70 -> 512.17525836512698 | AV70: =AA!AV70+'A-hetero'!AV70+'a-homo'!AV70 -> 27.054260190547666 | AW70: =AA!AW70+'A-hetero'!AW70+'a-homo'!AW70 -> 18.416951323431626 | AX70: =AA!AX70+'A-hetero'!AX70+'a-homo'!AX70 -> 27.431144302987114 | AY70: =AA!AY70+'A-hetero'!AY70+'a-homo'!AY70 -> 18.372845314259838 | AZ70: =AA!AZ70+'A-hetero'!AZ70+'a-homo'!AZ70 -> 27.724792460516738 | BA70: =AA!BA70+'A-hetero'!BA70+'a-homo'!BA70 -> 48.611586191998413 | BB70: =AA!BB70+'A-hetero'!BB70+'a-homo'!BB70 -> 346.66905901613563 | BC70: =AA!BC70+'A-hetero'!BC70+'a-homo'!BC70 -> 43.486444500721674 | BD70: =AA!BD70+'A-hetero'!BD70+'a-homo'!BD70 -> 21.887924377318861 | BE70: =AA!BE70+'A-hetero'!BE70+'a-homo'!BE70 -> 34.096940375585959 | BF70: =AA!BF70+'A-hetero'!BF70+'a-homo'!BF70 -> 18.981021381601117 | BG70: =AA!BG70+'A-hetero'!BG70+'a-homo'!BG70 -> 27.671065268036045 | BH70: =AA!BH70+'A-hetero'!BH70+'a-homo'!BH70 -> 55.038636419761325 | BI70: =AA!BI70+'A-hetero'!BI70+'a-homo'!BI70 -> 47.168908660839406 | BJ70: =SUM(AT70:BI70) -> 1642 | BK70: =AT70/BJ70 -> 0.22363773559752229 | BL70: =AU70/BJ70 -> 0.31192159461944396 | BM70: =AV70/BJ70 -> 1.6476406936996143E-2 | BN70: =AW70/BJ70 -> 1.1216170111712317E-2 | BO70: =AX70/BJ70 -> 1.6705934411076196E-2 | BP70: =AY70/BJ70 -> 1.1189308961181386E-2 | BQ70: =AZ70/BJ70 -> 1.6884770073396307E-2 | BR70: =BA70/BJ70 -> 2.9605107303287706E-2 | BS70: =BB70/BJ70 -> 0.21112610171506432 | BT70: =BC70/BJ70 -> 2.6483827345141094E-2 | BU70: =BD70/BJ70 -> 1.3330039206649732E-2 | BV70: =BE70/BJ70 -> 2.07654935295895E-2 | BW70: =BF70/BJ70 -> 1.1559696334714443E-2 | BX70: =BG70/BJ70 -> 1.6852049493322804E-2 | BY70: =BH70/BJ70 -> 3.3519267003508726E-2 | BZ70: =BI70/BJ70 -> 2.872649735739306E-2 | CA70: =SUM(BK70:BZ70) -> 1
AC71: =AA!AC71+'A-hetero'!AC71+'a-homo'!AC71 -> 334 | AD71: =AA!AD71+'A-hetero'!AD71+'a-homo'!AD71 -> 463 | AE71: =AA!AE71+'A-hetero'!AE71+'a-homo'!AE71 -> 10 | AF71: =AA!AF71+'A-hetero'!AF71+'a-homo'!AF71 -> 9 | AG71: =AA!AG71+'A-hetero'!AG71+'a-homo'!AG71 -> 10 | AH71: =AA!AH71+'A-hetero'!AH71+'a-homo'!AH71 -> 10 | AI71: =AA!AI71+'A-hetero'!AI71+'a-homo'!AI71 -> 10 | AJ71: =AA!AJ71+'A-hetero'!AJ71+'a-homo'!AJ71 -> 10 | AK71: =AA!AK71+'A-hetero'!AK71+'a-homo'!AK71 -> 305 | AL71: =AA!AL71+'A-hetero'!AL71+'a-homo'!AL71 -> 37 | AM71: =AA!AM71+'A-hetero'!AM71+'a-homo'!AM71 -> 10 | AN71: =AA!AN71+'A-hetero'!AN71+'a-homo'!AN71 -> 10 | AO71: =AA!AO71+'A-hetero'!AO71+'a-homo'!AO71 -> 10 | AP71: =AA!AP71+'A-hetero'!AP71+'a-homo'!AP71 -> 10 | AQ71: =AA!AQ71+'A-hetero'!AQ71+'a-homo'!AQ71 -> 10 | AR71: =AA!AR71+'A-hetero'!AR71+'a-homo'!AR71 -> 10 | AS71: =SUM(AC71:AJ71) -> 856 | AT71: =AA!AT71+'A-hetero'!AT71+'a-homo'!AT71 -> 367.213161850814 | AU71: =AA!AU71+'A-hetero'!AU71+'a-homo'!AU71 -> 512.17525836531581 | AV71: =AA!AV71+'A-hetero'!AV71+'a-homo'!AV71 -> 27.05426019068566 | AW71: =AA!AW71+'A-hetero'!AW71+'a-homo'!AW71 -> 18.416951323275157 | AX71: =AA!AX71+'A-hetero'!AX71+'a-homo'!AX71 -> 27.431144303105285 | AY71: =AA!AY71+'A-hetero'!AY71+'a-homo'!AY71 -> 18.372845314128551 | AZ71: =AA!AZ71+'A-hetero'!AZ71+'a-homo'!AZ71 -> 27.724792460242753 | BA71: =AA!BA71+'A-hetero'!BA71+'a-homo'!BA71 -> 48.611586192432789 | BB71: =AA!BB71+'A-hetero'!BB71+'a-homo'!BB71 -> 346.6690590162508 | BC71: =AA!BC71+'A-hetero'!BC71+'a-homo'!BC71 -> 43.486444500683874 | BD71: =AA!BD71+'A-hetero'!BD71+'a-homo'!BD71 -> 21.887924377149162 | BE71: =AA!BE71+'A-hetero'!BE71+'a-homo'!BE71 -> 34.096940375825525 | BF71: =AA!BF71+'A-hetero'!BF71+'a-homo'!BF71 -> 18.981021381459861 | BG71: =AA!BG71+'A-hetero'!BG71+'a-homo'!BG71 -> 27.671065268241808 | BH71: =AA!BH71+'A-hetero'!BH71+'a-homo'!BH71 -> 55.038636420292477 | BI71: =AA!BI71+'A-hetero'!BI71+'a-homo'!BI71 -> 47.168908660096491 | BJ71: =SUM(AT71:BI71) -> 1642 | BK71: =AT71/BJ71 -> 0.22363773559732886 | BL71: =AU71/BJ71 -> 0.31192159461955898 | BM71: =AV71/BJ71 -> 1.6476406937080183E-2 | BN71: =AW71/BJ71 -> 1.1216170111617026E-2 | BO71: =AX71/BJ71 -> 1.6705934411148163E-2 | BP71: =AY71/BJ71 -> 1.1189308961101431E-2 | BQ71: =AZ71/BJ71 -> 1.6884770073229447E-2 | BR71: =BA71/BJ71 -> 2.9605107303552248E-2 | BS71: =BB71/BJ71 -> 0.21112610171513446 | BT71: =BC71/BJ71 -> 2.6483827345118071E-2 | BU71: =BD71/BJ71 -> 1.3330039206546384E-2 | BV71: =BE71/BJ71 -> 2.0765493529735401E-2 | BW71: =BF71/BJ71 -> 1.1559696334628417E-2 | BX71: =BG71/BJ71 -> 1.6852049493448117E-2 | BY71: =BH71/BJ71 -> 3.3519267003832204E-2 | BZ71: =BI71/BJ71 -> 2.8726497356940616E-2 | CA71: =SUM(BK71:BZ71) -> 1
AC72: =AA!AC72+'A-hetero'!AC72+'a-homo'!AC72 -> 334 | AD72: =AA!AD72+'A-hetero'!AD72+'a-homo'!AD72 -> 463 | AE72: =AA!AE72+'A-hetero'!AE72+'a-homo'!AE72 -> 10 | AF72: =AA!AF72+'A-hetero'!AF72+'a-homo'!AF72 -> 9 | AG72: =AA!AG72+'A-hetero'!AG72+'a-homo'!AG72 -> 10 | AH72: =AA!AH72+'A-hetero'!AH72+'a-homo'!AH72 -> 10 | AI72: =AA!AI72+'A-hetero'!AI72+'a-homo'!AI72 -> 10 | AJ72: =AA!AJ72+'A-hetero'!AJ72+'a-homo'!AJ72 -> 10 | AK72: =AA!AK72+'A-hetero'!AK72+'a-homo'!AK72 -> 305 | AL72: =AA!AL72+'A-hetero'!AL72+'a-homo'!AL72 -> 37 | AM72: =AA!AM72+'A-hetero'!AM72+'a-homo'!AM72 -> 10 | AN72: =AA!AN72+'A-hetero'!AN72+'a-homo'!AN72 -> 10 | AO72: =AA!AO72+'A-hetero'!AO72+'a-homo'!AO72 -> 10 | AP72: =AA!AP72+'A-hetero'!AP72+'a-homo'!AP72 -> 10 | AQ72: =AA!AQ72+'A-hetero'!AQ72+'a-homo'!AQ72 -> 10 | AR72: =AA!AR72+'A-hetero'!AR72+'a-homo'!AR72 -> 10 | AS72: =SUM(AC72:AJ72) -> 856 | AT72: =AA!AT72+'A-hetero'!AT72+'a-homo'!AT72 -> 367.21316185058686 | AU72: =AA!AU72+'A-hetero'!AU72+'a-homo'!AU72 -> 512.17525836545087 | AV72: =AA!AV72+'A-hetero'!AV72+'a-homo'!AV72 -> 27.054260190784387 | AW72: =AA!AW72+'A-hetero'!AW72+'a-homo'!AW72 -> 18.416951323163211 | AX72: =AA!AX72+'A-hetero'!AX72+'a-homo'!AX72 -> 27.431144303189825 | AY72: =AA!AY72+'A-hetero'!AY72+'a-homo'!AY72 -> 18.37284531403462 | AZ72: =AA!AZ72+'A-hetero'!AZ72+'a-homo'!AZ72 -> 27.724792460046732 | BA72: =AA!BA72+'A-hetero'!BA72+'a-homo'!BA72 -> 48.611586192743545 | BB72: =AA!BB72+'A-hetero'!BB72+'a-homo'!BB72 -> 346.66905901633322 | BC72: =AA!BC72+'A-hetero'!BC72+'a-homo'!BC72 -> 43.48644450065683 | BD72: =AA!BD72+'A-hetero'!BD72+'a-homo'!BD72 -> 21.887924377027751 | BE72: =AA!BE72+'A-hetero'!BE72+'a-homo'!BE72 -> 34.096940375996908 | BF72: =AA!BF72+'A-hetero'!BF72+'a-homo'!BF72 -> 18.981021381358801 | BG72: =AA!BG72+'A-hetero'!BG72+'a-homo'!BG72 -> 27.671065268389022 | BH72: =AA!BH72+'A-hetero'!BH72+'a-homo'!BH72 -> 55.038636420672489 | BI72: =AA!BI72+'A-hetero'!BI72+'a-homo'!BI72 -> 47.16890865956497 | BJ72: =SUM(AT72:BI72) -> 1642 | BK72: =AT72/BJ72 -> 0.22363773559719061 | BL72: =AU72/BJ72 -> 0.31192159461964131 | BM72: =AV72/BJ72 -> 1.6476406937140312E-2 | BN72: =AW72/BJ72 -> 1.1216170111548853E-2 | BO72: =AX72/BJ72 -> 1.6705934411199653E-2 | BP72: =AY72/BJ72 -> 1.1189308961044231E-2 | BQ72: =AZ72/BJ72 -> 1.6884770073110074E-2 | BR72: =BA72/BJ72 -> 2.960510730374151E-2 | BS72: =BB72/BJ72 -> 0.21112610171518473 | BT72: =BC72/BJ72 -> 2.6483827345101608E-2 | BU72: =BD72/BJ72 -> 1.3330039206472447E-2 | BV72: =BE72/BJ72 -> 2.0765493529839779E-2 | BW72: =BF72/BJ72 -> 1.1559696334566874E-2 | BX72: =BG72/BJ72 -> 1.6852049493537778E-2 | BY72: =BH72/BJ72 -> 3.3519267004063644E-2 | BZ72: =BI72/BJ72 -> 2.872649735661692E-2 | CA72: =SUM(BK72:BZ72) -> 1
AC73: =AA!AC73+'A-hetero'!AC73+'a-homo'!AC73 -> 334 | AD73: =AA!AD73+'A-hetero'!AD73+'a-homo'!AD73 -> 463 | AE73: =AA!AE73+'A-hetero'!AE73+'a-homo'!AE73 -> 10 | AF73: =AA!AF73+'A-hetero'!AF73+'a-homo'!AF73 -> 9 | AG73: =AA!AG73+'A-hetero'!AG73+'a-homo'!AG73 -> 10 | AH73: =AA!AH73+'A-hetero'!AH73+'a-homo'!AH73 -> 10 | AI73: =AA!AI73+'A-hetero'!AI73+'a-homo'!AI73 -> 10 | AJ73: =AA!AJ73+'A-hetero'!AJ73+'a-homo'!AJ73 -> 10 | AK73: =AA!AK73+'A-hetero'!AK73+'a-homo'!AK73 -> 305 | AL73: =AA!AL73+'A-hetero'!AL73+'a-homo'!AL73 -> 37 | AM73: =AA!AM73+'A-hetero'!AM73+'a-homo'!AM73 -> 10 | AN73: =AA!AN73+'A-hetero'!AN73+'a-homo'!AN73 -> 10 | AO73: =AA!AO73+'A-hetero'!AO73+'a-homo'!AO73 -> 10 | AP73: =AA!AP73+'A-hetero'!AP73+'a-homo'!AP73 -> 10 | AQ73: =AA!AQ73+'A-hetero'!AQ73+'a-homo'!AQ73 -> 10 | AR73: =AA!AR73+'A-hetero'!AR73+'a-homo'!AR73 -> 10 | AS73: =SUM(AC73:AJ73) -> 856 | AT73: =AA!AT73+'A-hetero'!AT73+'a-homo'!AT73 -> 367.21316185042417 | AU73: =AA!AU73+'A-hetero'!AU73+'a-homo'!AU73 -> 512.17525836554751 | AV73: =AA!AV73+'A-hetero'!AV73+'a-homo'!AV73 -> 27.054260190855018 | AW73: =AA!AW73+'A-hetero'!AW73+'a-homo'!AW73 -> 18.416951323083119 | AX73: =AA!AX73+'A-hetero'!AX73+'a-homo'!AX73 -> 27.43114430325031 | AY73: =AA!AY73+'A-hetero'!AY73+'a-homo'!AY73 -> 18.372845313967424 | AZ73: =AA!AZ73+'A-hetero'!AZ73+'a-homo'!AZ73 -> 27.724792459906489 | BA73: =AA!BA73+'A-hetero'!BA73+'a-homo'!BA73 -> 48.611586192965873 | BB73: =AA!BB73+'A-hetero'!BB73+'a-homo'!BB73 -> 346.66905901639223 | BC73: =AA!BC73+'A-hetero'!BC73+'a-homo'!BC73 -> 43.486444500637475 | BD73: =AA!BD73+'A-hetero'!BD73+'a-homo'!BD73 -> 21.887924376940891 | BE73: =AA!BE73+'A-hetero'!BE73+'a-homo'!BE73 -> 34.096940376119534 | BF73: =AA!BF73+'A-hetero'!BF73+'a-homo'!BF73 -> 18.981021381286496 | BG73: =AA!BG73+'A-hetero'!BG73+'a-homo'!BG73 -> 27.671065268494338 | BH73: =AA!BH73+'A-hetero'!BH73+'a-homo'!BH73 -> 55.038636420944364 | BI73: =AA!BI73+'A-hetero'!BI73+'a-homo'!BI73 -> 47.168908659184694 | BJ73: =SUM(AT73:BI73) -> 1642 | BK73: =AT73/BJ73 -> 0.22363773559709146 | BL73: =AU73/BJ73 -> 0.31192159461970004 | BM73: =AV73/BJ73 -> 1.6476406937183323E-2 | BN73: =AW73/BJ73 -> 1.1216170111500072E-2 | BO73: =AX73/BJ73 -> 1.6705934411236485E-2 | BP73: =AY73/BJ73 -> 1.1189308961003303E-2 | BQ73: =AZ73/BJ73 -> 1.688477007302466E-2 | BR73: =BA73/BJ73 -> 2.9605107303876901E-2 | BS73: =BB73/BJ73 -> 0.21112610171522059 | BT73: =BC73/BJ73 -> 2.6483827345089816E-2 | BU73: =BD73/BJ73 -> 1.3330039206419543E-2 | BV73: =BE73/BJ73 -> 2.0765493529914456E-2 | BW73: =BF73/BJ73 -> 1.1559696334522836E-2 | BX73: =BG73/BJ73 -> 1.685204949360191E-2 | BY73: =BH73/BJ73 -> 3.3519267004229213E-2 | BZ73: =BI73/BJ73 -> 2.8726497356385321E-2 | CA73: =SUM(BK73:BZ73) -> 1
AC74: =AA!AC74+'A-hetero'!AC74+'a-homo'!AC74 -> 334 | AD74: =AA!AD74+'A-hetero'!AD74+'a-homo'!AD74 -> 463 | AE74: =AA!AE74+'A-hetero'!AE74+'a-homo'!AE74 -> 10 | AF74: =AA!AF74+'A-hetero'!AF74+'a-homo'!AF74 -> 9 | AG74: =AA!AG74+'A-hetero'!AG74+'a-homo'!AG74 -> 10 | AH74: =AA!AH74+'A-hetero'!AH74+'a-homo'!AH74 -> 10 | AI74: =AA!AI74+'A-hetero'!AI74+'a-homo'!AI74 -> 10 | AJ74: =AA!AJ74+'A-hetero'!AJ74+'a-homo'!AJ74 -> 10 | AK74: =AA!AK74+'A-hetero'!AK74+'a-homo'!AK74 -> 305 | AL74: =AA!AL74+'A-hetero'!AL74+'a-homo'!AL74 -> 37 | AM74: =AA!AM74+'A-hetero'!AM74+'a-homo'!AM74 -> 10 | AN74: =AA!AN74+'A-hetero'!AN74+'a-homo'!AN74 -> 10 | AO74: =AA!AO74+'A-hetero'!AO74+'a-homo'!AO74 -> 10 | AP74: =AA!AP74+'A-hetero'!AP74+'a-homo'!AP74 -> 10 | AQ74: =AA!AQ74+'A-hetero'!AQ74+'a-homo'!AQ74 -> 10 | AR74: =AA!AR74+'A-hetero'!AR74+'a-homo'!AR74 -> 10 | AS74: =SUM(AC74:AJ74) -> 856 | AT74: =AA!AT74+'A-hetero'!AT74+'a-homo'!AT74 -> 367.21316185030787 | AU74: =AA!AU74+'A-hetero'!AU74+'a-homo'!AU74 -> 512.17525836561663 | AV74: =AA!AV74+'A-hetero'!AV74+'a-homo'!AV74 -> 27.054260190905552 | AW74: =AA!AW74+'A-hetero'!AW74+'a-homo'!AW74 -> 18.41695132302582 | AX74: =AA!AX74+'A-hetero'!AX74+'a-homo'!AX74 -> 27.431144303293578 | AY74: =AA!AY74+'A-hetero'!AY74+'a-homo'!AY74 -> 18.372845313919349 | AZ74: =AA!AZ74+'A-hetero'!AZ74+'a-homo'!AZ74 -> 27.72479245980616 | BA74: =AA!BA74+'A-hetero'!BA74+'a-homo'!BA74 -> 48.611586193124936 | BB74: =AA!BB74+'A-hetero'!BB74+'a-homo'!BB74 -> 346.6690590164344 | BC74: =AA!BC74+'A-hetero'!BC74+'a-homo'!BC74 -> 43.486444500623634 | BD74: =AA!BD74+'A-hetero'!BD74+'a-homo'!BD74 -> 21.887924376878747 | BE74: =AA!BE74+'A-hetero'!BE74+'a-homo'!BE74 -> 34.096940376207272 | BF74: =AA!BF74+'A-hetero'!BF74+'a-homo'!BF74 -> 18.981021381234768 | BG74: =AA!BG74+'A-hetero'!BG74+'a-homo'!BG74 -> 27.671065268569691 | BH74: =AA!BH74+'A-hetero'!BH74+'a-homo'!BH74 -> 55.038636421138875 | BI74: =AA!BI74+'A-hetero'!BI74+'a-homo'!BI74 -> 47.168908658912628 | BJ74: =SUM(AT74:BI74) -> 1642 | BK74: =AT74/BJ74 -> 0.2236377355970206 | BL74: =AU74/BJ74 -> 0.31192159461974212 | BM74: =AV74/BJ74 -> 1.6476406937214097E-2 | BN74: =AW74/BJ74 -> 1.1216170111465175E-2 | BO74: =AX74/BJ74 -> 1.6705934411262835E-2 | BP74: =AY74/BJ74 -> 1.1189308960974023E-2 | BQ74: =AZ74/BJ74 -> 1.6884770072963556E-2 | BR74: =BA74/BJ74 -> 2.9605107303973768E-2 | BS74: =BB74/BJ74 -> 0.21112610171524626 | BT74: =BC74/BJ74 -> 2.6483827345081382E-2 | BU74: =BD74/BJ74 -> 1.3330039206381695E-2 | BV74: =BE74/BJ74 -> 2.0765493529967885E-2 | BW74: =BF74/BJ74 -> 1.1559696334491332E-2 | BX74: =BG74/BJ74 -> 1.6852049493647801E-2 | BY74: =BH74/BJ74 -> 3.3519267004347666E-2 | BZ74: =BI74/BJ74 -> 2.8726497356219623E-2 | CA74: =SUM(BK74:BZ74) -> 1
AC75: =AA!AC75+'A-hetero'!AC75+'a-homo'!AC75 -> 334 | AD75: =AA!AD75+'A-hetero'!AD75+'a-homo'!AD75 -> 463 | AE75: =AA!AE75+'A-hetero'!AE75+'a-homo'!AE75 -> 10 | AF75: =AA!AF75+'A-hetero'!AF75+'a-homo'!AF75 -> 9 | AG75: =AA!AG75+'A-hetero'!AG75+'a-homo'!AG75 -> 10 | AH75: =AA!AH75+'A-hetero'!AH75+'a-homo'!AH75 -> 10 | AI75: =AA!AI75+'A-hetero'!AI75+'a-homo'!AI75 -> 10 | AJ75: =AA!AJ75+'A-hetero'!AJ75+'a-homo'!AJ75 -> 10 | AK75: =AA!AK75+'A-hetero'!AK75+'a-homo'!AK75 -> 305 | AL75: =AA!AL75+'A-hetero'!AL75+'a-homo'!AL75 -> 37 | AM75: =AA!AM75+'A-hetero'!AM75+'a-homo'!AM75 -> 10 | AN75: =AA!AN75+'A-hetero'!AN75+'a-homo'!AN75 -> 10 | AO75: =AA!AO75+'A-hetero'!AO75+'a-homo'!AO75 -> 10 | AP75: =AA!AP75+'A-hetero'!AP75+'a-homo'!AP75 -> 10 | AQ75: =AA!AQ75+'A-hetero'!AQ75+'a-homo'!AQ75 -> 10 | AR75: =AA!AR75+'A-hetero'!AR75+'a-homo'!AR75 -> 10 | AS75: =SUM(AC75:AJ75) -> 856 | AT75: =AA!AT75+'A-hetero'!AT75+'a-homo'!AT75 -> 367.21316185022471 | AU75: =AA!AU75+'A-hetero'!AU75+'a-homo'!AU75 -> 512.1752583656662 | AV75: =AA!AV75+'A-hetero'!AV75+'a-homo'!AV75 -> 27.054260190941704 | AW75: =AA!AW75+'A-hetero'!AW75+'a-homo'!AW75 -> 18.416951322984826 | AX75: =AA!AX75+'A-hetero'!AX75+'a-homo'!AX75 -> 27.431144303324537 | AY75: =AA!AY75+'A-hetero'!AY75+'a-homo'!AY75 -> 18.372845313884955 | AZ75: =AA!AZ75+'A-hetero'!AZ75+'a-homo'!AZ75 -> 27.724792459734378 | BA75: =AA!BA75+'A-hetero'!BA75+'a-homo'!BA75 -> 48.611586193238736 | BB75: =AA!BB75+'A-hetero'!BB75+'a-homo'!BB75 -> 346.66905901646459 | BC75: =AA!BC75+'A-hetero'!BC75+'a-homo'!BC75 -> 43.486444500613736 | BD75: =AA!BD75+'A-hetero'!BD75+'a-homo'!BD75 -> 21.887924376834285 | BE75: =AA!BE75+'A-hetero'!BE75+'a-homo'!BE75 -> 34.096940376270027 | BF75: =AA!BF75+'A-hetero'!BF75+'a-homo'!BF75 -> 18.981021381197756 | BG75: =AA!BG75+'A-hetero'!BG75+'a-homo'!BG75 -> 27.6710652686236 | BH75: =AA!BH75+'A-hetero'!BH75+'a-homo'!BH75 -> 55.038636421278049 | BI75: =AA!BI75+'A-hetero'!BI75+'a-homo'!BI75 -> 47.168908658717982 | BJ75: =SUM(AT75:BI75) -> 1642 | BK75: =AT75/BJ75 -> 0.22363773559697001 | BL75: =AU75/BJ75 -> 0.31192159461977237 | BM75: =AV75/BJ75 -> 1.6476406937236121E-2 | BN75: =AW75/BJ75 -> 1.1216170111440212E-2 | BO75: =AX75/BJ75 -> 1.6705934411281695E-2 | BP75: =AY75/BJ75 -> 1.118930896095308E-2 | BQ75: =AZ75/BJ75 -> 1.6884770072919844E-2 | BR75: =BA75/BJ75 -> 2.9605107304043084E-2 | BS75: =BB75/BJ75 -> 0.21112610171526469 | BT75: =BC75/BJ75 -> 2.6483827345075362E-2 | BU75: =BD75/BJ75 -> 1.3330039206354621E-2 | BV75: =BE75/BJ75 -> 2.0765493530006108E-2 | BW75: =BF75/BJ75 -> 1.1559696334468794E-2 | BX75: =BG75/BJ75 -> 1.6852049493680635E-2 | BY75: =BH75/BJ75 -> 3.3519267004432432E-2 | BZ75: =BI75/BJ75 -> 2.872649735610109E-2 | CA75: =SUM(BK75:BZ75) -> 1
AC76: =AA!AC76+'A-hetero'!AC76+'a-homo'!AC76 -> 334 | AD76: =AA!AD76+'A-hetero'!AD76+'a-homo'!AD76 -> 463 | AE76: =AA!AE76+'A-hetero'!AE76+'a-homo'!AE76 -> 10 | AF76: =AA!AF76+'A-hetero'!AF76+'a-homo'!AF76 -> 9 | AG76: =AA!AG76+'A-hetero'!AG76+'a-homo'!AG76 -> 10 | AH76: =AA!AH76+'A-hetero'!AH76+'a-homo'!AH76 -> 10 | AI76: =AA!AI76+'A-hetero'!AI76+'a-homo'!AI76 -> 10 | AJ76: =AA!AJ76+'A-hetero'!AJ76+'a-homo'!AJ76 -> 10 | AK76: =AA!AK76+'A-hetero'!AK76+'a-homo'!AK76 -> 305 | AL76: =AA!AL76+'A-hetero'!AL76+'a-homo'!AL76 -> 37 | AM76: =AA!AM76+'A-hetero'!AM76+'a-homo'!AM76 -> 10 | AN76: =AA!AN76+'A-hetero'!AN76+'a-homo'!AN76 -> 10 | AO76: =AA!AO76+'A-hetero'!AO76+'a-homo'!AO76 -> 10 | AP76: =AA!AP76+'A-hetero'!AP76+'a-homo'!AP76 -> 10 | AQ76: =AA!AQ76+'A-hetero'!AQ76+'a-homo'!AQ76 -> 10 | AR76: =AA!AR76+'A-hetero'!AR76+'a-homo'!AR76 -> 10 | AS76: =SUM(AC76:AJ76) -> 856 | AT76: =AA!AT76+'A-hetero'!AT76+'a-homo'!AT76 -> 367.21316185016519 | AU76: =AA!AU76+'A-hetero'!AU76+'a-homo'!AU76 -> 512.17525836570155 | AV76: =AA!AV76+'A-hetero'!AV76+'a-homo'!AV76 -> 27.054260190967572 | AW76: =AA!AW76+'A-hetero'!AW76+'a-homo'!AW76 -> 18.416951322955498 | AX76: =AA!AX76+'A-hetero'!AX76+'a-homo'!AX76 -> 27.431144303346684 | AY76: =AA!AY76+'A-hetero'!AY76+'a-homo'!AY76 -> 18.372845313860346 | AZ76: =AA!AZ76+'A-hetero'!AZ76+'a-homo'!AZ76 -> 27.724792459683023 | BA76: =AA!BA76+'A-hetero'!BA76+'a-homo'!BA76 -> 48.61158619332015 | BB76: =AA!BB76+'A-hetero'!BB76+'a-homo'!BB76 -> 346.66905901648613 | BC76: =AA!BC76+'A-hetero'!BC76+'a-homo'!BC76 -> 43.486444500606645 | BD76: =AA!BD76+'A-hetero'!BD76+'a-homo'!BD76 -> 21.887924376802477 | BE76: =AA!BE76+'A-hetero'!BE76+'a-homo'!BE76 -> 34.096940376314933 | BF76: =AA!BF76+'A-hetero'!BF76+'a-homo'!BF76 -> 18.981021381171278 | BG76: =AA!BG76+'A-hetero'!BG76+'a-homo'!BG76 -> 27.671065268662169 | BH76: =AA!BH76+'A-hetero'!BH76+'a-homo'!BH76 -> 55.038636421377618 | BI76: =AA!BI76+'A-hetero'!BI76+'a-homo'!BI76 -> 47.168908658578729 | BJ76: =SUM(AT76:BI76) -> 1642 | BK76: =AT76/BJ76 -> 0.22363773559693373 | BL76: =AU76/BJ76 -> 0.31192159461979391 | BM76: =AV76/BJ76 -> 1.6476406937251872E-2 | BN76: =AW76/BJ76 -> 1.121617011142235E-2 | BO76: =AX76/BJ76 -> 1.6705934411295181E-2 | BP76: =AY76/BJ76 -> 1.1189308960938091E-2 | BQ76: =AZ76/BJ76 -> 1.6884770072888564E-2 | BR76: =BA76/BJ76 -> 2.9605107304092663E-2 | BS76: =BB76/BJ76 -> 0.21112610171527779 | BT76: =BC76/BJ76 -> 2.6483827345071039E-2 | BU76: =BD76/BJ76 -> 1.3330039206335248E-2 | BV76: =BE76/BJ76 -> 2.0765493530033454E-2 | BW76: =BF76/BJ76 -> 1.1559696334452666E-2 | BX76: =BG76/BJ76 -> 1.6852049493704124E-2 | BY76: =BH76/BJ76 -> 3.3519267004493071E-2 | BZ76: =BI76/BJ76 -> 2.8726497356016279E-2 | CA76: =SUM(BK76:BZ76) -> 1
AC77: =AA!AC77+'A-hetero'!AC77+'a-homo'!AC77 -> 334 | AD77: =AA!AD77+'A-hetero'!AD77+'a-homo'!AD77 -> 463 | AE77: =AA!AE77+'A-hetero'!AE77+'a-homo'!AE77 -> 10 | AF77: =AA!AF77+'A-hetero'!AF77+'a-homo'!AF77 -> 9 | AG77: =AA!AG77+'A-hetero'!AG77+'a-homo'!AG77 -> 10 | AH77: =AA!AH77+'A-hetero'!AH77+'a-homo'!AH77 -> 10 | AI77: =AA!AI77+'A-hetero'!AI77+'a-homo'!AI77 -> 10 | AJ77: =AA!AJ77+'A-hetero'!AJ77+'a-homo'!AJ77 -> 10 | AK77: =AA!AK77+'A-hetero'!AK77+'a-homo'!AK77 -> 305 | AL77: =AA!AL77+'A-hetero'!AL77+'a-homo'!AL77 -> 37 | AM77: =AA!AM77+'A-hetero'!AM77+'a-homo'!AM77 -> 10 | AN77: =AA!AN77+'A-hetero'!AN77+'a-homo'!AN77 -> 10 | AO77: =AA!AO77+'A-hetero'!AO77+'a-homo'!AO77 -> 10 | AP77: =AA!AP77+'A-hetero'!AP77+'a-homo'!AP77 -> 10 | AQ77: =AA!AQ77+'A-hetero'!AQ77+'a-homo'!AQ77 -> 10 | AR77: =AA!AR77+'A-hetero'!AR77+'a-homo'!AR77 -> 10 | AS77: =SUM(AC77:AJ77) -> 856 | AT77: =AA!AT77+'A-hetero'!AT77+'a-homo'!AT77 -> 367.21316185012262 | AU77: =AA!AU77+'A-hetero'!AU77+'a-homo'!AU77 -> 512.1752583657269 | AV77: =AA!AV77+'A-hetero'!AV77+'a-homo'!AV77 -> 27.054260190986078 | AW77: =AA!AW77+'A-hetero'!AW77+'a-homo'!AW77 -> 18.416951322934516 | AX77: =AA!AX77+'A-hetero'!AX77+'a-homo'!AX77 -> 27.431144303362537 | AY77: =AA!AY77+'A-hetero'!AY77+'a-homo'!AY77 -> 18.372845313842742 | AZ77: =AA!AZ77+'A-hetero'!AZ77+'a-homo'!AZ77 -> 27.724792459646281 | BA77: =AA!BA77+'A-hetero'!BA77+'a-homo'!BA77 -> 48.611586193378386 | BB77: =AA!BB77+'A-hetero'!BB77+'a-homo'!BB77 -> 346.66905901650159 | BC77: =AA!BC77+'A-hetero'!BC77+'a-homo'!BC77 -> 43.486444500601564 | BD77: =AA!BD77+'A-hetero'!BD77+'a-homo'!BD77 -> 21.887924376779715 | BE77: =AA!BE77+'A-hetero'!BE77+'a-homo'!BE77 -> 34.096940376347064 | BF77: =AA!BF77+'A-hetero'!BF77+'a-homo'!BF77 -> 18.981021381152331 | BG77: =AA!BG77+'A-hetero'!BG77+'a-homo'!BG77 -> 27.671065268689759 | BH77: =AA!BH77+'A-hetero'!BH77+'a-homo'!BH77 -> 55.038636421448864 | BI77: =AA!BI77+'A-hetero'!BI77+'a-homo'!BI77 -> 47.168908658479097 | BJ77: =SUM(AT77:BI77) -> 1642 | BK77: =AT77/BJ77 -> 0.22363773559690783 | BL77: =AU77/BJ77 -> 0.31192159461980934 | BM77: =AV77/BJ77 -> 1.6476406937263145E-2 | BN77: =AW77/BJ77 -> 1.1216170111409572E-2 | BO77: =AX77/BJ77 -> 1.6705934411304836E-2 | BP77: =AY77/BJ77 -> 1.1189308960927371E-2 | BQ77: =AZ77/BJ77 -> 1.6884770072866189E-2 | BR77: =BA77/BJ77 -> 2.9605107304128131E-2 | BS77: =BB77/BJ77 -> 0.21112610171528723 | BT77: =BC77/BJ77 -> 2.6483827345067948E-2 | BU77: =BD77/BJ77 -> 1.3330039206321387E-2 | BV77: =BE77/BJ77 -> 2.0765493530053025E-2 | BW77: =BF77/BJ77 -> 1.1559696334441129E-2 | BX77: =BG77/BJ77 -> 1.6852049493720926E-2 | BY77: =BH77/BJ77 -> 3.351926700453646E-2 | BZ77: =BI77/BJ77 -> 2.8726497355955605E-2 | CA77: =SUM(BK77:BZ77) -> 1
AC78: =AA!AC78+'A-hetero'!AC78+'a-homo'!AC78 -> 334 | AD78: =AA!AD78+'A-hetero'!AD78+'a-homo'!AD78 -> 463 | AE78: =AA!AE78+'A-hetero'!AE78+'a-homo'!AE78 -> 10 | AF78: =AA!AF78+'A-hetero'!AF78+'a-homo'!AF78 -> 9 | AG78: =AA!AG78+'A-hetero'!AG78+'a-homo'!AG78 -> 10 | AH78: =AA!AH78+'A-hetero'!AH78+'a-homo'!AH78 -> 10 | AI78: =AA!AI78+'A-hetero'!AI78+'a-homo'!AI78 -> 10 | AJ78: =AA!AJ78+'A-hetero'!AJ78+'a-homo'!AJ78 -> 10 | AK78: =AA!AK78+'A-hetero'!AK78+'a-homo'!AK78 -> 305 | AL78: =AA!AL78+'A-hetero'!AL78+'a-homo'!AL78 -> 37 | AM78: =AA!AM78+'A-hetero'!AM78+'a-homo'!AM78 -> 10 | AN78: =AA!AN78+'A-hetero'!AN78+'a-homo'!AN78 -> 10 | AO78: =AA!AO78+'A-hetero'!AO78+'a-homo'!AO78 -> 10 | AP78: =AA!AP78+'A-hetero'!AP78+'a-homo'!AP78 -> 10 | AQ78: =AA!AQ78+'A-hetero'!AQ78+'a-homo'!AQ78 -> 10 | AR78: =AA!AR78+'A-hetero'!AR78+'a-homo'!AR78 -> 10 | AS78: =SUM(AC78:AJ78) -> 856 | AT78: =AA!AT78+'A-hetero'!AT78+'a-homo'!AT78 -> 367.21316185009209 | AU78: =AA!AU78+'A-hetero'!AU78+'a-homo'!AU78 -> 512.17525836574498 | AV78: =AA!AV78+'A-hetero'!AV78+'a-homo'!AV78 -> 27.054260190999315 | AW78: =AA!AW78+'A-hetero'!AW78+'a-homo'!AW78 -> 18.416951322919502 | AX78: =AA!AX78+'A-hetero'!AX78+'a-homo'!AX78 -> 27.43114430337387 | AY78: =AA!AY78+'A-hetero'!AY78+'a-homo'!AY78 -> 18.372845313830148 | AZ78: =AA!AZ78+'A-hetero'!AZ78+'a-homo'!AZ78 -> 27.724792459619991 | BA78: =AA!BA78+'A-hetero'!BA78+'a-homo'!BA78 -> 48.611586193420067 | BB78: =AA!BB78+'A-hetero'!BB78+'a-homo'!BB78 -> 346.66905901651268 | BC78: =AA!BC78+'A-hetero'!BC78+'a-homo'!BC78 -> 43.486444500597941 | BD78: =AA!BD78+'A-hetero'!BD78+'a-homo'!BD78 -> 21.887924376763429 | BE78: =AA!BE78+'A-hetero'!BE78+'a-homo'!BE78 -> 34.09694037637005 | BF78: =AA!BF78+'A-hetero'!BF78+'a-homo'!BF78 -> 18.981021381138774 | BG78: =AA!BG78+'A-hetero'!BG78+'a-homo'!BG78 -> 27.671065268709505 | BH78: =AA!BH78+'A-hetero'!BH78+'a-homo'!BH78 -> 55.038636421499831 | BI78: =AA!BI78+'A-hetero'!BI78+'a-homo'!BI78 -> 47.168908658407815 | BJ78: =SUM(AT78:BI78) -> 1642 | BK78: =AT78/BJ78 -> 0.22363773559688921 | BL78: =AU78/BJ78 -> 0.31192159461982033 | BM78: =AV78/BJ78 -> 1.6476406937271204E-2 | BN78: =AW78/BJ78 -> 1.1216170111400428E-2 | BO78: =AX78/BJ78 -> 1.6705934411311737E-2 | BP78: =AY78/BJ78 -> 1.11893089609197E-2 | BQ78: =AZ78/BJ78 -> 1.6884770072850178E-2 | BR78: =BA78/BJ78 -> 2.9605107304153513E-2 | BS78: =BB78/BJ78 -> 0.21112610171529395 | BT78: =BC78/BJ78 -> 2.6483827345065738E-2 | BU78: =BD78/BJ78 -> 1.3330039206311468E-2 | BV78: =BE78/BJ78 -> 2.0765493530067021E-2 | BW78: =BF78/BJ78 -> 1.1559696334432872E-2 | BX78: =BG78/BJ78 -> 1.6852049493732951E-2 | BY78: =BH78/BJ78 -> 3.3519267004567498E-2 | BZ78: =BI78/BJ78 -> 2.8726497355912189E-2 | CA78: =SUM(BK78:BZ78) -> 1
AC79: =AA!AC79+'A-hetero'!AC79+'a-homo'!AC79 -> 334 | AD79: =AA!AD79+'A-hetero'!AD79+'a-homo'!AD79 -> 463 | AE79: =AA!AE79+'A-hetero'!AE79+'a-homo'!AE79 -> 10 | AF79: =AA!AF79+'A-hetero'!AF79+'a-homo'!AF79 -> 9 | AG79: =AA!AG79+'A-hetero'!AG79+'a-homo'!AG79 -> 10 | AH79: =AA!AH79+'A-hetero'!AH79+'a-homo'!AH79 -> 10 | AI79: =AA!AI79+'A-hetero'!AI79+'a-homo'!AI79 -> 10 | AJ79: =AA!AJ79+'A-hetero'!AJ79+'a-homo'!AJ79 -> 10 | AK79: =AA!AK79+'A-hetero'!AK79+'a-homo'!AK79 -> 305 | AL79: =AA!AL79+'A-hetero'!AL79+'a-homo'!AL79 -> 37 | AM79: =AA!AM79+'A-hetero'!AM79+'a-homo'!AM79 -> 10 | AN79: =AA!AN79+'A-hetero'!AN79+'a-homo'!AN79 -> 10 | AO79: =AA!AO79+'A-hetero'!AO79+'a-homo'!AO79 -> 10 | AP79: =AA!AP79+'A-hetero'!AP79+'a-homo'!AP79 -> 10 | AQ79: =AA!AQ79+'A-hetero'!AQ79+'a-homo'!AQ79 -> 10 | AR79: =AA!AR79+'A-hetero'!AR79+'a-homo'!AR79 -> 10 | AS79: =SUM(AC79:AJ79) -> 856 | AT79: =AA!AT79+'A-hetero'!AT79+'a-homo'!AT79 -> 367.21316185007032 | AU79: =AA!AU79+'A-hetero'!AU79+'a-homo'!AU79 -> 512.17525836575794 | AV79: =AA!AV79+'A-hetero'!AV79+'a-homo'!AV79 -> 27.054260191008787 | AW79: =AA!AW79+'A-hetero'!AW79+'a-homo'!AW79 -> 18.416951322908766 | AX79: =AA!AX79+'A-hetero'!AX79+'a-homo'!AX79 -> 27.431144303381984 | AY79: =AA!AY79+'A-hetero'!AY79+'a-homo'!AY79 -> 18.372845313821134 | AZ79: =AA!AZ79+'A-hetero'!AZ79+'a-homo'!AZ79 -> 27.724792459601186 | BA79: =AA!BA79+'A-hetero'!BA79+'a-homo'!BA79 -> 48.611586193449881 | BB79: =AA!BB79+'A-hetero'!BB79+'a-homo'!BB79 -> 346.66905901652058 | BC79: =AA!BC79+'A-hetero'!BC79+'a-homo'!BC79 -> 43.486444500595354 | BD79: =AA!BD79+'A-hetero'!BD79+'a-homo'!BD79 -> 21.88792437675178 | BE79: =AA!BE79+'A-hetero'!BE79+'a-homo'!BE79 -> 34.096940376386485 | BF79: =AA!BF79+'A-hetero'!BF79+'a-homo'!BF79 -> 18.981021381129082 | BG79: =AA!BG79+'A-hetero'!BG79+'a-homo'!BG79 -> 27.67106526872363 | BH79: =AA!BH79+'A-hetero'!BH79+'a-homo'!BH79 -> 55.038636421536303 | BI79: =AA!BI79+'A-hetero'!BI79+'a-homo'!BI79 -> 47.168908658356813 | BJ79: =SUM(AT79:BI79) -> 1642 | BK79: =AT79/BJ79 -> 0.223637735596876 | BL79: =AU79/BJ79 -> 0.31192159461982827 | BM79: =AV79/BJ79 -> 1.6476406937276974E-2 | BN79: =AW79/BJ79 -> 1.121617011139389E-2 | BO79: =AX79/BJ79 -> 1.6705934411316681E-2 | BP79: =AY79/BJ79 -> 1.1189308960914213E-2 | BQ79: =AZ79/BJ79 -> 1.6884770072838728E-2 | BR79: =BA79/BJ79 -> 2.9605107304171673E-2 | BS79: =BB79/BJ79 -> 0.2111261017152988 | BT79: =BC79/BJ79 -> 2.6483827345064166E-2 | BU79: =BD79/BJ79 -> 1.3330039206304375E-2 | BV79: =BE79/BJ79 -> 2.0765493530077034E-2 | BW79: =BF79/BJ79 -> 1.155969633442697E-2 | BX79: =BG79/BJ79 -> 1.6852049493741555E-2 | BY79: =BH79/BJ79 -> 3.3519267004589716E-2 | BZ79: =BI79/BJ79 -> 2.8726497355881134E-2 | CA79: =SUM(BK79:BZ79) -> 1
AC80: =AA!AC80+'A-hetero'!AC80+'a-homo'!AC80 -> 334 | AD80: =AA!AD80+'A-hetero'!AD80+'a-homo'!AD80 -> 463 | AE80: =AA!AE80+'A-hetero'!AE80+'a-homo'!AE80 -> 10 | AF80: =AA!AF80+'A-hetero'!AF80+'a-homo'!AF80 -> 9 | AG80: =AA!AG80+'A-hetero'!AG80+'a-homo'!AG80 -> 10 | AH80: =AA!AH80+'A-hetero'!AH80+'a-homo'!AH80 -> 10 | AI80: =AA!AI80+'A-hetero'!AI80+'a-homo'!AI80 -> 10 | AJ80: =AA!AJ80+'A-hetero'!AJ80+'a-homo'!AJ80 -> 10 | AK80: =AA!AK80+'A-hetero'!AK80+'a-homo'!AK80 -> 305 | AL80: =AA!AL80+'A-hetero'!AL80+'a-homo'!AL80 -> 37 | AM80: =AA!AM80+'A-hetero'!AM80+'a-homo'!AM80 -> 10 | AN80: =AA!AN80+'A-hetero'!AN80+'a-homo'!AN80 -> 10 | AO80: =AA!AO80+'A-hetero'!AO80+'a-homo'!AO80 -> 10 | AP80: =AA!AP80+'A-hetero'!AP80+'a-homo'!AP80 -> 10 | AQ80: =AA!AQ80+'A-hetero'!AQ80+'a-homo'!AQ80 -> 10 | AR80: =AA!AR80+'A-hetero'!AR80+'a-homo'!AR80 -> 10 | AS80: =SUM(AC80:AJ80) -> 856 | AT80: =AA!AT80+'A-hetero'!AT80+'a-homo'!AT80 -> 367.21316185005469 | AU80: =AA!AU80+'A-hetero'!AU80+'a-homo'!AU80 -> 512.17525836576726 | AV80: =AA!AV80+'A-hetero'!AV80+'a-homo'!AV80 -> 27.054260191015562 | AW80: =AA!AW80+'A-hetero'!AW80+'a-homo'!AW80 -> 18.416951322901085 | AX80: =AA!AX80+'A-hetero'!AX80+'a-homo'!AX80 -> 27.431144303387782 | AY80: =AA!AY80+'A-hetero'!AY80+'a-homo'!AY80 -> 18.37284531381469 | AZ80: =AA!AZ80+'A-hetero'!AZ80+'a-homo'!AZ80 -> 27.724792459587732 | BA80: =AA!BA80+'A-hetero'!BA80+'a-homo'!BA80 -> 48.611586193471211 | BB80: =AA!BB80+'A-hetero'!BB80+'a-homo'!BB80 -> 346.66905901652626 | BC80: =AA!BC80+'A-hetero'!BC80+'a-homo'!BC80 -> 43.486444500593493 | BD80: =AA!BD80+'A-hetero'!BD80+'a-homo'!BD80 -> 21.887924376743445 | BE80: =AA!BE80+'A-hetero'!BE80+'a-homo'!BE80 -> 34.096940376398251 | BF80: =AA!BF80+'A-hetero'!BF80+'a-homo'!BF80 -> 18.981021381122144 | BG80: =AA!BG80+'A-hetero'!BG80+'a-homo'!BG80 -> 27.671065268733734 | BH80: =AA!BH80+'A-hetero'!BH80+'a-homo'!BH80 -> 55.038636421562387 | BI80: =AA!BI80+'A-hetero'!BI80+'a-homo'!BI80 -> 47.168908658320326 | BJ80: =SUM(AT80:BI80) -> 1642 | BK80: =AT80/BJ80 -> 0.22363773559686645 | BL80: =AU80/BJ80 -> 0.31192159461983388 | BM80: =AV80/BJ80 -> 1.6476406937281099E-2 | BN80: =AW80/BJ80 -> 1.1216170111389211E-2 | BO80: =AX80/BJ80 -> 1.6705934411320209E-2 | BP80: =AY80/BJ80 -> 1.1189308960910286E-2 | BQ80: =AZ80/BJ80 -> 1.688477007283053E-2 | BR80: =BA80/BJ80 -> 2.9605107304184659E-2 | BS80: =BB80/BJ80 -> 0.21112610171530222 | BT80: =BC80/BJ80 -> 2.6483827345063028E-2 | BU80: =BD80/BJ80 -> 1.3330039206299297E-2 | BV80: =BE80/BJ80 -> 2.0765493530084198E-2 | BW80: =BF80/BJ80 -> 1.1559696334422742E-2 | BX80: =BG80/BJ80 -> 1.6852049493747707E-2 | BY80: =BH80/BJ80 -> 3.3519267004605592E-2 | BZ80: =BI80/BJ80 -> 2.8726497355858908E-2 | CA80: =SUM(BK80:BZ80) -> 1
AC81: =AA!AC81+'A-hetero'!AC81+'a-homo'!AC81 -> 334 | AD81: =AA!AD81+'A-hetero'!AD81+'a-homo'!AD81 -> 463 | AE81: =AA!AE81+'A-hetero'!AE81+'a-homo'!AE81 -> 10 | AF81: =AA!AF81+'A-hetero'!AF81+'a-homo'!AF81 -> 9 | AG81: =AA!AG81+'A-hetero'!AG81+'a-homo'!AG81 -> 10 | AH81: =AA!AH81+'A-hetero'!AH81+'a-homo'!AH81 -> 10 | AI81: =AA!AI81+'A-hetero'!AI81+'a-homo'!AI81 -> 10 | AJ81: =AA!AJ81+'A-hetero'!AJ81+'a-homo'!AJ81 -> 10 | AK81: =AA!AK81+'A-hetero'!AK81+'a-homo'!AK81 -> 305 | AL81: =AA!AL81+'A-hetero'!AL81+'a-homo'!AL81 -> 37 | AM81: =AA!AM81+'A-hetero'!AM81+'a-homo'!AM81 -> 10 | AN81: =AA!AN81+'A-hetero'!AN81+'a-homo'!AN81 -> 10 | AO81: =AA!AO81+'A-hetero'!AO81+'a-homo'!AO81 -> 10 | AP81: =AA!AP81+'A-hetero'!AP81+'a-homo'!AP81 -> 10 | AQ81: =AA!AQ81+'A-hetero'!AQ81+'a-homo'!AQ81 -> 10 | AR81: =AA!AR81+'A-hetero'!AR81+'a-homo'!AR81 -> 10 | AS81: =SUM(AC81:AJ81) -> 856 | AT81: =AA!AT81+'A-hetero'!AT81+'a-homo'!AT81 -> 367.21316185004355 | AU81: =AA!AU81+'A-hetero'!AU81+'a-homo'!AU81 -> 512.17525836577386 | AV81: =AA!AV81+'A-hetero'!AV81+'a-homo'!AV81 -> 27.054260191020411 | AW81: =AA!AW81+'A-hetero'!AW81+'a-homo'!AW81 -> 18.416951322895589 | AX81: =AA!AX81+'A-hetero'!AX81+'a-homo'!AX81 -> 27.431144303391935 | AY81: =AA!AY81+'A-hetero'!AY81+'a-homo'!AY81 -> 18.372845313810078 | AZ81: =AA!AZ81+'A-hetero'!AZ81+'a-homo'!AZ81 -> 27.724792459578104 | BA81: =AA!BA81+'A-hetero'!BA81+'a-homo'!BA81 -> 48.61158619348646 | BB81: =AA!BB81+'A-hetero'!BB81+'a-homo'!BB81 -> 346.66905901653024 | BC81: =AA!BC81+'A-hetero'!BC81+'a-homo'!BC81 -> 43.486444500592164 | BD81: =AA!BD81+'A-hetero'!BD81+'a-homo'!BD81 -> 21.887924376737487 | BE81: =AA!BE81+'A-hetero'!BE81+'a-homo'!BE81 -> 34.096940376406671 | BF81: =AA!BF81+'A-hetero'!BF81+'a-homo'!BF81 -> 18.981021381117181 | BG81: =AA!BG81+'A-hetero'!BG81+'a-homo'!BG81 -> 27.671065268740968 | BH81: =AA!BH81+'A-hetero'!BH81+'a-homo'!BH81 -> 55.038636421581053 | BI81: =AA!BI81+'A-hetero'!BI81+'a-homo'!BI81 -> 47.168908658294214 | BJ81: =SUM(AT81:BI81) -> 1642 | BK81: =AT81/BJ81 -> 0.22363773559685965 | BL81: =AU81/BJ81 -> 0.31192159461983793 | BM81: =AV81/BJ81 -> 1.6476406937284051E-2 | BN81: =AW81/BJ81 -> 1.1216170111385863E-2 | BO81: =AX81/BJ81 -> 1.6705934411322738E-2 | BP81: =AY81/BJ81 -> 1.1189308960907477E-2 | BQ81: =AZ81/BJ81 -> 1.6884770072824667E-2 | BR81: =BA81/BJ81 -> 2.9605107304193946E-2 | BS81: =BB81/BJ81 -> 0.21112610171530466 | BT81: =BC81/BJ81 -> 2.648382734506222E-2 | BU81: =BD81/BJ81 -> 1.3330039206295668E-2 | BV81: =BE81/BJ81 -> 2.0765493530089326E-2 | BW81: =BF81/BJ81 -> 1.1559696334419721E-2 | BX81: =BG81/BJ81 -> 1.6852049493752113E-2 | BY81: =BH81/BJ81 -> 3.3519267004616965E-2 | BZ81: =BI81/BJ81 -> 2.8726497355843005E-2 | CA81: =SUM(BK81:BZ81) -> 1
AC82: =AA!AC82+'A-hetero'!AC82+'a-homo'!AC82 -> 334 | AD82: =AA!AD82+'A-hetero'!AD82+'a-homo'!AD82 -> 463 | AE82: =AA!AE82+'A-hetero'!AE82+'a-homo'!AE82 -> 10 | AF82: =AA!AF82+'A-hetero'!AF82+'a-homo'!AF82 -> 9 | AG82: =AA!AG82+'A-hetero'!AG82+'a-homo'!AG82 -> 10 | AH82: =AA!AH82+'A-hetero'!AH82+'a-homo'!AH82 -> 10 | AI82: =AA!AI82+'A-hetero'!AI82+'a-homo'!AI82 -> 10 | AJ82: =AA!AJ82+'A-hetero'!AJ82+'a-homo'!AJ82 -> 10 | AK82: =AA!AK82+'A-hetero'!AK82+'a-homo'!AK82 -> 305 | AL82: =AA!AL82+'A-hetero'!AL82+'a-homo'!AL82 -> 37 | AM82: =AA!AM82+'A-hetero'!AM82+'a-homo'!AM82 -> 10 | AN82: =AA!AN82+'A-hetero'!AN82+'a-homo'!AN82 -> 10 | AO82: =AA!AO82+'A-hetero'!AO82+'a-homo'!AO82 -> 10 | AP82: =AA!AP82+'A-hetero'!AP82+'a-homo'!AP82 -> 10 | AQ82: =AA!AQ82+'A-hetero'!AQ82+'a-homo'!AQ82 -> 10 | AR82: =AA!AR82+'A-hetero'!AR82+'a-homo'!AR82 -> 10 | AS82: =SUM(AC82:AJ82) -> 856 | AT82: =AA!AT82+'A-hetero'!AT82+'a-homo'!AT82 -> 367.21316185003559 | AU82: =AA!AU82+'A-hetero'!AU82+'a-homo'!AU82 -> 512.17525836577852 | AV82: =AA!AV82+'A-hetero'!AV82+'a-homo'!AV82 -> 27.054260191023879 | AW82: =AA!AW82+'A-hetero'!AW82+'a-homo'!AW82 -> 18.416951322891656 | AX82: =AA!AX82+'A-hetero'!AX82+'a-homo'!AX82 -> 27.431144303394902 | AY82: =AA!AY82+'A-hetero'!AY82+'a-homo'!AY82 -> 18.372845313806778 | AZ82: =AA!AZ82+'A-hetero'!AZ82+'a-homo'!AZ82 -> 27.724792459571219 | BA82: =AA!BA82+'A-hetero'!BA82+'a-homo'!BA82 -> 48.611586193497388 | BB82: =AA!BB82+'A-hetero'!BB82+'a-homo'!BB82 -> 346.6690590165332 | BC82: =AA!BC82+'A-hetero'!BC82+'a-homo'!BC82 -> 43.486444500591212 | BD82: =AA!BD82+'A-hetero'!BD82+'a-homo'!BD82 -> 21.887924376733221 | BE82: =AA!BE82+'A-hetero'!BE82+'a-homo'!BE82 -> 34.096940376412697 | BF82: =AA!BF82+'A-hetero'!BF82+'a-homo'!BF82 -> 18.981021381113628 | BG82: =AA!BG82+'A-hetero'!BG82+'a-homo'!BG82 -> 27.671065268746137 | BH82: =AA!BH82+'A-hetero'!BH82+'a-homo'!BH82 -> 55.038636421594411 | BI82: =AA!BI82+'A-hetero'!BI82+'a-homo'!BI82 -> 47.168908658275548 | BJ82: =SUM(AT82:BI82) -> 1642 | BK82: =AT82/BJ82 -> 0.22363773559685479 | BL82: =AU82/BJ82 -> 0.31192159461984076 | BM82: =AV82/BJ82 -> 1.6476406937286161E-2 | BN82: =AW82/BJ82 -> 1.1216170111383469E-2 | BO82: =AX82/BJ82 -> 1.6705934411324546E-2 | BP82: =AY82/BJ82 -> 1.1189308960905468E-2 | BQ82: =AZ82/BJ82 -> 1.6884770072820476E-2 | BR82: =BA82/BJ82 -> 2.9605107304200601E-2 | BS82: =BB82/BJ82 -> 0.21112610171530646 | BT82: =BC82/BJ82 -> 2.648382734506164E-2 | BU82: =BD82/BJ82 -> 1.333003920629307E-2 | BV82: =BE82/BJ82 -> 2.0765493530092993E-2 | BW82: =BF82/BJ82 -> 1.1559696334417557E-2 | BX82: =BG82/BJ82 -> 1.685204949375526E-2 | BY82: =BH82/BJ82 -> 3.3519267004625097E-2 | BZ82: =BI82/BJ82 -> 2.8726497355831639E-2 | CA82: =SUM(BK82:BZ82) -> 1
AC83: =AA!AC83+'A-hetero'!AC83+'a-homo'!AC83 -> 334 | AD83: =AA!AD83+'A-hetero'!AD83+'a-homo'!AD83 -> 463 | AE83: =AA!AE83+'A-hetero'!AE83+'a-homo'!AE83 -> 10 | AF83: =AA!AF83+'A-hetero'!AF83+'a-homo'!AF83 -> 9 | AG83: =AA!AG83+'A-hetero'!AG83+'a-homo'!AG83 -> 10 | AH83: =AA!AH83+'A-hetero'!AH83+'a-homo'!AH83 -> 10 | AI83: =AA!AI83+'A-hetero'!AI83+'a-homo'!AI83 -> 10 | AJ83: =AA!AJ83+'A-hetero'!AJ83+'a-homo'!AJ83 -> 10 | AK83: =AA!AK83+'A-hetero'!AK83+'a-homo'!AK83 -> 305 | AL83: =AA!AL83+'A-hetero'!AL83+'a-homo'!AL83 -> 37 | AM83: =AA!AM83+'A-hetero'!AM83+'a-homo'!AM83 -> 10 | AN83: =AA!AN83+'A-hetero'!AN83+'a-homo'!AN83 -> 10 | AO83: =AA!AO83+'A-hetero'!AO83+'a-homo'!AO83 -> 10 | AP83: =AA!AP83+'A-hetero'!AP83+'a-homo'!AP83 -> 10 | AQ83: =AA!AQ83+'A-hetero'!AQ83+'a-homo'!AQ83 -> 10 | AR83: =AA!AR83+'A-hetero'!AR83+'a-homo'!AR83 -> 10 | AS83: =SUM(AC83:AJ83) -> 856 | AT83: =AA!AT83+'A-hetero'!AT83+'a-homo'!AT83 -> 367.21316185002991 | AU83: =AA!AU83+'A-hetero'!AU83+'a-homo'!AU83 -> 512.17525836578193 | AV83: =AA!AV83+'A-hetero'!AV83+'a-homo'!AV83 -> 27.054260191026362 | AW83: =AA!AW83+'A-hetero'!AW83+'a-homo'!AW83 -> 18.416951322888842 | AX83: =AA!AX83+'A-hetero'!AX83+'a-homo'!AX83 -> 27.43114430339703 | AY83: =AA!AY83+'A-hetero'!AY83+'a-homo'!AY83 -> 18.372845313804415 | AZ83: =AA!AZ83+'A-hetero'!AZ83+'a-homo'!AZ83 -> 27.724792459566288 | BA83: =AA!BA83+'A-hetero'!BA83+'a-homo'!BA83 -> 48.61158619350519 | BB83: =AA!BB83+'A-hetero'!BB83+'a-homo'!BB83 -> 346.66905901653524 | BC83: =AA!BC83+'A-hetero'!BC83+'a-homo'!BC83 -> 43.48644450059053 | BD83: =AA!BD83+'A-hetero'!BD83+'a-homo'!BD83 -> 21.887924376730162 | BE83: =AA!BE83+'A-hetero'!BE83+'a-homo'!BE83 -> 34.09694037641701 | BF83: =AA!BF83+'A-hetero'!BF83+'a-homo'!BF83 -> 18.981021381111084 | BG83: =AA!BG83+'A-hetero'!BG83+'a-homo'!BG83 -> 27.671065268749842 | BH83: =AA!BH83+'A-hetero'!BH83+'a-homo'!BH83 -> 55.038636421603947 | BI83: =AA!BI83+'A-hetero'!BI83+'a-homo'!BI83 -> 47.168908658262183 | BJ83: =SUM(AT83:BI83) -> 1642 | BK83: =AT83/BJ83 -> 0.22363773559685135 | BL83: =AU83/BJ83 -> 0.31192159461984281 | BM83: =AV83/BJ83 -> 1.6476406937287674E-2 | BN83: =AW83/BJ83 -> 1.1216170111381756E-2 | BO83: =AX83/BJ83 -> 1.670593441132584E-2 | BP83: =AY83/BJ83 -> 1.1189308960904028E-2 | BQ83: =AZ83/BJ83 -> 1.6884770072817471E-2 | BR83: =BA83/BJ83 -> 2.9605107304205354E-2 | BS83: =BB83/BJ83 -> 0.21112610171530771 | BT83: =BC83/BJ83 -> 2.6483827345061224E-2 | BU83: =BD83/BJ83 -> 1.3330039206291206E-2 | BV83: =BE83/BJ83 -> 2.076549353009562E-2 | BW83: =BF83/BJ83 -> 1.1559696334416007E-2 | BX83: =BG83/BJ83 -> 1.6852049493757518E-2 | BY83: =BH83/BJ83 -> 3.3519267004630905E-2 | BZ83: =BI83/BJ83 -> 2.8726497355823496E-2 | CA83: =SUM(BK83:BZ83) -> 1
AC84: =AA!AC84+'A-hetero'!AC84+'a-homo'!AC84 -> 334 | AD84: =AA!AD84+'A-hetero'!AD84+'a-homo'!AD84 -> 463 | AE84: =AA!AE84+'A-hetero'!AE84+'a-homo'!AE84 -> 10 | AF84: =AA!AF84+'A-hetero'!AF84+'a-homo'!AF84 -> 9 | AG84: =AA!AG84+'A-hetero'!AG84+'a-homo'!AG84 -> 10 | AH84: =AA!AH84+'A-hetero'!AH84+'a-homo'!AH84 -> 10 | AI84: =AA!AI84+'A-hetero'!AI84+'a-homo'!AI84 -> 10 | AJ84: =AA!AJ84+'A-hetero'!AJ84+'a-homo'!AJ84 -> 10 | AK84: =AA!AK84+'A-hetero'!AK84+'a-homo'!AK84 -> 305 | AL84: =AA!AL84+'A-hetero'!AL84+'a-homo'!AL84 -> 37 | AM84: =AA!AM84+'A-hetero'!AM84+'a-homo'!AM84 -> 10 | AN84: =AA!AN84+'A-hetero'!AN84+'a-homo'!AN84 -> 10 | AO84: =AA!AO84+'A-hetero'!AO84+'a-homo'!AO84 -> 10 | AP84: =AA!AP84+'A-hetero'!AP84+'a-homo'!AP84 -> 10 | AQ84: =AA!AQ84+'A-hetero'!AQ84+'a-homo'!AQ84 -> 10 | AR84: =AA!AR84+'A-hetero'!AR84+'a-homo'!AR84 -> 10 | AS84: =SUM(AC84:AJ84) -> 856 | AT84: =AA!AT84+'A-hetero'!AT84+'a-homo'!AT84 -> 367.21316185002581 | AU84: =AA!AU84+'A-hetero'!AU84+'a-homo'!AU84 -> 512.17525836578443 | AV84: =AA!AV84+'A-hetero'!AV84+'a-homo'!AV84 -> 27.054260191028142 | AW84: =AA!AW84+'A-hetero'!AW84+'a-homo'!AW84 -> 18.416951322886824 | AX84: =AA!AX84+'A-hetero'!AX84+'a-homo'!AX84 -> 27.43114430339855 | AY84: =AA!AY84+'A-hetero'!AY84+'a-homo'!AY84 -> 18.372845313802728 | AZ84: =AA!AZ84+'A-hetero'!AZ84+'a-homo'!AZ84 -> 27.724792459562764 | BA84: =AA!BA84+'A-hetero'!BA84+'a-homo'!BA84 -> 48.611586193510789 | BB84: =AA!BB84+'A-hetero'!BB84+'a-homo'!BB84 -> 346.66905901653672 | BC84: =AA!BC84+'A-hetero'!BC84+'a-homo'!BC84 -> 43.486444500590039 | BD84: =AA!BD84+'A-hetero'!BD84+'a-homo'!BD84 -> 21.88792437672798 | BE84: =AA!BE84+'A-hetero'!BE84+'a-homo'!BE84 -> 34.096940376420093 | BF84: =AA!BF84+'A-hetero'!BF84+'a-homo'!BF84 -> 18.981021381109269 | BG84: =AA!BG84+'A-hetero'!BG84+'a-homo'!BG84 -> 27.671065268752489 | BH84: =AA!BH84+'A-hetero'!BH84+'a-homo'!BH84 -> 55.038636421610789 | BI84: =AA!BI84+'A-hetero'!BI84+'a-homo'!BI84 -> 47.168908658252619 | BJ84: =SUM(AT84:BI84) -> 1642 | BK84: =AT84/BJ84 -> 0.22363773559684885 | BL84: =AU84/BJ84 -> 0.31192159461984437 | BM84: =AV84/BJ84 -> 1.6476406937288759E-2 | BN84: =AW84/BJ84 -> 1.1216170111380526E-2 | BO84: =AX84/BJ84 -> 1.6705934411326766E-2 | BP84: =AY84/BJ84 -> 1.1189308960903002E-2 | BQ84: =AZ84/BJ84 -> 1.6884770072815324E-2 | BR84: =BA84/BJ84 -> 2.9605107304208764E-2 | BS84: =BB84/BJ84 -> 0.2111261017153086 | BT84: =BC84/BJ84 -> 2.6483827345060926E-2 | BU84: =BD84/BJ84 -> 1.3330039206289878E-2 | BV84: =BE84/BJ84 -> 2.07654935300975E-2 | BW84: =BF84/BJ84 -> 1.1559696334414902E-2 | BX84: =BG84/BJ84 -> 1.6852049493759128E-2 | BY84: =BH84/BJ84 -> 3.3519267004635075E-2 | BZ84: =BI84/BJ84 -> 2.8726497355817674E-2 | CA84: =SUM(BK84:BZ84) -> 1
AC85: =AA!AC85+'A-hetero'!AC85+'a-homo'!AC85 -> 334 | AD85: =AA!AD85+'A-hetero'!AD85+'a-homo'!AD85 -> 463 | AE85: =AA!AE85+'A-hetero'!AE85+'a-homo'!AE85 -> 10 | AF85: =AA!AF85+'A-hetero'!AF85+'a-homo'!AF85 -> 9 | AG85: =AA!AG85+'A-hetero'!AG85+'a-homo'!AG85 -> 10 | AH85: =AA!AH85+'A-hetero'!AH85+'a-homo'!AH85 -> 10 | AI85: =AA!AI85+'A-hetero'!AI85+'a-homo'!AI85 -> 10 | AJ85: =AA!AJ85+'A-hetero'!AJ85+'a-homo'!AJ85 -> 10 | AK85: =AA!AK85+'A-hetero'!AK85+'a-homo'!AK85 -> 305 | AL85: =AA!AL85+'A-hetero'!AL85+'a-homo'!AL85 -> 37 | AM85: =AA!AM85+'A-hetero'!AM85+'a-homo'!AM85 -> 10 | AN85: =AA!AN85+'A-hetero'!AN85+'a-homo'!AN85 -> 10 | AO85: =AA!AO85+'A-hetero'!AO85+'a-homo'!AO85 -> 10 | AP85: =AA!AP85+'A-hetero'!AP85+'a-homo'!AP85 -> 10 | AQ85: =AA!AQ85+'A-hetero'!AQ85+'a-homo'!AQ85 -> 10 | AR85: =AA!AR85+'A-hetero'!AR85+'a-homo'!AR85 -> 10 | AS85: =SUM(AC85:AJ85) -> 856 | AT85: =AA!AT85+'A-hetero'!AT85+'a-homo'!AT85 -> 367.21316185002286 | AU85: =AA!AU85+'A-hetero'!AU85+'a-homo'!AU85 -> 512.17525836578614 | AV85: =AA!AV85+'A-hetero'!AV85+'a-homo'!AV85 -> 27.054260191029414 | AW85: =AA!AW85+'A-hetero'!AW85+'a-homo'!AW85 -> 18.416951322885382 | AX85: =AA!AX85+'A-hetero'!AX85+'a-homo'!AX85 -> 27.431144303399641 | AY85: =AA!AY85+'A-hetero'!AY85+'a-homo'!AY85 -> 18.37284531380152 | AZ85: =AA!AZ85+'A-hetero'!AZ85+'a-homo'!AZ85 -> 27.724792459560241 | BA85: =AA!BA85+'A-hetero'!BA85+'a-homo'!BA85 -> 48.611586193514782 | BB85: =AA!BB85+'A-hetero'!BB85+'a-homo'!BB85 -> 346.66905901653774 | BC85: =AA!BC85+'A-hetero'!BC85+'a-homo'!BC85 -> 43.486444500589698 | BD85: =AA!BD85+'A-hetero'!BD85+'a-homo'!BD85 -> 21.887924376726417 | BE85: =AA!BE85+'A-hetero'!BE85+'a-homo'!BE85 -> 34.096940376422296 | BF85: =AA!BF85+'A-hetero'!BF85+'a-homo'!BF85 -> 18.981021381107972 | BG85: =AA!BG85+'A-hetero'!BG85+'a-homo'!BG85 -> 27.671065268754383 | BH85: =AA!BH85+'A-hetero'!BH85+'a-homo'!BH85 -> 55.038636421615678 | BI85: =AA!BI85+'A-hetero'!BI85+'a-homo'!BI85 -> 47.168908658245783 | BJ85: =SUM(AT85:BI85) -> 1642 | BK85: =AT85/BJ85 -> 0.2236377355968471 | BL85: =AU85/BJ85 -> 0.31192159461984548 | BM85: =AV85/BJ85 -> 1.6476406937289537E-2 | BN85: =AW85/BJ85 -> 1.1216170111379651E-2 | BO85: =AX85/BJ85 -> 1.6705934411327436E-2 | BP85: =AY85/BJ85 -> 1.1189308960902268E-2 | BQ85: =AZ85/BJ85 -> 1.6884770072813794E-2 | BR85: =BA85/BJ85 -> 2.9605107304211203E-2 | BS85: =BB85/BJ85 -> 0.21112610171530929 | BT85: =BC85/BJ85 -> 2.6483827345060725E-2 | BU85: =BD85/BJ85 -> 1.3330039206288931E-2 | BV85: =BE85/BJ85 -> 2.0765493530098846E-2 | BW85: =BF85/BJ85 -> 1.1559696334414116E-2 | BX85: =BG85/BJ85 -> 1.6852049493760287E-2 | BY85: =BH85/BJ85 -> 3.3519267004638059E-2 | BZ85: =BI85/BJ85 -> 2.8726497355813518E-2 | CA85: =SUM(BK85:BZ85) -> 1
AC86: =AA!AC86+'A-hetero'!AC86+'a-homo'!AC86 -> 334 | AD86: =AA!AD86+'A-hetero'!AD86+'a-homo'!AD86 -> 463 | AE86: =AA!AE86+'A-hetero'!AE86+'a-homo'!AE86 -> 10 | AF86: =AA!AF86+'A-hetero'!AF86+'a-homo'!AF86 -> 9 | AG86: =AA!AG86+'A-hetero'!AG86+'a-homo'!AG86 -> 10 | AH86: =AA!AH86+'A-hetero'!AH86+'a-homo'!AH86 -> 10 | AI86: =AA!AI86+'A-hetero'!AI86+'a-homo'!AI86 -> 10 | AJ86: =AA!AJ86+'A-hetero'!AJ86+'a-homo'!AJ86 -> 10 | AK86: =AA!AK86+'A-hetero'!AK86+'a-homo'!AK86 -> 305 | AL86: =AA!AL86+'A-hetero'!AL86+'a-homo'!AL86 -> 37 | AM86: =AA!AM86+'A-hetero'!AM86+'a-homo'!AM86 -> 10 | AN86: =AA!AN86+'A-hetero'!AN86+'a-homo'!AN86 -> 10 | AO86: =AA!AO86+'A-hetero'!AO86+'a-homo'!AO86 -> 10 | AP86: =AA!AP86+'A-hetero'!AP86+'a-homo'!AP86 -> 10 | AQ86: =AA!AQ86+'A-hetero'!AQ86+'a-homo'!AQ86 -> 10 | AR86: =AA!AR86+'A-hetero'!AR86+'a-homo'!AR86 -> 10 | AS86: =SUM(AC86:AJ86) -> 856 | AT86: =AA!AT86+'A-hetero'!AT86+'a-homo'!AT86 -> 367.21316185002075 | AU86: =AA!AU86+'A-hetero'!AU86+'a-homo'!AU86 -> 512.17525836578739 | AV86: =AA!AV86+'A-hetero'!AV86+'a-homo'!AV86 -> 27.05426019103032 | AW86: =AA!AW86+'A-hetero'!AW86+'a-homo'!AW86 -> 18.416951322884351 | AX86: =AA!AX86+'A-hetero'!AX86+'a-homo'!AX86 -> 27.431144303400416 | AY86: =AA!AY86+'A-hetero'!AY86+'a-homo'!AY86 -> 18.372845313800649 | AZ86: =AA!AZ86+'A-hetero'!AZ86+'a-homo'!AZ86 -> 27.724792459558437 | BA86: =AA!BA86+'A-hetero'!BA86+'a-homo'!BA86 -> 48.611586193517645 | BB86: =AA!BB86+'A-hetero'!BB86+'a-homo'!BB86 -> 346.66905901653854 | BC86: =AA!BC86+'A-hetero'!BC86+'a-homo'!BC86 -> 43.48644450058945 | BD86: =AA!BD86+'A-hetero'!BD86+'a-homo'!BD86 -> 21.887924376725302 | BE86: =AA!BE86+'A-hetero'!BE86+'a-homo'!BE86 -> 34.096940376423873 | BF86: =AA!BF86+'A-hetero'!BF86+'a-homo'!BF86 -> 18.981021381107038 | BG86: =AA!BG86+'A-hetero'!BG86+'a-homo'!BG86 -> 27.67106526875574 | BH86: =AA!BH86+'A-hetero'!BH86+'a-homo'!BH86 -> 55.038636421619174 | BI86: =AA!BI86+'A-hetero'!BI86+'a-homo'!BI86 -> 47.168908658240895 | BJ86: =SUM(AT86:BI86) -> 1642 | BK86: =AT86/BJ86 -> 0.2236377355968458 | BL86: =AU86/BJ86 -> 0.3119215946198462 | BM86: =AV86/BJ86 -> 1.6476406937290088E-2 | BN86: =AW86/BJ86 -> 1.1216170111379022E-2 | BO86: =AX86/BJ86 -> 1.6705934411327904E-2 | BP86: =AY86/BJ86 -> 1.1189308960901737E-2 | BQ86: =AZ86/BJ86 -> 1.6884770072812694E-2 | BR86: =BA86/BJ86 -> 2.9605107304212942E-2 | BS86: =BB86/BJ86 -> 0.21112610171530974 | BT86: =BC86/BJ86 -> 2.6483827345060568E-2 | BU86: =BD86/BJ86 -> 1.3330039206288249E-2 | BV86: =BE86/BJ86 -> 2.0765493530099804E-2 | BW86: =BF86/BJ86 -> 1.1559696334413545E-2 | BX86: =BG86/BJ86 -> 1.6852049493761109E-2 | BY86: =BH86/BJ86 -> 3.3519267004640182E-2 | BZ86: =BI86/BJ86 -> 2.8726497355810537E-2 | CA86: =SUM(BK86:BZ86) -> 1
AC87: =AA!AC87+'A-hetero'!AC87+'a-homo'!AC87 -> 334 | AD87: =AA!AD87+'A-hetero'!AD87+'a-homo'!AD87 -> 463 | AE87: =AA!AE87+'A-hetero'!AE87+'a-homo'!AE87 -> 10 | AF87: =AA!AF87+'A-hetero'!AF87+'a-homo'!AF87 -> 9 | AG87: =AA!AG87+'A-hetero'!AG87+'a-homo'!AG87 -> 10 | AH87: =AA!AH87+'A-hetero'!AH87+'a-homo'!AH87 -> 10 | AI87: =AA!AI87+'A-hetero'!AI87+'a-homo'!AI87 -> 10 | AJ87: =AA!AJ87+'A-hetero'!AJ87+'a-homo'!AJ87 -> 10 | AK87: =AA!AK87+'A-hetero'!AK87+'a-homo'!AK87 -> 305 | AL87: =AA!AL87+'A-hetero'!AL87+'a-homo'!AL87 -> 37 | AM87: =AA!AM87+'A-hetero'!AM87+'a-homo'!AM87 -> 10 | AN87: =AA!AN87+'A-hetero'!AN87+'a-homo'!AN87 -> 10 | AO87: =AA!AO87+'A-hetero'!AO87+'a-homo'!AO87 -> 10 | AP87: =AA!AP87+'A-hetero'!AP87+'a-homo'!AP87 -> 10 | AQ87: =AA!AQ87+'A-hetero'!AQ87+'a-homo'!AQ87 -> 10 | AR87: =AA!AR87+'A-hetero'!AR87+'a-homo'!AR87 -> 10 | AS87: =SUM(AC87:AJ87) -> 856 | AT87: =AA!AT87+'A-hetero'!AT87+'a-homo'!AT87 -> 367.21316185001933 | AU87: =AA!AU87+'A-hetero'!AU87+'a-homo'!AU87 -> 512.1752583657883 | AV87: =AA!AV87+'A-hetero'!AV87+'a-homo'!AV87 -> 27.05426019103097 | AW87: =AA!AW87+'A-hetero'!AW87+'a-homo'!AW87 -> 18.416951322883616 | AX87: =AA!AX87+'A-hetero'!AX87+'a-homo'!AX87 -> 27.431144303400973 | AY87: =AA!AY87+'A-hetero'!AY87+'a-homo'!AY87 -> 18.372845313800031 | AZ87: =AA!AZ87+'A-hetero'!AZ87+'a-homo'!AZ87 -> 27.724792459557147 | BA87: =AA!BA87+'A-hetero'!BA87+'a-homo'!BA87 -> 48.611586193519699 | BB87: =AA!BB87+'A-hetero'!BB87+'a-homo'!BB87 -> 346.66905901653911 | BC87: =AA!BC87+'A-hetero'!BC87+'a-homo'!BC87 -> 43.486444500589272 | BD87: =AA!BD87+'A-hetero'!BD87+'a-homo'!BD87 -> 21.887924376724502 | BE87: =AA!BE87+'A-hetero'!BE87+'a-homo'!BE87 -> 34.096940376424996 | BF87: =AA!BF87+'A-hetero'!BF87+'a-homo'!BF87 -> 18.981021381106373 | BG87: =AA!BG87+'A-hetero'!BG87+'a-homo'!BG87 -> 27.671065268756706 | BH87: =AA!BH87+'A-hetero'!BH87+'a-homo'!BH87 -> 55.038636421621675 | BI87: =AA!BI87+'A-hetero'!BI87+'a-homo'!BI87 -> 47.168908658237399 | BJ87: =SUM(AT87:BI87) -> 1642 | BK87: =AT87/BJ87 -> 0.22363773559684494 | BL87: =AU87/BJ87 -> 0.31192159461984675 | BM87: =AV87/BJ87 -> 1.6476406937290484E-2 | BN87: =AW87/BJ87 -> 1.1216170111378574E-2 | BO87: =AX87/BJ87 -> 1.6705934411328244E-2 | BP87: =AY87/BJ87 -> 1.118930896090136E-2 | BQ87: =AZ87/BJ87 -> 1.6884770072811906E-2 | BR87: =BA87/BJ87 -> 2.9605107304214194E-2 | BS87: =BB87/BJ87 -> 0.21112610171531007 | BT87: =BC87/BJ87 -> 2.6483827345060461E-2 | BU87: =BD87/BJ87 -> 1.3330039206287761E-2 | BV87: =BE87/BJ87 -> 2.0765493530100487E-2 | BW87: =BF87/BJ87 -> 1.1559696334413141E-2 | BX87: =BG87/BJ87 -> 1.6852049493761699E-2 | BY87: =BH87/BJ87 -> 3.3519267004641709E-2 | BZ87: =BI87/BJ87 -> 2.8726497355808407E-2 | CA87: =SUM(BK87:BZ87) -> 1
AC88: =AA!AC88+'A-hetero'!AC88+'a-homo'!AC88 -> 334 | AD88: =AA!AD88+'A-hetero'!AD88+'a-homo'!AD88 -> 463 | AE88: =AA!AE88+'A-hetero'!AE88+'a-homo'!AE88 -> 10 | AF88: =AA!AF88+'A-hetero'!AF88+'a-homo'!AF88 -> 9 | AG88: =AA!AG88+'A-hetero'!AG88+'a-homo'!AG88 -> 10 | AH88: =AA!AH88+'A-hetero'!AH88+'a-homo'!AH88 -> 10 | AI88: =AA!AI88+'A-hetero'!AI88+'a-homo'!AI88 -> 10 | AJ88: =AA!AJ88+'A-hetero'!AJ88+'a-homo'!AJ88 -> 10 | AK88: =AA!AK88+'A-hetero'!AK88+'a-homo'!AK88 -> 305 | AL88: =AA!AL88+'A-hetero'!AL88+'a-homo'!AL88 -> 37 | AM88: =AA!AM88+'A-hetero'!AM88+'a-homo'!AM88 -> 10 | AN88: =AA!AN88+'A-hetero'!AN88+'a-homo'!AN88 -> 10 | AO88: =AA!AO88+'A-hetero'!AO88+'a-homo'!AO88 -> 10 | AP88: =AA!AP88+'A-hetero'!AP88+'a-homo'!AP88 -> 10 | AQ88: =AA!AQ88+'A-hetero'!AQ88+'a-homo'!AQ88 -> 10 | AR88: =AA!AR88+'A-hetero'!AR88+'a-homo'!AR88 -> 10 | AS88: =SUM(AC88:AJ88) -> 856 | AT88: =AA!AT88+'A-hetero'!AT88+'a-homo'!AT88 -> 367.2131618500182 | AU88: =AA!AU88+'A-hetero'!AU88+'a-homo'!AU88 -> 512.17525836578886 | AV88: =AA!AV88+'A-hetero'!AV88+'a-homo'!AV88 -> 27.054260191031435 | AW88: =AA!AW88+'A-hetero'!AW88+'a-homo'!AW88 -> 18.416951322883087 | AX88: =AA!AX88+'A-hetero'!AX88+'a-homo'!AX88 -> 27.431144303401375 | AY88: =AA!AY88+'A-hetero'!AY88+'a-homo'!AY88 -> 18.372845313799591 | AZ88: =AA!AZ88+'A-hetero'!AZ88+'a-homo'!AZ88 -> 27.724792459556223 | BA88: =AA!BA88+'A-hetero'!BA88+'a-homo'!BA88 -> 48.611586193521163 | BB88: =AA!BB88+'A-hetero'!BB88+'a-homo'!BB88 -> 346.66905901653945 | BC88: =AA!BC88+'A-hetero'!BC88+'a-homo'!BC88 -> 43.486444500589137 | BD88: =AA!BD88+'A-hetero'!BD88+'a-homo'!BD88 -> 21.88792437672393 | BE88: =AA!BE88+'A-hetero'!BE88+'a-homo'!BE88 -> 34.096940376425806 | BF88: =AA!BF88+'A-hetero'!BF88+'a-homo'!BF88 -> 18.981021381105901 | BG88: =AA!BG88+'A-hetero'!BG88+'a-homo'!BG88 -> 27.671065268757399 | BH88: =AA!BH88+'A-hetero'!BH88+'a-homo'!BH88 -> 55.038636421623465 | BI88: =AA!BI88+'A-hetero'!BI88+'a-homo'!BI88 -> 47.168908658234884 | BJ88: =SUM(AT88:BI88) -> 1642 | BK88: =AT88/BJ88 -> 0.22363773559684419 | BL88: =AU88/BJ88 -> 0.31192159461984703 | BM88: =AV88/BJ88 -> 1.6476406937290761E-2 | BN88: =AW88/BJ88 -> 1.1216170111378248E-2 | BO88: =AX88/BJ88 -> 1.6705934411328484E-2 | BP88: =AY88/BJ88 -> 1.1189308960901088E-2 | BQ88: =AZ88/BJ88 -> 1.6884770072811341E-2 | BR88: =BA88/BJ88 -> 2.9605107304215075E-2 | BS88: =BB88/BJ88 -> 0.21112610171531024 | BT88: =BC88/BJ88 -> 2.6483827345060371E-2 | BU88: =BD88/BJ88 -> 1.3330039206287409E-2 | BV88: =BE88/BJ88 -> 2.0765493530100976E-2 | BW88: =BF88/BJ88 -> 1.1559696334412849E-2 | BX88: =BG88/BJ88 -> 1.6852049493762115E-2 | BY88: =BH88/BJ88 -> 3.3519267004642785E-2 | BZ88: =BI88/BJ88 -> 2.8726497355806867E-2 | CA88: =SUM(BK88:BZ88) -> 1
AC89: =AA!AC89+'A-hetero'!AC89+'a-homo'!AC89 -> 334 | AD89: =AA!AD89+'A-hetero'!AD89+'a-homo'!AD89 -> 463 | AE89: =AA!AE89+'A-hetero'!AE89+'a-homo'!AE89 -> 10 | AF89: =AA!AF89+'A-hetero'!AF89+'a-homo'!AF89 -> 9 | AG89: =AA!AG89+'A-hetero'!AG89+'a-homo'!AG89 -> 10 | AH89: =AA!AH89+'A-hetero'!AH89+'a-homo'!AH89 -> 10 | AI89: =AA!AI89+'A-hetero'!AI89+'a-homo'!AI89 -> 10 | AJ89: =AA!AJ89+'A-hetero'!AJ89+'a-homo'!AJ89 -> 10 | AK89: =AA!AK89+'A-hetero'!AK89+'a-homo'!AK89 -> 305 | AL89: =AA!AL89+'A-hetero'!AL89+'a-homo'!AL89 -> 37 | AM89: =AA!AM89+'A-hetero'!AM89+'a-homo'!AM89 -> 10 | AN89: =AA!AN89+'A-hetero'!AN89+'a-homo'!AN89 -> 10 | AO89: =AA!AO89+'A-hetero'!AO89+'a-homo'!AO89 -> 10 | AP89: =AA!AP89+'A-hetero'!AP89+'a-homo'!AP89 -> 10 | AQ89: =AA!AQ89+'A-hetero'!AQ89+'a-homo'!AQ89 -> 10 | AR89: =AA!AR89+'A-hetero'!AR89+'a-homo'!AR89 -> 10 | AS89: =SUM(AC89:AJ89) -> 856 | AT89: =AA!AT89+'A-hetero'!AT89+'a-homo'!AT89 -> 367.2131618500174 | AU89: =AA!AU89+'A-hetero'!AU89+'a-homo'!AU89 -> 512.17525836578932 | AV89: =AA!AV89+'A-hetero'!AV89+'a-homo'!AV89 -> 27.054260191031766 | AW89: =AA!AW89+'A-hetero'!AW89+'a-homo'!AW89 -> 18.41695132288271 | AX89: =AA!AX89+'A-hetero'!AX89+'a-homo'!AX89 -> 27.431144303401659 | AY89: =AA!AY89+'A-hetero'!AY89+'a-homo'!AY89 -> 18.372845313799274 | AZ89: =AA!AZ89+'A-hetero'!AZ89+'a-homo'!AZ89 -> 27.724792459555562 | BA89: =AA!BA89+'A-hetero'!BA89+'a-homo'!BA89 -> 48.6115861935222 | BB89: =AA!BB89+'A-hetero'!BB89+'a-homo'!BB89 -> 346.66905901653973 | BC89: =AA!BC89+'A-hetero'!BC89+'a-homo'!BC89 -> 43.486444500589052 | BD89: =AA!BD89+'A-hetero'!BD89+'a-homo'!BD89 -> 21.887924376723522 | BE89: =AA!BE89+'A-hetero'!BE89+'a-homo'!BE89 -> 34.096940376426389 | BF89: =AA!BF89+'A-hetero'!BF89+'a-homo'!BF89 -> 18.98102138110556 | BG89: =AA!BG89+'A-hetero'!BG89+'a-homo'!BG89 -> 27.671065268757896 | BH89: =AA!BH89+'A-hetero'!BH89+'a-homo'!BH89 -> 55.038636421624737 | BI89: =AA!BI89+'A-hetero'!BI89+'a-homo'!BI89 -> 47.168908658233093 | BJ89: =SUM(AT89:BI89) -> 1642 | BK89: =AT89/BJ89 -> 0.22363773559684375 | BL89: =AU89/BJ89 -> 0.31192159461984736 | BM89: =AV89/BJ89 -> 1.647640693729097E-2 | BN89: =AW89/BJ89 -> 1.1216170111378022E-2 | BO89: =AX89/BJ89 -> 1.6705934411328661E-2 | BP89: =AY89/BJ89 -> 1.1189308960900899E-2 | BQ89: =AZ89/BJ89 -> 1.6884770072810942E-2 | BR89: =BA89/BJ89 -> 2.9605107304215717E-2 | BS89: =BB89/BJ89 -> 0.21112610171531046 | BT89: =BC89/BJ89 -> 2.6483827345060329E-2 | BU89: =BD89/BJ89 -> 1.3330039206287165E-2 | BV89: =BE89/BJ89 -> 2.0765493530101337E-2 | BW89: =BF89/BJ89 -> 1.1559696334412645E-2 | BX89: =BG89/BJ89 -> 1.6852049493762424E-2 | BY89: =BH89/BJ89 -> 3.3519267004643569E-2 | BZ89: =BI89/BJ89 -> 2.8726497355805784E-2 | CA89: =SUM(BK89:BZ89) -> 1
AC90: =AA!AC90+'A-hetero'!AC90+'a-homo'!AC90 -> 334 | AD90: =AA!AD90+'A-hetero'!AD90+'a-homo'!AD90 -> 463 | AE90: =AA!AE90+'A-hetero'!AE90+'a-homo'!AE90 -> 10 | AF90: =AA!AF90+'A-hetero'!AF90+'a-homo'!AF90 -> 9 | AG90: =AA!AG90+'A-hetero'!AG90+'a-homo'!AG90 -> 10 | AH90: =AA!AH90+'A-hetero'!AH90+'a-homo'!AH90 -> 10 | AI90: =AA!AI90+'A-hetero'!AI90+'a-homo'!AI90 -> 10 | AJ90: =AA!AJ90+'A-hetero'!AJ90+'a-homo'!AJ90 -> 10 | AK90: =AA!AK90+'A-hetero'!AK90+'a-homo'!AK90 -> 305 | AL90: =AA!AL90+'A-hetero'!AL90+'a-homo'!AL90 -> 37 | AM90: =AA!AM90+'A-hetero'!AM90+'a-homo'!AM90 -> 10 | AN90: =AA!AN90+'A-hetero'!AN90+'a-homo'!AN90 -> 10 | AO90: =AA!AO90+'A-hetero'!AO90+'a-homo'!AO90 -> 10 | AP90: =AA!AP90+'A-hetero'!AP90+'a-homo'!AP90 -> 10 | AQ90: =AA!AQ90+'A-hetero'!AQ90+'a-homo'!AQ90 -> 10 | AR90: =AA!AR90+'A-hetero'!AR90+'a-homo'!AR90 -> 10 | AS90: =SUM(AC90:AJ90) -> 856 | AT90: =AA!AT90+'A-hetero'!AT90+'a-homo'!AT90 -> 367.21316185001689 | AU90: =AA!AU90+'A-hetero'!AU90+'a-homo'!AU90 -> 512.17525836578966 | AV90: =AA!AV90+'A-hetero'!AV90+'a-homo'!AV90 -> 27.054260191032007 | AW90: =AA!AW90+'A-hetero'!AW90+'a-homo'!AW90 -> 18.41695132288244 | AX90: =AA!AX90+'A-hetero'!AX90+'a-homo'!AX90 -> 27.431144303401862 | AY90: =AA!AY90+'A-hetero'!AY90+'a-homo'!AY90 -> 18.372845313799047 | AZ90: =AA!AZ90+'A-hetero'!AZ90+'a-homo'!AZ90 -> 27.72479245955509 | BA90: =AA!BA90+'A-hetero'!BA90+'a-homo'!BA90 -> 48.611586193522953 | BB90: =AA!BB90+'A-hetero'!BB90+'a-homo'!BB90 -> 346.6690590165399 | BC90: =AA!BC90+'A-hetero'!BC90+'a-homo'!BC90 -> 43.486444500588981 | BD90: =AA!BD90+'A-hetero'!BD90+'a-homo'!BD90 -> 21.88792437672323 | BE90: =AA!BE90+'A-hetero'!BE90+'a-homo'!BE90 -> 34.096940376426801 | BF90: =AA!BF90+'A-hetero'!BF90+'a-homo'!BF90 -> 18.981021381105315 | BG90: =AA!BG90+'A-hetero'!BG90+'a-homo'!BG90 -> 27.671065268758255 | BH90: =AA!BH90+'A-hetero'!BH90+'a-homo'!BH90 -> 55.038636421625654 | BI90: =AA!BI90+'A-hetero'!BI90+'a-homo'!BI90 -> 47.168908658231807 | BJ90: =SUM(AT90:BI90) -> 1642 | BK90: =AT90/BJ90 -> 0.22363773559684341 | BL90: =AU90/BJ90 -> 0.31192159461984753 | BM90: =AV90/BJ90 -> 1.6476406937291112E-2 | BN90: =AW90/BJ90 -> 1.1216170111377856E-2 | BO90: =AX90/BJ90 -> 1.6705934411328782E-2 | BP90: =AY90/BJ90 -> 1.118930896090076E-2 | BQ90: =AZ90/BJ90 -> 1.688477007281065E-2 | BR90: =BA90/BJ90 -> 2.9605107304216172E-2 | BS90: =BB90/BJ90 -> 0.21112610171531054 | BT90: =BC90/BJ90 -> 2.648382734506028E-2 | BU90: =BD90/BJ90 -> 1.3330039206286986E-2 | BV90: =BE90/BJ90 -> 2.0765493530101584E-2 | BW90: =BF90/BJ90 -> 1.1559696334412494E-2 | BX90: =BG90/BJ90 -> 1.6852049493762639E-2 | BY90: =BH90/BJ90 -> 3.3519267004644124E-2 | BZ90: =BI90/BJ90 -> 2.8726497355804997E-2 | CA90: =SUM(BK90:BZ90) -> 1
AC91: =AA!AC91+'A-hetero'!AC91+'a-homo'!AC91 -> 334 | AD91: =AA!AD91+'A-hetero'!AD91+'a-homo'!AD91 -> 463 | AE91: =AA!AE91+'A-hetero'!AE91+'a-homo'!AE91 -> 10 | AF91: =AA!AF91+'A-hetero'!AF91+'a-homo'!AF91 -> 9 | AG91: =AA!AG91+'A-hetero'!AG91+'a-homo'!AG91 -> 10 | AH91: =AA!AH91+'A-hetero'!AH91+'a-homo'!AH91 -> 10 | AI91: =AA!AI91+'A-hetero'!AI91+'a-homo'!AI91 -> 10 | AJ91: =AA!AJ91+'A-hetero'!AJ91+'a-homo'!AJ91 -> 10 | AK91: =AA!AK91+'A-hetero'!AK91+'a-homo'!AK91 -> 305 | AL91: =AA!AL91+'A-hetero'!AL91+'a-homo'!AL91 -> 37 | AM91: =AA!AM91+'A-hetero'!AM91+'a-homo'!AM91 -> 10 | AN91: =AA!AN91+'A-hetero'!AN91+'a-homo'!AN91 -> 10 | AO91: =AA!AO91+'A-hetero'!AO91+'a-homo'!AO91 -> 10 | AP91: =AA!AP91+'A-hetero'!AP91+'a-homo'!AP91 -> 10 | AQ91: =AA!AQ91+'A-hetero'!AQ91+'a-homo'!AQ91 -> 10 | AR91: =AA!AR91+'A-hetero'!AR91+'a-homo'!AR91 -> 10 | AS91: =SUM(AC91:AJ91) -> 856 | AT91: =AA!AT91+'A-hetero'!AT91+'a-homo'!AT91 -> 367.21316185001649 | AU91: =AA!AU91+'A-hetero'!AU91+'a-homo'!AU91 -> 512.17525836578989 | AV91: =AA!AV91+'A-hetero'!AV91+'a-homo'!AV91 -> 27.054260191032178 | AW91: =AA!AW91+'A-hetero'!AW91+'a-homo'!AW91 -> 18.416951322882248 | AX91: =AA!AX91+'A-hetero'!AX91+'a-homo'!AX91 -> 27.431144303402007 | AY91: =AA!AY91+'A-hetero'!AY91+'a-homo'!AY91 -> 18.372845313798887 | AZ91: =AA!AZ91+'A-hetero'!AZ91+'a-homo'!AZ91 -> 27.724792459554756 | BA91: =AA!BA91+'A-hetero'!BA91+'a-homo'!BA91 -> 48.611586193523493 | BB91: =AA!BB91+'A-hetero'!BB91+'a-homo'!BB91 -> 346.66905901654013 | BC91: =AA!BC91+'A-hetero'!BC91+'a-homo'!BC91 -> 43.486444500588945 | BD91: =AA!BD91+'A-hetero'!BD91+'a-homo'!BD91 -> 21.887924376723021 | BE91: =AA!BE91+'A-hetero'!BE91+'a-homo'!BE91 -> 34.096940376427099 | BF91: =AA!BF91+'A-hetero'!BF91+'a-homo'!BF91 -> 18.981021381105144 | BG91: =AA!BG91+'A-hetero'!BG91+'a-homo'!BG91 -> 27.671065268758507 | BH91: =AA!BH91+'A-hetero'!BH91+'a-homo'!BH91 -> 55.038636421626322 | BI91: =AA!BI91+'A-hetero'!BI91+'a-homo'!BI91 -> 47.168908658230905 | BJ91: =SUM(AT91:BI91) -> 1642 | BK91: =AT91/BJ91 -> 0.22363773559684316 | BL91: =AU91/BJ91 -> 0.3119215946198477 | BM91: =AV91/BJ91 -> 1.6476406937291216E-2 | BN91: =AW91/BJ91 -> 1.121617011137774E-2 | BO91: =AX91/BJ91 -> 1.6705934411328872E-2 | BP91: =AY91/BJ91 -> 1.1189308960900661E-2 | BQ91: =AZ91/BJ91 -> 1.6884770072810449E-2 | BR91: =BA91/BJ91 -> 2.9605107304216501E-2 | BS91: =BB91/BJ91 -> 0.21112610171531068 | BT91: =BC91/BJ91 -> 2.648382734506026E-2 | BU91: =BD91/BJ91 -> 1.3330039206286858E-2 | BV91: =BE91/BJ91 -> 2.0765493530101764E-2 | BW91: =BF91/BJ91 -> 1.155969633441239E-2 | BX91: =BG91/BJ91 -> 1.6852049493762795E-2 | BY91: =BH91/BJ91 -> 3.3519267004644533E-2 | BZ91: =BI91/BJ91 -> 2.8726497355804449E-2 | CA91: =SUM(BK91:BZ91) -> 1
AC92: =AA!AC92+'A-hetero'!AC92+'a-homo'!AC92 -> 334 | AD92: =AA!AD92+'A-hetero'!AD92+'a-homo'!AD92 -> 463 | AE92: =AA!AE92+'A-hetero'!AE92+'a-homo'!AE92 -> 10 | AF92: =AA!AF92+'A-hetero'!AF92+'a-homo'!AF92 -> 9 | AG92: =AA!AG92+'A-hetero'!AG92+'a-homo'!AG92 -> 10 | AH92: =AA!AH92+'A-hetero'!AH92+'a-homo'!AH92 -> 10 | AI92: =AA!AI92+'A-hetero'!AI92+'a-homo'!AI92 -> 10 | AJ92: =AA!AJ92+'A-hetero'!AJ92+'a-homo'!AJ92 -> 10 | AK92: =AA!AK92+'A-hetero'!AK92+'a-homo'!AK92 -> 305 | AL92: =AA!AL92+'A-hetero'!AL92+'a-homo'!AL92 -> 37 | AM92: =AA!AM92+'A-hetero'!AM92+'a-homo'!AM92 -> 10 | AN92: =AA!AN92+'A-hetero'!AN92+'a-homo'!AN92 -> 10 | AO92: =AA!AO92+'A-hetero'!AO92+'a-homo'!AO92 -> 10 | AP92: =AA!AP92+'A-hetero'!AP92+'a-homo'!AP92 -> 10 | AQ92: =AA!AQ92+'A-hetero'!AQ92+'a-homo'!AQ92 -> 10 | AR92: =AA!AR92+'A-hetero'!AR92+'a-homo'!AR92 -> 10 | AS92: =SUM(AC92:AJ92) -> 856 | AT92: =AA!AT92+'A-hetero'!AT92+'a-homo'!AT92 -> 367.21316185001621 | AU92: =AA!AU92+'A-hetero'!AU92+'a-homo'!AU92 -> 512.17525836579011 | AV92: =AA!AV92+'A-hetero'!AV92+'a-homo'!AV92 -> 27.054260191032299 | AW92: =AA!AW92+'A-hetero'!AW92+'a-homo'!AW92 -> 18.416951322882113 | AX92: =AA!AX92+'A-hetero'!AX92+'a-homo'!AX92 -> 27.43114430340211 | AY92: =AA!AY92+'A-hetero'!AY92+'a-homo'!AY92 -> 18.37284531379877 | AZ92: =AA!AZ92+'A-hetero'!AZ92+'a-homo'!AZ92 -> 27.724792459554514 | BA92: =AA!BA92+'A-hetero'!BA92+'a-homo'!BA92 -> 48.611586193523877 | BB92: =AA!BB92+'A-hetero'!BB92+'a-homo'!BB92 -> 346.66905901654019 | BC92: =AA!BC92+'A-hetero'!BC92+'a-homo'!BC92 -> 43.48644450058891 | BD92: =AA!BD92+'A-hetero'!BD92+'a-homo'!BD92 -> 21.887924376722864 | BE92: =AA!BE92+'A-hetero'!BE92+'a-homo'!BE92 -> 34.096940376427305 | BF92: =AA!BF92+'A-hetero'!BF92+'a-homo'!BF92 -> 18.981021381105016 | BG92: =AA!BG92+'A-hetero'!BG92+'a-homo'!BG92 -> 27.671065268758685 | BH92: =AA!BH92+'A-hetero'!BH92+'a-homo'!BH92 -> 55.038636421626791 | BI92: =AA!BI92+'A-hetero'!BI92+'a-homo'!BI92 -> 47.168908658230237 | BJ92: =SUM(AT92:BI92) -> 1642 | BK92: =AT92/BJ92 -> 0.22363773559684302 | BL92: =AU92/BJ92 -> 0.31192159461984786 | BM92: =AV92/BJ92 -> 1.6476406937291292E-2 | BN92: =AW92/BJ92 -> 1.1216170111377658E-2 | BO92: =AX92/BJ92 -> 1.6705934411328938E-2 | BP92: =AY92/BJ92 -> 1.1189308960900592E-2 | BQ92: =AZ92/BJ92 -> 1.6884770072810303E-2 | BR92: =BA92/BJ92 -> 2.9605107304216737E-2 | BS92: =BB92/BJ92 -> 0.21112610171531074 | BT92: =BC92/BJ92 -> 2.6483827345060242E-2 | BU92: =BD92/BJ92 -> 1.3330039206286764E-2 | BV92: =BE92/BJ92 -> 2.0765493530101892E-2 | BW92: =BF92/BJ92 -> 1.1559696334412313E-2 | BX92: =BG92/BJ92 -> 1.6852049493762903E-2 | BY92: =BH92/BJ92 -> 3.3519267004644825E-2 | BZ92: =BI92/BJ92 -> 2.8726497355804046E-2 | CA92: =SUM(BK92:BZ92) -> 1
AC93: =AA!AC93+'A-hetero'!AC93+'a-homo'!AC93 -> 334 | AD93: =AA!AD93+'A-hetero'!AD93+'a-homo'!AD93 -> 463 | AE93: =AA!AE93+'A-hetero'!AE93+'a-homo'!AE93 -> 10 | AF93: =AA!AF93+'A-hetero'!AF93+'a-homo'!AF93 -> 9 | AG93: =AA!AG93+'A-hetero'!AG93+'a-homo'!AG93 -> 10 | AH93: =AA!AH93+'A-hetero'!AH93+'a-homo'!AH93 -> 10 | AI93: =AA!AI93+'A-hetero'!AI93+'a-homo'!AI93 -> 10 | AJ93: =AA!AJ93+'A-hetero'!AJ93+'a-homo'!AJ93 -> 10 | AK93: =AA!AK93+'A-hetero'!AK93+'a-homo'!AK93 -> 305 | AL93: =AA!AL93+'A-hetero'!AL93+'a-homo'!AL93 -> 37 | AM93: =AA!AM93+'A-hetero'!AM93+'a-homo'!AM93 -> 10 | AN93: =AA!AN93+'A-hetero'!AN93+'a-homo'!AN93 -> 10 | AO93: =AA!AO93+'A-hetero'!AO93+'a-homo'!AO93 -> 10 | AP93: =AA!AP93+'A-hetero'!AP93+'a-homo'!AP93 -> 10 | AQ93: =AA!AQ93+'A-hetero'!AQ93+'a-homo'!AQ93 -> 10 | AR93: =AA!AR93+'A-hetero'!AR93+'a-homo'!AR93 -> 10 | AS93: =SUM(AC93:AJ93) -> 856 | AT93: =AA!AT93+'A-hetero'!AT93+'a-homo'!AT93 -> 367.21316185001604 | AU93: =AA!AU93+'A-hetero'!AU93+'a-homo'!AU93 -> 512.17525836579023 | AV93: =AA!AV93+'A-hetero'!AV93+'a-homo'!AV93 -> 27.054260191032384 | AW93: =AA!AW93+'A-hetero'!AW93+'a-homo'!AW93 -> 18.416951322882014 | AX93: =AA!AX93+'A-hetero'!AX93+'a-homo'!AX93 -> 27.431144303402185 | AY93: =AA!AY93+'A-hetero'!AY93+'a-homo'!AY93 -> 18.372845313798685 | AZ93: =AA!AZ93+'A-hetero'!AZ93+'a-homo'!AZ93 -> 27.724792459554337 | BA93: =AA!BA93+'A-hetero'!BA93+'a-homo'!BA93 -> 48.611586193524147 | BB93: =AA!BB93+'A-hetero'!BB93+'a-homo'!BB93 -> 346.66905901654025 | BC93: =AA!BC93+'A-hetero'!BC93+'a-homo'!BC93 -> 43.486444500588881 | BD93: =AA!BD93+'A-hetero'!BD93+'a-homo'!BD93 -> 21.887924376722758 | BE93: =AA!BE93+'A-hetero'!BE93+'a-homo'!BE93 -> 34.096940376427455 | BF93: =AA!BF93+'A-hetero'!BF93+'a-homo'!BF93 -> 18.981021381104927 | BG93: =AA!BG93+'A-hetero'!BG93+'a-homo'!BG93 -> 27.671065268758817 | BH93: =AA!BH93+'A-hetero'!BH93+'a-homo'!BH93 -> 55.038636421627132 | BI93: =AA!BI93+'A-hetero'!BI93+'a-homo'!BI93 -> 47.168908658229768 | BJ93: =SUM(AT93:BI93) -> 1642 | BK93: =AT93/BJ93 -> 0.22363773559684283 | BL93: =AU93/BJ93 -> 0.31192159461984781 | BM93: =AV93/BJ93 -> 1.6476406937291337E-2 | BN93: =AW93/BJ93 -> 1.1216170111377594E-2 | BO93: =AX93/BJ93 -> 1.6705934411328976E-2 | BP93: =AY93/BJ93 -> 1.1189308960900536E-2 | BQ93: =AZ93/BJ93 -> 1.6884770072810189E-2 | BR93: =BA93/BJ93 -> 2.960510730421689E-2 | BS93: =BB93/BJ93 -> 0.21112610171531068 | BT93: =BC93/BJ93 -> 2.6483827345060211E-2 | BU93: =BD93/BJ93 -> 1.3330039206286694E-2 | BV93: =BE93/BJ93 -> 2.0765493530101976E-2 | BW93: =BF93/BJ93 -> 1.1559696334412254E-2 | BX93: =BG93/BJ93 -> 1.6852049493762976E-2 | BY93: =BH93/BJ93 -> 3.3519267004645019E-2 | BZ93: =BI93/BJ93 -> 2.8726497355803748E-2 | CA93: =SUM(BK93:BZ93) -> 1
AC94: =AA!AC94+'A-hetero'!AC94+'a-homo'!AC94 -> 334 | AD94: =AA!AD94+'A-hetero'!AD94+'a-homo'!AD94 -> 463 | AE94: =AA!AE94+'A-hetero'!AE94+'a-homo'!AE94 -> 10 | AF94: =AA!AF94+'A-hetero'!AF94+'a-homo'!AF94 -> 9 | AG94: =AA!AG94+'A-hetero'!AG94+'a-homo'!AG94 -> 10 | AH94: =AA!AH94+'A-hetero'!AH94+'a-homo'!AH94 -> 10 | AI94: =AA!AI94+'A-hetero'!AI94+'a-homo'!AI94 -> 10 | AJ94: =AA!AJ94+'A-hetero'!AJ94+'a-homo'!AJ94 -> 10 | AK94: =AA!AK94+'A-hetero'!AK94+'a-homo'!AK94 -> 305 | AL94: =AA!AL94+'A-hetero'!AL94+'a-homo'!AL94 -> 37 | AM94: =AA!AM94+'A-hetero'!AM94+'a-homo'!AM94 -> 10 | AN94: =AA!AN94+'A-hetero'!AN94+'a-homo'!AN94 -> 10 | AO94: =AA!AO94+'A-hetero'!AO94+'a-homo'!AO94 -> 10 | AP94: =AA!AP94+'A-hetero'!AP94+'a-homo'!AP94 -> 10 | AQ94: =AA!AQ94+'A-hetero'!AQ94+'a-homo'!AQ94 -> 10 | AR94: =AA!AR94+'A-hetero'!AR94+'a-homo'!AR94 -> 10 | AS94: =SUM(AC94:AJ94) -> 856 | AT94: =AA!AT94+'A-hetero'!AT94+'a-homo'!AT94 -> 367.21316185001592 | AU94: =AA!AU94+'A-hetero'!AU94+'a-homo'!AU94 -> 512.17525836579023 | AV94: =AA!AV94+'A-hetero'!AV94+'a-homo'!AV94 -> 27.054260191032448 | AW94: =AA!AW94+'A-hetero'!AW94+'a-homo'!AW94 -> 18.416951322881943 | AX94: =AA!AX94+'A-hetero'!AX94+'a-homo'!AX94 -> 27.431144303402238 | AY94: =AA!AY94+'A-hetero'!AY94+'a-homo'!AY94 -> 18.372845313798624 | AZ94: =AA!AZ94+'A-hetero'!AZ94+'a-homo'!AZ94 -> 27.724792459554216 | BA94: =AA!BA94+'A-hetero'!BA94+'a-homo'!BA94 -> 48.611586193524339 | BB94: =AA!BB94+'A-hetero'!BB94+'a-homo'!BB94 -> 346.6690590165403 | BC94: =AA!BC94+'A-hetero'!BC94+'a-homo'!BC94 -> 43.486444500588867 | BD94: =AA!BD94+'A-hetero'!BD94+'a-homo'!BD94 -> 21.887924376722687 | BE94: =AA!BE94+'A-hetero'!BE94+'a-homo'!BE94 -> 34.096940376427568 | BF94: =AA!BF94+'A-hetero'!BF94+'a-homo'!BF94 -> 18.981021381104863 | BG94: =AA!BG94+'A-hetero'!BG94+'a-homo'!BG94 -> 27.671065268758909 | BH94: =AA!BH94+'A-hetero'!BH94+'a-homo'!BH94 -> 55.038636421627359 | BI94: =AA!BI94+'A-hetero'!BI94+'a-homo'!BI94 -> 47.168908658229427 | BJ94: =SUM(AT94:BI94) -> 1642 | BK94: =AT94/BJ94 -> 0.22363773559684283 | BL94: =AU94/BJ94 -> 0.31192159461984786 | BM94: =AV94/BJ94 -> 1.6476406937291382E-2 | BN94: =AW94/BJ94 -> 1.1216170111377554E-2 | BO94: =AX94/BJ94 -> 1.6705934411329011E-2 | BP94: =AY94/BJ94 -> 1.1189308960900502E-2 | BQ94: =AZ94/BJ94 -> 1.6884770072810119E-2 | BR94: =BA94/BJ94 -> 2.9605107304217015E-2 | BS94: =BB94/BJ94 -> 0.21112610171531079 | BT94: =BC94/BJ94 -> 2.6483827345060211E-2 | BU94: =BD94/BJ94 -> 1.3330039206286655E-2 | BV94: =BE94/BJ94 -> 2.0765493530102052E-2 | BW94: =BF94/BJ94 -> 1.155969633441222E-2 | BX94: =BG94/BJ94 -> 1.6852049493763038E-2 | BY94: =BH94/BJ94 -> 3.3519267004645165E-2 | BZ94: =BI94/BJ94 -> 2.872649735580355E-2 | CA94: =SUM(BK94:BZ94) -> 1
AC95: =AA!AC95+'A-hetero'!AC95+'a-homo'!AC95 -> 334 | AD95: =AA!AD95+'A-hetero'!AD95+'a-homo'!AD95 -> 463 | AE95: =AA!AE95+'A-hetero'!AE95+'a-homo'!AE95 -> 10 | AF95: =AA!AF95+'A-hetero'!AF95+'a-homo'!AF95 -> 9 | AG95: =AA!AG95+'A-hetero'!AG95+'a-homo'!AG95 -> 10 | AH95: =AA!AH95+'A-hetero'!AH95+'a-homo'!AH95 -> 10 | AI95: =AA!AI95+'A-hetero'!AI95+'a-homo'!AI95 -> 10 | AJ95: =AA!AJ95+'A-hetero'!AJ95+'a-homo'!AJ95 -> 10 | AK95: =AA!AK95+'A-hetero'!AK95+'a-homo'!AK95 -> 305 | AL95: =AA!AL95+'A-hetero'!AL95+'a-homo'!AL95 -> 37 | AM95: =AA!AM95+'A-hetero'!AM95+'a-homo'!AM95 -> 10 | AN95: =AA!AN95+'A-hetero'!AN95+'a-homo'!AN95 -> 10 | AO95: =AA!AO95+'A-hetero'!AO95+'a-homo'!AO95 -> 10 | AP95: =AA!AP95+'A-hetero'!AP95+'a-homo'!AP95 -> 10 | AQ95: =AA!AQ95+'A-hetero'!AQ95+'a-homo'!AQ95 -> 10 | AR95: =AA!AR95+'A-hetero'!AR95+'a-homo'!AR95 -> 10 | AS95: =SUM(AC95:AJ95) -> 856 | AT95: =AA!AT95+'A-hetero'!AT95+'a-homo'!AT95 -> 367.21316185001581 | AU95: =AA!AU95+'A-hetero'!AU95+'a-homo'!AU95 -> 512.17525836579034 | AV95: =AA!AV95+'A-hetero'!AV95+'a-homo'!AV95 -> 27.054260191032487 | AW95: =AA!AW95+'A-hetero'!AW95+'a-homo'!AW95 -> 18.416951322881893 | AX95: =AA!AX95+'A-hetero'!AX95+'a-homo'!AX95 -> 27.431144303402277 | AY95: =AA!AY95+'A-hetero'!AY95+'a-homo'!AY95 -> 18.372845313798585 | AZ95: =AA!AZ95+'A-hetero'!AZ95+'a-homo'!AZ95 -> 27.724792459554127 | BA95: =AA!BA95+'A-hetero'!BA95+'a-homo'!BA95 -> 48.611586193524488 | BB95: =AA!BB95+'A-hetero'!BB95+'a-homo'!BB95 -> 346.66905901654036 | BC95: =AA!BC95+'A-hetero'!BC95+'a-homo'!BC95 -> 43.48644450058886 | BD95: =AA!BD95+'A-hetero'!BD95+'a-homo'!BD95 -> 21.88792437672263 | BE95: =AA!BE95+'A-hetero'!BE95+'a-homo'!BE95 -> 34.096940376427654 | BF95: =AA!BF95+'A-hetero'!BF95+'a-homo'!BF95 -> 18.981021381104817 | BG95: =AA!BG95+'A-hetero'!BG95+'a-homo'!BG95 -> 27.671065268758973 | BH95: =AA!BH95+'A-hetero'!BH95+'a-homo'!BH95 -> 55.038636421627537 | BI95: =AA!BI95+'A-hetero'!BI95+'a-homo'!BI95 -> 47.168908658229199 | BJ95: =SUM(AT95:BI95) -> 1642 | BK95: =AT95/BJ95 -> 0.22363773559684272 | BL95: =AU95/BJ95 -> 0.31192159461984792 | BM95: =AV95/BJ95 -> 1.6476406937291403E-2 | BN95: =AW95/BJ95 -> 1.1216170111377521E-2 | BO95: =AX95/BJ95 -> 1.6705934411329035E-2 | BP95: =AY95/BJ95 -> 1.1189308960900477E-2 | BQ95: =AZ95/BJ95 -> 1.6884770072810064E-2 | BR95: =BA95/BJ95 -> 2.9605107304217101E-2 | BS95: =BB95/BJ95 -> 0.21112610171531079 | BT95: =BC95/BJ95 -> 2.6483827345060204E-2 | BU95: =BD95/BJ95 -> 1.3330039206286618E-2 | BV95: =BE95/BJ95 -> 2.0765493530102101E-2 | BW95: =BF95/BJ95 -> 1.1559696334412188E-2 | BX95: =BG95/BJ95 -> 1.6852049493763076E-2 | BY95: =BH95/BJ95 -> 3.3519267004645269E-2 | BZ95: =BI95/BJ95 -> 2.8726497355803408E-2 | CA95: =SUM(BK95:BZ95) -> 1
AC96: =AA!AC96+'A-hetero'!AC96+'a-homo'!AC96 -> 334 | AD96: =AA!AD96+'A-hetero'!AD96+'a-homo'!AD96 -> 463 | AE96: =AA!AE96+'A-hetero'!AE96+'a-homo'!AE96 -> 10 | AF96: =AA!AF96+'A-hetero'!AF96+'a-homo'!AF96 -> 9 | AG96: =AA!AG96+'A-hetero'!AG96+'a-homo'!AG96 -> 10 | AH96: =AA!AH96+'A-hetero'!AH96+'a-homo'!AH96 -> 10 | AI96: =AA!AI96+'A-hetero'!AI96+'a-homo'!AI96 -> 10 | AJ96: =AA!AJ96+'A-hetero'!AJ96+'a-homo'!AJ96 -> 10 | AK96: =AA!AK96+'A-hetero'!AK96+'a-homo'!AK96 -> 305 | AL96: =AA!AL96+'A-hetero'!AL96+'a-homo'!AL96 -> 37 | AM96: =AA!AM96+'A-hetero'!AM96+'a-homo'!AM96 -> 10 | AN96: =AA!AN96+'A-hetero'!AN96+'a-homo'!AN96 -> 10 | AO96: =AA!AO96+'A-hetero'!AO96+'a-homo'!AO96 -> 10 | AP96: =AA!AP96+'A-hetero'!AP96+'a-homo'!AP96 -> 10 | AQ96: =AA!AQ96+'A-hetero'!AQ96+'a-homo'!AQ96 -> 10 | AR96: =AA!AR96+'A-hetero'!AR96+'a-homo'!AR96 -> 10 | AS96: =SUM(AC96:AJ96) -> 856 | AT96: =AA!AT96+'A-hetero'!AT96+'a-homo'!AT96 -> 367.21316185001569 | AU96: =AA!AU96+'A-hetero'!AU96+'a-homo'!AU96 -> 512.17525836579034 | AV96: =AA!AV96+'A-hetero'!AV96+'a-homo'!AV96 -> 27.054260191032522 | AW96: =AA!AW96+'A-hetero'!AW96+'a-homo'!AW96 -> 18.416951322881857 | AX96: =AA!AX96+'A-hetero'!AX96+'a-homo'!AX96 -> 27.431144303402306 | AY96: =AA!AY96+'A-hetero'!AY96+'a-homo'!AY96 -> 18.372845313798557 | AZ96: =AA!AZ96+'A-hetero'!AZ96+'a-homo'!AZ96 -> 27.724792459554063 | BA96: =AA!BA96+'A-hetero'!BA96+'a-homo'!BA96 -> 48.611586193524587 | BB96: =AA!BB96+'A-hetero'!BB96+'a-homo'!BB96 -> 346.66905901654036 | BC96: =AA!BC96+'A-hetero'!BC96+'a-homo'!BC96 -> 43.486444500588838 | BD96: =AA!BD96+'A-hetero'!BD96+'a-homo'!BD96 -> 21.887924376722587 | BE96: =AA!BE96+'A-hetero'!BE96+'a-homo'!BE96 -> 34.096940376427696 | BF96: =AA!BF96+'A-hetero'!BF96+'a-homo'!BF96 -> 18.981021381104785 | BG96: =AA!BG96+'A-hetero'!BG96+'a-homo'!BG96 -> 27.671065268759023 | BH96: =AA!BH96+'A-hetero'!BH96+'a-homo'!BH96 -> 55.038636421627658 | BI96: =AA!BI96+'A-hetero'!BI96+'a-homo'!BI96 -> 47.168908658229029 | BJ96: =SUM(AT96:BI96) -> 1642 | BK96: =AT96/BJ96 -> 0.22363773559684275 | BL96: =AU96/BJ96 -> 0.31192159461984803 | BM96: =AV96/BJ96 -> 1.6476406937291431E-2 | BN96: =AW96/BJ96 -> 1.1216170111377504E-2 | BO96: =AX96/BJ96 -> 1.670593441132906E-2 | BP96: =AY96/BJ96 -> 1.1189308960900464E-2 | BQ96: =AZ96/BJ96 -> 1.6884770072810033E-2 | BR96: =BA96/BJ96 -> 2.9605107304217174E-2 | BS96: =BB96/BJ96 -> 0.21112610171531088 | BT96: =BC96/BJ96 -> 2.6483827345060201E-2 | BU96: =BD96/BJ96 -> 1.3330039206286597E-2 | BV96: =BE96/BJ96 -> 2.0765493530102135E-2 | BW96: =BF96/BJ96 -> 1.1559696334412175E-2 | BX96: =BG96/BJ96 -> 1.6852049493763111E-2 | BY96: =BH96/BJ96 -> 3.3519267004645352E-2 | BZ96: =BI96/BJ96 -> 2.8726497355803314E-2 | CA96: =SUM(BK96:BZ96) -> 1
AC97: =AA!AC97+'A-hetero'!AC97+'a-homo'!AC97 -> 334 | AD97: =AA!AD97+'A-hetero'!AD97+'a-homo'!AD97 -> 463 | AE97: =AA!AE97+'A-hetero'!AE97+'a-homo'!AE97 -> 10 | AF97: =AA!AF97+'A-hetero'!AF97+'a-homo'!AF97 -> 9 | AG97: =AA!AG97+'A-hetero'!AG97+'a-homo'!AG97 -> 10 | AH97: =AA!AH97+'A-hetero'!AH97+'a-homo'!AH97 -> 10 | AI97: =AA!AI97+'A-hetero'!AI97+'a-homo'!AI97 -> 10 | AJ97: =AA!AJ97+'A-hetero'!AJ97+'a-homo'!AJ97 -> 10 | AK97: =AA!AK97+'A-hetero'!AK97+'a-homo'!AK97 -> 305 | AL97: =AA!AL97+'A-hetero'!AL97+'a-homo'!AL97 -> 37 | AM97: =AA!AM97+'A-hetero'!AM97+'a-homo'!AM97 -> 10 | AN97: =AA!AN97+'A-hetero'!AN97+'a-homo'!AN97 -> 10 | AO97: =AA!AO97+'A-hetero'!AO97+'a-homo'!AO97 -> 10 | AP97: =AA!AP97+'A-hetero'!AP97+'a-homo'!AP97 -> 10 | AQ97: =AA!AQ97+'A-hetero'!AQ97+'a-homo'!AQ97 -> 10 | AR97: =AA!AR97+'A-hetero'!AR97+'a-homo'!AR97 -> 10 | AS97: =SUM(AC97:AJ97) -> 856 | AT97: =AA!AT97+'A-hetero'!AT97+'a-homo'!AT97 -> 367.21316185001564 | AU97: =AA!AU97+'A-hetero'!AU97+'a-homo'!AU97 -> 512.17525836579034 | AV97: =AA!AV97+'A-hetero'!AV97+'a-homo'!AV97 -> 27.05426019103254 | AW97: =AA!AW97+'A-hetero'!AW97+'a-homo'!AW97 -> 18.416951322881829 | AX97: =AA!AX97+'A-hetero'!AX97+'a-homo'!AX97 -> 27.431144303402327 | AY97: =AA!AY97+'A-hetero'!AY97+'a-homo'!AY97 -> 18.372845313798535 | AZ97: =AA!AZ97+'A-hetero'!AZ97+'a-homo'!AZ97 -> 27.72479245955402 | BA97: =AA!BA97+'A-hetero'!BA97+'a-homo'!BA97 -> 48.611586193524658 | BB97: =AA!BB97+'A-hetero'!BB97+'a-homo'!BB97 -> 346.66905901654042 | BC97: =AA!BC97+'A-hetero'!BC97+'a-homo'!BC97 -> 43.486444500588846 | BD97: =AA!BD97+'A-hetero'!BD97+'a-homo'!BD97 -> 21.887924376722559 | BE97: =AA!BE97+'A-hetero'!BE97+'a-homo'!BE97 -> 34.096940376427739 | BF97: =AA!BF97+'A-hetero'!BF97+'a-homo'!BF97 -> 18.98102138110476 | BG97: =AA!BG97+'A-hetero'!BG97+'a-homo'!BG97 -> 27.671065268759058 | BH97: =AA!BH97+'A-hetero'!BH97+'a-homo'!BH97 -> 55.038636421627743 | BI97: =AA!BI97+'A-hetero'!BI97+'a-homo'!BI97 -> 47.168908658228901 | BJ97: =SUM(AT97:BI97) -> 1642 | BK97: =AT97/BJ97 -> 0.22363773559684269 | BL97: =AU97/BJ97 -> 0.31192159461984797 | BM97: =AV97/BJ97 -> 1.6476406937291441E-2 | BN97: =AW97/BJ97 -> 1.1216170111377486E-2 | BO97: =AX97/BJ97 -> 1.670593441132907E-2 | BP97: =AY97/BJ97 -> 1.118930896090045E-2 | BQ97: =AZ97/BJ97 -> 1.6884770072810001E-2 | BR97: =BA97/BJ97 -> 2.9605107304217212E-2 | BS97: =BB97/BJ97 -> 0.21112610171531088 | BT97: =BC97/BJ97 -> 2.6483827345060201E-2 | BU97: =BD97/BJ97 -> 1.3330039206286578E-2 | BV97: =BE97/BJ97 -> 2.076549353010216E-2 | BW97: =BF97/BJ97 -> 1.1559696334412157E-2 | BX97: =BG97/BJ97 -> 1.6852049493763132E-2 | BY97: =BH97/BJ97 -> 3.3519267004645401E-2 | BZ97: =BI97/BJ97 -> 2.8726497355803231E-2 | CA97: =SUM(BK97:BZ97) -> 1
AC98: =AA!AC98+'A-hetero'!AC98+'a-homo'!AC98 -> 334 | AD98: =AA!AD98+'A-hetero'!AD98+'a-homo'!AD98 -> 463 | AE98: =AA!AE98+'A-hetero'!AE98+'a-homo'!AE98 -> 10 | AF98: =AA!AF98+'A-hetero'!AF98+'a-homo'!AF98 -> 9 | AG98: =AA!AG98+'A-hetero'!AG98+'a-homo'!AG98 -> 10 | AH98: =AA!AH98+'A-hetero'!AH98+'a-homo'!AH98 -> 10 | AI98: =AA!AI98+'A-hetero'!AI98+'a-homo'!AI98 -> 10 | AJ98: =AA!AJ98+'A-hetero'!AJ98+'a-homo'!AJ98 -> 10 | AK98: =AA!AK98+'A-hetero'!AK98+'a-homo'!AK98 -> 305 | AL98: =AA!AL98+'A-hetero'!AL98+'a-homo'!AL98 -> 37 | AM98: =AA!AM98+'A-hetero'!AM98+'a-homo'!AM98 -> 10 | AN98: =AA!AN98+'A-hetero'!AN98+'a-homo'!AN98 -> 10 | AO98: =AA!AO98+'A-hetero'!AO98+'a-homo'!AO98 -> 10 | AP98: =AA!AP98+'A-hetero'!AP98+'a-homo'!AP98 -> 10 | AQ98: =AA!AQ98+'A-hetero'!AQ98+'a-homo'!AQ98 -> 10 | AR98: =AA!AR98+'A-hetero'!AR98+'a-homo'!AR98 -> 10 | AS98: =SUM(AC98:AJ98) -> 856 | AT98: =AA!AT98+'A-hetero'!AT98+'a-homo'!AT98 -> 367.21316185001558 | AU98: =AA!AU98+'A-hetero'!AU98+'a-homo'!AU98 -> 512.17525836579046 | AV98: =AA!AV98+'A-hetero'!AV98+'a-homo'!AV98 -> 27.054260191032558 | AW98: =AA!AW98+'A-hetero'!AW98+'a-homo'!AW98 -> 18.416951322881815 | AX98: =AA!AX98+'A-hetero'!AX98+'a-homo'!AX98 -> 27.431144303402338 | AY98: =AA!AY98+'A-hetero'!AY98+'a-homo'!AY98 -> 18.372845313798518 | AZ98: =AA!AZ98+'A-hetero'!AZ98+'a-homo'!AZ98 -> 27.724792459553989 | BA98: =AA!BA98+'A-hetero'!BA98+'a-homo'!BA98 -> 48.611586193524701 | BB98: =AA!BB98+'A-hetero'!BB98+'a-homo'!BB98 -> 346.66905901654042 | BC98: =AA!BC98+'A-hetero'!BC98+'a-homo'!BC98 -> 43.486444500588831 | BD98: =AA!BD98+'A-hetero'!BD98+'a-homo'!BD98 -> 21.887924376722541 | BE98: =AA!BE98+'A-hetero'!BE98+'a-homo'!BE98 -> 34.096940376427767 | BF98: =AA!BF98+'A-hetero'!BF98+'a-homo'!BF98 -> 18.981021381104743 | BG98: =AA!BG98+'A-hetero'!BG98+'a-homo'!BG98 -> 27.671065268759079 | BH98: =AA!BH98+'A-hetero'!BH98+'a-homo'!BH98 -> 55.038636421627807 | BI98: =AA!BI98+'A-hetero'!BI98+'a-homo'!BI98 -> 47.168908658228816 | BJ98: =SUM(AT98:BI98) -> 1642 | BK98: =AT98/BJ98 -> 0.22363773559684261 | BL98: =AU98/BJ98 -> 0.31192159461984803 | BM98: =AV98/BJ98 -> 1.6476406937291448E-2 | BN98: =AW98/BJ98 -> 1.1216170111377476E-2 | BO98: =AX98/BJ98 -> 1.6705934411329074E-2 | BP98: =AY98/BJ98 -> 1.1189308960900438E-2 | BQ98: =AZ98/BJ98 -> 1.6884770072809981E-2 | BR98: =BA98/BJ98 -> 2.9605107304217237E-2 | BS98: =BB98/BJ98 -> 0.21112610171531085 | BT98: =BC98/BJ98 -> 2.648382734506019E-2 | BU98: =BD98/BJ98 -> 1.3330039206286566E-2 | BV98: =BE98/BJ98 -> 2.0765493530102173E-2 | BW98: =BF98/BJ98 -> 1.1559696334412145E-2 | BX98: =BG98/BJ98 -> 1.6852049493763142E-2 | BY98: =BH98/BJ98 -> 3.3519267004645435E-2 | BZ98: =BI98/BJ98 -> 2.8726497355803175E-2 | CA98: =SUM(BK98:BZ98) -> 1
AC99: =AA!AC99+'A-hetero'!AC99+'a-homo'!AC99 -> 334 | AD99: =AA!AD99+'A-hetero'!AD99+'a-homo'!AD99 -> 463 | AE99: =AA!AE99+'A-hetero'!AE99+'a-homo'!AE99 -> 10 | AF99: =AA!AF99+'A-hetero'!AF99+'a-homo'!AF99 -> 9 | AG99: =AA!AG99+'A-hetero'!AG99+'a-homo'!AG99 -> 10 | AH99: =AA!AH99+'A-hetero'!AH99+'a-homo'!AH99 -> 10 | AI99: =AA!AI99+'A-hetero'!AI99+'a-homo'!AI99 -> 10 | AJ99: =AA!AJ99+'A-hetero'!AJ99+'a-homo'!AJ99 -> 10 | AK99: =AA!AK99+'A-hetero'!AK99+'a-homo'!AK99 -> 305 | AL99: =AA!AL99+'A-hetero'!AL99+'a-homo'!AL99 -> 37 | AM99: =AA!AM99+'A-hetero'!AM99+'a-homo'!AM99 -> 10 | AN99: =AA!AN99+'A-hetero'!AN99+'a-homo'!AN99 -> 10 | AO99: =AA!AO99+'A-hetero'!AO99+'a-homo'!AO99 -> 10 | AP99: =AA!AP99+'A-hetero'!AP99+'a-homo'!AP99 -> 10 | AQ99: =AA!AQ99+'A-hetero'!AQ99+'a-homo'!AQ99 -> 10 | AR99: =AA!AR99+'A-hetero'!AR99+'a-homo'!AR99 -> 10 | AS99: =SUM(AC99:AJ99) -> 856 | AT99: =AA!AT99+'A-hetero'!AT99+'a-homo'!AT99 -> 367.21316185001558 | AU99: =AA!AU99+'A-hetero'!AU99+'a-homo'!AU99 -> 512.17525836579046 | AV99: =AA!AV99+'A-hetero'!AV99+'a-homo'!AV99 -> 27.054260191032569 | AW99: =AA!AW99+'A-hetero'!AW99+'a-homo'!AW99 -> 18.4169513228818 | AX99: =AA!AX99+'A-hetero'!AX99+'a-homo'!AX99 -> 27.431144303402348 | AY99: =AA!AY99+'A-hetero'!AY99+'a-homo'!AY99 -> 18.372845313798507 | AZ99: =AA!AZ99+'A-hetero'!AZ99+'a-homo'!AZ99 -> 27.724792459553967 | BA99: =AA!BA99+'A-hetero'!BA99+'a-homo'!BA99 -> 48.611586193524744 | BB99: =AA!BB99+'A-hetero'!BB99+'a-homo'!BB99 -> 346.66905901654042 | BC99: =AA!BC99+'A-hetero'!BC99+'a-homo'!BC99 -> 43.486444500588831 | BD99: =AA!BD99+'A-hetero'!BD99+'a-homo'!BD99 -> 21.88792437672253 | BE99: =AA!BE99+'A-hetero'!BE99+'a-homo'!BE99 -> 34.096940376427781 | BF99: =AA!BF99+'A-hetero'!BF99+'a-homo'!BF99 -> 18.981021381104732 | BG99: =AA!BG99+'A-hetero'!BG99+'a-homo'!BG99 -> 27.671065268759101 | BH99: =AA!BH99+'A-hetero'!BH99+'a-homo'!BH99 -> 55.038636421627842 | BI99: =AA!BI99+'A-hetero'!BI99+'a-homo'!BI99 -> 47.168908658228744 | BJ99: =SUM(AT99:BI99) -> 1642 | BK99: =AT99/BJ99 -> 0.22363773559684266 | BL99: =AU99/BJ99 -> 0.31192159461984809 | BM99: =AV99/BJ99 -> 1.6476406937291459E-2 | BN99: =AW99/BJ99 -> 1.1216170111377469E-2 | BO99: =AX99/BJ99 -> 1.6705934411329081E-2 | BP99: =AY99/BJ99 -> 1.1189308960900432E-2 | BQ99: =AZ99/BJ99 -> 1.688477007280997E-2 | BR99: =BA99/BJ99 -> 2.9605107304217265E-2 | BS99: =BB99/BJ99 -> 0.21112610171531088 | BT99: =BC99/BJ99 -> 2.6483827345060194E-2 | BU99: =BD99/BJ99 -> 1.3330039206286561E-2 | BV99: =BE99/BJ99 -> 2.0765493530102184E-2 | BW99: =BF99/BJ99 -> 1.155969633441214E-2 | BX99: =BG99/BJ99 -> 1.6852049493763156E-2 | BY99: =BH99/BJ99 -> 3.3519267004645463E-2 | BZ99: =BI99/BJ99 -> 2.8726497355803137E-2 | CA99: =SUM(BK99:BZ99) -> 1
AC100: =AA!AC100+'A-hetero'!AC100+'a-homo'!AC100 -> 334 | AD100: =AA!AD100+'A-hetero'!AD100+'a-homo'!AD100 -> 463 | AE100: =AA!AE100+'A-hetero'!AE100+'a-homo'!AE100 -> 10 | AF100: =AA!AF100+'A-hetero'!AF100+'a-homo'!AF100 -> 9 | AG100: =AA!AG100+'A-hetero'!AG100+'a-homo'!AG100 -> 10 | AH100: =AA!AH100+'A-hetero'!AH100+'a-homo'!AH100 -> 10 | AI100: =AA!AI100+'A-hetero'!AI100+'a-homo'!AI100 -> 10 | AJ100: =AA!AJ100+'A-hetero'!AJ100+'a-homo'!AJ100 -> 10 | AK100: =AA!AK100+'A-hetero'!AK100+'a-homo'!AK100 -> 305 | AL100: =AA!AL100+'A-hetero'!AL100+'a-homo'!AL100 -> 37 | AM100: =AA!AM100+'A-hetero'!AM100+'a-homo'!AM100 -> 10 | AN100: =AA!AN100+'A-hetero'!AN100+'a-homo'!AN100 -> 10 | AO100: =AA!AO100+'A-hetero'!AO100+'a-homo'!AO100 -> 10 | AP100: =AA!AP100+'A-hetero'!AP100+'a-homo'!AP100 -> 10 | AQ100: =AA!AQ100+'A-hetero'!AQ100+'a-homo'!AQ100 -> 10 | AR100: =AA!AR100+'A-hetero'!AR100+'a-homo'!AR100 -> 10 | AS100: =SUM(AC100:AJ100) -> 856 | AT100: =AA!AT100+'A-hetero'!AT100+'a-homo'!AT100 -> 367.21316185001552 | AU100: =AA!AU100+'A-hetero'!AU100+'a-homo'!AU100 -> 512.17525836579046 | AV100: =AA!AV100+'A-hetero'!AV100+'a-homo'!AV100 -> 27.054260191032576 | AW100: =AA!AW100+'A-hetero'!AW100+'a-homo'!AW100 -> 18.416951322881793 | AX100: =AA!AX100+'A-hetero'!AX100+'a-homo'!AX100 -> 27.431144303402355 | AY100: =AA!AY100+'A-hetero'!AY100+'a-homo'!AY100 -> 18.3728453137985 | AZ100: =AA!AZ100+'A-hetero'!AZ100+'a-homo'!AZ100 -> 27.724792459553949 | BA100: =AA!BA100+'A-hetero'!BA100+'a-homo'!BA100 -> 48.611586193524772 | BB100: =AA!BB100+'A-hetero'!BB100+'a-homo'!BB100 -> 346.66905901654042 | BC100: =AA!BC100+'A-hetero'!BC100+'a-homo'!BC100 -> 43.486444500588831 | BD100: =AA!BD100+'A-hetero'!BD100+'a-homo'!BD100 -> 21.887924376722523 | BE100: =AA!BE100+'A-hetero'!BE100+'a-homo'!BE100 -> 34.096940376427796 | BF100: =AA!BF100+'A-hetero'!BF100+'a-homo'!BF100 -> 18.981021381104725 | BG100: =AA!BG100+'A-hetero'!BG100+'a-homo'!BG100 -> 27.671065268759108 | BH100: =AA!BH100+'A-hetero'!BH100+'a-homo'!BH100 -> 55.038636421627885 | BI100: =AA!BI100+'A-hetero'!BI100+'a-homo'!BI100 -> 47.168908658228716 | BJ100: =SUM(AT100:BI100) -> 1642 | BK100: =AT100/BJ100 -> 0.22363773559684261 | BL100: =AU100/BJ100 -> 0.31192159461984809 | BM100: =AV100/BJ100 -> 1.6476406937291462E-2 | BN100: =AW100/BJ100 -> 1.1216170111377464E-2 | BO100: =AX100/BJ100 -> 1.6705934411329088E-2 | BP100: =AY100/BJ100 -> 1.1189308960900427E-2 | BQ100: =AZ100/BJ100 -> 1.688477007280996E-2 | BR100: =BA100/BJ100 -> 2.9605107304217282E-2 | BS100: =BB100/BJ100 -> 0.21112610171531088 | BT100: =BC100/BJ100 -> 2.6483827345060194E-2 | BU100: =BD100/BJ100 -> 1.3330039206286557E-2 | BV100: =BE100/BJ100 -> 2.0765493530102194E-2 | BW100: =BF100/BJ100 -> 1.1559696334412136E-2 | BX100: =BG100/BJ100 -> 1.6852049493763163E-2 | BY100: =BH100/BJ100 -> 3.3519267004645491E-2 | BZ100: =BI100/BJ100 -> 2.872649735580312E-2 | CA100: =SUM(BK100:BZ100) -> 1
AC101: =AA!AC101+'A-hetero'!AC101+'a-homo'!AC101 -> 334 | AD101: =AA!AD101+'A-hetero'!AD101+'a-homo'!AD101 -> 463 | AE101: =AA!AE101+'A-hetero'!AE101+'a-homo'!AE101 -> 10 | AF101: =AA!AF101+'A-hetero'!AF101+'a-homo'!AF101 -> 9 | AG101: =AA!AG101+'A-hetero'!AG101+'a-homo'!AG101 -> 10 | AH101: =AA!AH101+'A-hetero'!AH101+'a-homo'!AH101 -> 10 | AI101: =AA!AI101+'A-hetero'!AI101+'a-homo'!AI101 -> 10 | AJ101: =AA!AJ101+'A-hetero'!AJ101+'a-homo'!AJ101 -> 10 | AK101: =AA!AK101+'A-hetero'!AK101+'a-homo'!AK101 -> 305 | AL101: =AA!AL101+'A-hetero'!AL101+'a-homo'!AL101 -> 37 | AM101: =AA!AM101+'A-hetero'!AM101+'a-homo'!AM101 -> 10 | AN101: =AA!AN101+'A-hetero'!AN101+'a-homo'!AN101 -> 10 | AO101: =AA!AO101+'A-hetero'!AO101+'a-homo'!AO101 -> 10 | AP101: =AA!AP101+'A-hetero'!AP101+'a-homo'!AP101 -> 10 | AQ101: =AA!AQ101+'A-hetero'!AQ101+'a-homo'!AQ101 -> 10 | AR101: =AA!AR101+'A-hetero'!AR101+'a-homo'!AR101 -> 10 | AS101: =SUM(AC101:AJ101) -> 856 | AT101: =AA!AT101+'A-hetero'!AT101+'a-homo'!AT101 -> 367.21316185001552 | AU101: =AA!AU101+'A-hetero'!AU101+'a-homo'!AU101 -> 512.17525836579046 | AV101: =AA!AV101+'A-hetero'!AV101+'a-homo'!AV101 -> 27.054260191032586 | AW101: =AA!AW101+'A-hetero'!AW101+'a-homo'!AW101 -> 18.416951322881786 | AX101: =AA!AX101+'A-hetero'!AX101+'a-homo'!AX101 -> 27.431144303402363 | AY101: =AA!AY101+'A-hetero'!AY101+'a-homo'!AY101 -> 18.372845313798493 | AZ101: =AA!AZ101+'A-hetero'!AZ101+'a-homo'!AZ101 -> 27.724792459553935 | BA101: =AA!BA101+'A-hetero'!BA101+'a-homo'!BA101 -> 48.611586193524786 | BB101: =AA!BB101+'A-hetero'!BB101+'a-homo'!BB101 -> 346.66905901654047 | BC101: =AA!BC101+'A-hetero'!BC101+'a-homo'!BC101 -> 43.486444500588831 | BD101: =AA!BD101+'A-hetero'!BD101+'a-homo'!BD101 -> 21.887924376722516 | BE101: =AA!BE101+'A-hetero'!BE101+'a-homo'!BE101 -> 34.09694037642781 | BF101: =AA!BF101+'A-hetero'!BF101+'a-homo'!BF101 -> 18.981021381104718 | BG101: =AA!BG101+'A-hetero'!BG101+'a-homo'!BG101 -> 27.671065268759115 | BH101: =AA!BH101+'A-hetero'!BH101+'a-homo'!BH101 -> 55.038636421627899 | BI101: =AA!BI101+'A-hetero'!BI101+'a-homo'!BI101 -> 47.168908658228681 | BJ101: =SUM(AT101:BI101) -> 1642 | BK101: =AT101/BJ101 -> 0.22363773559684261 | BL101: =AU101/BJ101 -> 0.31192159461984809 | BM101: =AV101/BJ101 -> 1.6476406937291469E-2 | BN101: =AW101/BJ101 -> 1.121617011137746E-2 | BO101: =AX101/BJ101 -> 1.6705934411329091E-2 | BP101: =AY101/BJ101 -> 1.1189308960900424E-2 | BQ101: =AZ101/BJ101 -> 1.6884770072809949E-2 | BR101: =BA101/BJ101 -> 2.9605107304217292E-2 | BS101: =BB101/BJ101 -> 0.2111261017153109 | BT101: =BC101/BJ101 -> 2.6483827345060194E-2 | BU101: =BD101/BJ101 -> 1.3330039206286552E-2 | BV101: =BE101/BJ101 -> 2.0765493530102201E-2 | BW101: =BF101/BJ101 -> 1.1559696334412131E-2 | BX101: =BG101/BJ101 -> 1.6852049493763167E-2 | BY101: =BH101/BJ101 -> 3.3519267004645498E-2 | BZ101: =BI101/BJ101 -> 2.8726497355803099E-2 | CA101: =SUM(BK101:BZ101) -> 1
AC102: =AA!AC102+'A-hetero'!AC102+'a-homo'!AC102 -> 334 | AD102: =AA!AD102+'A-hetero'!AD102+'a-homo'!AD102 -> 463 | AE102: =AA!AE102+'A-hetero'!AE102+'a-homo'!AE102 -> 10 | AF102: =AA!AF102+'A-hetero'!AF102+'a-homo'!AF102 -> 9 | AG102: =AA!AG102+'A-hetero'!AG102+'a-homo'!AG102 -> 10 | AH102: =AA!AH102+'A-hetero'!AH102+'a-homo'!AH102 -> 10 | AI102: =AA!AI102+'A-hetero'!AI102+'a-homo'!AI102 -> 10 | AJ102: =AA!AJ102+'A-hetero'!AJ102+'a-homo'!AJ102 -> 10 | AK102: =AA!AK102+'A-hetero'!AK102+'a-homo'!AK102 -> 305 | AL102: =AA!AL102+'A-hetero'!AL102+'a-homo'!AL102 -> 37 | AM102: =AA!AM102+'A-hetero'!AM102+'a-homo'!AM102 -> 10 | AN102: =AA!AN102+'A-hetero'!AN102+'a-homo'!AN102 -> 10 | AO102: =AA!AO102+'A-hetero'!AO102+'a-homo'!AO102 -> 10 | AP102: =AA!AP102+'A-hetero'!AP102+'a-homo'!AP102 -> 10 | AQ102: =AA!AQ102+'A-hetero'!AQ102+'a-homo'!AQ102 -> 10 | AR102: =AA!AR102+'A-hetero'!AR102+'a-homo'!AR102 -> 10 | AS102: =SUM(AC102:AJ102) -> 856 | AT102: =AA!AT102+'A-hetero'!AT102+'a-homo'!AT102 -> 367.21316185001547 | AU102: =AA!AU102+'A-hetero'!AU102+'a-homo'!AU102 -> 512.17525836579034 | AV102: =AA!AV102+'A-hetero'!AV102+'a-homo'!AV102 -> 27.05426019103259 | AW102: =AA!AW102+'A-hetero'!AW102+'a-homo'!AW102 -> 18.416951322881779 | AX102: =AA!AX102+'A-hetero'!AX102+'a-homo'!AX102 -> 27.43114430340237 | AY102: =AA!AY102+'A-hetero'!AY102+'a-homo'!AY102 -> 18.372845313798489 | AZ102: =AA!AZ102+'A-hetero'!AZ102+'a-homo'!AZ102 -> 27.724792459553928 | BA102: =AA!BA102+'A-hetero'!BA102+'a-homo'!BA102 -> 48.611586193524801 | BB102: =AA!BB102+'A-hetero'!BB102+'a-homo'!BB102 -> 346.66905901654047 | BC102: =AA!BC102+'A-hetero'!BC102+'a-homo'!BC102 -> 43.486444500588817 | BD102: =AA!BD102+'A-hetero'!BD102+'a-homo'!BD102 -> 21.887924376722509 | BE102: =AA!BE102+'A-hetero'!BE102+'a-homo'!BE102 -> 34.096940376427817 | BF102: =AA!BF102+'A-hetero'!BF102+'a-homo'!BF102 -> 18.981021381104718 | BG102: =AA!BG102+'A-hetero'!BG102+'a-homo'!BG102 -> 27.671065268759126 | BH102: =AA!BH102+'A-hetero'!BH102+'a-homo'!BH102 -> 55.03863642162792 | BI102: =AA!BI102+'A-hetero'!BI102+'a-homo'!BI102 -> 47.168908658228659 | BJ102: =SUM(AT102:BI102) -> 1642 | BK102: =AT102/BJ102 -> 0.22363773559684258 | BL102: =AU102/BJ102 -> 0.31192159461984797 | BM102: =AV102/BJ102 -> 1.6476406937291469E-2 | BN102: =AW102/BJ102 -> 1.1216170111377455E-2 | BO102: =AX102/BJ102 -> 1.6705934411329094E-2 | BP102: =AY102/BJ102 -> 1.1189308960900422E-2 | BQ102: =AZ102/BJ102 -> 1.6884770072809946E-2 | BR102: =BA102/BJ102 -> 2.9605107304217299E-2 | BS102: =BB102/BJ102 -> 0.2111261017153109 | BT102: =BC102/BJ102 -> 2.6483827345060183E-2 | BU102: =BD102/BJ102 -> 1.3330039206286549E-2 | BV102: =BE102/BJ102 -> 2.0765493530102205E-2 | BW102: =BF102/BJ102 -> 1.1559696334412131E-2 | BX102: =BG102/BJ102 -> 1.6852049493763174E-2 | BY102: =BH102/BJ102 -> 3.3519267004645512E-2 | BZ102: =BI102/BJ102 -> 2.8726497355803085E-2 | CA102: =SUM(BK102:BZ102) -> 1