A1: 観測カンソク数スウ | AC1: 確定カクテイ分ブン | AT1: 確定カクテイ分ブン＋推定スイテイ分ブン
A2: aaBBCCDD | B2: aaBBCCDd | C2: aaBBCCdd | D2: aaBBCcDD | E2: aaBBCcDd | F2: aaBBCcdd | G2: aaBBccDD | H2: aaBBccDd | I2: aaBBccdd | J2: aaBbCCDD | K2: aaBbCCDd | L2: aaBbCCdd | M2: aaBbCcDD | N2: aaBbCcDd | O2: aaBbCcdd | P2: aaBbccDD | Q2: aaBbccDd | R2: aaBbccdd | S2: aabbCCDD | T2: aabbCCDd | U2: aabbCCdd | V2: aabbCcDD | W2: aabbCcDd | X2: aabbCcdd | Y2: aabbccDD | Z2: aabbccDd | AA2: aabbccdd | AB2: sum | AC2: ABCD | AD2: AB Cd | AE2: ABcD | AF2: ABcd | AG2: AbCD | AH2: AbCd | AI2: AbcD | AJ2: Abcd | AK2: aBCD | AL2: aB Cd | AM2: aBcD | AN2: aBcd | AO2: abCD | AP2: abCd | AQ2: abcD | AR2: abcd | AT2: ABCD | AU2: AB Cd | AV2: ABcD | AW2: ABcd | AX2: AbCD | AY2: AbCd | AZ2: AbcD | BA2: Abcd | BB2: aBCD | BC2: aB Cd | BD2: aBcD | BE2: aBcd | BF2: abCD | BG2: abCd | BH2: abcD | BI2: abcd
A3: =input!A9 -> 100 | B3: =input!B9 -> 1 | C3: =input!C9 -> 1 | D3: =input!D9 -> 2 | E3: =input!E9 -> 5 | F3: =input!F9 -> 2 | G3: =input!G9 -> 1 | H3: =input!H9 -> 2 | I3: =input!I9 -> 1 | J3: =input!J9 -> 2 | K3: =input!K9 -> 4 | L3: =input!L9 -> 2 | M3: =input!M9 -> 4 | N3: =input!N9 -> 8 | O3: =input!O9 -> 4 | P3: =input!P9 -> 2 | Q3: =input!Q9 -> 4 | R3: =input!R9 -> 2 | S3: =input!S9 -> 1 | T3: =input!T9 -> 2 | U3: =input!U9 -> 1 | V3: =input!V9 -> 2 | W3: =input!W9 -> 4 | X3: =input!X9 -> 2 | Y3: =input!Y9 -> 1 | Z3: =input!Z9 -> 2 | AA3: =input!AA9 -> 1 | AB3: =SUM(A3:AA3) -> 163 | AK3: =2*A3+B3+D3+J3 -> 205 | AL3: =B3+2*C3+F3+L3 -> 7 | AM3: =D3+2*G3+H3+P3 -> 8 | AN3: =F3+H3+2*I3+R3 -> 8 | AO3: =J3+2*S3+T3+V3 -> 8 | AP3: =L3+T3+2*U3+X3 -> 8 | AQ3: =P3+V3+2*Y3+Z3 -> 8 | AR3: =R3+X3+Z3+2*AA3 -> 8 | AS3: =SUM(AK3:AR3) -> 260 | BB3: =AK3+E3*0.5+K3*0.5+M3*0.5+N3*0.25 -> 213.5 | BC3: =AL3+E3*0.5+K3*0.5+O3*0.5+N3*0.25 -> 15.5 | BD3: =AM3+E3*0.5+M3*0.5+Q3*0.5+N3*0.25 -> 16.5 | BE3: =AN3+E3*0.5+O3*0.5+Q3*0.5+N3*0.25 -> 16.5 | BF3: =AO3+K3*0.5+M3*0.5+W3*0.5+N3*0.25 -> 16 | BG3: =AP3+K3*0.5+O3*0.5+W3*0.5+N3*0.25 -> 16 | BH3: =AQ3+M3*0.5+Q3*0.5+W3*0.5+N3*0.25 -> 16 | BI3: =AR3+O3*0.5+Q3*0.5+W3*0.5+N3*0.25 -> 16 | BJ3: =SUM(BB3:BI3) -> 326
A4: =A3 -> 100 | B4: =B3 -> 1 | C4: =C3 -> 1 | D4: =D3 -> 2 | E4: =E3 -> 5 | F4: =F3 -> 2 | G4: =G3 -> 1 | H4: =H3 -> 2 | I4: =I3 -> 1 | J4: =J3 -> 2 | K4: =K3 -> 4 | L4: =L3 -> 2 | M4: =M3 -> 4 | N4: =N3 -> 8 | O4: =O3 -> 4 | P4: =P3 -> 2 | Q4: =Q3 -> 4 | R4: =R3 -> 2 | S4: =S3 -> 1 | T4: =T3 -> 2 | U4: =U3 -> 1 | V4: =V3 -> 2 | W4: =W3 -> 4 | X4: =X3 -> 2 | Y4: =Y3 -> 1 | Z4: =Z3 -> 2 | AA4: =AA3 -> 1 | AB4: =AB3 -> 163 | AK4: =AK3 -> 205 | AL4: =AL3 -> 7 | AM4: =AM3 -> 8 | AN4: =AN3 -> 8 | AO4: =AO3 -> 8 | AP4: =AP3 -> 8 | AQ4: =AQ3 -> 8 | AR4: =AR3 -> 8 | AS4: =AS3 -> 260 | BB4: =AK4+IF(s!BB3*s!BE3+s!BC3*s!BD3=0,0,E4*s!BB3*s!BE3/(s!BB3*s!BE3+s!BC3*s!BD3)+IF(s!BB3*s!BG3+s!BC3*s!BF3=0,0,K4*s!BB3*s!BG3/(s!BB3*s!BG3+s!BC3*s!BF3))+IF(s!BB3*s!BH3+s!BD3*s!BF3=0,0,M4*s!BB3*s!BH3/(s!BB3*s!BH3+s!BD3*s!BF3))+IF(s!BB3*s!BI3+s!BC3*s!BH3+s!BD3*s!BG3+s!BE3*s!BF3=0,0,N4*s!BB3*s!BI3/(s!BB3*s!BI3+s!BC3*s!BH3+s!BD3*s!BG3+s!BE3*s!BF3)
)) -> 222.01167036888876 | BC4: =AL4+IF(s!BC3*s!BD3+s!BB3*s!BE3=0,0,E4*s!BC3*s!BD3/(s!BC3*s!BD3+s!BB3*s!BE3))+IF(s!BB3*s!BG3+s!BC3*s!BF3=0,0,K4*s!BC3*s!BF3/(s!BB3*s!BG3+s!BC3*s!BF3))+IF(s!BC3*s!BI3+s!BE3*s!BG3=0,0,O4*s!BC3*s!BI3/(s!BC3*s!BI3+s!BE3*s!BG3))+IF(s!BB3*s!BI3+s!BC3*s!BH3+s!BD3*s!BG3+s!BE3*s!BF3=0,0,N4*s!BC3*s!BH3/(s!BB3*s!BI3+s!BC3*s!BH3+s!BD3*s!BG3+s!BE3*s!BF3)) -> 12.007473044147551 | BD4: =AM4+IF(s!BC3*s!BD3+s!BB3*s!BE3=0,0,E4*s!BC3*s!BD3/(s!BC3*s!BD3+s!BB3*s!BE3))+IF(s!BD3*s!BF3+s!BB3*s!BH3=0,0,M4*s!BD3*s!BF3/(s!BD3*s!BF3+s!BB3*s!BH3))+IF(s!BD3*s!BI3+s!BE3*s!BH3=0,0,Q4*s!BD3*s!BI3/(s!BD3*s!BI3+s!BE3*s!BH3))+IF(s!BB3*s!BI3+s!BC3*s!BH3+s!BD3*s!BG3+s!BE3*s!BF3=0,0,N4*s!BD3*s!BG3/(s!BB3*s!BI3+s!BC3*s!BH3+s!BD3*s!BG3+s!BE3*s!BF3)) -> 11.719830708491404 | BE4: =AN4+IF(s!BB3*s!BE3+s!BC3*s!BD3=0,0,E4*s!BB3*s!BE3/(s!BB3*s!BE3+s!BC3*s!BD3))+IF(s!BC3*s!BI3+s!BE3*s!BG3=0,0,O4*s!BE3*s!BG3/(s!BC3*s!BI3+s!BE3*s!BG3))+IF(s!BD3*s!BI3+s!BE3*s!BH3=0,0,Q4*s!BE3*s!BH3/(s!BD3*s!BI3+s!BE3*s!BH3))+IF(s!BB3*s!BI3+s!BC3*s!BH3+s!BD3*s!BG3+s!BE3*s!BF3=0,0,N4*s!BE3*s!BF3/(s!BB3*s!BI3+s!BC3*s!BH3+s!BD3*s!BG3+s!BE3*s!BF3)) -> 16.261025878472275 | BF4: =AO4+IF(s!BB3*s!BG3+s!BC3*s!BF3=0,0,K4*s!BC3*s!BF3/(s!BB3*s!BG3+s!BC3*s!BF3))+IF(s!BD3*s!BF3+s!BB3*s!BH3=0,0,M4*s!BD3*s!BF3/(s!BD3*s!BF3+s!BB3*s!BH3))+IF(s!BF3*s!BI3+s!BG3*s!BH3=0,0,W4*s!BF3*s!BI3/(s!BF3*s!BI3+s!BG3*s!BH3))+IF(s!BB3*s!BI3+s!BC3*s!BH3+s!BD3*s!BG3+s!BE3*s!BF3=0,0,N4*s!BE3*s!BF3/(s!BB3*s!BI3+s!BC3*s!BH3+s!BD3*s!BG3+s!BE3*s!BF3)) -> 11.629860477037177 | BG4: =AP4+IF(s!BB3*s!BG3+s!BC3*s!BF3=0,0,K4*s!BB3*s!BG3/(s!BB3*s!BG3+s!BC3*s!BF3))+IF(s!BC3*s!BI3+s!BE3*s!BG3=0,0,O4*s!BE3*s!BG3/(s!BC3*s!BI3+s!BE3*s!BG3))+IF(s!BF3*s!BI3+s!BG3*s!BH3=0,0,W4*s!BG3*s!BH3/(s!BF3*s!BI3+s!BG3*s!BH3))+IF(s!BB3*s!BI3+s!BC3*s!BH3+s!BD3*s!BG3+s!BE3*s!BF3=0,0,N4*s!BD3*s!BG3/(s!BB3*s!BI3+s!BC3*s!BH3+s!BD3*s!BG3+s!BE3*s!BF3)) -> 15.350996109926504 | BH4: =AQ4+IF(s!BB3*s!BH3+s!BD3*s!BF3=0,0,M4*s!BB3*s!BH3/(s!BB3*s!BH3+s!BD3*s!BF3))+IF(s!BD3*s!BI3+s!BE3*s!BH3=0,0,Q4*s!BE3*s!BH3/(s!BD3*s!BI3+s!BE3*s!BH3))+IF(s!BF3*s!BI3+s!BG3*s!BH3=0,0,W4*s!BG3*s!BH3/(s!BF3*s!BI3+s!BG3*s!BH3))+IF(s!BB3*s!BI3+s!BC3*s!BH3+s!BD3*s!BG3+s!BE3*s!BF3=0,0,N4*s!BC3*s!BH3/(s!BB3*s!BI3+s!BC3*s!BH3+s!BD3*s!BG3+s!BE3*s!BF3)) -> 16.63863844558265 | BI4: =AR4+IF(s!BC3*s!BI3+s!BE3*s!BG3=0,0,O4*s!BC3*s!BI3/(s!BC3*s!BI3+s!BE3*s!BG3))+IF(s!BD3*s!BI3+s!BE3*s!BH3=0,0,Q4*s!BD3*s!BI3/(s!BD3*s!BI3+s!BE3*s!BH3))+IF(s!BF3*s!BI3+s!BG3*s!BH3=0,0,W4*s!BF3*s!BI3/(s!BF3*s!BI3+s!BG3*s!BH3))+IF(s!BB3*s!BI3+s!BC3*s!BH3+s!BD3*s!BG3+s!BE3*s!BF3=0,0,N4*s!BB3*s!BI3/(s!BB3*s!BI3+s!BC3*s!BH3+s!BD3*s!BG3+s!BE3*s!BF3)) -> 20.380504967453668 | BJ4: =SUM(BB4:BI4) -> 326
A5: =A4 -> 100 | B5: =B4 -> 1 | C5: =C4 -> 1 | D5: =D4 -> 2 | E5: =E4 -> 5 | F5: =F4 -> 2 | G5: =G4 -> 1 | H5: =H4 -> 2 | I5: =I4 -> 1 | J5: =J4 -> 2 | K5: =K4 -> 4 | L5: =L4 -> 2 | M5: =M4 -> 4 | N5: =N4 -> 8 | O5: =O4 -> 4 | P5: =P4 -> 2 | Q5: =Q4 -> 4 | R5: =R4 -> 2 | S5: =S4 -> 1 | T5: =T4 -> 2 | U5: =U4 -> 1 | V5: =V4 -> 2 | W5: =W4 -> 4 | X5: =X4 -> 2 | Y5: =Y4 -> 1 | Z5: =Z4 -> 2 | AA5: =AA4 -> 1 | AB5: =AB4 -> 163 | AK5: =AK4 -> 205 | AL5: =AL4 -> 7 | AM5: =AM4 -> 8 | AN5: =AN4 -> 8 | AO5: =AO4 -> 8 | AP5: =AP4 -> 8 | AQ5: =AQ4 -> 8 | AR5: =AR4 -> 8 | AS5: =AS4 -> 260 | BB5: =AK5+IF(s!BB4*s!BE4+s!BC4*s!BD4=0,0,E5*s!BB4*s!BE4/(s!BB4*s!BE4+s!BC4*s!BD4)+IF(s!BB4*s!BG4+s!BC4*s!BF4=0,0,K5*s!BB4*s!BG4/(s!BB4*s!BG4+s!BC4*s!BF4))+IF(s!BB4*s!BH4+s!BD4*s!BF4=0,0,M5*s!BB4*s!BH4/(s!BB4*s!BH4+s!BD4*s!BF4))+IF(s!BB4*s!BI4+s!BC4*s!BH4+s!BD4*s!BG4+s!BE4*s!BF4=0,0,N5*s!BB4*s!BI4/(s!BB4*s!BI4+s!BC4*s!BH4+s!BD4*s!BG4+s!BE4*s!BF4)
)) -> 223.47373216944086 | BC5: =AL5+IF(s!BC4*s!BD4+s!BB4*s!BE4=0,0,E5*s!BC4*s!BD4/(s!BC4*s!BD4+s!BB4*s!BE4))+IF(s!BB4*s!BG4+s!BC4*s!BF4=0,0,K5*s!BC4*s!BF4/(s!BB4*s!BG4+s!BC4*s!BF4))+IF(s!BC4*s!BI4+s!BE4*s!BG4=0,0,O5*s!BC4*s!BI4/(s!BC4*s!BI4+s!BE4*s!BG4))+IF(s!BB4*s!BI4+s!BC4*s!BH4+s!BD4*s!BG4+s!BE4*s!BF4=0,0,N5*s!BC4*s!BH4/(s!BB4*s!BI4+s!BC4*s!BH4+s!BD4*s!BG4+s!BE4*s!BF4)) -> 11.658546888272044 | BD5: =AM5+IF(s!BC4*s!BD4+s!BB4*s!BE4=0,0,E5*s!BC4*s!BD4/(s!BC4*s!BD4+s!BB4*s!BE4))+IF(s!BD4*s!BF4+s!BB4*s!BH4=0,0,M5*s!BD4*s!BF4/(s!BD4*s!BF4+s!BB4*s!BH4))+IF(s!BD4*s!BI4+s!BE4*s!BH4=0,0,Q5*s!BD4*s!BI4/(s!BD4*s!BI4+s!BE4*s!BH4))+IF(s!BB4*s!BI4+s!BC4*s!BH4+s!BD4*s!BG4+s!BE4*s!BF4=0,0,N5*s!BD4*s!BG4/(s!BB4*s!BI4+s!BC4*s!BH4+s!BD4*s!BG4+s!BE4*s!BF4)) -> 10.773080688501553 | BE5: =AN5+IF(s!BB4*s!BE4+s!BC4*s!BD4=0,0,E5*s!BB4*s!BE4/(s!BB4*s!BE4+s!BC4*s!BD4))+IF(s!BC4*s!BI4+s!BE4*s!BG4=0,0,O5*s!BE4*s!BG4/(s!BC4*s!BI4+s!BE4*s!BG4))+IF(s!BD4*s!BI4+s!BE4*s!BH4=0,0,Q5*s!BE4*s!BH4/(s!BD4*s!BI4+s!BE4*s!BH4))+IF(s!BB4*s!BI4+s!BC4*s!BH4+s!BD4*s!BG4+s!BE4*s!BF4=0,0,N5*s!BE4*s!BF4/(s!BB4*s!BI4+s!BC4*s!BH4+s!BD4*s!BG4+s!BE4*s!BF4)) -> 16.094640253785542 | BF5: =AO5+IF(s!BB4*s!BG4+s!BC4*s!BF4=0,0,K5*s!BC4*s!BF4/(s!BB4*s!BG4+s!BC4*s!BF4))+IF(s!BD4*s!BF4+s!BB4*s!BH4=0,0,M5*s!BD4*s!BF4/(s!BD4*s!BF4+s!BB4*s!BH4))+IF(s!BF4*s!BI4+s!BG4*s!BH4=0,0,W5*s!BF4*s!BI4/(s!BF4*s!BI4+s!BG4*s!BH4))+IF(s!BB4*s!BI4+s!BC4*s!BH4+s!BD4*s!BG4+s!BE4*s!BF4=0,0,N5*s!BE4*s!BF4/(s!BB4*s!BI4+s!BC4*s!BH4+s!BD4*s!BG4+s!BE4*s!BF4)) -> 10.763401566888529 | BG5: =AP5+IF(s!BB4*s!BG4+s!BC4*s!BF4=0,0,K5*s!BB4*s!BG4/(s!BB4*s!BG4+s!BC4*s!BF4))+IF(s!BC4*s!BI4+s!BE4*s!BG4=0,0,O5*s!BE4*s!BG4/(s!BC4*s!BI4+s!BE4*s!BG4))+IF(s!BF4*s!BI4+s!BG4*s!BH4=0,0,W5*s!BG4*s!BH4/(s!BF4*s!BI4+s!BG4*s!BH4))+IF(s!BB4*s!BI4+s!BC4*s!BH4+s!BD4*s!BG4+s!BE4*s!BF4=0,0,N5*s!BD4*s!BG4/(s!BB4*s!BI4+s!BC4*s!BH4+s!BD4*s!BG4+s!BE4*s!BF4)) -> 15.104319375398564 | BH5: =AQ5+IF(s!BB4*s!BH4+s!BD4*s!BF4=0,0,M5*s!BB4*s!BH4/(s!BB4*s!BH4+s!BD4*s!BF4))+IF(s!BD4*s!BI4+s!BE4*s!BH4=0,0,Q5*s!BE4*s!BH4/(s!BD4*s!BI4+s!BE4*s!BH4))+IF(s!BF4*s!BI4+s!BG4*s!BH4=0,0,W5*s!BG4*s!BH4/(s!BF4*s!BI4+s!BG4*s!BH4))+IF(s!BB4*s!BI4+s!BC4*s!BH4+s!BD4*s!BG4+s!BE4*s!BF4=0,0,N5*s!BC4*s!BH4/(s!BB4*s!BI4+s!BC4*s!BH4+s!BD4*s!BG4+s!BE4*s!BF4)) -> 16.989785575169059 | BI5: =AR5+IF(s!BC4*s!BI4+s!BE4*s!BG4=0,0,O5*s!BC4*s!BI4/(s!BC4*s!BI4+s!BE4*s!BG4))+IF(s!BD4*s!BI4+s!BE4*s!BH4=0,0,Q5*s!BD4*s!BI4/(s!BD4*s!BI4+s!BE4*s!BH4))+IF(s!BF4*s!BI4+s!BG4*s!BH4=0,0,W5*s!BF4*s!BI4/(s!BF4*s!BI4+s!BG4*s!BH4))+IF(s!BB4*s!BI4+s!BC4*s!BH4+s!BD4*s!BG4+s!BE4*s!BF4=0,0,N5*s!BB4*s!BI4/(s!BB4*s!BI4+s!BC4*s!BH4+s!BD4*s!BG4+s!BE4*s!BF4)) -> 21.142493482543848 | BJ5: =SUM(BB5:BI5) -> 326
A6: =A5 -> 100 | B6: =B5 -> 1 | C6: =C5 -> 1 | D6: =D5 -> 2 | E6: =E5 -> 5 | F6: =F5 -> 2 | G6: =G5 -> 1 | H6: =H5 -> 2 | I6: =I5 -> 1 | J6: =J5 -> 2 | K6: =K5 -> 4 | L6: =L5 -> 2 | M6: =M5 -> 4 | N6: =N5 -> 8 | O6: =O5 -> 4 | P6: =P5 -> 2 | Q6: =Q5 -> 4 | R6: =R5 -> 2 | S6: =S5 -> 1 | T6: =T5 -> 2 | U6: =U5 -> 1 | V6: =V5 -> 2 | W6: =W5 -> 4 | X6: =X5 -> 2 | Y6: =Y5 -> 1 | Z6: =Z5 -> 2 | AA6: =AA5 -> 1 | AB6: =AB5 -> 163 | AK6: =AK5 -> 205 | AL6: =AL5 -> 7 | AM6: =AM5 -> 8 | AN6: =AN5 -> 8 | AO6: =AO5 -> 8 | AP6: =AP5 -> 8 | AQ6: =AQ5 -> 8 | AR6: =AR5 -> 8 | AS6: =AS5 -> 260 | BB6: =AK6+IF(s!BB5*s!BE5+s!BC5*s!BD5=0,0,E6*s!BB5*s!BE5/(s!BB5*s!BE5+s!BC5*s!BD5)+IF(s!BB5*s!BG5+s!BC5*s!BF5=0,0,K6*s!BB5*s!BG5/(s!BB5*s!BG5+s!BC5*s!BF5))+IF(s!BB5*s!BH5+s!BD5*s!BF5=0,0,M6*s!BB5*s!BH5/(s!BB5*s!BH5+s!BD5*s!BF5))+IF(s!BB5*s!BI5+s!BC5*s!BH5+s!BD5*s!BG5+s!BE5*s!BF5=0,0,N6*s!BB5*s!BI5/(s!BB5*s!BI5+s!BC5*s!BH5+s!BD5*s!BG5+s!BE5*s!BF5)
)) -> 223.68719804845816 | BC6: =AL6+IF(s!BC5*s!BD5+s!BB5*s!BE5=0,0,E6*s!BC5*s!BD5/(s!BC5*s!BD5+s!BB5*s!BE5))+IF(s!BB5*s!BG5+s!BC5*s!BF5=0,0,K6*s!BC5*s!BF5/(s!BB5*s!BG5+s!BC5*s!BF5))+IF(s!BC5*s!BI5+s!BE5*s!BG5=0,0,O6*s!BC5*s!BI5/(s!BC5*s!BI5+s!BE5*s!BG5))+IF(s!BB5*s!BI5+s!BC5*s!BH5+s!BD5*s!BG5+s!BE5*s!BF5=0,0,N6*s!BC5*s!BH5/(s!BB5*s!BI5+s!BC5*s!BH5+s!BD5*s!BG5+s!BE5*s!BF5)) -> 11.576819237388905 | BD6: =AM6+IF(s!BC5*s!BD5+s!BB5*s!BE5=0,0,E6*s!BC5*s!BD5/(s!BC5*s!BD5+s!BB5*s!BE5))+IF(s!BD5*s!BF5+s!BB5*s!BH5=0,0,M6*s!BD5*s!BF5/(s!BD5*s!BF5+s!BB5*s!BH5))+IF(s!BD5*s!BI5+s!BE5*s!BH5=0,0,Q6*s!BD5*s!BI5/(s!BD5*s!BI5+s!BE5*s!BH5))+IF(s!BB5*s!BI5+s!BC5*s!BH5+s!BD5*s!BG5+s!BE5*s!BF5=0,0,N6*s!BD5*s!BG5/(s!BB5*s!BI5+s!BC5*s!BH5+s!BD5*s!BG5+s!BE5*s!BF5)) -> 10.536987751015827 | BE6: =AN6+IF(s!BB5*s!BE5+s!BC5*s!BD5=0,0,E6*s!BB5*s!BE5/(s!BB5*s!BE5+s!BC5*s!BD5))+IF(s!BC5*s!BI5+s!BE5*s!BG5=0,0,O6*s!BE5*s!BG5/(s!BC5*s!BI5+s!BE5*s!BG5))+IF(s!BD5*s!BI5+s!BE5*s!BH5=0,0,Q6*s!BE5*s!BH5/(s!BD5*s!BI5+s!BE5*s!BH5))+IF(s!BB5*s!BI5+s!BC5*s!BH5+s!BD5*s!BG5+s!BE5*s!BF5=0,0,N6*s!BE5*s!BF5/(s!BB5*s!BI5+s!BC5*s!BH5+s!BD5*s!BG5+s!BE5*s!BF5)) -> 16.198994963137121 | BF6: =AO6+IF(s!BB5*s!BG5+s!BC5*s!BF5=0,0,K6*s!BC5*s!BF5/(s!BB5*s!BG5+s!BC5*s!BF5))+IF(s!BD5*s!BF5+s!BB5*s!BH5=0,0,M6*s!BD5*s!BF5/(s!BD5*s!BF5+s!BB5*s!BH5))+IF(s!BF5*s!BI5+s!BG5*s!BH5=0,0,W6*s!BF5*s!BI5/(s!BF5*s!BI5+s!BG5*s!BH5))+IF(s!BB5*s!BI5+s!BC5*s!BH5+s!BD5*s!BG5+s!BE5*s!BF5=0,0,N6*s!BE5*s!BF5/(s!BB5*s!BI5+s!BC5*s!BH5+s!BD5*s!BG5+s!BE5*s!BF5)) -> 10.548137101792443 | BG6: =AP6+IF(s!BB5*s!BG5+s!BC5*s!BF5=0,0,K6*s!BB5*s!BG5/(s!BB5*s!BG5+s!BC5*s!BF5))+IF(s!BC5*s!BI5+s!BE5*s!BG5=0,0,O6*s!BE5*s!BG5/(s!BC5*s!BI5+s!BE5*s!BG5))+IF(s!BF5*s!BI5+s!BG5*s!BH5=0,0,W6*s!BG5*s!BH5/(s!BF5*s!BI5+s!BG5*s!BH5))+IF(s!BB5*s!BI5+s!BC5*s!BH5+s!BD5*s!BG5+s!BE5*s!BF5=0,0,N6*s!BD5*s!BG5/(s!BB5*s!BI5+s!BC5*s!BH5+s!BD5*s!BG5+s!BE5*s!BF5)) -> 15.187845612360503 | BH6: =AQ6+IF(s!BB5*s!BH5+s!BD5*s!BF5=0,0,M6*s!BB5*s!BH5/(s!BB5*s!BH5+s!BD5*s!BF5))+IF(s!BD5*s!BI5+s!BE5*s!BH5=0,0,Q6*s!BE5*s!BH5/(s!BD5*s!BI5+s!BE5*s!BH5))+IF(s!BF5*s!BI5+s!BG5*s!BH5=0,0,W6*s!BG5*s!BH5/(s!BF5*s!BI5+s!BG5*s!BH5))+IF(s!BB5*s!BI5+s!BC5*s!BH5+s!BD5*s!BG5+s!BE5*s!BF5=0,0,N6*s!BC5*s!BH5/(s!BB5*s!BI5+s!BC5*s!BH5+s!BD5*s!BG5+s!BE5*s!BF5)) -> 17.227677098733583 | BI6: =AR6+IF(s!BC5*s!BI5+s!BE5*s!BG5=0,0,O6*s!BC5*s!BI5/(s!BC5*s!BI5+s!BE5*s!BG5))+IF(s!BD5*s!BI5+s!BE5*s!BH5=0,0,Q6*s!BD5*s!BI5/(s!BD5*s!BI5+s!BE5*s!BH5))+IF(s!BF5*s!BI5+s!BG5*s!BH5=0,0,W6*s!BF5*s!BI5/(s!BF5*s!BI5+s!BG5*s!BH5))+IF(s!BB5*s!BI5+s!BC5*s!BH5+s!BD5*s!BG5+s!BE5*s!BF5=0,0,N6*s!BB5*s!BI5/(s!BB5*s!BI5+s!BC5*s!BH5+s!BD5*s!BG5+s!BE5*s!BF5)) -> 21.036340187113474 | BJ6: =SUM(BB6:BI6) -> 326
A7: =A6 -> 100 | B7: =B6 -> 1 | C7: =C6 -> 1 | D7: =D6 -> 2 | E7: =E6 -> 5 | F7: =F6 -> 2 | G7: =G6 -> 1 | H7: =H6 -> 2 | I7: =I6 -> 1 | J7: =J6 -> 2 | K7: =K6 -> 4 | L7: =L6 -> 2 | M7: =M6 -> 4 | N7: =N6 -> 8 | O7: =O6 -> 4 | P7: =P6 -> 2 | Q7: =Q6 -> 4 | R7: =R6 -> 2 | S7: =S6 -> 1 | T7: =T6 -> 2 | U7: =U6 -> 1 | V7: =V6 -> 2 | W7: =W6 -> 4 | X7: =X6 -> 2 | Y7: =Y6 -> 1 | Z7: =Z6 -> 2 | AA7: =AA6 -> 1 | AB7: =AB6 -> 163 | AK7: =AK6 -> 205 | AL7: =AL6 -> 7 | AM7: =AM6 -> 8 | AN7: =AN6 -> 8 | AO7: =AO6 -> 8 | AP7: =AP6 -> 8 | AQ7: =AQ6 -> 8 | AR7: =AR6 -> 8 | AS7: =AS6 -> 260 | BB7: =AK7+IF(s!BB6*s!BE6+s!BC6*s!BD6=0,0,E7*s!BB6*s!BE6/(s!BB6*s!BE6+s!BC6*s!BD6)+IF(s!BB6*s!BG6+s!BC6*s!BF6=0,0,K7*s!BB6*s!BG6/(s!BB6*s!BG6+s!BC6*s!BF6))+IF(s!BB6*s!BH6+s!BD6*s!BF6=0,0,M7*s!BB6*s!BH6/(s!BB6*s!BH6+s!BD6*s!BF6))+IF(s!BB6*s!BI6+s!BC6*s!BH6+s!BD6*s!BG6+s!BE6*s!BF6=0,0,N7*s!BB6*s!BI6/(s!BB6*s!BI6+s!BC6*s!BH6+s!BD6*s!BG6+s!BE6*s!BF6)
)) -> 223.73993808675741 | BC7: =AL7+IF(s!BC6*s!BD6+s!BB6*s!BE6=0,0,E7*s!BC6*s!BD6/(s!BC6*s!BD6+s!BB6*s!BE6))+IF(s!BB6*s!BG6+s!BC6*s!BF6=0,0,K7*s!BC6*s!BF6/(s!BB6*s!BG6+s!BC6*s!BF6))+IF(s!BC6*s!BI6+s!BE6*s!BG6=0,0,O7*s!BC6*s!BI6/(s!BC6*s!BI6+s!BE6*s!BG6))+IF(s!BB6*s!BI6+s!BC6*s!BH6+s!BD6*s!BG6+s!BE6*s!BF6=0,0,N7*s!BC6*s!BH6/(s!BB6*s!BI6+s!BC6*s!BH6+s!BD6*s!BG6+s!BE6*s!BF6)) -> 11.526196740862916 | BD7: =AM7+IF(s!BC6*s!BD6+s!BB6*s!BE6=0,0,E7*s!BC6*s!BD6/(s!BC6*s!BD6+s!BB6*s!BE6))+IF(s!BD6*s!BF6+s!BB6*s!BH6=0,0,M7*s!BD6*s!BF6/(s!BD6*s!BF6+s!BB6*s!BH6))+IF(s!BD6*s!BI6+s!BE6*s!BH6=0,0,Q7*s!BD6*s!BI6/(s!BD6*s!BI6+s!BE6*s!BH6))+IF(s!BB6*s!BI6+s!BC6*s!BH6+s!BD6*s!BG6+s!BE6*s!BF6=0,0,N7*s!BD6*s!BG6/(s!BB6*s!BI6+s!BC6*s!BH6+s!BD6*s!BG6+s!BE6*s!BF6)) -> 10.415523109862658 | BE7: =AN7+IF(s!BB6*s!BE6+s!BC6*s!BD6=0,0,E7*s!BB6*s!BE6/(s!BB6*s!BE6+s!BC6*s!BD6))+IF(s!BC6*s!BI6+s!BE6*s!BG6=0,0,O7*s!BE6*s!BG6/(s!BC6*s!BI6+s!BE6*s!BG6))+IF(s!BD6*s!BI6+s!BE6*s!BH6=0,0,Q7*s!BE6*s!BH6/(s!BD6*s!BI6+s!BE6*s!BH6))+IF(s!BB6*s!BI6+s!BC6*s!BH6+s!BD6*s!BG6+s!BE6*s!BF6=0,0,N7*s!BE6*s!BF6/(s!BB6*s!BI6+s!BC6*s!BH6+s!BD6*s!BG6+s!BE6*s!BF6)) -> 16.318342062517015 | BF7: =AO7+IF(s!BB6*s!BG6+s!BC6*s!BF6=0,0,K7*s!BC6*s!BF6/(s!BB6*s!BG6+s!BC6*s!BF6))+IF(s!BD6*s!BF6+s!BB6*s!BH6=0,0,M7*s!BD6*s!BF6/(s!BD6*s!BF6+s!BB6*s!BH6))+IF(s!BF6*s!BI6+s!BG6*s!BH6=0,0,W7*s!BF6*s!BI6/(s!BF6*s!BI6+s!BG6*s!BH6))+IF(s!BB6*s!BI6+s!BC6*s!BH6+s!BD6*s!BG6+s!BE6*s!BF6=0,0,N7*s!BE6*s!BF6/(s!BB6*s!BI6+s!BC6*s!BH6+s!BD6*s!BG6+s!BE6*s!BF6)) -> 10.432042160062808 | BG7: =AP7+IF(s!BB6*s!BG6+s!BC6*s!BF6=0,0,K7*s!BB6*s!BG6/(s!BB6*s!BG6+s!BC6*s!BF6))+IF(s!BC6*s!BI6+s!BE6*s!BG6=0,0,O7*s!BE6*s!BG6/(s!BC6*s!BI6+s!BE6*s!BG6))+IF(s!BF6*s!BI6+s!BG6*s!BH6=0,0,W7*s!BG6*s!BH6/(s!BF6*s!BI6+s!BG6*s!BH6))+IF(s!BB6*s!BI6+s!BC6*s!BH6+s!BD6*s!BG6+s!BE6*s!BF6=0,0,N7*s!BD6*s!BG6/(s!BB6*s!BI6+s!BC6*s!BH6+s!BD6*s!BG6+s!BE6*s!BF6)) -> 15.301823012316861 | BH7: =AQ7+IF(s!BB6*s!BH6+s!BD6*s!BF6=0,0,M7*s!BB6*s!BH6/(s!BB6*s!BH6+s!BD6*s!BF6))+IF(s!BD6*s!BI6+s!BE6*s!BH6=0,0,Q7*s!BE6*s!BH6/(s!BD6*s!BI6+s!BE6*s!BH6))+IF(s!BF6*s!BI6+s!BG6*s!BH6=0,0,W7*s!BG6*s!BH6/(s!BF6*s!BI6+s!BG6*s!BH6))+IF(s!BB6*s!BI6+s!BC6*s!BH6+s!BD6*s!BG6+s!BE6*s!BF6=0,0,N7*s!BC6*s!BH6/(s!BB6*s!BI6+s!BC6*s!BH6+s!BD6*s!BG6+s!BE6*s!BF6)) -> 17.412496643317116 | BI7: =AR7+IF(s!BC6*s!BI6+s!BE6*s!BG6=0,0,O7*s!BC6*s!BI6/(s!BC6*s!BI6+s!BE6*s!BG6))+IF(s!BD6*s!BI6+s!BE6*s!BH6=0,0,Q7*s!BD6*s!BI6/(s!BD6*s!BI6+s!BE6*s!BH6))+IF(s!BF6*s!BI6+s!BG6*s!BH6=0,0,W7*s!BF6*s!BI6/(s!BF6*s!BI6+s!BG6*s!BH6))+IF(s!BB6*s!BI6+s!BC6*s!BH6+s!BD6*s!BG6+s!BE6*s!BF6=0,0,N7*s!BB6*s!BI6/(s!BB6*s!BI6+s!BC6*s!BH6+s!BD6*s!BG6+s!BE6*s!BF6)) -> 20.853638184303215 | BJ7: =SUM(BB7:BI7) -> 326
A8: =A7 -> 100 | B8: =B7 -> 1 | C8: =C7 -> 1 | D8: =D7 -> 2 | E8: =E7 -> 5 | F8: =F7 -> 2 | G8: =G7 -> 1 | H8: =H7 -> 2 | I8: =I7 -> 1 | J8: =J7 -> 2 | K8: =K7 -> 4 | L8: =L7 -> 2 | M8: =M7 -> 4 | N8: =N7 -> 8 | O8: =O7 -> 4 | P8: =P7 -> 2 | Q8: =Q7 -> 4 | R8: =R7 -> 2 | S8: =S7 -> 1 | T8: =T7 -> 2 | U8: =U7 -> 1 | V8: =V7 -> 2 | W8: =W7 -> 4 | X8: =X7 -> 2 | Y8: =Y7 -> 1 | Z8: =Z7 -> 2 | AA8: =AA7 -> 1 | AB8: =AB7 -> 163 | AK8: =AK7 -> 205 | AL8: =AL7 -> 7 | AM8: =AM7 -> 8 | AN8: =AN7 -> 8 | AO8: =AO7 -> 8 | AP8: =AP7 -> 8 | AQ8: =AQ7 -> 8 | AR8: =AR7 -> 8 | AS8: =AS7 -> 260 | BB8: =AK8+IF(s!BB7*s!BE7+s!BC7*s!BD7=0,0,E8*s!BB7*s!BE7/(s!BB7*s!BE7+s!BC7*s!BD7)+IF(s!BB7*s!BG7+s!BC7*s!BF7=0,0,K8*s!BB7*s!BG7/(s!BB7*s!BG7+s!BC7*s!BF7))+IF(s!BB7*s!BH7+s!BD7*s!BF7=0,0,M8*s!BB7*s!BH7/(s!BB7*s!BH7+s!BD7*s!BF7))+IF(s!BB7*s!BI7+s!BC7*s!BH7+s!BD7*s!BG7+s!BE7*s!BF7=0,0,N8*s!BB7*s!BI7/(s!BB7*s!BI7+s!BC7*s!BH7+s!BD7*s!BG7+s!BE7*s!BF7)
)) -> 223.76152692956094 | BC8: =AL8+IF(s!BC7*s!BD7+s!BB7*s!BE7=0,0,E8*s!BC7*s!BD7/(s!BC7*s!BD7+s!BB7*s!BE7))+IF(s!BB7*s!BG7+s!BC7*s!BF7=0,0,K8*s!BC7*s!BF7/(s!BB7*s!BG7+s!BC7*s!BF7))+IF(s!BC7*s!BI7+s!BE7*s!BG7=0,0,O8*s!BC7*s!BI7/(s!BC7*s!BI7+s!BE7*s!BG7))+IF(s!BB7*s!BI7+s!BC7*s!BH7+s!BD7*s!BG7+s!BE7*s!BF7=0,0,N8*s!BC7*s!BH7/(s!BB7*s!BI7+s!BC7*s!BH7+s!BD7*s!BG7+s!BE7*s!BF7)) -> 11.488534260271901 | BD8: =AM8+IF(s!BC7*s!BD7+s!BB7*s!BE7=0,0,E8*s!BC7*s!BD7/(s!BC7*s!BD7+s!BB7*s!BE7))+IF(s!BD7*s!BF7+s!BB7*s!BH7=0,0,M8*s!BD7*s!BF7/(s!BD7*s!BF7+s!BB7*s!BH7))+IF(s!BD7*s!BI7+s!BE7*s!BH7=0,0,Q8*s!BD7*s!BI7/(s!BD7*s!BI7+s!BE7*s!BH7))+IF(s!BB7*s!BI7+s!BC7*s!BH7+s!BD7*s!BG7+s!BE7*s!BF7=0,0,N8*s!BD7*s!BG7/(s!BB7*s!BI7+s!BC7*s!BH7+s!BD7*s!BG7+s!BE7*s!BF7)) -> 10.331959062459774 | BE8: =AN8+IF(s!BB7*s!BE7+s!BC7*s!BD7=0,0,E8*s!BB7*s!BE7/(s!BB7*s!BE7+s!BC7*s!BD7))+IF(s!BC7*s!BI7+s!BE7*s!BG7=0,0,O8*s!BE7*s!BG7/(s!BC7*s!BI7+s!BE7*s!BG7))+IF(s!BD7*s!BI7+s!BE7*s!BH7=0,0,Q8*s!BE7*s!BH7/(s!BD7*s!BI7+s!BE7*s!BH7))+IF(s!BB7*s!BI7+s!BC7*s!BH7+s!BD7*s!BG7+s!BE7*s!BF7=0,0,N8*s!BE7*s!BF7/(s!BB7*s!BI7+s!BC7*s!BH7+s!BD7*s!BG7+s!BE7*s!BF7)) -> 16.417979747707381 | BF8: =AO8+IF(s!BB7*s!BG7+s!BC7*s!BF7=0,0,K8*s!BC7*s!BF7/(s!BB7*s!BG7+s!BC7*s!BF7))+IF(s!BD7*s!BF7+s!BB7*s!BH7=0,0,M8*s!BD7*s!BF7/(s!BD7*s!BF7+s!BB7*s!BH7))+IF(s!BF7*s!BI7+s!BG7*s!BH7=0,0,W8*s!BF7*s!BI7/(s!BF7*s!BI7+s!BG7*s!BH7))+IF(s!BB7*s!BI7+s!BC7*s!BH7+s!BD7*s!BG7+s!BE7*s!BF7=0,0,N8*s!BE7*s!BF7/(s!BB7*s!BI7+s!BC7*s!BH7+s!BD7*s!BG7+s!BE7*s!BF7)) -> 10.350031900219753 | BG8: =AP8+IF(s!BB7*s!BG7+s!BC7*s!BF7=0,0,K8*s!BB7*s!BG7/(s!BB7*s!BG7+s!BC7*s!BF7))+IF(s!BC7*s!BI7+s!BE7*s!BG7=0,0,O8*s!BE7*s!BG7/(s!BC7*s!BI7+s!BE7*s!BG7))+IF(s!BF7*s!BI7+s!BG7*s!BH7=0,0,W8*s!BG7*s!BH7/(s!BF7*s!BI7+s!BG7*s!BH7))+IF(s!BB7*s!BI7+s!BC7*s!BH7+s!BD7*s!BG7+s!BE7*s!BF7=0,0,N8*s!BD7*s!BG7/(s!BB7*s!BI7+s!BC7*s!BH7+s!BD7*s!BG7+s!BE7*s!BF7)) -> 15.399906909947408 | BH8: =AQ8+IF(s!BB7*s!BH7+s!BD7*s!BF7=0,0,M8*s!BB7*s!BH7/(s!BB7*s!BH7+s!BD7*s!BF7))+IF(s!BD7*s!BI7+s!BE7*s!BH7=0,0,Q8*s!BE7*s!BH7/(s!BD7*s!BI7+s!BE7*s!BH7))+IF(s!BF7*s!BI7+s!BG7*s!BH7=0,0,W8*s!BG7*s!BH7/(s!BF7*s!BI7+s!BG7*s!BH7))+IF(s!BB7*s!BI7+s!BC7*s!BH7+s!BD7*s!BG7+s!BE7*s!BF7=0,0,N8*s!BC7*s!BH7/(s!BB7*s!BI7+s!BC7*s!BH7+s!BD7*s!BG7+s!BE7*s!BF7)) -> 17.556482107759532 | BI8: =AR8+IF(s!BC7*s!BI7+s!BE7*s!BG7=0,0,O8*s!BC7*s!BI7/(s!BC7*s!BI7+s!BE7*s!BG7))+IF(s!BD7*s!BI7+s!BE7*s!BH7=0,0,Q8*s!BD7*s!BI7/(s!BD7*s!BI7+s!BE7*s!BH7))+IF(s!BF7*s!BI7+s!BG7*s!BH7=0,0,W8*s!BF7*s!BI7/(s!BF7*s!BI7+s!BG7*s!BH7))+IF(s!BB7*s!BI7+s!BC7*s!BH7+s!BD7*s!BG7+s!BE7*s!BF7=0,0,N8*s!BB7*s!BI7/(s!BB7*s!BI7+s!BC7*s!BH7+s!BD7*s!BG7+s!BE7*s!BF7)) -> 20.693579082073306 | BJ8: =SUM(BB8:BI8) -> 326
A9: =A8 -> 100 | B9: =B8 -> 1 | C9: =C8 -> 1 | D9: =D8 -> 2 | E9: =E8 -> 5 | F9: =F8 -> 2 | G9: =G8 -> 1 | H9: =H8 -> 2 | I9: =I8 -> 1 | J9: =J8 -> 2 | K9: =K8 -> 4 | L9: =L8 -> 2 | M9: =M8 -> 4 | N9: =N8 -> 8 | O9: =O8 -> 4 | P9: =P8 -> 2 | Q9: =Q8 -> 4 | R9: =R8 -> 2 | S9: =S8 -> 1 | T9: =T8 -> 2 | U9: =U8 -> 1 | V9: =V8 -> 2 | W9: =W8 -> 4 | X9: =X8 -> 2 | Y9: =Y8 -> 1 | Z9: =Z8 -> 2 | AA9: =AA8 -> 1 | AB9: =AB8 -> 163 | AK9: =AK8 -> 205 | AL9: =AL8 -> 7 | AM9: =AM8 -> 8 | AN9: =AN8 -> 8 | AO9: =AO8 -> 8 | AP9: =AP8 -> 8 | AQ9: =AQ8 -> 8 | AR9: =AR8 -> 8 | AS9: =AS8 -> 260 | BB9: =AK9+IF(s!BB8*s!BE8+s!BC8*s!BD8=0,0,E9*s!BB8*s!BE8/(s!BB8*s!BE8+s!BC8*s!BD8)+IF(s!BB8*s!BG8+s!BC8*s!BF8=0,0,K9*s!BB8*s!BG8/(s!BB8*s!BG8+s!BC8*s!BF8))+IF(s!BB8*s!BH8+s!BD8*s!BF8=0,0,M9*s!BB8*s!BH8/(s!BB8*s!BH8+s!BD8*s!BF8))+IF(s!BB8*s!BI8+s!BC8*s!BH8+s!BD8*s!BG8+s!BE8*s!BF8=0,0,N9*s!BB8*s!BI8/(s!BB8*s!BI8+s!BC8*s!BH8+s!BD8*s!BG8+s!BE8*s!BF8)
)) -> 223.77119765267366 | BC9: =AL9+IF(s!BC8*s!BD8+s!BB8*s!BE8=0,0,E9*s!BC8*s!BD8/(s!BC8*s!BD8+s!BB8*s!BE8))+IF(s!BB8*s!BG8+s!BC8*s!BF8=0,0,K9*s!BC8*s!BF8/(s!BB8*s!BG8+s!BC8*s!BF8))+IF(s!BC8*s!BI8+s!BE8*s!BG8=0,0,O9*s!BC8*s!BI8/(s!BC8*s!BI8+s!BE8*s!BG8))+IF(s!BB8*s!BI8+s!BC8*s!BH8+s!BD8*s!BG8+s!BE8*s!BF8=0,0,N9*s!BC8*s!BH8/(s!BB8*s!BI8+s!BC8*s!BH8+s!BD8*s!BG8+s!BE8*s!BF8)) -> 11.460205880331916 | BD9: =AM9+IF(s!BC8*s!BD8+s!BB8*s!BE8=0,0,E9*s!BC8*s!BD8/(s!BC8*s!BD8+s!BB8*s!BE8))+IF(s!BD8*s!BF8+s!BB8*s!BH8=0,0,M9*s!BD8*s!BF8/(s!BD8*s!BF8+s!BB8*s!BH8))+IF(s!BD8*s!BI8+s!BE8*s!BH8=0,0,Q9*s!BD8*s!BI8/(s!BD8*s!BI8+s!BE8*s!BH8))+IF(s!BB8*s!BI8+s!BC8*s!BH8+s!BD8*s!BG8+s!BE8*s!BF8=0,0,N9*s!BD8*s!BG8/(s!BB8*s!BI8+s!BC8*s!BH8+s!BD8*s!BG8+s!BE8*s!BF8)) -> 10.271804359080466 | BE9: =AN9+IF(s!BB8*s!BE8+s!BC8*s!BD8=0,0,E9*s!BB8*s!BE8/(s!BB8*s!BE8+s!BC8*s!BD8))+IF(s!BC8*s!BI8+s!BE8*s!BG8=0,0,O9*s!BE8*s!BG8/(s!BC8*s!BI8+s!BE8*s!BG8))+IF(s!BD8*s!BI8+s!BE8*s!BH8=0,0,Q9*s!BE8*s!BH8/(s!BD8*s!BI8+s!BE8*s!BH8))+IF(s!BB8*s!BI8+s!BC8*s!BH8+s!BD8*s!BG8+s!BE8*s!BF8=0,0,N9*s!BE8*s!BF8/(s!BB8*s!BI8+s!BC8*s!BH8+s!BD8*s!BG8+s!BE8*s!BF8)) -> 16.496792107913947 | BF9: =AO9+IF(s!BB8*s!BG8+s!BC8*s!BF8=0,0,K9*s!BC8*s!BF8/(s!BB8*s!BG8+s!BC8*s!BF8))+IF(s!BD8*s!BF8+s!BB8*s!BH8=0,0,M9*s!BD8*s!BF8/(s!BD8*s!BF8+s!BB8*s!BH8))+IF(s!BF8*s!BI8+s!BG8*s!BH8=0,0,W9*s!BF8*s!BI8/(s!BF8*s!BI8+s!BG8*s!BH8))+IF(s!BB8*s!BI8+s!BC8*s!BH8+s!BD8*s!BG8+s!BE8*s!BF8=0,0,N9*s!BE8*s!BF8/(s!BB8*s!BI8+s!BC8*s!BH8+s!BD8*s!BG8+s!BE8*s!BF8)) -> 10.290744045081487 | BG9: =AP9+IF(s!BB8*s!BG8+s!BC8*s!BF8=0,0,K9*s!BB8*s!BG8/(s!BB8*s!BG8+s!BC8*s!BF8))+IF(s!BC8*s!BI8+s!BE8*s!BG8=0,0,O9*s!BE8*s!BG8/(s!BC8*s!BI8+s!BE8*s!BG8))+IF(s!BF8*s!BI8+s!BG8*s!BH8=0,0,W9*s!BG8*s!BH8/(s!BF8*s!BI8+s!BG8*s!BH8))+IF(s!BB8*s!BI8+s!BC8*s!BH8+s!BD8*s!BG8+s!BE8*s!BF8=0,0,N9*s!BD8*s!BG8/(s!BB8*s!BI8+s!BC8*s!BH8+s!BD8*s!BG8+s!BE8*s!BF8)) -> 15.477852421912923 | BH9: =AQ9+IF(s!BB8*s!BH8+s!BD8*s!BF8=0,0,M9*s!BB8*s!BH8/(s!BB8*s!BH8+s!BD8*s!BF8))+IF(s!BD8*s!BI8+s!BE8*s!BH8=0,0,Q9*s!BE8*s!BH8/(s!BD8*s!BI8+s!BE8*s!BH8))+IF(s!BF8*s!BI8+s!BG8*s!BH8=0,0,W9*s!BG8*s!BH8/(s!BF8*s!BI8+s!BG8*s!BH8))+IF(s!BB8*s!BI8+s!BC8*s!BH8+s!BD8*s!BG8+s!BE8*s!BF8=0,0,N9*s!BC8*s!BH8/(s!BB8*s!BI8+s!BC8*s!BH8+s!BD8*s!BG8+s!BE8*s!BF8)) -> 17.666253943164371 | BI9: =AR9+IF(s!BC8*s!BI8+s!BE8*s!BG8=0,0,O9*s!BC8*s!BI8/(s!BC8*s!BI8+s!BE8*s!BG8))+IF(s!BD8*s!BI8+s!BE8*s!BH8=0,0,Q9*s!BD8*s!BI8/(s!BD8*s!BI8+s!BE8*s!BH8))+IF(s!BF8*s!BI8+s!BG8*s!BH8=0,0,W9*s!BF8*s!BI8/(s!BF8*s!BI8+s!BG8*s!BH8))+IF(s!BB8*s!BI8+s!BC8*s!BH8+s!BD8*s!BG8+s!BE8*s!BF8=0,0,N9*s!BB8*s!BI8/(s!BB8*s!BI8+s!BC8*s!BH8+s!BD8*s!BG8+s!BE8*s!BF8)) -> 20.565149589841216 | BJ9: =SUM(BB9:BI9) -> 326
A10: =A9 -> 100 | B10: =B9 -> 1 | C10: =C9 -> 1 | D10: =D9 -> 2 | E10: =E9 -> 5 | F10: =F9 -> 2 | G10: =G9 -> 1 | H10: =H9 -> 2 | I10: =I9 -> 1 | J10: =J9 -> 2 | K10: =K9 -> 4 | L10: =L9 -> 2 | M10: =M9 -> 4 | N10: =N9 -> 8 | O10: =O9 -> 4 | P10: =P9 -> 2 | Q10: =Q9 -> 4 | R10: =R9 -> 2 | S10: =S9 -> 1 | T10: =T9 -> 2 | U10: =U9 -> 1 | V10: =V9 -> 2 | W10: =W9 -> 4 | X10: =X9 -> 2 | Y10: =Y9 -> 1 | Z10: =Z9 -> 2 | AA10: =AA9 -> 1 | AB10: =AB9 -> 163 | AK10: =AK9 -> 205 | AL10: =AL9 -> 7 | AM10: =AM9 -> 8 | AN10: =AN9 -> 8 | AO10: =AO9 -> 8 | AP10: =AP9 -> 8 | AQ10: =AQ9 -> 8 | AR10: =AR9 -> 8 | AS10: =AS9 -> 260 | BB10: =AK10+IF(s!BB9*s!BE9+s!BC9*s!BD9=0,0,E10*s!BB9*s!BE9/(s!BB9*s!BE9+s!BC9*s!BD9)+IF(s!BB9*s!BG9+s!BC9*s!BF9=0,0,K10*s!BB9*s!BG9/(s!BB9*s!BG9+s!BC9*s!BF9))+IF(s!BB9*s!BH9+s!BD9*s!BF9=0,0,M10*s!BB9*s!BH9/(s!BB9*s!BH9+s!BD9*s!BF9))+IF(s!BB9*s!BI9+s!BC9*s!BH9+s!BD9*s!BG9+s!BE9*s!BF9=0,0,N10*s!BB9*s!BI9/(s!BB9*s!BI9+s!BC9*s!BH9+s!BD9*s!BG9+s!BE9*s!BF9)
)) -> 223.77489058505708 | BC10: =AL10+IF(s!BC9*s!BD9+s!BB9*s!BE9=0,0,E10*s!BC9*s!BD9/(s!BC9*s!BD9+s!BB9*s!BE9))+IF(s!BB9*s!BG9+s!BC9*s!BF9=0,0,K10*s!BC9*s!BF9/(s!BB9*s!BG9+s!BC9*s!BF9))+IF(s!BC9*s!BI9+s!BE9*s!BG9=0,0,O10*s!BC9*s!BI9/(s!BC9*s!BI9+s!BE9*s!BG9))+IF(s!BB9*s!BI9+s!BC9*s!BH9+s!BD9*s!BG9+s!BE9*s!BF9=0,0,N10*s!BC9*s!BH9/(s!BB9*s!BI9+s!BC9*s!BH9+s!BD9*s!BG9+s!BE9*s!BF9)) -> 11.439281350445807 | BD10: =AM10+IF(s!BC9*s!BD9+s!BB9*s!BE9=0,0,E10*s!BC9*s!BD9/(s!BC9*s!BD9+s!BB9*s!BE9))+IF(s!BD9*s!BF9+s!BB9*s!BH9=0,0,M10*s!BD9*s!BF9/(s!BD9*s!BF9+s!BB9*s!BH9))+IF(s!BD9*s!BI9+s!BE9*s!BH9=0,0,Q10*s!BD9*s!BI9/(s!BD9*s!BI9+s!BE9*s!BH9))+IF(s!BB9*s!BI9+s!BC9*s!BH9+s!BD9*s!BG9+s!BE9*s!BF9=0,0,N10*s!BD9*s!BG9/(s!BB9*s!BI9+s!BC9*s!BH9+s!BD9*s!BG9+s!BE9*s!BF9)) -> 10.228476585755603 | BE10: =AN10+IF(s!BB9*s!BE9+s!BC9*s!BD9=0,0,E10*s!BB9*s!BE9/(s!BB9*s!BE9+s!BC9*s!BD9))+IF(s!BC9*s!BI9+s!BE9*s!BG9=0,0,O10*s!BE9*s!BG9/(s!BC9*s!BI9+s!BE9*s!BG9))+IF(s!BD9*s!BI9+s!BE9*s!BH9=0,0,Q10*s!BE9*s!BH9/(s!BD9*s!BI9+s!BE9*s!BH9))+IF(s!BB9*s!BI9+s!BC9*s!BH9+s!BD9*s!BG9+s!BE9*s!BF9=0,0,N10*s!BE9*s!BF9/(s!BB9*s!BI9+s!BC9*s!BH9+s!BD9*s!BG9+s!BE9*s!BF9)) -> 16.557351478741499 | BF10: =AO10+IF(s!BB9*s!BG9+s!BC9*s!BF9=0,0,K10*s!BC9*s!BF9/(s!BB9*s!BG9+s!BC9*s!BF9))+IF(s!BD9*s!BF9+s!BB9*s!BH9=0,0,M10*s!BD9*s!BF9/(s!BD9*s!BF9+s!BB9*s!BH9))+IF(s!BF9*s!BI9+s!BG9*s!BH9=0,0,W10*s!BF9*s!BI9/(s!BF9*s!BI9+s!BG9*s!BH9))+IF(s!BB9*s!BI9+s!BC9*s!BH9+s!BD9*s!BG9+s!BE9*s!BF9=0,0,N10*s!BE9*s!BF9/(s!BB9*s!BI9+s!BC9*s!BH9+s!BD9*s!BG9+s!BE9*s!BF9)) -> 10.248174940213158 | BG10: =AP10+IF(s!BB9*s!BG9+s!BC9*s!BF9=0,0,K10*s!BB9*s!BG9/(s!BB9*s!BG9+s!BC9*s!BF9))+IF(s!BC9*s!BI9+s!BE9*s!BG9=0,0,O10*s!BE9*s!BG9/(s!BC9*s!BI9+s!BE9*s!BG9))+IF(s!BF9*s!BI9+s!BG9*s!BH9=0,0,W10*s!BG9*s!BH9/(s!BF9*s!BI9+s!BG9*s!BH9))+IF(s!BB9*s!BI9+s!BC9*s!BH9+s!BD9*s!BG9+s!BE9*s!BF9=0,0,N10*s!BD9*s!BG9/(s!BB9*s!BI9+s!BC9*s!BH9+s!BD9*s!BG9+s!BE9*s!BF9)) -> 15.537653124283944 | BH10: =AQ10+IF(s!BB9*s!BH9+s!BD9*s!BF9=0,0,M10*s!BB9*s!BH9/(s!BB9*s!BH9+s!BD9*s!BF9))+IF(s!BD9*s!BI9+s!BE9*s!BH9=0,0,Q10*s!BE9*s!BH9/(s!BD9*s!BI9+s!BE9*s!BH9))+IF(s!BF9*s!BI9+s!BG9*s!BH9=0,0,W10*s!BG9*s!BH9/(s!BF9*s!BI9+s!BG9*s!BH9))+IF(s!BB9*s!BI9+s!BC9*s!BH9+s!BD9*s!BG9+s!BE9*s!BF9=0,0,N10*s!BC9*s!BH9/(s!BB9*s!BI9+s!BC9*s!BH9+s!BD9*s!BG9+s!BE9*s!BF9)) -> 17.748457888974148 | BI10: =AR10+IF(s!BC9*s!BI9+s!BE9*s!BG9=0,0,O10*s!BC9*s!BI9/(s!BC9*s!BI9+s!BE9*s!BG9))+IF(s!BD9*s!BI9+s!BE9*s!BH9=0,0,Q10*s!BD9*s!BI9/(s!BD9*s!BI9+s!BE9*s!BH9))+IF(s!BF9*s!BI9+s!BG9*s!BH9=0,0,W10*s!BF9*s!BI9/(s!BF9*s!BI9+s!BG9*s!BH9))+IF(s!BB9*s!BI9+s!BC9*s!BH9+s!BD9*s!BG9+s!BE9*s!BF9=0,0,N10*s!BB9*s!BI9/(s!BB9*s!BI9+s!BC9*s!BH9+s!BD9*s!BG9+s!BE9*s!BF9)) -> 20.465714046528749 | BJ10: =SUM(BB10:BI10) -> 326
A11: =A10 -> 100 | B11: =B10 -> 1 | C11: =C10 -> 1 | D11: =D10 -> 2 | E11: =E10 -> 5 | F11: =F10 -> 2 | G11: =G10 -> 1 | H11: =H10 -> 2 | I11: =I10 -> 1 | J11: =J10 -> 2 | K11: =K10 -> 4 | L11: =L10 -> 2 | M11: =M10 -> 4 | N11: =N10 -> 8 | O11: =O10 -> 4 | P11: =P10 -> 2 | Q11: =Q10 -> 4 | R11: =R10 -> 2 | S11: =S10 -> 1 | T11: =T10 -> 2 | U11: =U10 -> 1 | V11: =V10 -> 2 | W11: =W10 -> 4 | X11: =X10 -> 2 | Y11: =Y10 -> 1 | Z11: =Z10 -> 2 | AA11: =AA10 -> 1 | AB11: =AB10 -> 163 | AK11: =AK10 -> 205 | AL11: =AL10 -> 7 | AM11: =AM10 -> 8 | AN11: =AN10 -> 8 | AO11: =AO10 -> 8 | AP11: =AP10 -> 8 | AQ11: =AQ10 -> 8 | AR11: =AR10 -> 8 | AS11: =AS10 -> 260 | BB11: =AK11+IF(s!BB10*s!BE10+s!BC10*s!BD10=0,0,E11*s!BB10*s!BE10/(s!BB10*s!BE10+s!BC10*s!BD10)+IF(s!BB10*s!BG10+s!BC10*s!BF10=0,0,K11*s!BB10*s!BG10/(s!BB10*s!BG10+s!BC10*s!BF10))+IF(s!BB10*s!BH10+s!BD10*s!BF10=0,0,M11*s!BB10*s!BH10/(s!BB10*s!BH10+s!BD10*s!BF10))+IF(s!BB10*s!BI10+s!BC10*s!BH10+s!BD10*s!BG10+s!BE10*s!BF10=0,0,N11*s!BB10*s!BI10/(s!BB10*s!BI10+s!BC10*s!BH10+s!BD10*s!BG10+s!BE10*s!BF10)
)) -> 223.77555921123772 | BC11: =AL11+IF(s!BC10*s!BD10+s!BB10*s!BE10=0,0,E11*s!BC10*s!BD10/(s!BC10*s!BD10+s!BB10*s!BE10))+IF(s!BB10*s!BG10+s!BC10*s!BF10=0,0,K11*s!BC10*s!BF10/(s!BB10*s!BG10+s!BC10*s!BF10))+IF(s!BC10*s!BI10+s!BE10*s!BG10=0,0,O11*s!BC10*s!BI10/(s!BC10*s!BI10+s!BE10*s!BG10))+IF(s!BB10*s!BI10+s!BC10*s!BH10+s!BD10*s!BG10+s!BE10*s!BF10=0,0,N11*s!BC10*s!BH10/(s!BB10*s!BI10+s!BC10*s!BH10+s!BD10*s!BG10+s!BE10*s!BF10)) -> 11.424098220965591 | BD11: =AM11+IF(s!BC10*s!BD10+s!BB10*s!BE10=0,0,E11*s!BC10*s!BD10/(s!BC10*s!BD10+s!BB10*s!BE10))+IF(s!BD10*s!BF10+s!BB10*s!BH10=0,0,M11*s!BD10*s!BF10/(s!BD10*s!BF10+s!BB10*s!BH10))+IF(s!BD10*s!BI10+s!BE10*s!BH10=0,0,Q11*s!BD10*s!BI10/(s!BD10*s!BI10+s!BE10*s!BH10))+IF(s!BB10*s!BI10+s!BC10*s!BH10+s!BD10*s!BG10+s!BE10*s!BF10=0,0,N11*s!BD10*s!BG10/(s!BB10*s!BI10+s!BC10*s!BH10+s!BD10*s!BG10+s!BE10*s!BF10)) -> 10.197400601448438 | BE11: =AN11+IF(s!BB10*s!BE10+s!BC10*s!BD10=0,0,E11*s!BB10*s!BE10/(s!BB10*s!BE10+s!BC10*s!BD10))+IF(s!BC10*s!BI10+s!BE10*s!BG10=0,0,O11*s!BE10*s!BG10/(s!BC10*s!BI10+s!BE10*s!BG10))+IF(s!BD10*s!BI10+s!BE10*s!BH10=0,0,Q11*s!BE10*s!BH10/(s!BD10*s!BI10+s!BE10*s!BH10))+IF(s!BB10*s!BI10+s!BC10*s!BH10+s!BD10*s!BG10+s!BE10*s!BF10=0,0,N11*s!BE10*s!BF10/(s!BB10*s!BI10+s!BC10*s!BH10+s!BD10*s!BG10+s!BE10*s!BF10)) -> 16.602941966348261 | BF11: =AO11+IF(s!BB10*s!BG10+s!BC10*s!BF10=0,0,K11*s!BC10*s!BF10/(s!BB10*s!BG10+s!BC10*s!BF10))+IF(s!BD10*s!BF10+s!BB10*s!BH10=0,0,M11*s!BD10*s!BF10/(s!BD10*s!BF10+s!BB10*s!BH10))+IF(s!BF10*s!BI10+s!BG10*s!BH10=0,0,W11*s!BF10*s!BI10/(s!BF10*s!BI10+s!BG10*s!BH10))+IF(s!BB10*s!BI10+s!BC10*s!BH10+s!BD10*s!BG10+s!BE10*s!BF10=0,0,N11*s!BE10*s!BF10/(s!BB10*s!BI10+s!BC10*s!BH10+s!BD10*s!BG10+s!BE10*s!BF10)) -> 10.217765333327687 | BG11: =AP11+IF(s!BB10*s!BG10+s!BC10*s!BF10=0,0,K11*s!BB10*s!BG10/(s!BB10*s!BG10+s!BC10*s!BF10))+IF(s!BC10*s!BI10+s!BE10*s!BG10=0,0,O11*s!BE10*s!BG10/(s!BC10*s!BI10+s!BE10*s!BG10))+IF(s!BF10*s!BI10+s!BG10*s!BH10=0,0,W11*s!BG10*s!BH10/(s!BF10*s!BI10+s!BG10*s!BH10))+IF(s!BB10*s!BI10+s!BC10*s!BH10+s!BD10*s!BG10+s!BE10*s!BF10=0,0,N11*s!BD10*s!BG10/(s!BB10*s!BI10+s!BC10*s!BH10+s!BD10*s!BG10+s!BE10*s!BF10)) -> 15.58257723446901 | BH11: =AQ11+IF(s!BB10*s!BH10+s!BD10*s!BF10=0,0,M11*s!BB10*s!BH10/(s!BB10*s!BH10+s!BD10*s!BF10))+IF(s!BD10*s!BI10+s!BE10*s!BH10=0,0,Q11*s!BE10*s!BH10/(s!BD10*s!BI10+s!BE10*s!BH10))+IF(s!BF10*s!BI10+s!BG10*s!BH10=0,0,W11*s!BG10*s!BH10/(s!BF10*s!BI10+s!BG10*s!BH10))+IF(s!BB10*s!BI10+s!BC10*s!BH10+s!BD10*s!BG10+s!BE10*s!BF10=0,0,N11*s!BC10*s!BH10/(s!BB10*s!BI10+s!BC10*s!BH10+s!BD10*s!BG10+s!BE10*s!BF10)) -> 17.809274853986164 | BI11: =AR11+IF(s!BC10*s!BI10+s!BE10*s!BG10=0,0,O11*s!BC10*s!BI10/(s!BC10*s!BI10+s!BE10*s!BG10))+IF(s!BD10*s!BI10+s!BE10*s!BH10=0,0,Q11*s!BD10*s!BI10/(s!BD10*s!BI10+s!BE10*s!BH10))+IF(s!BF10*s!BI10+s!BG10*s!BH10=0,0,W11*s!BF10*s!BI10/(s!BF10*s!BI10+s!BG10*s!BH10))+IF(s!BB10*s!BI10+s!BC10*s!BH10+s!BD10*s!BG10+s!BE10*s!BF10=0,0,N11*s!BB10*s!BI10/(s!BB10*s!BI10+s!BC10*s!BH10+s!BD10*s!BG10+s!BE10*s!BF10)) -> 20.390382578217139 | BJ11: =SUM(BB11:BI11) -> 326
A12: =A11 -> 100 | B12: =B11 -> 1 | C12: =C11 -> 1 | D12: =D11 -> 2 | E12: =E11 -> 5 | F12: =F11 -> 2 | G12: =G11 -> 1 | H12: =H11 -> 2 | I12: =I11 -> 1 | J12: =J11 -> 2 | K12: =K11 -> 4 | L12: =L11 -> 2 | M12: =M11 -> 4 | N12: =N11 -> 8 | O12: =O11 -> 4 | P12: =P11 -> 2 | Q12: =Q11 -> 4 | R12: =R11 -> 2 | S12: =S11 -> 1 | T12: =T11 -> 2 | U12: =U11 -> 1 | V12: =V11 -> 2 | W12: =W11 -> 4 | X12: =X11 -> 2 | Y12: =Y11 -> 1 | Z12: =Z11 -> 2 | AA12: =AA11 -> 1 | AB12: =AB11 -> 163 | AK12: =AK11 -> 205 | AL12: =AL11 -> 7 | AM12: =AM11 -> 8 | AN12: =AN11 -> 8 | AO12: =AO11 -> 8 | AP12: =AP11 -> 8 | AQ12: =AQ11 -> 8 | AR12: =AR11 -> 8 | AS12: =AS11 -> 260 | BB12: =AK12+IF(s!BB11*s!BE11+s!BC11*s!BD11=0,0,E12*s!BB11*s!BE11/(s!BB11*s!BE11+s!BC11*s!BD11)+IF(s!BB11*s!BG11+s!BC11*s!BF11=0,0,K12*s!BB11*s!BG11/(s!BB11*s!BG11+s!BC11*s!BF11))+IF(s!BB11*s!BH11+s!BD11*s!BF11=0,0,M12*s!BB11*s!BH11/(s!BB11*s!BH11+s!BD11*s!BF11))+IF(s!BB11*s!BI11+s!BC11*s!BH11+s!BD11*s!BG11+s!BE11*s!BF11=0,0,N12*s!BB11*s!BI11/(s!BB11*s!BI11+s!BC11*s!BH11+s!BD11*s!BG11+s!BE11*s!BF11)
)) -> 223.77482704599748 | BC12: =AL12+IF(s!BC11*s!BD11+s!BB11*s!BE11=0,0,E12*s!BC11*s!BD11/(s!BC11*s!BD11+s!BB11*s!BE11))+IF(s!BB11*s!BG11+s!BC11*s!BF11=0,0,K12*s!BC11*s!BF11/(s!BB11*s!BG11+s!BC11*s!BF11))+IF(s!BC11*s!BI11+s!BE11*s!BG11=0,0,O12*s!BC11*s!BI11/(s!BC11*s!BI11+s!BE11*s!BG11))+IF(s!BB11*s!BI11+s!BC11*s!BH11+s!BD11*s!BG11+s!BE11*s!BF11=0,0,N12*s!BC11*s!BH11/(s!BB11*s!BI11+s!BC11*s!BH11+s!BD11*s!BG11+s!BE11*s!BF11)) -> 11.413217613915666 | BD12: =AM12+IF(s!BC11*s!BD11+s!BB11*s!BE11=0,0,E12*s!BC11*s!BD11/(s!BC11*s!BD11+s!BB11*s!BE11))+IF(s!BD11*s!BF11+s!BB11*s!BH11=0,0,M12*s!BD11*s!BF11/(s!BD11*s!BF11+s!BB11*s!BH11))+IF(s!BD11*s!BI11+s!BE11*s!BH11=0,0,Q12*s!BD11*s!BI11/(s!BD11*s!BI11+s!BE11*s!BH11))+IF(s!BB11*s!BI11+s!BC11*s!BH11+s!BD11*s!BG11+s!BE11*s!BF11=0,0,N12*s!BD11*s!BG11/(s!BB11*s!BI11+s!BC11*s!BH11+s!BD11*s!BG11+s!BE11*s!BF11)) -> 10.175181585520223 | BE12: =AN12+IF(s!BB11*s!BE11+s!BC11*s!BD11=0,0,E12*s!BB11*s!BE11/(s!BB11*s!BE11+s!BC11*s!BD11))+IF(s!BC11*s!BI11+s!BE11*s!BG11=0,0,O12*s!BE11*s!BG11/(s!BC11*s!BI11+s!BE11*s!BG11))+IF(s!BD11*s!BI11+s!BE11*s!BH11=0,0,Q12*s!BE11*s!BH11/(s!BD11*s!BI11+s!BE11*s!BH11))+IF(s!BB11*s!BI11+s!BC11*s!BH11+s!BD11*s!BG11+s!BE11*s!BF11=0,0,N12*s!BE11*s!BF11/(s!BB11*s!BI11+s!BC11*s!BH11+s!BD11*s!BG11+s!BE11*s!BF11)) -> 16.636773754566615 | BF12: =AO12+IF(s!BB11*s!BG11+s!BC11*s!BF11=0,0,K12*s!BC11*s!BF11/(s!BB11*s!BG11+s!BC11*s!BF11))+IF(s!BD11*s!BF11+s!BB11*s!BH11=0,0,M12*s!BD11*s!BF11/(s!BD11*s!BF11+s!BB11*s!BH11))+IF(s!BF11*s!BI11+s!BG11*s!BH11=0,0,W12*s!BF11*s!BI11/(s!BF11*s!BI11+s!BG11*s!BH11))+IF(s!BB11*s!BI11+s!BC11*s!BH11+s!BD11*s!BG11+s!BE11*s!BF11=0,0,N12*s!BE11*s!BF11/(s!BB11*s!BI11+s!BC11*s!BH11+s!BD11*s!BG11+s!BE11*s!BF11)) -> 10.19608506225326 | BG12: =AP12+IF(s!BB11*s!BG11+s!BC11*s!BF11=0,0,K12*s!BB11*s!BG11/(s!BB11*s!BG11+s!BC11*s!BF11))+IF(s!BC11*s!BI11+s!BE11*s!BG11=0,0,O12*s!BE11*s!BG11/(s!BC11*s!BI11+s!BE11*s!BG11))+IF(s!BF11*s!BI11+s!BG11*s!BH11=0,0,W12*s!BG11*s!BH11/(s!BF11*s!BI11+s!BG11*s!BH11))+IF(s!BB11*s!BI11+s!BC11*s!BH11+s!BD11*s!BG11+s!BE11*s!BF11=0,0,N12*s!BD11*s!BG11/(s!BB11*s!BI11+s!BC11*s!BH11+s!BD11*s!BG11+s!BE11*s!BF11)) -> 15.615870277833574 | BH12: =AQ12+IF(s!BB11*s!BH11+s!BD11*s!BF11=0,0,M12*s!BB11*s!BH11/(s!BB11*s!BH11+s!BD11*s!BF11))+IF(s!BD11*s!BI11+s!BE11*s!BH11=0,0,Q12*s!BE11*s!BH11/(s!BD11*s!BI11+s!BE11*s!BH11))+IF(s!BF11*s!BI11+s!BG11*s!BH11=0,0,W12*s!BG11*s!BH11/(s!BF11*s!BI11+s!BG11*s!BH11))+IF(s!BB11*s!BI11+s!BC11*s!BH11+s!BD11*s!BG11+s!BE11*s!BF11=0,0,N12*s!BC11*s!BH11/(s!BB11*s!BI11+s!BC11*s!BH11+s!BD11*s!BG11+s!BE11*s!BF11)) -> 17.853906306229014 | BI12: =AR12+IF(s!BC11*s!BI11+s!BE11*s!BG11=0,0,O12*s!BC11*s!BI11/(s!BC11*s!BI11+s!BE11*s!BG11))+IF(s!BD11*s!BI11+s!BE11*s!BH11=0,0,Q12*s!BD11*s!BI11/(s!BD11*s!BI11+s!BE11*s!BH11))+IF(s!BF11*s!BI11+s!BG11*s!BH11=0,0,W12*s!BF11*s!BI11/(s!BF11*s!BI11+s!BG11*s!BH11))+IF(s!BB11*s!BI11+s!BC11*s!BH11+s!BD11*s!BG11+s!BE11*s!BF11=0,0,N12*s!BB11*s!BI11/(s!BB11*s!BI11+s!BC11*s!BH11+s!BD11*s!BG11+s!BE11*s!BF11)) -> 20.334138353684146 | BJ12: =SUM(BB12:BI12) -> 326
A13: =A12 -> 100 | B13: =B12 -> 1 | C13: =C12 -> 1 | D13: =D12 -> 2 | E13: =E12 -> 5 | F13: =F12 -> 2 | G13: =G12 -> 1 | H13: =H12 -> 2 | I13: =I12 -> 1 | J13: =J12 -> 2 | K13: =K12 -> 4 | L13: =L12 -> 2 | M13: =M12 -> 4 | N13: =N12 -> 8 | O13: =O12 -> 4 | P13: =P12 -> 2 | Q13: =Q12 -> 4 | R13: =R12 -> 2 | S13: =S12 -> 1 | T13: =T12 -> 2 | U13: =U12 -> 1 | V13: =V12 -> 2 | W13: =W12 -> 4 | X13: =X12 -> 2 | Y13: =Y12 -> 1 | Z13: =Z12 -> 2 | AA13: =AA12 -> 1 | AB13: =AB12 -> 163 | AK13: =AK12 -> 205 | AL13: =AL12 -> 7 | AM13: =AM12 -> 8 | AN13: =AN12 -> 8 | AO13: =AO12 -> 8 | AP13: =AP12 -> 8 | AQ13: =AQ12 -> 8 | AR13: =AR12 -> 8 | AS13: =AS12 -> 260 | BB13: =AK13+IF(s!BB12*s!BE12+s!BC12*s!BD12=0,0,E13*s!BB12*s!BE12/(s!BB12*s!BE12+s!BC12*s!BD12)+IF(s!BB12*s!BG12+s!BC12*s!BF12=0,0,K13*s!BB12*s!BG12/(s!BB12*s!BG12+s!BC12*s!BF12))+IF(s!BB12*s!BH12+s!BD12*s!BF12=0,0,M13*s!BB12*s!BH12/(s!BB12*s!BH12+s!BD12*s!BF12))+IF(s!BB12*s!BI12+s!BC12*s!BH12+s!BD12*s!BG12+s!BE12*s!BF12=0,0,N13*s!BB12*s!BI12/(s!BB12*s!BI12+s!BC12*s!BH12+s!BD12*s!BG12+s!BE12*s!BF12)
)) -> 223.77356836814093 | BC13: =AL13+IF(s!BC12*s!BD12+s!BB12*s!BE12=0,0,E13*s!BC12*s!BD12/(s!BC12*s!BD12+s!BB12*s!BE12))+IF(s!BB12*s!BG12+s!BC12*s!BF12=0,0,K13*s!BC12*s!BF12/(s!BB12*s!BG12+s!BC12*s!BF12))+IF(s!BC12*s!BI12+s!BE12*s!BG12=0,0,O13*s!BC12*s!BI12/(s!BC12*s!BI12+s!BE12*s!BG12))+IF(s!BB12*s!BI12+s!BC12*s!BH12+s!BD12*s!BG12+s!BE12*s!BF12=0,0,N13*s!BC12*s!BH12/(s!BB12*s!BI12+s!BC12*s!BH12+s!BD12*s!BG12+s!BE12*s!BF12)) -> 11.405479981850213 | BD13: =AM13+IF(s!BC12*s!BD12+s!BB12*s!BE12=0,0,E13*s!BC12*s!BD12/(s!BC12*s!BD12+s!BB12*s!BE12))+IF(s!BD12*s!BF12+s!BB12*s!BH12=0,0,M13*s!BD12*s!BF12/(s!BD12*s!BF12+s!BB12*s!BH12))+IF(s!BD12*s!BI12+s!BE12*s!BH12=0,0,Q13*s!BD12*s!BI12/(s!BD12*s!BI12+s!BE12*s!BH12))+IF(s!BB12*s!BI12+s!BC12*s!BH12+s!BD12*s!BG12+s!BE12*s!BF12=0,0,N13*s!BD12*s!BG12/(s!BB12*s!BI12+s!BC12*s!BH12+s!BD12*s!BG12+s!BE12*s!BF12)) -> 10.159321307706383 | BE13: =AN13+IF(s!BB12*s!BE12+s!BC12*s!BD12=0,0,E13*s!BB12*s!BE12/(s!BB12*s!BE12+s!BC12*s!BD12))+IF(s!BC12*s!BI12+s!BE12*s!BG12=0,0,O13*s!BE12*s!BG12/(s!BC12*s!BI12+s!BE12*s!BG12))+IF(s!BD12*s!BI12+s!BE12*s!BH12=0,0,Q13*s!BE12*s!BH12/(s!BD12*s!BI12+s!BE12*s!BH12))+IF(s!BB12*s!BI12+s!BC12*s!BH12+s!BD12*s!BG12+s!BE12*s!BF12=0,0,N13*s!BE12*s!BF12/(s!BB12*s!BI12+s!BC12*s!BH12+s!BD12*s!BG12+s!BE12*s!BF12)) -> 16.661630342302466 | BF13: =AO13+IF(s!BB12*s!BG12+s!BC12*s!BF12=0,0,K13*s!BC12*s!BF12/(s!BB12*s!BG12+s!BC12*s!BF12))+IF(s!BD12*s!BF12+s!BB12*s!BH12=0,0,M13*s!BD12*s!BF12/(s!BD12*s!BF12+s!BB12*s!BH12))+IF(s!BF12*s!BI12+s!BG12*s!BH12=0,0,W13*s!BF12*s!BI12/(s!BF12*s!BI12+s!BG12*s!BH12))+IF(s!BB12*s!BI12+s!BC12*s!BH12+s!BD12*s!BG12+s!BE12*s!BF12=0,0,N13*s!BE12*s!BF12/(s!BB12*s!BI12+s!BC12*s!BH12+s!BD12*s!BG12+s!BE12*s!BF12)) -> 10.180631529697751 | BG13: =AP13+IF(s!BB12*s!BG12+s!BC12*s!BF12=0,0,K13*s!BB12*s!BG12/(s!BB12*s!BG12+s!BC12*s!BF12))+IF(s!BC12*s!BI12+s!BE12*s!BG12=0,0,O13*s!BE12*s!BG12/(s!BC12*s!BI12+s!BE12*s!BG12))+IF(s!BF12*s!BI12+s!BG12*s!BH12=0,0,W13*s!BG12*s!BH12/(s!BF12*s!BI12+s!BG12*s!BH12))+IF(s!BB12*s!BI12+s!BC12*s!BH12+s!BD12*s!BG12+s!BE12*s!BF12=0,0,N13*s!BD12*s!BG12/(s!BB12*s!BI12+s!BC12*s!BH12+s!BD12*s!BG12+s!BE12*s!BF12)) -> 15.640320120311101 | BH13: =AQ13+IF(s!BB12*s!BH12+s!BD12*s!BF12=0,0,M13*s!BB12*s!BH12/(s!BB12*s!BH12+s!BD12*s!BF12))+IF(s!BD12*s!BI12+s!BE12*s!BH12=0,0,Q13*s!BE12*s!BH12/(s!BD12*s!BI12+s!BE12*s!BH12))+IF(s!BF12*s!BI12+s!BG12*s!BH12=0,0,W13*s!BG12*s!BH12/(s!BF12*s!BI12+s!BG12*s!BH12))+IF(s!BB12*s!BI12+s!BC12*s!BH12+s!BD12*s!BG12+s!BE12*s!BF12=0,0,N13*s!BC12*s!BH12/(s!BB12*s!BI12+s!BC12*s!BH12+s!BD12*s!BG12+s!BE12*s!BF12)) -> 17.886478794454927 | BI13: =AR13+IF(s!BC12*s!BI12+s!BE12*s!BG12=0,0,O13*s!BC12*s!BI12/(s!BC12*s!BI12+s!BE12*s!BG12))+IF(s!BD12*s!BI12+s!BE12*s!BH12=0,0,Q13*s!BD12*s!BI12/(s!BD12*s!BI12+s!BE12*s!BH12))+IF(s!BF12*s!BI12+s!BG12*s!BH12=0,0,W13*s!BF12*s!BI12/(s!BF12*s!BI12+s!BG12*s!BH12))+IF(s!BB12*s!BI12+s!BC12*s!BH12+s!BD12*s!BG12+s!BE12*s!BF12=0,0,N13*s!BB12*s!BI12/(s!BB12*s!BI12+s!BC12*s!BH12+s!BD12*s!BG12+s!BE12*s!BF12)) -> 20.292569555536218 | BJ13: =SUM(BB13:BI13) -> 326
A14: =A13 -> 100 | B14: =B13 -> 1 | C14: =C13 -> 1 | D14: =D13 -> 2 | E14: =E13 -> 5 | F14: =F13 -> 2 | G14: =G13 -> 1 | H14: =H13 -> 2 | I14: =I13 -> 1 | J14: =J13 -> 2 | K14: =K13 -> 4 | L14: =L13 -> 2 | M14: =M13 -> 4 | N14: =N13 -> 8 | O14: =O13 -> 4 | P14: =P13 -> 2 | Q14: =Q13 -> 4 | R14: =R13 -> 2 | S14: =S13 -> 1 | T14: =T13 -> 2 | U14: =U13 -> 1 | V14: =V13 -> 2 | W14: =W13 -> 4 | X14: =X13 -> 2 | Y14: =Y13 -> 1 | Z14: =Z13 -> 2 | AA14: =AA13 -> 1 | AB14: =AB13 -> 163 | AK14: =AK13 -> 205 | AL14: =AL13 -> 7 | AM14: =AM13 -> 8 | AN14: =AN13 -> 8 | AO14: =AO13 -> 8 | AP14: =AP13 -> 8 | AQ14: =AQ13 -> 8 | AR14: =AR13 -> 8 | AS14: =AS13 -> 260 | BB14: =AK14+IF(s!BB13*s!BE13+s!BC13*s!BD13=0,0,E14*s!BB13*s!BE13/(s!BB13*s!BE13+s!BC13*s!BD13)+IF(s!BB13*s!BG13+s!BC13*s!BF13=0,0,K14*s!BB13*s!BG13/(s!BB13*s!BG13+s!BC13*s!BF13))+IF(s!BB13*s!BH13+s!BD13*s!BF13=0,0,M14*s!BB13*s!BH13/(s!BB13*s!BH13+s!BD13*s!BF13))+IF(s!BB13*s!BI13+s!BC13*s!BH13+s!BD13*s!BG13+s!BE13*s!BF13=0,0,N14*s!BB13*s!BI13/(s!BB13*s!BI13+s!BC13*s!BH13+s!BD13*s!BG13+s!BE13*s!BF13)
)) -> 223.77222619595051 | BC14: =AL14+IF(s!BC13*s!BD13+s!BB13*s!BE13=0,0,E14*s!BC13*s!BD13/(s!BC13*s!BD13+s!BB13*s!BE13))+IF(s!BB13*s!BG13+s!BC13*s!BF13=0,0,K14*s!BC13*s!BF13/(s!BB13*s!BG13+s!BC13*s!BF13))+IF(s!BC13*s!BI13+s!BE13*s!BG13=0,0,O14*s!BC13*s!BI13/(s!BC13*s!BI13+s!BE13*s!BG13))+IF(s!BB13*s!BI13+s!BC13*s!BH13+s!BD13*s!BG13+s!BE13*s!BF13=0,0,N14*s!BC13*s!BH13/(s!BB13*s!BI13+s!BC13*s!BH13+s!BD13*s!BG13+s!BE13*s!BF13)) -> 11.400000949012858 | BD14: =AM14+IF(s!BC13*s!BD13+s!BB13*s!BE13=0,0,E14*s!BC13*s!BD13/(s!BC13*s!BD13+s!BB13*s!BE13))+IF(s!BD13*s!BF13+s!BB13*s!BH13=0,0,M14*s!BD13*s!BF13/(s!BD13*s!BF13+s!BB13*s!BH13))+IF(s!BD13*s!BI13+s!BE13*s!BH13=0,0,Q14*s!BD13*s!BI13/(s!BD13*s!BI13+s!BE13*s!BH13))+IF(s!BB13*s!BI13+s!BC13*s!BH13+s!BD13*s!BG13+s!BE13*s!BF13=0,0,N14*s!BD13*s!BG13/(s!BB13*s!BI13+s!BC13*s!BH13+s!BD13*s!BG13+s!BE13*s!BF13)) -> 10.148006681464183 | BE14: =AN14+IF(s!BB13*s!BE13+s!BC13*s!BD13=0,0,E14*s!BB13*s!BE13/(s!BB13*s!BE13+s!BC13*s!BD13))+IF(s!BC13*s!BI13+s!BE13*s!BG13=0,0,O14*s!BE13*s!BG13/(s!BC13*s!BI13+s!BE13*s!BG13))+IF(s!BD13*s!BI13+s!BE13*s!BH13=0,0,Q14*s!BE13*s!BH13/(s!BD13*s!BI13+s!BE13*s!BH13))+IF(s!BB13*s!BI13+s!BC13*s!BH13+s!BD13*s!BG13+s!BE13*s!BF13=0,0,N14*s!BE13*s!BF13/(s!BB13*s!BI13+s!BC13*s!BH13+s!BD13*s!BG13+s!BE13*s!BF13)) -> 16.679766173572446 | BF14: =AO14+IF(s!BB13*s!BG13+s!BC13*s!BF13=0,0,K14*s!BC13*s!BF13/(s!BB13*s!BG13+s!BC13*s!BF13))+IF(s!BD13*s!BF13+s!BB13*s!BH13=0,0,M14*s!BD13*s!BF13/(s!BD13*s!BF13+s!BB13*s!BH13))+IF(s!BF13*s!BI13+s!BG13*s!BH13=0,0,W14*s!BF13*s!BI13/(s!BF13*s!BI13+s!BG13*s!BH13))+IF(s!BB13*s!BI13+s!BC13*s!BH13+s!BD13*s!BG13+s!BE13*s!BF13=0,0,N14*s!BE13*s!BF13/(s!BB13*s!BI13+s!BC13*s!BH13+s!BD13*s!BG13+s!BE13*s!BF13)) -> 10.169609695228225 | BG14: =AP14+IF(s!BB13*s!BG13+s!BC13*s!BF13=0,0,K14*s!BB13*s!BG13/(s!BB13*s!BG13+s!BC13*s!BF13))+IF(s!BC13*s!BI13+s!BE13*s!BG13=0,0,O14*s!BE13*s!BG13/(s!BC13*s!BI13+s!BE13*s!BG13))+IF(s!BF13*s!BI13+s!BG13*s!BH13=0,0,W14*s!BG13*s!BH13/(s!BF13*s!BI13+s!BG13*s!BH13))+IF(s!BB13*s!BI13+s!BC13*s!BH13+s!BD13*s!BG13+s!BE13*s!BF13=0,0,N14*s!BD13*s!BG13/(s!BB13*s!BI13+s!BC13*s!BH13+s!BD13*s!BG13+s!BE13*s!BF13)) -> 15.658163159808405 | BH14: =AQ14+IF(s!BB13*s!BH13+s!BD13*s!BF13=0,0,M14*s!BB13*s!BH13/(s!BB13*s!BH13+s!BD13*s!BF13))+IF(s!BD13*s!BI13+s!BE13*s!BH13=0,0,Q14*s!BE13*s!BH13/(s!BD13*s!BI13+s!BE13*s!BH13))+IF(s!BF13*s!BI13+s!BG13*s!BH13=0,0,W14*s!BG13*s!BH13/(s!BF13*s!BI13+s!BG13*s!BH13))+IF(s!BB13*s!BI13+s!BC13*s!BH13+s!BD13*s!BG13+s!BE13*s!BF13=0,0,N14*s!BC13*s!BH13/(s!BB13*s!BI13+s!BC13*s!BH13+s!BD13*s!BG13+s!BE13*s!BF13)) -> 17.910157427357074 | BI14: =AR14+IF(s!BC13*s!BI13+s!BE13*s!BG13=0,0,O14*s!BC13*s!BI13/(s!BC13*s!BI13+s!BE13*s!BG13))+IF(s!BD13*s!BI13+s!BE13*s!BH13=0,0,Q14*s!BD13*s!BI13/(s!BD13*s!BI13+s!BE13*s!BH13))+IF(s!BF13*s!BI13+s!BG13*s!BH13=0,0,W14*s!BF13*s!BI13/(s!BF13*s!BI13+s!BG13*s!BH13))+IF(s!BB13*s!BI13+s!BC13*s!BH13+s!BD13*s!BG13+s!BE13*s!BF13=0,0,N14*s!BB13*s!BI13/(s!BB13*s!BI13+s!BC13*s!BH13+s!BD13*s!BG13+s!BE13*s!BF13)) -> 20.262069717606291 | BJ14: =SUM(BB14:BI14) -> 326
A15: =A14 -> 100 | B15: =B14 -> 1 | C15: =C14 -> 1 | D15: =D14 -> 2 | E15: =E14 -> 5 | F15: =F14 -> 2 | G15: =G14 -> 1 | H15: =H14 -> 2 | I15: =I14 -> 1 | J15: =J14 -> 2 | K15: =K14 -> 4 | L15: =L14 -> 2 | M15: =M14 -> 4 | N15: =N14 -> 8 | O15: =O14 -> 4 | P15: =P14 -> 2 | Q15: =Q14 -> 4 | R15: =R14 -> 2 | S15: =S14 -> 1 | T15: =T14 -> 2 | U15: =U14 -> 1 | V15: =V14 -> 2 | W15: =W14 -> 4 | X15: =X14 -> 2 | Y15: =Y14 -> 1 | Z15: =Z14 -> 2 | AA15: =AA14 -> 1 | AB15: =AB14 -> 163 | AK15: =AK14 -> 205 | AL15: =AL14 -> 7 | AM15: =AM14 -> 8 | AN15: =AN14 -> 8 | AO15: =AO14 -> 8 | AP15: =AP14 -> 8 | AQ15: =AQ14 -> 8 | AR15: =AR14 -> 8 | AS15: =AS14 -> 260 | BB15: =AK15+IF(s!BB14*s!BE14+s!BC14*s!BD14=0,0,E15*s!BB14*s!BE14/(s!BB14*s!BE14+s!BC14*s!BD14)+IF(s!BB14*s!BG14+s!BC14*s!BF14=0,0,K15*s!BB14*s!BG14/(s!BB14*s!BG14+s!BC14*s!BF14))+IF(s!BB14*s!BH14+s!BD14*s!BF14=0,0,M15*s!BB14*s!BH14/(s!BB14*s!BH14+s!BD14*s!BF14))+IF(s!BB14*s!BI14+s!BC14*s!BH14+s!BD14*s!BG14+s!BE14*s!BF14=0,0,N15*s!BB14*s!BI14/(s!BB14*s!BI14+s!BC14*s!BH14+s!BD14*s!BG14+s!BE14*s!BF14)
)) -> 223.7710025104891 | BC15: =AL15+IF(s!BC14*s!BD14+s!BB14*s!BE14=0,0,E15*s!BC14*s!BD14/(s!BC14*s!BD14+s!BB14*s!BE14))+IF(s!BB14*s!BG14+s!BC14*s!BF14=0,0,K15*s!BC14*s!BF14/(s!BB14*s!BG14+s!BC14*s!BF14))+IF(s!BC14*s!BI14+s!BE14*s!BG14=0,0,O15*s!BC14*s!BI14/(s!BC14*s!BI14+s!BE14*s!BG14))+IF(s!BB14*s!BI14+s!BC14*s!BH14+s!BD14*s!BG14+s!BE14*s!BF14=0,0,N15*s!BC14*s!BH14/(s!BB14*s!BI14+s!BC14*s!BH14+s!BD14*s!BG14+s!BE14*s!BF14)) -> 11.396129151962027 | BD15: =AM15+IF(s!BC14*s!BD14+s!BB14*s!BE14=0,0,E15*s!BC14*s!BD14/(s!BC14*s!BD14+s!BB14*s!BE14))+IF(s!BD14*s!BF14+s!BB14*s!BH14=0,0,M15*s!BD14*s!BF14/(s!BD14*s!BF14+s!BB14*s!BH14))+IF(s!BD14*s!BI14+s!BE14*s!BH14=0,0,Q15*s!BD14*s!BI14/(s!BD14*s!BI14+s!BE14*s!BH14))+IF(s!BB14*s!BI14+s!BC14*s!BH14+s!BD14*s!BG14+s!BE14*s!BF14=0,0,N15*s!BD14*s!BG14/(s!BB14*s!BI14+s!BC14*s!BH14+s!BD14*s!BG14+s!BE14*s!BF14)) -> 10.139934606401482 | BE15: =AN15+IF(s!BB14*s!BE14+s!BC14*s!BD14=0,0,E15*s!BB14*s!BE14/(s!BB14*s!BE14+s!BC14*s!BD14))+IF(s!BC14*s!BI14+s!BE14*s!BG14=0,0,O15*s!BE14*s!BG14/(s!BC14*s!BI14+s!BE14*s!BG14))+IF(s!BD14*s!BI14+s!BE14*s!BH14=0,0,Q15*s!BE14*s!BH14/(s!BD14*s!BI14+s!BE14*s!BH14))+IF(s!BB14*s!BI14+s!BC14*s!BH14+s!BD14*s!BG14+s!BE14*s!BF14=0,0,N15*s!BE14*s!BF14/(s!BB14*s!BI14+s!BC14*s!BH14+s!BD14*s!BG14+s!BE14*s!BF14)) -> 16.692933731147395 | BF15: =AO15+IF(s!BB14*s!BG14+s!BC14*s!BF14=0,0,K15*s!BC14*s!BF14/(s!BB14*s!BG14+s!BC14*s!BF14))+IF(s!BD14*s!BF14+s!BB14*s!BH14=0,0,M15*s!BD14*s!BF14/(s!BD14*s!BF14+s!BB14*s!BH14))+IF(s!BF14*s!BI14+s!BG14*s!BH14=0,0,W15*s!BF14*s!BI14/(s!BF14*s!BI14+s!BG14*s!BH14))+IF(s!BB14*s!BI14+s!BC14*s!BH14+s!BD14*s!BG14+s!BE14*s!BF14=0,0,N15*s!BE14*s!BF14/(s!BB14*s!BI14+s!BC14*s!BH14+s!BD14*s!BG14+s!BE14*s!BF14)) -> 10.16174162800394 | BG15: =AP15+IF(s!BB14*s!BG14+s!BC14*s!BF14=0,0,K15*s!BB14*s!BG14/(s!BB14*s!BG14+s!BC14*s!BF14))+IF(s!BC14*s!BI14+s!BE14*s!BG14=0,0,O15*s!BE14*s!BG14/(s!BC14*s!BI14+s!BE14*s!BG14))+IF(s!BF14*s!BI14+s!BG14*s!BH14=0,0,W15*s!BG14*s!BH14/(s!BF14*s!BI14+s!BG14*s!BH14))+IF(s!BB14*s!BI14+s!BC14*s!BH14+s!BD14*s!BG14+s!BE14*s!BF14=0,0,N15*s!BD14*s!BG14/(s!BB14*s!BI14+s!BC14*s!BH14+s!BD14*s!BG14+s!BE14*s!BF14)) -> 15.671126709544936 | BH15: =AQ15+IF(s!BB14*s!BH14+s!BD14*s!BF14=0,0,M15*s!BB14*s!BH14/(s!BB14*s!BH14+s!BD14*s!BF14))+IF(s!BD14*s!BI14+s!BE14*s!BH14=0,0,Q15*s!BE14*s!BH14/(s!BD14*s!BI14+s!BE14*s!BH14))+IF(s!BF14*s!BI14+s!BG14*s!BH14=0,0,W15*s!BG14*s!BH14/(s!BF14*s!BI14+s!BG14*s!BH14))+IF(s!BB14*s!BI14+s!BC14*s!BH14+s!BD14*s!BG14+s!BE14*s!BF14=0,0,N15*s!BC14*s!BH14/(s!BB14*s!BI14+s!BC14*s!BH14+s!BD14*s!BG14+s!BE14*s!BF14)) -> 17.927321255105479 | BI15: =AR15+IF(s!BC14*s!BI14+s!BE14*s!BG14=0,0,O15*s!BC14*s!BI14/(s!BC14*s!BI14+s!BE14*s!BG14))+IF(s!BD14*s!BI14+s!BE14*s!BH14=0,0,Q15*s!BD14*s!BI14/(s!BD14*s!BI14+s!BE14*s!BH14))+IF(s!BF14*s!BI14+s!BG14*s!BH14=0,0,W15*s!BF14*s!BI14/(s!BF14*s!BI14+s!BG14*s!BH14))+IF(s!BB14*s!BI14+s!BC14*s!BH14+s!BD14*s!BG14+s!BE14*s!BF14=0,0,N15*s!BB14*s!BI14/(s!BB14*s!BI14+s!BC14*s!BH14+s!BD14*s!BG14+s!BE14*s!BF14)) -> 20.239810407345644 | BJ15: =SUM(BB15:BI15) -> 326
A16: =A15 -> 100 | B16: =B15 -> 1 | C16: =C15 -> 1 | D16: =D15 -> 2 | E16: =E15 -> 5 | F16: =F15 -> 2 | G16: =G15 -> 1 | H16: =H15 -> 2 | I16: =I15 -> 1 | J16: =J15 -> 2 | K16: =K15 -> 4 | L16: =L15 -> 2 | M16: =M15 -> 4 | N16: =N15 -> 8 | O16: =O15 -> 4 | P16: =P15 -> 2 | Q16: =Q15 -> 4 | R16: =R15 -> 2 | S16: =S15 -> 1 | T16: =T15 -> 2 | U16: =U15 -> 1 | V16: =V15 -> 2 | W16: =W15 -> 4 | X16: =X15 -> 2 | Y16: =Y15 -> 1 | Z16: =Z15 -> 2 | AA16: =AA15 -> 1 | AB16: =AB15 -> 163 | AK16: =AK15 -> 205 | AL16: =AL15 -> 7 | AM16: =AM15 -> 8 | AN16: =AN15 -> 8 | AO16: =AO15 -> 8 | AP16: =AP15 -> 8 | AQ16: =AQ15 -> 8 | AR16: =AR15 -> 8 | AS16: =AS15 -> 260 | BB16: =AK16+IF(s!BB15*s!BE15+s!BC15*s!BD15=0,0,E16*s!BB15*s!BE15/(s!BB15*s!BE15+s!BC15*s!BD15)+IF(s!BB15*s!BG15+s!BC15*s!BF15=0,0,K16*s!BB15*s!BG15/(s!BB15*s!BG15+s!BC15*s!BF15))+IF(s!BB15*s!BH15+s!BD15*s!BF15=0,0,M16*s!BB15*s!BH15/(s!BB15*s!BH15+s!BD15*s!BF15))+IF(s!BB15*s!BI15+s!BC15*s!BH15+s!BD15*s!BG15+s!BE15*s!BF15=0,0,N16*s!BB15*s!BI15/(s!BB15*s!BI15+s!BC15*s!BH15+s!BD15*s!BG15+s!BE15*s!BF15)
)) -> 223.76997073144534 | BC16: =AL16+IF(s!BC15*s!BD15+s!BB15*s!BE15=0,0,E16*s!BC15*s!BD15/(s!BC15*s!BD15+s!BB15*s!BE15))+IF(s!BB15*s!BG15+s!BC15*s!BF15=0,0,K16*s!BC15*s!BF15/(s!BB15*s!BG15+s!BC15*s!BF15))+IF(s!BC15*s!BI15+s!BE15*s!BG15=0,0,O16*s!BC15*s!BI15/(s!BC15*s!BI15+s!BE15*s!BG15))+IF(s!BB15*s!BI15+s!BC15*s!BH15+s!BD15*s!BG15+s!BE15*s!BF15=0,0,N16*s!BC15*s!BH15/(s!BB15*s!BI15+s!BC15*s!BH15+s!BD15*s!BG15+s!BE15*s!BF15)) -> 11.393394843295798 | BD16: =AM16+IF(s!BC15*s!BD15+s!BB15*s!BE15=0,0,E16*s!BC15*s!BD15/(s!BC15*s!BD15+s!BB15*s!BE15))+IF(s!BD15*s!BF15+s!BB15*s!BH15=0,0,M16*s!BD15*s!BF15/(s!BD15*s!BF15+s!BB15*s!BH15))+IF(s!BD15*s!BI15+s!BE15*s!BH15=0,0,Q16*s!BD15*s!BI15/(s!BD15*s!BI15+s!BE15*s!BH15))+IF(s!BB15*s!BI15+s!BC15*s!BH15+s!BD15*s!BG15+s!BE15*s!BF15=0,0,N16*s!BD15*s!BG15/(s!BB15*s!BI15+s!BC15*s!BH15+s!BD15*s!BG15+s!BE15*s!BF15)) -> 10.134173752504973 | BE16: =AN16+IF(s!BB15*s!BE15+s!BC15*s!BD15=0,0,E16*s!BB15*s!BE15/(s!BB15*s!BE15+s!BC15*s!BD15))+IF(s!BC15*s!BI15+s!BE15*s!BG15=0,0,O16*s!BE15*s!BG15/(s!BC15*s!BI15+s!BE15*s!BG15))+IF(s!BD15*s!BI15+s!BE15*s!BH15=0,0,Q16*s!BE15*s!BH15/(s!BD15*s!BI15+s!BE15*s!BH15))+IF(s!BB15*s!BI15+s!BC15*s!BH15+s!BD15*s!BG15+s!BE15*s!BF15=0,0,N16*s!BE15*s!BF15/(s!BB15*s!BI15+s!BC15*s!BH15+s!BD15*s!BG15+s!BE15*s!BF15)) -> 16.702460672753897 | BF16: =AO16+IF(s!BB15*s!BG15+s!BC15*s!BF15=0,0,K16*s!BC15*s!BF15/(s!BB15*s!BG15+s!BC15*s!BF15))+IF(s!BD15*s!BF15+s!BB15*s!BH15=0,0,M16*s!BD15*s!BF15/(s!BD15*s!BF15+s!BB15*s!BH15))+IF(s!BF15*s!BI15+s!BG15*s!BH15=0,0,W16*s!BF15*s!BI15/(s!BF15*s!BI15+s!BG15*s!BH15))+IF(s!BB15*s!BI15+s!BC15*s!BH15+s!BD15*s!BG15+s!BE15*s!BF15=0,0,N16*s!BE15*s!BF15/(s!BB15*s!BI15+s!BC15*s!BH15+s!BD15*s!BG15+s!BE15*s!BF15)) -> 10.156119765540566 | BG16: =AP16+IF(s!BB15*s!BG15+s!BC15*s!BF15=0,0,K16*s!BB15*s!BG15/(s!BB15*s!BG15+s!BC15*s!BF15))+IF(s!BC15*s!BI15+s!BE15*s!BG15=0,0,O16*s!BE15*s!BG15/(s!BC15*s!BI15+s!BE15*s!BG15))+IF(s!BF15*s!BI15+s!BG15*s!BH15=0,0,W16*s!BG15*s!BH15/(s!BF15*s!BI15+s!BG15*s!BH15))+IF(s!BB15*s!BI15+s!BC15*s!BH15+s!BD15*s!BG15+s!BE15*s!BF15=0,0,N16*s!BD15*s!BG15/(s!BB15*s!BI15+s!BC15*s!BH15+s!BD15*s!BG15+s!BE15*s!BF15)) -> 15.680514659718302 | BH16: =AQ16+IF(s!BB15*s!BH15+s!BD15*s!BF15=0,0,M16*s!BB15*s!BH15/(s!BB15*s!BH15+s!BD15*s!BF15))+IF(s!BD15*s!BI15+s!BE15*s!BH15=0,0,Q16*s!BE15*s!BH15/(s!BD15*s!BI15+s!BE15*s!BH15))+IF(s!BF15*s!BI15+s!BG15*s!BH15=0,0,W16*s!BG15*s!BH15/(s!BF15*s!BI15+s!BG15*s!BH15))+IF(s!BB15*s!BI15+s!BC15*s!BH15+s!BD15*s!BG15+s!BE15*s!BF15=0,0,N16*s!BC15*s!BH15/(s!BB15*s!BI15+s!BC15*s!BH15+s!BD15*s!BG15+s!BE15*s!BF15)) -> 17.939735750509129 | BI16: =AR16+IF(s!BC15*s!BI15+s!BE15*s!BG15=0,0,O16*s!BC15*s!BI15/(s!BC15*s!BI15+s!BE15*s!BG15))+IF(s!BD15*s!BI15+s!BE15*s!BH15=0,0,Q16*s!BD15*s!BI15/(s!BD15*s!BI15+s!BE15*s!BH15))+IF(s!BF15*s!BI15+s!BG15*s!BH15=0,0,W16*s!BF15*s!BI15/(s!BF15*s!BI15+s!BG15*s!BH15))+IF(s!BB15*s!BI15+s!BC15*s!BH15+s!BD15*s!BG15+s!BE15*s!BF15=0,0,N16*s!BB15*s!BI15/(s!BB15*s!BI15+s!BC15*s!BH15+s!BD15*s!BG15+s!BE15*s!BF15)) -> 20.223629824232003 | BJ16: =SUM(BB16:BI16) -> 326
A17: =A16 -> 100 | B17: =B16 -> 1 | C17: =C16 -> 1 | D17: =D16 -> 2 | E17: =E16 -> 5 | F17: =F16 -> 2 | G17: =G16 -> 1 | H17: =H16 -> 2 | I17: =I16 -> 1 | J17: =J16 -> 2 | K17: =K16 -> 4 | L17: =L16 -> 2 | M17: =M16 -> 4 | N17: =N16 -> 8 | O17: =O16 -> 4 | P17: =P16 -> 2 | Q17: =Q16 -> 4 | R17: =R16 -> 2 | S17: =S16 -> 1 | T17: =T16 -> 2 | U17: =U16 -> 1 | V17: =V16 -> 2 | W17: =W16 -> 4 | X17: =X16 -> 2 | Y17: =Y16 -> 1 | Z17: =Z16 -> 2 | AA17: =AA16 -> 1 | AB17: =AB16 -> 163 | AK17: =AK16 -> 205 | AL17: =AL16 -> 7 | AM17: =AM16 -> 8 | AN17: =AN16 -> 8 | AO17: =AO16 -> 8 | AP17: =AP16 -> 8 | AQ17: =AQ16 -> 8 | AR17: =AR16 -> 8 | AS17: =AS16 -> 260 | BB17: =AK17+IF(s!BB16*s!BE16+s!BC16*s!BD16=0,0,E17*s!BB16*s!BE16/(s!BB16*s!BE16+s!BC16*s!BD16)+IF(s!BB16*s!BG16+s!BC16*s!BF16=0,0,K17*s!BB16*s!BG16/(s!BB16*s!BG16+s!BC16*s!BF16))+IF(s!BB16*s!BH16+s!BD16*s!BF16=0,0,M17*s!BB16*s!BH16/(s!BB16*s!BH16+s!BD16*s!BF16))+IF(s!BB16*s!BI16+s!BC16*s!BH16+s!BD16*s!BG16+s!BE16*s!BF16=0,0,N17*s!BB16*s!BI16/(s!BB16*s!BI16+s!BC16*s!BH16+s!BD16*s!BG16+s!BE16*s!BF16)
)) -> 223.76914013761095 | BC17: =AL17+IF(s!BC16*s!BD16+s!BB16*s!BE16=0,0,E17*s!BC16*s!BD16/(s!BC16*s!BD16+s!BB16*s!BE16))+IF(s!BB16*s!BG16+s!BC16*s!BF16=0,0,K17*s!BC16*s!BF16/(s!BB16*s!BG16+s!BC16*s!BF16))+IF(s!BC16*s!BI16+s!BE16*s!BG16=0,0,O17*s!BC16*s!BI16/(s!BC16*s!BI16+s!BE16*s!BG16))+IF(s!BB16*s!BI16+s!BC16*s!BH16+s!BD16*s!BG16+s!BE16*s!BF16=0,0,N17*s!BC16*s!BH16/(s!BB16*s!BI16+s!BC16*s!BH16+s!BD16*s!BG16+s!BE16*s!BF16)) -> 11.391463402405657 | BD17: =AM17+IF(s!BC16*s!BD16+s!BB16*s!BE16=0,0,E17*s!BC16*s!BD16/(s!BC16*s!BD16+s!BB16*s!BE16))+IF(s!BD16*s!BF16+s!BB16*s!BH16=0,0,M17*s!BD16*s!BF16/(s!BD16*s!BF16+s!BB16*s!BH16))+IF(s!BD16*s!BI16+s!BE16*s!BH16=0,0,Q17*s!BD16*s!BI16/(s!BD16*s!BI16+s!BE16*s!BH16))+IF(s!BB16*s!BI16+s!BC16*s!BH16+s!BD16*s!BG16+s!BE16*s!BF16=0,0,N17*s!BD16*s!BG16/(s!BB16*s!BI16+s!BC16*s!BH16+s!BD16*s!BG16+s!BE16*s!BF16)) -> 10.130060323938501 | BE17: =AN17+IF(s!BB16*s!BE16+s!BC16*s!BD16=0,0,E17*s!BB16*s!BE16/(s!BB16*s!BE16+s!BC16*s!BD16))+IF(s!BC16*s!BI16+s!BE16*s!BG16=0,0,O17*s!BE16*s!BG16/(s!BC16*s!BI16+s!BE16*s!BG16))+IF(s!BD16*s!BI16+s!BE16*s!BH16=0,0,Q17*s!BE16*s!BH16/(s!BD16*s!BI16+s!BE16*s!BH16))+IF(s!BB16*s!BI16+s!BC16*s!BH16+s!BD16*s!BG16+s!BE16*s!BF16=0,0,N17*s!BE16*s!BF16/(s!BB16*s!BI16+s!BC16*s!BH16+s!BD16*s!BG16+s!BE16*s!BF16)) -> 16.709336136044886 | BF17: =AO17+IF(s!BB16*s!BG16+s!BC16*s!BF16=0,0,K17*s!BC16*s!BF16/(s!BB16*s!BG16+s!BC16*s!BF16))+IF(s!BD16*s!BF16+s!BB16*s!BH16=0,0,M17*s!BD16*s!BF16/(s!BD16*s!BF16+s!BB16*s!BH16))+IF(s!BF16*s!BI16+s!BG16*s!BH16=0,0,W17*s!BF16*s!BI16/(s!BF16*s!BI16+s!BG16*s!BH16))+IF(s!BB16*s!BI16+s!BC16*s!BH16+s!BD16*s!BG16+s!BE16*s!BF16=0,0,N17*s!BE16*s!BF16/(s!BB16*s!BI16+s!BC16*s!BH16+s!BD16*s!BG16+s!BE16*s!BF16)) -> 10.152099568807875 | BG17: =AP17+IF(s!BB16*s!BG16+s!BC16*s!BF16=0,0,K17*s!BB16*s!BG16/(s!BB16*s!BG16+s!BC16*s!BF16))+IF(s!BC16*s!BI16+s!BE16*s!BG16=0,0,O17*s!BE16*s!BG16/(s!BC16*s!BI16+s!BE16*s!BG16))+IF(s!BF16*s!BI16+s!BG16*s!BH16=0,0,W17*s!BG16*s!BH16/(s!BF16*s!BI16+s!BG16*s!BH16))+IF(s!BB16*s!BI16+s!BC16*s!BH16+s!BD16*s!BG16+s!BE16*s!BF16=0,0,N17*s!BD16*s!BG16/(s!BB16*s!BI16+s!BC16*s!BH16+s!BD16*s!BG16+s!BE16*s!BF16)) -> 15.687296891175514 | BH17: =AQ17+IF(s!BB16*s!BH16+s!BD16*s!BF16=0,0,M17*s!BB16*s!BH16/(s!BB16*s!BH16+s!BD16*s!BF16))+IF(s!BD16*s!BI16+s!BE16*s!BH16=0,0,Q17*s!BE16*s!BH16/(s!BD16*s!BI16+s!BE16*s!BH16))+IF(s!BF16*s!BI16+s!BG16*s!BH16=0,0,W17*s!BG16*s!BH16/(s!BF16*s!BI16+s!BG16*s!BH16))+IF(s!BB16*s!BI16+s!BC16*s!BH16+s!BD16*s!BG16+s!BE16*s!BF16=0,0,N17*s!BC16*s!BH16/(s!BB16*s!BI16+s!BC16*s!BH16+s!BD16*s!BG16+s!BE16*s!BF16)) -> 17.948699969642668 | BI17: =AR17+IF(s!BC16*s!BI16+s!BE16*s!BG16=0,0,O17*s!BC16*s!BI16/(s!BC16*s!BI16+s!BE16*s!BG16))+IF(s!BD16*s!BI16+s!BE16*s!BH16=0,0,Q17*s!BD16*s!BI16/(s!BD16*s!BI16+s!BE16*s!BH16))+IF(s!BF16*s!BI16+s!BG16*s!BH16=0,0,W17*s!BF16*s!BI16/(s!BF16*s!BI16+s!BG16*s!BH16))+IF(s!BB16*s!BI16+s!BC16*s!BH16+s!BD16*s!BG16+s!BE16*s!BF16=0,0,N17*s!BB16*s!BI16/(s!BB16*s!BI16+s!BC16*s!BH16+s!BD16*s!BG16+s!BE16*s!BF16)) -> 20.211903570373941 | BJ17: =SUM(BB17:BI17) -> 326
A18: =A17 -> 100 | B18: =B17 -> 1 | C18: =C17 -> 1 | D18: =D17 -> 2 | E18: =E17 -> 5 | F18: =F17 -> 2 | G18: =G17 -> 1 | H18: =H17 -> 2 | I18: =I17 -> 1 | J18: =J17 -> 2 | K18: =K17 -> 4 | L18: =L17 -> 2 | M18: =M17 -> 4 | N18: =N17 -> 8 | O18: =O17 -> 4 | P18: =P17 -> 2 | Q18: =Q17 -> 4 | R18: =R17 -> 2 | S18: =S17 -> 1 | T18: =T17 -> 2 | U18: =U17 -> 1 | V18: =V17 -> 2 | W18: =W17 -> 4 | X18: =X17 -> 2 | Y18: =Y17 -> 1 | Z18: =Z17 -> 2 | AA18: =AA17 -> 1 | AB18: =AB17 -> 163 | AK18: =AK17 -> 205 | AL18: =AL17 -> 7 | AM18: =AM17 -> 8 | AN18: =AN17 -> 8 | AO18: =AO17 -> 8 | AP18: =AP17 -> 8 | AQ18: =AQ17 -> 8 | AR18: =AR17 -> 8 | AS18: =AS17 -> 260 | BB18: =AK18+IF(s!BB17*s!BE17+s!BC17*s!BD17=0,0,E18*s!BB17*s!BE17/(s!BB17*s!BE17+s!BC17*s!BD17)+IF(s!BB17*s!BG17+s!BC17*s!BF17=0,0,K18*s!BB17*s!BG17/(s!BB17*s!BG17+s!BC17*s!BF17))+IF(s!BB17*s!BH17+s!BD17*s!BF17=0,0,M18*s!BB17*s!BH17/(s!BB17*s!BH17+s!BD17*s!BF17))+IF(s!BB17*s!BI17+s!BC17*s!BH17+s!BD17*s!BG17+s!BE17*s!BF17=0,0,N18*s!BB17*s!BI17/(s!BB17*s!BI17+s!BC17*s!BH17+s!BD17*s!BG17+s!BE17*s!BF17)
)) -> 223.76849136727478 | BC18: =AL18+IF(s!BC17*s!BD17+s!BB17*s!BE17=0,0,E18*s!BC17*s!BD17/(s!BC17*s!BD17+s!BB17*s!BE17))+IF(s!BB17*s!BG17+s!BC17*s!BF17=0,0,K18*s!BC17*s!BF17/(s!BB17*s!BG17+s!BC17*s!BF17))+IF(s!BC17*s!BI17+s!BE17*s!BG17=0,0,O18*s!BC17*s!BI17/(s!BC17*s!BI17+s!BE17*s!BG17))+IF(s!BB17*s!BI17+s!BC17*s!BH17+s!BD17*s!BG17+s!BE17*s!BF17=0,0,N18*s!BC17*s!BH17/(s!BB17*s!BI17+s!BC17*s!BH17+s!BD17*s!BG17+s!BE17*s!BF17)) -> 11.39009810090255 | BD18: =AM18+IF(s!BC17*s!BD17+s!BB17*s!BE17=0,0,E18*s!BC17*s!BD17/(s!BC17*s!BD17+s!BB17*s!BE17))+IF(s!BD17*s!BF17+s!BB17*s!BH17=0,0,M18*s!BD17*s!BF17/(s!BD17*s!BF17+s!BB17*s!BH17))+IF(s!BD17*s!BI17+s!BE17*s!BH17=0,0,Q18*s!BD17*s!BI17/(s!BD17*s!BI17+s!BE17*s!BH17))+IF(s!BB17*s!BI17+s!BC17*s!BH17+s!BD17*s!BG17+s!BE17*s!BF17=0,0,N18*s!BD17*s!BG17/(s!BB17*s!BI17+s!BC17*s!BH17+s!BD17*s!BG17+s!BE17*s!BF17)) -> 10.127121678387057 | BE18: =AN18+IF(s!BB17*s!BE17+s!BC17*s!BD17=0,0,E18*s!BB17*s!BE17/(s!BB17*s!BE17+s!BC17*s!BD17))+IF(s!BC17*s!BI17+s!BE17*s!BG17=0,0,O18*s!BE17*s!BG17/(s!BC17*s!BI17+s!BE17*s!BG17))+IF(s!BD17*s!BI17+s!BE17*s!BH17=0,0,Q18*s!BE17*s!BH17/(s!BD17*s!BI17+s!BE17*s!BH17))+IF(s!BB17*s!BI17+s!BC17*s!BH17+s!BD17*s!BG17+s!BE17*s!BF17=0,0,N18*s!BE17*s!BF17/(s!BB17*s!BI17+s!BC17*s!BH17+s!BD17*s!BG17+s!BE17*s!BF17)) -> 16.71428885343563 | BF18: =AO18+IF(s!BB17*s!BG17+s!BC17*s!BF17=0,0,K18*s!BC17*s!BF17/(s!BB17*s!BG17+s!BC17*s!BF17))+IF(s!BD17*s!BF17+s!BB17*s!BH17=0,0,M18*s!BD17*s!BF17/(s!BD17*s!BF17+s!BB17*s!BH17))+IF(s!BF17*s!BI17+s!BG17*s!BH17=0,0,W18*s!BF17*s!BI17/(s!BF17*s!BI17+s!BG17*s!BH17))+IF(s!BB17*s!BI17+s!BC17*s!BH17+s!BD17*s!BG17+s!BE17*s!BF17=0,0,N18*s!BE17*s!BF17/(s!BB17*s!BI17+s!BC17*s!BH17+s!BD17*s!BG17+s!BE17*s!BF17)) -> 10.14922279099205 | BG18: =AP18+IF(s!BB17*s!BG17+s!BC17*s!BF17=0,0,K18*s!BB17*s!BG17/(s!BB17*s!BG17+s!BC17*s!BF17))+IF(s!BC17*s!BI17+s!BE17*s!BG17=0,0,O18*s!BE17*s!BG17/(s!BC17*s!BI17+s!BE17*s!BG17))+IF(s!BF17*s!BI17+s!BG17*s!BH17=0,0,W18*s!BG17*s!BH17/(s!BF17*s!BI17+s!BG17*s!BH17))+IF(s!BB17*s!BI17+s!BC17*s!BH17+s!BD17*s!BG17+s!BE17*s!BF17=0,0,N18*s!BD17*s!BG17/(s!BB17*s!BI17+s!BC17*s!BH17+s!BD17*s!BG17+s!BE17*s!BF17)) -> 15.692187740830636 | BH18: =AQ18+IF(s!BB17*s!BH17+s!BD17*s!BF17=0,0,M18*s!BB17*s!BH17/(s!BB17*s!BH17+s!BD17*s!BF17))+IF(s!BD17*s!BI17+s!BE17*s!BH17=0,0,Q18*s!BE17*s!BH17/(s!BD17*s!BI17+s!BE17*s!BH17))+IF(s!BF17*s!BI17+s!BG17*s!BH17=0,0,W18*s!BG17*s!BH17/(s!BF17*s!BI17+s!BG17*s!BH17))+IF(s!BB17*s!BI17+s!BC17*s!BH17+s!BD17*s!BG17+s!BE17*s!BF17=0,0,N18*s!BC17*s!BH17/(s!BB17*s!BI17+s!BC17*s!BH17+s!BD17*s!BG17+s!BE17*s!BF17)) -> 17.955164163346133 | BI18: =AR18+IF(s!BC17*s!BI17+s!BE17*s!BG17=0,0,O18*s!BC17*s!BI17/(s!BC17*s!BI17+s!BE17*s!BG17))+IF(s!BD17*s!BI17+s!BE17*s!BH17=0,0,Q18*s!BD17*s!BI17/(s!BD17*s!BI17+s!BE17*s!BH17))+IF(s!BF17*s!BI17+s!BG17*s!BH17=0,0,W18*s!BF17*s!BI17/(s!BF17*s!BI17+s!BG17*s!BH17))+IF(s!BB17*s!BI17+s!BC17*s!BH17+s!BD17*s!BG17+s!BE17*s!BF17=0,0,N18*s!BB17*s!BI17/(s!BB17*s!BI17+s!BC17*s!BH17+s!BD17*s!BG17+s!BE17*s!BF17)) -> 20.203425304831185 | BJ18: =SUM(BB18:BI18) -> 326
A19: =A18 -> 100 | B19: =B18 -> 1 | C19: =C18 -> 1 | D19: =D18 -> 2 | E19: =E18 -> 5 | F19: =F18 -> 2 | G19: =G18 -> 1 | H19: =H18 -> 2 | I19: =I18 -> 1 | J19: =J18 -> 2 | K19: =K18 -> 4 | L19: =L18 -> 2 | M19: =M18 -> 4 | N19: =N18 -> 8 | O19: =O18 -> 4 | P19: =P18 -> 2 | Q19: =Q18 -> 4 | R19: =R18 -> 2 | S19: =S18 -> 1 | T19: =T18 -> 2 | U19: =U18 -> 1 | V19: =V18 -> 2 | W19: =W18 -> 4 | X19: =X18 -> 2 | Y19: =Y18 -> 1 | Z19: =Z18 -> 2 | AA19: =AA18 -> 1 | AB19: =AB18 -> 163 | AK19: =AK18 -> 205 | AL19: =AL18 -> 7 | AM19: =AM18 -> 8 | AN19: =AN18 -> 8 | AO19: =AO18 -> 8 | AP19: =AP18 -> 8 | AQ19: =AQ18 -> 8 | AR19: =AR18 -> 8 | AS19: =AS18 -> 260 | BB19: =AK19+IF(s!BB18*s!BE18+s!BC18*s!BD18=0,0,E19*s!BB18*s!BE18/(s!BB18*s!BE18+s!BC18*s!BD18)+IF(s!BB18*s!BG18+s!BC18*s!BF18=0,0,K19*s!BB18*s!BG18/(s!BB18*s!BG18+s!BC18*s!BF18))+IF(s!BB18*s!BH18+s!BD18*s!BF18=0,0,M19*s!BB18*s!BH18/(s!BB18*s!BH18+s!BD18*s!BF18))+IF(s!BB18*s!BI18+s!BC18*s!BH18+s!BD18*s!BG18+s!BE18*s!BF18=0,0,N19*s!BB18*s!BI18/(s!BB18*s!BI18+s!BC18*s!BH18+s!BD18*s!BG18+s!BE18*s!BF18)
)) -> 223.76799506850094 | BC19: =AL19+IF(s!BC18*s!BD18+s!BB18*s!BE18=0,0,E19*s!BC18*s!BD18/(s!BC18*s!BD18+s!BB18*s!BE18))+IF(s!BB18*s!BG18+s!BC18*s!BF18=0,0,K19*s!BC18*s!BF18/(s!BB18*s!BG18+s!BC18*s!BF18))+IF(s!BC18*s!BI18+s!BE18*s!BG18=0,0,O19*s!BC18*s!BI18/(s!BC18*s!BI18+s!BE18*s!BG18))+IF(s!BB18*s!BI18+s!BC18*s!BH18+s!BD18*s!BG18+s!BE18*s!BF18=0,0,N19*s!BC18*s!BH18/(s!BB18*s!BI18+s!BC18*s!BH18+s!BD18*s!BG18+s!BE18*s!BF18)) -> 11.389132048697151 | BD19: =AM19+IF(s!BC18*s!BD18+s!BB18*s!BE18=0,0,E19*s!BC18*s!BD18/(s!BC18*s!BD18+s!BB18*s!BE18))+IF(s!BD18*s!BF18+s!BB18*s!BH18=0,0,M19*s!BD18*s!BF18/(s!BD18*s!BF18+s!BB18*s!BH18))+IF(s!BD18*s!BI18+s!BE18*s!BH18=0,0,Q19*s!BD18*s!BI18/(s!BD18*s!BI18+s!BE18*s!BH18))+IF(s!BB18*s!BI18+s!BC18*s!BH18+s!BD18*s!BG18+s!BE18*s!BF18=0,0,N19*s!BD18*s!BG18/(s!BB18*s!BI18+s!BC18*s!BH18+s!BD18*s!BG18+s!BE18*s!BF18)) -> 10.125021280644408 | BE19: =AN19+IF(s!BB18*s!BE18+s!BC18*s!BD18=0,0,E19*s!BB18*s!BE18/(s!BB18*s!BE18+s!BC18*s!BD18))+IF(s!BC18*s!BI18+s!BE18*s!BG18=0,0,O19*s!BE18*s!BG18/(s!BC18*s!BI18+s!BE18*s!BG18))+IF(s!BD18*s!BI18+s!BE18*s!BH18=0,0,Q19*s!BE18*s!BH18/(s!BD18*s!BI18+s!BE18*s!BH18))+IF(s!BB18*s!BI18+s!BC18*s!BH18+s!BD18*s!BG18+s!BE18*s!BF18=0,0,N19*s!BE18*s!BF18/(s!BB18*s!BI18+s!BC18*s!BH18+s!BD18*s!BG18+s!BE18*s!BF18)) -> 16.717851602157495 | BF19: =AO19+IF(s!BB18*s!BG18+s!BC18*s!BF18=0,0,K19*s!BC18*s!BF18/(s!BB18*s!BG18+s!BC18*s!BF18))+IF(s!BD18*s!BF18+s!BB18*s!BH18=0,0,M19*s!BD18*s!BF18/(s!BD18*s!BF18+s!BB18*s!BH18))+IF(s!BF18*s!BI18+s!BG18*s!BH18=0,0,W19*s!BF18*s!BI18/(s!BF18*s!BI18+s!BG18*s!BH18))+IF(s!BB18*s!BI18+s!BC18*s!BH18+s!BD18*s!BG18+s!BE18*s!BF18=0,0,N19*s!BE18*s!BF18/(s!BB18*s!BI18+s!BC18*s!BH18+s!BD18*s!BG18+s!BE18*s!BF18)) -> 10.147163151269663 | BG19: =AP19+IF(s!BB18*s!BG18+s!BC18*s!BF18=0,0,K19*s!BB18*s!BG18/(s!BB18*s!BG18+s!BC18*s!BF18))+IF(s!BC18*s!BI18+s!BE18*s!BG18=0,0,O19*s!BE18*s!BG18/(s!BC18*s!BI18+s!BE18*s!BG18))+IF(s!BF18*s!BI18+s!BG18*s!BH18=0,0,W19*s!BG18*s!BH18/(s!BF18*s!BI18+s!BG18*s!BH18))+IF(s!BB18*s!BI18+s!BC18*s!BH18+s!BD18*s!BG18+s!BE18*s!BF18=0,0,N19*s!BD18*s!BG18/(s!BB18*s!BI18+s!BC18*s!BH18+s!BD18*s!BG18+s!BE18*s!BF18)) -> 15.69570973153224 | BH19: =AQ19+IF(s!BB18*s!BH18+s!BD18*s!BF18=0,0,M19*s!BB18*s!BH18/(s!BB18*s!BH18+s!BD18*s!BF18))+IF(s!BD18*s!BI18+s!BE18*s!BH18=0,0,Q19*s!BE18*s!BH18/(s!BD18*s!BI18+s!BE18*s!BH18))+IF(s!BF18*s!BI18+s!BG18*s!BH18=0,0,W19*s!BG18*s!BH18/(s!BF18*s!BI18+s!BG18*s!BH18))+IF(s!BB18*s!BI18+s!BC18*s!BH18+s!BD18*s!BG18+s!BE18*s!BF18=0,0,N19*s!BC18*s!BH18/(s!BB18*s!BI18+s!BC18*s!BH18+s!BD18*s!BG18+s!BE18*s!BF18)) -> 17.959820499584982 | BI19: =AR19+IF(s!BC18*s!BI18+s!BE18*s!BG18=0,0,O19*s!BC18*s!BI18/(s!BC18*s!BI18+s!BE18*s!BG18))+IF(s!BD18*s!BI18+s!BE18*s!BH18=0,0,Q19*s!BD18*s!BI18/(s!BD18*s!BI18+s!BE18*s!BH18))+IF(s!BF18*s!BI18+s!BG18*s!BH18=0,0,W19*s!BF18*s!BI18/(s!BF18*s!BI18+s!BG18*s!BH18))+IF(s!BB18*s!BI18+s!BC18*s!BH18+s!BD18*s!BG18+s!BE18*s!BF18=0,0,N19*s!BB18*s!BI18/(s!BB18*s!BI18+s!BC18*s!BH18+s!BD18*s!BG18+s!BE18*s!BF18)) -> 20.197306617613112 | BJ19: =SUM(BB19:BI19) -> 326
A20: =A19 -> 100 | B20: =B19 -> 1 | C20: =C19 -> 1 | D20: =D19 -> 2 | E20: =E19 -> 5 | F20: =F19 -> 2 | G20: =G19 -> 1 | H20: =H19 -> 2 | I20: =I19 -> 1 | J20: =J19 -> 2 | K20: =K19 -> 4 | L20: =L19 -> 2 | M20: =M19 -> 4 | N20: =N19 -> 8 | O20: =O19 -> 4 | P20: =P19 -> 2 | Q20: =Q19 -> 4 | R20: =R19 -> 2 | S20: =S19 -> 1 | T20: =T19 -> 2 | U20: =U19 -> 1 | V20: =V19 -> 2 | W20: =W19 -> 4 | X20: =X19 -> 2 | Y20: =Y19 -> 1 | Z20: =Z19 -> 2 | AA20: =AA19 -> 1 | AB20: =AB19 -> 163 | AK20: =AK19 -> 205 | AL20: =AL19 -> 7 | AM20: =AM19 -> 8 | AN20: =AN19 -> 8 | AO20: =AO19 -> 8 | AP20: =AP19 -> 8 | AQ20: =AQ19 -> 8 | AR20: =AR19 -> 8 | AS20: =AS19 -> 260 | BB20: =AK20+IF(s!BB19*s!BE19+s!BC19*s!BD19=0,0,E20*s!BB19*s!BE19/(s!BB19*s!BE19+s!BC19*s!BD19)+IF(s!BB19*s!BG19+s!BC19*s!BF19=0,0,K20*s!BB19*s!BG19/(s!BB19*s!BG19+s!BC19*s!BF19))+IF(s!BB19*s!BH19+s!BD19*s!BF19=0,0,M20*s!BB19*s!BH19/(s!BB19*s!BH19+s!BD19*s!BF19))+IF(s!BB19*s!BI19+s!BC19*s!BH19+s!BD19*s!BG19+s!BE19*s!BF19=0,0,N20*s!BB19*s!BI19/(s!BB19*s!BI19+s!BC19*s!BH19+s!BD19*s!BG19+s!BE19*s!BF19)
)) -> 223.76762105434813 | BC20: =AL20+IF(s!BC19*s!BD19+s!BB19*s!BE19=0,0,E20*s!BC19*s!BD19/(s!BC19*s!BD19+s!BB19*s!BE19))+IF(s!BB19*s!BG19+s!BC19*s!BF19=0,0,K20*s!BC19*s!BF19/(s!BB19*s!BG19+s!BC19*s!BF19))+IF(s!BC19*s!BI19+s!BE19*s!BG19=0,0,O20*s!BC19*s!BI19/(s!BC19*s!BI19+s!BE19*s!BG19))+IF(s!BB19*s!BI19+s!BC19*s!BH19+s!BD19*s!BG19+s!BE19*s!BF19=0,0,N20*s!BC19*s!BH19/(s!BB19*s!BI19+s!BC19*s!BH19+s!BD19*s!BG19+s!BE19*s!BF19)) -> 11.388447753395612 | BD20: =AM20+IF(s!BC19*s!BD19+s!BB19*s!BE19=0,0,E20*s!BC19*s!BD19/(s!BC19*s!BD19+s!BB19*s!BE19))+IF(s!BD19*s!BF19+s!BB19*s!BH19=0,0,M20*s!BD19*s!BF19/(s!BD19*s!BF19+s!BB19*s!BH19))+IF(s!BD19*s!BI19+s!BE19*s!BH19=0,0,Q20*s!BD19*s!BI19/(s!BD19*s!BI19+s!BE19*s!BH19))+IF(s!BB19*s!BI19+s!BC19*s!BH19+s!BD19*s!BG19+s!BE19*s!BF19=0,0,N20*s!BD19*s!BG19/(s!BB19*s!BI19+s!BC19*s!BH19+s!BD19*s!BG19+s!BE19*s!BF19)) -> 10.123519384860298 | BE20: =AN20+IF(s!BB19*s!BE19+s!BC19*s!BD19=0,0,E20*s!BB19*s!BE19/(s!BB19*s!BE19+s!BC19*s!BD19))+IF(s!BC19*s!BI19+s!BE19*s!BG19=0,0,O20*s!BE19*s!BG19/(s!BC19*s!BI19+s!BE19*s!BG19))+IF(s!BD19*s!BI19+s!BE19*s!BH19=0,0,Q20*s!BE19*s!BH19/(s!BD19*s!BI19+s!BE19*s!BH19))+IF(s!BB19*s!BI19+s!BC19*s!BH19+s!BD19*s!BG19+s!BE19*s!BF19=0,0,N20*s!BE19*s!BF19/(s!BB19*s!BI19+s!BC19*s!BH19+s!BD19*s!BG19+s!BE19*s!BF19)) -> 16.720411807395955 | BF20: =AO20+IF(s!BB19*s!BG19+s!BC19*s!BF19=0,0,K20*s!BC19*s!BF19/(s!BB19*s!BG19+s!BC19*s!BF19))+IF(s!BD19*s!BF19+s!BB19*s!BH19=0,0,M20*s!BD19*s!BF19/(s!BD19*s!BF19+s!BB19*s!BH19))+IF(s!BF19*s!BI19+s!BG19*s!BH19=0,0,W20*s!BF19*s!BI19/(s!BF19*s!BI19+s!BG19*s!BH19))+IF(s!BB19*s!BI19+s!BC19*s!BH19+s!BD19*s!BG19+s!BE19*s!BF19=0,0,N20*s!BE19*s!BF19/(s!BB19*s!BI19+s!BC19*s!BH19+s!BD19*s!BG19+s!BE19*s!BF19)) -> 10.145687983838087 | BG20: =AP20+IF(s!BB19*s!BG19+s!BC19*s!BF19=0,0,K20*s!BB19*s!BG19/(s!BB19*s!BG19+s!BC19*s!BF19))+IF(s!BC19*s!BI19+s!BE19*s!BG19=0,0,O20*s!BE19*s!BG19/(s!BC19*s!BI19+s!BE19*s!BG19))+IF(s!BF19*s!BI19+s!BG19*s!BH19=0,0,W20*s!BG19*s!BH19/(s!BF19*s!BI19+s!BG19*s!BH19))+IF(s!BB19*s!BI19+s!BC19*s!BH19+s!BD19*s!BG19+s!BE19*s!BF19=0,0,N20*s!BD19*s!BG19/(s!BB19*s!BI19+s!BC19*s!BH19+s!BD19*s!BG19+s!BE19*s!BF19)) -> 15.698243208418166 | BH20: =AQ20+IF(s!BB19*s!BH19+s!BD19*s!BF19=0,0,M20*s!BB19*s!BH19/(s!BB19*s!BH19+s!BD19*s!BF19))+IF(s!BD19*s!BI19+s!BE19*s!BH19=0,0,Q20*s!BE19*s!BH19/(s!BD19*s!BI19+s!BE19*s!BH19))+IF(s!BF19*s!BI19+s!BG19*s!BH19=0,0,W20*s!BG19*s!BH19/(s!BF19*s!BI19+s!BG19*s!BH19))+IF(s!BB19*s!BI19+s!BC19*s!BH19+s!BD19*s!BG19+s!BE19*s!BF19=0,0,N20*s!BC19*s!BH19/(s!BB19*s!BI19+s!BC19*s!BH19+s!BD19*s!BG19+s!BE19*s!BF19)) -> 17.963171576953485 | BI20: =AR20+IF(s!BC19*s!BI19+s!BE19*s!BG19=0,0,O20*s!BC19*s!BI19/(s!BC19*s!BI19+s!BE19*s!BG19))+IF(s!BD19*s!BI19+s!BE19*s!BH19=0,0,Q20*s!BD19*s!BI19/(s!BD19*s!BI19+s!BE19*s!BH19))+IF(s!BF19*s!BI19+s!BG19*s!BH19=0,0,W20*s!BF19*s!BI19/(s!BF19*s!BI19+s!BG19*s!BH19))+IF(s!BB19*s!BI19+s!BC19*s!BH19+s!BD19*s!BG19+s!BE19*s!BF19=0,0,N20*s!BB19*s!BI19/(s!BB19*s!BI19+s!BC19*s!BH19+s!BD19*s!BG19+s!BE19*s!BF19)) -> 20.192897230790269 | BJ20: =SUM(BB20:BI20) -> 326
A21: =A20 -> 100 | B21: =B20 -> 1 | C21: =C20 -> 1 | D21: =D20 -> 2 | E21: =E20 -> 5 | F21: =F20 -> 2 | G21: =G20 -> 1 | H21: =H20 -> 2 | I21: =I20 -> 1 | J21: =J20 -> 2 | K21: =K20 -> 4 | L21: =L20 -> 2 | M21: =M20 -> 4 | N21: =N20 -> 8 | O21: =O20 -> 4 | P21: =P20 -> 2 | Q21: =Q20 -> 4 | R21: =R20 -> 2 | S21: =S20 -> 1 | T21: =T20 -> 2 | U21: =U20 -> 1 | V21: =V20 -> 2 | W21: =W20 -> 4 | X21: =X20 -> 2 | Y21: =Y20 -> 1 | Z21: =Z20 -> 2 | AA21: =AA20 -> 1 | AB21: =AB20 -> 163 | AK21: =AK20 -> 205 | AL21: =AL20 -> 7 | AM21: =AM20 -> 8 | AN21: =AN20 -> 8 | AO21: =AO20 -> 8 | AP21: =AP20 -> 8 | AQ21: =AQ20 -> 8 | AR21: =AR20 -> 8 | AS21: =AS20 -> 260 | BB21: =AK21+IF(s!BB20*s!BE20+s!BC20*s!BD20=0,0,E21*s!BB20*s!BE20/(s!BB20*s!BE20+s!BC20*s!BD20)+IF(s!BB20*s!BG20+s!BC20*s!BF20=0,0,K21*s!BB20*s!BG20/(s!BB20*s!BG20+s!BC20*s!BF20))+IF(s!BB20*s!BH20+s!BD20*s!BF20=0,0,M21*s!BB20*s!BH20/(s!BB20*s!BH20+s!BD20*s!BF20))+IF(s!BB20*s!BI20+s!BC20*s!BH20+s!BD20*s!BG20+s!BE20*s!BF20=0,0,N21*s!BB20*s!BI20/(s!BB20*s!BI20+s!BC20*s!BH20+s!BD20*s!BG20+s!BE20*s!BF20)
)) -> 223.76734230233714 | BC21: =AL21+IF(s!BC20*s!BD20+s!BB20*s!BE20=0,0,E21*s!BC20*s!BD20/(s!BC20*s!BD20+s!BB20*s!BE20))+IF(s!BB20*s!BG20+s!BC20*s!BF20=0,0,K21*s!BC20*s!BF20/(s!BB20*s!BG20+s!BC20*s!BF20))+IF(s!BC20*s!BI20+s!BE20*s!BG20=0,0,O21*s!BC20*s!BI20/(s!BC20*s!BI20+s!BE20*s!BG20))+IF(s!BB20*s!BI20+s!BC20*s!BH20+s!BD20*s!BG20+s!BE20*s!BF20=0,0,N21*s!BC20*s!BH20/(s!BB20*s!BI20+s!BC20*s!BH20+s!BD20*s!BG20+s!BE20*s!BF20)) -> 11.387962506558942 | BD21: =AM21+IF(s!BC20*s!BD20+s!BB20*s!BE20=0,0,E21*s!BC20*s!BD20/(s!BC20*s!BD20+s!BB20*s!BE20))+IF(s!BD20*s!BF20+s!BB20*s!BH20=0,0,M21*s!BD20*s!BF20/(s!BD20*s!BF20+s!BB20*s!BH20))+IF(s!BD20*s!BI20+s!BE20*s!BH20=0,0,Q21*s!BD20*s!BI20/(s!BD20*s!BI20+s!BE20*s!BH20))+IF(s!BB20*s!BI20+s!BC20*s!BH20+s!BD20*s!BG20+s!BE20*s!BF20=0,0,N21*s!BD20*s!BG20/(s!BB20*s!BI20+s!BC20*s!BH20+s!BD20*s!BG20+s!BE20*s!BF20)) -> 10.122445072159255 | BE21: =AN21+IF(s!BB20*s!BE20+s!BC20*s!BD20=0,0,E21*s!BB20*s!BE20/(s!BB20*s!BE20+s!BC20*s!BD20))+IF(s!BC20*s!BI20+s!BE20*s!BG20=0,0,O21*s!BE20*s!BG20/(s!BC20*s!BI20+s!BE20*s!BG20))+IF(s!BD20*s!BI20+s!BE20*s!BH20=0,0,Q21*s!BE20*s!BH20/(s!BD20*s!BI20+s!BE20*s!BH20))+IF(s!BB20*s!BI20+s!BC20*s!BH20+s!BD20*s!BG20+s!BE20*s!BF20=0,0,N21*s!BE20*s!BF20/(s!BB20*s!BI20+s!BC20*s!BH20+s!BD20*s!BG20+s!BE20*s!BF20)) -> 16.722250118944658 | BF21: =AO21+IF(s!BB20*s!BG20+s!BC20*s!BF20=0,0,K21*s!BC20*s!BF20/(s!BB20*s!BG20+s!BC20*s!BF20))+IF(s!BD20*s!BF20+s!BB20*s!BH20=0,0,M21*s!BD20*s!BF20/(s!BD20*s!BF20+s!BB20*s!BH20))+IF(s!BF20*s!BI20+s!BG20*s!BH20=0,0,W21*s!BF20*s!BI20/(s!BF20*s!BI20+s!BG20*s!BH20))+IF(s!BB20*s!BI20+s!BC20*s!BH20+s!BD20*s!BG20+s!BE20*s!BF20=0,0,N21*s!BE20*s!BF20/(s!BB20*s!BI20+s!BC20*s!BH20+s!BD20*s!BG20+s!BE20*s!BF20)) -> 10.144631155926596 | BG21: =AP21+IF(s!BB20*s!BG20+s!BC20*s!BF20=0,0,K21*s!BB20*s!BG20/(s!BB20*s!BG20+s!BC20*s!BF20))+IF(s!BC20*s!BI20+s!BE20*s!BG20=0,0,O21*s!BE20*s!BG20/(s!BC20*s!BI20+s!BE20*s!BG20))+IF(s!BF20*s!BI20+s!BG20*s!BH20=0,0,W21*s!BG20*s!BH20/(s!BF20*s!BI20+s!BG20*s!BH20))+IF(s!BB20*s!BI20+s!BC20*s!BH20+s!BD20*s!BG20+s!BE20*s!BF20=0,0,N21*s!BD20*s!BG20/(s!BB20*s!BI20+s!BC20*s!BH20+s!BD20*s!BG20+s!BE20*s!BF20)) -> 15.700064035177315 | BH21: =AQ21+IF(s!BB20*s!BH20+s!BD20*s!BF20=0,0,M21*s!BB20*s!BH20/(s!BB20*s!BH20+s!BD20*s!BF20))+IF(s!BD20*s!BI20+s!BE20*s!BH20=0,0,Q21*s!BE20*s!BH20/(s!BD20*s!BI20+s!BE20*s!BH20))+IF(s!BF20*s!BI20+s!BG20*s!BH20=0,0,W21*s!BG20*s!BH20/(s!BF20*s!BI20+s!BG20*s!BH20))+IF(s!BB20*s!BI20+s!BC20*s!BH20+s!BD20*s!BG20+s!BE20*s!BF20=0,0,N21*s!BC20*s!BH20/(s!BB20*s!BI20+s!BC20*s!BH20+s!BD20*s!BG20+s!BE20*s!BF20)) -> 17.965581469577003 | BI21: =AR21+IF(s!BC20*s!BI20+s!BE20*s!BG20=0,0,O21*s!BC20*s!BI20/(s!BC20*s!BI20+s!BE20*s!BG20))+IF(s!BD20*s!BI20+s!BE20*s!BH20=0,0,Q21*s!BD20*s!BI20/(s!BD20*s!BI20+s!BE20*s!BH20))+IF(s!BF20*s!BI20+s!BG20*s!BH20=0,0,W21*s!BF20*s!BI20/(s!BF20*s!BI20+s!BG20*s!BH20))+IF(s!BB20*s!BI20+s!BC20*s!BH20+s!BD20*s!BG20+s!BE20*s!BF20=0,0,N21*s!BB20*s!BI20/(s!BB20*s!BI20+s!BC20*s!BH20+s!BD20*s!BG20+s!BE20*s!BF20)) -> 20.189723339319084 | BJ21: =SUM(BB21:BI21) -> 326
A22: =A21 -> 100 | B22: =B21 -> 1 | C22: =C21 -> 1 | D22: =D21 -> 2 | E22: =E21 -> 5 | F22: =F21 -> 2 | G22: =G21 -> 1 | H22: =H21 -> 2 | I22: =I21 -> 1 | J22: =J21 -> 2 | K22: =K21 -> 4 | L22: =L21 -> 2 | M22: =M21 -> 4 | N22: =N21 -> 8 | O22: =O21 -> 4 | P22: =P21 -> 2 | Q22: =Q21 -> 4 | R22: =R21 -> 2 | S22: =S21 -> 1 | T22: =T21 -> 2 | U22: =U21 -> 1 | V22: =V21 -> 2 | W22: =W21 -> 4 | X22: =X21 -> 2 | Y22: =Y21 -> 1 | Z22: =Z21 -> 2 | AA22: =AA21 -> 1 | AB22: =AB21 -> 163 | AK22: =AK21 -> 205 | AL22: =AL21 -> 7 | AM22: =AM21 -> 8 | AN22: =AN21 -> 8 | AO22: =AO21 -> 8 | AP22: =AP21 -> 8 | AQ22: =AQ21 -> 8 | AR22: =AR21 -> 8 | AS22: =AS21 -> 260 | BB22: =AK22+IF(s!BB21*s!BE21+s!BC21*s!BD21=0,0,E22*s!BB21*s!BE21/(s!BB21*s!BE21+s!BC21*s!BD21)+IF(s!BB21*s!BG21+s!BC21*s!BF21=0,0,K22*s!BB21*s!BG21/(s!BB21*s!BG21+s!BC21*s!BF21))+IF(s!BB21*s!BH21+s!BD21*s!BF21=0,0,M22*s!BB21*s!BH21/(s!BB21*s!BH21+s!BD21*s!BF21))+IF(s!BB21*s!BI21+s!BC21*s!BH21+s!BD21*s!BG21+s!BE21*s!BF21=0,0,N22*s!BB21*s!BI21/(s!BB21*s!BI21+s!BC21*s!BH21+s!BD21*s!BG21+s!BE21*s!BF21)
)) -> 223.76713628268857 | BC22: =AL22+IF(s!BC21*s!BD21+s!BB21*s!BE21=0,0,E22*s!BC21*s!BD21/(s!BC21*s!BD21+s!BB21*s!BE21))+IF(s!BB21*s!BG21+s!BC21*s!BF21=0,0,K22*s!BC21*s!BF21/(s!BB21*s!BG21+s!BC21*s!BF21))+IF(s!BC21*s!BI21+s!BE21*s!BG21=0,0,O22*s!BC21*s!BI21/(s!BC21*s!BI21+s!BE21*s!BG21))+IF(s!BB21*s!BI21+s!BC21*s!BH21+s!BD21*s!BG21+s!BE21*s!BF21=0,0,N22*s!BC21*s!BH21/(s!BB21*s!BI21+s!BC21*s!BH21+s!BD21*s!BG21+s!BE21*s!BF21)) -> 11.387618046411333 | BD22: =AM22+IF(s!BC21*s!BD21+s!BB21*s!BE21=0,0,E22*s!BC21*s!BD21/(s!BC21*s!BD21+s!BB21*s!BE21))+IF(s!BD21*s!BF21+s!BB21*s!BH21=0,0,M22*s!BD21*s!BF21/(s!BD21*s!BF21+s!BB21*s!BH21))+IF(s!BD21*s!BI21+s!BE21*s!BH21=0,0,Q22*s!BD21*s!BI21/(s!BD21*s!BI21+s!BE21*s!BH21))+IF(s!BB21*s!BI21+s!BC21*s!BH21+s!BD21*s!BG21+s!BE21*s!BF21=0,0,N22*s!BD21*s!BG21/(s!BB21*s!BI21+s!BC21*s!BH21+s!BD21*s!BG21+s!BE21*s!BF21)) -> 10.12167639603169 | BE22: =AN22+IF(s!BB21*s!BE21+s!BC21*s!BD21=0,0,E22*s!BB21*s!BE21/(s!BB21*s!BE21+s!BC21*s!BD21))+IF(s!BC21*s!BI21+s!BE21*s!BG21=0,0,O22*s!BE21*s!BG21/(s!BC21*s!BI21+s!BE21*s!BG21))+IF(s!BD21*s!BI21+s!BE21*s!BH21=0,0,Q22*s!BE21*s!BH21/(s!BD21*s!BI21+s!BE21*s!BH21))+IF(s!BB21*s!BI21+s!BC21*s!BH21+s!BD21*s!BG21+s!BE21*s!BF21=0,0,N22*s!BE21*s!BF21/(s!BB21*s!BI21+s!BC21*s!BH21+s!BD21*s!BG21+s!BE21*s!BF21)) -> 16.723569274868396 | BF22: =AO22+IF(s!BB21*s!BG21+s!BC21*s!BF21=0,0,K22*s!BC21*s!BF21/(s!BB21*s!BG21+s!BC21*s!BF21))+IF(s!BD21*s!BF21+s!BB21*s!BH21=0,0,M22*s!BD21*s!BF21/(s!BD21*s!BF21+s!BB21*s!BH21))+IF(s!BF21*s!BI21+s!BG21*s!BH21=0,0,W22*s!BF21*s!BI21/(s!BF21*s!BI21+s!BG21*s!BH21))+IF(s!BB21*s!BI21+s!BC21*s!BH21+s!BD21*s!BG21+s!BE21*s!BF21=0,0,N22*s!BE21*s!BF21/(s!BB21*s!BI21+s!BC21*s!BH21+s!BD21*s!BG21+s!BE21*s!BF21)) -> 10.143873909303613 | BG22: =AP22+IF(s!BB21*s!BG21+s!BC21*s!BF21=0,0,K22*s!BB21*s!BG21/(s!BB21*s!BG21+s!BC21*s!BF21))+IF(s!BC21*s!BI21+s!BE21*s!BG21=0,0,O22*s!BE21*s!BG21/(s!BC21*s!BI21+s!BE21*s!BG21))+IF(s!BF21*s!BI21+s!BG21*s!BH21=0,0,W22*s!BG21*s!BH21/(s!BF21*s!BI21+s!BG21*s!BH21))+IF(s!BB21*s!BI21+s!BC21*s!BH21+s!BD21*s!BG21+s!BE21*s!BF21=0,0,N22*s!BD21*s!BG21/(s!BB21*s!BI21+s!BC21*s!BH21+s!BD21*s!BG21+s!BE21*s!BF21)) -> 15.701371761596469 | BH22: =AQ22+IF(s!BB21*s!BH21+s!BD21*s!BF21=0,0,M22*s!BB21*s!BH21/(s!BB21*s!BH21+s!BD21*s!BF21))+IF(s!BD21*s!BI21+s!BE21*s!BH21=0,0,Q22*s!BE21*s!BH21/(s!BD21*s!BI21+s!BE21*s!BH21))+IF(s!BF21*s!BI21+s!BG21*s!BH21=0,0,W22*s!BG21*s!BH21/(s!BF21*s!BI21+s!BG21*s!BH21))+IF(s!BB21*s!BI21+s!BC21*s!BH21+s!BD21*s!BG21+s!BE21*s!BF21=0,0,N22*s!BC21*s!BH21/(s!BB21*s!BI21+s!BC21*s!BH21+s!BD21*s!BG21+s!BE21*s!BF21)) -> 17.967313411976114 | BI22: =AR22+IF(s!BC21*s!BI21+s!BE21*s!BG21=0,0,O22*s!BC21*s!BI21/(s!BC21*s!BI21+s!BE21*s!BG21))+IF(s!BD21*s!BI21+s!BE21*s!BH21=0,0,Q22*s!BD21*s!BI21/(s!BD21*s!BI21+s!BE21*s!BH21))+IF(s!BF21*s!BI21+s!BG21*s!BH21=0,0,W22*s!BF21*s!BI21/(s!BF21*s!BI21+s!BG21*s!BH21))+IF(s!BB21*s!BI21+s!BC21*s!BH21+s!BD21*s!BG21+s!BE21*s!BF21=0,0,N22*s!BB21*s!BI21/(s!BB21*s!BI21+s!BC21*s!BH21+s!BD21*s!BG21+s!BE21*s!BF21)) -> 20.187440917123805 | BJ22: =SUM(BB22:BI22) -> 326
A23: =A22 -> 100 | B23: =B22 -> 1 | C23: =C22 -> 1 | D23: =D22 -> 2 | E23: =E22 -> 5 | F23: =F22 -> 2 | G23: =G22 -> 1 | H23: =H22 -> 2 | I23: =I22 -> 1 | J23: =J22 -> 2 | K23: =K22 -> 4 | L23: =L22 -> 2 | M23: =M22 -> 4 | N23: =N22 -> 8 | O23: =O22 -> 4 | P23: =P22 -> 2 | Q23: =Q22 -> 4 | R23: =R22 -> 2 | S23: =S22 -> 1 | T23: =T22 -> 2 | U23: =U22 -> 1 | V23: =V22 -> 2 | W23: =W22 -> 4 | X23: =X22 -> 2 | Y23: =Y22 -> 1 | Z23: =Z22 -> 2 | AA23: =AA22 -> 1 | AB23: =AB22 -> 163 | AK23: =AK22 -> 205 | AL23: =AL22 -> 7 | AM23: =AM22 -> 8 | AN23: =AN22 -> 8 | AO23: =AO22 -> 8 | AP23: =AP22 -> 8 | AQ23: =AQ22 -> 8 | AR23: =AR22 -> 8 | AS23: =AS22 -> 260 | BB23: =AK23+IF(s!BB22*s!BE22+s!BC22*s!BD22=0,0,E23*s!BB22*s!BE22/(s!BB22*s!BE22+s!BC22*s!BD22)+IF(s!BB22*s!BG22+s!BC22*s!BF22=0,0,K23*s!BB22*s!BG22/(s!BB22*s!BG22+s!BC22*s!BF22))+IF(s!BB22*s!BH22+s!BD22*s!BF22=0,0,M23*s!BB22*s!BH22/(s!BB22*s!BH22+s!BD22*s!BF22))+IF(s!BB22*s!BI22+s!BC22*s!BH22+s!BD22*s!BG22+s!BE22*s!BF22=0,0,N23*s!BB22*s!BI22/(s!BB22*s!BI22+s!BC22*s!BH22+s!BD22*s!BG22+s!BE22*s!BF22)
)) -> 223.76698499524304 | BC23: =AL23+IF(s!BC22*s!BD22+s!BB22*s!BE22=0,0,E23*s!BC22*s!BD22/(s!BC22*s!BD22+s!BB22*s!BE22))+IF(s!BB22*s!BG22+s!BC22*s!BF22=0,0,K23*s!BC22*s!BF22/(s!BB22*s!BG22+s!BC22*s!BF22))+IF(s!BC22*s!BI22+s!BE22*s!BG22=0,0,O23*s!BC22*s!BI22/(s!BC22*s!BI22+s!BE22*s!BG22))+IF(s!BB22*s!BI22+s!BC22*s!BH22+s!BD22*s!BG22+s!BE22*s!BF22=0,0,N23*s!BC22*s!BH22/(s!BB22*s!BI22+s!BC22*s!BH22+s!BD22*s!BG22+s!BE22*s!BF22)) -> 11.387373286772693 | BD23: =AM23+IF(s!BC22*s!BD22+s!BB22*s!BE22=0,0,E23*s!BC22*s!BD22/(s!BC22*s!BD22+s!BB22*s!BE22))+IF(s!BD22*s!BF22+s!BB22*s!BH22=0,0,M23*s!BD22*s!BF22/(s!BD22*s!BF22+s!BB22*s!BH22))+IF(s!BD22*s!BI22+s!BE22*s!BH22=0,0,Q23*s!BD22*s!BI22/(s!BD22*s!BI22+s!BE22*s!BH22))+IF(s!BB22*s!BI22+s!BC22*s!BH22+s!BD22*s!BG22+s!BE22*s!BF22=0,0,N23*s!BD22*s!BG22/(s!BB22*s!BI22+s!BC22*s!BH22+s!BD22*s!BG22+s!BE22*s!BF22)) -> 10.121126285917804 | BE23: =AN23+IF(s!BB22*s!BE22+s!BC22*s!BD22=0,0,E23*s!BB22*s!BE22/(s!BB22*s!BE22+s!BC22*s!BD22))+IF(s!BC22*s!BI22+s!BE22*s!BG22=0,0,O23*s!BE22*s!BG22/(s!BC22*s!BI22+s!BE22*s!BG22))+IF(s!BD22*s!BI22+s!BE22*s!BH22=0,0,Q23*s!BE22*s!BH22/(s!BD22*s!BI22+s!BE22*s!BH22))+IF(s!BB22*s!BI22+s!BC22*s!BH22+s!BD22*s!BG22+s!BE22*s!BF22=0,0,N23*s!BE22*s!BF22/(s!BB22*s!BI22+s!BC22*s!BH22+s!BD22*s!BG22+s!BE22*s!BF22)) -> 16.724515432066454 | BF23: =AO23+IF(s!BB22*s!BG22+s!BC22*s!BF22=0,0,K23*s!BC22*s!BF22/(s!BB22*s!BG22+s!BC22*s!BF22))+IF(s!BD22*s!BF22+s!BB22*s!BH22=0,0,M23*s!BD22*s!BF22/(s!BD22*s!BF22+s!BB22*s!BH22))+IF(s!BF22*s!BI22+s!BG22*s!BH22=0,0,W23*s!BF22*s!BI22/(s!BF22*s!BI22+s!BG22*s!BH22))+IF(s!BB22*s!BI22+s!BC22*s!BH22+s!BD22*s!BG22+s!BE22*s!BF22=0,0,N23*s!BE22*s!BF22/(s!BB22*s!BI22+s!BC22*s!BH22+s!BD22*s!BG22+s!BE22*s!BF22)) -> 10.143331275677903 | BG23: =AP23+IF(s!BB22*s!BG22+s!BC22*s!BF22=0,0,K23*s!BB22*s!BG22/(s!BB22*s!BG22+s!BC22*s!BF22))+IF(s!BC22*s!BI22+s!BE22*s!BG22=0,0,O23*s!BE22*s!BG22/(s!BC22*s!BI22+s!BE22*s!BG22))+IF(s!BF22*s!BI22+s!BG22*s!BH22=0,0,W23*s!BG22*s!BH22/(s!BF22*s!BI22+s!BG22*s!BH22))+IF(s!BB22*s!BI22+s!BC22*s!BH22+s!BD22*s!BG22+s!BE22*s!BF22=0,0,N23*s!BD22*s!BG22/(s!BB22*s!BI22+s!BC22*s!BH22+s!BD22*s!BG22+s!BE22*s!BF22)) -> 15.702310442306354 | BH23: =AQ23+IF(s!BB22*s!BH22+s!BD22*s!BF22=0,0,M23*s!BB22*s!BH22/(s!BB22*s!BH22+s!BD22*s!BF22))+IF(s!BD22*s!BI22+s!BE22*s!BH22=0,0,Q23*s!BE22*s!BH22/(s!BD22*s!BI22+s!BE22*s!BH22))+IF(s!BF22*s!BI22+s!BG22*s!BH22=0,0,W23*s!BG22*s!BH22/(s!BF22*s!BI22+s!BG22*s!BH22))+IF(s!BB22*s!BI22+s!BC22*s!BH22+s!BD22*s!BG22+s!BE22*s!BF22=0,0,N23*s!BC22*s!BH22/(s!BB22*s!BI22+s!BC22*s!BH22+s!BD22*s!BG22+s!BE22*s!BF22)) -> 17.968557443161245 | BI23: =AR23+IF(s!BC22*s!BI22+s!BE22*s!BG22=0,0,O23*s!BC22*s!BI22/(s!BC22*s!BI22+s!BE22*s!BG22))+IF(s!BD22*s!BI22+s!BE22*s!BH22=0,0,Q23*s!BD22*s!BI22/(s!BD22*s!BI22+s!BE22*s!BH22))+IF(s!BF22*s!BI22+s!BG22*s!BH22=0,0,W23*s!BF22*s!BI22/(s!BF22*s!BI22+s!BG22*s!BH22))+IF(s!BB22*s!BI22+s!BC22*s!BH22+s!BD22*s!BG22+s!BE22*s!BF22=0,0,N23*s!BB22*s!BI22/(s!BB22*s!BI22+s!BC22*s!BH22+s!BD22*s!BG22+s!BE22*s!BF22)) -> 20.185800838854497 | BJ23: =SUM(BB23:BI23) -> 326
A24: =A23 -> 100 | B24: =B23 -> 1 | C24: =C23 -> 1 | D24: =D23 -> 2 | E24: =E23 -> 5 | F24: =F23 -> 2 | G24: =G23 -> 1 | H24: =H23 -> 2 | I24: =I23 -> 1 | J24: =J23 -> 2 | K24: =K23 -> 4 | L24: =L23 -> 2 | M24: =M23 -> 4 | N24: =N23 -> 8 | O24: =O23 -> 4 | P24: =P23 -> 2 | Q24: =Q23 -> 4 | R24: =R23 -> 2 | S24: =S23 -> 1 | T24: =T23 -> 2 | U24: =U23 -> 1 | V24: =V23 -> 2 | W24: =W23 -> 4 | X24: =X23 -> 2 | Y24: =Y23 -> 1 | Z24: =Z23 -> 2 | AA24: =AA23 -> 1 | AB24: =AB23 -> 163 | AK24: =AK23 -> 205 | AL24: =AL23 -> 7 | AM24: =AM23 -> 8 | AN24: =AN23 -> 8 | AO24: =AO23 -> 8 | AP24: =AP23 -> 8 | AQ24: =AQ23 -> 8 | AR24: =AR23 -> 8 | AS24: =AS23 -> 260 | BB24: =AK24+IF(s!BB23*s!BE23+s!BC23*s!BD23=0,0,E24*s!BB23*s!BE23/(s!BB23*s!BE23+s!BC23*s!BD23)+IF(s!BB23*s!BG23+s!BC23*s!BF23=0,0,K24*s!BB23*s!BG23/(s!BB23*s!BG23+s!BC23*s!BF23))+IF(s!BB23*s!BH23+s!BD23*s!BF23=0,0,M24*s!BB23*s!BH23/(s!BB23*s!BH23+s!BD23*s!BF23))+IF(s!BB23*s!BI23+s!BC23*s!BH23+s!BD23*s!BG23+s!BE23*s!BF23=0,0,N24*s!BB23*s!BI23/(s!BB23*s!BI23+s!BC23*s!BH23+s!BD23*s!BG23+s!BE23*s!BF23)
)) -> 223.76687445502355 | BC24: =AL24+IF(s!BC23*s!BD23+s!BB23*s!BE23=0,0,E24*s!BC23*s!BD23/(s!BC23*s!BD23+s!BB23*s!BE23))+IF(s!BB23*s!BG23+s!BC23*s!BF23=0,0,K24*s!BC23*s!BF23/(s!BB23*s!BG23+s!BC23*s!BF23))+IF(s!BC23*s!BI23+s!BE23*s!BG23=0,0,O24*s!BC23*s!BI23/(s!BC23*s!BI23+s!BE23*s!BG23))+IF(s!BB23*s!BI23+s!BC23*s!BH23+s!BD23*s!BG23+s!BE23*s!BF23=0,0,N24*s!BC23*s!BH23/(s!BB23*s!BI23+s!BC23*s!BH23+s!BD23*s!BG23+s!BE23*s!BF23)) -> 11.387199215875551 | BD24: =AM24+IF(s!BC23*s!BD23+s!BB23*s!BE23=0,0,E24*s!BC23*s!BD23/(s!BC23*s!BD23+s!BB23*s!BE23))+IF(s!BD23*s!BF23+s!BB23*s!BH23=0,0,M24*s!BD23*s!BF23/(s!BD23*s!BF23+s!BB23*s!BH23))+IF(s!BD23*s!BI23+s!BE23*s!BH23=0,0,Q24*s!BD23*s!BI23/(s!BD23*s!BI23+s!BE23*s!BH23))+IF(s!BB23*s!BI23+s!BC23*s!BH23+s!BD23*s!BG23+s!BE23*s!BF23=0,0,N24*s!BD23*s!BG23/(s!BB23*s!BI23+s!BC23*s!BH23+s!BD23*s!BG23+s!BE23*s!BF23)) -> 10.120732532026141 | BE24: =AN24+IF(s!BB23*s!BE23+s!BC23*s!BD23=0,0,E24*s!BB23*s!BE23/(s!BB23*s!BE23+s!BC23*s!BD23))+IF(s!BC23*s!BI23+s!BE23*s!BG23=0,0,O24*s!BE23*s!BG23/(s!BC23*s!BI23+s!BE23*s!BG23))+IF(s!BD23*s!BI23+s!BE23*s!BH23=0,0,Q24*s!BE23*s!BH23/(s!BD23*s!BI23+s!BE23*s!BH23))+IF(s!BB23*s!BI23+s!BC23*s!BH23+s!BD23*s!BG23+s!BE23*s!BF23=0,0,N24*s!BE23*s!BF23/(s!BB23*s!BI23+s!BC23*s!BH23+s!BD23*s!BG23+s!BE23*s!BF23)) -> 16.725193797074752 | BF24: =AO24+IF(s!BB23*s!BG23+s!BC23*s!BF23=0,0,K24*s!BC23*s!BF23/(s!BB23*s!BG23+s!BC23*s!BF23))+IF(s!BD23*s!BF23+s!BB23*s!BH23=0,0,M24*s!BD23*s!BF23/(s!BD23*s!BF23+s!BB23*s!BH23))+IF(s!BF23*s!BI23+s!BG23*s!BH23=0,0,W24*s!BF23*s!BI23/(s!BF23*s!BI23+s!BG23*s!BH23))+IF(s!BB23*s!BI23+s!BC23*s!BH23+s!BD23*s!BG23+s!BE23*s!BF23=0,0,N24*s!BE23*s!BF23/(s!BB23*s!BI23+s!BC23*s!BH23+s!BD23*s!BG23+s!BE23*s!BF23)) -> 10.142942421786856 | BG24: =AP24+IF(s!BB23*s!BG23+s!BC23*s!BF23=0,0,K24*s!BB23*s!BG23/(s!BB23*s!BG23+s!BC23*s!BF23))+IF(s!BC23*s!BI23+s!BE23*s!BG23=0,0,O24*s!BE23*s!BG23/(s!BC23*s!BI23+s!BE23*s!BG23))+IF(s!BF23*s!BI23+s!BG23*s!BH23=0,0,W24*s!BG23*s!BH23/(s!BF23*s!BI23+s!BG23*s!BH23))+IF(s!BB23*s!BI23+s!BC23*s!BH23+s!BD23*s!BG23+s!BE23*s!BF23=0,0,N24*s!BD23*s!BG23/(s!BB23*s!BI23+s!BC23*s!BH23+s!BD23*s!BG23+s!BE23*s!BF23)) -> 15.702983907314035 | BH24: =AQ24+IF(s!BB23*s!BH23+s!BD23*s!BF23=0,0,M24*s!BB23*s!BH23/(s!BB23*s!BH23+s!BD23*s!BF23))+IF(s!BD23*s!BI23+s!BE23*s!BH23=0,0,Q24*s!BE23*s!BH23/(s!BD23*s!BI23+s!BE23*s!BH23))+IF(s!BF23*s!BI23+s!BG23*s!BH23=0,0,W24*s!BG23*s!BH23/(s!BF23*s!BI23+s!BG23*s!BH23))+IF(s!BB23*s!BI23+s!BC23*s!BH23+s!BD23*s!BG23+s!BE23*s!BF23=0,0,N24*s!BC23*s!BH23/(s!BB23*s!BI23+s!BC23*s!BH23+s!BD23*s!BG23+s!BE23*s!BF23)) -> 17.969450591163447 | BI24: =AR24+IF(s!BC23*s!BI23+s!BE23*s!BG23=0,0,O24*s!BC23*s!BI23/(s!BC23*s!BI23+s!BE23*s!BG23))+IF(s!BD23*s!BI23+s!BE23*s!BH23=0,0,Q24*s!BD23*s!BI23/(s!BD23*s!BI23+s!BE23*s!BH23))+IF(s!BF23*s!BI23+s!BG23*s!BH23=0,0,W24*s!BF23*s!BI23/(s!BF23*s!BI23+s!BG23*s!BH23))+IF(s!BB23*s!BI23+s!BC23*s!BH23+s!BD23*s!BG23+s!BE23*s!BF23=0,0,N24*s!BB23*s!BI23/(s!BB23*s!BI23+s!BC23*s!BH23+s!BD23*s!BG23+s!BE23*s!BF23)) -> 20.184623079735662 | BJ24: =SUM(BB24:BI24) -> 326
A25: =A24 -> 100 | B25: =B24 -> 1 | C25: =C24 -> 1 | D25: =D24 -> 2 | E25: =E24 -> 5 | F25: =F24 -> 2 | G25: =G24 -> 1 | H25: =H24 -> 2 | I25: =I24 -> 1 | J25: =J24 -> 2 | K25: =K24 -> 4 | L25: =L24 -> 2 | M25: =M24 -> 4 | N25: =N24 -> 8 | O25: =O24 -> 4 | P25: =P24 -> 2 | Q25: =Q24 -> 4 | R25: =R24 -> 2 | S25: =S24 -> 1 | T25: =T24 -> 2 | U25: =U24 -> 1 | V25: =V24 -> 2 | W25: =W24 -> 4 | X25: =X24 -> 2 | Y25: =Y24 -> 1 | Z25: =Z24 -> 2 | AA25: =AA24 -> 1 | AB25: =AB24 -> 163 | AK25: =AK24 -> 205 | AL25: =AL24 -> 7 | AM25: =AM24 -> 8 | AN25: =AN24 -> 8 | AO25: =AO24 -> 8 | AP25: =AP24 -> 8 | AQ25: =AQ24 -> 8 | AR25: =AR24 -> 8 | AS25: =AS24 -> 260 | BB25: =AK25+IF(s!BB24*s!BE24+s!BC24*s!BD24=0,0,E25*s!BB24*s!BE24/(s!BB24*s!BE24+s!BC24*s!BD24)+IF(s!BB24*s!BG24+s!BC24*s!BF24=0,0,K25*s!BB24*s!BG24/(s!BB24*s!BG24+s!BC24*s!BF24))+IF(s!BB24*s!BH24+s!BD24*s!BF24=0,0,M25*s!BB24*s!BH24/(s!BB24*s!BH24+s!BD24*s!BF24))+IF(s!BB24*s!BI24+s!BC24*s!BH24+s!BD24*s!BG24+s!BE24*s!BF24=0,0,N25*s!BB24*s!BI24/(s!BB24*s!BI24+s!BC24*s!BH24+s!BD24*s!BG24+s!BE24*s!BF24)
)) -> 223.76679400516895 | BC25: =AL25+IF(s!BC24*s!BD24+s!BB24*s!BE24=0,0,E25*s!BC24*s!BD24/(s!BC24*s!BD24+s!BB24*s!BE24))+IF(s!BB24*s!BG24+s!BC24*s!BF24=0,0,K25*s!BC24*s!BF24/(s!BB24*s!BG24+s!BC24*s!BF24))+IF(s!BC24*s!BI24+s!BE24*s!BG24=0,0,O25*s!BC24*s!BI24/(s!BC24*s!BI24+s!BE24*s!BG24))+IF(s!BB24*s!BI24+s!BC24*s!BH24+s!BD24*s!BG24+s!BE24*s!BF24=0,0,N25*s!BC24*s!BH24/(s!BB24*s!BI24+s!BC24*s!BH24+s!BD24*s!BG24+s!BE24*s!BF24)) -> 11.387075319925646 | BD25: =AM25+IF(s!BC24*s!BD24+s!BB24*s!BE24=0,0,E25*s!BC24*s!BD24/(s!BC24*s!BD24+s!BB24*s!BE24))+IF(s!BD24*s!BF24+s!BB24*s!BH24=0,0,M25*s!BD24*s!BF24/(s!BD24*s!BF24+s!BB24*s!BH24))+IF(s!BD24*s!BI24+s!BE24*s!BH24=0,0,Q25*s!BD24*s!BI24/(s!BD24*s!BI24+s!BE24*s!BH24))+IF(s!BB24*s!BI24+s!BC24*s!BH24+s!BD24*s!BG24+s!BE24*s!BF24=0,0,N25*s!BD24*s!BG24/(s!BB24*s!BI24+s!BC24*s!BH24+s!BD24*s!BG24+s!BE24*s!BF24)) -> 10.120450662301856 | BE25: =AN25+IF(s!BB24*s!BE24+s!BC24*s!BD24=0,0,E25*s!BB24*s!BE24/(s!BB24*s!BE24+s!BC24*s!BD24))+IF(s!BC24*s!BI24+s!BE24*s!BG24=0,0,O25*s!BE24*s!BG24/(s!BC24*s!BI24+s!BE24*s!BG24))+IF(s!BD24*s!BI24+s!BE24*s!BH24=0,0,Q25*s!BE24*s!BH24/(s!BD24*s!BI24+s!BE24*s!BH24))+IF(s!BB24*s!BI24+s!BC24*s!BH24+s!BD24*s!BG24+s!BE24*s!BF24=0,0,N25*s!BE24*s!BF24/(s!BB24*s!BI24+s!BC24*s!BH24+s!BD24*s!BG24+s!BE24*s!BF24)) -> 16.72568001260354 | BF25: =AO25+IF(s!BB24*s!BG24+s!BC24*s!BF24=0,0,K25*s!BC24*s!BF24/(s!BB24*s!BG24+s!BC24*s!BF24))+IF(s!BD24*s!BF24+s!BB24*s!BH24=0,0,M25*s!BD24*s!BF24/(s!BD24*s!BF24+s!BB24*s!BH24))+IF(s!BF24*s!BI24+s!BG24*s!BH24=0,0,W25*s!BF24*s!BI24/(s!BF24*s!BI24+s!BG24*s!BH24))+IF(s!BB24*s!BI24+s!BC24*s!BH24+s!BD24*s!BG24+s!BE24*s!BF24=0,0,N25*s!BE24*s!BF24/(s!BB24*s!BI24+s!BC24*s!BH24+s!BD24*s!BG24+s!BE24*s!BF24)) -> 10.142663772854826 | BG25: =AP25+IF(s!BB24*s!BG24+s!BC24*s!BF24=0,0,K25*s!BB24*s!BG24/(s!BB24*s!BG24+s!BC24*s!BF24))+IF(s!BC24*s!BI24+s!BE24*s!BG24=0,0,O25*s!BE24*s!BG24/(s!BC24*s!BI24+s!BE24*s!BG24))+IF(s!BF24*s!BI24+s!BG24*s!BH24=0,0,W25*s!BG24*s!BH24/(s!BF24*s!BI24+s!BG24*s!BH24))+IF(s!BB24*s!BI24+s!BC24*s!BH24+s!BD24*s!BG24+s!BE24*s!BF24=0,0,N25*s!BD24*s!BG24/(s!BB24*s!BI24+s!BC24*s!BH24+s!BD24*s!BG24+s!BE24*s!BF24)) -> 15.703466902050566 | BH25: =AQ25+IF(s!BB24*s!BH24+s!BD24*s!BF24=0,0,M25*s!BB24*s!BH24/(s!BB24*s!BH24+s!BD24*s!BF24))+IF(s!BD24*s!BI24+s!BE24*s!BH24=0,0,Q25*s!BE24*s!BH24/(s!BD24*s!BI24+s!BE24*s!BH24))+IF(s!BF24*s!BI24+s!BG24*s!BH24=0,0,W25*s!BG24*s!BH24/(s!BF24*s!BI24+s!BG24*s!BH24))+IF(s!BB24*s!BI24+s!BC24*s!BH24+s!BD24*s!BG24+s!BE24*s!BF24=0,0,N25*s!BC24*s!BH24/(s!BB24*s!BI24+s!BC24*s!BH24+s!BD24*s!BG24+s!BE24*s!BF24)) -> 17.970091559674355 | BI25: =AR25+IF(s!BC24*s!BI24+s!BE24*s!BG24=0,0,O25*s!BC24*s!BI24/(s!BC24*s!BI24+s!BE24*s!BG24))+IF(s!BD24*s!BI24+s!BE24*s!BH24=0,0,Q25*s!BD24*s!BI24/(s!BD24*s!BI24+s!BE24*s!BH24))+IF(s!BF24*s!BI24+s!BG24*s!BH24=0,0,W25*s!BF24*s!BI24/(s!BF24*s!BI24+s!BG24*s!BH24))+IF(s!BB24*s!BI24+s!BC24*s!BH24+s!BD24*s!BG24+s!BE24*s!BF24=0,0,N25*s!BB24*s!BI24/(s!BB24*s!BI24+s!BC24*s!BH24+s!BD24*s!BG24+s!BE24*s!BF24)) -> 20.183777765420253 | BJ25: =SUM(BB25:BI25) -> 326
A26: =A25 -> 100 | B26: =B25 -> 1 | C26: =C25 -> 1 | D26: =D25 -> 2 | E26: =E25 -> 5 | F26: =F25 -> 2 | G26: =G25 -> 1 | H26: =H25 -> 2 | I26: =I25 -> 1 | J26: =J25 -> 2 | K26: =K25 -> 4 | L26: =L25 -> 2 | M26: =M25 -> 4 | N26: =N25 -> 8 | O26: =O25 -> 4 | P26: =P25 -> 2 | Q26: =Q25 -> 4 | R26: =R25 -> 2 | S26: =S25 -> 1 | T26: =T25 -> 2 | U26: =U25 -> 1 | V26: =V25 -> 2 | W26: =W25 -> 4 | X26: =X25 -> 2 | Y26: =Y25 -> 1 | Z26: =Z25 -> 2 | AA26: =AA25 -> 1 | AB26: =AB25 -> 163 | AK26: =AK25 -> 205 | AL26: =AL25 -> 7 | AM26: =AM25 -> 8 | AN26: =AN25 -> 8 | AO26: =AO25 -> 8 | AP26: =AP25 -> 8 | AQ26: =AQ25 -> 8 | AR26: =AR25 -> 8 | AS26: =AS25 -> 260 | BB26: =AK26+IF(s!BB25*s!BE25+s!BC25*s!BD25=0,0,E26*s!BB25*s!BE25/(s!BB25*s!BE25+s!BC25*s!BD25)+IF(s!BB25*s!BG25+s!BC25*s!BF25=0,0,K26*s!BB25*s!BG25/(s!BB25*s!BG25+s!BC25*s!BF25))+IF(s!BB25*s!BH25+s!BD25*s!BF25=0,0,M26*s!BB25*s!BH25/(s!BB25*s!BH25+s!BD25*s!BF25))+IF(s!BB25*s!BI25+s!BC25*s!BH25+s!BD25*s!BG25+s!BE25*s!BF25=0,0,N26*s!BB25*s!BI25/(s!BB25*s!BI25+s!BC25*s!BH25+s!BD25*s!BG25+s!BE25*s!BF25)
)) -> 223.7667356376592 | BC26: =AL26+IF(s!BC25*s!BD25+s!BB25*s!BE25=0,0,E26*s!BC25*s!BD25/(s!BC25*s!BD25+s!BB25*s!BE25))+IF(s!BB25*s!BG25+s!BC25*s!BF25=0,0,K26*s!BC25*s!BF25/(s!BB25*s!BG25+s!BC25*s!BF25))+IF(s!BC25*s!BI25+s!BE25*s!BG25=0,0,O26*s!BC25*s!BI25/(s!BC25*s!BI25+s!BE25*s!BG25))+IF(s!BB25*s!BI25+s!BC25*s!BH25+s!BD25*s!BG25+s!BE25*s!BF25=0,0,N26*s!BC25*s!BH25/(s!BB25*s!BI25+s!BC25*s!BH25+s!BD25*s!BG25+s!BE25*s!BF25)) -> 11.386987074450444 | BD26: =AM26+IF(s!BC25*s!BD25+s!BB25*s!BE25=0,0,E26*s!BC25*s!BD25/(s!BC25*s!BD25+s!BB25*s!BE25))+IF(s!BD25*s!BF25+s!BB25*s!BH25=0,0,M26*s!BD25*s!BF25/(s!BD25*s!BF25+s!BB25*s!BH25))+IF(s!BD25*s!BI25+s!BE25*s!BH25=0,0,Q26*s!BD25*s!BI25/(s!BD25*s!BI25+s!BE25*s!BH25))+IF(s!BB25*s!BI25+s!BC25*s!BH25+s!BD25*s!BG25+s!BE25*s!BF25=0,0,N26*s!BD25*s!BG25/(s!BB25*s!BI25+s!BC25*s!BH25+s!BD25*s!BG25+s!BE25*s!BF25)) -> 10.120248870535503 | BE26: =AN26+IF(s!BB25*s!BE25+s!BC25*s!BD25=0,0,E26*s!BB25*s!BE25/(s!BB25*s!BE25+s!BC25*s!BD25))+IF(s!BC25*s!BI25+s!BE25*s!BG25=0,0,O26*s!BE25*s!BG25/(s!BC25*s!BI25+s!BE25*s!BG25))+IF(s!BD25*s!BI25+s!BE25*s!BH25=0,0,Q26*s!BE25*s!BH25/(s!BD25*s!BI25+s!BE25*s!BH25))+IF(s!BB25*s!BI25+s!BC25*s!BH25+s!BD25*s!BG25+s!BE25*s!BF25=0,0,N26*s!BE25*s!BF25/(s!BB25*s!BI25+s!BC25*s!BH25+s!BD25*s!BG25+s!BE25*s!BF25)) -> 16.726028417354858 | BF26: =AO26+IF(s!BB25*s!BG25+s!BC25*s!BF25=0,0,K26*s!BC25*s!BF25/(s!BB25*s!BG25+s!BC25*s!BF25))+IF(s!BD25*s!BF25+s!BB25*s!BH25=0,0,M26*s!BD25*s!BF25/(s!BD25*s!BF25+s!BB25*s!BH25))+IF(s!BF25*s!BI25+s!BG25*s!BH25=0,0,W26*s!BF25*s!BI25/(s!BF25*s!BI25+s!BG25*s!BH25))+IF(s!BB25*s!BI25+s!BC25*s!BH25+s!BD25*s!BG25+s!BE25*s!BF25=0,0,N26*s!BE25*s!BF25/(s!BB25*s!BI25+s!BC25*s!BH25+s!BD25*s!BG25+s!BE25*s!BF25)) -> 10.142464106091655 | BG26: =AP26+IF(s!BB25*s!BG25+s!BC25*s!BF25=0,0,K26*s!BB25*s!BG25/(s!BB25*s!BG25+s!BC25*s!BF25))+IF(s!BC25*s!BI25+s!BE25*s!BG25=0,0,O26*s!BE25*s!BG25/(s!BC25*s!BI25+s!BE25*s!BG25))+IF(s!BF25*s!BI25+s!BG25*s!BH25=0,0,W26*s!BG25*s!BH25/(s!BF25*s!BI25+s!BG25*s!BH25))+IF(s!BB25*s!BI25+s!BC25*s!BH25+s!BD25*s!BG25+s!BE25*s!BF25=0,0,N26*s!BD25*s!BG25/(s!BB25*s!BI25+s!BC25*s!BH25+s!BD25*s!BG25+s!BE25*s!BF25)) -> 15.703813181798706 | BH26: =AQ26+IF(s!BB25*s!BH25+s!BD25*s!BF25=0,0,M26*s!BB25*s!BH25/(s!BB25*s!BH25+s!BD25*s!BF25))+IF(s!BD25*s!BI25+s!BE25*s!BH25=0,0,Q26*s!BE25*s!BH25/(s!BD25*s!BI25+s!BE25*s!BH25))+IF(s!BF25*s!BI25+s!BG25*s!BH25=0,0,W26*s!BG25*s!BH25/(s!BF25*s!BI25+s!BG25*s!BH25))+IF(s!BB25*s!BI25+s!BC25*s!BH25+s!BD25*s!BG25+s!BE25*s!BF25=0,0,N26*s!BC25*s!BH25/(s!BB25*s!BI25+s!BC25*s!BH25+s!BD25*s!BG25+s!BE25*s!BF25)) -> 17.970551385713648 | BI26: =AR26+IF(s!BC25*s!BI25+s!BE25*s!BG25=0,0,O26*s!BC25*s!BI25/(s!BC25*s!BI25+s!BE25*s!BG25))+IF(s!BD25*s!BI25+s!BE25*s!BH25=0,0,Q26*s!BD25*s!BI25/(s!BD25*s!BI25+s!BE25*s!BH25))+IF(s!BF25*s!BI25+s!BG25*s!BH25=0,0,W26*s!BF25*s!BI25/(s!BF25*s!BI25+s!BG25*s!BH25))+IF(s!BB25*s!BI25+s!BC25*s!BH25+s!BD25*s!BG25+s!BE25*s!BF25=0,0,N26*s!BB25*s!BI25/(s!BB25*s!BI25+s!BC25*s!BH25+s!BD25*s!BG25+s!BE25*s!BF25)) -> 20.183171326395993 | BJ26: =SUM(BB26:BI26) -> 326
A27: =A26 -> 100 | B27: =B26 -> 1 | C27: =C26 -> 1 | D27: =D26 -> 2 | E27: =E26 -> 5 | F27: =F26 -> 2 | G27: =G26 -> 1 | H27: =H26 -> 2 | I27: =I26 -> 1 | J27: =J26 -> 2 | K27: =K26 -> 4 | L27: =L26 -> 2 | M27: =M26 -> 4 | N27: =N26 -> 8 | O27: =O26 -> 4 | P27: =P26 -> 2 | Q27: =Q26 -> 4 | R27: =R26 -> 2 | S27: =S26 -> 1 | T27: =T26 -> 2 | U27: =U26 -> 1 | V27: =V26 -> 2 | W27: =W26 -> 4 | X27: =X26 -> 2 | Y27: =Y26 -> 1 | Z27: =Z26 -> 2 | AA27: =AA26 -> 1 | AB27: =AB26 -> 163 | AK27: =AK26 -> 205 | AL27: =AL26 -> 7 | AM27: =AM26 -> 8 | AN27: =AN26 -> 8 | AO27: =AO26 -> 8 | AP27: =AP26 -> 8 | AQ27: =AQ26 -> 8 | AR27: =AR26 -> 8 | AS27: =AS26 -> 260 | BB27: =AK27+IF(s!BB26*s!BE26+s!BC26*s!BD26=0,0,E27*s!BB26*s!BE26/(s!BB26*s!BE26+s!BC26*s!BD26)+IF(s!BB26*s!BG26+s!BC26*s!BF26=0,0,K27*s!BB26*s!BG26/(s!BB26*s!BG26+s!BC26*s!BF26))+IF(s!BB26*s!BH26+s!BD26*s!BF26=0,0,M27*s!BB26*s!BH26/(s!BB26*s!BH26+s!BD26*s!BF26))+IF(s!BB26*s!BI26+s!BC26*s!BH26+s!BD26*s!BG26+s!BE26*s!BF26=0,0,N27*s!BB26*s!BI26/(s!BB26*s!BI26+s!BC26*s!BH26+s!BD26*s!BG26+s!BE26*s!BF26)
)) -> 223.76669339701544 | BC27: =AL27+IF(s!BC26*s!BD26+s!BB26*s!BE26=0,0,E27*s!BC26*s!BD26/(s!BC26*s!BD26+s!BB26*s!BE26))+IF(s!BB26*s!BG26+s!BC26*s!BF26=0,0,K27*s!BC26*s!BF26/(s!BB26*s!BG26+s!BC26*s!BF26))+IF(s!BC26*s!BI26+s!BE26*s!BG26=0,0,O27*s!BC26*s!BI26/(s!BC26*s!BI26+s!BE26*s!BG26))+IF(s!BB26*s!BI26+s!BC26*s!BH26+s!BD26*s!BG26+s!BE26*s!BF26=0,0,N27*s!BC26*s!BH26/(s!BB26*s!BI26+s!BC26*s!BH26+s!BD26*s!BG26+s!BE26*s!BF26)) -> 11.386924182601554 | BD27: =AM27+IF(s!BC26*s!BD26+s!BB26*s!BE26=0,0,E27*s!BC26*s!BD26/(s!BC26*s!BD26+s!BB26*s!BE26))+IF(s!BD26*s!BF26+s!BB26*s!BH26=0,0,M27*s!BD26*s!BF26/(s!BD26*s!BF26+s!BB26*s!BH26))+IF(s!BD26*s!BI26+s!BE26*s!BH26=0,0,Q27*s!BD26*s!BI26/(s!BD26*s!BI26+s!BE26*s!BH26))+IF(s!BB26*s!BI26+s!BC26*s!BH26+s!BD26*s!BG26+s!BE26*s!BF26=0,0,N27*s!BD26*s!BG26/(s!BB26*s!BI26+s!BC26*s!BH26+s!BD26*s!BG26+s!BE26*s!BF26)) -> 10.1201044009655 | BE27: =AN27+IF(s!BB26*s!BE26+s!BC26*s!BD26=0,0,E27*s!BB26*s!BE26/(s!BB26*s!BE26+s!BC26*s!BD26))+IF(s!BC26*s!BI26+s!BE26*s!BG26=0,0,O27*s!BE26*s!BG26/(s!BC26*s!BI26+s!BE26*s!BG26))+IF(s!BD26*s!BI26+s!BE26*s!BH26=0,0,Q27*s!BE26*s!BH26/(s!BD26*s!BI26+s!BE26*s!BH26))+IF(s!BB26*s!BI26+s!BC26*s!BH26+s!BD26*s!BG26+s!BE26*s!BF26=0,0,N27*s!BE26*s!BF26/(s!BB26*s!BI26+s!BC26*s!BH26+s!BD26*s!BG26+s!BE26*s!BF26)) -> 16.726278019417496 | BF27: =AO27+IF(s!BB26*s!BG26+s!BC26*s!BF26=0,0,K27*s!BC26*s!BF26/(s!BB26*s!BG26+s!BC26*s!BF26))+IF(s!BD26*s!BF26+s!BB26*s!BH26=0,0,M27*s!BD26*s!BF26/(s!BD26*s!BF26+s!BB26*s!BH26))+IF(s!BF26*s!BI26+s!BG26*s!BH26=0,0,W27*s!BF26*s!BI26/(s!BF26*s!BI26+s!BG26*s!BH26))+IF(s!BB26*s!BI26+s!BC26*s!BH26+s!BD26*s!BG26+s!BE26*s!BF26=0,0,N27*s!BE26*s!BF26/(s!BB26*s!BI26+s!BC26*s!BH26+s!BD26*s!BG26+s!BE26*s!BF26)) -> 10.142321044756329 | BG27: =AP27+IF(s!BB26*s!BG26+s!BC26*s!BF26=0,0,K27*s!BB26*s!BG26/(s!BB26*s!BG26+s!BC26*s!BF26))+IF(s!BC26*s!BI26+s!BE26*s!BG26=0,0,O27*s!BE26*s!BG26/(s!BC26*s!BI26+s!BE26*s!BG26))+IF(s!BF26*s!BI26+s!BG26*s!BH26=0,0,W27*s!BG26*s!BH26/(s!BF26*s!BI26+s!BG26*s!BH26))+IF(s!BB26*s!BI26+s!BC26*s!BH26+s!BD26*s!BG26+s!BE26*s!BF26=0,0,N27*s!BD26*s!BG26/(s!BB26*s!BI26+s!BC26*s!BH26+s!BD26*s!BG26+s!BE26*s!BF26)) -> 15.704061375626667 | BH27: =AQ27+IF(s!BB26*s!BH26+s!BD26*s!BF26=0,0,M27*s!BB26*s!BH26/(s!BB26*s!BH26+s!BD26*s!BF26))+IF(s!BD26*s!BI26+s!BE26*s!BH26=0,0,Q27*s!BE26*s!BH26/(s!BD26*s!BI26+s!BE26*s!BH26))+IF(s!BF26*s!BI26+s!BG26*s!BH26=0,0,W27*s!BG26*s!BH26/(s!BF26*s!BI26+s!BG26*s!BH26))+IF(s!BB26*s!BI26+s!BC26*s!BH26+s!BD26*s!BG26+s!BE26*s!BF26=0,0,N27*s!BC26*s!BH26/(s!BB26*s!BI26+s!BC26*s!BH26+s!BD26*s!BG26+s!BE26*s!BF26)) -> 17.970881157262724 | BI27: =AR27+IF(s!BC26*s!BI26+s!BE26*s!BG26=0,0,O27*s!BC26*s!BI26/(s!BC26*s!BI26+s!BE26*s!BG26))+IF(s!BD26*s!BI26+s!BE26*s!BH26=0,0,Q27*s!BD26*s!BI26/(s!BD26*s!BI26+s!BE26*s!BH26))+IF(s!BF26*s!BI26+s!BG26*s!BH26=0,0,W27*s!BF26*s!BI26/(s!BF26*s!BI26+s!BG26*s!BH26))+IF(s!BB26*s!BI26+s!BC26*s!BH26+s!BD26*s!BG26+s!BE26*s!BF26=0,0,N27*s!BB26*s!BI26/(s!BB26*s!BI26+s!BC26*s!BH26+s!BD26*s!BG26+s!BE26*s!BF26)) -> 20.182736422354282 | BJ27: =SUM(BB27:BI27) -> 326
A28: =A27 -> 100 | B28: =B27 -> 1 | C28: =C27 -> 1 | D28: =D27 -> 2 | E28: =E27 -> 5 | F28: =F27 -> 2 | G28: =G27 -> 1 | H28: =H27 -> 2 | I28: =I27 -> 1 | J28: =J27 -> 2 | K28: =K27 -> 4 | L28: =L27 -> 2 | M28: =M27 -> 4 | N28: =N27 -> 8 | O28: =O27 -> 4 | P28: =P27 -> 2 | Q28: =Q27 -> 4 | R28: =R27 -> 2 | S28: =S27 -> 1 | T28: =T27 -> 2 | U28: =U27 -> 1 | V28: =V27 -> 2 | W28: =W27 -> 4 | X28: =X27 -> 2 | Y28: =Y27 -> 1 | Z28: =Z27 -> 2 | AA28: =AA27 -> 1 | AB28: =AB27 -> 163 | AK28: =AK27 -> 205 | AL28: =AL27 -> 7 | AM28: =AM27 -> 8 | AN28: =AN27 -> 8 | AO28: =AO27 -> 8 | AP28: =AP27 -> 8 | AQ28: =AQ27 -> 8 | AR28: =AR27 -> 8 | AS28: =AS27 -> 260 | BB28: =AK28+IF(s!BB27*s!BE27+s!BC27*s!BD27=0,0,E28*s!BB27*s!BE27/(s!BB27*s!BE27+s!BC27*s!BD27)+IF(s!BB27*s!BG27+s!BC27*s!BF27=0,0,K28*s!BB27*s!BG27/(s!BB27*s!BG27+s!BC27*s!BF27))+IF(s!BB27*s!BH27+s!BD27*s!BF27=0,0,M28*s!BB27*s!BH27/(s!BB27*s!BH27+s!BD27*s!BF27))+IF(s!BB27*s!BI27+s!BC27*s!BH27+s!BD27*s!BG27+s!BE27*s!BF27=0,0,N28*s!BB27*s!BI27/(s!BB27*s!BI27+s!BC27*s!BH27+s!BD27*s!BG27+s!BE27*s!BF27)
)) -> 223.76666288887952 | BC28: =AL28+IF(s!BC27*s!BD27+s!BB27*s!BE27=0,0,E28*s!BC27*s!BD27/(s!BC27*s!BD27+s!BB27*s!BE27))+IF(s!BB27*s!BG27+s!BC27*s!BF27=0,0,K28*s!BC27*s!BF27/(s!BB27*s!BG27+s!BC27*s!BF27))+IF(s!BC27*s!BI27+s!BE27*s!BG27=0,0,O28*s!BC27*s!BI27/(s!BC27*s!BI27+s!BE27*s!BG27))+IF(s!BB27*s!BI27+s!BC27*s!BH27+s!BD27*s!BG27+s!BE27*s!BF27=0,0,N28*s!BC27*s!BH27/(s!BB27*s!BI27+s!BC27*s!BH27+s!BD27*s!BG27+s!BE27*s!BF27)) -> 11.386879336134429 | BD28: =AM28+IF(s!BC27*s!BD27+s!BB27*s!BE27=0,0,E28*s!BC27*s!BD27/(s!BC27*s!BD27+s!BB27*s!BE27))+IF(s!BD27*s!BF27+s!BB27*s!BH27=0,0,M28*s!BD27*s!BF27/(s!BD27*s!BF27+s!BB27*s!BH27))+IF(s!BD27*s!BI27+s!BE27*s!BH27=0,0,Q28*s!BD27*s!BI27/(s!BD27*s!BI27+s!BE27*s!BH27))+IF(s!BB27*s!BI27+s!BC27*s!BH27+s!BD27*s!BG27+s!BE27*s!BF27=0,0,N28*s!BD27*s!BG27/(s!BB27*s!BI27+s!BC27*s!BH27+s!BD27*s!BG27+s!BE27*s!BF27)) -> 10.120000968546385 | BE28: =AN28+IF(s!BB27*s!BE27+s!BC27*s!BD27=0,0,E28*s!BB27*s!BE27/(s!BB27*s!BE27+s!BC27*s!BD27))+IF(s!BC27*s!BI27+s!BE27*s!BG27=0,0,O28*s!BE27*s!BG27/(s!BC27*s!BI27+s!BE27*s!BG27))+IF(s!BD27*s!BI27+s!BE27*s!BH27=0,0,Q28*s!BE27*s!BH27/(s!BD27*s!BI27+s!BE27*s!BH27))+IF(s!BB27*s!BI27+s!BC27*s!BH27+s!BD27*s!BG27+s!BE27*s!BF27=0,0,N28*s!BE27*s!BF27/(s!BB27*s!BI27+s!BC27*s!BH27+s!BD27*s!BG27+s!BE27*s!BF27)) -> 16.72645680643965 | BF28: =AO28+IF(s!BB27*s!BG27+s!BC27*s!BF27=0,0,K28*s!BC27*s!BF27/(s!BB27*s!BG27+s!BC27*s!BF27))+IF(s!BD27*s!BF27+s!BB27*s!BH27=0,0,M28*s!BD27*s!BF27/(s!BD27*s!BF27+s!BB27*s!BH27))+IF(s!BF27*s!BI27+s!BG27*s!BH27=0,0,W28*s!BF27*s!BI27/(s!BF27*s!BI27+s!BG27*s!BH27))+IF(s!BB27*s!BI27+s!BC27*s!BH27+s!BD27*s!BG27+s!BE27*s!BF27=0,0,N28*s!BE27*s!BF27/(s!BB27*s!BI27+s!BC27*s!BH27+s!BD27*s!BG27+s!BE27*s!BF27)) -> 10.142218550170659 | BG28: =AP28+IF(s!BB27*s!BG27+s!BC27*s!BF27=0,0,K28*s!BB27*s!BG27/(s!BB27*s!BG27+s!BC27*s!BF27))+IF(s!BC27*s!BI27+s!BE27*s!BG27=0,0,O28*s!BE27*s!BG27/(s!BC27*s!BI27+s!BE27*s!BG27))+IF(s!BF27*s!BI27+s!BG27*s!BH27=0,0,W28*s!BG27*s!BH27/(s!BF27*s!BI27+s!BG27*s!BH27))+IF(s!BB27*s!BI27+s!BC27*s!BH27+s!BD27*s!BG27+s!BE27*s!BF27=0,0,N28*s!BD27*s!BG27/(s!BB27*s!BI27+s!BC27*s!BH27+s!BD27*s!BG27+s!BE27*s!BF27)) -> 15.70423922481538 | BH28: =AQ28+IF(s!BB27*s!BH27+s!BD27*s!BF27=0,0,M28*s!BB27*s!BH27/(s!BB27*s!BH27+s!BD27*s!BF27))+IF(s!BD27*s!BI27+s!BE27*s!BH27=0,0,Q28*s!BE27*s!BH27/(s!BD27*s!BI27+s!BE27*s!BH27))+IF(s!BF27*s!BI27+s!BG27*s!BH27=0,0,W28*s!BG27*s!BH27/(s!BF27*s!BI27+s!BG27*s!BH27))+IF(s!BB27*s!BI27+s!BC27*s!BH27+s!BD27*s!BG27+s!BE27*s!BF27=0,0,N28*s!BC27*s!BH27/(s!BB27*s!BI27+s!BC27*s!BH27+s!BD27*s!BG27+s!BE27*s!BF27)) -> 17.971117592403424 | BI28: =AR28+IF(s!BC27*s!BI27+s!BE27*s!BG27=0,0,O28*s!BC27*s!BI27/(s!BC27*s!BI27+s!BE27*s!BG27))+IF(s!BD27*s!BI27+s!BE27*s!BH27=0,0,Q28*s!BD27*s!BI27/(s!BD27*s!BI27+s!BE27*s!BH27))+IF(s!BF27*s!BI27+s!BG27*s!BH27=0,0,W28*s!BF27*s!BI27/(s!BF27*s!BI27+s!BG27*s!BH27))+IF(s!BB27*s!BI27+s!BC27*s!BH27+s!BD27*s!BG27+s!BE27*s!BF27=0,0,N28*s!BB27*s!BI27/(s!BB27*s!BI27+s!BC27*s!BH27+s!BD27*s!BG27+s!BE27*s!BF27)) -> 20.182424632610537 | BJ28: =SUM(BB28:BI28) -> 326
A29: =A28 -> 100 | B29: =B28 -> 1 | C29: =C28 -> 1 | D29: =D28 -> 2 | E29: =E28 -> 5 | F29: =F28 -> 2 | G29: =G28 -> 1 | H29: =H28 -> 2 | I29: =I28 -> 1 | J29: =J28 -> 2 | K29: =K28 -> 4 | L29: =L28 -> 2 | M29: =M28 -> 4 | N29: =N28 -> 8 | O29: =O28 -> 4 | P29: =P28 -> 2 | Q29: =Q28 -> 4 | R29: =R28 -> 2 | S29: =S28 -> 1 | T29: =T28 -> 2 | U29: =U28 -> 1 | V29: =V28 -> 2 | W29: =W28 -> 4 | X29: =X28 -> 2 | Y29: =Y28 -> 1 | Z29: =Z28 -> 2 | AA29: =AA28 -> 1 | AB29: =AB28 -> 163 | AK29: =AK28 -> 205 | AL29: =AL28 -> 7 | AM29: =AM28 -> 8 | AN29: =AN28 -> 8 | AO29: =AO28 -> 8 | AP29: =AP28 -> 8 | AQ29: =AQ28 -> 8 | AR29: =AR28 -> 8 | AS29: =AS28 -> 260 | BB29: =AK29+IF(s!BB28*s!BE28+s!BC28*s!BD28=0,0,E29*s!BB28*s!BE28/(s!BB28*s!BE28+s!BC28*s!BD28)+IF(s!BB28*s!BG28+s!BC28*s!BF28=0,0,K29*s!BB28*s!BG28/(s!BB28*s!BG28+s!BC28*s!BF28))+IF(s!BB28*s!BH28+s!BD28*s!BF28=0,0,M29*s!BB28*s!BH28/(s!BB28*s!BH28+s!BD28*s!BF28))+IF(s!BB28*s!BI28+s!BC28*s!BH28+s!BD28*s!BG28+s!BE28*s!BF28=0,0,N29*s!BB28*s!BI28/(s!BB28*s!BI28+s!BC28*s!BH28+s!BD28*s!BG28+s!BE28*s!BF28)
)) -> 223.76664089035793 | BC29: =AL29+IF(s!BC28*s!BD28+s!BB28*s!BE28=0,0,E29*s!BC28*s!BD28/(s!BC28*s!BD28+s!BB28*s!BE28))+IF(s!BB28*s!BG28+s!BC28*s!BF28=0,0,K29*s!BC28*s!BF28/(s!BB28*s!BG28+s!BC28*s!BF28))+IF(s!BC28*s!BI28+s!BE28*s!BG28=0,0,O29*s!BC28*s!BI28/(s!BC28*s!BI28+s!BE28*s!BG28))+IF(s!BB28*s!BI28+s!BC28*s!BH28+s!BD28*s!BG28+s!BE28*s!BF28=0,0,N29*s!BC28*s!BH28/(s!BB28*s!BI28+s!BC28*s!BH28+s!BD28*s!BG28+s!BE28*s!BF28)) -> 11.386847342544682 | BD29: =AM29+IF(s!BC28*s!BD28+s!BB28*s!BE28=0,0,E29*s!BC28*s!BD28/(s!BC28*s!BD28+s!BB28*s!BE28))+IF(s!BD28*s!BF28+s!BB28*s!BH28=0,0,M29*s!BD28*s!BF28/(s!BD28*s!BF28+s!BB28*s!BH28))+IF(s!BD28*s!BI28+s!BE28*s!BH28=0,0,Q29*s!BD28*s!BI28/(s!BD28*s!BI28+s!BE28*s!BH28))+IF(s!BB28*s!BI28+s!BC28*s!BH28+s!BD28*s!BG28+s!BE28*s!BF28=0,0,N29*s!BD28*s!BG28/(s!BB28*s!BI28+s!BC28*s!BH28+s!BD28*s!BG28+s!BE28*s!BF28)) -> 10.119926916633423 | BE29: =AN29+IF(s!BB28*s!BE28+s!BC28*s!BD28=0,0,E29*s!BB28*s!BE28/(s!BB28*s!BE28+s!BC28*s!BD28))+IF(s!BC28*s!BI28+s!BE28*s!BG28=0,0,O29*s!BE28*s!BG28/(s!BC28*s!BI28+s!BE28*s!BG28))+IF(s!BD28*s!BI28+s!BE28*s!BH28=0,0,Q29*s!BE28*s!BH28/(s!BD28*s!BI28+s!BE28*s!BH28))+IF(s!BB28*s!BI28+s!BC28*s!BH28+s!BD28*s!BG28+s!BE28*s!BF28=0,0,N29*s!BE28*s!BF28/(s!BB28*s!BI28+s!BC28*s!BH28+s!BD28*s!BG28+s!BE28*s!BF28)) -> 16.726584850463947 | BF29: =AO29+IF(s!BB28*s!BG28+s!BC28*s!BF28=0,0,K29*s!BC28*s!BF28/(s!BB28*s!BG28+s!BC28*s!BF28))+IF(s!BD28*s!BF28+s!BB28*s!BH28=0,0,M29*s!BD28*s!BF28/(s!BD28*s!BF28+s!BB28*s!BH28))+IF(s!BF28*s!BI28+s!BG28*s!BH28=0,0,W29*s!BF28*s!BI28/(s!BF28*s!BI28+s!BG28*s!BH28))+IF(s!BB28*s!BI28+s!BC28*s!BH28+s!BD28*s!BG28+s!BE28*s!BF28=0,0,N29*s!BE28*s!BF28/(s!BB28*s!BI28+s!BC28*s!BH28+s!BD28*s!BG28+s!BE28*s!BF28)) -> 10.142145126112242 | BG29: =AP29+IF(s!BB28*s!BG28+s!BC28*s!BF28=0,0,K29*s!BB28*s!BG28/(s!BB28*s!BG28+s!BC28*s!BF28))+IF(s!BC28*s!BI28+s!BE28*s!BG28=0,0,O29*s!BE28*s!BG28/(s!BC28*s!BI28+s!BE28*s!BG28))+IF(s!BF28*s!BI28+s!BG28*s!BH28=0,0,W29*s!BG28*s!BH28/(s!BF28*s!BI28+s!BG28*s!BH28))+IF(s!BB28*s!BI28+s!BC28*s!BH28+s!BD28*s!BG28+s!BE28*s!BF28=0,0,N29*s!BD28*s!BG28/(s!BB28*s!BI28+s!BC28*s!BH28+s!BD28*s!BG28+s!BE28*s!BF28)) -> 15.70436664098513 | BH29: =AQ29+IF(s!BB28*s!BH28+s!BD28*s!BF28=0,0,M29*s!BB28*s!BH28/(s!BB28*s!BH28+s!BD28*s!BF28))+IF(s!BD28*s!BI28+s!BE28*s!BH28=0,0,Q29*s!BE28*s!BH28/(s!BD28*s!BI28+s!BE28*s!BH28))+IF(s!BF28*s!BI28+s!BG28*s!BH28=0,0,W29*s!BG28*s!BH28/(s!BF28*s!BI28+s!BG28*s!BH28))+IF(s!BB28*s!BI28+s!BC28*s!BH28+s!BD28*s!BG28+s!BE28*s!BF28=0,0,N29*s!BC28*s!BH28/(s!BB28*s!BI28+s!BC28*s!BH28+s!BD28*s!BG28+s!BE28*s!BF28)) -> 17.971287066896387 | BI29: =AR29+IF(s!BC28*s!BI28+s!BE28*s!BG28=0,0,O29*s!BC28*s!BI28/(s!BC28*s!BI28+s!BE28*s!BG28))+IF(s!BD28*s!BI28+s!BE28*s!BH28=0,0,Q29*s!BD28*s!BI28/(s!BD28*s!BI28+s!BE28*s!BH28))+IF(s!BF28*s!BI28+s!BG28*s!BH28=0,0,W29*s!BF28*s!BI28/(s!BF28*s!BI28+s!BG28*s!BH28))+IF(s!BB28*s!BI28+s!BC28*s!BH28+s!BD28*s!BG28+s!BE28*s!BF28=0,0,N29*s!BB28*s!BI28/(s!BB28*s!BI28+s!BC28*s!BH28+s!BD28*s!BG28+s!BE28*s!BF28)) -> 20.182201166006237 | BJ29: =SUM(BB29:BI29) -> 326
A30: =A29 -> 100 | B30: =B29 -> 1 | C30: =C29 -> 1 | D30: =D29 -> 2 | E30: =E29 -> 5 | F30: =F29 -> 2 | G30: =G29 -> 1 | H30: =H29 -> 2 | I30: =I29 -> 1 | J30: =J29 -> 2 | K30: =K29 -> 4 | L30: =L29 -> 2 | M30: =M29 -> 4 | N30: =N29 -> 8 | O30: =O29 -> 4 | P30: =P29 -> 2 | Q30: =Q29 -> 4 | R30: =R29 -> 2 | S30: =S29 -> 1 | T30: =T29 -> 2 | U30: =U29 -> 1 | V30: =V29 -> 2 | W30: =W29 -> 4 | X30: =X29 -> 2 | Y30: =Y29 -> 1 | Z30: =Z29 -> 2 | AA30: =AA29 -> 1 | AB30: =AB29 -> 163 | AK30: =AK29 -> 205 | AL30: =AL29 -> 7 | AM30: =AM29 -> 8 | AN30: =AN29 -> 8 | AO30: =AO29 -> 8 | AP30: =AP29 -> 8 | AQ30: =AQ29 -> 8 | AR30: =AR29 -> 8 | AS30: =AS29 -> 260 | BB30: =AK30+IF(s!BB29*s!BE29+s!BC29*s!BD29=0,0,E30*s!BB29*s!BE29/(s!BB29*s!BE29+s!BC29*s!BD29)+IF(s!BB29*s!BG29+s!BC29*s!BF29=0,0,K30*s!BB29*s!BG29/(s!BB29*s!BG29+s!BC29*s!BF29))+IF(s!BB29*s!BH29+s!BD29*s!BF29=0,0,M30*s!BB29*s!BH29/(s!BB29*s!BH29+s!BD29*s!BF29))+IF(s!BB29*s!BI29+s!BC29*s!BH29+s!BD29*s!BG29+s!BE29*s!BF29=0,0,N30*s!BB29*s!BI29/(s!BB29*s!BI29+s!BC29*s!BH29+s!BD29*s!BG29+s!BE29*s!BF29)
)) -> 223.76662504886232 | BC30: =AL30+IF(s!BC29*s!BD29+s!BB29*s!BE29=0,0,E30*s!BC29*s!BD29/(s!BC29*s!BD29+s!BB29*s!BE29))+IF(s!BB29*s!BG29+s!BC29*s!BF29=0,0,K30*s!BC29*s!BF29/(s!BB29*s!BG29+s!BC29*s!BF29))+IF(s!BC29*s!BI29+s!BE29*s!BG29=0,0,O30*s!BC29*s!BI29/(s!BC29*s!BI29+s!BE29*s!BG29))+IF(s!BB29*s!BI29+s!BC29*s!BH29+s!BD29*s!BG29+s!BE29*s!BF29=0,0,N30*s!BC29*s!BH29/(s!BB29*s!BI29+s!BC29*s!BH29+s!BD29*s!BG29+s!BE29*s!BF29)) -> 11.386824509121693 | BD30: =AM30+IF(s!BC29*s!BD29+s!BB29*s!BE29=0,0,E30*s!BC29*s!BD29/(s!BC29*s!BD29+s!BB29*s!BE29))+IF(s!BD29*s!BF29+s!BB29*s!BH29=0,0,M30*s!BD29*s!BF29/(s!BD29*s!BF29+s!BB29*s!BH29))+IF(s!BD29*s!BI29+s!BE29*s!BH29=0,0,Q30*s!BD29*s!BI29/(s!BD29*s!BI29+s!BE29*s!BH29))+IF(s!BB29*s!BI29+s!BC29*s!BH29+s!BD29*s!BG29+s!BE29*s!BF29=0,0,N30*s!BD29*s!BG29/(s!BB29*s!BI29+s!BC29*s!BH29+s!BD29*s!BG29+s!BE29*s!BF29)) -> 10.119873900361661 | BE30: =AN30+IF(s!BB29*s!BE29+s!BC29*s!BD29=0,0,E30*s!BB29*s!BE29/(s!BB29*s!BE29+s!BC29*s!BD29))+IF(s!BC29*s!BI29+s!BE29*s!BG29=0,0,O30*s!BE29*s!BG29/(s!BC29*s!BI29+s!BE29*s!BG29))+IF(s!BD29*s!BI29+s!BE29*s!BH29=0,0,Q30*s!BE29*s!BH29/(s!BD29*s!BI29+s!BE29*s!BH29))+IF(s!BB29*s!BI29+s!BC29*s!BH29+s!BD29*s!BG29+s!BE29*s!BF29=0,0,N30*s!BE29*s!BF29/(s!BB29*s!BI29+s!BC29*s!BH29+s!BD29*s!BG29+s!BE29*s!BF29)) -> 16.726676541654314 | BF30: =AO30+IF(s!BB29*s!BG29+s!BC29*s!BF29=0,0,K30*s!BC29*s!BF29/(s!BB29*s!BG29+s!BC29*s!BF29))+IF(s!BD29*s!BF29+s!BB29*s!BH29=0,0,M30*s!BD29*s!BF29/(s!BD29*s!BF29+s!BB29*s!BH29))+IF(s!BF29*s!BI29+s!BG29*s!BH29=0,0,W30*s!BF29*s!BI29/(s!BF29*s!BI29+s!BG29*s!BH29))+IF(s!BB29*s!BI29+s!BC29*s!BH29+s!BD29*s!BG29+s!BE29*s!BF29=0,0,N30*s!BE29*s!BF29/(s!BB29*s!BI29+s!BC29*s!BH29+s!BD29*s!BG29+s!BE29*s!BF29)) -> 10.142092532467005 | BG30: =AP30+IF(s!BB29*s!BG29+s!BC29*s!BF29=0,0,K30*s!BB29*s!BG29/(s!BB29*s!BG29+s!BC29*s!BF29))+IF(s!BC29*s!BI29+s!BE29*s!BG29=0,0,O30*s!BE29*s!BG29/(s!BC29*s!BI29+s!BE29*s!BG29))+IF(s!BF29*s!BI29+s!BG29*s!BH29=0,0,W30*s!BG29*s!BH29/(s!BF29*s!BI29+s!BG29*s!BH29))+IF(s!BB29*s!BI29+s!BC29*s!BH29+s!BD29*s!BG29+s!BE29*s!BF29=0,0,N30*s!BD29*s!BG29/(s!BB29*s!BI29+s!BC29*s!BH29+s!BD29*s!BG29+s!BE29*s!BF29)) -> 15.704457909548966 | BH30: =AQ30+IF(s!BB29*s!BH29+s!BD29*s!BF29=0,0,M30*s!BB29*s!BH29/(s!BB29*s!BH29+s!BD29*s!BF29))+IF(s!BD29*s!BI29+s!BE29*s!BH29=0,0,Q30*s!BE29*s!BH29/(s!BD29*s!BI29+s!BE29*s!BH29))+IF(s!BF29*s!BI29+s!BG29*s!BH29=0,0,W30*s!BG29*s!BH29/(s!BF29*s!BI29+s!BG29*s!BH29))+IF(s!BB29*s!BI29+s!BC29*s!BH29+s!BD29*s!BG29+s!BE29*s!BF29=0,0,N30*s!BC29*s!BH29/(s!BB29*s!BI29+s!BC29*s!BH29+s!BD29*s!BG29+s!BE29*s!BF29)) -> 17.971408518308998 | BI30: =AR30+IF(s!BC29*s!BI29+s!BE29*s!BG29=0,0,O30*s!BC29*s!BI29/(s!BC29*s!BI29+s!BE29*s!BG29))+IF(s!BD29*s!BI29+s!BE29*s!BH29=0,0,Q30*s!BD29*s!BI29/(s!BD29*s!BI29+s!BE29*s!BH29))+IF(s!BF29*s!BI29+s!BG29*s!BH29=0,0,W30*s!BF29*s!BI29/(s!BF29*s!BI29+s!BG29*s!BH29))+IF(s!BB29*s!BI29+s!BC29*s!BH29+s!BD29*s!BG29+s!BE29*s!BF29=0,0,N30*s!BB29*s!BI29/(s!BB29*s!BI29+s!BC29*s!BH29+s!BD29*s!BG29+s!BE29*s!BF29)) -> 20.182041039675031 | BJ30: =SUM(BB30:BI30) -> 326
A31: =A30 -> 100 | B31: =B30 -> 1 | C31: =C30 -> 1 | D31: =D30 -> 2 | E31: =E30 -> 5 | F31: =F30 -> 2 | G31: =G30 -> 1 | H31: =H30 -> 2 | I31: =I30 -> 1 | J31: =J30 -> 2 | K31: =K30 -> 4 | L31: =L30 -> 2 | M31: =M30 -> 4 | N31: =N30 -> 8 | O31: =O30 -> 4 | P31: =P30 -> 2 | Q31: =Q30 -> 4 | R31: =R30 -> 2 | S31: =S30 -> 1 | T31: =T30 -> 2 | U31: =U30 -> 1 | V31: =V30 -> 2 | W31: =W30 -> 4 | X31: =X30 -> 2 | Y31: =Y30 -> 1 | Z31: =Z30 -> 2 | AA31: =AA30 -> 1 | AB31: =AB30 -> 163 | AK31: =AK30 -> 205 | AL31: =AL30 -> 7 | AM31: =AM30 -> 8 | AN31: =AN30 -> 8 | AO31: =AO30 -> 8 | AP31: =AP30 -> 8 | AQ31: =AQ30 -> 8 | AR31: =AR30 -> 8 | AS31: =AS30 -> 260 | BB31: =AK31+IF(s!BB30*s!BE30+s!BC30*s!BD30=0,0,E31*s!BB30*s!BE30/(s!BB30*s!BE30+s!BC30*s!BD30)+IF(s!BB30*s!BG30+s!BC30*s!BF30=0,0,K31*s!BB30*s!BG30/(s!BB30*s!BG30+s!BC30*s!BF30))+IF(s!BB30*s!BH30+s!BD30*s!BF30=0,0,M31*s!BB30*s!BH30/(s!BB30*s!BH30+s!BD30*s!BF30))+IF(s!BB30*s!BI30+s!BC30*s!BH30+s!BD30*s!BG30+s!BE30*s!BF30=0,0,N31*s!BB30*s!BI30/(s!BB30*s!BI30+s!BC30*s!BH30+s!BD30*s!BG30+s!BE30*s!BF30)
)) -> 223.76661365347454 | BC31: =AL31+IF(s!BC30*s!BD30+s!BB30*s!BE30=0,0,E31*s!BC30*s!BD30/(s!BC30*s!BD30+s!BB30*s!BE30))+IF(s!BB30*s!BG30+s!BC30*s!BF30=0,0,K31*s!BC30*s!BF30/(s!BB30*s!BG30+s!BC30*s!BF30))+IF(s!BC30*s!BI30+s!BE30*s!BG30=0,0,O31*s!BC30*s!BI30/(s!BC30*s!BI30+s!BE30*s!BG30))+IF(s!BB30*s!BI30+s!BC30*s!BH30+s!BD30*s!BG30+s!BE30*s!BF30=0,0,N31*s!BC30*s!BH30/(s!BB30*s!BI30+s!BC30*s!BH30+s!BD30*s!BG30+s!BE30*s!BF30)) -> 11.386808207596639 | BD31: =AM31+IF(s!BC30*s!BD30+s!BB30*s!BE30=0,0,E31*s!BC30*s!BD30/(s!BC30*s!BD30+s!BB30*s!BE30))+IF(s!BD30*s!BF30+s!BB30*s!BH30=0,0,M31*s!BD30*s!BF30/(s!BD30*s!BF30+s!BB30*s!BH30))+IF(s!BD30*s!BI30+s!BE30*s!BH30=0,0,Q31*s!BD30*s!BI30/(s!BD30*s!BI30+s!BE30*s!BH30))+IF(s!BB30*s!BI30+s!BC30*s!BH30+s!BD30*s!BG30+s!BE30*s!BF30=0,0,N31*s!BD30*s!BG30/(s!BB30*s!BI30+s!BC30*s!BH30+s!BD30*s!BG30+s!BE30*s!BF30)) -> 10.11983594517965 | BE31: =AN31+IF(s!BB30*s!BE30+s!BC30*s!BD30=0,0,E31*s!BB30*s!BE30/(s!BB30*s!BE30+s!BC30*s!BD30))+IF(s!BC30*s!BI30+s!BE30*s!BG30=0,0,O31*s!BE30*s!BG30/(s!BC30*s!BI30+s!BE30*s!BG30))+IF(s!BD30*s!BI30+s!BE30*s!BH30=0,0,Q31*s!BE30*s!BH30/(s!BD30*s!BI30+s!BE30*s!BH30))+IF(s!BB30*s!BI30+s!BC30*s!BH30+s!BD30*s!BG30+s!BE30*s!BF30=0,0,N31*s!BE30*s!BF30/(s!BB30*s!BI30+s!BC30*s!BH30+s!BD30*s!BG30+s!BE30*s!BF30)) -> 16.726742193749178 | BF31: =AO31+IF(s!BB30*s!BG30+s!BC30*s!BF30=0,0,K31*s!BC30*s!BF30/(s!BB30*s!BG30+s!BC30*s!BF30))+IF(s!BD30*s!BF30+s!BB30*s!BH30=0,0,M31*s!BD30*s!BF30/(s!BD30*s!BF30+s!BB30*s!BH30))+IF(s!BF30*s!BI30+s!BG30*s!BH30=0,0,W31*s!BF30*s!BI30/(s!BF30*s!BI30+s!BG30*s!BH30))+IF(s!BB30*s!BI30+s!BC30*s!BH30+s!BD30*s!BG30+s!BE30*s!BF30=0,0,N31*s!BE30*s!BF30/(s!BB30*s!BI30+s!BC30*s!BH30+s!BD30*s!BG30+s!BE30*s!BF30)) -> 10.142054863333813 | BG31: =AP31+IF(s!BB30*s!BG30+s!BC30*s!BF30=0,0,K31*s!BB30*s!BG30/(s!BB30*s!BG30+s!BC30*s!BF30))+IF(s!BC30*s!BI30+s!BE30*s!BG30=0,0,O31*s!BE30*s!BG30/(s!BC30*s!BI30+s!BE30*s!BG30))+IF(s!BF30*s!BI30+s!BG30*s!BH30=0,0,W31*s!BG30*s!BH30/(s!BF30*s!BI30+s!BG30*s!BH30))+IF(s!BB30*s!BI30+s!BC30*s!BH30+s!BD30*s!BG30+s!BE30*s!BF30=0,0,N31*s!BD30*s!BG30/(s!BB30*s!BI30+s!BC30*s!BH30+s!BD30*s!BG30+s!BE30*s!BF30)) -> 15.704523275595015 | BH31: =AQ31+IF(s!BB30*s!BH30+s!BD30*s!BF30=0,0,M31*s!BB30*s!BH30/(s!BB30*s!BH30+s!BD30*s!BF30))+IF(s!BD30*s!BI30+s!BE30*s!BH30=0,0,Q31*s!BE30*s!BH30/(s!BD30*s!BI30+s!BE30*s!BH30))+IF(s!BF30*s!BI30+s!BG30*s!BH30=0,0,W31*s!BG30*s!BH30/(s!BF30*s!BI30+s!BG30*s!BH30))+IF(s!BB30*s!BI30+s!BC30*s!BH30+s!BD30*s!BG30+s!BE30*s!BF30=0,0,N31*s!BC30*s!BH30/(s!BB30*s!BI30+s!BC30*s!BH30+s!BD30*s!BG30+s!BE30*s!BF30)) -> 17.971495538012004 | BI31: =AR31+IF(s!BC30*s!BI30+s!BE30*s!BG30=0,0,O31*s!BC30*s!BI30/(s!BC30*s!BI30+s!BE30*s!BG30))+IF(s!BD30*s!BI30+s!BE30*s!BH30=0,0,Q31*s!BD30*s!BI30/(s!BD30*s!BI30+s!BE30*s!BH30))+IF(s!BF30*s!BI30+s!BG30*s!BH30=0,0,W31*s!BF30*s!BI30/(s!BF30*s!BI30+s!BG30*s!BH30))+IF(s!BB30*s!BI30+s!BC30*s!BH30+s!BD30*s!BG30+s!BE30*s!BF30=0,0,N31*s!BB30*s!BI30/(s!BB30*s!BI30+s!BC30*s!BH30+s!BD30*s!BG30+s!BE30*s!BF30)) -> 20.181926323059169 | BJ31: =SUM(BB31:BI31) -> 326
A32: =A31 -> 100 | B32: =B31 -> 1 | C32: =C31 -> 1 | D32: =D31 -> 2 | E32: =E31 -> 5 | F32: =F31 -> 2 | G32: =G31 -> 1 | H32: =H31 -> 2 | I32: =I31 -> 1 | J32: =J31 -> 2 | K32: =K31 -> 4 | L32: =L31 -> 2 | M32: =M31 -> 4 | N32: =N31 -> 8 | O32: =O31 -> 4 | P32: =P31 -> 2 | Q32: =Q31 -> 4 | R32: =R31 -> 2 | S32: =S31 -> 1 | T32: =T31 -> 2 | U32: =U31 -> 1 | V32: =V31 -> 2 | W32: =W31 -> 4 | X32: =X31 -> 2 | Y32: =Y31 -> 1 | Z32: =Z31 -> 2 | AA32: =AA31 -> 1 | AB32: =AB31 -> 163 | AK32: =AK31 -> 205 | AL32: =AL31 -> 7 | AM32: =AM31 -> 8 | AN32: =AN31 -> 8 | AO32: =AO31 -> 8 | AP32: =AP31 -> 8 | AQ32: =AQ31 -> 8 | AR32: =AR31 -> 8 | AS32: =AS31 -> 260 | BB32: =AK32+IF(s!BB31*s!BE31+s!BC31*s!BD31=0,0,E32*s!BB31*s!BE31/(s!BB31*s!BE31+s!BC31*s!BD31)+IF(s!BB31*s!BG31+s!BC31*s!BF31=0,0,K32*s!BB31*s!BG31/(s!BB31*s!BG31+s!BC31*s!BF31))+IF(s!BB31*s!BH31+s!BD31*s!BF31=0,0,M32*s!BB31*s!BH31/(s!BB31*s!BH31+s!BD31*s!BF31))+IF(s!BB31*s!BI31+s!BC31*s!BH31+s!BD31*s!BG31+s!BE31*s!BF31=0,0,N32*s!BB31*s!BI31/(s!BB31*s!BI31+s!BC31*s!BH31+s!BD31*s!BG31+s!BE31*s!BF31)
)) -> 223.7666054636091 | BC32: =AL32+IF(s!BC31*s!BD31+s!BB31*s!BE31=0,0,E32*s!BC31*s!BD31/(s!BC31*s!BD31+s!BB31*s!BE31))+IF(s!BB31*s!BG31+s!BC31*s!BF31=0,0,K32*s!BC31*s!BF31/(s!BB31*s!BG31+s!BC31*s!BF31))+IF(s!BC31*s!BI31+s!BE31*s!BG31=0,0,O32*s!BC31*s!BI31/(s!BC31*s!BI31+s!BE31*s!BG31))+IF(s!BB31*s!BI31+s!BC31*s!BH31+s!BD31*s!BG31+s!BE31*s!BF31=0,0,N32*s!BC31*s!BH31/(s!BB31*s!BI31+s!BC31*s!BH31+s!BD31*s!BG31+s!BE31*s!BF31)) -> 11.386796565971846 | BD32: =AM32+IF(s!BC31*s!BD31+s!BB31*s!BE31=0,0,E32*s!BC31*s!BD31/(s!BC31*s!BD31+s!BB31*s!BE31))+IF(s!BD31*s!BF31+s!BB31*s!BH31=0,0,M32*s!BD31*s!BF31/(s!BD31*s!BF31+s!BB31*s!BH31))+IF(s!BD31*s!BI31+s!BE31*s!BH31=0,0,Q32*s!BD31*s!BI31/(s!BD31*s!BI31+s!BE31*s!BH31))+IF(s!BB31*s!BI31+s!BC31*s!BH31+s!BD31*s!BG31+s!BE31*s!BF31=0,0,N32*s!BD31*s!BG31/(s!BB31*s!BI31+s!BC31*s!BH31+s!BD31*s!BG31+s!BE31*s!BF31)) -> 10.119808773342115 | BE32: =AN32+IF(s!BB31*s!BE31+s!BC31*s!BD31=0,0,E32*s!BB31*s!BE31/(s!BB31*s!BE31+s!BC31*s!BD31))+IF(s!BC31*s!BI31+s!BE31*s!BG31=0,0,O32*s!BE31*s!BG31/(s!BC31*s!BI31+s!BE31*s!BG31))+IF(s!BD31*s!BI31+s!BE31*s!BH31=0,0,Q32*s!BE31*s!BH31/(s!BD31*s!BI31+s!BE31*s!BH31))+IF(s!BB31*s!BI31+s!BC31*s!BH31+s!BD31*s!BG31+s!BE31*s!BF31=0,0,N32*s!BE31*s!BF31/(s!BB31*s!BI31+s!BC31*s!BH31+s!BD31*s!BG31+s!BE31*s!BF31)) -> 16.726789197076936 | BF32: =AO32+IF(s!BB31*s!BG31+s!BC31*s!BF31=0,0,K32*s!BC31*s!BF31/(s!BB31*s!BG31+s!BC31*s!BF31))+IF(s!BD31*s!BF31+s!BB31*s!BH31=0,0,M32*s!BD31*s!BF31/(s!BD31*s!BF31+s!BB31*s!BH31))+IF(s!BF31*s!BI31+s!BG31*s!BH31=0,0,W32*s!BF31*s!BI31/(s!BF31*s!BI31+s!BG31*s!BH31))+IF(s!BB31*s!BI31+s!BC31*s!BH31+s!BD31*s!BG31+s!BE31*s!BF31=0,0,N32*s!BE31*s!BF31/(s!BB31*s!BI31+s!BC31*s!BH31+s!BD31*s!BG31+s!BE31*s!BF31)) -> 10.142027886156447 | BG32: =AP32+IF(s!BB31*s!BG31+s!BC31*s!BF31=0,0,K32*s!BB31*s!BG31/(s!BB31*s!BG31+s!BC31*s!BF31))+IF(s!BC31*s!BI31+s!BE31*s!BG31=0,0,O32*s!BE31*s!BG31/(s!BC31*s!BI31+s!BE31*s!BG31))+IF(s!BF31*s!BI31+s!BG31*s!BH31=0,0,W32*s!BG31*s!BH31/(s!BF31*s!BI31+s!BG31*s!BH31))+IF(s!BB31*s!BI31+s!BC31*s!BH31+s!BD31*s!BG31+s!BE31*s!BF31=0,0,N32*s!BD31*s!BG31/(s!BB31*s!BI31+s!BC31*s!BH31+s!BD31*s!BG31+s!BE31*s!BF31)) -> 15.70457008426261 | BH32: =AQ32+IF(s!BB31*s!BH31+s!BD31*s!BF31=0,0,M32*s!BB31*s!BH31/(s!BB31*s!BH31+s!BD31*s!BF31))+IF(s!BD31*s!BI31+s!BE31*s!BH31=0,0,Q32*s!BE31*s!BH31/(s!BD31*s!BI31+s!BE31*s!BH31))+IF(s!BF31*s!BI31+s!BG31*s!BH31=0,0,W32*s!BG31*s!BH31/(s!BF31*s!BI31+s!BG31*s!BH31))+IF(s!BB31*s!BI31+s!BC31*s!BH31+s!BD31*s!BG31+s!BE31*s!BF31=0,0,N32*s!BC31*s!BH31/(s!BB31*s!BI31+s!BC31*s!BH31+s!BD31*s!BG31+s!BE31*s!BF31)) -> 17.971557876892341 | BI32: =AR32+IF(s!BC31*s!BI31+s!BE31*s!BG31=0,0,O32*s!BC31*s!BI31/(s!BC31*s!BI31+s!BE31*s!BG31))+IF(s!BD31*s!BI31+s!BE31*s!BH31=0,0,Q32*s!BD31*s!BI31/(s!BD31*s!BI31+s!BE31*s!BH31))+IF(s!BF31*s!BI31+s!BG31*s!BH31=0,0,W32*s!BF31*s!BI31/(s!BF31*s!BI31+s!BG31*s!BH31))+IF(s!BB31*s!BI31+s!BC31*s!BH31+s!BD31*s!BG31+s!BE31*s!BF31=0,0,N32*s!BB31*s!BI31/(s!BB31*s!BI31+s!BC31*s!BH31+s!BD31*s!BG31+s!BE31*s!BF31)) -> 20.181844152688608 | BJ32: =SUM(BB32:BI32) -> 326
A33: =A32 -> 100 | B33: =B32 -> 1 | C33: =C32 -> 1 | D33: =D32 -> 2 | E33: =E32 -> 5 | F33: =F32 -> 2 | G33: =G32 -> 1 | H33: =H32 -> 2 | I33: =I32 -> 1 | J33: =J32 -> 2 | K33: =K32 -> 4 | L33: =L32 -> 2 | M33: =M32 -> 4 | N33: =N32 -> 8 | O33: =O32 -> 4 | P33: =P32 -> 2 | Q33: =Q32 -> 4 | R33: =R32 -> 2 | S33: =S32 -> 1 | T33: =T32 -> 2 | U33: =U32 -> 1 | V33: =V32 -> 2 | W33: =W32 -> 4 | X33: =X32 -> 2 | Y33: =Y32 -> 1 | Z33: =Z32 -> 2 | AA33: =AA32 -> 1 | AB33: =AB32 -> 163 | AK33: =AK32 -> 205 | AL33: =AL32 -> 7 | AM33: =AM32 -> 8 | AN33: =AN32 -> 8 | AO33: =AO32 -> 8 | AP33: =AP32 -> 8 | AQ33: =AQ32 -> 8 | AR33: =AR32 -> 8 | AS33: =AS32 -> 260 | BB33: =AK33+IF(s!BB32*s!BE32+s!BC32*s!BD32=0,0,E33*s!BB32*s!BE32/(s!BB32*s!BE32+s!BC32*s!BD32)+IF(s!BB32*s!BG32+s!BC32*s!BF32=0,0,K33*s!BB32*s!BG32/(s!BB32*s!BG32+s!BC32*s!BF32))+IF(s!BB32*s!BH32+s!BD32*s!BF32=0,0,M33*s!BB32*s!BH32/(s!BB32*s!BH32+s!BD32*s!BF32))+IF(s!BB32*s!BI32+s!BC32*s!BH32+s!BD32*s!BG32+s!BE32*s!BF32=0,0,N33*s!BB32*s!BI32/(s!BB32*s!BI32+s!BC32*s!BH32+s!BD32*s!BG32+s!BE32*s!BF32)
)) -> 223.76659958184999 | BC33: =AL33+IF(s!BC32*s!BD32+s!BB32*s!BE32=0,0,E33*s!BC32*s!BD32/(s!BC32*s!BD32+s!BB32*s!BE32))+IF(s!BB32*s!BG32+s!BC32*s!BF32=0,0,K33*s!BC32*s!BF32/(s!BB32*s!BG32+s!BC32*s!BF32))+IF(s!BC32*s!BI32+s!BE32*s!BG32=0,0,O33*s!BC32*s!BI32/(s!BC32*s!BI32+s!BE32*s!BG32))+IF(s!BB32*s!BI32+s!BC32*s!BH32+s!BD32*s!BG32+s!BE32*s!BF32=0,0,N33*s!BC32*s!BH32/(s!BB32*s!BI32+s!BC32*s!BH32+s!BD32*s!BG32+s!BE32*s!BF32)) -> 11.386788250078171 | BD33: =AM33+IF(s!BC32*s!BD32+s!BB32*s!BE32=0,0,E33*s!BC32*s!BD32/(s!BC32*s!BD32+s!BB32*s!BE32))+IF(s!BD32*s!BF32+s!BB32*s!BH32=0,0,M33*s!BD32*s!BF32/(s!BD32*s!BF32+s!BB32*s!BH32))+IF(s!BD32*s!BI32+s!BE32*s!BH32=0,0,Q33*s!BD32*s!BI32/(s!BD32*s!BI32+s!BE32*s!BH32))+IF(s!BB32*s!BI32+s!BC32*s!BH32+s!BD32*s!BG32+s!BE32*s!BF32=0,0,N33*s!BD32*s!BG32/(s!BB32*s!BI32+s!BC32*s!BH32+s!BD32*s!BG32+s!BE32*s!BF32)) -> 10.119789321932126 | BE33: =AN33+IF(s!BB32*s!BE32+s!BC32*s!BD32=0,0,E33*s!BB32*s!BE32/(s!BB32*s!BE32+s!BC32*s!BD32))+IF(s!BC32*s!BI32+s!BE32*s!BG32=0,0,O33*s!BE32*s!BG32/(s!BC32*s!BI32+s!BE32*s!BG32))+IF(s!BD32*s!BI32+s!BE32*s!BH32=0,0,Q33*s!BE32*s!BH32/(s!BD32*s!BI32+s!BE32*s!BH32))+IF(s!BB32*s!BI32+s!BC32*s!BH32+s!BD32*s!BG32+s!BE32*s!BF32=0,0,N33*s!BE32*s!BF32/(s!BB32*s!BI32+s!BC32*s!BH32+s!BD32*s!BG32+s!BE32*s!BF32)) -> 16.726822846139711 | BF33: =AO33+IF(s!BB32*s!BG32+s!BC32*s!BF32=0,0,K33*s!BC32*s!BF32/(s!BB32*s!BG32+s!BC32*s!BF32))+IF(s!BD32*s!BF32+s!BB32*s!BH32=0,0,M33*s!BD32*s!BF32/(s!BD32*s!BF32+s!BB32*s!BH32))+IF(s!BF32*s!BI32+s!BG32*s!BH32=0,0,W33*s!BF32*s!BI32/(s!BF32*s!BI32+s!BG32*s!BH32))+IF(s!BB32*s!BI32+s!BC32*s!BH32+s!BD32*s!BG32+s!BE32*s!BF32=0,0,N33*s!BE32*s!BF32/(s!BB32*s!BI32+s!BC32*s!BH32+s!BD32*s!BG32+s!BE32*s!BF32)) -> 10.142008567911533 | BG33: =AP33+IF(s!BB32*s!BG32+s!BC32*s!BF32=0,0,K33*s!BB32*s!BG32/(s!BB32*s!BG32+s!BC32*s!BF32))+IF(s!BC32*s!BI32+s!BE32*s!BG32=0,0,O33*s!BE32*s!BG32/(s!BC32*s!BI32+s!BE32*s!BG32))+IF(s!BF32*s!BI32+s!BG32*s!BH32=0,0,W33*s!BG32*s!BH32/(s!BF32*s!BI32+s!BG32*s!BH32))+IF(s!BB32*s!BI32+s!BC32*s!BH32+s!BD32*s!BG32+s!BE32*s!BF32=0,0,N33*s!BD32*s!BG32/(s!BB32*s!BI32+s!BC32*s!BH32+s!BD32*s!BG32+s!BE32*s!BF32)) -> 15.704603600160302 | BH33: =AQ33+IF(s!BB32*s!BH32+s!BD32*s!BF32=0,0,M33*s!BB32*s!BH32/(s!BB32*s!BH32+s!BD32*s!BF32))+IF(s!BD32*s!BI32+s!BE32*s!BH32=0,0,Q33*s!BE32*s!BH32/(s!BD32*s!BI32+s!BE32*s!BH32))+IF(s!BF32*s!BI32+s!BG32*s!BH32=0,0,W33*s!BG32*s!BH32/(s!BF32*s!BI32+s!BG32*s!BH32))+IF(s!BB32*s!BI32+s!BC32*s!BH32+s!BD32*s!BG32+s!BE32*s!BF32=0,0,N33*s!BC32*s!BH32/(s!BB32*s!BI32+s!BC32*s!BH32+s!BD32*s!BG32+s!BE32*s!BF32)) -> 17.971602528306345 | BI33: =AR33+IF(s!BC32*s!BI32+s!BE32*s!BG32=0,0,O33*s!BC32*s!BI32/(s!BC32*s!BI32+s!BE32*s!BG32))+IF(s!BD32*s!BI32+s!BE32*s!BH32=0,0,Q33*s!BD32*s!BI32/(s!BD32*s!BI32+s!BE32*s!BH32))+IF(s!BF32*s!BI32+s!BG32*s!BH32=0,0,W33*s!BF32*s!BI32/(s!BF32*s!BI32+s!BG32*s!BH32))+IF(s!BB32*s!BI32+s!BC32*s!BH32+s!BD32*s!BG32+s!BE32*s!BF32=0,0,N33*s!BB32*s!BI32/(s!BB32*s!BI32+s!BC32*s!BH32+s!BD32*s!BG32+s!BE32*s!BF32)) -> 20.181785303621815 | BJ33: =SUM(BB33:BI33) -> 326
A34: =A33 -> 100 | B34: =B33 -> 1 | C34: =C33 -> 1 | D34: =D33 -> 2 | E34: =E33 -> 5 | F34: =F33 -> 2 | G34: =G33 -> 1 | H34: =H33 -> 2 | I34: =I33 -> 1 | J34: =J33 -> 2 | K34: =K33 -> 4 | L34: =L33 -> 2 | M34: =M33 -> 4 | N34: =N33 -> 8 | O34: =O33 -> 4 | P34: =P33 -> 2 | Q34: =Q33 -> 4 | R34: =R33 -> 2 | S34: =S33 -> 1 | T34: =T33 -> 2 | U34: =U33 -> 1 | V34: =V33 -> 2 | W34: =W33 -> 4 | X34: =X33 -> 2 | Y34: =Y33 -> 1 | Z34: =Z33 -> 2 | AA34: =AA33 -> 1 | AB34: =AB33 -> 163 | AK34: =AK33 -> 205 | AL34: =AL33 -> 7 | AM34: =AM33 -> 8 | AN34: =AN33 -> 8 | AO34: =AO33 -> 8 | AP34: =AP33 -> 8 | AQ34: =AQ33 -> 8 | AR34: =AR33 -> 8 | AS34: =AS33 -> 260 | BB34: =AK34+IF(s!BB33*s!BE33+s!BC33*s!BD33=0,0,E34*s!BB33*s!BE33/(s!BB33*s!BE33+s!BC33*s!BD33)+IF(s!BB33*s!BG33+s!BC33*s!BF33=0,0,K34*s!BB33*s!BG33/(s!BB33*s!BG33+s!BC33*s!BF33))+IF(s!BB33*s!BH33+s!BD33*s!BF33=0,0,M34*s!BB33*s!BH33/(s!BB33*s!BH33+s!BD33*s!BF33))+IF(s!BB33*s!BI33+s!BC33*s!BH33+s!BD33*s!BG33+s!BE33*s!BF33=0,0,N34*s!BB33*s!BI33/(s!BB33*s!BI33+s!BC33*s!BH33+s!BD33*s!BG33+s!BE33*s!BF33)
)) -> 223.76659536026415 | BC34: =AL34+IF(s!BC33*s!BD33+s!BB33*s!BE33=0,0,E34*s!BC33*s!BD33/(s!BC33*s!BD33+s!BB33*s!BE33))+IF(s!BB33*s!BG33+s!BC33*s!BF33=0,0,K34*s!BC33*s!BF33/(s!BB33*s!BG33+s!BC33*s!BF33))+IF(s!BC33*s!BI33+s!BE33*s!BG33=0,0,O34*s!BC33*s!BI33/(s!BC33*s!BI33+s!BE33*s!BG33))+IF(s!BB33*s!BI33+s!BC33*s!BH33+s!BD33*s!BG33+s!BE33*s!BF33=0,0,N34*s!BC33*s!BH33/(s!BB33*s!BI33+s!BC33*s!BH33+s!BD33*s!BG33+s!BE33*s!BF33)) -> 11.386782308544479 | BD34: =AM34+IF(s!BC33*s!BD33+s!BB33*s!BE33=0,0,E34*s!BC33*s!BD33/(s!BC33*s!BD33+s!BB33*s!BE33))+IF(s!BD33*s!BF33+s!BB33*s!BH33=0,0,M34*s!BD33*s!BF33/(s!BD33*s!BF33+s!BB33*s!BH33))+IF(s!BD33*s!BI33+s!BE33*s!BH33=0,0,Q34*s!BD33*s!BI33/(s!BD33*s!BI33+s!BE33*s!BH33))+IF(s!BB33*s!BI33+s!BC33*s!BH33+s!BD33*s!BG33+s!BE33*s!BF33=0,0,N34*s!BD33*s!BG33/(s!BB33*s!BI33+s!BC33*s!BH33+s!BD33*s!BG33+s!BE33*s!BF33)) -> 10.119775397860231 | BE34: =AN34+IF(s!BB33*s!BE33+s!BC33*s!BD33=0,0,E34*s!BB33*s!BE33/(s!BB33*s!BE33+s!BC33*s!BD33))+IF(s!BC33*s!BI33+s!BE33*s!BG33=0,0,O34*s!BE33*s!BG33/(s!BC33*s!BI33+s!BE33*s!BG33))+IF(s!BD33*s!BI33+s!BE33*s!BH33=0,0,Q34*s!BE33*s!BH33/(s!BD33*s!BI33+s!BE33*s!BH33))+IF(s!BB33*s!BI33+s!BC33*s!BH33+s!BD33*s!BG33+s!BE33*s!BF33=0,0,N34*s!BE33*s!BF33/(s!BB33*s!BI33+s!BC33*s!BH33+s!BD33*s!BG33+s!BE33*s!BF33)) -> 16.726846933331142 | BF34: =AO34+IF(s!BB33*s!BG33+s!BC33*s!BF33=0,0,K34*s!BC33*s!BF33/(s!BB33*s!BG33+s!BC33*s!BF33))+IF(s!BD33*s!BF33+s!BB33*s!BH33=0,0,M34*s!BD33*s!BF33/(s!BD33*s!BF33+s!BB33*s!BH33))+IF(s!BF33*s!BI33+s!BG33*s!BH33=0,0,W34*s!BF33*s!BI33/(s!BF33*s!BI33+s!BG33*s!BH33))+IF(s!BB33*s!BI33+s!BC33*s!BH33+s!BD33*s!BG33+s!BE33*s!BF33=0,0,N34*s!BE33*s!BF33/(s!BB33*s!BI33+s!BC33*s!BH33+s!BD33*s!BG33+s!BE33*s!BF33)) -> 10.141994735391439 | BG34: =AP34+IF(s!BB33*s!BG33+s!BC33*s!BF33=0,0,K34*s!BB33*s!BG33/(s!BB33*s!BG33+s!BC33*s!BF33))+IF(s!BC33*s!BI33+s!BE33*s!BG33=0,0,O34*s!BE33*s!BG33/(s!BC33*s!BI33+s!BE33*s!BG33))+IF(s!BF33*s!BI33+s!BG33*s!BH33=0,0,W34*s!BG33*s!BH33/(s!BF33*s!BI33+s!BG33*s!BH33))+IF(s!BB33*s!BI33+s!BC33*s!BH33+s!BD33*s!BG33+s!BE33*s!BF33=0,0,N34*s!BD33*s!BG33/(s!BB33*s!BI33+s!BC33*s!BH33+s!BD33*s!BG33+s!BE33*s!BF33)) -> 15.704627595799938 | BH34: =AQ34+IF(s!BB33*s!BH33+s!BD33*s!BF33=0,0,M34*s!BB33*s!BH33/(s!BB33*s!BH33+s!BD33*s!BF33))+IF(s!BD33*s!BI33+s!BE33*s!BH33=0,0,Q34*s!BE33*s!BH33/(s!BD33*s!BI33+s!BE33*s!BH33))+IF(s!BF33*s!BI33+s!BG33*s!BH33=0,0,W34*s!BG33*s!BH33/(s!BF33*s!BI33+s!BG33*s!BH33))+IF(s!BB33*s!BI33+s!BC33*s!BH33+s!BD33*s!BG33+s!BE33*s!BF33=0,0,N34*s!BC33*s!BH33/(s!BB33*s!BI33+s!BC33*s!BH33+s!BD33*s!BG33+s!BE33*s!BF33)) -> 17.97163450648419 | BI34: =AR34+IF(s!BC33*s!BI33+s!BE33*s!BG33=0,0,O34*s!BC33*s!BI33/(s!BC33*s!BI33+s!BE33*s!BG33))+IF(s!BD33*s!BI33+s!BE33*s!BH33=0,0,Q34*s!BD33*s!BI33/(s!BD33*s!BI33+s!BE33*s!BH33))+IF(s!BF33*s!BI33+s!BG33*s!BH33=0,0,W34*s!BF33*s!BI33/(s!BF33*s!BI33+s!BG33*s!BH33))+IF(s!BB33*s!BI33+s!BC33*s!BH33+s!BD33*s!BG33+s!BE33*s!BF33=0,0,N34*s!BB33*s!BI33/(s!BB33*s!BI33+s!BC33*s!BH33+s!BD33*s!BG33+s!BE33*s!BF33)) -> 20.181743162324437 | BJ34: =SUM(BB34:BI34) -> 326
A35: =A34 -> 100 | B35: =B34 -> 1 | C35: =C34 -> 1 | D35: =D34 -> 2 | E35: =E34 -> 5 | F35: =F34 -> 2 | G35: =G34 -> 1 | H35: =H34 -> 2 | I35: =I34 -> 1 | J35: =J34 -> 2 | K35: =K34 -> 4 | L35: =L34 -> 2 | M35: =M34 -> 4 | N35: =N34 -> 8 | O35: =O34 -> 4 | P35: =P34 -> 2 | Q35: =Q34 -> 4 | R35: =R34 -> 2 | S35: =S34 -> 1 | T35: =T34 -> 2 | U35: =U34 -> 1 | V35: =V34 -> 2 | W35: =W34 -> 4 | X35: =X34 -> 2 | Y35: =Y34 -> 1 | Z35: =Z34 -> 2 | AA35: =AA34 -> 1 | AB35: =AB34 -> 163 | AK35: =AK34 -> 205 | AL35: =AL34 -> 7 | AM35: =AM34 -> 8 | AN35: =AN34 -> 8 | AO35: =AO34 -> 8 | AP35: =AP34 -> 8 | AQ35: =AQ34 -> 8 | AR35: =AR34 -> 8 | AS35: =AS34 -> 260 | BB35: =AK35+IF(s!BB34*s!BE34+s!BC34*s!BD34=0,0,E35*s!BB34*s!BE34/(s!BB34*s!BE34+s!BC34*s!BD34)+IF(s!BB34*s!BG34+s!BC34*s!BF34=0,0,K35*s!BB34*s!BG34/(s!BB34*s!BG34+s!BC34*s!BF34))+IF(s!BB34*s!BH34+s!BD34*s!BF34=0,0,M35*s!BB34*s!BH34/(s!BB34*s!BH34+s!BD34*s!BF34))+IF(s!BB34*s!BI34+s!BC34*s!BH34+s!BD34*s!BG34+s!BE34*s!BF34=0,0,N35*s!BB34*s!BI34/(s!BB34*s!BI34+s!BC34*s!BH34+s!BD34*s!BG34+s!BE34*s!BF34)
)) -> 223.76659233176997 | BC35: =AL35+IF(s!BC34*s!BD34+s!BB34*s!BE34=0,0,E35*s!BC34*s!BD34/(s!BC34*s!BD34+s!BB34*s!BE34))+IF(s!BB34*s!BG34+s!BC34*s!BF34=0,0,K35*s!BC34*s!BF34/(s!BB34*s!BG34+s!BC34*s!BF34))+IF(s!BC34*s!BI34+s!BE34*s!BG34=0,0,O35*s!BC34*s!BI34/(s!BC34*s!BI34+s!BE34*s!BG34))+IF(s!BB34*s!BI34+s!BC34*s!BH34+s!BD34*s!BG34+s!BE34*s!BF34=0,0,N35*s!BC34*s!BH34/(s!BB34*s!BI34+s!BC34*s!BH34+s!BD34*s!BG34+s!BE34*s!BF34)) -> 11.386778062651365 | BD35: =AM35+IF(s!BC34*s!BD34+s!BB34*s!BE34=0,0,E35*s!BC34*s!BD34/(s!BC34*s!BD34+s!BB34*s!BE34))+IF(s!BD34*s!BF34+s!BB34*s!BH34=0,0,M35*s!BD34*s!BF34/(s!BD34*s!BF34+s!BB34*s!BH34))+IF(s!BD34*s!BI34+s!BE34*s!BH34=0,0,Q35*s!BD34*s!BI34/(s!BD34*s!BI34+s!BE34*s!BH34))+IF(s!BB34*s!BI34+s!BC34*s!BH34+s!BD34*s!BG34+s!BE34*s!BF34=0,0,N35*s!BD34*s!BG34/(s!BB34*s!BI34+s!BC34*s!BH34+s!BD34*s!BG34+s!BE34*s!BF34)) -> 10.119765430868572 | BE35: =AN35+IF(s!BB34*s!BE34+s!BC34*s!BD34=0,0,E35*s!BB34*s!BE34/(s!BB34*s!BE34+s!BC34*s!BD34))+IF(s!BC34*s!BI34+s!BE34*s!BG34=0,0,O35*s!BE34*s!BG34/(s!BC34*s!BI34+s!BE34*s!BG34))+IF(s!BD34*s!BI34+s!BE34*s!BH34=0,0,Q35*s!BE34*s!BH34/(s!BD34*s!BI34+s!BE34*s!BH34))+IF(s!BB34*s!BI34+s!BC34*s!BH34+s!BD34*s!BG34+s!BE34*s!BF34=0,0,N35*s!BE34*s!BF34/(s!BB34*s!BI34+s!BC34*s!BH34+s!BD34*s!BG34+s!BE34*s!BF34)) -> 16.726864174710105 | BF35: =AO35+IF(s!BB34*s!BG34+s!BC34*s!BF34=0,0,K35*s!BC34*s!BF34/(s!BB34*s!BG34+s!BC34*s!BF34))+IF(s!BD34*s!BF34+s!BB34*s!BH34=0,0,M35*s!BD34*s!BF34/(s!BD34*s!BF34+s!BB34*s!BH34))+IF(s!BF34*s!BI34+s!BG34*s!BH34=0,0,W35*s!BF34*s!BI34/(s!BF34*s!BI34+s!BG34*s!BH34))+IF(s!BB34*s!BI34+s!BC34*s!BH34+s!BD34*s!BG34+s!BE34*s!BF34=0,0,N35*s!BE34*s!BF34/(s!BB34*s!BI34+s!BC34*s!BH34+s!BD34*s!BG34+s!BE34*s!BF34)) -> 10.141984831636211 | BG35: =AP35+IF(s!BB34*s!BG34+s!BC34*s!BF34=0,0,K35*s!BB34*s!BG34/(s!BB34*s!BG34+s!BC34*s!BF34))+IF(s!BC34*s!BI34+s!BE34*s!BG34=0,0,O35*s!BE34*s!BG34/(s!BC34*s!BI34+s!BE34*s!BG34))+IF(s!BF34*s!BI34+s!BG34*s!BH34=0,0,W35*s!BG34*s!BH34/(s!BF34*s!BI34+s!BG34*s!BH34))+IF(s!BB34*s!BI34+s!BC34*s!BH34+s!BD34*s!BG34+s!BE34*s!BF34=0,0,N35*s!BD34*s!BG34/(s!BB34*s!BI34+s!BC34*s!BH34+s!BD34*s!BG34+s!BE34*s!BF34)) -> 15.704644773942469 | BH35: =AQ35+IF(s!BB34*s!BH34+s!BD34*s!BF34=0,0,M35*s!BB34*s!BH34/(s!BB34*s!BH34+s!BD34*s!BF34))+IF(s!BD34*s!BI34+s!BE34*s!BH34=0,0,Q35*s!BE34*s!BH34/(s!BD34*s!BI34+s!BE34*s!BH34))+IF(s!BF34*s!BI34+s!BG34*s!BH34=0,0,W35*s!BG34*s!BH34/(s!BF34*s!BI34+s!BG34*s!BH34))+IF(s!BB34*s!BI34+s!BC34*s!BH34+s!BD34*s!BG34+s!BE34*s!BF34=0,0,N35*s!BC34*s!BH34/(s!BB34*s!BI34+s!BC34*s!BH34+s!BD34*s!BG34+s!BE34*s!BF34)) -> 17.97165740572526 | BI35: =AR35+IF(s!BC34*s!BI34+s!BE34*s!BG34=0,0,O35*s!BC34*s!BI34/(s!BC34*s!BI34+s!BE34*s!BG34))+IF(s!BD34*s!BI34+s!BE34*s!BH34=0,0,Q35*s!BD34*s!BI34/(s!BD34*s!BI34+s!BE34*s!BH34))+IF(s!BF34*s!BI34+s!BG34*s!BH34=0,0,W35*s!BF34*s!BI34/(s!BF34*s!BI34+s!BG34*s!BH34))+IF(s!BB34*s!BI34+s!BC34*s!BH34+s!BD34*s!BG34+s!BE34*s!BF34=0,0,N35*s!BB34*s!BI34/(s!BB34*s!BI34+s!BC34*s!BH34+s!BD34*s!BG34+s!BE34*s!BF34)) -> 20.181712988696063 | BJ35: =SUM(BB35:BI35) -> 326
A36: =A35 -> 100 | B36: =B35 -> 1 | C36: =C35 -> 1 | D36: =D35 -> 2 | E36: =E35 -> 5 | F36: =F35 -> 2 | G36: =G35 -> 1 | H36: =H35 -> 2 | I36: =I35 -> 1 | J36: =J35 -> 2 | K36: =K35 -> 4 | L36: =L35 -> 2 | M36: =M35 -> 4 | N36: =N35 -> 8 | O36: =O35 -> 4 | P36: =P35 -> 2 | Q36: =Q35 -> 4 | R36: =R35 -> 2 | S36: =S35 -> 1 | T36: =T35 -> 2 | U36: =U35 -> 1 | V36: =V35 -> 2 | W36: =W35 -> 4 | X36: =X35 -> 2 | Y36: =Y35 -> 1 | Z36: =Z35 -> 2 | AA36: =AA35 -> 1 | AB36: =AB35 -> 163 | AK36: =AK35 -> 205 | AL36: =AL35 -> 7 | AM36: =AM35 -> 8 | AN36: =AN35 -> 8 | AO36: =AO35 -> 8 | AP36: =AP35 -> 8 | AQ36: =AQ35 -> 8 | AR36: =AR35 -> 8 | AS36: =AS35 -> 260 | BB36: =AK36+IF(s!BB35*s!BE35+s!BC35*s!BD35=0,0,E36*s!BB35*s!BE35/(s!BB35*s!BE35+s!BC35*s!BD35)+IF(s!BB35*s!BG35+s!BC35*s!BF35=0,0,K36*s!BB35*s!BG35/(s!BB35*s!BG35+s!BC35*s!BF35))+IF(s!BB35*s!BH35+s!BD35*s!BF35=0,0,M36*s!BB35*s!BH35/(s!BB35*s!BH35+s!BD35*s!BF35))+IF(s!BB35*s!BI35+s!BC35*s!BH35+s!BD35*s!BG35+s!BE35*s!BF35=0,0,N36*s!BB35*s!BI35/(s!BB35*s!BI35+s!BC35*s!BH35+s!BD35*s!BG35+s!BE35*s!BF35)
)) -> 223.76659016008335 | BC36: =AL36+IF(s!BC35*s!BD35+s!BB35*s!BE35=0,0,E36*s!BC35*s!BD35/(s!BC35*s!BD35+s!BB35*s!BE35))+IF(s!BB35*s!BG35+s!BC35*s!BF35=0,0,K36*s!BC35*s!BF35/(s!BB35*s!BG35+s!BC35*s!BF35))+IF(s!BC35*s!BI35+s!BE35*s!BG35=0,0,O36*s!BC35*s!BI35/(s!BC35*s!BI35+s!BE35*s!BG35))+IF(s!BB35*s!BI35+s!BC35*s!BH35+s!BD35*s!BG35+s!BE35*s!BF35=0,0,N36*s!BC35*s!BH35/(s!BB35*s!BI35+s!BC35*s!BH35+s!BD35*s!BG35+s!BE35*s!BF35)) -> 11.386775027999448 | BD36: =AM36+IF(s!BC35*s!BD35+s!BB35*s!BE35=0,0,E36*s!BC35*s!BD35/(s!BC35*s!BD35+s!BB35*s!BE35))+IF(s!BD35*s!BF35+s!BB35*s!BH35=0,0,M36*s!BD35*s!BF35/(s!BD35*s!BF35+s!BB35*s!BH35))+IF(s!BD35*s!BI35+s!BE35*s!BH35=0,0,Q36*s!BD35*s!BI35/(s!BD35*s!BI35+s!BE35*s!BH35))+IF(s!BB35*s!BI35+s!BC35*s!BH35+s!BD35*s!BG35+s!BE35*s!BF35=0,0,N36*s!BD35*s!BG35/(s!BB35*s!BI35+s!BC35*s!BH35+s!BD35*s!BG35+s!BE35*s!BF35)) -> 10.119758296678839 | BE36: =AN36+IF(s!BB35*s!BE35+s!BC35*s!BD35=0,0,E36*s!BB35*s!BE35/(s!BB35*s!BE35+s!BC35*s!BD35))+IF(s!BC35*s!BI35+s!BE35*s!BG35=0,0,O36*s!BE35*s!BG35/(s!BC35*s!BI35+s!BE35*s!BG35))+IF(s!BD35*s!BI35+s!BE35*s!BH35=0,0,Q36*s!BE35*s!BH35/(s!BD35*s!BI35+s!BE35*s!BH35))+IF(s!BB35*s!BI35+s!BC35*s!BH35+s!BD35*s!BG35+s!BE35*s!BF35=0,0,N36*s!BE35*s!BF35/(s!BB35*s!BI35+s!BC35*s!BH35+s!BD35*s!BG35+s!BE35*s!BF35)) -> 16.726876515238345 | BF36: =AO36+IF(s!BB35*s!BG35+s!BC35*s!BF35=0,0,K36*s!BC35*s!BF35/(s!BB35*s!BG35+s!BC35*s!BF35))+IF(s!BD35*s!BF35+s!BB35*s!BH35=0,0,M36*s!BD35*s!BF35/(s!BD35*s!BF35+s!BB35*s!BH35))+IF(s!BF35*s!BI35+s!BG35*s!BH35=0,0,W36*s!BF35*s!BI35/(s!BF35*s!BI35+s!BG35*s!BH35))+IF(s!BB35*s!BI35+s!BC35*s!BH35+s!BD35*s!BG35+s!BE35*s!BF35=0,0,N36*s!BE35*s!BF35/(s!BB35*s!BI35+s!BC35*s!BH35+s!BD35*s!BG35+s!BE35*s!BF35)) -> 10.141977741313184 | BG36: =AP36+IF(s!BB35*s!BG35+s!BC35*s!BF35=0,0,K36*s!BB35*s!BG35/(s!BB35*s!BG35+s!BC35*s!BF35))+IF(s!BC35*s!BI35+s!BE35*s!BG35=0,0,O36*s!BE35*s!BG35/(s!BC35*s!BI35+s!BE35*s!BG35))+IF(s!BF35*s!BI35+s!BG35*s!BH35=0,0,W36*s!BG35*s!BH35/(s!BF35*s!BI35+s!BG35*s!BH35))+IF(s!BB35*s!BI35+s!BC35*s!BH35+s!BD35*s!BG35+s!BE35*s!BF35=0,0,N36*s!BD35*s!BG35/(s!BB35*s!BI35+s!BC35*s!BH35+s!BD35*s!BG35+s!BE35*s!BF35)) -> 15.704657070604002 | BH36: =AQ36+IF(s!BB35*s!BH35+s!BD35*s!BF35=0,0,M36*s!BB35*s!BH35/(s!BB35*s!BH35+s!BD35*s!BF35))+IF(s!BD35*s!BI35+s!BE35*s!BH35=0,0,Q36*s!BE35*s!BH35/(s!BD35*s!BI35+s!BE35*s!BH35))+IF(s!BF35*s!BI35+s!BG35*s!BH35=0,0,W36*s!BG35*s!BH35/(s!BF35*s!BI35+s!BG35*s!BH35))+IF(s!BB35*s!BI35+s!BC35*s!BH35+s!BD35*s!BG35+s!BE35*s!BF35=0,0,N36*s!BC35*s!BH35/(s!BB35*s!BI35+s!BC35*s!BH35+s!BD35*s!BG35+s!BE35*s!BF35)) -> 17.971673801924613 | BI36: =AR36+IF(s!BC35*s!BI35+s!BE35*s!BG35=0,0,O36*s!BC35*s!BI35/(s!BC35*s!BI35+s!BE35*s!BG35))+IF(s!BD35*s!BI35+s!BE35*s!BH35=0,0,Q36*s!BD35*s!BI35/(s!BD35*s!BI35+s!BE35*s!BH35))+IF(s!BF35*s!BI35+s!BG35*s!BH35=0,0,W36*s!BF35*s!BI35/(s!BF35*s!BI35+s!BG35*s!BH35))+IF(s!BB35*s!BI35+s!BC35*s!BH35+s!BD35*s!BG35+s!BE35*s!BF35=0,0,N36*s!BB35*s!BI35/(s!BB35*s!BI35+s!BC35*s!BH35+s!BD35*s!BG35+s!BE35*s!BF35)) -> 20.181691386158203 | BJ36: =SUM(BB36:BI36) -> 326
A37: =A36 -> 100 | B37: =B36 -> 1 | C37: =C36 -> 1 | D37: =D36 -> 2 | E37: =E36 -> 5 | F37: =F36 -> 2 | G37: =G36 -> 1 | H37: =H36 -> 2 | I37: =I36 -> 1 | J37: =J36 -> 2 | K37: =K36 -> 4 | L37: =L36 -> 2 | M37: =M36 -> 4 | N37: =N36 -> 8 | O37: =O36 -> 4 | P37: =P36 -> 2 | Q37: =Q36 -> 4 | R37: =R36 -> 2 | S37: =S36 -> 1 | T37: =T36 -> 2 | U37: =U36 -> 1 | V37: =V36 -> 2 | W37: =W36 -> 4 | X37: =X36 -> 2 | Y37: =Y36 -> 1 | Z37: =Z36 -> 2 | AA37: =AA36 -> 1 | AB37: =AB36 -> 163 | AK37: =AK36 -> 205 | AL37: =AL36 -> 7 | AM37: =AM36 -> 8 | AN37: =AN36 -> 8 | AO37: =AO36 -> 8 | AP37: =AP36 -> 8 | AQ37: =AQ36 -> 8 | AR37: =AR36 -> 8 | AS37: =AS36 -> 260 | BB37: =AK37+IF(s!BB36*s!BE36+s!BC36*s!BD36=0,0,E37*s!BB36*s!BE36/(s!BB36*s!BE36+s!BC36*s!BD36)+IF(s!BB36*s!BG36+s!BC36*s!BF36=0,0,K37*s!BB36*s!BG36/(s!BB36*s!BG36+s!BC36*s!BF36))+IF(s!BB36*s!BH36+s!BD36*s!BF36=0,0,M37*s!BB36*s!BH36/(s!BB36*s!BH36+s!BD36*s!BF36))+IF(s!BB36*s!BI36+s!BC36*s!BH36+s!BD36*s!BG36+s!BE36*s!BF36=0,0,N37*s!BB36*s!BI36/(s!BB36*s!BI36+s!BC36*s!BH36+s!BD36*s!BG36+s!BE36*s!BF36)
)) -> 223.76658860334084 | BC37: =AL37+IF(s!BC36*s!BD36+s!BB36*s!BE36=0,0,E37*s!BC36*s!BD36/(s!BC36*s!BD36+s!BB36*s!BE36))+IF(s!BB36*s!BG36+s!BC36*s!BF36=0,0,K37*s!BC36*s!BF36/(s!BB36*s!BG36+s!BC36*s!BF36))+IF(s!BC36*s!BI36+s!BE36*s!BG36=0,0,O37*s!BC36*s!BI36/(s!BC36*s!BI36+s!BE36*s!BG36))+IF(s!BB36*s!BI36+s!BC36*s!BH36+s!BD36*s!BG36+s!BE36*s!BF36=0,0,N37*s!BC36*s!BH36/(s!BB36*s!BI36+s!BC36*s!BH36+s!BD36*s!BG36+s!BE36*s!BF36)) -> 11.386772858756556 | BD37: =AM37+IF(s!BC36*s!BD36+s!BB36*s!BE36=0,0,E37*s!BC36*s!BD36/(s!BC36*s!BD36+s!BB36*s!BE36))+IF(s!BD36*s!BF36+s!BB36*s!BH36=0,0,M37*s!BD36*s!BF36/(s!BD36*s!BF36+s!BB36*s!BH36))+IF(s!BD36*s!BI36+s!BE36*s!BH36=0,0,Q37*s!BD36*s!BI36/(s!BD36*s!BI36+s!BE36*s!BH36))+IF(s!BB36*s!BI36+s!BC36*s!BH36+s!BD36*s!BG36+s!BE36*s!BF36=0,0,N37*s!BD36*s!BG36/(s!BB36*s!BI36+s!BC36*s!BH36+s!BD36*s!BG36+s!BE36*s!BF36)) -> 10.119753190355155 | BE37: =AN37+IF(s!BB36*s!BE36+s!BC36*s!BD36=0,0,E37*s!BB36*s!BE36/(s!BB36*s!BE36+s!BC36*s!BD36))+IF(s!BC36*s!BI36+s!BE36*s!BG36=0,0,O37*s!BE36*s!BG36/(s!BC36*s!BI36+s!BE36*s!BG36))+IF(s!BD36*s!BI36+s!BE36*s!BH36=0,0,Q37*s!BE36*s!BH36/(s!BD36*s!BI36+s!BE36*s!BH36))+IF(s!BB36*s!BI36+s!BC36*s!BH36+s!BD36*s!BG36+s!BE36*s!BF36=0,0,N37*s!BE36*s!BF36/(s!BB36*s!BI36+s!BC36*s!BH36+s!BD36*s!BG36+s!BE36*s!BF36)) -> 16.726885347547444 | BF37: =AO37+IF(s!BB36*s!BG36+s!BC36*s!BF36=0,0,K37*s!BC36*s!BF36/(s!BB36*s!BG36+s!BC36*s!BF36))+IF(s!BD36*s!BF36+s!BB36*s!BH36=0,0,M37*s!BD36*s!BF36/(s!BD36*s!BF36+s!BB36*s!BH36))+IF(s!BF36*s!BI36+s!BG36*s!BH36=0,0,W37*s!BF36*s!BI36/(s!BF36*s!BI36+s!BG36*s!BH36))+IF(s!BB36*s!BI36+s!BC36*s!BH36+s!BD36*s!BG36+s!BE36*s!BF36=0,0,N37*s!BE36*s!BF36/(s!BB36*s!BI36+s!BC36*s!BH36+s!BD36*s!BG36+s!BE36*s!BF36)) -> 10.141972665539006 | BG37: =AP37+IF(s!BB36*s!BG36+s!BC36*s!BF36=0,0,K37*s!BB36*s!BG36/(s!BB36*s!BG36+s!BC36*s!BF36))+IF(s!BC36*s!BI36+s!BE36*s!BG36=0,0,O37*s!BE36*s!BG36/(s!BC36*s!BI36+s!BE36*s!BG36))+IF(s!BF36*s!BI36+s!BG36*s!BH36=0,0,W37*s!BG36*s!BH36/(s!BF36*s!BI36+s!BG36*s!BH36))+IF(s!BB36*s!BI36+s!BC36*s!BH36+s!BD36*s!BG36+s!BE36*s!BF36=0,0,N37*s!BD36*s!BG36/(s!BB36*s!BI36+s!BC36*s!BH36+s!BD36*s!BG36+s!BE36*s!BF36)) -> 15.704665872363597 | BH37: =AQ37+IF(s!BB36*s!BH36+s!BD36*s!BF36=0,0,M37*s!BB36*s!BH36/(s!BB36*s!BH36+s!BD36*s!BF36))+IF(s!BD36*s!BI36+s!BE36*s!BH36=0,0,Q37*s!BE36*s!BH36/(s!BD36*s!BI36+s!BE36*s!BH36))+IF(s!BF36*s!BI36+s!BG36*s!BH36=0,0,W37*s!BG36*s!BH36/(s!BF36*s!BI36+s!BG36*s!BH36))+IF(s!BB36*s!BI36+s!BC36*s!BH36+s!BD36*s!BG36+s!BE36*s!BF36=0,0,N37*s!BC36*s!BH36/(s!BB36*s!BI36+s!BC36*s!BH36+s!BD36*s!BG36+s!BE36*s!BF36)) -> 17.971685540764994 | BI37: =AR37+IF(s!BC36*s!BI36+s!BE36*s!BG36=0,0,O37*s!BC36*s!BI36/(s!BC36*s!BI36+s!BE36*s!BG36))+IF(s!BD36*s!BI36+s!BE36*s!BH36=0,0,Q37*s!BD36*s!BI36/(s!BD36*s!BI36+s!BE36*s!BH36))+IF(s!BF36*s!BI36+s!BG36*s!BH36=0,0,W37*s!BF36*s!BI36/(s!BF36*s!BI36+s!BG36*s!BH36))+IF(s!BB36*s!BI36+s!BC36*s!BH36+s!BD36*s!BG36+s!BE36*s!BF36=0,0,N37*s!BB36*s!BI36/(s!BB36*s!BI36+s!BC36*s!BH36+s!BD36*s!BG36+s!BE36*s!BF36)) -> 20.181675921332403 | BJ37: =SUM(BB37:BI37) -> 326
A38: =A37 -> 100 | B38: =B37 -> 1 | C38: =C37 -> 1 | D38: =D37 -> 2 | E38: =E37 -> 5 | F38: =F37 -> 2 | G38: =G37 -> 1 | H38: =H37 -> 2 | I38: =I37 -> 1 | J38: =J37 -> 2 | K38: =K37 -> 4 | L38: =L37 -> 2 | M38: =M37 -> 4 | N38: =N37 -> 8 | O38: =O37 -> 4 | P38: =P37 -> 2 | Q38: =Q37 -> 4 | R38: =R37 -> 2 | S38: =S37 -> 1 | T38: =T37 -> 2 | U38: =U37 -> 1 | V38: =V37 -> 2 | W38: =W37 -> 4 | X38: =X37 -> 2 | Y38: =Y37 -> 1 | Z38: =Z37 -> 2 | AA38: =AA37 -> 1 | AB38: =AB37 -> 163 | AK38: =AK37 -> 205 | AL38: =AL37 -> 7 | AM38: =AM37 -> 8 | AN38: =AN37 -> 8 | AO38: =AO37 -> 8 | AP38: =AP37 -> 8 | AQ38: =AQ37 -> 8 | AR38: =AR37 -> 8 | AS38: =AS37 -> 260 | BB38: =AK38+IF(s!BB37*s!BE37+s!BC37*s!BD37=0,0,E38*s!BB37*s!BE37/(s!BB37*s!BE37+s!BC37*s!BD37)+IF(s!BB37*s!BG37+s!BC37*s!BF37=0,0,K38*s!BB37*s!BG37/(s!BB37*s!BG37+s!BC37*s!BF37))+IF(s!BB37*s!BH37+s!BD37*s!BF37=0,0,M38*s!BB37*s!BH37/(s!BB37*s!BH37+s!BD37*s!BF37))+IF(s!BB37*s!BI37+s!BC37*s!BH37+s!BD37*s!BG37+s!BE37*s!BF37=0,0,N38*s!BB37*s!BI37/(s!BB37*s!BI37+s!BC37*s!BH37+s!BD37*s!BG37+s!BE37*s!BF37)
)) -> 223.76658748773633 | BC38: =AL38+IF(s!BC37*s!BD37+s!BB37*s!BE37=0,0,E38*s!BC37*s!BD37/(s!BC37*s!BD37+s!BB37*s!BE37))+IF(s!BB37*s!BG37+s!BC37*s!BF37=0,0,K38*s!BC37*s!BF37/(s!BB37*s!BG37+s!BC37*s!BF37))+IF(s!BC37*s!BI37+s!BE37*s!BG37=0,0,O38*s!BC37*s!BI37/(s!BC37*s!BI37+s!BE37*s!BG37))+IF(s!BB37*s!BI37+s!BC37*s!BH37+s!BD37*s!BG37+s!BE37*s!BF37=0,0,N38*s!BC37*s!BH37/(s!BB37*s!BI37+s!BC37*s!BH37+s!BD37*s!BG37+s!BE37*s!BF37)) -> 11.38677130794678 | BD38: =AM38+IF(s!BC37*s!BD37+s!BB37*s!BE37=0,0,E38*s!BC37*s!BD37/(s!BC37*s!BD37+s!BB37*s!BE37))+IF(s!BD37*s!BF37+s!BB37*s!BH37=0,0,M38*s!BD37*s!BF37/(s!BD37*s!BF37+s!BB37*s!BH37))+IF(s!BD37*s!BI37+s!BE37*s!BH37=0,0,Q38*s!BD37*s!BI37/(s!BD37*s!BI37+s!BE37*s!BH37))+IF(s!BB37*s!BI37+s!BC37*s!BH37+s!BD37*s!BG37+s!BE37*s!BF37=0,0,N38*s!BD37*s!BG37/(s!BB37*s!BI37+s!BC37*s!BH37+s!BD37*s!BG37+s!BE37*s!BF37)) -> 10.119749535620928 | BE38: =AN38+IF(s!BB37*s!BE37+s!BC37*s!BD37=0,0,E38*s!BB37*s!BE37/(s!BB37*s!BE37+s!BC37*s!BD37))+IF(s!BC37*s!BI37+s!BE37*s!BG37=0,0,O38*s!BE37*s!BG37/(s!BC37*s!BI37+s!BE37*s!BG37))+IF(s!BD37*s!BI37+s!BE37*s!BH37=0,0,Q38*s!BE37*s!BH37/(s!BD37*s!BI37+s!BE37*s!BH37))+IF(s!BB37*s!BI37+s!BC37*s!BH37+s!BD37*s!BG37+s!BE37*s!BF37=0,0,N38*s!BE37*s!BF37/(s!BB37*s!BI37+s!BC37*s!BH37+s!BD37*s!BG37+s!BE37*s!BF37)) -> 16.726891668695963 | BF38: =AO38+IF(s!BB37*s!BG37+s!BC37*s!BF37=0,0,K38*s!BC37*s!BF37/(s!BB37*s!BG37+s!BC37*s!BF37))+IF(s!BD37*s!BF37+s!BB37*s!BH37=0,0,M38*s!BD37*s!BF37/(s!BD37*s!BF37+s!BB37*s!BH37))+IF(s!BF37*s!BI37+s!BG37*s!BH37=0,0,W38*s!BF37*s!BI37/(s!BF37*s!BI37+s!BG37*s!BH37))+IF(s!BB37*s!BI37+s!BC37*s!BH37+s!BD37*s!BG37+s!BE37*s!BF37=0,0,N38*s!BE37*s!BF37/(s!BB37*s!BI37+s!BC37*s!BH37+s!BD37*s!BG37+s!BE37*s!BF37)) -> 10.141969032155215 | BG38: =AP38+IF(s!BB37*s!BG37+s!BC37*s!BF37=0,0,K38*s!BB37*s!BG37/(s!BB37*s!BG37+s!BC37*s!BF37))+IF(s!BC37*s!BI37+s!BE37*s!BG37=0,0,O38*s!BE37*s!BG37/(s!BC37*s!BI37+s!BE37*s!BG37))+IF(s!BF37*s!BI37+s!BG37*s!BH37=0,0,W38*s!BG37*s!BH37/(s!BF37*s!BI37+s!BG37*s!BH37))+IF(s!BB37*s!BI37+s!BC37*s!BH37+s!BD37*s!BG37+s!BE37*s!BF37=0,0,N38*s!BD37*s!BG37/(s!BB37*s!BI37+s!BC37*s!BH37+s!BD37*s!BG37+s!BE37*s!BF37)) -> 15.704672172161679 | BH38: =AQ38+IF(s!BB37*s!BH37+s!BD37*s!BF37=0,0,M38*s!BB37*s!BH37/(s!BB37*s!BH37+s!BD37*s!BF37))+IF(s!BD37*s!BI37+s!BE37*s!BH37=0,0,Q38*s!BE37*s!BH37/(s!BD37*s!BI37+s!BE37*s!BH37))+IF(s!BF37*s!BI37+s!BG37*s!BH37=0,0,W38*s!BG37*s!BH37/(s!BF37*s!BI37+s!BG37*s!BH37))+IF(s!BB37*s!BI37+s!BC37*s!BH37+s!BD37*s!BG37+s!BE37*s!BF37=0,0,N38*s!BC37*s!BH37/(s!BB37*s!BI37+s!BC37*s!BH37+s!BD37*s!BG37+s!BE37*s!BF37)) -> 17.97169394448753 | BI38: =AR38+IF(s!BC37*s!BI37+s!BE37*s!BG37=0,0,O38*s!BC37*s!BI37/(s!BC37*s!BI37+s!BE37*s!BG37))+IF(s!BD37*s!BI37+s!BE37*s!BH37=0,0,Q38*s!BD37*s!BI37/(s!BD37*s!BI37+s!BE37*s!BH37))+IF(s!BF37*s!BI37+s!BG37*s!BH37=0,0,W38*s!BF37*s!BI37/(s!BF37*s!BI37+s!BG37*s!BH37))+IF(s!BB37*s!BI37+s!BC37*s!BH37+s!BD37*s!BG37+s!BE37*s!BF37=0,0,N38*s!BB37*s!BI37/(s!BB37*s!BI37+s!BC37*s!BH37+s!BD37*s!BG37+s!BE37*s!BF37)) -> 20.181664851195574 | BJ38: =SUM(BB38:BI38) -> 326
A39: =A38 -> 100 | B39: =B38 -> 1 | C39: =C38 -> 1 | D39: =D38 -> 2 | E39: =E38 -> 5 | F39: =F38 -> 2 | G39: =G38 -> 1 | H39: =H38 -> 2 | I39: =I38 -> 1 | J39: =J38 -> 2 | K39: =K38 -> 4 | L39: =L38 -> 2 | M39: =M38 -> 4 | N39: =N38 -> 8 | O39: =O38 -> 4 | P39: =P38 -> 2 | Q39: =Q38 -> 4 | R39: =R38 -> 2 | S39: =S38 -> 1 | T39: =T38 -> 2 | U39: =U38 -> 1 | V39: =V38 -> 2 | W39: =W38 -> 4 | X39: =X38 -> 2 | Y39: =Y38 -> 1 | Z39: =Z38 -> 2 | AA39: =AA38 -> 1 | AB39: =AB38 -> 163 | AK39: =AK38 -> 205 | AL39: =AL38 -> 7 | AM39: =AM38 -> 8 | AN39: =AN38 -> 8 | AO39: =AO38 -> 8 | AP39: =AP38 -> 8 | AQ39: =AQ38 -> 8 | AR39: =AR38 -> 8 | AS39: =AS38 -> 260 | BB39: =AK39+IF(s!BB38*s!BE38+s!BC38*s!BD38=0,0,E39*s!BB38*s!BE38/(s!BB38*s!BE38+s!BC38*s!BD38)+IF(s!BB38*s!BG38+s!BC38*s!BF38=0,0,K39*s!BB38*s!BG38/(s!BB38*s!BG38+s!BC38*s!BF38))+IF(s!BB38*s!BH38+s!BD38*s!BF38=0,0,M39*s!BB38*s!BH38/(s!BB38*s!BH38+s!BD38*s!BF38))+IF(s!BB38*s!BI38+s!BC38*s!BH38+s!BD38*s!BG38+s!BE38*s!BF38=0,0,N39*s!BB38*s!BI38/(s!BB38*s!BI38+s!BC38*s!BH38+s!BD38*s!BG38+s!BE38*s!BF38)
)) -> 223.76658668845829 | BC39: =AL39+IF(s!BC38*s!BD38+s!BB38*s!BE38=0,0,E39*s!BC38*s!BD38/(s!BC38*s!BD38+s!BB38*s!BE38))+IF(s!BB38*s!BG38+s!BC38*s!BF38=0,0,K39*s!BC38*s!BF38/(s!BB38*s!BG38+s!BC38*s!BF38))+IF(s!BC38*s!BI38+s!BE38*s!BG38=0,0,O39*s!BC38*s!BI38/(s!BC38*s!BI38+s!BE38*s!BG38))+IF(s!BB38*s!BI38+s!BC38*s!BH38+s!BD38*s!BG38+s!BE38*s!BF38=0,0,N39*s!BC38*s!BH38/(s!BB38*s!BI38+s!BC38*s!BH38+s!BD38*s!BG38+s!BE38*s!BF38)) -> 11.386770199148041 | BD39: =AM39+IF(s!BC38*s!BD38+s!BB38*s!BE38=0,0,E39*s!BC38*s!BD38/(s!BC38*s!BD38+s!BB38*s!BE38))+IF(s!BD38*s!BF38+s!BB38*s!BH38=0,0,M39*s!BD38*s!BF38/(s!BD38*s!BF38+s!BB38*s!BH38))+IF(s!BD38*s!BI38+s!BE38*s!BH38=0,0,Q39*s!BD38*s!BI38/(s!BD38*s!BI38+s!BE38*s!BH38))+IF(s!BB38*s!BI38+s!BC38*s!BH38+s!BD38*s!BG38+s!BE38*s!BF38=0,0,N39*s!BD38*s!BG38/(s!BB38*s!BI38+s!BC38*s!BH38+s!BD38*s!BG38+s!BE38*s!BF38)) -> 10.119746919921432 | BE39: =AN39+IF(s!BB38*s!BE38+s!BC38*s!BD38=0,0,E39*s!BB38*s!BE38/(s!BB38*s!BE38+s!BC38*s!BD38))+IF(s!BC38*s!BI38+s!BE38*s!BG38=0,0,O39*s!BE38*s!BG38/(s!BC38*s!BI38+s!BE38*s!BG38))+IF(s!BD38*s!BI38+s!BE38*s!BH38=0,0,Q39*s!BE38*s!BH38/(s!BD38*s!BI38+s!BE38*s!BH38))+IF(s!BB38*s!BI38+s!BC38*s!BH38+s!BD38*s!BG38+s!BE38*s!BF38=0,0,N39*s!BE38*s!BF38/(s!BB38*s!BI38+s!BC38*s!BH38+s!BD38*s!BG38+s!BE38*s!BF38)) -> 16.726896192472221 | BF39: =AO39+IF(s!BB38*s!BG38+s!BC38*s!BF38=0,0,K39*s!BC38*s!BF38/(s!BB38*s!BG38+s!BC38*s!BF38))+IF(s!BD38*s!BF38+s!BB38*s!BH38=0,0,M39*s!BD38*s!BF38/(s!BD38*s!BF38+s!BB38*s!BH38))+IF(s!BF38*s!BI38+s!BG38*s!BH38=0,0,W39*s!BF38*s!BI38/(s!BF38*s!BI38+s!BG38*s!BH38))+IF(s!BB38*s!BI38+s!BC38*s!BH38+s!BD38*s!BG38+s!BE38*s!BF38=0,0,N39*s!BE38*s!BF38/(s!BB38*s!BI38+s!BC38*s!BH38+s!BD38*s!BG38+s!BE38*s!BF38)) -> 10.141966431424208 | BG39: =AP39+IF(s!BB38*s!BG38+s!BC38*s!BF38=0,0,K39*s!BB38*s!BG38/(s!BB38*s!BG38+s!BC38*s!BF38))+IF(s!BC38*s!BI38+s!BE38*s!BG38=0,0,O39*s!BE38*s!BG38/(s!BC38*s!BI38+s!BE38*s!BG38))+IF(s!BF38*s!BI38+s!BG38*s!BH38=0,0,W39*s!BG38*s!BH38/(s!BF38*s!BI38+s!BG38*s!BH38))+IF(s!BB38*s!BI38+s!BC38*s!BH38+s!BD38*s!BG38+s!BE38*s!BF38=0,0,N39*s!BD38*s!BG38/(s!BB38*s!BI38+s!BC38*s!BH38+s!BD38*s!BG38+s!BE38*s!BF38)) -> 15.704676680969449 | BH39: =AQ39+IF(s!BB38*s!BH38+s!BD38*s!BF38=0,0,M39*s!BB38*s!BH38/(s!BB38*s!BH38+s!BD38*s!BF38))+IF(s!BD38*s!BI38+s!BE38*s!BH38=0,0,Q39*s!BE38*s!BH38/(s!BD38*s!BI38+s!BE38*s!BH38))+IF(s!BF38*s!BI38+s!BG38*s!BH38=0,0,W39*s!BG38*s!BH38/(s!BF38*s!BI38+s!BG38*s!BH38))+IF(s!BB38*s!BI38+s!BC38*s!BH38+s!BD38*s!BG38+s!BE38*s!BF38=0,0,N39*s!BC38*s!BH38/(s!BB38*s!BI38+s!BC38*s!BH38+s!BD38*s!BG38+s!BE38*s!BF38)) -> 17.971699960196055 | BI39: =AR39+IF(s!BC38*s!BI38+s!BE38*s!BG38=0,0,O39*s!BC38*s!BI38/(s!BC38*s!BI38+s!BE38*s!BG38))+IF(s!BD38*s!BI38+s!BE38*s!BH38=0,0,Q39*s!BD38*s!BI38/(s!BD38*s!BI38+s!BE38*s!BH38))+IF(s!BF38*s!BI38+s!BG38*s!BH38=0,0,W39*s!BF38*s!BI38/(s!BF38*s!BI38+s!BG38*s!BH38))+IF(s!BB38*s!BI38+s!BC38*s!BH38+s!BD38*s!BG38+s!BE38*s!BF38=0,0,N39*s!BB38*s!BI38/(s!BB38*s!BI38+s!BC38*s!BH38+s!BD38*s!BG38+s!BE38*s!BF38)) -> 20.181656927410287 | BJ39: =SUM(BB39:BI39) -> 326
A40: =A39 -> 100 | B40: =B39 -> 1 | C40: =C39 -> 1 | D40: =D39 -> 2 | E40: =E39 -> 5 | F40: =F39 -> 2 | G40: =G39 -> 1 | H40: =H39 -> 2 | I40: =I39 -> 1 | J40: =J39 -> 2 | K40: =K39 -> 4 | L40: =L39 -> 2 | M40: =M39 -> 4 | N40: =N39 -> 8 | O40: =O39 -> 4 | P40: =P39 -> 2 | Q40: =Q39 -> 4 | R40: =R39 -> 2 | S40: =S39 -> 1 | T40: =T39 -> 2 | U40: =U39 -> 1 | V40: =V39 -> 2 | W40: =W39 -> 4 | X40: =X39 -> 2 | Y40: =Y39 -> 1 | Z40: =Z39 -> 2 | AA40: =AA39 -> 1 | AB40: =AB39 -> 163 | AK40: =AK39 -> 205 | AL40: =AL39 -> 7 | AM40: =AM39 -> 8 | AN40: =AN39 -> 8 | AO40: =AO39 -> 8 | AP40: =AP39 -> 8 | AQ40: =AQ39 -> 8 | AR40: =AR39 -> 8 | AS40: =AS39 -> 260 | BB40: =AK40+IF(s!BB39*s!BE39+s!BC39*s!BD39=0,0,E40*s!BB39*s!BE39/(s!BB39*s!BE39+s!BC39*s!BD39)+IF(s!BB39*s!BG39+s!BC39*s!BF39=0,0,K40*s!BB39*s!BG39/(s!BB39*s!BG39+s!BC39*s!BF39))+IF(s!BB39*s!BH39+s!BD39*s!BF39=0,0,M40*s!BB39*s!BH39/(s!BB39*s!BH39+s!BD39*s!BF39))+IF(s!BB39*s!BI39+s!BC39*s!BH39+s!BD39*s!BG39+s!BE39*s!BF39=0,0,N40*s!BB39*s!BI39/(s!BB39*s!BI39+s!BC39*s!BH39+s!BD39*s!BG39+s!BE39*s!BF39)
)) -> 223.76658611593075 | BC40: =AL40+IF(s!BC39*s!BD39+s!BB39*s!BE39=0,0,E40*s!BC39*s!BD39/(s!BC39*s!BD39+s!BB39*s!BE39))+IF(s!BB39*s!BG39+s!BC39*s!BF39=0,0,K40*s!BC39*s!BF39/(s!BB39*s!BG39+s!BC39*s!BF39))+IF(s!BC39*s!BI39+s!BE39*s!BG39=0,0,O40*s!BC39*s!BI39/(s!BC39*s!BI39+s!BE39*s!BG39))+IF(s!BB39*s!BI39+s!BC39*s!BH39+s!BD39*s!BG39+s!BE39*s!BF39=0,0,N40*s!BC39*s!BH39/(s!BB39*s!BI39+s!BC39*s!BH39+s!BD39*s!BG39+s!BE39*s!BF39)) -> 11.386769406309757 | BD40: =AM40+IF(s!BC39*s!BD39+s!BB39*s!BE39=0,0,E40*s!BC39*s!BD39/(s!BC39*s!BD39+s!BB39*s!BE39))+IF(s!BD39*s!BF39+s!BB39*s!BH39=0,0,M40*s!BD39*s!BF39/(s!BD39*s!BF39+s!BB39*s!BH39))+IF(s!BD39*s!BI39+s!BE39*s!BH39=0,0,Q40*s!BD39*s!BI39/(s!BD39*s!BI39+s!BE39*s!BH39))+IF(s!BB39*s!BI39+s!BC39*s!BH39+s!BD39*s!BG39+s!BE39*s!BF39=0,0,N40*s!BD39*s!BG39/(s!BB39*s!BI39+s!BC39*s!BH39+s!BD39*s!BG39+s!BE39*s!BF39)) -> 10.119745047923322 | BE40: =AN40+IF(s!BB39*s!BE39+s!BC39*s!BD39=0,0,E40*s!BB39*s!BE39/(s!BB39*s!BE39+s!BC39*s!BD39))+IF(s!BC39*s!BI39+s!BE39*s!BG39=0,0,O40*s!BE39*s!BG39/(s!BC39*s!BI39+s!BE39*s!BG39))+IF(s!BD39*s!BI39+s!BE39*s!BH39=0,0,Q40*s!BE39*s!BH39/(s!BD39*s!BI39+s!BE39*s!BH39))+IF(s!BB39*s!BI39+s!BC39*s!BH39+s!BD39*s!BG39+s!BE39*s!BF39=0,0,N40*s!BE39*s!BF39/(s!BB39*s!BI39+s!BC39*s!BH39+s!BD39*s!BG39+s!BE39*s!BF39)) -> 16.726899429836163 | BF40: =AO40+IF(s!BB39*s!BG39+s!BC39*s!BF39=0,0,K40*s!BC39*s!BF39/(s!BB39*s!BG39+s!BC39*s!BF39))+IF(s!BD39*s!BF39+s!BB39*s!BH39=0,0,M40*s!BD39*s!BF39/(s!BD39*s!BF39+s!BB39*s!BH39))+IF(s!BF39*s!BI39+s!BG39*s!BH39=0,0,W40*s!BF39*s!BI39/(s!BF39*s!BI39+s!BG39*s!BH39))+IF(s!BB39*s!BI39+s!BC39*s!BH39+s!BD39*s!BG39+s!BE39*s!BF39=0,0,N40*s!BE39*s!BF39/(s!BB39*s!BI39+s!BC39*s!BH39+s!BD39*s!BG39+s!BE39*s!BF39)) -> 10.141964569949605 | BG40: =AP40+IF(s!BB39*s!BG39+s!BC39*s!BF39=0,0,K40*s!BB39*s!BG39/(s!BB39*s!BG39+s!BC39*s!BF39))+IF(s!BC39*s!BI39+s!BE39*s!BG39=0,0,O40*s!BE39*s!BG39/(s!BC39*s!BI39+s!BE39*s!BG39))+IF(s!BF39*s!BI39+s!BG39*s!BH39=0,0,W40*s!BG39*s!BH39/(s!BF39*s!BI39+s!BG39*s!BH39))+IF(s!BB39*s!BI39+s!BC39*s!BH39+s!BD39*s!BG39+s!BE39*s!BF39=0,0,N40*s!BD39*s!BG39/(s!BB39*s!BI39+s!BC39*s!BH39+s!BD39*s!BG39+s!BE39*s!BF39)) -> 15.704679907809878 | BH40: =AQ40+IF(s!BB39*s!BH39+s!BD39*s!BF39=0,0,M40*s!BB39*s!BH39/(s!BB39*s!BH39+s!BD39*s!BF39))+IF(s!BD39*s!BI39+s!BE39*s!BH39=0,0,Q40*s!BE39*s!BH39/(s!BD39*s!BI39+s!BE39*s!BH39))+IF(s!BF39*s!BI39+s!BG39*s!BH39=0,0,W40*s!BG39*s!BH39/(s!BF39*s!BI39+s!BG39*s!BH39))+IF(s!BB39*s!BI39+s!BC39*s!BH39+s!BD39*s!BG39+s!BE39*s!BF39=0,0,N40*s!BC39*s!BH39/(s!BB39*s!BI39+s!BC39*s!BH39+s!BD39*s!BG39+s!BE39*s!BF39)) -> 17.971704266196312 | BI40: =AR40+IF(s!BC39*s!BI39+s!BE39*s!BG39=0,0,O40*s!BC39*s!BI39/(s!BC39*s!BI39+s!BE39*s!BG39))+IF(s!BD39*s!BI39+s!BE39*s!BH39=0,0,Q40*s!BD39*s!BI39/(s!BD39*s!BI39+s!BE39*s!BH39))+IF(s!BF39*s!BI39+s!BG39*s!BH39=0,0,W40*s!BF39*s!BI39/(s!BF39*s!BI39+s!BG39*s!BH39))+IF(s!BB39*s!BI39+s!BC39*s!BH39+s!BD39*s!BG39+s!BE39*s!BF39=0,0,N40*s!BB39*s!BI39/(s!BB39*s!BI39+s!BC39*s!BH39+s!BD39*s!BG39+s!BE39*s!BF39)) -> 20.181651256044205 | BJ40: =SUM(BB40:BI40) -> 326
A41: =A40 -> 100 | B41: =B40 -> 1 | C41: =C40 -> 1 | D41: =D40 -> 2 | E41: =E40 -> 5 | F41: =F40 -> 2 | G41: =G40 -> 1 | H41: =H40 -> 2 | I41: =I40 -> 1 | J41: =J40 -> 2 | K41: =K40 -> 4 | L41: =L40 -> 2 | M41: =M40 -> 4 | N41: =N40 -> 8 | O41: =O40 -> 4 | P41: =P40 -> 2 | Q41: =Q40 -> 4 | R41: =R40 -> 2 | S41: =S40 -> 1 | T41: =T40 -> 2 | U41: =U40 -> 1 | V41: =V40 -> 2 | W41: =W40 -> 4 | X41: =X40 -> 2 | Y41: =Y40 -> 1 | Z41: =Z40 -> 2 | AA41: =AA40 -> 1 | AB41: =AB40 -> 163 | AK41: =AK40 -> 205 | AL41: =AL40 -> 7 | AM41: =AM40 -> 8 | AN41: =AN40 -> 8 | AO41: =AO40 -> 8 | AP41: =AP40 -> 8 | AQ41: =AQ40 -> 8 | AR41: =AR40 -> 8 | AS41: =AS40 -> 260 | BB41: =AK41+IF(s!BB40*s!BE40+s!BC40*s!BD40=0,0,E41*s!BB40*s!BE40/(s!BB40*s!BE40+s!BC40*s!BD40)+IF(s!BB40*s!BG40+s!BC40*s!BF40=0,0,K41*s!BB40*s!BG40/(s!BB40*s!BG40+s!BC40*s!BF40))+IF(s!BB40*s!BH40+s!BD40*s!BF40=0,0,M41*s!BB40*s!BH40/(s!BB40*s!BH40+s!BD40*s!BF40))+IF(s!BB40*s!BI40+s!BC40*s!BH40+s!BD40*s!BG40+s!BE40*s!BF40=0,0,N41*s!BB40*s!BI40/(s!BB40*s!BI40+s!BC40*s!BH40+s!BD40*s!BG40+s!BE40*s!BF40)
)) -> 223.76658570589689 | BC41: =AL41+IF(s!BC40*s!BD40+s!BB40*s!BE40=0,0,E41*s!BC40*s!BD40/(s!BC40*s!BD40+s!BB40*s!BE40))+IF(s!BB40*s!BG40+s!BC40*s!BF40=0,0,K41*s!BC40*s!BF40/(s!BB40*s!BG40+s!BC40*s!BF40))+IF(s!BC40*s!BI40+s!BE40*s!BG40=0,0,O41*s!BC40*s!BI40/(s!BC40*s!BI40+s!BE40*s!BG40))+IF(s!BB40*s!BI40+s!BC40*s!BH40+s!BD40*s!BG40+s!BE40*s!BF40=0,0,N41*s!BC40*s!BH40/(s!BB40*s!BI40+s!BC40*s!BH40+s!BD40*s!BG40+s!BE40*s!BF40)) -> 11.386768839354296 | BD41: =AM41+IF(s!BC40*s!BD40+s!BB40*s!BE40=0,0,E41*s!BC40*s!BD40/(s!BC40*s!BD40+s!BB40*s!BE40))+IF(s!BD40*s!BF40+s!BB40*s!BH40=0,0,M41*s!BD40*s!BF40/(s!BD40*s!BF40+s!BB40*s!BH40))+IF(s!BD40*s!BI40+s!BE40*s!BH40=0,0,Q41*s!BD40*s!BI40/(s!BD40*s!BI40+s!BE40*s!BH40))+IF(s!BB40*s!BI40+s!BC40*s!BH40+s!BD40*s!BG40+s!BE40*s!BF40=0,0,N41*s!BD40*s!BG40/(s!BB40*s!BI40+s!BC40*s!BH40+s!BD40*s!BG40+s!BE40*s!BF40)) -> 10.119743708217493 | BE41: =AN41+IF(s!BB40*s!BE40+s!BC40*s!BD40=0,0,E41*s!BB40*s!BE40/(s!BB40*s!BE40+s!BC40*s!BD40))+IF(s!BC40*s!BI40+s!BE40*s!BG40=0,0,O41*s!BE40*s!BG40/(s!BC40*s!BI40+s!BE40*s!BG40))+IF(s!BD40*s!BI40+s!BE40*s!BH40=0,0,Q41*s!BE40*s!BH40/(s!BD40*s!BI40+s!BE40*s!BH40))+IF(s!BB40*s!BI40+s!BC40*s!BH40+s!BD40*s!BG40+s!BE40*s!BF40=0,0,N41*s!BE40*s!BF40/(s!BB40*s!BI40+s!BC40*s!BH40+s!BD40*s!BG40+s!BE40*s!BF40)) -> 16.726901746531315 | BF41: =AO41+IF(s!BB40*s!BG40+s!BC40*s!BF40=0,0,K41*s!BC40*s!BF40/(s!BB40*s!BG40+s!BC40*s!BF40))+IF(s!BD40*s!BF40+s!BB40*s!BH40=0,0,M41*s!BD40*s!BF40/(s!BD40*s!BF40+s!BB40*s!BH40))+IF(s!BF40*s!BI40+s!BG40*s!BH40=0,0,W41*s!BF40*s!BI40/(s!BF40*s!BI40+s!BG40*s!BH40))+IF(s!BB40*s!BI40+s!BC40*s!BH40+s!BD40*s!BG40+s!BE40*s!BF40=0,0,N41*s!BE40*s!BF40/(s!BB40*s!BI40+s!BC40*s!BH40+s!BD40*s!BG40+s!BE40*s!BF40)) -> 10.141963237660418 | BG41: =AP41+IF(s!BB40*s!BG40+s!BC40*s!BF40=0,0,K41*s!BB40*s!BG40/(s!BB40*s!BG40+s!BC40*s!BF40))+IF(s!BC40*s!BI40+s!BE40*s!BG40=0,0,O41*s!BE40*s!BG40/(s!BC40*s!BI40+s!BE40*s!BG40))+IF(s!BF40*s!BI40+s!BG40*s!BH40=0,0,W41*s!BG40*s!BH40/(s!BF40*s!BI40+s!BG40*s!BH40))+IF(s!BB40*s!BI40+s!BC40*s!BH40+s!BD40*s!BG40+s!BE40*s!BF40=0,0,N41*s!BD40*s!BG40/(s!BB40*s!BI40+s!BC40*s!BH40+s!BD40*s!BG40+s!BE40*s!BF40)) -> 15.704682217088392 | BH41: =AQ41+IF(s!BB40*s!BH40+s!BD40*s!BF40=0,0,M41*s!BB40*s!BH40/(s!BB40*s!BH40+s!BD40*s!BF40))+IF(s!BD40*s!BI40+s!BE40*s!BH40=0,0,Q41*s!BE40*s!BH40/(s!BD40*s!BI40+s!BE40*s!BH40))+IF(s!BF40*s!BI40+s!BG40*s!BH40=0,0,W41*s!BG40*s!BH40/(s!BF40*s!BI40+s!BG40*s!BH40))+IF(s!BB40*s!BI40+s!BC40*s!BH40+s!BD40*s!BG40+s!BE40*s!BF40=0,0,N41*s!BC40*s!BH40/(s!BB40*s!BI40+s!BC40*s!BH40+s!BD40*s!BG40+s!BE40*s!BF40)) -> 17.971707348225195 | BI41: =AR41+IF(s!BC40*s!BI40+s!BE40*s!BG40=0,0,O41*s!BC40*s!BI40/(s!BC40*s!BI40+s!BE40*s!BG40))+IF(s!BD40*s!BI40+s!BE40*s!BH40=0,0,Q41*s!BD40*s!BI40/(s!BD40*s!BI40+s!BE40*s!BH40))+IF(s!BF40*s!BI40+s!BG40*s!BH40=0,0,W41*s!BF40*s!BI40/(s!BF40*s!BI40+s!BG40*s!BH40))+IF(s!BB40*s!BI40+s!BC40*s!BH40+s!BD40*s!BG40+s!BE40*s!BF40=0,0,N41*s!BB40*s!BI40/(s!BB40*s!BI40+s!BC40*s!BH40+s!BD40*s!BG40+s!BE40*s!BF40)) -> 20.181647197025995 | BJ41: =SUM(BB41:BI41) -> 326
A42: =A41 -> 100 | B42: =B41 -> 1 | C42: =C41 -> 1 | D42: =D41 -> 2 | E42: =E41 -> 5 | F42: =F41 -> 2 | G42: =G41 -> 1 | H42: =H41 -> 2 | I42: =I41 -> 1 | J42: =J41 -> 2 | K42: =K41 -> 4 | L42: =L41 -> 2 | M42: =M41 -> 4 | N42: =N41 -> 8 | O42: =O41 -> 4 | P42: =P41 -> 2 | Q42: =Q41 -> 4 | R42: =R41 -> 2 | S42: =S41 -> 1 | T42: =T41 -> 2 | U42: =U41 -> 1 | V42: =V41 -> 2 | W42: =W41 -> 4 | X42: =X41 -> 2 | Y42: =Y41 -> 1 | Z42: =Z41 -> 2 | AA42: =AA41 -> 1 | AB42: =AB41 -> 163 | AK42: =AK41 -> 205 | AL42: =AL41 -> 7 | AM42: =AM41 -> 8 | AN42: =AN41 -> 8 | AO42: =AO41 -> 8 | AP42: =AP41 -> 8 | AQ42: =AQ41 -> 8 | AR42: =AR41 -> 8 | AS42: =AS41 -> 260 | BB42: =AK42+IF(s!BB41*s!BE41+s!BC41*s!BD41=0,0,E42*s!BB41*s!BE41/(s!BB41*s!BE41+s!BC41*s!BD41)+IF(s!BB41*s!BG41+s!BC41*s!BF41=0,0,K42*s!BB41*s!BG41/(s!BB41*s!BG41+s!BC41*s!BF41))+IF(s!BB41*s!BH41+s!BD41*s!BF41=0,0,M42*s!BB41*s!BH41/(s!BB41*s!BH41+s!BD41*s!BF41))+IF(s!BB41*s!BI41+s!BC41*s!BH41+s!BD41*s!BG41+s!BE41*s!BF41=0,0,N42*s!BB41*s!BI41/(s!BB41*s!BI41+s!BC41*s!BH41+s!BD41*s!BG41+s!BE41*s!BF41)
)) -> 223.76658541228105 | BC42: =AL42+IF(s!BC41*s!BD41+s!BB41*s!BE41=0,0,E42*s!BC41*s!BD41/(s!BC41*s!BD41+s!BB41*s!BE41))+IF(s!BB41*s!BG41+s!BC41*s!BF41=0,0,K42*s!BC41*s!BF41/(s!BB41*s!BG41+s!BC41*s!BF41))+IF(s!BC41*s!BI41+s!BE41*s!BG41=0,0,O42*s!BC41*s!BI41/(s!BC41*s!BI41+s!BE41*s!BG41))+IF(s!BB41*s!BI41+s!BC41*s!BH41+s!BD41*s!BG41+s!BE41*s!BF41=0,0,N42*s!BC41*s!BH41/(s!BB41*s!BI41+s!BC41*s!BH41+s!BD41*s!BG41+s!BE41*s!BF41)) -> 11.386768433900643 | BD42: =AM42+IF(s!BC41*s!BD41+s!BB41*s!BE41=0,0,E42*s!BC41*s!BD41/(s!BC41*s!BD41+s!BB41*s!BE41))+IF(s!BD41*s!BF41+s!BB41*s!BH41=0,0,M42*s!BD41*s!BF41/(s!BD41*s!BF41+s!BB41*s!BH41))+IF(s!BD41*s!BI41+s!BE41*s!BH41=0,0,Q42*s!BD41*s!BI41/(s!BD41*s!BI41+s!BE41*s!BH41))+IF(s!BB41*s!BI41+s!BC41*s!BH41+s!BD41*s!BG41+s!BE41*s!BF41=0,0,N42*s!BD41*s!BG41/(s!BB41*s!BI41+s!BC41*s!BH41+s!BD41*s!BG41+s!BE41*s!BF41)) -> 10.119742749477231 | BE42: =AN42+IF(s!BB41*s!BE41+s!BC41*s!BD41=0,0,E42*s!BB41*s!BE41/(s!BB41*s!BE41+s!BC41*s!BD41))+IF(s!BC41*s!BI41+s!BE41*s!BG41=0,0,O42*s!BE41*s!BG41/(s!BC41*s!BI41+s!BE41*s!BG41))+IF(s!BD41*s!BI41+s!BE41*s!BH41=0,0,Q42*s!BE41*s!BH41/(s!BD41*s!BI41+s!BE41*s!BH41))+IF(s!BB41*s!BI41+s!BC41*s!BH41+s!BD41*s!BG41+s!BE41*s!BF41=0,0,N42*s!BE41*s!BF41/(s!BB41*s!BI41+s!BC41*s!BH41+s!BD41*s!BG41+s!BE41*s!BF41)) -> 16.726903404341073 | BF42: =AO42+IF(s!BB41*s!BG41+s!BC41*s!BF41=0,0,K42*s!BC41*s!BF41/(s!BB41*s!BG41+s!BC41*s!BF41))+IF(s!BD41*s!BF41+s!BB41*s!BH41=0,0,M42*s!BD41*s!BF41/(s!BD41*s!BF41+s!BB41*s!BH41))+IF(s!BF41*s!BI41+s!BG41*s!BH41=0,0,W42*s!BF41*s!BI41/(s!BF41*s!BI41+s!BG41*s!BH41))+IF(s!BB41*s!BI41+s!BC41*s!BH41+s!BD41*s!BG41+s!BE41*s!BF41=0,0,N42*s!BE41*s!BF41/(s!BB41*s!BI41+s!BC41*s!BH41+s!BD41*s!BG41+s!BE41*s!BF41)) -> 10.14196228415836 | BG42: =AP42+IF(s!BB41*s!BG41+s!BC41*s!BF41=0,0,K42*s!BB41*s!BG41/(s!BB41*s!BG41+s!BC41*s!BF41))+IF(s!BC41*s!BI41+s!BE41*s!BG41=0,0,O42*s!BE41*s!BG41/(s!BC41*s!BI41+s!BE41*s!BG41))+IF(s!BF41*s!BI41+s!BG41*s!BH41=0,0,W42*s!BG41*s!BH41/(s!BF41*s!BI41+s!BG41*s!BH41))+IF(s!BB41*s!BI41+s!BC41*s!BH41+s!BD41*s!BG41+s!BE41*s!BF41=0,0,N42*s!BD41*s!BG41/(s!BB41*s!BI41+s!BC41*s!BH41+s!BD41*s!BG41+s!BE41*s!BF41)) -> 15.704683869659942 | BH42: =AQ42+IF(s!BB41*s!BH41+s!BD41*s!BF41=0,0,M42*s!BB41*s!BH41/(s!BB41*s!BH41+s!BD41*s!BF41))+IF(s!BD41*s!BI41+s!BE41*s!BH41=0,0,Q42*s!BE41*s!BH41/(s!BD41*s!BI41+s!BE41*s!BH41))+IF(s!BF41*s!BI41+s!BG41*s!BH41=0,0,W42*s!BG41*s!BH41/(s!BF41*s!BI41+s!BG41*s!BH41))+IF(s!BB41*s!BI41+s!BC41*s!BH41+s!BD41*s!BG41+s!BE41*s!BF41=0,0,N42*s!BC41*s!BH41/(s!BB41*s!BI41+s!BC41*s!BH41+s!BD41*s!BG41+s!BE41*s!BF41)) -> 17.97170955408335 | BI42: =AR42+IF(s!BC41*s!BI41+s!BE41*s!BG41=0,0,O42*s!BC41*s!BI41/(s!BC41*s!BI41+s!BE41*s!BG41))+IF(s!BD41*s!BI41+s!BE41*s!BH41=0,0,Q42*s!BD41*s!BI41/(s!BD41*s!BI41+s!BE41*s!BH41))+IF(s!BF41*s!BI41+s!BG41*s!BH41=0,0,W42*s!BF41*s!BI41/(s!BF41*s!BI41+s!BG41*s!BH41))+IF(s!BB41*s!BI41+s!BC41*s!BH41+s!BD41*s!BG41+s!BE41*s!BF41=0,0,N42*s!BB41*s!BI41/(s!BB41*s!BI41+s!BC41*s!BH41+s!BD41*s!BG41+s!BE41*s!BF41)) -> 20.181644292098344 | BJ42: =SUM(BB42:BI42) -> 326
A43: =A42 -> 100 | B43: =B42 -> 1 | C43: =C42 -> 1 | D43: =D42 -> 2 | E43: =E42 -> 5 | F43: =F42 -> 2 | G43: =G42 -> 1 | H43: =H42 -> 2 | I43: =I42 -> 1 | J43: =J42 -> 2 | K43: =K42 -> 4 | L43: =L42 -> 2 | M43: =M42 -> 4 | N43: =N42 -> 8 | O43: =O42 -> 4 | P43: =P42 -> 2 | Q43: =Q42 -> 4 | R43: =R42 -> 2 | S43: =S42 -> 1 | T43: =T42 -> 2 | U43: =U42 -> 1 | V43: =V42 -> 2 | W43: =W42 -> 4 | X43: =X42 -> 2 | Y43: =Y42 -> 1 | Z43: =Z42 -> 2 | AA43: =AA42 -> 1 | AB43: =AB42 -> 163 | AK43: =AK42 -> 205 | AL43: =AL42 -> 7 | AM43: =AM42 -> 8 | AN43: =AN42 -> 8 | AO43: =AO42 -> 8 | AP43: =AP42 -> 8 | AQ43: =AQ42 -> 8 | AR43: =AR42 -> 8 | AS43: =AS42 -> 260 | BB43: =AK43+IF(s!BB42*s!BE42+s!BC42*s!BD42=0,0,E43*s!BB42*s!BE42/(s!BB42*s!BE42+s!BC42*s!BD42)+IF(s!BB42*s!BG42+s!BC42*s!BF42=0,0,K43*s!BB42*s!BG42/(s!BB42*s!BG42+s!BC42*s!BF42))+IF(s!BB42*s!BH42+s!BD42*s!BF42=0,0,M43*s!BB42*s!BH42/(s!BB42*s!BH42+s!BD42*s!BF42))+IF(s!BB42*s!BI42+s!BC42*s!BH42+s!BD42*s!BG42+s!BE42*s!BF42=0,0,N43*s!BB42*s!BI42/(s!BB42*s!BI42+s!BC42*s!BH42+s!BD42*s!BG42+s!BE42*s!BF42)
)) -> 223.76658520205558 | BC43: =AL43+IF(s!BC42*s!BD42+s!BB42*s!BE42=0,0,E43*s!BC42*s!BD42/(s!BC42*s!BD42+s!BB42*s!BE42))+IF(s!BB42*s!BG42+s!BC42*s!BF42=0,0,K43*s!BC42*s!BF42/(s!BB42*s!BG42+s!BC42*s!BF42))+IF(s!BC42*s!BI42+s!BE42*s!BG42=0,0,O43*s!BC42*s!BI42/(s!BC42*s!BI42+s!BE42*s!BG42))+IF(s!BB42*s!BI42+s!BC42*s!BH42+s!BD42*s!BG42+s!BE42*s!BF42=0,0,N43*s!BC42*s!BH42/(s!BB42*s!BI42+s!BC42*s!BH42+s!BD42*s!BG42+s!BE42*s!BF42)) -> 11.386768143927625 | BD43: =AM43+IF(s!BC42*s!BD42+s!BB42*s!BE42=0,0,E43*s!BC42*s!BD42/(s!BC42*s!BD42+s!BB42*s!BE42))+IF(s!BD42*s!BF42+s!BB42*s!BH42=0,0,M43*s!BD42*s!BF42/(s!BD42*s!BF42+s!BB42*s!BH42))+IF(s!BD42*s!BI42+s!BE42*s!BH42=0,0,Q43*s!BD42*s!BI42/(s!BD42*s!BI42+s!BE42*s!BH42))+IF(s!BB42*s!BI42+s!BC42*s!BH42+s!BD42*s!BG42+s!BE42*s!BF42=0,0,N43*s!BD42*s!BG42/(s!BB42*s!BI42+s!BC42*s!BH42+s!BD42*s!BG42+s!BE42*s!BF42)) -> 10.119742063387447 | BE43: =AN43+IF(s!BB42*s!BE42+s!BC42*s!BD42=0,0,E43*s!BB42*s!BE42/(s!BB42*s!BE42+s!BC42*s!BD42))+IF(s!BC42*s!BI42+s!BE42*s!BG42=0,0,O43*s!BE42*s!BG42/(s!BC42*s!BI42+s!BE42*s!BG42))+IF(s!BD42*s!BI42+s!BE42*s!BH42=0,0,Q43*s!BE42*s!BH42/(s!BD42*s!BI42+s!BE42*s!BH42))+IF(s!BB42*s!BI42+s!BC42*s!BH42+s!BD42*s!BG42+s!BE42*s!BF42=0,0,N43*s!BE42*s!BF42/(s!BB42*s!BI42+s!BC42*s!BH42+s!BD42*s!BG42+s!BE42*s!BF42)) -> 16.726904590629339 | BF43: =AO43+IF(s!BB42*s!BG42+s!BC42*s!BF42=0,0,K43*s!BC42*s!BF42/(s!BB42*s!BG42+s!BC42*s!BF42))+IF(s!BD42*s!BF42+s!BB42*s!BH42=0,0,M43*s!BD42*s!BF42/(s!BD42*s!BF42+s!BB42*s!BH42))+IF(s!BF42*s!BI42+s!BG42*s!BH42=0,0,W43*s!BF42*s!BI42/(s!BF42*s!BI42+s!BG42*s!BH42))+IF(s!BB42*s!BI42+s!BC42*s!BH42+s!BD42*s!BG42+s!BE42*s!BF42=0,0,N43*s!BE42*s!BF42/(s!BB42*s!BI42+s!BC42*s!BH42+s!BD42*s!BG42+s!BE42*s!BF42)) -> 10.141961601775083 | BG43: =AP43+IF(s!BB42*s!BG42+s!BC42*s!BF42=0,0,K43*s!BB42*s!BG42/(s!BB42*s!BG42+s!BC42*s!BF42))+IF(s!BC42*s!BI42+s!BE42*s!BG42=0,0,O43*s!BE42*s!BG42/(s!BC42*s!BI42+s!BE42*s!BG42))+IF(s!BF42*s!BI42+s!BG42*s!BH42=0,0,W43*s!BG42*s!BH42/(s!BF42*s!BI42+s!BG42*s!BH42))+IF(s!BB42*s!BI42+s!BC42*s!BH42+s!BD42*s!BG42+s!BE42*s!BF42=0,0,N43*s!BD42*s!BG42/(s!BB42*s!BI42+s!BC42*s!BH42+s!BD42*s!BG42+s!BE42*s!BF42)) -> 15.704685052241702 | BH43: =AQ43+IF(s!BB42*s!BH42+s!BD42*s!BF42=0,0,M43*s!BB42*s!BH42/(s!BB42*s!BH42+s!BD42*s!BF42))+IF(s!BD42*s!BI42+s!BE42*s!BH42=0,0,Q43*s!BE42*s!BH42/(s!BD42*s!BI42+s!BE42*s!BH42))+IF(s!BF42*s!BI42+s!BG42*s!BH42=0,0,W43*s!BG42*s!BH42/(s!BF42*s!BI42+s!BG42*s!BH42))+IF(s!BB42*s!BI42+s!BC42*s!BH42+s!BD42*s!BG42+s!BE42*s!BF42=0,0,N43*s!BC42*s!BH42/(s!BB42*s!BI42+s!BC42*s!BH42+s!BD42*s!BG42+s!BE42*s!BF42)) -> 17.971711132781881 | BI43: =AR43+IF(s!BC42*s!BI42+s!BE42*s!BG42=0,0,O43*s!BC42*s!BI42/(s!BC42*s!BI42+s!BE42*s!BG42))+IF(s!BD42*s!BI42+s!BE42*s!BH42=0,0,Q43*s!BD42*s!BI42/(s!BD42*s!BI42+s!BE42*s!BH42))+IF(s!BF42*s!BI42+s!BG42*s!BH42=0,0,W43*s!BF42*s!BI42/(s!BF42*s!BI42+s!BG42*s!BH42))+IF(s!BB42*s!BI42+s!BC42*s!BH42+s!BD42*s!BG42+s!BE42*s!BF42=0,0,N43*s!BB42*s!BI42/(s!BB42*s!BI42+s!BC42*s!BH42+s!BD42*s!BG42+s!BE42*s!BF42)) -> 20.181642213201336 | BJ43: =SUM(BB43:BI43) -> 326
A44: =A43 -> 100 | B44: =B43 -> 1 | C44: =C43 -> 1 | D44: =D43 -> 2 | E44: =E43 -> 5 | F44: =F43 -> 2 | G44: =G43 -> 1 | H44: =H43 -> 2 | I44: =I43 -> 1 | J44: =J43 -> 2 | K44: =K43 -> 4 | L44: =L43 -> 2 | M44: =M43 -> 4 | N44: =N43 -> 8 | O44: =O43 -> 4 | P44: =P43 -> 2 | Q44: =Q43 -> 4 | R44: =R43 -> 2 | S44: =S43 -> 1 | T44: =T43 -> 2 | U44: =U43 -> 1 | V44: =V43 -> 2 | W44: =W43 -> 4 | X44: =X43 -> 2 | Y44: =Y43 -> 1 | Z44: =Z43 -> 2 | AA44: =AA43 -> 1 | AB44: =AB43 -> 163 | AK44: =AK43 -> 205 | AL44: =AL43 -> 7 | AM44: =AM43 -> 8 | AN44: =AN43 -> 8 | AO44: =AO43 -> 8 | AP44: =AP43 -> 8 | AQ44: =AQ43 -> 8 | AR44: =AR43 -> 8 | AS44: =AS43 -> 260 | BB44: =AK44+IF(s!BB43*s!BE43+s!BC43*s!BD43=0,0,E44*s!BB43*s!BE43/(s!BB43*s!BE43+s!BC43*s!BD43)+IF(s!BB43*s!BG43+s!BC43*s!BF43=0,0,K44*s!BB43*s!BG43/(s!BB43*s!BG43+s!BC43*s!BF43))+IF(s!BB43*s!BH43+s!BD43*s!BF43=0,0,M44*s!BB43*s!BH43/(s!BB43*s!BH43+s!BD43*s!BF43))+IF(s!BB43*s!BI43+s!BC43*s!BH43+s!BD43*s!BG43+s!BE43*s!BF43=0,0,N44*s!BB43*s!BI43/(s!BB43*s!BI43+s!BC43*s!BH43+s!BD43*s!BG43+s!BE43*s!BF43)
)) -> 223.76658505155254 | BC44: =AL44+IF(s!BC43*s!BD43+s!BB43*s!BE43=0,0,E44*s!BC43*s!BD43/(s!BC43*s!BD43+s!BB43*s!BE43))+IF(s!BB43*s!BG43+s!BC43*s!BF43=0,0,K44*s!BC43*s!BF43/(s!BB43*s!BG43+s!BC43*s!BF43))+IF(s!BC43*s!BI43+s!BE43*s!BG43=0,0,O44*s!BC43*s!BI43/(s!BC43*s!BI43+s!BE43*s!BG43))+IF(s!BB43*s!BI43+s!BC43*s!BH43+s!BD43*s!BG43+s!BE43*s!BF43=0,0,N44*s!BC43*s!BH43/(s!BB43*s!BI43+s!BC43*s!BH43+s!BD43*s!BG43+s!BE43*s!BF43)) -> 11.3867679365343 | BD44: =AM44+IF(s!BC43*s!BD43+s!BB43*s!BE43=0,0,E44*s!BC43*s!BD43/(s!BC43*s!BD43+s!BB43*s!BE43))+IF(s!BD43*s!BF43+s!BB43*s!BH43=0,0,M44*s!BD43*s!BF43/(s!BD43*s!BF43+s!BB43*s!BH43))+IF(s!BD43*s!BI43+s!BE43*s!BH43=0,0,Q44*s!BD43*s!BI43/(s!BD43*s!BI43+s!BE43*s!BH43))+IF(s!BB43*s!BI43+s!BC43*s!BH43+s!BD43*s!BG43+s!BE43*s!BF43=0,0,N44*s!BD43*s!BG43/(s!BB43*s!BI43+s!BC43*s!BH43+s!BD43*s!BG43+s!BE43*s!BF43)) -> 10.119741572422628 | BE44: =AN44+IF(s!BB43*s!BE43+s!BC43*s!BD43=0,0,E44*s!BB43*s!BE43/(s!BB43*s!BE43+s!BC43*s!BD43))+IF(s!BC43*s!BI43+s!BE43*s!BG43=0,0,O44*s!BE43*s!BG43/(s!BC43*s!BI43+s!BE43*s!BG43))+IF(s!BD43*s!BI43+s!BE43*s!BH43=0,0,Q44*s!BE43*s!BH43/(s!BD43*s!BI43+s!BE43*s!BH43))+IF(s!BB43*s!BI43+s!BC43*s!BH43+s!BD43*s!BG43+s!BE43*s!BF43=0,0,N44*s!BE43*s!BF43/(s!BB43*s!BI43+s!BC43*s!BH43+s!BD43*s!BG43+s!BE43*s!BF43)) -> 16.726905439490533 | BF44: =AO44+IF(s!BB43*s!BG43+s!BC43*s!BF43=0,0,K44*s!BC43*s!BF43/(s!BB43*s!BG43+s!BC43*s!BF43))+IF(s!BD43*s!BF43+s!BB43*s!BH43=0,0,M44*s!BD43*s!BF43/(s!BD43*s!BF43+s!BB43*s!BH43))+IF(s!BF43*s!BI43+s!BG43*s!BH43=0,0,W44*s!BF43*s!BI43/(s!BF43*s!BI43+s!BG43*s!BH43))+IF(s!BB43*s!BI43+s!BC43*s!BH43+s!BD43*s!BG43+s!BE43*s!BF43=0,0,N44*s!BE43*s!BF43/(s!BB43*s!BI43+s!BC43*s!BH43+s!BD43*s!BG43+s!BE43*s!BF43)) -> 10.141961113437169 | BG44: =AP44+IF(s!BB43*s!BG43+s!BC43*s!BF43=0,0,K44*s!BB43*s!BG43/(s!BB43*s!BG43+s!BC43*s!BF43))+IF(s!BC43*s!BI43+s!BE43*s!BG43=0,0,O44*s!BE43*s!BG43/(s!BC43*s!BI43+s!BE43*s!BG43))+IF(s!BF43*s!BI43+s!BG43*s!BH43=0,0,W44*s!BG43*s!BH43/(s!BF43*s!BI43+s!BG43*s!BH43))+IF(s!BB43*s!BI43+s!BC43*s!BH43+s!BD43*s!BG43+s!BE43*s!BF43=0,0,N44*s!BD43*s!BG43/(s!BB43*s!BI43+s!BC43*s!BH43+s!BD43*s!BG43+s!BE43*s!BF43)) -> 15.704685898475997 | BH44: =AQ44+IF(s!BB43*s!BH43+s!BD43*s!BF43=0,0,M44*s!BB43*s!BH43/(s!BB43*s!BH43+s!BD43*s!BF43))+IF(s!BD43*s!BI43+s!BE43*s!BH43=0,0,Q44*s!BE43*s!BH43/(s!BD43*s!BI43+s!BE43*s!BH43))+IF(s!BF43*s!BI43+s!BG43*s!BH43=0,0,W44*s!BG43*s!BH43/(s!BF43*s!BI43+s!BG43*s!BH43))+IF(s!BB43*s!BI43+s!BC43*s!BH43+s!BD43*s!BG43+s!BE43*s!BF43=0,0,N44*s!BC43*s!BH43/(s!BB43*s!BI43+s!BC43*s!BH43+s!BD43*s!BG43+s!BE43*s!BF43)) -> 17.971712262587669 | BI44: =AR44+IF(s!BC43*s!BI43+s!BE43*s!BG43=0,0,O44*s!BC43*s!BI43/(s!BC43*s!BI43+s!BE43*s!BG43))+IF(s!BD43*s!BI43+s!BE43*s!BH43=0,0,Q44*s!BD43*s!BI43/(s!BD43*s!BI43+s!BE43*s!BH43))+IF(s!BF43*s!BI43+s!BG43*s!BH43=0,0,W44*s!BF43*s!BI43/(s!BF43*s!BI43+s!BG43*s!BH43))+IF(s!BB43*s!BI43+s!BC43*s!BH43+s!BD43*s!BG43+s!BE43*s!BF43=0,0,N44*s!BB43*s!BI43/(s!BB43*s!BI43+s!BC43*s!BH43+s!BD43*s!BG43+s!BE43*s!BF43)) -> 20.181640725499168 | BJ44: =SUM(BB44:BI44) -> 326
A45: =A44 -> 100 | B45: =B44 -> 1 | C45: =C44 -> 1 | D45: =D44 -> 2 | E45: =E44 -> 5 | F45: =F44 -> 2 | G45: =G44 -> 1 | H45: =H44 -> 2 | I45: =I44 -> 1 | J45: =J44 -> 2 | K45: =K44 -> 4 | L45: =L44 -> 2 | M45: =M44 -> 4 | N45: =N44 -> 8 | O45: =O44 -> 4 | P45: =P44 -> 2 | Q45: =Q44 -> 4 | R45: =R44 -> 2 | S45: =S44 -> 1 | T45: =T44 -> 2 | U45: =U44 -> 1 | V45: =V44 -> 2 | W45: =W44 -> 4 | X45: =X44 -> 2 | Y45: =Y44 -> 1 | Z45: =Z44 -> 2 | AA45: =AA44 -> 1 | AB45: =AB44 -> 163 | AK45: =AK44 -> 205 | AL45: =AL44 -> 7 | AM45: =AM44 -> 8 | AN45: =AN44 -> 8 | AO45: =AO44 -> 8 | AP45: =AP44 -> 8 | AQ45: =AQ44 -> 8 | AR45: =AR44 -> 8 | AS45: =AS44 -> 260 | BB45: =AK45+IF(s!BB44*s!BE44+s!BC44*s!BD44=0,0,E45*s!BB44*s!BE44/(s!BB44*s!BE44+s!BC44*s!BD44)+IF(s!BB44*s!BG44+s!BC44*s!BF44=0,0,K45*s!BB44*s!BG44/(s!BB44*s!BG44+s!BC44*s!BF44))+IF(s!BB44*s!BH44+s!BD44*s!BF44=0,0,M45*s!BB44*s!BH44/(s!BB44*s!BH44+s!BD44*s!BF44))+IF(s!BB44*s!BI44+s!BC44*s!BH44+s!BD44*s!BG44+s!BE44*s!BF44=0,0,N45*s!BB44*s!BI44/(s!BB44*s!BI44+s!BC44*s!BH44+s!BD44*s!BG44+s!BE44*s!BF44)
)) -> 223.76658494381519 | BC45: =AL45+IF(s!BC44*s!BD44+s!BB44*s!BE44=0,0,E45*s!BC44*s!BD44/(s!BC44*s!BD44+s!BB44*s!BE44))+IF(s!BB44*s!BG44+s!BC44*s!BF44=0,0,K45*s!BC44*s!BF44/(s!BB44*s!BG44+s!BC44*s!BF44))+IF(s!BC44*s!BI44+s!BE44*s!BG44=0,0,O45*s!BC44*s!BI44/(s!BC44*s!BI44+s!BE44*s!BG44))+IF(s!BB44*s!BI44+s!BC44*s!BH44+s!BD44*s!BG44+s!BE44*s!BF44=0,0,N45*s!BC44*s!BH44/(s!BB44*s!BI44+s!BC44*s!BH44+s!BD44*s!BG44+s!BE44*s!BF44)) -> 11.386767788197146 | BD45: =AM45+IF(s!BC44*s!BD44+s!BB44*s!BE44=0,0,E45*s!BC44*s!BD44/(s!BC44*s!BD44+s!BB44*s!BE44))+IF(s!BD44*s!BF44+s!BB44*s!BH44=0,0,M45*s!BD44*s!BF44/(s!BD44*s!BF44+s!BB44*s!BH44))+IF(s!BD44*s!BI44+s!BE44*s!BH44=0,0,Q45*s!BD44*s!BI44/(s!BD44*s!BI44+s!BE44*s!BH44))+IF(s!BB44*s!BI44+s!BC44*s!BH44+s!BD44*s!BG44+s!BE44*s!BF44=0,0,N45*s!BD44*s!BG44/(s!BB44*s!BI44+s!BC44*s!BH44+s!BD44*s!BG44+s!BE44*s!BF44)) -> 10.119741221096749 | BE45: =AN45+IF(s!BB44*s!BE44+s!BC44*s!BD44=0,0,E45*s!BB44*s!BE44/(s!BB44*s!BE44+s!BC44*s!BD44))+IF(s!BC44*s!BI44+s!BE44*s!BG44=0,0,O45*s!BE44*s!BG44/(s!BC44*s!BI44+s!BE44*s!BG44))+IF(s!BD44*s!BI44+s!BE44*s!BH44=0,0,Q45*s!BE44*s!BH44/(s!BD44*s!BI44+s!BE44*s!BH44))+IF(s!BB44*s!BI44+s!BC44*s!BH44+s!BD44*s!BG44+s!BE44*s!BF44=0,0,N45*s!BE44*s!BF44/(s!BB44*s!BI44+s!BC44*s!BH44+s!BD44*s!BG44+s!BE44*s!BF44)) -> 16.726906046890914 | BF45: =AO45+IF(s!BB44*s!BG44+s!BC44*s!BF44=0,0,K45*s!BC44*s!BF44/(s!BB44*s!BG44+s!BC44*s!BF44))+IF(s!BD44*s!BF44+s!BB44*s!BH44=0,0,M45*s!BD44*s!BF44/(s!BD44*s!BF44+s!BB44*s!BH44))+IF(s!BF44*s!BI44+s!BG44*s!BH44=0,0,W45*s!BF44*s!BI44/(s!BF44*s!BI44+s!BG44*s!BH44))+IF(s!BB44*s!BI44+s!BC44*s!BH44+s!BD44*s!BG44+s!BE44*s!BF44=0,0,N45*s!BE44*s!BF44/(s!BB44*s!BI44+s!BC44*s!BH44+s!BD44*s!BG44+s!BE44*s!BF44)) -> 10.141960763975622 | BG45: =AP45+IF(s!BB44*s!BG44+s!BC44*s!BF44=0,0,K45*s!BB44*s!BG44/(s!BB44*s!BG44+s!BC44*s!BF44))+IF(s!BC44*s!BI44+s!BE44*s!BG44=0,0,O45*s!BE44*s!BG44/(s!BC44*s!BI44+s!BE44*s!BG44))+IF(s!BF44*s!BI44+s!BG44*s!BH44=0,0,W45*s!BG44*s!BH44/(s!BF44*s!BI44+s!BG44*s!BH44))+IF(s!BB44*s!BI44+s!BC44*s!BH44+s!BD44*s!BG44+s!BE44*s!BF44=0,0,N45*s!BD44*s!BG44/(s!BB44*s!BI44+s!BC44*s!BH44+s!BD44*s!BG44+s!BE44*s!BF44)) -> 15.704686504012043 | BH45: =AQ45+IF(s!BB44*s!BH44+s!BD44*s!BF44=0,0,M45*s!BB44*s!BH44/(s!BB44*s!BH44+s!BD44*s!BF44))+IF(s!BD44*s!BI44+s!BE44*s!BH44=0,0,Q45*s!BE44*s!BH44/(s!BD44*s!BI44+s!BE44*s!BH44))+IF(s!BF44*s!BI44+s!BG44*s!BH44=0,0,W45*s!BG44*s!BH44/(s!BF44*s!BI44+s!BG44*s!BH44))+IF(s!BB44*s!BI44+s!BC44*s!BH44+s!BD44*s!BG44+s!BE44*s!BF44=0,0,N45*s!BC44*s!BH44/(s!BB44*s!BI44+s!BC44*s!BH44+s!BD44*s!BG44+s!BE44*s!BF44)) -> 17.97171307111244 | BI45: =AR45+IF(s!BC44*s!BI44+s!BE44*s!BG44=0,0,O45*s!BC44*s!BI44/(s!BC44*s!BI44+s!BE44*s!BG44))+IF(s!BD44*s!BI44+s!BE44*s!BH44=0,0,Q45*s!BD44*s!BI44/(s!BD44*s!BI44+s!BE44*s!BH44))+IF(s!BF44*s!BI44+s!BG44*s!BH44=0,0,W45*s!BF44*s!BI44/(s!BF44*s!BI44+s!BG44*s!BH44))+IF(s!BB44*s!BI44+s!BC44*s!BH44+s!BD44*s!BG44+s!BE44*s!BF44=0,0,N45*s!BB44*s!BI44/(s!BB44*s!BI44+s!BC44*s!BH44+s!BD44*s!BG44+s!BE44*s!BF44)) -> 20.181639660899897 | BJ45: =SUM(BB45:BI45) -> 326
A46: =A45 -> 100 | B46: =B45 -> 1 | C46: =C45 -> 1 | D46: =D45 -> 2 | E46: =E45 -> 5 | F46: =F45 -> 2 | G46: =G45 -> 1 | H46: =H45 -> 2 | I46: =I45 -> 1 | J46: =J45 -> 2 | K46: =K45 -> 4 | L46: =L45 -> 2 | M46: =M45 -> 4 | N46: =N45 -> 8 | O46: =O45 -> 4 | P46: =P45 -> 2 | Q46: =Q45 -> 4 | R46: =R45 -> 2 | S46: =S45 -> 1 | T46: =T45 -> 2 | U46: =U45 -> 1 | V46: =V45 -> 2 | W46: =W45 -> 4 | X46: =X45 -> 2 | Y46: =Y45 -> 1 | Z46: =Z45 -> 2 | AA46: =AA45 -> 1 | AB46: =AB45 -> 163 | AK46: =AK45 -> 205 | AL46: =AL45 -> 7 | AM46: =AM45 -> 8 | AN46: =AN45 -> 8 | AO46: =AO45 -> 8 | AP46: =AP45 -> 8 | AQ46: =AQ45 -> 8 | AR46: =AR45 -> 8 | AS46: =AS45 -> 260 | BB46: =AK46+IF(s!BB45*s!BE45+s!BC45*s!BD45=0,0,E46*s!BB45*s!BE45/(s!BB45*s!BE45+s!BC45*s!BD45)+IF(s!BB45*s!BG45+s!BC45*s!BF45=0,0,K46*s!BB45*s!BG45/(s!BB45*s!BG45+s!BC45*s!BF45))+IF(s!BB45*s!BH45+s!BD45*s!BF45=0,0,M46*s!BB45*s!BH45/(s!BB45*s!BH45+s!BD45*s!BF45))+IF(s!BB45*s!BI45+s!BC45*s!BH45+s!BD45*s!BG45+s!BE45*s!BF45=0,0,N46*s!BB45*s!BI45/(s!BB45*s!BI45+s!BC45*s!BH45+s!BD45*s!BG45+s!BE45*s!BF45)
)) -> 223.76658486669754 | BC46: =AL46+IF(s!BC45*s!BD45+s!BB45*s!BE45=0,0,E46*s!BC45*s!BD45/(s!BC45*s!BD45+s!BB45*s!BE45))+IF(s!BB45*s!BG45+s!BC45*s!BF45=0,0,K46*s!BC45*s!BF45/(s!BB45*s!BG45+s!BC45*s!BF45))+IF(s!BC45*s!BI45+s!BE45*s!BG45=0,0,O46*s!BC45*s!BI45/(s!BC45*s!BI45+s!BE45*s!BG45))+IF(s!BB45*s!BI45+s!BC45*s!BH45+s!BD45*s!BG45+s!BE45*s!BF45=0,0,N46*s!BC45*s!BH45/(s!BB45*s!BI45+s!BC45*s!BH45+s!BD45*s!BG45+s!BE45*s!BF45)) -> 11.386767682095854 | BD46: =AM46+IF(s!BC45*s!BD45+s!BB45*s!BE45=0,0,E46*s!BC45*s!BD45/(s!BC45*s!BD45+s!BB45*s!BE45))+IF(s!BD45*s!BF45+s!BB45*s!BH45=0,0,M46*s!BD45*s!BF45/(s!BD45*s!BF45+s!BB45*s!BH45))+IF(s!BD45*s!BI45+s!BE45*s!BH45=0,0,Q46*s!BD45*s!BI45/(s!BD45*s!BI45+s!BE45*s!BH45))+IF(s!BB45*s!BI45+s!BC45*s!BH45+s!BD45*s!BG45+s!BE45*s!BF45=0,0,N46*s!BD45*s!BG45/(s!BB45*s!BI45+s!BC45*s!BH45+s!BD45*s!BG45+s!BE45*s!BF45)) -> 10.119740969699141 | BE46: =AN46+IF(s!BB45*s!BE45+s!BC45*s!BD45=0,0,E46*s!BB45*s!BE45/(s!BB45*s!BE45+s!BC45*s!BD45))+IF(s!BC45*s!BI45+s!BE45*s!BG45=0,0,O46*s!BE45*s!BG45/(s!BC45*s!BI45+s!BE45*s!BG45))+IF(s!BD45*s!BI45+s!BE45*s!BH45=0,0,Q46*s!BE45*s!BH45/(s!BD45*s!BI45+s!BE45*s!BH45))+IF(s!BB45*s!BI45+s!BC45*s!BH45+s!BD45*s!BG45+s!BE45*s!BF45=0,0,N46*s!BE45*s!BF45/(s!BB45*s!BI45+s!BC45*s!BH45+s!BD45*s!BG45+s!BE45*s!BF45)) -> 16.726906481507477 | BF46: =AO46+IF(s!BB45*s!BG45+s!BC45*s!BF45=0,0,K46*s!BC45*s!BF45/(s!BB45*s!BG45+s!BC45*s!BF45))+IF(s!BD45*s!BF45+s!BB45*s!BH45=0,0,M46*s!BD45*s!BF45/(s!BD45*s!BF45+s!BB45*s!BH45))+IF(s!BF45*s!BI45+s!BG45*s!BH45=0,0,W46*s!BF45*s!BI45/(s!BF45*s!BI45+s!BG45*s!BH45))+IF(s!BB45*s!BI45+s!BC45*s!BH45+s!BD45*s!BG45+s!BE45*s!BF45=0,0,N46*s!BE45*s!BF45/(s!BB45*s!BI45+s!BC45*s!BH45+s!BD45*s!BG45+s!BE45*s!BF45)) -> 10.141960513902708 | BG46: =AP46+IF(s!BB45*s!BG45+s!BC45*s!BF45=0,0,K46*s!BB45*s!BG45/(s!BB45*s!BG45+s!BC45*s!BF45))+IF(s!BC45*s!BI45+s!BE45*s!BG45=0,0,O46*s!BE45*s!BG45/(s!BC45*s!BI45+s!BE45*s!BG45))+IF(s!BF45*s!BI45+s!BG45*s!BH45=0,0,W46*s!BG45*s!BH45/(s!BF45*s!BI45+s!BG45*s!BH45))+IF(s!BB45*s!BI45+s!BC45*s!BH45+s!BD45*s!BG45+s!BE45*s!BF45=0,0,N46*s!BD45*s!BG45/(s!BB45*s!BI45+s!BC45*s!BH45+s!BD45*s!BG45+s!BE45*s!BF45)) -> 15.70468693730391 | BH46: =AQ46+IF(s!BB45*s!BH45+s!BD45*s!BF45=0,0,M46*s!BB45*s!BH45/(s!BB45*s!BH45+s!BD45*s!BF45))+IF(s!BD45*s!BI45+s!BE45*s!BH45=0,0,Q46*s!BE45*s!BH45/(s!BD45*s!BI45+s!BE45*s!BH45))+IF(s!BF45*s!BI45+s!BG45*s!BH45=0,0,W46*s!BG45*s!BH45/(s!BF45*s!BI45+s!BG45*s!BH45))+IF(s!BB45*s!BI45+s!BC45*s!BH45+s!BD45*s!BG45+s!BE45*s!BF45=0,0,N46*s!BC45*s!BH45/(s!BB45*s!BI45+s!BC45*s!BH45+s!BD45*s!BG45+s!BE45*s!BF45)) -> 17.971713649700625 | BI46: =AR46+IF(s!BC45*s!BI45+s!BE45*s!BG45=0,0,O46*s!BC45*s!BI45/(s!BC45*s!BI45+s!BE45*s!BG45))+IF(s!BD45*s!BI45+s!BE45*s!BH45=0,0,Q46*s!BD45*s!BI45/(s!BD45*s!BI45+s!BE45*s!BH45))+IF(s!BF45*s!BI45+s!BG45*s!BH45=0,0,W46*s!BF45*s!BI45/(s!BF45*s!BI45+s!BG45*s!BH45))+IF(s!BB45*s!BI45+s!BC45*s!BH45+s!BD45*s!BG45+s!BE45*s!BF45=0,0,N46*s!BB45*s!BI45/(s!BB45*s!BI45+s!BC45*s!BH45+s!BD45*s!BG45+s!BE45*s!BF45)) -> 20.181638899092757 | BJ46: =SUM(BB46:BI46) -> 326
A47: =A46 -> 100 | B47: =B46 -> 1 | C47: =C46 -> 1 | D47: =D46 -> 2 | E47: =E46 -> 5 | F47: =F46 -> 2 | G47: =G46 -> 1 | H47: =H46 -> 2 | I47: =I46 -> 1 | J47: =J46 -> 2 | K47: =K46 -> 4 | L47: =L46 -> 2 | M47: =M46 -> 4 | N47: =N46 -> 8 | O47: =O46 -> 4 | P47: =P46 -> 2 | Q47: =Q46 -> 4 | R47: =R46 -> 2 | S47: =S46 -> 1 | T47: =T46 -> 2 | U47: =U46 -> 1 | V47: =V46 -> 2 | W47: =W46 -> 4 | X47: =X46 -> 2 | Y47: =Y46 -> 1 | Z47: =Z46 -> 2 | AA47: =AA46 -> 1 | AB47: =AB46 -> 163 | AK47: =AK46 -> 205 | AL47: =AL46 -> 7 | AM47: =AM46 -> 8 | AN47: =AN46 -> 8 | AO47: =AO46 -> 8 | AP47: =AP46 -> 8 | AQ47: =AQ46 -> 8 | AR47: =AR46 -> 8 | AS47: =AS46 -> 260 | BB47: =AK47+IF(s!BB46*s!BE46+s!BC46*s!BD46=0,0,E47*s!BB46*s!BE46/(s!BB46*s!BE46+s!BC46*s!BD46)+IF(s!BB46*s!BG46+s!BC46*s!BF46=0,0,K47*s!BB46*s!BG46/(s!BB46*s!BG46+s!BC46*s!BF46))+IF(s!BB46*s!BH46+s!BD46*s!BF46=0,0,M47*s!BB46*s!BH46/(s!BB46*s!BH46+s!BD46*s!BF46))+IF(s!BB46*s!BI46+s!BC46*s!BH46+s!BD46*s!BG46+s!BE46*s!BF46=0,0,N47*s!BB46*s!BI46/(s!BB46*s!BI46+s!BC46*s!BH46+s!BD46*s!BG46+s!BE46*s!BF46)
)) -> 223.76658481150085 | BC47: =AL47+IF(s!BC46*s!BD46+s!BB46*s!BE46=0,0,E47*s!BC46*s!BD46/(s!BC46*s!BD46+s!BB46*s!BE46))+IF(s!BB46*s!BG46+s!BC46*s!BF46=0,0,K47*s!BC46*s!BF46/(s!BB46*s!BG46+s!BC46*s!BF46))+IF(s!BC46*s!BI46+s!BE46*s!BG46=0,0,O47*s!BC46*s!BI46/(s!BC46*s!BI46+s!BE46*s!BG46))+IF(s!BB46*s!BI46+s!BC46*s!BH46+s!BD46*s!BG46+s!BE46*s!BF46=0,0,N47*s!BC46*s!BH46/(s!BB46*s!BI46+s!BC46*s!BH46+s!BD46*s!BG46+s!BE46*s!BF46)) -> 11.386767606202302 | BD47: =AM47+IF(s!BC46*s!BD46+s!BB46*s!BE46=0,0,E47*s!BC46*s!BD46/(s!BC46*s!BD46+s!BB46*s!BE46))+IF(s!BD46*s!BF46+s!BB46*s!BH46=0,0,M47*s!BD46*s!BF46/(s!BD46*s!BF46+s!BB46*s!BH46))+IF(s!BD46*s!BI46+s!BE46*s!BH46=0,0,Q47*s!BD46*s!BI46/(s!BD46*s!BI46+s!BE46*s!BH46))+IF(s!BB46*s!BI46+s!BC46*s!BH46+s!BD46*s!BG46+s!BE46*s!BF46=0,0,N47*s!BD46*s!BG46/(s!BB46*s!BI46+s!BC46*s!BH46+s!BD46*s!BG46+s!BE46*s!BF46)) -> 10.11974078981031 | BE47: =AN47+IF(s!BB46*s!BE46+s!BC46*s!BD46=0,0,E47*s!BB46*s!BE46/(s!BB46*s!BE46+s!BC46*s!BD46))+IF(s!BC46*s!BI46+s!BE46*s!BG46=0,0,O47*s!BE46*s!BG46/(s!BC46*s!BI46+s!BE46*s!BG46))+IF(s!BD46*s!BI46+s!BE46*s!BH46=0,0,Q47*s!BE46*s!BH46/(s!BD46*s!BI46+s!BE46*s!BH46))+IF(s!BB46*s!BI46+s!BC46*s!BH46+s!BD46*s!BG46+s!BE46*s!BF46=0,0,N47*s!BE46*s!BF46/(s!BB46*s!BI46+s!BC46*s!BH46+s!BD46*s!BG46+s!BE46*s!BF46)) -> 16.726906792486538 | BF47: =AO47+IF(s!BB46*s!BG46+s!BC46*s!BF46=0,0,K47*s!BC46*s!BF46/(s!BB46*s!BG46+s!BC46*s!BF46))+IF(s!BD46*s!BF46+s!BB46*s!BH46=0,0,M47*s!BD46*s!BF46/(s!BD46*s!BF46+s!BB46*s!BH46))+IF(s!BF46*s!BI46+s!BG46*s!BH46=0,0,W47*s!BF46*s!BI46/(s!BF46*s!BI46+s!BG46*s!BH46))+IF(s!BB46*s!BI46+s!BC46*s!BH46+s!BD46*s!BG46+s!BE46*s!BF46=0,0,N47*s!BE46*s!BF46/(s!BB46*s!BI46+s!BC46*s!BH46+s!BD46*s!BG46+s!BE46*s!BF46)) -> 10.141960334956096 | BG47: =AP47+IF(s!BB46*s!BG46+s!BC46*s!BF46=0,0,K47*s!BB46*s!BG46/(s!BB46*s!BG46+s!BC46*s!BF46))+IF(s!BC46*s!BI46+s!BE46*s!BG46=0,0,O47*s!BE46*s!BG46/(s!BC46*s!BI46+s!BE46*s!BG46))+IF(s!BF46*s!BI46+s!BG46*s!BH46=0,0,W47*s!BG46*s!BH46/(s!BF46*s!BI46+s!BG46*s!BH46))+IF(s!BB46*s!BI46+s!BC46*s!BH46+s!BD46*s!BG46+s!BE46*s!BF46=0,0,N47*s!BD46*s!BG46/(s!BB46*s!BI46+s!BC46*s!BH46+s!BD46*s!BG46+s!BE46*s!BF46)) -> 15.704687247340754 | BH47: =AQ47+IF(s!BB46*s!BH46+s!BD46*s!BF46=0,0,M47*s!BB46*s!BH46/(s!BB46*s!BH46+s!BD46*s!BF46))+IF(s!BD46*s!BI46+s!BE46*s!BH46=0,0,Q47*s!BE46*s!BH46/(s!BD46*s!BI46+s!BE46*s!BH46))+IF(s!BF46*s!BI46+s!BG46*s!BH46=0,0,W47*s!BG46*s!BH46/(s!BF46*s!BI46+s!BG46*s!BH46))+IF(s!BB46*s!BI46+s!BC46*s!BH46+s!BD46*s!BG46+s!BE46*s!BF46=0,0,N47*s!BC46*s!BH46/(s!BB46*s!BI46+s!BC46*s!BH46+s!BD46*s!BG46+s!BE46*s!BF46)) -> 17.971714063732744 | BI47: =AR47+IF(s!BC46*s!BI46+s!BE46*s!BG46=0,0,O47*s!BC46*s!BI46/(s!BC46*s!BI46+s!BE46*s!BG46))+IF(s!BD46*s!BI46+s!BE46*s!BH46=0,0,Q47*s!BD46*s!BI46/(s!BD46*s!BI46+s!BE46*s!BH46))+IF(s!BF46*s!BI46+s!BG46*s!BH46=0,0,W47*s!BF46*s!BI46/(s!BF46*s!BI46+s!BG46*s!BH46))+IF(s!BB46*s!BI46+s!BC46*s!BH46+s!BD46*s!BG46+s!BE46*s!BF46=0,0,N47*s!BB46*s!BI46/(s!BB46*s!BI46+s!BC46*s!BH46+s!BD46*s!BG46+s!BE46*s!BF46)) -> 20.181638353970406 | BJ47: =SUM(BB47:BI47) -> 326
A48: =A47 -> 100 | B48: =B47 -> 1 | C48: =C47 -> 1 | D48: =D47 -> 2 | E48: =E47 -> 5 | F48: =F47 -> 2 | G48: =G47 -> 1 | H48: =H47 -> 2 | I48: =I47 -> 1 | J48: =J47 -> 2 | K48: =K47 -> 4 | L48: =L47 -> 2 | M48: =M47 -> 4 | N48: =N47 -> 8 | O48: =O47 -> 4 | P48: =P47 -> 2 | Q48: =Q47 -> 4 | R48: =R47 -> 2 | S48: =S47 -> 1 | T48: =T47 -> 2 | U48: =U47 -> 1 | V48: =V47 -> 2 | W48: =W47 -> 4 | X48: =X47 -> 2 | Y48: =Y47 -> 1 | Z48: =Z47 -> 2 | AA48: =AA47 -> 1 | AB48: =AB47 -> 163 | AK48: =AK47 -> 205 | AL48: =AL47 -> 7 | AM48: =AM47 -> 8 | AN48: =AN47 -> 8 | AO48: =AO47 -> 8 | AP48: =AP47 -> 8 | AQ48: =AQ47 -> 8 | AR48: =AR47 -> 8 | AS48: =AS47 -> 260 | BB48: =AK48+IF(s!BB47*s!BE47+s!BC47*s!BD47=0,0,E48*s!BB47*s!BE47/(s!BB47*s!BE47+s!BC47*s!BD47)+IF(s!BB47*s!BG47+s!BC47*s!BF47=0,0,K48*s!BB47*s!BG47/(s!BB47*s!BG47+s!BC47*s!BF47))+IF(s!BB47*s!BH47+s!BD47*s!BF47=0,0,M48*s!BB47*s!BH47/(s!BB47*s!BH47+s!BD47*s!BF47))+IF(s!BB47*s!BI47+s!BC47*s!BH47+s!BD47*s!BG47+s!BE47*s!BF47=0,0,N48*s!BB47*s!BI47/(s!BB47*s!BI47+s!BC47*s!BH47+s!BD47*s!BG47+s!BE47*s!BF47)
)) -> 223.76658477199626 | BC48: =AL48+IF(s!BC47*s!BD47+s!BB47*s!BE47=0,0,E48*s!BC47*s!BD47/(s!BC47*s!BD47+s!BB47*s!BE47))+IF(s!BB47*s!BG47+s!BC47*s!BF47=0,0,K48*s!BC47*s!BF47/(s!BB47*s!BG47+s!BC47*s!BF47))+IF(s!BC47*s!BI47+s!BE47*s!BG47=0,0,O48*s!BC47*s!BI47/(s!BC47*s!BI47+s!BE47*s!BG47))+IF(s!BB47*s!BI47+s!BC47*s!BH47+s!BD47*s!BG47+s!BE47*s!BF47=0,0,N48*s!BC47*s!BH47/(s!BB47*s!BI47+s!BC47*s!BH47+s!BD47*s!BG47+s!BE47*s!BF47)) -> 11.386767551914684 | BD48: =AM48+IF(s!BC47*s!BD47+s!BB47*s!BE47=0,0,E48*s!BC47*s!BD47/(s!BC47*s!BD47+s!BB47*s!BE47))+IF(s!BD47*s!BF47+s!BB47*s!BH47=0,0,M48*s!BD47*s!BF47/(s!BD47*s!BF47+s!BB47*s!BH47))+IF(s!BD47*s!BI47+s!BE47*s!BH47=0,0,Q48*s!BD47*s!BI47/(s!BD47*s!BI47+s!BE47*s!BH47))+IF(s!BB47*s!BI47+s!BC47*s!BH47+s!BD47*s!BG47+s!BE47*s!BF47=0,0,N48*s!BD47*s!BG47/(s!BB47*s!BI47+s!BC47*s!BH47+s!BD47*s!BG47+s!BE47*s!BF47)) -> 10.119740661092079 | BE48: =AN48+IF(s!BB47*s!BE47+s!BC47*s!BD47=0,0,E48*s!BB47*s!BE47/(s!BB47*s!BE47+s!BC47*s!BD47))+IF(s!BC47*s!BI47+s!BE47*s!BG47=0,0,O48*s!BE47*s!BG47/(s!BC47*s!BI47+s!BE47*s!BG47))+IF(s!BD47*s!BI47+s!BE47*s!BH47=0,0,Q48*s!BE47*s!BH47/(s!BD47*s!BI47+s!BE47*s!BH47))+IF(s!BB47*s!BI47+s!BC47*s!BH47+s!BD47*s!BG47+s!BE47*s!BF47=0,0,N48*s!BE47*s!BF47/(s!BB47*s!BI47+s!BC47*s!BH47+s!BD47*s!BG47+s!BE47*s!BF47)) -> 16.726907014996975 | BF48: =AO48+IF(s!BB47*s!BG47+s!BC47*s!BF47=0,0,K48*s!BC47*s!BF47/(s!BB47*s!BG47+s!BC47*s!BF47))+IF(s!BD47*s!BF47+s!BB47*s!BH47=0,0,M48*s!BD47*s!BF47/(s!BD47*s!BF47+s!BB47*s!BH47))+IF(s!BF47*s!BI47+s!BG47*s!BH47=0,0,W48*s!BF47*s!BI47/(s!BF47*s!BI47+s!BG47*s!BH47))+IF(s!BB47*s!BI47+s!BC47*s!BH47+s!BD47*s!BG47+s!BE47*s!BF47=0,0,N48*s!BE47*s!BF47/(s!BB47*s!BI47+s!BC47*s!BH47+s!BD47*s!BG47+s!BE47*s!BF47)) -> 10.141960206908616 | BG48: =AP48+IF(s!BB47*s!BG47+s!BC47*s!BF47=0,0,K48*s!BB47*s!BG47/(s!BB47*s!BG47+s!BC47*s!BF47))+IF(s!BC47*s!BI47+s!BE47*s!BG47=0,0,O48*s!BE47*s!BG47/(s!BC47*s!BI47+s!BE47*s!BG47))+IF(s!BF47*s!BI47+s!BG47*s!BH47=0,0,W48*s!BG47*s!BH47/(s!BF47*s!BI47+s!BG47*s!BH47))+IF(s!BB47*s!BI47+s!BC47*s!BH47+s!BD47*s!BG47+s!BE47*s!BF47=0,0,N48*s!BD47*s!BG47/(s!BB47*s!BI47+s!BC47*s!BH47+s!BD47*s!BG47+s!BE47*s!BF47)) -> 15.704687469180438 | BH48: =AQ48+IF(s!BB47*s!BH47+s!BD47*s!BF47=0,0,M48*s!BB47*s!BH47/(s!BB47*s!BH47+s!BD47*s!BF47))+IF(s!BD47*s!BI47+s!BE47*s!BH47=0,0,Q48*s!BE47*s!BH47/(s!BD47*s!BI47+s!BE47*s!BH47))+IF(s!BF47*s!BI47+s!BG47*s!BH47=0,0,W48*s!BG47*s!BH47/(s!BF47*s!BI47+s!BG47*s!BH47))+IF(s!BB47*s!BI47+s!BC47*s!BH47+s!BD47*s!BG47+s!BE47*s!BF47=0,0,N48*s!BC47*s!BH47/(s!BB47*s!BI47+s!BC47*s!BH47+s!BD47*s!BG47+s!BE47*s!BF47)) -> 17.971714360003041 | BI48: =AR48+IF(s!BC47*s!BI47+s!BE47*s!BG47=0,0,O48*s!BC47*s!BI47/(s!BC47*s!BI47+s!BE47*s!BG47))+IF(s!BD47*s!BI47+s!BE47*s!BH47=0,0,Q48*s!BD47*s!BI47/(s!BD47*s!BI47+s!BE47*s!BH47))+IF(s!BF47*s!BI47+s!BG47*s!BH47=0,0,W48*s!BF47*s!BI47/(s!BF47*s!BI47+s!BG47*s!BH47))+IF(s!BB47*s!BI47+s!BC47*s!BH47+s!BD47*s!BG47+s!BE47*s!BF47=0,0,N48*s!BB47*s!BI47/(s!BB47*s!BI47+s!BC47*s!BH47+s!BD47*s!BG47+s!BE47*s!BF47)) -> 20.181637963907903 | BJ48: =SUM(BB48:BI48) -> 326
A49: =A48 -> 100 | B49: =B48 -> 1 | C49: =C48 -> 1 | D49: =D48 -> 2 | E49: =E48 -> 5 | F49: =F48 -> 2 | G49: =G48 -> 1 | H49: =H48 -> 2 | I49: =I48 -> 1 | J49: =J48 -> 2 | K49: =K48 -> 4 | L49: =L48 -> 2 | M49: =M48 -> 4 | N49: =N48 -> 8 | O49: =O48 -> 4 | P49: =P48 -> 2 | Q49: =Q48 -> 4 | R49: =R48 -> 2 | S49: =S48 -> 1 | T49: =T48 -> 2 | U49: =U48 -> 1 | V49: =V48 -> 2 | W49: =W48 -> 4 | X49: =X48 -> 2 | Y49: =Y48 -> 1 | Z49: =Z48 -> 2 | AA49: =AA48 -> 1 | AB49: =AB48 -> 163 | AK49: =AK48 -> 205 | AL49: =AL48 -> 7 | AM49: =AM48 -> 8 | AN49: =AN48 -> 8 | AO49: =AO48 -> 8 | AP49: =AP48 -> 8 | AQ49: =AQ48 -> 8 | AR49: =AR48 -> 8 | AS49: =AS48 -> 260 | BB49: =AK49+IF(s!BB48*s!BE48+s!BC48*s!BD48=0,0,E49*s!BB48*s!BE48/(s!BB48*s!BE48+s!BC48*s!BD48)+IF(s!BB48*s!BG48+s!BC48*s!BF48=0,0,K49*s!BB48*s!BG48/(s!BB48*s!BG48+s!BC48*s!BF48))+IF(s!BB48*s!BH48+s!BD48*s!BF48=0,0,M49*s!BB48*s!BH48/(s!BB48*s!BH48+s!BD48*s!BF48))+IF(s!BB48*s!BI48+s!BC48*s!BH48+s!BD48*s!BG48+s!BE48*s!BF48=0,0,N49*s!BB48*s!BI48/(s!BB48*s!BI48+s!BC48*s!BH48+s!BD48*s!BG48+s!BE48*s!BF48)
)) -> 223.76658474372397 | BC49: =AL49+IF(s!BC48*s!BD48+s!BB48*s!BE48=0,0,E49*s!BC48*s!BD48/(s!BC48*s!BD48+s!BB48*s!BE48))+IF(s!BB48*s!BG48+s!BC48*s!BF48=0,0,K49*s!BC48*s!BF48/(s!BB48*s!BG48+s!BC48*s!BF48))+IF(s!BC48*s!BI48+s!BE48*s!BG48=0,0,O49*s!BC48*s!BI48/(s!BC48*s!BI48+s!BE48*s!BG48))+IF(s!BB48*s!BI48+s!BC48*s!BH48+s!BD48*s!BG48+s!BE48*s!BF48=0,0,N49*s!BC48*s!BH48/(s!BB48*s!BI48+s!BC48*s!BH48+s!BD48*s!BG48+s!BE48*s!BF48)) -> 11.386767513081155 | BD49: =AM49+IF(s!BC48*s!BD48+s!BB48*s!BE48=0,0,E49*s!BC48*s!BD48/(s!BC48*s!BD48+s!BB48*s!BE48))+IF(s!BD48*s!BF48+s!BB48*s!BH48=0,0,M49*s!BD48*s!BF48/(s!BD48*s!BF48+s!BB48*s!BH48))+IF(s!BD48*s!BI48+s!BE48*s!BH48=0,0,Q49*s!BD48*s!BI48/(s!BD48*s!BI48+s!BE48*s!BH48))+IF(s!BB48*s!BI48+s!BC48*s!BH48+s!BD48*s!BG48+s!BE48*s!BF48=0,0,N49*s!BD48*s!BG48/(s!BB48*s!BI48+s!BC48*s!BH48+s!BD48*s!BG48+s!BE48*s!BF48)) -> 10.119740568989997 | BE49: =AN49+IF(s!BB48*s!BE48+s!BC48*s!BD48=0,0,E49*s!BB48*s!BE48/(s!BB48*s!BE48+s!BC48*s!BD48))+IF(s!BC48*s!BI48+s!BE48*s!BG48=0,0,O49*s!BE48*s!BG48/(s!BC48*s!BI48+s!BE48*s!BG48))+IF(s!BD48*s!BI48+s!BE48*s!BH48=0,0,Q49*s!BE48*s!BH48/(s!BD48*s!BI48+s!BE48*s!BH48))+IF(s!BB48*s!BI48+s!BC48*s!BH48+s!BD48*s!BG48+s!BE48*s!BF48=0,0,N49*s!BE48*s!BF48/(s!BB48*s!BI48+s!BC48*s!BH48+s!BD48*s!BG48+s!BE48*s!BF48)) -> 16.726907174204882 | BF49: =AO49+IF(s!BB48*s!BG48+s!BC48*s!BF48=0,0,K49*s!BC48*s!BF48/(s!BB48*s!BG48+s!BC48*s!BF48))+IF(s!BD48*s!BF48+s!BB48*s!BH48=0,0,M49*s!BD48*s!BF48/(s!BD48*s!BF48+s!BB48*s!BH48))+IF(s!BF48*s!BI48+s!BG48*s!BH48=0,0,W49*s!BF48*s!BI48/(s!BF48*s!BI48+s!BG48*s!BH48))+IF(s!BB48*s!BI48+s!BC48*s!BH48+s!BD48*s!BG48+s!BE48*s!BF48=0,0,N49*s!BE48*s!BF48/(s!BB48*s!BI48+s!BC48*s!BH48+s!BD48*s!BG48+s!BE48*s!BF48)) -> 10.141960115284387 | BG49: =AP49+IF(s!BB48*s!BG48+s!BC48*s!BF48=0,0,K49*s!BB48*s!BG48/(s!BB48*s!BG48+s!BC48*s!BF48))+IF(s!BC48*s!BI48+s!BE48*s!BG48=0,0,O49*s!BE48*s!BG48/(s!BC48*s!BI48+s!BE48*s!BG48))+IF(s!BF48*s!BI48+s!BG48*s!BH48=0,0,W49*s!BG48*s!BH48/(s!BF48*s!BI48+s!BG48*s!BH48))+IF(s!BB48*s!BI48+s!BC48*s!BH48+s!BD48*s!BG48+s!BE48*s!BF48=0,0,N49*s!BD48*s!BG48/(s!BB48*s!BI48+s!BC48*s!BH48+s!BD48*s!BG48+s!BE48*s!BF48)) -> 15.704687627910497 | BH49: =AQ49+IF(s!BB48*s!BH48+s!BD48*s!BF48=0,0,M49*s!BB48*s!BH48/(s!BB48*s!BH48+s!BD48*s!BF48))+IF(s!BD48*s!BI48+s!BE48*s!BH48=0,0,Q49*s!BE48*s!BH48/(s!BD48*s!BI48+s!BE48*s!BH48))+IF(s!BF48*s!BI48+s!BG48*s!BH48=0,0,W49*s!BG48*s!BH48/(s!BF48*s!BI48+s!BG48*s!BH48))+IF(s!BB48*s!BI48+s!BC48*s!BH48+s!BD48*s!BG48+s!BE48*s!BF48=0,0,N49*s!BC48*s!BH48/(s!BB48*s!BI48+s!BC48*s!BH48+s!BD48*s!BG48+s!BE48*s!BF48)) -> 17.971714572001659 | BI49: =AR49+IF(s!BC48*s!BI48+s!BE48*s!BG48=0,0,O49*s!BC48*s!BI48/(s!BC48*s!BI48+s!BE48*s!BG48))+IF(s!BD48*s!BI48+s!BE48*s!BH48=0,0,Q49*s!BD48*s!BI48/(s!BD48*s!BI48+s!BE48*s!BH48))+IF(s!BF48*s!BI48+s!BG48*s!BH48=0,0,W49*s!BF48*s!BI48/(s!BF48*s!BI48+s!BG48*s!BH48))+IF(s!BB48*s!BI48+s!BC48*s!BH48+s!BD48*s!BG48+s!BE48*s!BF48=0,0,N49*s!BB48*s!BI48/(s!BB48*s!BI48+s!BC48*s!BH48+s!BD48*s!BG48+s!BE48*s!BF48)) -> 20.181637684803462 | BJ49: =SUM(BB49:BI49) -> 326
A50: =A49 -> 100 | B50: =B49 -> 1 | C50: =C49 -> 1 | D50: =D49 -> 2 | E50: =E49 -> 5 | F50: =F49 -> 2 | G50: =G49 -> 1 | H50: =H49 -> 2 | I50: =I49 -> 1 | J50: =J49 -> 2 | K50: =K49 -> 4 | L50: =L49 -> 2 | M50: =M49 -> 4 | N50: =N49 -> 8 | O50: =O49 -> 4 | P50: =P49 -> 2 | Q50: =Q49 -> 4 | R50: =R49 -> 2 | S50: =S49 -> 1 | T50: =T49 -> 2 | U50: =U49 -> 1 | V50: =V49 -> 2 | W50: =W49 -> 4 | X50: =X49 -> 2 | Y50: =Y49 -> 1 | Z50: =Z49 -> 2 | AA50: =AA49 -> 1 | AB50: =AB49 -> 163 | AK50: =AK49 -> 205 | AL50: =AL49 -> 7 | AM50: =AM49 -> 8 | AN50: =AN49 -> 8 | AO50: =AO49 -> 8 | AP50: =AP49 -> 8 | AQ50: =AQ49 -> 8 | AR50: =AR49 -> 8 | AS50: =AS49 -> 260 | BB50: =AK50+IF(s!BB49*s!BE49+s!BC49*s!BD49=0,0,E50*s!BB49*s!BE49/(s!BB49*s!BE49+s!BC49*s!BD49)+IF(s!BB49*s!BG49+s!BC49*s!BF49=0,0,K50*s!BB49*s!BG49/(s!BB49*s!BG49+s!BC49*s!BF49))+IF(s!BB49*s!BH49+s!BD49*s!BF49=0,0,M50*s!BB49*s!BH49/(s!BB49*s!BH49+s!BD49*s!BF49))+IF(s!BB49*s!BI49+s!BC49*s!BH49+s!BD49*s!BG49+s!BE49*s!BF49=0,0,N50*s!BB49*s!BI49/(s!BB49*s!BI49+s!BC49*s!BH49+s!BD49*s!BG49+s!BE49*s!BF49)
)) -> 223.76658472349112 | BC50: =AL50+IF(s!BC49*s!BD49+s!BB49*s!BE49=0,0,E50*s!BC49*s!BD49/(s!BC49*s!BD49+s!BB49*s!BE49))+IF(s!BB49*s!BG49+s!BC49*s!BF49=0,0,K50*s!BC49*s!BF49/(s!BB49*s!BG49+s!BC49*s!BF49))+IF(s!BC49*s!BI49+s!BE49*s!BG49=0,0,O50*s!BC49*s!BI49/(s!BC49*s!BI49+s!BE49*s!BG49))+IF(s!BB49*s!BI49+s!BC49*s!BH49+s!BD49*s!BG49+s!BE49*s!BF49=0,0,N50*s!BC49*s!BH49/(s!BB49*s!BI49+s!BC49*s!BH49+s!BD49*s!BG49+s!BE49*s!BF49)) -> 11.386767485301828 | BD50: =AM50+IF(s!BC49*s!BD49+s!BB49*s!BE49=0,0,E50*s!BC49*s!BD49/(s!BC49*s!BD49+s!BB49*s!BE49))+IF(s!BD49*s!BF49+s!BB49*s!BH49=0,0,M50*s!BD49*s!BF49/(s!BD49*s!BF49+s!BB49*s!BH49))+IF(s!BD49*s!BI49+s!BE49*s!BH49=0,0,Q50*s!BD49*s!BI49/(s!BD49*s!BI49+s!BE49*s!BH49))+IF(s!BB49*s!BI49+s!BC49*s!BH49+s!BD49*s!BG49+s!BE49*s!BF49=0,0,N50*s!BD49*s!BG49/(s!BB49*s!BI49+s!BC49*s!BH49+s!BD49*s!BG49+s!BE49*s!BF49)) -> 10.119740503088842 | BE50: =AN50+IF(s!BB49*s!BE49+s!BC49*s!BD49=0,0,E50*s!BB49*s!BE49/(s!BB49*s!BE49+s!BC49*s!BD49))+IF(s!BC49*s!BI49+s!BE49*s!BG49=0,0,O50*s!BE49*s!BG49/(s!BC49*s!BI49+s!BE49*s!BG49))+IF(s!BD49*s!BI49+s!BE49*s!BH49=0,0,Q50*s!BE49*s!BH49/(s!BD49*s!BI49+s!BE49*s!BH49))+IF(s!BB49*s!BI49+s!BC49*s!BH49+s!BD49*s!BG49+s!BE49*s!BF49=0,0,N50*s!BE49*s!BF49/(s!BB49*s!BI49+s!BC49*s!BH49+s!BD49*s!BG49+s!BE49*s!BF49)) -> 16.726907288118198 | BF50: =AO50+IF(s!BB49*s!BG49+s!BC49*s!BF49=0,0,K50*s!BC49*s!BF49/(s!BB49*s!BG49+s!BC49*s!BF49))+IF(s!BD49*s!BF49+s!BB49*s!BH49=0,0,M50*s!BD49*s!BF49/(s!BD49*s!BF49+s!BB49*s!BH49))+IF(s!BF49*s!BI49+s!BG49*s!BH49=0,0,W50*s!BF49*s!BI49/(s!BF49*s!BI49+s!BG49*s!BH49))+IF(s!BB49*s!BI49+s!BC49*s!BH49+s!BD49*s!BG49+s!BE49*s!BF49=0,0,N50*s!BE49*s!BF49/(s!BB49*s!BI49+s!BC49*s!BH49+s!BD49*s!BG49+s!BE49*s!BF49)) -> 10.141960049723874 | BG50: =AP50+IF(s!BB49*s!BG49+s!BC49*s!BF49=0,0,K50*s!BB49*s!BG49/(s!BB49*s!BG49+s!BC49*s!BF49))+IF(s!BC49*s!BI49+s!BE49*s!BG49=0,0,O50*s!BE49*s!BG49/(s!BC49*s!BI49+s!BE49*s!BG49))+IF(s!BF49*s!BI49+s!BG49*s!BH49=0,0,W50*s!BG49*s!BH49/(s!BF49*s!BI49+s!BG49*s!BH49))+IF(s!BB49*s!BI49+s!BC49*s!BH49+s!BD49*s!BG49+s!BE49*s!BF49=0,0,N50*s!BD49*s!BG49/(s!BB49*s!BI49+s!BC49*s!BH49+s!BD49*s!BG49+s!BE49*s!BF49)) -> 15.704687741483164 | BH50: =AQ50+IF(s!BB49*s!BH49+s!BD49*s!BF49=0,0,M50*s!BB49*s!BH49/(s!BB49*s!BH49+s!BD49*s!BF49))+IF(s!BD49*s!BI49+s!BE49*s!BH49=0,0,Q50*s!BE49*s!BH49/(s!BD49*s!BI49+s!BE49*s!BH49))+IF(s!BF49*s!BI49+s!BG49*s!BH49=0,0,W50*s!BG49*s!BH49/(s!BF49*s!BI49+s!BG49*s!BH49))+IF(s!BB49*s!BI49+s!BC49*s!BH49+s!BD49*s!BG49+s!BE49*s!BF49=0,0,N50*s!BC49*s!BH49/(s!BB49*s!BI49+s!BC49*s!BH49+s!BD49*s!BG49+s!BE49*s!BF49)) -> 17.971714723696152 | BI50: =AR50+IF(s!BC49*s!BI49+s!BE49*s!BG49=0,0,O50*s!BC49*s!BI49/(s!BC49*s!BI49+s!BE49*s!BG49))+IF(s!BD49*s!BI49+s!BE49*s!BH49=0,0,Q50*s!BD49*s!BI49/(s!BD49*s!BI49+s!BE49*s!BH49))+IF(s!BF49*s!BI49+s!BG49*s!BH49=0,0,W50*s!BF49*s!BI49/(s!BF49*s!BI49+s!BG49*s!BH49))+IF(s!BB49*s!BI49+s!BC49*s!BH49+s!BD49*s!BG49+s!BE49*s!BF49=0,0,N50*s!BB49*s!BI49/(s!BB49*s!BI49+s!BC49*s!BH49+s!BD49*s!BG49+s!BE49*s!BF49)) -> 20.181637485096807 | BJ50: =SUM(BB50:BI50) -> 326
A51: =A50 -> 100 | B51: =B50 -> 1 | C51: =C50 -> 1 | D51: =D50 -> 2 | E51: =E50 -> 5 | F51: =F50 -> 2 | G51: =G50 -> 1 | H51: =H50 -> 2 | I51: =I50 -> 1 | J51: =J50 -> 2 | K51: =K50 -> 4 | L51: =L50 -> 2 | M51: =M50 -> 4 | N51: =N50 -> 8 | O51: =O50 -> 4 | P51: =P50 -> 2 | Q51: =Q50 -> 4 | R51: =R50 -> 2 | S51: =S50 -> 1 | T51: =T50 -> 2 | U51: =U50 -> 1 | V51: =V50 -> 2 | W51: =W50 -> 4 | X51: =X50 -> 2 | Y51: =Y50 -> 1 | Z51: =Z50 -> 2 | AA51: =AA50 -> 1 | AB51: =AB50 -> 163 | AK51: =AK50 -> 205 | AL51: =AL50 -> 7 | AM51: =AM50 -> 8 | AN51: =AN50 -> 8 | AO51: =AO50 -> 8 | AP51: =AP50 -> 8 | AQ51: =AQ50 -> 8 | AR51: =AR50 -> 8 | AS51: =AS50 -> 260 | BB51: =AK51+IF(s!BB50*s!BE50+s!BC50*s!BD50=0,0,E51*s!BB50*s!BE50/(s!BB50*s!BE50+s!BC50*s!BD50)+IF(s!BB50*s!BG50+s!BC50*s!BF50=0,0,K51*s!BB50*s!BG50/(s!BB50*s!BG50+s!BC50*s!BF50))+IF(s!BB50*s!BH50+s!BD50*s!BF50=0,0,M51*s!BB50*s!BH50/(s!BB50*s!BH50+s!BD50*s!BF50))+IF(s!BB50*s!BI50+s!BC50*s!BH50+s!BD50*s!BG50+s!BE50*s!BF50=0,0,N51*s!BB50*s!BI50/(s!BB50*s!BI50+s!BC50*s!BH50+s!BD50*s!BG50+s!BE50*s!BF50)
)) -> 223.76658470901219 | BC51: =AL51+IF(s!BC50*s!BD50+s!BB50*s!BE50=0,0,E51*s!BC50*s!BD50/(s!BC50*s!BD50+s!BB50*s!BE50))+IF(s!BB50*s!BG50+s!BC50*s!BF50=0,0,K51*s!BC50*s!BF50/(s!BB50*s!BG50+s!BC50*s!BF50))+IF(s!BC50*s!BI50+s!BE50*s!BG50=0,0,O51*s!BC50*s!BI50/(s!BC50*s!BI50+s!BE50*s!BG50))+IF(s!BB50*s!BI50+s!BC50*s!BH50+s!BD50*s!BG50+s!BE50*s!BF50=0,0,N51*s!BC50*s!BH50/(s!BB50*s!BI50+s!BC50*s!BH50+s!BD50*s!BG50+s!BE50*s!BF50)) -> 11.386767465429706 | BD51: =AM51+IF(s!BC50*s!BD50+s!BB50*s!BE50=0,0,E51*s!BC50*s!BD50/(s!BC50*s!BD50+s!BB50*s!BE50))+IF(s!BD50*s!BF50+s!BB50*s!BH50=0,0,M51*s!BD50*s!BF50/(s!BD50*s!BF50+s!BB50*s!BH50))+IF(s!BD50*s!BI50+s!BE50*s!BH50=0,0,Q51*s!BD50*s!BI50/(s!BD50*s!BI50+s!BE50*s!BH50))+IF(s!BB50*s!BI50+s!BC50*s!BH50+s!BD50*s!BG50+s!BE50*s!BF50=0,0,N51*s!BD50*s!BG50/(s!BB50*s!BI50+s!BC50*s!BH50+s!BD50*s!BG50+s!BE50*s!BF50)) -> 10.119740455935625 | BE51: =AN51+IF(s!BB50*s!BE50+s!BC50*s!BD50=0,0,E51*s!BB50*s!BE50/(s!BB50*s!BE50+s!BC50*s!BD50))+IF(s!BC50*s!BI50+s!BE50*s!BG50=0,0,O51*s!BE50*s!BG50/(s!BC50*s!BI50+s!BE50*s!BG50))+IF(s!BD50*s!BI50+s!BE50*s!BH50=0,0,Q51*s!BE50*s!BH50/(s!BD50*s!BI50+s!BE50*s!BH50))+IF(s!BB50*s!BI50+s!BC50*s!BH50+s!BD50*s!BG50+s!BE50*s!BF50=0,0,N51*s!BE50*s!BF50/(s!BB50*s!BI50+s!BC50*s!BH50+s!BD50*s!BG50+s!BE50*s!BF50)) -> 16.726907369622474 | BF51: =AO51+IF(s!BB50*s!BG50+s!BC50*s!BF50=0,0,K51*s!BC50*s!BF50/(s!BB50*s!BG50+s!BC50*s!BF50))+IF(s!BD50*s!BF50+s!BB50*s!BH50=0,0,M51*s!BD50*s!BF50/(s!BD50*s!BF50+s!BB50*s!BH50))+IF(s!BF50*s!BI50+s!BG50*s!BH50=0,0,W51*s!BF50*s!BI50/(s!BF50*s!BI50+s!BG50*s!BH50))+IF(s!BB50*s!BI50+s!BC50*s!BH50+s!BD50*s!BG50+s!BE50*s!BF50=0,0,N51*s!BE50*s!BF50/(s!BB50*s!BI50+s!BC50*s!BH50+s!BD50*s!BG50+s!BE50*s!BF50)) -> 10.141960002813619 | BG51: =AP51+IF(s!BB50*s!BG50+s!BC50*s!BF50=0,0,K51*s!BB50*s!BG50/(s!BB50*s!BG50+s!BC50*s!BF50))+IF(s!BC50*s!BI50+s!BE50*s!BG50=0,0,O51*s!BE50*s!BG50/(s!BC50*s!BI50+s!BE50*s!BG50))+IF(s!BF50*s!BI50+s!BG50*s!BH50=0,0,W51*s!BG50*s!BH50/(s!BF50*s!BI50+s!BG50*s!BH50))+IF(s!BB50*s!BI50+s!BC50*s!BH50+s!BD50*s!BG50+s!BE50*s!BF50=0,0,N51*s!BD50*s!BG50/(s!BB50*s!BI50+s!BC50*s!BH50+s!BD50*s!BG50+s!BE50*s!BF50)) -> 15.704687822744482 | BH51: =AQ51+IF(s!BB50*s!BH50+s!BD50*s!BF50=0,0,M51*s!BB50*s!BH50/(s!BB50*s!BH50+s!BD50*s!BF50))+IF(s!BD50*s!BI50+s!BE50*s!BH50=0,0,Q51*s!BE50*s!BH50/(s!BD50*s!BI50+s!BE50*s!BH50))+IF(s!BF50*s!BI50+s!BG50*s!BH50=0,0,W51*s!BG50*s!BH50/(s!BF50*s!BI50+s!BG50*s!BH50))+IF(s!BB50*s!BI50+s!BC50*s!BH50+s!BD50*s!BG50+s!BE50*s!BF50=0,0,N51*s!BC50*s!BH50/(s!BB50*s!BI50+s!BC50*s!BH50+s!BD50*s!BG50+s!BE50*s!BF50)) -> 17.971714832238561 | BI51: =AR51+IF(s!BC50*s!BI50+s!BE50*s!BG50=0,0,O51*s!BC50*s!BI50/(s!BC50*s!BI50+s!BE50*s!BG50))+IF(s!BD50*s!BI50+s!BE50*s!BH50=0,0,Q51*s!BD50*s!BI50/(s!BD50*s!BI50+s!BE50*s!BH50))+IF(s!BF50*s!BI50+s!BG50*s!BH50=0,0,W51*s!BF50*s!BI50/(s!BF50*s!BI50+s!BG50*s!BH50))+IF(s!BB50*s!BI50+s!BC50*s!BH50+s!BD50*s!BG50+s!BE50*s!BF50=0,0,N51*s!BB50*s!BI50/(s!BB50*s!BI50+s!BC50*s!BH50+s!BD50*s!BG50+s!BE50*s!BF50)) -> 20.181637342203338 | BJ51: =SUM(BB51:BI51) -> 326
A52: =A51 -> 100 | B52: =B51 -> 1 | C52: =C51 -> 1 | D52: =D51 -> 2 | E52: =E51 -> 5 | F52: =F51 -> 2 | G52: =G51 -> 1 | H52: =H51 -> 2 | I52: =I51 -> 1 | J52: =J51 -> 2 | K52: =K51 -> 4 | L52: =L51 -> 2 | M52: =M51 -> 4 | N52: =N51 -> 8 | O52: =O51 -> 4 | P52: =P51 -> 2 | Q52: =Q51 -> 4 | R52: =R51 -> 2 | S52: =S51 -> 1 | T52: =T51 -> 2 | U52: =U51 -> 1 | V52: =V51 -> 2 | W52: =W51 -> 4 | X52: =X51 -> 2 | Y52: =Y51 -> 1 | Z52: =Z51 -> 2 | AA52: =AA51 -> 1 | AB52: =AB51 -> 163 | AK52: =AK51 -> 205 | AL52: =AL51 -> 7 | AM52: =AM51 -> 8 | AN52: =AN51 -> 8 | AO52: =AO51 -> 8 | AP52: =AP51 -> 8 | AQ52: =AQ51 -> 8 | AR52: =AR51 -> 8 | AS52: =AS51 -> 260 | BB52: =AK52+IF(s!BB51*s!BE51+s!BC51*s!BD51=0,0,E52*s!BB51*s!BE51/(s!BB51*s!BE51+s!BC51*s!BD51)+IF(s!BB51*s!BG51+s!BC51*s!BF51=0,0,K52*s!BB51*s!BG51/(s!BB51*s!BG51+s!BC51*s!BF51))+IF(s!BB51*s!BH51+s!BD51*s!BF51=0,0,M52*s!BB51*s!BH51/(s!BB51*s!BH51+s!BD51*s!BF51))+IF(s!BB51*s!BI51+s!BC51*s!BH51+s!BD51*s!BG51+s!BE51*s!BF51=0,0,N52*s!BB51*s!BI51/(s!BB51*s!BI51+s!BC51*s!BH51+s!BD51*s!BG51+s!BE51*s!BF51)
)) -> 223.76658469865117 | BC52: =AL52+IF(s!BC51*s!BD51+s!BB51*s!BE51=0,0,E52*s!BC51*s!BD51/(s!BC51*s!BD51+s!BB51*s!BE51))+IF(s!BB51*s!BG51+s!BC51*s!BF51=0,0,K52*s!BC51*s!BF51/(s!BB51*s!BG51+s!BC51*s!BF51))+IF(s!BC51*s!BI51+s!BE51*s!BG51=0,0,O52*s!BC51*s!BI51/(s!BC51*s!BI51+s!BE51*s!BG51))+IF(s!BB51*s!BI51+s!BC51*s!BH51+s!BD51*s!BG51+s!BE51*s!BF51=0,0,N52*s!BC51*s!BH51/(s!BB51*s!BI51+s!BC51*s!BH51+s!BD51*s!BG51+s!BE51*s!BF51)) -> 11.386767451213835 | BD52: =AM52+IF(s!BC51*s!BD51+s!BB51*s!BE51=0,0,E52*s!BC51*s!BD51/(s!BC51*s!BD51+s!BB51*s!BE51))+IF(s!BD51*s!BF51+s!BB51*s!BH51=0,0,M52*s!BD51*s!BF51/(s!BD51*s!BF51+s!BB51*s!BH51))+IF(s!BD51*s!BI51+s!BE51*s!BH51=0,0,Q52*s!BD51*s!BI51/(s!BD51*s!BI51+s!BE51*s!BH51))+IF(s!BB51*s!BI51+s!BC51*s!BH51+s!BD51*s!BG51+s!BE51*s!BF51=0,0,N52*s!BD51*s!BG51/(s!BB51*s!BI51+s!BC51*s!BH51+s!BD51*s!BG51+s!BE51*s!BF51)) -> 10.119740422197188 | BE52: =AN52+IF(s!BB51*s!BE51+s!BC51*s!BD51=0,0,E52*s!BB51*s!BE51/(s!BB51*s!BE51+s!BC51*s!BD51))+IF(s!BC51*s!BI51+s!BE51*s!BG51=0,0,O52*s!BE51*s!BG51/(s!BC51*s!BI51+s!BE51*s!BG51))+IF(s!BD51*s!BI51+s!BE51*s!BH51=0,0,Q52*s!BE51*s!BH51/(s!BD51*s!BI51+s!BE51*s!BH51))+IF(s!BB51*s!BI51+s!BC51*s!BH51+s!BD51*s!BG51+s!BE51*s!BF51=0,0,N52*s!BE51*s!BF51/(s!BB51*s!BI51+s!BC51*s!BH51+s!BD51*s!BG51+s!BE51*s!BF51)) -> 16.726907427937814 | BF52: =AO52+IF(s!BB51*s!BG51+s!BC51*s!BF51=0,0,K52*s!BC51*s!BF51/(s!BB51*s!BG51+s!BC51*s!BF51))+IF(s!BD51*s!BF51+s!BB51*s!BH51=0,0,M52*s!BD51*s!BF51/(s!BD51*s!BF51+s!BB51*s!BH51))+IF(s!BF51*s!BI51+s!BG51*s!BH51=0,0,W52*s!BF51*s!BI51/(s!BF51*s!BI51+s!BG51*s!BH51))+IF(s!BB51*s!BI51+s!BC51*s!BH51+s!BD51*s!BG51+s!BE51*s!BF51=0,0,N52*s!BE51*s!BF51/(s!BB51*s!BI51+s!BC51*s!BH51+s!BD51*s!BG51+s!BE51*s!BF51)) -> 10.141959969248548 | BG52: =AP52+IF(s!BB51*s!BG51+s!BC51*s!BF51=0,0,K52*s!BB51*s!BG51/(s!BB51*s!BG51+s!BC51*s!BF51))+IF(s!BC51*s!BI51+s!BE51*s!BG51=0,0,O52*s!BE51*s!BG51/(s!BC51*s!BI51+s!BE51*s!BG51))+IF(s!BF51*s!BI51+s!BG51*s!BH51=0,0,W52*s!BG51*s!BH51/(s!BF51*s!BI51+s!BG51*s!BH51))+IF(s!BB51*s!BI51+s!BC51*s!BH51+s!BD51*s!BG51+s!BE51*s!BF51=0,0,N52*s!BD51*s!BG51/(s!BB51*s!BI51+s!BC51*s!BH51+s!BD51*s!BG51+s!BE51*s!BF51)) -> 15.704687880886457 | BH52: =AQ52+IF(s!BB51*s!BH51+s!BD51*s!BF51=0,0,M52*s!BB51*s!BH51/(s!BB51*s!BH51+s!BD51*s!BF51))+IF(s!BD51*s!BI51+s!BE51*s!BH51=0,0,Q52*s!BE51*s!BH51/(s!BD51*s!BI51+s!BE51*s!BH51))+IF(s!BF51*s!BI51+s!BG51*s!BH51=0,0,W52*s!BG51*s!BH51/(s!BF51*s!BI51+s!BG51*s!BH51))+IF(s!BB51*s!BI51+s!BC51*s!BH51+s!BD51*s!BG51+s!BE51*s!BF51=0,0,N52*s!BC51*s!BH51/(s!BB51*s!BI51+s!BC51*s!BH51+s!BD51*s!BG51+s!BE51*s!BF51)) -> 17.971714909903106 | BI52: =AR52+IF(s!BC51*s!BI51+s!BE51*s!BG51=0,0,O52*s!BC51*s!BI51/(s!BC51*s!BI51+s!BE51*s!BG51))+IF(s!BD51*s!BI51+s!BE51*s!BH51=0,0,Q52*s!BD51*s!BI51/(s!BD51*s!BI51+s!BE51*s!BH51))+IF(s!BF51*s!BI51+s!BG51*s!BH51=0,0,W52*s!BF51*s!BI51/(s!BF51*s!BI51+s!BG51*s!BH51))+IF(s!BB51*s!BI51+s!BC51*s!BH51+s!BD51*s!BG51+s!BE51*s!BF51=0,0,N52*s!BB51*s!BI51/(s!BB51*s!BI51+s!BC51*s!BH51+s!BD51*s!BG51+s!BE51*s!BF51)) -> 20.181637239961894 | BJ52: =SUM(BB52:BI52) -> 326
A53: =A52 -> 100 | B53: =B52 -> 1 | C53: =C52 -> 1 | D53: =D52 -> 2 | E53: =E52 -> 5 | F53: =F52 -> 2 | G53: =G52 -> 1 | H53: =H52 -> 2 | I53: =I52 -> 1 | J53: =J52 -> 2 | K53: =K52 -> 4 | L53: =L52 -> 2 | M53: =M52 -> 4 | N53: =N52 -> 8 | O53: =O52 -> 4 | P53: =P52 -> 2 | Q53: =Q52 -> 4 | R53: =R52 -> 2 | S53: =S52 -> 1 | T53: =T52 -> 2 | U53: =U52 -> 1 | V53: =V52 -> 2 | W53: =W52 -> 4 | X53: =X52 -> 2 | Y53: =Y52 -> 1 | Z53: =Z52 -> 2 | AA53: =AA52 -> 1 | AB53: =AB52 -> 163 | AK53: =AK52 -> 205 | AL53: =AL52 -> 7 | AM53: =AM52 -> 8 | AN53: =AN52 -> 8 | AO53: =AO52 -> 8 | AP53: =AP52 -> 8 | AQ53: =AQ52 -> 8 | AR53: =AR52 -> 8 | AS53: =AS52 -> 260 | BB53: =AK53+IF(s!BB52*s!BE52+s!BC52*s!BD52=0,0,E53*s!BB52*s!BE52/(s!BB52*s!BE52+s!BC52*s!BD52)+IF(s!BB52*s!BG52+s!BC52*s!BF52=0,0,K53*s!BB52*s!BG52/(s!BB52*s!BG52+s!BC52*s!BF52))+IF(s!BB52*s!BH52+s!BD52*s!BF52=0,0,M53*s!BB52*s!BH52/(s!BB52*s!BH52+s!BD52*s!BF52))+IF(s!BB52*s!BI52+s!BC52*s!BH52+s!BD52*s!BG52+s!BE52*s!BF52=0,0,N53*s!BB52*s!BI52/(s!BB52*s!BI52+s!BC52*s!BH52+s!BD52*s!BG52+s!BE52*s!BF52)
)) -> 223.76658469123709 | BC53: =AL53+IF(s!BC52*s!BD52+s!BB52*s!BE52=0,0,E53*s!BC52*s!BD52/(s!BC52*s!BD52+s!BB52*s!BE52))+IF(s!BB52*s!BG52+s!BC52*s!BF52=0,0,K53*s!BC52*s!BF52/(s!BB52*s!BG52+s!BC52*s!BF52))+IF(s!BC52*s!BI52+s!BE52*s!BG52=0,0,O53*s!BC52*s!BI52/(s!BC52*s!BI52+s!BE52*s!BG52))+IF(s!BB52*s!BI52+s!BC52*s!BH52+s!BD52*s!BG52+s!BE52*s!BF52=0,0,N53*s!BC52*s!BH52/(s!BB52*s!BI52+s!BC52*s!BH52+s!BD52*s!BG52+s!BE52*s!BF52)) -> 11.386767441044126 | BD53: =AM53+IF(s!BC52*s!BD52+s!BB52*s!BE52=0,0,E53*s!BC52*s!BD52/(s!BC52*s!BD52+s!BB52*s!BE52))+IF(s!BD52*s!BF52+s!BB52*s!BH52=0,0,M53*s!BD52*s!BF52/(s!BD52*s!BF52+s!BB52*s!BH52))+IF(s!BD52*s!BI52+s!BE52*s!BH52=0,0,Q53*s!BD52*s!BI52/(s!BD52*s!BI52+s!BE52*s!BH52))+IF(s!BB52*s!BI52+s!BC52*s!BH52+s!BD52*s!BG52+s!BE52*s!BF52=0,0,N53*s!BD52*s!BG52/(s!BB52*s!BI52+s!BC52*s!BH52+s!BD52*s!BG52+s!BE52*s!BF52)) -> 10.119740398057345 | BE53: =AN53+IF(s!BB52*s!BE52+s!BC52*s!BD52=0,0,E53*s!BB52*s!BE52/(s!BB52*s!BE52+s!BC52*s!BD52))+IF(s!BC52*s!BI52+s!BE52*s!BG52=0,0,O53*s!BE52*s!BG52/(s!BC52*s!BI52+s!BE52*s!BG52))+IF(s!BD52*s!BI52+s!BE52*s!BH52=0,0,Q53*s!BE52*s!BH52/(s!BD52*s!BI52+s!BE52*s!BH52))+IF(s!BB52*s!BI52+s!BC52*s!BH52+s!BD52*s!BG52+s!BE52*s!BF52=0,0,N53*s!BE52*s!BF52/(s!BB52*s!BI52+s!BC52*s!BH52+s!BD52*s!BG52+s!BE52*s!BF52)) -> 16.726907469661459 | BF53: =AO53+IF(s!BB52*s!BG52+s!BC52*s!BF52=0,0,K53*s!BC52*s!BF52/(s!BB52*s!BG52+s!BC52*s!BF52))+IF(s!BD52*s!BF52+s!BB52*s!BH52=0,0,M53*s!BD52*s!BF52/(s!BD52*s!BF52+s!BB52*s!BH52))+IF(s!BF52*s!BI52+s!BG52*s!BH52=0,0,W53*s!BF52*s!BI52/(s!BF52*s!BI52+s!BG52*s!BH52))+IF(s!BB52*s!BI52+s!BC52*s!BH52+s!BD52*s!BG52+s!BE52*s!BF52=0,0,N53*s!BE52*s!BF52/(s!BB52*s!BI52+s!BC52*s!BH52+s!BD52*s!BG52+s!BE52*s!BF52)) -> 10.141959945232461 | BG53: =AP53+IF(s!BB52*s!BG52+s!BC52*s!BF52=0,0,K53*s!BB52*s!BG52/(s!BB52*s!BG52+s!BC52*s!BF52))+IF(s!BC52*s!BI52+s!BE52*s!BG52=0,0,O53*s!BE52*s!BG52/(s!BC52*s!BI52+s!BE52*s!BG52))+IF(s!BF52*s!BI52+s!BG52*s!BH52=0,0,W53*s!BG52*s!BH52/(s!BF52*s!BI52+s!BG52*s!BH52))+IF(s!BB52*s!BI52+s!BC52*s!BH52+s!BD52*s!BG52+s!BE52*s!BF52=0,0,N53*s!BD52*s!BG52/(s!BB52*s!BI52+s!BC52*s!BH52+s!BD52*s!BG52+s!BE52*s!BF52)) -> 15.704687922486341 | BH53: =AQ53+IF(s!BB52*s!BH52+s!BD52*s!BF52=0,0,M53*s!BB52*s!BH52/(s!BB52*s!BH52+s!BD52*s!BF52))+IF(s!BD52*s!BI52+s!BE52*s!BH52=0,0,Q53*s!BE52*s!BH52/(s!BD52*s!BI52+s!BE52*s!BH52))+IF(s!BF52*s!BI52+s!BG52*s!BH52=0,0,W53*s!BG52*s!BH52/(s!BF52*s!BI52+s!BG52*s!BH52))+IF(s!BB52*s!BI52+s!BC52*s!BH52+s!BD52*s!BG52+s!BE52*s!BF52=0,0,N53*s!BC52*s!BH52/(s!BB52*s!BI52+s!BC52*s!BH52+s!BD52*s!BG52+s!BE52*s!BF52)) -> 17.971714965473122 | BI53: =AR53+IF(s!BC52*s!BI52+s!BE52*s!BG52=0,0,O53*s!BC52*s!BI52/(s!BC52*s!BI52+s!BE52*s!BG52))+IF(s!BD52*s!BI52+s!BE52*s!BH52=0,0,Q53*s!BD52*s!BI52/(s!BD52*s!BI52+s!BE52*s!BH52))+IF(s!BF52*s!BI52+s!BG52*s!BH52=0,0,W53*s!BF52*s!BI52/(s!BF52*s!BI52+s!BG52*s!BH52))+IF(s!BB52*s!BI52+s!BC52*s!BH52+s!BD52*s!BG52+s!BE52*s!BF52=0,0,N53*s!BB52*s!BI52/(s!BB52*s!BI52+s!BC52*s!BH52+s!BD52*s!BG52+s!BE52*s!BF52)) -> 20.181637166808073 | BJ53: =SUM(BB53:BI53) -> 326
A54: =A53 -> 100 | B54: =B53 -> 1 | C54: =C53 -> 1 | D54: =D53 -> 2 | E54: =E53 -> 5 | F54: =F53 -> 2 | G54: =G53 -> 1 | H54: =H53 -> 2 | I54: =I53 -> 1 | J54: =J53 -> 2 | K54: =K53 -> 4 | L54: =L53 -> 2 | M54: =M53 -> 4 | N54: =N53 -> 8 | O54: =O53 -> 4 | P54: =P53 -> 2 | Q54: =Q53 -> 4 | R54: =R53 -> 2 | S54: =S53 -> 1 | T54: =T53 -> 2 | U54: =U53 -> 1 | V54: =V53 -> 2 | W54: =W53 -> 4 | X54: =X53 -> 2 | Y54: =Y53 -> 1 | Z54: =Z53 -> 2 | AA54: =AA53 -> 1 | AB54: =AB53 -> 163 | AK54: =AK53 -> 205 | AL54: =AL53 -> 7 | AM54: =AM53 -> 8 | AN54: =AN53 -> 8 | AO54: =AO53 -> 8 | AP54: =AP53 -> 8 | AQ54: =AQ53 -> 8 | AR54: =AR53 -> 8 | AS54: =AS53 -> 260 | BB54: =AK54+IF(s!BB53*s!BE53+s!BC53*s!BD53=0,0,E54*s!BB53*s!BE53/(s!BB53*s!BE53+s!BC53*s!BD53)+IF(s!BB53*s!BG53+s!BC53*s!BF53=0,0,K54*s!BB53*s!BG53/(s!BB53*s!BG53+s!BC53*s!BF53))+IF(s!BB53*s!BH53+s!BD53*s!BF53=0,0,M54*s!BB53*s!BH53/(s!BB53*s!BH53+s!BD53*s!BF53))+IF(s!BB53*s!BI53+s!BC53*s!BH53+s!BD53*s!BG53+s!BE53*s!BF53=0,0,N54*s!BB53*s!BI53/(s!BB53*s!BI53+s!BC53*s!BH53+s!BD53*s!BG53+s!BE53*s!BF53)
)) -> 223.76658468593186 | BC54: =AL54+IF(s!BC53*s!BD53+s!BB53*s!BE53=0,0,E54*s!BC53*s!BD53/(s!BC53*s!BD53+s!BB53*s!BE53))+IF(s!BB53*s!BG53+s!BC53*s!BF53=0,0,K54*s!BC53*s!BF53/(s!BB53*s!BG53+s!BC53*s!BF53))+IF(s!BC53*s!BI53+s!BE53*s!BG53=0,0,O54*s!BC53*s!BI53/(s!BC53*s!BI53+s!BE53*s!BG53))+IF(s!BB53*s!BI53+s!BC53*s!BH53+s!BD53*s!BG53+s!BE53*s!BF53=0,0,N54*s!BC53*s!BH53/(s!BB53*s!BI53+s!BC53*s!BH53+s!BD53*s!BG53+s!BE53*s!BF53)) -> 11.386767433768863 | BD54: =AM54+IF(s!BC53*s!BD53+s!BB53*s!BE53=0,0,E54*s!BC53*s!BD53/(s!BC53*s!BD53+s!BB53*s!BE53))+IF(s!BD53*s!BF53+s!BB53*s!BH53=0,0,M54*s!BD53*s!BF53/(s!BD53*s!BF53+s!BB53*s!BH53))+IF(s!BD53*s!BI53+s!BE53*s!BH53=0,0,Q54*s!BD53*s!BI53/(s!BD53*s!BI53+s!BE53*s!BH53))+IF(s!BB53*s!BI53+s!BC53*s!BH53+s!BD53*s!BG53+s!BE53*s!BF53=0,0,N54*s!BD53*s!BG53/(s!BB53*s!BI53+s!BC53*s!BH53+s!BD53*s!BG53+s!BE53*s!BF53)) -> 10.119740380785444 | BE54: =AN54+IF(s!BB53*s!BE53+s!BC53*s!BD53=0,0,E54*s!BB53*s!BE53/(s!BB53*s!BE53+s!BC53*s!BD53))+IF(s!BC53*s!BI53+s!BE53*s!BG53=0,0,O54*s!BE53*s!BG53/(s!BC53*s!BI53+s!BE53*s!BG53))+IF(s!BD53*s!BI53+s!BE53*s!BH53=0,0,Q54*s!BE53*s!BH53/(s!BD53*s!BI53+s!BE53*s!BH53))+IF(s!BB53*s!BI53+s!BC53*s!BH53+s!BD53*s!BG53+s!BE53*s!BF53=0,0,N54*s!BE53*s!BF53/(s!BB53*s!BI53+s!BC53*s!BH53+s!BD53*s!BG53+s!BE53*s!BF53)) -> 16.726907499513832 | BF54: =AO54+IF(s!BB53*s!BG53+s!BC53*s!BF53=0,0,K54*s!BC53*s!BF53/(s!BB53*s!BG53+s!BC53*s!BF53))+IF(s!BD53*s!BF53+s!BB53*s!BH53=0,0,M54*s!BD53*s!BF53/(s!BD53*s!BF53+s!BB53*s!BH53))+IF(s!BF53*s!BI53+s!BG53*s!BH53=0,0,W54*s!BF53*s!BI53/(s!BF53*s!BI53+s!BG53*s!BH53))+IF(s!BB53*s!BI53+s!BC53*s!BH53+s!BD53*s!BG53+s!BE53*s!BF53=0,0,N54*s!BE53*s!BF53/(s!BB53*s!BI53+s!BC53*s!BH53+s!BD53*s!BG53+s!BE53*s!BF53)) -> 10.141959928048932 | BG54: =AP54+IF(s!BB53*s!BG53+s!BC53*s!BF53=0,0,K54*s!BB53*s!BG53/(s!BB53*s!BG53+s!BC53*s!BF53))+IF(s!BC53*s!BI53+s!BE53*s!BG53=0,0,O54*s!BE53*s!BG53/(s!BC53*s!BI53+s!BE53*s!BG53))+IF(s!BF53*s!BI53+s!BG53*s!BH53=0,0,W54*s!BG53*s!BH53/(s!BF53*s!BI53+s!BG53*s!BH53))+IF(s!BB53*s!BI53+s!BC53*s!BH53+s!BD53*s!BG53+s!BE53*s!BF53=0,0,N54*s!BD53*s!BG53/(s!BB53*s!BI53+s!BC53*s!BH53+s!BD53*s!BG53+s!BE53*s!BF53)) -> 15.704687952250342 | BH54: =AQ54+IF(s!BB53*s!BH53+s!BD53*s!BF53=0,0,M54*s!BB53*s!BH53/(s!BB53*s!BH53+s!BD53*s!BF53))+IF(s!BD53*s!BI53+s!BE53*s!BH53=0,0,Q54*s!BE53*s!BH53/(s!BD53*s!BI53+s!BE53*s!BH53))+IF(s!BF53*s!BI53+s!BG53*s!BH53=0,0,W54*s!BG53*s!BH53/(s!BF53*s!BI53+s!BG53*s!BH53))+IF(s!BB53*s!BI53+s!BC53*s!BH53+s!BD53*s!BG53+s!BE53*s!BF53=0,0,N54*s!BC53*s!BH53/(s!BB53*s!BI53+s!BC53*s!BH53+s!BD53*s!BG53+s!BE53*s!BF53)) -> 17.971715005233758 | BI54: =AR54+IF(s!BC53*s!BI53+s!BE53*s!BG53=0,0,O54*s!BC53*s!BI53/(s!BC53*s!BI53+s!BE53*s!BG53))+IF(s!BD53*s!BI53+s!BE53*s!BH53=0,0,Q54*s!BD53*s!BI53/(s!BD53*s!BI53+s!BE53*s!BH53))+IF(s!BF53*s!BI53+s!BG53*s!BH53=0,0,W54*s!BF53*s!BI53/(s!BF53*s!BI53+s!BG53*s!BH53))+IF(s!BB53*s!BI53+s!BC53*s!BH53+s!BD53*s!BG53+s!BE53*s!BF53=0,0,N54*s!BB53*s!BI53/(s!BB53*s!BI53+s!BC53*s!BH53+s!BD53*s!BG53+s!BE53*s!BF53)) -> 20.181637114466962 | BJ54: =SUM(BB54:BI54) -> 326
A55: =A54 -> 100 | B55: =B54 -> 1 | C55: =C54 -> 1 | D55: =D54 -> 2 | E55: =E54 -> 5 | F55: =F54 -> 2 | G55: =G54 -> 1 | H55: =H54 -> 2 | I55: =I54 -> 1 | J55: =J54 -> 2 | K55: =K54 -> 4 | L55: =L54 -> 2 | M55: =M54 -> 4 | N55: =N54 -> 8 | O55: =O54 -> 4 | P55: =P54 -> 2 | Q55: =Q54 -> 4 | R55: =R54 -> 2 | S55: =S54 -> 1 | T55: =T54 -> 2 | U55: =U54 -> 1 | V55: =V54 -> 2 | W55: =W54 -> 4 | X55: =X54 -> 2 | Y55: =Y54 -> 1 | Z55: =Z54 -> 2 | AA55: =AA54 -> 1 | AB55: =AB54 -> 163 | AK55: =AK54 -> 205 | AL55: =AL54 -> 7 | AM55: =AM54 -> 8 | AN55: =AN54 -> 8 | AO55: =AO54 -> 8 | AP55: =AP54 -> 8 | AQ55: =AQ54 -> 8 | AR55: =AR54 -> 8 | AS55: =AS54 -> 260 | BB55: =AK55+IF(s!BB54*s!BE54+s!BC54*s!BD54=0,0,E55*s!BB54*s!BE54/(s!BB54*s!BE54+s!BC54*s!BD54)+IF(s!BB54*s!BG54+s!BC54*s!BF54=0,0,K55*s!BB54*s!BG54/(s!BB54*s!BG54+s!BC54*s!BF54))+IF(s!BB54*s!BH54+s!BD54*s!BF54=0,0,M55*s!BB54*s!BH54/(s!BB54*s!BH54+s!BD54*s!BF54))+IF(s!BB54*s!BI54+s!BC54*s!BH54+s!BD54*s!BG54+s!BE54*s!BF54=0,0,N55*s!BB54*s!BI54/(s!BB54*s!BI54+s!BC54*s!BH54+s!BD54*s!BG54+s!BE54*s!BF54)
)) -> 223.76658468213574 | BC55: =AL55+IF(s!BC54*s!BD54+s!BB54*s!BE54=0,0,E55*s!BC54*s!BD54/(s!BC54*s!BD54+s!BB54*s!BE54))+IF(s!BB54*s!BG54+s!BC54*s!BF54=0,0,K55*s!BC54*s!BF54/(s!BB54*s!BG54+s!BC54*s!BF54))+IF(s!BC54*s!BI54+s!BE54*s!BG54=0,0,O55*s!BC54*s!BI54/(s!BC54*s!BI54+s!BE54*s!BG54))+IF(s!BB54*s!BI54+s!BC54*s!BH54+s!BD54*s!BG54+s!BE54*s!BF54=0,0,N55*s!BC54*s!BH54/(s!BB54*s!BI54+s!BC54*s!BH54+s!BD54*s!BG54+s!BE54*s!BF54)) -> 11.386767428564193 | BD55: =AM55+IF(s!BC54*s!BD54+s!BB54*s!BE54=0,0,E55*s!BC54*s!BD54/(s!BC54*s!BD54+s!BB54*s!BE54))+IF(s!BD54*s!BF54+s!BB54*s!BH54=0,0,M55*s!BD54*s!BF54/(s!BD54*s!BF54+s!BB54*s!BH54))+IF(s!BD54*s!BI54+s!BE54*s!BH54=0,0,Q55*s!BD54*s!BI54/(s!BD54*s!BI54+s!BE54*s!BH54))+IF(s!BB54*s!BI54+s!BC54*s!BH54+s!BD54*s!BG54+s!BE54*s!BF54=0,0,N55*s!BD54*s!BG54/(s!BB54*s!BI54+s!BC54*s!BH54+s!BD54*s!BG54+s!BE54*s!BF54)) -> 10.119740368427609 | BE55: =AN55+IF(s!BB54*s!BE54+s!BC54*s!BD54=0,0,E55*s!BB54*s!BE54/(s!BB54*s!BE54+s!BC54*s!BD54))+IF(s!BC54*s!BI54+s!BE54*s!BG54=0,0,O55*s!BE54*s!BG54/(s!BC54*s!BI54+s!BE54*s!BG54))+IF(s!BD54*s!BI54+s!BE54*s!BH54=0,0,Q55*s!BE54*s!BH54/(s!BD54*s!BI54+s!BE54*s!BH54))+IF(s!BB54*s!BI54+s!BC54*s!BH54+s!BD54*s!BG54+s!BE54*s!BF54=0,0,N55*s!BE54*s!BF54/(s!BB54*s!BI54+s!BC54*s!BH54+s!BD54*s!BG54+s!BE54*s!BF54)) -> 16.726907520872448 | BF55: =AO55+IF(s!BB54*s!BG54+s!BC54*s!BF54=0,0,K55*s!BC54*s!BF54/(s!BB54*s!BG54+s!BC54*s!BF54))+IF(s!BD54*s!BF54+s!BB54*s!BH54=0,0,M55*s!BD54*s!BF54/(s!BD54*s!BF54+s!BB54*s!BH54))+IF(s!BF54*s!BI54+s!BG54*s!BH54=0,0,W55*s!BF54*s!BI54/(s!BF54*s!BI54+s!BG54*s!BH54))+IF(s!BB54*s!BI54+s!BC54*s!BH54+s!BD54*s!BG54+s!BE54*s!BF54=0,0,N55*s!BE54*s!BF54/(s!BB54*s!BI54+s!BC54*s!BH54+s!BD54*s!BG54+s!BE54*s!BF54)) -> 10.141959915754217 | BG55: =AP55+IF(s!BB54*s!BG54+s!BC54*s!BF54=0,0,K55*s!BB54*s!BG54/(s!BB54*s!BG54+s!BC54*s!BF54))+IF(s!BC54*s!BI54+s!BE54*s!BG54=0,0,O55*s!BE54*s!BG54/(s!BC54*s!BI54+s!BE54*s!BG54))+IF(s!BF54*s!BI54+s!BG54*s!BH54=0,0,W55*s!BG54*s!BH54/(s!BF54*s!BI54+s!BG54*s!BH54))+IF(s!BB54*s!BI54+s!BC54*s!BH54+s!BD54*s!BG54+s!BE54*s!BF54=0,0,N55*s!BD54*s!BG54/(s!BB54*s!BI54+s!BC54*s!BH54+s!BD54*s!BG54+s!BE54*s!BF54)) -> 15.704687973545838 | BH55: =AQ55+IF(s!BB54*s!BH54+s!BD54*s!BF54=0,0,M55*s!BB54*s!BH54/(s!BB54*s!BH54+s!BD54*s!BF54))+IF(s!BD54*s!BI54+s!BE54*s!BH54=0,0,Q55*s!BE54*s!BH54/(s!BD54*s!BI54+s!BE54*s!BH54))+IF(s!BF54*s!BI54+s!BG54*s!BH54=0,0,W55*s!BG54*s!BH54/(s!BF54*s!BI54+s!BG54*s!BH54))+IF(s!BB54*s!BI54+s!BC54*s!BH54+s!BD54*s!BG54+s!BE54*s!BF54=0,0,N55*s!BC54*s!BH54/(s!BB54*s!BI54+s!BC54*s!BH54+s!BD54*s!BG54+s!BE54*s!BF54)) -> 17.971715033682422 | BI55: =AR55+IF(s!BC54*s!BI54+s!BE54*s!BG54=0,0,O55*s!BC54*s!BI54/(s!BC54*s!BI54+s!BE54*s!BG54))+IF(s!BD54*s!BI54+s!BE54*s!BH54=0,0,Q55*s!BD54*s!BI54/(s!BD54*s!BI54+s!BE54*s!BH54))+IF(s!BF54*s!BI54+s!BG54*s!BH54=0,0,W55*s!BF54*s!BI54/(s!BF54*s!BI54+s!BG54*s!BH54))+IF(s!BB54*s!BI54+s!BC54*s!BH54+s!BD54*s!BG54+s!BE54*s!BF54=0,0,N55*s!BB54*s!BI54/(s!BB54*s!BI54+s!BC54*s!BH54+s!BD54*s!BG54+s!BE54*s!BF54)) -> 20.181637077017527 | BJ55: =SUM(BB55:BI55) -> 326
A56: =A55 -> 100 | B56: =B55 -> 1 | C56: =C55 -> 1 | D56: =D55 -> 2 | E56: =E55 -> 5 | F56: =F55 -> 2 | G56: =G55 -> 1 | H56: =H55 -> 2 | I56: =I55 -> 1 | J56: =J55 -> 2 | K56: =K55 -> 4 | L56: =L55 -> 2 | M56: =M55 -> 4 | N56: =N55 -> 8 | O56: =O55 -> 4 | P56: =P55 -> 2 | Q56: =Q55 -> 4 | R56: =R55 -> 2 | S56: =S55 -> 1 | T56: =T55 -> 2 | U56: =U55 -> 1 | V56: =V55 -> 2 | W56: =W55 -> 4 | X56: =X55 -> 2 | Y56: =Y55 -> 1 | Z56: =Z55 -> 2 | AA56: =AA55 -> 1 | AB56: =AB55 -> 163 | AK56: =AK55 -> 205 | AL56: =AL55 -> 7 | AM56: =AM55 -> 8 | AN56: =AN55 -> 8 | AO56: =AO55 -> 8 | AP56: =AP55 -> 8 | AQ56: =AQ55 -> 8 | AR56: =AR55 -> 8 | AS56: =AS55 -> 260 | BB56: =AK56+IF(s!BB55*s!BE55+s!BC55*s!BD55=0,0,E56*s!BB55*s!BE55/(s!BB55*s!BE55+s!BC55*s!BD55)+IF(s!BB55*s!BG55+s!BC55*s!BF55=0,0,K56*s!BB55*s!BG55/(s!BB55*s!BG55+s!BC55*s!BF55))+IF(s!BB55*s!BH55+s!BD55*s!BF55=0,0,M56*s!BB55*s!BH55/(s!BB55*s!BH55+s!BD55*s!BF55))+IF(s!BB55*s!BI55+s!BC55*s!BH55+s!BD55*s!BG55+s!BE55*s!BF55=0,0,N56*s!BB55*s!BI55/(s!BB55*s!BI55+s!BC55*s!BH55+s!BD55*s!BG55+s!BE55*s!BF55)
)) -> 223.76658467941951 | BC56: =AL56+IF(s!BC55*s!BD55+s!BB55*s!BE55=0,0,E56*s!BC55*s!BD55/(s!BC55*s!BD55+s!BB55*s!BE55))+IF(s!BB55*s!BG55+s!BC55*s!BF55=0,0,K56*s!BC55*s!BF55/(s!BB55*s!BG55+s!BC55*s!BF55))+IF(s!BC55*s!BI55+s!BE55*s!BG55=0,0,O56*s!BC55*s!BI55/(s!BC55*s!BI55+s!BE55*s!BG55))+IF(s!BB55*s!BI55+s!BC55*s!BH55+s!BD55*s!BG55+s!BE55*s!BF55=0,0,N56*s!BC55*s!BH55/(s!BB55*s!BI55+s!BC55*s!BH55+s!BD55*s!BG55+s!BE55*s!BF55)) -> 11.386767424840775 | BD56: =AM56+IF(s!BC55*s!BD55+s!BB55*s!BE55=0,0,E56*s!BC55*s!BD55/(s!BC55*s!BD55+s!BB55*s!BE55))+IF(s!BD55*s!BF55+s!BB55*s!BH55=0,0,M56*s!BD55*s!BF55/(s!BD55*s!BF55+s!BB55*s!BH55))+IF(s!BD55*s!BI55+s!BE55*s!BH55=0,0,Q56*s!BD55*s!BI55/(s!BD55*s!BI55+s!BE55*s!BH55))+IF(s!BB55*s!BI55+s!BC55*s!BH55+s!BD55*s!BG55+s!BE55*s!BF55=0,0,N56*s!BD55*s!BG55/(s!BB55*s!BI55+s!BC55*s!BH55+s!BD55*s!BG55+s!BE55*s!BF55)) -> 10.119740359585787 | BE56: =AN56+IF(s!BB55*s!BE55+s!BC55*s!BD55=0,0,E56*s!BB55*s!BE55/(s!BB55*s!BE55+s!BC55*s!BD55))+IF(s!BC55*s!BI55+s!BE55*s!BG55=0,0,O56*s!BE55*s!BG55/(s!BC55*s!BI55+s!BE55*s!BG55))+IF(s!BD55*s!BI55+s!BE55*s!BH55=0,0,Q56*s!BE55*s!BH55/(s!BD55*s!BI55+s!BE55*s!BH55))+IF(s!BB55*s!BI55+s!BC55*s!BH55+s!BD55*s!BG55+s!BE55*s!BF55=0,0,N56*s!BE55*s!BF55/(s!BB55*s!BI55+s!BC55*s!BH55+s!BD55*s!BG55+s!BE55*s!BF55)) -> 16.726907536153917 | BF56: =AO56+IF(s!BB55*s!BG55+s!BC55*s!BF55=0,0,K56*s!BC55*s!BF55/(s!BB55*s!BG55+s!BC55*s!BF55))+IF(s!BD55*s!BF55+s!BB55*s!BH55=0,0,M56*s!BD55*s!BF55/(s!BD55*s!BF55+s!BB55*s!BH55))+IF(s!BF55*s!BI55+s!BG55*s!BH55=0,0,W56*s!BF55*s!BI55/(s!BF55*s!BI55+s!BG55*s!BH55))+IF(s!BB55*s!BI55+s!BC55*s!BH55+s!BD55*s!BG55+s!BE55*s!BF55=0,0,N56*s!BE55*s!BF55/(s!BB55*s!BI55+s!BC55*s!BH55+s!BD55*s!BG55+s!BE55*s!BF55)) -> 10.14195990695749 | BG56: =AP56+IF(s!BB55*s!BG55+s!BC55*s!BF55=0,0,K56*s!BB55*s!BG55/(s!BB55*s!BG55+s!BC55*s!BF55))+IF(s!BC55*s!BI55+s!BE55*s!BG55=0,0,O56*s!BE55*s!BG55/(s!BC55*s!BI55+s!BE55*s!BG55))+IF(s!BF55*s!BI55+s!BG55*s!BH55=0,0,W56*s!BG55*s!BH55/(s!BF55*s!BI55+s!BG55*s!BH55))+IF(s!BB55*s!BI55+s!BC55*s!BH55+s!BD55*s!BG55+s!BE55*s!BF55=0,0,N56*s!BD55*s!BG55/(s!BB55*s!BI55+s!BC55*s!BH55+s!BD55*s!BG55+s!BE55*s!BF55)) -> 15.704687988782212 | BH56: =AQ56+IF(s!BB55*s!BH55+s!BD55*s!BF55=0,0,M56*s!BB55*s!BH55/(s!BB55*s!BH55+s!BD55*s!BF55))+IF(s!BD55*s!BI55+s!BE55*s!BH55=0,0,Q56*s!BE55*s!BH55/(s!BD55*s!BI55+s!BE55*s!BH55))+IF(s!BF55*s!BI55+s!BG55*s!BH55=0,0,W56*s!BG55*s!BH55/(s!BF55*s!BI55+s!BG55*s!BH55))+IF(s!BB55*s!BI55+s!BC55*s!BH55+s!BD55*s!BG55+s!BE55*s!BF55=0,0,N56*s!BC55*s!BH55/(s!BB55*s!BI55+s!BC55*s!BH55+s!BD55*s!BG55+s!BE55*s!BF55)) -> 17.971715054037205 | BI56: =AR56+IF(s!BC55*s!BI55+s!BE55*s!BG55=0,0,O56*s!BC55*s!BI55/(s!BC55*s!BI55+s!BE55*s!BG55))+IF(s!BD55*s!BI55+s!BE55*s!BH55=0,0,Q56*s!BD55*s!BI55/(s!BD55*s!BI55+s!BE55*s!BH55))+IF(s!BF55*s!BI55+s!BG55*s!BH55=0,0,W56*s!BF55*s!BI55/(s!BF55*s!BI55+s!BG55*s!BH55))+IF(s!BB55*s!BI55+s!BC55*s!BH55+s!BD55*s!BG55+s!BE55*s!BF55=0,0,N56*s!BB55*s!BI55/(s!BB55*s!BI55+s!BC55*s!BH55+s!BD55*s!BG55+s!BE55*s!BF55)) -> 20.181637050223092 | BJ56: =SUM(BB56:BI56) -> 326
A57: =A56 -> 100 | B57: =B56 -> 1 | C57: =C56 -> 1 | D57: =D56 -> 2 | E57: =E56 -> 5 | F57: =F56 -> 2 | G57: =G56 -> 1 | H57: =H56 -> 2 | I57: =I56 -> 1 | J57: =J56 -> 2 | K57: =K56 -> 4 | L57: =L56 -> 2 | M57: =M56 -> 4 | N57: =N56 -> 8 | O57: =O56 -> 4 | P57: =P56 -> 2 | Q57: =Q56 -> 4 | R57: =R56 -> 2 | S57: =S56 -> 1 | T57: =T56 -> 2 | U57: =U56 -> 1 | V57: =V56 -> 2 | W57: =W56 -> 4 | X57: =X56 -> 2 | Y57: =Y56 -> 1 | Z57: =Z56 -> 2 | AA57: =AA56 -> 1 | AB57: =AB56 -> 163 | AK57: =AK56 -> 205 | AL57: =AL56 -> 7 | AM57: =AM56 -> 8 | AN57: =AN56 -> 8 | AO57: =AO56 -> 8 | AP57: =AP56 -> 8 | AQ57: =AQ56 -> 8 | AR57: =AR56 -> 8 | AS57: =AS56 -> 260 | BB57: =AK57+IF(s!BB56*s!BE56+s!BC56*s!BD56=0,0,E57*s!BB56*s!BE56/(s!BB56*s!BE56+s!BC56*s!BD56)+IF(s!BB56*s!BG56+s!BC56*s!BF56=0,0,K57*s!BB56*s!BG56/(s!BB56*s!BG56+s!BC56*s!BF56))+IF(s!BB56*s!BH56+s!BD56*s!BF56=0,0,M57*s!BB56*s!BH56/(s!BB56*s!BH56+s!BD56*s!BF56))+IF(s!BB56*s!BI56+s!BC56*s!BH56+s!BD56*s!BG56+s!BE56*s!BF56=0,0,N57*s!BB56*s!BI56/(s!BB56*s!BI56+s!BC56*s!BH56+s!BD56*s!BG56+s!BE56*s!BF56)
)) -> 223.766584677476 | BC57: =AL57+IF(s!BC56*s!BD56+s!BB56*s!BE56=0,0,E57*s!BC56*s!BD56/(s!BC56*s!BD56+s!BB56*s!BE56))+IF(s!BB56*s!BG56+s!BC56*s!BF56=0,0,K57*s!BC56*s!BF56/(s!BB56*s!BG56+s!BC56*s!BF56))+IF(s!BC56*s!BI56+s!BE56*s!BG56=0,0,O57*s!BC56*s!BI56/(s!BC56*s!BI56+s!BE56*s!BG56))+IF(s!BB56*s!BI56+s!BC56*s!BH56+s!BD56*s!BG56+s!BE56*s!BF56=0,0,N57*s!BC56*s!BH56/(s!BB56*s!BI56+s!BC56*s!BH56+s!BD56*s!BG56+s!BE56*s!BF56)) -> 11.386767422177027 | BD57: =AM57+IF(s!BC56*s!BD56+s!BB56*s!BE56=0,0,E57*s!BC56*s!BD56/(s!BC56*s!BD56+s!BB56*s!BE56))+IF(s!BD56*s!BF56+s!BB56*s!BH56=0,0,M57*s!BD56*s!BF56/(s!BD56*s!BF56+s!BB56*s!BH56))+IF(s!BD56*s!BI56+s!BE56*s!BH56=0,0,Q57*s!BD56*s!BI56/(s!BD56*s!BI56+s!BE56*s!BH56))+IF(s!BB56*s!BI56+s!BC56*s!BH56+s!BD56*s!BG56+s!BE56*s!BF56=0,0,N57*s!BD56*s!BG56/(s!BB56*s!BI56+s!BC56*s!BH56+s!BD56*s!BG56+s!BE56*s!BF56)) -> 10.119740353259649 | BE57: =AN57+IF(s!BB56*s!BE56+s!BC56*s!BD56=0,0,E57*s!BB56*s!BE56/(s!BB56*s!BE56+s!BC56*s!BD56))+IF(s!BC56*s!BI56+s!BE56*s!BG56=0,0,O57*s!BE56*s!BG56/(s!BC56*s!BI56+s!BE56*s!BG56))+IF(s!BD56*s!BI56+s!BE56*s!BH56=0,0,Q57*s!BE56*s!BH56/(s!BD56*s!BI56+s!BE56*s!BH56))+IF(s!BB56*s!BI56+s!BC56*s!BH56+s!BD56*s!BG56+s!BE56*s!BF56=0,0,N57*s!BE56*s!BF56/(s!BB56*s!BI56+s!BC56*s!BH56+s!BD56*s!BG56+s!BE56*s!BF56)) -> 16.726907547087325 | BF57: =AO57+IF(s!BB56*s!BG56+s!BC56*s!BF56=0,0,K57*s!BC56*s!BF56/(s!BB56*s!BG56+s!BC56*s!BF56))+IF(s!BD56*s!BF56+s!BB56*s!BH56=0,0,M57*s!BD56*s!BF56/(s!BD56*s!BF56+s!BB56*s!BH56))+IF(s!BF56*s!BI56+s!BG56*s!BH56=0,0,W57*s!BF56*s!BI56/(s!BF56*s!BI56+s!BG56*s!BH56))+IF(s!BB56*s!BI56+s!BC56*s!BH56+s!BD56*s!BG56+s!BE56*s!BF56=0,0,N57*s!BE56*s!BF56/(s!BB56*s!BI56+s!BC56*s!BH56+s!BD56*s!BG56+s!BE56*s!BF56)) -> 10.141959900663581 | BG57: =AP57+IF(s!BB56*s!BG56+s!BC56*s!BF56=0,0,K57*s!BB56*s!BG56/(s!BB56*s!BG56+s!BC56*s!BF56))+IF(s!BC56*s!BI56+s!BE56*s!BG56=0,0,O57*s!BE56*s!BG56/(s!BC56*s!BI56+s!BE56*s!BG56))+IF(s!BF56*s!BI56+s!BG56*s!BH56=0,0,W57*s!BG56*s!BH56/(s!BF56*s!BI56+s!BG56*s!BH56))+IF(s!BB56*s!BI56+s!BC56*s!BH56+s!BD56*s!BG56+s!BE56*s!BF56=0,0,N57*s!BD56*s!BG56/(s!BB56*s!BI56+s!BC56*s!BH56+s!BD56*s!BG56+s!BE56*s!BF56)) -> 15.704687999683394 | BH57: =AQ57+IF(s!BB56*s!BH56+s!BD56*s!BF56=0,0,M57*s!BB56*s!BH56/(s!BB56*s!BH56+s!BD56*s!BF56))+IF(s!BD56*s!BI56+s!BE56*s!BH56=0,0,Q57*s!BE56*s!BH56/(s!BD56*s!BI56+s!BE56*s!BH56))+IF(s!BF56*s!BI56+s!BG56*s!BH56=0,0,W57*s!BG56*s!BH56/(s!BF56*s!BI56+s!BG56*s!BH56))+IF(s!BB56*s!BI56+s!BC56*s!BH56+s!BD56*s!BG56+s!BE56*s!BF56=0,0,N57*s!BC56*s!BH56/(s!BB56*s!BI56+s!BC56*s!BH56+s!BD56*s!BG56+s!BE56*s!BF56)) -> 17.971715068600769 | BI57: =AR57+IF(s!BC56*s!BI56+s!BE56*s!BG56=0,0,O57*s!BC56*s!BI56/(s!BC56*s!BI56+s!BE56*s!BG56))+IF(s!BD56*s!BI56+s!BE56*s!BH56=0,0,Q57*s!BD56*s!BI56/(s!BD56*s!BI56+s!BE56*s!BH56))+IF(s!BF56*s!BI56+s!BG56*s!BH56=0,0,W57*s!BF56*s!BI56/(s!BF56*s!BI56+s!BG56*s!BH56))+IF(s!BB56*s!BI56+s!BC56*s!BH56+s!BD56*s!BG56+s!BE56*s!BF56=0,0,N57*s!BB56*s!BI56/(s!BB56*s!BI56+s!BC56*s!BH56+s!BD56*s!BG56+s!BE56*s!BF56)) -> 20.181637031052258 | BJ57: =SUM(BB57:BI57) -> 326
A58: =A57 -> 100 | B58: =B57 -> 1 | C58: =C57 -> 1 | D58: =D57 -> 2 | E58: =E57 -> 5 | F58: =F57 -> 2 | G58: =G57 -> 1 | H58: =H57 -> 2 | I58: =I57 -> 1 | J58: =J57 -> 2 | K58: =K57 -> 4 | L58: =L57 -> 2 | M58: =M57 -> 4 | N58: =N57 -> 8 | O58: =O57 -> 4 | P58: =P57 -> 2 | Q58: =Q57 -> 4 | R58: =R57 -> 2 | S58: =S57 -> 1 | T58: =T57 -> 2 | U58: =U57 -> 1 | V58: =V57 -> 2 | W58: =W57 -> 4 | X58: =X57 -> 2 | Y58: =Y57 -> 1 | Z58: =Z57 -> 2 | AA58: =AA57 -> 1 | AB58: =AB57 -> 163 | AK58: =AK57 -> 205 | AL58: =AL57 -> 7 | AM58: =AM57 -> 8 | AN58: =AN57 -> 8 | AO58: =AO57 -> 8 | AP58: =AP57 -> 8 | AQ58: =AQ57 -> 8 | AR58: =AR57 -> 8 | AS58: =AS57 -> 260 | BB58: =AK58+IF(s!BB57*s!BE57+s!BC57*s!BD57=0,0,E58*s!BB57*s!BE57/(s!BB57*s!BE57+s!BC57*s!BD57)+IF(s!BB57*s!BG57+s!BC57*s!BF57=0,0,K58*s!BB57*s!BG57/(s!BB57*s!BG57+s!BC57*s!BF57))+IF(s!BB57*s!BH57+s!BD57*s!BF57=0,0,M58*s!BB57*s!BH57/(s!BB57*s!BH57+s!BD57*s!BF57))+IF(s!BB57*s!BI57+s!BC57*s!BH57+s!BD57*s!BG57+s!BE57*s!BF57=0,0,N58*s!BB57*s!BI57/(s!BB57*s!BI57+s!BC57*s!BH57+s!BD57*s!BG57+s!BE57*s!BF57)
)) -> 223.76658467608539 | BC58: =AL58+IF(s!BC57*s!BD57+s!BB57*s!BE57=0,0,E58*s!BC57*s!BD57/(s!BC57*s!BD57+s!BB57*s!BE57))+IF(s!BB57*s!BG57+s!BC57*s!BF57=0,0,K58*s!BC57*s!BF57/(s!BB57*s!BG57+s!BC57*s!BF57))+IF(s!BC57*s!BI57+s!BE57*s!BG57=0,0,O58*s!BC57*s!BI57/(s!BC57*s!BI57+s!BE57*s!BG57))+IF(s!BB57*s!BI57+s!BC57*s!BH57+s!BD57*s!BG57+s!BE57*s!BF57=0,0,N58*s!BC57*s!BH57/(s!BB57*s!BI57+s!BC57*s!BH57+s!BD57*s!BG57+s!BE57*s!BF57)) -> 11.386767420271353 | BD58: =AM58+IF(s!BC57*s!BD57+s!BB57*s!BE57=0,0,E58*s!BC57*s!BD57/(s!BC57*s!BD57+s!BB57*s!BE57))+IF(s!BD57*s!BF57+s!BB57*s!BH57=0,0,M58*s!BD57*s!BF57/(s!BD57*s!BF57+s!BB57*s!BH57))+IF(s!BD57*s!BI57+s!BE57*s!BH57=0,0,Q58*s!BD57*s!BI57/(s!BD57*s!BI57+s!BE57*s!BH57))+IF(s!BB57*s!BI57+s!BC57*s!BH57+s!BD57*s!BG57+s!BE57*s!BF57=0,0,N58*s!BD57*s!BG57/(s!BB57*s!BI57+s!BC57*s!BH57+s!BD57*s!BG57+s!BE57*s!BF57)) -> 10.11974034873346 | BE58: =AN58+IF(s!BB57*s!BE57+s!BC57*s!BD57=0,0,E58*s!BB57*s!BE57/(s!BB57*s!BE57+s!BC57*s!BD57))+IF(s!BC57*s!BI57+s!BE57*s!BG57=0,0,O58*s!BE57*s!BG57/(s!BC57*s!BI57+s!BE57*s!BG57))+IF(s!BD57*s!BI57+s!BE57*s!BH57=0,0,Q58*s!BE57*s!BH57/(s!BD57*s!BI57+s!BE57*s!BH57))+IF(s!BB57*s!BI57+s!BC57*s!BH57+s!BD57*s!BG57+s!BE57*s!BF57=0,0,N58*s!BE57*s!BF57/(s!BB57*s!BI57+s!BC57*s!BH57+s!BD57*s!BG57+s!BE57*s!BF57)) -> 16.726907554909797 | BF58: =AO58+IF(s!BB57*s!BG57+s!BC57*s!BF57=0,0,K58*s!BC57*s!BF57/(s!BB57*s!BG57+s!BC57*s!BF57))+IF(s!BD57*s!BF57+s!BB57*s!BH57=0,0,M58*s!BD57*s!BF57/(s!BD57*s!BF57+s!BB57*s!BH57))+IF(s!BF57*s!BI57+s!BG57*s!BH57=0,0,W58*s!BF57*s!BI57/(s!BF57*s!BI57+s!BG57*s!BH57))+IF(s!BB57*s!BI57+s!BC57*s!BH57+s!BD57*s!BG57+s!BE57*s!BF57=0,0,N58*s!BE57*s!BF57/(s!BB57*s!BI57+s!BC57*s!BH57+s!BD57*s!BG57+s!BE57*s!BF57)) -> 10.141959896160426 | BG58: =AP58+IF(s!BB57*s!BG57+s!BC57*s!BF57=0,0,K58*s!BB57*s!BG57/(s!BB57*s!BG57+s!BC57*s!BF57))+IF(s!BC57*s!BI57+s!BE57*s!BG57=0,0,O58*s!BE57*s!BG57/(s!BC57*s!BI57+s!BE57*s!BG57))+IF(s!BF57*s!BI57+s!BG57*s!BH57=0,0,W58*s!BG57*s!BH57/(s!BF57*s!BI57+s!BG57*s!BH57))+IF(s!BB57*s!BI57+s!BC57*s!BH57+s!BD57*s!BG57+s!BE57*s!BF57=0,0,N58*s!BD57*s!BG57/(s!BB57*s!BI57+s!BC57*s!BH57+s!BD57*s!BG57+s!BE57*s!BF57)) -> 15.704688007482833 | BH58: =AQ58+IF(s!BB57*s!BH57+s!BD57*s!BF57=0,0,M58*s!BB57*s!BH57/(s!BB57*s!BH57+s!BD57*s!BF57))+IF(s!BD57*s!BI57+s!BE57*s!BH57=0,0,Q58*s!BE57*s!BH57/(s!BD57*s!BI57+s!BE57*s!BH57))+IF(s!BF57*s!BI57+s!BG57*s!BH57=0,0,W58*s!BG57*s!BH57/(s!BF57*s!BI57+s!BG57*s!BH57))+IF(s!BB57*s!BI57+s!BC57*s!BH57+s!BD57*s!BG57+s!BE57*s!BF57=0,0,N58*s!BC57*s!BH57/(s!BB57*s!BI57+s!BC57*s!BH57+s!BD57*s!BG57+s!BE57*s!BF57)) -> 17.971715079020726 | BI58: =AR58+IF(s!BC57*s!BI57+s!BE57*s!BG57=0,0,O58*s!BC57*s!BI57/(s!BC57*s!BI57+s!BE57*s!BG57))+IF(s!BD57*s!BI57+s!BE57*s!BH57=0,0,Q58*s!BD57*s!BI57/(s!BD57*s!BI57+s!BE57*s!BH57))+IF(s!BF57*s!BI57+s!BG57*s!BH57=0,0,W58*s!BF57*s!BI57/(s!BF57*s!BI57+s!BG57*s!BH57))+IF(s!BB57*s!BI57+s!BC57*s!BH57+s!BD57*s!BG57+s!BE57*s!BF57=0,0,N58*s!BB57*s!BI57/(s!BB57*s!BI57+s!BC57*s!BH57+s!BD57*s!BG57+s!BE57*s!BF57)) -> 20.181637017336016 | BJ58: =SUM(BB58:BI58) -> 326
A59: =A58 -> 100 | B59: =B58 -> 1 | C59: =C58 -> 1 | D59: =D58 -> 2 | E59: =E58 -> 5 | F59: =F58 -> 2 | G59: =G58 -> 1 | H59: =H58 -> 2 | I59: =I58 -> 1 | J59: =J58 -> 2 | K59: =K58 -> 4 | L59: =L58 -> 2 | M59: =M58 -> 4 | N59: =N58 -> 8 | O59: =O58 -> 4 | P59: =P58 -> 2 | Q59: =Q58 -> 4 | R59: =R58 -> 2 | S59: =S58 -> 1 | T59: =T58 -> 2 | U59: =U58 -> 1 | V59: =V58 -> 2 | W59: =W58 -> 4 | X59: =X58 -> 2 | Y59: =Y58 -> 1 | Z59: =Z58 -> 2 | AA59: =AA58 -> 1 | AB59: =AB58 -> 163 | AK59: =AK58 -> 205 | AL59: =AL58 -> 7 | AM59: =AM58 -> 8 | AN59: =AN58 -> 8 | AO59: =AO58 -> 8 | AP59: =AP58 -> 8 | AQ59: =AQ58 -> 8 | AR59: =AR58 -> 8 | AS59: =AS58 -> 260 | BB59: =AK59+IF(s!BB58*s!BE58+s!BC58*s!BD58=0,0,E59*s!BB58*s!BE58/(s!BB58*s!BE58+s!BC58*s!BD58)+IF(s!BB58*s!BG58+s!BC58*s!BF58=0,0,K59*s!BB58*s!BG58/(s!BB58*s!BG58+s!BC58*s!BF58))+IF(s!BB58*s!BH58+s!BD58*s!BF58=0,0,M59*s!BB58*s!BH58/(s!BB58*s!BH58+s!BD58*s!BF58))+IF(s!BB58*s!BI58+s!BC58*s!BH58+s!BD58*s!BG58+s!BE58*s!BF58=0,0,N59*s!BB58*s!BI58/(s!BB58*s!BI58+s!BC58*s!BH58+s!BD58*s!BG58+s!BE58*s!BF58)
)) -> 223.7665846750904 | BC59: =AL59+IF(s!BC58*s!BD58+s!BB58*s!BE58=0,0,E59*s!BC58*s!BD58/(s!BC58*s!BD58+s!BB58*s!BE58))+IF(s!BB58*s!BG58+s!BC58*s!BF58=0,0,K59*s!BC58*s!BF58/(s!BB58*s!BG58+s!BC58*s!BF58))+IF(s!BC58*s!BI58+s!BE58*s!BG58=0,0,O59*s!BC58*s!BI58/(s!BC58*s!BI58+s!BE58*s!BG58))+IF(s!BB58*s!BI58+s!BC58*s!BH58+s!BD58*s!BG58+s!BE58*s!BF58=0,0,N59*s!BC58*s!BH58/(s!BB58*s!BI58+s!BC58*s!BH58+s!BD58*s!BG58+s!BE58*s!BF58)) -> 11.386767418908009 | BD59: =AM59+IF(s!BC58*s!BD58+s!BB58*s!BE58=0,0,E59*s!BC58*s!BD58/(s!BC58*s!BD58+s!BB58*s!BE58))+IF(s!BD58*s!BF58+s!BB58*s!BH58=0,0,M59*s!BD58*s!BF58/(s!BD58*s!BF58+s!BB58*s!BH58))+IF(s!BD58*s!BI58+s!BE58*s!BH58=0,0,Q59*s!BD58*s!BI58/(s!BD58*s!BI58+s!BE58*s!BH58))+IF(s!BB58*s!BI58+s!BC58*s!BH58+s!BD58*s!BG58+s!BE58*s!BF58=0,0,N59*s!BD58*s!BG58/(s!BB58*s!BI58+s!BC58*s!BH58+s!BD58*s!BG58+s!BE58*s!BF58)) -> 10.119740345495098 | BE59: =AN59+IF(s!BB58*s!BE58+s!BC58*s!BD58=0,0,E59*s!BB58*s!BE58/(s!BB58*s!BE58+s!BC58*s!BD58))+IF(s!BC58*s!BI58+s!BE58*s!BG58=0,0,O59*s!BE58*s!BG58/(s!BC58*s!BI58+s!BE58*s!BG58))+IF(s!BD58*s!BI58+s!BE58*s!BH58=0,0,Q59*s!BE58*s!BH58/(s!BD58*s!BI58+s!BE58*s!BH58))+IF(s!BB58*s!BI58+s!BC58*s!BH58+s!BD58*s!BG58+s!BE58*s!BF58=0,0,N59*s!BE58*s!BF58/(s!BB58*s!BI58+s!BC58*s!BH58+s!BD58*s!BG58+s!BE58*s!BF58)) -> 16.726907560506483 | BF59: =AO59+IF(s!BB58*s!BG58+s!BC58*s!BF58=0,0,K59*s!BC58*s!BF58/(s!BB58*s!BG58+s!BC58*s!BF58))+IF(s!BD58*s!BF58+s!BB58*s!BH58=0,0,M59*s!BD58*s!BF58/(s!BD58*s!BF58+s!BB58*s!BH58))+IF(s!BF58*s!BI58+s!BG58*s!BH58=0,0,W59*s!BF58*s!BI58/(s!BF58*s!BI58+s!BG58*s!BH58))+IF(s!BB58*s!BI58+s!BC58*s!BH58+s!BD58*s!BG58+s!BE58*s!BF58=0,0,N59*s!BE58*s!BF58/(s!BB58*s!BI58+s!BC58*s!BH58+s!BD58*s!BG58+s!BE58*s!BF58)) -> 10.141959892938527 | BG59: =AP59+IF(s!BB58*s!BG58+s!BC58*s!BF58=0,0,K59*s!BB58*s!BG58/(s!BB58*s!BG58+s!BC58*s!BF58))+IF(s!BC58*s!BI58+s!BE58*s!BG58=0,0,O59*s!BE58*s!BG58/(s!BC58*s!BI58+s!BE58*s!BG58))+IF(s!BF58*s!BI58+s!BG58*s!BH58=0,0,W59*s!BG58*s!BH58/(s!BF58*s!BI58+s!BG58*s!BH58))+IF(s!BB58*s!BI58+s!BC58*s!BH58+s!BD58*s!BG58+s!BE58*s!BF58=0,0,N59*s!BD58*s!BG58/(s!BB58*s!BI58+s!BC58*s!BH58+s!BD58*s!BG58+s!BE58*s!BF58)) -> 15.704688013063057 | BH59: =AQ59+IF(s!BB58*s!BH58+s!BD58*s!BF58=0,0,M59*s!BB58*s!BH58/(s!BB58*s!BH58+s!BD58*s!BF58))+IF(s!BD58*s!BI58+s!BE58*s!BH58=0,0,Q59*s!BE58*s!BH58/(s!BD58*s!BI58+s!BE58*s!BH58))+IF(s!BF58*s!BI58+s!BG58*s!BH58=0,0,W59*s!BG58*s!BH58/(s!BF58*s!BI58+s!BG58*s!BH58))+IF(s!BB58*s!BI58+s!BC58*s!BH58+s!BD58*s!BG58+s!BE58*s!BF58=0,0,N59*s!BC58*s!BH58/(s!BB58*s!BI58+s!BC58*s!BH58+s!BD58*s!BG58+s!BE58*s!BF58)) -> 17.971715086475967 | BI59: =AR59+IF(s!BC58*s!BI58+s!BE58*s!BG58=0,0,O59*s!BC58*s!BI58/(s!BC58*s!BI58+s!BE58*s!BG58))+IF(s!BD58*s!BI58+s!BE58*s!BH58=0,0,Q59*s!BD58*s!BI58/(s!BD58*s!BI58+s!BE58*s!BH58))+IF(s!BF58*s!BI58+s!BG58*s!BH58=0,0,W59*s!BF58*s!BI58/(s!BF58*s!BI58+s!BG58*s!BH58))+IF(s!BB58*s!BI58+s!BC58*s!BH58+s!BD58*s!BG58+s!BE58*s!BF58=0,0,N59*s!BB58*s!BI58/(s!BB58*s!BI58+s!BC58*s!BH58+s!BD58*s!BG58+s!BE58*s!BF58)) -> 20.181637007522447 | BJ59: =SUM(BB59:BI59) -> 326
A60: =A59 -> 100 | B60: =B59 -> 1 | C60: =C59 -> 1 | D60: =D59 -> 2 | E60: =E59 -> 5 | F60: =F59 -> 2 | G60: =G59 -> 1 | H60: =H59 -> 2 | I60: =I59 -> 1 | J60: =J59 -> 2 | K60: =K59 -> 4 | L60: =L59 -> 2 | M60: =M59 -> 4 | N60: =N59 -> 8 | O60: =O59 -> 4 | P60: =P59 -> 2 | Q60: =Q59 -> 4 | R60: =R59 -> 2 | S60: =S59 -> 1 | T60: =T59 -> 2 | U60: =U59 -> 1 | V60: =V59 -> 2 | W60: =W59 -> 4 | X60: =X59 -> 2 | Y60: =Y59 -> 1 | Z60: =Z59 -> 2 | AA60: =AA59 -> 1 | AB60: =AB59 -> 163 | AK60: =AK59 -> 205 | AL60: =AL59 -> 7 | AM60: =AM59 -> 8 | AN60: =AN59 -> 8 | AO60: =AO59 -> 8 | AP60: =AP59 -> 8 | AQ60: =AQ59 -> 8 | AR60: =AR59 -> 8 | AS60: =AS59 -> 260 | BB60: =AK60+IF(s!BB59*s!BE59+s!BC59*s!BD59=0,0,E60*s!BB59*s!BE59/(s!BB59*s!BE59+s!BC59*s!BD59)+IF(s!BB59*s!BG59+s!BC59*s!BF59=0,0,K60*s!BB59*s!BG59/(s!BB59*s!BG59+s!BC59*s!BF59))+IF(s!BB59*s!BH59+s!BD59*s!BF59=0,0,M60*s!BB59*s!BH59/(s!BB59*s!BH59+s!BD59*s!BF59))+IF(s!BB59*s!BI59+s!BC59*s!BH59+s!BD59*s!BG59+s!BE59*s!BF59=0,0,N60*s!BB59*s!BI59/(s!BB59*s!BI59+s!BC59*s!BH59+s!BD59*s!BG59+s!BE59*s!BF59)
)) -> 223.76658467437849 | BC60: =AL60+IF(s!BC59*s!BD59+s!BB59*s!BE59=0,0,E60*s!BC59*s!BD59/(s!BC59*s!BD59+s!BB59*s!BE59))+IF(s!BB59*s!BG59+s!BC59*s!BF59=0,0,K60*s!BC59*s!BF59/(s!BB59*s!BG59+s!BC59*s!BF59))+IF(s!BC59*s!BI59+s!BE59*s!BG59=0,0,O60*s!BC59*s!BI59/(s!BC59*s!BI59+s!BE59*s!BG59))+IF(s!BB59*s!BI59+s!BC59*s!BH59+s!BD59*s!BG59+s!BE59*s!BF59=0,0,N60*s!BC59*s!BH59/(s!BB59*s!BI59+s!BC59*s!BH59+s!BD59*s!BG59+s!BE59*s!BF59)) -> 11.386767417932647 | BD60: =AM60+IF(s!BC59*s!BD59+s!BB59*s!BE59=0,0,E60*s!BC59*s!BD59/(s!BC59*s!BD59+s!BB59*s!BE59))+IF(s!BD59*s!BF59+s!BB59*s!BH59=0,0,M60*s!BD59*s!BF59/(s!BD59*s!BF59+s!BB59*s!BH59))+IF(s!BD59*s!BI59+s!BE59*s!BH59=0,0,Q60*s!BD59*s!BI59/(s!BD59*s!BI59+s!BE59*s!BH59))+IF(s!BB59*s!BI59+s!BC59*s!BH59+s!BD59*s!BG59+s!BE59*s!BF59=0,0,N60*s!BD59*s!BG59/(s!BB59*s!BI59+s!BC59*s!BH59+s!BD59*s!BG59+s!BE59*s!BF59)) -> 10.119740343178156 | BE60: =AN60+IF(s!BB59*s!BE59+s!BC59*s!BD59=0,0,E60*s!BB59*s!BE59/(s!BB59*s!BE59+s!BC59*s!BD59))+IF(s!BC59*s!BI59+s!BE59*s!BG59=0,0,O60*s!BE59*s!BG59/(s!BC59*s!BI59+s!BE59*s!BG59))+IF(s!BD59*s!BI59+s!BE59*s!BH59=0,0,Q60*s!BE59*s!BH59/(s!BD59*s!BI59+s!BE59*s!BH59))+IF(s!BB59*s!BI59+s!BC59*s!BH59+s!BD59*s!BG59+s!BE59*s!BF59=0,0,N60*s!BE59*s!BF59/(s!BB59*s!BI59+s!BC59*s!BH59+s!BD59*s!BG59+s!BE59*s!BF59)) -> 16.726907564510697 | BF60: =AO60+IF(s!BB59*s!BG59+s!BC59*s!BF59=0,0,K60*s!BC59*s!BF59/(s!BB59*s!BG59+s!BC59*s!BF59))+IF(s!BD59*s!BF59+s!BB59*s!BH59=0,0,M60*s!BD59*s!BF59/(s!BD59*s!BF59+s!BB59*s!BH59))+IF(s!BF59*s!BI59+s!BG59*s!BH59=0,0,W60*s!BF59*s!BI59/(s!BF59*s!BI59+s!BG59*s!BH59))+IF(s!BB59*s!BI59+s!BC59*s!BH59+s!BD59*s!BG59+s!BE59*s!BF59=0,0,N60*s!BE59*s!BF59/(s!BB59*s!BI59+s!BC59*s!BH59+s!BD59*s!BG59+s!BE59*s!BF59)) -> 10.141959890633354 | BG60: =AP60+IF(s!BB59*s!BG59+s!BC59*s!BF59=0,0,K60*s!BB59*s!BG59/(s!BB59*s!BG59+s!BC59*s!BF59))+IF(s!BC59*s!BI59+s!BE59*s!BG59=0,0,O60*s!BE59*s!BG59/(s!BC59*s!BI59+s!BE59*s!BG59))+IF(s!BF59*s!BI59+s!BG59*s!BH59=0,0,W60*s!BG59*s!BH59/(s!BF59*s!BI59+s!BG59*s!BH59))+IF(s!BB59*s!BI59+s!BC59*s!BH59+s!BD59*s!BG59+s!BE59*s!BF59=0,0,N60*s!BD59*s!BG59/(s!BB59*s!BI59+s!BC59*s!BH59+s!BD59*s!BG59+s!BE59*s!BF59)) -> 15.704688017055497 | BH60: =AQ60+IF(s!BB59*s!BH59+s!BD59*s!BF59=0,0,M60*s!BB59*s!BH59/(s!BB59*s!BH59+s!BD59*s!BF59))+IF(s!BD59*s!BI59+s!BE59*s!BH59=0,0,Q60*s!BE59*s!BH59/(s!BD59*s!BI59+s!BE59*s!BH59))+IF(s!BF59*s!BI59+s!BG59*s!BH59=0,0,W60*s!BG59*s!BH59/(s!BF59*s!BI59+s!BG59*s!BH59))+IF(s!BB59*s!BI59+s!BC59*s!BH59+s!BD59*s!BG59+s!BE59*s!BF59=0,0,N60*s!BC59*s!BH59/(s!BB59*s!BI59+s!BC59*s!BH59+s!BD59*s!BG59+s!BE59*s!BF59)) -> 17.97171509180999 | BI60: =AR60+IF(s!BC59*s!BI59+s!BE59*s!BG59=0,0,O60*s!BC59*s!BI59/(s!BC59*s!BI59+s!BE59*s!BG59))+IF(s!BD59*s!BI59+s!BE59*s!BH59=0,0,Q60*s!BD59*s!BI59/(s!BD59*s!BI59+s!BE59*s!BH59))+IF(s!BF59*s!BI59+s!BG59*s!BH59=0,0,W60*s!BF59*s!BI59/(s!BF59*s!BI59+s!BG59*s!BH59))+IF(s!BB59*s!BI59+s!BC59*s!BH59+s!BD59*s!BG59+s!BE59*s!BF59=0,0,N60*s!BB59*s!BI59/(s!BB59*s!BI59+s!BC59*s!BH59+s!BD59*s!BG59+s!BE59*s!BF59)) -> 20.181637000501162 | BJ60: =SUM(BB60:BI60) -> 326
A61: =A60 -> 100 | B61: =B60 -> 1 | C61: =C60 -> 1 | D61: =D60 -> 2 | E61: =E60 -> 5 | F61: =F60 -> 2 | G61: =G60 -> 1 | H61: =H60 -> 2 | I61: =I60 -> 1 | J61: =J60 -> 2 | K61: =K60 -> 4 | L61: =L60 -> 2 | M61: =M60 -> 4 | N61: =N60 -> 8 | O61: =O60 -> 4 | P61: =P60 -> 2 | Q61: =Q60 -> 4 | R61: =R60 -> 2 | S61: =S60 -> 1 | T61: =T60 -> 2 | U61: =U60 -> 1 | V61: =V60 -> 2 | W61: =W60 -> 4 | X61: =X60 -> 2 | Y61: =Y60 -> 1 | Z61: =Z60 -> 2 | AA61: =AA60 -> 1 | AB61: =AB60 -> 163 | AK61: =AK60 -> 205 | AL61: =AL60 -> 7 | AM61: =AM60 -> 8 | AN61: =AN60 -> 8 | AO61: =AO60 -> 8 | AP61: =AP60 -> 8 | AQ61: =AQ60 -> 8 | AR61: =AR60 -> 8 | AS61: =AS60 -> 260 | BB61: =AK61+IF(s!BB60*s!BE60+s!BC60*s!BD60=0,0,E61*s!BB60*s!BE60/(s!BB60*s!BE60+s!BC60*s!BD60)+IF(s!BB60*s!BG60+s!BC60*s!BF60=0,0,K61*s!BB60*s!BG60/(s!BB60*s!BG60+s!BC60*s!BF60))+IF(s!BB60*s!BH60+s!BD60*s!BF60=0,0,M61*s!BB60*s!BH60/(s!BB60*s!BH60+s!BD60*s!BF60))+IF(s!BB60*s!BI60+s!BC60*s!BH60+s!BD60*s!BG60+s!BE60*s!BF60=0,0,N61*s!BB60*s!BI60/(s!BB60*s!BI60+s!BC60*s!BH60+s!BD60*s!BG60+s!BE60*s!BF60)
)) -> 223.76658467386915 | BC61: =AL61+IF(s!BC60*s!BD60+s!BB60*s!BE60=0,0,E61*s!BC60*s!BD60/(s!BC60*s!BD60+s!BB60*s!BE60))+IF(s!BB60*s!BG60+s!BC60*s!BF60=0,0,K61*s!BC60*s!BF60/(s!BB60*s!BG60+s!BC60*s!BF60))+IF(s!BC60*s!BI60+s!BE60*s!BG60=0,0,O61*s!BC60*s!BI60/(s!BC60*s!BI60+s!BE60*s!BG60))+IF(s!BB60*s!BI60+s!BC60*s!BH60+s!BD60*s!BG60+s!BE60*s!BF60=0,0,N61*s!BC60*s!BH60/(s!BB60*s!BI60+s!BC60*s!BH60+s!BD60*s!BG60+s!BE60*s!BF60)) -> 11.386767417234855 | BD61: =AM61+IF(s!BC60*s!BD60+s!BB60*s!BE60=0,0,E61*s!BC60*s!BD60/(s!BC60*s!BD60+s!BB60*s!BE60))+IF(s!BD60*s!BF60+s!BB60*s!BH60=0,0,M61*s!BD60*s!BF60/(s!BD60*s!BF60+s!BB60*s!BH60))+IF(s!BD60*s!BI60+s!BE60*s!BH60=0,0,Q61*s!BD60*s!BI60/(s!BD60*s!BI60+s!BE60*s!BH60))+IF(s!BB60*s!BI60+s!BC60*s!BH60+s!BD60*s!BG60+s!BE60*s!BF60=0,0,N61*s!BD60*s!BG60/(s!BB60*s!BI60+s!BC60*s!BH60+s!BD60*s!BG60+s!BE60*s!BF60)) -> 10.119740341520464 | BE61: =AN61+IF(s!BB60*s!BE60+s!BC60*s!BD60=0,0,E61*s!BB60*s!BE60/(s!BB60*s!BE60+s!BC60*s!BD60))+IF(s!BC60*s!BI60+s!BE60*s!BG60=0,0,O61*s!BE60*s!BG60/(s!BC60*s!BI60+s!BE60*s!BG60))+IF(s!BD60*s!BI60+s!BE60*s!BH60=0,0,Q61*s!BE60*s!BH60/(s!BD60*s!BI60+s!BE60*s!BH60))+IF(s!BB60*s!BI60+s!BC60*s!BH60+s!BD60*s!BG60+s!BE60*s!BF60=0,0,N61*s!BE60*s!BF60/(s!BB60*s!BI60+s!BC60*s!BH60+s!BD60*s!BG60+s!BE60*s!BF60)) -> 16.726907567375545 | BF61: =AO61+IF(s!BB60*s!BG60+s!BC60*s!BF60=0,0,K61*s!BC60*s!BF60/(s!BB60*s!BG60+s!BC60*s!BF60))+IF(s!BD60*s!BF60+s!BB60*s!BH60=0,0,M61*s!BD60*s!BF60/(s!BD60*s!BF60+s!BB60*s!BH60))+IF(s!BF60*s!BI60+s!BG60*s!BH60=0,0,W61*s!BF60*s!BI60/(s!BF60*s!BI60+s!BG60*s!BH60))+IF(s!BB60*s!BI60+s!BC60*s!BH60+s!BD60*s!BG60+s!BE60*s!BF60=0,0,N61*s!BE60*s!BF60/(s!BB60*s!BI60+s!BC60*s!BH60+s!BD60*s!BG60+s!BE60*s!BF60)) -> 10.141959888984076 | BG61: =AP61+IF(s!BB60*s!BG60+s!BC60*s!BF60=0,0,K61*s!BB60*s!BG60/(s!BB60*s!BG60+s!BC60*s!BF60))+IF(s!BC60*s!BI60+s!BE60*s!BG60=0,0,O61*s!BE60*s!BG60/(s!BC60*s!BI60+s!BE60*s!BG60))+IF(s!BF60*s!BI60+s!BG60*s!BH60=0,0,W61*s!BG60*s!BH60/(s!BF60*s!BI60+s!BG60*s!BH60))+IF(s!BB60*s!BI60+s!BC60*s!BH60+s!BD60*s!BG60+s!BE60*s!BF60=0,0,N61*s!BD60*s!BG60/(s!BB60*s!BI60+s!BC60*s!BH60+s!BD60*s!BG60+s!BE60*s!BF60)) -> 15.704688019911931 | BH61: =AQ61+IF(s!BB60*s!BH60+s!BD60*s!BF60=0,0,M61*s!BB60*s!BH60/(s!BB60*s!BH60+s!BD60*s!BF60))+IF(s!BD60*s!BI60+s!BE60*s!BH60=0,0,Q61*s!BE60*s!BH60/(s!BD60*s!BI60+s!BE60*s!BH60))+IF(s!BF60*s!BI60+s!BG60*s!BH60=0,0,W61*s!BG60*s!BH60/(s!BF60*s!BI60+s!BG60*s!BH60))+IF(s!BB60*s!BI60+s!BC60*s!BH60+s!BD60*s!BG60+s!BE60*s!BF60=0,0,N61*s!BC60*s!BH60/(s!BB60*s!BI60+s!BC60*s!BH60+s!BD60*s!BG60+s!BE60*s!BF60)) -> 17.971715095626323 | BI61: =AR61+IF(s!BC60*s!BI60+s!BE60*s!BG60=0,0,O61*s!BC60*s!BI60/(s!BC60*s!BI60+s!BE60*s!BG60))+IF(s!BD60*s!BI60+s!BE60*s!BH60=0,0,Q61*s!BD60*s!BI60/(s!BD60*s!BI60+s!BE60*s!BH60))+IF(s!BF60*s!BI60+s!BG60*s!BH60=0,0,W61*s!BF60*s!BI60/(s!BF60*s!BI60+s!BG60*s!BH60))+IF(s!BB60*s!BI60+s!BC60*s!BH60+s!BD60*s!BG60+s!BE60*s!BF60=0,0,N61*s!BB60*s!BI60/(s!BB60*s!BI60+s!BC60*s!BH60+s!BD60*s!BG60+s!BE60*s!BF60)) -> 20.181636995477671 | BJ61: =SUM(BB61:BI61) -> 326
A62: =A61 -> 100 | B62: =B61 -> 1 | C62: =C61 -> 1 | D62: =D61 -> 2 | E62: =E61 -> 5 | F62: =F61 -> 2 | G62: =G61 -> 1 | H62: =H61 -> 2 | I62: =I61 -> 1 | J62: =J61 -> 2 | K62: =K61 -> 4 | L62: =L61 -> 2 | M62: =M61 -> 4 | N62: =N61 -> 8 | O62: =O61 -> 4 | P62: =P61 -> 2 | Q62: =Q61 -> 4 | R62: =R61 -> 2 | S62: =S61 -> 1 | T62: =T61 -> 2 | U62: =U61 -> 1 | V62: =V61 -> 2 | W62: =W61 -> 4 | X62: =X61 -> 2 | Y62: =Y61 -> 1 | Z62: =Z61 -> 2 | AA62: =AA61 -> 1 | AB62: =AB61 -> 163 | AK62: =AK61 -> 205 | AL62: =AL61 -> 7 | AM62: =AM61 -> 8 | AN62: =AN61 -> 8 | AO62: =AO61 -> 8 | AP62: =AP61 -> 8 | AQ62: =AQ61 -> 8 | AR62: =AR61 -> 8 | AS62: =AS61 -> 260 | BB62: =AK62+IF(s!BB61*s!BE61+s!BC61*s!BD61=0,0,E62*s!BB61*s!BE61/(s!BB61*s!BE61+s!BC61*s!BD61)+IF(s!BB61*s!BG61+s!BC61*s!BF61=0,0,K62*s!BB61*s!BG61/(s!BB61*s!BG61+s!BC61*s!BF61))+IF(s!BB61*s!BH61+s!BD61*s!BF61=0,0,M62*s!BB61*s!BH61/(s!BB61*s!BH61+s!BD61*s!BF61))+IF(s!BB61*s!BI61+s!BC61*s!BH61+s!BD61*s!BG61+s!BE61*s!BF61=0,0,N62*s!BB61*s!BI61/(s!BB61*s!BI61+s!BC61*s!BH61+s!BD61*s!BG61+s!BE61*s!BF61)
)) -> 223.7665846735047 | BC62: =AL62+IF(s!BC61*s!BD61+s!BB61*s!BE61=0,0,E62*s!BC61*s!BD61/(s!BC61*s!BD61+s!BB61*s!BE61))+IF(s!BB61*s!BG61+s!BC61*s!BF61=0,0,K62*s!BC61*s!BF61/(s!BB61*s!BG61+s!BC61*s!BF61))+IF(s!BC61*s!BI61+s!BE61*s!BG61=0,0,O62*s!BC61*s!BI61/(s!BC61*s!BI61+s!BE61*s!BG61))+IF(s!BB61*s!BI61+s!BC61*s!BH61+s!BD61*s!BG61+s!BE61*s!BF61=0,0,N62*s!BC61*s!BH61/(s!BB61*s!BI61+s!BC61*s!BH61+s!BD61*s!BG61+s!BE61*s!BF61)) -> 11.386767416735637 | BD62: =AM62+IF(s!BC61*s!BD61+s!BB61*s!BE61=0,0,E62*s!BC61*s!BD61/(s!BC61*s!BD61+s!BB61*s!BE61))+IF(s!BD61*s!BF61+s!BB61*s!BH61=0,0,M62*s!BD61*s!BF61/(s!BD61*s!BF61+s!BB61*s!BH61))+IF(s!BD61*s!BI61+s!BE61*s!BH61=0,0,Q62*s!BD61*s!BI61/(s!BD61*s!BI61+s!BE61*s!BH61))+IF(s!BB61*s!BI61+s!BC61*s!BH61+s!BD61*s!BG61+s!BE61*s!BF61=0,0,N62*s!BD61*s!BG61/(s!BB61*s!BI61+s!BC61*s!BH61+s!BD61*s!BG61+s!BE61*s!BF61)) -> 10.119740340334445 | BE62: =AN62+IF(s!BB61*s!BE61+s!BC61*s!BD61=0,0,E62*s!BB61*s!BE61/(s!BB61*s!BE61+s!BC61*s!BD61))+IF(s!BC61*s!BI61+s!BE61*s!BG61=0,0,O62*s!BE61*s!BG61/(s!BC61*s!BI61+s!BE61*s!BG61))+IF(s!BD61*s!BI61+s!BE61*s!BH61=0,0,Q62*s!BE61*s!BH61/(s!BD61*s!BI61+s!BE61*s!BH61))+IF(s!BB61*s!BI61+s!BC61*s!BH61+s!BD61*s!BG61+s!BE61*s!BF61=0,0,N62*s!BE61*s!BF61/(s!BB61*s!BI61+s!BC61*s!BH61+s!BD61*s!BG61+s!BE61*s!BF61)) -> 16.726907569425219 | BF62: =AO62+IF(s!BB61*s!BG61+s!BC61*s!BF61=0,0,K62*s!BC61*s!BF61/(s!BB61*s!BG61+s!BC61*s!BF61))+IF(s!BD61*s!BF61+s!BB61*s!BH61=0,0,M62*s!BD61*s!BF61/(s!BD61*s!BF61+s!BB61*s!BH61))+IF(s!BF61*s!BI61+s!BG61*s!BH61=0,0,W62*s!BF61*s!BI61/(s!BF61*s!BI61+s!BG61*s!BH61))+IF(s!BB61*s!BI61+s!BC61*s!BH61+s!BD61*s!BG61+s!BE61*s!BF61=0,0,N62*s!BE61*s!BF61/(s!BB61*s!BI61+s!BC61*s!BH61+s!BD61*s!BG61+s!BE61*s!BF61)) -> 10.141959887804074 | BG62: =AP62+IF(s!BB61*s!BG61+s!BC61*s!BF61=0,0,K62*s!BB61*s!BG61/(s!BB61*s!BG61+s!BC61*s!BF61))+IF(s!BC61*s!BI61+s!BE61*s!BG61=0,0,O62*s!BE61*s!BG61/(s!BC61*s!BI61+s!BE61*s!BG61))+IF(s!BF61*s!BI61+s!BG61*s!BH61=0,0,W62*s!BG61*s!BH61/(s!BF61*s!BI61+s!BG61*s!BH61))+IF(s!BB61*s!BI61+s!BC61*s!BH61+s!BD61*s!BG61+s!BE61*s!BF61=0,0,N62*s!BD61*s!BG61/(s!BB61*s!BI61+s!BC61*s!BH61+s!BD61*s!BG61+s!BE61*s!BF61)) -> 15.704688021955588 | BH62: =AQ62+IF(s!BB61*s!BH61+s!BD61*s!BF61=0,0,M62*s!BB61*s!BH61/(s!BB61*s!BH61+s!BD61*s!BF61))+IF(s!BD61*s!BI61+s!BE61*s!BH61=0,0,Q62*s!BE61*s!BH61/(s!BD61*s!BI61+s!BE61*s!BH61))+IF(s!BF61*s!BI61+s!BG61*s!BH61=0,0,W62*s!BG61*s!BH61/(s!BF61*s!BI61+s!BG61*s!BH61))+IF(s!BB61*s!BI61+s!BC61*s!BH61+s!BD61*s!BG61+s!BE61*s!BF61=0,0,N62*s!BC61*s!BH61/(s!BB61*s!BI61+s!BC61*s!BH61+s!BD61*s!BG61+s!BE61*s!BF61)) -> 17.971715098356782 | BI62: =AR62+IF(s!BC61*s!BI61+s!BE61*s!BG61=0,0,O62*s!BC61*s!BI61/(s!BC61*s!BI61+s!BE61*s!BG61))+IF(s!BD61*s!BI61+s!BE61*s!BH61=0,0,Q62*s!BD61*s!BI61/(s!BD61*s!BI61+s!BE61*s!BH61))+IF(s!BF61*s!BI61+s!BG61*s!BH61=0,0,W62*s!BF61*s!BI61/(s!BF61*s!BI61+s!BG61*s!BH61))+IF(s!BB61*s!BI61+s!BC61*s!BH61+s!BD61*s!BG61+s!BE61*s!BF61=0,0,N62*s!BB61*s!BI61/(s!BB61*s!BI61+s!BC61*s!BH61+s!BD61*s!BG61+s!BE61*s!BF61)) -> 20.181636991883554 | BJ62: =SUM(BB62:BI62) -> 326
A63: =A62 -> 100 | B63: =B62 -> 1 | C63: =C62 -> 1 | D63: =D62 -> 2 | E63: =E62 -> 5 | F63: =F62 -> 2 | G63: =G62 -> 1 | H63: =H62 -> 2 | I63: =I62 -> 1 | J63: =J62 -> 2 | K63: =K62 -> 4 | L63: =L62 -> 2 | M63: =M62 -> 4 | N63: =N62 -> 8 | O63: =O62 -> 4 | P63: =P62 -> 2 | Q63: =Q62 -> 4 | R63: =R62 -> 2 | S63: =S62 -> 1 | T63: =T62 -> 2 | U63: =U62 -> 1 | V63: =V62 -> 2 | W63: =W62 -> 4 | X63: =X62 -> 2 | Y63: =Y62 -> 1 | Z63: =Z62 -> 2 | AA63: =AA62 -> 1 | AB63: =AB62 -> 163 | AK63: =AK62 -> 205 | AL63: =AL62 -> 7 | AM63: =AM62 -> 8 | AN63: =AN62 -> 8 | AO63: =AO62 -> 8 | AP63: =AP62 -> 8 | AQ63: =AQ62 -> 8 | AR63: =AR62 -> 8 | AS63: =AS62 -> 260 | BB63: =AK63+IF(s!BB62*s!BE62+s!BC62*s!BD62=0,0,E63*s!BB62*s!BE62/(s!BB62*s!BE62+s!BC62*s!BD62)+IF(s!BB62*s!BG62+s!BC62*s!BF62=0,0,K63*s!BB62*s!BG62/(s!BB62*s!BG62+s!BC62*s!BF62))+IF(s!BB62*s!BH62+s!BD62*s!BF62=0,0,M63*s!BB62*s!BH62/(s!BB62*s!BH62+s!BD62*s!BF62))+IF(s!BB62*s!BI62+s!BC62*s!BH62+s!BD62*s!BG62+s!BE62*s!BF62=0,0,N63*s!BB62*s!BI62/(s!BB62*s!BI62+s!BC62*s!BH62+s!BD62*s!BG62+s!BE62*s!BF62)
)) -> 223.76658467324395 | BC63: =AL63+IF(s!BC62*s!BD62+s!BB62*s!BE62=0,0,E63*s!BC62*s!BD62/(s!BC62*s!BD62+s!BB62*s!BE62))+IF(s!BB62*s!BG62+s!BC62*s!BF62=0,0,K63*s!BC62*s!BF62/(s!BB62*s!BG62+s!BC62*s!BF62))+IF(s!BC62*s!BI62+s!BE62*s!BG62=0,0,O63*s!BC62*s!BI62/(s!BC62*s!BI62+s!BE62*s!BG62))+IF(s!BB62*s!BI62+s!BC62*s!BH62+s!BD62*s!BG62+s!BE62*s!BF62=0,0,N63*s!BC62*s!BH62/(s!BB62*s!BI62+s!BC62*s!BH62+s!BD62*s!BG62+s!BE62*s!BF62)) -> 11.386767416378484 | BD63: =AM63+IF(s!BC62*s!BD62+s!BB62*s!BE62=0,0,E63*s!BC62*s!BD62/(s!BC62*s!BD62+s!BB62*s!BE62))+IF(s!BD62*s!BF62+s!BB62*s!BH62=0,0,M63*s!BD62*s!BF62/(s!BD62*s!BF62+s!BB62*s!BH62))+IF(s!BD62*s!BI62+s!BE62*s!BH62=0,0,Q63*s!BD62*s!BI62/(s!BD62*s!BI62+s!BE62*s!BH62))+IF(s!BB62*s!BI62+s!BC62*s!BH62+s!BD62*s!BG62+s!BE62*s!BF62=0,0,N63*s!BD62*s!BG62/(s!BB62*s!BI62+s!BC62*s!BH62+s!BD62*s!BG62+s!BE62*s!BF62)) -> 10.119740339485894 | BE63: =AN63+IF(s!BB62*s!BE62+s!BC62*s!BD62=0,0,E63*s!BB62*s!BE62/(s!BB62*s!BE62+s!BC62*s!BD62))+IF(s!BC62*s!BI62+s!BE62*s!BG62=0,0,O63*s!BE62*s!BG62/(s!BC62*s!BI62+s!BE62*s!BG62))+IF(s!BD62*s!BI62+s!BE62*s!BH62=0,0,Q63*s!BE62*s!BH62/(s!BD62*s!BI62+s!BE62*s!BH62))+IF(s!BB62*s!BI62+s!BC62*s!BH62+s!BD62*s!BG62+s!BE62*s!BF62=0,0,N63*s!BE62*s!BF62/(s!BB62*s!BI62+s!BC62*s!BH62+s!BD62*s!BG62+s!BE62*s!BF62)) -> 16.726907570891672 | BF63: =AO63+IF(s!BB62*s!BG62+s!BC62*s!BF62=0,0,K63*s!BC62*s!BF62/(s!BB62*s!BG62+s!BC62*s!BF62))+IF(s!BD62*s!BF62+s!BB62*s!BH62=0,0,M63*s!BD62*s!BF62/(s!BD62*s!BF62+s!BB62*s!BH62))+IF(s!BF62*s!BI62+s!BG62*s!BH62=0,0,W63*s!BF62*s!BI62/(s!BF62*s!BI62+s!BG62*s!BH62))+IF(s!BB62*s!BI62+s!BC62*s!BH62+s!BD62*s!BG62+s!BE62*s!BF62=0,0,N63*s!BE62*s!BF62/(s!BB62*s!BI62+s!BC62*s!BH62+s!BD62*s!BG62+s!BE62*s!BF62)) -> 10.141959886959828 | BG63: =AP63+IF(s!BB62*s!BG62+s!BC62*s!BF62=0,0,K63*s!BB62*s!BG62/(s!BB62*s!BG62+s!BC62*s!BF62))+IF(s!BC62*s!BI62+s!BE62*s!BG62=0,0,O63*s!BE62*s!BG62/(s!BC62*s!BI62+s!BE62*s!BG62))+IF(s!BF62*s!BI62+s!BG62*s!BH62=0,0,W63*s!BG62*s!BH62/(s!BF62*s!BI62+s!BG62*s!BH62))+IF(s!BB62*s!BI62+s!BC62*s!BH62+s!BD62*s!BG62+s!BE62*s!BF62=0,0,N63*s!BD62*s!BG62/(s!BB62*s!BI62+s!BC62*s!BH62+s!BD62*s!BG62+s!BE62*s!BF62)) -> 15.704688023417738 | BH63: =AQ63+IF(s!BB62*s!BH62+s!BD62*s!BF62=0,0,M63*s!BB62*s!BH62/(s!BB62*s!BH62+s!BD62*s!BF62))+IF(s!BD62*s!BI62+s!BE62*s!BH62=0,0,Q63*s!BE62*s!BH62/(s!BD62*s!BI62+s!BE62*s!BH62))+IF(s!BF62*s!BI62+s!BG62*s!BH62=0,0,W63*s!BG62*s!BH62/(s!BF62*s!BI62+s!BG62*s!BH62))+IF(s!BB62*s!BI62+s!BC62*s!BH62+s!BD62*s!BG62+s!BE62*s!BF62=0,0,N63*s!BC62*s!BH62/(s!BB62*s!BI62+s!BC62*s!BH62+s!BD62*s!BG62+s!BE62*s!BF62)) -> 17.971715100310327 | BI63: =AR63+IF(s!BC62*s!BI62+s!BE62*s!BG62=0,0,O63*s!BC62*s!BI62/(s!BC62*s!BI62+s!BE62*s!BG62))+IF(s!BD62*s!BI62+s!BE62*s!BH62=0,0,Q63*s!BD62*s!BI62/(s!BD62*s!BI62+s!BE62*s!BH62))+IF(s!BF62*s!BI62+s!BG62*s!BH62=0,0,W63*s!BF62*s!BI62/(s!BF62*s!BI62+s!BG62*s!BH62))+IF(s!BB62*s!BI62+s!BC62*s!BH62+s!BD62*s!BG62+s!BE62*s!BF62=0,0,N63*s!BB62*s!BI62/(s!BB62*s!BI62+s!BC62*s!BH62+s!BD62*s!BG62+s!BE62*s!BF62)) -> 20.181636989312107 | BJ63: =SUM(BB63:BI63) -> 326
A64: =A63 -> 100 | B64: =B63 -> 1 | C64: =C63 -> 1 | D64: =D63 -> 2 | E64: =E63 -> 5 | F64: =F63 -> 2 | G64: =G63 -> 1 | H64: =H63 -> 2 | I64: =I63 -> 1 | J64: =J63 -> 2 | K64: =K63 -> 4 | L64: =L63 -> 2 | M64: =M63 -> 4 | N64: =N63 -> 8 | O64: =O63 -> 4 | P64: =P63 -> 2 | Q64: =Q63 -> 4 | R64: =R63 -> 2 | S64: =S63 -> 1 | T64: =T63 -> 2 | U64: =U63 -> 1 | V64: =V63 -> 2 | W64: =W63 -> 4 | X64: =X63 -> 2 | Y64: =Y63 -> 1 | Z64: =Z63 -> 2 | AA64: =AA63 -> 1 | AB64: =AB63 -> 163 | AK64: =AK63 -> 205 | AL64: =AL63 -> 7 | AM64: =AM63 -> 8 | AN64: =AN63 -> 8 | AO64: =AO63 -> 8 | AP64: =AP63 -> 8 | AQ64: =AQ63 -> 8 | AR64: =AR63 -> 8 | AS64: =AS63 -> 260 | BB64: =AK64+IF(s!BB63*s!BE63+s!BC63*s!BD63=0,0,E64*s!BB63*s!BE63/(s!BB63*s!BE63+s!BC63*s!BD63)+IF(s!BB63*s!BG63+s!BC63*s!BF63=0,0,K64*s!BB63*s!BG63/(s!BB63*s!BG63+s!BC63*s!BF63))+IF(s!BB63*s!BH63+s!BD63*s!BF63=0,0,M64*s!BB63*s!BH63/(s!BB63*s!BH63+s!BD63*s!BF63))+IF(s!BB63*s!BI63+s!BC63*s!BH63+s!BD63*s!BG63+s!BE63*s!BF63=0,0,N64*s!BB63*s!BI63/(s!BB63*s!BI63+s!BC63*s!BH63+s!BD63*s!BG63+s!BE63*s!BF63)
)) -> 223.76658467305739 | BC64: =AL64+IF(s!BC63*s!BD63+s!BB63*s!BE63=0,0,E64*s!BC63*s!BD63/(s!BC63*s!BD63+s!BB63*s!BE63))+IF(s!BB63*s!BG63+s!BC63*s!BF63=0,0,K64*s!BC63*s!BF63/(s!BB63*s!BG63+s!BC63*s!BF63))+IF(s!BC63*s!BI63+s!BE63*s!BG63=0,0,O64*s!BC63*s!BI63/(s!BC63*s!BI63+s!BE63*s!BG63))+IF(s!BB63*s!BI63+s!BC63*s!BH63+s!BD63*s!BG63+s!BE63*s!BF63=0,0,N64*s!BC63*s!BH63/(s!BB63*s!BI63+s!BC63*s!BH63+s!BD63*s!BG63+s!BE63*s!BF63)) -> 11.386767416122966 | BD64: =AM64+IF(s!BC63*s!BD63+s!BB63*s!BE63=0,0,E64*s!BC63*s!BD63/(s!BC63*s!BD63+s!BB63*s!BE63))+IF(s!BD63*s!BF63+s!BB63*s!BH63=0,0,M64*s!BD63*s!BF63/(s!BD63*s!BF63+s!BB63*s!BH63))+IF(s!BD63*s!BI63+s!BE63*s!BH63=0,0,Q64*s!BD63*s!BI63/(s!BD63*s!BI63+s!BE63*s!BH63))+IF(s!BB63*s!BI63+s!BC63*s!BH63+s!BD63*s!BG63+s!BE63*s!BF63=0,0,N64*s!BD63*s!BG63/(s!BB63*s!BI63+s!BC63*s!BH63+s!BD63*s!BG63+s!BE63*s!BF63)) -> 10.119740338878792 | BE64: =AN64+IF(s!BB63*s!BE63+s!BC63*s!BD63=0,0,E64*s!BB63*s!BE63/(s!BB63*s!BE63+s!BC63*s!BD63))+IF(s!BC63*s!BI63+s!BE63*s!BG63=0,0,O64*s!BE63*s!BG63/(s!BC63*s!BI63+s!BE63*s!BG63))+IF(s!BD63*s!BI63+s!BE63*s!BH63=0,0,Q64*s!BE63*s!BH63/(s!BD63*s!BI63+s!BE63*s!BH63))+IF(s!BB63*s!BI63+s!BC63*s!BH63+s!BD63*s!BG63+s!BE63*s!BF63=0,0,N64*s!BE63*s!BF63/(s!BB63*s!BI63+s!BC63*s!BH63+s!BD63*s!BG63+s!BE63*s!BF63)) -> 16.726907571940849 | BF64: =AO64+IF(s!BB63*s!BG63+s!BC63*s!BF63=0,0,K64*s!BC63*s!BF63/(s!BB63*s!BG63+s!BC63*s!BF63))+IF(s!BD63*s!BF63+s!BB63*s!BH63=0,0,M64*s!BD63*s!BF63/(s!BD63*s!BF63+s!BB63*s!BH63))+IF(s!BF63*s!BI63+s!BG63*s!BH63=0,0,W64*s!BF63*s!BI63/(s!BF63*s!BI63+s!BG63*s!BH63))+IF(s!BB63*s!BI63+s!BC63*s!BH63+s!BD63*s!BG63+s!BE63*s!BF63=0,0,N64*s!BE63*s!BF63/(s!BB63*s!BI63+s!BC63*s!BH63+s!BD63*s!BG63+s!BE63*s!BF63)) -> 10.141959886355803 | BG64: =AP64+IF(s!BB63*s!BG63+s!BC63*s!BF63=0,0,K64*s!BB63*s!BG63/(s!BB63*s!BG63+s!BC63*s!BF63))+IF(s!BC63*s!BI63+s!BE63*s!BG63=0,0,O64*s!BE63*s!BG63/(s!BC63*s!BI63+s!BE63*s!BG63))+IF(s!BF63*s!BI63+s!BG63*s!BH63=0,0,W64*s!BG63*s!BH63/(s!BF63*s!BI63+s!BG63*s!BH63))+IF(s!BB63*s!BI63+s!BC63*s!BH63+s!BD63*s!BG63+s!BE63*s!BF63=0,0,N64*s!BD63*s!BG63/(s!BB63*s!BI63+s!BC63*s!BH63+s!BD63*s!BG63+s!BE63*s!BF63)) -> 15.70468802446384 | BH64: =AQ64+IF(s!BB63*s!BH63+s!BD63*s!BF63=0,0,M64*s!BB63*s!BH63/(s!BB63*s!BH63+s!BD63*s!BF63))+IF(s!BD63*s!BI63+s!BE63*s!BH63=0,0,Q64*s!BE63*s!BH63/(s!BD63*s!BI63+s!BE63*s!BH63))+IF(s!BF63*s!BI63+s!BG63*s!BH63=0,0,W64*s!BG63*s!BH63/(s!BF63*s!BI63+s!BG63*s!BH63))+IF(s!BB63*s!BI63+s!BC63*s!BH63+s!BD63*s!BG63+s!BE63*s!BF63=0,0,N64*s!BC63*s!BH63/(s!BB63*s!BI63+s!BC63*s!BH63+s!BD63*s!BG63+s!BE63*s!BF63)) -> 17.971715101708014 | BI64: =AR64+IF(s!BC63*s!BI63+s!BE63*s!BG63=0,0,O64*s!BC63*s!BI63/(s!BC63*s!BI63+s!BE63*s!BG63))+IF(s!BD63*s!BI63+s!BE63*s!BH63=0,0,Q64*s!BD63*s!BI63/(s!BD63*s!BI63+s!BE63*s!BH63))+IF(s!BF63*s!BI63+s!BG63*s!BH63=0,0,W64*s!BF63*s!BI63/(s!BF63*s!BI63+s!BG63*s!BH63))+IF(s!BB63*s!BI63+s!BC63*s!BH63+s!BD63*s!BG63+s!BE63*s!BF63=0,0,N64*s!BB63*s!BI63/(s!BB63*s!BI63+s!BC63*s!BH63+s!BD63*s!BG63+s!BE63*s!BF63)) -> 20.181636987472345 | BJ64: =SUM(BB64:BI64) -> 326
A65: =A64 -> 100 | B65: =B64 -> 1 | C65: =C64 -> 1 | D65: =D64 -> 2 | E65: =E64 -> 5 | F65: =F64 -> 2 | G65: =G64 -> 1 | H65: =H64 -> 2 | I65: =I64 -> 1 | J65: =J64 -> 2 | K65: =K64 -> 4 | L65: =L64 -> 2 | M65: =M64 -> 4 | N65: =N64 -> 8 | O65: =O64 -> 4 | P65: =P64 -> 2 | Q65: =Q64 -> 4 | R65: =R64 -> 2 | S65: =S64 -> 1 | T65: =T64 -> 2 | U65: =U64 -> 1 | V65: =V64 -> 2 | W65: =W64 -> 4 | X65: =X64 -> 2 | Y65: =Y64 -> 1 | Z65: =Z64 -> 2 | AA65: =AA64 -> 1 | AB65: =AB64 -> 163 | AK65: =AK64 -> 205 | AL65: =AL64 -> 7 | AM65: =AM64 -> 8 | AN65: =AN64 -> 8 | AO65: =AO64 -> 8 | AP65: =AP64 -> 8 | AQ65: =AQ64 -> 8 | AR65: =AR64 -> 8 | AS65: =AS64 -> 260 | BB65: =AK65+IF(s!BB64*s!BE64+s!BC64*s!BD64=0,0,E65*s!BB64*s!BE64/(s!BB64*s!BE64+s!BC64*s!BD64)+IF(s!BB64*s!BG64+s!BC64*s!BF64=0,0,K65*s!BB64*s!BG64/(s!BB64*s!BG64+s!BC64*s!BF64))+IF(s!BB64*s!BH64+s!BD64*s!BF64=0,0,M65*s!BB64*s!BH64/(s!BB64*s!BH64+s!BD64*s!BF64))+IF(s!BB64*s!BI64+s!BC64*s!BH64+s!BD64*s!BG64+s!BE64*s!BF64=0,0,N65*s!BB64*s!BI64/(s!BB64*s!BI64+s!BC64*s!BH64+s!BD64*s!BG64+s!BE64*s!BF64)
)) -> 223.7665846729239 | BC65: =AL65+IF(s!BC64*s!BD64+s!BB64*s!BE64=0,0,E65*s!BC64*s!BD64/(s!BC64*s!BD64+s!BB64*s!BE64))+IF(s!BB64*s!BG64+s!BC64*s!BF64=0,0,K65*s!BC64*s!BF64/(s!BB64*s!BG64+s!BC64*s!BF64))+IF(s!BC64*s!BI64+s!BE64*s!BG64=0,0,O65*s!BC64*s!BI64/(s!BC64*s!BI64+s!BE64*s!BG64))+IF(s!BB64*s!BI64+s!BC64*s!BH64+s!BD64*s!BG64+s!BE64*s!BF64=0,0,N65*s!BC64*s!BH64/(s!BB64*s!BI64+s!BC64*s!BH64+s!BD64*s!BG64+s!BE64*s!BF64)) -> 11.386767415940158 | BD65: =AM65+IF(s!BC64*s!BD64+s!BB64*s!BE64=0,0,E65*s!BC64*s!BD64/(s!BC64*s!BD64+s!BB64*s!BE64))+IF(s!BD64*s!BF64+s!BB64*s!BH64=0,0,M65*s!BD64*s!BF64/(s!BD64*s!BF64+s!BB64*s!BH64))+IF(s!BD64*s!BI64+s!BE64*s!BH64=0,0,Q65*s!BD64*s!BI64/(s!BD64*s!BI64+s!BE64*s!BH64))+IF(s!BB64*s!BI64+s!BC64*s!BH64+s!BD64*s!BG64+s!BE64*s!BF64=0,0,N65*s!BD64*s!BG64/(s!BB64*s!BI64+s!BC64*s!BH64+s!BD64*s!BG64+s!BE64*s!BF64)) -> 10.119740338444434 | BE65: =AN65+IF(s!BB64*s!BE64+s!BC64*s!BD64=0,0,E65*s!BB64*s!BE64/(s!BB64*s!BE64+s!BC64*s!BD64))+IF(s!BC64*s!BI64+s!BE64*s!BG64=0,0,O65*s!BE64*s!BG64/(s!BC64*s!BI64+s!BE64*s!BG64))+IF(s!BD64*s!BI64+s!BE64*s!BH64=0,0,Q65*s!BE64*s!BH64/(s!BD64*s!BI64+s!BE64*s!BH64))+IF(s!BB64*s!BI64+s!BC64*s!BH64+s!BD64*s!BG64+s!BE64*s!BF64=0,0,N65*s!BE64*s!BF64/(s!BB64*s!BI64+s!BC64*s!BH64+s!BD64*s!BG64+s!BE64*s!BF64)) -> 16.726907572691491 | BF65: =AO65+IF(s!BB64*s!BG64+s!BC64*s!BF64=0,0,K65*s!BC64*s!BF64/(s!BB64*s!BG64+s!BC64*s!BF64))+IF(s!BD64*s!BF64+s!BB64*s!BH64=0,0,M65*s!BD64*s!BF64/(s!BD64*s!BF64+s!BB64*s!BH64))+IF(s!BF64*s!BI64+s!BG64*s!BH64=0,0,W65*s!BF64*s!BI64/(s!BF64*s!BI64+s!BG64*s!BH64))+IF(s!BB64*s!BI64+s!BC64*s!BH64+s!BD64*s!BG64+s!BE64*s!BF64=0,0,N65*s!BE64*s!BF64/(s!BB64*s!BI64+s!BC64*s!BH64+s!BD64*s!BG64+s!BE64*s!BF64)) -> 10.141959885923647 | BG65: =AP65+IF(s!BB64*s!BG64+s!BC64*s!BF64=0,0,K65*s!BB64*s!BG64/(s!BB64*s!BG64+s!BC64*s!BF64))+IF(s!BC64*s!BI64+s!BE64*s!BG64=0,0,O65*s!BE64*s!BG64/(s!BC64*s!BI64+s!BE64*s!BG64))+IF(s!BF64*s!BI64+s!BG64*s!BH64=0,0,W65*s!BG64*s!BH64/(s!BF64*s!BI64+s!BG64*s!BH64))+IF(s!BB64*s!BI64+s!BC64*s!BH64+s!BD64*s!BG64+s!BE64*s!BF64=0,0,N65*s!BD64*s!BG64/(s!BB64*s!BI64+s!BC64*s!BH64+s!BD64*s!BG64+s!BE64*s!BF64)) -> 15.704688025212279 | BH65: =AQ65+IF(s!BB64*s!BH64+s!BD64*s!BF64=0,0,M65*s!BB64*s!BH64/(s!BB64*s!BH64+s!BD64*s!BF64))+IF(s!BD64*s!BI64+s!BE64*s!BH64=0,0,Q65*s!BE64*s!BH64/(s!BD64*s!BI64+s!BE64*s!BH64))+IF(s!BF64*s!BI64+s!BG64*s!BH64=0,0,W65*s!BG64*s!BH64/(s!BF64*s!BI64+s!BG64*s!BH64))+IF(s!BB64*s!BI64+s!BC64*s!BH64+s!BD64*s!BG64+s!BE64*s!BF64=0,0,N65*s!BC64*s!BH64/(s!BB64*s!BI64+s!BC64*s!BH64+s!BD64*s!BG64+s!BE64*s!BF64)) -> 17.971715102708007 | BI65: =AR65+IF(s!BC64*s!BI64+s!BE64*s!BG64=0,0,O65*s!BC64*s!BI64/(s!BC64*s!BI64+s!BE64*s!BG64))+IF(s!BD64*s!BI64+s!BE64*s!BH64=0,0,Q65*s!BD64*s!BI64/(s!BD64*s!BI64+s!BE64*s!BH64))+IF(s!BF64*s!BI64+s!BG64*s!BH64=0,0,W65*s!BF64*s!BI64/(s!BF64*s!BI64+s!BG64*s!BH64))+IF(s!BB64*s!BI64+s!BC64*s!BH64+s!BD64*s!BG64+s!BE64*s!BF64=0,0,N65*s!BB64*s!BI64/(s!BB64*s!BI64+s!BC64*s!BH64+s!BD64*s!BG64+s!BE64*s!BF64)) -> 20.181636986156072 | BJ65: =SUM(BB65:BI65) -> 326
A66: =A65 -> 100 | B66: =B65 -> 1 | C66: =C65 -> 1 | D66: =D65 -> 2 | E66: =E65 -> 5 | F66: =F65 -> 2 | G66: =G65 -> 1 | H66: =H65 -> 2 | I66: =I65 -> 1 | J66: =J65 -> 2 | K66: =K65 -> 4 | L66: =L65 -> 2 | M66: =M65 -> 4 | N66: =N65 -> 8 | O66: =O65 -> 4 | P66: =P65 -> 2 | Q66: =Q65 -> 4 | R66: =R65 -> 2 | S66: =S65 -> 1 | T66: =T65 -> 2 | U66: =U65 -> 1 | V66: =V65 -> 2 | W66: =W65 -> 4 | X66: =X65 -> 2 | Y66: =Y65 -> 1 | Z66: =Z65 -> 2 | AA66: =AA65 -> 1 | AB66: =AB65 -> 163 | AK66: =AK65 -> 205 | AL66: =AL65 -> 7 | AM66: =AM65 -> 8 | AN66: =AN65 -> 8 | AO66: =AO65 -> 8 | AP66: =AP65 -> 8 | AQ66: =AQ65 -> 8 | AR66: =AR65 -> 8 | AS66: =AS65 -> 260 | BB66: =AK66+IF(s!BB65*s!BE65+s!BC65*s!BD65=0,0,E66*s!BB65*s!BE65/(s!BB65*s!BE65+s!BC65*s!BD65)+IF(s!BB65*s!BG65+s!BC65*s!BF65=0,0,K66*s!BB65*s!BG65/(s!BB65*s!BG65+s!BC65*s!BF65))+IF(s!BB65*s!BH65+s!BD65*s!BF65=0,0,M66*s!BB65*s!BH65/(s!BB65*s!BH65+s!BD65*s!BF65))+IF(s!BB65*s!BI65+s!BC65*s!BH65+s!BD65*s!BG65+s!BE65*s!BF65=0,0,N66*s!BB65*s!BI65/(s!BB65*s!BI65+s!BC65*s!BH65+s!BD65*s!BG65+s!BE65*s!BF65)
)) -> 223.7665846728284 | BC66: =AL66+IF(s!BC65*s!BD65+s!BB65*s!BE65=0,0,E66*s!BC65*s!BD65/(s!BC65*s!BD65+s!BB65*s!BE65))+IF(s!BB65*s!BG65+s!BC65*s!BF65=0,0,K66*s!BC65*s!BF65/(s!BB65*s!BG65+s!BC65*s!BF65))+IF(s!BC65*s!BI65+s!BE65*s!BG65=0,0,O66*s!BC65*s!BI65/(s!BC65*s!BI65+s!BE65*s!BG65))+IF(s!BB65*s!BI65+s!BC65*s!BH65+s!BD65*s!BG65+s!BE65*s!BF65=0,0,N66*s!BC65*s!BH65/(s!BB65*s!BI65+s!BC65*s!BH65+s!BD65*s!BG65+s!BE65*s!BF65)) -> 11.386767415809373 | BD66: =AM66+IF(s!BC65*s!BD65+s!BB65*s!BE65=0,0,E66*s!BC65*s!BD65/(s!BC65*s!BD65+s!BB65*s!BE65))+IF(s!BD65*s!BF65+s!BB65*s!BH65=0,0,M66*s!BD65*s!BF65/(s!BD65*s!BF65+s!BB65*s!BH65))+IF(s!BD65*s!BI65+s!BE65*s!BH65=0,0,Q66*s!BD65*s!BI65/(s!BD65*s!BI65+s!BE65*s!BH65))+IF(s!BB65*s!BI65+s!BC65*s!BH65+s!BD65*s!BG65+s!BE65*s!BF65=0,0,N66*s!BD65*s!BG65/(s!BB65*s!BI65+s!BC65*s!BH65+s!BD65*s!BG65+s!BE65*s!BF65)) -> 10.119740338133672 | BE66: =AN66+IF(s!BB65*s!BE65+s!BC65*s!BD65=0,0,E66*s!BB65*s!BE65/(s!BB65*s!BE65+s!BC65*s!BD65))+IF(s!BC65*s!BI65+s!BE65*s!BG65=0,0,O66*s!BE65*s!BG65/(s!BC65*s!BI65+s!BE65*s!BG65))+IF(s!BD65*s!BI65+s!BE65*s!BH65=0,0,Q66*s!BE65*s!BH65/(s!BD65*s!BI65+s!BE65*s!BH65))+IF(s!BB65*s!BI65+s!BC65*s!BH65+s!BD65*s!BG65+s!BE65*s!BF65=0,0,N66*s!BE65*s!BF65/(s!BB65*s!BI65+s!BC65*s!BH65+s!BD65*s!BG65+s!BE65*s!BF65)) -> 16.726907573228541 | BF66: =AO66+IF(s!BB65*s!BG65+s!BC65*s!BF65=0,0,K66*s!BC65*s!BF65/(s!BB65*s!BG65+s!BC65*s!BF65))+IF(s!BD65*s!BF65+s!BB65*s!BH65=0,0,M66*s!BD65*s!BF65/(s!BD65*s!BF65+s!BB65*s!BH65))+IF(s!BF65*s!BI65+s!BG65*s!BH65=0,0,W66*s!BF65*s!BI65/(s!BF65*s!BI65+s!BG65*s!BH65))+IF(s!BB65*s!BI65+s!BC65*s!BH65+s!BD65*s!BG65+s!BE65*s!BF65=0,0,N66*s!BE65*s!BF65/(s!BB65*s!BI65+s!BC65*s!BH65+s!BD65*s!BG65+s!BE65*s!BF65)) -> 10.141959885614458 | BG66: =AP66+IF(s!BB65*s!BG65+s!BC65*s!BF65=0,0,K66*s!BB65*s!BG65/(s!BB65*s!BG65+s!BC65*s!BF65))+IF(s!BC65*s!BI65+s!BE65*s!BG65=0,0,O66*s!BE65*s!BG65/(s!BC65*s!BI65+s!BE65*s!BG65))+IF(s!BF65*s!BI65+s!BG65*s!BH65=0,0,W66*s!BG65*s!BH65/(s!BF65*s!BI65+s!BG65*s!BH65))+IF(s!BB65*s!BI65+s!BC65*s!BH65+s!BD65*s!BG65+s!BE65*s!BF65=0,0,N66*s!BD65*s!BG65/(s!BB65*s!BI65+s!BC65*s!BH65+s!BD65*s!BG65+s!BE65*s!BF65)) -> 15.704688025747751 | BH66: =AQ66+IF(s!BB65*s!BH65+s!BD65*s!BF65=0,0,M66*s!BB65*s!BH65/(s!BB65*s!BH65+s!BD65*s!BF65))+IF(s!BD65*s!BI65+s!BE65*s!BH65=0,0,Q66*s!BE65*s!BH65/(s!BD65*s!BI65+s!BE65*s!BH65))+IF(s!BF65*s!BI65+s!BG65*s!BH65=0,0,W66*s!BG65*s!BH65/(s!BF65*s!BI65+s!BG65*s!BH65))+IF(s!BB65*s!BI65+s!BC65*s!BH65+s!BD65*s!BG65+s!BE65*s!BF65=0,0,N66*s!BC65*s!BH65/(s!BB65*s!BI65+s!BC65*s!BH65+s!BD65*s!BG65+s!BE65*s!BF65)) -> 17.971715103423453 | BI66: =AR66+IF(s!BC65*s!BI65+s!BE65*s!BG65=0,0,O66*s!BC65*s!BI65/(s!BC65*s!BI65+s!BE65*s!BG65))+IF(s!BD65*s!BI65+s!BE65*s!BH65=0,0,Q66*s!BD65*s!BI65/(s!BD65*s!BI65+s!BE65*s!BH65))+IF(s!BF65*s!BI65+s!BG65*s!BH65=0,0,W66*s!BF65*s!BI65/(s!BF65*s!BI65+s!BG65*s!BH65))+IF(s!BB65*s!BI65+s!BC65*s!BH65+s!BD65*s!BG65+s!BE65*s!BF65=0,0,N66*s!BB65*s!BI65/(s!BB65*s!BI65+s!BC65*s!BH65+s!BD65*s!BG65+s!BE65*s!BF65)) -> 20.181636985214336 | BJ66: =SUM(BB66:BI66) -> 326
A67: =A66 -> 100 | B67: =B66 -> 1 | C67: =C66 -> 1 | D67: =D66 -> 2 | E67: =E66 -> 5 | F67: =F66 -> 2 | G67: =G66 -> 1 | H67: =H66 -> 2 | I67: =I66 -> 1 | J67: =J66 -> 2 | K67: =K66 -> 4 | L67: =L66 -> 2 | M67: =M66 -> 4 | N67: =N66 -> 8 | O67: =O66 -> 4 | P67: =P66 -> 2 | Q67: =Q66 -> 4 | R67: =R66 -> 2 | S67: =S66 -> 1 | T67: =T66 -> 2 | U67: =U66 -> 1 | V67: =V66 -> 2 | W67: =W66 -> 4 | X67: =X66 -> 2 | Y67: =Y66 -> 1 | Z67: =Z66 -> 2 | AA67: =AA66 -> 1 | AB67: =AB66 -> 163 | AK67: =AK66 -> 205 | AL67: =AL66 -> 7 | AM67: =AM66 -> 8 | AN67: =AN66 -> 8 | AO67: =AO66 -> 8 | AP67: =AP66 -> 8 | AQ67: =AQ66 -> 8 | AR67: =AR66 -> 8 | AS67: =AS66 -> 260 | BB67: =AK67+IF(s!BB66*s!BE66+s!BC66*s!BD66=0,0,E67*s!BB66*s!BE66/(s!BB66*s!BE66+s!BC66*s!BD66)+IF(s!BB66*s!BG66+s!BC66*s!BF66=0,0,K67*s!BB66*s!BG66/(s!BB66*s!BG66+s!BC66*s!BF66))+IF(s!BB66*s!BH66+s!BD66*s!BF66=0,0,M67*s!BB66*s!BH66/(s!BB66*s!BH66+s!BD66*s!BF66))+IF(s!BB66*s!BI66+s!BC66*s!BH66+s!BD66*s!BG66+s!BE66*s!BF66=0,0,N67*s!BB66*s!BI66/(s!BB66*s!BI66+s!BC66*s!BH66+s!BD66*s!BG66+s!BE66*s!BF66)
)) -> 223.76658467276008 | BC67: =AL67+IF(s!BC66*s!BD66+s!BB66*s!BE66=0,0,E67*s!BC66*s!BD66/(s!BC66*s!BD66+s!BB66*s!BE66))+IF(s!BB66*s!BG66+s!BC66*s!BF66=0,0,K67*s!BC66*s!BF66/(s!BB66*s!BG66+s!BC66*s!BF66))+IF(s!BC66*s!BI66+s!BE66*s!BG66=0,0,O67*s!BC66*s!BI66/(s!BC66*s!BI66+s!BE66*s!BG66))+IF(s!BB66*s!BI66+s!BC66*s!BH66+s!BD66*s!BG66+s!BE66*s!BF66=0,0,N67*s!BC66*s!BH66/(s!BB66*s!BI66+s!BC66*s!BH66+s!BD66*s!BG66+s!BE66*s!BF66)) -> 11.386767415715807 | BD67: =AM67+IF(s!BC66*s!BD66+s!BB66*s!BE66=0,0,E67*s!BC66*s!BD66/(s!BC66*s!BD66+s!BB66*s!BE66))+IF(s!BD66*s!BF66+s!BB66*s!BH66=0,0,M67*s!BD66*s!BF66/(s!BD66*s!BF66+s!BB66*s!BH66))+IF(s!BD66*s!BI66+s!BE66*s!BH66=0,0,Q67*s!BD66*s!BI66/(s!BD66*s!BI66+s!BE66*s!BH66))+IF(s!BB66*s!BI66+s!BC66*s!BH66+s!BD66*s!BG66+s!BE66*s!BF66=0,0,N67*s!BD66*s!BG66/(s!BB66*s!BI66+s!BC66*s!BH66+s!BD66*s!BG66+s!BE66*s!BF66)) -> 10.119740337911336 | BE67: =AN67+IF(s!BB66*s!BE66+s!BC66*s!BD66=0,0,E67*s!BB66*s!BE66/(s!BB66*s!BE66+s!BC66*s!BD66))+IF(s!BC66*s!BI66+s!BE66*s!BG66=0,0,O67*s!BE66*s!BG66/(s!BC66*s!BI66+s!BE66*s!BG66))+IF(s!BD66*s!BI66+s!BE66*s!BH66=0,0,Q67*s!BE66*s!BH66/(s!BD66*s!BI66+s!BE66*s!BH66))+IF(s!BB66*s!BI66+s!BC66*s!BH66+s!BD66*s!BG66+s!BE66*s!BF66=0,0,N67*s!BE66*s!BF66/(s!BB66*s!BI66+s!BC66*s!BH66+s!BD66*s!BG66+s!BE66*s!BF66)) -> 16.726907573612767 | BF67: =AO67+IF(s!BB66*s!BG66+s!BC66*s!BF66=0,0,K67*s!BC66*s!BF66/(s!BB66*s!BG66+s!BC66*s!BF66))+IF(s!BD66*s!BF66+s!BB66*s!BH66=0,0,M67*s!BD66*s!BF66/(s!BD66*s!BF66+s!BB66*s!BH66))+IF(s!BF66*s!BI66+s!BG66*s!BH66=0,0,W67*s!BF66*s!BI66/(s!BF66*s!BI66+s!BG66*s!BH66))+IF(s!BB66*s!BI66+s!BC66*s!BH66+s!BD66*s!BG66+s!BE66*s!BF66=0,0,N67*s!BE66*s!BF66/(s!BB66*s!BI66+s!BC66*s!BH66+s!BD66*s!BG66+s!BE66*s!BF66)) -> 10.14195988539325 | BG67: =AP67+IF(s!BB66*s!BG66+s!BC66*s!BF66=0,0,K67*s!BB66*s!BG66/(s!BB66*s!BG66+s!BC66*s!BF66))+IF(s!BC66*s!BI66+s!BE66*s!BG66=0,0,O67*s!BE66*s!BG66/(s!BC66*s!BI66+s!BE66*s!BG66))+IF(s!BF66*s!BI66+s!BG66*s!BH66=0,0,W67*s!BG66*s!BH66/(s!BF66*s!BI66+s!BG66*s!BH66))+IF(s!BB66*s!BI66+s!BC66*s!BH66+s!BD66*s!BG66+s!BE66*s!BF66=0,0,N67*s!BD66*s!BG66/(s!BB66*s!BI66+s!BC66*s!BH66+s!BD66*s!BG66+s!BE66*s!BF66)) -> 15.704688026130855 | BH67: =AQ67+IF(s!BB66*s!BH66+s!BD66*s!BF66=0,0,M67*s!BB66*s!BH66/(s!BB66*s!BH66+s!BD66*s!BF66))+IF(s!BD66*s!BI66+s!BE66*s!BH66=0,0,Q67*s!BE66*s!BH66/(s!BD66*s!BI66+s!BE66*s!BH66))+IF(s!BF66*s!BI66+s!BG66*s!BH66=0,0,W67*s!BG66*s!BH66/(s!BF66*s!BI66+s!BG66*s!BH66))+IF(s!BB66*s!BI66+s!BC66*s!BH66+s!BD66*s!BG66+s!BE66*s!BF66=0,0,N67*s!BC66*s!BH66/(s!BB66*s!BI66+s!BC66*s!BH66+s!BD66*s!BG66+s!BE66*s!BF66)) -> 17.971715103935328 | BI67: =AR67+IF(s!BC66*s!BI66+s!BE66*s!BG66=0,0,O67*s!BC66*s!BI66/(s!BC66*s!BI66+s!BE66*s!BG66))+IF(s!BD66*s!BI66+s!BE66*s!BH66=0,0,Q67*s!BD66*s!BI66/(s!BD66*s!BI66+s!BE66*s!BH66))+IF(s!BF66*s!BI66+s!BG66*s!BH66=0,0,W67*s!BF66*s!BI66/(s!BF66*s!BI66+s!BG66*s!BH66))+IF(s!BB66*s!BI66+s!BC66*s!BH66+s!BD66*s!BG66+s!BE66*s!BF66=0,0,N67*s!BB66*s!BI66/(s!BB66*s!BI66+s!BC66*s!BH66+s!BD66*s!BG66+s!BE66*s!BF66)) -> 20.181636984540571 | BJ67: =SUM(BB67:BI67) -> 326
A68: =A67 -> 100 | B68: =B67 -> 1 | C68: =C67 -> 1 | D68: =D67 -> 2 | E68: =E67 -> 5 | F68: =F67 -> 2 | G68: =G67 -> 1 | H68: =H67 -> 2 | I68: =I67 -> 1 | J68: =J67 -> 2 | K68: =K67 -> 4 | L68: =L67 -> 2 | M68: =M67 -> 4 | N68: =N67 -> 8 | O68: =O67 -> 4 | P68: =P67 -> 2 | Q68: =Q67 -> 4 | R68: =R67 -> 2 | S68: =S67 -> 1 | T68: =T67 -> 2 | U68: =U67 -> 1 | V68: =V67 -> 2 | W68: =W67 -> 4 | X68: =X67 -> 2 | Y68: =Y67 -> 1 | Z68: =Z67 -> 2 | AA68: =AA67 -> 1 | AB68: =AB67 -> 163 | AK68: =AK67 -> 205 | AL68: =AL67 -> 7 | AM68: =AM67 -> 8 | AN68: =AN67 -> 8 | AO68: =AO67 -> 8 | AP68: =AP67 -> 8 | AQ68: =AQ67 -> 8 | AR68: =AR67 -> 8 | AS68: =AS67 -> 260 | BB68: =AK68+IF(s!BB67*s!BE67+s!BC67*s!BD67=0,0,E68*s!BB67*s!BE67/(s!BB67*s!BE67+s!BC67*s!BD67)+IF(s!BB67*s!BG67+s!BC67*s!BF67=0,0,K68*s!BB67*s!BG67/(s!BB67*s!BG67+s!BC67*s!BF67))+IF(s!BB67*s!BH67+s!BD67*s!BF67=0,0,M68*s!BB67*s!BH67/(s!BB67*s!BH67+s!BD67*s!BF67))+IF(s!BB67*s!BI67+s!BC67*s!BH67+s!BD67*s!BG67+s!BE67*s!BF67=0,0,N68*s!BB67*s!BI67/(s!BB67*s!BI67+s!BC67*s!BH67+s!BD67*s!BG67+s!BE67*s!BF67)
)) -> 223.76658467271119 | BC68: =AL68+IF(s!BC67*s!BD67+s!BB67*s!BE67=0,0,E68*s!BC67*s!BD67/(s!BC67*s!BD67+s!BB67*s!BE67))+IF(s!BB67*s!BG67+s!BC67*s!BF67=0,0,K68*s!BC67*s!BF67/(s!BB67*s!BG67+s!BC67*s!BF67))+IF(s!BC67*s!BI67+s!BE67*s!BG67=0,0,O68*s!BC67*s!BI67/(s!BC67*s!BI67+s!BE67*s!BG67))+IF(s!BB67*s!BI67+s!BC67*s!BH67+s!BD67*s!BG67+s!BE67*s!BF67=0,0,N68*s!BC67*s!BH67/(s!BB67*s!BI67+s!BC67*s!BH67+s!BD67*s!BG67+s!BE67*s!BF67)) -> 11.386767415648867 | BD68: =AM68+IF(s!BC67*s!BD67+s!BB67*s!BE67=0,0,E68*s!BC67*s!BD67/(s!BC67*s!BD67+s!BB67*s!BE67))+IF(s!BD67*s!BF67+s!BB67*s!BH67=0,0,M68*s!BD67*s!BF67/(s!BD67*s!BF67+s!BB67*s!BH67))+IF(s!BD67*s!BI67+s!BE67*s!BH67=0,0,Q68*s!BD67*s!BI67/(s!BD67*s!BI67+s!BE67*s!BH67))+IF(s!BB67*s!BI67+s!BC67*s!BH67+s!BD67*s!BG67+s!BE67*s!BF67=0,0,N68*s!BD67*s!BG67/(s!BB67*s!BI67+s!BC67*s!BH67+s!BD67*s!BG67+s!BE67*s!BF67)) -> 10.119740337752265 | BE68: =AN68+IF(s!BB67*s!BE67+s!BC67*s!BD67=0,0,E68*s!BB67*s!BE67/(s!BB67*s!BE67+s!BC67*s!BD67))+IF(s!BC67*s!BI67+s!BE67*s!BG67=0,0,O68*s!BE67*s!BG67/(s!BC67*s!BI67+s!BE67*s!BG67))+IF(s!BD67*s!BI67+s!BE67*s!BH67=0,0,Q68*s!BE67*s!BH67/(s!BD67*s!BI67+s!BE67*s!BH67))+IF(s!BB67*s!BI67+s!BC67*s!BH67+s!BD67*s!BG67+s!BE67*s!BF67=0,0,N68*s!BE67*s!BF67/(s!BB67*s!BI67+s!BC67*s!BH67+s!BD67*s!BG67+s!BE67*s!BF67)) -> 16.726907573887665 | BF68: =AO68+IF(s!BB67*s!BG67+s!BC67*s!BF67=0,0,K68*s!BC67*s!BF67/(s!BB67*s!BG67+s!BC67*s!BF67))+IF(s!BD67*s!BF67+s!BB67*s!BH67=0,0,M68*s!BD67*s!BF67/(s!BD67*s!BF67+s!BB67*s!BH67))+IF(s!BF67*s!BI67+s!BG67*s!BH67=0,0,W68*s!BF67*s!BI67/(s!BF67*s!BI67+s!BG67*s!BH67))+IF(s!BB67*s!BI67+s!BC67*s!BH67+s!BD67*s!BG67+s!BE67*s!BF67=0,0,N68*s!BE67*s!BF67/(s!BB67*s!BI67+s!BC67*s!BH67+s!BD67*s!BG67+s!BE67*s!BF67)) -> 10.141959885234982 | BG68: =AP68+IF(s!BB67*s!BG67+s!BC67*s!BF67=0,0,K68*s!BB67*s!BG67/(s!BB67*s!BG67+s!BC67*s!BF67))+IF(s!BC67*s!BI67+s!BE67*s!BG67=0,0,O68*s!BE67*s!BG67/(s!BC67*s!BI67+s!BE67*s!BG67))+IF(s!BF67*s!BI67+s!BG67*s!BH67=0,0,W68*s!BG67*s!BH67/(s!BF67*s!BI67+s!BG67*s!BH67))+IF(s!BB67*s!BI67+s!BC67*s!BH67+s!BD67*s!BG67+s!BE67*s!BF67=0,0,N68*s!BD67*s!BG67/(s!BB67*s!BI67+s!BC67*s!BH67+s!BD67*s!BG67+s!BE67*s!BF67)) -> 15.70468802640495 | BH68: =AQ68+IF(s!BB67*s!BH67+s!BD67*s!BF67=0,0,M68*s!BB67*s!BH67/(s!BB67*s!BH67+s!BD67*s!BF67))+IF(s!BD67*s!BI67+s!BE67*s!BH67=0,0,Q68*s!BE67*s!BH67/(s!BD67*s!BI67+s!BE67*s!BH67))+IF(s!BF67*s!BI67+s!BG67*s!BH67=0,0,W68*s!BG67*s!BH67/(s!BF67*s!BI67+s!BG67*s!BH67))+IF(s!BB67*s!BI67+s!BC67*s!BH67+s!BD67*s!BG67+s!BE67*s!BF67=0,0,N68*s!BC67*s!BH67/(s!BB67*s!BI67+s!BC67*s!BH67+s!BD67*s!BG67+s!BE67*s!BF67)) -> 17.971715104301548 | BI68: =AR68+IF(s!BC67*s!BI67+s!BE67*s!BG67=0,0,O68*s!BC67*s!BI67/(s!BC67*s!BI67+s!BE67*s!BG67))+IF(s!BD67*s!BI67+s!BE67*s!BH67=0,0,Q68*s!BD67*s!BI67/(s!BD67*s!BI67+s!BE67*s!BH67))+IF(s!BF67*s!BI67+s!BG67*s!BH67=0,0,W68*s!BF67*s!BI67/(s!BF67*s!BI67+s!BG67*s!BH67))+IF(s!BB67*s!BI67+s!BC67*s!BH67+s!BD67*s!BG67+s!BE67*s!BF67=0,0,N68*s!BB67*s!BI67/(s!BB67*s!BI67+s!BC67*s!BH67+s!BD67*s!BG67+s!BE67*s!BF67)) -> 20.181636984058521 | BJ68: =SUM(BB68:BI68) -> 326
A69: =A68 -> 100 | B69: =B68 -> 1 | C69: =C68 -> 1 | D69: =D68 -> 2 | E69: =E68 -> 5 | F69: =F68 -> 2 | G69: =G68 -> 1 | H69: =H68 -> 2 | I69: =I68 -> 1 | J69: =J68 -> 2 | K69: =K68 -> 4 | L69: =L68 -> 2 | M69: =M68 -> 4 | N69: =N68 -> 8 | O69: =O68 -> 4 | P69: =P68 -> 2 | Q69: =Q68 -> 4 | R69: =R68 -> 2 | S69: =S68 -> 1 | T69: =T68 -> 2 | U69: =U68 -> 1 | V69: =V68 -> 2 | W69: =W68 -> 4 | X69: =X68 -> 2 | Y69: =Y68 -> 1 | Z69: =Z68 -> 2 | AA69: =AA68 -> 1 | AB69: =AB68 -> 163 | AK69: =AK68 -> 205 | AL69: =AL68 -> 7 | AM69: =AM68 -> 8 | AN69: =AN68 -> 8 | AO69: =AO68 -> 8 | AP69: =AP68 -> 8 | AQ69: =AQ68 -> 8 | AR69: =AR68 -> 8 | AS69: =AS68 -> 260 | BB69: =AK69+IF(s!BB68*s!BE68+s!BC68*s!BD68=0,0,E69*s!BB68*s!BE68/(s!BB68*s!BE68+s!BC68*s!BD68)+IF(s!BB68*s!BG68+s!BC68*s!BF68=0,0,K69*s!BB68*s!BG68/(s!BB68*s!BG68+s!BC68*s!BF68))+IF(s!BB68*s!BH68+s!BD68*s!BF68=0,0,M69*s!BB68*s!BH68/(s!BB68*s!BH68+s!BD68*s!BF68))+IF(s!BB68*s!BI68+s!BC68*s!BH68+s!BD68*s!BG68+s!BE68*s!BF68=0,0,N69*s!BB68*s!BI68/(s!BB68*s!BI68+s!BC68*s!BH68+s!BD68*s!BG68+s!BE68*s!BF68)
)) -> 223.76658467267623 | BC69: =AL69+IF(s!BC68*s!BD68+s!BB68*s!BE68=0,0,E69*s!BC68*s!BD68/(s!BC68*s!BD68+s!BB68*s!BE68))+IF(s!BB68*s!BG68+s!BC68*s!BF68=0,0,K69*s!BC68*s!BF68/(s!BB68*s!BG68+s!BC68*s!BF68))+IF(s!BC68*s!BI68+s!BE68*s!BG68=0,0,O69*s!BC68*s!BI68/(s!BC68*s!BI68+s!BE68*s!BG68))+IF(s!BB68*s!BI68+s!BC68*s!BH68+s!BD68*s!BG68+s!BE68*s!BF68=0,0,N69*s!BC68*s!BH68/(s!BB68*s!BI68+s!BC68*s!BH68+s!BD68*s!BG68+s!BE68*s!BF68)) -> 11.386767415600973 | BD69: =AM69+IF(s!BC68*s!BD68+s!BB68*s!BE68=0,0,E69*s!BC68*s!BD68/(s!BC68*s!BD68+s!BB68*s!BE68))+IF(s!BD68*s!BF68+s!BB68*s!BH68=0,0,M69*s!BD68*s!BF68/(s!BD68*s!BF68+s!BB68*s!BH68))+IF(s!BD68*s!BI68+s!BE68*s!BH68=0,0,Q69*s!BD68*s!BI68/(s!BD68*s!BI68+s!BE68*s!BH68))+IF(s!BB68*s!BI68+s!BC68*s!BH68+s!BD68*s!BG68+s!BE68*s!BF68=0,0,N69*s!BD68*s!BG68/(s!BB68*s!BI68+s!BC68*s!BH68+s!BD68*s!BG68+s!BE68*s!BF68)) -> 10.119740337638458 | BE69: =AN69+IF(s!BB68*s!BE68+s!BC68*s!BD68=0,0,E69*s!BB68*s!BE68/(s!BB68*s!BE68+s!BC68*s!BD68))+IF(s!BC68*s!BI68+s!BE68*s!BG68=0,0,O69*s!BE68*s!BG68/(s!BC68*s!BI68+s!BE68*s!BG68))+IF(s!BD68*s!BI68+s!BE68*s!BH68=0,0,Q69*s!BE68*s!BH68/(s!BD68*s!BI68+s!BE68*s!BH68))+IF(s!BB68*s!BI68+s!BC68*s!BH68+s!BD68*s!BG68+s!BE68*s!BF68=0,0,N69*s!BE68*s!BF68/(s!BB68*s!BI68+s!BC68*s!BH68+s!BD68*s!BG68+s!BE68*s!BF68)) -> 16.72690757408434 | BF69: =AO69+IF(s!BB68*s!BG68+s!BC68*s!BF68=0,0,K69*s!BC68*s!BF68/(s!BB68*s!BG68+s!BC68*s!BF68))+IF(s!BD68*s!BF68+s!BB68*s!BH68=0,0,M69*s!BD68*s!BF68/(s!BD68*s!BF68+s!BB68*s!BH68))+IF(s!BF68*s!BI68+s!BG68*s!BH68=0,0,W69*s!BF68*s!BI68/(s!BF68*s!BI68+s!BG68*s!BH68))+IF(s!BB68*s!BI68+s!BC68*s!BH68+s!BD68*s!BG68+s!BE68*s!BF68=0,0,N69*s!BE68*s!BF68/(s!BB68*s!BI68+s!BC68*s!BH68+s!BD68*s!BG68+s!BE68*s!BF68)) -> 10.141959885121752 | BG69: =AP69+IF(s!BB68*s!BG68+s!BC68*s!BF68=0,0,K69*s!BB68*s!BG68/(s!BB68*s!BG68+s!BC68*s!BF68))+IF(s!BC68*s!BI68+s!BE68*s!BG68=0,0,O69*s!BE68*s!BG68/(s!BC68*s!BI68+s!BE68*s!BG68))+IF(s!BF68*s!BI68+s!BG68*s!BH68=0,0,W69*s!BG68*s!BH68/(s!BF68*s!BI68+s!BG68*s!BH68))+IF(s!BB68*s!BI68+s!BC68*s!BH68+s!BD68*s!BG68+s!BE68*s!BF68=0,0,N69*s!BD68*s!BG68/(s!BB68*s!BI68+s!BC68*s!BH68+s!BD68*s!BG68+s!BE68*s!BF68)) -> 15.704688026601046 | BH69: =AQ69+IF(s!BB68*s!BH68+s!BD68*s!BF68=0,0,M69*s!BB68*s!BH68/(s!BB68*s!BH68+s!BD68*s!BF68))+IF(s!BD68*s!BI68+s!BE68*s!BH68=0,0,Q69*s!BE68*s!BH68/(s!BD68*s!BI68+s!BE68*s!BH68))+IF(s!BF68*s!BI68+s!BG68*s!BH68=0,0,W69*s!BG68*s!BH68/(s!BF68*s!BI68+s!BG68*s!BH68))+IF(s!BB68*s!BI68+s!BC68*s!BH68+s!BD68*s!BG68+s!BE68*s!BF68=0,0,N69*s!BC68*s!BH68/(s!BB68*s!BI68+s!BC68*s!BH68+s!BD68*s!BG68+s!BE68*s!BF68)) -> 17.971715104563565 | BI69: =AR69+IF(s!BC68*s!BI68+s!BE68*s!BG68=0,0,O69*s!BC68*s!BI68/(s!BC68*s!BI68+s!BE68*s!BG68))+IF(s!BD68*s!BI68+s!BE68*s!BH68=0,0,Q69*s!BD68*s!BI68/(s!BD68*s!BI68+s!BE68*s!BH68))+IF(s!BF68*s!BI68+s!BG68*s!BH68=0,0,W69*s!BF68*s!BI68/(s!BF68*s!BI68+s!BG68*s!BH68))+IF(s!BB68*s!BI68+s!BC68*s!BH68+s!BD68*s!BG68+s!BE68*s!BF68=0,0,N69*s!BB68*s!BI68/(s!BB68*s!BI68+s!BC68*s!BH68+s!BD68*s!BG68+s!BE68*s!BF68)) -> 20.181636983713638 | BJ69: =SUM(BB69:BI69) -> 326
A70: =A69 -> 100 | B70: =B69 -> 1 | C70: =C69 -> 1 | D70: =D69 -> 2 | E70: =E69 -> 5 | F70: =F69 -> 2 | G70: =G69 -> 1 | H70: =H69 -> 2 | I70: =I69 -> 1 | J70: =J69 -> 2 | K70: =K69 -> 4 | L70: =L69 -> 2 | M70: =M69 -> 4 | N70: =N69 -> 8 | O70: =O69 -> 4 | P70: =P69 -> 2 | Q70: =Q69 -> 4 | R70: =R69 -> 2 | S70: =S69 -> 1 | T70: =T69 -> 2 | U70: =U69 -> 1 | V70: =V69 -> 2 | W70: =W69 -> 4 | X70: =X69 -> 2 | Y70: =Y69 -> 1 | Z70: =Z69 -> 2 | AA70: =AA69 -> 1 | AB70: =AB69 -> 163 | AK70: =AK69 -> 205 | AL70: =AL69 -> 7 | AM70: =AM69 -> 8 | AN70: =AN69 -> 8 | AO70: =AO69 -> 8 | AP70: =AP69 -> 8 | AQ70: =AQ69 -> 8 | AR70: =AR69 -> 8 | AS70: =AS69 -> 260 | BB70: =AK70+IF(s!BB69*s!BE69+s!BC69*s!BD69=0,0,E70*s!BB69*s!BE69/(s!BB69*s!BE69+s!BC69*s!BD69)+IF(s!BB69*s!BG69+s!BC69*s!BF69=0,0,K70*s!BB69*s!BG69/(s!BB69*s!BG69+s!BC69*s!BF69))+IF(s!BB69*s!BH69+s!BD69*s!BF69=0,0,M70*s!BB69*s!BH69/(s!BB69*s!BH69+s!BD69*s!BF69))+IF(s!BB69*s!BI69+s!BC69*s!BH69+s!BD69*s!BG69+s!BE69*s!BF69=0,0,N70*s!BB69*s!BI69/(s!BB69*s!BI69+s!BC69*s!BH69+s!BD69*s!BG69+s!BE69*s!BF69)
)) -> 223.76658467265122 | BC70: =AL70+IF(s!BC69*s!BD69+s!BB69*s!BE69=0,0,E70*s!BC69*s!BD69/(s!BC69*s!BD69+s!BB69*s!BE69))+IF(s!BB69*s!BG69+s!BC69*s!BF69=0,0,K70*s!BC69*s!BF69/(s!BB69*s!BG69+s!BC69*s!BF69))+IF(s!BC69*s!BI69+s!BE69*s!BG69=0,0,O70*s!BC69*s!BI69/(s!BC69*s!BI69+s!BE69*s!BG69))+IF(s!BB69*s!BI69+s!BC69*s!BH69+s!BD69*s!BG69+s!BE69*s!BF69=0,0,N70*s!BC69*s!BH69/(s!BB69*s!BI69+s!BC69*s!BH69+s!BD69*s!BG69+s!BE69*s!BF69)) -> 11.386767415566709 | BD70: =AM70+IF(s!BC69*s!BD69+s!BB69*s!BE69=0,0,E70*s!BC69*s!BD69/(s!BC69*s!BD69+s!BB69*s!BE69))+IF(s!BD69*s!BF69+s!BB69*s!BH69=0,0,M70*s!BD69*s!BF69/(s!BD69*s!BF69+s!BB69*s!BH69))+IF(s!BD69*s!BI69+s!BE69*s!BH69=0,0,Q70*s!BD69*s!BI69/(s!BD69*s!BI69+s!BE69*s!BH69))+IF(s!BB69*s!BI69+s!BC69*s!BH69+s!BD69*s!BG69+s!BE69*s!BF69=0,0,N70*s!BD69*s!BG69/(s!BB69*s!BI69+s!BC69*s!BH69+s!BD69*s!BG69+s!BE69*s!BF69)) -> 10.119740337557033 | BE70: =AN70+IF(s!BB69*s!BE69+s!BC69*s!BD69=0,0,E70*s!BB69*s!BE69/(s!BB69*s!BE69+s!BC69*s!BD69))+IF(s!BC69*s!BI69+s!BE69*s!BG69=0,0,O70*s!BE69*s!BG69/(s!BC69*s!BI69+s!BE69*s!BG69))+IF(s!BD69*s!BI69+s!BE69*s!BH69=0,0,Q70*s!BE69*s!BH69/(s!BD69*s!BI69+s!BE69*s!BH69))+IF(s!BB69*s!BI69+s!BC69*s!BH69+s!BD69*s!BG69+s!BE69*s!BF69=0,0,N70*s!BE69*s!BF69/(s!BB69*s!BI69+s!BC69*s!BH69+s!BD69*s!BG69+s!BE69*s!BF69)) -> 16.726907574225052 | BF70: =AO70+IF(s!BB69*s!BG69+s!BC69*s!BF69=0,0,K70*s!BC69*s!BF69/(s!BB69*s!BG69+s!BC69*s!BF69))+IF(s!BD69*s!BF69+s!BB69*s!BH69=0,0,M70*s!BD69*s!BF69/(s!BD69*s!BF69+s!BB69*s!BH69))+IF(s!BF69*s!BI69+s!BG69*s!BH69=0,0,W70*s!BF69*s!BI69/(s!BF69*s!BI69+s!BG69*s!BH69))+IF(s!BB69*s!BI69+s!BC69*s!BH69+s!BD69*s!BG69+s!BE69*s!BF69=0,0,N70*s!BE69*s!BF69/(s!BB69*s!BI69+s!BC69*s!BH69+s!BD69*s!BG69+s!BE69*s!BF69)) -> 10.141959885040738 | BG70: =AP70+IF(s!BB69*s!BG69+s!BC69*s!BF69=0,0,K70*s!BB69*s!BG69/(s!BB69*s!BG69+s!BC69*s!BF69))+IF(s!BC69*s!BI69+s!BE69*s!BG69=0,0,O70*s!BE69*s!BG69/(s!BC69*s!BI69+s!BE69*s!BG69))+IF(s!BF69*s!BI69+s!BG69*s!BH69=0,0,W70*s!BG69*s!BH69/(s!BF69*s!BI69+s!BG69*s!BH69))+IF(s!BB69*s!BI69+s!BC69*s!BH69+s!BD69*s!BG69+s!BE69*s!BF69=0,0,N70*s!BD69*s!BG69/(s!BB69*s!BI69+s!BC69*s!BH69+s!BD69*s!BG69+s!BE69*s!BF69)) -> 15.704688026741346 | BH70: =AQ70+IF(s!BB69*s!BH69+s!BD69*s!BF69=0,0,M70*s!BB69*s!BH69/(s!BB69*s!BH69+s!BD69*s!BF69))+IF(s!BD69*s!BI69+s!BE69*s!BH69=0,0,Q70*s!BE69*s!BH69/(s!BD69*s!BI69+s!BE69*s!BH69))+IF(s!BF69*s!BI69+s!BG69*s!BH69=0,0,W70*s!BG69*s!BH69/(s!BF69*s!BI69+s!BG69*s!BH69))+IF(s!BB69*s!BI69+s!BC69*s!BH69+s!BD69*s!BG69+s!BE69*s!BF69=0,0,N70*s!BC69*s!BH69/(s!BB69*s!BI69+s!BC69*s!BH69+s!BD69*s!BG69+s!BE69*s!BF69)) -> 17.97171510475102 | BI70: =AR70+IF(s!BC69*s!BI69+s!BE69*s!BG69=0,0,O70*s!BC69*s!BI69/(s!BC69*s!BI69+s!BE69*s!BG69))+IF(s!BD69*s!BI69+s!BE69*s!BH69=0,0,Q70*s!BD69*s!BI69/(s!BD69*s!BI69+s!BE69*s!BH69))+IF(s!BF69*s!BI69+s!BG69*s!BH69=0,0,W70*s!BF69*s!BI69/(s!BF69*s!BI69+s!BG69*s!BH69))+IF(s!BB69*s!BI69+s!BC69*s!BH69+s!BD69*s!BG69+s!BE69*s!BF69=0,0,N70*s!BB69*s!BI69/(s!BB69*s!BI69+s!BC69*s!BH69+s!BD69*s!BG69+s!BE69*s!BF69)) -> 20.181636983466891 | BJ70: =SUM(BB70:BI70) -> 326
A71: =A70 -> 100 | B71: =B70 -> 1 | C71: =C70 -> 1 | D71: =D70 -> 2 | E71: =E70 -> 5 | F71: =F70 -> 2 | G71: =G70 -> 1 | H71: =H70 -> 2 | I71: =I70 -> 1 | J71: =J70 -> 2 | K71: =K70 -> 4 | L71: =L70 -> 2 | M71: =M70 -> 4 | N71: =N70 -> 8 | O71: =O70 -> 4 | P71: =P70 -> 2 | Q71: =Q70 -> 4 | R71: =R70 -> 2 | S71: =S70 -> 1 | T71: =T70 -> 2 | U71: =U70 -> 1 | V71: =V70 -> 2 | W71: =W70 -> 4 | X71: =X70 -> 2 | Y71: =Y70 -> 1 | Z71: =Z70 -> 2 | AA71: =AA70 -> 1 | AB71: =AB70 -> 163 | AK71: =AK70 -> 205 | AL71: =AL70 -> 7 | AM71: =AM70 -> 8 | AN71: =AN70 -> 8 | AO71: =AO70 -> 8 | AP71: =AP70 -> 8 | AQ71: =AQ70 -> 8 | AR71: =AR70 -> 8 | AS71: =AS70 -> 260 | BB71: =AK71+IF(s!BB70*s!BE70+s!BC70*s!BD70=0,0,E71*s!BB70*s!BE70/(s!BB70*s!BE70+s!BC70*s!BD70)+IF(s!BB70*s!BG70+s!BC70*s!BF70=0,0,K71*s!BB70*s!BG70/(s!BB70*s!BG70+s!BC70*s!BF70))+IF(s!BB70*s!BH70+s!BD70*s!BF70=0,0,M71*s!BB70*s!BH70/(s!BB70*s!BH70+s!BD70*s!BF70))+IF(s!BB70*s!BI70+s!BC70*s!BH70+s!BD70*s!BG70+s!BE70*s!BF70=0,0,N71*s!BB70*s!BI70/(s!BB70*s!BI70+s!BC70*s!BH70+s!BD70*s!BG70+s!BE70*s!BF70)
)) -> 223.76658467263331 | BC71: =AL71+IF(s!BC70*s!BD70+s!BB70*s!BE70=0,0,E71*s!BC70*s!BD70/(s!BC70*s!BD70+s!BB70*s!BE70))+IF(s!BB70*s!BG70+s!BC70*s!BF70=0,0,K71*s!BC70*s!BF70/(s!BB70*s!BG70+s!BC70*s!BF70))+IF(s!BC70*s!BI70+s!BE70*s!BG70=0,0,O71*s!BC70*s!BI70/(s!BC70*s!BI70+s!BE70*s!BG70))+IF(s!BB70*s!BI70+s!BC70*s!BH70+s!BD70*s!BG70+s!BE70*s!BF70=0,0,N71*s!BC70*s!BH70/(s!BB70*s!BI70+s!BC70*s!BH70+s!BD70*s!BG70+s!BE70*s!BF70)) -> 11.386767415542195 | BD71: =AM71+IF(s!BC70*s!BD70+s!BB70*s!BE70=0,0,E71*s!BC70*s!BD70/(s!BC70*s!BD70+s!BB70*s!BE70))+IF(s!BD70*s!BF70+s!BB70*s!BH70=0,0,M71*s!BD70*s!BF70/(s!BD70*s!BF70+s!BB70*s!BH70))+IF(s!BD70*s!BI70+s!BE70*s!BH70=0,0,Q71*s!BD70*s!BI70/(s!BD70*s!BI70+s!BE70*s!BH70))+IF(s!BB70*s!BI70+s!BC70*s!BH70+s!BD70*s!BG70+s!BE70*s!BF70=0,0,N71*s!BD70*s!BG70/(s!BB70*s!BI70+s!BC70*s!BH70+s!BD70*s!BG70+s!BE70*s!BF70)) -> 10.119740337498778 | BE71: =AN71+IF(s!BB70*s!BE70+s!BC70*s!BD70=0,0,E71*s!BB70*s!BE70/(s!BB70*s!BE70+s!BC70*s!BD70))+IF(s!BC70*s!BI70+s!BE70*s!BG70=0,0,O71*s!BE70*s!BG70/(s!BC70*s!BI70+s!BE70*s!BG70))+IF(s!BD70*s!BI70+s!BE70*s!BH70=0,0,Q71*s!BE70*s!BH70/(s!BD70*s!BI70+s!BE70*s!BH70))+IF(s!BB70*s!BI70+s!BC70*s!BH70+s!BD70*s!BG70+s!BE70*s!BF70=0,0,N71*s!BE70*s!BF70/(s!BB70*s!BI70+s!BC70*s!BH70+s!BD70*s!BG70+s!BE70*s!BF70)) -> 16.726907574325725 | BF71: =AO71+IF(s!BB70*s!BG70+s!BC70*s!BF70=0,0,K71*s!BC70*s!BF70/(s!BB70*s!BG70+s!BC70*s!BF70))+IF(s!BD70*s!BF70+s!BB70*s!BH70=0,0,M71*s!BD70*s!BF70/(s!BD70*s!BF70+s!BB70*s!BH70))+IF(s!BF70*s!BI70+s!BG70*s!BH70=0,0,W71*s!BF70*s!BI70/(s!BF70*s!BI70+s!BG70*s!BH70))+IF(s!BB70*s!BI70+s!BC70*s!BH70+s!BD70*s!BG70+s!BE70*s!BF70=0,0,N71*s!BE70*s!BF70/(s!BB70*s!BI70+s!BC70*s!BH70+s!BD70*s!BG70+s!BE70*s!BF70)) -> 10.141959884982777 | BG71: =AP71+IF(s!BB70*s!BG70+s!BC70*s!BF70=0,0,K71*s!BB70*s!BG70/(s!BB70*s!BG70+s!BC70*s!BF70))+IF(s!BC70*s!BI70+s!BE70*s!BG70=0,0,O71*s!BE70*s!BG70/(s!BC70*s!BI70+s!BE70*s!BG70))+IF(s!BF70*s!BI70+s!BG70*s!BH70=0,0,W71*s!BG70*s!BH70/(s!BF70*s!BI70+s!BG70*s!BH70))+IF(s!BB70*s!BI70+s!BC70*s!BH70+s!BD70*s!BG70+s!BE70*s!BF70=0,0,N71*s!BD70*s!BG70/(s!BB70*s!BI70+s!BC70*s!BH70+s!BD70*s!BG70+s!BE70*s!BF70)) -> 15.704688026841723 | BH71: =AQ71+IF(s!BB70*s!BH70+s!BD70*s!BF70=0,0,M71*s!BB70*s!BH70/(s!BB70*s!BH70+s!BD70*s!BF70))+IF(s!BD70*s!BI70+s!BE70*s!BH70=0,0,Q71*s!BE70*s!BH70/(s!BD70*s!BI70+s!BE70*s!BH70))+IF(s!BF70*s!BI70+s!BG70*s!BH70=0,0,W71*s!BG70*s!BH70/(s!BF70*s!BI70+s!BG70*s!BH70))+IF(s!BB70*s!BI70+s!BC70*s!BH70+s!BD70*s!BG70+s!BE70*s!BF70=0,0,N71*s!BC70*s!BH70/(s!BB70*s!BI70+s!BC70*s!BH70+s!BD70*s!BG70+s!BE70*s!BF70)) -> 17.971715104885142 | BI71: =AR71+IF(s!BC70*s!BI70+s!BE70*s!BG70=0,0,O71*s!BC70*s!BI70/(s!BC70*s!BI70+s!BE70*s!BG70))+IF(s!BD70*s!BI70+s!BE70*s!BH70=0,0,Q71*s!BD70*s!BI70/(s!BD70*s!BI70+s!BE70*s!BH70))+IF(s!BF70*s!BI70+s!BG70*s!BH70=0,0,W71*s!BF70*s!BI70/(s!BF70*s!BI70+s!BG70*s!BH70))+IF(s!BB70*s!BI70+s!BC70*s!BH70+s!BD70*s!BG70+s!BE70*s!BF70=0,0,N71*s!BB70*s!BI70/(s!BB70*s!BI70+s!BC70*s!BH70+s!BD70*s!BG70+s!BE70*s!BF70)) -> 20.181636983290357 | BJ71: =SUM(BB71:BI71) -> 326
A72: =A71 -> 100 | B72: =B71 -> 1 | C72: =C71 -> 1 | D72: =D71 -> 2 | E72: =E71 -> 5 | F72: =F71 -> 2 | G72: =G71 -> 1 | H72: =H71 -> 2 | I72: =I71 -> 1 | J72: =J71 -> 2 | K72: =K71 -> 4 | L72: =L71 -> 2 | M72: =M71 -> 4 | N72: =N71 -> 8 | O72: =O71 -> 4 | P72: =P71 -> 2 | Q72: =Q71 -> 4 | R72: =R71 -> 2 | S72: =S71 -> 1 | T72: =T71 -> 2 | U72: =U71 -> 1 | V72: =V71 -> 2 | W72: =W71 -> 4 | X72: =X71 -> 2 | Y72: =Y71 -> 1 | Z72: =Z71 -> 2 | AA72: =AA71 -> 1 | AB72: =AB71 -> 163 | AK72: =AK71 -> 205 | AL72: =AL71 -> 7 | AM72: =AM71 -> 8 | AN72: =AN71 -> 8 | AO72: =AO71 -> 8 | AP72: =AP71 -> 8 | AQ72: =AQ71 -> 8 | AR72: =AR71 -> 8 | AS72: =AS71 -> 260 | BB72: =AK72+IF(s!BB71*s!BE71+s!BC71*s!BD71=0,0,E72*s!BB71*s!BE71/(s!BB71*s!BE71+s!BC71*s!BD71)+IF(s!BB71*s!BG71+s!BC71*s!BF71=0,0,K72*s!BB71*s!BG71/(s!BB71*s!BG71+s!BC71*s!BF71))+IF(s!BB71*s!BH71+s!BD71*s!BF71=0,0,M72*s!BB71*s!BH71/(s!BB71*s!BH71+s!BD71*s!BF71))+IF(s!BB71*s!BI71+s!BC71*s!BH71+s!BD71*s!BG71+s!BE71*s!BF71=0,0,N72*s!BB71*s!BI71/(s!BB71*s!BI71+s!BC71*s!BH71+s!BD71*s!BG71+s!BE71*s!BF71)
)) -> 223.7665846726205 | BC72: =AL72+IF(s!BC71*s!BD71+s!BB71*s!BE71=0,0,E72*s!BC71*s!BD71/(s!BC71*s!BD71+s!BB71*s!BE71))+IF(s!BB71*s!BG71+s!BC71*s!BF71=0,0,K72*s!BC71*s!BF71/(s!BB71*s!BG71+s!BC71*s!BF71))+IF(s!BC71*s!BI71+s!BE71*s!BG71=0,0,O72*s!BC71*s!BI71/(s!BC71*s!BI71+s!BE71*s!BG71))+IF(s!BB71*s!BI71+s!BC71*s!BH71+s!BD71*s!BG71+s!BE71*s!BF71=0,0,N72*s!BC71*s!BH71/(s!BB71*s!BI71+s!BC71*s!BH71+s!BD71*s!BG71+s!BE71*s!BF71)) -> 11.386767415524657 | BD72: =AM72+IF(s!BC71*s!BD71+s!BB71*s!BE71=0,0,E72*s!BC71*s!BD71/(s!BC71*s!BD71+s!BB71*s!BE71))+IF(s!BD71*s!BF71+s!BB71*s!BH71=0,0,M72*s!BD71*s!BF71/(s!BD71*s!BF71+s!BB71*s!BH71))+IF(s!BD71*s!BI71+s!BE71*s!BH71=0,0,Q72*s!BD71*s!BI71/(s!BD71*s!BI71+s!BE71*s!BH71))+IF(s!BB71*s!BI71+s!BC71*s!BH71+s!BD71*s!BG71+s!BE71*s!BF71=0,0,N72*s!BD71*s!BG71/(s!BB71*s!BI71+s!BC71*s!BH71+s!BD71*s!BG71+s!BE71*s!BF71)) -> 10.119740337457099 | BE72: =AN72+IF(s!BB71*s!BE71+s!BC71*s!BD71=0,0,E72*s!BB71*s!BE71/(s!BB71*s!BE71+s!BC71*s!BD71))+IF(s!BC71*s!BI71+s!BE71*s!BG71=0,0,O72*s!BE71*s!BG71/(s!BC71*s!BI71+s!BE71*s!BG71))+IF(s!BD71*s!BI71+s!BE71*s!BH71=0,0,Q72*s!BE71*s!BH71/(s!BD71*s!BI71+s!BE71*s!BH71))+IF(s!BB71*s!BI71+s!BC71*s!BH71+s!BD71*s!BG71+s!BE71*s!BF71=0,0,N72*s!BE71*s!BF71/(s!BB71*s!BI71+s!BC71*s!BH71+s!BD71*s!BG71+s!BE71*s!BF71)) -> 16.726907574397746 | BF72: =AO72+IF(s!BB71*s!BG71+s!BC71*s!BF71=0,0,K72*s!BC71*s!BF71/(s!BB71*s!BG71+s!BC71*s!BF71))+IF(s!BD71*s!BF71+s!BB71*s!BH71=0,0,M72*s!BD71*s!BF71/(s!BD71*s!BF71+s!BB71*s!BH71))+IF(s!BF71*s!BI71+s!BG71*s!BH71=0,0,W72*s!BF71*s!BI71/(s!BF71*s!BI71+s!BG71*s!BH71))+IF(s!BB71*s!BI71+s!BC71*s!BH71+s!BD71*s!BG71+s!BE71*s!BF71=0,0,N72*s!BE71*s!BF71/(s!BB71*s!BI71+s!BC71*s!BH71+s!BD71*s!BG71+s!BE71*s!BF71)) -> 10.141959884941311 | BG72: =AP72+IF(s!BB71*s!BG71+s!BC71*s!BF71=0,0,K72*s!BB71*s!BG71/(s!BB71*s!BG71+s!BC71*s!BF71))+IF(s!BC71*s!BI71+s!BE71*s!BG71=0,0,O72*s!BE71*s!BG71/(s!BC71*s!BI71+s!BE71*s!BG71))+IF(s!BF71*s!BI71+s!BG71*s!BH71=0,0,W72*s!BG71*s!BH71/(s!BF71*s!BI71+s!BG71*s!BH71))+IF(s!BB71*s!BI71+s!BC71*s!BH71+s!BD71*s!BG71+s!BE71*s!BF71=0,0,N72*s!BD71*s!BG71/(s!BB71*s!BI71+s!BC71*s!BH71+s!BD71*s!BG71+s!BE71*s!BF71)) -> 15.704688026913539 | BH72: =AQ72+IF(s!BB71*s!BH71+s!BD71*s!BF71=0,0,M72*s!BB71*s!BH71/(s!BB71*s!BH71+s!BD71*s!BF71))+IF(s!BD71*s!BI71+s!BE71*s!BH71=0,0,Q72*s!BE71*s!BH71/(s!BD71*s!BI71+s!BE71*s!BH71))+IF(s!BF71*s!BI71+s!BG71*s!BH71=0,0,W72*s!BG71*s!BH71/(s!BF71*s!BI71+s!BG71*s!BH71))+IF(s!BB71*s!BI71+s!BC71*s!BH71+s!BD71*s!BG71+s!BE71*s!BF71=0,0,N72*s!BC71*s!BH71/(s!BB71*s!BI71+s!BC71*s!BH71+s!BD71*s!BG71+s!BE71*s!BF71)) -> 17.971715104981097 | BI72: =AR72+IF(s!BC71*s!BI71+s!BE71*s!BG71=0,0,O72*s!BC71*s!BI71/(s!BC71*s!BI71+s!BE71*s!BG71))+IF(s!BD71*s!BI71+s!BE71*s!BH71=0,0,Q72*s!BD71*s!BI71/(s!BD71*s!BI71+s!BE71*s!BH71))+IF(s!BF71*s!BI71+s!BG71*s!BH71=0,0,W72*s!BF71*s!BI71/(s!BF71*s!BI71+s!BG71*s!BH71))+IF(s!BB71*s!BI71+s!BC71*s!BH71+s!BD71*s!BG71+s!BE71*s!BF71=0,0,N72*s!BB71*s!BI71/(s!BB71*s!BI71+s!BC71*s!BH71+s!BD71*s!BG71+s!BE71*s!BF71)) -> 20.181636983164054 | BJ72: =SUM(BB72:BI72) -> 326
A73: =A72 -> 100 | B73: =B72 -> 1 | C73: =C72 -> 1 | D73: =D72 -> 2 | E73: =E72 -> 5 | F73: =F72 -> 2 | G73: =G72 -> 1 | H73: =H72 -> 2 | I73: =I72 -> 1 | J73: =J72 -> 2 | K73: =K72 -> 4 | L73: =L72 -> 2 | M73: =M72 -> 4 | N73: =N72 -> 8 | O73: =O72 -> 4 | P73: =P72 -> 2 | Q73: =Q72 -> 4 | R73: =R72 -> 2 | S73: =S72 -> 1 | T73: =T72 -> 2 | U73: =U72 -> 1 | V73: =V72 -> 2 | W73: =W72 -> 4 | X73: =X72 -> 2 | Y73: =Y72 -> 1 | Z73: =Z72 -> 2 | AA73: =AA72 -> 1 | AB73: =AB72 -> 163 | AK73: =AK72 -> 205 | AL73: =AL72 -> 7 | AM73: =AM72 -> 8 | AN73: =AN72 -> 8 | AO73: =AO72 -> 8 | AP73: =AP72 -> 8 | AQ73: =AQ72 -> 8 | AR73: =AR72 -> 8 | AS73: =AS72 -> 260 | BB73: =AK73+IF(s!BB72*s!BE72+s!BC72*s!BD72=0,0,E73*s!BB72*s!BE72/(s!BB72*s!BE72+s!BC72*s!BD72)+IF(s!BB72*s!BG72+s!BC72*s!BF72=0,0,K73*s!BB72*s!BG72/(s!BB72*s!BG72+s!BC72*s!BF72))+IF(s!BB72*s!BH72+s!BD72*s!BF72=0,0,M73*s!BB72*s!BH72/(s!BB72*s!BH72+s!BD72*s!BF72))+IF(s!BB72*s!BI72+s!BC72*s!BH72+s!BD72*s!BG72+s!BE72*s!BF72=0,0,N73*s!BB72*s!BI72/(s!BB72*s!BI72+s!BC72*s!BH72+s!BD72*s!BG72+s!BE72*s!BF72)
)) -> 223.76658467261132 | BC73: =AL73+IF(s!BC72*s!BD72+s!BB72*s!BE72=0,0,E73*s!BC72*s!BD72/(s!BC72*s!BD72+s!BB72*s!BE72))+IF(s!BB72*s!BG72+s!BC72*s!BF72=0,0,K73*s!BC72*s!BF72/(s!BB72*s!BG72+s!BC72*s!BF72))+IF(s!BC72*s!BI72+s!BE72*s!BG72=0,0,O73*s!BC72*s!BI72/(s!BC72*s!BI72+s!BE72*s!BG72))+IF(s!BB72*s!BI72+s!BC72*s!BH72+s!BD72*s!BG72+s!BE72*s!BF72=0,0,N73*s!BC72*s!BH72/(s!BB72*s!BI72+s!BC72*s!BH72+s!BD72*s!BG72+s!BE72*s!BF72)) -> 11.386767415512111 | BD73: =AM73+IF(s!BC72*s!BD72+s!BB72*s!BE72=0,0,E73*s!BC72*s!BD72/(s!BC72*s!BD72+s!BB72*s!BE72))+IF(s!BD72*s!BF72+s!BB72*s!BH72=0,0,M73*s!BD72*s!BF72/(s!BD72*s!BF72+s!BB72*s!BH72))+IF(s!BD72*s!BI72+s!BE72*s!BH72=0,0,Q73*s!BD72*s!BI72/(s!BD72*s!BI72+s!BE72*s!BH72))+IF(s!BB72*s!BI72+s!BC72*s!BH72+s!BD72*s!BG72+s!BE72*s!BF72=0,0,N73*s!BD72*s!BG72/(s!BB72*s!BI72+s!BC72*s!BH72+s!BD72*s!BG72+s!BE72*s!BF72)) -> 10.119740337427281 | BE73: =AN73+IF(s!BB72*s!BE72+s!BC72*s!BD72=0,0,E73*s!BB72*s!BE72/(s!BB72*s!BE72+s!BC72*s!BD72))+IF(s!BC72*s!BI72+s!BE72*s!BG72=0,0,O73*s!BE72*s!BG72/(s!BC72*s!BI72+s!BE72*s!BG72))+IF(s!BD72*s!BI72+s!BE72*s!BH72=0,0,Q73*s!BE72*s!BH72/(s!BD72*s!BI72+s!BE72*s!BH72))+IF(s!BB72*s!BI72+s!BC72*s!BH72+s!BD72*s!BG72+s!BE72*s!BF72=0,0,N73*s!BE72*s!BF72/(s!BB72*s!BI72+s!BC72*s!BH72+s!BD72*s!BG72+s!BE72*s!BF72)) -> 16.726907574449278 | BF73: =AO73+IF(s!BB72*s!BG72+s!BC72*s!BF72=0,0,K73*s!BC72*s!BF72/(s!BB72*s!BG72+s!BC72*s!BF72))+IF(s!BD72*s!BF72+s!BB72*s!BH72=0,0,M73*s!BD72*s!BF72/(s!BD72*s!BF72+s!BB72*s!BH72))+IF(s!BF72*s!BI72+s!BG72*s!BH72=0,0,W73*s!BF72*s!BI72/(s!BF72*s!BI72+s!BG72*s!BH72))+IF(s!BB72*s!BI72+s!BC72*s!BH72+s!BD72*s!BG72+s!BE72*s!BF72=0,0,N73*s!BE72*s!BF72/(s!BB72*s!BI72+s!BC72*s!BH72+s!BD72*s!BG72+s!BE72*s!BF72)) -> 10.141959884911643 | BG73: =AP73+IF(s!BB72*s!BG72+s!BC72*s!BF72=0,0,K73*s!BB72*s!BG72/(s!BB72*s!BG72+s!BC72*s!BF72))+IF(s!BC72*s!BI72+s!BE72*s!BG72=0,0,O73*s!BE72*s!BG72/(s!BC72*s!BI72+s!BE72*s!BG72))+IF(s!BF72*s!BI72+s!BG72*s!BH72=0,0,W73*s!BG72*s!BH72/(s!BF72*s!BI72+s!BG72*s!BH72))+IF(s!BB72*s!BI72+s!BC72*s!BH72+s!BD72*s!BG72+s!BE72*s!BF72=0,0,N73*s!BD72*s!BG72/(s!BB72*s!BI72+s!BC72*s!BH72+s!BD72*s!BG72+s!BE72*s!BF72)) -> 15.704688026964917 | BH73: =AQ73+IF(s!BB72*s!BH72+s!BD72*s!BF72=0,0,M73*s!BB72*s!BH72/(s!BB72*s!BH72+s!BD72*s!BF72))+IF(s!BD72*s!BI72+s!BE72*s!BH72=0,0,Q73*s!BE72*s!BH72/(s!BD72*s!BI72+s!BE72*s!BH72))+IF(s!BF72*s!BI72+s!BG72*s!BH72=0,0,W73*s!BG72*s!BH72/(s!BF72*s!BI72+s!BG72*s!BH72))+IF(s!BB72*s!BI72+s!BC72*s!BH72+s!BD72*s!BG72+s!BE72*s!BF72=0,0,N73*s!BC72*s!BH72/(s!BB72*s!BI72+s!BC72*s!BH72+s!BD72*s!BG72+s!BE72*s!BF72)) -> 17.971715105049746 | BI73: =AR73+IF(s!BC72*s!BI72+s!BE72*s!BG72=0,0,O73*s!BC72*s!BI72/(s!BC72*s!BI72+s!BE72*s!BG72))+IF(s!BD72*s!BI72+s!BE72*s!BH72=0,0,Q73*s!BD72*s!BI72/(s!BD72*s!BI72+s!BE72*s!BH72))+IF(s!BF72*s!BI72+s!BG72*s!BH72=0,0,W73*s!BF72*s!BI72/(s!BF72*s!BI72+s!BG72*s!BH72))+IF(s!BB72*s!BI72+s!BC72*s!BH72+s!BD72*s!BG72+s!BE72*s!BF72=0,0,N73*s!BB72*s!BI72/(s!BB72*s!BI72+s!BC72*s!BH72+s!BD72*s!BG72+s!BE72*s!BF72)) -> 20.181636983073695 | BJ73: =SUM(BB73:BI73) -> 326
A74: =A73 -> 100 | B74: =B73 -> 1 | C74: =C73 -> 1 | D74: =D73 -> 2 | E74: =E73 -> 5 | F74: =F73 -> 2 | G74: =G73 -> 1 | H74: =H73 -> 2 | I74: =I73 -> 1 | J74: =J73 -> 2 | K74: =K73 -> 4 | L74: =L73 -> 2 | M74: =M73 -> 4 | N74: =N73 -> 8 | O74: =O73 -> 4 | P74: =P73 -> 2 | Q74: =Q73 -> 4 | R74: =R73 -> 2 | S74: =S73 -> 1 | T74: =T73 -> 2 | U74: =U73 -> 1 | V74: =V73 -> 2 | W74: =W73 -> 4 | X74: =X73 -> 2 | Y74: =Y73 -> 1 | Z74: =Z73 -> 2 | AA74: =AA73 -> 1 | AB74: =AB73 -> 163 | AK74: =AK73 -> 205 | AL74: =AL73 -> 7 | AM74: =AM73 -> 8 | AN74: =AN73 -> 8 | AO74: =AO73 -> 8 | AP74: =AP73 -> 8 | AQ74: =AQ73 -> 8 | AR74: =AR73 -> 8 | AS74: =AS73 -> 260 | BB74: =AK74+IF(s!BB73*s!BE73+s!BC73*s!BD73=0,0,E74*s!BB73*s!BE73/(s!BB73*s!BE73+s!BC73*s!BD73)+IF(s!BB73*s!BG73+s!BC73*s!BF73=0,0,K74*s!BB73*s!BG73/(s!BB73*s!BG73+s!BC73*s!BF73))+IF(s!BB73*s!BH73+s!BD73*s!BF73=0,0,M74*s!BB73*s!BH73/(s!BB73*s!BH73+s!BD73*s!BF73))+IF(s!BB73*s!BI73+s!BC73*s!BH73+s!BD73*s!BG73+s!BE73*s!BF73=0,0,N74*s!BB73*s!BI73/(s!BB73*s!BI73+s!BC73*s!BH73+s!BD73*s!BG73+s!BE73*s!BF73)
)) -> 223.76658467260478 | BC74: =AL74+IF(s!BC73*s!BD73+s!BB73*s!BE73=0,0,E74*s!BC73*s!BD73/(s!BC73*s!BD73+s!BB73*s!BE73))+IF(s!BB73*s!BG73+s!BC73*s!BF73=0,0,K74*s!BC73*s!BF73/(s!BB73*s!BG73+s!BC73*s!BF73))+IF(s!BC73*s!BI73+s!BE73*s!BG73=0,0,O74*s!BC73*s!BI73/(s!BC73*s!BI73+s!BE73*s!BG73))+IF(s!BB73*s!BI73+s!BC73*s!BH73+s!BD73*s!BG73+s!BE73*s!BF73=0,0,N74*s!BC73*s!BH73/(s!BB73*s!BI73+s!BC73*s!BH73+s!BD73*s!BG73+s!BE73*s!BF73)) -> 11.386767415503133 | BD74: =AM74+IF(s!BC73*s!BD73+s!BB73*s!BE73=0,0,E74*s!BC73*s!BD73/(s!BC73*s!BD73+s!BB73*s!BE73))+IF(s!BD73*s!BF73+s!BB73*s!BH73=0,0,M74*s!BD73*s!BF73/(s!BD73*s!BF73+s!BB73*s!BH73))+IF(s!BD73*s!BI73+s!BE73*s!BH73=0,0,Q74*s!BD73*s!BI73/(s!BD73*s!BI73+s!BE73*s!BH73))+IF(s!BB73*s!BI73+s!BC73*s!BH73+s!BD73*s!BG73+s!BE73*s!BF73=0,0,N74*s!BD73*s!BG73/(s!BB73*s!BI73+s!BC73*s!BH73+s!BD73*s!BG73+s!BE73*s!BF73)) -> 10.119740337405947 | BE74: =AN74+IF(s!BB73*s!BE73+s!BC73*s!BD73=0,0,E74*s!BB73*s!BE73/(s!BB73*s!BE73+s!BC73*s!BD73))+IF(s!BC73*s!BI73+s!BE73*s!BG73=0,0,O74*s!BE73*s!BG73/(s!BC73*s!BI73+s!BE73*s!BG73))+IF(s!BD73*s!BI73+s!BE73*s!BH73=0,0,Q74*s!BE73*s!BH73/(s!BD73*s!BI73+s!BE73*s!BH73))+IF(s!BB73*s!BI73+s!BC73*s!BH73+s!BD73*s!BG73+s!BE73*s!BF73=0,0,N74*s!BE73*s!BF73/(s!BB73*s!BI73+s!BC73*s!BH73+s!BD73*s!BG73+s!BE73*s!BF73)) -> 16.726907574486148 | BF74: =AO74+IF(s!BB73*s!BG73+s!BC73*s!BF73=0,0,K74*s!BC73*s!BF73/(s!BB73*s!BG73+s!BC73*s!BF73))+IF(s!BD73*s!BF73+s!BB73*s!BH73=0,0,M74*s!BD73*s!BF73/(s!BD73*s!BF73+s!BB73*s!BH73))+IF(s!BF73*s!BI73+s!BG73*s!BH73=0,0,W74*s!BF73*s!BI73/(s!BF73*s!BI73+s!BG73*s!BH73))+IF(s!BB73*s!BI73+s!BC73*s!BH73+s!BD73*s!BG73+s!BE73*s!BF73=0,0,N74*s!BE73*s!BF73/(s!BB73*s!BI73+s!BC73*s!BH73+s!BD73*s!BG73+s!BE73*s!BF73)) -> 10.141959884890417 | BG74: =AP74+IF(s!BB73*s!BG73+s!BC73*s!BF73=0,0,K74*s!BB73*s!BG73/(s!BB73*s!BG73+s!BC73*s!BF73))+IF(s!BC73*s!BI73+s!BE73*s!BG73=0,0,O74*s!BE73*s!BG73/(s!BC73*s!BI73+s!BE73*s!BG73))+IF(s!BF73*s!BI73+s!BG73*s!BH73=0,0,W74*s!BG73*s!BH73/(s!BF73*s!BI73+s!BG73*s!BH73))+IF(s!BB73*s!BI73+s!BC73*s!BH73+s!BD73*s!BG73+s!BE73*s!BF73=0,0,N74*s!BD73*s!BG73/(s!BB73*s!BI73+s!BC73*s!BH73+s!BD73*s!BG73+s!BE73*s!BF73)) -> 15.704688027001676 | BH74: =AQ74+IF(s!BB73*s!BH73+s!BD73*s!BF73=0,0,M74*s!BB73*s!BH73/(s!BB73*s!BH73+s!BD73*s!BF73))+IF(s!BD73*s!BI73+s!BE73*s!BH73=0,0,Q74*s!BE73*s!BH73/(s!BD73*s!BI73+s!BE73*s!BH73))+IF(s!BF73*s!BI73+s!BG73*s!BH73=0,0,W74*s!BG73*s!BH73/(s!BF73*s!BI73+s!BG73*s!BH73))+IF(s!BB73*s!BI73+s!BC73*s!BH73+s!BD73*s!BG73+s!BE73*s!BF73=0,0,N74*s!BC73*s!BH73/(s!BB73*s!BI73+s!BC73*s!BH73+s!BD73*s!BG73+s!BE73*s!BF73)) -> 17.971715105098863 | BI74: =AR74+IF(s!BC73*s!BI73+s!BE73*s!BG73=0,0,O74*s!BC73*s!BI73/(s!BC73*s!BI73+s!BE73*s!BG73))+IF(s!BD73*s!BI73+s!BE73*s!BH73=0,0,Q74*s!BD73*s!BI73/(s!BD73*s!BI73+s!BE73*s!BH73))+IF(s!BF73*s!BI73+s!BG73*s!BH73=0,0,W74*s!BF73*s!BI73/(s!BF73*s!BI73+s!BG73*s!BH73))+IF(s!BB73*s!BI73+s!BC73*s!BH73+s!BD73*s!BG73+s!BE73*s!BF73=0,0,N74*s!BB73*s!BI73/(s!BB73*s!BI73+s!BC73*s!BH73+s!BD73*s!BG73+s!BE73*s!BF73)) -> 20.181636983009042 | BJ74: =SUM(BB74:BI74) -> 326
A75: =A74 -> 100 | B75: =B74 -> 1 | C75: =C74 -> 1 | D75: =D74 -> 2 | E75: =E74 -> 5 | F75: =F74 -> 2 | G75: =G74 -> 1 | H75: =H74 -> 2 | I75: =I74 -> 1 | J75: =J74 -> 2 | K75: =K74 -> 4 | L75: =L74 -> 2 | M75: =M74 -> 4 | N75: =N74 -> 8 | O75: =O74 -> 4 | P75: =P74 -> 2 | Q75: =Q74 -> 4 | R75: =R74 -> 2 | S75: =S74 -> 1 | T75: =T74 -> 2 | U75: =U74 -> 1 | V75: =V74 -> 2 | W75: =W74 -> 4 | X75: =X74 -> 2 | Y75: =Y74 -> 1 | Z75: =Z74 -> 2 | AA75: =AA74 -> 1 | AB75: =AB74 -> 163 | AK75: =AK74 -> 205 | AL75: =AL74 -> 7 | AM75: =AM74 -> 8 | AN75: =AN74 -> 8 | AO75: =AO74 -> 8 | AP75: =AP74 -> 8 | AQ75: =AQ74 -> 8 | AR75: =AR74 -> 8 | AS75: =AS74 -> 260 | BB75: =AK75+IF(s!BB74*s!BE74+s!BC74*s!BD74=0,0,E75*s!BB74*s!BE74/(s!BB74*s!BE74+s!BC74*s!BD74)+IF(s!BB74*s!BG74+s!BC74*s!BF74=0,0,K75*s!BB74*s!BG74/(s!BB74*s!BG74+s!BC74*s!BF74))+IF(s!BB74*s!BH74+s!BD74*s!BF74=0,0,M75*s!BB74*s!BH74/(s!BB74*s!BH74+s!BD74*s!BF74))+IF(s!BB74*s!BI74+s!BC74*s!BH74+s!BD74*s!BG74+s!BE74*s!BF74=0,0,N75*s!BB74*s!BI74/(s!BB74*s!BI74+s!BC74*s!BH74+s!BD74*s!BG74+s!BE74*s!BF74)
)) -> 223.76658467260009 | BC75: =AL75+IF(s!BC74*s!BD74+s!BB74*s!BE74=0,0,E75*s!BC74*s!BD74/(s!BC74*s!BD74+s!BB74*s!BE74))+IF(s!BB74*s!BG74+s!BC74*s!BF74=0,0,K75*s!BC74*s!BF74/(s!BB74*s!BG74+s!BC74*s!BF74))+IF(s!BC74*s!BI74+s!BE74*s!BG74=0,0,O75*s!BC74*s!BI74/(s!BC74*s!BI74+s!BE74*s!BG74))+IF(s!BB74*s!BI74+s!BC74*s!BH74+s!BD74*s!BG74+s!BE74*s!BF74=0,0,N75*s!BC74*s!BH74/(s!BB74*s!BI74+s!BC74*s!BH74+s!BD74*s!BG74+s!BE74*s!BF74)) -> 11.386767415496712 | BD75: =AM75+IF(s!BC74*s!BD74+s!BB74*s!BE74=0,0,E75*s!BC74*s!BD74/(s!BC74*s!BD74+s!BB74*s!BE74))+IF(s!BD74*s!BF74+s!BB74*s!BH74=0,0,M75*s!BD74*s!BF74/(s!BD74*s!BF74+s!BB74*s!BH74))+IF(s!BD74*s!BI74+s!BE74*s!BH74=0,0,Q75*s!BD74*s!BI74/(s!BD74*s!BI74+s!BE74*s!BH74))+IF(s!BB74*s!BI74+s!BC74*s!BH74+s!BD74*s!BG74+s!BE74*s!BF74=0,0,N75*s!BD74*s!BG74/(s!BB74*s!BI74+s!BC74*s!BH74+s!BD74*s!BG74+s!BE74*s!BF74)) -> 10.119740337390684 | BE75: =AN75+IF(s!BB74*s!BE74+s!BC74*s!BD74=0,0,E75*s!BB74*s!BE74/(s!BB74*s!BE74+s!BC74*s!BD74))+IF(s!BC74*s!BI74+s!BE74*s!BG74=0,0,O75*s!BE74*s!BG74/(s!BC74*s!BI74+s!BE74*s!BG74))+IF(s!BD74*s!BI74+s!BE74*s!BH74=0,0,Q75*s!BE74*s!BH74/(s!BD74*s!BI74+s!BE74*s!BH74))+IF(s!BB74*s!BI74+s!BC74*s!BH74+s!BD74*s!BG74+s!BE74*s!BF74=0,0,N75*s!BE74*s!BF74/(s!BB74*s!BI74+s!BC74*s!BH74+s!BD74*s!BG74+s!BE74*s!BF74)) -> 16.72690757451252 | BF75: =AO75+IF(s!BB74*s!BG74+s!BC74*s!BF74=0,0,K75*s!BC74*s!BF74/(s!BB74*s!BG74+s!BC74*s!BF74))+IF(s!BD74*s!BF74+s!BB74*s!BH74=0,0,M75*s!BD74*s!BF74/(s!BD74*s!BF74+s!BB74*s!BH74))+IF(s!BF74*s!BI74+s!BG74*s!BH74=0,0,W75*s!BF74*s!BI74/(s!BF74*s!BI74+s!BG74*s!BH74))+IF(s!BB74*s!BI74+s!BC74*s!BH74+s!BD74*s!BG74+s!BE74*s!BF74=0,0,N75*s!BE74*s!BF74/(s!BB74*s!BI74+s!BC74*s!BH74+s!BD74*s!BG74+s!BE74*s!BF74)) -> 10.141959884875231 | BG75: =AP75+IF(s!BB74*s!BG74+s!BC74*s!BF74=0,0,K75*s!BB74*s!BG74/(s!BB74*s!BG74+s!BC74*s!BF74))+IF(s!BC74*s!BI74+s!BE74*s!BG74=0,0,O75*s!BE74*s!BG74/(s!BC74*s!BI74+s!BE74*s!BG74))+IF(s!BF74*s!BI74+s!BG74*s!BH74=0,0,W75*s!BG74*s!BH74/(s!BF74*s!BI74+s!BG74*s!BH74))+IF(s!BB74*s!BI74+s!BC74*s!BH74+s!BD74*s!BG74+s!BE74*s!BF74=0,0,N75*s!BD74*s!BG74/(s!BB74*s!BI74+s!BC74*s!BH74+s!BD74*s!BG74+s!BE74*s!BF74)) -> 15.704688027027977 | BH75: =AQ75+IF(s!BB74*s!BH74+s!BD74*s!BF74=0,0,M75*s!BB74*s!BH74/(s!BB74*s!BH74+s!BD74*s!BF74))+IF(s!BD74*s!BI74+s!BE74*s!BH74=0,0,Q75*s!BE74*s!BH74/(s!BD74*s!BI74+s!BE74*s!BH74))+IF(s!BF74*s!BI74+s!BG74*s!BH74=0,0,W75*s!BG74*s!BH74/(s!BF74*s!BI74+s!BG74*s!BH74))+IF(s!BB74*s!BI74+s!BC74*s!BH74+s!BD74*s!BG74+s!BE74*s!BF74=0,0,N75*s!BC74*s!BH74/(s!BB74*s!BI74+s!BC74*s!BH74+s!BD74*s!BG74+s!BE74*s!BF74)) -> 17.971715105134002 | BI75: =AR75+IF(s!BC74*s!BI74+s!BE74*s!BG74=0,0,O75*s!BC74*s!BI74/(s!BC74*s!BI74+s!BE74*s!BG74))+IF(s!BD74*s!BI74+s!BE74*s!BH74=0,0,Q75*s!BD74*s!BI74/(s!BD74*s!BI74+s!BE74*s!BH74))+IF(s!BF74*s!BI74+s!BG74*s!BH74=0,0,W75*s!BF74*s!BI74/(s!BF74*s!BI74+s!BG74*s!BH74))+IF(s!BB74*s!BI74+s!BC74*s!BH74+s!BD74*s!BG74+s!BE74*s!BF74=0,0,N75*s!BB74*s!BI74/(s!BB74*s!BI74+s!BC74*s!BH74+s!BD74*s!BG74+s!BE74*s!BF74)) -> 20.18163698296279 | BJ75: =SUM(BB75:BI75) -> 326
A76: =A75 -> 100 | B76: =B75 -> 1 | C76: =C75 -> 1 | D76: =D75 -> 2 | E76: =E75 -> 5 | F76: =F75 -> 2 | G76: =G75 -> 1 | H76: =H75 -> 2 | I76: =I75 -> 1 | J76: =J75 -> 2 | K76: =K75 -> 4 | L76: =L75 -> 2 | M76: =M75 -> 4 | N76: =N75 -> 8 | O76: =O75 -> 4 | P76: =P75 -> 2 | Q76: =Q75 -> 4 | R76: =R75 -> 2 | S76: =S75 -> 1 | T76: =T75 -> 2 | U76: =U75 -> 1 | V76: =V75 -> 2 | W76: =W75 -> 4 | X76: =X75 -> 2 | Y76: =Y75 -> 1 | Z76: =Z75 -> 2 | AA76: =AA75 -> 1 | AB76: =AB75 -> 163 | AK76: =AK75 -> 205 | AL76: =AL75 -> 7 | AM76: =AM75 -> 8 | AN76: =AN75 -> 8 | AO76: =AO75 -> 8 | AP76: =AP75 -> 8 | AQ76: =AQ75 -> 8 | AR76: =AR75 -> 8 | AS76: =AS75 -> 260 | BB76: =AK76+IF(s!BB75*s!BE75+s!BC75*s!BD75=0,0,E76*s!BB75*s!BE75/(s!BB75*s!BE75+s!BC75*s!BD75)+IF(s!BB75*s!BG75+s!BC75*s!BF75=0,0,K76*s!BB75*s!BG75/(s!BB75*s!BG75+s!BC75*s!BF75))+IF(s!BB75*s!BH75+s!BD75*s!BF75=0,0,M76*s!BB75*s!BH75/(s!BB75*s!BH75+s!BD75*s!BF75))+IF(s!BB75*s!BI75+s!BC75*s!BH75+s!BD75*s!BG75+s!BE75*s!BF75=0,0,N76*s!BB75*s!BI75/(s!BB75*s!BI75+s!BC75*s!BH75+s!BD75*s!BG75+s!BE75*s!BF75)
)) -> 223.76658467259674 | BC76: =AL76+IF(s!BC75*s!BD75+s!BB75*s!BE75=0,0,E76*s!BC75*s!BD75/(s!BC75*s!BD75+s!BB75*s!BE75))+IF(s!BB75*s!BG75+s!BC75*s!BF75=0,0,K76*s!BC75*s!BF75/(s!BB75*s!BG75+s!BC75*s!BF75))+IF(s!BC75*s!BI75+s!BE75*s!BG75=0,0,O76*s!BC75*s!BI75/(s!BC75*s!BI75+s!BE75*s!BG75))+IF(s!BB75*s!BI75+s!BC75*s!BH75+s!BD75*s!BG75+s!BE75*s!BF75=0,0,N76*s!BC75*s!BH75/(s!BB75*s!BI75+s!BC75*s!BH75+s!BD75*s!BG75+s!BE75*s!BF75)) -> 11.386767415492116 | BD76: =AM76+IF(s!BC75*s!BD75+s!BB75*s!BE75=0,0,E76*s!BC75*s!BD75/(s!BC75*s!BD75+s!BB75*s!BE75))+IF(s!BD75*s!BF75+s!BB75*s!BH75=0,0,M76*s!BD75*s!BF75/(s!BD75*s!BF75+s!BB75*s!BH75))+IF(s!BD75*s!BI75+s!BE75*s!BH75=0,0,Q76*s!BD75*s!BI75/(s!BD75*s!BI75+s!BE75*s!BH75))+IF(s!BB75*s!BI75+s!BC75*s!BH75+s!BD75*s!BG75+s!BE75*s!BF75=0,0,N76*s!BD75*s!BG75/(s!BB75*s!BI75+s!BC75*s!BH75+s!BD75*s!BG75+s!BE75*s!BF75)) -> 10.119740337379765 | BE76: =AN76+IF(s!BB75*s!BE75+s!BC75*s!BD75=0,0,E76*s!BB75*s!BE75/(s!BB75*s!BE75+s!BC75*s!BD75))+IF(s!BC75*s!BI75+s!BE75*s!BG75=0,0,O76*s!BE75*s!BG75/(s!BC75*s!BI75+s!BE75*s!BG75))+IF(s!BD75*s!BI75+s!BE75*s!BH75=0,0,Q76*s!BE75*s!BH75/(s!BD75*s!BI75+s!BE75*s!BH75))+IF(s!BB75*s!BI75+s!BC75*s!BH75+s!BD75*s!BG75+s!BE75*s!BF75=0,0,N76*s!BE75*s!BF75/(s!BB75*s!BI75+s!BC75*s!BH75+s!BD75*s!BG75+s!BE75*s!BF75)) -> 16.726907574531396 | BF76: =AO76+IF(s!BB75*s!BG75+s!BC75*s!BF75=0,0,K76*s!BC75*s!BF75/(s!BB75*s!BG75+s!BC75*s!BF75))+IF(s!BD75*s!BF75+s!BB75*s!BH75=0,0,M76*s!BD75*s!BF75/(s!BD75*s!BF75+s!BB75*s!BH75))+IF(s!BF75*s!BI75+s!BG75*s!BH75=0,0,W76*s!BF75*s!BI75/(s!BF75*s!BI75+s!BG75*s!BH75))+IF(s!BB75*s!BI75+s!BC75*s!BH75+s!BD75*s!BG75+s!BE75*s!BF75=0,0,N76*s!BE75*s!BF75/(s!BB75*s!BI75+s!BC75*s!BH75+s!BD75*s!BG75+s!BE75*s!BF75)) -> 10.141959884864365 | BG76: =AP76+IF(s!BB75*s!BG75+s!BC75*s!BF75=0,0,K76*s!BB75*s!BG75/(s!BB75*s!BG75+s!BC75*s!BF75))+IF(s!BC75*s!BI75+s!BE75*s!BG75=0,0,O76*s!BE75*s!BG75/(s!BC75*s!BI75+s!BE75*s!BG75))+IF(s!BF75*s!BI75+s!BG75*s!BH75=0,0,W76*s!BG75*s!BH75/(s!BF75*s!BI75+s!BG75*s!BH75))+IF(s!BB75*s!BI75+s!BC75*s!BH75+s!BD75*s!BG75+s!BE75*s!BF75=0,0,N76*s!BD75*s!BG75/(s!BB75*s!BI75+s!BC75*s!BH75+s!BD75*s!BG75+s!BE75*s!BF75)) -> 15.704688027046792 | BH76: =AQ76+IF(s!BB75*s!BH75+s!BD75*s!BF75=0,0,M76*s!BB75*s!BH75/(s!BB75*s!BH75+s!BD75*s!BF75))+IF(s!BD75*s!BI75+s!BE75*s!BH75=0,0,Q76*s!BE75*s!BH75/(s!BD75*s!BI75+s!BE75*s!BH75))+IF(s!BF75*s!BI75+s!BG75*s!BH75=0,0,W76*s!BG75*s!BH75/(s!BF75*s!BI75+s!BG75*s!BH75))+IF(s!BB75*s!BI75+s!BC75*s!BH75+s!BD75*s!BG75+s!BE75*s!BF75=0,0,N76*s!BC75*s!BH75/(s!BB75*s!BI75+s!BC75*s!BH75+s!BD75*s!BG75+s!BE75*s!BF75)) -> 17.971715105159142 | BI76: =AR76+IF(s!BC75*s!BI75+s!BE75*s!BG75=0,0,O76*s!BC75*s!BI75/(s!BC75*s!BI75+s!BE75*s!BG75))+IF(s!BD75*s!BI75+s!BE75*s!BH75=0,0,Q76*s!BD75*s!BI75/(s!BD75*s!BI75+s!BE75*s!BH75))+IF(s!BF75*s!BI75+s!BG75*s!BH75=0,0,W76*s!BF75*s!BI75/(s!BF75*s!BI75+s!BG75*s!BH75))+IF(s!BB75*s!BI75+s!BC75*s!BH75+s!BD75*s!BG75+s!BE75*s!BF75=0,0,N76*s!BB75*s!BI75/(s!BB75*s!BI75+s!BC75*s!BH75+s!BD75*s!BG75+s!BE75*s!BF75)) -> 20.1816369829297 | BJ76: =SUM(BB76:BI76) -> 326
A77: =A76 -> 100 | B77: =B76 -> 1 | C77: =C76 -> 1 | D77: =D76 -> 2 | E77: =E76 -> 5 | F77: =F76 -> 2 | G77: =G76 -> 1 | H77: =H76 -> 2 | I77: =I76 -> 1 | J77: =J76 -> 2 | K77: =K76 -> 4 | L77: =L76 -> 2 | M77: =M76 -> 4 | N77: =N76 -> 8 | O77: =O76 -> 4 | P77: =P76 -> 2 | Q77: =Q76 -> 4 | R77: =R76 -> 2 | S77: =S76 -> 1 | T77: =T76 -> 2 | U77: =U76 -> 1 | V77: =V76 -> 2 | W77: =W76 -> 4 | X77: =X76 -> 2 | Y77: =Y76 -> 1 | Z77: =Z76 -> 2 | AA77: =AA76 -> 1 | AB77: =AB76 -> 163 | AK77: =AK76 -> 205 | AL77: =AL76 -> 7 | AM77: =AM76 -> 8 | AN77: =AN76 -> 8 | AO77: =AO76 -> 8 | AP77: =AP76 -> 8 | AQ77: =AQ76 -> 8 | AR77: =AR76 -> 8 | AS77: =AS76 -> 260 | BB77: =AK77+IF(s!BB76*s!BE76+s!BC76*s!BD76=0,0,E77*s!BB76*s!BE76/(s!BB76*s!BE76+s!BC76*s!BD76)+IF(s!BB76*s!BG76+s!BC76*s!BF76=0,0,K77*s!BB76*s!BG76/(s!BB76*s!BG76+s!BC76*s!BF76))+IF(s!BB76*s!BH76+s!BD76*s!BF76=0,0,M77*s!BB76*s!BH76/(s!BB76*s!BH76+s!BD76*s!BF76))+IF(s!BB76*s!BI76+s!BC76*s!BH76+s!BD76*s!BG76+s!BE76*s!BF76=0,0,N77*s!BB76*s!BI76/(s!BB76*s!BI76+s!BC76*s!BH76+s!BD76*s!BG76+s!BE76*s!BF76)
)) -> 223.76658467259432 | BC77: =AL77+IF(s!BC76*s!BD76+s!BB76*s!BE76=0,0,E77*s!BC76*s!BD76/(s!BC76*s!BD76+s!BB76*s!BE76))+IF(s!BB76*s!BG76+s!BC76*s!BF76=0,0,K77*s!BC76*s!BF76/(s!BB76*s!BG76+s!BC76*s!BF76))+IF(s!BC76*s!BI76+s!BE76*s!BG76=0,0,O77*s!BC76*s!BI76/(s!BC76*s!BI76+s!BE76*s!BG76))+IF(s!BB76*s!BI76+s!BC76*s!BH76+s!BD76*s!BG76+s!BE76*s!BF76=0,0,N77*s!BC76*s!BH76/(s!BB76*s!BI76+s!BC76*s!BH76+s!BD76*s!BG76+s!BE76*s!BF76)) -> 11.386767415488828 | BD77: =AM77+IF(s!BC76*s!BD76+s!BB76*s!BE76=0,0,E77*s!BC76*s!BD76/(s!BC76*s!BD76+s!BB76*s!BE76))+IF(s!BD76*s!BF76+s!BB76*s!BH76=0,0,M77*s!BD76*s!BF76/(s!BD76*s!BF76+s!BB76*s!BH76))+IF(s!BD76*s!BI76+s!BE76*s!BH76=0,0,Q77*s!BD76*s!BI76/(s!BD76*s!BI76+s!BE76*s!BH76))+IF(s!BB76*s!BI76+s!BC76*s!BH76+s!BD76*s!BG76+s!BE76*s!BF76=0,0,N77*s!BD76*s!BG76/(s!BB76*s!BI76+s!BC76*s!BH76+s!BD76*s!BG76+s!BE76*s!BF76)) -> 10.119740337371951 | BE77: =AN77+IF(s!BB76*s!BE76+s!BC76*s!BD76=0,0,E77*s!BB76*s!BE76/(s!BB76*s!BE76+s!BC76*s!BD76))+IF(s!BC76*s!BI76+s!BE76*s!BG76=0,0,O77*s!BE76*s!BG76/(s!BC76*s!BI76+s!BE76*s!BG76))+IF(s!BD76*s!BI76+s!BE76*s!BH76=0,0,Q77*s!BE76*s!BH76/(s!BD76*s!BI76+s!BE76*s!BH76))+IF(s!BB76*s!BI76+s!BC76*s!BH76+s!BD76*s!BG76+s!BE76*s!BF76=0,0,N77*s!BE76*s!BF76/(s!BB76*s!BI76+s!BC76*s!BH76+s!BD76*s!BG76+s!BE76*s!BF76)) -> 16.726907574544896 | BF77: =AO77+IF(s!BB76*s!BG76+s!BC76*s!BF76=0,0,K77*s!BC76*s!BF76/(s!BB76*s!BG76+s!BC76*s!BF76))+IF(s!BD76*s!BF76+s!BB76*s!BH76=0,0,M77*s!BD76*s!BF76/(s!BD76*s!BF76+s!BB76*s!BH76))+IF(s!BF76*s!BI76+s!BG76*s!BH76=0,0,W77*s!BF76*s!BI76/(s!BF76*s!BI76+s!BG76*s!BH76))+IF(s!BB76*s!BI76+s!BC76*s!BH76+s!BD76*s!BG76+s!BE76*s!BF76=0,0,N77*s!BE76*s!BF76/(s!BB76*s!BI76+s!BC76*s!BH76+s!BD76*s!BG76+s!BE76*s!BF76)) -> 10.141959884856592 | BG77: =AP77+IF(s!BB76*s!BG76+s!BC76*s!BF76=0,0,K77*s!BB76*s!BG76/(s!BB76*s!BG76+s!BC76*s!BF76))+IF(s!BC76*s!BI76+s!BE76*s!BG76=0,0,O77*s!BE76*s!BG76/(s!BC76*s!BI76+s!BE76*s!BG76))+IF(s!BF76*s!BI76+s!BG76*s!BH76=0,0,W77*s!BG76*s!BH76/(s!BF76*s!BI76+s!BG76*s!BH76))+IF(s!BB76*s!BI76+s!BC76*s!BH76+s!BD76*s!BG76+s!BE76*s!BF76=0,0,N77*s!BD76*s!BG76/(s!BB76*s!BI76+s!BC76*s!BH76+s!BD76*s!BG76+s!BE76*s!BF76)) -> 15.704688027060252 | BH77: =AQ77+IF(s!BB76*s!BH76+s!BD76*s!BF76=0,0,M77*s!BB76*s!BH76/(s!BB76*s!BH76+s!BD76*s!BF76))+IF(s!BD76*s!BI76+s!BE76*s!BH76=0,0,Q77*s!BE76*s!BH76/(s!BD76*s!BI76+s!BE76*s!BH76))+IF(s!BF76*s!BI76+s!BG76*s!BH76=0,0,W77*s!BG76*s!BH76/(s!BF76*s!BI76+s!BG76*s!BH76))+IF(s!BB76*s!BI76+s!BC76*s!BH76+s!BD76*s!BG76+s!BE76*s!BF76=0,0,N77*s!BC76*s!BH76/(s!BB76*s!BI76+s!BC76*s!BH76+s!BD76*s!BG76+s!BE76*s!BF76)) -> 17.971715105177132 | BI77: =AR77+IF(s!BC76*s!BI76+s!BE76*s!BG76=0,0,O77*s!BC76*s!BI76/(s!BC76*s!BI76+s!BE76*s!BG76))+IF(s!BD76*s!BI76+s!BE76*s!BH76=0,0,Q77*s!BD76*s!BI76/(s!BD76*s!BI76+s!BE76*s!BH76))+IF(s!BF76*s!BI76+s!BG76*s!BH76=0,0,W77*s!BF76*s!BI76/(s!BF76*s!BI76+s!BG76*s!BH76))+IF(s!BB76*s!BI76+s!BC76*s!BH76+s!BD76*s!BG76+s!BE76*s!BF76=0,0,N77*s!BB76*s!BI76/(s!BB76*s!BI76+s!BC76*s!BH76+s!BD76*s!BG76+s!BE76*s!BF76)) -> 20.181636982906024 | BJ77: =SUM(BB77:BI77) -> 326
A78: =A77 -> 100 | B78: =B77 -> 1 | C78: =C77 -> 1 | D78: =D77 -> 2 | E78: =E77 -> 5 | F78: =F77 -> 2 | G78: =G77 -> 1 | H78: =H77 -> 2 | I78: =I77 -> 1 | J78: =J77 -> 2 | K78: =K77 -> 4 | L78: =L77 -> 2 | M78: =M77 -> 4 | N78: =N77 -> 8 | O78: =O77 -> 4 | P78: =P77 -> 2 | Q78: =Q77 -> 4 | R78: =R77 -> 2 | S78: =S77 -> 1 | T78: =T77 -> 2 | U78: =U77 -> 1 | V78: =V77 -> 2 | W78: =W77 -> 4 | X78: =X77 -> 2 | Y78: =Y77 -> 1 | Z78: =Z77 -> 2 | AA78: =AA77 -> 1 | AB78: =AB77 -> 163 | AK78: =AK77 -> 205 | AL78: =AL77 -> 7 | AM78: =AM77 -> 8 | AN78: =AN77 -> 8 | AO78: =AO77 -> 8 | AP78: =AP77 -> 8 | AQ78: =AQ77 -> 8 | AR78: =AR77 -> 8 | AS78: =AS77 -> 260 | BB78: =AK78+IF(s!BB77*s!BE77+s!BC77*s!BD77=0,0,E78*s!BB77*s!BE77/(s!BB77*s!BE77+s!BC77*s!BD77)+IF(s!BB77*s!BG77+s!BC77*s!BF77=0,0,K78*s!BB77*s!BG77/(s!BB77*s!BG77+s!BC77*s!BF77))+IF(s!BB77*s!BH77+s!BD77*s!BF77=0,0,M78*s!BB77*s!BH77/(s!BB77*s!BH77+s!BD77*s!BF77))+IF(s!BB77*s!BI77+s!BC77*s!BH77+s!BD77*s!BG77+s!BE77*s!BF77=0,0,N78*s!BB77*s!BI77/(s!BB77*s!BI77+s!BC77*s!BH77+s!BD77*s!BG77+s!BE77*s!BF77)
)) -> 223.76658467259261 | BC78: =AL78+IF(s!BC77*s!BD77+s!BB77*s!BE77=0,0,E78*s!BC77*s!BD77/(s!BC77*s!BD77+s!BB77*s!BE77))+IF(s!BB77*s!BG77+s!BC77*s!BF77=0,0,K78*s!BC77*s!BF77/(s!BB77*s!BG77+s!BC77*s!BF77))+IF(s!BC77*s!BI77+s!BE77*s!BG77=0,0,O78*s!BC77*s!BI77/(s!BC77*s!BI77+s!BE77*s!BG77))+IF(s!BB77*s!BI77+s!BC77*s!BH77+s!BD77*s!BG77+s!BE77*s!BF77=0,0,N78*s!BC77*s!BH77/(s!BB77*s!BI77+s!BC77*s!BH77+s!BD77*s!BG77+s!BE77*s!BF77)) -> 11.386767415486476 | BD78: =AM78+IF(s!BC77*s!BD77+s!BB77*s!BE77=0,0,E78*s!BC77*s!BD77/(s!BC77*s!BD77+s!BB77*s!BE77))+IF(s!BD77*s!BF77+s!BB77*s!BH77=0,0,M78*s!BD77*s!BF77/(s!BD77*s!BF77+s!BB77*s!BH77))+IF(s!BD77*s!BI77+s!BE77*s!BH77=0,0,Q78*s!BD77*s!BI77/(s!BD77*s!BI77+s!BE77*s!BH77))+IF(s!BB77*s!BI77+s!BC77*s!BH77+s!BD77*s!BG77+s!BE77*s!BF77=0,0,N78*s!BD77*s!BG77/(s!BB77*s!BI77+s!BC77*s!BH77+s!BD77*s!BG77+s!BE77*s!BF77)) -> 10.119740337366361 | BE78: =AN78+IF(s!BB77*s!BE77+s!BC77*s!BD77=0,0,E78*s!BB77*s!BE77/(s!BB77*s!BE77+s!BC77*s!BD77))+IF(s!BC77*s!BI77+s!BE77*s!BG77=0,0,O78*s!BE77*s!BG77/(s!BC77*s!BI77+s!BE77*s!BG77))+IF(s!BD77*s!BI77+s!BE77*s!BH77=0,0,Q78*s!BE77*s!BH77/(s!BD77*s!BI77+s!BE77*s!BH77))+IF(s!BB77*s!BI77+s!BC77*s!BH77+s!BD77*s!BG77+s!BE77*s!BF77=0,0,N78*s!BE77*s!BF77/(s!BB77*s!BI77+s!BC77*s!BH77+s!BD77*s!BG77+s!BE77*s!BF77)) -> 16.726907574554556 | BF78: =AO78+IF(s!BB77*s!BG77+s!BC77*s!BF77=0,0,K78*s!BC77*s!BF77/(s!BB77*s!BG77+s!BC77*s!BF77))+IF(s!BD77*s!BF77+s!BB77*s!BH77=0,0,M78*s!BD77*s!BF77/(s!BD77*s!BF77+s!BB77*s!BH77))+IF(s!BF77*s!BI77+s!BG77*s!BH77=0,0,W78*s!BF77*s!BI77/(s!BF77*s!BI77+s!BG77*s!BH77))+IF(s!BB77*s!BI77+s!BC77*s!BH77+s!BD77*s!BG77+s!BE77*s!BF77=0,0,N78*s!BE77*s!BF77/(s!BB77*s!BI77+s!BC77*s!BH77+s!BD77*s!BG77+s!BE77*s!BF77)) -> 10.14195988485103 | BG78: =AP78+IF(s!BB77*s!BG77+s!BC77*s!BF77=0,0,K78*s!BB77*s!BG77/(s!BB77*s!BG77+s!BC77*s!BF77))+IF(s!BC77*s!BI77+s!BE77*s!BG77=0,0,O78*s!BE77*s!BG77/(s!BC77*s!BI77+s!BE77*s!BG77))+IF(s!BF77*s!BI77+s!BG77*s!BH77=0,0,W78*s!BG77*s!BH77/(s!BF77*s!BI77+s!BG77*s!BH77))+IF(s!BB77*s!BI77+s!BC77*s!BH77+s!BD77*s!BG77+s!BE77*s!BF77=0,0,N78*s!BD77*s!BG77/(s!BB77*s!BI77+s!BC77*s!BH77+s!BD77*s!BG77+s!BE77*s!BF77)) -> 15.704688027069885 | BH78: =AQ78+IF(s!BB77*s!BH77+s!BD77*s!BF77=0,0,M78*s!BB77*s!BH77/(s!BB77*s!BH77+s!BD77*s!BF77))+IF(s!BD77*s!BI77+s!BE77*s!BH77=0,0,Q78*s!BE77*s!BH77/(s!BD77*s!BI77+s!BE77*s!BH77))+IF(s!BF77*s!BI77+s!BG77*s!BH77=0,0,W78*s!BG77*s!BH77/(s!BF77*s!BI77+s!BG77*s!BH77))+IF(s!BB77*s!BI77+s!BC77*s!BH77+s!BD77*s!BG77+s!BE77*s!BF77=0,0,N78*s!BC77*s!BH77/(s!BB77*s!BI77+s!BC77*s!BH77+s!BD77*s!BG77+s!BE77*s!BF77)) -> 17.97171510519 | BI78: =AR78+IF(s!BC77*s!BI77+s!BE77*s!BG77=0,0,O78*s!BC77*s!BI77/(s!BC77*s!BI77+s!BE77*s!BG77))+IF(s!BD77*s!BI77+s!BE77*s!BH77=0,0,Q78*s!BD77*s!BI77/(s!BD77*s!BI77+s!BE77*s!BH77))+IF(s!BF77*s!BI77+s!BG77*s!BH77=0,0,W78*s!BF77*s!BI77/(s!BF77*s!BI77+s!BG77*s!BH77))+IF(s!BB77*s!BI77+s!BC77*s!BH77+s!BD77*s!BG77+s!BE77*s!BF77=0,0,N78*s!BB77*s!BI77/(s!BB77*s!BI77+s!BC77*s!BH77+s!BD77*s!BG77+s!BE77*s!BF77)) -> 20.181636982889085 | BJ78: =SUM(BB78:BI78) -> 326
A79: =A78 -> 100 | B79: =B78 -> 1 | C79: =C78 -> 1 | D79: =D78 -> 2 | E79: =E78 -> 5 | F79: =F78 -> 2 | G79: =G78 -> 1 | H79: =H78 -> 2 | I79: =I78 -> 1 | J79: =J78 -> 2 | K79: =K78 -> 4 | L79: =L78 -> 2 | M79: =M78 -> 4 | N79: =N78 -> 8 | O79: =O78 -> 4 | P79: =P78 -> 2 | Q79: =Q78 -> 4 | R79: =R78 -> 2 | S79: =S78 -> 1 | T79: =T78 -> 2 | U79: =U78 -> 1 | V79: =V78 -> 2 | W79: =W78 -> 4 | X79: =X78 -> 2 | Y79: =Y78 -> 1 | Z79: =Z78 -> 2 | AA79: =AA78 -> 1 | AB79: =AB78 -> 163 | AK79: =AK78 -> 205 | AL79: =AL78 -> 7 | AM79: =AM78 -> 8 | AN79: =AN78 -> 8 | AO79: =AO78 -> 8 | AP79: =AP78 -> 8 | AQ79: =AQ78 -> 8 | AR79: =AR78 -> 8 | AS79: =AS78 -> 260 | BB79: =AK79+IF(s!BB78*s!BE78+s!BC78*s!BD78=0,0,E79*s!BB78*s!BE78/(s!BB78*s!BE78+s!BC78*s!BD78)+IF(s!BB78*s!BG78+s!BC78*s!BF78=0,0,K79*s!BB78*s!BG78/(s!BB78*s!BG78+s!BC78*s!BF78))+IF(s!BB78*s!BH78+s!BD78*s!BF78=0,0,M79*s!BB78*s!BH78/(s!BB78*s!BH78+s!BD78*s!BF78))+IF(s!BB78*s!BI78+s!BC78*s!BH78+s!BD78*s!BG78+s!BE78*s!BF78=0,0,N79*s!BB78*s!BI78/(s!BB78*s!BI78+s!BC78*s!BH78+s!BD78*s!BG78+s!BE78*s!BF78)
)) -> 223.76658467259136 | BC79: =AL79+IF(s!BC78*s!BD78+s!BB78*s!BE78=0,0,E79*s!BC78*s!BD78/(s!BC78*s!BD78+s!BB78*s!BE78))+IF(s!BB78*s!BG78+s!BC78*s!BF78=0,0,K79*s!BC78*s!BF78/(s!BB78*s!BG78+s!BC78*s!BF78))+IF(s!BC78*s!BI78+s!BE78*s!BG78=0,0,O79*s!BC78*s!BI78/(s!BC78*s!BI78+s!BE78*s!BG78))+IF(s!BB78*s!BI78+s!BC78*s!BH78+s!BD78*s!BG78+s!BE78*s!BF78=0,0,N79*s!BC78*s!BH78/(s!BB78*s!BI78+s!BC78*s!BH78+s!BD78*s!BG78+s!BE78*s!BF78)) -> 11.386767415484794 | BD79: =AM79+IF(s!BC78*s!BD78+s!BB78*s!BE78=0,0,E79*s!BC78*s!BD78/(s!BC78*s!BD78+s!BB78*s!BE78))+IF(s!BD78*s!BF78+s!BB78*s!BH78=0,0,M79*s!BD78*s!BF78/(s!BD78*s!BF78+s!BB78*s!BH78))+IF(s!BD78*s!BI78+s!BE78*s!BH78=0,0,Q79*s!BD78*s!BI78/(s!BD78*s!BI78+s!BE78*s!BH78))+IF(s!BB78*s!BI78+s!BC78*s!BH78+s!BD78*s!BG78+s!BE78*s!BF78=0,0,N79*s!BD78*s!BG78/(s!BB78*s!BI78+s!BC78*s!BH78+s!BD78*s!BG78+s!BE78*s!BF78)) -> 10.11974033736236 | BE79: =AN79+IF(s!BB78*s!BE78+s!BC78*s!BD78=0,0,E79*s!BB78*s!BE78/(s!BB78*s!BE78+s!BC78*s!BD78))+IF(s!BC78*s!BI78+s!BE78*s!BG78=0,0,O79*s!BE78*s!BG78/(s!BC78*s!BI78+s!BE78*s!BG78))+IF(s!BD78*s!BI78+s!BE78*s!BH78=0,0,Q79*s!BE78*s!BH78/(s!BD78*s!BI78+s!BE78*s!BH78))+IF(s!BB78*s!BI78+s!BC78*s!BH78+s!BD78*s!BG78+s!BE78*s!BF78=0,0,N79*s!BE78*s!BF78/(s!BB78*s!BI78+s!BC78*s!BH78+s!BD78*s!BG78+s!BE78*s!BF78)) -> 16.726907574561462 | BF79: =AO79+IF(s!BB78*s!BG78+s!BC78*s!BF78=0,0,K79*s!BC78*s!BF78/(s!BB78*s!BG78+s!BC78*s!BF78))+IF(s!BD78*s!BF78+s!BB78*s!BH78=0,0,M79*s!BD78*s!BF78/(s!BD78*s!BF78+s!BB78*s!BH78))+IF(s!BF78*s!BI78+s!BG78*s!BH78=0,0,W79*s!BF78*s!BI78/(s!BF78*s!BI78+s!BG78*s!BH78))+IF(s!BB78*s!BI78+s!BC78*s!BH78+s!BD78*s!BG78+s!BE78*s!BF78=0,0,N79*s!BE78*s!BF78/(s!BB78*s!BI78+s!BC78*s!BH78+s!BD78*s!BG78+s!BE78*s!BF78)) -> 10.141959884847051 | BG79: =AP79+IF(s!BB78*s!BG78+s!BC78*s!BF78=0,0,K79*s!BB78*s!BG78/(s!BB78*s!BG78+s!BC78*s!BF78))+IF(s!BC78*s!BI78+s!BE78*s!BG78=0,0,O79*s!BE78*s!BG78/(s!BC78*s!BI78+s!BE78*s!BG78))+IF(s!BF78*s!BI78+s!BG78*s!BH78=0,0,W79*s!BG78*s!BH78/(s!BF78*s!BI78+s!BG78*s!BH78))+IF(s!BB78*s!BI78+s!BC78*s!BH78+s!BD78*s!BG78+s!BE78*s!BF78=0,0,N79*s!BD78*s!BG78/(s!BB78*s!BI78+s!BC78*s!BH78+s!BD78*s!BG78+s!BE78*s!BF78)) -> 15.704688027076774 | BH79: =AQ79+IF(s!BB78*s!BH78+s!BD78*s!BF78=0,0,M79*s!BB78*s!BH78/(s!BB78*s!BH78+s!BD78*s!BF78))+IF(s!BD78*s!BI78+s!BE78*s!BH78=0,0,Q79*s!BE78*s!BH78/(s!BD78*s!BI78+s!BE78*s!BH78))+IF(s!BF78*s!BI78+s!BG78*s!BH78=0,0,W79*s!BG78*s!BH78/(s!BF78*s!BI78+s!BG78*s!BH78))+IF(s!BB78*s!BI78+s!BC78*s!BH78+s!BD78*s!BG78+s!BE78*s!BF78=0,0,N79*s!BC78*s!BH78/(s!BB78*s!BI78+s!BC78*s!BH78+s!BD78*s!BG78+s!BE78*s!BF78)) -> 17.971715105199209 | BI79: =AR79+IF(s!BC78*s!BI78+s!BE78*s!BG78=0,0,O79*s!BC78*s!BI78/(s!BC78*s!BI78+s!BE78*s!BG78))+IF(s!BD78*s!BI78+s!BE78*s!BH78=0,0,Q79*s!BD78*s!BI78/(s!BD78*s!BI78+s!BE78*s!BH78))+IF(s!BF78*s!BI78+s!BG78*s!BH78=0,0,W79*s!BF78*s!BI78/(s!BF78*s!BI78+s!BG78*s!BH78))+IF(s!BB78*s!BI78+s!BC78*s!BH78+s!BD78*s!BG78+s!BE78*s!BF78=0,0,N79*s!BB78*s!BI78/(s!BB78*s!BI78+s!BC78*s!BH78+s!BD78*s!BG78+s!BE78*s!BF78)) -> 20.181636982876967 | BJ79: =SUM(BB79:BI79) -> 326
A80: =A79 -> 100 | B80: =B79 -> 1 | C80: =C79 -> 1 | D80: =D79 -> 2 | E80: =E79 -> 5 | F80: =F79 -> 2 | G80: =G79 -> 1 | H80: =H79 -> 2 | I80: =I79 -> 1 | J80: =J79 -> 2 | K80: =K79 -> 4 | L80: =L79 -> 2 | M80: =M79 -> 4 | N80: =N79 -> 8 | O80: =O79 -> 4 | P80: =P79 -> 2 | Q80: =Q79 -> 4 | R80: =R79 -> 2 | S80: =S79 -> 1 | T80: =T79 -> 2 | U80: =U79 -> 1 | V80: =V79 -> 2 | W80: =W79 -> 4 | X80: =X79 -> 2 | Y80: =Y79 -> 1 | Z80: =Z79 -> 2 | AA80: =AA79 -> 1 | AB80: =AB79 -> 163 | AK80: =AK79 -> 205 | AL80: =AL79 -> 7 | AM80: =AM79 -> 8 | AN80: =AN79 -> 8 | AO80: =AO79 -> 8 | AP80: =AP79 -> 8 | AQ80: =AQ79 -> 8 | AR80: =AR79 -> 8 | AS80: =AS79 -> 260 | BB80: =AK80+IF(s!BB79*s!BE79+s!BC79*s!BD79=0,0,E80*s!BB79*s!BE79/(s!BB79*s!BE79+s!BC79*s!BD79)+IF(s!BB79*s!BG79+s!BC79*s!BF79=0,0,K80*s!BB79*s!BG79/(s!BB79*s!BG79+s!BC79*s!BF79))+IF(s!BB79*s!BH79+s!BD79*s!BF79=0,0,M80*s!BB79*s!BH79/(s!BB79*s!BH79+s!BD79*s!BF79))+IF(s!BB79*s!BI79+s!BC79*s!BH79+s!BD79*s!BG79+s!BE79*s!BF79=0,0,N80*s!BB79*s!BI79/(s!BB79*s!BI79+s!BC79*s!BH79+s!BD79*s!BG79+s!BE79*s!BF79)
)) -> 223.76658467259051 | BC80: =AL80+IF(s!BC79*s!BD79+s!BB79*s!BE79=0,0,E80*s!BC79*s!BD79/(s!BC79*s!BD79+s!BB79*s!BE79))+IF(s!BB79*s!BG79+s!BC79*s!BF79=0,0,K80*s!BC79*s!BF79/(s!BB79*s!BG79+s!BC79*s!BF79))+IF(s!BC79*s!BI79+s!BE79*s!BG79=0,0,O80*s!BC79*s!BI79/(s!BC79*s!BI79+s!BE79*s!BG79))+IF(s!BB79*s!BI79+s!BC79*s!BH79+s!BD79*s!BG79+s!BE79*s!BF79=0,0,N80*s!BC79*s!BH79/(s!BB79*s!BI79+s!BC79*s!BH79+s!BD79*s!BG79+s!BE79*s!BF79)) -> 11.38676741548359 | BD80: =AM80+IF(s!BC79*s!BD79+s!BB79*s!BE79=0,0,E80*s!BC79*s!BD79/(s!BC79*s!BD79+s!BB79*s!BE79))+IF(s!BD79*s!BF79+s!BB79*s!BH79=0,0,M80*s!BD79*s!BF79/(s!BD79*s!BF79+s!BB79*s!BH79))+IF(s!BD79*s!BI79+s!BE79*s!BH79=0,0,Q80*s!BD79*s!BI79/(s!BD79*s!BI79+s!BE79*s!BH79))+IF(s!BB79*s!BI79+s!BC79*s!BH79+s!BD79*s!BG79+s!BE79*s!BF79=0,0,N80*s!BD79*s!BG79/(s!BB79*s!BI79+s!BC79*s!BH79+s!BD79*s!BG79+s!BE79*s!BF79)) -> 10.119740337359501 | BE80: =AN80+IF(s!BB79*s!BE79+s!BC79*s!BD79=0,0,E80*s!BB79*s!BE79/(s!BB79*s!BE79+s!BC79*s!BD79))+IF(s!BC79*s!BI79+s!BE79*s!BG79=0,0,O80*s!BE79*s!BG79/(s!BC79*s!BI79+s!BE79*s!BG79))+IF(s!BD79*s!BI79+s!BE79*s!BH79=0,0,Q80*s!BE79*s!BH79/(s!BD79*s!BI79+s!BE79*s!BH79))+IF(s!BB79*s!BI79+s!BC79*s!BH79+s!BD79*s!BG79+s!BE79*s!BF79=0,0,N80*s!BE79*s!BF79/(s!BB79*s!BI79+s!BC79*s!BH79+s!BD79*s!BG79+s!BE79*s!BF79)) -> 16.726907574566411 | BF80: =AO80+IF(s!BB79*s!BG79+s!BC79*s!BF79=0,0,K80*s!BC79*s!BF79/(s!BB79*s!BG79+s!BC79*s!BF79))+IF(s!BD79*s!BF79+s!BB79*s!BH79=0,0,M80*s!BD79*s!BF79/(s!BD79*s!BF79+s!BB79*s!BH79))+IF(s!BF79*s!BI79+s!BG79*s!BH79=0,0,W80*s!BF79*s!BI79/(s!BF79*s!BI79+s!BG79*s!BH79))+IF(s!BB79*s!BI79+s!BC79*s!BH79+s!BD79*s!BG79+s!BE79*s!BF79=0,0,N80*s!BE79*s!BF79/(s!BB79*s!BI79+s!BC79*s!BH79+s!BD79*s!BG79+s!BE79*s!BF79)) -> 10.141959884844205 | BG80: =AP80+IF(s!BB79*s!BG79+s!BC79*s!BF79=0,0,K80*s!BB79*s!BG79/(s!BB79*s!BG79+s!BC79*s!BF79))+IF(s!BC79*s!BI79+s!BE79*s!BG79=0,0,O80*s!BE79*s!BG79/(s!BC79*s!BI79+s!BE79*s!BG79))+IF(s!BF79*s!BI79+s!BG79*s!BH79=0,0,W80*s!BG79*s!BH79/(s!BF79*s!BI79+s!BG79*s!BH79))+IF(s!BB79*s!BI79+s!BC79*s!BH79+s!BD79*s!BG79+s!BE79*s!BF79=0,0,N80*s!BD79*s!BG79/(s!BB79*s!BI79+s!BC79*s!BH79+s!BD79*s!BG79+s!BE79*s!BF79)) -> 15.704688027081707 | BH80: =AQ80+IF(s!BB79*s!BH79+s!BD79*s!BF79=0,0,M80*s!BB79*s!BH79/(s!BB79*s!BH79+s!BD79*s!BF79))+IF(s!BD79*s!BI79+s!BE79*s!BH79=0,0,Q80*s!BE79*s!BH79/(s!BD79*s!BI79+s!BE79*s!BH79))+IF(s!BF79*s!BI79+s!BG79*s!BH79=0,0,W80*s!BG79*s!BH79/(s!BF79*s!BI79+s!BG79*s!BH79))+IF(s!BB79*s!BI79+s!BC79*s!BH79+s!BD79*s!BG79+s!BE79*s!BF79=0,0,N80*s!BC79*s!BH79/(s!BB79*s!BI79+s!BC79*s!BH79+s!BD79*s!BG79+s!BE79*s!BF79)) -> 17.971715105205799 | BI80: =AR80+IF(s!BC79*s!BI79+s!BE79*s!BG79=0,0,O80*s!BC79*s!BI79/(s!BC79*s!BI79+s!BE79*s!BG79))+IF(s!BD79*s!BI79+s!BE79*s!BH79=0,0,Q80*s!BD79*s!BI79/(s!BD79*s!BI79+s!BE79*s!BH79))+IF(s!BF79*s!BI79+s!BG79*s!BH79=0,0,W80*s!BF79*s!BI79/(s!BF79*s!BI79+s!BG79*s!BH79))+IF(s!BB79*s!BI79+s!BC79*s!BH79+s!BD79*s!BG79+s!BE79*s!BF79=0,0,N80*s!BB79*s!BI79/(s!BB79*s!BI79+s!BC79*s!BH79+s!BD79*s!BG79+s!BE79*s!BF79)) -> 20.181636982868294 | BJ80: =SUM(BB80:BI80) -> 326
A81: =A80 -> 100 | B81: =B80 -> 1 | C81: =C80 -> 1 | D81: =D80 -> 2 | E81: =E80 -> 5 | F81: =F80 -> 2 | G81: =G80 -> 1 | H81: =H80 -> 2 | I81: =I80 -> 1 | J81: =J80 -> 2 | K81: =K80 -> 4 | L81: =L80 -> 2 | M81: =M80 -> 4 | N81: =N80 -> 8 | O81: =O80 -> 4 | P81: =P80 -> 2 | Q81: =Q80 -> 4 | R81: =R80 -> 2 | S81: =S80 -> 1 | T81: =T80 -> 2 | U81: =U80 -> 1 | V81: =V80 -> 2 | W81: =W80 -> 4 | X81: =X80 -> 2 | Y81: =Y80 -> 1 | Z81: =Z80 -> 2 | AA81: =AA80 -> 1 | AB81: =AB80 -> 163 | AK81: =AK80 -> 205 | AL81: =AL80 -> 7 | AM81: =AM80 -> 8 | AN81: =AN80 -> 8 | AO81: =AO80 -> 8 | AP81: =AP80 -> 8 | AQ81: =AQ80 -> 8 | AR81: =AR80 -> 8 | AS81: =AS80 -> 260 | BB81: =AK81+IF(s!BB80*s!BE80+s!BC80*s!BD80=0,0,E81*s!BB80*s!BE80/(s!BB80*s!BE80+s!BC80*s!BD80)+IF(s!BB80*s!BG80+s!BC80*s!BF80=0,0,K81*s!BB80*s!BG80/(s!BB80*s!BG80+s!BC80*s!BF80))+IF(s!BB80*s!BH80+s!BD80*s!BF80=0,0,M81*s!BB80*s!BH80/(s!BB80*s!BH80+s!BD80*s!BF80))+IF(s!BB80*s!BI80+s!BC80*s!BH80+s!BD80*s!BG80+s!BE80*s!BF80=0,0,N81*s!BB80*s!BI80/(s!BB80*s!BI80+s!BC80*s!BH80+s!BD80*s!BG80+s!BE80*s!BF80)
)) -> 223.76658467258986 | BC81: =AL81+IF(s!BC80*s!BD80+s!BB80*s!BE80=0,0,E81*s!BC80*s!BD80/(s!BC80*s!BD80+s!BB80*s!BE80))+IF(s!BB80*s!BG80+s!BC80*s!BF80=0,0,K81*s!BC80*s!BF80/(s!BB80*s!BG80+s!BC80*s!BF80))+IF(s!BC80*s!BI80+s!BE80*s!BG80=0,0,O81*s!BC80*s!BI80/(s!BC80*s!BI80+s!BE80*s!BG80))+IF(s!BB80*s!BI80+s!BC80*s!BH80+s!BD80*s!BG80+s!BE80*s!BF80=0,0,N81*s!BC80*s!BH80/(s!BB80*s!BI80+s!BC80*s!BH80+s!BD80*s!BG80+s!BE80*s!BF80)) -> 11.386767415482728 | BD81: =AM81+IF(s!BC80*s!BD80+s!BB80*s!BE80=0,0,E81*s!BC80*s!BD80/(s!BC80*s!BD80+s!BB80*s!BE80))+IF(s!BD80*s!BF80+s!BB80*s!BH80=0,0,M81*s!BD80*s!BF80/(s!BD80*s!BF80+s!BB80*s!BH80))+IF(s!BD80*s!BI80+s!BE80*s!BH80=0,0,Q81*s!BD80*s!BI80/(s!BD80*s!BI80+s!BE80*s!BH80))+IF(s!BB80*s!BI80+s!BC80*s!BH80+s!BD80*s!BG80+s!BE80*s!BF80=0,0,N81*s!BD80*s!BG80/(s!BB80*s!BI80+s!BC80*s!BH80+s!BD80*s!BG80+s!BE80*s!BF80)) -> 10.119740337357454 | BE81: =AN81+IF(s!BB80*s!BE80+s!BC80*s!BD80=0,0,E81*s!BB80*s!BE80/(s!BB80*s!BE80+s!BC80*s!BD80))+IF(s!BC80*s!BI80+s!BE80*s!BG80=0,0,O81*s!BE80*s!BG80/(s!BC80*s!BI80+s!BE80*s!BG80))+IF(s!BD80*s!BI80+s!BE80*s!BH80=0,0,Q81*s!BE80*s!BH80/(s!BD80*s!BI80+s!BE80*s!BH80))+IF(s!BB80*s!BI80+s!BC80*s!BH80+s!BD80*s!BG80+s!BE80*s!BF80=0,0,N81*s!BE80*s!BF80/(s!BB80*s!BI80+s!BC80*s!BH80+s!BD80*s!BG80+s!BE80*s!BF80)) -> 16.726907574569946 | BF81: =AO81+IF(s!BB80*s!BG80+s!BC80*s!BF80=0,0,K81*s!BC80*s!BF80/(s!BB80*s!BG80+s!BC80*s!BF80))+IF(s!BD80*s!BF80+s!BB80*s!BH80=0,0,M81*s!BD80*s!BF80/(s!BD80*s!BF80+s!BB80*s!BH80))+IF(s!BF80*s!BI80+s!BG80*s!BH80=0,0,W81*s!BF80*s!BI80/(s!BF80*s!BI80+s!BG80*s!BH80))+IF(s!BB80*s!BI80+s!BC80*s!BH80+s!BD80*s!BG80+s!BE80*s!BF80=0,0,N81*s!BE80*s!BF80/(s!BB80*s!BI80+s!BC80*s!BH80+s!BD80*s!BG80+s!BE80*s!BF80)) -> 10.141959884842167 | BG81: =AP81+IF(s!BB80*s!BG80+s!BC80*s!BF80=0,0,K81*s!BB80*s!BG80/(s!BB80*s!BG80+s!BC80*s!BF80))+IF(s!BC80*s!BI80+s!BE80*s!BG80=0,0,O81*s!BE80*s!BG80/(s!BC80*s!BI80+s!BE80*s!BG80))+IF(s!BF80*s!BI80+s!BG80*s!BH80=0,0,W81*s!BG80*s!BH80/(s!BF80*s!BI80+s!BG80*s!BH80))+IF(s!BB80*s!BI80+s!BC80*s!BH80+s!BD80*s!BG80+s!BE80*s!BF80=0,0,N81*s!BD80*s!BG80/(s!BB80*s!BI80+s!BC80*s!BH80+s!BD80*s!BG80+s!BE80*s!BF80)) -> 15.704688027085233 | BH81: =AQ81+IF(s!BB80*s!BH80+s!BD80*s!BF80=0,0,M81*s!BB80*s!BH80/(s!BB80*s!BH80+s!BD80*s!BF80))+IF(s!BD80*s!BI80+s!BE80*s!BH80=0,0,Q81*s!BE80*s!BH80/(s!BD80*s!BI80+s!BE80*s!BH80))+IF(s!BF80*s!BI80+s!BG80*s!BH80=0,0,W81*s!BG80*s!BH80/(s!BF80*s!BI80+s!BG80*s!BH80))+IF(s!BB80*s!BI80+s!BC80*s!BH80+s!BD80*s!BG80+s!BE80*s!BF80=0,0,N81*s!BC80*s!BH80/(s!BB80*s!BI80+s!BC80*s!BH80+s!BD80*s!BG80+s!BE80*s!BF80)) -> 17.971715105210507 | BI81: =AR81+IF(s!BC80*s!BI80+s!BE80*s!BG80=0,0,O81*s!BC80*s!BI80/(s!BC80*s!BI80+s!BE80*s!BG80))+IF(s!BD80*s!BI80+s!BE80*s!BH80=0,0,Q81*s!BD80*s!BI80/(s!BD80*s!BI80+s!BE80*s!BH80))+IF(s!BF80*s!BI80+s!BG80*s!BH80=0,0,W81*s!BF80*s!BI80/(s!BF80*s!BI80+s!BG80*s!BH80))+IF(s!BB80*s!BI80+s!BC80*s!BH80+s!BD80*s!BG80+s!BE80*s!BF80=0,0,N81*s!BB80*s!BI80/(s!BB80*s!BI80+s!BC80*s!BH80+s!BD80*s!BG80+s!BE80*s!BF80)) -> 20.181636982862091 | BJ81: =SUM(BB81:BI81) -> 326
A82: =A81 -> 100 | B82: =B81 -> 1 | C82: =C81 -> 1 | D82: =D81 -> 2 | E82: =E81 -> 5 | F82: =F81 -> 2 | G82: =G81 -> 1 | H82: =H81 -> 2 | I82: =I81 -> 1 | J82: =J81 -> 2 | K82: =K81 -> 4 | L82: =L81 -> 2 | M82: =M81 -> 4 | N82: =N81 -> 8 | O82: =O81 -> 4 | P82: =P81 -> 2 | Q82: =Q81 -> 4 | R82: =R81 -> 2 | S82: =S81 -> 1 | T82: =T81 -> 2 | U82: =U81 -> 1 | V82: =V81 -> 2 | W82: =W81 -> 4 | X82: =X81 -> 2 | Y82: =Y81 -> 1 | Z82: =Z81 -> 2 | AA82: =AA81 -> 1 | AB82: =AB81 -> 163 | AK82: =AK81 -> 205 | AL82: =AL81 -> 7 | AM82: =AM81 -> 8 | AN82: =AN81 -> 8 | AO82: =AO81 -> 8 | AP82: =AP81 -> 8 | AQ82: =AQ81 -> 8 | AR82: =AR81 -> 8 | AS82: =AS81 -> 260 | BB82: =AK82+IF(s!BB81*s!BE81+s!BC81*s!BD81=0,0,E82*s!BB81*s!BE81/(s!BB81*s!BE81+s!BC81*s!BD81)+IF(s!BB81*s!BG81+s!BC81*s!BF81=0,0,K82*s!BB81*s!BG81/(s!BB81*s!BG81+s!BC81*s!BF81))+IF(s!BB81*s!BH81+s!BD81*s!BF81=0,0,M82*s!BB81*s!BH81/(s!BB81*s!BH81+s!BD81*s!BF81))+IF(s!BB81*s!BI81+s!BC81*s!BH81+s!BD81*s!BG81+s!BE81*s!BF81=0,0,N82*s!BB81*s!BI81/(s!BB81*s!BI81+s!BC81*s!BH81+s!BD81*s!BG81+s!BE81*s!BF81)
)) -> 223.76658467258943 | BC82: =AL82+IF(s!BC81*s!BD81+s!BB81*s!BE81=0,0,E82*s!BC81*s!BD81/(s!BC81*s!BD81+s!BB81*s!BE81))+IF(s!BB81*s!BG81+s!BC81*s!BF81=0,0,K82*s!BC81*s!BF81/(s!BB81*s!BG81+s!BC81*s!BF81))+IF(s!BC81*s!BI81+s!BE81*s!BG81=0,0,O82*s!BC81*s!BI81/(s!BC81*s!BI81+s!BE81*s!BG81))+IF(s!BB81*s!BI81+s!BC81*s!BH81+s!BD81*s!BG81+s!BE81*s!BF81=0,0,N82*s!BC81*s!BH81/(s!BB81*s!BI81+s!BC81*s!BH81+s!BD81*s!BG81+s!BE81*s!BF81)) -> 11.386767415482112 | BD82: =AM82+IF(s!BC81*s!BD81+s!BB81*s!BE81=0,0,E82*s!BC81*s!BD81/(s!BC81*s!BD81+s!BB81*s!BE81))+IF(s!BD81*s!BF81+s!BB81*s!BH81=0,0,M82*s!BD81*s!BF81/(s!BD81*s!BF81+s!BB81*s!BH81))+IF(s!BD81*s!BI81+s!BE81*s!BH81=0,0,Q82*s!BD81*s!BI81/(s!BD81*s!BI81+s!BE81*s!BH81))+IF(s!BB81*s!BI81+s!BC81*s!BH81+s!BD81*s!BG81+s!BE81*s!BF81=0,0,N82*s!BD81*s!BG81/(s!BB81*s!BI81+s!BC81*s!BH81+s!BD81*s!BG81+s!BE81*s!BF81)) -> 10.119740337355989 | BE82: =AN82+IF(s!BB81*s!BE81+s!BC81*s!BD81=0,0,E82*s!BB81*s!BE81/(s!BB81*s!BE81+s!BC81*s!BD81))+IF(s!BC81*s!BI81+s!BE81*s!BG81=0,0,O82*s!BE81*s!BG81/(s!BC81*s!BI81+s!BE81*s!BG81))+IF(s!BD81*s!BI81+s!BE81*s!BH81=0,0,Q82*s!BE81*s!BH81/(s!BD81*s!BI81+s!BE81*s!BH81))+IF(s!BB81*s!BI81+s!BC81*s!BH81+s!BD81*s!BG81+s!BE81*s!BF81=0,0,N82*s!BE81*s!BF81/(s!BB81*s!BI81+s!BC81*s!BH81+s!BD81*s!BG81+s!BE81*s!BF81)) -> 16.726907574572479 | BF82: =AO82+IF(s!BB81*s!BG81+s!BC81*s!BF81=0,0,K82*s!BC81*s!BF81/(s!BB81*s!BG81+s!BC81*s!BF81))+IF(s!BD81*s!BF81+s!BB81*s!BH81=0,0,M82*s!BD81*s!BF81/(s!BD81*s!BF81+s!BB81*s!BH81))+IF(s!BF81*s!BI81+s!BG81*s!BH81=0,0,W82*s!BF81*s!BI81/(s!BF81*s!BI81+s!BG81*s!BH81))+IF(s!BB81*s!BI81+s!BC81*s!BH81+s!BD81*s!BG81+s!BE81*s!BF81=0,0,N82*s!BE81*s!BF81/(s!BB81*s!BI81+s!BC81*s!BH81+s!BD81*s!BG81+s!BE81*s!BF81)) -> 10.141959884840711 | BG82: =AP82+IF(s!BB81*s!BG81+s!BC81*s!BF81=0,0,K82*s!BB81*s!BG81/(s!BB81*s!BG81+s!BC81*s!BF81))+IF(s!BC81*s!BI81+s!BE81*s!BG81=0,0,O82*s!BE81*s!BG81/(s!BC81*s!BI81+s!BE81*s!BG81))+IF(s!BF81*s!BI81+s!BG81*s!BH81=0,0,W82*s!BG81*s!BH81/(s!BF81*s!BI81+s!BG81*s!BH81))+IF(s!BB81*s!BI81+s!BC81*s!BH81+s!BD81*s!BG81+s!BE81*s!BF81=0,0,N82*s!BD81*s!BG81/(s!BB81*s!BI81+s!BC81*s!BH81+s!BD81*s!BG81+s!BE81*s!BF81)) -> 15.704688027087755 | BH82: =AQ82+IF(s!BB81*s!BH81+s!BD81*s!BF81=0,0,M82*s!BB81*s!BH81/(s!BB81*s!BH81+s!BD81*s!BF81))+IF(s!BD81*s!BI81+s!BE81*s!BH81=0,0,Q82*s!BE81*s!BH81/(s!BD81*s!BI81+s!BE81*s!BH81))+IF(s!BF81*s!BI81+s!BG81*s!BH81=0,0,W82*s!BG81*s!BH81/(s!BF81*s!BI81+s!BG81*s!BH81))+IF(s!BB81*s!BI81+s!BC81*s!BH81+s!BD81*s!BG81+s!BE81*s!BF81=0,0,N82*s!BC81*s!BH81/(s!BB81*s!BI81+s!BC81*s!BH81+s!BD81*s!BG81+s!BE81*s!BF81)) -> 17.971715105213882 | BI82: =AR82+IF(s!BC81*s!BI81+s!BE81*s!BG81=0,0,O82*s!BC81*s!BI81/(s!BC81*s!BI81+s!BE81*s!BG81))+IF(s!BD81*s!BI81+s!BE81*s!BH81=0,0,Q82*s!BD81*s!BI81/(s!BD81*s!BI81+s!BE81*s!BH81))+IF(s!BF81*s!BI81+s!BG81*s!BH81=0,0,W82*s!BF81*s!BI81/(s!BF81*s!BI81+s!BG81*s!BH81))+IF(s!BB81*s!BI81+s!BC81*s!BH81+s!BD81*s!BG81+s!BE81*s!BF81=0,0,N82*s!BB81*s!BI81/(s!BB81*s!BI81+s!BC81*s!BH81+s!BD81*s!BG81+s!BE81*s!BF81)) -> 20.181636982857654 | BJ82: =SUM(BB82:BI82) -> 326
A83: =A82 -> 100 | B83: =B82 -> 1 | C83: =C82 -> 1 | D83: =D82 -> 2 | E83: =E82 -> 5 | F83: =F82 -> 2 | G83: =G82 -> 1 | H83: =H82 -> 2 | I83: =I82 -> 1 | J83: =J82 -> 2 | K83: =K82 -> 4 | L83: =L82 -> 2 | M83: =M82 -> 4 | N83: =N82 -> 8 | O83: =O82 -> 4 | P83: =P82 -> 2 | Q83: =Q82 -> 4 | R83: =R82 -> 2 | S83: =S82 -> 1 | T83: =T82 -> 2 | U83: =U82 -> 1 | V83: =V82 -> 2 | W83: =W82 -> 4 | X83: =X82 -> 2 | Y83: =Y82 -> 1 | Z83: =Z82 -> 2 | AA83: =AA82 -> 1 | AB83: =AB82 -> 163 | AK83: =AK82 -> 205 | AL83: =AL82 -> 7 | AM83: =AM82 -> 8 | AN83: =AN82 -> 8 | AO83: =AO82 -> 8 | AP83: =AP82 -> 8 | AQ83: =AQ82 -> 8 | AR83: =AR82 -> 8 | AS83: =AS82 -> 260 | BB83: =AK83+IF(s!BB82*s!BE82+s!BC82*s!BD82=0,0,E83*s!BB82*s!BE82/(s!BB82*s!BE82+s!BC82*s!BD82)+IF(s!BB82*s!BG82+s!BC82*s!BF82=0,0,K83*s!BB82*s!BG82/(s!BB82*s!BG82+s!BC82*s!BF82))+IF(s!BB82*s!BH82+s!BD82*s!BF82=0,0,M83*s!BB82*s!BH82/(s!BB82*s!BH82+s!BD82*s!BF82))+IF(s!BB82*s!BI82+s!BC82*s!BH82+s!BD82*s!BG82+s!BE82*s!BF82=0,0,N83*s!BB82*s!BI82/(s!BB82*s!BI82+s!BC82*s!BH82+s!BD82*s!BG82+s!BE82*s!BF82)
)) -> 223.76658467258909 | BC83: =AL83+IF(s!BC82*s!BD82+s!BB82*s!BE82=0,0,E83*s!BC82*s!BD82/(s!BC82*s!BD82+s!BB82*s!BE82))+IF(s!BB82*s!BG82+s!BC82*s!BF82=0,0,K83*s!BC82*s!BF82/(s!BB82*s!BG82+s!BC82*s!BF82))+IF(s!BC82*s!BI82+s!BE82*s!BG82=0,0,O83*s!BC82*s!BI82/(s!BC82*s!BI82+s!BE82*s!BG82))+IF(s!BB82*s!BI82+s!BC82*s!BH82+s!BD82*s!BG82+s!BE82*s!BF82=0,0,N83*s!BC82*s!BH82/(s!BB82*s!BI82+s!BC82*s!BH82+s!BD82*s!BG82+s!BE82*s!BF82)) -> 11.386767415481671 | BD83: =AM83+IF(s!BC82*s!BD82+s!BB82*s!BE82=0,0,E83*s!BC82*s!BD82/(s!BC82*s!BD82+s!BB82*s!BE82))+IF(s!BD82*s!BF82+s!BB82*s!BH82=0,0,M83*s!BD82*s!BF82/(s!BD82*s!BF82+s!BB82*s!BH82))+IF(s!BD82*s!BI82+s!BE82*s!BH82=0,0,Q83*s!BD82*s!BI82/(s!BD82*s!BI82+s!BE82*s!BH82))+IF(s!BB82*s!BI82+s!BC82*s!BH82+s!BD82*s!BG82+s!BE82*s!BF82=0,0,N83*s!BD82*s!BG82/(s!BB82*s!BI82+s!BC82*s!BH82+s!BD82*s!BG82+s!BE82*s!BF82)) -> 10.119740337354941 | BE83: =AN83+IF(s!BB82*s!BE82+s!BC82*s!BD82=0,0,E83*s!BB82*s!BE82/(s!BB82*s!BE82+s!BC82*s!BD82))+IF(s!BC82*s!BI82+s!BE82*s!BG82=0,0,O83*s!BE82*s!BG82/(s!BC82*s!BI82+s!BE82*s!BG82))+IF(s!BD82*s!BI82+s!BE82*s!BH82=0,0,Q83*s!BE82*s!BH82/(s!BD82*s!BI82+s!BE82*s!BH82))+IF(s!BB82*s!BI82+s!BC82*s!BH82+s!BD82*s!BG82+s!BE82*s!BF82=0,0,N83*s!BE82*s!BF82/(s!BB82*s!BI82+s!BC82*s!BH82+s!BD82*s!BG82+s!BE82*s!BF82)) -> 16.726907574574291 | BF83: =AO83+IF(s!BB82*s!BG82+s!BC82*s!BF82=0,0,K83*s!BC82*s!BF82/(s!BB82*s!BG82+s!BC82*s!BF82))+IF(s!BD82*s!BF82+s!BB82*s!BH82=0,0,M83*s!BD82*s!BF82/(s!BD82*s!BF82+s!BB82*s!BH82))+IF(s!BF82*s!BI82+s!BG82*s!BH82=0,0,W83*s!BF82*s!BI82/(s!BF82*s!BI82+s!BG82*s!BH82))+IF(s!BB82*s!BI82+s!BC82*s!BH82+s!BD82*s!BG82+s!BE82*s!BF82=0,0,N83*s!BE82*s!BF82/(s!BB82*s!BI82+s!BC82*s!BH82+s!BD82*s!BG82+s!BE82*s!BF82)) -> 10.141959884839666 | BG83: =AP83+IF(s!BB82*s!BG82+s!BC82*s!BF82=0,0,K83*s!BB82*s!BG82/(s!BB82*s!BG82+s!BC82*s!BF82))+IF(s!BC82*s!BI82+s!BE82*s!BG82=0,0,O83*s!BE82*s!BG82/(s!BC82*s!BI82+s!BE82*s!BG82))+IF(s!BF82*s!BI82+s!BG82*s!BH82=0,0,W83*s!BG82*s!BH82/(s!BF82*s!BI82+s!BG82*s!BH82))+IF(s!BB82*s!BI82+s!BC82*s!BH82+s!BD82*s!BG82+s!BE82*s!BF82=0,0,N83*s!BD82*s!BG82/(s!BB82*s!BI82+s!BC82*s!BH82+s!BD82*s!BG82+s!BE82*s!BF82)) -> 15.704688027089563 | BH83: =AQ83+IF(s!BB82*s!BH82+s!BD82*s!BF82=0,0,M83*s!BB82*s!BH82/(s!BB82*s!BH82+s!BD82*s!BF82))+IF(s!BD82*s!BI82+s!BE82*s!BH82=0,0,Q83*s!BE82*s!BH82/(s!BD82*s!BI82+s!BE82*s!BH82))+IF(s!BF82*s!BI82+s!BG82*s!BH82=0,0,W83*s!BG82*s!BH82/(s!BF82*s!BI82+s!BG82*s!BH82))+IF(s!BB82*s!BI82+s!BC82*s!BH82+s!BD82*s!BG82+s!BE82*s!BF82=0,0,N83*s!BC82*s!BH82/(s!BB82*s!BI82+s!BC82*s!BH82+s!BD82*s!BG82+s!BE82*s!BF82)) -> 17.97171510521629 | BI83: =AR83+IF(s!BC82*s!BI82+s!BE82*s!BG82=0,0,O83*s!BC82*s!BI82/(s!BC82*s!BI82+s!BE82*s!BG82))+IF(s!BD82*s!BI82+s!BE82*s!BH82=0,0,Q83*s!BD82*s!BI82/(s!BD82*s!BI82+s!BE82*s!BH82))+IF(s!BF82*s!BI82+s!BG82*s!BH82=0,0,W83*s!BF82*s!BI82/(s!BF82*s!BI82+s!BG82*s!BH82))+IF(s!BB82*s!BI82+s!BC82*s!BH82+s!BD82*s!BG82+s!BE82*s!BF82=0,0,N83*s!BB82*s!BI82/(s!BB82*s!BI82+s!BC82*s!BH82+s!BD82*s!BG82+s!BE82*s!BF82)) -> 20.181636982854478 | BJ83: =SUM(BB83:BI83) -> 326
A84: =A83 -> 100 | B84: =B83 -> 1 | C84: =C83 -> 1 | D84: =D83 -> 2 | E84: =E83 -> 5 | F84: =F83 -> 2 | G84: =G83 -> 1 | H84: =H83 -> 2 | I84: =I83 -> 1 | J84: =J83 -> 2 | K84: =K83 -> 4 | L84: =L83 -> 2 | M84: =M83 -> 4 | N84: =N83 -> 8 | O84: =O83 -> 4 | P84: =P83 -> 2 | Q84: =Q83 -> 4 | R84: =R83 -> 2 | S84: =S83 -> 1 | T84: =T83 -> 2 | U84: =U83 -> 1 | V84: =V83 -> 2 | W84: =W83 -> 4 | X84: =X83 -> 2 | Y84: =Y83 -> 1 | Z84: =Z83 -> 2 | AA84: =AA83 -> 1 | AB84: =AB83 -> 163 | AK84: =AK83 -> 205 | AL84: =AL83 -> 7 | AM84: =AM83 -> 8 | AN84: =AN83 -> 8 | AO84: =AO83 -> 8 | AP84: =AP83 -> 8 | AQ84: =AQ83 -> 8 | AR84: =AR83 -> 8 | AS84: =AS83 -> 260 | BB84: =AK84+IF(s!BB83*s!BE83+s!BC83*s!BD83=0,0,E84*s!BB83*s!BE83/(s!BB83*s!BE83+s!BC83*s!BD83)+IF(s!BB83*s!BG83+s!BC83*s!BF83=0,0,K84*s!BB83*s!BG83/(s!BB83*s!BG83+s!BC83*s!BF83))+IF(s!BB83*s!BH83+s!BD83*s!BF83=0,0,M84*s!BB83*s!BH83/(s!BB83*s!BH83+s!BD83*s!BF83))+IF(s!BB83*s!BI83+s!BC83*s!BH83+s!BD83*s!BG83+s!BE83*s!BF83=0,0,N84*s!BB83*s!BI83/(s!BB83*s!BI83+s!BC83*s!BH83+s!BD83*s!BG83+s!BE83*s!BF83)
)) -> 223.76658467258886 | BC84: =AL84+IF(s!BC83*s!BD83+s!BB83*s!BE83=0,0,E84*s!BC83*s!BD83/(s!BC83*s!BD83+s!BB83*s!BE83))+IF(s!BB83*s!BG83+s!BC83*s!BF83=0,0,K84*s!BC83*s!BF83/(s!BB83*s!BG83+s!BC83*s!BF83))+IF(s!BC83*s!BI83+s!BE83*s!BG83=0,0,O84*s!BC83*s!BI83/(s!BC83*s!BI83+s!BE83*s!BG83))+IF(s!BB83*s!BI83+s!BC83*s!BH83+s!BD83*s!BG83+s!BE83*s!BF83=0,0,N84*s!BC83*s!BH83/(s!BB83*s!BI83+s!BC83*s!BH83+s!BD83*s!BG83+s!BE83*s!BF83)) -> 11.386767415481355 | BD84: =AM84+IF(s!BC83*s!BD83+s!BB83*s!BE83=0,0,E84*s!BC83*s!BD83/(s!BC83*s!BD83+s!BB83*s!BE83))+IF(s!BD83*s!BF83+s!BB83*s!BH83=0,0,M84*s!BD83*s!BF83/(s!BD83*s!BF83+s!BB83*s!BH83))+IF(s!BD83*s!BI83+s!BE83*s!BH83=0,0,Q84*s!BD83*s!BI83/(s!BD83*s!BI83+s!BE83*s!BH83))+IF(s!BB83*s!BI83+s!BC83*s!BH83+s!BD83*s!BG83+s!BE83*s!BF83=0,0,N84*s!BD83*s!BG83/(s!BB83*s!BI83+s!BC83*s!BH83+s!BD83*s!BG83+s!BE83*s!BF83)) -> 10.119740337354193 | BE84: =AN84+IF(s!BB83*s!BE83+s!BC83*s!BD83=0,0,E84*s!BB83*s!BE83/(s!BB83*s!BE83+s!BC83*s!BD83))+IF(s!BC83*s!BI83+s!BE83*s!BG83=0,0,O84*s!BE83*s!BG83/(s!BC83*s!BI83+s!BE83*s!BG83))+IF(s!BD83*s!BI83+s!BE83*s!BH83=0,0,Q84*s!BE83*s!BH83/(s!BD83*s!BI83+s!BE83*s!BH83))+IF(s!BB83*s!BI83+s!BC83*s!BH83+s!BD83*s!BG83+s!BE83*s!BF83=0,0,N84*s!BE83*s!BF83/(s!BB83*s!BI83+s!BC83*s!BH83+s!BD83*s!BG83+s!BE83*s!BF83)) -> 16.726907574575588 | BF84: =AO84+IF(s!BB83*s!BG83+s!BC83*s!BF83=0,0,K84*s!BC83*s!BF83/(s!BB83*s!BG83+s!BC83*s!BF83))+IF(s!BD83*s!BF83+s!BB83*s!BH83=0,0,M84*s!BD83*s!BF83/(s!BD83*s!BF83+s!BB83*s!BH83))+IF(s!BF83*s!BI83+s!BG83*s!BH83=0,0,W84*s!BF83*s!BI83/(s!BF83*s!BI83+s!BG83*s!BH83))+IF(s!BB83*s!BI83+s!BC83*s!BH83+s!BD83*s!BG83+s!BE83*s!BF83=0,0,N84*s!BE83*s!BF83/(s!BB83*s!BI83+s!BC83*s!BH83+s!BD83*s!BG83+s!BE83*s!BF83)) -> 10.141959884838922 | BG84: =AP84+IF(s!BB83*s!BG83+s!BC83*s!BF83=0,0,K84*s!BB83*s!BG83/(s!BB83*s!BG83+s!BC83*s!BF83))+IF(s!BC83*s!BI83+s!BE83*s!BG83=0,0,O84*s!BE83*s!BG83/(s!BC83*s!BI83+s!BE83*s!BG83))+IF(s!BF83*s!BI83+s!BG83*s!BH83=0,0,W84*s!BG83*s!BH83/(s!BF83*s!BI83+s!BG83*s!BH83))+IF(s!BB83*s!BI83+s!BC83*s!BH83+s!BD83*s!BG83+s!BE83*s!BF83=0,0,N84*s!BD83*s!BG83/(s!BB83*s!BI83+s!BC83*s!BH83+s!BD83*s!BG83+s!BE83*s!BF83)) -> 15.704688027090855 | BH84: =AQ84+IF(s!BB83*s!BH83+s!BD83*s!BF83=0,0,M84*s!BB83*s!BH83/(s!BB83*s!BH83+s!BD83*s!BF83))+IF(s!BD83*s!BI83+s!BE83*s!BH83=0,0,Q84*s!BE83*s!BH83/(s!BD83*s!BI83+s!BE83*s!BH83))+IF(s!BF83*s!BI83+s!BG83*s!BH83=0,0,W84*s!BG83*s!BH83/(s!BF83*s!BI83+s!BG83*s!BH83))+IF(s!BB83*s!BI83+s!BC83*s!BH83+s!BD83*s!BG83+s!BE83*s!BF83=0,0,N84*s!BC83*s!BH83/(s!BB83*s!BI83+s!BC83*s!BH83+s!BD83*s!BG83+s!BE83*s!BF83)) -> 17.971715105218021 | BI84: =AR84+IF(s!BC83*s!BI83+s!BE83*s!BG83=0,0,O84*s!BC83*s!BI83/(s!BC83*s!BI83+s!BE83*s!BG83))+IF(s!BD83*s!BI83+s!BE83*s!BH83=0,0,Q84*s!BD83*s!BI83/(s!BD83*s!BI83+s!BE83*s!BH83))+IF(s!BF83*s!BI83+s!BG83*s!BH83=0,0,W84*s!BF83*s!BI83/(s!BF83*s!BI83+s!BG83*s!BH83))+IF(s!BB83*s!BI83+s!BC83*s!BH83+s!BD83*s!BG83+s!BE83*s!BF83=0,0,N84*s!BB83*s!BI83/(s!BB83*s!BI83+s!BC83*s!BH83+s!BD83*s!BG83+s!BE83*s!BF83)) -> 20.181636982852204 | BJ84: =SUM(BB84:BI84) -> 326
A85: =A84 -> 100 | B85: =B84 -> 1 | C85: =C84 -> 1 | D85: =D84 -> 2 | E85: =E84 -> 5 | F85: =F84 -> 2 | G85: =G84 -> 1 | H85: =H84 -> 2 | I85: =I84 -> 1 | J85: =J84 -> 2 | K85: =K84 -> 4 | L85: =L84 -> 2 | M85: =M84 -> 4 | N85: =N84 -> 8 | O85: =O84 -> 4 | P85: =P84 -> 2 | Q85: =Q84 -> 4 | R85: =R84 -> 2 | S85: =S84 -> 1 | T85: =T84 -> 2 | U85: =U84 -> 1 | V85: =V84 -> 2 | W85: =W84 -> 4 | X85: =X84 -> 2 | Y85: =Y84 -> 1 | Z85: =Z84 -> 2 | AA85: =AA84 -> 1 | AB85: =AB84 -> 163 | AK85: =AK84 -> 205 | AL85: =AL84 -> 7 | AM85: =AM84 -> 8 | AN85: =AN84 -> 8 | AO85: =AO84 -> 8 | AP85: =AP84 -> 8 | AQ85: =AQ84 -> 8 | AR85: =AR84 -> 8 | AS85: =AS84 -> 260 | BB85: =AK85+IF(s!BB84*s!BE84+s!BC84*s!BD84=0,0,E85*s!BB84*s!BE84/(s!BB84*s!BE84+s!BC84*s!BD84)+IF(s!BB84*s!BG84+s!BC84*s!BF84=0,0,K85*s!BB84*s!BG84/(s!BB84*s!BG84+s!BC84*s!BF84))+IF(s!BB84*s!BH84+s!BD84*s!BF84=0,0,M85*s!BB84*s!BH84/(s!BB84*s!BH84+s!BD84*s!BF84))+IF(s!BB84*s!BI84+s!BC84*s!BH84+s!BD84*s!BG84+s!BE84*s!BF84=0,0,N85*s!BB84*s!BI84/(s!BB84*s!BI84+s!BC84*s!BH84+s!BD84*s!BG84+s!BE84*s!BF84)
)) -> 223.76658467258869 | BC85: =AL85+IF(s!BC84*s!BD84+s!BB84*s!BE84=0,0,E85*s!BC84*s!BD84/(s!BC84*s!BD84+s!BB84*s!BE84))+IF(s!BB84*s!BG84+s!BC84*s!BF84=0,0,K85*s!BC84*s!BF84/(s!BB84*s!BG84+s!BC84*s!BF84))+IF(s!BC84*s!BI84+s!BE84*s!BG84=0,0,O85*s!BC84*s!BI84/(s!BC84*s!BI84+s!BE84*s!BG84))+IF(s!BB84*s!BI84+s!BC84*s!BH84+s!BD84*s!BG84+s!BE84*s!BF84=0,0,N85*s!BC84*s!BH84/(s!BB84*s!BI84+s!BC84*s!BH84+s!BD84*s!BG84+s!BE84*s!BF84)) -> 11.386767415481128 | BD85: =AM85+IF(s!BC84*s!BD84+s!BB84*s!BE84=0,0,E85*s!BC84*s!BD84/(s!BC84*s!BD84+s!BB84*s!BE84))+IF(s!BD84*s!BF84+s!BB84*s!BH84=0,0,M85*s!BD84*s!BF84/(s!BD84*s!BF84+s!BB84*s!BH84))+IF(s!BD84*s!BI84+s!BE84*s!BH84=0,0,Q85*s!BD84*s!BI84/(s!BD84*s!BI84+s!BE84*s!BH84))+IF(s!BB84*s!BI84+s!BC84*s!BH84+s!BD84*s!BG84+s!BE84*s!BF84=0,0,N85*s!BD84*s!BG84/(s!BB84*s!BI84+s!BC84*s!BH84+s!BD84*s!BG84+s!BE84*s!BF84)) -> 10.119740337353655 | BE85: =AN85+IF(s!BB84*s!BE84+s!BC84*s!BD84=0,0,E85*s!BB84*s!BE84/(s!BB84*s!BE84+s!BC84*s!BD84))+IF(s!BC84*s!BI84+s!BE84*s!BG84=0,0,O85*s!BE84*s!BG84/(s!BC84*s!BI84+s!BE84*s!BG84))+IF(s!BD84*s!BI84+s!BE84*s!BH84=0,0,Q85*s!BE84*s!BH84/(s!BD84*s!BI84+s!BE84*s!BH84))+IF(s!BB84*s!BI84+s!BC84*s!BH84+s!BD84*s!BG84+s!BE84*s!BF84=0,0,N85*s!BE84*s!BF84/(s!BB84*s!BI84+s!BC84*s!BH84+s!BD84*s!BG84+s!BE84*s!BF84)) -> 16.726907574576511 | BF85: =AO85+IF(s!BB84*s!BG84+s!BC84*s!BF84=0,0,K85*s!BC84*s!BF84/(s!BB84*s!BG84+s!BC84*s!BF84))+IF(s!BD84*s!BF84+s!BB84*s!BH84=0,0,M85*s!BD84*s!BF84/(s!BD84*s!BF84+s!BB84*s!BH84))+IF(s!BF84*s!BI84+s!BG84*s!BH84=0,0,W85*s!BF84*s!BI84/(s!BF84*s!BI84+s!BG84*s!BH84))+IF(s!BB84*s!BI84+s!BC84*s!BH84+s!BD84*s!BG84+s!BE84*s!BF84=0,0,N85*s!BE84*s!BF84/(s!BB84*s!BI84+s!BC84*s!BH84+s!BD84*s!BG84+s!BE84*s!BF84)) -> 10.141959884838389 | BG85: =AP85+IF(s!BB84*s!BG84+s!BC84*s!BF84=0,0,K85*s!BB84*s!BG84/(s!BB84*s!BG84+s!BC84*s!BF84))+IF(s!BC84*s!BI84+s!BE84*s!BG84=0,0,O85*s!BE84*s!BG84/(s!BC84*s!BI84+s!BE84*s!BG84))+IF(s!BF84*s!BI84+s!BG84*s!BH84=0,0,W85*s!BG84*s!BH84/(s!BF84*s!BI84+s!BG84*s!BH84))+IF(s!BB84*s!BI84+s!BC84*s!BH84+s!BD84*s!BG84+s!BE84*s!BF84=0,0,N85*s!BD84*s!BG84/(s!BB84*s!BI84+s!BC84*s!BH84+s!BD84*s!BG84+s!BE84*s!BF84)) -> 15.704688027091777 | BH85: =AQ85+IF(s!BB84*s!BH84+s!BD84*s!BF84=0,0,M85*s!BB84*s!BH84/(s!BB84*s!BH84+s!BD84*s!BF84))+IF(s!BD84*s!BI84+s!BE84*s!BH84=0,0,Q85*s!BE84*s!BH84/(s!BD84*s!BI84+s!BE84*s!BH84))+IF(s!BF84*s!BI84+s!BG84*s!BH84=0,0,W85*s!BG84*s!BH84/(s!BF84*s!BI84+s!BG84*s!BH84))+IF(s!BB84*s!BI84+s!BC84*s!BH84+s!BD84*s!BG84+s!BE84*s!BF84=0,0,N85*s!BC84*s!BH84/(s!BB84*s!BI84+s!BC84*s!BH84+s!BD84*s!BG84+s!BE84*s!BF84)) -> 17.97171510521925 | BI85: =AR85+IF(s!BC84*s!BI84+s!BE84*s!BG84=0,0,O85*s!BC84*s!BI84/(s!BC84*s!BI84+s!BE84*s!BG84))+IF(s!BD84*s!BI84+s!BE84*s!BH84=0,0,Q85*s!BD84*s!BI84/(s!BD84*s!BI84+s!BE84*s!BH84))+IF(s!BF84*s!BI84+s!BG84*s!BH84=0,0,W85*s!BF84*s!BI84/(s!BF84*s!BI84+s!BG84*s!BH84))+IF(s!BB84*s!BI84+s!BC84*s!BH84+s!BD84*s!BG84+s!BE84*s!BF84=0,0,N85*s!BB84*s!BI84/(s!BB84*s!BI84+s!BC84*s!BH84+s!BD84*s!BG84+s!BE84*s!BF84)) -> 20.181636982850581 | BJ85: =SUM(BB85:BI85) -> 326
A86: =A85 -> 100 | B86: =B85 -> 1 | C86: =C85 -> 1 | D86: =D85 -> 2 | E86: =E85 -> 5 | F86: =F85 -> 2 | G86: =G85 -> 1 | H86: =H85 -> 2 | I86: =I85 -> 1 | J86: =J85 -> 2 | K86: =K85 -> 4 | L86: =L85 -> 2 | M86: =M85 -> 4 | N86: =N85 -> 8 | O86: =O85 -> 4 | P86: =P85 -> 2 | Q86: =Q85 -> 4 | R86: =R85 -> 2 | S86: =S85 -> 1 | T86: =T85 -> 2 | U86: =U85 -> 1 | V86: =V85 -> 2 | W86: =W85 -> 4 | X86: =X85 -> 2 | Y86: =Y85 -> 1 | Z86: =Z85 -> 2 | AA86: =AA85 -> 1 | AB86: =AB85 -> 163 | AK86: =AK85 -> 205 | AL86: =AL85 -> 7 | AM86: =AM85 -> 8 | AN86: =AN85 -> 8 | AO86: =AO85 -> 8 | AP86: =AP85 -> 8 | AQ86: =AQ85 -> 8 | AR86: =AR85 -> 8 | AS86: =AS85 -> 260 | BB86: =AK86+IF(s!BB85*s!BE85+s!BC85*s!BD85=0,0,E86*s!BB85*s!BE85/(s!BB85*s!BE85+s!BC85*s!BD85)+IF(s!BB85*s!BG85+s!BC85*s!BF85=0,0,K86*s!BB85*s!BG85/(s!BB85*s!BG85+s!BC85*s!BF85))+IF(s!BB85*s!BH85+s!BD85*s!BF85=0,0,M86*s!BB85*s!BH85/(s!BB85*s!BH85+s!BD85*s!BF85))+IF(s!BB85*s!BI85+s!BC85*s!BH85+s!BD85*s!BG85+s!BE85*s!BF85=0,0,N86*s!BB85*s!BI85/(s!BB85*s!BI85+s!BC85*s!BH85+s!BD85*s!BG85+s!BE85*s!BF85)
)) -> 223.76658467258858 | BC86: =AL86+IF(s!BC85*s!BD85+s!BB85*s!BE85=0,0,E86*s!BC85*s!BD85/(s!BC85*s!BD85+s!BB85*s!BE85))+IF(s!BB85*s!BG85+s!BC85*s!BF85=0,0,K86*s!BC85*s!BF85/(s!BB85*s!BG85+s!BC85*s!BF85))+IF(s!BC85*s!BI85+s!BE85*s!BG85=0,0,O86*s!BC85*s!BI85/(s!BC85*s!BI85+s!BE85*s!BG85))+IF(s!BB85*s!BI85+s!BC85*s!BH85+s!BD85*s!BG85+s!BE85*s!BF85=0,0,N86*s!BC85*s!BH85/(s!BB85*s!BI85+s!BC85*s!BH85+s!BD85*s!BG85+s!BE85*s!BF85)) -> 11.386767415480968 | BD86: =AM86+IF(s!BC85*s!BD85+s!BB85*s!BE85=0,0,E86*s!BC85*s!BD85/(s!BC85*s!BD85+s!BB85*s!BE85))+IF(s!BD85*s!BF85+s!BB85*s!BH85=0,0,M86*s!BD85*s!BF85/(s!BD85*s!BF85+s!BB85*s!BH85))+IF(s!BD85*s!BI85+s!BE85*s!BH85=0,0,Q86*s!BD85*s!BI85/(s!BD85*s!BI85+s!BE85*s!BH85))+IF(s!BB85*s!BI85+s!BC85*s!BH85+s!BD85*s!BG85+s!BE85*s!BF85=0,0,N86*s!BD85*s!BG85/(s!BB85*s!BI85+s!BC85*s!BH85+s!BD85*s!BG85+s!BE85*s!BF85)) -> 10.119740337353271 | BE86: =AN86+IF(s!BB85*s!BE85+s!BC85*s!BD85=0,0,E86*s!BB85*s!BE85/(s!BB85*s!BE85+s!BC85*s!BD85))+IF(s!BC85*s!BI85+s!BE85*s!BG85=0,0,O86*s!BE85*s!BG85/(s!BC85*s!BI85+s!BE85*s!BG85))+IF(s!BD85*s!BI85+s!BE85*s!BH85=0,0,Q86*s!BE85*s!BH85/(s!BD85*s!BI85+s!BE85*s!BH85))+IF(s!BB85*s!BI85+s!BC85*s!BH85+s!BD85*s!BG85+s!BE85*s!BF85=0,0,N86*s!BE85*s!BF85/(s!BB85*s!BI85+s!BC85*s!BH85+s!BD85*s!BG85+s!BE85*s!BF85)) -> 16.726907574577176 | BF86: =AO86+IF(s!BB85*s!BG85+s!BC85*s!BF85=0,0,K86*s!BC85*s!BF85/(s!BB85*s!BG85+s!BC85*s!BF85))+IF(s!BD85*s!BF85+s!BB85*s!BH85=0,0,M86*s!BD85*s!BF85/(s!BD85*s!BF85+s!BB85*s!BH85))+IF(s!BF85*s!BI85+s!BG85*s!BH85=0,0,W86*s!BF85*s!BI85/(s!BF85*s!BI85+s!BG85*s!BH85))+IF(s!BB85*s!BI85+s!BC85*s!BH85+s!BD85*s!BG85+s!BE85*s!BF85=0,0,N86*s!BE85*s!BF85/(s!BB85*s!BI85+s!BC85*s!BH85+s!BD85*s!BG85+s!BE85*s!BF85)) -> 10.141959884838005 | BG86: =AP86+IF(s!BB85*s!BG85+s!BC85*s!BF85=0,0,K86*s!BB85*s!BG85/(s!BB85*s!BG85+s!BC85*s!BF85))+IF(s!BC85*s!BI85+s!BE85*s!BG85=0,0,O86*s!BE85*s!BG85/(s!BC85*s!BI85+s!BE85*s!BG85))+IF(s!BF85*s!BI85+s!BG85*s!BH85=0,0,W86*s!BG85*s!BH85/(s!BF85*s!BI85+s!BG85*s!BH85))+IF(s!BB85*s!BI85+s!BC85*s!BH85+s!BD85*s!BG85+s!BE85*s!BF85=0,0,N86*s!BD85*s!BG85/(s!BB85*s!BI85+s!BC85*s!BH85+s!BD85*s!BG85+s!BE85*s!BF85)) -> 15.704688027092441 | BH86: =AQ86+IF(s!BB85*s!BH85+s!BD85*s!BF85=0,0,M86*s!BB85*s!BH85/(s!BB85*s!BH85+s!BD85*s!BF85))+IF(s!BD85*s!BI85+s!BE85*s!BH85=0,0,Q86*s!BE85*s!BH85/(s!BD85*s!BI85+s!BE85*s!BH85))+IF(s!BF85*s!BI85+s!BG85*s!BH85=0,0,W86*s!BG85*s!BH85/(s!BF85*s!BI85+s!BG85*s!BH85))+IF(s!BB85*s!BI85+s!BC85*s!BH85+s!BD85*s!BG85+s!BE85*s!BF85=0,0,N86*s!BC85*s!BH85/(s!BB85*s!BI85+s!BC85*s!BH85+s!BD85*s!BG85+s!BE85*s!BF85)) -> 17.971715105220138 | BI86: =AR86+IF(s!BC85*s!BI85+s!BE85*s!BG85=0,0,O86*s!BC85*s!BI85/(s!BC85*s!BI85+s!BE85*s!BG85))+IF(s!BD85*s!BI85+s!BE85*s!BH85=0,0,Q86*s!BD85*s!BI85/(s!BD85*s!BI85+s!BE85*s!BH85))+IF(s!BF85*s!BI85+s!BG85*s!BH85=0,0,W86*s!BF85*s!BI85/(s!BF85*s!BI85+s!BG85*s!BH85))+IF(s!BB85*s!BI85+s!BC85*s!BH85+s!BD85*s!BG85+s!BE85*s!BF85=0,0,N86*s!BB85*s!BI85/(s!BB85*s!BI85+s!BC85*s!BH85+s!BD85*s!BG85+s!BE85*s!BF85)) -> 20.181636982849415 | BJ86: =SUM(BB86:BI86) -> 326
A87: =A86 -> 100 | B87: =B86 -> 1 | C87: =C86 -> 1 | D87: =D86 -> 2 | E87: =E86 -> 5 | F87: =F86 -> 2 | G87: =G86 -> 1 | H87: =H86 -> 2 | I87: =I86 -> 1 | J87: =J86 -> 2 | K87: =K86 -> 4 | L87: =L86 -> 2 | M87: =M86 -> 4 | N87: =N86 -> 8 | O87: =O86 -> 4 | P87: =P86 -> 2 | Q87: =Q86 -> 4 | R87: =R86 -> 2 | S87: =S86 -> 1 | T87: =T86 -> 2 | U87: =U86 -> 1 | V87: =V86 -> 2 | W87: =W86 -> 4 | X87: =X86 -> 2 | Y87: =Y86 -> 1 | Z87: =Z86 -> 2 | AA87: =AA86 -> 1 | AB87: =AB86 -> 163 | AK87: =AK86 -> 205 | AL87: =AL86 -> 7 | AM87: =AM86 -> 8 | AN87: =AN86 -> 8 | AO87: =AO86 -> 8 | AP87: =AP86 -> 8 | AQ87: =AQ86 -> 8 | AR87: =AR86 -> 8 | AS87: =AS86 -> 260 | BB87: =AK87+IF(s!BB86*s!BE86+s!BC86*s!BD86=0,0,E87*s!BB86*s!BE86/(s!BB86*s!BE86+s!BC86*s!BD86)+IF(s!BB86*s!BG86+s!BC86*s!BF86=0,0,K87*s!BB86*s!BG86/(s!BB86*s!BG86+s!BC86*s!BF86))+IF(s!BB86*s!BH86+s!BD86*s!BF86=0,0,M87*s!BB86*s!BH86/(s!BB86*s!BH86+s!BD86*s!BF86))+IF(s!BB86*s!BI86+s!BC86*s!BH86+s!BD86*s!BG86+s!BE86*s!BF86=0,0,N87*s!BB86*s!BI86/(s!BB86*s!BI86+s!BC86*s!BH86+s!BD86*s!BG86+s!BE86*s!BF86)
)) -> 223.76658467258849 | BC87: =AL87+IF(s!BC86*s!BD86+s!BB86*s!BE86=0,0,E87*s!BC86*s!BD86/(s!BC86*s!BD86+s!BB86*s!BE86))+IF(s!BB86*s!BG86+s!BC86*s!BF86=0,0,K87*s!BC86*s!BF86/(s!BB86*s!BG86+s!BC86*s!BF86))+IF(s!BC86*s!BI86+s!BE86*s!BG86=0,0,O87*s!BC86*s!BI86/(s!BC86*s!BI86+s!BE86*s!BG86))+IF(s!BB86*s!BI86+s!BC86*s!BH86+s!BD86*s!BG86+s!BE86*s!BF86=0,0,N87*s!BC86*s!BH86/(s!BB86*s!BI86+s!BC86*s!BH86+s!BD86*s!BG86+s!BE86*s!BF86)) -> 11.386767415480854 | BD87: =AM87+IF(s!BC86*s!BD86+s!BB86*s!BE86=0,0,E87*s!BC86*s!BD86/(s!BC86*s!BD86+s!BB86*s!BE86))+IF(s!BD86*s!BF86+s!BB86*s!BH86=0,0,M87*s!BD86*s!BF86/(s!BD86*s!BF86+s!BB86*s!BH86))+IF(s!BD86*s!BI86+s!BE86*s!BH86=0,0,Q87*s!BD86*s!BI86/(s!BD86*s!BI86+s!BE86*s!BH86))+IF(s!BB86*s!BI86+s!BC86*s!BH86+s!BD86*s!BG86+s!BE86*s!BF86=0,0,N87*s!BD86*s!BG86/(s!BB86*s!BI86+s!BC86*s!BH86+s!BD86*s!BG86+s!BE86*s!BF86)) -> 10.119740337352997 | BE87: =AN87+IF(s!BB86*s!BE86+s!BC86*s!BD86=0,0,E87*s!BB86*s!BE86/(s!BB86*s!BE86+s!BC86*s!BD86))+IF(s!BC86*s!BI86+s!BE86*s!BG86=0,0,O87*s!BE86*s!BG86/(s!BC86*s!BI86+s!BE86*s!BG86))+IF(s!BD86*s!BI86+s!BE86*s!BH86=0,0,Q87*s!BE86*s!BH86/(s!BD86*s!BI86+s!BE86*s!BH86))+IF(s!BB86*s!BI86+s!BC86*s!BH86+s!BD86*s!BG86+s!BE86*s!BF86=0,0,N87*s!BE86*s!BF86/(s!BB86*s!BI86+s!BC86*s!BH86+s!BD86*s!BG86+s!BE86*s!BF86)) -> 16.726907574577648 | BF87: =AO87+IF(s!BB86*s!BG86+s!BC86*s!BF86=0,0,K87*s!BC86*s!BF86/(s!BB86*s!BG86+s!BC86*s!BF86))+IF(s!BD86*s!BF86+s!BB86*s!BH86=0,0,M87*s!BD86*s!BF86/(s!BD86*s!BF86+s!BB86*s!BH86))+IF(s!BF86*s!BI86+s!BG86*s!BH86=0,0,W87*s!BF86*s!BI86/(s!BF86*s!BI86+s!BG86*s!BH86))+IF(s!BB86*s!BI86+s!BC86*s!BH86+s!BD86*s!BG86+s!BE86*s!BF86=0,0,N87*s!BE86*s!BF86/(s!BB86*s!BI86+s!BC86*s!BH86+s!BD86*s!BG86+s!BE86*s!BF86)) -> 10.141959884837734 | BG87: =AP87+IF(s!BB86*s!BG86+s!BC86*s!BF86=0,0,K87*s!BB86*s!BG86/(s!BB86*s!BG86+s!BC86*s!BF86))+IF(s!BC86*s!BI86+s!BE86*s!BG86=0,0,O87*s!BE86*s!BG86/(s!BC86*s!BI86+s!BE86*s!BG86))+IF(s!BF86*s!BI86+s!BG86*s!BH86=0,0,W87*s!BG86*s!BH86/(s!BF86*s!BI86+s!BG86*s!BH86))+IF(s!BB86*s!BI86+s!BC86*s!BH86+s!BD86*s!BG86+s!BE86*s!BF86=0,0,N87*s!BD86*s!BG86/(s!BB86*s!BI86+s!BC86*s!BH86+s!BD86*s!BG86+s!BE86*s!BF86)) -> 15.704688027092912 | BH87: =AQ87+IF(s!BB86*s!BH86+s!BD86*s!BF86=0,0,M87*s!BB86*s!BH86/(s!BB86*s!BH86+s!BD86*s!BF86))+IF(s!BD86*s!BI86+s!BE86*s!BH86=0,0,Q87*s!BE86*s!BH86/(s!BD86*s!BI86+s!BE86*s!BH86))+IF(s!BF86*s!BI86+s!BG86*s!BH86=0,0,W87*s!BG86*s!BH86/(s!BF86*s!BI86+s!BG86*s!BH86))+IF(s!BB86*s!BI86+s!BC86*s!BH86+s!BD86*s!BG86+s!BE86*s!BF86=0,0,N87*s!BC86*s!BH86/(s!BB86*s!BI86+s!BC86*s!BH86+s!BD86*s!BG86+s!BE86*s!BF86)) -> 17.971715105220767 | BI87: =AR87+IF(s!BC86*s!BI86+s!BE86*s!BG86=0,0,O87*s!BC86*s!BI86/(s!BC86*s!BI86+s!BE86*s!BG86))+IF(s!BD86*s!BI86+s!BE86*s!BH86=0,0,Q87*s!BD86*s!BI86/(s!BD86*s!BI86+s!BE86*s!BH86))+IF(s!BF86*s!BI86+s!BG86*s!BH86=0,0,W87*s!BF86*s!BI86/(s!BF86*s!BI86+s!BG86*s!BH86))+IF(s!BB86*s!BI86+s!BC86*s!BH86+s!BD86*s!BG86+s!BE86*s!BF86=0,0,N87*s!BB86*s!BI86/(s!BB86*s!BI86+s!BC86*s!BH86+s!BD86*s!BG86+s!BE86*s!BF86)) -> 20.181636982848588 | BJ87: =SUM(BB87:BI87) -> 326
A88: =A87 -> 100 | B88: =B87 -> 1 | C88: =C87 -> 1 | D88: =D87 -> 2 | E88: =E87 -> 5 | F88: =F87 -> 2 | G88: =G87 -> 1 | H88: =H87 -> 2 | I88: =I87 -> 1 | J88: =J87 -> 2 | K88: =K87 -> 4 | L88: =L87 -> 2 | M88: =M87 -> 4 | N88: =N87 -> 8 | O88: =O87 -> 4 | P88: =P87 -> 2 | Q88: =Q87 -> 4 | R88: =R87 -> 2 | S88: =S87 -> 1 | T88: =T87 -> 2 | U88: =U87 -> 1 | V88: =V87 -> 2 | W88: =W87 -> 4 | X88: =X87 -> 2 | Y88: =Y87 -> 1 | Z88: =Z87 -> 2 | AA88: =AA87 -> 1 | AB88: =AB87 -> 163 | AK88: =AK87 -> 205 | AL88: =AL87 -> 7 | AM88: =AM87 -> 8 | AN88: =AN87 -> 8 | AO88: =AO87 -> 8 | AP88: =AP87 -> 8 | AQ88: =AQ87 -> 8 | AR88: =AR87 -> 8 | AS88: =AS87 -> 260 | BB88: =AK88+IF(s!BB87*s!BE87+s!BC87*s!BD87=0,0,E88*s!BB87*s!BE87/(s!BB87*s!BE87+s!BC87*s!BD87)+IF(s!BB87*s!BG87+s!BC87*s!BF87=0,0,K88*s!BB87*s!BG87/(s!BB87*s!BG87+s!BC87*s!BF87))+IF(s!BB87*s!BH87+s!BD87*s!BF87=0,0,M88*s!BB87*s!BH87/(s!BB87*s!BH87+s!BD87*s!BF87))+IF(s!BB87*s!BI87+s!BC87*s!BH87+s!BD87*s!BG87+s!BE87*s!BF87=0,0,N88*s!BB87*s!BI87/(s!BB87*s!BI87+s!BC87*s!BH87+s!BD87*s!BG87+s!BE87*s!BF87)
)) -> 223.76658467258844 | BC88: =AL88+IF(s!BC87*s!BD87+s!BB87*s!BE87=0,0,E88*s!BC87*s!BD87/(s!BC87*s!BD87+s!BB87*s!BE87))+IF(s!BB87*s!BG87+s!BC87*s!BF87=0,0,K88*s!BC87*s!BF87/(s!BB87*s!BG87+s!BC87*s!BF87))+IF(s!BC87*s!BI87+s!BE87*s!BG87=0,0,O88*s!BC87*s!BI87/(s!BC87*s!BI87+s!BE87*s!BG87))+IF(s!BB87*s!BI87+s!BC87*s!BH87+s!BD87*s!BG87+s!BE87*s!BF87=0,0,N88*s!BC87*s!BH87/(s!BB87*s!BI87+s!BC87*s!BH87+s!BD87*s!BG87+s!BE87*s!BF87)) -> 11.386767415480771 | BD88: =AM88+IF(s!BC87*s!BD87+s!BB87*s!BE87=0,0,E88*s!BC87*s!BD87/(s!BC87*s!BD87+s!BB87*s!BE87))+IF(s!BD87*s!BF87+s!BB87*s!BH87=0,0,M88*s!BD87*s!BF87/(s!BD87*s!BF87+s!BB87*s!BH87))+IF(s!BD87*s!BI87+s!BE87*s!BH87=0,0,Q88*s!BD87*s!BI87/(s!BD87*s!BI87+s!BE87*s!BH87))+IF(s!BB87*s!BI87+s!BC87*s!BH87+s!BD87*s!BG87+s!BE87*s!BF87=0,0,N88*s!BD87*s!BG87/(s!BB87*s!BI87+s!BC87*s!BH87+s!BD87*s!BG87+s!BE87*s!BF87)) -> 10.119740337352804 | BE88: =AN88+IF(s!BB87*s!BE87+s!BC87*s!BD87=0,0,E88*s!BB87*s!BE87/(s!BB87*s!BE87+s!BC87*s!BD87))+IF(s!BC87*s!BI87+s!BE87*s!BG87=0,0,O88*s!BE87*s!BG87/(s!BC87*s!BI87+s!BE87*s!BG87))+IF(s!BD87*s!BI87+s!BE87*s!BH87=0,0,Q88*s!BE87*s!BH87/(s!BD87*s!BI87+s!BE87*s!BH87))+IF(s!BB87*s!BI87+s!BC87*s!BH87+s!BD87*s!BG87+s!BE87*s!BF87=0,0,N88*s!BE87*s!BF87/(s!BB87*s!BI87+s!BC87*s!BH87+s!BD87*s!BG87+s!BE87*s!BF87)) -> 16.726907574577986 | BF88: =AO88+IF(s!BB87*s!BG87+s!BC87*s!BF87=0,0,K88*s!BC87*s!BF87/(s!BB87*s!BG87+s!BC87*s!BF87))+IF(s!BD87*s!BF87+s!BB87*s!BH87=0,0,M88*s!BD87*s!BF87/(s!BD87*s!BF87+s!BB87*s!BH87))+IF(s!BF87*s!BI87+s!BG87*s!BH87=0,0,W88*s!BF87*s!BI87/(s!BF87*s!BI87+s!BG87*s!BH87))+IF(s!BB87*s!BI87+s!BC87*s!BH87+s!BD87*s!BG87+s!BE87*s!BF87=0,0,N88*s!BE87*s!BF87/(s!BB87*s!BI87+s!BC87*s!BH87+s!BD87*s!BG87+s!BE87*s!BF87)) -> 10.14195988483754 | BG88: =AP88+IF(s!BB87*s!BG87+s!BC87*s!BF87=0,0,K88*s!BB87*s!BG87/(s!BB87*s!BG87+s!BC87*s!BF87))+IF(s!BC87*s!BI87+s!BE87*s!BG87=0,0,O88*s!BE87*s!BG87/(s!BC87*s!BI87+s!BE87*s!BG87))+IF(s!BF87*s!BI87+s!BG87*s!BH87=0,0,W88*s!BG87*s!BH87/(s!BF87*s!BI87+s!BG87*s!BH87))+IF(s!BB87*s!BI87+s!BC87*s!BH87+s!BD87*s!BG87+s!BE87*s!BF87=0,0,N88*s!BD87*s!BG87/(s!BB87*s!BI87+s!BC87*s!BH87+s!BD87*s!BG87+s!BE87*s!BF87)) -> 15.704688027093249 | BH88: =AQ88+IF(s!BB87*s!BH87+s!BD87*s!BF87=0,0,M88*s!BB87*s!BH87/(s!BB87*s!BH87+s!BD87*s!BF87))+IF(s!BD87*s!BI87+s!BE87*s!BH87=0,0,Q88*s!BE87*s!BH87/(s!BD87*s!BI87+s!BE87*s!BH87))+IF(s!BF87*s!BI87+s!BG87*s!BH87=0,0,W88*s!BG87*s!BH87/(s!BF87*s!BI87+s!BG87*s!BH87))+IF(s!BB87*s!BI87+s!BC87*s!BH87+s!BD87*s!BG87+s!BE87*s!BF87=0,0,N88*s!BC87*s!BH87/(s!BB87*s!BI87+s!BC87*s!BH87+s!BD87*s!BG87+s!BE87*s!BF87)) -> 17.971715105221222 | BI88: =AR88+IF(s!BC87*s!BI87+s!BE87*s!BG87=0,0,O88*s!BC87*s!BI87/(s!BC87*s!BI87+s!BE87*s!BG87))+IF(s!BD87*s!BI87+s!BE87*s!BH87=0,0,Q88*s!BD87*s!BI87/(s!BD87*s!BI87+s!BE87*s!BH87))+IF(s!BF87*s!BI87+s!BG87*s!BH87=0,0,W88*s!BF87*s!BI87/(s!BF87*s!BI87+s!BG87*s!BH87))+IF(s!BB87*s!BI87+s!BC87*s!BH87+s!BD87*s!BG87+s!BE87*s!BF87=0,0,N88*s!BB87*s!BI87/(s!BB87*s!BI87+s!BC87*s!BH87+s!BD87*s!BG87+s!BE87*s!BF87)) -> 20.181636982847991 | BJ88: =SUM(BB88:BI88) -> 326
A89: =A88 -> 100 | B89: =B88 -> 1 | C89: =C88 -> 1 | D89: =D88 -> 2 | E89: =E88 -> 5 | F89: =F88 -> 2 | G89: =G88 -> 1 | H89: =H88 -> 2 | I89: =I88 -> 1 | J89: =J88 -> 2 | K89: =K88 -> 4 | L89: =L88 -> 2 | M89: =M88 -> 4 | N89: =N88 -> 8 | O89: =O88 -> 4 | P89: =P88 -> 2 | Q89: =Q88 -> 4 | R89: =R88 -> 2 | S89: =S88 -> 1 | T89: =T88 -> 2 | U89: =U88 -> 1 | V89: =V88 -> 2 | W89: =W88 -> 4 | X89: =X88 -> 2 | Y89: =Y88 -> 1 | Z89: =Z88 -> 2 | AA89: =AA88 -> 1 | AB89: =AB88 -> 163 | AK89: =AK88 -> 205 | AL89: =AL88 -> 7 | AM89: =AM88 -> 8 | AN89: =AN88 -> 8 | AO89: =AO88 -> 8 | AP89: =AP88 -> 8 | AQ89: =AQ88 -> 8 | AR89: =AR88 -> 8 | AS89: =AS88 -> 260 | BB89: =AK89+IF(s!BB88*s!BE88+s!BC88*s!BD88=0,0,E89*s!BB88*s!BE88/(s!BB88*s!BE88+s!BC88*s!BD88)+IF(s!BB88*s!BG88+s!BC88*s!BF88=0,0,K89*s!BB88*s!BG88/(s!BB88*s!BG88+s!BC88*s!BF88))+IF(s!BB88*s!BH88+s!BD88*s!BF88=0,0,M89*s!BB88*s!BH88/(s!BB88*s!BH88+s!BD88*s!BF88))+IF(s!BB88*s!BI88+s!BC88*s!BH88+s!BD88*s!BG88+s!BE88*s!BF88=0,0,N89*s!BB88*s!BI88/(s!BB88*s!BI88+s!BC88*s!BH88+s!BD88*s!BG88+s!BE88*s!BF88)
)) -> 223.76658467258841 | BC89: =AL89+IF(s!BC88*s!BD88+s!BB88*s!BE88=0,0,E89*s!BC88*s!BD88/(s!BC88*s!BD88+s!BB88*s!BE88))+IF(s!BB88*s!BG88+s!BC88*s!BF88=0,0,K89*s!BC88*s!BF88/(s!BB88*s!BG88+s!BC88*s!BF88))+IF(s!BC88*s!BI88+s!BE88*s!BG88=0,0,O89*s!BC88*s!BI88/(s!BC88*s!BI88+s!BE88*s!BG88))+IF(s!BB88*s!BI88+s!BC88*s!BH88+s!BD88*s!BG88+s!BE88*s!BF88=0,0,N89*s!BC88*s!BH88/(s!BB88*s!BI88+s!BC88*s!BH88+s!BD88*s!BG88+s!BE88*s!BF88)) -> 11.38676741548071 | BD89: =AM89+IF(s!BC88*s!BD88+s!BB88*s!BE88=0,0,E89*s!BC88*s!BD88/(s!BC88*s!BD88+s!BB88*s!BE88))+IF(s!BD88*s!BF88+s!BB88*s!BH88=0,0,M89*s!BD88*s!BF88/(s!BD88*s!BF88+s!BB88*s!BH88))+IF(s!BD88*s!BI88+s!BE88*s!BH88=0,0,Q89*s!BD88*s!BI88/(s!BD88*s!BI88+s!BE88*s!BH88))+IF(s!BB88*s!BI88+s!BC88*s!BH88+s!BD88*s!BG88+s!BE88*s!BF88=0,0,N89*s!BD88*s!BG88/(s!BB88*s!BI88+s!BC88*s!BH88+s!BD88*s!BG88+s!BE88*s!BF88)) -> 10.119740337352662 | BE89: =AN89+IF(s!BB88*s!BE88+s!BC88*s!BD88=0,0,E89*s!BB88*s!BE88/(s!BB88*s!BE88+s!BC88*s!BD88))+IF(s!BC88*s!BI88+s!BE88*s!BG88=0,0,O89*s!BE88*s!BG88/(s!BC88*s!BI88+s!BE88*s!BG88))+IF(s!BD88*s!BI88+s!BE88*s!BH88=0,0,Q89*s!BE88*s!BH88/(s!BD88*s!BI88+s!BE88*s!BH88))+IF(s!BB88*s!BI88+s!BC88*s!BH88+s!BD88*s!BG88+s!BE88*s!BF88=0,0,N89*s!BE88*s!BF88/(s!BB88*s!BI88+s!BC88*s!BH88+s!BD88*s!BG88+s!BE88*s!BF88)) -> 16.726907574578235 | BF89: =AO89+IF(s!BB88*s!BG88+s!BC88*s!BF88=0,0,K89*s!BC88*s!BF88/(s!BB88*s!BG88+s!BC88*s!BF88))+IF(s!BD88*s!BF88+s!BB88*s!BH88=0,0,M89*s!BD88*s!BF88/(s!BD88*s!BF88+s!BB88*s!BH88))+IF(s!BF88*s!BI88+s!BG88*s!BH88=0,0,W89*s!BF88*s!BI88/(s!BF88*s!BI88+s!BG88*s!BH88))+IF(s!BB88*s!BI88+s!BC88*s!BH88+s!BD88*s!BG88+s!BE88*s!BF88=0,0,N89*s!BE88*s!BF88/(s!BB88*s!BI88+s!BC88*s!BH88+s!BD88*s!BG88+s!BE88*s!BF88)) -> 10.1419598848374 | BG89: =AP89+IF(s!BB88*s!BG88+s!BC88*s!BF88=0,0,K89*s!BB88*s!BG88/(s!BB88*s!BG88+s!BC88*s!BF88))+IF(s!BC88*s!BI88+s!BE88*s!BG88=0,0,O89*s!BE88*s!BG88/(s!BC88*s!BI88+s!BE88*s!BG88))+IF(s!BF88*s!BI88+s!BG88*s!BH88=0,0,W89*s!BG88*s!BH88/(s!BF88*s!BI88+s!BG88*s!BH88))+IF(s!BB88*s!BI88+s!BC88*s!BH88+s!BD88*s!BG88+s!BE88*s!BF88=0,0,N89*s!BD88*s!BG88/(s!BB88*s!BI88+s!BC88*s!BH88+s!BD88*s!BG88+s!BE88*s!BF88)) -> 15.704688027093493 | BH89: =AQ89+IF(s!BB88*s!BH88+s!BD88*s!BF88=0,0,M89*s!BB88*s!BH88/(s!BB88*s!BH88+s!BD88*s!BF88))+IF(s!BD88*s!BI88+s!BE88*s!BH88=0,0,Q89*s!BE88*s!BH88/(s!BD88*s!BI88+s!BE88*s!BH88))+IF(s!BF88*s!BI88+s!BG88*s!BH88=0,0,W89*s!BG88*s!BH88/(s!BF88*s!BI88+s!BG88*s!BH88))+IF(s!BB88*s!BI88+s!BC88*s!BH88+s!BD88*s!BG88+s!BE88*s!BF88=0,0,N89*s!BC88*s!BH88/(s!BB88*s!BI88+s!BC88*s!BH88+s!BD88*s!BG88+s!BE88*s!BF88)) -> 17.971715105221541 | BI89: =AR89+IF(s!BC88*s!BI88+s!BE88*s!BG88=0,0,O89*s!BC88*s!BI88/(s!BC88*s!BI88+s!BE88*s!BG88))+IF(s!BD88*s!BI88+s!BE88*s!BH88=0,0,Q89*s!BD88*s!BI88/(s!BD88*s!BI88+s!BE88*s!BH88))+IF(s!BF88*s!BI88+s!BG88*s!BH88=0,0,W89*s!BF88*s!BI88/(s!BF88*s!BI88+s!BG88*s!BH88))+IF(s!BB88*s!BI88+s!BC88*s!BH88+s!BD88*s!BG88+s!BE88*s!BF88=0,0,N89*s!BB88*s!BI88/(s!BB88*s!BI88+s!BC88*s!BH88+s!BD88*s!BG88+s!BE88*s!BF88)) -> 20.181636982847568 | BJ89: =SUM(BB89:BI89) -> 326
A90: =A89 -> 100 | B90: =B89 -> 1 | C90: =C89 -> 1 | D90: =D89 -> 2 | E90: =E89 -> 5 | F90: =F89 -> 2 | G90: =G89 -> 1 | H90: =H89 -> 2 | I90: =I89 -> 1 | J90: =J89 -> 2 | K90: =K89 -> 4 | L90: =L89 -> 2 | M90: =M89 -> 4 | N90: =N89 -> 8 | O90: =O89 -> 4 | P90: =P89 -> 2 | Q90: =Q89 -> 4 | R90: =R89 -> 2 | S90: =S89 -> 1 | T90: =T89 -> 2 | U90: =U89 -> 1 | V90: =V89 -> 2 | W90: =W89 -> 4 | X90: =X89 -> 2 | Y90: =Y89 -> 1 | Z90: =Z89 -> 2 | AA90: =AA89 -> 1 | AB90: =AB89 -> 163 | AK90: =AK89 -> 205 | AL90: =AL89 -> 7 | AM90: =AM89 -> 8 | AN90: =AN89 -> 8 | AO90: =AO89 -> 8 | AP90: =AP89 -> 8 | AQ90: =AQ89 -> 8 | AR90: =AR89 -> 8 | AS90: =AS89 -> 260 | BB90: =AK90+IF(s!BB89*s!BE89+s!BC89*s!BD89=0,0,E90*s!BB89*s!BE89/(s!BB89*s!BE89+s!BC89*s!BD89)+IF(s!BB89*s!BG89+s!BC89*s!BF89=0,0,K90*s!BB89*s!BG89/(s!BB89*s!BG89+s!BC89*s!BF89))+IF(s!BB89*s!BH89+s!BD89*s!BF89=0,0,M90*s!BB89*s!BH89/(s!BB89*s!BH89+s!BD89*s!BF89))+IF(s!BB89*s!BI89+s!BC89*s!BH89+s!BD89*s!BG89+s!BE89*s!BF89=0,0,N90*s!BB89*s!BI89/(s!BB89*s!BI89+s!BC89*s!BH89+s!BD89*s!BG89+s!BE89*s!BF89)
)) -> 223.76658467258835 | BC90: =AL90+IF(s!BC89*s!BD89+s!BB89*s!BE89=0,0,E90*s!BC89*s!BD89/(s!BC89*s!BD89+s!BB89*s!BE89))+IF(s!BB89*s!BG89+s!BC89*s!BF89=0,0,K90*s!BC89*s!BF89/(s!BB89*s!BG89+s!BC89*s!BF89))+IF(s!BC89*s!BI89+s!BE89*s!BG89=0,0,O90*s!BC89*s!BI89/(s!BC89*s!BI89+s!BE89*s!BG89))+IF(s!BB89*s!BI89+s!BC89*s!BH89+s!BD89*s!BG89+s!BE89*s!BF89=0,0,N90*s!BC89*s!BH89/(s!BB89*s!BI89+s!BC89*s!BH89+s!BD89*s!BG89+s!BE89*s!BF89)) -> 11.386767415480669 | BD90: =AM90+IF(s!BC89*s!BD89+s!BB89*s!BE89=0,0,E90*s!BC89*s!BD89/(s!BC89*s!BD89+s!BB89*s!BE89))+IF(s!BD89*s!BF89+s!BB89*s!BH89=0,0,M90*s!BD89*s!BF89/(s!BD89*s!BF89+s!BB89*s!BH89))+IF(s!BD89*s!BI89+s!BE89*s!BH89=0,0,Q90*s!BD89*s!BI89/(s!BD89*s!BI89+s!BE89*s!BH89))+IF(s!BB89*s!BI89+s!BC89*s!BH89+s!BD89*s!BG89+s!BE89*s!BF89=0,0,N90*s!BD89*s!BG89/(s!BB89*s!BI89+s!BC89*s!BH89+s!BD89*s!BG89+s!BE89*s!BF89)) -> 10.119740337352562 | BE90: =AN90+IF(s!BB89*s!BE89+s!BC89*s!BD89=0,0,E90*s!BB89*s!BE89/(s!BB89*s!BE89+s!BC89*s!BD89))+IF(s!BC89*s!BI89+s!BE89*s!BG89=0,0,O90*s!BE89*s!BG89/(s!BC89*s!BI89+s!BE89*s!BG89))+IF(s!BD89*s!BI89+s!BE89*s!BH89=0,0,Q90*s!BE89*s!BH89/(s!BD89*s!BI89+s!BE89*s!BH89))+IF(s!BB89*s!BI89+s!BC89*s!BH89+s!BD89*s!BG89+s!BE89*s!BF89=0,0,N90*s!BE89*s!BF89/(s!BB89*s!BI89+s!BC89*s!BH89+s!BD89*s!BG89+s!BE89*s!BF89)) -> 16.726907574578405 | BF90: =AO90+IF(s!BB89*s!BG89+s!BC89*s!BF89=0,0,K90*s!BC89*s!BF89/(s!BB89*s!BG89+s!BC89*s!BF89))+IF(s!BD89*s!BF89+s!BB89*s!BH89=0,0,M90*s!BD89*s!BF89/(s!BD89*s!BF89+s!BB89*s!BH89))+IF(s!BF89*s!BI89+s!BG89*s!BH89=0,0,W90*s!BF89*s!BI89/(s!BF89*s!BI89+s!BG89*s!BH89))+IF(s!BB89*s!BI89+s!BC89*s!BH89+s!BD89*s!BG89+s!BE89*s!BF89=0,0,N90*s!BE89*s!BF89/(s!BB89*s!BI89+s!BC89*s!BH89+s!BD89*s!BG89+s!BE89*s!BF89)) -> 10.141959884837298 | BG90: =AP90+IF(s!BB89*s!BG89+s!BC89*s!BF89=0,0,K90*s!BB89*s!BG89/(s!BB89*s!BG89+s!BC89*s!BF89))+IF(s!BC89*s!BI89+s!BE89*s!BG89=0,0,O90*s!BE89*s!BG89/(s!BC89*s!BI89+s!BE89*s!BG89))+IF(s!BF89*s!BI89+s!BG89*s!BH89=0,0,W90*s!BG89*s!BH89/(s!BF89*s!BI89+s!BG89*s!BH89))+IF(s!BB89*s!BI89+s!BC89*s!BH89+s!BD89*s!BG89+s!BE89*s!BF89=0,0,N90*s!BD89*s!BG89/(s!BB89*s!BI89+s!BC89*s!BH89+s!BD89*s!BG89+s!BE89*s!BF89)) -> 15.704688027093667 | BH90: =AQ90+IF(s!BB89*s!BH89+s!BD89*s!BF89=0,0,M90*s!BB89*s!BH89/(s!BB89*s!BH89+s!BD89*s!BF89))+IF(s!BD89*s!BI89+s!BE89*s!BH89=0,0,Q90*s!BE89*s!BH89/(s!BD89*s!BI89+s!BE89*s!BH89))+IF(s!BF89*s!BI89+s!BG89*s!BH89=0,0,W90*s!BG89*s!BH89/(s!BF89*s!BI89+s!BG89*s!BH89))+IF(s!BB89*s!BI89+s!BC89*s!BH89+s!BD89*s!BG89+s!BE89*s!BF89=0,0,N90*s!BC89*s!BH89/(s!BB89*s!BI89+s!BC89*s!BH89+s!BD89*s!BG89+s!BE89*s!BF89)) -> 17.971715105221772 | BI90: =AR90+IF(s!BC89*s!BI89+s!BE89*s!BG89=0,0,O90*s!BC89*s!BI89/(s!BC89*s!BI89+s!BE89*s!BG89))+IF(s!BD89*s!BI89+s!BE89*s!BH89=0,0,Q90*s!BD89*s!BI89/(s!BD89*s!BI89+s!BE89*s!BH89))+IF(s!BF89*s!BI89+s!BG89*s!BH89=0,0,W90*s!BF89*s!BI89/(s!BF89*s!BI89+s!BG89*s!BH89))+IF(s!BB89*s!BI89+s!BC89*s!BH89+s!BD89*s!BG89+s!BE89*s!BF89=0,0,N90*s!BB89*s!BI89/(s!BB89*s!BI89+s!BC89*s!BH89+s!BD89*s!BG89+s!BE89*s!BF89)) -> 20.181636982847259 | BJ90: =SUM(BB90:BI90) -> 326
A91: =A90 -> 100 | B91: =B90 -> 1 | C91: =C90 -> 1 | D91: =D90 -> 2 | E91: =E90 -> 5 | F91: =F90 -> 2 | G91: =G90 -> 1 | H91: =H90 -> 2 | I91: =I90 -> 1 | J91: =J90 -> 2 | K91: =K90 -> 4 | L91: =L90 -> 2 | M91: =M90 -> 4 | N91: =N90 -> 8 | O91: =O90 -> 4 | P91: =P90 -> 2 | Q91: =Q90 -> 4 | R91: =R90 -> 2 | S91: =S90 -> 1 | T91: =T90 -> 2 | U91: =U90 -> 1 | V91: =V90 -> 2 | W91: =W90 -> 4 | X91: =X90 -> 2 | Y91: =Y90 -> 1 | Z91: =Z90 -> 2 | AA91: =AA90 -> 1 | AB91: =AB90 -> 163 | AK91: =AK90 -> 205 | AL91: =AL90 -> 7 | AM91: =AM90 -> 8 | AN91: =AN90 -> 8 | AO91: =AO90 -> 8 | AP91: =AP90 -> 8 | AQ91: =AQ90 -> 8 | AR91: =AR90 -> 8 | AS91: =AS90 -> 260 | BB91: =AK91+IF(s!BB90*s!BE90+s!BC90*s!BD90=0,0,E91*s!BB90*s!BE90/(s!BB90*s!BE90+s!BC90*s!BD90)+IF(s!BB90*s!BG90+s!BC90*s!BF90=0,0,K91*s!BB90*s!BG90/(s!BB90*s!BG90+s!BC90*s!BF90))+IF(s!BB90*s!BH90+s!BD90*s!BF90=0,0,M91*s!BB90*s!BH90/(s!BB90*s!BH90+s!BD90*s!BF90))+IF(s!BB90*s!BI90+s!BC90*s!BH90+s!BD90*s!BG90+s!BE90*s!BF90=0,0,N91*s!BB90*s!BI90/(s!BB90*s!BI90+s!BC90*s!BH90+s!BD90*s!BG90+s!BE90*s!BF90)
)) -> 223.76658467258835 | BC91: =AL91+IF(s!BC90*s!BD90+s!BB90*s!BE90=0,0,E91*s!BC90*s!BD90/(s!BC90*s!BD90+s!BB90*s!BE90))+IF(s!BB90*s!BG90+s!BC90*s!BF90=0,0,K91*s!BC90*s!BF90/(s!BB90*s!BG90+s!BC90*s!BF90))+IF(s!BC90*s!BI90+s!BE90*s!BG90=0,0,O91*s!BC90*s!BI90/(s!BC90*s!BI90+s!BE90*s!BG90))+IF(s!BB90*s!BI90+s!BC90*s!BH90+s!BD90*s!BG90+s!BE90*s!BF90=0,0,N91*s!BC90*s!BH90/(s!BB90*s!BI90+s!BC90*s!BH90+s!BD90*s!BG90+s!BE90*s!BF90)) -> 11.386767415480639 | BD91: =AM91+IF(s!BC90*s!BD90+s!BB90*s!BE90=0,0,E91*s!BC90*s!BD90/(s!BC90*s!BD90+s!BB90*s!BE90))+IF(s!BD90*s!BF90+s!BB90*s!BH90=0,0,M91*s!BD90*s!BF90/(s!BD90*s!BF90+s!BB90*s!BH90))+IF(s!BD90*s!BI90+s!BE90*s!BH90=0,0,Q91*s!BD90*s!BI90/(s!BD90*s!BI90+s!BE90*s!BH90))+IF(s!BB90*s!BI90+s!BC90*s!BH90+s!BD90*s!BG90+s!BE90*s!BF90=0,0,N91*s!BD90*s!BG90/(s!BB90*s!BI90+s!BC90*s!BH90+s!BD90*s!BG90+s!BE90*s!BF90)) -> 10.119740337352487 | BE91: =AN91+IF(s!BB90*s!BE90+s!BC90*s!BD90=0,0,E91*s!BB90*s!BE90/(s!BB90*s!BE90+s!BC90*s!BD90))+IF(s!BC90*s!BI90+s!BE90*s!BG90=0,0,O91*s!BE90*s!BG90/(s!BC90*s!BI90+s!BE90*s!BG90))+IF(s!BD90*s!BI90+s!BE90*s!BH90=0,0,Q91*s!BE90*s!BH90/(s!BD90*s!BI90+s!BE90*s!BH90))+IF(s!BB90*s!BI90+s!BC90*s!BH90+s!BD90*s!BG90+s!BE90*s!BF90=0,0,N91*s!BE90*s!BF90/(s!BB90*s!BI90+s!BC90*s!BH90+s!BD90*s!BG90+s!BE90*s!BF90)) -> 16.726907574578529 | BF91: =AO91+IF(s!BB90*s!BG90+s!BC90*s!BF90=0,0,K91*s!BC90*s!BF90/(s!BB90*s!BG90+s!BC90*s!BF90))+IF(s!BD90*s!BF90+s!BB90*s!BH90=0,0,M91*s!BD90*s!BF90/(s!BD90*s!BF90+s!BB90*s!BH90))+IF(s!BF90*s!BI90+s!BG90*s!BH90=0,0,W91*s!BF90*s!BI90/(s!BF90*s!BI90+s!BG90*s!BH90))+IF(s!BB90*s!BI90+s!BC90*s!BH90+s!BD90*s!BG90+s!BE90*s!BF90=0,0,N91*s!BE90*s!BF90/(s!BB90*s!BI90+s!BC90*s!BH90+s!BD90*s!BG90+s!BE90*s!BF90)) -> 10.141959884837229 | BG91: =AP91+IF(s!BB90*s!BG90+s!BC90*s!BF90=0,0,K91*s!BB90*s!BG90/(s!BB90*s!BG90+s!BC90*s!BF90))+IF(s!BC90*s!BI90+s!BE90*s!BG90=0,0,O91*s!BE90*s!BG90/(s!BC90*s!BI90+s!BE90*s!BG90))+IF(s!BF90*s!BI90+s!BG90*s!BH90=0,0,W91*s!BG90*s!BH90/(s!BF90*s!BI90+s!BG90*s!BH90))+IF(s!BB90*s!BI90+s!BC90*s!BH90+s!BD90*s!BG90+s!BE90*s!BF90=0,0,N91*s!BD90*s!BG90/(s!BB90*s!BI90+s!BC90*s!BH90+s!BD90*s!BG90+s!BE90*s!BF90)) -> 15.704688027093788 | BH91: =AQ91+IF(s!BB90*s!BH90+s!BD90*s!BF90=0,0,M91*s!BB90*s!BH90/(s!BB90*s!BH90+s!BD90*s!BF90))+IF(s!BD90*s!BI90+s!BE90*s!BH90=0,0,Q91*s!BE90*s!BH90/(s!BD90*s!BI90+s!BE90*s!BH90))+IF(s!BF90*s!BI90+s!BG90*s!BH90=0,0,W91*s!BG90*s!BH90/(s!BF90*s!BI90+s!BG90*s!BH90))+IF(s!BB90*s!BI90+s!BC90*s!BH90+s!BD90*s!BG90+s!BE90*s!BF90=0,0,N91*s!BC90*s!BH90/(s!BB90*s!BI90+s!BC90*s!BH90+s!BD90*s!BG90+s!BE90*s!BF90)) -> 17.971715105221939 | BI91: =AR91+IF(s!BC90*s!BI90+s!BE90*s!BG90=0,0,O91*s!BC90*s!BI90/(s!BC90*s!BI90+s!BE90*s!BG90))+IF(s!BD90*s!BI90+s!BE90*s!BH90=0,0,Q91*s!BD90*s!BI90/(s!BD90*s!BI90+s!BE90*s!BH90))+IF(s!BF90*s!BI90+s!BG90*s!BH90=0,0,W91*s!BF90*s!BI90/(s!BF90*s!BI90+s!BG90*s!BH90))+IF(s!BB90*s!BI90+s!BC90*s!BH90+s!BD90*s!BG90+s!BE90*s!BF90=0,0,N91*s!BB90*s!BI90/(s!BB90*s!BI90+s!BC90*s!BH90+s!BD90*s!BG90+s!BE90*s!BF90)) -> 20.181636982847042 | BJ91: =SUM(BB91:BI91) -> 326
A92: =A91 -> 100 | B92: =B91 -> 1 | C92: =C91 -> 1 | D92: =D91 -> 2 | E92: =E91 -> 5 | F92: =F91 -> 2 | G92: =G91 -> 1 | H92: =H91 -> 2 | I92: =I91 -> 1 | J92: =J91 -> 2 | K92: =K91 -> 4 | L92: =L91 -> 2 | M92: =M91 -> 4 | N92: =N91 -> 8 | O92: =O91 -> 4 | P92: =P91 -> 2 | Q92: =Q91 -> 4 | R92: =R91 -> 2 | S92: =S91 -> 1 | T92: =T91 -> 2 | U92: =U91 -> 1 | V92: =V91 -> 2 | W92: =W91 -> 4 | X92: =X91 -> 2 | Y92: =Y91 -> 1 | Z92: =Z91 -> 2 | AA92: =AA91 -> 1 | AB92: =AB91 -> 163 | AK92: =AK91 -> 205 | AL92: =AL91 -> 7 | AM92: =AM91 -> 8 | AN92: =AN91 -> 8 | AO92: =AO91 -> 8 | AP92: =AP91 -> 8 | AQ92: =AQ91 -> 8 | AR92: =AR91 -> 8 | AS92: =AS91 -> 260 | BB92: =AK92+IF(s!BB91*s!BE91+s!BC91*s!BD91=0,0,E92*s!BB91*s!BE91/(s!BB91*s!BE91+s!BC91*s!BD91)+IF(s!BB91*s!BG91+s!BC91*s!BF91=0,0,K92*s!BB91*s!BG91/(s!BB91*s!BG91+s!BC91*s!BF91))+IF(s!BB91*s!BH91+s!BD91*s!BF91=0,0,M92*s!BB91*s!BH91/(s!BB91*s!BH91+s!BD91*s!BF91))+IF(s!BB91*s!BI91+s!BC91*s!BH91+s!BD91*s!BG91+s!BE91*s!BF91=0,0,N92*s!BB91*s!BI91/(s!BB91*s!BI91+s!BC91*s!BH91+s!BD91*s!BG91+s!BE91*s!BF91)
)) -> 223.76658467258832 | BC92: =AL92+IF(s!BC91*s!BD91+s!BB91*s!BE91=0,0,E92*s!BC91*s!BD91/(s!BC91*s!BD91+s!BB91*s!BE91))+IF(s!BB91*s!BG91+s!BC91*s!BF91=0,0,K92*s!BC91*s!BF91/(s!BB91*s!BG91+s!BC91*s!BF91))+IF(s!BC91*s!BI91+s!BE91*s!BG91=0,0,O92*s!BC91*s!BI91/(s!BC91*s!BI91+s!BE91*s!BG91))+IF(s!BB91*s!BI91+s!BC91*s!BH91+s!BD91*s!BG91+s!BE91*s!BF91=0,0,N92*s!BC91*s!BH91/(s!BB91*s!BI91+s!BC91*s!BH91+s!BD91*s!BG91+s!BE91*s!BF91)) -> 11.386767415480618 | BD92: =AM92+IF(s!BC91*s!BD91+s!BB91*s!BE91=0,0,E92*s!BC91*s!BD91/(s!BC91*s!BD91+s!BB91*s!BE91))+IF(s!BD91*s!BF91+s!BB91*s!BH91=0,0,M92*s!BD91*s!BF91/(s!BD91*s!BF91+s!BB91*s!BH91))+IF(s!BD91*s!BI91+s!BE91*s!BH91=0,0,Q92*s!BD91*s!BI91/(s!BD91*s!BI91+s!BE91*s!BH91))+IF(s!BB91*s!BI91+s!BC91*s!BH91+s!BD91*s!BG91+s!BE91*s!BF91=0,0,N92*s!BD91*s!BG91/(s!BB91*s!BI91+s!BC91*s!BH91+s!BD91*s!BG91+s!BE91*s!BF91)) -> 10.119740337352434 | BE92: =AN92+IF(s!BB91*s!BE91+s!BC91*s!BD91=0,0,E92*s!BB91*s!BE91/(s!BB91*s!BE91+s!BC91*s!BD91))+IF(s!BC91*s!BI91+s!BE91*s!BG91=0,0,O92*s!BE91*s!BG91/(s!BC91*s!BI91+s!BE91*s!BG91))+IF(s!BD91*s!BI91+s!BE91*s!BH91=0,0,Q92*s!BE91*s!BH91/(s!BD91*s!BI91+s!BE91*s!BH91))+IF(s!BB91*s!BI91+s!BC91*s!BH91+s!BD91*s!BG91+s!BE91*s!BF91=0,0,N92*s!BE91*s!BF91/(s!BB91*s!BI91+s!BC91*s!BH91+s!BD91*s!BG91+s!BE91*s!BF91)) -> 16.726907574578618 | BF92: =AO92+IF(s!BB91*s!BG91+s!BC91*s!BF91=0,0,K92*s!BC91*s!BF91/(s!BB91*s!BG91+s!BC91*s!BF91))+IF(s!BD91*s!BF91+s!BB91*s!BH91=0,0,M92*s!BD91*s!BF91/(s!BD91*s!BF91+s!BB91*s!BH91))+IF(s!BF91*s!BI91+s!BG91*s!BH91=0,0,W92*s!BF91*s!BI91/(s!BF91*s!BI91+s!BG91*s!BH91))+IF(s!BB91*s!BI91+s!BC91*s!BH91+s!BD91*s!BG91+s!BE91*s!BF91=0,0,N92*s!BE91*s!BF91/(s!BB91*s!BI91+s!BC91*s!BH91+s!BD91*s!BG91+s!BE91*s!BF91)) -> 10.141959884837178 | BG92: =AP92+IF(s!BB91*s!BG91+s!BC91*s!BF91=0,0,K92*s!BB91*s!BG91/(s!BB91*s!BG91+s!BC91*s!BF91))+IF(s!BC91*s!BI91+s!BE91*s!BG91=0,0,O92*s!BE91*s!BG91/(s!BC91*s!BI91+s!BE91*s!BG91))+IF(s!BF91*s!BI91+s!BG91*s!BH91=0,0,W92*s!BG91*s!BH91/(s!BF91*s!BI91+s!BG91*s!BH91))+IF(s!BB91*s!BI91+s!BC91*s!BH91+s!BD91*s!BG91+s!BE91*s!BF91=0,0,N92*s!BD91*s!BG91/(s!BB91*s!BI91+s!BC91*s!BH91+s!BD91*s!BG91+s!BE91*s!BF91)) -> 15.704688027093878 | BH92: =AQ92+IF(s!BB91*s!BH91+s!BD91*s!BF91=0,0,M92*s!BB91*s!BH91/(s!BB91*s!BH91+s!BD91*s!BF91))+IF(s!BD91*s!BI91+s!BE91*s!BH91=0,0,Q92*s!BE91*s!BH91/(s!BD91*s!BI91+s!BE91*s!BH91))+IF(s!BF91*s!BI91+s!BG91*s!BH91=0,0,W92*s!BG91*s!BH91/(s!BF91*s!BI91+s!BG91*s!BH91))+IF(s!BB91*s!BI91+s!BC91*s!BH91+s!BD91*s!BG91+s!BE91*s!BF91=0,0,N92*s!BC91*s!BH91/(s!BB91*s!BI91+s!BC91*s!BH91+s!BD91*s!BG91+s!BE91*s!BF91)) -> 17.97171510522206 | BI92: =AR92+IF(s!BC91*s!BI91+s!BE91*s!BG91=0,0,O92*s!BC91*s!BI91/(s!BC91*s!BI91+s!BE91*s!BG91))+IF(s!BD91*s!BI91+s!BE91*s!BH91=0,0,Q92*s!BD91*s!BI91/(s!BD91*s!BI91+s!BE91*s!BH91))+IF(s!BF91*s!BI91+s!BG91*s!BH91=0,0,W92*s!BF91*s!BI91/(s!BF91*s!BI91+s!BG91*s!BH91))+IF(s!BB91*s!BI91+s!BC91*s!BH91+s!BD91*s!BG91+s!BE91*s!BF91=0,0,N92*s!BB91*s!BI91/(s!BB91*s!BI91+s!BC91*s!BH91+s!BD91*s!BG91+s!BE91*s!BF91)) -> 20.181636982846886 | BJ92: =SUM(BB92:BI92) -> 326
A93: =A92 -> 100 | B93: =B92 -> 1 | C93: =C92 -> 1 | D93: =D92 -> 2 | E93: =E92 -> 5 | F93: =F92 -> 2 | G93: =G92 -> 1 | H93: =H92 -> 2 | I93: =I92 -> 1 | J93: =J92 -> 2 | K93: =K92 -> 4 | L93: =L92 -> 2 | M93: =M92 -> 4 | N93: =N92 -> 8 | O93: =O92 -> 4 | P93: =P92 -> 2 | Q93: =Q92 -> 4 | R93: =R92 -> 2 | S93: =S92 -> 1 | T93: =T92 -> 2 | U93: =U92 -> 1 | V93: =V92 -> 2 | W93: =W92 -> 4 | X93: =X92 -> 2 | Y93: =Y92 -> 1 | Z93: =Z92 -> 2 | AA93: =AA92 -> 1 | AB93: =AB92 -> 163 | AK93: =AK92 -> 205 | AL93: =AL92 -> 7 | AM93: =AM92 -> 8 | AN93: =AN92 -> 8 | AO93: =AO92 -> 8 | AP93: =AP92 -> 8 | AQ93: =AQ92 -> 8 | AR93: =AR92 -> 8 | AS93: =AS92 -> 260 | BB93: =AK93+IF(s!BB92*s!BE92+s!BC92*s!BD92=0,0,E93*s!BB92*s!BE92/(s!BB92*s!BE92+s!BC92*s!BD92)+IF(s!BB92*s!BG92+s!BC92*s!BF92=0,0,K93*s!BB92*s!BG92/(s!BB92*s!BG92+s!BC92*s!BF92))+IF(s!BB92*s!BH92+s!BD92*s!BF92=0,0,M93*s!BB92*s!BH92/(s!BB92*s!BH92+s!BD92*s!BF92))+IF(s!BB92*s!BI92+s!BC92*s!BH92+s!BD92*s!BG92+s!BE92*s!BF92=0,0,N93*s!BB92*s!BI92/(s!BB92*s!BI92+s!BC92*s!BH92+s!BD92*s!BG92+s!BE92*s!BF92)
)) -> 223.76658467258832 | BC93: =AL93+IF(s!BC92*s!BD92+s!BB92*s!BE92=0,0,E93*s!BC92*s!BD92/(s!BC92*s!BD92+s!BB92*s!BE92))+IF(s!BB92*s!BG92+s!BC92*s!BF92=0,0,K93*s!BC92*s!BF92/(s!BB92*s!BG92+s!BC92*s!BF92))+IF(s!BC92*s!BI92+s!BE92*s!BG92=0,0,O93*s!BC92*s!BI92/(s!BC92*s!BI92+s!BE92*s!BG92))+IF(s!BB92*s!BI92+s!BC92*s!BH92+s!BD92*s!BG92+s!BE92*s!BF92=0,0,N93*s!BC92*s!BH92/(s!BB92*s!BI92+s!BC92*s!BH92+s!BD92*s!BG92+s!BE92*s!BF92)) -> 11.3867674154806 | BD93: =AM93+IF(s!BC92*s!BD92+s!BB92*s!BE92=0,0,E93*s!BC92*s!BD92/(s!BC92*s!BD92+s!BB92*s!BE92))+IF(s!BD92*s!BF92+s!BB92*s!BH92=0,0,M93*s!BD92*s!BF92/(s!BD92*s!BF92+s!BB92*s!BH92))+IF(s!BD92*s!BI92+s!BE92*s!BH92=0,0,Q93*s!BD92*s!BI92/(s!BD92*s!BI92+s!BE92*s!BH92))+IF(s!BB92*s!BI92+s!BC92*s!BH92+s!BD92*s!BG92+s!BE92*s!BF92=0,0,N93*s!BD92*s!BG92/(s!BB92*s!BI92+s!BC92*s!BH92+s!BD92*s!BG92+s!BE92*s!BF92)) -> 10.1197403373524 | BE93: =AN93+IF(s!BB92*s!BE92+s!BC92*s!BD92=0,0,E93*s!BB92*s!BE92/(s!BB92*s!BE92+s!BC92*s!BD92))+IF(s!BC92*s!BI92+s!BE92*s!BG92=0,0,O93*s!BE92*s!BG92/(s!BC92*s!BI92+s!BE92*s!BG92))+IF(s!BD92*s!BI92+s!BE92*s!BH92=0,0,Q93*s!BE92*s!BH92/(s!BD92*s!BI92+s!BE92*s!BH92))+IF(s!BB92*s!BI92+s!BC92*s!BH92+s!BD92*s!BG92+s!BE92*s!BF92=0,0,N93*s!BE92*s!BF92/(s!BB92*s!BI92+s!BC92*s!BH92+s!BD92*s!BG92+s!BE92*s!BF92)) -> 16.726907574578682 | BF93: =AO93+IF(s!BB92*s!BG92+s!BC92*s!BF92=0,0,K93*s!BC92*s!BF92/(s!BB92*s!BG92+s!BC92*s!BF92))+IF(s!BD92*s!BF92+s!BB92*s!BH92=0,0,M93*s!BD92*s!BF92/(s!BD92*s!BF92+s!BB92*s!BH92))+IF(s!BF92*s!BI92+s!BG92*s!BH92=0,0,W93*s!BF92*s!BI92/(s!BF92*s!BI92+s!BG92*s!BH92))+IF(s!BB92*s!BI92+s!BC92*s!BH92+s!BD92*s!BG92+s!BE92*s!BF92=0,0,N93*s!BE92*s!BF92/(s!BB92*s!BI92+s!BC92*s!BH92+s!BD92*s!BG92+s!BE92*s!BF92)) -> 10.141959884837139 | BG93: =AP93+IF(s!BB92*s!BG92+s!BC92*s!BF92=0,0,K93*s!BB92*s!BG92/(s!BB92*s!BG92+s!BC92*s!BF92))+IF(s!BC92*s!BI92+s!BE92*s!BG92=0,0,O93*s!BE92*s!BG92/(s!BC92*s!BI92+s!BE92*s!BG92))+IF(s!BF92*s!BI92+s!BG92*s!BH92=0,0,W93*s!BG92*s!BH92/(s!BF92*s!BI92+s!BG92*s!BH92))+IF(s!BB92*s!BI92+s!BC92*s!BH92+s!BD92*s!BG92+s!BE92*s!BF92=0,0,N93*s!BD92*s!BG92/(s!BB92*s!BI92+s!BC92*s!BH92+s!BD92*s!BG92+s!BE92*s!BF92)) -> 15.704688027093942 | BH93: =AQ93+IF(s!BB92*s!BH92+s!BD92*s!BF92=0,0,M93*s!BB92*s!BH92/(s!BB92*s!BH92+s!BD92*s!BF92))+IF(s!BD92*s!BI92+s!BE92*s!BH92=0,0,Q93*s!BE92*s!BH92/(s!BD92*s!BI92+s!BE92*s!BH92))+IF(s!BF92*s!BI92+s!BG92*s!BH92=0,0,W93*s!BG92*s!BH92/(s!BF92*s!BI92+s!BG92*s!BH92))+IF(s!BB92*s!BI92+s!BC92*s!BH92+s!BD92*s!BG92+s!BE92*s!BF92=0,0,N93*s!BC92*s!BH92/(s!BB92*s!BI92+s!BC92*s!BH92+s!BD92*s!BG92+s!BE92*s!BF92)) -> 17.971715105222145 | BI93: =AR93+IF(s!BC92*s!BI92+s!BE92*s!BG92=0,0,O93*s!BC92*s!BI92/(s!BC92*s!BI92+s!BE92*s!BG92))+IF(s!BD92*s!BI92+s!BE92*s!BH92=0,0,Q93*s!BD92*s!BI92/(s!BD92*s!BI92+s!BE92*s!BH92))+IF(s!BF92*s!BI92+s!BG92*s!BH92=0,0,W93*s!BF92*s!BI92/(s!BF92*s!BI92+s!BG92*s!BH92))+IF(s!BB92*s!BI92+s!BC92*s!BH92+s!BD92*s!BG92+s!BE92*s!BF92=0,0,N93*s!BB92*s!BI92/(s!BB92*s!BI92+s!BC92*s!BH92+s!BD92*s!BG92+s!BE92*s!BF92)) -> 20.181636982846776 | BJ93: =SUM(BB93:BI93) -> 326
A94: =A93 -> 100 | B94: =B93 -> 1 | C94: =C93 -> 1 | D94: =D93 -> 2 | E94: =E93 -> 5 | F94: =F93 -> 2 | G94: =G93 -> 1 | H94: =H93 -> 2 | I94: =I93 -> 1 | J94: =J93 -> 2 | K94: =K93 -> 4 | L94: =L93 -> 2 | M94: =M93 -> 4 | N94: =N93 -> 8 | O94: =O93 -> 4 | P94: =P93 -> 2 | Q94: =Q93 -> 4 | R94: =R93 -> 2 | S94: =S93 -> 1 | T94: =T93 -> 2 | U94: =U93 -> 1 | V94: =V93 -> 2 | W94: =W93 -> 4 | X94: =X93 -> 2 | Y94: =Y93 -> 1 | Z94: =Z93 -> 2 | AA94: =AA93 -> 1 | AB94: =AB93 -> 163 | AK94: =AK93 -> 205 | AL94: =AL93 -> 7 | AM94: =AM93 -> 8 | AN94: =AN93 -> 8 | AO94: =AO93 -> 8 | AP94: =AP93 -> 8 | AQ94: =AQ93 -> 8 | AR94: =AR93 -> 8 | AS94: =AS93 -> 260 | BB94: =AK94+IF(s!BB93*s!BE93+s!BC93*s!BD93=0,0,E94*s!BB93*s!BE93/(s!BB93*s!BE93+s!BC93*s!BD93)+IF(s!BB93*s!BG93+s!BC93*s!BF93=0,0,K94*s!BB93*s!BG93/(s!BB93*s!BG93+s!BC93*s!BF93))+IF(s!BB93*s!BH93+s!BD93*s!BF93=0,0,M94*s!BB93*s!BH93/(s!BB93*s!BH93+s!BD93*s!BF93))+IF(s!BB93*s!BI93+s!BC93*s!BH93+s!BD93*s!BG93+s!BE93*s!BF93=0,0,N94*s!BB93*s!BI93/(s!BB93*s!BI93+s!BC93*s!BH93+s!BD93*s!BG93+s!BE93*s!BF93)
)) -> 223.76658467258829 | BC94: =AL94+IF(s!BC93*s!BD93+s!BB93*s!BE93=0,0,E94*s!BC93*s!BD93/(s!BC93*s!BD93+s!BB93*s!BE93))+IF(s!BB93*s!BG93+s!BC93*s!BF93=0,0,K94*s!BC93*s!BF93/(s!BB93*s!BG93+s!BC93*s!BF93))+IF(s!BC93*s!BI93+s!BE93*s!BG93=0,0,O94*s!BC93*s!BI93/(s!BC93*s!BI93+s!BE93*s!BG93))+IF(s!BB93*s!BI93+s!BC93*s!BH93+s!BD93*s!BG93+s!BE93*s!BF93=0,0,N94*s!BC93*s!BH93/(s!BB93*s!BI93+s!BC93*s!BH93+s!BD93*s!BG93+s!BE93*s!BF93)) -> 11.386767415480591 | BD94: =AM94+IF(s!BC93*s!BD93+s!BB93*s!BE93=0,0,E94*s!BC93*s!BD93/(s!BC93*s!BD93+s!BB93*s!BE93))+IF(s!BD93*s!BF93+s!BB93*s!BH93=0,0,M94*s!BD93*s!BF93/(s!BD93*s!BF93+s!BB93*s!BH93))+IF(s!BD93*s!BI93+s!BE93*s!BH93=0,0,Q94*s!BD93*s!BI93/(s!BD93*s!BI93+s!BE93*s!BH93))+IF(s!BB93*s!BI93+s!BC93*s!BH93+s!BD93*s!BG93+s!BE93*s!BF93=0,0,N94*s!BD93*s!BG93/(s!BB93*s!BI93+s!BC93*s!BH93+s!BD93*s!BG93+s!BE93*s!BF93)) -> 10.119740337352376 | BE94: =AN94+IF(s!BB93*s!BE93+s!BC93*s!BD93=0,0,E94*s!BB93*s!BE93/(s!BB93*s!BE93+s!BC93*s!BD93))+IF(s!BC93*s!BI93+s!BE93*s!BG93=0,0,O94*s!BE93*s!BG93/(s!BC93*s!BI93+s!BE93*s!BG93))+IF(s!BD93*s!BI93+s!BE93*s!BH93=0,0,Q94*s!BE93*s!BH93/(s!BD93*s!BI93+s!BE93*s!BH93))+IF(s!BB93*s!BI93+s!BC93*s!BH93+s!BD93*s!BG93+s!BE93*s!BF93=0,0,N94*s!BE93*s!BF93/(s!BB93*s!BI93+s!BC93*s!BH93+s!BD93*s!BG93+s!BE93*s!BF93)) -> 16.726907574578728 | BF94: =AO94+IF(s!BB93*s!BG93+s!BC93*s!BF93=0,0,K94*s!BC93*s!BF93/(s!BB93*s!BG93+s!BC93*s!BF93))+IF(s!BD93*s!BF93+s!BB93*s!BH93=0,0,M94*s!BD93*s!BF93/(s!BD93*s!BF93+s!BB93*s!BH93))+IF(s!BF93*s!BI93+s!BG93*s!BH93=0,0,W94*s!BF93*s!BI93/(s!BF93*s!BI93+s!BG93*s!BH93))+IF(s!BB93*s!BI93+s!BC93*s!BH93+s!BD93*s!BG93+s!BE93*s!BF93=0,0,N94*s!BE93*s!BF93/(s!BB93*s!BI93+s!BC93*s!BH93+s!BD93*s!BG93+s!BE93*s!BF93)) -> 10.141959884837114 | BG94: =AP94+IF(s!BB93*s!BG93+s!BC93*s!BF93=0,0,K94*s!BB93*s!BG93/(s!BB93*s!BG93+s!BC93*s!BF93))+IF(s!BC93*s!BI93+s!BE93*s!BG93=0,0,O94*s!BE93*s!BG93/(s!BC93*s!BI93+s!BE93*s!BG93))+IF(s!BF93*s!BI93+s!BG93*s!BH93=0,0,W94*s!BG93*s!BH93/(s!BF93*s!BI93+s!BG93*s!BH93))+IF(s!BB93*s!BI93+s!BC93*s!BH93+s!BD93*s!BG93+s!BE93*s!BF93=0,0,N94*s!BD93*s!BG93/(s!BB93*s!BI93+s!BC93*s!BH93+s!BD93*s!BG93+s!BE93*s!BF93)) -> 15.704688027093988 | BH94: =AQ94+IF(s!BB93*s!BH93+s!BD93*s!BF93=0,0,M94*s!BB93*s!BH93/(s!BB93*s!BH93+s!BD93*s!BF93))+IF(s!BD93*s!BI93+s!BE93*s!BH93=0,0,Q94*s!BE93*s!BH93/(s!BD93*s!BI93+s!BE93*s!BH93))+IF(s!BF93*s!BI93+s!BG93*s!BH93=0,0,W94*s!BG93*s!BH93/(s!BF93*s!BI93+s!BG93*s!BH93))+IF(s!BB93*s!BI93+s!BC93*s!BH93+s!BD93*s!BG93+s!BE93*s!BF93=0,0,N94*s!BC93*s!BH93/(s!BB93*s!BI93+s!BC93*s!BH93+s!BD93*s!BG93+s!BE93*s!BF93)) -> 17.971715105222202 | BI94: =AR94+IF(s!BC93*s!BI93+s!BE93*s!BG93=0,0,O94*s!BC93*s!BI93/(s!BC93*s!BI93+s!BE93*s!BG93))+IF(s!BD93*s!BI93+s!BE93*s!BH93=0,0,Q94*s!BD93*s!BI93/(s!BD93*s!BI93+s!BE93*s!BH93))+IF(s!BF93*s!BI93+s!BG93*s!BH93=0,0,W94*s!BF93*s!BI93/(s!BF93*s!BI93+s!BG93*s!BH93))+IF(s!BB93*s!BI93+s!BC93*s!BH93+s!BD93*s!BG93+s!BE93*s!BF93=0,0,N94*s!BB93*s!BI93/(s!BB93*s!BI93+s!BC93*s!BH93+s!BD93*s!BG93+s!BE93*s!BF93)) -> 20.181636982846694 | BJ94: =SUM(BB94:BI94) -> 326
A95: =A94 -> 100 | B95: =B94 -> 1 | C95: =C94 -> 1 | D95: =D94 -> 2 | E95: =E94 -> 5 | F95: =F94 -> 2 | G95: =G94 -> 1 | H95: =H94 -> 2 | I95: =I94 -> 1 | J95: =J94 -> 2 | K95: =K94 -> 4 | L95: =L94 -> 2 | M95: =M94 -> 4 | N95: =N94 -> 8 | O95: =O94 -> 4 | P95: =P94 -> 2 | Q95: =Q94 -> 4 | R95: =R94 -> 2 | S95: =S94 -> 1 | T95: =T94 -> 2 | U95: =U94 -> 1 | V95: =V94 -> 2 | W95: =W94 -> 4 | X95: =X94 -> 2 | Y95: =Y94 -> 1 | Z95: =Z94 -> 2 | AA95: =AA94 -> 1 | AB95: =AB94 -> 163 | AK95: =AK94 -> 205 | AL95: =AL94 -> 7 | AM95: =AM94 -> 8 | AN95: =AN94 -> 8 | AO95: =AO94 -> 8 | AP95: =AP94 -> 8 | AQ95: =AQ94 -> 8 | AR95: =AR94 -> 8 | AS95: =AS94 -> 260 | BB95: =AK95+IF(s!BB94*s!BE94+s!BC94*s!BD94=0,0,E95*s!BB94*s!BE94/(s!BB94*s!BE94+s!BC94*s!BD94)+IF(s!BB94*s!BG94+s!BC94*s!BF94=0,0,K95*s!BB94*s!BG94/(s!BB94*s!BG94+s!BC94*s!BF94))+IF(s!BB94*s!BH94+s!BD94*s!BF94=0,0,M95*s!BB94*s!BH94/(s!BB94*s!BH94+s!BD94*s!BF94))+IF(s!BB94*s!BI94+s!BC94*s!BH94+s!BD94*s!BG94+s!BE94*s!BF94=0,0,N95*s!BB94*s!BI94/(s!BB94*s!BI94+s!BC94*s!BH94+s!BD94*s!BG94+s!BE94*s!BF94)
)) -> 223.76658467258829 | BC95: =AL95+IF(s!BC94*s!BD94+s!BB94*s!BE94=0,0,E95*s!BC94*s!BD94/(s!BC94*s!BD94+s!BB94*s!BE94))+IF(s!BB94*s!BG94+s!BC94*s!BF94=0,0,K95*s!BC94*s!BF94/(s!BB94*s!BG94+s!BC94*s!BF94))+IF(s!BC94*s!BI94+s!BE94*s!BG94=0,0,O95*s!BC94*s!BI94/(s!BC94*s!BI94+s!BE94*s!BG94))+IF(s!BB94*s!BI94+s!BC94*s!BH94+s!BD94*s!BG94+s!BE94*s!BF94=0,0,N95*s!BC94*s!BH94/(s!BB94*s!BI94+s!BC94*s!BH94+s!BD94*s!BG94+s!BE94*s!BF94)) -> 11.386767415480584 | BD95: =AM95+IF(s!BC94*s!BD94+s!BB94*s!BE94=0,0,E95*s!BC94*s!BD94/(s!BC94*s!BD94+s!BB94*s!BE94))+IF(s!BD94*s!BF94+s!BB94*s!BH94=0,0,M95*s!BD94*s!BF94/(s!BD94*s!BF94+s!BB94*s!BH94))+IF(s!BD94*s!BI94+s!BE94*s!BH94=0,0,Q95*s!BD94*s!BI94/(s!BD94*s!BI94+s!BE94*s!BH94))+IF(s!BB94*s!BI94+s!BC94*s!BH94+s!BD94*s!BG94+s!BE94*s!BF94=0,0,N95*s!BD94*s!BG94/(s!BB94*s!BI94+s!BC94*s!BH94+s!BD94*s!BG94+s!BE94*s!BF94)) -> 10.119740337352354 | BE95: =AN95+IF(s!BB94*s!BE94+s!BC94*s!BD94=0,0,E95*s!BB94*s!BE94/(s!BB94*s!BE94+s!BC94*s!BD94))+IF(s!BC94*s!BI94+s!BE94*s!BG94=0,0,O95*s!BE94*s!BG94/(s!BC94*s!BI94+s!BE94*s!BG94))+IF(s!BD94*s!BI94+s!BE94*s!BH94=0,0,Q95*s!BE94*s!BH94/(s!BD94*s!BI94+s!BE94*s!BH94))+IF(s!BB94*s!BI94+s!BC94*s!BH94+s!BD94*s!BG94+s!BE94*s!BF94=0,0,N95*s!BE94*s!BF94/(s!BB94*s!BI94+s!BC94*s!BH94+s!BD94*s!BG94+s!BE94*s!BF94)) -> 16.726907574578764 | BF95: =AO95+IF(s!BB94*s!BG94+s!BC94*s!BF94=0,0,K95*s!BC94*s!BF94/(s!BB94*s!BG94+s!BC94*s!BF94))+IF(s!BD94*s!BF94+s!BB94*s!BH94=0,0,M95*s!BD94*s!BF94/(s!BD94*s!BF94+s!BB94*s!BH94))+IF(s!BF94*s!BI94+s!BG94*s!BH94=0,0,W95*s!BF94*s!BI94/(s!BF94*s!BI94+s!BG94*s!BH94))+IF(s!BB94*s!BI94+s!BC94*s!BH94+s!BD94*s!BG94+s!BE94*s!BF94=0,0,N95*s!BE94*s!BF94/(s!BB94*s!BI94+s!BC94*s!BH94+s!BD94*s!BG94+s!BE94*s!BF94)) -> 10.141959884837094 | BG95: =AP95+IF(s!BB94*s!BG94+s!BC94*s!BF94=0,0,K95*s!BB94*s!BG94/(s!BB94*s!BG94+s!BC94*s!BF94))+IF(s!BC94*s!BI94+s!BE94*s!BG94=0,0,O95*s!BE94*s!BG94/(s!BC94*s!BI94+s!BE94*s!BG94))+IF(s!BF94*s!BI94+s!BG94*s!BH94=0,0,W95*s!BG94*s!BH94/(s!BF94*s!BI94+s!BG94*s!BH94))+IF(s!BB94*s!BI94+s!BC94*s!BH94+s!BD94*s!BG94+s!BE94*s!BF94=0,0,N95*s!BD94*s!BG94/(s!BB94*s!BI94+s!BC94*s!BH94+s!BD94*s!BG94+s!BE94*s!BF94)) -> 15.704688027094019 | BH95: =AQ95+IF(s!BB94*s!BH94+s!BD94*s!BF94=0,0,M95*s!BB94*s!BH94/(s!BB94*s!BH94+s!BD94*s!BF94))+IF(s!BD94*s!BI94+s!BE94*s!BH94=0,0,Q95*s!BE94*s!BH94/(s!BD94*s!BI94+s!BE94*s!BH94))+IF(s!BF94*s!BI94+s!BG94*s!BH94=0,0,W95*s!BG94*s!BH94/(s!BF94*s!BI94+s!BG94*s!BH94))+IF(s!BB94*s!BI94+s!BC94*s!BH94+s!BD94*s!BG94+s!BE94*s!BF94=0,0,N95*s!BC94*s!BH94/(s!BB94*s!BI94+s!BC94*s!BH94+s!BD94*s!BG94+s!BE94*s!BF94)) -> 17.971715105222245 | BI95: =AR95+IF(s!BC94*s!BI94+s!BE94*s!BG94=0,0,O95*s!BC94*s!BI94/(s!BC94*s!BI94+s!BE94*s!BG94))+IF(s!BD94*s!BI94+s!BE94*s!BH94=0,0,Q95*s!BD94*s!BI94/(s!BD94*s!BI94+s!BE94*s!BH94))+IF(s!BF94*s!BI94+s!BG94*s!BH94=0,0,W95*s!BF94*s!BI94/(s!BF94*s!BI94+s!BG94*s!BH94))+IF(s!BB94*s!BI94+s!BC94*s!BH94+s!BD94*s!BG94+s!BE94*s!BF94=0,0,N95*s!BB94*s!BI94/(s!BB94*s!BI94+s!BC94*s!BH94+s!BD94*s!BG94+s!BE94*s!BF94)) -> 20.181636982846641 | BJ95: =SUM(BB95:BI95) -> 326
A96: =A95 -> 100 | B96: =B95 -> 1 | C96: =C95 -> 1 | D96: =D95 -> 2 | E96: =E95 -> 5 | F96: =F95 -> 2 | G96: =G95 -> 1 | H96: =H95 -> 2 | I96: =I95 -> 1 | J96: =J95 -> 2 | K96: =K95 -> 4 | L96: =L95 -> 2 | M96: =M95 -> 4 | N96: =N95 -> 8 | O96: =O95 -> 4 | P96: =P95 -> 2 | Q96: =Q95 -> 4 | R96: =R95 -> 2 | S96: =S95 -> 1 | T96: =T95 -> 2 | U96: =U95 -> 1 | V96: =V95 -> 2 | W96: =W95 -> 4 | X96: =X95 -> 2 | Y96: =Y95 -> 1 | Z96: =Z95 -> 2 | AA96: =AA95 -> 1 | AB96: =AB95 -> 163 | AK96: =AK95 -> 205 | AL96: =AL95 -> 7 | AM96: =AM95 -> 8 | AN96: =AN95 -> 8 | AO96: =AO95 -> 8 | AP96: =AP95 -> 8 | AQ96: =AQ95 -> 8 | AR96: =AR95 -> 8 | AS96: =AS95 -> 260 | BB96: =AK96+IF(s!BB95*s!BE95+s!BC95*s!BD95=0,0,E96*s!BB95*s!BE95/(s!BB95*s!BE95+s!BC95*s!BD95)+IF(s!BB95*s!BG95+s!BC95*s!BF95=0,0,K96*s!BB95*s!BG95/(s!BB95*s!BG95+s!BC95*s!BF95))+IF(s!BB95*s!BH95+s!BD95*s!BF95=0,0,M96*s!BB95*s!BH95/(s!BB95*s!BH95+s!BD95*s!BF95))+IF(s!BB95*s!BI95+s!BC95*s!BH95+s!BD95*s!BG95+s!BE95*s!BF95=0,0,N96*s!BB95*s!BI95/(s!BB95*s!BI95+s!BC95*s!BH95+s!BD95*s!BG95+s!BE95*s!BF95)
)) -> 223.76658467258829 | BC96: =AL96+IF(s!BC95*s!BD95+s!BB95*s!BE95=0,0,E96*s!BC95*s!BD95/(s!BC95*s!BD95+s!BB95*s!BE95))+IF(s!BB95*s!BG95+s!BC95*s!BF95=0,0,K96*s!BC95*s!BF95/(s!BB95*s!BG95+s!BC95*s!BF95))+IF(s!BC95*s!BI95+s!BE95*s!BG95=0,0,O96*s!BC95*s!BI95/(s!BC95*s!BI95+s!BE95*s!BG95))+IF(s!BB95*s!BI95+s!BC95*s!BH95+s!BD95*s!BG95+s!BE95*s!BF95=0,0,N96*s!BC95*s!BH95/(s!BB95*s!BI95+s!BC95*s!BH95+s!BD95*s!BG95+s!BE95*s!BF95)) -> 11.386767415480577 | BD96: =AM96+IF(s!BC95*s!BD95+s!BB95*s!BE95=0,0,E96*s!BC95*s!BD95/(s!BC95*s!BD95+s!BB95*s!BE95))+IF(s!BD95*s!BF95+s!BB95*s!BH95=0,0,M96*s!BD95*s!BF95/(s!BD95*s!BF95+s!BB95*s!BH95))+IF(s!BD95*s!BI95+s!BE95*s!BH95=0,0,Q96*s!BD95*s!BI95/(s!BD95*s!BI95+s!BE95*s!BH95))+IF(s!BB95*s!BI95+s!BC95*s!BH95+s!BD95*s!BG95+s!BE95*s!BF95=0,0,N96*s!BD95*s!BG95/(s!BB95*s!BI95+s!BC95*s!BH95+s!BD95*s!BG95+s!BE95*s!BF95)) -> 10.119740337352342 | BE96: =AN96+IF(s!BB95*s!BE95+s!BC95*s!BD95=0,0,E96*s!BB95*s!BE95/(s!BB95*s!BE95+s!BC95*s!BD95))+IF(s!BC95*s!BI95+s!BE95*s!BG95=0,0,O96*s!BE95*s!BG95/(s!BC95*s!BI95+s!BE95*s!BG95))+IF(s!BD95*s!BI95+s!BE95*s!BH95=0,0,Q96*s!BE95*s!BH95/(s!BD95*s!BI95+s!BE95*s!BH95))+IF(s!BB95*s!BI95+s!BC95*s!BH95+s!BD95*s!BG95+s!BE95*s!BF95=0,0,N96*s!BE95*s!BF95/(s!BB95*s!BI95+s!BC95*s!BH95+s!BD95*s!BG95+s!BE95*s!BF95)) -> 16.726907574578785 | BF96: =AO96+IF(s!BB95*s!BG95+s!BC95*s!BF95=0,0,K96*s!BC95*s!BF95/(s!BB95*s!BG95+s!BC95*s!BF95))+IF(s!BD95*s!BF95+s!BB95*s!BH95=0,0,M96*s!BD95*s!BF95/(s!BD95*s!BF95+s!BB95*s!BH95))+IF(s!BF95*s!BI95+s!BG95*s!BH95=0,0,W96*s!BF95*s!BI95/(s!BF95*s!BI95+s!BG95*s!BH95))+IF(s!BB95*s!BI95+s!BC95*s!BH95+s!BD95*s!BG95+s!BE95*s!BF95=0,0,N96*s!BE95*s!BF95/(s!BB95*s!BI95+s!BC95*s!BH95+s!BD95*s!BG95+s!BE95*s!BF95)) -> 10.141959884837082 | BG96: =AP96+IF(s!BB95*s!BG95+s!BC95*s!BF95=0,0,K96*s!BB95*s!BG95/(s!BB95*s!BG95+s!BC95*s!BF95))+IF(s!BC95*s!BI95+s!BE95*s!BG95=0,0,O96*s!BE95*s!BG95/(s!BC95*s!BI95+s!BE95*s!BG95))+IF(s!BF95*s!BI95+s!BG95*s!BH95=0,0,W96*s!BG95*s!BH95/(s!BF95*s!BI95+s!BG95*s!BH95))+IF(s!BB95*s!BI95+s!BC95*s!BH95+s!BD95*s!BG95+s!BE95*s!BF95=0,0,N96*s!BD95*s!BG95/(s!BB95*s!BI95+s!BC95*s!BH95+s!BD95*s!BG95+s!BE95*s!BF95)) -> 15.704688027094043 | BH96: =AQ96+IF(s!BB95*s!BH95+s!BD95*s!BF95=0,0,M96*s!BB95*s!BH95/(s!BB95*s!BH95+s!BD95*s!BF95))+IF(s!BD95*s!BI95+s!BE95*s!BH95=0,0,Q96*s!BE95*s!BH95/(s!BD95*s!BI95+s!BE95*s!BH95))+IF(s!BF95*s!BI95+s!BG95*s!BH95=0,0,W96*s!BG95*s!BH95/(s!BF95*s!BI95+s!BG95*s!BH95))+IF(s!BB95*s!BI95+s!BC95*s!BH95+s!BD95*s!BG95+s!BE95*s!BF95=0,0,N96*s!BC95*s!BH95/(s!BB95*s!BI95+s!BC95*s!BH95+s!BD95*s!BG95+s!BE95*s!BF95)) -> 17.971715105222277 | BI96: =AR96+IF(s!BC95*s!BI95+s!BE95*s!BG95=0,0,O96*s!BC95*s!BI95/(s!BC95*s!BI95+s!BE95*s!BG95))+IF(s!BD95*s!BI95+s!BE95*s!BH95=0,0,Q96*s!BD95*s!BI95/(s!BD95*s!BI95+s!BE95*s!BH95))+IF(s!BF95*s!BI95+s!BG95*s!BH95=0,0,W96*s!BF95*s!BI95/(s!BF95*s!BI95+s!BG95*s!BH95))+IF(s!BB95*s!BI95+s!BC95*s!BH95+s!BD95*s!BG95+s!BE95*s!BF95=0,0,N96*s!BB95*s!BI95/(s!BB95*s!BI95+s!BC95*s!BH95+s!BD95*s!BG95+s!BE95*s!BF95)) -> 20.181636982846598 | BJ96: =SUM(BB96:BI96) -> 326
A97: =A96 -> 100 | B97: =B96 -> 1 | C97: =C96 -> 1 | D97: =D96 -> 2 | E97: =E96 -> 5 | F97: =F96 -> 2 | G97: =G96 -> 1 | H97: =H96 -> 2 | I97: =I96 -> 1 | J97: =J96 -> 2 | K97: =K96 -> 4 | L97: =L96 -> 2 | M97: =M96 -> 4 | N97: =N96 -> 8 | O97: =O96 -> 4 | P97: =P96 -> 2 | Q97: =Q96 -> 4 | R97: =R96 -> 2 | S97: =S96 -> 1 | T97: =T96 -> 2 | U97: =U96 -> 1 | V97: =V96 -> 2 | W97: =W96 -> 4 | X97: =X96 -> 2 | Y97: =Y96 -> 1 | Z97: =Z96 -> 2 | AA97: =AA96 -> 1 | AB97: =AB96 -> 163 | AK97: =AK96 -> 205 | AL97: =AL96 -> 7 | AM97: =AM96 -> 8 | AN97: =AN96 -> 8 | AO97: =AO96 -> 8 | AP97: =AP96 -> 8 | AQ97: =AQ96 -> 8 | AR97: =AR96 -> 8 | AS97: =AS96 -> 260 | BB97: =AK97+IF(s!BB96*s!BE96+s!BC96*s!BD96=0,0,E97*s!BB96*s!BE96/(s!BB96*s!BE96+s!BC96*s!BD96)+IF(s!BB96*s!BG96+s!BC96*s!BF96=0,0,K97*s!BB96*s!BG96/(s!BB96*s!BG96+s!BC96*s!BF96))+IF(s!BB96*s!BH96+s!BD96*s!BF96=0,0,M97*s!BB96*s!BH96/(s!BB96*s!BH96+s!BD96*s!BF96))+IF(s!BB96*s!BI96+s!BC96*s!BH96+s!BD96*s!BG96+s!BE96*s!BF96=0,0,N97*s!BB96*s!BI96/(s!BB96*s!BI96+s!BC96*s!BH96+s!BD96*s!BG96+s!BE96*s!BF96)
)) -> 223.76658467258829 | BC97: =AL97+IF(s!BC96*s!BD96+s!BB96*s!BE96=0,0,E97*s!BC96*s!BD96/(s!BC96*s!BD96+s!BB96*s!BE96))+IF(s!BB96*s!BG96+s!BC96*s!BF96=0,0,K97*s!BC96*s!BF96/(s!BB96*s!BG96+s!BC96*s!BF96))+IF(s!BC96*s!BI96+s!BE96*s!BG96=0,0,O97*s!BC96*s!BI96/(s!BC96*s!BI96+s!BE96*s!BG96))+IF(s!BB96*s!BI96+s!BC96*s!BH96+s!BD96*s!BG96+s!BE96*s!BF96=0,0,N97*s!BC96*s!BH96/(s!BB96*s!BI96+s!BC96*s!BH96+s!BD96*s!BG96+s!BE96*s!BF96)) -> 11.386767415480573 | BD97: =AM97+IF(s!BC96*s!BD96+s!BB96*s!BE96=0,0,E97*s!BC96*s!BD96/(s!BC96*s!BD96+s!BB96*s!BE96))+IF(s!BD96*s!BF96+s!BB96*s!BH96=0,0,M97*s!BD96*s!BF96/(s!BD96*s!BF96+s!BB96*s!BH96))+IF(s!BD96*s!BI96+s!BE96*s!BH96=0,0,Q97*s!BD96*s!BI96/(s!BD96*s!BI96+s!BE96*s!BH96))+IF(s!BB96*s!BI96+s!BC96*s!BH96+s!BD96*s!BG96+s!BE96*s!BF96=0,0,N97*s!BD96*s!BG96/(s!BB96*s!BI96+s!BC96*s!BH96+s!BD96*s!BG96+s!BE96*s!BF96)) -> 10.119740337352331 | BE97: =AN97+IF(s!BB96*s!BE96+s!BC96*s!BD96=0,0,E97*s!BB96*s!BE96/(s!BB96*s!BE96+s!BC96*s!BD96))+IF(s!BC96*s!BI96+s!BE96*s!BG96=0,0,O97*s!BE96*s!BG96/(s!BC96*s!BI96+s!BE96*s!BG96))+IF(s!BD96*s!BI96+s!BE96*s!BH96=0,0,Q97*s!BE96*s!BH96/(s!BD96*s!BI96+s!BE96*s!BH96))+IF(s!BB96*s!BI96+s!BC96*s!BH96+s!BD96*s!BG96+s!BE96*s!BF96=0,0,N97*s!BE96*s!BF96/(s!BB96*s!BI96+s!BC96*s!BH96+s!BD96*s!BG96+s!BE96*s!BF96)) -> 16.726907574578799 | BF97: =AO97+IF(s!BB96*s!BG96+s!BC96*s!BF96=0,0,K97*s!BC96*s!BF96/(s!BB96*s!BG96+s!BC96*s!BF96))+IF(s!BD96*s!BF96+s!BB96*s!BH96=0,0,M97*s!BD96*s!BF96/(s!BD96*s!BF96+s!BB96*s!BH96))+IF(s!BF96*s!BI96+s!BG96*s!BH96=0,0,W97*s!BF96*s!BI96/(s!BF96*s!BI96+s!BG96*s!BH96))+IF(s!BB96*s!BI96+s!BC96*s!BH96+s!BD96*s!BG96+s!BE96*s!BF96=0,0,N97*s!BE96*s!BF96/(s!BB96*s!BI96+s!BC96*s!BH96+s!BD96*s!BG96+s!BE96*s!BF96)) -> 10.141959884837071 | BG97: =AP97+IF(s!BB96*s!BG96+s!BC96*s!BF96=0,0,K97*s!BB96*s!BG96/(s!BB96*s!BG96+s!BC96*s!BF96))+IF(s!BC96*s!BI96+s!BE96*s!BG96=0,0,O97*s!BE96*s!BG96/(s!BC96*s!BI96+s!BE96*s!BG96))+IF(s!BF96*s!BI96+s!BG96*s!BH96=0,0,W97*s!BG96*s!BH96/(s!BF96*s!BI96+s!BG96*s!BH96))+IF(s!BB96*s!BI96+s!BC96*s!BH96+s!BD96*s!BG96+s!BE96*s!BF96=0,0,N97*s!BD96*s!BG96/(s!BB96*s!BI96+s!BC96*s!BH96+s!BD96*s!BG96+s!BE96*s!BF96)) -> 15.704688027094058 | BH97: =AQ97+IF(s!BB96*s!BH96+s!BD96*s!BF96=0,0,M97*s!BB96*s!BH96/(s!BB96*s!BH96+s!BD96*s!BF96))+IF(s!BD96*s!BI96+s!BE96*s!BH96=0,0,Q97*s!BE96*s!BH96/(s!BD96*s!BI96+s!BE96*s!BH96))+IF(s!BF96*s!BI96+s!BG96*s!BH96=0,0,W97*s!BG96*s!BH96/(s!BF96*s!BI96+s!BG96*s!BH96))+IF(s!BB96*s!BI96+s!BC96*s!BH96+s!BD96*s!BG96+s!BE96*s!BF96=0,0,N97*s!BC96*s!BH96/(s!BB96*s!BI96+s!BC96*s!BH96+s!BD96*s!BG96+s!BE96*s!BF96)) -> 17.971715105222298 | BI97: =AR97+IF(s!BC96*s!BI96+s!BE96*s!BG96=0,0,O97*s!BC96*s!BI96/(s!BC96*s!BI96+s!BE96*s!BG96))+IF(s!BD96*s!BI96+s!BE96*s!BH96=0,0,Q97*s!BD96*s!BI96/(s!BD96*s!BI96+s!BE96*s!BH96))+IF(s!BF96*s!BI96+s!BG96*s!BH96=0,0,W97*s!BF96*s!BI96/(s!BF96*s!BI96+s!BG96*s!BH96))+IF(s!BB96*s!BI96+s!BC96*s!BH96+s!BD96*s!BG96+s!BE96*s!BF96=0,0,N97*s!BB96*s!BI96/(s!BB96*s!BI96+s!BC96*s!BH96+s!BD96*s!BG96+s!BE96*s!BF96)) -> 20.18163698284657 | BJ97: =SUM(BB97:BI97) -> 326
A98: =A97 -> 100 | B98: =B97 -> 1 | C98: =C97 -> 1 | D98: =D97 -> 2 | E98: =E97 -> 5 | F98: =F97 -> 2 | G98: =G97 -> 1 | H98: =H97 -> 2 | I98: =I97 -> 1 | J98: =J97 -> 2 | K98: =K97 -> 4 | L98: =L97 -> 2 | M98: =M97 -> 4 | N98: =N97 -> 8 | O98: =O97 -> 4 | P98: =P97 -> 2 | Q98: =Q97 -> 4 | R98: =R97 -> 2 | S98: =S97 -> 1 | T98: =T97 -> 2 | U98: =U97 -> 1 | V98: =V97 -> 2 | W98: =W97 -> 4 | X98: =X97 -> 2 | Y98: =Y97 -> 1 | Z98: =Z97 -> 2 | AA98: =AA97 -> 1 | AB98: =AB97 -> 163 | AK98: =AK97 -> 205 | AL98: =AL97 -> 7 | AM98: =AM97 -> 8 | AN98: =AN97 -> 8 | AO98: =AO97 -> 8 | AP98: =AP97 -> 8 | AQ98: =AQ97 -> 8 | AR98: =AR97 -> 8 | AS98: =AS97 -> 260 | BB98: =AK98+IF(s!BB97*s!BE97+s!BC97*s!BD97=0,0,E98*s!BB97*s!BE97/(s!BB97*s!BE97+s!BC97*s!BD97)+IF(s!BB97*s!BG97+s!BC97*s!BF97=0,0,K98*s!BB97*s!BG97/(s!BB97*s!BG97+s!BC97*s!BF97))+IF(s!BB97*s!BH97+s!BD97*s!BF97=0,0,M98*s!BB97*s!BH97/(s!BB97*s!BH97+s!BD97*s!BF97))+IF(s!BB97*s!BI97+s!BC97*s!BH97+s!BD97*s!BG97+s!BE97*s!BF97=0,0,N98*s!BB97*s!BI97/(s!BB97*s!BI97+s!BC97*s!BH97+s!BD97*s!BG97+s!BE97*s!BF97)
)) -> 223.76658467258829 | BC98: =AL98+IF(s!BC97*s!BD97+s!BB97*s!BE97=0,0,E98*s!BC97*s!BD97/(s!BC97*s!BD97+s!BB97*s!BE97))+IF(s!BB97*s!BG97+s!BC97*s!BF97=0,0,K98*s!BC97*s!BF97/(s!BB97*s!BG97+s!BC97*s!BF97))+IF(s!BC97*s!BI97+s!BE97*s!BG97=0,0,O98*s!BC97*s!BI97/(s!BC97*s!BI97+s!BE97*s!BG97))+IF(s!BB97*s!BI97+s!BC97*s!BH97+s!BD97*s!BG97+s!BE97*s!BF97=0,0,N98*s!BC97*s!BH97/(s!BB97*s!BI97+s!BC97*s!BH97+s!BD97*s!BG97+s!BE97*s!BF97)) -> 11.386767415480572 | BD98: =AM98+IF(s!BC97*s!BD97+s!BB97*s!BE97=0,0,E98*s!BC97*s!BD97/(s!BC97*s!BD97+s!BB97*s!BE97))+IF(s!BD97*s!BF97+s!BB97*s!BH97=0,0,M98*s!BD97*s!BF97/(s!BD97*s!BF97+s!BB97*s!BH97))+IF(s!BD97*s!BI97+s!BE97*s!BH97=0,0,Q98*s!BD97*s!BI97/(s!BD97*s!BI97+s!BE97*s!BH97))+IF(s!BB97*s!BI97+s!BC97*s!BH97+s!BD97*s!BG97+s!BE97*s!BF97=0,0,N98*s!BD97*s!BG97/(s!BB97*s!BI97+s!BC97*s!BH97+s!BD97*s!BG97+s!BE97*s!BF97)) -> 10.119740337352322 | BE98: =AN98+IF(s!BB97*s!BE97+s!BC97*s!BD97=0,0,E98*s!BB97*s!BE97/(s!BB97*s!BE97+s!BC97*s!BD97))+IF(s!BC97*s!BI97+s!BE97*s!BG97=0,0,O98*s!BE97*s!BG97/(s!BC97*s!BI97+s!BE97*s!BG97))+IF(s!BD97*s!BI97+s!BE97*s!BH97=0,0,Q98*s!BE97*s!BH97/(s!BD97*s!BI97+s!BE97*s!BH97))+IF(s!BB97*s!BI97+s!BC97*s!BH97+s!BD97*s!BG97+s!BE97*s!BF97=0,0,N98*s!BE97*s!BF97/(s!BB97*s!BI97+s!BC97*s!BH97+s!BD97*s!BG97+s!BE97*s!BF97)) -> 16.72690757457881 | BF98: =AO98+IF(s!BB97*s!BG97+s!BC97*s!BF97=0,0,K98*s!BC97*s!BF97/(s!BB97*s!BG97+s!BC97*s!BF97))+IF(s!BD97*s!BF97+s!BB97*s!BH97=0,0,M98*s!BD97*s!BF97/(s!BD97*s!BF97+s!BB97*s!BH97))+IF(s!BF97*s!BI97+s!BG97*s!BH97=0,0,W98*s!BF97*s!BI97/(s!BF97*s!BI97+s!BG97*s!BH97))+IF(s!BB97*s!BI97+s!BC97*s!BH97+s!BD97*s!BG97+s!BE97*s!BF97=0,0,N98*s!BE97*s!BF97/(s!BB97*s!BI97+s!BC97*s!BH97+s!BD97*s!BG97+s!BE97*s!BF97)) -> 10.141959884837064 | BG98: =AP98+IF(s!BB97*s!BG97+s!BC97*s!BF97=0,0,K98*s!BB97*s!BG97/(s!BB97*s!BG97+s!BC97*s!BF97))+IF(s!BC97*s!BI97+s!BE97*s!BG97=0,0,O98*s!BE97*s!BG97/(s!BC97*s!BI97+s!BE97*s!BG97))+IF(s!BF97*s!BI97+s!BG97*s!BH97=0,0,W98*s!BG97*s!BH97/(s!BF97*s!BI97+s!BG97*s!BH97))+IF(s!BB97*s!BI97+s!BC97*s!BH97+s!BD97*s!BG97+s!BE97*s!BF97=0,0,N98*s!BD97*s!BG97/(s!BB97*s!BI97+s!BC97*s!BH97+s!BD97*s!BG97+s!BE97*s!BF97)) -> 15.704688027094068 | BH98: =AQ98+IF(s!BB97*s!BH97+s!BD97*s!BF97=0,0,M98*s!BB97*s!BH97/(s!BB97*s!BH97+s!BD97*s!BF97))+IF(s!BD97*s!BI97+s!BE97*s!BH97=0,0,Q98*s!BE97*s!BH97/(s!BD97*s!BI97+s!BE97*s!BH97))+IF(s!BF97*s!BI97+s!BG97*s!BH97=0,0,W98*s!BG97*s!BH97/(s!BF97*s!BI97+s!BG97*s!BH97))+IF(s!BB97*s!BI97+s!BC97*s!BH97+s!BD97*s!BG97+s!BE97*s!BF97=0,0,N98*s!BC97*s!BH97/(s!BB97*s!BI97+s!BC97*s!BH97+s!BD97*s!BG97+s!BE97*s!BF97)) -> 17.971715105222316 | BI98: =AR98+IF(s!BC97*s!BI97+s!BE97*s!BG97=0,0,O98*s!BC97*s!BI97/(s!BC97*s!BI97+s!BE97*s!BG97))+IF(s!BD97*s!BI97+s!BE97*s!BH97=0,0,Q98*s!BD97*s!BI97/(s!BD97*s!BI97+s!BE97*s!BH97))+IF(s!BF97*s!BI97+s!BG97*s!BH97=0,0,W98*s!BF97*s!BI97/(s!BF97*s!BI97+s!BG97*s!BH97))+IF(s!BB97*s!BI97+s!BC97*s!BH97+s!BD97*s!BG97+s!BE97*s!BF97=0,0,N98*s!BB97*s!BI97/(s!BB97*s!BI97+s!BC97*s!BH97+s!BD97*s!BG97+s!BE97*s!BF97)) -> 20.181636982846548 | BJ98: =SUM(BB98:BI98) -> 326
A99: =A98 -> 100 | B99: =B98 -> 1 | C99: =C98 -> 1 | D99: =D98 -> 2 | E99: =E98 -> 5 | F99: =F98 -> 2 | G99: =G98 -> 1 | H99: =H98 -> 2 | I99: =I98 -> 1 | J99: =J98 -> 2 | K99: =K98 -> 4 | L99: =L98 -> 2 | M99: =M98 -> 4 | N99: =N98 -> 8 | O99: =O98 -> 4 | P99: =P98 -> 2 | Q99: =Q98 -> 4 | R99: =R98 -> 2 | S99: =S98 -> 1 | T99: =T98 -> 2 | U99: =U98 -> 1 | V99: =V98 -> 2 | W99: =W98 -> 4 | X99: =X98 -> 2 | Y99: =Y98 -> 1 | Z99: =Z98 -> 2 | AA99: =AA98 -> 1 | AB99: =AB98 -> 163 | AK99: =AK98 -> 205 | AL99: =AL98 -> 7 | AM99: =AM98 -> 8 | AN99: =AN98 -> 8 | AO99: =AO98 -> 8 | AP99: =AP98 -> 8 | AQ99: =AQ98 -> 8 | AR99: =AR98 -> 8 | AS99: =AS98 -> 260 | BB99: =AK99+IF(s!BB98*s!BE98+s!BC98*s!BD98=0,0,E99*s!BB98*s!BE98/(s!BB98*s!BE98+s!BC98*s!BD98)+IF(s!BB98*s!BG98+s!BC98*s!BF98=0,0,K99*s!BB98*s!BG98/(s!BB98*s!BG98+s!BC98*s!BF98))+IF(s!BB98*s!BH98+s!BD98*s!BF98=0,0,M99*s!BB98*s!BH98/(s!BB98*s!BH98+s!BD98*s!BF98))+IF(s!BB98*s!BI98+s!BC98*s!BH98+s!BD98*s!BG98+s!BE98*s!BF98=0,0,N99*s!BB98*s!BI98/(s!BB98*s!BI98+s!BC98*s!BH98+s!BD98*s!BG98+s!BE98*s!BF98)
)) -> 223.76658467258829 | BC99: =AL99+IF(s!BC98*s!BD98+s!BB98*s!BE98=0,0,E99*s!BC98*s!BD98/(s!BC98*s!BD98+s!BB98*s!BE98))+IF(s!BB98*s!BG98+s!BC98*s!BF98=0,0,K99*s!BC98*s!BF98/(s!BB98*s!BG98+s!BC98*s!BF98))+IF(s!BC98*s!BI98+s!BE98*s!BG98=0,0,O99*s!BC98*s!BI98/(s!BC98*s!BI98+s!BE98*s!BG98))+IF(s!BB98*s!BI98+s!BC98*s!BH98+s!BD98*s!BG98+s!BE98*s!BF98=0,0,N99*s!BC98*s!BH98/(s!BB98*s!BI98+s!BC98*s!BH98+s!BD98*s!BG98+s!BE98*s!BF98)) -> 11.386767415480566 | BD99: =AM99+IF(s!BC98*s!BD98+s!BB98*s!BE98=0,0,E99*s!BC98*s!BD98/(s!BC98*s!BD98+s!BB98*s!BE98))+IF(s!BD98*s!BF98+s!BB98*s!BH98=0,0,M99*s!BD98*s!BF98/(s!BD98*s!BF98+s!BB98*s!BH98))+IF(s!BD98*s!BI98+s!BE98*s!BH98=0,0,Q99*s!BD98*s!BI98/(s!BD98*s!BI98+s!BE98*s!BH98))+IF(s!BB98*s!BI98+s!BC98*s!BH98+s!BD98*s!BG98+s!BE98*s!BF98=0,0,N99*s!BD98*s!BG98/(s!BB98*s!BI98+s!BC98*s!BH98+s!BD98*s!BG98+s!BE98*s!BF98)) -> 10.11974033735232 | BE99: =AN99+IF(s!BB98*s!BE98+s!BC98*s!BD98=0,0,E99*s!BB98*s!BE98/(s!BB98*s!BE98+s!BC98*s!BD98))+IF(s!BC98*s!BI98+s!BE98*s!BG98=0,0,O99*s!BE98*s!BG98/(s!BC98*s!BI98+s!BE98*s!BG98))+IF(s!BD98*s!BI98+s!BE98*s!BH98=0,0,Q99*s!BE98*s!BH98/(s!BD98*s!BI98+s!BE98*s!BH98))+IF(s!BB98*s!BI98+s!BC98*s!BH98+s!BD98*s!BG98+s!BE98*s!BF98=0,0,N99*s!BE98*s!BF98/(s!BB98*s!BI98+s!BC98*s!BH98+s!BD98*s!BG98+s!BE98*s!BF98)) -> 16.726907574578817 | BF99: =AO99+IF(s!BB98*s!BG98+s!BC98*s!BF98=0,0,K99*s!BC98*s!BF98/(s!BB98*s!BG98+s!BC98*s!BF98))+IF(s!BD98*s!BF98+s!BB98*s!BH98=0,0,M99*s!BD98*s!BF98/(s!BD98*s!BF98+s!BB98*s!BH98))+IF(s!BF98*s!BI98+s!BG98*s!BH98=0,0,W99*s!BF98*s!BI98/(s!BF98*s!BI98+s!BG98*s!BH98))+IF(s!BB98*s!BI98+s!BC98*s!BH98+s!BD98*s!BG98+s!BE98*s!BF98=0,0,N99*s!BE98*s!BF98/(s!BB98*s!BI98+s!BC98*s!BH98+s!BD98*s!BG98+s!BE98*s!BF98)) -> 10.141959884837059 | BG99: =AP99+IF(s!BB98*s!BG98+s!BC98*s!BF98=0,0,K99*s!BB98*s!BG98/(s!BB98*s!BG98+s!BC98*s!BF98))+IF(s!BC98*s!BI98+s!BE98*s!BG98=0,0,O99*s!BE98*s!BG98/(s!BC98*s!BI98+s!BE98*s!BG98))+IF(s!BF98*s!BI98+s!BG98*s!BH98=0,0,W99*s!BG98*s!BH98/(s!BF98*s!BI98+s!BG98*s!BH98))+IF(s!BB98*s!BI98+s!BC98*s!BH98+s!BD98*s!BG98+s!BE98*s!BF98=0,0,N99*s!BD98*s!BG98/(s!BB98*s!BI98+s!BC98*s!BH98+s!BD98*s!BG98+s!BE98*s!BF98)) -> 15.704688027094081 | BH99: =AQ99+IF(s!BB98*s!BH98+s!BD98*s!BF98=0,0,M99*s!BB98*s!BH98/(s!BB98*s!BH98+s!BD98*s!BF98))+IF(s!BD98*s!BI98+s!BE98*s!BH98=0,0,Q99*s!BE98*s!BH98/(s!BD98*s!BI98+s!BE98*s!BH98))+IF(s!BF98*s!BI98+s!BG98*s!BH98=0,0,W99*s!BG98*s!BH98/(s!BF98*s!BI98+s!BG98*s!BH98))+IF(s!BB98*s!BI98+s!BC98*s!BH98+s!BD98*s!BG98+s!BE98*s!BF98=0,0,N99*s!BC98*s!BH98/(s!BB98*s!BI98+s!BC98*s!BH98+s!BD98*s!BG98+s!BE98*s!BF98)) -> 17.971715105222327 | BI99: =AR99+IF(s!BC98*s!BI98+s!BE98*s!BG98=0,0,O99*s!BC98*s!BI98/(s!BC98*s!BI98+s!BE98*s!BG98))+IF(s!BD98*s!BI98+s!BE98*s!BH98=0,0,Q99*s!BD98*s!BI98/(s!BD98*s!BI98+s!BE98*s!BH98))+IF(s!BF98*s!BI98+s!BG98*s!BH98=0,0,W99*s!BF98*s!BI98/(s!BF98*s!BI98+s!BG98*s!BH98))+IF(s!BB98*s!BI98+s!BC98*s!BH98+s!BD98*s!BG98+s!BE98*s!BF98=0,0,N99*s!BB98*s!BI98/(s!BB98*s!BI98+s!BC98*s!BH98+s!BD98*s!BG98+s!BE98*s!BF98)) -> 20.181636982846534 | BJ99: =SUM(BB99:BI99) -> 326
A100: =A99 -> 100 | B100: =B99 -> 1 | C100: =C99 -> 1 | D100: =D99 -> 2 | E100: =E99 -> 5 | F100: =F99 -> 2 | G100: =G99 -> 1 | H100: =H99 -> 2 | I100: =I99 -> 1 | J100: =J99 -> 2 | K100: =K99 -> 4 | L100: =L99 -> 2 | M100: =M99 -> 4 | N100: =N99 -> 8 | O100: =O99 -> 4 | P100: =P99 -> 2 | Q100: =Q99 -> 4 | R100: =R99 -> 2 | S100: =S99 -> 1 | T100: =T99 -> 2 | U100: =U99 -> 1 | V100: =V99 -> 2 | W100: =W99 -> 4 | X100: =X99 -> 2 | Y100: =Y99 -> 1 | Z100: =Z99 -> 2 | AA100: =AA99 -> 1 | AB100: =AB99 -> 163 | AK100: =AK99 -> 205 | AL100: =AL99 -> 7 | AM100: =AM99 -> 8 | AN100: =AN99 -> 8 | AO100: =AO99 -> 8 | AP100: =AP99 -> 8 | AQ100: =AQ99 -> 8 | AR100: =AR99 -> 8 | AS100: =AS99 -> 260 | BB100: =AK100+IF(s!BB99*s!BE99+s!BC99*s!BD99=0,0,E100*s!BB99*s!BE99/(s!BB99*s!BE99+s!BC99*s!BD99)+IF(s!BB99*s!BG99+s!BC99*s!BF99=0,0,K100*s!BB99*s!BG99/(s!BB99*s!BG99+s!BC99*s!BF99))+IF(s!BB99*s!BH99+s!BD99*s!BF99=0,0,M100*s!BB99*s!BH99/(s!BB99*s!BH99+s!BD99*s!BF99))+IF(s!BB99*s!BI99+s!BC99*s!BH99+s!BD99*s!BG99+s!BE99*s!BF99=0,0,N100*s!BB99*s!BI99/(s!BB99*s!BI99+s!BC99*s!BH99+s!BD99*s!BG99+s!BE99*s!BF99)
)) -> 223.76658467258829 | BC100: =AL100+IF(s!BC99*s!BD99+s!BB99*s!BE99=0,0,E100*s!BC99*s!BD99/(s!BC99*s!BD99+s!BB99*s!BE99))+IF(s!BB99*s!BG99+s!BC99*s!BF99=0,0,K100*s!BC99*s!BF99/(s!BB99*s!BG99+s!BC99*s!BF99))+IF(s!BC99*s!BI99+s!BE99*s!BG99=0,0,O100*s!BC99*s!BI99/(s!BC99*s!BI99+s!BE99*s!BG99))+IF(s!BB99*s!BI99+s!BC99*s!BH99+s!BD99*s!BG99+s!BE99*s!BF99=0,0,N100*s!BC99*s!BH99/(s!BB99*s!BI99+s!BC99*s!BH99+s!BD99*s!BG99+s!BE99*s!BF99)) -> 11.386767415480566 | BD100: =AM100+IF(s!BC99*s!BD99+s!BB99*s!BE99=0,0,E100*s!BC99*s!BD99/(s!BC99*s!BD99+s!BB99*s!BE99))+IF(s!BD99*s!BF99+s!BB99*s!BH99=0,0,M100*s!BD99*s!BF99/(s!BD99*s!BF99+s!BB99*s!BH99))+IF(s!BD99*s!BI99+s!BE99*s!BH99=0,0,Q100*s!BD99*s!BI99/(s!BD99*s!BI99+s!BE99*s!BH99))+IF(s!BB99*s!BI99+s!BC99*s!BH99+s!BD99*s!BG99+s!BE99*s!BF99=0,0,N100*s!BD99*s!BG99/(s!BB99*s!BI99+s!BC99*s!BH99+s!BD99*s!BG99+s!BE99*s!BF99)) -> 10.119740337352319 | BE100: =AN100+IF(s!BB99*s!BE99+s!BC99*s!BD99=0,0,E100*s!BB99*s!BE99/(s!BB99*s!BE99+s!BC99*s!BD99))+IF(s!BC99*s!BI99+s!BE99*s!BG99=0,0,O100*s!BE99*s!BG99/(s!BC99*s!BI99+s!BE99*s!BG99))+IF(s!BD99*s!BI99+s!BE99*s!BH99=0,0,Q100*s!BE99*s!BH99/(s!BD99*s!BI99+s!BE99*s!BH99))+IF(s!BB99*s!BI99+s!BC99*s!BH99+s!BD99*s!BG99+s!BE99*s!BF99=0,0,N100*s!BE99*s!BF99/(s!BB99*s!BI99+s!BC99*s!BH99+s!BD99*s!BG99+s!BE99*s!BF99)) -> 16.726907574578824 | BF100: =AO100+IF(s!BB99*s!BG99+s!BC99*s!BF99=0,0,K100*s!BC99*s!BF99/(s!BB99*s!BG99+s!BC99*s!BF99))+IF(s!BD99*s!BF99+s!BB99*s!BH99=0,0,M100*s!BD99*s!BF99/(s!BD99*s!BF99+s!BB99*s!BH99))+IF(s!BF99*s!BI99+s!BG99*s!BH99=0,0,W100*s!BF99*s!BI99/(s!BF99*s!BI99+s!BG99*s!BH99))+IF(s!BB99*s!BI99+s!BC99*s!BH99+s!BD99*s!BG99+s!BE99*s!BF99=0,0,N100*s!BE99*s!BF99/(s!BB99*s!BI99+s!BC99*s!BH99+s!BD99*s!BG99+s!BE99*s!BF99)) -> 10.141959884837057 | BG100: =AP100+IF(s!BB99*s!BG99+s!BC99*s!BF99=0,0,K100*s!BB99*s!BG99/(s!BB99*s!BG99+s!BC99*s!BF99))+IF(s!BC99*s!BI99+s!BE99*s!BG99=0,0,O100*s!BE99*s!BG99/(s!BC99*s!BI99+s!BE99*s!BG99))+IF(s!BF99*s!BI99+s!BG99*s!BH99=0,0,W100*s!BG99*s!BH99/(s!BF99*s!BI99+s!BG99*s!BH99))+IF(s!BB99*s!BI99+s!BC99*s!BH99+s!BD99*s!BG99+s!BE99*s!BF99=0,0,N100*s!BD99*s!BG99/(s!BB99*s!BI99+s!BC99*s!BH99+s!BD99*s!BG99+s!BE99*s!BF99)) -> 15.704688027094084 | BH100: =AQ100+IF(s!BB99*s!BH99+s!BD99*s!BF99=0,0,M100*s!BB99*s!BH99/(s!BB99*s!BH99+s!BD99*s!BF99))+IF(s!BD99*s!BI99+s!BE99*s!BH99=0,0,Q100*s!BE99*s!BH99/(s!BD99*s!BI99+s!BE99*s!BH99))+IF(s!BF99*s!BI99+s!BG99*s!BH99=0,0,W100*s!BG99*s!BH99/(s!BF99*s!BI99+s!BG99*s!BH99))+IF(s!BB99*s!BI99+s!BC99*s!BH99+s!BD99*s!BG99+s!BE99*s!BF99=0,0,N100*s!BC99*s!BH99/(s!BB99*s!BI99+s!BC99*s!BH99+s!BD99*s!BG99+s!BE99*s!BF99)) -> 17.971715105222337 | BI100: =AR100+IF(s!BC99*s!BI99+s!BE99*s!BG99=0,0,O100*s!BC99*s!BI99/(s!BC99*s!BI99+s!BE99*s!BG99))+IF(s!BD99*s!BI99+s!BE99*s!BH99=0,0,Q100*s!BD99*s!BI99/(s!BD99*s!BI99+s!BE99*s!BH99))+IF(s!BF99*s!BI99+s!BG99*s!BH99=0,0,W100*s!BF99*s!BI99/(s!BF99*s!BI99+s!BG99*s!BH99))+IF(s!BB99*s!BI99+s!BC99*s!BH99+s!BD99*s!BG99+s!BE99*s!BF99=0,0,N100*s!BB99*s!BI99/(s!BB99*s!BI99+s!BC99*s!BH99+s!BD99*s!BG99+s!BE99*s!BF99)) -> 20.181636982846527 | BJ100: =SUM(BB100:BI100) -> 326
A101: =A100 -> 100 | B101: =B100 -> 1 | C101: =C100 -> 1 | D101: =D100 -> 2 | E101: =E100 -> 5 | F101: =F100 -> 2 | G101: =G100 -> 1 | H101: =H100 -> 2 | I101: =I100 -> 1 | J101: =J100 -> 2 | K101: =K100 -> 4 | L101: =L100 -> 2 | M101: =M100 -> 4 | N101: =N100 -> 8 | O101: =O100 -> 4 | P101: =P100 -> 2 | Q101: =Q100 -> 4 | R101: =R100 -> 2 | S101: =S100 -> 1 | T101: =T100 -> 2 | U101: =U100 -> 1 | V101: =V100 -> 2 | W101: =W100 -> 4 | X101: =X100 -> 2 | Y101: =Y100 -> 1 | Z101: =Z100 -> 2 | AA101: =AA100 -> 1 | AB101: =AB100 -> 163 | AK101: =AK100 -> 205 | AL101: =AL100 -> 7 | AM101: =AM100 -> 8 | AN101: =AN100 -> 8 | AO101: =AO100 -> 8 | AP101: =AP100 -> 8 | AQ101: =AQ100 -> 8 | AR101: =AR100 -> 8 | AS101: =AS100 -> 260 | BB101: =AK101+IF(s!BB100*s!BE100+s!BC100*s!BD100=0,0,E101*s!BB100*s!BE100/(s!BB100*s!BE100+s!BC100*s!BD100)+IF(s!BB100*s!BG100+s!BC100*s!BF100=0,0,K101*s!BB100*s!BG100/(s!BB100*s!BG100+s!BC100*s!BF100))+IF(s!BB100*s!BH100+s!BD100*s!BF100=0,0,M101*s!BB100*s!BH100/(s!BB100*s!BH100+s!BD100*s!BF100))+IF(s!BB100*s!BI100+s!BC100*s!BH100+s!BD100*s!BG100+s!BE100*s!BF100=0,0,N101*s!BB100*s!BI100/(s!BB100*s!BI100+s!BC100*s!BH100+s!BD100*s!BG100+s!BE100*s!BF100)
)) -> 223.76658467258829 | BC101: =AL101+IF(s!BC100*s!BD100+s!BB100*s!BE100=0,0,E101*s!BC100*s!BD100/(s!BC100*s!BD100+s!BB100*s!BE100))+IF(s!BB100*s!BG100+s!BC100*s!BF100=0,0,K101*s!BC100*s!BF100/(s!BB100*s!BG100+s!BC100*s!BF100))+IF(s!BC100*s!BI100+s!BE100*s!BG100=0,0,O101*s!BC100*s!BI100/(s!BC100*s!BI100+s!BE100*s!BG100))+IF(s!BB100*s!BI100+s!BC100*s!BH100+s!BD100*s!BG100+s!BE100*s!BF100=0,0,N101*s!BC100*s!BH100/(s!BB100*s!BI100+s!BC100*s!BH100+s!BD100*s!BG100+s!BE100*s!BF100)) -> 11.386767415480566 | BD101: =AM101+IF(s!BC100*s!BD100+s!BB100*s!BE100=0,0,E101*s!BC100*s!BD100/(s!BC100*s!BD100+s!BB100*s!BE100))+IF(s!BD100*s!BF100+s!BB100*s!BH100=0,0,M101*s!BD100*s!BF100/(s!BD100*s!BF100+s!BB100*s!BH100))+IF(s!BD100*s!BI100+s!BE100*s!BH100=0,0,Q101*s!BD100*s!BI100/(s!BD100*s!BI100+s!BE100*s!BH100))+IF(s!BB100*s!BI100+s!BC100*s!BH100+s!BD100*s!BG100+s!BE100*s!BF100=0,0,N101*s!BD100*s!BG100/(s!BB100*s!BI100+s!BC100*s!BH100+s!BD100*s!BG100+s!BE100*s!BF100)) -> 10.119740337352315 | BE101: =AN101+IF(s!BB100*s!BE100+s!BC100*s!BD100=0,0,E101*s!BB100*s!BE100/(s!BB100*s!BE100+s!BC100*s!BD100))+IF(s!BC100*s!BI100+s!BE100*s!BG100=0,0,O101*s!BE100*s!BG100/(s!BC100*s!BI100+s!BE100*s!BG100))+IF(s!BD100*s!BI100+s!BE100*s!BH100=0,0,Q101*s!BE100*s!BH100/(s!BD100*s!BI100+s!BE100*s!BH100))+IF(s!BB100*s!BI100+s!BC100*s!BH100+s!BD100*s!BG100+s!BE100*s!BF100=0,0,N101*s!BE100*s!BF100/(s!BB100*s!BI100+s!BC100*s!BH100+s!BD100*s!BG100+s!BE100*s!BF100)) -> 16.726907574578828 | BF101: =AO101+IF(s!BB100*s!BG100+s!BC100*s!BF100=0,0,K101*s!BC100*s!BF100/(s!BB100*s!BG100+s!BC100*s!BF100))+IF(s!BD100*s!BF100+s!BB100*s!BH100=0,0,M101*s!BD100*s!BF100/(s!BD100*s!BF100+s!BB100*s!BH100))+IF(s!BF100*s!BI100+s!BG100*s!BH100=0,0,W101*s!BF100*s!BI100/(s!BF100*s!BI100+s!BG100*s!BH100))+IF(s!BB100*s!BI100+s!BC100*s!BH100+s!BD100*s!BG100+s!BE100*s!BF100=0,0,N101*s!BE100*s!BF100/(s!BB100*s!BI100+s!BC100*s!BH100+s!BD100*s!BG100+s!BE100*s!BF100)) -> 10.141959884837055 | BG101: =AP101+IF(s!BB100*s!BG100+s!BC100*s!BF100=0,0,K101*s!BB100*s!BG100/(s!BB100*s!BG100+s!BC100*s!BF100))+IF(s!BC100*s!BI100+s!BE100*s!BG100=0,0,O101*s!BE100*s!BG100/(s!BC100*s!BI100+s!BE100*s!BG100))+IF(s!BF100*s!BI100+s!BG100*s!BH100=0,0,W101*s!BG100*s!BH100/(s!BF100*s!BI100+s!BG100*s!BH100))+IF(s!BB100*s!BI100+s!BC100*s!BH100+s!BD100*s!BG100+s!BE100*s!BF100=0,0,N101*s!BD100*s!BG100/(s!BB100*s!BI100+s!BC100*s!BH100+s!BD100*s!BG100+s!BE100*s!BF100)) -> 15.704688027094088 | BH101: =AQ101+IF(s!BB100*s!BH100+s!BD100*s!BF100=0,0,M101*s!BB100*s!BH100/(s!BB100*s!BH100+s!BD100*s!BF100))+IF(s!BD100*s!BI100+s!BE100*s!BH100=0,0,Q101*s!BE100*s!BH100/(s!BD100*s!BI100+s!BE100*s!BH100))+IF(s!BF100*s!BI100+s!BG100*s!BH100=0,0,W101*s!BG100*s!BH100/(s!BF100*s!BI100+s!BG100*s!BH100))+IF(s!BB100*s!BI100+s!BC100*s!BH100+s!BD100*s!BG100+s!BE100*s!BF100=0,0,N101*s!BC100*s!BH100/(s!BB100*s!BI100+s!BC100*s!BH100+s!BD100*s!BG100+s!BE100*s!BF100)) -> 17.971715105222341 | BI101: =AR101+IF(s!BC100*s!BI100+s!BE100*s!BG100=0,0,O101*s!BC100*s!BI100/(s!BC100*s!BI100+s!BE100*s!BG100))+IF(s!BD100*s!BI100+s!BE100*s!BH100=0,0,Q101*s!BD100*s!BI100/(s!BD100*s!BI100+s!BE100*s!BH100))+IF(s!BF100*s!BI100+s!BG100*s!BH100=0,0,W101*s!BF100*s!BI100/(s!BF100*s!BI100+s!BG100*s!BH100))+IF(s!BB100*s!BI100+s!BC100*s!BH100+s!BD100*s!BG100+s!BE100*s!BF100=0,0,N101*s!BB100*s!BI100/(s!BB100*s!BI100+s!BC100*s!BH100+s!BD100*s!BG100+s!BE100*s!BF100)) -> 20.18163698284652 | BJ101: =SUM(BB101:BI101) -> 326
A102: =A101 -> 100 | B102: =B101 -> 1 | C102: =C101 -> 1 | D102: =D101 -> 2 | E102: =E101 -> 5 | F102: =F101 -> 2 | G102: =G101 -> 1 | H102: =H101 -> 2 | I102: =I101 -> 1 | J102: =J101 -> 2 | K102: =K101 -> 4 | L102: =L101 -> 2 | M102: =M101 -> 4 | N102: =N101 -> 8 | O102: =O101 -> 4 | P102: =P101 -> 2 | Q102: =Q101 -> 4 | R102: =R101 -> 2 | S102: =S101 -> 1 | T102: =T101 -> 2 | U102: =U101 -> 1 | V102: =V101 -> 2 | W102: =W101 -> 4 | X102: =X101 -> 2 | Y102: =Y101 -> 1 | Z102: =Z101 -> 2 | AA102: =AA101 -> 1 | AB102: =AB101 -> 163 | AK102: =AK101 -> 205 | AL102: =AL101 -> 7 | AM102: =AM101 -> 8 | AN102: =AN101 -> 8 | AO102: =AO101 -> 8 | AP102: =AP101 -> 8 | AQ102: =AQ101 -> 8 | AR102: =AR101 -> 8 | AS102: =AS101 -> 260 | BB102: =AK102+IF(s!BB101*s!BE101+s!BC101*s!BD101=0,0,E102*s!BB101*s!BE101/(s!BB101*s!BE101+s!BC101*s!BD101)+IF(s!BB101*s!BG101+s!BC101*s!BF101=0,0,K102*s!BB101*s!BG101/(s!BB101*s!BG101+s!BC101*s!BF101))+IF(s!BB101*s!BH101+s!BD101*s!BF101=0,0,M102*s!BB101*s!BH101/(s!BB101*s!BH101+s!BD101*s!BF101))+IF(s!BB101*s!BI101+s!BC101*s!BH101+s!BD101*s!BG101+s!BE101*s!BF101=0,0,N102*s!BB101*s!BI101/(s!BB101*s!BI101+s!BC101*s!BH101+s!BD101*s!BG101+s!BE101*s!BF101)
)) -> 223.76658467258829 | BC102: =AL102+IF(s!BC101*s!BD101+s!BB101*s!BE101=0,0,E102*s!BC101*s!BD101/(s!BC101*s!BD101+s!BB101*s!BE101))+IF(s!BB101*s!BG101+s!BC101*s!BF101=0,0,K102*s!BC101*s!BF101/(s!BB101*s!BG101+s!BC101*s!BF101))+IF(s!BC101*s!BI101+s!BE101*s!BG101=0,0,O102*s!BC101*s!BI101/(s!BC101*s!BI101+s!BE101*s!BG101))+IF(s!BB101*s!BI101+s!BC101*s!BH101+s!BD101*s!BG101+s!BE101*s!BF101=0,0,N102*s!BC101*s!BH101/(s!BB101*s!BI101+s!BC101*s!BH101+s!BD101*s!BG101+s!BE101*s!BF101)) -> 11.386767415480564 | BD102: =AM102+IF(s!BC101*s!BD101+s!BB101*s!BE101=0,0,E102*s!BC101*s!BD101/(s!BC101*s!BD101+s!BB101*s!BE101))+IF(s!BD101*s!BF101+s!BB101*s!BH101=0,0,M102*s!BD101*s!BF101/(s!BD101*s!BF101+s!BB101*s!BH101))+IF(s!BD101*s!BI101+s!BE101*s!BH101=0,0,Q102*s!BD101*s!BI101/(s!BD101*s!BI101+s!BE101*s!BH101))+IF(s!BB101*s!BI101+s!BC101*s!BH101+s!BD101*s!BG101+s!BE101*s!BF101=0,0,N102*s!BD101*s!BG101/(s!BB101*s!BI101+s!BC101*s!BH101+s!BD101*s!BG101+s!BE101*s!BF101)) -> 10.119740337352313 | BE102: =AN102+IF(s!BB101*s!BE101+s!BC101*s!BD101=0,0,E102*s!BB101*s!BE101/(s!BB101*s!BE101+s!BC101*s!BD101))+IF(s!BC101*s!BI101+s!BE101*s!BG101=0,0,O102*s!BE101*s!BG101/(s!BC101*s!BI101+s!BE101*s!BG101))+IF(s!BD101*s!BI101+s!BE101*s!BH101=0,0,Q102*s!BE101*s!BH101/(s!BD101*s!BI101+s!BE101*s!BH101))+IF(s!BB101*s!BI101+s!BC101*s!BH101+s!BD101*s!BG101+s!BE101*s!BF101=0,0,N102*s!BE101*s!BF101/(s!BB101*s!BI101+s!BC101*s!BH101+s!BD101*s!BG101+s!BE101*s!BF101)) -> 16.726907574578831 | BF102: =AO102+IF(s!BB101*s!BG101+s!BC101*s!BF101=0,0,K102*s!BC101*s!BF101/(s!BB101*s!BG101+s!BC101*s!BF101))+IF(s!BD101*s!BF101+s!BB101*s!BH101=0,0,M102*s!BD101*s!BF101/(s!BD101*s!BF101+s!BB101*s!BH101))+IF(s!BF101*s!BI101+s!BG101*s!BH101=0,0,W102*s!BF101*s!BI101/(s!BF101*s!BI101+s!BG101*s!BH101))+IF(s!BB101*s!BI101+s!BC101*s!BH101+s!BD101*s!BG101+s!BE101*s!BF101=0,0,N102*s!BE101*s!BF101/(s!BB101*s!BI101+s!BC101*s!BH101+s!BD101*s!BG101+s!BE101*s!BF101)) -> 10.141959884837055 | BG102: =AP102+IF(s!BB101*s!BG101+s!BC101*s!BF101=0,0,K102*s!BB101*s!BG101/(s!BB101*s!BG101+s!BC101*s!BF101))+IF(s!BC101*s!BI101+s!BE101*s!BG101=0,0,O102*s!BE101*s!BG101/(s!BC101*s!BI101+s!BE101*s!BG101))+IF(s!BF101*s!BI101+s!BG101*s!BH101=0,0,W102*s!BG101*s!BH101/(s!BF101*s!BI101+s!BG101*s!BH101))+IF(s!BB101*s!BI101+s!BC101*s!BH101+s!BD101*s!BG101+s!BE101*s!BF101=0,0,N102*s!BD101*s!BG101/(s!BB101*s!BI101+s!BC101*s!BH101+s!BD101*s!BG101+s!BE101*s!BF101)) -> 15.704688027094091 | BH102: =AQ102+IF(s!BB101*s!BH101+s!BD101*s!BF101=0,0,M102*s!BB101*s!BH101/(s!BB101*s!BH101+s!BD101*s!BF101))+IF(s!BD101*s!BI101+s!BE101*s!BH101=0,0,Q102*s!BE101*s!BH101/(s!BD101*s!BI101+s!BE101*s!BH101))+IF(s!BF101*s!BI101+s!BG101*s!BH101=0,0,W102*s!BG101*s!BH101/(s!BF101*s!BI101+s!BG101*s!BH101))+IF(s!BB101*s!BI101+s!BC101*s!BH101+s!BD101*s!BG101+s!BE101*s!BF101=0,0,N102*s!BC101*s!BH101/(s!BB101*s!BI101+s!BC101*s!BH101+s!BD101*s!BG101+s!BE101*s!BF101)) -> 17.971715105222344 | BI102: =AR102+IF(s!BC101*s!BI101+s!BE101*s!BG101=0,0,O102*s!BC101*s!BI101/(s!BC101*s!BI101+s!BE101*s!BG101))+IF(s!BD101*s!BI101+s!BE101*s!BH101=0,0,Q102*s!BD101*s!BI101/(s!BD101*s!BI101+s!BE101*s!BH101))+IF(s!BF101*s!BI101+s!BG101*s!BH101=0,0,W102*s!BF101*s!BI101/(s!BF101*s!BI101+s!BG101*s!BH101))+IF(s!BB101*s!BI101+s!BC101*s!BH101+s!BD101*s!BG101+s!BE101*s!BF101=0,0,N102*s!BB101*s!BI101/(s!BB101*s!BI101+s!BC101*s!BH101+s!BD101*s!BG101+s!BE101*s!BF101)) -> 20.181636982846509 | BJ102: =SUM(BB102:BI102) -> 326