A1: 観測カンソク数スウ | AC1: 確定カクテイ分ブン | AT1: 確定カクテイ＋推定スイテイ分ブン
A2: AABBCCDD | B2: AABBCCDd | C2: AABBCCdd | D2: AABBCcDD | E2: AABBCcDd | F2: AABBCcdd | G2: AABBccDD | H2: AABBccDd | I2: AABBccdd | J2: AABbCCDD | K2: AABbCCDd | L2: AABbCCdd | M2: AABbCcDD | N2: AABbCcDd | O2: AABbCcdd | P2: AABbccDD | Q2: AABbccDd | R2: AABbccdd | S2: AAbbCCDD | T2: AAbbCCDd | U2: AAbbCCdd | V2: AAbbCcDD | W2: AAbbCcDd | X2: AAbbCcdd | Y2: AAbbccDD | Z2: AAbbccDd | AA2: AAbbccdd | AB2: sum | AC2: ABCD | AD2: AB Cd | AE2: ABcD | AF2: ABcd | AG2: AbCD | AH2: AbCd | AI2: AbcD | AJ2: Abcd | AK2: aBCD | AL2: aB Cd | AM2: aBcD | AN2: aBcd | AO2: abCD | AP2: abCd | AQ2: abcD | AR2: abcd | AT2: ABCD | AU2: AB Cd | AV2: ABcD | AW2: ABcd | AX2: AbCD | AY2: AbCd | AZ2: AbcD | BA2: Abcd | BB2: aBCD | BC2: aB Cd | BD2: aBcD | BE2: aBcd | BF2: abCD | BG2: abCd | BH2: abcD | BI2: abcd
A3: =input!A3 -> 100 | B3: =input!B3 -> 30 | C3: =input!C3 -> 200 | D3: =input!D3 -> 2 | E3: =input!E3 -> 4 | F3: =input!F3 -> 1 | G3: =input!G3 -> 1 | H3: =input!H3 -> 2 | I3: =input!I3 -> 1 | J3: =input!J3 -> 2 | K3: =input!K3 -> 4 | L3: =input!L3 -> 2 | M3: =input!M3 -> 4 | N3: =input!N3 -> 8 | O3: =input!O3 -> 4 | P3: =input!P3 -> 2 | Q3: =input!Q3 -> 4 | R3: =input!R3 -> 2 | S3: =input!S3 -> 1 | T3: =input!T3 -> 2 | U3: =input!U3 -> 1 | V3: =input!V3 -> 2 | W3: =input!W3 -> 4 | X3: =input!X3 -> 2 | Y3: =input!Y3 -> 1 | Z3: =input!Z3 -> 2 | AA3: =input!AA3 -> 1 | AB3: =SUM(A3:AA3) -> 389 | AC3: =2*A3+B3+D3+J3 -> 234 | AD3: =B3+2*C3+F3+L3 -> 433 | AE3: =D3+2*G3+H3+P3 -> 8 | AF3: =F3+H3+2*I3+R3 -> 7 | AG3: =J3+2*S3+T3+V3 -> 8 | AH3: =L3+T3+2*U3+X3 -> 8 | AI3: =P3+V3+2*Y3+Z3 -> 8 | AJ3: =R3+X3+Z3+2*AA3 -> 8 | AS3: =SUM(AC3:AJ3) -> 714 | AT3: =AC3+E3*0.5+K3*0.5+M3*0.5+N3*0.25 -> 242 | AU3: =AD3+E3*0.5+K3*0.5+O3*0.5+N3*0.25 -> 441 | AV3: =AE3+E3*0.5+M3*0.5+Q3*0.5+N3*0.25 -> 16 | AW3: =AF3+E3*0.5+O3*0.5+Q3*0.5+N3*0.25 -> 15 | AX3: =AG3+K3*0.5+M3*0.5+W3*0.5+N3*0.25 -> 16 | AY3: =AH3+K3*0.5+O3*0.5+W3*0.5+N3*0.25 -> 16 | AZ3: =AI3+M3*0.5+Q3*0.5+W3*0.5+N3*0.25 -> 16 | BA3: =AJ3+O3*0.5+Q3*0.5+W3*0.5+N3*0.25 -> 16 | BJ3: =SUM(AT3:BA3) -> 778
A4: =A3 -> 100 | B4: =B3 -> 30 | C4: =C3 -> 200 | D4: =D3 -> 2 | E4: =E3 -> 4 | F4: =F3 -> 1 | G4: =G3 -> 1 | H4: =H3 -> 2 | I4: =I3 -> 1 | J4: =J3 -> 2 | K4: =K3 -> 4 | L4: =L3 -> 2 | M4: =M3 -> 4 | N4: =N3 -> 8 | O4: =O3 -> 4 | P4: =P3 -> 2 | Q4: =Q3 -> 4 | R4: =R3 -> 2 | S4: =S3 -> 1 | T4: =T3 -> 2 | U4: =U3 -> 1 | V4: =V3 -> 2 | W4: =W3 -> 4 | X4: =X3 -> 2 | Y4: =Y3 -> 1 | Z4: =Z3 -> 2 | AA4: =AA3 -> 1 | AB4: =AB3 -> 389 | AC4: =AC3 -> 234 | AD4: =AD3 -> 433 | AE4: =AE3 -> 8 | AF4: =AF3 -> 7 | AG4: =AG3 -> 8 | AH4: =AH3 -> 8 | AI4: =AI3 -> 8 | AJ4: =AJ3 -> 8 | AS4: =AS3 -> 714 | AT4: =AC4+IF(s!AT3*s!AW3+s!AU3*s!AV3=0,0,E4*s!AT3*s!AW3/(s!AT3*s!AW3+s!AU3*s!AV3))+IF(s!AT3*s!AY3+s!AU3*s!AX3=0,0,K4*s!AT3*s!AY3/(s!AT3*s!AY3+s!AU3*s!AX3))+IF(s!AT3*s!AZ3+s!AV3*s!AX3=0,0,M4*s!AT3*s!AZ3/(s!AT3*s!AZ3+s!AV3*s!AX3))+IF(s!AT3*s!BA3+s!AU3*s!AZ3+s!AV3*s!AY3+s!AW3*s!AX3=0,0,N4*s!AT3*s!BA3/(s!AT3*s!BA3+s!AU3*s!AZ3+s!AV3*s!AY3+s!AW3*s!AX3)) -> 244.1644150017006 | AU4: =AD4+IF(s!AU3*s!AV3+s!AT3*s!AW3=0,0,E4*s!AU3*s!AV3/(s!AU3*s!AV3+s!AT3*s!AW3))+IF(s!AT3*s!AY3+s!AU3*s!AX3=0,0,K4*s!AU3*s!AX3/(s!AT3*s!AY3+s!AU3*s!AX3))+IF(s!AU3*s!BA3+s!AW3*s!AY3=0,0,O4*s!AU3*s!BA3/(s!AU3*s!BA3+s!AW3*s!AY3))+IF(s!AT3*s!BA3+s!AU3*s!AZ3+s!AV3*s!AY3+s!AW3*s!AX3=0,0,N4*s!AU3*s!AZ3/(s!AT3*s!BA3+s!AU3*s!AZ3+s!AV3*s!AY3+s!AW3*s!AX3)) -> 445.67083248381846 | AV4: =AE4+IF(s!AU3*s!AV3+s!AT3*s!AW3=0,0,E4*s!AU3*s!AV3/(s!AU3*s!AV3+s!AT3*s!AW3))+IF(s!AV3*s!AX3+s!AT3*s!AZ3=0,0,M4*s!AV3*s!AX3/(s!AV3*s!AX3+s!AT3*s!AZ3))+IF(s!AV3*s!BA3+s!AW3*s!AZ3=0,0,Q4*s!AV3*s!BA3/(s!AV3*s!BA3+s!AW3*s!AZ3))+IF(s!AT3*s!BA3+s!AU3*s!AZ3+s!AV3*s!AY3+s!AW3*s!AX3=0,0,N4*s!AV3*s!AY3/(s!AT3*s!BA3+s!AU3*s!AZ3+s!AV3*s!AY3+s!AW3*s!AX3)) -> 12.98520917158473 | AW4: =AF4+IF(s!AT3*s!AW3+s!AU3*s!AV3=0,0,E4*s!AT3*s!AW3/(s!AT3*s!AW3+s!AU3*s!AV3))+IF(s!AU3*s!BA3+s!AW3*s!AY3=0,0,O4*s!AW3*s!AY3/(s!AU3*s!BA3+s!AW3*s!AY3))+IF(s!AV3*s!BA3+s!AW3*s!AZ3=0,0,Q4*s!AW3*s!AZ3/(s!AV3*s!BA3+s!AW3*s!AZ3))+IF(s!AT3*s!BA3+s!AU3*s!AZ3+s!AV3*s!AY3+s!AW3*s!AX3=0,0,N4*s!AW3*s!AX3/(s!AT3*s!BA3+s!AU3*s!AZ3+s!AV3*s!AY3+s!AW3*s!AX3)) -> 11.179543342896118 | AX4: =AG4+IF(s!AT3*s!AY3+s!AU3*s!AX3=0,0,K4*s!AU3*s!AX3/(s!AT3*s!AY3+s!AU3*s!AX3))+IF(s!AV3*s!AX3+s!AT3*s!AZ3=0,0,M4*s!AV3*s!AX3/(s!AV3*s!AX3+s!AT3*s!AZ3))+IF(s!AX3*s!BA3+s!AY3*s!AZ3=0,0,W4*s!AX3*s!BA3/(s!AX3*s!BA3+s!AY3*s!AZ3))+IF(s!AT3*s!BA3+s!AU3*s!AZ3+s!AV3*s!AY3+s!AW3*s!AX3=0,0,N4*s!AW3*s!AX3/(s!AT3*s!BA3+s!AU3*s!AZ3+s!AV3*s!AY3+s!AW3*s!AX3)) -> 12.987816526790212 | AY4: =AH4+IF(s!AT3*s!AY3+s!AU3*s!AX3=0,0,K4*s!AT3*s!AY3/(s!AT3*s!AY3+s!AU3*s!AX3))+IF(s!AU3*s!BA3+s!AW3*s!AY3=0,0,O4*s!AW3*s!AY3/(s!AU3*s!BA3+s!AW3*s!AY3))+IF(s!AX3*s!BA3+s!AY3*s!AZ3=0,0,W4*s!AY3*s!AZ3/(s!AX3*s!BA3+s!AY3*s!AZ3))+IF(s!AT3*s!BA3+s!AU3*s!AZ3+s!AV3*s!AY3+s!AW3*s!AX3=0,0,N4*s!AV3*s!AY3/(s!AT3*s!BA3+s!AU3*s!AZ3+s!AV3*s!AY3+s!AW3*s!AX3)) -> 12.176935987690634 | AZ4: =AI4+IF(s!AT3*s!AZ3+s!AV3*s!AX3=0,0,M4*s!AT3*s!AZ3/(s!AT3*s!AZ3+s!AV3*s!AX3))+IF(s!AV3*s!BA3+s!AW3*s!AZ3=0,0,Q4*s!AW3*s!AZ3/(s!AV3*s!BA3+s!AW3*s!AZ3))+IF(s!AX3*s!BA3+s!AY3*s!AZ3=0,0,W4*s!AY3*s!AZ3/(s!AX3*s!BA3+s!AY3*s!AZ3))+IF(s!AT3*s!BA3+s!AU3*s!AZ3+s!AV3*s!AY3+s!AW3*s!AX3=0,0,N4*s!AU3*s!AZ3/(s!AT3*s!BA3+s!AU3*s!AZ3+s!AV3*s!AY3+s!AW3*s!AX3)) -> 19.862559299924435 | BA4: =AJ4+IF(s!AU3*s!BA3+s!AW3*s!AY3=0,0,O4*s!AU3*s!BA3/(s!AU3*s!BA3+s!AW3*s!AY3))+IF(s!AV3*s!BA3+s!AW3*s!AZ3=0,0,Q4*s!AV3*s!BA3/(s!AV3*s!BA3+s!AW3*s!AZ3))+IF(s!AX3*s!BA3+s!AY3*s!AZ3=0,0,W4*s!AX3*s!BA3/(s!AX3*s!BA3+s!AY3*s!AZ3))+IF(s!AT3*s!BA3+s!AU3*s!AZ3+s!AV3*s!AY3+s!AW3*s!AX3=0,0,N4*s!AT3*s!BA3/(s!AT3*s!BA3+s!AU3*s!AZ3+s!AV3*s!AY3+s!AW3*s!AX3)) -> 18.97268818559472 | BJ4: =SUM(AT4:BA4) -> 778
A5: =A4 -> 100 | B5: =B4 -> 30 | C5: =C4 -> 200 | D5: =D4 -> 2 | E5: =E4 -> 4 | F5: =F4 -> 1 | G5: =G4 -> 1 | H5: =H4 -> 2 | I5: =I4 -> 1 | J5: =J4 -> 2 | K5: =K4 -> 4 | L5: =L4 -> 2 | M5: =M4 -> 4 | N5: =N4 -> 8 | O5: =O4 -> 4 | P5: =P4 -> 2 | Q5: =Q4 -> 4 | R5: =R4 -> 2 | S5: =S4 -> 1 | T5: =T4 -> 2 | U5: =U4 -> 1 | V5: =V4 -> 2 | W5: =W4 -> 4 | X5: =X4 -> 2 | Y5: =Y4 -> 1 | Z5: =Z4 -> 2 | AA5: =AA4 -> 1 | AB5: =AB4 -> 389 | AC5: =AC4 -> 234 | AD5: =AD4 -> 433 | AE5: =AE4 -> 8 | AF5: =AF4 -> 7 | AG5: =AG4 -> 8 | AH5: =AH4 -> 8 | AI5: =AI4 -> 8 | AJ5: =AJ4 -> 8 | AS5: =AS4 -> 714 | AT5: =AC5+IF(s!AT4*s!AW4+s!AU4*s!AV4=0,0,E5*s!AT4*s!AW4/(s!AT4*s!AW4+s!AU4*s!AV4))+IF(s!AT4*s!AY4+s!AU4*s!AX4=0,0,K5*s!AT4*s!AY4/(s!AT4*s!AY4+s!AU4*s!AX4))+IF(s!AT4*s!AZ4+s!AV4*s!AX4=0,0,M5*s!AT4*s!AZ4/(s!AT4*s!AZ4+s!AV4*s!AX4))+IF(s!AT4*s!BA4+s!AU4*s!AZ4+s!AV4*s!AY4+s!AW4*s!AX4=0,0,N5*s!AT4*s!BA4/(s!AT4*s!BA4+s!AU4*s!AZ4+s!AV4*s!AY4+s!AW4*s!AX4)) -> 244.68371543343986 | AU5: =AD5+IF(s!AU4*s!AV4+s!AT4*s!AW4=0,0,E5*s!AU4*s!AV4/(s!AU4*s!AV4+s!AT4*s!AW4))+IF(s!AT4*s!AY4+s!AU4*s!AX4=0,0,K5*s!AU4*s!AX4/(s!AT4*s!AY4+s!AU4*s!AX4))+IF(s!AU4*s!BA4+s!AW4*s!AY4=0,0,O5*s!AU4*s!BA4/(s!AU4*s!BA4+s!AW4*s!AY4))+IF(s!AT4*s!BA4+s!AU4*s!AZ4+s!AV4*s!AY4+s!AW4*s!AX4=0,0,N5*s!AU4*s!AZ4/(s!AT4*s!BA4+s!AU4*s!AZ4+s!AV4*s!AY4+s!AW4*s!AX4)) -> 445.78957043417944 | AV5: =AE5+IF(s!AU4*s!AV4+s!AT4*s!AW4=0,0,E5*s!AU4*s!AV4/(s!AU4*s!AV4+s!AT4*s!AW4))+IF(s!AV4*s!AX4+s!AT4*s!AZ4=0,0,M5*s!AV4*s!AX4/(s!AV4*s!AX4+s!AT4*s!AZ4))+IF(s!AV4*s!BA4+s!AW4*s!AZ4=0,0,Q5*s!AV4*s!BA4/(s!AV4*s!BA4+s!AW4*s!AZ4))+IF(s!AT4*s!BA4+s!AU4*s!AZ4+s!AV4*s!AY4+s!AW4*s!AX4=0,0,N5*s!AV4*s!AY4/(s!AT4*s!BA4+s!AU4*s!AZ4+s!AV4*s!AY4+s!AW4*s!AX4)) -> 12.967498138064341 | AW5: =AF5+IF(s!AT4*s!AW4+s!AU4*s!AV4=0,0,E5*s!AT4*s!AW4/(s!AT4*s!AW4+s!AU4*s!AV4))+IF(s!AU4*s!BA4+s!AW4*s!AY4=0,0,O5*s!AW4*s!AY4/(s!AU4*s!BA4+s!AW4*s!AY4))+IF(s!AV4*s!BA4+s!AW4*s!AZ4=0,0,Q5*s!AW4*s!AZ4/(s!AV4*s!BA4+s!AW4*s!AZ4))+IF(s!AT4*s!BA4+s!AU4*s!AZ4+s!AV4*s!AY4+s!AW4*s!AX4=0,0,N5*s!AW4*s!AX4/(s!AT4*s!BA4+s!AU4*s!AZ4+s!AV4*s!AY4+s!AW4*s!AX4)) -> 10.559215994316293 | AX5: =AG5+IF(s!AT4*s!AY4+s!AU4*s!AX4=0,0,K5*s!AU4*s!AX4/(s!AT4*s!AY4+s!AU4*s!AX4))+IF(s!AV4*s!AX4+s!AT4*s!AZ4=0,0,M5*s!AV4*s!AX4/(s!AV4*s!AX4+s!AT4*s!AZ4))+IF(s!AX4*s!BA4+s!AY4*s!AZ4=0,0,W5*s!AX4*s!BA4/(s!AX4*s!BA4+s!AY4*s!AZ4))+IF(s!AT4*s!BA4+s!AU4*s!AZ4+s!AV4*s!AY4+s!AW4*s!AX4=0,0,N5*s!AW4*s!AX4/(s!AT4*s!BA4+s!AU4*s!AZ4+s!AV4*s!AY4+s!AW4*s!AX4)) -> 13.027762110842692 | AY5: =AH5+IF(s!AT4*s!AY4+s!AU4*s!AX4=0,0,K5*s!AT4*s!AY4/(s!AT4*s!AY4+s!AU4*s!AX4))+IF(s!AU4*s!BA4+s!AW4*s!AY4=0,0,O5*s!AW4*s!AY4/(s!AU4*s!BA4+s!AW4*s!AY4))+IF(s!AX4*s!BA4+s!AY4*s!AZ4=0,0,W5*s!AY4*s!AZ4/(s!AX4*s!BA4+s!AY4*s!AZ4))+IF(s!AT4*s!BA4+s!AU4*s!AZ4+s!AV4*s!AY4+s!AW4*s!AX4=0,0,N5*s!AV4*s!AY4/(s!AT4*s!BA4+s!AU4*s!AZ4+s!AV4*s!AY4+s!AW4*s!AX4)) -> 11.498952021537942 | AZ5: =AI5+IF(s!AT4*s!AZ4+s!AV4*s!AX4=0,0,M5*s!AT4*s!AZ4/(s!AT4*s!AZ4+s!AV4*s!AX4))+IF(s!AV4*s!BA4+s!AW4*s!AZ4=0,0,Q5*s!AW4*s!AZ4/(s!AV4*s!BA4+s!AW4*s!AZ4))+IF(s!AX4*s!BA4+s!AY4*s!AZ4=0,0,W5*s!AY4*s!AZ4/(s!AX4*s!BA4+s!AY4*s!AZ4))+IF(s!AT4*s!BA4+s!AU4*s!AZ4+s!AV4*s!AY4+s!AW4*s!AX4=0,0,N5*s!AU4*s!AZ4/(s!AT4*s!BA4+s!AU4*s!AZ4+s!AV4*s!AY4+s!AW4*s!AX4)) -> 19.321024317653109 | BA5: =AJ5+IF(s!AU4*s!BA4+s!AW4*s!AY4=0,0,O5*s!AU4*s!BA4/(s!AU4*s!BA4+s!AW4*s!AY4))+IF(s!AV4*s!BA4+s!AW4*s!AZ4=0,0,Q5*s!AV4*s!BA4/(s!AV4*s!BA4+s!AW4*s!AZ4))+IF(s!AX4*s!BA4+s!AY4*s!AZ4=0,0,W5*s!AX4*s!BA4/(s!AX4*s!BA4+s!AY4*s!AZ4))+IF(s!AT4*s!BA4+s!AU4*s!AZ4+s!AV4*s!AY4+s!AW4*s!AX4=0,0,N5*s!AT4*s!BA4/(s!AT4*s!BA4+s!AU4*s!AZ4+s!AV4*s!AY4+s!AW4*s!AX4)) -> 20.152261549966255 | BJ5: =SUM(AT5:BA5) -> 778
A6: =A5 -> 100 | B6: =B5 -> 30 | C6: =C5 -> 200 | D6: =D5 -> 2 | E6: =E5 -> 4 | F6: =F5 -> 1 | G6: =G5 -> 1 | H6: =H5 -> 2 | I6: =I5 -> 1 | J6: =J5 -> 2 | K6: =K5 -> 4 | L6: =L5 -> 2 | M6: =M5 -> 4 | N6: =N5 -> 8 | O6: =O5 -> 4 | P6: =P5 -> 2 | Q6: =Q5 -> 4 | R6: =R5 -> 2 | S6: =S5 -> 1 | T6: =T5 -> 2 | U6: =U5 -> 1 | V6: =V5 -> 2 | W6: =W5 -> 4 | X6: =X5 -> 2 | Y6: =Y5 -> 1 | Z6: =Z5 -> 2 | AA6: =AA5 -> 1 | AB6: =AB5 -> 389 | AC6: =AC5 -> 234 | AD6: =AD5 -> 433 | AE6: =AE5 -> 8 | AF6: =AF5 -> 7 | AG6: =AG5 -> 8 | AH6: =AH5 -> 8 | AI6: =AI5 -> 8 | AJ6: =AJ5 -> 8 | AS6: =AS5 -> 714 | AT6: =AC6+IF(s!AT5*s!AW5+s!AU5*s!AV5=0,0,E6*s!AT5*s!AW5/(s!AT5*s!AW5+s!AU5*s!AV5))+IF(s!AT5*s!AY5+s!AU5*s!AX5=0,0,K6*s!AT5*s!AY5/(s!AT5*s!AY5+s!AU5*s!AX5))+IF(s!AT5*s!AZ5+s!AV5*s!AX5=0,0,M6*s!AT5*s!AZ5/(s!AT5*s!AZ5+s!AV5*s!AX5))+IF(s!AT5*s!BA5+s!AU5*s!AZ5+s!AV5*s!AY5+s!AW5*s!AX5=0,0,N6*s!AT5*s!BA5/(s!AT5*s!BA5+s!AU5*s!AZ5+s!AV5*s!AY5+s!AW5*s!AX5)) -> 244.73554250292358 | AU6: =AD6+IF(s!AU5*s!AV5+s!AT5*s!AW5=0,0,E6*s!AU5*s!AV5/(s!AU5*s!AV5+s!AT5*s!AW5))+IF(s!AT5*s!AY5+s!AU5*s!AX5=0,0,K6*s!AU5*s!AX5/(s!AT5*s!AY5+s!AU5*s!AX5))+IF(s!AU5*s!BA5+s!AW5*s!AY5=0,0,O6*s!AU5*s!BA5/(s!AU5*s!BA5+s!AW5*s!AY5))+IF(s!AT5*s!BA5+s!AU5*s!AZ5+s!AV5*s!AY5+s!AW5*s!AX5=0,0,N6*s!AU5*s!AZ5/(s!AT5*s!BA5+s!AU5*s!AZ5+s!AV5*s!AY5+s!AW5*s!AX5)) -> 445.76781000806068 | AV6: =AE6+IF(s!AU5*s!AV5+s!AT5*s!AW5=0,0,E6*s!AU5*s!AV5/(s!AU5*s!AV5+s!AT5*s!AW5))+IF(s!AV5*s!AX5+s!AT5*s!AZ5=0,0,M6*s!AV5*s!AX5/(s!AV5*s!AX5+s!AT5*s!AZ5))+IF(s!AV5*s!BA5+s!AW5*s!AZ5=0,0,Q6*s!AV5*s!BA5/(s!AV5*s!BA5+s!AW5*s!AZ5))+IF(s!AT5*s!BA5+s!AU5*s!AZ5+s!AV5*s!AY5+s!AW5*s!AX5=0,0,N6*s!AV5*s!AY5/(s!AT5*s!BA5+s!AU5*s!AZ5+s!AV5*s!AY5+s!AW5*s!AX5)) -> 13.245225732111717 | AW6: =AF6+IF(s!AT5*s!AW5+s!AU5*s!AV5=0,0,E6*s!AT5*s!AW5/(s!AT5*s!AW5+s!AU5*s!AV5))+IF(s!AU5*s!BA5+s!AW5*s!AY5=0,0,O6*s!AW5*s!AY5/(s!AU5*s!BA5+s!AW5*s!AY5))+IF(s!AV5*s!BA5+s!AW5*s!AZ5=0,0,Q6*s!AW5*s!AZ5/(s!AV5*s!BA5+s!AW5*s!AZ5))+IF(s!AT5*s!BA5+s!AU5*s!AZ5+s!AV5*s!AY5+s!AW5*s!AX5=0,0,N6*s!AW5*s!AX5/(s!AT5*s!BA5+s!AU5*s!AZ5+s!AV5*s!AY5+s!AW5*s!AX5)) -> 10.251421756904081 | AX6: =AG6+IF(s!AT5*s!AY5+s!AU5*s!AX5=0,0,K6*s!AU5*s!AX5/(s!AT5*s!AY5+s!AU5*s!AX5))+IF(s!AV5*s!AX5+s!AT5*s!AZ5=0,0,M6*s!AV5*s!AX5/(s!AV5*s!AX5+s!AT5*s!AZ5))+IF(s!AX5*s!BA5+s!AY5*s!AZ5=0,0,W6*s!AX5*s!BA5/(s!AX5*s!BA5+s!AY5*s!AZ5))+IF(s!AT5*s!BA5+s!AU5*s!AZ5+s!AV5*s!AY5+s!AW5*s!AX5=0,0,N6*s!AW5*s!AX5/(s!AT5*s!BA5+s!AU5*s!AZ5+s!AV5*s!AY5+s!AW5*s!AX5)) -> 13.313323896852516 | AY6: =AH6+IF(s!AT5*s!AY5+s!AU5*s!AX5=0,0,K6*s!AT5*s!AY5/(s!AT5*s!AY5+s!AU5*s!AX5))+IF(s!AU5*s!BA5+s!AW5*s!AY5=0,0,O6*s!AW5*s!AY5/(s!AU5*s!BA5+s!AW5*s!AY5))+IF(s!AX5*s!BA5+s!AY5*s!AZ5=0,0,W6*s!AY5*s!AZ5/(s!AX5*s!BA5+s!AY5*s!AZ5))+IF(s!AT5*s!BA5+s!AU5*s!AZ5+s!AV5*s!AY5+s!AW5*s!AX5=0,0,N6*s!AV5*s!AY5/(s!AT5*s!BA5+s!AU5*s!AZ5+s!AV5*s!AY5+s!AW5*s!AX5)) -> 11.183323592163283 | AZ6: =AI6+IF(s!AT5*s!AZ5+s!AV5*s!AX5=0,0,M6*s!AT5*s!AZ5/(s!AT5*s!AZ5+s!AV5*s!AX5))+IF(s!AV5*s!BA5+s!AW5*s!AZ5=0,0,Q6*s!AW5*s!AZ5/(s!AV5*s!BA5+s!AW5*s!AZ5))+IF(s!AX5*s!BA5+s!AY5*s!AZ5=0,0,W6*s!AY5*s!AZ5/(s!AX5*s!BA5+s!AY5*s!AZ5))+IF(s!AT5*s!BA5+s!AU5*s!AZ5+s!AV5*s!AY5+s!AW5*s!AX5=0,0,N6*s!AU5*s!AZ5/(s!AT5*s!BA5+s!AU5*s!AZ5+s!AV5*s!AY5+s!AW5*s!AX5)) -> 18.705907868112195 | BA6: =AJ6+IF(s!AU5*s!BA5+s!AW5*s!AY5=0,0,O6*s!AU5*s!BA5/(s!AU5*s!BA5+s!AW5*s!AY5))+IF(s!AV5*s!BA5+s!AW5*s!AZ5=0,0,Q6*s!AV5*s!BA5/(s!AV5*s!BA5+s!AW5*s!AZ5))+IF(s!AX5*s!BA5+s!AY5*s!AZ5=0,0,W6*s!AX5*s!BA5/(s!AX5*s!BA5+s!AY5*s!AZ5))+IF(s!AT5*s!BA5+s!AU5*s!AZ5+s!AV5*s!AY5+s!AW5*s!AX5=0,0,N6*s!AT5*s!BA5/(s!AT5*s!BA5+s!AU5*s!AZ5+s!AV5*s!AY5+s!AW5*s!AX5)) -> 20.797444642872005 | BJ6: =SUM(AT6:BA6) -> 778
A7: =A6 -> 100 | B7: =B6 -> 30 | C7: =C6 -> 200 | D7: =D6 -> 2 | E7: =E6 -> 4 | F7: =F6 -> 1 | G7: =G6 -> 1 | H7: =H6 -> 2 | I7: =I6 -> 1 | J7: =J6 -> 2 | K7: =K6 -> 4 | L7: =L6 -> 2 | M7: =M6 -> 4 | N7: =N6 -> 8 | O7: =O6 -> 4 | P7: =P6 -> 2 | Q7: =Q6 -> 4 | R7: =R6 -> 2 | S7: =S6 -> 1 | T7: =T6 -> 2 | U7: =U6 -> 1 | V7: =V6 -> 2 | W7: =W6 -> 4 | X7: =X6 -> 2 | Y7: =Y6 -> 1 | Z7: =Z6 -> 2 | AA7: =AA6 -> 1 | AB7: =AB6 -> 389 | AC7: =AC6 -> 234 | AD7: =AD6 -> 433 | AE7: =AE6 -> 8 | AF7: =AF6 -> 7 | AG7: =AG6 -> 8 | AH7: =AH6 -> 8 | AI7: =AI6 -> 8 | AJ7: =AJ6 -> 8 | AS7: =AS6 -> 714 | AT7: =AC7+IF(s!AT6*s!AW6+s!AU6*s!AV6=0,0,E7*s!AT6*s!AW6/(s!AT6*s!AW6+s!AU6*s!AV6))+IF(s!AT6*s!AY6+s!AU6*s!AX6=0,0,K7*s!AT6*s!AY6/(s!AT6*s!AY6+s!AU6*s!AX6))+IF(s!AT6*s!AZ6+s!AV6*s!AX6=0,0,M7*s!AT6*s!AZ6/(s!AT6*s!AZ6+s!AV6*s!AX6))+IF(s!AT6*s!BA6+s!AU6*s!AZ6+s!AV6*s!AY6+s!AW6*s!AX6=0,0,N7*s!AT6*s!BA6/(s!AT6*s!BA6+s!AU6*s!AZ6+s!AV6*s!AY6+s!AW6*s!AX6)) -> 244.71127179254688 | AU7: =AD7+IF(s!AU6*s!AV6+s!AT6*s!AW6=0,0,E7*s!AU6*s!AV6/(s!AU6*s!AV6+s!AT6*s!AW6))+IF(s!AT6*s!AY6+s!AU6*s!AX6=0,0,K7*s!AU6*s!AX6/(s!AT6*s!AY6+s!AU6*s!AX6))+IF(s!AU6*s!BA6+s!AW6*s!AY6=0,0,O7*s!AU6*s!BA6/(s!AU6*s!BA6+s!AW6*s!AY6))+IF(s!AT6*s!BA6+s!AU6*s!AZ6+s!AV6*s!AY6+s!AW6*s!AX6=0,0,N7*s!AU6*s!AZ6/(s!AT6*s!BA6+s!AU6*s!AZ6+s!AV6*s!AY6+s!AW6*s!AX6)) -> 445.7718313371671 | AV7: =AE7+IF(s!AU6*s!AV6+s!AT6*s!AW6=0,0,E7*s!AU6*s!AV6/(s!AU6*s!AV6+s!AT6*s!AW6))+IF(s!AV6*s!AX6+s!AT6*s!AZ6=0,0,M7*s!AV6*s!AX6/(s!AV6*s!AX6+s!AT6*s!AZ6))+IF(s!AV6*s!BA6+s!AW6*s!AZ6=0,0,Q7*s!AV6*s!BA6/(s!AV6*s!BA6+s!AW6*s!AZ6))+IF(s!AT6*s!BA6+s!AU6*s!AZ6+s!AV6*s!AY6+s!AW6*s!AX6=0,0,N7*s!AV6*s!AY6/(s!AT6*s!BA6+s!AU6*s!AZ6+s!AV6*s!AY6+s!AW6*s!AX6)) -> 13.470509323050178 | AW7: =AF7+IF(s!AT6*s!AW6+s!AU6*s!AV6=0,0,E7*s!AT6*s!AW6/(s!AT6*s!AW6+s!AU6*s!AV6))+IF(s!AU6*s!BA6+s!AW6*s!AY6=0,0,O7*s!AW6*s!AY6/(s!AU6*s!BA6+s!AW6*s!AY6))+IF(s!AV6*s!BA6+s!AW6*s!AZ6=0,0,Q7*s!AW6*s!AZ6/(s!AV6*s!BA6+s!AW6*s!AZ6))+IF(s!AT6*s!BA6+s!AU6*s!AZ6+s!AV6*s!AY6+s!AW6*s!AX6=0,0,N7*s!AW6*s!AX6/(s!AT6*s!BA6+s!AU6*s!AZ6+s!AV6*s!AY6+s!AW6*s!AX6)) -> 10.04638754723578 | AX7: =AG7+IF(s!AT6*s!AY6+s!AU6*s!AX6=0,0,K7*s!AU6*s!AX6/(s!AT6*s!AY6+s!AU6*s!AX6))+IF(s!AV6*s!AX6+s!AT6*s!AZ6=0,0,M7*s!AV6*s!AX6/(s!AV6*s!AX6+s!AT6*s!AZ6))+IF(s!AX6*s!BA6+s!AY6*s!AZ6=0,0,W7*s!AX6*s!BA6/(s!AX6*s!BA6+s!AY6*s!AZ6))+IF(s!AT6*s!BA6+s!AU6*s!AZ6+s!AV6*s!AY6+s!AW6*s!AX6=0,0,N7*s!AW6*s!AX6/(s!AT6*s!BA6+s!AU6*s!AZ6+s!AV6*s!AY6+s!AW6*s!AX6)) -> 13.532165215273388 | AY7: =AH7+IF(s!AT6*s!AY6+s!AU6*s!AX6=0,0,K7*s!AT6*s!AY6/(s!AT6*s!AY6+s!AU6*s!AX6))+IF(s!AU6*s!BA6+s!AW6*s!AY6=0,0,O7*s!AW6*s!AY6/(s!AU6*s!BA6+s!AW6*s!AY6))+IF(s!AX6*s!BA6+s!AY6*s!AZ6=0,0,W7*s!AY6*s!AZ6/(s!AX6*s!BA6+s!AY6*s!AZ6))+IF(s!AT6*s!BA6+s!AU6*s!AZ6+s!AV6*s!AY6+s!AW6*s!AX6=0,0,N7*s!AV6*s!AY6/(s!AT6*s!BA6+s!AU6*s!AZ6+s!AV6*s!AY6+s!AW6*s!AX6)) -> 10.984731655012572 | AZ7: =AI7+IF(s!AT6*s!AZ6+s!AV6*s!AX6=0,0,M7*s!AT6*s!AZ6/(s!AT6*s!AZ6+s!AV6*s!AX6))+IF(s!AV6*s!BA6+s!AW6*s!AZ6=0,0,Q7*s!AW6*s!AZ6/(s!AV6*s!BA6+s!AW6*s!AZ6))+IF(s!AX6*s!BA6+s!AY6*s!AZ6=0,0,W7*s!AY6*s!AZ6/(s!AX6*s!BA6+s!AY6*s!AZ6))+IF(s!AT6*s!BA6+s!AU6*s!AZ6+s!AV6*s!AY6+s!AW6*s!AX6=0,0,N7*s!AU6*s!AZ6/(s!AT6*s!BA6+s!AU6*s!AZ6+s!AV6*s!AY6+s!AW6*s!AX6)) -> 18.28605366912954 | BA7: =AJ7+IF(s!AU6*s!BA6+s!AW6*s!AY6=0,0,O7*s!AU6*s!BA6/(s!AU6*s!BA6+s!AW6*s!AY6))+IF(s!AV6*s!BA6+s!AW6*s!AZ6=0,0,Q7*s!AV6*s!BA6/(s!AV6*s!BA6+s!AW6*s!AZ6))+IF(s!AX6*s!BA6+s!AY6*s!AZ6=0,0,W7*s!AX6*s!BA6/(s!AX6*s!BA6+s!AY6*s!AZ6))+IF(s!AT6*s!BA6+s!AU6*s!AZ6+s!AV6*s!AY6+s!AW6*s!AX6=0,0,N7*s!AT6*s!BA6/(s!AT6*s!BA6+s!AU6*s!AZ6+s!AV6*s!AY6+s!AW6*s!AX6)) -> 21.197049460584498 | BJ7: =SUM(AT7:BA7) -> 778
A8: =A7 -> 100 | B8: =B7 -> 30 | C8: =C7 -> 200 | D8: =D7 -> 2 | E8: =E7 -> 4 | F8: =F7 -> 1 | G8: =G7 -> 1 | H8: =H7 -> 2 | I8: =I7 -> 1 | J8: =J7 -> 2 | K8: =K7 -> 4 | L8: =L7 -> 2 | M8: =M7 -> 4 | N8: =N7 -> 8 | O8: =O7 -> 4 | P8: =P7 -> 2 | Q8: =Q7 -> 4 | R8: =R7 -> 2 | S8: =S7 -> 1 | T8: =T7 -> 2 | U8: =U7 -> 1 | V8: =V7 -> 2 | W8: =W7 -> 4 | X8: =X7 -> 2 | Y8: =Y7 -> 1 | Z8: =Z7 -> 2 | AA8: =AA7 -> 1 | AB8: =AB7 -> 389 | AC8: =AC7 -> 234 | AD8: =AD7 -> 433 | AE8: =AE7 -> 8 | AF8: =AF7 -> 7 | AG8: =AG7 -> 8 | AH8: =AH7 -> 8 | AI8: =AI7 -> 8 | AJ8: =AJ7 -> 8 | AS8: =AS7 -> 714 | AT8: =AC8+IF(s!AT7*s!AW7+s!AU7*s!AV7=0,0,E8*s!AT7*s!AW7/(s!AT7*s!AW7+s!AU7*s!AV7))+IF(s!AT7*s!AY7+s!AU7*s!AX7=0,0,K8*s!AT7*s!AY7/(s!AT7*s!AY7+s!AU7*s!AX7))+IF(s!AT7*s!AZ7+s!AV7*s!AX7=0,0,M8*s!AT7*s!AZ7/(s!AT7*s!AZ7+s!AV7*s!AX7))+IF(s!AT7*s!BA7+s!AU7*s!AZ7+s!AV7*s!AY7+s!AW7*s!AX7=0,0,N8*s!AT7*s!BA7/(s!AT7*s!BA7+s!AU7*s!AZ7+s!AV7*s!AY7+s!AW7*s!AX7)) -> 244.68774366495003 | AU8: =AD8+IF(s!AU7*s!AV7+s!AT7*s!AW7=0,0,E8*s!AU7*s!AV7/(s!AU7*s!AV7+s!AT7*s!AW7))+IF(s!AT7*s!AY7+s!AU7*s!AX7=0,0,K8*s!AU7*s!AX7/(s!AT7*s!AY7+s!AU7*s!AX7))+IF(s!AU7*s!BA7+s!AW7*s!AY7=0,0,O8*s!AU7*s!BA7/(s!AU7*s!BA7+s!AW7*s!AY7))+IF(s!AT7*s!BA7+s!AU7*s!AZ7+s!AV7*s!AY7+s!AW7*s!AX7=0,0,N8*s!AU7*s!AZ7/(s!AT7*s!BA7+s!AU7*s!AZ7+s!AV7*s!AY7+s!AW7*s!AX7)) -> 445.77779963007958 | AV8: =AE8+IF(s!AU7*s!AV7+s!AT7*s!AW7=0,0,E8*s!AU7*s!AV7/(s!AU7*s!AV7+s!AT7*s!AW7))+IF(s!AV7*s!AX7+s!AT7*s!AZ7=0,0,M8*s!AV7*s!AX7/(s!AV7*s!AX7+s!AT7*s!AZ7))+IF(s!AV7*s!BA7+s!AW7*s!AZ7=0,0,Q8*s!AV7*s!BA7/(s!AV7*s!BA7+s!AW7*s!AZ7))+IF(s!AT7*s!BA7+s!AU7*s!AZ7+s!AV7*s!AY7+s!AW7*s!AX7=0,0,N8*s!AV7*s!AY7/(s!AT7*s!BA7+s!AU7*s!AZ7+s!AV7*s!AY7+s!AW7*s!AX7)) -> 13.627117322471813 | AW8: =AF8+IF(s!AT7*s!AW7+s!AU7*s!AV7=0,0,E8*s!AT7*s!AW7/(s!AT7*s!AW7+s!AU7*s!AV7))+IF(s!AU7*s!BA7+s!AW7*s!AY7=0,0,O8*s!AW7*s!AY7/(s!AU7*s!BA7+s!AW7*s!AY7))+IF(s!AV7*s!BA7+s!AW7*s!AZ7=0,0,Q8*s!AW7*s!AZ7/(s!AV7*s!BA7+s!AW7*s!AZ7))+IF(s!AT7*s!BA7+s!AU7*s!AZ7+s!AV7*s!AY7+s!AW7*s!AX7=0,0,N8*s!AW7*s!AX7/(s!AT7*s!BA7+s!AU7*s!AZ7+s!AV7*s!AY7+s!AW7*s!AX7)) -> 9.9073393824985772 | AX8: =AG8+IF(s!AT7*s!AY7+s!AU7*s!AX7=0,0,K8*s!AU7*s!AX7/(s!AT7*s!AY7+s!AU7*s!AX7))+IF(s!AV7*s!AX7+s!AT7*s!AZ7=0,0,M8*s!AV7*s!AX7/(s!AV7*s!AX7+s!AT7*s!AZ7))+IF(s!AX7*s!BA7+s!AY7*s!AZ7=0,0,W8*s!AX7*s!BA7/(s!AX7*s!BA7+s!AY7*s!AZ7))+IF(s!AT7*s!BA7+s!AU7*s!AZ7+s!AV7*s!AY7+s!AW7*s!AX7=0,0,N8*s!AW7*s!AX7/(s!AT7*s!BA7+s!AU7*s!AZ7+s!AV7*s!AY7+s!AW7*s!AX7)) -> 13.680934984107763 | AY8: =AH8+IF(s!AT7*s!AY7+s!AU7*s!AX7=0,0,K8*s!AT7*s!AY7/(s!AT7*s!AY7+s!AU7*s!AX7))+IF(s!AU7*s!BA7+s!AW7*s!AY7=0,0,O8*s!AW7*s!AY7/(s!AU7*s!BA7+s!AW7*s!AY7))+IF(s!AX7*s!BA7+s!AY7*s!AZ7=0,0,W8*s!AY7*s!AZ7/(s!AX7*s!BA7+s!AY7*s!AZ7))+IF(s!AT7*s!BA7+s!AU7*s!AZ7+s!AV7*s!AY7+s!AW7*s!AX7=0,0,N8*s!AV7*s!AY7/(s!AT7*s!BA7+s!AU7*s!AZ7+s!AV7*s!AY7+s!AW7*s!AX7)) -> 10.853521720862627 | AZ8: =AI8+IF(s!AT7*s!AZ7+s!AV7*s!AX7=0,0,M8*s!AT7*s!AZ7/(s!AT7*s!AZ7+s!AV7*s!AX7))+IF(s!AV7*s!BA7+s!AW7*s!AZ7=0,0,Q8*s!AW7*s!AZ7/(s!AV7*s!BA7+s!AW7*s!AZ7))+IF(s!AX7*s!BA7+s!AY7*s!AZ7=0,0,W8*s!AY7*s!AZ7/(s!AX7*s!BA7+s!AY7*s!AZ7))+IF(s!AT7*s!BA7+s!AU7*s!AZ7+s!AV7*s!AY7+s!AW7*s!AX7=0,0,N8*s!AU7*s!AZ7/(s!AT7*s!BA7+s!AU7*s!AZ7+s!AV7*s!AY7+s!AW7*s!AX7)) -> 18.004204028470383 | BA8: =AJ8+IF(s!AU7*s!BA7+s!AW7*s!AY7=0,0,O8*s!AU7*s!BA7/(s!AU7*s!BA7+s!AW7*s!AY7))+IF(s!AV7*s!BA7+s!AW7*s!AZ7=0,0,Q8*s!AV7*s!BA7/(s!AV7*s!BA7+s!AW7*s!AZ7))+IF(s!AX7*s!BA7+s!AY7*s!AZ7=0,0,W8*s!AX7*s!BA7/(s!AX7*s!BA7+s!AY7*s!AZ7))+IF(s!AT7*s!BA7+s!AU7*s!AZ7+s!AV7*s!AY7+s!AW7*s!AX7=0,0,N8*s!AT7*s!BA7/(s!AT7*s!BA7+s!AU7*s!AZ7+s!AV7*s!AY7+s!AW7*s!AX7)) -> 21.461339266559229 | BJ8: =SUM(AT8:BA8) -> 778
A9: =A8 -> 100 | B9: =B8 -> 30 | C9: =C8 -> 200 | D9: =D8 -> 2 | E9: =E8 -> 4 | F9: =F8 -> 1 | G9: =G8 -> 1 | H9: =H8 -> 2 | I9: =I8 -> 1 | J9: =J8 -> 2 | K9: =K8 -> 4 | L9: =L8 -> 2 | M9: =M8 -> 4 | N9: =N8 -> 8 | O9: =O8 -> 4 | P9: =P8 -> 2 | Q9: =Q8 -> 4 | R9: =R8 -> 2 | S9: =S8 -> 1 | T9: =T8 -> 2 | U9: =U8 -> 1 | V9: =V8 -> 2 | W9: =W8 -> 4 | X9: =X8 -> 2 | Y9: =Y8 -> 1 | Z9: =Z8 -> 2 | AA9: =AA8 -> 1 | AB9: =AB8 -> 389 | AC9: =AC8 -> 234 | AD9: =AD8 -> 433 | AE9: =AE8 -> 8 | AF9: =AF8 -> 7 | AG9: =AG8 -> 8 | AH9: =AH8 -> 8 | AI9: =AI8 -> 8 | AJ9: =AJ8 -> 8 | AS9: =AS8 -> 714 | AT9: =AC9+IF(s!AT8*s!AW8+s!AU8*s!AV8=0,0,E9*s!AT8*s!AW8/(s!AT8*s!AW8+s!AU8*s!AV8))+IF(s!AT8*s!AY8+s!AU8*s!AX8=0,0,K9*s!AT8*s!AY8/(s!AT8*s!AY8+s!AU8*s!AX8))+IF(s!AT8*s!AZ8+s!AV8*s!AX8=0,0,M9*s!AT8*s!AZ8/(s!AT8*s!AZ8+s!AV8*s!AX8))+IF(s!AT8*s!BA8+s!AU8*s!AZ8+s!AV8*s!AY8+s!AW8*s!AX8=0,0,N9*s!AT8*s!BA8/(s!AT8*s!BA8+s!AU8*s!AZ8+s!AV8*s!AY8+s!AW8*s!AX8)) -> 244.67301306977149 | AU9: =AD9+IF(s!AU8*s!AV8+s!AT8*s!AW8=0,0,E9*s!AU8*s!AV8/(s!AU8*s!AV8+s!AT8*s!AW8))+IF(s!AT8*s!AY8+s!AU8*s!AX8=0,0,K9*s!AU8*s!AX8/(s!AT8*s!AY8+s!AU8*s!AX8))+IF(s!AU8*s!BA8+s!AW8*s!AY8=0,0,O9*s!AU8*s!BA8/(s!AU8*s!BA8+s!AW8*s!AY8))+IF(s!AT8*s!BA8+s!AU8*s!AZ8+s!AV8*s!AY8+s!AW8*s!AX8=0,0,N9*s!AU8*s!AZ8/(s!AT8*s!BA8+s!AU8*s!AZ8+s!AV8*s!AY8+s!AW8*s!AX8)) -> 445.78074937254496 | AV9: =AE9+IF(s!AU8*s!AV8+s!AT8*s!AW8=0,0,E9*s!AU8*s!AV8/(s!AU8*s!AV8+s!AT8*s!AW8))+IF(s!AV8*s!AX8+s!AT8*s!AZ8=0,0,M9*s!AV8*s!AX8/(s!AV8*s!AX8+s!AT8*s!AZ8))+IF(s!AV8*s!BA8+s!AW8*s!AZ8=0,0,Q9*s!AV8*s!BA8/(s!AV8*s!BA8+s!AW8*s!AZ8))+IF(s!AT8*s!BA8+s!AU8*s!AZ8+s!AV8*s!AY8+s!AW8*s!AX8=0,0,N9*s!AV8*s!AY8/(s!AT8*s!BA8+s!AU8*s!AZ8+s!AV8*s!AY8+s!AW8*s!AX8)) -> 13.733212800283708 | AW9: =AF9+IF(s!AT8*s!AW8+s!AU8*s!AV8=0,0,E9*s!AT8*s!AW8/(s!AT8*s!AW8+s!AU8*s!AV8))+IF(s!AU8*s!BA8+s!AW8*s!AY8=0,0,O9*s!AW8*s!AY8/(s!AU8*s!BA8+s!AW8*s!AY8))+IF(s!AV8*s!BA8+s!AW8*s!AZ8=0,0,Q9*s!AW8*s!AZ8/(s!AV8*s!BA8+s!AW8*s!AZ8))+IF(s!AT8*s!BA8+s!AU8*s!AZ8+s!AV8*s!AY8+s!AW8*s!AX8=0,0,N9*s!AW8*s!AX8/(s!AT8*s!BA8+s!AU8*s!AZ8+s!AV8*s!AY8+s!AW8*s!AX8)) -> 9.8130247573998499 | AX9: =AG9+IF(s!AT8*s!AY8+s!AU8*s!AX8=0,0,K9*s!AU8*s!AX8/(s!AT8*s!AY8+s!AU8*s!AX8))+IF(s!AV8*s!AX8+s!AT8*s!AZ8=0,0,M9*s!AV8*s!AX8/(s!AV8*s!AX8+s!AT8*s!AZ8))+IF(s!AX8*s!BA8+s!AY8*s!AZ8=0,0,W9*s!AX8*s!BA8/(s!AX8*s!BA8+s!AY8*s!AZ8))+IF(s!AT8*s!BA8+s!AU8*s!AZ8+s!AV8*s!AY8+s!AW8*s!AX8=0,0,N9*s!AW8*s!AX8/(s!AT8*s!BA8+s!AU8*s!AZ8+s!AV8*s!AY8+s!AW8*s!AX8)) -> 13.780553347737444 | AY9: =AH9+IF(s!AT8*s!AY8+s!AU8*s!AX8=0,0,K9*s!AT8*s!AY8/(s!AT8*s!AY8+s!AU8*s!AX8))+IF(s!AU8*s!BA8+s!AW8*s!AY8=0,0,O9*s!AW8*s!AY8/(s!AU8*s!BA8+s!AW8*s!AY8))+IF(s!AX8*s!BA8+s!AY8*s!AZ8=0,0,W9*s!AY8*s!AZ8/(s!AX8*s!BA8+s!AY8*s!AZ8))+IF(s!AT8*s!BA8+s!AU8*s!AZ8+s!AV8*s!AY8+s!AW8*s!AX8=0,0,N9*s!AV8*s!AY8/(s!AT8*s!BA8+s!AU8*s!AZ8+s!AV8*s!AY8+s!AW8*s!AX8)) -> 10.765684209946116 | AZ9: =AI9+IF(s!AT8*s!AZ8+s!AV8*s!AX8=0,0,M9*s!AT8*s!AZ8/(s!AT8*s!AZ8+s!AV8*s!AX8))+IF(s!AV8*s!BA8+s!AW8*s!AZ8=0,0,Q9*s!AW8*s!AZ8/(s!AV8*s!BA8+s!AW8*s!AZ8))+IF(s!AX8*s!BA8+s!AY8*s!AZ8=0,0,W9*s!AY8*s!AZ8/(s!AX8*s!BA8+s!AY8*s!AZ8))+IF(s!AT8*s!BA8+s!AU8*s!AZ8+s!AV8*s!AY8+s!AW8*s!AX8=0,0,N9*s!AU8*s!AZ8/(s!AT8*s!BA8+s!AU8*s!AZ8+s!AV8*s!AY8+s!AW8*s!AX8)) -> 17.813220782207399 | BA9: =AJ9+IF(s!AU8*s!BA8+s!AW8*s!AY8=0,0,O9*s!AU8*s!BA8/(s!AU8*s!BA8+s!AW8*s!AY8))+IF(s!AV8*s!BA8+s!AW8*s!AZ8=0,0,Q9*s!AV8*s!BA8/(s!AV8*s!BA8+s!AW8*s!AZ8))+IF(s!AX8*s!BA8+s!AY8*s!AZ8=0,0,W9*s!AX8*s!BA8/(s!AX8*s!BA8+s!AY8*s!AZ8))+IF(s!AT8*s!BA8+s!AU8*s!AZ8+s!AV8*s!AY8+s!AW8*s!AX8=0,0,N9*s!AT8*s!BA8/(s!AT8*s!BA8+s!AU8*s!AZ8+s!AV8*s!AY8+s!AW8*s!AX8)) -> 21.640541660109044 | BJ9: =SUM(AT9:BA9) -> 778
A10: =A9 -> 100 | B10: =B9 -> 30 | C10: =C9 -> 200 | D10: =D9 -> 2 | E10: =E9 -> 4 | F10: =F9 -> 1 | G10: =G9 -> 1 | H10: =H9 -> 2 | I10: =I9 -> 1 | J10: =J9 -> 2 | K10: =K9 -> 4 | L10: =L9 -> 2 | M10: =M9 -> 4 | N10: =N9 -> 8 | O10: =O9 -> 4 | P10: =P9 -> 2 | Q10: =Q9 -> 4 | R10: =R9 -> 2 | S10: =S9 -> 1 | T10: =T9 -> 2 | U10: =U9 -> 1 | V10: =V9 -> 2 | W10: =W9 -> 4 | X10: =X9 -> 2 | Y10: =Y9 -> 1 | Z10: =Z9 -> 2 | AA10: =AA9 -> 1 | AB10: =AB9 -> 389 | AC10: =AC9 -> 234 | AD10: =AD9 -> 433 | AE10: =AE9 -> 8 | AF10: =AF9 -> 7 | AG10: =AG9 -> 8 | AH10: =AH9 -> 8 | AI10: =AI9 -> 8 | AJ10: =AJ9 -> 8 | AS10: =AS9 -> 714 | AT10: =AC10+IF(s!AT9*s!AW9+s!AU9*s!AV9=0,0,E10*s!AT9*s!AW9/(s!AT9*s!AW9+s!AU9*s!AV9))+IF(s!AT9*s!AY9+s!AU9*s!AX9=0,0,K10*s!AT9*s!AY9/(s!AT9*s!AY9+s!AU9*s!AX9))+IF(s!AT9*s!AZ9+s!AV9*s!AX9=0,0,M10*s!AT9*s!AZ9/(s!AT9*s!AZ9+s!AV9*s!AX9))+IF(s!AT9*s!BA9+s!AU9*s!AZ9+s!AV9*s!AY9+s!AW9*s!AX9=0,0,N10*s!AT9*s!BA9/(s!AT9*s!BA9+s!AU9*s!AZ9+s!AV9*s!AY9+s!AW9*s!AX9)) -> 244.66478661693111 | AU10: =AD10+IF(s!AU9*s!AV9+s!AT9*s!AW9=0,0,E10*s!AU9*s!AV9/(s!AU9*s!AV9+s!AT9*s!AW9))+IF(s!AT9*s!AY9+s!AU9*s!AX9=0,0,K10*s!AU9*s!AX9/(s!AT9*s!AY9+s!AU9*s!AX9))+IF(s!AU9*s!BA9+s!AW9*s!AY9=0,0,O10*s!AU9*s!BA9/(s!AU9*s!BA9+s!AW9*s!AY9))+IF(s!AT9*s!BA9+s!AU9*s!AZ9+s!AV9*s!AY9+s!AW9*s!AX9=0,0,N10*s!AU9*s!AZ9/(s!AT9*s!BA9+s!AU9*s!AZ9+s!AV9*s!AY9+s!AW9*s!AX9)) -> 445.78137876849974 | AV10: =AE10+IF(s!AU9*s!AV9+s!AT9*s!AW9=0,0,E10*s!AU9*s!AV9/(s!AU9*s!AV9+s!AT9*s!AW9))+IF(s!AV9*s!AX9+s!AT9*s!AZ9=0,0,M10*s!AV9*s!AX9/(s!AV9*s!AX9+s!AT9*s!AZ9))+IF(s!AV9*s!BA9+s!AW9*s!AZ9=0,0,Q10*s!AV9*s!BA9/(s!AV9*s!BA9+s!AW9*s!AZ9))+IF(s!AT9*s!BA9+s!AU9*s!AZ9+s!AV9*s!AY9+s!AW9*s!AX9=0,0,N10*s!AV9*s!AY9/(s!AT9*s!BA9+s!AU9*s!AZ9+s!AV9*s!AY9+s!AW9*s!AX9)) -> 13.804972945738793 | AW10: =AF10+IF(s!AT9*s!AW9+s!AU9*s!AV9=0,0,E10*s!AT9*s!AW9/(s!AT9*s!AW9+s!AU9*s!AV9))+IF(s!AU9*s!BA9+s!AW9*s!AY9=0,0,O10*s!AW9*s!AY9/(s!AU9*s!BA9+s!AW9*s!AY9))+IF(s!AV9*s!BA9+s!AW9*s!AZ9=0,0,Q10*s!AW9*s!AZ9/(s!AV9*s!BA9+s!AW9*s!AZ9))+IF(s!AT9*s!BA9+s!AU9*s!AZ9+s!AV9*s!AY9+s!AW9*s!AX9=0,0,N10*s!AW9*s!AX9/(s!AT9*s!BA9+s!AU9*s!AZ9+s!AV9*s!AY9+s!AW9*s!AX9)) -> 9.74886166883031 | AX10: =AG10+IF(s!AT9*s!AY9+s!AU9*s!AX9=0,0,K10*s!AU9*s!AX9/(s!AT9*s!AY9+s!AU9*s!AX9))+IF(s!AV9*s!AX9+s!AT9*s!AZ9=0,0,M10*s!AV9*s!AX9/(s!AV9*s!AX9+s!AT9*s!AZ9))+IF(s!AX9*s!BA9+s!AY9*s!AZ9=0,0,W10*s!AX9*s!BA9/(s!AX9*s!BA9+s!AY9*s!AZ9))+IF(s!AT9*s!BA9+s!AU9*s!AZ9+s!AV9*s!AY9+s!AW9*s!AX9=0,0,N10*s!AW9*s!AX9/(s!AT9*s!BA9+s!AU9*s!AZ9+s!AV9*s!AY9+s!AW9*s!AX9)) -> 13.847388938322831 | AY10: =AH10+IF(s!AT9*s!AY9+s!AU9*s!AX9=0,0,K10*s!AT9*s!AY9/(s!AT9*s!AY9+s!AU9*s!AX9))+IF(s!AU9*s!BA9+s!AW9*s!AY9=0,0,O10*s!AW9*s!AY9/(s!AU9*s!BA9+s!AW9*s!AY9))+IF(s!AX9*s!BA9+s!AY9*s!AZ9=0,0,W10*s!AY9*s!AZ9/(s!AX9*s!BA9+s!AY9*s!AZ9))+IF(s!AT9*s!BA9+s!AU9*s!AZ9+s!AV9*s!AY9+s!AW9*s!AX9=0,0,N10*s!AV9*s!AY9/(s!AT9*s!BA9+s!AU9*s!AZ9+s!AV9*s!AY9+s!AW9*s!AX9)) -> 10.706445676246272 | AZ10: =AI10+IF(s!AT9*s!AZ9+s!AV9*s!AX9=0,0,M10*s!AT9*s!AZ9/(s!AT9*s!AZ9+s!AV9*s!AX9))+IF(s!AV9*s!BA9+s!AW9*s!AZ9=0,0,Q10*s!AW9*s!AZ9/(s!AV9*s!BA9+s!AW9*s!AZ9))+IF(s!AX9*s!BA9+s!AY9*s!AZ9=0,0,W10*s!AY9*s!AZ9/(s!AX9*s!BA9+s!AY9*s!AZ9))+IF(s!AT9*s!BA9+s!AU9*s!AZ9+s!AV9*s!AY9+s!AW9*s!AX9=0,0,N10*s!AU9*s!AZ9/(s!AT9*s!BA9+s!AU9*s!AZ9+s!AV9*s!AY9+s!AW9*s!AX9)) -> 17.682851499007249 | BA10: =AJ10+IF(s!AU9*s!BA9+s!AW9*s!AY9=0,0,O10*s!AU9*s!BA9/(s!AU9*s!BA9+s!AW9*s!AY9))+IF(s!AV9*s!BA9+s!AW9*s!AZ9=0,0,Q10*s!AV9*s!BA9/(s!AV9*s!BA9+s!AW9*s!AZ9))+IF(s!AX9*s!BA9+s!AY9*s!AZ9=0,0,W10*s!AX9*s!BA9/(s!AX9*s!BA9+s!AY9*s!AZ9))+IF(s!AT9*s!BA9+s!AU9*s!AZ9+s!AV9*s!AY9+s!AW9*s!AX9=0,0,N10*s!AT9*s!BA9/(s!AT9*s!BA9+s!AU9*s!AZ9+s!AV9*s!AY9+s!AW9*s!AX9)) -> 21.763313886423646 | BJ10: =SUM(AT10:BA10) -> 778
A11: =A10 -> 100 | B11: =B10 -> 30 | C11: =C10 -> 200 | D11: =D10 -> 2 | E11: =E10 -> 4 | F11: =F10 -> 1 | G11: =G10 -> 1 | H11: =H10 -> 2 | I11: =I10 -> 1 | J11: =J10 -> 2 | K11: =K10 -> 4 | L11: =L10 -> 2 | M11: =M10 -> 4 | N11: =N10 -> 8 | O11: =O10 -> 4 | P11: =P10 -> 2 | Q11: =Q10 -> 4 | R11: =R10 -> 2 | S11: =S10 -> 1 | T11: =T10 -> 2 | U11: =U10 -> 1 | V11: =V10 -> 2 | W11: =W10 -> 4 | X11: =X10 -> 2 | Y11: =Y10 -> 1 | Z11: =Z10 -> 2 | AA11: =AA10 -> 1 | AB11: =AB10 -> 389 | AC11: =AC10 -> 234 | AD11: =AD10 -> 433 | AE11: =AE10 -> 8 | AF11: =AF10 -> 7 | AG11: =AG10 -> 8 | AH11: =AH10 -> 8 | AI11: =AI10 -> 8 | AJ11: =AJ10 -> 8 | AS11: =AS10 -> 714 | AT11: =AC11+IF(s!AT10*s!AW10+s!AU10*s!AV10=0,0,E11*s!AT10*s!AW10/(s!AT10*s!AW10+s!AU10*s!AV10))+IF(s!AT10*s!AY10+s!AU10*s!AX10=0,0,K11*s!AT10*s!AY10/(s!AT10*s!AY10+s!AU10*s!AX10))+IF(s!AT10*s!AZ10+s!AV10*s!AX10=0,0,M11*s!AT10*s!AZ10/(s!AT10*s!AZ10+s!AV10*s!AX10))+IF(s!AT10*s!BA10+s!AU10*s!AZ10+s!AV10*s!AY10+s!AW10*s!AX10=0,0,N11*s!AT10*s!BA10/(s!AT10*s!BA10+s!AU10*s!AZ10+s!AV10*s!AY10+s!AW10*s!AX10)) -> 244.66048736804214 | AU11: =AD11+IF(s!AU10*s!AV10+s!AT10*s!AW10=0,0,E11*s!AU10*s!AV10/(s!AU10*s!AV10+s!AT10*s!AW10))+IF(s!AT10*s!AY10+s!AU10*s!AX10=0,0,K11*s!AU10*s!AX10/(s!AT10*s!AY10+s!AU10*s!AX10))+IF(s!AU10*s!BA10+s!AW10*s!AY10=0,0,O11*s!AU10*s!BA10/(s!AU10*s!BA10+s!AW10*s!AY10))+IF(s!AT10*s!BA10+s!AU10*s!AZ10+s!AV10*s!AY10+s!AW10*s!AX10=0,0,N11*s!AU10*s!AZ10/(s!AT10*s!BA10+s!AU10*s!AZ10+s!AV10*s!AY10+s!AW10*s!AX10)) -> 445.78080236106808 | AV11: =AE11+IF(s!AU10*s!AV10+s!AT10*s!AW10=0,0,E11*s!AU10*s!AV10/(s!AU10*s!AV10+s!AT10*s!AW10))+IF(s!AV10*s!AX10+s!AT10*s!AZ10=0,0,M11*s!AV10*s!AX10/(s!AV10*s!AX10+s!AT10*s!AZ10))+IF(s!AV10*s!BA10+s!AW10*s!AZ10=0,0,Q11*s!AV10*s!BA10/(s!AV10*s!BA10+s!AW10*s!AZ10))+IF(s!AT10*s!BA10+s!AU10*s!AZ10+s!AV10*s!AY10+s!AW10*s!AX10=0,0,N11*s!AV10*s!AY10/(s!AT10*s!BA10+s!AU10*s!AZ10+s!AV10*s!AY10+s!AW10*s!AX10)) -> 13.853691739581967 | AW11: =AF11+IF(s!AT10*s!AW10+s!AU10*s!AV10=0,0,E11*s!AT10*s!AW10/(s!AT10*s!AW10+s!AU10*s!AV10))+IF(s!AU10*s!BA10+s!AW10*s!AY10=0,0,O11*s!AW10*s!AY10/(s!AU10*s!BA10+s!AW10*s!AY10))+IF(s!AV10*s!BA10+s!AW10*s!AZ10=0,0,Q11*s!AW10*s!AZ10/(s!AV10*s!BA10+s!AW10*s!AZ10))+IF(s!AT10*s!BA10+s!AU10*s!AZ10+s!AV10*s!AY10+s!AW10*s!AX10=0,0,N11*s!AW10*s!AX10/(s!AT10*s!BA10+s!AU10*s!AZ10+s!AV10*s!AY10+s!AW10*s!AX10)) -> 9.7050185313077311 | AX11: =AG11+IF(s!AT10*s!AY10+s!AU10*s!AX10=0,0,K11*s!AU10*s!AX10/(s!AT10*s!AY10+s!AU10*s!AX10))+IF(s!AV10*s!AX10+s!AT10*s!AZ10=0,0,M11*s!AV10*s!AX10/(s!AV10*s!AX10+s!AT10*s!AZ10))+IF(s!AX10*s!BA10+s!AY10*s!AZ10=0,0,W11*s!AX10*s!BA10/(s!AX10*s!BA10+s!AY10*s!AZ10))+IF(s!AT10*s!BA10+s!AU10*s!AZ10+s!AV10*s!AY10+s!AW10*s!AX10=0,0,N11*s!AW10*s!AX10/(s!AT10*s!BA10+s!AU10*s!AZ10+s!AV10*s!AY10+s!AW10*s!AX10)) -> 13.892454743970516 | AY11: =AH11+IF(s!AT10*s!AY10+s!AU10*s!AX10=0,0,K11*s!AT10*s!AY10/(s!AT10*s!AY10+s!AU10*s!AX10))+IF(s!AU10*s!BA10+s!AW10*s!AY10=0,0,O11*s!AW10*s!AY10/(s!AU10*s!BA10+s!AW10*s!AY10))+IF(s!AX10*s!BA10+s!AY10*s!AZ10=0,0,W11*s!AY10*s!AZ10/(s!AX10*s!BA10+s!AY10*s!AZ10))+IF(s!AT10*s!BA10+s!AU10*s!AZ10+s!AV10*s!AY10+s!AW10*s!AX10=0,0,N11*s!AV10*s!AY10/(s!AT10*s!BA10+s!AU10*s!AZ10+s!AV10*s!AY10+s!AW10*s!AX10)) -> 10.666255526919182 | AZ11: =AI11+IF(s!AT10*s!AZ10+s!AV10*s!AX10=0,0,M11*s!AT10*s!AZ10/(s!AT10*s!AZ10+s!AV10*s!AX10))+IF(s!AV10*s!BA10+s!AW10*s!AZ10=0,0,Q11*s!AW10*s!AZ10/(s!AV10*s!BA10+s!AW10*s!AZ10))+IF(s!AX10*s!BA10+s!AY10*s!AZ10=0,0,W11*s!AY10*s!AZ10/(s!AX10*s!BA10+s!AY10*s!AZ10))+IF(s!AT10*s!BA10+s!AU10*s!AZ10+s!AV10*s!AY10+s!AW10*s!AX10=0,0,N11*s!AU10*s!AZ10/(s!AT10*s!BA10+s!AU10*s!AZ10+s!AV10*s!AY10+s!AW10*s!AX10)) -> 17.593366148405345 | BA11: =AJ11+IF(s!AU10*s!BA10+s!AW10*s!AY10=0,0,O11*s!AU10*s!BA10/(s!AU10*s!BA10+s!AW10*s!AY10))+IF(s!AV10*s!BA10+s!AW10*s!AZ10=0,0,Q11*s!AV10*s!BA10/(s!AV10*s!BA10+s!AW10*s!AZ10))+IF(s!AX10*s!BA10+s!AY10*s!AZ10=0,0,W11*s!AX10*s!BA10/(s!AX10*s!BA10+s!AY10*s!AZ10))+IF(s!AT10*s!BA10+s!AU10*s!AZ10+s!AV10*s!AY10+s!AW10*s!AX10=0,0,N11*s!AT10*s!BA10/(s!AT10*s!BA10+s!AU10*s!AZ10+s!AV10*s!AY10+s!AW10*s!AX10)) -> 21.847923580704958 | BJ11: =SUM(AT11:BA11) -> 778
A12: =A11 -> 100 | B12: =B11 -> 30 | C12: =C11 -> 200 | D12: =D11 -> 2 | E12: =E11 -> 4 | F12: =F11 -> 1 | G12: =G11 -> 1 | H12: =H11 -> 2 | I12: =I11 -> 1 | J12: =J11 -> 2 | K12: =K11 -> 4 | L12: =L11 -> 2 | M12: =M11 -> 4 | N12: =N11 -> 8 | O12: =O11 -> 4 | P12: =P11 -> 2 | Q12: =Q11 -> 4 | R12: =R11 -> 2 | S12: =S11 -> 1 | T12: =T11 -> 2 | U12: =U11 -> 1 | V12: =V11 -> 2 | W12: =W11 -> 4 | X12: =X11 -> 2 | Y12: =Y11 -> 1 | Z12: =Z11 -> 2 | AA12: =AA11 -> 1 | AB12: =AB11 -> 389 | AC12: =AC11 -> 234 | AD12: =AD11 -> 433 | AE12: =AE11 -> 8 | AF12: =AF11 -> 7 | AG12: =AG11 -> 8 | AH12: =AH11 -> 8 | AI12: =AI11 -> 8 | AJ12: =AJ11 -> 8 | AS12: =AS11 -> 714 | AT12: =AC12+IF(s!AT11*s!AW11+s!AU11*s!AV11=0,0,E12*s!AT11*s!AW11/(s!AT11*s!AW11+s!AU11*s!AV11))+IF(s!AT11*s!AY11+s!AU11*s!AX11=0,0,K12*s!AT11*s!AY11/(s!AT11*s!AY11+s!AU11*s!AX11))+IF(s!AT11*s!AZ11+s!AV11*s!AX11=0,0,M12*s!AT11*s!AZ11/(s!AT11*s!AZ11+s!AV11*s!AX11))+IF(s!AT11*s!BA11+s!AU11*s!AZ11+s!AV11*s!AY11+s!AW11*s!AX11=0,0,N12*s!AT11*s!BA11/(s!AT11*s!BA11+s!AU11*s!AZ11+s!AV11*s!AY11+s!AW11*s!AX11)) -> 244.65840396606026 | AU12: =AD12+IF(s!AU11*s!AV11+s!AT11*s!AW11=0,0,E12*s!AU11*s!AV11/(s!AU11*s!AV11+s!AT11*s!AW11))+IF(s!AT11*s!AY11+s!AU11*s!AX11=0,0,K12*s!AU11*s!AX11/(s!AT11*s!AY11+s!AU11*s!AX11))+IF(s!AU11*s!BA11+s!AW11*s!AY11=0,0,O12*s!AU11*s!BA11/(s!AU11*s!BA11+s!AW11*s!AY11))+IF(s!AT11*s!BA11+s!AU11*s!AZ11+s!AV11*s!AY11+s!AW11*s!AX11=0,0,N12*s!AU11*s!AZ11/(s!AT11*s!BA11+s!AU11*s!AZ11+s!AV11*s!AY11+s!AW11*s!AX11)) -> 445.77974388740239 | AV12: =AE12+IF(s!AU11*s!AV11+s!AT11*s!AW11=0,0,E12*s!AU11*s!AV11/(s!AU11*s!AV11+s!AT11*s!AW11))+IF(s!AV11*s!AX11+s!AT11*s!AZ11=0,0,M12*s!AV11*s!AX11/(s!AV11*s!AX11+s!AT11*s!AZ11))+IF(s!AV11*s!BA11+s!AW11*s!AZ11=0,0,Q12*s!AV11*s!BA11/(s!AV11*s!BA11+s!AW11*s!AZ11))+IF(s!AT11*s!BA11+s!AU11*s!AZ11+s!AV11*s!AY11+s!AW11*s!AX11=0,0,N12*s!AV11*s!AY11/(s!AT11*s!BA11+s!AU11*s!AZ11+s!AV11*s!AY11+s!AW11*s!AX11)) -> 13.88692742192875 | AW12: =AF12+IF(s!AT11*s!AW11+s!AU11*s!AV11=0,0,E12*s!AT11*s!AW11/(s!AT11*s!AW11+s!AU11*s!AV11))+IF(s!AU11*s!BA11+s!AW11*s!AY11=0,0,O12*s!AW11*s!AY11/(s!AU11*s!BA11+s!AW11*s!AY11))+IF(s!AV11*s!BA11+s!AW11*s!AZ11=0,0,Q12*s!AW11*s!AZ11/(s!AV11*s!BA11+s!AW11*s!AZ11))+IF(s!AT11*s!BA11+s!AU11*s!AZ11+s!AV11*s!AY11+s!AW11*s!AX11=0,0,N12*s!AW11*s!AX11/(s!AT11*s!BA11+s!AU11*s!AZ11+s!AV11*s!AY11+s!AW11*s!AX11)) -> 9.6749247246085996 | AX12: =AG12+IF(s!AT11*s!AY11+s!AU11*s!AX11=0,0,K12*s!AU11*s!AX11/(s!AT11*s!AY11+s!AU11*s!AX11))+IF(s!AV11*s!AX11+s!AT11*s!AZ11=0,0,M12*s!AV11*s!AX11/(s!AV11*s!AX11+s!AT11*s!AZ11))+IF(s!AX11*s!BA11+s!AY11*s!AZ11=0,0,W12*s!AX11*s!BA11/(s!AX11*s!BA11+s!AY11*s!AZ11))+IF(s!AT11*s!BA11+s!AU11*s!AZ11+s!AV11*s!AY11+s!AW11*s!AX11=0,0,N12*s!AW11*s!AX11/(s!AT11*s!BA11+s!AU11*s!AZ11+s!AV11*s!AY11+s!AW11*s!AX11)) -> 13.92301134288118 | AY12: =AH12+IF(s!AT11*s!AY11+s!AU11*s!AX11=0,0,K12*s!AT11*s!AY11/(s!AT11*s!AY11+s!AU11*s!AX11))+IF(s!AU11*s!BA11+s!AW11*s!AY11=0,0,O12*s!AW11*s!AY11/(s!AU11*s!BA11+s!AW11*s!AY11))+IF(s!AX11*s!BA11+s!AY11*s!AZ11=0,0,W12*s!AY11*s!AZ11/(s!AX11*s!BA11+s!AY11*s!AZ11))+IF(s!AT11*s!BA11+s!AU11*s!AZ11+s!AV11*s!AY11+s!AW11*s!AX11=0,0,N12*s!AV11*s!AY11/(s!AT11*s!BA11+s!AU11*s!AZ11+s!AV11*s!AY11+s!AW11*s!AX11)) -> 10.638840803656169 | AZ12: =AI12+IF(s!AT11*s!AZ11+s!AV11*s!AX11=0,0,M12*s!AT11*s!AZ11/(s!AT11*s!AZ11+s!AV11*s!AX11))+IF(s!AV11*s!BA11+s!AW11*s!AZ11=0,0,Q12*s!AW11*s!AZ11/(s!AV11*s!BA11+s!AW11*s!AZ11))+IF(s!AX11*s!BA11+s!AY11*s!AZ11=0,0,W12*s!AY11*s!AZ11/(s!AX11*s!BA11+s!AY11*s!AZ11))+IF(s!AT11*s!BA11+s!AU11*s!AZ11+s!AV11*s!AY11+s!AW11*s!AX11=0,0,N12*s!AU11*s!AZ11/(s!AT11*s!BA11+s!AU11*s!AZ11+s!AV11*s!AY11+s!AW11*s!AX11)) -> 17.531657269129809 | BA12: =AJ12+IF(s!AU11*s!BA11+s!AW11*s!AY11=0,0,O12*s!AU11*s!BA11/(s!AU11*s!BA11+s!AW11*s!AY11))+IF(s!AV11*s!BA11+s!AW11*s!AZ11=0,0,Q12*s!AV11*s!BA11/(s!AV11*s!BA11+s!AW11*s!AZ11))+IF(s!AX11*s!BA11+s!AY11*s!AZ11=0,0,W12*s!AX11*s!BA11/(s!AX11*s!BA11+s!AY11*s!AZ11))+IF(s!AT11*s!BA11+s!AU11*s!AZ11+s!AV11*s!AY11+s!AW11*s!AX11=0,0,N12*s!AT11*s!BA11/(s!AT11*s!BA11+s!AU11*s!AZ11+s!AV11*s!AY11+s!AW11*s!AX11)) -> 21.906490584332843 | BJ12: =SUM(AT12:BA12) -> 778
A13: =A12 -> 100 | B13: =B12 -> 30 | C13: =C12 -> 200 | D13: =D12 -> 2 | E13: =E12 -> 4 | F13: =F12 -> 1 | G13: =G12 -> 1 | H13: =H12 -> 2 | I13: =I12 -> 1 | J13: =J12 -> 2 | K13: =K12 -> 4 | L13: =L12 -> 2 | M13: =M12 -> 4 | N13: =N12 -> 8 | O13: =O12 -> 4 | P13: =P12 -> 2 | Q13: =Q12 -> 4 | R13: =R12 -> 2 | S13: =S12 -> 1 | T13: =T12 -> 2 | U13: =U12 -> 1 | V13: =V12 -> 2 | W13: =W12 -> 4 | X13: =X12 -> 2 | Y13: =Y12 -> 1 | Z13: =Z12 -> 2 | AA13: =AA12 -> 1 | AB13: =AB12 -> 389 | AC13: =AC12 -> 234 | AD13: =AD12 -> 433 | AE13: =AE12 -> 8 | AF13: =AF12 -> 7 | AG13: =AG12 -> 8 | AH13: =AH12 -> 8 | AI13: =AI12 -> 8 | AJ13: =AJ12 -> 8 | AS13: =AS12 -> 714 | AT13: =AC13+IF(s!AT12*s!AW12+s!AU12*s!AV12=0,0,E13*s!AT12*s!AW12/(s!AT12*s!AW12+s!AU12*s!AV12))+IF(s!AT12*s!AY12+s!AU12*s!AX12=0,0,K13*s!AT12*s!AY12/(s!AT12*s!AY12+s!AU12*s!AX12))+IF(s!AT12*s!AZ12+s!AV12*s!AX12=0,0,M13*s!AT12*s!AZ12/(s!AT12*s!AZ12+s!AV12*s!AX12))+IF(s!AT12*s!BA12+s!AU12*s!AZ12+s!AV12*s!AY12+s!AW12*s!AX12=0,0,N13*s!AT12*s!BA12/(s!AT12*s!BA12+s!AU12*s!AZ12+s!AV12*s!AY12+s!AW12*s!AX12)) -> 244.65751691544239 | AU13: =AD13+IF(s!AU12*s!AV12+s!AT12*s!AW12=0,0,E13*s!AU12*s!AV12/(s!AU12*s!AV12+s!AT12*s!AW12))+IF(s!AT12*s!AY12+s!AU12*s!AX12=0,0,K13*s!AU12*s!AX12/(s!AT12*s!AY12+s!AU12*s!AX12))+IF(s!AU12*s!BA12+s!AW12*s!AY12=0,0,O13*s!AU12*s!BA12/(s!AU12*s!BA12+s!AW12*s!AY12))+IF(s!AT12*s!BA12+s!AU12*s!AZ12+s!AV12*s!AY12+s!AW12*s!AX12=0,0,N13*s!AU12*s!AZ12/(s!AT12*s!BA12+s!AU12*s!AZ12+s!AV12*s!AY12+s!AW12*s!AX12)) -> 445.77859124859953 | AV13: =AE13+IF(s!AU12*s!AV12+s!AT12*s!AW12=0,0,E13*s!AU12*s!AV12/(s!AU12*s!AV12+s!AT12*s!AW12))+IF(s!AV12*s!AX12+s!AT12*s!AZ12=0,0,M13*s!AV12*s!AX12/(s!AV12*s!AX12+s!AT12*s!AZ12))+IF(s!AV12*s!BA12+s!AW12*s!AZ12=0,0,Q13*s!AV12*s!BA12/(s!AV12*s!BA12+s!AW12*s!AZ12))+IF(s!AT12*s!BA12+s!AU12*s!AZ12+s!AV12*s!AY12+s!AW12*s!AX12=0,0,N13*s!AV12*s!AY12/(s!AT12*s!BA12+s!AU12*s!AZ12+s!AV12*s!AY12+s!AW12*s!AX12)) -> 13.909710585344364 | AW13: =AF13+IF(s!AT12*s!AW12+s!AU12*s!AV12=0,0,E13*s!AT12*s!AW12/(s!AT12*s!AW12+s!AU12*s!AV12))+IF(s!AU12*s!BA12+s!AW12*s!AY12=0,0,O13*s!AW12*s!AY12/(s!AU12*s!BA12+s!AW12*s!AY12))+IF(s!AV12*s!BA12+s!AW12*s!AZ12=0,0,Q13*s!AW12*s!AZ12/(s!AV12*s!BA12+s!AW12*s!AZ12))+IF(s!AT12*s!BA12+s!AU12*s!AZ12+s!AV12*s!AY12+s!AW12*s!AX12=0,0,N13*s!AW12*s!AX12/(s!AT12*s!BA12+s!AU12*s!AZ12+s!AV12*s!AY12+s!AW12*s!AX12)) -> 9.6541812506137195 | AX13: =AG13+IF(s!AT12*s!AY12+s!AU12*s!AX12=0,0,K13*s!AU12*s!AX12/(s!AT12*s!AY12+s!AU12*s!AX12))+IF(s!AV12*s!AX12+s!AT12*s!AZ12=0,0,M13*s!AV12*s!AX12/(s!AV12*s!AX12+s!AT12*s!AZ12))+IF(s!AX12*s!BA12+s!AY12*s!AZ12=0,0,W13*s!AX12*s!BA12/(s!AX12*s!BA12+s!AY12*s!AZ12))+IF(s!AT12*s!BA12+s!AU12*s!AZ12+s!AV12*s!AY12+s!AW12*s!AX12=0,0,N13*s!AW12*s!AX12/(s!AT12*s!BA12+s!AU12*s!AZ12+s!AV12*s!AY12+s!AW12*s!AX12)) -> 13.943846640854089 | AY13: =AH13+IF(s!AT12*s!AY12+s!AU12*s!AX12=0,0,K13*s!AT12*s!AY12/(s!AT12*s!AY12+s!AU12*s!AX12))+IF(s!AU12*s!BA12+s!AW12*s!AY12=0,0,O13*s!AW12*s!AY12/(s!AU12*s!BA12+s!AW12*s!AY12))+IF(s!AX12*s!BA12+s!AY12*s!AZ12=0,0,W13*s!AY12*s!AZ12/(s!AX12*s!BA12+s!AY12*s!AZ12))+IF(s!AT12*s!BA12+s!AU12*s!AZ12+s!AV12*s!AY12+s!AW12*s!AX12=0,0,N13*s!AV12*s!AY12/(s!AT12*s!BA12+s!AU12*s!AZ12+s!AV12*s!AY12+s!AW12*s!AX12)) -> 10.620045195103994 | AZ13: =AI13+IF(s!AT12*s!AZ12+s!AV12*s!AX12=0,0,M13*s!AT12*s!AZ12/(s!AT12*s!AZ12+s!AV12*s!AX12))+IF(s!AV12*s!BA12+s!AW12*s!AZ12=0,0,Q13*s!AW12*s!AZ12/(s!AV12*s!BA12+s!AW12*s!AZ12))+IF(s!AX12*s!BA12+s!AY12*s!AZ12=0,0,W13*s!AY12*s!AZ12/(s!AX12*s!BA12+s!AY12*s!AZ12))+IF(s!AT12*s!BA12+s!AU12*s!AZ12+s!AV12*s!AY12+s!AW12*s!AX12=0,0,N13*s!AU12*s!AZ12/(s!AT12*s!BA12+s!AU12*s!AZ12+s!AV12*s!AY12+s!AW12*s!AX12)) -> 17.488925858359167 | BA13: =AJ13+IF(s!AU12*s!BA12+s!AW12*s!AY12=0,0,O13*s!AU12*s!BA12/(s!AU12*s!BA12+s!AW12*s!AY12))+IF(s!AV12*s!BA12+s!AW12*s!AZ12=0,0,Q13*s!AV12*s!BA12/(s!AV12*s!BA12+s!AW12*s!AZ12))+IF(s!AX12*s!BA12+s!AY12*s!AZ12=0,0,W13*s!AX12*s!BA12/(s!AX12*s!BA12+s!AY12*s!AZ12))+IF(s!AT12*s!BA12+s!AU12*s!AZ12+s!AV12*s!AY12+s!AW12*s!AX12=0,0,N13*s!AT12*s!BA12/(s!AT12*s!BA12+s!AU12*s!AZ12+s!AV12*s!AY12+s!AW12*s!AX12)) -> 21.947182305682752 | BJ13: =SUM(AT13:BA13) -> 778
A14: =A13 -> 100 | B14: =B13 -> 30 | C14: =C13 -> 200 | D14: =D13 -> 2 | E14: =E13 -> 4 | F14: =F13 -> 1 | G14: =G13 -> 1 | H14: =H13 -> 2 | I14: =I13 -> 1 | J14: =J13 -> 2 | K14: =K13 -> 4 | L14: =L13 -> 2 | M14: =M13 -> 4 | N14: =N13 -> 8 | O14: =O13 -> 4 | P14: =P13 -> 2 | Q14: =Q13 -> 4 | R14: =R13 -> 2 | S14: =S13 -> 1 | T14: =T13 -> 2 | U14: =U13 -> 1 | V14: =V13 -> 2 | W14: =W13 -> 4 | X14: =X13 -> 2 | Y14: =Y13 -> 1 | Z14: =Z13 -> 2 | AA14: =AA13 -> 1 | AB14: =AB13 -> 389 | AC14: =AC13 -> 234 | AD14: =AD13 -> 433 | AE14: =AE13 -> 8 | AF14: =AF13 -> 7 | AG14: =AG13 -> 8 | AH14: =AH13 -> 8 | AI14: =AI13 -> 8 | AJ14: =AJ13 -> 8 | AS14: =AS13 -> 714 | AT14: =AC14+IF(s!AT13*s!AW13+s!AU13*s!AV13=0,0,E14*s!AT13*s!AW13/(s!AT13*s!AW13+s!AU13*s!AV13))+IF(s!AT13*s!AY13+s!AU13*s!AX13=0,0,K14*s!AT13*s!AY13/(s!AT13*s!AY13+s!AU13*s!AX13))+IF(s!AT13*s!AZ13+s!AV13*s!AX13=0,0,M14*s!AT13*s!AZ13/(s!AT13*s!AZ13+s!AV13*s!AX13))+IF(s!AT13*s!BA13+s!AU13*s!AZ13+s!AV13*s!AY13+s!AW13*s!AX13=0,0,N14*s!AT13*s!BA13/(s!AT13*s!BA13+s!AU13*s!AZ13+s!AV13*s!AY13+s!AW13*s!AX13)) -> 244.65724465850283 | AU14: =AD14+IF(s!AU13*s!AV13+s!AT13*s!AW13=0,0,E14*s!AU13*s!AV13/(s!AU13*s!AV13+s!AT13*s!AW13))+IF(s!AT13*s!AY13+s!AU13*s!AX13=0,0,K14*s!AU13*s!AX13/(s!AT13*s!AY13+s!AU13*s!AX13))+IF(s!AU13*s!BA13+s!AW13*s!AY13=0,0,O14*s!AU13*s!BA13/(s!AU13*s!BA13+s!AW13*s!AY13))+IF(s!AT13*s!BA13+s!AU13*s!AZ13+s!AV13*s!AY13+s!AW13*s!AX13=0,0,N14*s!AU13*s!AZ13/(s!AT13*s!BA13+s!AU13*s!AZ13+s!AV13*s!AY13+s!AW13*s!AX13)) -> 445.77752742288038 | AV14: =AE14+IF(s!AU13*s!AV13+s!AT13*s!AW13=0,0,E14*s!AU13*s!AV13/(s!AU13*s!AV13+s!AT13*s!AW13))+IF(s!AV13*s!AX13+s!AT13*s!AZ13=0,0,M14*s!AV13*s!AX13/(s!AV13*s!AX13+s!AT13*s!AZ13))+IF(s!AV13*s!BA13+s!AW13*s!AZ13=0,0,Q14*s!AV13*s!BA13/(s!AV13*s!BA13+s!AW13*s!AZ13))+IF(s!AT13*s!BA13+s!AU13*s!AZ13+s!AV13*s!AY13+s!AW13*s!AX13=0,0,N14*s!AV13*s!AY13/(s!AT13*s!BA13+s!AU13*s!AZ13+s!AV13*s!AY13+s!AW13*s!AX13)) -> 13.925400206218667 | AW14: =AF14+IF(s!AT13*s!AW13+s!AU13*s!AV13=0,0,E14*s!AT13*s!AW13/(s!AT13*s!AW13+s!AU13*s!AV13))+IF(s!AU13*s!BA13+s!AW13*s!AY13=0,0,O14*s!AW13*s!AY13/(s!AU13*s!BA13+s!AW13*s!AY13))+IF(s!AV13*s!BA13+s!AW13*s!AZ13=0,0,Q14*s!AW13*s!AZ13/(s!AV13*s!BA13+s!AW13*s!AZ13))+IF(s!AT13*s!BA13+s!AU13*s!AZ13+s!AV13*s!AY13+s!AW13*s!AX13=0,0,N14*s!AW13*s!AX13/(s!AT13*s!BA13+s!AU13*s!AZ13+s!AV13*s!AY13+s!AW13*s!AX13)) -> 9.6398277123981355 | AX14: =AG14+IF(s!AT13*s!AY13+s!AU13*s!AX13=0,0,K14*s!AU13*s!AX13/(s!AT13*s!AY13+s!AU13*s!AX13))+IF(s!AV13*s!AX13+s!AT13*s!AZ13=0,0,M14*s!AV13*s!AX13/(s!AV13*s!AX13+s!AT13*s!AZ13))+IF(s!AX13*s!BA13+s!AY13*s!AZ13=0,0,W14*s!AX13*s!BA13/(s!AX13*s!BA13+s!AY13*s!AZ13))+IF(s!AT13*s!BA13+s!AU13*s!AZ13+s!AV13*s!AY13+s!AW13*s!AX13=0,0,N14*s!AW13*s!AX13/(s!AT13*s!BA13+s!AU13*s!AZ13+s!AV13*s!AY13+s!AW13*s!AX13)) -> 13.95813099591091 | AY14: =AH14+IF(s!AT13*s!AY13+s!AU13*s!AX13=0,0,K14*s!AT13*s!AY13/(s!AT13*s!AY13+s!AU13*s!AX13))+IF(s!AU13*s!BA13+s!AW13*s!AY13=0,0,O14*s!AW13*s!AY13/(s!AU13*s!BA13+s!AW13*s!AY13))+IF(s!AX13*s!BA13+s!AY13*s!AZ13=0,0,W14*s!AY13*s!AZ13/(s!AX13*s!BA13+s!AY13*s!AZ13))+IF(s!AT13*s!BA13+s!AU13*s!AZ13+s!AV13*s!AY13+s!AW13*s!AX13=0,0,N14*s!AV13*s!AY13/(s!AT13*s!BA13+s!AU13*s!AZ13+s!AV13*s!AY13+s!AW13*s!AX13)) -> 10.607096922705892 | AZ14: =AI14+IF(s!AT13*s!AZ13+s!AV13*s!AX13=0,0,M14*s!AT13*s!AZ13/(s!AT13*s!AZ13+s!AV13*s!AX13))+IF(s!AV13*s!BA13+s!AW13*s!AZ13=0,0,Q14*s!AW13*s!AZ13/(s!AV13*s!BA13+s!AW13*s!AZ13))+IF(s!AX13*s!BA13+s!AY13*s!AZ13=0,0,W14*s!AY13*s!AZ13/(s!AX13*s!BA13+s!AY13*s!AZ13))+IF(s!AT13*s!BA13+s!AU13*s!AZ13+s!AV13*s!AY13+s!AW13*s!AX13=0,0,N14*s!AU13*s!AZ13/(s!AT13*s!BA13+s!AU13*s!AZ13+s!AV13*s!AY13+s!AW13*s!AX13)) -> 17.459224139367603 | BA14: =AJ14+IF(s!AU13*s!BA13+s!AW13*s!AY13=0,0,O14*s!AU13*s!BA13/(s!AU13*s!BA13+s!AW13*s!AY13))+IF(s!AV13*s!BA13+s!AW13*s!AZ13=0,0,Q14*s!AV13*s!BA13/(s!AV13*s!BA13+s!AW13*s!AZ13))+IF(s!AX13*s!BA13+s!AY13*s!AZ13=0,0,W14*s!AX13*s!BA13/(s!AX13*s!BA13+s!AY13*s!AZ13))+IF(s!AT13*s!BA13+s!AU13*s!AZ13+s!AV13*s!AY13+s!AW13*s!AX13=0,0,N14*s!AT13*s!BA13/(s!AT13*s!BA13+s!AU13*s!AZ13+s!AV13*s!AY13+s!AW13*s!AX13)) -> 21.975547942015595 | BJ14: =SUM(AT14:BA14) -> 778
A15: =A14 -> 100 | B15: =B14 -> 30 | C15: =C14 -> 200 | D15: =D14 -> 2 | E15: =E14 -> 4 | F15: =F14 -> 1 | G15: =G14 -> 1 | H15: =H14 -> 2 | I15: =I14 -> 1 | J15: =J14 -> 2 | K15: =K14 -> 4 | L15: =L14 -> 2 | M15: =M14 -> 4 | N15: =N14 -> 8 | O15: =O14 -> 4 | P15: =P14 -> 2 | Q15: =Q14 -> 4 | R15: =R14 -> 2 | S15: =S14 -> 1 | T15: =T14 -> 2 | U15: =U14 -> 1 | V15: =V14 -> 2 | W15: =W14 -> 4 | X15: =X14 -> 2 | Y15: =Y14 -> 1 | Z15: =Z14 -> 2 | AA15: =AA14 -> 1 | AB15: =AB14 -> 389 | AC15: =AC14 -> 234 | AD15: =AD14 -> 433 | AE15: =AE14 -> 8 | AF15: =AF14 -> 7 | AG15: =AG14 -> 8 | AH15: =AH14 -> 8 | AI15: =AI14 -> 8 | AJ15: =AJ14 -> 8 | AS15: =AS14 -> 714 | AT15: =AC15+IF(s!AT14*s!AW14+s!AU14*s!AV14=0,0,E15*s!AT14*s!AW14/(s!AT14*s!AW14+s!AU14*s!AV14))+IF(s!AT14*s!AY14+s!AU14*s!AX14=0,0,K15*s!AT14*s!AY14/(s!AT14*s!AY14+s!AU14*s!AX14))+IF(s!AT14*s!AZ14+s!AV14*s!AX14=0,0,M15*s!AT14*s!AZ14/(s!AT14*s!AZ14+s!AV14*s!AX14))+IF(s!AT14*s!BA14+s!AU14*s!AZ14+s!AV14*s!AY14+s!AW14*s!AX14=0,0,N15*s!AT14*s!BA14/(s!AT14*s!BA14+s!AU14*s!AZ14+s!AV14*s!AY14+s!AW14*s!AX14)) -> 244.65726569899678 | AU15: =AD15+IF(s!AU14*s!AV14+s!AT14*s!AW14=0,0,E15*s!AU14*s!AV14/(s!AU14*s!AV14+s!AT14*s!AW14))+IF(s!AT14*s!AY14+s!AU14*s!AX14=0,0,K15*s!AU14*s!AX14/(s!AT14*s!AY14+s!AU14*s!AX14))+IF(s!AU14*s!BA14+s!AW14*s!AY14=0,0,O15*s!AU14*s!BA14/(s!AU14*s!BA14+s!AW14*s!AY14))+IF(s!AT14*s!BA14+s!AU14*s!AZ14+s!AV14*s!AY14+s!AW14*s!AX14=0,0,N15*s!AU14*s!AZ14/(s!AT14*s!BA14+s!AU14*s!AZ14+s!AV14*s!AY14+s!AW14*s!AX14)) -> 445.77662273426631 | AV15: =AE15+IF(s!AU14*s!AV14+s!AT14*s!AW14=0,0,E15*s!AU14*s!AV14/(s!AU14*s!AV14+s!AT14*s!AW14))+IF(s!AV14*s!AX14+s!AT14*s!AZ14=0,0,M15*s!AV14*s!AX14/(s!AV14*s!AX14+s!AT14*s!AZ14))+IF(s!AV14*s!BA14+s!AW14*s!AZ14=0,0,Q15*s!AV14*s!BA14/(s!AV14*s!BA14+s!AW14*s!AZ14))+IF(s!AT14*s!BA14+s!AU14*s!AZ14+s!AV14*s!AY14+s!AW14*s!AX14=0,0,N15*s!AV14*s!AY14/(s!AT14*s!BA14+s!AU14*s!AZ14+s!AV14*s!AY14+s!AW14*s!AX14)) -> 13.936250890227024 | AW15: =AF15+IF(s!AT14*s!AW14+s!AU14*s!AV14=0,0,E15*s!AT14*s!AW14/(s!AT14*s!AW14+s!AU14*s!AV14))+IF(s!AU14*s!BA14+s!AW14*s!AY14=0,0,O15*s!AW14*s!AY14/(s!AU14*s!BA14+s!AW14*s!AY14))+IF(s!AV14*s!BA14+s!AW14*s!AZ14=0,0,Q15*s!AW14*s!AZ14/(s!AV14*s!BA14+s!AW14*s!AZ14))+IF(s!AT14*s!BA14+s!AU14*s!AZ14+s!AV14*s!AY14+s!AW14*s!AX14=0,0,N15*s!AW14*s!AX14/(s!AT14*s!BA14+s!AU14*s!AZ14+s!AV14*s!AY14+s!AW14*s!AX14)) -> 9.629860676509896 | AX15: =AG15+IF(s!AT14*s!AY14+s!AU14*s!AX14=0,0,K15*s!AU14*s!AX14/(s!AT14*s!AY14+s!AU14*s!AX14))+IF(s!AV14*s!AX14+s!AT14*s!AZ14=0,0,M15*s!AV14*s!AX14/(s!AV14*s!AX14+s!AT14*s!AZ14))+IF(s!AX14*s!BA14+s!AY14*s!AZ14=0,0,W15*s!AX14*s!BA14/(s!AX14*s!BA14+s!AY14*s!AZ14))+IF(s!AT14*s!BA14+s!AU14*s!AZ14+s!AV14*s!AY14+s!AW14*s!AX14=0,0,N15*s!AW14*s!AX14/(s!AT14*s!BA14+s!AU14*s!AZ14+s!AV14*s!AY14+s!AW14*s!AX14)) -> 13.967974710910003 | AY15: =AH15+IF(s!AT14*s!AY14+s!AU14*s!AX14=0,0,K15*s!AT14*s!AY14/(s!AT14*s!AY14+s!AU14*s!AX14))+IF(s!AU14*s!BA14+s!AW14*s!AY14=0,0,O15*s!AW14*s!AY14/(s!AU14*s!BA14+s!AW14*s!AY14))+IF(s!AX14*s!BA14+s!AY14*s!AZ14=0,0,W15*s!AY14*s!AZ14/(s!AX14*s!BA14+s!AY14*s!AZ14))+IF(s!AT14*s!BA14+s!AU14*s!AZ14+s!AV14*s!AY14+s!AW14*s!AX14=0,0,N15*s!AV14*s!AY14/(s!AT14*s!BA14+s!AU14*s!AZ14+s!AV14*s!AY14+s!AW14*s!AX14)) -> 10.598136855826914 | AZ15: =AI15+IF(s!AT14*s!AZ14+s!AV14*s!AX14=0,0,M15*s!AT14*s!AZ14/(s!AT14*s!AZ14+s!AV14*s!AX14))+IF(s!AV14*s!BA14+s!AW14*s!AZ14=0,0,Q15*s!AW14*s!AZ14/(s!AV14*s!BA14+s!AW14*s!AZ14))+IF(s!AX14*s!BA14+s!AY14*s!AZ14=0,0,W15*s!AY14*s!AZ14/(s!AX14*s!BA14+s!AY14*s!AZ14))+IF(s!AT14*s!BA14+s!AU14*s!AZ14+s!AV14*s!AY14+s!AW14*s!AX14=0,0,N15*s!AU14*s!AZ14/(s!AT14*s!BA14+s!AU14*s!AZ14+s!AV14*s!AY14+s!AW14*s!AX14)) -> 17.438508699866205 | BA15: =AJ15+IF(s!AU14*s!BA14+s!AW14*s!AY14=0,0,O15*s!AU14*s!BA14/(s!AU14*s!BA14+s!AW14*s!AY14))+IF(s!AV14*s!BA14+s!AW14*s!AZ14=0,0,Q15*s!AV14*s!BA14/(s!AV14*s!BA14+s!AW14*s!AZ14))+IF(s!AX14*s!BA14+s!AY14*s!AZ14=0,0,W15*s!AX14*s!BA14/(s!AX14*s!BA14+s!AY14*s!AZ14))+IF(s!AT14*s!BA14+s!AU14*s!AZ14+s!AV14*s!AY14+s!AW14*s!AX14=0,0,N15*s!AT14*s!BA14/(s!AT14*s!BA14+s!AU14*s!AZ14+s!AV14*s!AY14+s!AW14*s!AX14)) -> 21.995379733396881 | BJ15: =SUM(AT15:BA15) -> 778
A16: =A15 -> 100 | B16: =B15 -> 30 | C16: =C15 -> 200 | D16: =D15 -> 2 | E16: =E15 -> 4 | F16: =F15 -> 1 | G16: =G15 -> 1 | H16: =H15 -> 2 | I16: =I15 -> 1 | J16: =J15 -> 2 | K16: =K15 -> 4 | L16: =L15 -> 2 | M16: =M15 -> 4 | N16: =N15 -> 8 | O16: =O15 -> 4 | P16: =P15 -> 2 | Q16: =Q15 -> 4 | R16: =R15 -> 2 | S16: =S15 -> 1 | T16: =T15 -> 2 | U16: =U15 -> 1 | V16: =V15 -> 2 | W16: =W15 -> 4 | X16: =X15 -> 2 | Y16: =Y15 -> 1 | Z16: =Z15 -> 2 | AA16: =AA15 -> 1 | AB16: =AB15 -> 389 | AC16: =AC15 -> 234 | AD16: =AD15 -> 433 | AE16: =AE15 -> 8 | AF16: =AF15 -> 7 | AG16: =AG15 -> 8 | AH16: =AH15 -> 8 | AI16: =AI15 -> 8 | AJ16: =AJ15 -> 8 | AS16: =AS15 -> 714 | AT16: =AC16+IF(s!AT15*s!AW15+s!AU15*s!AV15=0,0,E16*s!AT15*s!AW15/(s!AT15*s!AW15+s!AU15*s!AV15))+IF(s!AT15*s!AY15+s!AU15*s!AX15=0,0,K16*s!AT15*s!AY15/(s!AT15*s!AY15+s!AU15*s!AX15))+IF(s!AT15*s!AZ15+s!AV15*s!AX15=0,0,M16*s!AT15*s!AZ15/(s!AT15*s!AZ15+s!AV15*s!AX15))+IF(s!AT15*s!BA15+s!AU15*s!AZ15+s!AV15*s!AY15+s!AW15*s!AX15=0,0,N16*s!AT15*s!BA15/(s!AT15*s!BA15+s!AU15*s!AZ15+s!AV15*s!AY15+s!AW15*s!AX15)) -> 244.65740843903282 | AU16: =AD16+IF(s!AU15*s!AV15+s!AT15*s!AW15=0,0,E16*s!AU15*s!AV15/(s!AU15*s!AV15+s!AT15*s!AW15))+IF(s!AT15*s!AY15+s!AU15*s!AX15=0,0,K16*s!AU15*s!AX15/(s!AT15*s!AY15+s!AU15*s!AX15))+IF(s!AU15*s!BA15+s!AW15*s!AY15=0,0,O16*s!AU15*s!BA15/(s!AU15*s!BA15+s!AW15*s!AY15))+IF(s!AT15*s!BA15+s!AU15*s!AZ15+s!AV15*s!AY15+s!AW15*s!AX15=0,0,N16*s!AU15*s!AZ15/(s!AT15*s!BA15+s!AU15*s!AZ15+s!AV15*s!AY15+s!AW15*s!AX15)) -> 445.77588989088542 | AV16: =AE16+IF(s!AU15*s!AV15+s!AT15*s!AW15=0,0,E16*s!AU15*s!AV15/(s!AU15*s!AV15+s!AT15*s!AW15))+IF(s!AV15*s!AX15+s!AT15*s!AZ15=0,0,M16*s!AV15*s!AX15/(s!AV15*s!AX15+s!AT15*s!AZ15))+IF(s!AV15*s!BA15+s!AW15*s!AZ15=0,0,Q16*s!AV15*s!BA15/(s!AV15*s!BA15+s!AW15*s!AZ15))+IF(s!AT15*s!BA15+s!AU15*s!AZ15+s!AV15*s!AY15+s!AW15*s!AX15=0,0,N16*s!AV15*s!AY15/(s!AT15*s!BA15+s!AU15*s!AZ15+s!AV15*s!AY15+s!AW15*s!AX15)) -> 13.943784411067998 | AW16: =AF16+IF(s!AT15*s!AW15+s!AU15*s!AV15=0,0,E16*s!AT15*s!AW15/(s!AT15*s!AW15+s!AU15*s!AV15))+IF(s!AU15*s!BA15+s!AW15*s!AY15=0,0,O16*s!AW15*s!AY15/(s!AU15*s!BA15+s!AW15*s!AY15))+IF(s!AV15*s!BA15+s!AW15*s!AZ15=0,0,Q16*s!AW15*s!AZ15/(s!AV15*s!BA15+s!AW15*s!AZ15))+IF(s!AT15*s!BA15+s!AU15*s!AZ15+s!AV15*s!AY15+s!AW15*s!AX15=0,0,N16*s!AW15*s!AX15/(s!AT15*s!BA15+s!AU15*s!AZ15+s!AV15*s!AY15+s!AW15*s!AX15)) -> 9.6229172590137324 | AX16: =AG16+IF(s!AT15*s!AY15+s!AU15*s!AX15=0,0,K16*s!AU15*s!AX15/(s!AT15*s!AY15+s!AU15*s!AX15))+IF(s!AV15*s!AX15+s!AT15*s!AZ15=0,0,M16*s!AV15*s!AX15/(s!AV15*s!AX15+s!AT15*s!AZ15))+IF(s!AX15*s!BA15+s!AY15*s!AZ15=0,0,W16*s!AX15*s!BA15/(s!AX15*s!BA15+s!AY15*s!AZ15))+IF(s!AT15*s!BA15+s!AU15*s!AZ15+s!AV15*s!AY15+s!AW15*s!AX15=0,0,N16*s!AW15*s!AX15/(s!AT15*s!BA15+s!AU15*s!AZ15+s!AV15*s!AY15+s!AW15*s!AX15)) -> 13.974790660892204 | AY16: =AH16+IF(s!AT15*s!AY15+s!AU15*s!AX15=0,0,K16*s!AT15*s!AY15/(s!AT15*s!AY15+s!AU15*s!AX15))+IF(s!AU15*s!BA15+s!AW15*s!AY15=0,0,O16*s!AW15*s!AY15/(s!AU15*s!BA15+s!AW15*s!AY15))+IF(s!AX15*s!BA15+s!AY15*s!AZ15=0,0,W16*s!AY15*s!AZ15/(s!AX15*s!BA15+s!AY15*s!AZ15))+IF(s!AT15*s!BA15+s!AU15*s!AZ15+s!AV15*s!AY15+s!AW15*s!AX15=0,0,N16*s!AV15*s!AY15/(s!AT15*s!BA15+s!AU15*s!AZ15+s!AV15*s!AY15+s!AW15*s!AX15)) -> 10.591911009189527 | AZ16: =AI16+IF(s!AT15*s!AZ15+s!AV15*s!AX15=0,0,M16*s!AT15*s!AZ15/(s!AT15*s!AZ15+s!AV15*s!AX15))+IF(s!AV15*s!BA15+s!AW15*s!AZ15=0,0,Q16*s!AW15*s!AZ15/(s!AV15*s!BA15+s!AW15*s!AZ15))+IF(s!AX15*s!BA15+s!AY15*s!AZ15=0,0,W16*s!AY15*s!AZ15/(s!AX15*s!BA15+s!AY15*s!AZ15))+IF(s!AT15*s!BA15+s!AU15*s!AZ15+s!AV15*s!AY15+s!AW15*s!AX15=0,0,N16*s!AU15*s!AZ15/(s!AT15*s!BA15+s!AU15*s!AZ15+s!AV15*s!AY15+s!AW15*s!AX15)) -> 17.424016489006959 | BA16: =AJ16+IF(s!AU15*s!BA15+s!AW15*s!AY15=0,0,O16*s!AU15*s!BA15/(s!AU15*s!BA15+s!AW15*s!AY15))+IF(s!AV15*s!BA15+s!AW15*s!AZ15=0,0,Q16*s!AV15*s!BA15/(s!AV15*s!BA15+s!AW15*s!AZ15))+IF(s!AX15*s!BA15+s!AY15*s!AZ15=0,0,W16*s!AX15*s!BA15/(s!AX15*s!BA15+s!AY15*s!AZ15))+IF(s!AT15*s!BA15+s!AU15*s!AZ15+s!AV15*s!AY15+s!AW15*s!AX15=0,0,N16*s!AT15*s!BA15/(s!AT15*s!BA15+s!AU15*s!AZ15+s!AV15*s!AY15+s!AW15*s!AX15)) -> 22.009281840911306 | BJ16: =SUM(AT16:BA16) -> 778
A17: =A16 -> 100 | B17: =B16 -> 30 | C17: =C16 -> 200 | D17: =D16 -> 2 | E17: =E16 -> 4 | F17: =F16 -> 1 | G17: =G16 -> 1 | H17: =H16 -> 2 | I17: =I16 -> 1 | J17: =J16 -> 2 | K17: =K16 -> 4 | L17: =L16 -> 2 | M17: =M16 -> 4 | N17: =N16 -> 8 | O17: =O16 -> 4 | P17: =P16 -> 2 | Q17: =Q16 -> 4 | R17: =R16 -> 2 | S17: =S16 -> 1 | T17: =T16 -> 2 | U17: =U16 -> 1 | V17: =V16 -> 2 | W17: =W16 -> 4 | X17: =X16 -> 2 | Y17: =Y16 -> 1 | Z17: =Z16 -> 2 | AA17: =AA16 -> 1 | AB17: =AB16 -> 389 | AC17: =AC16 -> 234 | AD17: =AD16 -> 433 | AE17: =AE16 -> 8 | AF17: =AF16 -> 7 | AG17: =AG16 -> 8 | AH17: =AH16 -> 8 | AI17: =AI16 -> 8 | AJ17: =AJ16 -> 8 | AS17: =AS16 -> 714 | AT17: =AC17+IF(s!AT16*s!AW16+s!AU16*s!AV16=0,0,E17*s!AT16*s!AW16/(s!AT16*s!AW16+s!AU16*s!AV16))+IF(s!AT16*s!AY16+s!AU16*s!AX16=0,0,K17*s!AT16*s!AY16/(s!AT16*s!AY16+s!AU16*s!AX16))+IF(s!AT16*s!AZ16+s!AV16*s!AX16=0,0,M17*s!AT16*s!AZ16/(s!AT16*s!AZ16+s!AV16*s!AX16))+IF(s!AT16*s!BA16+s!AU16*s!AZ16+s!AV16*s!AY16+s!AW16*s!AX16=0,0,N17*s!AT16*s!BA16/(s!AT16*s!BA16+s!AU16*s!AZ16+s!AV16*s!AY16+s!AW16*s!AX16)) -> 244.65758565208714 | AU17: =AD17+IF(s!AU16*s!AV16+s!AT16*s!AW16=0,0,E17*s!AU16*s!AV16/(s!AU16*s!AV16+s!AT16*s!AW16))+IF(s!AT16*s!AY16+s!AU16*s!AX16=0,0,K17*s!AU16*s!AX16/(s!AT16*s!AY16+s!AU16*s!AX16))+IF(s!AU16*s!BA16+s!AW16*s!AY16=0,0,O17*s!AU16*s!BA16/(s!AU16*s!BA16+s!AW16*s!AY16))+IF(s!AT16*s!BA16+s!AU16*s!AZ16+s!AV16*s!AY16+s!AW16*s!AX16=0,0,N17*s!AU16*s!AZ16/(s!AT16*s!BA16+s!AU16*s!AZ16+s!AV16*s!AY16+s!AW16*s!AX16)) -> 445.77531491352897 | AV17: =AE17+IF(s!AU16*s!AV16+s!AT16*s!AW16=0,0,E17*s!AU16*s!AV16/(s!AU16*s!AV16+s!AT16*s!AW16))+IF(s!AV16*s!AX16+s!AT16*s!AZ16=0,0,M17*s!AV16*s!AX16/(s!AV16*s!AX16+s!AT16*s!AZ16))+IF(s!AV16*s!BA16+s!AW16*s!AZ16=0,0,Q17*s!AV16*s!BA16/(s!AV16*s!BA16+s!AW16*s!AZ16))+IF(s!AT16*s!BA16+s!AU16*s!AZ16+s!AV16*s!AY16+s!AW16*s!AX16=0,0,N17*s!AV16*s!AY16/(s!AT16*s!BA16+s!AU16*s!AZ16+s!AV16*s!AY16+s!AW16*s!AX16)) -> 13.949033506807153 | AW17: =AF17+IF(s!AT16*s!AW16+s!AU16*s!AV16=0,0,E17*s!AT16*s!AW16/(s!AT16*s!AW16+s!AU16*s!AV16))+IF(s!AU16*s!BA16+s!AW16*s!AY16=0,0,O17*s!AW16*s!AY16/(s!AU16*s!BA16+s!AW16*s!AY16))+IF(s!AV16*s!BA16+s!AW16*s!AZ16=0,0,Q17*s!AW16*s!AZ16/(s!AV16*s!BA16+s!AW16*s!AZ16))+IF(s!AT16*s!BA16+s!AU16*s!AZ16+s!AV16*s!AY16+s!AW16*s!AX16=0,0,N17*s!AW16*s!AX16/(s!AT16*s!BA16+s!AU16*s!AZ16+s!AV16*s!AY16+s!AW16*s!AX16)) -> 9.6180659275767173 | AX17: =AG17+IF(s!AT16*s!AY16+s!AU16*s!AX16=0,0,K17*s!AU16*s!AX16/(s!AT16*s!AY16+s!AU16*s!AX16))+IF(s!AV16*s!AX16+s!AT16*s!AZ16=0,0,M17*s!AV16*s!AX16/(s!AV16*s!AX16+s!AT16*s!AZ16))+IF(s!AX16*s!BA16+s!AY16*s!AZ16=0,0,W17*s!AX16*s!BA16/(s!AX16*s!BA16+s!AY16*s!AZ16))+IF(s!AT16*s!BA16+s!AU16*s!AZ16+s!AV16*s!AY16+s!AW16*s!AX16=0,0,N17*s!AW16*s!AX16/(s!AT16*s!BA16+s!AU16*s!AZ16+s!AV16*s!AY16+s!AW16*s!AX16)) -> 13.979530584787966 | AY17: =AH17+IF(s!AT16*s!AY16+s!AU16*s!AX16=0,0,K17*s!AT16*s!AY16/(s!AT16*s!AY16+s!AU16*s!AX16))+IF(s!AU16*s!BA16+s!AW16*s!AY16=0,0,O17*s!AW16*s!AY16/(s!AU16*s!BA16+s!AW16*s!AY16))+IF(s!AX16*s!BA16+s!AY16*s!AZ16=0,0,W17*s!AY16*s!AZ16/(s!AX16*s!BA16+s!AY16*s!AZ16))+IF(s!AT16*s!BA16+s!AU16*s!AZ16+s!AV16*s!AY16+s!AW16*s!AX16=0,0,N17*s!AV16*s!AY16/(s!AT16*s!BA16+s!AU16*s!AZ16+s!AV16*s!AY16+s!AW16*s!AX16)) -> 10.587568849595904 | AZ17: =AI17+IF(s!AT16*s!AZ16+s!AV16*s!AX16=0,0,M17*s!AT16*s!AZ16/(s!AT16*s!AZ16+s!AV16*s!AX16))+IF(s!AV16*s!BA16+s!AW16*s!AZ16=0,0,Q17*s!AW16*s!AZ16/(s!AV16*s!BA16+s!AW16*s!AZ16))+IF(s!AX16*s!BA16+s!AY16*s!AZ16=0,0,W17*s!AY16*s!AZ16/(s!AX16*s!BA16+s!AY16*s!AZ16))+IF(s!AT16*s!BA16+s!AU16*s!AZ16+s!AV16*s!AY16+s!AW16*s!AX16=0,0,N17*s!AU16*s!AZ16/(s!AT16*s!BA16+s!AU16*s!AZ16+s!AV16*s!AY16+s!AW16*s!AX16)) -> 17.413850256317737 | BA17: =AJ17+IF(s!AU16*s!BA16+s!AW16*s!AY16=0,0,O17*s!AU16*s!BA16/(s!AU16*s!BA16+s!AW16*s!AY16))+IF(s!AV16*s!BA16+s!AW16*s!AZ16=0,0,Q17*s!AV16*s!BA16/(s!AV16*s!BA16+s!AW16*s!AZ16))+IF(s!AX16*s!BA16+s!AY16*s!AZ16=0,0,W17*s!AX16*s!BA16/(s!AX16*s!BA16+s!AY16*s!AZ16))+IF(s!AT16*s!BA16+s!AU16*s!AZ16+s!AV16*s!AY16+s!AW16*s!AX16=0,0,N17*s!AT16*s!BA16/(s!AT16*s!BA16+s!AU16*s!AZ16+s!AV16*s!AY16+s!AW16*s!AX16)) -> 22.019050309298393 | BJ17: =SUM(AT17:BA17) -> 778
A18: =A17 -> 100 | B18: =B17 -> 30 | C18: =C17 -> 200 | D18: =D17 -> 2 | E18: =E17 -> 4 | F18: =F17 -> 1 | G18: =G17 -> 1 | H18: =H17 -> 2 | I18: =I17 -> 1 | J18: =J17 -> 2 | K18: =K17 -> 4 | L18: =L17 -> 2 | M18: =M17 -> 4 | N18: =N17 -> 8 | O18: =O17 -> 4 | P18: =P17 -> 2 | Q18: =Q17 -> 4 | R18: =R17 -> 2 | S18: =S17 -> 1 | T18: =T17 -> 2 | U18: =U17 -> 1 | V18: =V17 -> 2 | W18: =W17 -> 4 | X18: =X17 -> 2 | Y18: =Y17 -> 1 | Z18: =Z17 -> 2 | AA18: =AA17 -> 1 | AB18: =AB17 -> 389 | AC18: =AC17 -> 234 | AD18: =AD17 -> 433 | AE18: =AE17 -> 8 | AF18: =AF17 -> 7 | AG18: =AG17 -> 8 | AH18: =AH17 -> 8 | AI18: =AI17 -> 8 | AJ18: =AJ17 -> 8 | AS18: =AS17 -> 714 | AT18: =AC18+IF(s!AT17*s!AW17+s!AU17*s!AV17=0,0,E18*s!AT17*s!AW17/(s!AT17*s!AW17+s!AU17*s!AV17))+IF(s!AT17*s!AY17+s!AU17*s!AX17=0,0,K18*s!AT17*s!AY17/(s!AT17*s!AY17+s!AU17*s!AX17))+IF(s!AT17*s!AZ17+s!AV17*s!AX17=0,0,M18*s!AT17*s!AZ17/(s!AT17*s!AZ17+s!AV17*s!AX17))+IF(s!AT17*s!BA17+s!AU17*s!AZ17+s!AV17*s!AY17+s!AW17*s!AX17=0,0,N18*s!AT17*s!BA17/(s!AT17*s!BA17+s!AU17*s!AZ17+s!AV17*s!AY17+s!AW17*s!AX17)) -> 244.65775635291141 | AU18: =AD18+IF(s!AU17*s!AV17+s!AT17*s!AW17=0,0,E18*s!AU17*s!AV17/(s!AU17*s!AV17+s!AT17*s!AW17))+IF(s!AT17*s!AY17+s!AU17*s!AX17=0,0,K18*s!AU17*s!AX17/(s!AT17*s!AY17+s!AU17*s!AX17))+IF(s!AU17*s!BA17+s!AW17*s!AY17=0,0,O18*s!AU17*s!BA17/(s!AU17*s!BA17+s!AW17*s!AY17))+IF(s!AT17*s!BA17+s!AU17*s!AZ17+s!AV17*s!AY17+s!AW17*s!AX17=0,0,N18*s!AU17*s!AZ17/(s!AT17*s!BA17+s!AU17*s!AZ17+s!AV17*s!AY17+s!AW17*s!AX17)) -> 445.7748737563868 | AV18: =AE18+IF(s!AU17*s!AV17+s!AT17*s!AW17=0,0,E18*s!AU17*s!AV17/(s!AU17*s!AV17+s!AT17*s!AW17))+IF(s!AV17*s!AX17+s!AT17*s!AZ17=0,0,M18*s!AV17*s!AX17/(s!AV17*s!AX17+s!AT17*s!AZ17))+IF(s!AV17*s!BA17+s!AW17*s!AZ17=0,0,Q18*s!AV17*s!BA17/(s!AV17*s!BA17+s!AW17*s!AZ17))+IF(s!AT17*s!BA17+s!AU17*s!AZ17+s!AV17*s!AY17+s!AW17*s!AX17=0,0,N18*s!AV17*s!AY17/(s!AT17*s!BA17+s!AU17*s!AZ17+s!AV17*s!AY17+s!AW17*s!AX17)) -> 13.952702683034428 | AW18: =AF18+IF(s!AT17*s!AW17+s!AU17*s!AV17=0,0,E18*s!AT17*s!AW17/(s!AT17*s!AW17+s!AU17*s!AV17))+IF(s!AU17*s!BA17+s!AW17*s!AY17=0,0,O18*s!AW17*s!AY17/(s!AU17*s!BA17+s!AW17*s!AY17))+IF(s!AV17*s!BA17+s!AW17*s!AZ17=0,0,Q18*s!AW17*s!AZ17/(s!AV17*s!BA17+s!AW17*s!AZ17))+IF(s!AT17*s!BA17+s!AU17*s!AZ17+s!AV17*s!AY17+s!AW17*s!AX17=0,0,N18*s!AW17*s!AX17/(s!AT17*s!BA17+s!AU17*s!AZ17+s!AV17*s!AY17+s!AW17*s!AX17)) -> 9.6146672076673294 | AX18: =AG18+IF(s!AT17*s!AY17+s!AU17*s!AX17=0,0,K18*s!AU17*s!AX17/(s!AT17*s!AY17+s!AU17*s!AX17))+IF(s!AV17*s!AX17+s!AT17*s!AZ17=0,0,M18*s!AV17*s!AX17/(s!AV17*s!AX17+s!AT17*s!AZ17))+IF(s!AX17*s!BA17+s!AY17*s!AZ17=0,0,W18*s!AX17*s!BA17/(s!AX17*s!BA17+s!AY17*s!AZ17))+IF(s!AT17*s!BA17+s!AU17*s!AZ17+s!AV17*s!AY17+s!AW17*s!AX17=0,0,N18*s!AW17*s!AX17/(s!AT17*s!BA17+s!AU17*s!AZ17+s!AV17*s!AY17+s!AW17*s!AX17)) -> 13.982839565502783 | AY18: =AH18+IF(s!AT17*s!AY17+s!AU17*s!AX17=0,0,K18*s!AT17*s!AY17/(s!AT17*s!AY17+s!AU17*s!AX17))+IF(s!AU17*s!BA17+s!AW17*s!AY17=0,0,O18*s!AW17*s!AY17/(s!AU17*s!BA17+s!AW17*s!AY17))+IF(s!AX17*s!BA17+s!AY17*s!AZ17=0,0,W18*s!AY17*s!AZ17/(s!AX17*s!BA17+s!AY17*s!AZ17))+IF(s!AT17*s!BA17+s!AU17*s!AZ17+s!AV17*s!AY17+s!AW17*s!AX17=0,0,N18*s!AV17*s!AY17/(s!AT17*s!BA17+s!AU17*s!AZ17+s!AV17*s!AY17+s!AW17*s!AX17)) -> 10.584530325198974 | AZ18: =AI18+IF(s!AT17*s!AZ17+s!AV17*s!AX17=0,0,M18*s!AT17*s!AZ17/(s!AT17*s!AZ17+s!AV17*s!AX17))+IF(s!AV17*s!BA17+s!AW17*s!AZ17=0,0,Q18*s!AW17*s!AZ17/(s!AV17*s!BA17+s!AW17*s!AZ17))+IF(s!AX17*s!BA17+s!AY17*s!AZ17=0,0,W18*s!AY17*s!AZ17/(s!AX17*s!BA17+s!AY17*s!AZ17))+IF(s!AT17*s!BA17+s!AU17*s!AZ17+s!AV17*s!AY17+s!AW17*s!AX17=0,0,N18*s!AU17*s!AZ17/(s!AT17*s!BA17+s!AU17*s!AZ17+s!AV17*s!AY17+s!AW17*s!AX17)) -> 17.406701398551366 | BA18: =AJ18+IF(s!AU17*s!BA17+s!AW17*s!AY17=0,0,O18*s!AU17*s!BA17/(s!AU17*s!BA17+s!AW17*s!AY17))+IF(s!AV17*s!BA17+s!AW17*s!AZ17=0,0,Q18*s!AV17*s!BA17/(s!AV17*s!BA17+s!AW17*s!AZ17))+IF(s!AX17*s!BA17+s!AY17*s!AZ17=0,0,W18*s!AX17*s!BA17/(s!AX17*s!BA17+s!AY17*s!AZ17))+IF(s!AT17*s!BA17+s!AU17*s!AZ17+s!AV17*s!AY17+s!AW17*s!AX17=0,0,N18*s!AT17*s!BA17/(s!AT17*s!BA17+s!AU17*s!AZ17+s!AV17*s!AY17+s!AW17*s!AX17)) -> 22.025928710746879 | BJ18: =SUM(AT18:BA18) -> 778
A19: =A18 -> 100 | B19: =B18 -> 30 | C19: =C18 -> 200 | D19: =D18 -> 2 | E19: =E18 -> 4 | F19: =F18 -> 1 | G19: =G18 -> 1 | H19: =H18 -> 2 | I19: =I18 -> 1 | J19: =J18 -> 2 | K19: =K18 -> 4 | L19: =L18 -> 2 | M19: =M18 -> 4 | N19: =N18 -> 8 | O19: =O18 -> 4 | P19: =P18 -> 2 | Q19: =Q18 -> 4 | R19: =R18 -> 2 | S19: =S18 -> 1 | T19: =T18 -> 2 | U19: =U18 -> 1 | V19: =V18 -> 2 | W19: =W18 -> 4 | X19: =X18 -> 2 | Y19: =Y18 -> 1 | Z19: =Z18 -> 2 | AA19: =AA18 -> 1 | AB19: =AB18 -> 389 | AC19: =AC18 -> 234 | AD19: =AD18 -> 433 | AE19: =AE18 -> 8 | AF19: =AF18 -> 7 | AG19: =AG18 -> 8 | AH19: =AH18 -> 8 | AI19: =AI18 -> 8 | AJ19: =AJ18 -> 8 | AS19: =AS18 -> 714 | AT19: =AC19+IF(s!AT18*s!AW18+s!AU18*s!AV18=0,0,E19*s!AT18*s!AW18/(s!AT18*s!AW18+s!AU18*s!AV18))+IF(s!AT18*s!AY18+s!AU18*s!AX18=0,0,K19*s!AT18*s!AY18/(s!AT18*s!AY18+s!AU18*s!AX18))+IF(s!AT18*s!AZ18+s!AV18*s!AX18=0,0,M19*s!AT18*s!AZ18/(s!AT18*s!AZ18+s!AV18*s!AX18))+IF(s!AT18*s!BA18+s!AU18*s!AZ18+s!AV18*s!AY18+s!AW18*s!AX18=0,0,N19*s!AT18*s!BA18/(s!AT18*s!BA18+s!AU18*s!AZ18+s!AV18*s!AY18+s!AW18*s!AX18)) -> 244.65790402872699 | AU19: =AD19+IF(s!AU18*s!AV18+s!AT18*s!AW18=0,0,E19*s!AU18*s!AV18/(s!AU18*s!AV18+s!AT18*s!AW18))+IF(s!AT18*s!AY18+s!AU18*s!AX18=0,0,K19*s!AU18*s!AX18/(s!AT18*s!AY18+s!AU18*s!AX18))+IF(s!AU18*s!BA18+s!AW18*s!AY18=0,0,O19*s!AU18*s!BA18/(s!AU18*s!BA18+s!AW18*s!AY18))+IF(s!AT18*s!BA18+s!AU18*s!AZ18+s!AV18*s!AY18+s!AW18*s!AX18=0,0,N19*s!AU18*s!AZ18/(s!AT18*s!BA18+s!AU18*s!AZ18+s!AV18*s!AY18+s!AW18*s!AX18)) -> 445.77454073063723 | AV19: =AE19+IF(s!AU18*s!AV18+s!AT18*s!AW18=0,0,E19*s!AU18*s!AV18/(s!AU18*s!AV18+s!AT18*s!AW18))+IF(s!AV18*s!AX18+s!AT18*s!AZ18=0,0,M19*s!AV18*s!AX18/(s!AV18*s!AX18+s!AT18*s!AZ18))+IF(s!AV18*s!BA18+s!AW18*s!AZ18=0,0,Q19*s!AV18*s!BA18/(s!AV18*s!BA18+s!AW18*s!AZ18))+IF(s!AT18*s!BA18+s!AU18*s!AZ18+s!AV18*s!AY18+s!AW18*s!AX18=0,0,N19*s!AV18*s!AY18/(s!AT18*s!BA18+s!AU18*s!AZ18+s!AV18*s!AY18+s!AW18*s!AX18)) -> 13.955274897308232 | AW19: =AF19+IF(s!AT18*s!AW18+s!AU18*s!AV18=0,0,E19*s!AT18*s!AW18/(s!AT18*s!AW18+s!AU18*s!AV18))+IF(s!AU18*s!BA18+s!AW18*s!AY18=0,0,O19*s!AW18*s!AY18/(s!AU18*s!BA18+s!AW18*s!AY18))+IF(s!AV18*s!BA18+s!AW18*s!AZ18=0,0,Q19*s!AW18*s!AZ18/(s!AV18*s!BA18+s!AW18*s!AZ18))+IF(s!AT18*s!BA18+s!AU18*s!AZ18+s!AV18*s!AY18+s!AW18*s!AX18=0,0,N19*s!AW18*s!AX18/(s!AT18*s!BA18+s!AU18*s!AZ18+s!AV18*s!AY18+s!AW18*s!AX18)) -> 9.6122803433276047 | AX19: =AG19+IF(s!AT18*s!AY18+s!AU18*s!AX18=0,0,K19*s!AU18*s!AX18/(s!AT18*s!AY18+s!AU18*s!AX18))+IF(s!AV18*s!AX18+s!AT18*s!AZ18=0,0,M19*s!AV18*s!AX18/(s!AV18*s!AX18+s!AT18*s!AZ18))+IF(s!AX18*s!BA18+s!AY18*s!AZ18=0,0,W19*s!AX18*s!BA18/(s!AX18*s!BA18+s!AY18*s!AZ18))+IF(s!AT18*s!BA18+s!AU18*s!AZ18+s!AV18*s!AY18+s!AW18*s!AX18=0,0,N19*s!AW18*s!AX18/(s!AT18*s!BA18+s!AU18*s!AZ18+s!AV18*s!AY18+s!AW18*s!AX18)) -> 13.985157483036565 | AY19: =AH19+IF(s!AT18*s!AY18+s!AU18*s!AX18=0,0,K19*s!AT18*s!AY18/(s!AT18*s!AY18+s!AU18*s!AX18))+IF(s!AU18*s!BA18+s!AW18*s!AY18=0,0,O19*s!AW18*s!AY18/(s!AU18*s!BA18+s!AW18*s!AY18))+IF(s!AX18*s!BA18+s!AY18*s!AZ18=0,0,W19*s!AY18*s!AZ18/(s!AX18*s!BA18+s!AY18*s!AZ18))+IF(s!AT18*s!BA18+s!AU18*s!AZ18+s!AV18*s!AY18+s!AW18*s!AX18=0,0,N19*s!AV18*s!AY18/(s!AT18*s!BA18+s!AU18*s!AZ18+s!AV18*s!AY18+s!AW18*s!AX18)) -> 10.582397757599271 | AZ19: =AI19+IF(s!AT18*s!AZ18+s!AV18*s!AX18=0,0,M19*s!AT18*s!AZ18/(s!AT18*s!AZ18+s!AV18*s!AX18))+IF(s!AV18*s!BA18+s!AW18*s!AZ18=0,0,Q19*s!AW18*s!AZ18/(s!AV18*s!BA18+s!AW18*s!AZ18))+IF(s!AX18*s!BA18+s!AY18*s!AZ18=0,0,W19*s!AY18*s!AZ18/(s!AX18*s!BA18+s!AY18*s!AZ18))+IF(s!AT18*s!BA18+s!AU18*s!AZ18+s!AV18*s!AY18+s!AW18*s!AX18=0,0,N19*s!AU18*s!AZ18/(s!AT18*s!BA18+s!AU18*s!AZ18+s!AV18*s!AY18+s!AW18*s!AX18)) -> 17.401663590928248 | BA19: =AJ19+IF(s!AU18*s!BA18+s!AW18*s!AY18=0,0,O19*s!AU18*s!BA18/(s!AU18*s!BA18+s!AW18*s!AY18))+IF(s!AV18*s!BA18+s!AW18*s!AZ18=0,0,Q19*s!AV18*s!BA18/(s!AV18*s!BA18+s!AW18*s!AZ18))+IF(s!AX18*s!BA18+s!AY18*s!AZ18=0,0,W19*s!AX18*s!BA18/(s!AX18*s!BA18+s!AY18*s!AZ18))+IF(s!AT18*s!BA18+s!AU18*s!AZ18+s!AV18*s!AY18+s!AW18*s!AX18=0,0,N19*s!AT18*s!BA18/(s!AT18*s!BA18+s!AU18*s!AZ18+s!AV18*s!AY18+s!AW18*s!AX18)) -> 22.030781168435912 | BJ19: =SUM(AT19:BA19) -> 778
A20: =A19 -> 100 | B20: =B19 -> 30 | C20: =C19 -> 200 | D20: =D19 -> 2 | E20: =E19 -> 4 | F20: =F19 -> 1 | G20: =G19 -> 1 | H20: =H19 -> 2 | I20: =I19 -> 1 | J20: =J19 -> 2 | K20: =K19 -> 4 | L20: =L19 -> 2 | M20: =M19 -> 4 | N20: =N19 -> 8 | O20: =O19 -> 4 | P20: =P19 -> 2 | Q20: =Q19 -> 4 | R20: =R19 -> 2 | S20: =S19 -> 1 | T20: =T19 -> 2 | U20: =U19 -> 1 | V20: =V19 -> 2 | W20: =W19 -> 4 | X20: =X19 -> 2 | Y20: =Y19 -> 1 | Z20: =Z19 -> 2 | AA20: =AA19 -> 1 | AB20: =AB19 -> 389 | AC20: =AC19 -> 234 | AD20: =AD19 -> 433 | AE20: =AE19 -> 8 | AF20: =AF19 -> 7 | AG20: =AG19 -> 8 | AH20: =AH19 -> 8 | AI20: =AI19 -> 8 | AJ20: =AJ19 -> 8 | AS20: =AS19 -> 714 | AT20: =AC20+IF(s!AT19*s!AW19+s!AU19*s!AV19=0,0,E20*s!AT19*s!AW19/(s!AT19*s!AW19+s!AU19*s!AV19))+IF(s!AT19*s!AY19+s!AU19*s!AX19=0,0,K20*s!AT19*s!AY19/(s!AT19*s!AY19+s!AU19*s!AX19))+IF(s!AT19*s!AZ19+s!AV19*s!AX19=0,0,M20*s!AT19*s!AZ19/(s!AT19*s!AZ19+s!AV19*s!AX19))+IF(s!AT19*s!BA19+s!AU19*s!AZ19+s!AV19*s!AY19+s!AW19*s!AX19=0,0,N20*s!AT19*s!BA19/(s!AT19*s!BA19+s!AU19*s!AZ19+s!AV19*s!AY19+s!AW19*s!AX19)) -> 244.65802447325422 | AU20: =AD20+IF(s!AU19*s!AV19+s!AT19*s!AW19=0,0,E20*s!AU19*s!AV19/(s!AU19*s!AV19+s!AT19*s!AW19))+IF(s!AT19*s!AY19+s!AU19*s!AX19=0,0,K20*s!AU19*s!AX19/(s!AT19*s!AY19+s!AU19*s!AX19))+IF(s!AU19*s!BA19+s!AW19*s!AY19=0,0,O20*s!AU19*s!BA19/(s!AU19*s!BA19+s!AW19*s!AY19))+IF(s!AT19*s!BA19+s!AU19*s!AZ19+s!AV19*s!AY19+s!AW19*s!AX19=0,0,N20*s!AU19*s!AZ19/(s!AT19*s!BA19+s!AU19*s!AZ19+s!AV19*s!AY19+s!AW19*s!AX19)) -> 445.77429236964753 | AV20: =AE20+IF(s!AU19*s!AV19+s!AT19*s!AW19=0,0,E20*s!AU19*s!AV19/(s!AU19*s!AV19+s!AT19*s!AW19))+IF(s!AV19*s!AX19+s!AT19*s!AZ19=0,0,M20*s!AV19*s!AX19/(s!AV19*s!AX19+s!AT19*s!AZ19))+IF(s!AV19*s!BA19+s!AW19*s!AZ19=0,0,Q20*s!AV19*s!BA19/(s!AV19*s!BA19+s!AW19*s!AZ19))+IF(s!AT19*s!BA19+s!AU19*s!AZ19+s!AV19*s!AY19+s!AW19*s!AX19=0,0,N20*s!AV19*s!AY19/(s!AT19*s!BA19+s!AU19*s!AZ19+s!AV19*s!AY19+s!AW19*s!AX19)) -> 13.957082754863432 | AW20: =AF20+IF(s!AT19*s!AW19+s!AU19*s!AV19=0,0,E20*s!AT19*s!AW19/(s!AT19*s!AW19+s!AU19*s!AV19))+IF(s!AU19*s!BA19+s!AW19*s!AY19=0,0,O20*s!AW19*s!AY19/(s!AU19*s!BA19+s!AW19*s!AY19))+IF(s!AV19*s!BA19+s!AW19*s!AZ19=0,0,Q20*s!AW19*s!AZ19/(s!AV19*s!BA19+s!AW19*s!AZ19))+IF(s!AT19*s!BA19+s!AU19*s!AZ19+s!AV19*s!AY19+s!AW19*s!AX19=0,0,N20*s!AW19*s!AX19/(s!AT19*s!BA19+s!AU19*s!AZ19+s!AV19*s!AY19+s!AW19*s!AX19)) -> 9.610600402234839 | AX20: =AG20+IF(s!AT19*s!AY19+s!AU19*s!AX19=0,0,K20*s!AU19*s!AX19/(s!AT19*s!AY19+s!AU19*s!AX19))+IF(s!AV19*s!AX19+s!AT19*s!AZ19=0,0,M20*s!AV19*s!AX19/(s!AV19*s!AX19+s!AT19*s!AZ19))+IF(s!AX19*s!BA19+s!AY19*s!AZ19=0,0,W20*s!AX19*s!BA19/(s!AX19*s!BA19+s!AY19*s!AZ19))+IF(s!AT19*s!BA19+s!AU19*s!AZ19+s!AV19*s!AY19+s!AW19*s!AX19=0,0,N20*s!AW19*s!AX19/(s!AT19*s!BA19+s!AU19*s!AZ19+s!AV19*s!AY19+s!AW19*s!AX19)) -> 13.986786013372505 | AY20: =AH20+IF(s!AT19*s!AY19+s!AU19*s!AX19=0,0,K20*s!AT19*s!AY19/(s!AT19*s!AY19+s!AU19*s!AX19))+IF(s!AU19*s!BA19+s!AW19*s!AY19=0,0,O20*s!AW19*s!AY19/(s!AU19*s!BA19+s!AW19*s!AY19))+IF(s!AX19*s!BA19+s!AY19*s!AZ19=0,0,W20*s!AY19*s!AZ19/(s!AX19*s!BA19+s!AY19*s!AZ19))+IF(s!AT19*s!BA19+s!AU19*s!AZ19+s!AV19*s!AY19+s!AW19*s!AX19=0,0,N20*s!AV19*s!AY19/(s!AT19*s!BA19+s!AU19*s!AZ19+s!AV19*s!AY19+s!AW19*s!AX19)) -> 10.580897143725766 | AZ20: =AI20+IF(s!AT19*s!AZ19+s!AV19*s!AX19=0,0,M20*s!AT19*s!AZ19/(s!AT19*s!AZ19+s!AV19*s!AX19))+IF(s!AV19*s!BA19+s!AW19*s!AZ19=0,0,Q20*s!AW19*s!AZ19/(s!AV19*s!BA19+s!AW19*s!AZ19))+IF(s!AX19*s!BA19+s!AY19*s!AZ19=0,0,W20*s!AY19*s!AZ19/(s!AX19*s!BA19+s!AY19*s!AZ19))+IF(s!AT19*s!BA19+s!AU19*s!AZ19+s!AV19*s!AY19+s!AW19*s!AX19=0,0,N20*s!AU19*s!AZ19/(s!AT19*s!BA19+s!AU19*s!AZ19+s!AV19*s!AY19+s!AW19*s!AX19)) -> 17.398106758509851 | BA20: =AJ20+IF(s!AU19*s!BA19+s!AW19*s!AY19=0,0,O20*s!AU19*s!BA19/(s!AU19*s!BA19+s!AW19*s!AY19))+IF(s!AV19*s!BA19+s!AW19*s!AZ19=0,0,Q20*s!AV19*s!BA19/(s!AV19*s!BA19+s!AW19*s!AZ19))+IF(s!AX19*s!BA19+s!AY19*s!AZ19=0,0,W20*s!AX19*s!BA19/(s!AX19*s!BA19+s!AY19*s!AZ19))+IF(s!AT19*s!BA19+s!AU19*s!AZ19+s!AV19*s!AY19+s!AW19*s!AX19=0,0,N20*s!AT19*s!BA19/(s!AT19*s!BA19+s!AU19*s!AZ19+s!AV19*s!AY19+s!AW19*s!AX19)) -> 22.03421008439188 | BJ20: =SUM(AT20:BA20) -> 778
A21: =A20 -> 100 | B21: =B20 -> 30 | C21: =C20 -> 200 | D21: =D20 -> 2 | E21: =E20 -> 4 | F21: =F20 -> 1 | G21: =G20 -> 1 | H21: =H20 -> 2 | I21: =I20 -> 1 | J21: =J20 -> 2 | K21: =K20 -> 4 | L21: =L20 -> 2 | M21: =M20 -> 4 | N21: =N20 -> 8 | O21: =O20 -> 4 | P21: =P20 -> 2 | Q21: =Q20 -> 4 | R21: =R20 -> 2 | S21: =S20 -> 1 | T21: =T20 -> 2 | U21: =U20 -> 1 | V21: =V20 -> 2 | W21: =W20 -> 4 | X21: =X20 -> 2 | Y21: =Y20 -> 1 | Z21: =Z20 -> 2 | AA21: =AA20 -> 1 | AB21: =AB20 -> 389 | AC21: =AC20 -> 234 | AD21: =AD20 -> 433 | AE21: =AE20 -> 8 | AF21: =AF20 -> 7 | AG21: =AG20 -> 8 | AH21: =AH20 -> 8 | AI21: =AI20 -> 8 | AJ21: =AJ20 -> 8 | AS21: =AS20 -> 714 | AT21: =AC21+IF(s!AT20*s!AW20+s!AU20*s!AV20=0,0,E21*s!AT20*s!AW20/(s!AT20*s!AW20+s!AU20*s!AV20))+IF(s!AT20*s!AY20+s!AU20*s!AX20=0,0,K21*s!AT20*s!AY20/(s!AT20*s!AY20+s!AU20*s!AX20))+IF(s!AT20*s!AZ20+s!AV20*s!AX20=0,0,M21*s!AT20*s!AZ20/(s!AT20*s!AZ20+s!AV20*s!AX20))+IF(s!AT20*s!BA20+s!AU20*s!AZ20+s!AV20*s!AY20+s!AW20*s!AX20=0,0,N21*s!AT20*s!BA20/(s!AT20*s!BA20+s!AU20*s!AZ20+s!AV20*s!AY20+s!AW20*s!AX20)) -> 244.65811916675258 | AU21: =AD21+IF(s!AU20*s!AV20+s!AT20*s!AW20=0,0,E21*s!AU20*s!AV20/(s!AU20*s!AV20+s!AT20*s!AW20))+IF(s!AT20*s!AY20+s!AU20*s!AX20=0,0,K21*s!AU20*s!AX20/(s!AT20*s!AY20+s!AU20*s!AX20))+IF(s!AU20*s!BA20+s!AW20*s!AY20=0,0,O21*s!AU20*s!BA20/(s!AU20*s!BA20+s!AW20*s!AY20))+IF(s!AT20*s!BA20+s!AU20*s!AZ20+s!AV20*s!AY20+s!AW20*s!AX20=0,0,N21*s!AU20*s!AZ20/(s!AT20*s!BA20+s!AU20*s!AZ20+s!AV20*s!AY20+s!AW20*s!AX20)) -> 445.77410885674698 | AV21: =AE21+IF(s!AU20*s!AV20+s!AT20*s!AW20=0,0,E21*s!AU20*s!AV20/(s!AU20*s!AV20+s!AT20*s!AW20))+IF(s!AV20*s!AX20+s!AT20*s!AZ20=0,0,M21*s!AV20*s!AX20/(s!AV20*s!AX20+s!AT20*s!AZ20))+IF(s!AV20*s!BA20+s!AW20*s!AZ20=0,0,Q21*s!AV20*s!BA20/(s!AV20*s!BA20+s!AW20*s!AZ20))+IF(s!AT20*s!BA20+s!AU20*s!AZ20+s!AV20*s!AY20+s!AW20*s!AX20=0,0,N21*s!AV20*s!AY20/(s!AT20*s!BA20+s!AU20*s!AZ20+s!AV20*s!AY20+s!AW20*s!AX20)) -> 13.958356294645672 | AW21: =AF21+IF(s!AT20*s!AW20+s!AU20*s!AV20=0,0,E21*s!AT20*s!AW20/(s!AT20*s!AW20+s!AU20*s!AV20))+IF(s!AU20*s!BA20+s!AW20*s!AY20=0,0,O21*s!AW20*s!AY20/(s!AU20*s!BA20+s!AW20*s!AY20))+IF(s!AV20*s!BA20+s!AW20*s!AZ20=0,0,Q21*s!AW20*s!AZ20/(s!AV20*s!BA20+s!AW20*s!AZ20))+IF(s!AT20*s!BA20+s!AU20*s!AZ20+s!AV20*s!AY20+s!AW20*s!AX20=0,0,N21*s!AW20*s!AX20/(s!AT20*s!BA20+s!AU20*s!AZ20+s!AV20*s!AY20+s!AW20*s!AX20)) -> 9.6094156818547702 | AX21: =AG21+IF(s!AT20*s!AY20+s!AU20*s!AX20=0,0,K21*s!AU20*s!AX20/(s!AT20*s!AY20+s!AU20*s!AX20))+IF(s!AV20*s!AX20+s!AT20*s!AZ20=0,0,M21*s!AV20*s!AX20/(s!AV20*s!AX20+s!AT20*s!AZ20))+IF(s!AX20*s!BA20+s!AY20*s!AZ20=0,0,W21*s!AX20*s!BA20/(s!AX20*s!BA20+s!AY20*s!AZ20))+IF(s!AT20*s!BA20+s!AU20*s!AZ20+s!AV20*s!AY20+s!AW20*s!AX20=0,0,N21*s!AW20*s!AX20/(s!AT20*s!BA20+s!AU20*s!AZ20+s!AV20*s!AY20+s!AW20*s!AX20)) -> 13.987933152091015 | AY21: =AH21+IF(s!AT20*s!AY20+s!AU20*s!AX20=0,0,K21*s!AT20*s!AY20/(s!AT20*s!AY20+s!AU20*s!AX20))+IF(s!AU20*s!BA20+s!AW20*s!AY20=0,0,O21*s!AW20*s!AY20/(s!AU20*s!BA20+s!AW20*s!AY20))+IF(s!AX20*s!BA20+s!AY20*s!AZ20=0,0,W21*s!AY20*s!AZ20/(s!AX20*s!BA20+s!AY20*s!AZ20))+IF(s!AT20*s!BA20+s!AU20*s!AZ20+s!AV20*s!AY20+s!AW20*s!AX20=0,0,N21*s!AV20*s!AY20/(s!AT20*s!BA20+s!AU20*s!AZ20+s!AV20*s!AY20+s!AW20*s!AX20)) -> 10.579838824409425 | AZ21: =AI21+IF(s!AT20*s!AZ20+s!AV20*s!AX20=0,0,M21*s!AT20*s!AZ20/(s!AT20*s!AZ20+s!AV20*s!AX20))+IF(s!AV20*s!BA20+s!AW20*s!AZ20=0,0,Q21*s!AW20*s!AZ20/(s!AV20*s!BA20+s!AW20*s!AZ20))+IF(s!AX20*s!BA20+s!AY20*s!AZ20=0,0,W21*s!AY20*s!AZ20/(s!AX20*s!BA20+s!AY20*s!AZ20))+IF(s!AT20*s!BA20+s!AU20*s!AZ20+s!AV20*s!AY20+s!AW20*s!AX20=0,0,N21*s!AU20*s!AZ20/(s!AT20*s!BA20+s!AU20*s!AZ20+s!AV20*s!AY20+s!AW20*s!AX20)) -> 17.39559138651072 | BA21: =AJ21+IF(s!AU20*s!BA20+s!AW20*s!AY20=0,0,O21*s!AU20*s!BA20/(s!AU20*s!BA20+s!AW20*s!AY20))+IF(s!AV20*s!BA20+s!AW20*s!AZ20=0,0,Q21*s!AV20*s!BA20/(s!AV20*s!BA20+s!AW20*s!AZ20))+IF(s!AX20*s!BA20+s!AY20*s!AZ20=0,0,W21*s!AX20*s!BA20/(s!AX20*s!BA20+s!AY20*s!AZ20))+IF(s!AT20*s!BA20+s!AU20*s!AZ20+s!AV20*s!AY20+s!AW20*s!AX20=0,0,N21*s!AT20*s!BA20/(s!AT20*s!BA20+s!AU20*s!AZ20+s!AV20*s!AY20+s!AW20*s!AX20)) -> 22.036636636988835 | BJ21: =SUM(AT21:BA21) -> 778
A22: =A21 -> 100 | B22: =B21 -> 30 | C22: =C21 -> 200 | D22: =D21 -> 2 | E22: =E21 -> 4 | F22: =F21 -> 1 | G22: =G21 -> 1 | H22: =H21 -> 2 | I22: =I21 -> 1 | J22: =J21 -> 2 | K22: =K21 -> 4 | L22: =L21 -> 2 | M22: =M21 -> 4 | N22: =N21 -> 8 | O22: =O21 -> 4 | P22: =P21 -> 2 | Q22: =Q21 -> 4 | R22: =R21 -> 2 | S22: =S21 -> 1 | T22: =T21 -> 2 | U22: =U21 -> 1 | V22: =V21 -> 2 | W22: =W21 -> 4 | X22: =X21 -> 2 | Y22: =Y21 -> 1 | Z22: =Z21 -> 2 | AA22: =AA21 -> 1 | AB22: =AB21 -> 389 | AC22: =AC21 -> 234 | AD22: =AD21 -> 433 | AE22: =AE21 -> 8 | AF22: =AF21 -> 7 | AG22: =AG21 -> 8 | AH22: =AH21 -> 8 | AI22: =AI21 -> 8 | AJ22: =AJ21 -> 8 | AS22: =AS21 -> 714 | AT22: =AC22+IF(s!AT21*s!AW21+s!AU21*s!AV21=0,0,E22*s!AT21*s!AW21/(s!AT21*s!AW21+s!AU21*s!AV21))+IF(s!AT21*s!AY21+s!AU21*s!AX21=0,0,K22*s!AT21*s!AY21/(s!AT21*s!AY21+s!AU21*s!AX21))+IF(s!AT21*s!AZ21+s!AV21*s!AX21=0,0,M22*s!AT21*s!AZ21/(s!AT21*s!AZ21+s!AV21*s!AX21))+IF(s!AT21*s!BA21+s!AU21*s!AZ21+s!AV21*s!AY21+s!AW21*s!AX21=0,0,N22*s!AT21*s!BA21/(s!AT21*s!BA21+s!AU21*s!AZ21+s!AV21*s!AY21+s!AW21*s!AX21)) -> 244.65819180238103 | AU22: =AD22+IF(s!AU21*s!AV21+s!AT21*s!AW21=0,0,E22*s!AU21*s!AV21/(s!AU21*s!AV21+s!AT21*s!AW21))+IF(s!AT21*s!AY21+s!AU21*s!AX21=0,0,K22*s!AU21*s!AX21/(s!AT21*s!AY21+s!AU21*s!AX21))+IF(s!AU21*s!BA21+s!AW21*s!AY21=0,0,O22*s!AU21*s!BA21/(s!AU21*s!BA21+s!AW21*s!AY21))+IF(s!AT21*s!BA21+s!AU21*s!AZ21+s!AV21*s!AY21+s!AW21*s!AX21=0,0,N22*s!AU21*s!AZ21/(s!AT21*s!BA21+s!AU21*s!AZ21+s!AV21*s!AY21+s!AW21*s!AX21)) -> 445.77397422558192 | AV22: =AE22+IF(s!AU21*s!AV21+s!AT21*s!AW21=0,0,E22*s!AU21*s!AV21/(s!AU21*s!AV21+s!AT21*s!AW21))+IF(s!AV21*s!AX21+s!AT21*s!AZ21=0,0,M22*s!AV21*s!AX21/(s!AV21*s!AX21+s!AT21*s!AZ21))+IF(s!AV21*s!BA21+s!AW21*s!AZ21=0,0,Q22*s!AV21*s!BA21/(s!AV21*s!BA21+s!AW21*s!AZ21))+IF(s!AT21*s!BA21+s!AU21*s!AZ21+s!AV21*s!AY21+s!AW21*s!AX21=0,0,N22*s!AV21*s!AY21/(s!AT21*s!BA21+s!AU21*s!AZ21+s!AV21*s!AY21+s!AW21*s!AX21)) -> 13.959255242927407 | AW22: =AF22+IF(s!AT21*s!AW21+s!AU21*s!AV21=0,0,E22*s!AT21*s!AW21/(s!AT21*s!AW21+s!AU21*s!AV21))+IF(s!AU21*s!BA21+s!AW21*s!AY21=0,0,O22*s!AW21*s!AY21/(s!AU21*s!BA21+s!AW21*s!AY21))+IF(s!AV21*s!BA21+s!AW21*s!AZ21=0,0,Q22*s!AW21*s!AZ21/(s!AV21*s!BA21+s!AW21*s!AZ21))+IF(s!AT21*s!BA21+s!AU21*s!AZ21+s!AV21*s!AY21+s!AW21*s!AX21=0,0,N22*s!AW21*s!AX21/(s!AT21*s!BA21+s!AU21*s!AZ21+s!AV21*s!AY21+s!AW21*s!AX21)) -> 9.6085787291096736 | AX22: =AG22+IF(s!AT21*s!AY21+s!AU21*s!AX21=0,0,K22*s!AU21*s!AX21/(s!AT21*s!AY21+s!AU21*s!AX21))+IF(s!AV21*s!AX21+s!AT21*s!AZ21=0,0,M22*s!AV21*s!AX21/(s!AV21*s!AX21+s!AT21*s!AZ21))+IF(s!AX21*s!BA21+s!AY21*s!AZ21=0,0,W22*s!AX21*s!BA21/(s!AX21*s!BA21+s!AY21*s!AZ21))+IF(s!AT21*s!BA21+s!AU21*s!AZ21+s!AV21*s!AY21+s!AW21*s!AX21=0,0,N22*s!AW21*s!AX21/(s!AT21*s!BA21+s!AU21*s!AZ21+s!AV21*s!AY21+s!AW21*s!AX21)) -> 13.988742999901749 | AY22: =AH22+IF(s!AT21*s!AY21+s!AU21*s!AX21=0,0,K22*s!AT21*s!AY21/(s!AT21*s!AY21+s!AU21*s!AX21))+IF(s!AU21*s!BA21+s!AW21*s!AY21=0,0,O22*s!AW21*s!AY21/(s!AU21*s!BA21+s!AW21*s!AY21))+IF(s!AX21*s!BA21+s!AY21*s!AZ21=0,0,W22*s!AY21*s!AZ21/(s!AX21*s!BA21+s!AY21*s!AZ21))+IF(s!AT21*s!BA21+s!AU21*s!AZ21+s!AV21*s!AY21+s!AW21*s!AX21=0,0,N22*s!AV21*s!AY21/(s!AT21*s!BA21+s!AU21*s!AZ21+s!AV21*s!AY21+s!AW21*s!AX21)) -> 10.579090972135331 | AZ22: =AI22+IF(s!AT21*s!AZ21+s!AV21*s!AX21=0,0,M22*s!AT21*s!AZ21/(s!AT21*s!AZ21+s!AV21*s!AX21))+IF(s!AV21*s!BA21+s!AW21*s!AZ21=0,0,Q22*s!AW21*s!AZ21/(s!AV21*s!BA21+s!AW21*s!AZ21))+IF(s!AX21*s!BA21+s!AY21*s!AZ21=0,0,W22*s!AY21*s!AZ21/(s!AX21*s!BA21+s!AY21*s!AZ21))+IF(s!AT21*s!BA21+s!AU21*s!AZ21+s!AV21*s!AY21+s!AW21*s!AX21=0,0,N22*s!AU21*s!AZ21/(s!AT21*s!BA21+s!AU21*s!AZ21+s!AV21*s!AY21+s!AW21*s!AX21)) -> 17.393809954789827 | BA22: =AJ22+IF(s!AU21*s!BA21+s!AW21*s!AY21=0,0,O22*s!AU21*s!BA21/(s!AU21*s!BA21+s!AW21*s!AY21))+IF(s!AV21*s!BA21+s!AW21*s!AZ21=0,0,Q22*s!AV21*s!BA21/(s!AV21*s!BA21+s!AW21*s!AZ21))+IF(s!AX21*s!BA21+s!AY21*s!AZ21=0,0,W22*s!AX21*s!BA21/(s!AX21*s!BA21+s!AY21*s!AZ21))+IF(s!AT21*s!BA21+s!AU21*s!AZ21+s!AV21*s!AY21+s!AW21*s!AX21=0,0,N22*s!AT21*s!BA21/(s!AT21*s!BA21+s!AU21*s!AZ21+s!AV21*s!AY21+s!AW21*s!AX21)) -> 22.038356073173091 | BJ22: =SUM(AT22:BA22) -> 778
A23: =A22 -> 100 | B23: =B22 -> 30 | C23: =C22 -> 200 | D23: =D22 -> 2 | E23: =E22 -> 4 | F23: =F22 -> 1 | G23: =G22 -> 1 | H23: =H22 -> 2 | I23: =I22 -> 1 | J23: =J22 -> 2 | K23: =K22 -> 4 | L23: =L22 -> 2 | M23: =M22 -> 4 | N23: =N22 -> 8 | O23: =O22 -> 4 | P23: =P22 -> 2 | Q23: =Q22 -> 4 | R23: =R22 -> 2 | S23: =S22 -> 1 | T23: =T22 -> 2 | U23: =U22 -> 1 | V23: =V22 -> 2 | W23: =W22 -> 4 | X23: =X22 -> 2 | Y23: =Y22 -> 1 | Z23: =Z22 -> 2 | AA23: =AA22 -> 1 | AB23: =AB22 -> 389 | AC23: =AC22 -> 234 | AD23: =AD22 -> 433 | AE23: =AE22 -> 8 | AF23: =AF22 -> 7 | AG23: =AG22 -> 8 | AH23: =AH22 -> 8 | AI23: =AI22 -> 8 | AJ23: =AJ22 -> 8 | AS23: =AS22 -> 714 | AT23: =AC23+IF(s!AT22*s!AW22+s!AU22*s!AV22=0,0,E23*s!AT22*s!AW22/(s!AT22*s!AW22+s!AU22*s!AV22))+IF(s!AT22*s!AY22+s!AU22*s!AX22=0,0,K23*s!AT22*s!AY22/(s!AT22*s!AY22+s!AU22*s!AX22))+IF(s!AT22*s!AZ22+s!AV22*s!AX22=0,0,M23*s!AT22*s!AZ22/(s!AT22*s!AZ22+s!AV22*s!AX22))+IF(s!AT22*s!BA22+s!AU22*s!AZ22+s!AV22*s!AY22+s!AW22*s!AX22=0,0,N23*s!AT22*s!BA22/(s!AT22*s!BA22+s!AU22*s!AZ22+s!AV22*s!AY22+s!AW22*s!AX22)) -> 244.65824655955768 | AU23: =AD23+IF(s!AU22*s!AV22+s!AT22*s!AW22=0,0,E23*s!AU22*s!AV22/(s!AU22*s!AV22+s!AT22*s!AW22))+IF(s!AT22*s!AY22+s!AU22*s!AX22=0,0,K23*s!AU22*s!AX22/(s!AT22*s!AY22+s!AU22*s!AX22))+IF(s!AU22*s!BA22+s!AW22*s!AY22=0,0,O23*s!AU22*s!BA22/(s!AU22*s!BA22+s!AW22*s!AY22))+IF(s!AT22*s!BA22+s!AU22*s!AZ22+s!AV22*s!AY22+s!AW22*s!AX22=0,0,N23*s!AU22*s!AZ22/(s!AT22*s!BA22+s!AU22*s!AZ22+s!AV22*s!AY22+s!AW22*s!AX22)) -> 445.77387600371969 | AV23: =AE23+IF(s!AU22*s!AV22+s!AT22*s!AW22=0,0,E23*s!AU22*s!AV22/(s!AU22*s!AV22+s!AT22*s!AW22))+IF(s!AV22*s!AX22+s!AT22*s!AZ22=0,0,M23*s!AV22*s!AX22/(s!AV22*s!AX22+s!AT22*s!AZ22))+IF(s!AV22*s!BA22+s!AW22*s!AZ22=0,0,Q23*s!AV22*s!BA22/(s!AV22*s!BA22+s!AW22*s!AZ22))+IF(s!AT22*s!BA22+s!AU22*s!AZ22+s!AV22*s!AY22+s!AW22*s!AX22=0,0,N23*s!AV22*s!AY22/(s!AT22*s!BA22+s!AU22*s!AZ22+s!AV22*s!AY22+s!AW22*s!AX22)) -> 13.959890901488318 | AW23: =AF23+IF(s!AT22*s!AW22+s!AU22*s!AV22=0,0,E23*s!AT22*s!AW22/(s!AT22*s!AW22+s!AU22*s!AV22))+IF(s!AU22*s!BA22+s!AW22*s!AY22=0,0,O23*s!AW22*s!AY22/(s!AU22*s!BA22+s!AW22*s!AY22))+IF(s!AV22*s!BA22+s!AW22*s!AZ22=0,0,Q23*s!AW22*s!AZ22/(s!AV22*s!BA22+s!AW22*s!AZ22))+IF(s!AT22*s!BA22+s!AU22*s!AZ22+s!AV22*s!AY22+s!AW22*s!AX22=0,0,N23*s!AW22*s!AX22/(s!AT22*s!BA22+s!AU22*s!AZ22+s!AV22*s!AY22+s!AW22*s!AX22)) -> 9.6079865352342999 | AX23: =AG23+IF(s!AT22*s!AY22+s!AU22*s!AX22=0,0,K23*s!AU22*s!AX22/(s!AT22*s!AY22+s!AU22*s!AX22))+IF(s!AV22*s!AX22+s!AT22*s!AZ22=0,0,M23*s!AV22*s!AX22/(s!AV22*s!AX22+s!AT22*s!AZ22))+IF(s!AX22*s!BA22+s!AY22*s!AZ22=0,0,W23*s!AX22*s!BA22/(s!AX22*s!BA22+s!AY22*s!AZ22))+IF(s!AT22*s!BA22+s!AU22*s!AZ22+s!AV22*s!AY22+s!AW22*s!AX22=0,0,N23*s!AW22*s!AX22/(s!AT22*s!BA22+s!AU22*s!AZ22+s!AV22*s!AY22+s!AW22*s!AX22)) -> 13.989315823818831 | AY23: =AH23+IF(s!AT22*s!AY22+s!AU22*s!AX22=0,0,K23*s!AT22*s!AY22/(s!AT22*s!AY22+s!AU22*s!AX22))+IF(s!AU22*s!BA22+s!AW22*s!AY22=0,0,O23*s!AW22*s!AY22/(s!AU22*s!BA22+s!AW22*s!AY22))+IF(s!AX22*s!BA22+s!AY22*s!AZ22=0,0,W23*s!AY22*s!AZ22/(s!AX22*s!BA22+s!AY22*s!AZ22))+IF(s!AT22*s!BA22+s!AU22*s!AZ22+s!AV22*s!AY22+s!AW22*s!AX22=0,0,N23*s!AV22*s!AY22/(s!AT22*s!BA22+s!AU22*s!AZ22+s!AV22*s!AY22+s!AW22*s!AX22)) -> 10.578561612903787 | AZ23: =AI23+IF(s!AT22*s!AZ22+s!AV22*s!AX22=0,0,M23*s!AT22*s!AZ22/(s!AT22*s!AZ22+s!AV22*s!AX22))+IF(s!AV22*s!BA22+s!AW22*s!AZ22=0,0,Q23*s!AW22*s!AZ22/(s!AV22*s!BA22+s!AW22*s!AZ22))+IF(s!AX22*s!BA22+s!AY22*s!AZ22=0,0,W23*s!AY22*s!AZ22/(s!AX22*s!BA22+s!AY22*s!AZ22))+IF(s!AT22*s!BA22+s!AU22*s!AZ22+s!AV22*s!AY22+s!AW22*s!AX22=0,0,N23*s!AU22*s!AZ22/(s!AT22*s!BA22+s!AU22*s!AZ22+s!AV22*s!AY22+s!AW22*s!AX22)) -> 17.39254671513514 | BA23: =AJ23+IF(s!AU22*s!BA22+s!AW22*s!AY22=0,0,O23*s!AU22*s!BA22/(s!AU22*s!BA22+s!AW22*s!AY22))+IF(s!AV22*s!BA22+s!AW22*s!AZ22=0,0,Q23*s!AV22*s!BA22/(s!AV22*s!BA22+s!AW22*s!AZ22))+IF(s!AX22*s!BA22+s!AY22*s!AZ22=0,0,W23*s!AX22*s!BA22/(s!AX22*s!BA22+s!AY22*s!AZ22))+IF(s!AT22*s!BA22+s!AU22*s!AZ22+s!AV22*s!AY22+s!AW22*s!AX22=0,0,N23*s!AT22*s!BA22/(s!AT22*s!BA22+s!AU22*s!AZ22+s!AV22*s!AY22+s!AW22*s!AX22)) -> 22.039575848142242 | BJ23: =SUM(AT23:BA23) -> 778
A24: =A23 -> 100 | B24: =B23 -> 30 | C24: =C23 -> 200 | D24: =D23 -> 2 | E24: =E23 -> 4 | F24: =F23 -> 1 | G24: =G23 -> 1 | H24: =H23 -> 2 | I24: =I23 -> 1 | J24: =J23 -> 2 | K24: =K23 -> 4 | L24: =L23 -> 2 | M24: =M23 -> 4 | N24: =N23 -> 8 | O24: =O23 -> 4 | P24: =P23 -> 2 | Q24: =Q23 -> 4 | R24: =R23 -> 2 | S24: =S23 -> 1 | T24: =T23 -> 2 | U24: =U23 -> 1 | V24: =V23 -> 2 | W24: =W23 -> 4 | X24: =X23 -> 2 | Y24: =Y23 -> 1 | Z24: =Z23 -> 2 | AA24: =AA23 -> 1 | AB24: =AB23 -> 389 | AC24: =AC23 -> 234 | AD24: =AD23 -> 433 | AE24: =AE23 -> 8 | AF24: =AF23 -> 7 | AG24: =AG23 -> 8 | AH24: =AH23 -> 8 | AI24: =AI23 -> 8 | AJ24: =AJ23 -> 8 | AS24: =AS23 -> 714 | AT24: =AC24+IF(s!AT23*s!AW23+s!AU23*s!AV23=0,0,E24*s!AT23*s!AW23/(s!AT23*s!AW23+s!AU23*s!AV23))+IF(s!AT23*s!AY23+s!AU23*s!AX23=0,0,K24*s!AT23*s!AY23/(s!AT23*s!AY23+s!AU23*s!AX23))+IF(s!AT23*s!AZ23+s!AV23*s!AX23=0,0,M24*s!AT23*s!AZ23/(s!AT23*s!AZ23+s!AV23*s!AX23))+IF(s!AT23*s!BA23+s!AU23*s!AZ23+s!AV23*s!AY23+s!AW23*s!AX23=0,0,N24*s!AT23*s!BA23/(s!AT23*s!BA23+s!AU23*s!AZ23+s!AV23*s!AY23+s!AW23*s!AX23)) -> 244.65828732096753 | AU24: =AD24+IF(s!AU23*s!AV23+s!AT23*s!AW23=0,0,E24*s!AU23*s!AV23/(s!AU23*s!AV23+s!AT23*s!AW23))+IF(s!AT23*s!AY23+s!AU23*s!AX23=0,0,K24*s!AU23*s!AX23/(s!AT23*s!AY23+s!AU23*s!AX23))+IF(s!AU23*s!BA23+s!AW23*s!AY23=0,0,O24*s!AU23*s!BA23/(s!AU23*s!BA23+s!AW23*s!AY23))+IF(s!AT23*s!BA23+s!AU23*s!AZ23+s!AV23*s!AY23+s!AW23*s!AX23=0,0,N24*s!AU23*s!AZ23/(s!AT23*s!BA23+s!AU23*s!AZ23+s!AV23*s!AY23+s!AW23*s!AX23)) -> 445.77380465617989 | AV24: =AE24+IF(s!AU23*s!AV23+s!AT23*s!AW23=0,0,E24*s!AU23*s!AV23/(s!AU23*s!AV23+s!AT23*s!AW23))+IF(s!AV23*s!AX23+s!AT23*s!AZ23=0,0,M24*s!AV23*s!AX23/(s!AV23*s!AX23+s!AT23*s!AZ23))+IF(s!AV23*s!BA23+s!AW23*s!AZ23=0,0,Q24*s!AV23*s!BA23/(s!AV23*s!BA23+s!AW23*s!AZ23))+IF(s!AT23*s!BA23+s!AU23*s!AZ23+s!AV23*s!AY23+s!AW23*s!AX23=0,0,N24*s!AV23*s!AY23/(s!AT23*s!BA23+s!AU23*s!AZ23+s!AV23*s!AY23+s!AW23*s!AX23)) -> 13.960341079009957 | AW24: =AF24+IF(s!AT23*s!AW23+s!AU23*s!AV23=0,0,E24*s!AT23*s!AW23/(s!AT23*s!AW23+s!AU23*s!AV23))+IF(s!AU23*s!BA23+s!AW23*s!AY23=0,0,O24*s!AW23*s!AY23/(s!AU23*s!BA23+s!AW23*s!AY23))+IF(s!AV23*s!BA23+s!AW23*s!AZ23=0,0,Q24*s!AW23*s!AZ23/(s!AV23*s!BA23+s!AW23*s!AZ23))+IF(s!AT23*s!BA23+s!AU23*s!AZ23+s!AV23*s!AY23+s!AW23*s!AX23=0,0,N24*s!AW23*s!AX23/(s!AT23*s!BA23+s!AU23*s!AZ23+s!AV23*s!AY23+s!AW23*s!AX23)) -> 9.6075669438426292 | AX24: =AG24+IF(s!AT23*s!AY23+s!AU23*s!AX23=0,0,K24*s!AU23*s!AX23/(s!AT23*s!AY23+s!AU23*s!AX23))+IF(s!AV23*s!AX23+s!AT23*s!AZ23=0,0,M24*s!AV23*s!AX23/(s!AV23*s!AX23+s!AT23*s!AZ23))+IF(s!AX23*s!BA23+s!AY23*s!AZ23=0,0,W24*s!AX23*s!BA23/(s!AX23*s!BA23+s!AY23*s!AZ23))+IF(s!AT23*s!BA23+s!AU23*s!AZ23+s!AV23*s!AY23+s!AW23*s!AX23=0,0,N24*s!AW23*s!AX23/(s!AT23*s!BA23+s!AU23*s!AZ23+s!AV23*s!AY23+s!AW23*s!AX23)) -> 13.989721658539027 | AY24: =AH24+IF(s!AT23*s!AY23+s!AU23*s!AX23=0,0,K24*s!AT23*s!AY23/(s!AT23*s!AY23+s!AU23*s!AX23))+IF(s!AU23*s!BA23+s!AW23*s!AY23=0,0,O24*s!AW23*s!AY23/(s!AU23*s!BA23+s!AW23*s!AY23))+IF(s!AX23*s!BA23+s!AY23*s!AZ23=0,0,W24*s!AY23*s!AZ23/(s!AX23*s!BA23+s!AY23*s!AZ23))+IF(s!AT23*s!BA23+s!AU23*s!AZ23+s!AV23*s!AY23+s!AW23*s!AX23=0,0,N24*s!AV23*s!AY23/(s!AT23*s!BA23+s!AU23*s!AZ23+s!AV23*s!AY23+s!AW23*s!AX23)) -> 10.578186364313558 | AZ24: =AI24+IF(s!AT23*s!AZ23+s!AV23*s!AX23=0,0,M24*s!AT23*s!AZ23/(s!AT23*s!AZ23+s!AV23*s!AX23))+IF(s!AV23*s!BA23+s!AW23*s!AZ23=0,0,Q24*s!AW23*s!AZ23/(s!AV23*s!BA23+s!AW23*s!AZ23))+IF(s!AX23*s!BA23+s!AY23*s!AZ23=0,0,W24*s!AY23*s!AZ23/(s!AX23*s!BA23+s!AY23*s!AZ23))+IF(s!AT23*s!BA23+s!AU23*s!AZ23+s!AV23*s!AY23+s!AW23*s!AX23=0,0,N24*s!AU23*s!AZ23/(s!AT23*s!BA23+s!AU23*s!AZ23+s!AV23*s!AY23+s!AW23*s!AX23)) -> 17.391649941483486 | BA24: =AJ24+IF(s!AU23*s!BA23+s!AW23*s!AY23=0,0,O24*s!AU23*s!BA23/(s!AU23*s!BA23+s!AW23*s!AY23))+IF(s!AV23*s!BA23+s!AW23*s!AZ23=0,0,Q24*s!AV23*s!BA23/(s!AV23*s!BA23+s!AW23*s!AZ23))+IF(s!AX23*s!BA23+s!AY23*s!AZ23=0,0,W24*s!AX23*s!BA23/(s!AX23*s!BA23+s!AY23*s!AZ23))+IF(s!AT23*s!BA23+s!AU23*s!AZ23+s!AV23*s!AY23+s!AW23*s!AX23=0,0,N24*s!AT23*s!BA23/(s!AT23*s!BA23+s!AU23*s!AZ23+s!AV23*s!AY23+s!AW23*s!AX23)) -> 22.040442035663929 | BJ24: =SUM(AT24:BA24) -> 778
A25: =A24 -> 100 | B25: =B24 -> 30 | C25: =C24 -> 200 | D25: =D24 -> 2 | E25: =E24 -> 4 | F25: =F24 -> 1 | G25: =G24 -> 1 | H25: =H24 -> 2 | I25: =I24 -> 1 | J25: =J24 -> 2 | K25: =K24 -> 4 | L25: =L24 -> 2 | M25: =M24 -> 4 | N25: =N24 -> 8 | O25: =O24 -> 4 | P25: =P24 -> 2 | Q25: =Q24 -> 4 | R25: =R24 -> 2 | S25: =S24 -> 1 | T25: =T24 -> 2 | U25: =U24 -> 1 | V25: =V24 -> 2 | W25: =W24 -> 4 | X25: =X24 -> 2 | Y25: =Y24 -> 1 | Z25: =Z24 -> 2 | AA25: =AA24 -> 1 | AB25: =AB24 -> 389 | AC25: =AC24 -> 234 | AD25: =AD24 -> 433 | AE25: =AE24 -> 8 | AF25: =AF24 -> 7 | AG25: =AG24 -> 8 | AH25: =AH24 -> 8 | AI25: =AI24 -> 8 | AJ25: =AJ24 -> 8 | AS25: =AS24 -> 714 | AT25: =AC25+IF(s!AT24*s!AW24+s!AU24*s!AV24=0,0,E25*s!AT24*s!AW24/(s!AT24*s!AW24+s!AU24*s!AV24))+IF(s!AT24*s!AY24+s!AU24*s!AX24=0,0,K25*s!AT24*s!AY24/(s!AT24*s!AY24+s!AU24*s!AX24))+IF(s!AT24*s!AZ24+s!AV24*s!AX24=0,0,M25*s!AT24*s!AZ24/(s!AT24*s!AZ24+s!AV24*s!AX24))+IF(s!AT24*s!BA24+s!AU24*s!AZ24+s!AV24*s!AY24+s!AW24*s!AX24=0,0,N25*s!AT24*s!BA24/(s!AT24*s!BA24+s!AU24*s!AZ24+s!AV24*s!AY24+s!AW24*s!AX24)) -> 244.65831738025796 | AU25: =AD25+IF(s!AU24*s!AV24+s!AT24*s!AW24=0,0,E25*s!AU24*s!AV24/(s!AU24*s!AV24+s!AT24*s!AW24))+IF(s!AT24*s!AY24+s!AU24*s!AX24=0,0,K25*s!AU24*s!AX24/(s!AT24*s!AY24+s!AU24*s!AX24))+IF(s!AU24*s!BA24+s!AW24*s!AY24=0,0,O25*s!AU24*s!BA24/(s!AU24*s!BA24+s!AW24*s!AY24))+IF(s!AT24*s!BA24+s!AU24*s!AZ24+s!AV24*s!AY24+s!AW24*s!AX24=0,0,N25*s!AU24*s!AZ24/(s!AT24*s!BA24+s!AU24*s!AZ24+s!AV24*s!AY24+s!AW24*s!AX24)) -> 445.77375300695019 | AV25: =AE25+IF(s!AU24*s!AV24+s!AT24*s!AW24=0,0,E25*s!AU24*s!AV24/(s!AU24*s!AV24+s!AT24*s!AW24))+IF(s!AV24*s!AX24+s!AT24*s!AZ24=0,0,M25*s!AV24*s!AX24/(s!AV24*s!AX24+s!AT24*s!AZ24))+IF(s!AV24*s!BA24+s!AW24*s!AZ24=0,0,Q25*s!AV24*s!BA24/(s!AV24*s!BA24+s!AW24*s!AZ24))+IF(s!AT24*s!BA24+s!AU24*s!AZ24+s!AV24*s!AY24+s!AW24*s!AX24=0,0,N25*s!AV24*s!AY24/(s!AT24*s!BA24+s!AU24*s!AZ24+s!AV24*s!AY24+s!AW24*s!AX24)) -> 13.960660327211727 | AW25: =AF25+IF(s!AT24*s!AW24+s!AU24*s!AV24=0,0,E25*s!AT24*s!AW24/(s!AT24*s!AW24+s!AU24*s!AV24))+IF(s!AU24*s!BA24+s!AW24*s!AY24=0,0,O25*s!AW24*s!AY24/(s!AU24*s!BA24+s!AW24*s!AY24))+IF(s!AV24*s!BA24+s!AW24*s!AZ24=0,0,Q25*s!AW24*s!AZ24/(s!AV24*s!BA24+s!AW24*s!AZ24))+IF(s!AT24*s!BA24+s!AU24*s!AZ24+s!AV24*s!AY24+s!AW24*s!AX24=0,0,N25*s!AW24*s!AX24/(s!AT24*s!BA24+s!AU24*s!AZ24+s!AV24*s!AY24+s!AW24*s!AX24)) -> 9.6072692855801947 | AX25: =AG25+IF(s!AT24*s!AY24+s!AU24*s!AX24=0,0,K25*s!AU24*s!AX24/(s!AT24*s!AY24+s!AU24*s!AX24))+IF(s!AV24*s!AX24+s!AT24*s!AZ24=0,0,M25*s!AV24*s!AX24/(s!AV24*s!AX24+s!AT24*s!AZ24))+IF(s!AX24*s!BA24+s!AY24*s!AZ24=0,0,W25*s!AX24*s!BA24/(s!AX24*s!BA24+s!AY24*s!AZ24))+IF(s!AT24*s!BA24+s!AU24*s!AZ24+s!AV24*s!AY24+s!AW24*s!AX24=0,0,N25*s!AW24*s!AX24/(s!AT24*s!BA24+s!AU24*s!AZ24+s!AV24*s!AY24+s!AW24*s!AX24)) -> 13.990009586409299 | AY25: =AH25+IF(s!AT24*s!AY24+s!AU24*s!AX24=0,0,K25*s!AT24*s!AY24/(s!AT24*s!AY24+s!AU24*s!AX24))+IF(s!AU24*s!BA24+s!AW24*s!AY24=0,0,O25*s!AW24*s!AY24/(s!AU24*s!BA24+s!AW24*s!AY24))+IF(s!AX24*s!BA24+s!AY24*s!AZ24=0,0,W25*s!AY24*s!AZ24/(s!AX24*s!BA24+s!AY24*s!AZ24))+IF(s!AT24*s!BA24+s!AU24*s!AZ24+s!AV24*s!AY24+s!AW24*s!AX24=0,0,N25*s!AV24*s!AY24/(s!AT24*s!BA24+s!AU24*s!AZ24+s!AV24*s!AY24+s!AW24*s!AX24)) -> 10.577920026382623 | AZ25: =AI25+IF(s!AT24*s!AZ24+s!AV24*s!AX24=0,0,M25*s!AT24*s!AZ24/(s!AT24*s!AZ24+s!AV24*s!AX24))+IF(s!AV24*s!BA24+s!AW24*s!AZ24=0,0,Q25*s!AW24*s!AZ24/(s!AV24*s!BA24+s!AW24*s!AZ24))+IF(s!AX24*s!BA24+s!AY24*s!AZ24=0,0,W25*s!AY24*s!AZ24/(s!AX24*s!BA24+s!AY24*s!AZ24))+IF(s!AT24*s!BA24+s!AU24*s!AZ24+s!AV24*s!AY24+s!AW24*s!AX24=0,0,N25*s!AU24*s!AZ24/(s!AT24*s!BA24+s!AU24*s!AZ24+s!AV24*s!AY24+s!AW24*s!AX24)) -> 17.391012706121032 | BA25: =AJ25+IF(s!AU24*s!BA24+s!AW24*s!AY24=0,0,O25*s!AU24*s!BA24/(s!AU24*s!BA24+s!AW24*s!AY24))+IF(s!AV24*s!BA24+s!AW24*s!AZ24=0,0,Q25*s!AV24*s!BA24/(s!AV24*s!BA24+s!AW24*s!AZ24))+IF(s!AX24*s!BA24+s!AY24*s!AZ24=0,0,W25*s!AX24*s!BA24/(s!AX24*s!BA24+s!AY24*s!AZ24))+IF(s!AT24*s!BA24+s!AU24*s!AZ24+s!AV24*s!AY24+s!AW24*s!AX24=0,0,N25*s!AT24*s!BA24/(s!AT24*s!BA24+s!AU24*s!AZ24+s!AV24*s!AY24+s!AW24*s!AX24)) -> 22.041057681087043 | BJ25: =SUM(AT25:BA25) -> 778
A26: =A25 -> 100 | B26: =B25 -> 30 | C26: =C25 -> 200 | D26: =D25 -> 2 | E26: =E25 -> 4 | F26: =F25 -> 1 | G26: =G25 -> 1 | H26: =H25 -> 2 | I26: =I25 -> 1 | J26: =J25 -> 2 | K26: =K25 -> 4 | L26: =L25 -> 2 | M26: =M25 -> 4 | N26: =N25 -> 8 | O26: =O25 -> 4 | P26: =P25 -> 2 | Q26: =Q25 -> 4 | R26: =R25 -> 2 | S26: =S25 -> 1 | T26: =T25 -> 2 | U26: =U25 -> 1 | V26: =V25 -> 2 | W26: =W25 -> 4 | X26: =X25 -> 2 | Y26: =Y25 -> 1 | Z26: =Z25 -> 2 | AA26: =AA25 -> 1 | AB26: =AB25 -> 389 | AC26: =AC25 -> 234 | AD26: =AD25 -> 433 | AE26: =AE25 -> 8 | AF26: =AF25 -> 7 | AG26: =AG25 -> 8 | AH26: =AH25 -> 8 | AI26: =AI25 -> 8 | AJ26: =AJ25 -> 8 | AS26: =AS25 -> 714 | AT26: =AC26+IF(s!AT25*s!AW25+s!AU25*s!AV25=0,0,E26*s!AT25*s!AW25/(s!AT25*s!AW25+s!AU25*s!AV25))+IF(s!AT25*s!AY25+s!AU25*s!AX25=0,0,K26*s!AT25*s!AY25/(s!AT25*s!AY25+s!AU25*s!AX25))+IF(s!AT25*s!AZ25+s!AV25*s!AX25=0,0,M26*s!AT25*s!AZ25/(s!AT25*s!AZ25+s!AV25*s!AX25))+IF(s!AT25*s!BA25+s!AU25*s!AZ25+s!AV25*s!AY25+s!AW25*s!AX25=0,0,N26*s!AT25*s!BA25/(s!AT25*s!BA25+s!AU25*s!AZ25+s!AV25*s!AY25+s!AW25*s!AX25)) -> 244.65833939058655 | AU26: =AD26+IF(s!AU25*s!AV25+s!AT25*s!AW25=0,0,E26*s!AU25*s!AV25/(s!AU25*s!AV25+s!AT25*s!AW25))+IF(s!AT25*s!AY25+s!AU25*s!AX25=0,0,K26*s!AU25*s!AX25/(s!AT25*s!AY25+s!AU25*s!AX25))+IF(s!AU25*s!BA25+s!AW25*s!AY25=0,0,O26*s!AU25*s!BA25/(s!AU25*s!BA25+s!AW25*s!AY25))+IF(s!AT25*s!BA25+s!AU25*s!AZ25+s!AV25*s!AY25+s!AW25*s!AX25=0,0,N26*s!AU25*s!AZ25/(s!AT25*s!BA25+s!AU25*s!AZ25+s!AV25*s!AY25+s!AW25*s!AX25)) -> 445.77371571805827 | AV26: =AE26+IF(s!AU25*s!AV25+s!AT25*s!AW25=0,0,E26*s!AU25*s!AV25/(s!AU25*s!AV25+s!AT25*s!AW25))+IF(s!AV25*s!AX25+s!AT25*s!AZ25=0,0,M26*s!AV25*s!AX25/(s!AV25*s!AX25+s!AT25*s!AZ25))+IF(s!AV25*s!BA25+s!AW25*s!AZ25=0,0,Q26*s!AV25*s!BA25/(s!AV25*s!BA25+s!AW25*s!AZ25))+IF(s!AT25*s!BA25+s!AU25*s!AZ25+s!AV25*s!AY25+s!AW25*s!AX25=0,0,N26*s!AV25*s!AY25/(s!AT25*s!BA25+s!AU25*s!AZ25+s!AV25*s!AY25+s!AW25*s!AX25)) -> 13.960886990767415 | AW26: =AF26+IF(s!AT25*s!AW25+s!AU25*s!AV25=0,0,E26*s!AT25*s!AW25/(s!AT25*s!AW25+s!AU25*s!AV25))+IF(s!AU25*s!BA25+s!AW25*s!AY25=0,0,O26*s!AW25*s!AY25/(s!AU25*s!BA25+s!AW25*s!AY25))+IF(s!AV25*s!BA25+s!AW25*s!AZ25=0,0,Q26*s!AW25*s!AZ25/(s!AV25*s!BA25+s!AW25*s!AZ25))+IF(s!AT25*s!BA25+s!AU25*s!AZ25+s!AV25*s!AY25+s!AW25*s!AX25=0,0,N26*s!AW25*s!AX25/(s!AT25*s!BA25+s!AU25*s!AZ25+s!AV25*s!AY25+s!AW25*s!AX25)) -> 9.6070579005877796 | AX26: =AG26+IF(s!AT25*s!AY25+s!AU25*s!AX25=0,0,K26*s!AU25*s!AX25/(s!AT25*s!AY25+s!AU25*s!AX25))+IF(s!AV25*s!AX25+s!AT25*s!AZ25=0,0,M26*s!AV25*s!AX25/(s!AV25*s!AX25+s!AT25*s!AZ25))+IF(s!AX25*s!BA25+s!AY25*s!AZ25=0,0,W26*s!AX25*s!BA25/(s!AX25*s!BA25+s!AY25*s!AZ25))+IF(s!AT25*s!BA25+s!AU25*s!AZ25+s!AV25*s!AY25+s!AW25*s!AX25=0,0,N26*s!AW25*s!AX25/(s!AT25*s!BA25+s!AU25*s!AZ25+s!AV25*s!AY25+s!AW25*s!AX25)) -> 13.990214106199613 | AY26: =AH26+IF(s!AT25*s!AY25+s!AU25*s!AX25=0,0,K26*s!AT25*s!AY25/(s!AT25*s!AY25+s!AU25*s!AX25))+IF(s!AU25*s!BA25+s!AW25*s!AY25=0,0,O26*s!AW25*s!AY25/(s!AU25*s!BA25+s!AW25*s!AY25))+IF(s!AX25*s!BA25+s!AY25*s!AZ25=0,0,W26*s!AY25*s!AZ25/(s!AX25*s!BA25+s!AY25*s!AZ25))+IF(s!AT25*s!BA25+s!AU25*s!AZ25+s!AV25*s!AY25+s!AW25*s!AX25=0,0,N26*s!AV25*s!AY25/(s!AT25*s!BA25+s!AU25*s!AZ25+s!AV25*s!AY25+s!AW25*s!AX25)) -> 10.577730785155582 | AZ26: =AI26+IF(s!AT25*s!AZ25+s!AV25*s!AX25=0,0,M26*s!AT25*s!AZ25/(s!AT25*s!AZ25+s!AV25*s!AX25))+IF(s!AV25*s!BA25+s!AW25*s!AZ25=0,0,Q26*s!AW25*s!AZ25/(s!AV25*s!BA25+s!AW25*s!AZ25))+IF(s!AX25*s!BA25+s!AY25*s!AZ25=0,0,W26*s!AY25*s!AZ25/(s!AX25*s!BA25+s!AY25*s!AZ25))+IF(s!AT25*s!BA25+s!AU25*s!AZ25+s!AV25*s!AY25+s!AW25*s!AX25=0,0,N26*s!AU25*s!AZ25/(s!AT25*s!BA25+s!AU25*s!AZ25+s!AV25*s!AY25+s!AW25*s!AX25)) -> 17.39055951244643 | BA26: =AJ26+IF(s!AU25*s!BA25+s!AW25*s!AY25=0,0,O26*s!AU25*s!BA25/(s!AU25*s!BA25+s!AW25*s!AY25))+IF(s!AV25*s!BA25+s!AW25*s!AZ25=0,0,Q26*s!AV25*s!BA25/(s!AV25*s!BA25+s!AW25*s!AZ25))+IF(s!AX25*s!BA25+s!AY25*s!AZ25=0,0,W26*s!AX25*s!BA25/(s!AX25*s!BA25+s!AY25*s!AZ25))+IF(s!AT25*s!BA25+s!AU25*s!AZ25+s!AV25*s!AY25+s!AW25*s!AX25=0,0,N26*s!AT25*s!BA25/(s!AT25*s!BA25+s!AU25*s!AZ25+s!AV25*s!AY25+s!AW25*s!AX25)) -> 22.041495596198377 | BJ26: =SUM(AT26:BA26) -> 778
A27: =A26 -> 100 | B27: =B26 -> 30 | C27: =C26 -> 200 | D27: =D26 -> 2 | E27: =E26 -> 4 | F27: =F26 -> 1 | G27: =G26 -> 1 | H27: =H26 -> 2 | I27: =I26 -> 1 | J27: =J26 -> 2 | K27: =K26 -> 4 | L27: =L26 -> 2 | M27: =M26 -> 4 | N27: =N26 -> 8 | O27: =O26 -> 4 | P27: =P26 -> 2 | Q27: =Q26 -> 4 | R27: =R26 -> 2 | S27: =S26 -> 1 | T27: =T26 -> 2 | U27: =U26 -> 1 | V27: =V26 -> 2 | W27: =W26 -> 4 | X27: =X26 -> 2 | Y27: =Y26 -> 1 | Z27: =Z26 -> 2 | AA27: =AA26 -> 1 | AB27: =AB26 -> 389 | AC27: =AC26 -> 234 | AD27: =AD26 -> 433 | AE27: =AE26 -> 8 | AF27: =AF26 -> 7 | AG27: =AG26 -> 8 | AH27: =AH26 -> 8 | AI27: =AI26 -> 8 | AJ27: =AJ26 -> 8 | AS27: =AS26 -> 714 | AT27: =AC27+IF(s!AT26*s!AW26+s!AU26*s!AV26=0,0,E27*s!AT26*s!AW26/(s!AT26*s!AW26+s!AU26*s!AV26))+IF(s!AT26*s!AY26+s!AU26*s!AX26=0,0,K27*s!AT26*s!AY26/(s!AT26*s!AY26+s!AU26*s!AX26))+IF(s!AT26*s!AZ26+s!AV26*s!AX26=0,0,M27*s!AT26*s!AZ26/(s!AT26*s!AZ26+s!AV26*s!AX26))+IF(s!AT26*s!BA26+s!AU26*s!AZ26+s!AV26*s!AY26+s!AW26*s!AX26=0,0,N27*s!AT26*s!BA26/(s!AT26*s!BA26+s!AU26*s!AZ26+s!AV26*s!AY26+s!AW26*s!AX26)) -> 244.65835542009683 | AU27: =AD27+IF(s!AU26*s!AV26+s!AT26*s!AW26=0,0,E27*s!AU26*s!AV26/(s!AU26*s!AV26+s!AT26*s!AW26))+IF(s!AT26*s!AY26+s!AU26*s!AX26=0,0,K27*s!AU26*s!AX26/(s!AT26*s!AY26+s!AU26*s!AX26))+IF(s!AU26*s!BA26+s!AW26*s!AY26=0,0,O27*s!AU26*s!BA26/(s!AU26*s!BA26+s!AW26*s!AY26))+IF(s!AT26*s!BA26+s!AU26*s!AZ26+s!AV26*s!AY26+s!AW26*s!AX26=0,0,N27*s!AU26*s!AZ26/(s!AT26*s!BA26+s!AU26*s!AZ26+s!AV26*s!AY26+s!AW26*s!AX26)) -> 445.77368885379684 | AV27: =AE27+IF(s!AU26*s!AV26+s!AT26*s!AW26=0,0,E27*s!AU26*s!AV26/(s!AU26*s!AV26+s!AT26*s!AW26))+IF(s!AV26*s!AX26+s!AT26*s!AZ26=0,0,M27*s!AV26*s!AX26/(s!AV26*s!AX26+s!AT26*s!AZ26))+IF(s!AV26*s!BA26+s!AW26*s!AZ26=0,0,Q27*s!AV26*s!BA26/(s!AV26*s!BA26+s!AW26*s!AZ26))+IF(s!AT26*s!BA26+s!AU26*s!AZ26+s!AV26*s!AY26+s!AW26*s!AX26=0,0,N27*s!AV26*s!AY26/(s!AT26*s!BA26+s!AU26*s!AZ26+s!AV26*s!AY26+s!AW26*s!AX26)) -> 13.961048083688304 | AW27: =AF27+IF(s!AT26*s!AW26+s!AU26*s!AV26=0,0,E27*s!AT26*s!AW26/(s!AT26*s!AW26+s!AU26*s!AV26))+IF(s!AU26*s!BA26+s!AW26*s!AY26=0,0,O27*s!AW26*s!AY26/(s!AU26*s!BA26+s!AW26*s!AY26))+IF(s!AV26*s!BA26+s!AW26*s!AZ26=0,0,Q27*s!AW26*s!AZ26/(s!AV26*s!BA26+s!AW26*s!AZ26))+IF(s!AT26*s!BA26+s!AU26*s!AZ26+s!AV26*s!AY26+s!AW26*s!AX26=0,0,N27*s!AW26*s!AX26/(s!AT26*s!BA26+s!AU26*s!AZ26+s!AV26*s!AY26+s!AW26*s!AX26)) -> 9.6069076424179727 | AX27: =AG27+IF(s!AT26*s!AY26+s!AU26*s!AX26=0,0,K27*s!AU26*s!AX26/(s!AT26*s!AY26+s!AU26*s!AX26))+IF(s!AV26*s!AX26+s!AT26*s!AZ26=0,0,M27*s!AV26*s!AX26/(s!AV26*s!AX26+s!AT26*s!AZ26))+IF(s!AX26*s!BA26+s!AY26*s!AZ26=0,0,W27*s!AX26*s!BA26/(s!AX26*s!BA26+s!AY26*s!AZ26))+IF(s!AT26*s!BA26+s!AU26*s!AZ26+s!AV26*s!AY26+s!AW26*s!AX26=0,0,N27*s!AW26*s!AX26/(s!AT26*s!BA26+s!AU26*s!AZ26+s!AV26*s!AY26+s!AW26*s!AX26)) -> 13.990359527394618 | AY27: =AH27+IF(s!AT26*s!AY26+s!AU26*s!AX26=0,0,K27*s!AT26*s!AY26/(s!AT26*s!AY26+s!AU26*s!AX26))+IF(s!AU26*s!BA26+s!AW26*s!AY26=0,0,O27*s!AW26*s!AY26/(s!AU26*s!BA26+s!AW26*s!AY26))+IF(s!AX26*s!BA26+s!AY26*s!AZ26=0,0,W27*s!AY26*s!AZ26/(s!AX26*s!BA26+s!AY26*s!AZ26))+IF(s!AT26*s!BA26+s!AU26*s!AZ26+s!AV26*s!AY26+s!AW26*s!AX26=0,0,N27*s!AV26*s!AY26/(s!AT26*s!BA26+s!AU26*s!AZ26+s!AV26*s!AY26+s!AW26*s!AX26)) -> 10.577596198711657 | AZ27: =AI27+IF(s!AT26*s!AZ26+s!AV26*s!AX26=0,0,M27*s!AT26*s!AZ26/(s!AT26*s!AZ26+s!AV26*s!AX26))+IF(s!AV26*s!BA26+s!AW26*s!AZ26=0,0,Q27*s!AW26*s!AZ26/(s!AV26*s!BA26+s!AW26*s!AZ26))+IF(s!AX26*s!BA26+s!AY26*s!AZ26=0,0,W27*s!AY26*s!AZ26/(s!AX26*s!BA26+s!AY26*s!AZ26))+IF(s!AT26*s!BA26+s!AU26*s!AZ26+s!AV26*s!AY26+s!AW26*s!AX26=0,0,N27*s!AU26*s!AZ26/(s!AT26*s!BA26+s!AU26*s!AZ26+s!AV26*s!AY26+s!AW26*s!AX26)) -> 17.390236968820247 | BA27: =AJ27+IF(s!AU26*s!BA26+s!AW26*s!AY26=0,0,O27*s!AU26*s!BA26/(s!AU26*s!BA26+s!AW26*s!AY26))+IF(s!AV26*s!BA26+s!AW26*s!AZ26=0,0,Q27*s!AV26*s!BA26/(s!AV26*s!BA26+s!AW26*s!AZ26))+IF(s!AX26*s!BA26+s!AY26*s!AZ26=0,0,W27*s!AX26*s!BA26/(s!AX26*s!BA26+s!AY26*s!AZ26))+IF(s!AT26*s!BA26+s!AU26*s!AZ26+s!AV26*s!AY26+s!AW26*s!AX26=0,0,N27*s!AT26*s!BA26/(s!AT26*s!BA26+s!AU26*s!AZ26+s!AV26*s!AY26+s!AW26*s!AX26)) -> 22.041807305073476 | BJ27: =SUM(AT27:BA27) -> 778
A28: =A27 -> 100 | B28: =B27 -> 30 | C28: =C27 -> 200 | D28: =D27 -> 2 | E28: =E27 -> 4 | F28: =F27 -> 1 | G28: =G27 -> 1 | H28: =H27 -> 2 | I28: =I27 -> 1 | J28: =J27 -> 2 | K28: =K27 -> 4 | L28: =L27 -> 2 | M28: =M27 -> 4 | N28: =N27 -> 8 | O28: =O27 -> 4 | P28: =P27 -> 2 | Q28: =Q27 -> 4 | R28: =R27 -> 2 | S28: =S27 -> 1 | T28: =T27 -> 2 | U28: =U27 -> 1 | V28: =V27 -> 2 | W28: =W27 -> 4 | X28: =X27 -> 2 | Y28: =Y27 -> 1 | Z28: =Z27 -> 2 | AA28: =AA27 -> 1 | AB28: =AB27 -> 389 | AC28: =AC27 -> 234 | AD28: =AD27 -> 433 | AE28: =AE27 -> 8 | AF28: =AF27 -> 7 | AG28: =AG27 -> 8 | AH28: =AH27 -> 8 | AI28: =AI27 -> 8 | AJ28: =AJ27 -> 8 | AS28: =AS27 -> 714 | AT28: =AC28+IF(s!AT27*s!AW27+s!AU27*s!AV27=0,0,E28*s!AT27*s!AW27/(s!AT27*s!AW27+s!AU27*s!AV27))+IF(s!AT27*s!AY27+s!AU27*s!AX27=0,0,K28*s!AT27*s!AY27/(s!AT27*s!AY27+s!AU27*s!AX27))+IF(s!AT27*s!AZ27+s!AV27*s!AX27=0,0,M28*s!AT27*s!AZ27/(s!AT27*s!AZ27+s!AV27*s!AX27))+IF(s!AT27*s!BA27+s!AU27*s!AZ27+s!AV27*s!AY27+s!AW27*s!AX27=0,0,N28*s!AT27*s!BA27/(s!AT27*s!BA27+s!AU27*s!AZ27+s!AV27*s!AY27+s!AW27*s!AX27)) -> 244.65836704534672 | AU28: =AD28+IF(s!AU27*s!AV27+s!AT27*s!AW27=0,0,E28*s!AU27*s!AV27/(s!AU27*s!AV27+s!AT27*s!AW27))+IF(s!AT27*s!AY27+s!AU27*s!AX27=0,0,K28*s!AU27*s!AX27/(s!AT27*s!AY27+s!AU27*s!AX27))+IF(s!AU27*s!BA27+s!AW27*s!AY27=0,0,O28*s!AU27*s!BA27/(s!AU27*s!BA27+s!AW27*s!AY27))+IF(s!AT27*s!BA27+s!AU27*s!AZ27+s!AV27*s!AY27+s!AW27*s!AX27=0,0,N28*s!AU27*s!AZ27/(s!AT27*s!BA27+s!AU27*s!AZ27+s!AV27*s!AY27+s!AW27*s!AX27)) -> 445.77366953203205 | AV28: =AE28+IF(s!AU27*s!AV27+s!AT27*s!AW27=0,0,E28*s!AU27*s!AV27/(s!AU27*s!AV27+s!AT27*s!AW27))+IF(s!AV27*s!AX27+s!AT27*s!AZ27=0,0,M28*s!AV27*s!AX27/(s!AV27*s!AX27+s!AT27*s!AZ27))+IF(s!AV27*s!BA27+s!AW27*s!AZ27=0,0,Q28*s!AV27*s!BA27/(s!AV27*s!BA27+s!AW27*s!AZ27))+IF(s!AT27*s!BA27+s!AU27*s!AZ27+s!AV27*s!AY27+s!AW27*s!AX27=0,0,N28*s!AV27*s!AY27/(s!AT27*s!BA27+s!AU27*s!AZ27+s!AV27*s!AY27+s!AW27*s!AX27)) -> 13.961162675605696 | AW28: =AF28+IF(s!AT27*s!AW27+s!AU27*s!AV27=0,0,E28*s!AT27*s!AW27/(s!AT27*s!AW27+s!AU27*s!AV27))+IF(s!AU27*s!BA27+s!AW27*s!AY27=0,0,O28*s!AW27*s!AY27/(s!AU27*s!BA27+s!AW27*s!AY27))+IF(s!AV27*s!BA27+s!AW27*s!AZ27=0,0,Q28*s!AW27*s!AZ27/(s!AV27*s!BA27+s!AW27*s!AZ27))+IF(s!AT27*s!BA27+s!AU27*s!AZ27+s!AV27*s!AY27+s!AW27*s!AX27=0,0,N28*s!AW27*s!AX27/(s!AT27*s!BA27+s!AU27*s!AZ27+s!AV27*s!AY27+s!AW27*s!AX27)) -> 9.6068007470154893 | AX28: =AG28+IF(s!AT27*s!AY27+s!AU27*s!AX27=0,0,K28*s!AU27*s!AX27/(s!AT27*s!AY27+s!AU27*s!AX27))+IF(s!AV27*s!AX27+s!AT27*s!AZ27=0,0,M28*s!AV27*s!AX27/(s!AV27*s!AX27+s!AT27*s!AZ27))+IF(s!AX27*s!BA27+s!AY27*s!AZ27=0,0,W28*s!AX27*s!BA27/(s!AX27*s!BA27+s!AY27*s!AZ27))+IF(s!AT27*s!BA27+s!AU27*s!AZ27+s!AV27*s!AY27+s!AW27*s!AX27=0,0,N28*s!AW27*s!AX27/(s!AT27*s!BA27+s!AU27*s!AZ27+s!AV27*s!AY27+s!AW27*s!AX27)) -> 13.990463016762209 | AY28: =AH28+IF(s!AT27*s!AY27+s!AU27*s!AX27=0,0,K28*s!AT27*s!AY27/(s!AT27*s!AY27+s!AU27*s!AX27))+IF(s!AU27*s!BA27+s!AW27*s!AY27=0,0,O28*s!AW27*s!AY27/(s!AU27*s!BA27+s!AW27*s!AY27))+IF(s!AX27*s!BA27+s!AY27*s!AZ27=0,0,W28*s!AY27*s!AZ27/(s!AX27*s!BA27+s!AY27*s!AZ27))+IF(s!AT27*s!BA27+s!AU27*s!AZ27+s!AV27*s!AY27+s!AW27*s!AX27=0,0,N28*s!AV27*s!AY27/(s!AT27*s!BA27+s!AU27*s!AZ27+s!AV27*s!AY27+s!AW27*s!AX27)) -> 10.577500405858975 | AZ28: =AI28+IF(s!AT27*s!AZ27+s!AV27*s!AX27=0,0,M28*s!AT27*s!AZ27/(s!AT27*s!AZ27+s!AV27*s!AX27))+IF(s!AV27*s!BA27+s!AW27*s!AZ27=0,0,Q28*s!AW27*s!AZ27/(s!AV27*s!BA27+s!AW27*s!AZ27))+IF(s!AX27*s!BA27+s!AY27*s!AZ27=0,0,W28*s!AY27*s!AZ27/(s!AX27*s!BA27+s!AY27*s!AZ27))+IF(s!AT27*s!BA27+s!AU27*s!AZ27+s!AV27*s!AY27+s!AW27*s!AX27=0,0,N28*s!AU27*s!AZ27/(s!AT27*s!BA27+s!AU27*s!AZ27+s!AV27*s!AY27+s!AW27*s!AX27)) -> 17.390007262285376 | BA28: =AJ28+IF(s!AU27*s!BA27+s!AW27*s!AY27=0,0,O28*s!AU27*s!BA27/(s!AU27*s!BA27+s!AW27*s!AY27))+IF(s!AV27*s!BA27+s!AW27*s!AZ27=0,0,Q28*s!AV27*s!BA27/(s!AV27*s!BA27+s!AW27*s!AZ27))+IF(s!AX27*s!BA27+s!AY27*s!AZ27=0,0,W28*s!AX27*s!BA27/(s!AX27*s!BA27+s!AY27*s!AZ27))+IF(s!AT27*s!BA27+s!AU27*s!AZ27+s!AV27*s!AY27+s!AW27*s!AX27=0,0,N28*s!AT27*s!BA27/(s!AT27*s!BA27+s!AU27*s!AZ27+s!AV27*s!AY27+s!AW27*s!AX27)) -> 22.042029315093441 | BJ28: =SUM(AT28:BA28) -> 778
A29: =A28 -> 100 | B29: =B28 -> 30 | C29: =C28 -> 200 | D29: =D28 -> 2 | E29: =E28 -> 4 | F29: =F28 -> 1 | G29: =G28 -> 1 | H29: =H28 -> 2 | I29: =I28 -> 1 | J29: =J28 -> 2 | K29: =K28 -> 4 | L29: =L28 -> 2 | M29: =M28 -> 4 | N29: =N28 -> 8 | O29: =O28 -> 4 | P29: =P28 -> 2 | Q29: =Q28 -> 4 | R29: =R28 -> 2 | S29: =S28 -> 1 | T29: =T28 -> 2 | U29: =U28 -> 1 | V29: =V28 -> 2 | W29: =W28 -> 4 | X29: =X28 -> 2 | Y29: =Y28 -> 1 | Z29: =Z28 -> 2 | AA29: =AA28 -> 1 | AB29: =AB28 -> 389 | AC29: =AC28 -> 234 | AD29: =AD28 -> 433 | AE29: =AE28 -> 8 | AF29: =AF28 -> 7 | AG29: =AG28 -> 8 | AH29: =AH28 -> 8 | AI29: =AI28 -> 8 | AJ29: =AJ28 -> 8 | AS29: =AS28 -> 714 | AT29: =AC29+IF(s!AT28*s!AW28+s!AU28*s!AV28=0,0,E29*s!AT28*s!AW28/(s!AT28*s!AW28+s!AU28*s!AV28))+IF(s!AT28*s!AY28+s!AU28*s!AX28=0,0,K29*s!AT28*s!AY28/(s!AT28*s!AY28+s!AU28*s!AX28))+IF(s!AT28*s!AZ28+s!AV28*s!AX28=0,0,M29*s!AT28*s!AZ28/(s!AT28*s!AZ28+s!AV28*s!AX28))+IF(s!AT28*s!BA28+s!AU28*s!AZ28+s!AV28*s!AY28+s!AW28*s!AX28=0,0,N29*s!AT28*s!BA28/(s!AT28*s!BA28+s!AU28*s!AZ28+s!AV28*s!AY28+s!AW28*s!AX28)) -> 244.65837544929454 | AU29: =AD29+IF(s!AU28*s!AV28+s!AT28*s!AW28=0,0,E29*s!AU28*s!AV28/(s!AU28*s!AV28+s!AT28*s!AW28))+IF(s!AT28*s!AY28+s!AU28*s!AX28=0,0,K29*s!AU28*s!AX28/(s!AT28*s!AY28+s!AU28*s!AX28))+IF(s!AU28*s!BA28+s!AW28*s!AY28=0,0,O29*s!AU28*s!BA28/(s!AU28*s!BA28+s!AW28*s!AY28))+IF(s!AT28*s!BA28+s!AU28*s!AZ28+s!AV28*s!AY28+s!AW28*s!AX28=0,0,N29*s!AU28*s!AZ28/(s!AT28*s!BA28+s!AU28*s!AZ28+s!AV28*s!AY28+s!AW28*s!AX28)) -> 445.77365565326454 | AV29: =AE29+IF(s!AU28*s!AV28+s!AT28*s!AW28=0,0,E29*s!AU28*s!AV28/(s!AU28*s!AV28+s!AT28*s!AW28))+IF(s!AV28*s!AX28+s!AT28*s!AZ28=0,0,M29*s!AV28*s!AX28/(s!AV28*s!AX28+s!AT28*s!AZ28))+IF(s!AV28*s!BA28+s!AW28*s!AZ28=0,0,Q29*s!AV28*s!BA28/(s!AV28*s!BA28+s!AW28*s!AZ28))+IF(s!AT28*s!BA28+s!AU28*s!AZ28+s!AV28*s!AY28+s!AW28*s!AX28=0,0,N29*s!AV28*s!AY28/(s!AT28*s!BA28+s!AU28*s!AZ28+s!AV28*s!AY28+s!AW28*s!AX28)) -> 13.961244251722828 | AW29: =AF29+IF(s!AT28*s!AW28+s!AU28*s!AV28=0,0,E29*s!AT28*s!AW28/(s!AT28*s!AW28+s!AU28*s!AV28))+IF(s!AU28*s!BA28+s!AW28*s!AY28=0,0,O29*s!AW28*s!AY28/(s!AU28*s!BA28+s!AW28*s!AY28))+IF(s!AV28*s!BA28+s!AW28*s!AZ28=0,0,Q29*s!AW28*s!AZ28/(s!AV28*s!BA28+s!AW28*s!AZ28))+IF(s!AT28*s!BA28+s!AU28*s!AZ28+s!AV28*s!AY28+s!AW28*s!AX28=0,0,N29*s!AW28*s!AX28/(s!AT28*s!BA28+s!AU28*s!AZ28+s!AV28*s!AY28+s!AW28*s!AX28)) -> 9.6067246457180797 | AX29: =AG29+IF(s!AT28*s!AY28+s!AU28*s!AX28=0,0,K29*s!AU28*s!AX28/(s!AT28*s!AY28+s!AU28*s!AX28))+IF(s!AV28*s!AX28+s!AT28*s!AZ28=0,0,M29*s!AV28*s!AX28/(s!AV28*s!AX28+s!AT28*s!AZ28))+IF(s!AX28*s!BA28+s!AY28*s!AZ28=0,0,W29*s!AX28*s!BA28/(s!AX28*s!BA28+s!AY28*s!AZ28))+IF(s!AT28*s!BA28+s!AU28*s!AZ28+s!AV28*s!AY28+s!AW28*s!AX28=0,0,N29*s!AW28*s!AX28/(s!AT28*s!BA28+s!AU28*s!AZ28+s!AV28*s!AY28+s!AW28*s!AX28)) -> 13.990536719582547 | AY29: =AH29+IF(s!AT28*s!AY28+s!AU28*s!AX28=0,0,K29*s!AT28*s!AY28/(s!AT28*s!AY28+s!AU28*s!AX28))+IF(s!AU28*s!BA28+s!AW28*s!AY28=0,0,O29*s!AW28*s!AY28/(s!AU28*s!BA28+s!AW28*s!AY28))+IF(s!AX28*s!BA28+s!AY28*s!AZ28=0,0,W29*s!AY28*s!AZ28/(s!AX28*s!BA28+s!AY28*s!AZ28))+IF(s!AT28*s!BA28+s!AU28*s!AZ28+s!AV28*s!AY28+s!AW28*s!AX28=0,0,N29*s!AV28*s!AY28/(s!AT28*s!BA28+s!AU28*s!AZ28+s!AV28*s!AY28+s!AW28*s!AX28)) -> 10.577432177858361 | AZ29: =AI29+IF(s!AT28*s!AZ28+s!AV28*s!AX28=0,0,M29*s!AT28*s!AZ28/(s!AT28*s!AZ28+s!AV28*s!AX28))+IF(s!AV28*s!BA28+s!AW28*s!AZ28=0,0,Q29*s!AW28*s!AZ28/(s!AV28*s!BA28+s!AW28*s!AZ28))+IF(s!AX28*s!BA28+s!AY28*s!AZ28=0,0,W29*s!AY28*s!AZ28/(s!AX28*s!BA28+s!AY28*s!AZ28))+IF(s!AT28*s!BA28+s!AU28*s!AZ28+s!AV28*s!AY28+s!AW28*s!AX28=0,0,N29*s!AU28*s!AZ28/(s!AT28*s!BA28+s!AU28*s!AZ28+s!AV28*s!AY28+s!AW28*s!AX28)) -> 17.389843579400065 | BA29: =AJ29+IF(s!AU28*s!BA28+s!AW28*s!AY28=0,0,O29*s!AU28*s!BA28/(s!AU28*s!BA28+s!AW28*s!AY28))+IF(s!AV28*s!BA28+s!AW28*s!AZ28=0,0,Q29*s!AV28*s!BA28/(s!AV28*s!BA28+s!AW28*s!AZ28))+IF(s!AX28*s!BA28+s!AY28*s!AZ28=0,0,W29*s!AX28*s!BA28/(s!AX28*s!BA28+s!AY28*s!AZ28))+IF(s!AT28*s!BA28+s!AU28*s!AZ28+s!AV28*s!AY28+s!AW28*s!AX28=0,0,N29*s!AT28*s!BA28/(s!AT28*s!BA28+s!AU28*s!AZ28+s!AV28*s!AY28+s!AW28*s!AX28)) -> 22.042187523159029 | BJ29: =SUM(AT29:BA29) -> 778
A30: =A29 -> 100 | B30: =B29 -> 30 | C30: =C29 -> 200 | D30: =D29 -> 2 | E30: =E29 -> 4 | F30: =F29 -> 1 | G30: =G29 -> 1 | H30: =H29 -> 2 | I30: =I29 -> 1 | J30: =J29 -> 2 | K30: =K29 -> 4 | L30: =L29 -> 2 | M30: =M29 -> 4 | N30: =N29 -> 8 | O30: =O29 -> 4 | P30: =P29 -> 2 | Q30: =Q29 -> 4 | R30: =R29 -> 2 | S30: =S29 -> 1 | T30: =T29 -> 2 | U30: =U29 -> 1 | V30: =V29 -> 2 | W30: =W29 -> 4 | X30: =X29 -> 2 | Y30: =Y29 -> 1 | Z30: =Z29 -> 2 | AA30: =AA29 -> 1 | AB30: =AB29 -> 389 | AC30: =AC29 -> 234 | AD30: =AD29 -> 433 | AE30: =AE29 -> 8 | AF30: =AF29 -> 7 | AG30: =AG29 -> 8 | AH30: =AH29 -> 8 | AI30: =AI29 -> 8 | AJ30: =AJ29 -> 8 | AS30: =AS29 -> 714 | AT30: =AC30+IF(s!AT29*s!AW29+s!AU29*s!AV29=0,0,E30*s!AT29*s!AW29/(s!AT29*s!AW29+s!AU29*s!AV29))+IF(s!AT29*s!AY29+s!AU29*s!AX29=0,0,K30*s!AT29*s!AY29/(s!AT29*s!AY29+s!AU29*s!AX29))+IF(s!AT29*s!AZ29+s!AV29*s!AX29=0,0,M30*s!AT29*s!AZ29/(s!AT29*s!AZ29+s!AV29*s!AX29))+IF(s!AT29*s!BA29+s!AU29*s!AZ29+s!AV29*s!AY29+s!AW29*s!AX29=0,0,N30*s!AT29*s!BA29/(s!AT29*s!BA29+s!AU29*s!AZ29+s!AV29*s!AY29+s!AW29*s!AX29)) -> 244.65838150937012 | AU30: =AD30+IF(s!AU29*s!AV29+s!AT29*s!AW29=0,0,E30*s!AU29*s!AV29/(s!AU29*s!AV29+s!AT29*s!AW29))+IF(s!AT29*s!AY29+s!AU29*s!AX29=0,0,K30*s!AU29*s!AX29/(s!AT29*s!AY29+s!AU29*s!AX29))+IF(s!AU29*s!BA29+s!AW29*s!AY29=0,0,O30*s!AU29*s!BA29/(s!AU29*s!BA29+s!AW29*s!AY29))+IF(s!AT29*s!BA29+s!AU29*s!AZ29+s!AV29*s!AY29+s!AW29*s!AX29=0,0,N30*s!AU29*s!AZ29/(s!AT29*s!BA29+s!AU29*s!AZ29+s!AV29*s!AY29+s!AW29*s!AX29)) -> 445.77364569437782 | AV30: =AE30+IF(s!AU29*s!AV29+s!AT29*s!AW29=0,0,E30*s!AU29*s!AV29/(s!AU29*s!AV29+s!AT29*s!AW29))+IF(s!AV29*s!AX29+s!AT29*s!AZ29=0,0,M30*s!AV29*s!AX29/(s!AV29*s!AX29+s!AT29*s!AZ29))+IF(s!AV29*s!BA29+s!AW29*s!AZ29=0,0,Q30*s!AV29*s!BA29/(s!AV29*s!BA29+s!AW29*s!AZ29))+IF(s!AT29*s!BA29+s!AU29*s!AZ29+s!AV29*s!AY29+s!AW29*s!AX29=0,0,N30*s!AV29*s!AY29/(s!AT29*s!BA29+s!AU29*s!AZ29+s!AV29*s!AY29+s!AW29*s!AX29)) -> 13.961302362811226 | AW30: =AF30+IF(s!AT29*s!AW29+s!AU29*s!AV29=0,0,E30*s!AT29*s!AW29/(s!AT29*s!AW29+s!AU29*s!AV29))+IF(s!AU29*s!BA29+s!AW29*s!AY29=0,0,O30*s!AW29*s!AY29/(s!AU29*s!BA29+s!AW29*s!AY29))+IF(s!AV29*s!BA29+s!AW29*s!AZ29=0,0,Q30*s!AW29*s!AZ29/(s!AV29*s!BA29+s!AW29*s!AZ29))+IF(s!AT29*s!BA29+s!AU29*s!AZ29+s!AV29*s!AY29+s!AW29*s!AX29=0,0,N30*s!AW29*s!AX29/(s!AT29*s!BA29+s!AU29*s!AZ29+s!AV29*s!AY29+s!AW29*s!AX29)) -> 9.6066704334408968 | AX30: =AG30+IF(s!AT29*s!AY29+s!AU29*s!AX29=0,0,K30*s!AU29*s!AX29/(s!AT29*s!AY29+s!AU29*s!AX29))+IF(s!AV29*s!AX29+s!AT29*s!AZ29=0,0,M30*s!AV29*s!AX29/(s!AV29*s!AX29+s!AT29*s!AZ29))+IF(s!AX29*s!BA29+s!AY29*s!AZ29=0,0,W30*s!AX29*s!BA29/(s!AX29*s!BA29+s!AY29*s!AZ29))+IF(s!AT29*s!BA29+s!AU29*s!AZ29+s!AV29*s!AY29+s!AW29*s!AX29=0,0,N30*s!AW29*s!AX29/(s!AT29*s!BA29+s!AU29*s!AZ29+s!AV29*s!AY29+s!AW29*s!AX29)) -> 13.990589242145862 | AY30: =AH30+IF(s!AT29*s!AY29+s!AU29*s!AX29=0,0,K30*s!AT29*s!AY29/(s!AT29*s!AY29+s!AU29*s!AX29))+IF(s!AU29*s!BA29+s!AW29*s!AY29=0,0,O30*s!AW29*s!AY29/(s!AU29*s!BA29+s!AW29*s!AY29))+IF(s!AX29*s!BA29+s!AY29*s!AZ29=0,0,W30*s!AY29*s!AZ29/(s!AX29*s!BA29+s!AY29*s!AZ29))+IF(s!AT29*s!BA29+s!AU29*s!AZ29+s!AV29*s!AY29+s!AW29*s!AX29=0,0,N30*s!AV29*s!AY29/(s!AT29*s!BA29+s!AU29*s!AZ29+s!AV29*s!AY29+s!AW29*s!AX29)) -> 10.577383554106261 | AZ30: =AI30+IF(s!AT29*s!AZ29+s!AV29*s!AX29=0,0,M30*s!AT29*s!AZ29/(s!AT29*s!AZ29+s!AV29*s!AX29))+IF(s!AV29*s!BA29+s!AW29*s!AZ29=0,0,Q30*s!AW29*s!AZ29/(s!AV29*s!BA29+s!AW29*s!AZ29))+IF(s!AX29*s!BA29+s!AY29*s!AZ29=0,0,W30*s!AY29*s!AZ29/(s!AX29*s!BA29+s!AY29*s!AZ29))+IF(s!AT29*s!BA29+s!AU29*s!AZ29+s!AV29*s!AY29+s!AW29*s!AX29=0,0,N30*s!AU29*s!AZ29/(s!AT29*s!BA29+s!AU29*s!AZ29+s!AV29*s!AY29+s!AW29*s!AX29)) -> 17.389726885672808 | BA30: =AJ30+IF(s!AU29*s!BA29+s!AW29*s!AY29=0,0,O30*s!AU29*s!BA29/(s!AU29*s!BA29+s!AW29*s!AY29))+IF(s!AV29*s!BA29+s!AW29*s!AZ29=0,0,Q30*s!AV29*s!BA29/(s!AV29*s!BA29+s!AW29*s!AZ29))+IF(s!AX29*s!BA29+s!AY29*s!AZ29=0,0,W30*s!AX29*s!BA29/(s!AX29*s!BA29+s!AY29*s!AZ29))+IF(s!AT29*s!BA29+s!AU29*s!AZ29+s!AV29*s!AY29+s!AW29*s!AX29=0,0,N30*s!AT29*s!BA29/(s!AT29*s!BA29+s!AU29*s!AZ29+s!AV29*s!AY29+s!AW29*s!AX29)) -> 22.042300318075071 | BJ30: =SUM(AT30:BA30) -> 778
A31: =A30 -> 100 | B31: =B30 -> 30 | C31: =C30 -> 200 | D31: =D30 -> 2 | E31: =E30 -> 4 | F31: =F30 -> 1 | G31: =G30 -> 1 | H31: =H30 -> 2 | I31: =I30 -> 1 | J31: =J30 -> 2 | K31: =K30 -> 4 | L31: =L30 -> 2 | M31: =M30 -> 4 | N31: =N30 -> 8 | O31: =O30 -> 4 | P31: =P30 -> 2 | Q31: =Q30 -> 4 | R31: =R30 -> 2 | S31: =S30 -> 1 | T31: =T30 -> 2 | U31: =U30 -> 1 | V31: =V30 -> 2 | W31: =W30 -> 4 | X31: =X30 -> 2 | Y31: =Y30 -> 1 | Z31: =Z30 -> 2 | AA31: =AA30 -> 1 | AB31: =AB30 -> 389 | AC31: =AC30 -> 234 | AD31: =AD30 -> 433 | AE31: =AE30 -> 8 | AF31: =AF30 -> 7 | AG31: =AG30 -> 8 | AH31: =AH30 -> 8 | AI31: =AI30 -> 8 | AJ31: =AJ30 -> 8 | AS31: =AS30 -> 714 | AT31: =AC31+IF(s!AT30*s!AW30+s!AU30*s!AV30=0,0,E31*s!AT30*s!AW30/(s!AT30*s!AW30+s!AU30*s!AV30))+IF(s!AT30*s!AY30+s!AU30*s!AX30=0,0,K31*s!AT30*s!AY30/(s!AT30*s!AY30+s!AU30*s!AX30))+IF(s!AT30*s!AZ30+s!AV30*s!AX30=0,0,M31*s!AT30*s!AZ30/(s!AT30*s!AZ30+s!AV30*s!AX30))+IF(s!AT30*s!BA30+s!AU30*s!AZ30+s!AV30*s!AY30+s!AW30*s!AX30=0,0,N31*s!AT30*s!BA30/(s!AT30*s!BA30+s!AU30*s!AZ30+s!AV30*s!AY30+s!AW30*s!AX30)) -> 244.65838587080574 | AU31: =AD31+IF(s!AU30*s!AV30+s!AT30*s!AW30=0,0,E31*s!AU30*s!AV30/(s!AU30*s!AV30+s!AT30*s!AW30))+IF(s!AT30*s!AY30+s!AU30*s!AX30=0,0,K31*s!AU30*s!AX30/(s!AT30*s!AY30+s!AU30*s!AX30))+IF(s!AU30*s!BA30+s!AW30*s!AY30=0,0,O31*s!AU30*s!BA30/(s!AU30*s!BA30+s!AW30*s!AY30))+IF(s!AT30*s!BA30+s!AU30*s!AZ30+s!AV30*s!AY30+s!AW30*s!AX30=0,0,N31*s!AU30*s!AZ30/(s!AT30*s!BA30+s!AU30*s!AZ30+s!AV30*s!AY30+s!AW30*s!AX30)) -> 445.77363855394543 | AV31: =AE31+IF(s!AU30*s!AV30+s!AT30*s!AW30=0,0,E31*s!AU30*s!AV30/(s!AU30*s!AV30+s!AT30*s!AW30))+IF(s!AV30*s!AX30+s!AT30*s!AZ30=0,0,M31*s!AV30*s!AX30/(s!AV30*s!AX30+s!AT30*s!AZ30))+IF(s!AV30*s!BA30+s!AW30*s!AZ30=0,0,Q31*s!AV30*s!BA30/(s!AV30*s!BA30+s!AW30*s!AZ30))+IF(s!AT30*s!BA30+s!AU30*s!AZ30+s!AV30*s!AY30+s!AW30*s!AX30=0,0,N31*s!AV30*s!AY30/(s!AT30*s!BA30+s!AU30*s!AZ30+s!AV30*s!AY30+s!AW30*s!AX30)) -> 13.961343782158972 | AW31: =AF31+IF(s!AT30*s!AW30+s!AU30*s!AV30=0,0,E31*s!AT30*s!AW30/(s!AT30*s!AW30+s!AU30*s!AV30))+IF(s!AU30*s!BA30+s!AW30*s!AY30=0,0,O31*s!AW30*s!AY30/(s!AU30*s!BA30+s!AW30*s!AY30))+IF(s!AV30*s!BA30+s!AW30*s!AZ30=0,0,Q31*s!AW30*s!AZ30/(s!AV30*s!BA30+s!AW30*s!AZ30))+IF(s!AT30*s!BA30+s!AU30*s!AZ30+s!AV30*s!AY30+s!AW30*s!AX30=0,0,N31*s!AW30*s!AX30/(s!AT30*s!BA30+s!AU30*s!AZ30+s!AV30*s!AY30+s!AW30*s!AX30)) -> 9.6066317930898766 | AX31: =AG31+IF(s!AT30*s!AY30+s!AU30*s!AX30=0,0,K31*s!AU30*s!AX30/(s!AT30*s!AY30+s!AU30*s!AX30))+IF(s!AV30*s!AX30+s!AT30*s!AZ30=0,0,M31*s!AV30*s!AX30/(s!AV30*s!AX30+s!AT30*s!AZ30))+IF(s!AX30*s!BA30+s!AY30*s!AZ30=0,0,W31*s!AX30*s!BA30/(s!AX30*s!BA30+s!AY30*s!AZ30))+IF(s!AT30*s!BA30+s!AU30*s!AZ30+s!AV30*s!AY30+s!AW30*s!AX30=0,0,N31*s!AW30*s!AX30/(s!AT30*s!BA30+s!AU30*s!AZ30+s!AV30*s!AY30+s!AW30*s!AX30)) -> 13.990626691245348 | AY31: =AH31+IF(s!AT30*s!AY30+s!AU30*s!AX30=0,0,K31*s!AT30*s!AY30/(s!AT30*s!AY30+s!AU30*s!AX30))+IF(s!AU30*s!BA30+s!AW30*s!AY30=0,0,O31*s!AW30*s!AY30/(s!AU30*s!BA30+s!AW30*s!AY30))+IF(s!AX30*s!BA30+s!AY30*s!AZ30=0,0,W31*s!AY30*s!AZ30/(s!AX30*s!BA30+s!AY30*s!AZ30))+IF(s!AT30*s!BA30+s!AU30*s!AZ30+s!AV30*s!AY30+s!AW30*s!AX30=0,0,N31*s!AV30*s!AY30/(s!AT30*s!BA30+s!AU30*s!AZ30+s!AV30*s!AY30+s!AW30*s!AX30)) -> 10.577348884003502 | AZ31: =AI31+IF(s!AT30*s!AZ30+s!AV30*s!AX30=0,0,M31*s!AT30*s!AZ30/(s!AT30*s!AZ30+s!AV30*s!AX30))+IF(s!AV30*s!BA30+s!AW30*s!AZ30=0,0,Q31*s!AW30*s!AZ30/(s!AV30*s!BA30+s!AW30*s!AZ30))+IF(s!AX30*s!BA30+s!AY30*s!AZ30=0,0,W31*s!AY30*s!AZ30/(s!AX30*s!BA30+s!AY30*s!AZ30))+IF(s!AT30*s!BA30+s!AU30*s!AZ30+s!AV30*s!AY30+s!AW30*s!AX30=0,0,N31*s!AU30*s!AZ30/(s!AT30*s!BA30+s!AU30*s!AZ30+s!AV30*s!AY30+s!AW30*s!AX30)) -> 17.389643655789921 | BA31: =AJ31+IF(s!AU30*s!BA30+s!AW30*s!AY30=0,0,O31*s!AU30*s!BA30/(s!AU30*s!BA30+s!AW30*s!AY30))+IF(s!AV30*s!BA30+s!AW30*s!AZ30=0,0,Q31*s!AV30*s!BA30/(s!AV30*s!BA30+s!AW30*s!AZ30))+IF(s!AX30*s!BA30+s!AY30*s!AZ30=0,0,W31*s!AX30*s!BA30/(s!AX30*s!BA30+s!AY30*s!AZ30))+IF(s!AT30*s!BA30+s!AU30*s!AZ30+s!AV30*s!AY30+s!AW30*s!AX30=0,0,N31*s!AT30*s!BA30/(s!AT30*s!BA30+s!AU30*s!AZ30+s!AV30*s!AY30+s!AW30*s!AX30)) -> 22.042380768961234 | BJ31: =SUM(AT31:BA31) -> 778
A32: =A31 -> 100 | B32: =B31 -> 30 | C32: =C31 -> 200 | D32: =D31 -> 2 | E32: =E31 -> 4 | F32: =F31 -> 1 | G32: =G31 -> 1 | H32: =H31 -> 2 | I32: =I31 -> 1 | J32: =J31 -> 2 | K32: =K31 -> 4 | L32: =L31 -> 2 | M32: =M31 -> 4 | N32: =N31 -> 8 | O32: =O31 -> 4 | P32: =P31 -> 2 | Q32: =Q31 -> 4 | R32: =R31 -> 2 | S32: =S31 -> 1 | T32: =T31 -> 2 | U32: =U31 -> 1 | V32: =V31 -> 2 | W32: =W31 -> 4 | X32: =X31 -> 2 | Y32: =Y31 -> 1 | Z32: =Z31 -> 2 | AA32: =AA31 -> 1 | AB32: =AB31 -> 389 | AC32: =AC31 -> 234 | AD32: =AD31 -> 433 | AE32: =AE31 -> 8 | AF32: =AF31 -> 7 | AG32: =AG31 -> 8 | AH32: =AH31 -> 8 | AI32: =AI31 -> 8 | AJ32: =AJ31 -> 8 | AS32: =AS31 -> 714 | AT32: =AC32+IF(s!AT31*s!AW31+s!AU31*s!AV31=0,0,E32*s!AT31*s!AW31/(s!AT31*s!AW31+s!AU31*s!AV31))+IF(s!AT31*s!AY31+s!AU31*s!AX31=0,0,K32*s!AT31*s!AY31/(s!AT31*s!AY31+s!AU31*s!AX31))+IF(s!AT31*s!AZ31+s!AV31*s!AX31=0,0,M32*s!AT31*s!AZ31/(s!AT31*s!AZ31+s!AV31*s!AX31))+IF(s!AT31*s!BA31+s!AU31*s!AZ31+s!AV31*s!AY31+s!AW31*s!AX31=0,0,N32*s!AT31*s!BA31/(s!AT31*s!BA31+s!AU31*s!AZ31+s!AV31*s!AY31+s!AW31*s!AX31)) -> 244.65838900500518 | AU32: =AD32+IF(s!AU31*s!AV31+s!AT31*s!AW31=0,0,E32*s!AU31*s!AV31/(s!AU31*s!AV31+s!AT31*s!AW31))+IF(s!AT31*s!AY31+s!AU31*s!AX31=0,0,K32*s!AU31*s!AX31/(s!AT31*s!AY31+s!AU31*s!AX31))+IF(s!AU31*s!BA31+s!AW31*s!AY31=0,0,O32*s!AU31*s!BA31/(s!AU31*s!BA31+s!AW31*s!AY31))+IF(s!AT31*s!BA31+s!AU31*s!AZ31+s!AV31*s!AY31+s!AW31*s!AX31=0,0,N32*s!AU31*s!AZ31/(s!AT31*s!BA31+s!AU31*s!AZ31+s!AV31*s!AY31+s!AW31*s!AX31)) -> 445.77363343748277 | AV32: =AE32+IF(s!AU31*s!AV31+s!AT31*s!AW31=0,0,E32*s!AU31*s!AV31/(s!AU31*s!AV31+s!AT31*s!AW31))+IF(s!AV31*s!AX31+s!AT31*s!AZ31=0,0,M32*s!AV31*s!AX31/(s!AV31*s!AX31+s!AT31*s!AZ31))+IF(s!AV31*s!BA31+s!AW31*s!AZ31=0,0,Q32*s!AV31*s!BA31/(s!AV31*s!BA31+s!AW31*s!AZ31))+IF(s!AT31*s!BA31+s!AU31*s!AZ31+s!AV31*s!AY31+s!AW31*s!AX31=0,0,N32*s!AV31*s!AY31/(s!AT31*s!BA31+s!AU31*s!AZ31+s!AV31*s!AY31+s!AW31*s!AX31)) -> 13.961373318880288 | AW32: =AF32+IF(s!AT31*s!AW31+s!AU31*s!AV31=0,0,E32*s!AT31*s!AW31/(s!AT31*s!AW31+s!AU31*s!AV31))+IF(s!AU31*s!BA31+s!AW31*s!AY31=0,0,O32*s!AW31*s!AY31/(s!AU31*s!BA31+s!AW31*s!AY31))+IF(s!AV31*s!BA31+s!AW31*s!AZ31=0,0,Q32*s!AW31*s!AZ31/(s!AV31*s!BA31+s!AW31*s!AZ31))+IF(s!AT31*s!BA31+s!AU31*s!AZ31+s!AV31*s!AY31+s!AW31*s!AX31=0,0,N32*s!AW31*s!AX31/(s!AT31*s!BA31+s!AU31*s!AZ31+s!AV31*s!AY31+s!AW31*s!AX31)) -> 9.6066042386317889 | AX32: =AG32+IF(s!AT31*s!AY31+s!AU31*s!AX31=0,0,K32*s!AU31*s!AX31/(s!AT31*s!AY31+s!AU31*s!AX31))+IF(s!AV31*s!AX31+s!AT31*s!AZ31=0,0,M32*s!AV31*s!AX31/(s!AV31*s!AX31+s!AT31*s!AZ31))+IF(s!AX31*s!BA31+s!AY31*s!AZ31=0,0,W32*s!AX31*s!BA31/(s!AX31*s!BA31+s!AY31*s!AZ31))+IF(s!AT31*s!BA31+s!AU31*s!AZ31+s!AV31*s!AY31+s!AW31*s!AX31=0,0,N32*s!AW31*s!AX31/(s!AT31*s!BA31+s!AU31*s!AZ31+s!AV31*s!AY31+s!AW31*s!AX31)) -> 13.990653405114355 | AY32: =AH32+IF(s!AT31*s!AY31+s!AU31*s!AX31=0,0,K32*s!AT31*s!AY31/(s!AT31*s!AY31+s!AU31*s!AX31))+IF(s!AU31*s!BA31+s!AW31*s!AY31=0,0,O32*s!AW31*s!AY31/(s!AU31*s!BA31+s!AW31*s!AY31))+IF(s!AX31*s!BA31+s!AY31*s!AZ31=0,0,W32*s!AY31*s!AZ31/(s!AX31*s!BA31+s!AY31*s!AZ31))+IF(s!AT31*s!BA31+s!AU31*s!AZ31+s!AV31*s!AY31+s!AW31*s!AX31=0,0,N32*s!AV31*s!AY31/(s!AT31*s!BA31+s!AU31*s!AZ31+s!AV31*s!AY31+s!AW31*s!AX31)) -> 10.577324152397722 | AZ32: =AI32+IF(s!AT31*s!AZ31+s!AV31*s!AX31=0,0,M32*s!AT31*s!AZ31/(s!AT31*s!AZ31+s!AV31*s!AX31))+IF(s!AV31*s!BA31+s!AW31*s!AZ31=0,0,Q32*s!AW31*s!AZ31/(s!AV31*s!BA31+s!AW31*s!AZ31))+IF(s!AX31*s!BA31+s!AY31*s!AZ31=0,0,W32*s!AY31*s!AZ31/(s!AX31*s!BA31+s!AY31*s!AZ31))+IF(s!AT31*s!BA31+s!AU31*s!AZ31+s!AV31*s!AY31+s!AW31*s!AX31=0,0,N32*s!AU31*s!AZ31/(s!AT31*s!BA31+s!AU31*s!AZ31+s!AV31*s!AY31+s!AW31*s!AX31)) -> 17.389584271000164 | BA32: =AJ32+IF(s!AU31*s!BA31+s!AW31*s!AY31=0,0,O32*s!AU31*s!BA31/(s!AU31*s!BA31+s!AW31*s!AY31))+IF(s!AV31*s!BA31+s!AW31*s!AZ31=0,0,Q32*s!AV31*s!BA31/(s!AV31*s!BA31+s!AW31*s!AZ31))+IF(s!AX31*s!BA31+s!AY31*s!AZ31=0,0,W32*s!AX31*s!BA31/(s!AX31*s!BA31+s!AY31*s!AZ31))+IF(s!AT31*s!BA31+s!AU31*s!AZ31+s!AV31*s!AY31+s!AW31*s!AX31=0,0,N32*s!AT31*s!BA31/(s!AT31*s!BA31+s!AU31*s!AZ31+s!AV31*s!AY31+s!AW31*s!AX31)) -> 22.04243817148776 | BJ32: =SUM(AT32:BA32) -> 778
A33: =A32 -> 100 | B33: =B32 -> 30 | C33: =C32 -> 200 | D33: =D32 -> 2 | E33: =E32 -> 4 | F33: =F32 -> 1 | G33: =G32 -> 1 | H33: =H32 -> 2 | I33: =I32 -> 1 | J33: =J32 -> 2 | K33: =K32 -> 4 | L33: =L32 -> 2 | M33: =M32 -> 4 | N33: =N32 -> 8 | O33: =O32 -> 4 | P33: =P32 -> 2 | Q33: =Q32 -> 4 | R33: =R32 -> 2 | S33: =S32 -> 1 | T33: =T32 -> 2 | U33: =U32 -> 1 | V33: =V32 -> 2 | W33: =W32 -> 4 | X33: =X32 -> 2 | Y33: =Y32 -> 1 | Z33: =Z32 -> 2 | AA33: =AA32 -> 1 | AB33: =AB32 -> 389 | AC33: =AC32 -> 234 | AD33: =AD32 -> 433 | AE33: =AE32 -> 8 | AF33: =AF32 -> 7 | AG33: =AG32 -> 8 | AH33: =AH32 -> 8 | AI33: =AI32 -> 8 | AJ33: =AJ32 -> 8 | AS33: =AS32 -> 714 | AT33: =AC33+IF(s!AT32*s!AW32+s!AU32*s!AV32=0,0,E33*s!AT32*s!AW32/(s!AT32*s!AW32+s!AU32*s!AV32))+IF(s!AT32*s!AY32+s!AU32*s!AX32=0,0,K33*s!AT32*s!AY32/(s!AT32*s!AY32+s!AU32*s!AX32))+IF(s!AT32*s!AZ32+s!AV32*s!AX32=0,0,M33*s!AT32*s!AZ32/(s!AT32*s!AZ32+s!AV32*s!AX32))+IF(s!AT32*s!BA32+s!AU32*s!AZ32+s!AV32*s!AY32+s!AW32*s!AX32=0,0,N33*s!AT32*s!BA32/(s!AT32*s!BA32+s!AU32*s!AZ32+s!AV32*s!AY32+s!AW32*s!AX32)) -> 244.65839125466593 | AU33: =AD33+IF(s!AU32*s!AV32+s!AT32*s!AW32=0,0,E33*s!AU32*s!AV32/(s!AU32*s!AV32+s!AT32*s!AW32))+IF(s!AT32*s!AY32+s!AU32*s!AX32=0,0,K33*s!AU32*s!AX32/(s!AT32*s!AY32+s!AU32*s!AX32))+IF(s!AU32*s!BA32+s!AW32*s!AY32=0,0,O33*s!AU32*s!BA32/(s!AU32*s!BA32+s!AW32*s!AY32))+IF(s!AT32*s!BA32+s!AU32*s!AZ32+s!AV32*s!AY32+s!AW32*s!AX32=0,0,N33*s!AU32*s!AZ32/(s!AT32*s!BA32+s!AU32*s!AZ32+s!AV32*s!AY32+s!AW32*s!AX32)) -> 445.77362977303721 | AV33: =AE33+IF(s!AU32*s!AV32+s!AT32*s!AW32=0,0,E33*s!AU32*s!AV32/(s!AU32*s!AV32+s!AT32*s!AW32))+IF(s!AV32*s!AX32+s!AT32*s!AZ32=0,0,M33*s!AV32*s!AX32/(s!AV32*s!AX32+s!AT32*s!AZ32))+IF(s!AV32*s!BA32+s!AW32*s!AZ32=0,0,Q33*s!AV32*s!BA32/(s!AV32*s!BA32+s!AW32*s!AZ32))+IF(s!AT32*s!BA32+s!AU32*s!AZ32+s!AV32*s!AY32+s!AW32*s!AX32=0,0,N33*s!AV32*s!AY32/(s!AT32*s!BA32+s!AU32*s!AZ32+s!AV32*s!AY32+s!AW32*s!AX32)) -> 13.96139439094782 | AW33: =AF33+IF(s!AT32*s!AW32+s!AU32*s!AV32=0,0,E33*s!AT32*s!AW32/(s!AT32*s!AW32+s!AU32*s!AV32))+IF(s!AU32*s!BA32+s!AW32*s!AY32=0,0,O33*s!AW32*s!AY32/(s!AU32*s!BA32+s!AW32*s!AY32))+IF(s!AV32*s!BA32+s!AW32*s!AZ32=0,0,Q33*s!AW32*s!AZ32/(s!AV32*s!BA32+s!AW32*s!AZ32))+IF(s!AT32*s!BA32+s!AU32*s!AZ32+s!AV32*s!AY32+s!AW32*s!AX32=0,0,N33*s!AW32*s!AX32/(s!AT32*s!BA32+s!AU32*s!AZ32+s!AV32*s!AY32+s!AW32*s!AX32)) -> 9.6065845813490398 | AX33: =AG33+IF(s!AT32*s!AY32+s!AU32*s!AX32=0,0,K33*s!AU32*s!AX32/(s!AT32*s!AY32+s!AU32*s!AX32))+IF(s!AV32*s!AX32+s!AT32*s!AZ32=0,0,M33*s!AV32*s!AX32/(s!AV32*s!AX32+s!AT32*s!AZ32))+IF(s!AX32*s!BA32+s!AY32*s!AZ32=0,0,W33*s!AX32*s!BA32/(s!AX32*s!BA32+s!AY32*s!AZ32))+IF(s!AT32*s!BA32+s!AU32*s!AZ32+s!AV32*s!AY32+s!AW32*s!AX32=0,0,N33*s!AW32*s!AX32/(s!AT32*s!BA32+s!AU32*s!AZ32+s!AV32*s!AY32+s!AW32*s!AX32)) -> 13.990672468655044 | AY33: =AH33+IF(s!AT32*s!AY32+s!AU32*s!AX32=0,0,K33*s!AT32*s!AY32/(s!AT32*s!AY32+s!AU32*s!AX32))+IF(s!AU32*s!BA32+s!AW32*s!AY32=0,0,O33*s!AW32*s!AY32/(s!AU32*s!BA32+s!AW32*s!AY32))+IF(s!AX32*s!BA32+s!AY32*s!AZ32=0,0,W33*s!AY32*s!AZ32/(s!AX32*s!BA32+s!AY32*s!AZ32))+IF(s!AT32*s!BA32+s!AU32*s!AZ32+s!AV32*s!AY32+s!AW32*s!AX32=0,0,N33*s!AV32*s!AY32/(s!AT32*s!BA32+s!AU32*s!AZ32+s!AV32*s!AY32+s!AW32*s!AX32)) -> 10.577306503641816 | AZ33: =AI33+IF(s!AT32*s!AZ32+s!AV32*s!AX32=0,0,M33*s!AT32*s!AZ32/(s!AT32*s!AZ32+s!AV32*s!AX32))+IF(s!AV32*s!BA32+s!AW32*s!AZ32=0,0,Q33*s!AW32*s!AZ32/(s!AV32*s!BA32+s!AW32*s!AZ32))+IF(s!AX32*s!BA32+s!AY32*s!AZ32=0,0,W33*s!AY32*s!AZ32/(s!AX32*s!BA32+s!AY32*s!AZ32))+IF(s!AT32*s!BA32+s!AU32*s!AZ32+s!AV32*s!AY32+s!AW32*s!AX32=0,0,N33*s!AU32*s!AZ32/(s!AT32*s!BA32+s!AU32*s!AZ32+s!AV32*s!AY32+s!AW32*s!AX32)) -> 17.389541885731209 | BA33: =AJ33+IF(s!AU32*s!BA32+s!AW32*s!AY32=0,0,O33*s!AU32*s!BA32/(s!AU32*s!BA32+s!AW32*s!AY32))+IF(s!AV32*s!BA32+s!AW32*s!AZ32=0,0,Q33*s!AV32*s!BA32/(s!AV32*s!BA32+s!AW32*s!AZ32))+IF(s!AX32*s!BA32+s!AY32*s!AZ32=0,0,W33*s!AX32*s!BA32/(s!AX32*s!BA32+s!AY32*s!AZ32))+IF(s!AT32*s!BA32+s!AU32*s!AZ32+s!AV32*s!AY32+s!AW32*s!AX32=0,0,N33*s!AT32*s!BA32/(s!AT32*s!BA32+s!AU32*s!AZ32+s!AV32*s!AY32+s!AW32*s!AX32)) -> 22.042479141971931 | BJ33: =SUM(AT33:BA33) -> 778
A34: =A33 -> 100 | B34: =B33 -> 30 | C34: =C33 -> 200 | D34: =D33 -> 2 | E34: =E33 -> 4 | F34: =F33 -> 1 | G34: =G33 -> 1 | H34: =H33 -> 2 | I34: =I33 -> 1 | J34: =J33 -> 2 | K34: =K33 -> 4 | L34: =L33 -> 2 | M34: =M33 -> 4 | N34: =N33 -> 8 | O34: =O33 -> 4 | P34: =P33 -> 2 | Q34: =Q33 -> 4 | R34: =R33 -> 2 | S34: =S33 -> 1 | T34: =T33 -> 2 | U34: =U33 -> 1 | V34: =V33 -> 2 | W34: =W33 -> 4 | X34: =X33 -> 2 | Y34: =Y33 -> 1 | Z34: =Z33 -> 2 | AA34: =AA33 -> 1 | AB34: =AB33 -> 389 | AC34: =AC33 -> 234 | AD34: =AD33 -> 433 | AE34: =AE33 -> 8 | AF34: =AF33 -> 7 | AG34: =AG33 -> 8 | AH34: =AH33 -> 8 | AI34: =AI33 -> 8 | AJ34: =AJ33 -> 8 | AS34: =AS33 -> 714 | AT34: =AC34+IF(s!AT33*s!AW33+s!AU33*s!AV33=0,0,E34*s!AT33*s!AW33/(s!AT33*s!AW33+s!AU33*s!AV33))+IF(s!AT33*s!AY33+s!AU33*s!AX33=0,0,K34*s!AT33*s!AY33/(s!AT33*s!AY33+s!AU33*s!AX33))+IF(s!AT33*s!AZ33+s!AV33*s!AX33=0,0,M34*s!AT33*s!AZ33/(s!AT33*s!AZ33+s!AV33*s!AX33))+IF(s!AT33*s!BA33+s!AU33*s!AZ33+s!AV33*s!AY33+s!AW33*s!AX33=0,0,N34*s!AT33*s!BA33/(s!AT33*s!BA33+s!AU33*s!AZ33+s!AV33*s!AY33+s!AW33*s!AX33)) -> 244.65839286796952 | AU34: =AD34+IF(s!AU33*s!AV33+s!AT33*s!AW33=0,0,E34*s!AU33*s!AV33/(s!AU33*s!AV33+s!AT33*s!AW33))+IF(s!AT33*s!AY33+s!AU33*s!AX33=0,0,K34*s!AU33*s!AX33/(s!AT33*s!AY33+s!AU33*s!AX33))+IF(s!AU33*s!BA33+s!AW33*s!AY33=0,0,O34*s!AU33*s!BA33/(s!AU33*s!BA33+s!AW33*s!AY33))+IF(s!AT33*s!BA33+s!AU33*s!AZ33+s!AV33*s!AY33+s!AW33*s!AX33=0,0,N34*s!AU33*s!AZ33/(s!AT33*s!BA33+s!AU33*s!AZ33+s!AV33*s!AY33+s!AW33*s!AX33)) -> 445.77362714949197 | AV34: =AE34+IF(s!AU33*s!AV33+s!AT33*s!AW33=0,0,E34*s!AU33*s!AV33/(s!AU33*s!AV33+s!AT33*s!AW33))+IF(s!AV33*s!AX33+s!AT33*s!AZ33=0,0,M34*s!AV33*s!AX33/(s!AV33*s!AX33+s!AT33*s!AZ33))+IF(s!AV33*s!BA33+s!AW33*s!AZ33=0,0,Q34*s!AV33*s!BA33/(s!AV33*s!BA33+s!AW33*s!AZ33))+IF(s!AT33*s!BA33+s!AU33*s!AZ33+s!AV33*s!AY33+s!AW33*s!AX33=0,0,N34*s!AV33*s!AY33/(s!AT33*s!BA33+s!AU33*s!AZ33+s!AV33*s!AY33+s!AW33*s!AX33)) -> 13.961409429735941 | AW34: =AF34+IF(s!AT33*s!AW33+s!AU33*s!AV33=0,0,E34*s!AT33*s!AW33/(s!AT33*s!AW33+s!AU33*s!AV33))+IF(s!AU33*s!BA33+s!AW33*s!AY33=0,0,O34*s!AW33*s!AY33/(s!AU33*s!BA33+s!AW33*s!AY33))+IF(s!AV33*s!BA33+s!AW33*s!AZ33=0,0,Q34*s!AW33*s!AZ33/(s!AV33*s!BA33+s!AW33*s!AZ33))+IF(s!AT33*s!BA33+s!AU33*s!AZ33+s!AV33*s!AY33+s!AW33*s!AX33=0,0,N34*s!AW33*s!AX33/(s!AT33*s!BA33+s!AU33*s!AZ33+s!AV33*s!AY33+s!AW33*s!AX33)) -> 9.6065705528025287 | AX34: =AG34+IF(s!AT33*s!AY33+s!AU33*s!AX33=0,0,K34*s!AU33*s!AX33/(s!AT33*s!AY33+s!AU33*s!AX33))+IF(s!AV33*s!AX33+s!AT33*s!AZ33=0,0,M34*s!AV33*s!AX33/(s!AV33*s!AX33+s!AT33*s!AZ33))+IF(s!AX33*s!BA33+s!AY33*s!AZ33=0,0,W34*s!AX33*s!BA33/(s!AX33*s!BA33+s!AY33*s!AZ33))+IF(s!AT33*s!BA33+s!AU33*s!AZ33+s!AV33*s!AY33+s!AW33*s!AX33=0,0,N34*s!AW33*s!AX33/(s!AT33*s!BA33+s!AU33*s!AZ33+s!AV33*s!AY33+s!AW33*s!AX33)) -> 13.99068607738003 | AY34: =AH34+IF(s!AT33*s!AY33+s!AU33*s!AX33=0,0,K34*s!AT33*s!AY33/(s!AT33*s!AY33+s!AU33*s!AX33))+IF(s!AU33*s!BA33+s!AW33*s!AY33=0,0,O34*s!AW33*s!AY33/(s!AU33*s!BA33+s!AW33*s!AY33))+IF(s!AX33*s!BA33+s!AY33*s!AZ33=0,0,W34*s!AY33*s!AZ33/(s!AX33*s!BA33+s!AY33*s!AZ33))+IF(s!AT33*s!BA33+s!AU33*s!AZ33+s!AV33*s!AY33+s!AW33*s!AX33=0,0,N34*s!AV33*s!AY33/(s!AT33*s!BA33+s!AU33*s!AZ33+s!AV33*s!AY33+s!AW33*s!AX33)) -> 10.577293905158442 | AZ34: =AI34+IF(s!AT33*s!AZ33+s!AV33*s!AX33=0,0,M34*s!AT33*s!AZ33/(s!AT33*s!AZ33+s!AV33*s!AX33))+IF(s!AV33*s!BA33+s!AW33*s!AZ33=0,0,Q34*s!AW33*s!AZ33/(s!AV33*s!BA33+s!AW33*s!AZ33))+IF(s!AX33*s!BA33+s!AY33*s!AZ33=0,0,W34*s!AY33*s!AZ33/(s!AX33*s!BA33+s!AY33*s!AZ33))+IF(s!AT33*s!BA33+s!AU33*s!AZ33+s!AV33*s!AY33+s!AW33*s!AX33=0,0,N34*s!AU33*s!AZ33/(s!AT33*s!BA33+s!AU33*s!AZ33+s!AV33*s!AY33+s!AW33*s!AX33)) -> 17.389511624914487 | BA34: =AJ34+IF(s!AU33*s!BA33+s!AW33*s!AY33=0,0,O34*s!AU33*s!BA33/(s!AU33*s!BA33+s!AW33*s!AY33))+IF(s!AV33*s!BA33+s!AW33*s!AZ33=0,0,Q34*s!AV33*s!BA33/(s!AV33*s!BA33+s!AW33*s!AZ33))+IF(s!AX33*s!BA33+s!AY33*s!AZ33=0,0,W34*s!AX33*s!BA33/(s!AX33*s!BA33+s!AY33*s!AZ33))+IF(s!AT33*s!BA33+s!AU33*s!AZ33+s!AV33*s!AY33+s!AW33*s!AX33=0,0,N34*s!AT33*s!BA33/(s!AT33*s!BA33+s!AU33*s!AZ33+s!AV33*s!AY33+s!AW33*s!AX33)) -> 22.042508392547045 | BJ34: =SUM(AT34:BA34) -> 778
A35: =A34 -> 100 | B35: =B34 -> 30 | C35: =C34 -> 200 | D35: =D34 -> 2 | E35: =E34 -> 4 | F35: =F34 -> 1 | G35: =G34 -> 1 | H35: =H34 -> 2 | I35: =I34 -> 1 | J35: =J34 -> 2 | K35: =K34 -> 4 | L35: =L34 -> 2 | M35: =M34 -> 4 | N35: =N34 -> 8 | O35: =O34 -> 4 | P35: =P34 -> 2 | Q35: =Q34 -> 4 | R35: =R34 -> 2 | S35: =S34 -> 1 | T35: =T34 -> 2 | U35: =U34 -> 1 | V35: =V34 -> 2 | W35: =W34 -> 4 | X35: =X34 -> 2 | Y35: =Y34 -> 1 | Z35: =Z34 -> 2 | AA35: =AA34 -> 1 | AB35: =AB34 -> 389 | AC35: =AC34 -> 234 | AD35: =AD34 -> 433 | AE35: =AE34 -> 8 | AF35: =AF34 -> 7 | AG35: =AG34 -> 8 | AH35: =AH34 -> 8 | AI35: =AI34 -> 8 | AJ35: =AJ34 -> 8 | AS35: =AS34 -> 714 | AT35: =AC35+IF(s!AT34*s!AW34+s!AU34*s!AV34=0,0,E35*s!AT34*s!AW34/(s!AT34*s!AW34+s!AU34*s!AV34))+IF(s!AT34*s!AY34+s!AU34*s!AX34=0,0,K35*s!AT34*s!AY34/(s!AT34*s!AY34+s!AU34*s!AX34))+IF(s!AT34*s!AZ34+s!AV34*s!AX34=0,0,M35*s!AT34*s!AZ34/(s!AT34*s!AZ34+s!AV34*s!AX34))+IF(s!AT34*s!BA34+s!AU34*s!AZ34+s!AV34*s!AY34+s!AW34*s!AX34=0,0,N35*s!AT34*s!BA34/(s!AT34*s!BA34+s!AU34*s!AZ34+s!AV34*s!AY34+s!AW34*s!AX34)) -> 244.65839402411987 | AU35: =AD35+IF(s!AU34*s!AV34+s!AT34*s!AW34=0,0,E35*s!AU34*s!AV34/(s!AU34*s!AV34+s!AT34*s!AW34))+IF(s!AT34*s!AY34+s!AU34*s!AX34=0,0,K35*s!AU34*s!AX34/(s!AT34*s!AY34+s!AU34*s!AX34))+IF(s!AU34*s!BA34+s!AW34*s!AY34=0,0,O35*s!AU34*s!BA34/(s!AU34*s!BA34+s!AW34*s!AY34))+IF(s!AT34*s!BA34+s!AU34*s!AZ34+s!AV34*s!AY34+s!AW34*s!AX34=0,0,N35*s!AU34*s!AZ34/(s!AT34*s!BA34+s!AU34*s!AZ34+s!AV34*s!AY34+s!AW34*s!AX34)) -> 445.77362527169339 | AV35: =AE35+IF(s!AU34*s!AV34+s!AT34*s!AW34=0,0,E35*s!AU34*s!AV34/(s!AU34*s!AV34+s!AT34*s!AW34))+IF(s!AV34*s!AX34+s!AT34*s!AZ34=0,0,M35*s!AV34*s!AX34/(s!AV34*s!AX34+s!AT34*s!AZ34))+IF(s!AV34*s!BA34+s!AW34*s!AZ34=0,0,Q35*s!AV34*s!BA34/(s!AV34*s!BA34+s!AW34*s!AZ34))+IF(s!AT34*s!BA34+s!AU34*s!AZ34+s!AV34*s!AY34+s!AW34*s!AX34=0,0,N35*s!AV34*s!AY34/(s!AT34*s!BA34+s!AU34*s!AZ34+s!AV34*s!AY34+s!AW34*s!AX34)) -> 13.961420166113387 | AW35: =AF35+IF(s!AT34*s!AW34+s!AU34*s!AV34=0,0,E35*s!AT34*s!AW34/(s!AT34*s!AW34+s!AU34*s!AV34))+IF(s!AU34*s!BA34+s!AW34*s!AY34=0,0,O35*s!AW34*s!AY34/(s!AU34*s!BA34+s!AW34*s!AY34))+IF(s!AV34*s!BA34+s!AW34*s!AZ34=0,0,Q35*s!AW34*s!AZ34/(s!AV34*s!BA34+s!AW34*s!AZ34))+IF(s!AT34*s!BA34+s!AU34*s!AZ34+s!AV34*s!AY34+s!AW34*s!AX34=0,0,N35*s!AW34*s!AX34/(s!AT34*s!BA34+s!AU34*s!AZ34+s!AV34*s!AY34+s!AW34*s!AX34)) -> 9.6065605380734151 | AX35: =AG35+IF(s!AT34*s!AY34+s!AU34*s!AX34=0,0,K35*s!AU34*s!AX34/(s!AT34*s!AY34+s!AU34*s!AX34))+IF(s!AV34*s!AX34+s!AT34*s!AZ34=0,0,M35*s!AV34*s!AX34/(s!AV34*s!AX34+s!AT34*s!AZ34))+IF(s!AX34*s!BA34+s!AY34*s!AZ34=0,0,W35*s!AX34*s!BA34/(s!AX34*s!BA34+s!AY34*s!AZ34))+IF(s!AT34*s!BA34+s!AU34*s!AZ34+s!AV34*s!AY34+s!AW34*s!AX34=0,0,N35*s!AW34*s!AX34/(s!AT34*s!BA34+s!AU34*s!AZ34+s!AV34*s!AY34+s!AW34*s!AX34)) -> 13.990695794952593 | AY35: =AH35+IF(s!AT34*s!AY34+s!AU34*s!AX34=0,0,K35*s!AT34*s!AY34/(s!AT34*s!AY34+s!AU34*s!AX34))+IF(s!AU34*s!BA34+s!AW34*s!AY34=0,0,O35*s!AW34*s!AY34/(s!AU34*s!BA34+s!AW34*s!AY34))+IF(s!AX34*s!BA34+s!AY34*s!AZ34=0,0,W35*s!AY34*s!AZ34/(s!AX34*s!BA34+s!AY34*s!AZ34))+IF(s!AT34*s!BA34+s!AU34*s!AZ34+s!AV34*s!AY34+s!AW34*s!AX34=0,0,N35*s!AV34*s!AY34/(s!AT34*s!BA34+s!AU34*s!AZ34+s!AV34*s!AY34+s!AW34*s!AX34)) -> 10.577284909234207 | AZ35: =AI35+IF(s!AT34*s!AZ34+s!AV34*s!AX34=0,0,M35*s!AT34*s!AZ34/(s!AT34*s!AZ34+s!AV34*s!AX34))+IF(s!AV34*s!BA34+s!AW34*s!AZ34=0,0,Q35*s!AW34*s!AZ34/(s!AV34*s!BA34+s!AW34*s!AZ34))+IF(s!AX34*s!BA34+s!AY34*s!AZ34=0,0,W35*s!AY34*s!AZ34/(s!AX34*s!BA34+s!AY34*s!AZ34))+IF(s!AT34*s!BA34+s!AU34*s!AZ34+s!AV34*s!AY34+s!AW34*s!AX34=0,0,N35*s!AU34*s!AZ34/(s!AT34*s!BA34+s!AU34*s!AZ34+s!AV34*s!AY34+s!AW34*s!AX34)) -> 17.389490014814161 | BA35: =AJ35+IF(s!AU34*s!BA34+s!AW34*s!AY34=0,0,O35*s!AU34*s!BA34/(s!AU34*s!BA34+s!AW34*s!AY34))+IF(s!AV34*s!BA34+s!AW34*s!AZ34=0,0,Q35*s!AV34*s!BA34/(s!AV34*s!BA34+s!AW34*s!AZ34))+IF(s!AX34*s!BA34+s!AY34*s!AZ34=0,0,W35*s!AX34*s!BA34/(s!AX34*s!BA34+s!AY34*s!AZ34))+IF(s!AT34*s!BA34+s!AU34*s!AZ34+s!AV34*s!AY34+s!AW34*s!AX34=0,0,N35*s!AT34*s!BA34/(s!AT34*s!BA34+s!AU34*s!AZ34+s!AV34*s!AY34+s!AW34*s!AX34)) -> 22.042529280999041 | BJ35: =SUM(AT35:BA35) -> 778
A36: =A35 -> 100 | B36: =B35 -> 30 | C36: =C35 -> 200 | D36: =D35 -> 2 | E36: =E35 -> 4 | F36: =F35 -> 1 | G36: =G35 -> 1 | H36: =H35 -> 2 | I36: =I35 -> 1 | J36: =J35 -> 2 | K36: =K35 -> 4 | L36: =L35 -> 2 | M36: =M35 -> 4 | N36: =N35 -> 8 | O36: =O35 -> 4 | P36: =P35 -> 2 | Q36: =Q35 -> 4 | R36: =R35 -> 2 | S36: =S35 -> 1 | T36: =T35 -> 2 | U36: =U35 -> 1 | V36: =V35 -> 2 | W36: =W35 -> 4 | X36: =X35 -> 2 | Y36: =Y35 -> 1 | Z36: =Z35 -> 2 | AA36: =AA35 -> 1 | AB36: =AB35 -> 389 | AC36: =AC35 -> 234 | AD36: =AD35 -> 433 | AE36: =AE35 -> 8 | AF36: =AF35 -> 7 | AG36: =AG35 -> 8 | AH36: =AH35 -> 8 | AI36: =AI35 -> 8 | AJ36: =AJ35 -> 8 | AS36: =AS35 -> 714 | AT36: =AC36+IF(s!AT35*s!AW35+s!AU35*s!AV35=0,0,E36*s!AT35*s!AW35/(s!AT35*s!AW35+s!AU35*s!AV35))+IF(s!AT35*s!AY35+s!AU35*s!AX35=0,0,K36*s!AT35*s!AY35/(s!AT35*s!AY35+s!AU35*s!AX35))+IF(s!AT35*s!AZ35+s!AV35*s!AX35=0,0,M36*s!AT35*s!AZ35/(s!AT35*s!AZ35+s!AV35*s!AX35))+IF(s!AT35*s!BA35+s!AU35*s!AZ35+s!AV35*s!AY35+s!AW35*s!AX35=0,0,N36*s!AT35*s!BA35/(s!AT35*s!BA35+s!AU35*s!AZ35+s!AV35*s!AY35+s!AW35*s!AX35)) -> 244.65839485221929 | AU36: =AD36+IF(s!AU35*s!AV35+s!AT35*s!AW35=0,0,E36*s!AU35*s!AV35/(s!AU35*s!AV35+s!AT35*s!AW35))+IF(s!AT35*s!AY35+s!AU35*s!AX35=0,0,K36*s!AU35*s!AX35/(s!AT35*s!AY35+s!AU35*s!AX35))+IF(s!AU35*s!BA35+s!AW35*s!AY35=0,0,O36*s!AU35*s!BA35/(s!AU35*s!BA35+s!AW35*s!AY35))+IF(s!AT35*s!BA35+s!AU35*s!AZ35+s!AV35*s!AY35+s!AW35*s!AX35=0,0,N36*s!AU35*s!AZ35/(s!AT35*s!BA35+s!AU35*s!AZ35+s!AV35*s!AY35+s!AW35*s!AX35)) -> 445.7736239279393 | AV36: =AE36+IF(s!AU35*s!AV35+s!AT35*s!AW35=0,0,E36*s!AU35*s!AV35/(s!AU35*s!AV35+s!AT35*s!AW35))+IF(s!AV35*s!AX35+s!AT35*s!AZ35=0,0,M36*s!AV35*s!AX35/(s!AV35*s!AX35+s!AT35*s!AZ35))+IF(s!AV35*s!BA35+s!AW35*s!AZ35=0,0,Q36*s!AV35*s!BA35/(s!AV35*s!BA35+s!AW35*s!AZ35))+IF(s!AT35*s!BA35+s!AU35*s!AZ35+s!AV35*s!AY35+s!AW35*s!AX35=0,0,N36*s!AV35*s!AY35/(s!AT35*s!BA35+s!AU35*s!AZ35+s!AV35*s!AY35+s!AW35*s!AX35)) -> 13.961427833075341 | AW36: =AF36+IF(s!AT35*s!AW35+s!AU35*s!AV35=0,0,E36*s!AT35*s!AW35/(s!AT35*s!AW35+s!AU35*s!AV35))+IF(s!AU35*s!BA35+s!AW35*s!AY35=0,0,O36*s!AW35*s!AY35/(s!AU35*s!BA35+s!AW35*s!AY35))+IF(s!AV35*s!BA35+s!AW35*s!AZ35=0,0,Q36*s!AW35*s!AZ35/(s!AV35*s!BA35+s!AW35*s!AZ35))+IF(s!AT35*s!BA35+s!AU35*s!AZ35+s!AV35*s!AY35+s!AW35*s!AX35=0,0,N36*s!AW35*s!AX35/(s!AT35*s!BA35+s!AU35*s!AZ35+s!AV35*s!AY35+s!AW35*s!AX35)) -> 9.6065533867660875 | AX36: =AG36+IF(s!AT35*s!AY35+s!AU35*s!AX35=0,0,K36*s!AU35*s!AX35/(s!AT35*s!AY35+s!AU35*s!AX35))+IF(s!AV35*s!AX35+s!AT35*s!AZ35=0,0,M36*s!AV35*s!AX35/(s!AV35*s!AX35+s!AT35*s!AZ35))+IF(s!AX35*s!BA35+s!AY35*s!AZ35=0,0,W36*s!AX35*s!BA35/(s!AX35*s!BA35+s!AY35*s!AZ35))+IF(s!AT35*s!BA35+s!AU35*s!AZ35+s!AV35*s!AY35+s!AW35*s!AX35=0,0,N36*s!AW35*s!AX35/(s!AT35*s!BA35+s!AU35*s!AZ35+s!AV35*s!AY35+s!AW35*s!AX35)) -> 13.990702735713525 | AY36: =AH36+IF(s!AT35*s!AY35+s!AU35*s!AX35=0,0,K36*s!AT35*s!AY35/(s!AT35*s!AY35+s!AU35*s!AX35))+IF(s!AU35*s!BA35+s!AW35*s!AY35=0,0,O36*s!AW35*s!AY35/(s!AU35*s!BA35+s!AW35*s!AY35))+IF(s!AX35*s!BA35+s!AY35*s!AZ35=0,0,W36*s!AY35*s!AZ35/(s!AX35*s!BA35+s!AY35*s!AZ35))+IF(s!AT35*s!BA35+s!AU35*s!AZ35+s!AV35*s!AY35+s!AW35*s!AX35=0,0,N36*s!AV35*s!AY35/(s!AT35*s!BA35+s!AU35*s!AZ35+s!AV35*s!AY35+s!AW35*s!AX35)) -> 10.577278484127906 | AZ36: =AI36+IF(s!AT35*s!AZ35+s!AV35*s!AX35=0,0,M36*s!AT35*s!AZ35/(s!AT35*s!AZ35+s!AV35*s!AX35))+IF(s!AV35*s!BA35+s!AW35*s!AZ35=0,0,Q36*s!AW35*s!AZ35/(s!AV35*s!BA35+s!AW35*s!AZ35))+IF(s!AX35*s!BA35+s!AY35*s!AZ35=0,0,W36*s!AY35*s!AZ35/(s!AX35*s!BA35+s!AY35*s!AZ35))+IF(s!AT35*s!BA35+s!AU35*s!AZ35+s!AV35*s!AY35+s!AW35*s!AX35=0,0,N36*s!AU35*s!AZ35/(s!AT35*s!BA35+s!AU35*s!AZ35+s!AV35*s!AY35+s!AW35*s!AX35)) -> 17.389474578991859 | BA36: =AJ36+IF(s!AU35*s!BA35+s!AW35*s!AY35=0,0,O36*s!AU35*s!BA35/(s!AU35*s!BA35+s!AW35*s!AY35))+IF(s!AV35*s!BA35+s!AW35*s!AZ35=0,0,Q36*s!AV35*s!BA35/(s!AV35*s!BA35+s!AW35*s!AZ35))+IF(s!AX35*s!BA35+s!AY35*s!AZ35=0,0,W36*s!AX35*s!BA35/(s!AX35*s!BA35+s!AY35*s!AZ35))+IF(s!AT35*s!BA35+s!AU35*s!AZ35+s!AV35*s!AY35+s!AW35*s!AX35=0,0,N36*s!AT35*s!BA35/(s!AT35*s!BA35+s!AU35*s!AZ35+s!AV35*s!AY35+s!AW35*s!AX35)) -> 22.042544201166709 | BJ36: =SUM(AT36:BA36) -> 778
A37: =A36 -> 100 | B37: =B36 -> 30 | C37: =C36 -> 200 | D37: =D36 -> 2 | E37: =E36 -> 4 | F37: =F36 -> 1 | G37: =G36 -> 1 | H37: =H36 -> 2 | I37: =I36 -> 1 | J37: =J36 -> 2 | K37: =K36 -> 4 | L37: =L36 -> 2 | M37: =M36 -> 4 | N37: =N36 -> 8 | O37: =O36 -> 4 | P37: =P36 -> 2 | Q37: =Q36 -> 4 | R37: =R36 -> 2 | S37: =S36 -> 1 | T37: =T36 -> 2 | U37: =U36 -> 1 | V37: =V36 -> 2 | W37: =W36 -> 4 | X37: =X36 -> 2 | Y37: =Y36 -> 1 | Z37: =Z36 -> 2 | AA37: =AA36 -> 1 | AB37: =AB36 -> 389 | AC37: =AC36 -> 234 | AD37: =AD36 -> 433 | AE37: =AE36 -> 8 | AF37: =AF36 -> 7 | AG37: =AG36 -> 8 | AH37: =AH36 -> 8 | AI37: =AI36 -> 8 | AJ37: =AJ36 -> 8 | AS37: =AS36 -> 714 | AT37: =AC37+IF(s!AT36*s!AW36+s!AU36*s!AV36=0,0,E37*s!AT36*s!AW36/(s!AT36*s!AW36+s!AU36*s!AV36))+IF(s!AT36*s!AY36+s!AU36*s!AX36=0,0,K37*s!AT36*s!AY36/(s!AT36*s!AY36+s!AU36*s!AX36))+IF(s!AT36*s!AZ36+s!AV36*s!AX36=0,0,M37*s!AT36*s!AZ36/(s!AT36*s!AZ36+s!AV36*s!AX36))+IF(s!AT36*s!BA36+s!AU36*s!AZ36+s!AV36*s!AY36+s!AW36*s!AX36=0,0,N37*s!AT36*s!BA36/(s!AT36*s!BA36+s!AU36*s!AZ36+s!AV36*s!AY36+s!AW36*s!AX36)) -> 244.65839544511195 | AU37: =AD37+IF(s!AU36*s!AV36+s!AT36*s!AW36=0,0,E37*s!AU36*s!AV36/(s!AU36*s!AV36+s!AT36*s!AW36))+IF(s!AT36*s!AY36+s!AU36*s!AX36=0,0,K37*s!AU36*s!AX36/(s!AT36*s!AY36+s!AU36*s!AX36))+IF(s!AU36*s!BA36+s!AW36*s!AY36=0,0,O37*s!AU36*s!BA36/(s!AU36*s!BA36+s!AW36*s!AY36))+IF(s!AT36*s!BA36+s!AU36*s!AZ36+s!AV36*s!AY36+s!AW36*s!AX36=0,0,N37*s!AU36*s!AZ36/(s!AT36*s!BA36+s!AU36*s!AZ36+s!AV36*s!AY36+s!AW36*s!AX36)) -> 445.77362296649443 | AV37: =AE37+IF(s!AU36*s!AV36+s!AT36*s!AW36=0,0,E37*s!AU36*s!AV36/(s!AU36*s!AV36+s!AT36*s!AW36))+IF(s!AV36*s!AX36+s!AT36*s!AZ36=0,0,M37*s!AV36*s!AX36/(s!AV36*s!AX36+s!AT36*s!AZ36))+IF(s!AV36*s!BA36+s!AW36*s!AZ36=0,0,Q37*s!AV36*s!BA36/(s!AV36*s!BA36+s!AW36*s!AZ36))+IF(s!AT36*s!BA36+s!AU36*s!AZ36+s!AV36*s!AY36+s!AW36*s!AX36=0,0,N37*s!AV36*s!AY36/(s!AT36*s!BA36+s!AU36*s!AZ36+s!AV36*s!AY36+s!AW36*s!AX36)) -> 13.961433309452799 | AW37: =AF37+IF(s!AT36*s!AW36+s!AU36*s!AV36=0,0,E37*s!AT36*s!AW36/(s!AT36*s!AW36+s!AU36*s!AV36))+IF(s!AU36*s!BA36+s!AW36*s!AY36=0,0,O37*s!AW36*s!AY36/(s!AU36*s!BA36+s!AW36*s!AY36))+IF(s!AV36*s!BA36+s!AW36*s!AZ36=0,0,Q37*s!AW36*s!AZ36/(s!AV36*s!BA36+s!AW36*s!AZ36))+IF(s!AT36*s!BA36+s!AU36*s!AZ36+s!AV36*s!AY36+s!AW36*s!AX36=0,0,N37*s!AW36*s!AX36/(s!AT36*s!BA36+s!AU36*s!AZ36+s!AV36*s!AY36+s!AW36*s!AX36)) -> 9.6065482789408367 | AX37: =AG37+IF(s!AT36*s!AY36+s!AU36*s!AX36=0,0,K37*s!AU36*s!AX36/(s!AT36*s!AY36+s!AU36*s!AX36))+IF(s!AV36*s!AX36+s!AT36*s!AZ36=0,0,M37*s!AV36*s!AX36/(s!AV36*s!AX36+s!AT36*s!AZ36))+IF(s!AX36*s!BA36+s!AY36*s!AZ36=0,0,W37*s!AX36*s!BA36/(s!AX36*s!BA36+s!AY36*s!AZ36))+IF(s!AT36*s!BA36+s!AU36*s!AZ36+s!AV36*s!AY36+s!AW36*s!AX36=0,0,N37*s!AW36*s!AX36/(s!AT36*s!BA36+s!AU36*s!AZ36+s!AV36*s!AY36+s!AW36*s!AX36)) -> 13.990707694214063 | AY37: =AH37+IF(s!AT36*s!AY36+s!AU36*s!AX36=0,0,K37*s!AT36*s!AY36/(s!AT36*s!AY36+s!AU36*s!AX36))+IF(s!AU36*s!BA36+s!AW36*s!AY36=0,0,O37*s!AW36*s!AY36/(s!AU36*s!BA36+s!AW36*s!AY36))+IF(s!AX36*s!BA36+s!AY36*s!AZ36=0,0,W37*s!AY36*s!AZ36/(s!AX36*s!BA36+s!AY36*s!AZ36))+IF(s!AT36*s!BA36+s!AU36*s!AZ36+s!AV36*s!AY36+s!AW36*s!AX36=0,0,N37*s!AV36*s!AY36/(s!AT36*s!BA36+s!AU36*s!AZ36+s!AV36*s!AY36+s!AW36*s!AX36)) -> 10.577273894179573 | AZ37: =AI37+IF(s!AT36*s!AZ36+s!AV36*s!AX36=0,0,M37*s!AT36*s!AZ36/(s!AT36*s!AZ36+s!AV36*s!AX36))+IF(s!AV36*s!BA36+s!AW36*s!AZ36=0,0,Q37*s!AW36*s!AZ36/(s!AV36*s!BA36+s!AW36*s!AZ36))+IF(s!AX36*s!BA36+s!AY36*s!AZ36=0,0,W37*s!AY36*s!AZ36/(s!AX36*s!BA36+s!AY36*s!AZ36))+IF(s!AT36*s!BA36+s!AU36*s!AZ36+s!AV36*s!AY36+s!AW36*s!AX36=0,0,N37*s!AU36*s!AZ36/(s!AT36*s!BA36+s!AU36*s!AZ36+s!AV36*s!AY36+s!AW36*s!AX36)) -> 17.389463551221183 | BA37: =AJ37+IF(s!AU36*s!BA36+s!AW36*s!AY36=0,0,O37*s!AU36*s!BA36/(s!AU36*s!BA36+s!AW36*s!AY36))+IF(s!AV36*s!BA36+s!AW36*s!AZ36=0,0,Q37*s!AV36*s!BA36/(s!AV36*s!BA36+s!AW36*s!AZ36))+IF(s!AX36*s!BA36+s!AY36*s!AZ36=0,0,W37*s!AX36*s!BA36/(s!AX36*s!BA36+s!AY36*s!AZ36))+IF(s!AT36*s!BA36+s!AU36*s!AZ36+s!AV36*s!AY36+s!AW36*s!AX36=0,0,N37*s!AT36*s!BA36/(s!AT36*s!BA36+s!AU36*s!AZ36+s!AV36*s!AY36+s!AW36*s!AX36)) -> 22.042554860385181 | BJ37: =SUM(AT37:BA37) -> 778
A38: =A37 -> 100 | B38: =B37 -> 30 | C38: =C37 -> 200 | D38: =D37 -> 2 | E38: =E37 -> 4 | F38: =F37 -> 1 | G38: =G37 -> 1 | H38: =H37 -> 2 | I38: =I37 -> 1 | J38: =J37 -> 2 | K38: =K37 -> 4 | L38: =L37 -> 2 | M38: =M37 -> 4 | N38: =N37 -> 8 | O38: =O37 -> 4 | P38: =P37 -> 2 | Q38: =Q37 -> 4 | R38: =R37 -> 2 | S38: =S37 -> 1 | T38: =T37 -> 2 | U38: =U37 -> 1 | V38: =V37 -> 2 | W38: =W37 -> 4 | X38: =X37 -> 2 | Y38: =Y37 -> 1 | Z38: =Z37 -> 2 | AA38: =AA37 -> 1 | AB38: =AB37 -> 389 | AC38: =AC37 -> 234 | AD38: =AD37 -> 433 | AE38: =AE37 -> 8 | AF38: =AF37 -> 7 | AG38: =AG37 -> 8 | AH38: =AH37 -> 8 | AI38: =AI37 -> 8 | AJ38: =AJ37 -> 8 | AS38: =AS37 -> 714 | AT38: =AC38+IF(s!AT37*s!AW37+s!AU37*s!AV37=0,0,E38*s!AT37*s!AW37/(s!AT37*s!AW37+s!AU37*s!AV37))+IF(s!AT37*s!AY37+s!AU37*s!AX37=0,0,K38*s!AT37*s!AY37/(s!AT37*s!AY37+s!AU37*s!AX37))+IF(s!AT37*s!AZ37+s!AV37*s!AX37=0,0,M38*s!AT37*s!AZ37/(s!AT37*s!AZ37+s!AV37*s!AX37))+IF(s!AT37*s!BA37+s!AU37*s!AZ37+s!AV37*s!AY37+s!AW37*s!AX37=0,0,N38*s!AT37*s!BA37/(s!AT37*s!BA37+s!AU37*s!AZ37+s!AV37*s!AY37+s!AW37*s!AX37)) -> 244.6583958694759 | AU38: =AD38+IF(s!AU37*s!AV37+s!AT37*s!AW37=0,0,E38*s!AU37*s!AV37/(s!AU37*s!AV37+s!AT37*s!AW37))+IF(s!AT37*s!AY37+s!AU37*s!AX37=0,0,K38*s!AU37*s!AX37/(s!AT37*s!AY37+s!AU37*s!AX37))+IF(s!AU37*s!BA37+s!AW37*s!AY37=0,0,O38*s!AU37*s!BA37/(s!AU37*s!BA37+s!AW37*s!AY37))+IF(s!AT37*s!BA37+s!AU37*s!AZ37+s!AV37*s!AY37+s!AW37*s!AX37=0,0,N38*s!AU37*s!AZ37/(s!AT37*s!BA37+s!AU37*s!AZ37+s!AV37*s!AY37+s!AW37*s!AX37)) -> 445.77362227866428 | AV38: =AE38+IF(s!AU37*s!AV37+s!AT37*s!AW37=0,0,E38*s!AU37*s!AV37/(s!AU37*s!AV37+s!AT37*s!AW37))+IF(s!AV37*s!AX37+s!AT37*s!AZ37=0,0,M38*s!AV37*s!AX37/(s!AV37*s!AX37+s!AT37*s!AZ37))+IF(s!AV37*s!BA37+s!AW37*s!AZ37=0,0,Q38*s!AV37*s!BA37/(s!AV37*s!BA37+s!AW37*s!AZ37))+IF(s!AT37*s!BA37+s!AU37*s!AZ37+s!AV37*s!AY37+s!AW37*s!AX37=0,0,N38*s!AV37*s!AY37/(s!AT37*s!BA37+s!AU37*s!AZ37+s!AV37*s!AY37+s!AW37*s!AX37)) -> 13.961437221950451 | AW38: =AF38+IF(s!AT37*s!AW37+s!AU37*s!AV37=0,0,E38*s!AT37*s!AW37/(s!AT37*s!AW37+s!AU37*s!AV37))+IF(s!AU37*s!BA37+s!AW37*s!AY37=0,0,O38*s!AW37*s!AY37/(s!AU37*s!BA37+s!AW37*s!AY37))+IF(s!AV37*s!BA37+s!AW37*s!AZ37=0,0,Q38*s!AW37*s!AZ37/(s!AV37*s!BA37+s!AW37*s!AZ37))+IF(s!AT37*s!BA37+s!AU37*s!AZ37+s!AV37*s!AY37+s!AW37*s!AX37=0,0,N38*s!AW37*s!AX37/(s!AT37*s!BA37+s!AU37*s!AZ37+s!AV37*s!AY37+s!AW37*s!AX37)) -> 9.6065446299093402 | AX38: =AG38+IF(s!AT37*s!AY37+s!AU37*s!AX37=0,0,K38*s!AU37*s!AX37/(s!AT37*s!AY37+s!AU37*s!AX37))+IF(s!AV37*s!AX37+s!AT37*s!AZ37=0,0,M38*s!AV37*s!AX37/(s!AV37*s!AX37+s!AT37*s!AZ37))+IF(s!AX37*s!BA37+s!AY37*s!AZ37=0,0,W38*s!AX37*s!BA37/(s!AX37*s!BA37+s!AY37*s!AZ37))+IF(s!AT37*s!BA37+s!AU37*s!AZ37+s!AV37*s!AY37+s!AW37*s!AX37=0,0,N38*s!AW37*s!AX37/(s!AT37*s!BA37+s!AU37*s!AZ37+s!AV37*s!AY37+s!AW37*s!AX37)) -> 13.990711237244318 | AY38: =AH38+IF(s!AT37*s!AY37+s!AU37*s!AX37=0,0,K38*s!AT37*s!AY37/(s!AT37*s!AY37+s!AU37*s!AX37))+IF(s!AU37*s!BA37+s!AW37*s!AY37=0,0,O38*s!AW37*s!AY37/(s!AU37*s!BA37+s!AW37*s!AY37))+IF(s!AX37*s!BA37+s!AY37*s!AZ37=0,0,W38*s!AY37*s!AZ37/(s!AX37*s!BA37+s!AY37*s!AZ37))+IF(s!AT37*s!BA37+s!AU37*s!AZ37+s!AV37*s!AY37+s!AW37*s!AX37=0,0,N38*s!AV37*s!AY37/(s!AT37*s!BA37+s!AU37*s!AZ37+s!AV37*s!AY37+s!AW37*s!AX37)) -> 10.577270614615474 | AZ38: =AI38+IF(s!AT37*s!AZ37+s!AV37*s!AX37=0,0,M38*s!AT37*s!AZ37/(s!AT37*s!AZ37+s!AV37*s!AX37))+IF(s!AV37*s!BA37+s!AW37*s!AZ37=0,0,Q38*s!AW37*s!AZ37/(s!AV37*s!BA37+s!AW37*s!AZ37))+IF(s!AX37*s!BA37+s!AY37*s!AZ37=0,0,W38*s!AY37*s!AZ37/(s!AX37*s!BA37+s!AY37*s!AZ37))+IF(s!AT37*s!BA37+s!AU37*s!AZ37+s!AV37*s!AY37+s!AW37*s!AX37=0,0,N38*s!AU37*s!AZ37/(s!AT37*s!BA37+s!AU37*s!AZ37+s!AV37*s!AY37+s!AW37*s!AX37)) -> 17.389455671329333 | BA38: =AJ38+IF(s!AU37*s!BA37+s!AW37*s!AY37=0,0,O38*s!AU37*s!BA37/(s!AU37*s!BA37+s!AW37*s!AY37))+IF(s!AV37*s!BA37+s!AW37*s!AZ37=0,0,Q38*s!AV37*s!BA37/(s!AV37*s!BA37+s!AW37*s!AZ37))+IF(s!AX37*s!BA37+s!AY37*s!AZ37=0,0,W38*s!AX37*s!BA37/(s!AX37*s!BA37+s!AY37*s!AZ37))+IF(s!AT37*s!BA37+s!AU37*s!AZ37+s!AV37*s!AY37+s!AW37*s!AX37=0,0,N38*s!AT37*s!BA37/(s!AT37*s!BA37+s!AU37*s!AZ37+s!AV37*s!AY37+s!AW37*s!AX37)) -> 22.042562476810872 | BJ38: =SUM(AT38:BA38) -> 778
A39: =A38 -> 100 | B39: =B38 -> 30 | C39: =C38 -> 200 | D39: =D38 -> 2 | E39: =E38 -> 4 | F39: =F38 -> 1 | G39: =G38 -> 1 | H39: =H38 -> 2 | I39: =I38 -> 1 | J39: =J38 -> 2 | K39: =K38 -> 4 | L39: =L38 -> 2 | M39: =M38 -> 4 | N39: =N38 -> 8 | O39: =O38 -> 4 | P39: =P38 -> 2 | Q39: =Q38 -> 4 | R39: =R38 -> 2 | S39: =S38 -> 1 | T39: =T38 -> 2 | U39: =U38 -> 1 | V39: =V38 -> 2 | W39: =W38 -> 4 | X39: =X38 -> 2 | Y39: =Y38 -> 1 | Z39: =Z38 -> 2 | AA39: =AA38 -> 1 | AB39: =AB38 -> 389 | AC39: =AC38 -> 234 | AD39: =AD38 -> 433 | AE39: =AE38 -> 8 | AF39: =AF38 -> 7 | AG39: =AG38 -> 8 | AH39: =AH38 -> 8 | AI39: =AI38 -> 8 | AJ39: =AJ38 -> 8 | AS39: =AS38 -> 714 | AT39: =AC39+IF(s!AT38*s!AW38+s!AU38*s!AV38=0,0,E39*s!AT38*s!AW38/(s!AT38*s!AW38+s!AU38*s!AV38))+IF(s!AT38*s!AY38+s!AU38*s!AX38=0,0,K39*s!AT38*s!AY38/(s!AT38*s!AY38+s!AU38*s!AX38))+IF(s!AT38*s!AZ38+s!AV38*s!AX38=0,0,M39*s!AT38*s!AZ38/(s!AT38*s!AZ38+s!AV38*s!AX38))+IF(s!AT38*s!BA38+s!AU38*s!AZ38+s!AV38*s!AY38+s!AW38*s!AX38=0,0,N39*s!AT38*s!BA38/(s!AT38*s!BA38+s!AU38*s!AZ38+s!AV38*s!AY38+s!AW38*s!AX38)) -> 244.65839617314694 | AU39: =AD39+IF(s!AU38*s!AV38+s!AT38*s!AW38=0,0,E39*s!AU38*s!AV38/(s!AU38*s!AV38+s!AT38*s!AW38))+IF(s!AT38*s!AY38+s!AU38*s!AX38=0,0,K39*s!AU38*s!AX38/(s!AT38*s!AY38+s!AU38*s!AX38))+IF(s!AU38*s!BA38+s!AW38*s!AY38=0,0,O39*s!AU38*s!BA38/(s!AU38*s!BA38+s!AW38*s!AY38))+IF(s!AT38*s!BA38+s!AU38*s!AZ38+s!AV38*s!AY38+s!AW38*s!AX38=0,0,N39*s!AU38*s!AZ38/(s!AT38*s!BA38+s!AU38*s!AZ38+s!AV38*s!AY38+s!AW38*s!AX38)) -> 445.77362178661991 | AV39: =AE39+IF(s!AU38*s!AV38+s!AT38*s!AW38=0,0,E39*s!AU38*s!AV38/(s!AU38*s!AV38+s!AT38*s!AW38))+IF(s!AV38*s!AX38+s!AT38*s!AZ38=0,0,M39*s!AV38*s!AX38/(s!AV38*s!AX38+s!AT38*s!AZ38))+IF(s!AV38*s!BA38+s!AW38*s!AZ38=0,0,Q39*s!AV38*s!BA38/(s!AV38*s!BA38+s!AW38*s!AZ38))+IF(s!AT38*s!BA38+s!AU38*s!AZ38+s!AV38*s!AY38+s!AW38*s!AX38=0,0,N39*s!AV38*s!AY38/(s!AT38*s!BA38+s!AU38*s!AZ38+s!AV38*s!AY38+s!AW38*s!AX38)) -> 13.961440017669164 | AW39: =AF39+IF(s!AT38*s!AW38+s!AU38*s!AV38=0,0,E39*s!AT38*s!AW38/(s!AT38*s!AW38+s!AU38*s!AV38))+IF(s!AU38*s!BA38+s!AW38*s!AY38=0,0,O39*s!AW38*s!AY38/(s!AU38*s!BA38+s!AW38*s!AY38))+IF(s!AV38*s!BA38+s!AW38*s!AZ38=0,0,Q39*s!AW38*s!AZ38/(s!AV38*s!BA38+s!AW38*s!AZ38))+IF(s!AT38*s!BA38+s!AU38*s!AZ38+s!AV38*s!AY38+s!AW38*s!AX38=0,0,N39*s!AW38*s!AX38/(s!AT38*s!BA38+s!AU38*s!AZ38+s!AV38*s!AY38+s!AW38*s!AX38)) -> 9.6065420225639819 | AX39: =AG39+IF(s!AT38*s!AY38+s!AU38*s!AX38=0,0,K39*s!AU38*s!AX38/(s!AT38*s!AY38+s!AU38*s!AX38))+IF(s!AV38*s!AX38+s!AT38*s!AZ38=0,0,M39*s!AV38*s!AX38/(s!AV38*s!AX38+s!AT38*s!AZ38))+IF(s!AX38*s!BA38+s!AY38*s!AZ38=0,0,W39*s!AX38*s!BA38/(s!AX38*s!BA38+s!AY38*s!AZ38))+IF(s!AT38*s!BA38+s!AU38*s!AZ38+s!AV38*s!AY38+s!AW38*s!AX38=0,0,N39*s!AW38*s!AX38/(s!AT38*s!BA38+s!AU38*s!AZ38+s!AV38*s!AY38+s!AW38*s!AX38)) -> 13.990713769279006 | AY39: =AH39+IF(s!AT38*s!AY38+s!AU38*s!AX38=0,0,K39*s!AT38*s!AY38/(s!AT38*s!AY38+s!AU38*s!AX38))+IF(s!AU38*s!BA38+s!AW38*s!AY38=0,0,O39*s!AW38*s!AY38/(s!AU38*s!BA38+s!AW38*s!AY38))+IF(s!AX38*s!BA38+s!AY38*s!AZ38=0,0,W39*s!AY38*s!AZ38/(s!AX38*s!BA38+s!AY38*s!AZ38))+IF(s!AT38*s!BA38+s!AU38*s!AZ38+s!AV38*s!AY38+s!AW38*s!AX38=0,0,N39*s!AV38*s!AY38/(s!AT38*s!BA38+s!AU38*s!AZ38+s!AV38*s!AY38+s!AW38*s!AX38)) -> 10.577268270954141 | AZ39: =AI39+IF(s!AT38*s!AZ38+s!AV38*s!AX38=0,0,M39*s!AT38*s!AZ38/(s!AT38*s!AZ38+s!AV38*s!AX38))+IF(s!AV38*s!BA38+s!AW38*s!AZ38=0,0,Q39*s!AW38*s!AZ38/(s!AV38*s!BA38+s!AW38*s!AZ38))+IF(s!AX38*s!BA38+s!AY38*s!AZ38=0,0,W39*s!AY38*s!AZ38/(s!AX38*s!BA38+s!AY38*s!AZ38))+IF(s!AT38*s!BA38+s!AU38*s!AZ38+s!AV38*s!AY38+s!AW38*s!AX38=0,0,N39*s!AU38*s!AZ38/(s!AT38*s!BA38+s!AU38*s!AZ38+s!AV38*s!AY38+s!AW38*s!AX38)) -> 17.389450039904883 | BA39: =AJ39+IF(s!AU38*s!BA38+s!AW38*s!AY38=0,0,O39*s!AU38*s!BA38/(s!AU38*s!BA38+s!AW38*s!AY38))+IF(s!AV38*s!BA38+s!AW38*s!AZ38=0,0,Q39*s!AV38*s!BA38/(s!AV38*s!BA38+s!AW38*s!AZ38))+IF(s!AX38*s!BA38+s!AY38*s!AZ38=0,0,W39*s!AX38*s!BA38/(s!AX38*s!BA38+s!AY38*s!AZ38))+IF(s!AT38*s!BA38+s!AU38*s!AZ38+s!AV38*s!AY38+s!AW38*s!AX38=0,0,N39*s!AT38*s!BA38/(s!AT38*s!BA38+s!AU38*s!AZ38+s!AV38*s!AY38+s!AW38*s!AX38)) -> 22.042567919861973 | BJ39: =SUM(AT39:BA39) -> 778
A40: =A39 -> 100 | B40: =B39 -> 30 | C40: =C39 -> 200 | D40: =D39 -> 2 | E40: =E39 -> 4 | F40: =F39 -> 1 | G40: =G39 -> 1 | H40: =H39 -> 2 | I40: =I39 -> 1 | J40: =J39 -> 2 | K40: =K39 -> 4 | L40: =L39 -> 2 | M40: =M39 -> 4 | N40: =N39 -> 8 | O40: =O39 -> 4 | P40: =P39 -> 2 | Q40: =Q39 -> 4 | R40: =R39 -> 2 | S40: =S39 -> 1 | T40: =T39 -> 2 | U40: =U39 -> 1 | V40: =V39 -> 2 | W40: =W39 -> 4 | X40: =X39 -> 2 | Y40: =Y39 -> 1 | Z40: =Z39 -> 2 | AA40: =AA39 -> 1 | AB40: =AB39 -> 389 | AC40: =AC39 -> 234 | AD40: =AD39 -> 433 | AE40: =AE39 -> 8 | AF40: =AF39 -> 7 | AG40: =AG39 -> 8 | AH40: =AH39 -> 8 | AI40: =AI39 -> 8 | AJ40: =AJ39 -> 8 | AS40: =AS39 -> 714 | AT40: =AC40+IF(s!AT39*s!AW39+s!AU39*s!AV39=0,0,E40*s!AT39*s!AW39/(s!AT39*s!AW39+s!AU39*s!AV39))+IF(s!AT39*s!AY39+s!AU39*s!AX39=0,0,K40*s!AT39*s!AY39/(s!AT39*s!AY39+s!AU39*s!AX39))+IF(s!AT39*s!AZ39+s!AV39*s!AX39=0,0,M40*s!AT39*s!AZ39/(s!AT39*s!AZ39+s!AV39*s!AX39))+IF(s!AT39*s!BA39+s!AU39*s!AZ39+s!AV39*s!AY39+s!AW39*s!AX39=0,0,N40*s!AT39*s!BA39/(s!AT39*s!BA39+s!AU39*s!AZ39+s!AV39*s!AY39+s!AW39*s!AX39)) -> 244.65839639041562 | AU40: =AD40+IF(s!AU39*s!AV39+s!AT39*s!AW39=0,0,E40*s!AU39*s!AV39/(s!AU39*s!AV39+s!AT39*s!AW39))+IF(s!AT39*s!AY39+s!AU39*s!AX39=0,0,K40*s!AU39*s!AX39/(s!AT39*s!AY39+s!AU39*s!AX39))+IF(s!AU39*s!BA39+s!AW39*s!AY39=0,0,O40*s!AU39*s!BA39/(s!AU39*s!BA39+s!AW39*s!AY39))+IF(s!AT39*s!BA39+s!AU39*s!AZ39+s!AV39*s!AY39+s!AW39*s!AX39=0,0,N40*s!AU39*s!AZ39/(s!AT39*s!BA39+s!AU39*s!AZ39+s!AV39*s!AY39+s!AW39*s!AX39)) -> 445.77362143465075 | AV40: =AE40+IF(s!AU39*s!AV39+s!AT39*s!AW39=0,0,E40*s!AU39*s!AV39/(s!AU39*s!AV39+s!AT39*s!AW39))+IF(s!AV39*s!AX39+s!AT39*s!AZ39=0,0,M40*s!AV39*s!AX39/(s!AV39*s!AX39+s!AT39*s!AZ39))+IF(s!AV39*s!BA39+s!AW39*s!AZ39=0,0,Q40*s!AV39*s!BA39/(s!AV39*s!BA39+s!AW39*s!AZ39))+IF(s!AT39*s!BA39+s!AU39*s!AZ39+s!AV39*s!AY39+s!AW39*s!AX39=0,0,N40*s!AV39*s!AY39/(s!AT39*s!BA39+s!AU39*s!AZ39+s!AV39*s!AY39+s!AW39*s!AX39)) -> 13.961442015695335 | AW40: =AF40+IF(s!AT39*s!AW39+s!AU39*s!AV39=0,0,E40*s!AT39*s!AW39/(s!AT39*s!AW39+s!AU39*s!AV39))+IF(s!AU39*s!BA39+s!AW39*s!AY39=0,0,O40*s!AW39*s!AY39/(s!AU39*s!BA39+s!AW39*s!AY39))+IF(s!AV39*s!BA39+s!AW39*s!AZ39=0,0,Q40*s!AW39*s!AZ39/(s!AV39*s!BA39+s!AW39*s!AZ39))+IF(s!AT39*s!BA39+s!AU39*s!AZ39+s!AV39*s!AY39+s!AW39*s!AX39=0,0,N40*s!AW39*s!AX39/(s!AT39*s!BA39+s!AU39*s!AZ39+s!AV39*s!AY39+s!AW39*s!AX39)) -> 9.6065401592383477 | AX40: =AG40+IF(s!AT39*s!AY39+s!AU39*s!AX39=0,0,K40*s!AU39*s!AX39/(s!AT39*s!AY39+s!AU39*s!AX39))+IF(s!AV39*s!AX39+s!AT39*s!AZ39=0,0,M40*s!AV39*s!AX39/(s!AV39*s!AX39+s!AT39*s!AZ39))+IF(s!AX39*s!BA39+s!AY39*s!AZ39=0,0,W40*s!AX39*s!BA39/(s!AX39*s!BA39+s!AY39*s!AZ39))+IF(s!AT39*s!BA39+s!AU39*s!AZ39+s!AV39*s!AY39+s!AW39*s!AX39=0,0,N40*s!AW39*s!AX39/(s!AT39*s!BA39+s!AU39*s!AZ39+s!AV39*s!AY39+s!AW39*s!AX39)) -> 13.990715579057287 | AY40: =AH40+IF(s!AT39*s!AY39+s!AU39*s!AX39=0,0,K40*s!AT39*s!AY39/(s!AT39*s!AY39+s!AU39*s!AX39))+IF(s!AU39*s!BA39+s!AW39*s!AY39=0,0,O40*s!AW39*s!AY39/(s!AU39*s!BA39+s!AW39*s!AY39))+IF(s!AX39*s!BA39+s!AY39*s!AZ39=0,0,W40*s!AY39*s!AZ39/(s!AX39*s!BA39+s!AY39*s!AZ39))+IF(s!AT39*s!BA39+s!AU39*s!AZ39+s!AV39*s!AY39+s!AW39*s!AX39=0,0,N40*s!AV39*s!AY39/(s!AT39*s!BA39+s!AU39*s!AZ39+s!AV39*s!AY39+s!AW39*s!AX39)) -> 10.577266595876397 | AZ40: =AI40+IF(s!AT39*s!AZ39+s!AV39*s!AX39=0,0,M40*s!AT39*s!AZ39/(s!AT39*s!AZ39+s!AV39*s!AX39))+IF(s!AV39*s!BA39+s!AW39*s!AZ39=0,0,Q40*s!AW39*s!AZ39/(s!AV39*s!BA39+s!AW39*s!AZ39))+IF(s!AX39*s!BA39+s!AY39*s!AZ39=0,0,W40*s!AY39*s!AZ39/(s!AX39*s!BA39+s!AY39*s!AZ39))+IF(s!AT39*s!BA39+s!AU39*s!AZ39+s!AV39*s!AY39+s!AW39*s!AX39=0,0,N40*s!AU39*s!AZ39/(s!AT39*s!BA39+s!AU39*s!AZ39+s!AV39*s!AY39+s!AW39*s!AX39)) -> 17.389446014831776 | BA40: =AJ40+IF(s!AU39*s!BA39+s!AW39*s!AY39=0,0,O40*s!AU39*s!BA39/(s!AU39*s!BA39+s!AW39*s!AY39))+IF(s!AV39*s!BA39+s!AW39*s!AZ39=0,0,Q40*s!AV39*s!BA39/(s!AV39*s!BA39+s!AW39*s!AZ39))+IF(s!AX39*s!BA39+s!AY39*s!AZ39=0,0,W40*s!AX39*s!BA39/(s!AX39*s!BA39+s!AY39*s!AZ39))+IF(s!AT39*s!BA39+s!AU39*s!AZ39+s!AV39*s!AY39+s!AW39*s!AX39=0,0,N40*s!AT39*s!BA39/(s!AT39*s!BA39+s!AU39*s!AZ39+s!AV39*s!AY39+s!AW39*s!AX39)) -> 22.042571810234538 | BJ40: =SUM(AT40:BA40) -> 778
A41: =A40 -> 100 | B41: =B40 -> 30 | C41: =C40 -> 200 | D41: =D40 -> 2 | E41: =E40 -> 4 | F41: =F40 -> 1 | G41: =G40 -> 1 | H41: =H40 -> 2 | I41: =I40 -> 1 | J41: =J40 -> 2 | K41: =K40 -> 4 | L41: =L40 -> 2 | M41: =M40 -> 4 | N41: =N40 -> 8 | O41: =O40 -> 4 | P41: =P40 -> 2 | Q41: =Q40 -> 4 | R41: =R40 -> 2 | S41: =S40 -> 1 | T41: =T40 -> 2 | U41: =U40 -> 1 | V41: =V40 -> 2 | W41: =W40 -> 4 | X41: =X40 -> 2 | Y41: =Y40 -> 1 | Z41: =Z40 -> 2 | AA41: =AA40 -> 1 | AB41: =AB40 -> 389 | AC41: =AC40 -> 234 | AD41: =AD40 -> 433 | AE41: =AE40 -> 8 | AF41: =AF40 -> 7 | AG41: =AG40 -> 8 | AH41: =AH40 -> 8 | AI41: =AI40 -> 8 | AJ41: =AJ40 -> 8 | AS41: =AS40 -> 714 | AT41: =AC41+IF(s!AT40*s!AW40+s!AU40*s!AV40=0,0,E41*s!AT40*s!AW40/(s!AT40*s!AW40+s!AU40*s!AV40))+IF(s!AT40*s!AY40+s!AU40*s!AX40=0,0,K41*s!AT40*s!AY40/(s!AT40*s!AY40+s!AU40*s!AX40))+IF(s!AT40*s!AZ40+s!AV40*s!AX40=0,0,M41*s!AT40*s!AZ40/(s!AT40*s!AZ40+s!AV40*s!AX40))+IF(s!AT40*s!BA40+s!AU40*s!AZ40+s!AV40*s!AY40+s!AW40*s!AX40=0,0,N41*s!AT40*s!BA40/(s!AT40*s!BA40+s!AU40*s!AZ40+s!AV40*s!AY40+s!AW40*s!AX40)) -> 244.65839654584732 | AU41: =AD41+IF(s!AU40*s!AV40+s!AT40*s!AW40=0,0,E41*s!AU40*s!AV40/(s!AU40*s!AV40+s!AT40*s!AW40))+IF(s!AT40*s!AY40+s!AU40*s!AX40=0,0,K41*s!AU40*s!AX40/(s!AT40*s!AY40+s!AU40*s!AX40))+IF(s!AU40*s!BA40+s!AW40*s!AY40=0,0,O41*s!AU40*s!BA40/(s!AU40*s!BA40+s!AW40*s!AY40))+IF(s!AT40*s!BA40+s!AU40*s!AZ40+s!AV40*s!AY40+s!AW40*s!AX40=0,0,N41*s!AU40*s!AZ40/(s!AT40*s!BA40+s!AU40*s!AZ40+s!AV40*s!AY40+s!AW40*s!AX40)) -> 445.77362118288846 | AV41: =AE41+IF(s!AU40*s!AV40+s!AT40*s!AW40=0,0,E41*s!AU40*s!AV40/(s!AU40*s!AV40+s!AT40*s!AW40))+IF(s!AV40*s!AX40+s!AT40*s!AZ40=0,0,M41*s!AV40*s!AX40/(s!AV40*s!AX40+s!AT40*s!AZ40))+IF(s!AV40*s!BA40+s!AW40*s!AZ40=0,0,Q41*s!AV40*s!BA40/(s!AV40*s!BA40+s!AW40*s!AZ40))+IF(s!AT40*s!BA40+s!AU40*s!AZ40+s!AV40*s!AY40+s!AW40*s!AX40=0,0,N41*s!AV40*s!AY40/(s!AT40*s!BA40+s!AU40*s!AZ40+s!AV40*s!AY40+s!AW40*s!AX40)) -> 13.961443443826985 | AW41: =AF41+IF(s!AT40*s!AW40+s!AU40*s!AV40=0,0,E41*s!AT40*s!AW40/(s!AT40*s!AW40+s!AU40*s!AV40))+IF(s!AU40*s!BA40+s!AW40*s!AY40=0,0,O41*s!AW40*s!AY40/(s!AU40*s!BA40+s!AW40*s!AY40))+IF(s!AV40*s!BA40+s!AW40*s!AZ40=0,0,Q41*s!AW40*s!AZ40/(s!AV40*s!BA40+s!AW40*s!AZ40))+IF(s!AT40*s!BA40+s!AU40*s!AZ40+s!AV40*s!AY40+s!AW40*s!AX40=0,0,N41*s!AW40*s!AX40/(s!AT40*s!BA40+s!AU40*s!AZ40+s!AV40*s!AY40+s!AW40*s!AX40)) -> 9.6065388274371379 | AX41: =AG41+IF(s!AT40*s!AY40+s!AU40*s!AX40=0,0,K41*s!AU40*s!AX40/(s!AT40*s!AY40+s!AU40*s!AX40))+IF(s!AV40*s!AX40+s!AT40*s!AZ40=0,0,M41*s!AV40*s!AX40/(s!AV40*s!AX40+s!AT40*s!AZ40))+IF(s!AX40*s!BA40+s!AY40*s!AZ40=0,0,W41*s!AX40*s!BA40/(s!AX40*s!BA40+s!AY40*s!AZ40))+IF(s!AT40*s!BA40+s!AU40*s!AZ40+s!AV40*s!AY40+s!AW40*s!AX40=0,0,N41*s!AW40*s!AX40/(s!AT40*s!BA40+s!AU40*s!AZ40+s!AV40*s!AY40+s!AW40*s!AX40)) -> 13.990716872758501 | AY41: =AH41+IF(s!AT40*s!AY40+s!AU40*s!AX40=0,0,K41*s!AT40*s!AY40/(s!AT40*s!AY40+s!AU40*s!AX40))+IF(s!AU40*s!BA40+s!AW40*s!AY40=0,0,O41*s!AW40*s!AY40/(s!AU40*s!BA40+s!AW40*s!AY40))+IF(s!AX40*s!BA40+s!AY40*s!AZ40=0,0,W41*s!AY40*s!AZ40/(s!AX40*s!BA40+s!AY40*s!AZ40))+IF(s!AT40*s!BA40+s!AU40*s!AZ40+s!AV40*s!AY40+s!AW40*s!AX40=0,0,N41*s!AV40*s!AY40/(s!AT40*s!BA40+s!AU40*s!AZ40+s!AV40*s!AY40+s!AW40*s!AX40)) -> 10.57726539850562 | AZ41: =AI41+IF(s!AT40*s!AZ40+s!AV40*s!AX40=0,0,M41*s!AT40*s!AZ40/(s!AT40*s!AZ40+s!AV40*s!AX40))+IF(s!AV40*s!BA40+s!AW40*s!AZ40=0,0,Q41*s!AW40*s!AZ40/(s!AV40*s!BA40+s!AW40*s!AZ40))+IF(s!AX40*s!BA40+s!AY40*s!AZ40=0,0,W41*s!AY40*s!AZ40/(s!AX40*s!BA40+s!AY40*s!AZ40))+IF(s!AT40*s!BA40+s!AU40*s!AZ40+s!AV40*s!AY40+s!AW40*s!AX40=0,0,N41*s!AU40*s!AZ40/(s!AT40*s!BA40+s!AU40*s!AZ40+s!AV40*s!AY40+s!AW40*s!AX40)) -> 17.389443137567167 | BA41: =AJ41+IF(s!AU40*s!BA40+s!AW40*s!AY40=0,0,O41*s!AU40*s!BA40/(s!AU40*s!BA40+s!AW40*s!AY40))+IF(s!AV40*s!BA40+s!AW40*s!AZ40=0,0,Q41*s!AV40*s!BA40/(s!AV40*s!BA40+s!AW40*s!AZ40))+IF(s!AX40*s!BA40+s!AY40*s!AZ40=0,0,W41*s!AX40*s!BA40/(s!AX40*s!BA40+s!AY40*s!AZ40))+IF(s!AT40*s!BA40+s!AU40*s!AZ40+s!AV40*s!AY40+s!AW40*s!AX40=0,0,N41*s!AT40*s!BA40/(s!AT40*s!BA40+s!AU40*s!AZ40+s!AV40*s!AY40+s!AW40*s!AX40)) -> 22.042574591168709 | BJ41: =SUM(AT41:BA41) -> 778
A42: =A41 -> 100 | B42: =B41 -> 30 | C42: =C41 -> 200 | D42: =D41 -> 2 | E42: =E41 -> 4 | F42: =F41 -> 1 | G42: =G41 -> 1 | H42: =H41 -> 2 | I42: =I41 -> 1 | J42: =J41 -> 2 | K42: =K41 -> 4 | L42: =L41 -> 2 | M42: =M41 -> 4 | N42: =N41 -> 8 | O42: =O41 -> 4 | P42: =P41 -> 2 | Q42: =Q41 -> 4 | R42: =R41 -> 2 | S42: =S41 -> 1 | T42: =T41 -> 2 | U42: =U41 -> 1 | V42: =V41 -> 2 | W42: =W41 -> 4 | X42: =X41 -> 2 | Y42: =Y41 -> 1 | Z42: =Z41 -> 2 | AA42: =AA41 -> 1 | AB42: =AB41 -> 389 | AC42: =AC41 -> 234 | AD42: =AD41 -> 433 | AE42: =AE41 -> 8 | AF42: =AF41 -> 7 | AG42: =AG41 -> 8 | AH42: =AH41 -> 8 | AI42: =AI41 -> 8 | AJ42: =AJ41 -> 8 | AS42: =AS41 -> 714 | AT42: =AC42+IF(s!AT41*s!AW41+s!AU41*s!AV41=0,0,E42*s!AT41*s!AW41/(s!AT41*s!AW41+s!AU41*s!AV41))+IF(s!AT41*s!AY41+s!AU41*s!AX41=0,0,K42*s!AT41*s!AY41/(s!AT41*s!AY41+s!AU41*s!AX41))+IF(s!AT41*s!AZ41+s!AV41*s!AX41=0,0,M42*s!AT41*s!AZ41/(s!AT41*s!AZ41+s!AV41*s!AX41))+IF(s!AT41*s!BA41+s!AU41*s!AZ41+s!AV41*s!AY41+s!AW41*s!AX41=0,0,N42*s!AT41*s!BA41/(s!AT41*s!BA41+s!AU41*s!AZ41+s!AV41*s!AY41+s!AW41*s!AX41)) -> 244.65839665703254 | AU42: =AD42+IF(s!AU41*s!AV41+s!AT41*s!AW41=0,0,E42*s!AU41*s!AV41/(s!AU41*s!AV41+s!AT41*s!AW41))+IF(s!AT41*s!AY41+s!AU41*s!AX41=0,0,K42*s!AU41*s!AX41/(s!AT41*s!AY41+s!AU41*s!AX41))+IF(s!AU41*s!BA41+s!AW41*s!AY41=0,0,O42*s!AU41*s!BA41/(s!AU41*s!BA41+s!AW41*s!AY41))+IF(s!AT41*s!BA41+s!AU41*s!AZ41+s!AV41*s!AY41+s!AW41*s!AX41=0,0,N42*s!AU41*s!AZ41/(s!AT41*s!BA41+s!AU41*s!AZ41+s!AV41*s!AY41+s!AW41*s!AX41)) -> 445.77362100280743 | AV42: =AE42+IF(s!AU41*s!AV41+s!AT41*s!AW41=0,0,E42*s!AU41*s!AV41/(s!AU41*s!AV41+s!AT41*s!AW41))+IF(s!AV41*s!AX41+s!AT41*s!AZ41=0,0,M42*s!AV41*s!AX41/(s!AV41*s!AX41+s!AT41*s!AZ41))+IF(s!AV41*s!BA41+s!AW41*s!AZ41=0,0,Q42*s!AV41*s!BA41/(s!AV41*s!BA41+s!AW41*s!AZ41))+IF(s!AT41*s!BA41+s!AU41*s!AZ41+s!AV41*s!AY41+s!AW41*s!AX41=0,0,N42*s!AV41*s!AY41/(s!AT41*s!BA41+s!AU41*s!AZ41+s!AV41*s!AY41+s!AW41*s!AX41)) -> 13.961444464735784 | AW42: =AF42+IF(s!AT41*s!AW41+s!AU41*s!AV41=0,0,E42*s!AT41*s!AW41/(s!AT41*s!AW41+s!AU41*s!AV41))+IF(s!AU41*s!BA41+s!AW41*s!AY41=0,0,O42*s!AW41*s!AY41/(s!AU41*s!BA41+s!AW41*s!AY41))+IF(s!AV41*s!BA41+s!AW41*s!AZ41=0,0,Q42*s!AW41*s!AZ41/(s!AV41*s!BA41+s!AW41*s!AZ41))+IF(s!AT41*s!BA41+s!AU41*s!AZ41+s!AV41*s!AY41+s!AW41*s!AX41=0,0,N42*s!AW41*s!AX41/(s!AT41*s!BA41+s!AU41*s!AZ41+s!AV41*s!AY41+s!AW41*s!AX41)) -> 9.6065378754242303 | AX42: =AG42+IF(s!AT41*s!AY41+s!AU41*s!AX41=0,0,K42*s!AU41*s!AX41/(s!AT41*s!AY41+s!AU41*s!AX41))+IF(s!AV41*s!AX41+s!AT41*s!AZ41=0,0,M42*s!AV41*s!AX41/(s!AV41*s!AX41+s!AT41*s!AZ41))+IF(s!AX41*s!BA41+s!AY41*s!AZ41=0,0,W42*s!AX41*s!BA41/(s!AX41*s!BA41+s!AY41*s!AZ41))+IF(s!AT41*s!BA41+s!AU41*s!AZ41+s!AV41*s!AY41+s!AW41*s!AX41=0,0,N42*s!AW41*s!AX41/(s!AT41*s!BA41+s!AU41*s!AZ41+s!AV41*s!AY41+s!AW41*s!AX41)) -> 13.990717797645287 | AY42: =AH42+IF(s!AT41*s!AY41+s!AU41*s!AX41=0,0,K42*s!AT41*s!AY41/(s!AT41*s!AY41+s!AU41*s!AX41))+IF(s!AU41*s!BA41+s!AW41*s!AY41=0,0,O42*s!AW41*s!AY41/(s!AU41*s!BA41+s!AW41*s!AY41))+IF(s!AX41*s!BA41+s!AY41*s!AZ41=0,0,W42*s!AY41*s!AZ41/(s!AX41*s!BA41+s!AY41*s!AZ41))+IF(s!AT41*s!BA41+s!AU41*s!AZ41+s!AV41*s!AY41+s!AW41*s!AX41=0,0,N42*s!AV41*s!AY41/(s!AT41*s!BA41+s!AU41*s!AZ41+s!AV41*s!AY41+s!AW41*s!AX41)) -> 10.577264542514728 | AZ42: =AI42+IF(s!AT41*s!AZ41+s!AV41*s!AX41=0,0,M42*s!AT41*s!AZ41/(s!AT41*s!AZ41+s!AV41*s!AX41))+IF(s!AV41*s!BA41+s!AW41*s!AZ41=0,0,Q42*s!AW41*s!AZ41/(s!AV41*s!BA41+s!AW41*s!AZ41))+IF(s!AX41*s!BA41+s!AY41*s!AZ41=0,0,W42*s!AY41*s!AZ41/(s!AX41*s!BA41+s!AY41*s!AZ41))+IF(s!AT41*s!BA41+s!AU41*s!AZ41+s!AV41*s!AY41+s!AW41*s!AX41=0,0,N42*s!AU41*s!AZ41/(s!AT41*s!BA41+s!AU41*s!AZ41+s!AV41*s!AY41+s!AW41*s!AX41)) -> 17.389441080586394 | BA42: =AJ42+IF(s!AU41*s!BA41+s!AW41*s!AY41=0,0,O42*s!AU41*s!BA41/(s!AU41*s!BA41+s!AW41*s!AY41))+IF(s!AV41*s!BA41+s!AW41*s!AZ41=0,0,Q42*s!AV41*s!BA41/(s!AV41*s!BA41+s!AW41*s!AZ41))+IF(s!AX41*s!BA41+s!AY41*s!AZ41=0,0,W42*s!AX41*s!BA41/(s!AX41*s!BA41+s!AY41*s!AZ41))+IF(s!AT41*s!BA41+s!AU41*s!AZ41+s!AV41*s!AY41+s!AW41*s!AX41=0,0,N42*s!AT41*s!BA41/(s!AT41*s!BA41+s!AU41*s!AZ41+s!AV41*s!AY41+s!AW41*s!AX41)) -> 22.042576579253591 | BJ42: =SUM(AT42:BA42) -> 778
A43: =A42 -> 100 | B43: =B42 -> 30 | C43: =C42 -> 200 | D43: =D42 -> 2 | E43: =E42 -> 4 | F43: =F42 -> 1 | G43: =G42 -> 1 | H43: =H42 -> 2 | I43: =I42 -> 1 | J43: =J42 -> 2 | K43: =K42 -> 4 | L43: =L42 -> 2 | M43: =M42 -> 4 | N43: =N42 -> 8 | O43: =O42 -> 4 | P43: =P42 -> 2 | Q43: =Q42 -> 4 | R43: =R42 -> 2 | S43: =S42 -> 1 | T43: =T42 -> 2 | U43: =U42 -> 1 | V43: =V42 -> 2 | W43: =W42 -> 4 | X43: =X42 -> 2 | Y43: =Y42 -> 1 | Z43: =Z42 -> 2 | AA43: =AA42 -> 1 | AB43: =AB42 -> 389 | AC43: =AC42 -> 234 | AD43: =AD42 -> 433 | AE43: =AE42 -> 8 | AF43: =AF42 -> 7 | AG43: =AG42 -> 8 | AH43: =AH42 -> 8 | AI43: =AI42 -> 8 | AJ43: =AJ42 -> 8 | AS43: =AS42 -> 714 | AT43: =AC43+IF(s!AT42*s!AW42+s!AU42*s!AV42=0,0,E43*s!AT42*s!AW42/(s!AT42*s!AW42+s!AU42*s!AV42))+IF(s!AT42*s!AY42+s!AU42*s!AX42=0,0,K43*s!AT42*s!AY42/(s!AT42*s!AY42+s!AU42*s!AX42))+IF(s!AT42*s!AZ42+s!AV42*s!AX42=0,0,M43*s!AT42*s!AZ42/(s!AT42*s!AZ42+s!AV42*s!AX42))+IF(s!AT42*s!BA42+s!AU42*s!AZ42+s!AV42*s!AY42+s!AW42*s!AX42=0,0,N43*s!AT42*s!BA42/(s!AT42*s!BA42+s!AU42*s!AZ42+s!AV42*s!AY42+s!AW42*s!AX42)) -> 244.65839673656248 | AU43: =AD43+IF(s!AU42*s!AV42+s!AT42*s!AW42=0,0,E43*s!AU42*s!AV42/(s!AU42*s!AV42+s!AT42*s!AW42))+IF(s!AT42*s!AY42+s!AU42*s!AX42=0,0,K43*s!AU42*s!AX42/(s!AT42*s!AY42+s!AU42*s!AX42))+IF(s!AU42*s!BA42+s!AW42*s!AY42=0,0,O43*s!AU42*s!BA42/(s!AU42*s!BA42+s!AW42*s!AY42))+IF(s!AT42*s!BA42+s!AU42*s!AZ42+s!AV42*s!AY42+s!AW42*s!AX42=0,0,N43*s!AU42*s!AZ42/(s!AT42*s!BA42+s!AU42*s!AZ42+s!AV42*s!AY42+s!AW42*s!AX42)) -> 445.77362087399968 | AV43: =AE43+IF(s!AU42*s!AV42+s!AT42*s!AW42=0,0,E43*s!AU42*s!AV42/(s!AU42*s!AV42+s!AT42*s!AW42))+IF(s!AV42*s!AX42+s!AT42*s!AZ42=0,0,M43*s!AV42*s!AX42/(s!AV42*s!AX42+s!AT42*s!AZ42))+IF(s!AV42*s!BA42+s!AW42*s!AZ42=0,0,Q43*s!AV42*s!BA42/(s!AV42*s!BA42+s!AW42*s!AZ42))+IF(s!AT42*s!BA42+s!AU42*s!AZ42+s!AV42*s!AY42+s!AW42*s!AX42=0,0,N43*s!AV42*s!AY42/(s!AT42*s!BA42+s!AU42*s!AZ42+s!AV42*s!AY42+s!AW42*s!AX42)) -> 13.96144519461431 | AW43: =AF43+IF(s!AT42*s!AW42+s!AU42*s!AV42=0,0,E43*s!AT42*s!AW42/(s!AT42*s!AW42+s!AU42*s!AV42))+IF(s!AU42*s!BA42+s!AW42*s!AY42=0,0,O43*s!AW42*s!AY42/(s!AU42*s!BA42+s!AW42*s!AY42))+IF(s!AV42*s!BA42+s!AW42*s!AZ42=0,0,Q43*s!AW42*s!AZ42/(s!AV42*s!BA42+s!AW42*s!AZ42))+IF(s!AT42*s!BA42+s!AU42*s!AZ42+s!AV42*s!AY42+s!AW42*s!AX42=0,0,N43*s!AW42*s!AX42/(s!AT42*s!BA42+s!AU42*s!AZ42+s!AV42*s!AY42+s!AW42*s!AX42)) -> 9.6065371948235452 | AX43: =AG43+IF(s!AT42*s!AY42+s!AU42*s!AX42=0,0,K43*s!AU42*s!AX42/(s!AT42*s!AY42+s!AU42*s!AX42))+IF(s!AV42*s!AX42+s!AT42*s!AZ42=0,0,M43*s!AV42*s!AX42/(s!AV42*s!AX42+s!AT42*s!AZ42))+IF(s!AX42*s!BA42+s!AY42*s!AZ42=0,0,W43*s!AX42*s!BA42/(s!AX42*s!BA42+s!AY42*s!AZ42))+IF(s!AT42*s!BA42+s!AU42*s!AZ42+s!AV42*s!AY42+s!AW42*s!AX42=0,0,N43*s!AW42*s!AX42/(s!AT42*s!BA42+s!AU42*s!AZ42+s!AV42*s!AY42+s!AW42*s!AX42)) -> 13.990718458921917 | AY43: =AH43+IF(s!AT42*s!AY42+s!AU42*s!AX42=0,0,K43*s!AT42*s!AY42/(s!AT42*s!AY42+s!AU42*s!AX42))+IF(s!AU42*s!BA42+s!AW42*s!AY42=0,0,O43*s!AW42*s!AY42/(s!AU42*s!BA42+s!AW42*s!AY42))+IF(s!AX42*s!BA42+s!AY42*s!AZ42=0,0,W43*s!AY42*s!AZ42/(s!AX42*s!BA42+s!AY42*s!AZ42))+IF(s!AT42*s!BA42+s!AU42*s!AZ42+s!AV42*s!AY42+s!AW42*s!AX42=0,0,N43*s!AV42*s!AY42/(s!AT42*s!BA42+s!AU42*s!AZ42+s!AV42*s!AY42+s!AW42*s!AX42)) -> 10.577263930515938 | AZ43: =AI43+IF(s!AT42*s!AZ42+s!AV42*s!AX42=0,0,M43*s!AT42*s!AZ42/(s!AT42*s!AZ42+s!AV42*s!AX42))+IF(s!AV42*s!BA42+s!AW42*s!AZ42=0,0,Q43*s!AW42*s!AZ42/(s!AV42*s!BA42+s!AW42*s!AZ42))+IF(s!AX42*s!BA42+s!AY42*s!AZ42=0,0,W43*s!AY42*s!AZ42/(s!AX42*s!BA42+s!AY42*s!AZ42))+IF(s!AT42*s!BA42+s!AU42*s!AZ42+s!AV42*s!AY42+s!AW42*s!AX42=0,0,N43*s!AU42*s!AZ42/(s!AT42*s!BA42+s!AU42*s!AZ42+s!AV42*s!AY42+s!AW42*s!AX42)) -> 17.389439609901309 | BA43: =AJ43+IF(s!AU42*s!BA42+s!AW42*s!AY42=0,0,O43*s!AU42*s!BA42/(s!AU42*s!BA42+s!AW42*s!AY42))+IF(s!AV42*s!BA42+s!AW42*s!AZ42=0,0,Q43*s!AV42*s!BA42/(s!AV42*s!BA42+s!AW42*s!AZ42))+IF(s!AX42*s!BA42+s!AY42*s!AZ42=0,0,W43*s!AX42*s!BA42/(s!AX42*s!BA42+s!AY42*s!AZ42))+IF(s!AT42*s!BA42+s!AU42*s!AZ42+s!AV42*s!AY42+s!AW42*s!AX42=0,0,N43*s!AT42*s!BA42/(s!AT42*s!BA42+s!AU42*s!AZ42+s!AV42*s!AY42+s!AW42*s!AX42)) -> 22.042578000660836 | BJ43: =SUM(AT43:BA43) -> 778
A44: =A43 -> 100 | B44: =B43 -> 30 | C44: =C43 -> 200 | D44: =D43 -> 2 | E44: =E43 -> 4 | F44: =F43 -> 1 | G44: =G43 -> 1 | H44: =H43 -> 2 | I44: =I43 -> 1 | J44: =J43 -> 2 | K44: =K43 -> 4 | L44: =L43 -> 2 | M44: =M43 -> 4 | N44: =N43 -> 8 | O44: =O43 -> 4 | P44: =P43 -> 2 | Q44: =Q43 -> 4 | R44: =R43 -> 2 | S44: =S43 -> 1 | T44: =T43 -> 2 | U44: =U43 -> 1 | V44: =V43 -> 2 | W44: =W43 -> 4 | X44: =X43 -> 2 | Y44: =Y43 -> 1 | Z44: =Z43 -> 2 | AA44: =AA43 -> 1 | AB44: =AB43 -> 389 | AC44: =AC43 -> 234 | AD44: =AD43 -> 433 | AE44: =AE43 -> 8 | AF44: =AF43 -> 7 | AG44: =AG43 -> 8 | AH44: =AH43 -> 8 | AI44: =AI43 -> 8 | AJ44: =AJ43 -> 8 | AS44: =AS43 -> 714 | AT44: =AC44+IF(s!AT43*s!AW43+s!AU43*s!AV43=0,0,E44*s!AT43*s!AW43/(s!AT43*s!AW43+s!AU43*s!AV43))+IF(s!AT43*s!AY43+s!AU43*s!AX43=0,0,K44*s!AT43*s!AY43/(s!AT43*s!AY43+s!AU43*s!AX43))+IF(s!AT43*s!AZ43+s!AV43*s!AX43=0,0,M44*s!AT43*s!AZ43/(s!AT43*s!AZ43+s!AV43*s!AX43))+IF(s!AT43*s!BA43+s!AU43*s!AZ43+s!AV43*s!AY43+s!AW43*s!AX43=0,0,N44*s!AT43*s!BA43/(s!AT43*s!BA43+s!AU43*s!AZ43+s!AV43*s!AY43+s!AW43*s!AX43)) -> 244.65839679344771 | AU44: =AD44+IF(s!AU43*s!AV43+s!AT43*s!AW43=0,0,E44*s!AU43*s!AV43/(s!AU43*s!AV43+s!AT43*s!AW43))+IF(s!AT43*s!AY43+s!AU43*s!AX43=0,0,K44*s!AU43*s!AX43/(s!AT43*s!AY43+s!AU43*s!AX43))+IF(s!AU43*s!BA43+s!AW43*s!AY43=0,0,O44*s!AU43*s!BA43/(s!AU43*s!BA43+s!AW43*s!AY43))+IF(s!AT43*s!BA43+s!AU43*s!AZ43+s!AV43*s!AY43+s!AW43*s!AX43=0,0,N44*s!AU43*s!AZ43/(s!AT43*s!BA43+s!AU43*s!AZ43+s!AV43*s!AY43+s!AW43*s!AX43)) -> 445.77362078186655 | AV44: =AE44+IF(s!AU43*s!AV43+s!AT43*s!AW43=0,0,E44*s!AU43*s!AV43/(s!AU43*s!AV43+s!AT43*s!AW43))+IF(s!AV43*s!AX43+s!AT43*s!AZ43=0,0,M44*s!AV43*s!AX43/(s!AV43*s!AX43+s!AT43*s!AZ43))+IF(s!AV43*s!BA43+s!AW43*s!AZ43=0,0,Q44*s!AV43*s!BA43/(s!AV43*s!BA43+s!AW43*s!AZ43))+IF(s!AT43*s!BA43+s!AU43*s!AZ43+s!AV43*s!AY43+s!AW43*s!AX43=0,0,N44*s!AV43*s!AY43/(s!AT43*s!BA43+s!AU43*s!AZ43+s!AV43*s!AY43+s!AW43*s!AX43)) -> 13.961445716473532 | AW44: =AF44+IF(s!AT43*s!AW43+s!AU43*s!AV43=0,0,E44*s!AT43*s!AW43/(s!AT43*s!AW43+s!AU43*s!AV43))+IF(s!AU43*s!BA43+s!AW43*s!AY43=0,0,O44*s!AW43*s!AY43/(s!AU43*s!BA43+s!AW43*s!AY43))+IF(s!AV43*s!BA43+s!AW43*s!AZ43=0,0,Q44*s!AW43*s!AZ43/(s!AV43*s!BA43+s!AW43*s!AZ43))+IF(s!AT43*s!BA43+s!AU43*s!AZ43+s!AV43*s!AY43+s!AW43*s!AX43=0,0,N44*s!AW43*s!AX43/(s!AT43*s!BA43+s!AU43*s!AZ43+s!AV43*s!AY43+s!AW43*s!AX43)) -> 9.6065367082121984 | AX44: =AG44+IF(s!AT43*s!AY43+s!AU43*s!AX43=0,0,K44*s!AU43*s!AX43/(s!AT43*s!AY43+s!AU43*s!AX43))+IF(s!AV43*s!AX43+s!AT43*s!AZ43=0,0,M44*s!AV43*s!AX43/(s!AV43*s!AX43+s!AT43*s!AZ43))+IF(s!AX43*s!BA43+s!AY43*s!AZ43=0,0,W44*s!AX43*s!BA43/(s!AX43*s!BA43+s!AY43*s!AZ43))+IF(s!AT43*s!BA43+s!AU43*s!AZ43+s!AV43*s!AY43+s!AW43*s!AX43=0,0,N44*s!AW43*s!AX43/(s!AT43*s!BA43+s!AU43*s!AZ43+s!AV43*s!AY43+s!AW43*s!AX43)) -> 13.990718931760208 | AY44: =AH44+IF(s!AT43*s!AY43+s!AU43*s!AX43=0,0,K44*s!AT43*s!AY43/(s!AT43*s!AY43+s!AU43*s!AX43))+IF(s!AU43*s!BA43+s!AW43*s!AY43=0,0,O44*s!AW43*s!AY43/(s!AU43*s!BA43+s!AW43*s!AY43))+IF(s!AX43*s!BA43+s!AY43*s!AZ43=0,0,W44*s!AY43*s!AZ43/(s!AX43*s!BA43+s!AY43*s!AZ43))+IF(s!AT43*s!BA43+s!AU43*s!AZ43+s!AV43*s!AY43+s!AW43*s!AX43=0,0,N44*s!AV43*s!AY43/(s!AT43*s!BA43+s!AU43*s!AZ43+s!AV43*s!AY43+s!AW43*s!AX43)) -> 10.577263492925523 | AZ44: =AI44+IF(s!AT43*s!AZ43+s!AV43*s!AX43=0,0,M44*s!AT43*s!AZ43/(s!AT43*s!AZ43+s!AV43*s!AX43))+IF(s!AV43*s!BA43+s!AW43*s!AZ43=0,0,Q44*s!AW43*s!AZ43/(s!AV43*s!BA43+s!AW43*s!AZ43))+IF(s!AX43*s!BA43+s!AY43*s!AZ43=0,0,W44*s!AY43*s!AZ43/(s!AX43*s!BA43+s!AY43*s!AZ43))+IF(s!AT43*s!BA43+s!AU43*s!AZ43+s!AV43*s!AY43+s!AW43*s!AX43=0,0,N44*s!AU43*s!AZ43/(s!AT43*s!BA43+s!AU43*s!AZ43+s!AV43*s!AY43+s!AW43*s!AX43)) -> 17.389438558318549 | BA44: =AJ44+IF(s!AU43*s!BA43+s!AW43*s!AY43=0,0,O44*s!AU43*s!BA43/(s!AU43*s!BA43+s!AW43*s!AY43))+IF(s!AV43*s!BA43+s!AW43*s!AZ43=0,0,Q44*s!AV43*s!BA43/(s!AV43*s!BA43+s!AW43*s!AZ43))+IF(s!AX43*s!BA43+s!AY43*s!AZ43=0,0,W44*s!AX43*s!BA43/(s!AX43*s!BA43+s!AY43*s!AZ43))+IF(s!AT43*s!BA43+s!AU43*s!AZ43+s!AV43*s!AY43+s!AW43*s!AX43=0,0,N44*s!AT43*s!BA43/(s!AT43*s!BA43+s!AU43*s!AZ43+s!AV43*s!AY43+s!AW43*s!AX43)) -> 22.042579016995717 | BJ44: =SUM(AT44:BA44) -> 778
A45: =A44 -> 100 | B45: =B44 -> 30 | C45: =C44 -> 200 | D45: =D44 -> 2 | E45: =E44 -> 4 | F45: =F44 -> 1 | G45: =G44 -> 1 | H45: =H44 -> 2 | I45: =I44 -> 1 | J45: =J44 -> 2 | K45: =K44 -> 4 | L45: =L44 -> 2 | M45: =M44 -> 4 | N45: =N44 -> 8 | O45: =O44 -> 4 | P45: =P44 -> 2 | Q45: =Q44 -> 4 | R45: =R44 -> 2 | S45: =S44 -> 1 | T45: =T44 -> 2 | U45: =U44 -> 1 | V45: =V44 -> 2 | W45: =W44 -> 4 | X45: =X44 -> 2 | Y45: =Y44 -> 1 | Z45: =Z44 -> 2 | AA45: =AA44 -> 1 | AB45: =AB44 -> 389 | AC45: =AC44 -> 234 | AD45: =AD44 -> 433 | AE45: =AE44 -> 8 | AF45: =AF44 -> 7 | AG45: =AG44 -> 8 | AH45: =AH44 -> 8 | AI45: =AI44 -> 8 | AJ45: =AJ44 -> 8 | AS45: =AS44 -> 714 | AT45: =AC45+IF(s!AT44*s!AW44+s!AU44*s!AV44=0,0,E45*s!AT44*s!AW44/(s!AT44*s!AW44+s!AU44*s!AV44))+IF(s!AT44*s!AY44+s!AU44*s!AX44=0,0,K45*s!AT44*s!AY44/(s!AT44*s!AY44+s!AU44*s!AX44))+IF(s!AT44*s!AZ44+s!AV44*s!AX44=0,0,M45*s!AT44*s!AZ44/(s!AT44*s!AZ44+s!AV44*s!AX44))+IF(s!AT44*s!BA44+s!AU44*s!AZ44+s!AV44*s!AY44+s!AW44*s!AX44=0,0,N45*s!AT44*s!BA44/(s!AT44*s!BA44+s!AU44*s!AZ44+s!AV44*s!AY44+s!AW44*s!AX44)) -> 244.6583968341352 | AU45: =AD45+IF(s!AU44*s!AV44+s!AT44*s!AW44=0,0,E45*s!AU44*s!AV44/(s!AU44*s!AV44+s!AT44*s!AW44))+IF(s!AT44*s!AY44+s!AU44*s!AX44=0,0,K45*s!AU44*s!AX44/(s!AT44*s!AY44+s!AU44*s!AX44))+IF(s!AU44*s!BA44+s!AW44*s!AY44=0,0,O45*s!AU44*s!BA44/(s!AU44*s!BA44+s!AW44*s!AY44))+IF(s!AT44*s!BA44+s!AU44*s!AZ44+s!AV44*s!AY44+s!AW44*s!AX44=0,0,N45*s!AU44*s!AZ44/(s!AT44*s!BA44+s!AU44*s!AZ44+s!AV44*s!AY44+s!AW44*s!AX44)) -> 445.77362071596559 | AV45: =AE45+IF(s!AU44*s!AV44+s!AT44*s!AW44=0,0,E45*s!AU44*s!AV44/(s!AU44*s!AV44+s!AT44*s!AW44))+IF(s!AV44*s!AX44+s!AT44*s!AZ44=0,0,M45*s!AV44*s!AX44/(s!AV44*s!AX44+s!AT44*s!AZ44))+IF(s!AV44*s!BA44+s!AW44*s!AZ44=0,0,Q45*s!AV44*s!BA44/(s!AV44*s!BA44+s!AW44*s!AZ44))+IF(s!AT44*s!BA44+s!AU44*s!AZ44+s!AV44*s!AY44+s!AW44*s!AX44=0,0,N45*s!AV44*s!AY44/(s!AT44*s!BA44+s!AU44*s!AZ44+s!AV44*s!AY44+s!AW44*s!AX44)) -> 13.961446089629378 | AW45: =AF45+IF(s!AT44*s!AW44+s!AU44*s!AV44=0,0,E45*s!AT44*s!AW44/(s!AT44*s!AW44+s!AU44*s!AV44))+IF(s!AU44*s!BA44+s!AW44*s!AY44=0,0,O45*s!AW44*s!AY44/(s!AU44*s!BA44+s!AW44*s!AY44))+IF(s!AV44*s!BA44+s!AW44*s!AZ44=0,0,Q45*s!AW44*s!AZ44/(s!AV44*s!BA44+s!AW44*s!AZ44))+IF(s!AT44*s!BA44+s!AU44*s!AZ44+s!AV44*s!AY44+s!AW44*s!AX44=0,0,N45*s!AW44*s!AX44/(s!AT44*s!BA44+s!AU44*s!AZ44+s!AV44*s!AY44+s!AW44*s!AX44)) -> 9.6065363602698266 | AX45: =AG45+IF(s!AT44*s!AY44+s!AU44*s!AX44=0,0,K45*s!AU44*s!AX44/(s!AT44*s!AY44+s!AU44*s!AX44))+IF(s!AV44*s!AX44+s!AT44*s!AZ44=0,0,M45*s!AV44*s!AX44/(s!AV44*s!AX44+s!AT44*s!AZ44))+IF(s!AX44*s!BA44+s!AY44*s!AZ44=0,0,W45*s!AX44*s!BA44/(s!AX44*s!BA44+s!AY44*s!AZ44))+IF(s!AT44*s!BA44+s!AU44*s!AZ44+s!AV44*s!AY44+s!AW44*s!AX44=0,0,N45*s!AW44*s!AX44/(s!AT44*s!BA44+s!AU44*s!AZ44+s!AV44*s!AY44+s!AW44*s!AX44)) -> 13.990719269881497 | AY45: =AH45+IF(s!AT44*s!AY44+s!AU44*s!AX44=0,0,K45*s!AT44*s!AY44/(s!AT44*s!AY44+s!AU44*s!AX44))+IF(s!AU44*s!BA44+s!AW44*s!AY44=0,0,O45*s!AW44*s!AY44/(s!AU44*s!BA44+s!AW44*s!AY44))+IF(s!AX44*s!BA44+s!AY44*s!AZ44=0,0,W45*s!AY44*s!AZ44/(s!AX44*s!BA44+s!AY44*s!AZ44))+IF(s!AT44*s!BA44+s!AU44*s!AZ44+s!AV44*s!AY44+s!AW44*s!AX44=0,0,N45*s!AV44*s!AY44/(s!AT44*s!BA44+s!AU44*s!AZ44+s!AV44*s!AY44+s!AW44*s!AX44)) -> 10.577263180017708 | AZ45: =AI45+IF(s!AT44*s!AZ44+s!AV44*s!AX44=0,0,M45*s!AT44*s!AZ44/(s!AT44*s!AZ44+s!AV44*s!AX44))+IF(s!AV44*s!BA44+s!AW44*s!AZ44=0,0,Q45*s!AW44*s!AZ44/(s!AV44*s!BA44+s!AW44*s!AZ44))+IF(s!AX44*s!BA44+s!AY44*s!AZ44=0,0,W45*s!AY44*s!AZ44/(s!AX44*s!BA44+s!AY44*s!AZ44))+IF(s!AT44*s!BA44+s!AU44*s!AZ44+s!AV44*s!AY44+s!AW44*s!AX44=0,0,N45*s!AU44*s!AZ44/(s!AT44*s!BA44+s!AU44*s!AZ44+s!AV44*s!AY44+s!AW44*s!AX44)) -> 17.389437806353936 | BA45: =AJ45+IF(s!AU44*s!BA44+s!AW44*s!AY44=0,0,O45*s!AU44*s!BA44/(s!AU44*s!BA44+s!AW44*s!AY44))+IF(s!AV44*s!BA44+s!AW44*s!AZ44=0,0,Q45*s!AV44*s!BA44/(s!AV44*s!BA44+s!AW44*s!AZ44))+IF(s!AX44*s!BA44+s!AY44*s!AZ44=0,0,W45*s!AX44*s!BA44/(s!AX44*s!BA44+s!AY44*s!AZ44))+IF(s!AT44*s!BA44+s!AU44*s!AZ44+s!AV44*s!AY44+s!AW44*s!AX44=0,0,N45*s!AT44*s!BA44/(s!AT44*s!BA44+s!AU44*s!AZ44+s!AV44*s!AY44+s!AW44*s!AX44)) -> 22.04257974374686 | BJ45: =SUM(AT45:BA45) -> 778
A46: =A45 -> 100 | B46: =B45 -> 30 | C46: =C45 -> 200 | D46: =D45 -> 2 | E46: =E45 -> 4 | F46: =F45 -> 1 | G46: =G45 -> 1 | H46: =H45 -> 2 | I46: =I45 -> 1 | J46: =J45 -> 2 | K46: =K45 -> 4 | L46: =L45 -> 2 | M46: =M45 -> 4 | N46: =N45 -> 8 | O46: =O45 -> 4 | P46: =P45 -> 2 | Q46: =Q45 -> 4 | R46: =R45 -> 2 | S46: =S45 -> 1 | T46: =T45 -> 2 | U46: =U45 -> 1 | V46: =V45 -> 2 | W46: =W45 -> 4 | X46: =X45 -> 2 | Y46: =Y45 -> 1 | Z46: =Z45 -> 2 | AA46: =AA45 -> 1 | AB46: =AB45 -> 389 | AC46: =AC45 -> 234 | AD46: =AD45 -> 433 | AE46: =AE45 -> 8 | AF46: =AF45 -> 7 | AG46: =AG45 -> 8 | AH46: =AH45 -> 8 | AI46: =AI45 -> 8 | AJ46: =AJ45 -> 8 | AS46: =AS45 -> 714 | AT46: =AC46+IF(s!AT45*s!AW45+s!AU45*s!AV45=0,0,E46*s!AT45*s!AW45/(s!AT45*s!AW45+s!AU45*s!AV45))+IF(s!AT45*s!AY45+s!AU45*s!AX45=0,0,K46*s!AT45*s!AY45/(s!AT45*s!AY45+s!AU45*s!AX45))+IF(s!AT45*s!AZ45+s!AV45*s!AX45=0,0,M46*s!AT45*s!AZ45/(s!AT45*s!AZ45+s!AV45*s!AX45))+IF(s!AT45*s!BA45+s!AU45*s!AZ45+s!AV45*s!AY45+s!AW45*s!AX45=0,0,N46*s!AT45*s!BA45/(s!AT45*s!BA45+s!AU45*s!AZ45+s!AV45*s!AY45+s!AW45*s!AX45)) -> 244.6583968632369 | AU46: =AD46+IF(s!AU45*s!AV45+s!AT45*s!AW45=0,0,E46*s!AU45*s!AV45/(s!AU45*s!AV45+s!AT45*s!AW45))+IF(s!AT45*s!AY45+s!AU45*s!AX45=0,0,K46*s!AU45*s!AX45/(s!AT45*s!AY45+s!AU45*s!AX45))+IF(s!AU45*s!BA45+s!AW45*s!AY45=0,0,O46*s!AU45*s!BA45/(s!AU45*s!BA45+s!AW45*s!AY45))+IF(s!AT45*s!BA45+s!AU45*s!AZ45+s!AV45*s!AY45+s!AW45*s!AX45=0,0,N46*s!AU45*s!AZ45/(s!AT45*s!BA45+s!AU45*s!AZ45+s!AV45*s!AY45+s!AW45*s!AX45)) -> 445.77362066882756 | AV46: =AE46+IF(s!AU45*s!AV45+s!AT45*s!AW45=0,0,E46*s!AU45*s!AV45/(s!AU45*s!AV45+s!AT45*s!AW45))+IF(s!AV45*s!AX45+s!AT45*s!AZ45=0,0,M46*s!AV45*s!AX45/(s!AV45*s!AX45+s!AT45*s!AZ45))+IF(s!AV45*s!BA45+s!AW45*s!AZ45=0,0,Q46*s!AV45*s!BA45/(s!AV45*s!BA45+s!AW45*s!AZ45))+IF(s!AT45*s!BA45+s!AU45*s!AZ45+s!AV45*s!AY45+s!AW45*s!AX45=0,0,N46*s!AV45*s!AY45/(s!AT45*s!BA45+s!AU45*s!AZ45+s!AV45*s!AY45+s!AW45*s!AX45)) -> 13.961446356473033 | AW46: =AF46+IF(s!AT45*s!AW45+s!AU45*s!AV45=0,0,E46*s!AT45*s!AW45/(s!AT45*s!AW45+s!AU45*s!AV45))+IF(s!AU45*s!BA45+s!AW45*s!AY45=0,0,O46*s!AW45*s!AY45/(s!AU45*s!BA45+s!AW45*s!AY45))+IF(s!AV45*s!BA45+s!AW45*s!AZ45=0,0,Q46*s!AW45*s!AZ45/(s!AV45*s!BA45+s!AW45*s!AZ45))+IF(s!AT45*s!BA45+s!AU45*s!AZ45+s!AV45*s!AY45+s!AW45*s!AX45=0,0,N46*s!AW45*s!AX45/(s!AT45*s!BA45+s!AU45*s!AZ45+s!AV45*s!AY45+s!AW45*s!AX45)) -> 9.6065361114624608 | AX46: =AG46+IF(s!AT45*s!AY45+s!AU45*s!AX45=0,0,K46*s!AU45*s!AX45/(s!AT45*s!AY45+s!AU45*s!AX45))+IF(s!AV45*s!AX45+s!AT45*s!AZ45=0,0,M46*s!AV45*s!AX45/(s!AV45*s!AX45+s!AT45*s!AZ45))+IF(s!AX45*s!BA45+s!AY45*s!AZ45=0,0,W46*s!AX45*s!BA45/(s!AX45*s!BA45+s!AY45*s!AZ45))+IF(s!AT45*s!BA45+s!AU45*s!AZ45+s!AV45*s!AY45+s!AW45*s!AX45=0,0,N46*s!AW45*s!AX45/(s!AT45*s!BA45+s!AU45*s!AZ45+s!AV45*s!AY45+s!AW45*s!AX45)) -> 13.990719511682974 | AY46: =AH46+IF(s!AT45*s!AY45+s!AU45*s!AX45=0,0,K46*s!AT45*s!AY45/(s!AT45*s!AY45+s!AU45*s!AX45))+IF(s!AU45*s!BA45+s!AW45*s!AY45=0,0,O46*s!AW45*s!AY45/(s!AU45*s!BA45+s!AW45*s!AY45))+IF(s!AX45*s!BA45+s!AY45*s!AZ45=0,0,W46*s!AY45*s!AZ45/(s!AX45*s!BA45+s!AY45*s!AZ45))+IF(s!AT45*s!BA45+s!AU45*s!AZ45+s!AV45*s!AY45+s!AW45*s!AX45=0,0,N46*s!AV45*s!AY45/(s!AT45*s!BA45+s!AU45*s!AZ45+s!AV45*s!AY45+s!AW45*s!AX45)) -> 10.577262956252522 | AZ46: =AI46+IF(s!AT45*s!AZ45+s!AV45*s!AX45=0,0,M46*s!AT45*s!AZ45/(s!AT45*s!AZ45+s!AV45*s!AX45))+IF(s!AV45*s!BA45+s!AW45*s!AZ45=0,0,Q46*s!AW45*s!AZ45/(s!AV45*s!BA45+s!AW45*s!AZ45))+IF(s!AX45*s!BA45+s!AY45*s!AZ45=0,0,W46*s!AY45*s!AZ45/(s!AX45*s!BA45+s!AY45*s!AZ45))+IF(s!AT45*s!BA45+s!AU45*s!AZ45+s!AV45*s!AY45+s!AW45*s!AX45=0,0,N46*s!AU45*s!AZ45/(s!AT45*s!BA45+s!AU45*s!AZ45+s!AV45*s!AY45+s!AW45*s!AX45)) -> 17.389437268607061 | BA46: =AJ46+IF(s!AU45*s!BA45+s!AW45*s!AY45=0,0,O46*s!AU45*s!BA45/(s!AU45*s!BA45+s!AW45*s!AY45))+IF(s!AV45*s!BA45+s!AW45*s!AZ45=0,0,Q46*s!AV45*s!BA45/(s!AV45*s!BA45+s!AW45*s!AZ45))+IF(s!AX45*s!BA45+s!AY45*s!AZ45=0,0,W46*s!AX45*s!BA45/(s!AX45*s!BA45+s!AY45*s!AZ45))+IF(s!AT45*s!BA45+s!AU45*s!AZ45+s!AV45*s!AY45+s!AW45*s!AX45=0,0,N46*s!AT45*s!BA45/(s!AT45*s!BA45+s!AU45*s!AZ45+s!AV45*s!AY45+s!AW45*s!AX45)) -> 22.042580263457442 | BJ46: =SUM(AT46:BA46) -> 778
A47: =A46 -> 100 | B47: =B46 -> 30 | C47: =C46 -> 200 | D47: =D46 -> 2 | E47: =E46 -> 4 | F47: =F46 -> 1 | G47: =G46 -> 1 | H47: =H46 -> 2 | I47: =I46 -> 1 | J47: =J46 -> 2 | K47: =K46 -> 4 | L47: =L46 -> 2 | M47: =M46 -> 4 | N47: =N46 -> 8 | O47: =O46 -> 4 | P47: =P46 -> 2 | Q47: =Q46 -> 4 | R47: =R46 -> 2 | S47: =S46 -> 1 | T47: =T46 -> 2 | U47: =U46 -> 1 | V47: =V46 -> 2 | W47: =W46 -> 4 | X47: =X46 -> 2 | Y47: =Y46 -> 1 | Z47: =Z46 -> 2 | AA47: =AA46 -> 1 | AB47: =AB46 -> 389 | AC47: =AC46 -> 234 | AD47: =AD46 -> 433 | AE47: =AE46 -> 8 | AF47: =AF46 -> 7 | AG47: =AG46 -> 8 | AH47: =AH46 -> 8 | AI47: =AI46 -> 8 | AJ47: =AJ46 -> 8 | AS47: =AS46 -> 714 | AT47: =AC47+IF(s!AT46*s!AW46+s!AU46*s!AV46=0,0,E47*s!AT46*s!AW46/(s!AT46*s!AW46+s!AU46*s!AV46))+IF(s!AT46*s!AY46+s!AU46*s!AX46=0,0,K47*s!AT46*s!AY46/(s!AT46*s!AY46+s!AU46*s!AX46))+IF(s!AT46*s!AZ46+s!AV46*s!AX46=0,0,M47*s!AT46*s!AZ46/(s!AT46*s!AZ46+s!AV46*s!AX46))+IF(s!AT46*s!BA46+s!AU46*s!AZ46+s!AV46*s!AY46+s!AW46*s!AX46=0,0,N47*s!AT46*s!BA46/(s!AT46*s!BA46+s!AU46*s!AZ46+s!AV46*s!AY46+s!AW46*s!AX46)) -> 244.658396884052 | AU47: =AD47+IF(s!AU46*s!AV46+s!AT46*s!AW46=0,0,E47*s!AU46*s!AV46/(s!AU46*s!AV46+s!AT46*s!AW46))+IF(s!AT46*s!AY46+s!AU46*s!AX46=0,0,K47*s!AU46*s!AX46/(s!AT46*s!AY46+s!AU46*s!AX46))+IF(s!AU46*s!BA46+s!AW46*s!AY46=0,0,O47*s!AU46*s!BA46/(s!AU46*s!BA46+s!AW46*s!AY46))+IF(s!AT46*s!BA46+s!AU46*s!AZ46+s!AV46*s!AY46+s!AW46*s!AX46=0,0,N47*s!AU46*s!AZ46/(s!AT46*s!BA46+s!AU46*s!AZ46+s!AV46*s!AY46+s!AW46*s!AX46)) -> 445.77362063511003 | AV47: =AE47+IF(s!AU46*s!AV46+s!AT46*s!AW46=0,0,E47*s!AU46*s!AV46/(s!AU46*s!AV46+s!AT46*s!AW46))+IF(s!AV46*s!AX46+s!AT46*s!AZ46=0,0,M47*s!AV46*s!AX46/(s!AV46*s!AX46+s!AT46*s!AZ46))+IF(s!AV46*s!BA46+s!AW46*s!AZ46=0,0,Q47*s!AV46*s!BA46/(s!AV46*s!BA46+s!AW46*s!AZ46))+IF(s!AT46*s!BA46+s!AU46*s!AZ46+s!AV46*s!AY46+s!AW46*s!AX46=0,0,N47*s!AV46*s!AY46/(s!AT46*s!BA46+s!AU46*s!AZ46+s!AV46*s!AY46+s!AW46*s!AX46)) -> 13.961446547304277 | AW47: =AF47+IF(s!AT46*s!AW46+s!AU46*s!AV46=0,0,E47*s!AT46*s!AW46/(s!AT46*s!AW46+s!AU46*s!AV46))+IF(s!AU46*s!BA46+s!AW46*s!AY46=0,0,O47*s!AW46*s!AY46/(s!AU46*s!BA46+s!AW46*s!AY46))+IF(s!AV46*s!BA46+s!AW46*s!AZ46=0,0,Q47*s!AW46*s!AZ46/(s!AV46*s!BA46+s!AW46*s!AZ46))+IF(s!AT46*s!BA46+s!AU46*s!AZ46+s!AV46*s!AY46+s!AW46*s!AX46=0,0,N47*s!AW46*s!AX46/(s!AT46*s!BA46+s!AU46*s!AZ46+s!AV46*s!AY46+s!AW46*s!AX46)) -> 9.6065359335337117 | AX47: =AG47+IF(s!AT46*s!AY46+s!AU46*s!AX46=0,0,K47*s!AU46*s!AX46/(s!AT46*s!AY46+s!AU46*s!AX46))+IF(s!AV46*s!AX46+s!AT46*s!AZ46=0,0,M47*s!AV46*s!AX46/(s!AV46*s!AX46+s!AT46*s!AZ46))+IF(s!AX46*s!BA46+s!AY46*s!AZ46=0,0,W47*s!AX46*s!BA46/(s!AX46*s!BA46+s!AY46*s!AZ46))+IF(s!AT46*s!BA46+s!AU46*s!AZ46+s!AV46*s!AY46+s!AW46*s!AX46=0,0,N47*s!AW46*s!AX46/(s!AT46*s!BA46+s!AU46*s!AZ46+s!AV46*s!AY46+s!AW46*s!AX46)) -> 13.990719684612275 | AY47: =AH47+IF(s!AT46*s!AY46+s!AU46*s!AX46=0,0,K47*s!AT46*s!AY46/(s!AT46*s!AY46+s!AU46*s!AX46))+IF(s!AU46*s!BA46+s!AW46*s!AY46=0,0,O47*s!AW46*s!AY46/(s!AU46*s!BA46+s!AW46*s!AY46))+IF(s!AX46*s!BA46+s!AY46*s!AZ46=0,0,W47*s!AY46*s!AZ46/(s!AX46*s!BA46+s!AY46*s!AZ46))+IF(s!AT46*s!BA46+s!AU46*s!AZ46+s!AV46*s!AY46+s!AW46*s!AX46=0,0,N47*s!AV46*s!AY46/(s!AT46*s!BA46+s!AU46*s!AZ46+s!AV46*s!AY46+s!AW46*s!AX46)) -> 10.577262796225714 | AZ47: =AI47+IF(s!AT46*s!AZ46+s!AV46*s!AX46=0,0,M47*s!AT46*s!AZ46/(s!AT46*s!AZ46+s!AV46*s!AX46))+IF(s!AV46*s!BA46+s!AW46*s!AZ46=0,0,Q47*s!AW46*s!AZ46/(s!AV46*s!BA46+s!AW46*s!AZ46))+IF(s!AX46*s!BA46+s!AY46*s!AZ46=0,0,W47*s!AY46*s!AZ46/(s!AX46*s!BA46+s!AY46*s!AZ46))+IF(s!AT46*s!BA46+s!AU46*s!AZ46+s!AV46*s!AY46+s!AW46*s!AX46=0,0,N47*s!AU46*s!AZ46/(s!AT46*s!BA46+s!AU46*s!AZ46+s!AV46*s!AY46+s!AW46*s!AX46)) -> 17.389436884031451 | BA47: =AJ47+IF(s!AU46*s!BA46+s!AW46*s!AY46=0,0,O47*s!AU46*s!BA46/(s!AU46*s!BA46+s!AW46*s!AY46))+IF(s!AV46*s!BA46+s!AW46*s!AZ46=0,0,Q47*s!AV46*s!BA46/(s!AV46*s!BA46+s!AW46*s!AZ46))+IF(s!AX46*s!BA46+s!AY46*s!AZ46=0,0,W47*s!AX46*s!BA46/(s!AX46*s!BA46+s!AY46*s!AZ46))+IF(s!AT46*s!BA46+s!AU46*s!AZ46+s!AV46*s!AY46+s!AW46*s!AX46=0,0,N47*s!AT46*s!BA46/(s!AT46*s!BA46+s!AU46*s!AZ46+s!AV46*s!AY46+s!AW46*s!AX46)) -> 22.042580635130562 | BJ47: =SUM(AT47:BA47) -> 778
A48: =A47 -> 100 | B48: =B47 -> 30 | C48: =C47 -> 200 | D48: =D47 -> 2 | E48: =E47 -> 4 | F48: =F47 -> 1 | G48: =G47 -> 1 | H48: =H47 -> 2 | I48: =I47 -> 1 | J48: =J47 -> 2 | K48: =K47 -> 4 | L48: =L47 -> 2 | M48: =M47 -> 4 | N48: =N47 -> 8 | O48: =O47 -> 4 | P48: =P47 -> 2 | Q48: =Q47 -> 4 | R48: =R47 -> 2 | S48: =S47 -> 1 | T48: =T47 -> 2 | U48: =U47 -> 1 | V48: =V47 -> 2 | W48: =W47 -> 4 | X48: =X47 -> 2 | Y48: =Y47 -> 1 | Z48: =Z47 -> 2 | AA48: =AA47 -> 1 | AB48: =AB47 -> 389 | AC48: =AC47 -> 234 | AD48: =AD47 -> 433 | AE48: =AE47 -> 8 | AF48: =AF47 -> 7 | AG48: =AG47 -> 8 | AH48: =AH47 -> 8 | AI48: =AI47 -> 8 | AJ48: =AJ47 -> 8 | AS48: =AS47 -> 714 | AT48: =AC48+IF(s!AT47*s!AW47+s!AU47*s!AV47=0,0,E48*s!AT47*s!AW47/(s!AT47*s!AW47+s!AU47*s!AV47))+IF(s!AT47*s!AY47+s!AU47*s!AX47=0,0,K48*s!AT47*s!AY47/(s!AT47*s!AY47+s!AU47*s!AX47))+IF(s!AT47*s!AZ47+s!AV47*s!AX47=0,0,M48*s!AT47*s!AZ47/(s!AT47*s!AZ47+s!AV47*s!AX47))+IF(s!AT47*s!BA47+s!AU47*s!AZ47+s!AV47*s!AY47+s!AW47*s!AX47=0,0,N48*s!AT47*s!BA47/(s!AT47*s!BA47+s!AU47*s!AZ47+s!AV47*s!AY47+s!AW47*s!AX47)) -> 244.65839689894014 | AU48: =AD48+IF(s!AU47*s!AV47+s!AT47*s!AW47=0,0,E48*s!AU47*s!AV47/(s!AU47*s!AV47+s!AT47*s!AW47))+IF(s!AT47*s!AY47+s!AU47*s!AX47=0,0,K48*s!AU47*s!AX47/(s!AT47*s!AY47+s!AU47*s!AX47))+IF(s!AU47*s!BA47+s!AW47*s!AY47=0,0,O48*s!AU47*s!BA47/(s!AU47*s!BA47+s!AW47*s!AY47))+IF(s!AT47*s!BA47+s!AU47*s!AZ47+s!AV47*s!AY47+s!AW47*s!AX47=0,0,N48*s!AU47*s!AZ47/(s!AT47*s!BA47+s!AU47*s!AZ47+s!AV47*s!AY47+s!AW47*s!AX47)) -> 445.77362061099171 | AV48: =AE48+IF(s!AU47*s!AV47+s!AT47*s!AW47=0,0,E48*s!AU47*s!AV47/(s!AU47*s!AV47+s!AT47*s!AW47))+IF(s!AV47*s!AX47+s!AT47*s!AZ47=0,0,M48*s!AV47*s!AX47/(s!AV47*s!AX47+s!AT47*s!AZ47))+IF(s!AV47*s!BA47+s!AW47*s!AZ47=0,0,Q48*s!AV47*s!BA47/(s!AV47*s!BA47+s!AW47*s!AZ47))+IF(s!AT47*s!BA47+s!AU47*s!AZ47+s!AV47*s!AY47+s!AW47*s!AX47=0,0,N48*s!AV47*s!AY47/(s!AT47*s!BA47+s!AU47*s!AZ47+s!AV47*s!AY47+s!AW47*s!AX47)) -> 13.961446683782935 | AW48: =AF48+IF(s!AT47*s!AW47+s!AU47*s!AV47=0,0,E48*s!AT47*s!AW47/(s!AT47*s!AW47+s!AU47*s!AV47))+IF(s!AU47*s!BA47+s!AW47*s!AY47=0,0,O48*s!AW47*s!AY47/(s!AU47*s!BA47+s!AW47*s!AY47))+IF(s!AV47*s!BA47+s!AW47*s!AZ47=0,0,Q48*s!AW47*s!AZ47/(s!AV47*s!BA47+s!AW47*s!AZ47))+IF(s!AT47*s!BA47+s!AU47*s!AZ47+s!AV47*s!AY47+s!AW47*s!AX47=0,0,N48*s!AW47*s!AX47/(s!AT47*s!BA47+s!AU47*s!AZ47+s!AV47*s!AY47+s!AW47*s!AX47)) -> 9.6065358062852209 | AX48: =AG48+IF(s!AT47*s!AY47+s!AU47*s!AX47=0,0,K48*s!AU47*s!AX47/(s!AT47*s!AY47+s!AU47*s!AX47))+IF(s!AV47*s!AX47+s!AT47*s!AZ47=0,0,M48*s!AV47*s!AX47/(s!AV47*s!AX47+s!AT47*s!AZ47))+IF(s!AX47*s!BA47+s!AY47*s!AZ47=0,0,W48*s!AX47*s!BA47/(s!AX47*s!BA47+s!AY47*s!AZ47))+IF(s!AT47*s!BA47+s!AU47*s!AZ47+s!AV47*s!AY47+s!AW47*s!AX47=0,0,N48*s!AW47*s!AX47/(s!AT47*s!BA47+s!AU47*s!AZ47+s!AV47*s!AY47+s!AW47*s!AX47)) -> 13.990719808292003 | AY48: =AH48+IF(s!AT47*s!AY47+s!AU47*s!AX47=0,0,K48*s!AT47*s!AY47/(s!AT47*s!AY47+s!AU47*s!AX47))+IF(s!AU47*s!BA47+s!AW47*s!AY47=0,0,O48*s!AW47*s!AY47/(s!AU47*s!BA47+s!AW47*s!AY47))+IF(s!AX47*s!BA47+s!AY47*s!AZ47=0,0,W48*s!AY47*s!AZ47/(s!AX47*s!BA47+s!AY47*s!AZ47))+IF(s!AT47*s!BA47+s!AU47*s!AZ47+s!AV47*s!AY47+s!AW47*s!AX47=0,0,N48*s!AV47*s!AY47/(s!AT47*s!BA47+s!AU47*s!AZ47+s!AV47*s!AY47+s!AW47*s!AX47)) -> 10.577262681776153 | AZ48: =AI48+IF(s!AT47*s!AZ47+s!AV47*s!AX47=0,0,M48*s!AT47*s!AZ47/(s!AT47*s!AZ47+s!AV47*s!AX47))+IF(s!AV47*s!BA47+s!AW47*s!AZ47=0,0,Q48*s!AW47*s!AZ47/(s!AV47*s!BA47+s!AW47*s!AZ47))+IF(s!AX47*s!BA47+s!AY47*s!AZ47=0,0,W48*s!AY47*s!AZ47/(s!AX47*s!BA47+s!AY47*s!AZ47))+IF(s!AT47*s!BA47+s!AU47*s!AZ47+s!AV47*s!AY47+s!AW47*s!AX47=0,0,N48*s!AU47*s!AZ47/(s!AT47*s!BA47+s!AU47*s!AZ47+s!AV47*s!AY47+s!AW47*s!AX47)) -> 17.389436608984944 | BA48: =AJ48+IF(s!AU47*s!BA47+s!AW47*s!AY47=0,0,O48*s!AU47*s!BA47/(s!AU47*s!BA47+s!AW47*s!AY47))+IF(s!AV47*s!BA47+s!AW47*s!AZ47=0,0,Q48*s!AV47*s!BA47/(s!AV47*s!BA47+s!AW47*s!AZ47))+IF(s!AX47*s!BA47+s!AY47*s!AZ47=0,0,W48*s!AX47*s!BA47/(s!AX47*s!BA47+s!AY47*s!AZ47))+IF(s!AT47*s!BA47+s!AU47*s!AZ47+s!AV47*s!AY47+s!AW47*s!AX47=0,0,N48*s!AT47*s!BA47/(s!AT47*s!BA47+s!AU47*s!AZ47+s!AV47*s!AY47+s!AW47*s!AX47)) -> 22.042580900946895 | BJ48: =SUM(AT48:BA48) -> 778
A49: =A48 -> 100 | B49: =B48 -> 30 | C49: =C48 -> 200 | D49: =D48 -> 2 | E49: =E48 -> 4 | F49: =F48 -> 1 | G49: =G48 -> 1 | H49: =H48 -> 2 | I49: =I48 -> 1 | J49: =J48 -> 2 | K49: =K48 -> 4 | L49: =L48 -> 2 | M49: =M48 -> 4 | N49: =N48 -> 8 | O49: =O48 -> 4 | P49: =P48 -> 2 | Q49: =Q48 -> 4 | R49: =R48 -> 2 | S49: =S48 -> 1 | T49: =T48 -> 2 | U49: =U48 -> 1 | V49: =V48 -> 2 | W49: =W48 -> 4 | X49: =X48 -> 2 | Y49: =Y48 -> 1 | Z49: =Z48 -> 2 | AA49: =AA48 -> 1 | AB49: =AB48 -> 389 | AC49: =AC48 -> 234 | AD49: =AD48 -> 433 | AE49: =AE48 -> 8 | AF49: =AF48 -> 7 | AG49: =AG48 -> 8 | AH49: =AH48 -> 8 | AI49: =AI48 -> 8 | AJ49: =AJ48 -> 8 | AS49: =AS48 -> 714 | AT49: =AC49+IF(s!AT48*s!AW48+s!AU48*s!AV48=0,0,E49*s!AT48*s!AW48/(s!AT48*s!AW48+s!AU48*s!AV48))+IF(s!AT48*s!AY48+s!AU48*s!AX48=0,0,K49*s!AT48*s!AY48/(s!AT48*s!AY48+s!AU48*s!AX48))+IF(s!AT48*s!AZ48+s!AV48*s!AX48=0,0,M49*s!AT48*s!AZ48/(s!AT48*s!AZ48+s!AV48*s!AX48))+IF(s!AT48*s!BA48+s!AU48*s!AZ48+s!AV48*s!AY48+s!AW48*s!AX48=0,0,N49*s!AT48*s!BA48/(s!AT48*s!BA48+s!AU48*s!AZ48+s!AV48*s!AY48+s!AW48*s!AX48)) -> 244.65839690958904 | AU49: =AD49+IF(s!AU48*s!AV48+s!AT48*s!AW48=0,0,E49*s!AU48*s!AV48/(s!AU48*s!AV48+s!AT48*s!AW48))+IF(s!AT48*s!AY48+s!AU48*s!AX48=0,0,K49*s!AU48*s!AX48/(s!AT48*s!AY48+s!AU48*s!AX48))+IF(s!AU48*s!BA48+s!AW48*s!AY48=0,0,O49*s!AU48*s!BA48/(s!AU48*s!BA48+s!AW48*s!AY48))+IF(s!AT48*s!BA48+s!AU48*s!AZ48+s!AV48*s!AY48+s!AW48*s!AX48=0,0,N49*s!AU48*s!AZ48/(s!AT48*s!BA48+s!AU48*s!AZ48+s!AV48*s!AY48+s!AW48*s!AX48)) -> 445.77362059373962 | AV49: =AE49+IF(s!AU48*s!AV48+s!AT48*s!AW48=0,0,E49*s!AU48*s!AV48/(s!AU48*s!AV48+s!AT48*s!AW48))+IF(s!AV48*s!AX48+s!AT48*s!AZ48=0,0,M49*s!AV48*s!AX48/(s!AV48*s!AX48+s!AT48*s!AZ48))+IF(s!AV48*s!BA48+s!AW48*s!AZ48=0,0,Q49*s!AV48*s!BA48/(s!AV48*s!BA48+s!AW48*s!AZ48))+IF(s!AT48*s!BA48+s!AU48*s!AZ48+s!AV48*s!AY48+s!AW48*s!AX48=0,0,N49*s!AV48*s!AY48/(s!AT48*s!BA48+s!AU48*s!AZ48+s!AV48*s!AY48+s!AW48*s!AX48)) -> 13.961446781394173 | AW49: =AF49+IF(s!AT48*s!AW48+s!AU48*s!AV48=0,0,E49*s!AT48*s!AW48/(s!AT48*s!AW48+s!AU48*s!AV48))+IF(s!AU48*s!BA48+s!AW48*s!AY48=0,0,O49*s!AW48*s!AY48/(s!AU48*s!BA48+s!AW48*s!AY48))+IF(s!AV48*s!BA48+s!AW48*s!AZ48=0,0,Q49*s!AW48*s!AZ48/(s!AV48*s!BA48+s!AW48*s!AZ48))+IF(s!AT48*s!BA48+s!AU48*s!AZ48+s!AV48*s!AY48+s!AW48*s!AX48=0,0,N49*s!AW48*s!AX48/(s!AT48*s!BA48+s!AU48*s!AZ48+s!AV48*s!AY48+s!AW48*s!AX48)) -> 9.6065357152771682 | AX49: =AG49+IF(s!AT48*s!AY48+s!AU48*s!AX48=0,0,K49*s!AU48*s!AX48/(s!AT48*s!AY48+s!AU48*s!AX48))+IF(s!AV48*s!AX48+s!AT48*s!AZ48=0,0,M49*s!AV48*s!AX48/(s!AV48*s!AX48+s!AT48*s!AZ48))+IF(s!AX48*s!BA48+s!AY48*s!AZ48=0,0,W49*s!AX48*s!BA48/(s!AX48*s!BA48+s!AY48*s!AZ48))+IF(s!AT48*s!BA48+s!AU48*s!AZ48+s!AV48*s!AY48+s!AW48*s!AX48=0,0,N49*s!AW48*s!AX48/(s!AT48*s!BA48+s!AU48*s!AZ48+s!AV48*s!AY48+s!AW48*s!AX48)) -> 13.990719896751861 | AY49: =AH49+IF(s!AT48*s!AY48+s!AU48*s!AX48=0,0,K49*s!AT48*s!AY48/(s!AT48*s!AY48+s!AU48*s!AX48))+IF(s!AU48*s!BA48+s!AW48*s!AY48=0,0,O49*s!AW48*s!AY48/(s!AU48*s!BA48+s!AW48*s!AY48))+IF(s!AX48*s!BA48+s!AY48*s!AZ48=0,0,W49*s!AY48*s!AZ48/(s!AX48*s!BA48+s!AY48*s!AZ48))+IF(s!AT48*s!BA48+s!AU48*s!AZ48+s!AV48*s!AY48+s!AW48*s!AX48=0,0,N49*s!AV48*s!AY48/(s!AT48*s!BA48+s!AU48*s!AZ48+s!AV48*s!AY48+s!AW48*s!AX48)) -> 10.57726259991948 | AZ49: =AI49+IF(s!AT48*s!AZ48+s!AV48*s!AX48=0,0,M49*s!AT48*s!AZ48/(s!AT48*s!AZ48+s!AV48*s!AX48))+IF(s!AV48*s!BA48+s!AW48*s!AZ48=0,0,Q49*s!AW48*s!AZ48/(s!AV48*s!BA48+s!AW48*s!AZ48))+IF(s!AX48*s!BA48+s!AY48*s!AZ48=0,0,W49*s!AY48*s!AZ48/(s!AX48*s!BA48+s!AY48*s!AZ48))+IF(s!AT48*s!BA48+s!AU48*s!AZ48+s!AV48*s!AY48+s!AW48*s!AX48=0,0,N49*s!AU48*s!AZ48/(s!AT48*s!BA48+s!AU48*s!AZ48+s!AV48*s!AY48+s!AW48*s!AX48)) -> 17.389436412264899 | BA49: =AJ49+IF(s!AU48*s!BA48+s!AW48*s!AY48=0,0,O49*s!AU48*s!BA48/(s!AU48*s!BA48+s!AW48*s!AY48))+IF(s!AV48*s!BA48+s!AW48*s!AZ48=0,0,Q49*s!AV48*s!BA48/(s!AV48*s!BA48+s!AW48*s!AZ48))+IF(s!AX48*s!BA48+s!AY48*s!AZ48=0,0,W49*s!AX48*s!BA48/(s!AX48*s!BA48+s!AY48*s!AZ48))+IF(s!AT48*s!BA48+s!AU48*s!AZ48+s!AV48*s!AY48+s!AW48*s!AX48=0,0,N49*s!AT48*s!BA48/(s!AT48*s!BA48+s!AU48*s!AZ48+s!AV48*s!AY48+s!AW48*s!AX48)) -> 22.042581091063759 | BJ49: =SUM(AT49:BA49) -> 778
A50: =A49 -> 100 | B50: =B49 -> 30 | C50: =C49 -> 200 | D50: =D49 -> 2 | E50: =E49 -> 4 | F50: =F49 -> 1 | G50: =G49 -> 1 | H50: =H49 -> 2 | I50: =I49 -> 1 | J50: =J49 -> 2 | K50: =K49 -> 4 | L50: =L49 -> 2 | M50: =M49 -> 4 | N50: =N49 -> 8 | O50: =O49 -> 4 | P50: =P49 -> 2 | Q50: =Q49 -> 4 | R50: =R49 -> 2 | S50: =S49 -> 1 | T50: =T49 -> 2 | U50: =U49 -> 1 | V50: =V49 -> 2 | W50: =W49 -> 4 | X50: =X49 -> 2 | Y50: =Y49 -> 1 | Z50: =Z49 -> 2 | AA50: =AA49 -> 1 | AB50: =AB49 -> 389 | AC50: =AC49 -> 234 | AD50: =AD49 -> 433 | AE50: =AE49 -> 8 | AF50: =AF49 -> 7 | AG50: =AG49 -> 8 | AH50: =AH49 -> 8 | AI50: =AI49 -> 8 | AJ50: =AJ49 -> 8 | AS50: =AS49 -> 714 | AT50: =AC50+IF(s!AT49*s!AW49+s!AU49*s!AV49=0,0,E50*s!AT49*s!AW49/(s!AT49*s!AW49+s!AU49*s!AV49))+IF(s!AT49*s!AY49+s!AU49*s!AX49=0,0,K50*s!AT49*s!AY49/(s!AT49*s!AY49+s!AU49*s!AX49))+IF(s!AT49*s!AZ49+s!AV49*s!AX49=0,0,M50*s!AT49*s!AZ49/(s!AT49*s!AZ49+s!AV49*s!AX49))+IF(s!AT49*s!BA49+s!AU49*s!AZ49+s!AV49*s!AY49+s!AW49*s!AX49=0,0,N50*s!AT49*s!BA49/(s!AT49*s!BA49+s!AU49*s!AZ49+s!AV49*s!AY49+s!AW49*s!AX49)) -> 244.65839691720598 | AU50: =AD50+IF(s!AU49*s!AV49+s!AT49*s!AW49=0,0,E50*s!AU49*s!AV49/(s!AU49*s!AV49+s!AT49*s!AW49))+IF(s!AT49*s!AY49+s!AU49*s!AX49=0,0,K50*s!AU49*s!AX49/(s!AT49*s!AY49+s!AU49*s!AX49))+IF(s!AU49*s!BA49+s!AW49*s!AY49=0,0,O50*s!AU49*s!BA49/(s!AU49*s!BA49+s!AW49*s!AY49))+IF(s!AT49*s!BA49+s!AU49*s!AZ49+s!AV49*s!AY49+s!AW49*s!AX49=0,0,N50*s!AU49*s!AZ49/(s!AT49*s!BA49+s!AU49*s!AZ49+s!AV49*s!AY49+s!AW49*s!AX49)) -> 445.77362058139875 | AV50: =AE50+IF(s!AU49*s!AV49+s!AT49*s!AW49=0,0,E50*s!AU49*s!AV49/(s!AU49*s!AV49+s!AT49*s!AW49))+IF(s!AV49*s!AX49+s!AT49*s!AZ49=0,0,M50*s!AV49*s!AX49/(s!AV49*s!AX49+s!AT49*s!AZ49))+IF(s!AV49*s!BA49+s!AW49*s!AZ49=0,0,Q50*s!AV49*s!BA49/(s!AV49*s!BA49+s!AW49*s!AZ49))+IF(s!AT49*s!BA49+s!AU49*s!AZ49+s!AV49*s!AY49+s!AW49*s!AX49=0,0,N50*s!AV49*s!AY49/(s!AT49*s!BA49+s!AU49*s!AZ49+s!AV49*s!AY49+s!AW49*s!AX49)) -> 13.961446851209731 | AW50: =AF50+IF(s!AT49*s!AW49+s!AU49*s!AV49=0,0,E50*s!AT49*s!AW49/(s!AT49*s!AW49+s!AU49*s!AV49))+IF(s!AU49*s!BA49+s!AW49*s!AY49=0,0,O50*s!AW49*s!AY49/(s!AU49*s!BA49+s!AW49*s!AY49))+IF(s!AV49*s!BA49+s!AW49*s!AZ49=0,0,Q50*s!AW49*s!AZ49/(s!AV49*s!BA49+s!AW49*s!AZ49))+IF(s!AT49*s!BA49+s!AU49*s!AZ49+s!AV49*s!AY49+s!AW49*s!AX49=0,0,N50*s!AW49*s!AX49/(s!AT49*s!BA49+s!AU49*s!AZ49+s!AV49*s!AY49+s!AW49*s!AX49)) -> 9.6065356501855366 | AX50: =AG50+IF(s!AT49*s!AY49+s!AU49*s!AX49=0,0,K50*s!AU49*s!AX49/(s!AT49*s!AY49+s!AU49*s!AX49))+IF(s!AV49*s!AX49+s!AT49*s!AZ49=0,0,M50*s!AV49*s!AX49/(s!AV49*s!AX49+s!AT49*s!AZ49))+IF(s!AX49*s!BA49+s!AY49*s!AZ49=0,0,W50*s!AX49*s!BA49/(s!AX49*s!BA49+s!AY49*s!AZ49))+IF(s!AT49*s!BA49+s!AU49*s!AZ49+s!AV49*s!AY49+s!AW49*s!AX49=0,0,N50*s!AW49*s!AX49/(s!AT49*s!BA49+s!AU49*s!AZ49+s!AV49*s!AY49+s!AW49*s!AX49)) -> 13.990719960023561 | AY50: =AH50+IF(s!AT49*s!AY49+s!AU49*s!AX49=0,0,K50*s!AT49*s!AY49/(s!AT49*s!AY49+s!AU49*s!AX49))+IF(s!AU49*s!BA49+s!AW49*s!AY49=0,0,O50*s!AW49*s!AY49/(s!AU49*s!BA49+s!AW49*s!AY49))+IF(s!AX49*s!BA49+s!AY49*s!AZ49=0,0,W50*s!AY49*s!AZ49/(s!AX49*s!BA49+s!AY49*s!AZ49))+IF(s!AT49*s!BA49+s!AU49*s!AZ49+s!AV49*s!AY49+s!AW49*s!AX49=0,0,N50*s!AV49*s!AY49/(s!AT49*s!BA49+s!AU49*s!AZ49+s!AV49*s!AY49+s!AW49*s!AX49)) -> 10.577262541371708 | AZ50: =AI50+IF(s!AT49*s!AZ49+s!AV49*s!AX49=0,0,M50*s!AT49*s!AZ49/(s!AT49*s!AZ49+s!AV49*s!AX49))+IF(s!AV49*s!BA49+s!AW49*s!AZ49=0,0,Q50*s!AW49*s!AZ49/(s!AV49*s!BA49+s!AW49*s!AZ49))+IF(s!AX49*s!BA49+s!AY49*s!AZ49=0,0,W50*s!AY49*s!AZ49/(s!AX49*s!BA49+s!AY49*s!AZ49))+IF(s!AT49*s!BA49+s!AU49*s!AZ49+s!AV49*s!AY49+s!AW49*s!AX49=0,0,N50*s!AU49*s!AZ49/(s!AT49*s!BA49+s!AU49*s!AZ49+s!AV49*s!AY49+s!AW49*s!AX49)) -> 17.389436271560722 | BA50: =AJ50+IF(s!AU49*s!BA49+s!AW49*s!AY49=0,0,O50*s!AU49*s!BA49/(s!AU49*s!BA49+s!AW49*s!AY49))+IF(s!AV49*s!BA49+s!AW49*s!AZ49=0,0,Q50*s!AV49*s!BA49/(s!AV49*s!BA49+s!AW49*s!AZ49))+IF(s!AX49*s!BA49+s!AY49*s!AZ49=0,0,W50*s!AX49*s!BA49/(s!AX49*s!BA49+s!AY49*s!AZ49))+IF(s!AT49*s!BA49+s!AU49*s!AZ49+s!AV49*s!AY49+s!AW49*s!AX49=0,0,N50*s!AT49*s!BA49/(s!AT49*s!BA49+s!AU49*s!AZ49+s!AV49*s!AY49+s!AW49*s!AX49)) -> 22.04258122704401 | BJ50: =SUM(AT50:BA50) -> 778
A51: =A50 -> 100 | B51: =B50 -> 30 | C51: =C50 -> 200 | D51: =D50 -> 2 | E51: =E50 -> 4 | F51: =F50 -> 1 | G51: =G50 -> 1 | H51: =H50 -> 2 | I51: =I50 -> 1 | J51: =J50 -> 2 | K51: =K50 -> 4 | L51: =L50 -> 2 | M51: =M50 -> 4 | N51: =N50 -> 8 | O51: =O50 -> 4 | P51: =P50 -> 2 | Q51: =Q50 -> 4 | R51: =R50 -> 2 | S51: =S50 -> 1 | T51: =T50 -> 2 | U51: =U50 -> 1 | V51: =V50 -> 2 | W51: =W50 -> 4 | X51: =X50 -> 2 | Y51: =Y50 -> 1 | Z51: =Z50 -> 2 | AA51: =AA50 -> 1 | AB51: =AB50 -> 389 | AC51: =AC50 -> 234 | AD51: =AD50 -> 433 | AE51: =AE50 -> 8 | AF51: =AF50 -> 7 | AG51: =AG50 -> 8 | AH51: =AH50 -> 8 | AI51: =AI50 -> 8 | AJ51: =AJ50 -> 8 | AS51: =AS50 -> 714 | AT51: =AC51+IF(s!AT50*s!AW50+s!AU50*s!AV50=0,0,E51*s!AT50*s!AW50/(s!AT50*s!AW50+s!AU50*s!AV50))+IF(s!AT50*s!AY50+s!AU50*s!AX50=0,0,K51*s!AT50*s!AY50/(s!AT50*s!AY50+s!AU50*s!AX50))+IF(s!AT50*s!AZ50+s!AV50*s!AX50=0,0,M51*s!AT50*s!AZ50/(s!AT50*s!AZ50+s!AV50*s!AX50))+IF(s!AT50*s!BA50+s!AU50*s!AZ50+s!AV50*s!AY50+s!AW50*s!AX50=0,0,N51*s!AT50*s!BA50/(s!AT50*s!BA50+s!AU50*s!AZ50+s!AV50*s!AY50+s!AW50*s!AX50)) -> 244.65839692265425 | AU51: =AD51+IF(s!AU50*s!AV50+s!AT50*s!AW50=0,0,E51*s!AU50*s!AV50/(s!AU50*s!AV50+s!AT50*s!AW50))+IF(s!AT50*s!AY50+s!AU50*s!AX50=0,0,K51*s!AU50*s!AX50/(s!AT50*s!AY50+s!AU50*s!AX50))+IF(s!AU50*s!BA50+s!AW50*s!AY50=0,0,O51*s!AU50*s!BA50/(s!AU50*s!BA50+s!AW50*s!AY50))+IF(s!AT50*s!BA50+s!AU50*s!AZ50+s!AV50*s!AY50+s!AW50*s!AX50=0,0,N51*s!AU50*s!AZ50/(s!AT50*s!BA50+s!AU50*s!AZ50+s!AV50*s!AY50+s!AW50*s!AX50)) -> 445.77362057257091 | AV51: =AE51+IF(s!AU50*s!AV50+s!AT50*s!AW50=0,0,E51*s!AU50*s!AV50/(s!AU50*s!AV50+s!AT50*s!AW50))+IF(s!AV50*s!AX50+s!AT50*s!AZ50=0,0,M51*s!AV50*s!AX50/(s!AV50*s!AX50+s!AT50*s!AZ50))+IF(s!AV50*s!BA50+s!AW50*s!AZ50=0,0,Q51*s!AV50*s!BA50/(s!AV50*s!BA50+s!AW50*s!AZ50))+IF(s!AT50*s!BA50+s!AU50*s!AZ50+s!AV50*s!AY50+s!AW50*s!AX50=0,0,N51*s!AV50*s!AY50/(s!AT50*s!BA50+s!AU50*s!AZ50+s!AV50*s!AY50+s!AW50*s!AX50)) -> 13.961446901146424 | AW51: =AF51+IF(s!AT50*s!AW50+s!AU50*s!AV50=0,0,E51*s!AT50*s!AW50/(s!AT50*s!AW50+s!AU50*s!AV50))+IF(s!AU50*s!BA50+s!AW50*s!AY50=0,0,O51*s!AW50*s!AY50/(s!AU50*s!BA50+s!AW50*s!AY50))+IF(s!AV50*s!BA50+s!AW50*s!AZ50=0,0,Q51*s!AW50*s!AZ50/(s!AV50*s!BA50+s!AW50*s!AZ50))+IF(s!AT50*s!BA50+s!AU50*s!AZ50+s!AV50*s!AY50+s!AW50*s!AX50=0,0,N51*s!AW50*s!AX50/(s!AT50*s!BA50+s!AU50*s!AZ50+s!AV50*s!AY50+s!AW50*s!AX50)) -> 9.6065356036283891 | AX51: =AG51+IF(s!AT50*s!AY50+s!AU50*s!AX50=0,0,K51*s!AU50*s!AX50/(s!AT50*s!AY50+s!AU50*s!AX50))+IF(s!AV50*s!AX50+s!AT50*s!AZ50=0,0,M51*s!AV50*s!AX50/(s!AV50*s!AX50+s!AT50*s!AZ50))+IF(s!AX50*s!BA50+s!AY50*s!AZ50=0,0,W51*s!AX50*s!BA50/(s!AX50*s!BA50+s!AY50*s!AZ50))+IF(s!AT50*s!BA50+s!AU50*s!AZ50+s!AV50*s!AY50+s!AW50*s!AX50=0,0,N51*s!AW50*s!AX50/(s!AT50*s!BA50+s!AU50*s!AZ50+s!AV50*s!AY50+s!AW50*s!AX50)) -> 13.990720005280629 | AY51: =AH51+IF(s!AT50*s!AY50+s!AU50*s!AX50=0,0,K51*s!AT50*s!AY50/(s!AT50*s!AY50+s!AU50*s!AX50))+IF(s!AU50*s!BA50+s!AW50*s!AY50=0,0,O51*s!AW50*s!AY50/(s!AU50*s!BA50+s!AW50*s!AY50))+IF(s!AX50*s!BA50+s!AY50*s!AZ50=0,0,W51*s!AY50*s!AZ50/(s!AX50*s!BA50+s!AY50*s!AZ50))+IF(s!AT50*s!BA50+s!AU50*s!AZ50+s!AV50*s!AY50+s!AW50*s!AX50=0,0,N51*s!AV50*s!AY50/(s!AT50*s!BA50+s!AU50*s!AZ50+s!AV50*s!AY50+s!AW50*s!AX50)) -> 10.577262499494182 | AZ51: =AI51+IF(s!AT50*s!AZ50+s!AV50*s!AX50=0,0,M51*s!AT50*s!AZ50/(s!AT50*s!AZ50+s!AV50*s!AX50))+IF(s!AV50*s!BA50+s!AW50*s!AZ50=0,0,Q51*s!AW50*s!AZ50/(s!AV50*s!BA50+s!AW50*s!AZ50))+IF(s!AX50*s!BA50+s!AY50*s!AZ50=0,0,W51*s!AY50*s!AZ50/(s!AX50*s!BA50+s!AY50*s!AZ50))+IF(s!AT50*s!BA50+s!AU50*s!AZ50+s!AV50*s!AY50+s!AW50*s!AX50=0,0,N51*s!AU50*s!AZ50/(s!AT50*s!BA50+s!AU50*s!AZ50+s!AV50*s!AY50+s!AW50*s!AX50)) -> 17.389436170918685 | BA51: =AJ51+IF(s!AU50*s!BA50+s!AW50*s!AY50=0,0,O51*s!AU50*s!BA50/(s!AU50*s!BA50+s!AW50*s!AY50))+IF(s!AV50*s!BA50+s!AW50*s!AZ50=0,0,Q51*s!AV50*s!BA50/(s!AV50*s!BA50+s!AW50*s!AZ50))+IF(s!AX50*s!BA50+s!AY50*s!AZ50=0,0,W51*s!AX50*s!BA50/(s!AX50*s!BA50+s!AY50*s!AZ50))+IF(s!AT50*s!BA50+s!AU50*s!AZ50+s!AV50*s!AY50+s!AW50*s!AX50=0,0,N51*s!AT50*s!BA50/(s!AT50*s!BA50+s!AU50*s!AZ50+s!AV50*s!AY50+s!AW50*s!AX50)) -> 22.042581324306504 | BJ51: =SUM(AT51:BA51) -> 778
A52: =A51 -> 100 | B52: =B51 -> 30 | C52: =C51 -> 200 | D52: =D51 -> 2 | E52: =E51 -> 4 | F52: =F51 -> 1 | G52: =G51 -> 1 | H52: =H51 -> 2 | I52: =I51 -> 1 | J52: =J51 -> 2 | K52: =K51 -> 4 | L52: =L51 -> 2 | M52: =M51 -> 4 | N52: =N51 -> 8 | O52: =O51 -> 4 | P52: =P51 -> 2 | Q52: =Q51 -> 4 | R52: =R51 -> 2 | S52: =S51 -> 1 | T52: =T51 -> 2 | U52: =U51 -> 1 | V52: =V51 -> 2 | W52: =W51 -> 4 | X52: =X51 -> 2 | Y52: =Y51 -> 1 | Z52: =Z51 -> 2 | AA52: =AA51 -> 1 | AB52: =AB51 -> 389 | AC52: =AC51 -> 234 | AD52: =AD51 -> 433 | AE52: =AE51 -> 8 | AF52: =AF51 -> 7 | AG52: =AG51 -> 8 | AH52: =AH51 -> 8 | AI52: =AI51 -> 8 | AJ52: =AJ51 -> 8 | AS52: =AS51 -> 714 | AT52: =AC52+IF(s!AT51*s!AW51+s!AU51*s!AV51=0,0,E52*s!AT51*s!AW51/(s!AT51*s!AW51+s!AU51*s!AV51))+IF(s!AT51*s!AY51+s!AU51*s!AX51=0,0,K52*s!AT51*s!AY51/(s!AT51*s!AY51+s!AU51*s!AX51))+IF(s!AT51*s!AZ51+s!AV51*s!AX51=0,0,M52*s!AT51*s!AZ51/(s!AT51*s!AZ51+s!AV51*s!AX51))+IF(s!AT51*s!BA51+s!AU51*s!AZ51+s!AV51*s!AY51+s!AW51*s!AX51=0,0,N52*s!AT51*s!BA51/(s!AT51*s!BA51+s!AU51*s!AZ51+s!AV51*s!AY51+s!AW51*s!AX51)) -> 244.6583969265514 | AU52: =AD52+IF(s!AU51*s!AV51+s!AT51*s!AW51=0,0,E52*s!AU51*s!AV51/(s!AU51*s!AV51+s!AT51*s!AW51))+IF(s!AT51*s!AY51+s!AU51*s!AX51=0,0,K52*s!AU51*s!AX51/(s!AT51*s!AY51+s!AU51*s!AX51))+IF(s!AU51*s!BA51+s!AW51*s!AY51=0,0,O52*s!AU51*s!BA51/(s!AU51*s!BA51+s!AW51*s!AY51))+IF(s!AT51*s!BA51+s!AU51*s!AZ51+s!AV51*s!AY51+s!AW51*s!AX51=0,0,N52*s!AU51*s!AZ51/(s!AT51*s!BA51+s!AU51*s!AZ51+s!AV51*s!AY51+s!AW51*s!AX51)) -> 445.773620566256 | AV52: =AE52+IF(s!AU51*s!AV51+s!AT51*s!AW51=0,0,E52*s!AU51*s!AV51/(s!AU51*s!AV51+s!AT51*s!AW51))+IF(s!AV51*s!AX51+s!AT51*s!AZ51=0,0,M52*s!AV51*s!AX51/(s!AV51*s!AX51+s!AT51*s!AZ51))+IF(s!AV51*s!BA51+s!AW51*s!AZ51=0,0,Q52*s!AV51*s!BA51/(s!AV51*s!BA51+s!AW51*s!AZ51))+IF(s!AT51*s!BA51+s!AU51*s!AZ51+s!AV51*s!AY51+s!AW51*s!AX51=0,0,N52*s!AV51*s!AY51/(s!AT51*s!BA51+s!AU51*s!AZ51+s!AV51*s!AY51+s!AW51*s!AX51)) -> 13.961446936865526 | AW52: =AF52+IF(s!AT51*s!AW51+s!AU51*s!AV51=0,0,E52*s!AT51*s!AW51/(s!AT51*s!AW51+s!AU51*s!AV51))+IF(s!AU51*s!BA51+s!AW51*s!AY51=0,0,O52*s!AW51*s!AY51/(s!AU51*s!BA51+s!AW51*s!AY51))+IF(s!AV51*s!BA51+s!AW51*s!AZ51=0,0,Q52*s!AW51*s!AZ51/(s!AV51*s!BA51+s!AW51*s!AZ51))+IF(s!AT51*s!BA51+s!AU51*s!AZ51+s!AV51*s!AY51+s!AW51*s!AX51=0,0,N52*s!AW51*s!AX51/(s!AT51*s!BA51+s!AU51*s!AZ51+s!AV51*s!AY51+s!AW51*s!AX51)) -> 9.6065355703270647 | AX52: =AG52+IF(s!AT51*s!AY51+s!AU51*s!AX51=0,0,K52*s!AU51*s!AX51/(s!AT51*s!AY51+s!AU51*s!AX51))+IF(s!AV51*s!AX51+s!AT51*s!AZ51=0,0,M52*s!AV51*s!AX51/(s!AV51*s!AX51+s!AT51*s!AZ51))+IF(s!AX51*s!BA51+s!AY51*s!AZ51=0,0,W52*s!AX51*s!BA51/(s!AX51*s!BA51+s!AY51*s!AZ51))+IF(s!AT51*s!BA51+s!AU51*s!AZ51+s!AV51*s!AY51+s!AW51*s!AX51=0,0,N52*s!AW51*s!AX51/(s!AT51*s!BA51+s!AU51*s!AZ51+s!AV51*s!AY51+s!AW51*s!AX51)) -> 13.990720037653061 | AY52: =AH52+IF(s!AT51*s!AY51+s!AU51*s!AX51=0,0,K52*s!AT51*s!AY51/(s!AT51*s!AY51+s!AU51*s!AX51))+IF(s!AU51*s!BA51+s!AW51*s!AY51=0,0,O52*s!AW51*s!AY51/(s!AU51*s!BA51+s!AW51*s!AY51))+IF(s!AX51*s!BA51+s!AY51*s!AZ51=0,0,W52*s!AY51*s!AZ51/(s!AX51*s!BA51+s!AY51*s!AZ51))+IF(s!AT51*s!BA51+s!AU51*s!AZ51+s!AV51*s!AY51+s!AW51*s!AX51=0,0,N52*s!AV51*s!AY51/(s!AT51*s!BA51+s!AU51*s!AZ51+s!AV51*s!AY51+s!AW51*s!AX51)) -> 10.577262469539532 | AZ52: =AI52+IF(s!AT51*s!AZ51+s!AV51*s!AX51=0,0,M52*s!AT51*s!AZ51/(s!AT51*s!AZ51+s!AV51*s!AX51))+IF(s!AV51*s!BA51+s!AW51*s!AZ51=0,0,Q52*s!AW51*s!AZ51/(s!AV51*s!BA51+s!AW51*s!AZ51))+IF(s!AX51*s!BA51+s!AY51*s!AZ51=0,0,W52*s!AY51*s!AZ51/(s!AX51*s!BA51+s!AY51*s!AZ51))+IF(s!AT51*s!BA51+s!AU51*s!AZ51+s!AV51*s!AY51+s!AW51*s!AX51=0,0,N52*s!AU51*s!AZ51/(s!AT51*s!BA51+s!AU51*s!AZ51+s!AV51*s!AY51+s!AW51*s!AX51)) -> 17.389436098930013 | BA52: =AJ52+IF(s!AU51*s!BA51+s!AW51*s!AY51=0,0,O52*s!AU51*s!BA51/(s!AU51*s!BA51+s!AW51*s!AY51))+IF(s!AV51*s!BA51+s!AW51*s!AZ51=0,0,Q52*s!AV51*s!BA51/(s!AV51*s!BA51+s!AW51*s!AZ51))+IF(s!AX51*s!BA51+s!AY51*s!AZ51=0,0,W52*s!AX51*s!BA51/(s!AX51*s!BA51+s!AY51*s!AZ51))+IF(s!AT51*s!BA51+s!AU51*s!AZ51+s!AV51*s!AY51+s!AW51*s!AX51=0,0,N52*s!AT51*s!BA51/(s!AT51*s!BA51+s!AU51*s!AZ51+s!AV51*s!AY51+s!AW51*s!AX51)) -> 22.042581393877391 | BJ52: =SUM(AT52:BA52) -> 778
A53: =A52 -> 100 | B53: =B52 -> 30 | C53: =C52 -> 200 | D53: =D52 -> 2 | E53: =E52 -> 4 | F53: =F52 -> 1 | G53: =G52 -> 1 | H53: =H52 -> 2 | I53: =I52 -> 1 | J53: =J52 -> 2 | K53: =K52 -> 4 | L53: =L52 -> 2 | M53: =M52 -> 4 | N53: =N52 -> 8 | O53: =O52 -> 4 | P53: =P52 -> 2 | Q53: =Q52 -> 4 | R53: =R52 -> 2 | S53: =S52 -> 1 | T53: =T52 -> 2 | U53: =U52 -> 1 | V53: =V52 -> 2 | W53: =W52 -> 4 | X53: =X52 -> 2 | Y53: =Y52 -> 1 | Z53: =Z52 -> 2 | AA53: =AA52 -> 1 | AB53: =AB52 -> 389 | AC53: =AC52 -> 234 | AD53: =AD52 -> 433 | AE53: =AE52 -> 8 | AF53: =AF52 -> 7 | AG53: =AG52 -> 8 | AH53: =AH52 -> 8 | AI53: =AI52 -> 8 | AJ53: =AJ52 -> 8 | AS53: =AS52 -> 714 | AT53: =AC53+IF(s!AT52*s!AW52+s!AU52*s!AV52=0,0,E53*s!AT52*s!AW52/(s!AT52*s!AW52+s!AU52*s!AV52))+IF(s!AT52*s!AY52+s!AU52*s!AX52=0,0,K53*s!AT52*s!AY52/(s!AT52*s!AY52+s!AU52*s!AX52))+IF(s!AT52*s!AZ52+s!AV52*s!AX52=0,0,M53*s!AT52*s!AZ52/(s!AT52*s!AZ52+s!AV52*s!AX52))+IF(s!AT52*s!BA52+s!AU52*s!AZ52+s!AV52*s!AY52+s!AW52*s!AX52=0,0,N53*s!AT52*s!BA52/(s!AT52*s!BA52+s!AU52*s!AZ52+s!AV52*s!AY52+s!AW52*s!AX52)) -> 244.65839692933906 | AU53: =AD53+IF(s!AU52*s!AV52+s!AT52*s!AW52=0,0,E53*s!AU52*s!AV52/(s!AU52*s!AV52+s!AT52*s!AW52))+IF(s!AT52*s!AY52+s!AU52*s!AX52=0,0,K53*s!AU52*s!AX52/(s!AT52*s!AY52+s!AU52*s!AX52))+IF(s!AU52*s!BA52+s!AW52*s!AY52=0,0,O53*s!AU52*s!BA52/(s!AU52*s!BA52+s!AW52*s!AY52))+IF(s!AT52*s!BA52+s!AU52*s!AZ52+s!AV52*s!AY52+s!AW52*s!AX52=0,0,N53*s!AU52*s!AZ52/(s!AT52*s!BA52+s!AU52*s!AZ52+s!AV52*s!AY52+s!AW52*s!AX52)) -> 445.77362056173865 | AV53: =AE53+IF(s!AU52*s!AV52+s!AT52*s!AW52=0,0,E53*s!AU52*s!AV52/(s!AU52*s!AV52+s!AT52*s!AW52))+IF(s!AV52*s!AX52+s!AT52*s!AZ52=0,0,M53*s!AV52*s!AX52/(s!AV52*s!AX52+s!AT52*s!AZ52))+IF(s!AV52*s!BA52+s!AW52*s!AZ52=0,0,Q53*s!AV52*s!BA52/(s!AV52*s!BA52+s!AW52*s!AZ52))+IF(s!AT52*s!BA52+s!AU52*s!AZ52+s!AV52*s!AY52+s!AW52*s!AX52=0,0,N53*s!AV52*s!AY52/(s!AT52*s!BA52+s!AU52*s!AZ52+s!AV52*s!AY52+s!AW52*s!AX52)) -> 13.961446962415652 | AW53: =AF53+IF(s!AT52*s!AW52+s!AU52*s!AV52=0,0,E53*s!AT52*s!AW52/(s!AT52*s!AW52+s!AU52*s!AV52))+IF(s!AU52*s!BA52+s!AW52*s!AY52=0,0,O53*s!AW52*s!AY52/(s!AU52*s!BA52+s!AW52*s!AY52))+IF(s!AV52*s!BA52+s!AW52*s!AZ52=0,0,Q53*s!AW52*s!AZ52/(s!AV52*s!BA52+s!AW52*s!AZ52))+IF(s!AT52*s!BA52+s!AU52*s!AZ52+s!AV52*s!AY52+s!AW52*s!AX52=0,0,N53*s!AW52*s!AX52/(s!AT52*s!BA52+s!AU52*s!AZ52+s!AV52*s!AY52+s!AW52*s!AX52)) -> 9.6065355465066755 | AX53: =AG53+IF(s!AT52*s!AY52+s!AU52*s!AX52=0,0,K53*s!AU52*s!AX52/(s!AT52*s!AY52+s!AU52*s!AX52))+IF(s!AV52*s!AX52+s!AT52*s!AZ52=0,0,M53*s!AV52*s!AX52/(s!AV52*s!AX52+s!AT52*s!AZ52))+IF(s!AX52*s!BA52+s!AY52*s!AZ52=0,0,W53*s!AX52*s!BA52/(s!AX52*s!BA52+s!AY52*s!AZ52))+IF(s!AT52*s!BA52+s!AU52*s!AZ52+s!AV52*s!AY52+s!AW52*s!AX52=0,0,N53*s!AW52*s!AX52/(s!AT52*s!BA52+s!AU52*s!AZ52+s!AV52*s!AY52+s!AW52*s!AX52)) -> 13.990720060809654 | AY53: =AH53+IF(s!AT52*s!AY52+s!AU52*s!AX52=0,0,K53*s!AT52*s!AY52/(s!AT52*s!AY52+s!AU52*s!AX52))+IF(s!AU52*s!BA52+s!AW52*s!AY52=0,0,O53*s!AW52*s!AY52/(s!AU52*s!BA52+s!AW52*s!AY52))+IF(s!AX52*s!BA52+s!AY52*s!AZ52=0,0,W53*s!AY52*s!AZ52/(s!AX52*s!BA52+s!AY52*s!AZ52))+IF(s!AT52*s!BA52+s!AU52*s!AZ52+s!AV52*s!AY52+s!AW52*s!AX52=0,0,N53*s!AV52*s!AY52/(s!AT52*s!BA52+s!AU52*s!AZ52+s!AV52*s!AY52+s!AW52*s!AX52)) -> 10.577262448112673 | AZ53: =AI53+IF(s!AT52*s!AZ52+s!AV52*s!AX52=0,0,M53*s!AT52*s!AZ52/(s!AT52*s!AZ52+s!AV52*s!AX52))+IF(s!AV52*s!BA52+s!AW52*s!AZ52=0,0,Q53*s!AW52*s!AZ52/(s!AV52*s!BA52+s!AW52*s!AZ52))+IF(s!AX52*s!BA52+s!AY52*s!AZ52=0,0,W53*s!AY52*s!AZ52/(s!AX52*s!BA52+s!AY52*s!AZ52))+IF(s!AT52*s!BA52+s!AU52*s!AZ52+s!AV52*s!AY52+s!AW52*s!AX52=0,0,N53*s!AU52*s!AZ52/(s!AT52*s!BA52+s!AU52*s!AZ52+s!AV52*s!AY52+s!AW52*s!AX52)) -> 17.389436047435641 | BA53: =AJ53+IF(s!AU52*s!BA52+s!AW52*s!AY52=0,0,O53*s!AU52*s!BA52/(s!AU52*s!BA52+s!AW52*s!AY52))+IF(s!AV52*s!BA52+s!AW52*s!AZ52=0,0,Q53*s!AV52*s!BA52/(s!AV52*s!BA52+s!AW52*s!AZ52))+IF(s!AX52*s!BA52+s!AY52*s!AZ52=0,0,W53*s!AX52*s!BA52/(s!AX52*s!BA52+s!AY52*s!AZ52))+IF(s!AT52*s!BA52+s!AU52*s!AZ52+s!AV52*s!AY52+s!AW52*s!AX52=0,0,N53*s!AT52*s!BA52/(s!AT52*s!BA52+s!AU52*s!AZ52+s!AV52*s!AY52+s!AW52*s!AX52)) -> 22.042581443642035 | BJ53: =SUM(AT53:BA53) -> 778
A54: =A53 -> 100 | B54: =B53 -> 30 | C54: =C53 -> 200 | D54: =D53 -> 2 | E54: =E53 -> 4 | F54: =F53 -> 1 | G54: =G53 -> 1 | H54: =H53 -> 2 | I54: =I53 -> 1 | J54: =J53 -> 2 | K54: =K53 -> 4 | L54: =L53 -> 2 | M54: =M53 -> 4 | N54: =N53 -> 8 | O54: =O53 -> 4 | P54: =P53 -> 2 | Q54: =Q53 -> 4 | R54: =R53 -> 2 | S54: =S53 -> 1 | T54: =T53 -> 2 | U54: =U53 -> 1 | V54: =V53 -> 2 | W54: =W53 -> 4 | X54: =X53 -> 2 | Y54: =Y53 -> 1 | Z54: =Z53 -> 2 | AA54: =AA53 -> 1 | AB54: =AB53 -> 389 | AC54: =AC53 -> 234 | AD54: =AD53 -> 433 | AE54: =AE53 -> 8 | AF54: =AF53 -> 7 | AG54: =AG53 -> 8 | AH54: =AH53 -> 8 | AI54: =AI53 -> 8 | AJ54: =AJ53 -> 8 | AS54: =AS53 -> 714 | AT54: =AC54+IF(s!AT53*s!AW53+s!AU53*s!AV53=0,0,E54*s!AT53*s!AW53/(s!AT53*s!AW53+s!AU53*s!AV53))+IF(s!AT53*s!AY53+s!AU53*s!AX53=0,0,K54*s!AT53*s!AY53/(s!AT53*s!AY53+s!AU53*s!AX53))+IF(s!AT53*s!AZ53+s!AV53*s!AX53=0,0,M54*s!AT53*s!AZ53/(s!AT53*s!AZ53+s!AV53*s!AX53))+IF(s!AT53*s!BA53+s!AU53*s!AZ53+s!AV53*s!AY53+s!AW53*s!AX53=0,0,N54*s!AT53*s!BA53/(s!AT53*s!BA53+s!AU53*s!AZ53+s!AV53*s!AY53+s!AW53*s!AX53)) -> 244.65839693133313 | AU54: =AD54+IF(s!AU53*s!AV53+s!AT53*s!AW53=0,0,E54*s!AU53*s!AV53/(s!AU53*s!AV53+s!AT53*s!AW53))+IF(s!AT53*s!AY53+s!AU53*s!AX53=0,0,K54*s!AU53*s!AX53/(s!AT53*s!AY53+s!AU53*s!AX53))+IF(s!AU53*s!BA53+s!AW53*s!AY53=0,0,O54*s!AU53*s!BA53/(s!AU53*s!BA53+s!AW53*s!AY53))+IF(s!AT53*s!BA53+s!AU53*s!AZ53+s!AV53*s!AY53+s!AW53*s!AX53=0,0,N54*s!AU53*s!AZ53/(s!AT53*s!BA53+s!AU53*s!AZ53+s!AV53*s!AY53+s!AW53*s!AX53)) -> 445.7736205585071 | AV54: =AE54+IF(s!AU53*s!AV53+s!AT53*s!AW53=0,0,E54*s!AU53*s!AV53/(s!AU53*s!AV53+s!AT53*s!AW53))+IF(s!AV53*s!AX53+s!AT53*s!AZ53=0,0,M54*s!AV53*s!AX53/(s!AV53*s!AX53+s!AT53*s!AZ53))+IF(s!AV53*s!BA53+s!AW53*s!AZ53=0,0,Q54*s!AV53*s!BA53/(s!AV53*s!BA53+s!AW53*s!AZ53))+IF(s!AT53*s!BA53+s!AU53*s!AZ53+s!AV53*s!AY53+s!AW53*s!AX53=0,0,N54*s!AV53*s!AY53/(s!AT53*s!BA53+s!AU53*s!AZ53+s!AV53*s!AY53+s!AW53*s!AX53)) -> 13.961446980692259 | AW54: =AF54+IF(s!AT53*s!AW53+s!AU53*s!AV53=0,0,E54*s!AT53*s!AW53/(s!AT53*s!AW53+s!AU53*s!AV53))+IF(s!AU53*s!BA53+s!AW53*s!AY53=0,0,O54*s!AW53*s!AY53/(s!AU53*s!BA53+s!AW53*s!AY53))+IF(s!AV53*s!BA53+s!AW53*s!AZ53=0,0,Q54*s!AW53*s!AZ53/(s!AV53*s!BA53+s!AW53*s!AZ53))+IF(s!AT53*s!BA53+s!AU53*s!AZ53+s!AV53*s!AY53+s!AW53*s!AX53=0,0,N54*s!AW53*s!AX53/(s!AT53*s!BA53+s!AU53*s!AZ53+s!AV53*s!AY53+s!AW53*s!AX53)) -> 9.6065355294675658 | AX54: =AG54+IF(s!AT53*s!AY53+s!AU53*s!AX53=0,0,K54*s!AU53*s!AX53/(s!AT53*s!AY53+s!AU53*s!AX53))+IF(s!AV53*s!AX53+s!AT53*s!AZ53=0,0,M54*s!AV53*s!AX53/(s!AV53*s!AX53+s!AT53*s!AZ53))+IF(s!AX53*s!BA53+s!AY53*s!AZ53=0,0,W54*s!AX53*s!BA53/(s!AX53*s!BA53+s!AY53*s!AZ53))+IF(s!AT53*s!BA53+s!AU53*s!AZ53+s!AV53*s!AY53+s!AW53*s!AX53=0,0,N54*s!AW53*s!AX53/(s!AT53*s!BA53+s!AU53*s!AZ53+s!AV53*s!AY53+s!AW53*s!AX53)) -> 13.990720077374343 | AY54: =AH54+IF(s!AT53*s!AY53+s!AU53*s!AX53=0,0,K54*s!AT53*s!AY53/(s!AT53*s!AY53+s!AU53*s!AX53))+IF(s!AU53*s!BA53+s!AW53*s!AY53=0,0,O54*s!AW53*s!AY53/(s!AU53*s!BA53+s!AW53*s!AY53))+IF(s!AX53*s!BA53+s!AY53*s!AZ53=0,0,W54*s!AY53*s!AZ53/(s!AX53*s!BA53+s!AY53*s!AZ53))+IF(s!AT53*s!BA53+s!AU53*s!AZ53+s!AV53*s!AY53+s!AW53*s!AX53=0,0,N54*s!AV53*s!AY53/(s!AT53*s!BA53+s!AU53*s!AZ53+s!AV53*s!AY53+s!AW53*s!AX53)) -> 10.577262432785481 | AZ54: =AI54+IF(s!AT53*s!AZ53+s!AV53*s!AX53=0,0,M54*s!AT53*s!AZ53/(s!AT53*s!AZ53+s!AV53*s!AX53))+IF(s!AV53*s!BA53+s!AW53*s!AZ53=0,0,Q54*s!AW53*s!AZ53/(s!AV53*s!BA53+s!AW53*s!AZ53))+IF(s!AX53*s!BA53+s!AY53*s!AZ53=0,0,W54*s!AY53*s!AZ53/(s!AX53*s!BA53+s!AY53*s!AZ53))+IF(s!AT53*s!BA53+s!AU53*s!AZ53+s!AV53*s!AY53+s!AW53*s!AX53=0,0,N54*s!AU53*s!AZ53/(s!AT53*s!BA53+s!AU53*s!AZ53+s!AV53*s!AY53+s!AW53*s!AX53)) -> 17.389436010600278 | BA54: =AJ54+IF(s!AU53*s!BA53+s!AW53*s!AY53=0,0,O54*s!AU53*s!BA53/(s!AU53*s!BA53+s!AW53*s!AY53))+IF(s!AV53*s!BA53+s!AW53*s!AZ53=0,0,Q54*s!AV53*s!BA53/(s!AV53*s!BA53+s!AW53*s!AZ53))+IF(s!AX53*s!BA53+s!AY53*s!AZ53=0,0,W54*s!AX53*s!BA53/(s!AX53*s!BA53+s!AY53*s!AZ53))+IF(s!AT53*s!BA53+s!AU53*s!AZ53+s!AV53*s!AY53+s!AW53*s!AX53=0,0,N54*s!AT53*s!BA53/(s!AT53*s!BA53+s!AU53*s!AZ53+s!AV53*s!AY53+s!AW53*s!AX53)) -> 22.0425814792399 | BJ54: =SUM(AT54:BA54) -> 778
A55: =A54 -> 100 | B55: =B54 -> 30 | C55: =C54 -> 200 | D55: =D54 -> 2 | E55: =E54 -> 4 | F55: =F54 -> 1 | G55: =G54 -> 1 | H55: =H54 -> 2 | I55: =I54 -> 1 | J55: =J54 -> 2 | K55: =K54 -> 4 | L55: =L54 -> 2 | M55: =M54 -> 4 | N55: =N54 -> 8 | O55: =O54 -> 4 | P55: =P54 -> 2 | Q55: =Q54 -> 4 | R55: =R54 -> 2 | S55: =S54 -> 1 | T55: =T54 -> 2 | U55: =U54 -> 1 | V55: =V54 -> 2 | W55: =W54 -> 4 | X55: =X54 -> 2 | Y55: =Y54 -> 1 | Z55: =Z54 -> 2 | AA55: =AA54 -> 1 | AB55: =AB54 -> 389 | AC55: =AC54 -> 234 | AD55: =AD54 -> 433 | AE55: =AE54 -> 8 | AF55: =AF54 -> 7 | AG55: =AG54 -> 8 | AH55: =AH54 -> 8 | AI55: =AI54 -> 8 | AJ55: =AJ54 -> 8 | AS55: =AS54 -> 714 | AT55: =AC55+IF(s!AT54*s!AW54+s!AU54*s!AV54=0,0,E55*s!AT54*s!AW54/(s!AT54*s!AW54+s!AU54*s!AV54))+IF(s!AT54*s!AY54+s!AU54*s!AX54=0,0,K55*s!AT54*s!AY54/(s!AT54*s!AY54+s!AU54*s!AX54))+IF(s!AT54*s!AZ54+s!AV54*s!AX54=0,0,M55*s!AT54*s!AZ54/(s!AT54*s!AZ54+s!AV54*s!AX54))+IF(s!AT54*s!BA54+s!AU54*s!AZ54+s!AV54*s!AY54+s!AW54*s!AX54=0,0,N55*s!AT54*s!BA54/(s!AT54*s!BA54+s!AU54*s!AZ54+s!AV54*s!AY54+s!AW54*s!AX54)) -> 244.65839693275953 | AU55: =AD55+IF(s!AU54*s!AV54+s!AT54*s!AW54=0,0,E55*s!AU54*s!AV54/(s!AU54*s!AV54+s!AT54*s!AW54))+IF(s!AT54*s!AY54+s!AU54*s!AX54=0,0,K55*s!AU54*s!AX54/(s!AT54*s!AY54+s!AU54*s!AX54))+IF(s!AU54*s!BA54+s!AW54*s!AY54=0,0,O55*s!AU54*s!BA54/(s!AU54*s!BA54+s!AW54*s!AY54))+IF(s!AT54*s!BA54+s!AU54*s!AZ54+s!AV54*s!AY54+s!AW54*s!AX54=0,0,N55*s!AU54*s!AZ54/(s!AT54*s!BA54+s!AU54*s!AZ54+s!AV54*s!AY54+s!AW54*s!AX54)) -> 445.77362055619528 | AV55: =AE55+IF(s!AU54*s!AV54+s!AT54*s!AW54=0,0,E55*s!AU54*s!AV54/(s!AU54*s!AV54+s!AT54*s!AW54))+IF(s!AV54*s!AX54+s!AT54*s!AZ54=0,0,M55*s!AV54*s!AX54/(s!AV54*s!AX54+s!AT54*s!AZ54))+IF(s!AV54*s!BA54+s!AW54*s!AZ54=0,0,Q55*s!AV54*s!BA54/(s!AV54*s!BA54+s!AW54*s!AZ54))+IF(s!AT54*s!BA54+s!AU54*s!AZ54+s!AV54*s!AY54+s!AW54*s!AX54=0,0,N55*s!AV54*s!AY54/(s!AT54*s!BA54+s!AU54*s!AZ54+s!AV54*s!AY54+s!AW54*s!AX54)) -> 13.961446993766216 | AW55: =AF55+IF(s!AT54*s!AW54+s!AU54*s!AV54=0,0,E55*s!AT54*s!AW54/(s!AT54*s!AW54+s!AU54*s!AV54))+IF(s!AU54*s!BA54+s!AW54*s!AY54=0,0,O55*s!AW54*s!AY54/(s!AU54*s!BA54+s!AW54*s!AY54))+IF(s!AV54*s!BA54+s!AW54*s!AZ54=0,0,Q55*s!AW54*s!AZ54/(s!AV54*s!BA54+s!AW54*s!AZ54))+IF(s!AT54*s!BA54+s!AU54*s!AZ54+s!AV54*s!AY54+s!AW54*s!AX54=0,0,N55*s!AW54*s!AX54/(s!AT54*s!BA54+s!AU54*s!AZ54+s!AV54*s!AY54+s!AW54*s!AX54)) -> 9.6065355172789477 | AX55: =AG55+IF(s!AT54*s!AY54+s!AU54*s!AX54=0,0,K55*s!AU54*s!AX54/(s!AT54*s!AY54+s!AU54*s!AX54))+IF(s!AV54*s!AX54+s!AT54*s!AZ54=0,0,M55*s!AV54*s!AX54/(s!AV54*s!AX54+s!AT54*s!AZ54))+IF(s!AX54*s!BA54+s!AY54*s!AZ54=0,0,W55*s!AX54*s!BA54/(s!AX54*s!BA54+s!AY54*s!AZ54))+IF(s!AT54*s!BA54+s!AU54*s!AZ54+s!AV54*s!AY54+s!AW54*s!AX54=0,0,N55*s!AW54*s!AX54/(s!AT54*s!BA54+s!AU54*s!AZ54+s!AV54*s!AY54+s!AW54*s!AX54)) -> 13.990720089223842 | AY55: =AH55+IF(s!AT54*s!AY54+s!AU54*s!AX54=0,0,K55*s!AT54*s!AY54/(s!AT54*s!AY54+s!AU54*s!AX54))+IF(s!AU54*s!BA54+s!AW54*s!AY54=0,0,O55*s!AW54*s!AY54/(s!AU54*s!BA54+s!AW54*s!AY54))+IF(s!AX54*s!BA54+s!AY54*s!AZ54=0,0,W55*s!AY54*s!AZ54/(s!AX54*s!BA54+s!AY54*s!AZ54))+IF(s!AT54*s!BA54+s!AU54*s!AZ54+s!AV54*s!AY54+s!AW54*s!AX54=0,0,N55*s!AV54*s!AY54/(s!AT54*s!BA54+s!AU54*s!AZ54+s!AV54*s!AY54+s!AW54*s!AX54)) -> 10.577262421821324 | AZ55: =AI55+IF(s!AT54*s!AZ54+s!AV54*s!AX54=0,0,M55*s!AT54*s!AZ54/(s!AT54*s!AZ54+s!AV54*s!AX54))+IF(s!AV54*s!BA54+s!AW54*s!AZ54=0,0,Q55*s!AW54*s!AZ54/(s!AV54*s!BA54+s!AW54*s!AZ54))+IF(s!AX54*s!BA54+s!AY54*s!AZ54=0,0,W55*s!AY54*s!AZ54/(s!AX54*s!BA54+s!AY54*s!AZ54))+IF(s!AT54*s!BA54+s!AU54*s!AZ54+s!AV54*s!AY54+s!AW54*s!AX54=0,0,N55*s!AU54*s!AZ54/(s!AT54*s!BA54+s!AU54*s!AZ54+s!AV54*s!AY54+s!AW54*s!AX54)) -> 17.389435984250404 | BA55: =AJ55+IF(s!AU54*s!BA54+s!AW54*s!AY54=0,0,O55*s!AU54*s!BA54/(s!AU54*s!BA54+s!AW54*s!AY54))+IF(s!AV54*s!BA54+s!AW54*s!AZ54=0,0,Q55*s!AV54*s!BA54/(s!AV54*s!BA54+s!AW54*s!AZ54))+IF(s!AX54*s!BA54+s!AY54*s!AZ54=0,0,W55*s!AX54*s!BA54/(s!AX54*s!BA54+s!AY54*s!AZ54))+IF(s!AT54*s!BA54+s!AU54*s!AZ54+s!AV54*s!AY54+s!AW54*s!AX54=0,0,N55*s!AT54*s!BA54/(s!AT54*s!BA54+s!AU54*s!AZ54+s!AV54*s!AY54+s!AW54*s!AX54)) -> 22.042581504704433 | BJ55: =SUM(AT55:BA55) -> 778
A56: =A55 -> 100 | B56: =B55 -> 30 | C56: =C55 -> 200 | D56: =D55 -> 2 | E56: =E55 -> 4 | F56: =F55 -> 1 | G56: =G55 -> 1 | H56: =H55 -> 2 | I56: =I55 -> 1 | J56: =J55 -> 2 | K56: =K55 -> 4 | L56: =L55 -> 2 | M56: =M55 -> 4 | N56: =N55 -> 8 | O56: =O55 -> 4 | P56: =P55 -> 2 | Q56: =Q55 -> 4 | R56: =R55 -> 2 | S56: =S55 -> 1 | T56: =T55 -> 2 | U56: =U55 -> 1 | V56: =V55 -> 2 | W56: =W55 -> 4 | X56: =X55 -> 2 | Y56: =Y55 -> 1 | Z56: =Z55 -> 2 | AA56: =AA55 -> 1 | AB56: =AB55 -> 389 | AC56: =AC55 -> 234 | AD56: =AD55 -> 433 | AE56: =AE55 -> 8 | AF56: =AF55 -> 7 | AG56: =AG55 -> 8 | AH56: =AH55 -> 8 | AI56: =AI55 -> 8 | AJ56: =AJ55 -> 8 | AS56: =AS55 -> 714 | AT56: =AC56+IF(s!AT55*s!AW55+s!AU55*s!AV55=0,0,E56*s!AT55*s!AW55/(s!AT55*s!AW55+s!AU55*s!AV55))+IF(s!AT55*s!AY55+s!AU55*s!AX55=0,0,K56*s!AT55*s!AY55/(s!AT55*s!AY55+s!AU55*s!AX55))+IF(s!AT55*s!AZ55+s!AV55*s!AX55=0,0,M56*s!AT55*s!AZ55/(s!AT55*s!AZ55+s!AV55*s!AX55))+IF(s!AT55*s!BA55+s!AU55*s!AZ55+s!AV55*s!AY55+s!AW55*s!AX55=0,0,N56*s!AT55*s!BA55/(s!AT55*s!BA55+s!AU55*s!AZ55+s!AV55*s!AY55+s!AW55*s!AX55)) -> 244.65839693377993 | AU56: =AD56+IF(s!AU55*s!AV55+s!AT55*s!AW55=0,0,E56*s!AU55*s!AV55/(s!AU55*s!AV55+s!AT55*s!AW55))+IF(s!AT55*s!AY55+s!AU55*s!AX55=0,0,K56*s!AU55*s!AX55/(s!AT55*s!AY55+s!AU55*s!AX55))+IF(s!AU55*s!BA55+s!AW55*s!AY55=0,0,O56*s!AU55*s!BA55/(s!AU55*s!BA55+s!AW55*s!AY55))+IF(s!AT55*s!BA55+s!AU55*s!AZ55+s!AV55*s!AY55+s!AW55*s!AX55=0,0,N56*s!AU55*s!AZ55/(s!AT55*s!BA55+s!AU55*s!AZ55+s!AV55*s!AY55+s!AW55*s!AX55)) -> 445.77362055454154 | AV56: =AE56+IF(s!AU55*s!AV55+s!AT55*s!AW55=0,0,E56*s!AU55*s!AV55/(s!AU55*s!AV55+s!AT55*s!AW55))+IF(s!AV55*s!AX55+s!AT55*s!AZ55=0,0,M56*s!AV55*s!AX55/(s!AV55*s!AX55+s!AT55*s!AZ55))+IF(s!AV55*s!BA55+s!AW55*s!AZ55=0,0,Q56*s!AV55*s!BA55/(s!AV55*s!BA55+s!AW55*s!AZ55))+IF(s!AT55*s!BA55+s!AU55*s!AZ55+s!AV55*s!AY55+s!AW55*s!AX55=0,0,N56*s!AV55*s!AY55/(s!AT55*s!BA55+s!AU55*s!AZ55+s!AV55*s!AY55+s!AW55*s!AX55)) -> 13.961447003118689 | AW56: =AF56+IF(s!AT55*s!AW55+s!AU55*s!AV55=0,0,E56*s!AT55*s!AW55/(s!AT55*s!AW55+s!AU55*s!AV55))+IF(s!AU55*s!BA55+s!AW55*s!AY55=0,0,O56*s!AW55*s!AY55/(s!AU55*s!BA55+s!AW55*s!AY55))+IF(s!AV55*s!BA55+s!AW55*s!AZ55=0,0,Q56*s!AW55*s!AZ55/(s!AV55*s!BA55+s!AW55*s!AZ55))+IF(s!AT55*s!BA55+s!AU55*s!AZ55+s!AV55*s!AY55+s!AW55*s!AX55=0,0,N56*s!AW55*s!AX55/(s!AT55*s!BA55+s!AU55*s!AZ55+s!AV55*s!AY55+s!AW55*s!AX55)) -> 9.606535508559876 | AX56: =AG56+IF(s!AT55*s!AY55+s!AU55*s!AX55=0,0,K56*s!AU55*s!AX55/(s!AT55*s!AY55+s!AU55*s!AX55))+IF(s!AV55*s!AX55+s!AT55*s!AZ55=0,0,M56*s!AV55*s!AX55/(s!AV55*s!AX55+s!AT55*s!AZ55))+IF(s!AX55*s!BA55+s!AY55*s!AZ55=0,0,W56*s!AX55*s!BA55/(s!AX55*s!BA55+s!AY55*s!AZ55))+IF(s!AT55*s!BA55+s!AU55*s!AZ55+s!AV55*s!AY55+s!AW55*s!AX55=0,0,N56*s!AW55*s!AX55/(s!AT55*s!BA55+s!AU55*s!AZ55+s!AV55*s!AY55+s!AW55*s!AX55)) -> 13.990720097700482 | AY56: =AH56+IF(s!AT55*s!AY55+s!AU55*s!AX55=0,0,K56*s!AT55*s!AY55/(s!AT55*s!AY55+s!AU55*s!AX55))+IF(s!AU55*s!BA55+s!AW55*s!AY55=0,0,O56*s!AW55*s!AY55/(s!AU55*s!BA55+s!AW55*s!AY55))+IF(s!AX55*s!BA55+s!AY55*s!AZ55=0,0,W56*s!AY55*s!AZ55/(s!AX55*s!BA55+s!AY55*s!AZ55))+IF(s!AT55*s!BA55+s!AU55*s!AZ55+s!AV55*s!AY55+s!AW55*s!AX55=0,0,N56*s!AV55*s!AY55/(s!AT55*s!BA55+s!AU55*s!AZ55+s!AV55*s!AY55+s!AW55*s!AX55)) -> 10.577262413978083 | AZ56: =AI56+IF(s!AT55*s!AZ55+s!AV55*s!AX55=0,0,M56*s!AT55*s!AZ55/(s!AT55*s!AZ55+s!AV55*s!AX55))+IF(s!AV55*s!BA55+s!AW55*s!AZ55=0,0,Q56*s!AW55*s!AZ55/(s!AV55*s!BA55+s!AW55*s!AZ55))+IF(s!AX55*s!BA55+s!AY55*s!AZ55=0,0,W56*s!AY55*s!AZ55/(s!AX55*s!BA55+s!AY55*s!AZ55))+IF(s!AT55*s!BA55+s!AU55*s!AZ55+s!AV55*s!AY55+s!AW55*s!AX55=0,0,N56*s!AU55*s!AZ55/(s!AT55*s!BA55+s!AU55*s!AZ55+s!AV55*s!AY55+s!AW55*s!AX55)) -> 17.389435965400921 | BA56: =AJ56+IF(s!AU55*s!BA55+s!AW55*s!AY55=0,0,O56*s!AU55*s!BA55/(s!AU55*s!BA55+s!AW55*s!AY55))+IF(s!AV55*s!BA55+s!AW55*s!AZ55=0,0,Q56*s!AV55*s!BA55/(s!AV55*s!BA55+s!AW55*s!AZ55))+IF(s!AX55*s!BA55+s!AY55*s!AZ55=0,0,W56*s!AX55*s!BA55/(s!AX55*s!BA55+s!AY55*s!AZ55))+IF(s!AT55*s!BA55+s!AU55*s!AZ55+s!AV55*s!AY55+s!AW55*s!AX55=0,0,N56*s!AT55*s!BA55/(s!AT55*s!BA55+s!AU55*s!AZ55+s!AV55*s!AY55+s!AW55*s!AX55)) -> 22.042581522920521 | BJ56: =SUM(AT56:BA56) -> 778
A57: =A56 -> 100 | B57: =B56 -> 30 | C57: =C56 -> 200 | D57: =D56 -> 2 | E57: =E56 -> 4 | F57: =F56 -> 1 | G57: =G56 -> 1 | H57: =H56 -> 2 | I57: =I56 -> 1 | J57: =J56 -> 2 | K57: =K56 -> 4 | L57: =L56 -> 2 | M57: =M56 -> 4 | N57: =N56 -> 8 | O57: =O56 -> 4 | P57: =P56 -> 2 | Q57: =Q56 -> 4 | R57: =R56 -> 2 | S57: =S56 -> 1 | T57: =T56 -> 2 | U57: =U56 -> 1 | V57: =V56 -> 2 | W57: =W56 -> 4 | X57: =X56 -> 2 | Y57: =Y56 -> 1 | Z57: =Z56 -> 2 | AA57: =AA56 -> 1 | AB57: =AB56 -> 389 | AC57: =AC56 -> 234 | AD57: =AD56 -> 433 | AE57: =AE56 -> 8 | AF57: =AF56 -> 7 | AG57: =AG56 -> 8 | AH57: =AH56 -> 8 | AI57: =AI56 -> 8 | AJ57: =AJ56 -> 8 | AS57: =AS56 -> 714 | AT57: =AC57+IF(s!AT56*s!AW56+s!AU56*s!AV56=0,0,E57*s!AT56*s!AW56/(s!AT56*s!AW56+s!AU56*s!AV56))+IF(s!AT56*s!AY56+s!AU56*s!AX56=0,0,K57*s!AT56*s!AY56/(s!AT56*s!AY56+s!AU56*s!AX56))+IF(s!AT56*s!AZ56+s!AV56*s!AX56=0,0,M57*s!AT56*s!AZ56/(s!AT56*s!AZ56+s!AV56*s!AX56))+IF(s!AT56*s!BA56+s!AU56*s!AZ56+s!AV56*s!AY56+s!AW56*s!AX56=0,0,N57*s!AT56*s!BA56/(s!AT56*s!BA56+s!AU56*s!AZ56+s!AV56*s!AY56+s!AW56*s!AX56)) -> 244.6583969345098 | AU57: =AD57+IF(s!AU56*s!AV56+s!AT56*s!AW56=0,0,E57*s!AU56*s!AV56/(s!AU56*s!AV56+s!AT56*s!AW56))+IF(s!AT56*s!AY56+s!AU56*s!AX56=0,0,K57*s!AU56*s!AX56/(s!AT56*s!AY56+s!AU56*s!AX56))+IF(s!AU56*s!BA56+s!AW56*s!AY56=0,0,O57*s!AU56*s!BA56/(s!AU56*s!BA56+s!AW56*s!AY56))+IF(s!AT56*s!BA56+s!AU56*s!AZ56+s!AV56*s!AY56+s!AW56*s!AX56=0,0,N57*s!AU56*s!AZ56/(s!AT56*s!BA56+s!AU56*s!AZ56+s!AV56*s!AY56+s!AW56*s!AX56)) -> 445.7736205533584 | AV57: =AE57+IF(s!AU56*s!AV56+s!AT56*s!AW56=0,0,E57*s!AU56*s!AV56/(s!AU56*s!AV56+s!AT56*s!AW56))+IF(s!AV56*s!AX56+s!AT56*s!AZ56=0,0,M57*s!AV56*s!AX56/(s!AV56*s!AX56+s!AT56*s!AZ56))+IF(s!AV56*s!BA56+s!AW56*s!AZ56=0,0,Q57*s!AV56*s!BA56/(s!AV56*s!BA56+s!AW56*s!AZ56))+IF(s!AT56*s!BA56+s!AU56*s!AZ56+s!AV56*s!AY56+s!AW56*s!AX56=0,0,N57*s!AV56*s!AY56/(s!AT56*s!BA56+s!AU56*s!AZ56+s!AV56*s!AY56+s!AW56*s!AX56)) -> 13.961447009809094 | AW57: =AF57+IF(s!AT56*s!AW56+s!AU56*s!AV56=0,0,E57*s!AT56*s!AW56/(s!AT56*s!AW56+s!AU56*s!AV56))+IF(s!AU56*s!BA56+s!AW56*s!AY56=0,0,O57*s!AW56*s!AY56/(s!AU56*s!BA56+s!AW56*s!AY56))+IF(s!AV56*s!BA56+s!AW56*s!AZ56=0,0,Q57*s!AW56*s!AZ56/(s!AV56*s!BA56+s!AW56*s!AZ56))+IF(s!AT56*s!BA56+s!AU56*s!AZ56+s!AV56*s!AY56+s!AW56*s!AX56=0,0,N57*s!AW56*s!AX56/(s!AT56*s!BA56+s!AU56*s!AZ56+s!AV56*s!AY56+s!AW56*s!AX56)) -> 9.6065355023226289 | AX57: =AG57+IF(s!AT56*s!AY56+s!AU56*s!AX56=0,0,K57*s!AU56*s!AX56/(s!AT56*s!AY56+s!AU56*s!AX56))+IF(s!AV56*s!AX56+s!AT56*s!AZ56=0,0,M57*s!AV56*s!AX56/(s!AV56*s!AX56+s!AT56*s!AZ56))+IF(s!AX56*s!BA56+s!AY56*s!AZ56=0,0,W57*s!AX56*s!BA56/(s!AX56*s!BA56+s!AY56*s!AZ56))+IF(s!AT56*s!BA56+s!AU56*s!AZ56+s!AV56*s!AY56+s!AW56*s!AX56=0,0,N57*s!AW56*s!AX56/(s!AT56*s!BA56+s!AU56*s!AZ56+s!AV56*s!AY56+s!AW56*s!AX56)) -> 13.990720103764405 | AY57: =AH57+IF(s!AT56*s!AY56+s!AU56*s!AX56=0,0,K57*s!AT56*s!AY56/(s!AT56*s!AY56+s!AU56*s!AX56))+IF(s!AU56*s!BA56+s!AW56*s!AY56=0,0,O57*s!AW56*s!AY56/(s!AU56*s!BA56+s!AW56*s!AY56))+IF(s!AX56*s!BA56+s!AY56*s!AZ56=0,0,W57*s!AY56*s!AZ56/(s!AX56*s!BA56+s!AY56*s!AZ56))+IF(s!AT56*s!BA56+s!AU56*s!AZ56+s!AV56*s!AY56+s!AW56*s!AX56=0,0,N57*s!AV56*s!AY56/(s!AT56*s!BA56+s!AU56*s!AZ56+s!AV56*s!AY56+s!AW56*s!AX56)) -> 10.577262408367318 | AZ57: =AI57+IF(s!AT56*s!AZ56+s!AV56*s!AX56=0,0,M57*s!AT56*s!AZ56/(s!AT56*s!AZ56+s!AV56*s!AX56))+IF(s!AV56*s!BA56+s!AW56*s!AZ56=0,0,Q57*s!AW56*s!AZ56/(s!AV56*s!BA56+s!AW56*s!AZ56))+IF(s!AX56*s!BA56+s!AY56*s!AZ56=0,0,W57*s!AY56*s!AZ56/(s!AX56*s!BA56+s!AY56*s!AZ56))+IF(s!AT56*s!BA56+s!AU56*s!AZ56+s!AV56*s!AY56+s!AW56*s!AX56=0,0,N57*s!AU56*s!AZ56/(s!AT56*s!BA56+s!AU56*s!AZ56+s!AV56*s!AY56+s!AW56*s!AX56)) -> 17.38943595191666 | BA57: =AJ57+IF(s!AU56*s!BA56+s!AW56*s!AY56=0,0,O57*s!AU56*s!BA56/(s!AU56*s!BA56+s!AW56*s!AY56))+IF(s!AV56*s!BA56+s!AW56*s!AZ56=0,0,Q57*s!AV56*s!BA56/(s!AV56*s!BA56+s!AW56*s!AZ56))+IF(s!AX56*s!BA56+s!AY56*s!AZ56=0,0,W57*s!AX56*s!BA56/(s!AX56*s!BA56+s!AY56*s!AZ56))+IF(s!AT56*s!BA56+s!AU56*s!AZ56+s!AV56*s!AY56+s!AW56*s!AX56=0,0,N57*s!AT56*s!BA56/(s!AT56*s!BA56+s!AU56*s!AZ56+s!AV56*s!AY56+s!AW56*s!AX56)) -> 22.042581535951619 | BJ57: =SUM(AT57:BA57) -> 778
A58: =A57 -> 100 | B58: =B57 -> 30 | C58: =C57 -> 200 | D58: =D57 -> 2 | E58: =E57 -> 4 | F58: =F57 -> 1 | G58: =G57 -> 1 | H58: =H57 -> 2 | I58: =I57 -> 1 | J58: =J57 -> 2 | K58: =K57 -> 4 | L58: =L57 -> 2 | M58: =M57 -> 4 | N58: =N57 -> 8 | O58: =O57 -> 4 | P58: =P57 -> 2 | Q58: =Q57 -> 4 | R58: =R57 -> 2 | S58: =S57 -> 1 | T58: =T57 -> 2 | U58: =U57 -> 1 | V58: =V57 -> 2 | W58: =W57 -> 4 | X58: =X57 -> 2 | Y58: =Y57 -> 1 | Z58: =Z57 -> 2 | AA58: =AA57 -> 1 | AB58: =AB57 -> 389 | AC58: =AC57 -> 234 | AD58: =AD57 -> 433 | AE58: =AE57 -> 8 | AF58: =AF57 -> 7 | AG58: =AG57 -> 8 | AH58: =AH57 -> 8 | AI58: =AI57 -> 8 | AJ58: =AJ57 -> 8 | AS58: =AS57 -> 714 | AT58: =AC58+IF(s!AT57*s!AW57+s!AU57*s!AV57=0,0,E58*s!AT57*s!AW57/(s!AT57*s!AW57+s!AU57*s!AV57))+IF(s!AT57*s!AY57+s!AU57*s!AX57=0,0,K58*s!AT57*s!AY57/(s!AT57*s!AY57+s!AU57*s!AX57))+IF(s!AT57*s!AZ57+s!AV57*s!AX57=0,0,M58*s!AT57*s!AZ57/(s!AT57*s!AZ57+s!AV57*s!AX57))+IF(s!AT57*s!BA57+s!AU57*s!AZ57+s!AV57*s!AY57+s!AW57*s!AX57=0,0,N58*s!AT57*s!BA57/(s!AT57*s!BA57+s!AU57*s!AZ57+s!AV57*s!AY57+s!AW57*s!AX57)) -> 244.65839693503202 | AU58: =AD58+IF(s!AU57*s!AV57+s!AT57*s!AW57=0,0,E58*s!AU57*s!AV57/(s!AU57*s!AV57+s!AT57*s!AW57))+IF(s!AT57*s!AY57+s!AU57*s!AX57=0,0,K58*s!AU57*s!AX57/(s!AT57*s!AY57+s!AU57*s!AX57))+IF(s!AU57*s!BA57+s!AW57*s!AY57=0,0,O58*s!AU57*s!BA57/(s!AU57*s!BA57+s!AW57*s!AY57))+IF(s!AT57*s!BA57+s!AU57*s!AZ57+s!AV57*s!AY57+s!AW57*s!AX57=0,0,N58*s!AU57*s!AZ57/(s!AT57*s!BA57+s!AU57*s!AZ57+s!AV57*s!AY57+s!AW57*s!AX57)) -> 445.77362055251206 | AV58: =AE58+IF(s!AU57*s!AV57+s!AT57*s!AW57=0,0,E58*s!AU57*s!AV57/(s!AU57*s!AV57+s!AT57*s!AW57))+IF(s!AV57*s!AX57+s!AT57*s!AZ57=0,0,M58*s!AV57*s!AX57/(s!AV57*s!AX57+s!AT57*s!AZ57))+IF(s!AV57*s!BA57+s!AW57*s!AZ57=0,0,Q58*s!AV57*s!BA57/(s!AV57*s!BA57+s!AW57*s!AZ57))+IF(s!AT57*s!BA57+s!AU57*s!AZ57+s!AV57*s!AY57+s!AW57*s!AX57=0,0,N58*s!AV57*s!AY57/(s!AT57*s!BA57+s!AU57*s!AZ57+s!AV57*s!AY57+s!AW57*s!AX57)) -> 13.961447014595228 | AW58: =AF58+IF(s!AT57*s!AW57+s!AU57*s!AV57=0,0,E58*s!AT57*s!AW57/(s!AT57*s!AW57+s!AU57*s!AV57))+IF(s!AU57*s!BA57+s!AW57*s!AY57=0,0,O58*s!AW57*s!AY57/(s!AU57*s!BA57+s!AW57*s!AY57))+IF(s!AV57*s!BA57+s!AW57*s!AZ57=0,0,Q58*s!AW57*s!AZ57/(s!AV57*s!BA57+s!AW57*s!AZ57))+IF(s!AT57*s!BA57+s!AU57*s!AZ57+s!AV57*s!AY57+s!AW57*s!AX57=0,0,N58*s!AW57*s!AX57/(s!AT57*s!BA57+s!AU57*s!AZ57+s!AV57*s!AY57+s!AW57*s!AX57)) -> 9.6065354978607012 | AX58: =AG58+IF(s!AT57*s!AY57+s!AU57*s!AX57=0,0,K58*s!AU57*s!AX57/(s!AT57*s!AY57+s!AU57*s!AX57))+IF(s!AV57*s!AX57+s!AT57*s!AZ57=0,0,M58*s!AV57*s!AX57/(s!AV57*s!AX57+s!AT57*s!AZ57))+IF(s!AX57*s!BA57+s!AY57*s!AZ57=0,0,W58*s!AX57*s!BA57/(s!AX57*s!BA57+s!AY57*s!AZ57))+IF(s!AT57*s!BA57+s!AU57*s!AZ57+s!AV57*s!AY57+s!AW57*s!AX57=0,0,N58*s!AW57*s!AX57/(s!AT57*s!BA57+s!AU57*s!AZ57+s!AV57*s!AY57+s!AW57*s!AX57)) -> 13.990720108102405 | AY58: =AH58+IF(s!AT57*s!AY57+s!AU57*s!AX57=0,0,K58*s!AT57*s!AY57/(s!AT57*s!AY57+s!AU57*s!AX57))+IF(s!AU57*s!BA57+s!AW57*s!AY57=0,0,O58*s!AW57*s!AY57/(s!AU57*s!BA57+s!AW57*s!AY57))+IF(s!AX57*s!BA57+s!AY57*s!AZ57=0,0,W58*s!AY57*s!AZ57/(s!AX57*s!BA57+s!AY57*s!AZ57))+IF(s!AT57*s!BA57+s!AU57*s!AZ57+s!AV57*s!AY57+s!AW57*s!AX57=0,0,N58*s!AV57*s!AY57/(s!AT57*s!BA57+s!AU57*s!AZ57+s!AV57*s!AY57+s!AW57*s!AX57)) -> 10.577262404353524 | AZ58: =AI58+IF(s!AT57*s!AZ57+s!AV57*s!AX57=0,0,M58*s!AT57*s!AZ57/(s!AT57*s!AZ57+s!AV57*s!AX57))+IF(s!AV57*s!BA57+s!AW57*s!AZ57=0,0,Q58*s!AW57*s!AZ57/(s!AV57*s!BA57+s!AW57*s!AZ57))+IF(s!AX57*s!BA57+s!AY57*s!AZ57=0,0,W58*s!AY57*s!AZ57/(s!AX57*s!BA57+s!AY57*s!AZ57))+IF(s!AT57*s!BA57+s!AU57*s!AZ57+s!AV57*s!AY57+s!AW57*s!AX57=0,0,N58*s!AU57*s!AZ57/(s!AT57*s!BA57+s!AU57*s!AZ57+s!AV57*s!AY57+s!AW57*s!AX57)) -> 17.389435942270367 | BA58: =AJ58+IF(s!AU57*s!BA57+s!AW57*s!AY57=0,0,O58*s!AU57*s!BA57/(s!AU57*s!BA57+s!AW57*s!AY57))+IF(s!AV57*s!BA57+s!AW57*s!AZ57=0,0,Q58*s!AV57*s!BA57/(s!AV57*s!BA57+s!AW57*s!AZ57))+IF(s!AX57*s!BA57+s!AY57*s!AZ57=0,0,W58*s!AX57*s!BA57/(s!AX57*s!BA57+s!AY57*s!AZ57))+IF(s!AT57*s!BA57+s!AU57*s!AZ57+s!AV57*s!AY57+s!AW57*s!AX57=0,0,N58*s!AT57*s!BA57/(s!AT57*s!BA57+s!AU57*s!AZ57+s!AV57*s!AY57+s!AW57*s!AX57)) -> 22.042581545273702 | BJ58: =SUM(AT58:BA58) -> 778
A59: =A58 -> 100 | B59: =B58 -> 30 | C59: =C58 -> 200 | D59: =D58 -> 2 | E59: =E58 -> 4 | F59: =F58 -> 1 | G59: =G58 -> 1 | H59: =H58 -> 2 | I59: =I58 -> 1 | J59: =J58 -> 2 | K59: =K58 -> 4 | L59: =L58 -> 2 | M59: =M58 -> 4 | N59: =N58 -> 8 | O59: =O58 -> 4 | P59: =P58 -> 2 | Q59: =Q58 -> 4 | R59: =R58 -> 2 | S59: =S58 -> 1 | T59: =T58 -> 2 | U59: =U58 -> 1 | V59: =V58 -> 2 | W59: =W58 -> 4 | X59: =X58 -> 2 | Y59: =Y58 -> 1 | Z59: =Z58 -> 2 | AA59: =AA58 -> 1 | AB59: =AB58 -> 389 | AC59: =AC58 -> 234 | AD59: =AD58 -> 433 | AE59: =AE58 -> 8 | AF59: =AF58 -> 7 | AG59: =AG58 -> 8 | AH59: =AH58 -> 8 | AI59: =AI58 -> 8 | AJ59: =AJ58 -> 8 | AS59: =AS58 -> 714 | AT59: =AC59+IF(s!AT58*s!AW58+s!AU58*s!AV58=0,0,E59*s!AT58*s!AW58/(s!AT58*s!AW58+s!AU58*s!AV58))+IF(s!AT58*s!AY58+s!AU58*s!AX58=0,0,K59*s!AT58*s!AY58/(s!AT58*s!AY58+s!AU58*s!AX58))+IF(s!AT58*s!AZ58+s!AV58*s!AX58=0,0,M59*s!AT58*s!AZ58/(s!AT58*s!AZ58+s!AV58*s!AX58))+IF(s!AT58*s!BA58+s!AU58*s!AZ58+s!AV58*s!AY58+s!AW58*s!AX58=0,0,N59*s!AT58*s!BA58/(s!AT58*s!BA58+s!AU58*s!AZ58+s!AV58*s!AY58+s!AW58*s!AX58)) -> 244.65839693540556 | AU59: =AD59+IF(s!AU58*s!AV58+s!AT58*s!AW58=0,0,E59*s!AU58*s!AV58/(s!AU58*s!AV58+s!AT58*s!AW58))+IF(s!AT58*s!AY58+s!AU58*s!AX58=0,0,K59*s!AU58*s!AX58/(s!AT58*s!AY58+s!AU58*s!AX58))+IF(s!AU58*s!BA58+s!AW58*s!AY58=0,0,O59*s!AU58*s!BA58/(s!AU58*s!BA58+s!AW58*s!AY58))+IF(s!AT58*s!BA58+s!AU58*s!AZ58+s!AV58*s!AY58+s!AW58*s!AX58=0,0,N59*s!AU58*s!AZ58/(s!AT58*s!BA58+s!AU58*s!AZ58+s!AV58*s!AY58+s!AW58*s!AX58)) -> 445.77362055190656 | AV59: =AE59+IF(s!AU58*s!AV58+s!AT58*s!AW58=0,0,E59*s!AU58*s!AV58/(s!AU58*s!AV58+s!AT58*s!AW58))+IF(s!AV58*s!AX58+s!AT58*s!AZ58=0,0,M59*s!AV58*s!AX58/(s!AV58*s!AX58+s!AT58*s!AZ58))+IF(s!AV58*s!BA58+s!AW58*s!AZ58=0,0,Q59*s!AV58*s!BA58/(s!AV58*s!BA58+s!AW58*s!AZ58))+IF(s!AT58*s!BA58+s!AU58*s!AZ58+s!AV58*s!AY58+s!AW58*s!AX58=0,0,N59*s!AV58*s!AY58/(s!AT58*s!BA58+s!AU58*s!AZ58+s!AV58*s!AY58+s!AW58*s!AX58)) -> 13.96144701801914 | AW59: =AF59+IF(s!AT58*s!AW58+s!AU58*s!AV58=0,0,E59*s!AT58*s!AW58/(s!AT58*s!AW58+s!AU58*s!AV58))+IF(s!AU58*s!BA58+s!AW58*s!AY58=0,0,O59*s!AW58*s!AY58/(s!AU58*s!BA58+s!AW58*s!AY58))+IF(s!AV58*s!BA58+s!AW58*s!AZ58=0,0,Q59*s!AW58*s!AZ58/(s!AV58*s!BA58+s!AW58*s!AZ58))+IF(s!AT58*s!BA58+s!AU58*s!AZ58+s!AV58*s!AY58+s!AW58*s!AX58=0,0,N59*s!AW58*s!AX58/(s!AT58*s!BA58+s!AU58*s!AZ58+s!AV58*s!AY58+s!AW58*s!AX58)) -> 9.6065354946687389 | AX59: =AG59+IF(s!AT58*s!AY58+s!AU58*s!AX58=0,0,K59*s!AU58*s!AX58/(s!AT58*s!AY58+s!AU58*s!AX58))+IF(s!AV58*s!AX58+s!AT58*s!AZ58=0,0,M59*s!AV58*s!AX58/(s!AV58*s!AX58+s!AT58*s!AZ58))+IF(s!AX58*s!BA58+s!AY58*s!AZ58=0,0,W59*s!AX58*s!BA58/(s!AX58*s!BA58+s!AY58*s!AZ58))+IF(s!AT58*s!BA58+s!AU58*s!AZ58+s!AV58*s!AY58+s!AW58*s!AX58=0,0,N59*s!AW58*s!AX58/(s!AT58*s!BA58+s!AU58*s!AZ58+s!AV58*s!AY58+s!AW58*s!AX58)) -> 13.990720111205748 | AY59: =AH59+IF(s!AT58*s!AY58+s!AU58*s!AX58=0,0,K59*s!AT58*s!AY58/(s!AT58*s!AY58+s!AU58*s!AX58))+IF(s!AU58*s!BA58+s!AW58*s!AY58=0,0,O59*s!AW58*s!AY58/(s!AU58*s!BA58+s!AW58*s!AY58))+IF(s!AX58*s!BA58+s!AY58*s!AZ58=0,0,W59*s!AY58*s!AZ58/(s!AX58*s!BA58+s!AY58*s!AZ58))+IF(s!AT58*s!BA58+s!AU58*s!AZ58+s!AV58*s!AY58+s!AW58*s!AX58=0,0,N59*s!AV58*s!AY58/(s!AT58*s!BA58+s!AU58*s!AZ58+s!AV58*s!AY58+s!AW58*s!AX58)) -> 10.577262401482129 | AZ59: =AI59+IF(s!AT58*s!AZ58+s!AV58*s!AX58=0,0,M59*s!AT58*s!AZ58/(s!AT58*s!AZ58+s!AV58*s!AX58))+IF(s!AV58*s!BA58+s!AW58*s!AZ58=0,0,Q59*s!AW58*s!AZ58/(s!AV58*s!BA58+s!AW58*s!AZ58))+IF(s!AX58*s!BA58+s!AY58*s!AZ58=0,0,W59*s!AY58*s!AZ58/(s!AX58*s!BA58+s!AY58*s!AZ58))+IF(s!AT58*s!BA58+s!AU58*s!AZ58+s!AV58*s!AY58+s!AW58*s!AX58=0,0,N59*s!AU58*s!AZ58/(s!AT58*s!BA58+s!AU58*s!AZ58+s!AV58*s!AY58+s!AW58*s!AX58)) -> 17.389435935369576 | BA59: =AJ59+IF(s!AU58*s!BA58+s!AW58*s!AY58=0,0,O59*s!AU58*s!BA58/(s!AU58*s!BA58+s!AW58*s!AY58))+IF(s!AV58*s!BA58+s!AW58*s!AZ58=0,0,Q59*s!AV58*s!BA58/(s!AV58*s!BA58+s!AW58*s!AZ58))+IF(s!AX58*s!BA58+s!AY58*s!AZ58=0,0,W59*s!AX58*s!BA58/(s!AX58*s!BA58+s!AY58*s!AZ58))+IF(s!AT58*s!BA58+s!AU58*s!AZ58+s!AV58*s!AY58+s!AW58*s!AX58=0,0,N59*s!AT58*s!BA58/(s!AT58*s!BA58+s!AU58*s!AZ58+s!AV58*s!AY58+s!AW58*s!AX58)) -> 22.042581551942543 | BJ59: =SUM(AT59:BA59) -> 778
A60: =A59 -> 100 | B60: =B59 -> 30 | C60: =C59 -> 200 | D60: =D59 -> 2 | E60: =E59 -> 4 | F60: =F59 -> 1 | G60: =G59 -> 1 | H60: =H59 -> 2 | I60: =I59 -> 1 | J60: =J59 -> 2 | K60: =K59 -> 4 | L60: =L59 -> 2 | M60: =M59 -> 4 | N60: =N59 -> 8 | O60: =O59 -> 4 | P60: =P59 -> 2 | Q60: =Q59 -> 4 | R60: =R59 -> 2 | S60: =S59 -> 1 | T60: =T59 -> 2 | U60: =U59 -> 1 | V60: =V59 -> 2 | W60: =W59 -> 4 | X60: =X59 -> 2 | Y60: =Y59 -> 1 | Z60: =Z59 -> 2 | AA60: =AA59 -> 1 | AB60: =AB59 -> 389 | AC60: =AC59 -> 234 | AD60: =AD59 -> 433 | AE60: =AE59 -> 8 | AF60: =AF59 -> 7 | AG60: =AG59 -> 8 | AH60: =AH59 -> 8 | AI60: =AI59 -> 8 | AJ60: =AJ59 -> 8 | AS60: =AS59 -> 714 | AT60: =AC60+IF(s!AT59*s!AW59+s!AU59*s!AV59=0,0,E60*s!AT59*s!AW59/(s!AT59*s!AW59+s!AU59*s!AV59))+IF(s!AT59*s!AY59+s!AU59*s!AX59=0,0,K60*s!AT59*s!AY59/(s!AT59*s!AY59+s!AU59*s!AX59))+IF(s!AT59*s!AZ59+s!AV59*s!AX59=0,0,M60*s!AT59*s!AZ59/(s!AT59*s!AZ59+s!AV59*s!AX59))+IF(s!AT59*s!BA59+s!AU59*s!AZ59+s!AV59*s!AY59+s!AW59*s!AX59=0,0,N60*s!AT59*s!BA59/(s!AT59*s!BA59+s!AU59*s!AZ59+s!AV59*s!AY59+s!AW59*s!AX59)) -> 244.65839693567276 | AU60: =AD60+IF(s!AU59*s!AV59+s!AT59*s!AW59=0,0,E60*s!AU59*s!AV59/(s!AU59*s!AV59+s!AT59*s!AW59))+IF(s!AT59*s!AY59+s!AU59*s!AX59=0,0,K60*s!AU59*s!AX59/(s!AT59*s!AY59+s!AU59*s!AX59))+IF(s!AU59*s!BA59+s!AW59*s!AY59=0,0,O60*s!AU59*s!BA59/(s!AU59*s!BA59+s!AW59*s!AY59))+IF(s!AT59*s!BA59+s!AU59*s!AZ59+s!AV59*s!AY59+s!AW59*s!AX59=0,0,N60*s!AU59*s!AZ59/(s!AT59*s!BA59+s!AU59*s!AZ59+s!AV59*s!AY59+s!AW59*s!AX59)) -> 445.77362055147347 | AV60: =AE60+IF(s!AU59*s!AV59+s!AT59*s!AW59=0,0,E60*s!AU59*s!AV59/(s!AU59*s!AV59+s!AT59*s!AW59))+IF(s!AV59*s!AX59+s!AT59*s!AZ59=0,0,M60*s!AV59*s!AX59/(s!AV59*s!AX59+s!AT59*s!AZ59))+IF(s!AV59*s!BA59+s!AW59*s!AZ59=0,0,Q60*s!AV59*s!BA59/(s!AV59*s!BA59+s!AW59*s!AZ59))+IF(s!AT59*s!BA59+s!AU59*s!AZ59+s!AV59*s!AY59+s!AW59*s!AX59=0,0,N60*s!AV59*s!AY59/(s!AT59*s!BA59+s!AU59*s!AZ59+s!AV59*s!AY59+s!AW59*s!AX59)) -> 13.961447020468567 | AW60: =AF60+IF(s!AT59*s!AW59+s!AU59*s!AV59=0,0,E60*s!AT59*s!AW59/(s!AT59*s!AW59+s!AU59*s!AV59))+IF(s!AU59*s!BA59+s!AW59*s!AY59=0,0,O60*s!AW59*s!AY59/(s!AU59*s!BA59+s!AW59*s!AY59))+IF(s!AV59*s!BA59+s!AW59*s!AZ59=0,0,Q60*s!AW59*s!AZ59/(s!AV59*s!BA59+s!AW59*s!AZ59))+IF(s!AT59*s!BA59+s!AU59*s!AZ59+s!AV59*s!AY59+s!AW59*s!AX59=0,0,N60*s!AW59*s!AX59/(s!AT59*s!BA59+s!AU59*s!AZ59+s!AV59*s!AY59+s!AW59*s!AX59)) -> 9.6065354923852571 | AX60: =AG60+IF(s!AT59*s!AY59+s!AU59*s!AX59=0,0,K60*s!AU59*s!AX59/(s!AT59*s!AY59+s!AU59*s!AX59))+IF(s!AV59*s!AX59+s!AT59*s!AZ59=0,0,M60*s!AV59*s!AX59/(s!AV59*s!AX59+s!AT59*s!AZ59))+IF(s!AX59*s!BA59+s!AY59*s!AZ59=0,0,W60*s!AX59*s!BA59/(s!AX59*s!BA59+s!AY59*s!AZ59))+IF(s!AT59*s!BA59+s!AU59*s!AZ59+s!AV59*s!AY59+s!AW59*s!AX59=0,0,N60*s!AW59*s!AX59/(s!AT59*s!BA59+s!AU59*s!AZ59+s!AV59*s!AY59+s!AW59*s!AX59)) -> 13.990720113425859 | AY60: =AH60+IF(s!AT59*s!AY59+s!AU59*s!AX59=0,0,K60*s!AT59*s!AY59/(s!AT59*s!AY59+s!AU59*s!AX59))+IF(s!AU59*s!BA59+s!AW59*s!AY59=0,0,O60*s!AW59*s!AY59/(s!AU59*s!BA59+s!AW59*s!AY59))+IF(s!AX59*s!BA59+s!AY59*s!AZ59=0,0,W60*s!AY59*s!AZ59/(s!AX59*s!BA59+s!AY59*s!AZ59))+IF(s!AT59*s!BA59+s!AU59*s!AZ59+s!AV59*s!AY59+s!AW59*s!AX59=0,0,N60*s!AV59*s!AY59/(s!AT59*s!BA59+s!AU59*s!AZ59+s!AV59*s!AY59+s!AW59*s!AX59)) -> 10.577262399427966 | AZ60: =AI60+IF(s!AT59*s!AZ59+s!AV59*s!AX59=0,0,M60*s!AT59*s!AZ59/(s!AT59*s!AZ59+s!AV59*s!AX59))+IF(s!AV59*s!BA59+s!AW59*s!AZ59=0,0,Q60*s!AW59*s!AZ59/(s!AV59*s!BA59+s!AW59*s!AZ59))+IF(s!AX59*s!BA59+s!AY59*s!AZ59=0,0,W60*s!AY59*s!AZ59/(s!AX59*s!BA59+s!AY59*s!AZ59))+IF(s!AT59*s!BA59+s!AU59*s!AZ59+s!AV59*s!AY59+s!AW59*s!AX59=0,0,N60*s!AU59*s!AZ59/(s!AT59*s!BA59+s!AU59*s!AZ59+s!AV59*s!AY59+s!AW59*s!AX59)) -> 17.389435930432821 | BA60: =AJ60+IF(s!AU59*s!BA59+s!AW59*s!AY59=0,0,O60*s!AU59*s!BA59/(s!AU59*s!BA59+s!AW59*s!AY59))+IF(s!AV59*s!BA59+s!AW59*s!AZ59=0,0,Q60*s!AV59*s!BA59/(s!AV59*s!BA59+s!AW59*s!AZ59))+IF(s!AX59*s!BA59+s!AY59*s!AZ59=0,0,W60*s!AX59*s!BA59/(s!AX59*s!BA59+s!AY59*s!AZ59))+IF(s!AT59*s!BA59+s!AU59*s!AZ59+s!AV59*s!AY59+s!AW59*s!AX59=0,0,N60*s!AT59*s!BA59/(s!AT59*s!BA59+s!AU59*s!AZ59+s!AV59*s!AY59+s!AW59*s!AX59)) -> 22.042581556713358 | BJ60: =SUM(AT60:BA60) -> 778
A61: =A60 -> 100 | B61: =B60 -> 30 | C61: =C60 -> 200 | D61: =D60 -> 2 | E61: =E60 -> 4 | F61: =F60 -> 1 | G61: =G60 -> 1 | H61: =H60 -> 2 | I61: =I60 -> 1 | J61: =J60 -> 2 | K61: =K60 -> 4 | L61: =L60 -> 2 | M61: =M60 -> 4 | N61: =N60 -> 8 | O61: =O60 -> 4 | P61: =P60 -> 2 | Q61: =Q60 -> 4 | R61: =R60 -> 2 | S61: =S60 -> 1 | T61: =T60 -> 2 | U61: =U60 -> 1 | V61: =V60 -> 2 | W61: =W60 -> 4 | X61: =X60 -> 2 | Y61: =Y60 -> 1 | Z61: =Z60 -> 2 | AA61: =AA60 -> 1 | AB61: =AB60 -> 389 | AC61: =AC60 -> 234 | AD61: =AD60 -> 433 | AE61: =AE60 -> 8 | AF61: =AF60 -> 7 | AG61: =AG60 -> 8 | AH61: =AH60 -> 8 | AI61: =AI60 -> 8 | AJ61: =AJ60 -> 8 | AS61: =AS60 -> 714 | AT61: =AC61+IF(s!AT60*s!AW60+s!AU60*s!AV60=0,0,E61*s!AT60*s!AW60/(s!AT60*s!AW60+s!AU60*s!AV60))+IF(s!AT60*s!AY60+s!AU60*s!AX60=0,0,K61*s!AT60*s!AY60/(s!AT60*s!AY60+s!AU60*s!AX60))+IF(s!AT60*s!AZ60+s!AV60*s!AX60=0,0,M61*s!AT60*s!AZ60/(s!AT60*s!AZ60+s!AV60*s!AX60))+IF(s!AT60*s!BA60+s!AU60*s!AZ60+s!AV60*s!AY60+s!AW60*s!AX60=0,0,N61*s!AT60*s!BA60/(s!AT60*s!BA60+s!AU60*s!AZ60+s!AV60*s!AY60+s!AW60*s!AX60)) -> 244.65839693586395 | AU61: =AD61+IF(s!AU60*s!AV60+s!AT60*s!AW60=0,0,E61*s!AU60*s!AV60/(s!AU60*s!AV60+s!AT60*s!AW60))+IF(s!AT60*s!AY60+s!AU60*s!AX60=0,0,K61*s!AU60*s!AX60/(s!AT60*s!AY60+s!AU60*s!AX60))+IF(s!AU60*s!BA60+s!AW60*s!AY60=0,0,O61*s!AU60*s!BA60/(s!AU60*s!BA60+s!AW60*s!AY60))+IF(s!AT60*s!BA60+s!AU60*s!AZ60+s!AV60*s!AY60+s!AW60*s!AX60=0,0,N61*s!AU60*s!AZ60/(s!AT60*s!BA60+s!AU60*s!AZ60+s!AV60*s!AY60+s!AW60*s!AX60)) -> 445.7736205511635 | AV61: =AE61+IF(s!AU60*s!AV60+s!AT60*s!AW60=0,0,E61*s!AU60*s!AV60/(s!AU60*s!AV60+s!AT60*s!AW60))+IF(s!AV60*s!AX60+s!AT60*s!AZ60=0,0,M61*s!AV60*s!AX60/(s!AV60*s!AX60+s!AT60*s!AZ60))+IF(s!AV60*s!BA60+s!AW60*s!AZ60=0,0,Q61*s!AV60*s!BA60/(s!AV60*s!BA60+s!AW60*s!AZ60))+IF(s!AT60*s!BA60+s!AU60*s!AZ60+s!AV60*s!AY60+s!AW60*s!AX60=0,0,N61*s!AV60*s!AY60/(s!AT60*s!BA60+s!AU60*s!AZ60+s!AV60*s!AY60+s!AW60*s!AX60)) -> 13.961447022220877 | AW61: =AF61+IF(s!AT60*s!AW60+s!AU60*s!AV60=0,0,E61*s!AT60*s!AW60/(s!AT60*s!AW60+s!AU60*s!AV60))+IF(s!AU60*s!BA60+s!AW60*s!AY60=0,0,O61*s!AW60*s!AY60/(s!AU60*s!BA60+s!AW60*s!AY60))+IF(s!AV60*s!BA60+s!AW60*s!AZ60=0,0,Q61*s!AW60*s!AZ60/(s!AV60*s!BA60+s!AW60*s!AZ60))+IF(s!AT60*s!BA60+s!AU60*s!AZ60+s!AV60*s!AY60+s!AW60*s!AX60=0,0,N61*s!AW60*s!AX60/(s!AT60*s!BA60+s!AU60*s!AZ60+s!AV60*s!AY60+s!AW60*s!AX60)) -> 9.6065354907516731 | AX61: =AG61+IF(s!AT60*s!AY60+s!AU60*s!AX60=0,0,K61*s!AU60*s!AX60/(s!AT60*s!AY60+s!AU60*s!AX60))+IF(s!AV60*s!AX60+s!AT60*s!AZ60=0,0,M61*s!AV60*s!AX60/(s!AV60*s!AX60+s!AT60*s!AZ60))+IF(s!AX60*s!BA60+s!AY60*s!AZ60=0,0,W61*s!AX60*s!BA60/(s!AX60*s!BA60+s!AY60*s!AZ60))+IF(s!AT60*s!BA60+s!AU60*s!AZ60+s!AV60*s!AY60+s!AW60*s!AX60=0,0,N61*s!AW60*s!AX60/(s!AT60*s!BA60+s!AU60*s!AZ60+s!AV60*s!AY60+s!AW60*s!AX60)) -> 13.990720115014122 | AY61: =AH61+IF(s!AT60*s!AY60+s!AU60*s!AX60=0,0,K61*s!AT60*s!AY60/(s!AT60*s!AY60+s!AU60*s!AX60))+IF(s!AU60*s!BA60+s!AW60*s!AY60=0,0,O61*s!AW60*s!AY60/(s!AU60*s!BA60+s!AW60*s!AY60))+IF(s!AX60*s!BA60+s!AY60*s!AZ60=0,0,W61*s!AY60*s!AZ60/(s!AX60*s!BA60+s!AY60*s!AZ60))+IF(s!AT60*s!BA60+s!AU60*s!AZ60+s!AV60*s!AY60+s!AW60*s!AX60=0,0,N61*s!AV60*s!AY60/(s!AT60*s!BA60+s!AU60*s!AZ60+s!AV60*s!AY60+s!AW60*s!AX60)) -> 10.577262397958426 | AZ61: =AI61+IF(s!AT60*s!AZ60+s!AV60*s!AX60=0,0,M61*s!AT60*s!AZ60/(s!AT60*s!AZ60+s!AV60*s!AX60))+IF(s!AV60*s!BA60+s!AW60*s!AZ60=0,0,Q61*s!AW60*s!AZ60/(s!AV60*s!BA60+s!AW60*s!AZ60))+IF(s!AX60*s!BA60+s!AY60*s!AZ60=0,0,W61*s!AY60*s!AZ60/(s!AX60*s!BA60+s!AY60*s!AZ60))+IF(s!AT60*s!BA60+s!AU60*s!AZ60+s!AV60*s!AY60+s!AW60*s!AX60=0,0,N61*s!AU60*s!AZ60/(s!AT60*s!BA60+s!AU60*s!AZ60+s!AV60*s!AY60+s!AW60*s!AX60)) -> 17.389435926901083 | BA61: =AJ61+IF(s!AU60*s!BA60+s!AW60*s!AY60=0,0,O61*s!AU60*s!BA60/(s!AU60*s!BA60+s!AW60*s!AY60))+IF(s!AV60*s!BA60+s!AW60*s!AZ60=0,0,Q61*s!AV60*s!BA60/(s!AV60*s!BA60+s!AW60*s!AZ60))+IF(s!AX60*s!BA60+s!AY60*s!AZ60=0,0,W61*s!AX60*s!BA60/(s!AX60*s!BA60+s!AY60*s!AZ60))+IF(s!AT60*s!BA60+s!AU60*s!AZ60+s!AV60*s!AY60+s!AW60*s!AX60=0,0,N61*s!AT60*s!BA60/(s!AT60*s!BA60+s!AU60*s!AZ60+s!AV60*s!AY60+s!AW60*s!AX60)) -> 22.042581560126369 | BJ61: =SUM(AT61:BA61) -> 778
A62: =A61 -> 100 | B62: =B61 -> 30 | C62: =C61 -> 200 | D62: =D61 -> 2 | E62: =E61 -> 4 | F62: =F61 -> 1 | G62: =G61 -> 1 | H62: =H61 -> 2 | I62: =I61 -> 1 | J62: =J61 -> 2 | K62: =K61 -> 4 | L62: =L61 -> 2 | M62: =M61 -> 4 | N62: =N61 -> 8 | O62: =O61 -> 4 | P62: =P61 -> 2 | Q62: =Q61 -> 4 | R62: =R61 -> 2 | S62: =S61 -> 1 | T62: =T61 -> 2 | U62: =U61 -> 1 | V62: =V61 -> 2 | W62: =W61 -> 4 | X62: =X61 -> 2 | Y62: =Y61 -> 1 | Z62: =Z61 -> 2 | AA62: =AA61 -> 1 | AB62: =AB61 -> 389 | AC62: =AC61 -> 234 | AD62: =AD61 -> 433 | AE62: =AE61 -> 8 | AF62: =AF61 -> 7 | AG62: =AG61 -> 8 | AH62: =AH61 -> 8 | AI62: =AI61 -> 8 | AJ62: =AJ61 -> 8 | AS62: =AS61 -> 714 | AT62: =AC62+IF(s!AT61*s!AW61+s!AU61*s!AV61=0,0,E62*s!AT61*s!AW61/(s!AT61*s!AW61+s!AU61*s!AV61))+IF(s!AT61*s!AY61+s!AU61*s!AX61=0,0,K62*s!AT61*s!AY61/(s!AT61*s!AY61+s!AU61*s!AX61))+IF(s!AT61*s!AZ61+s!AV61*s!AX61=0,0,M62*s!AT61*s!AZ61/(s!AT61*s!AZ61+s!AV61*s!AX61))+IF(s!AT61*s!BA61+s!AU61*s!AZ61+s!AV61*s!AY61+s!AW61*s!AX61=0,0,N62*s!AT61*s!BA61/(s!AT61*s!BA61+s!AU61*s!AZ61+s!AV61*s!AY61+s!AW61*s!AX61)) -> 244.65839693600068 | AU62: =AD62+IF(s!AU61*s!AV61+s!AT61*s!AW61=0,0,E62*s!AU61*s!AV61/(s!AU61*s!AV61+s!AT61*s!AW61))+IF(s!AT61*s!AY61+s!AU61*s!AX61=0,0,K62*s!AU61*s!AX61/(s!AT61*s!AY61+s!AU61*s!AX61))+IF(s!AU61*s!BA61+s!AW61*s!AY61=0,0,O62*s!AU61*s!BA61/(s!AU61*s!BA61+s!AW61*s!AY61))+IF(s!AT61*s!BA61+s!AU61*s!AZ61+s!AV61*s!AY61+s!AW61*s!AX61=0,0,N62*s!AU61*s!AZ61/(s!AT61*s!BA61+s!AU61*s!AZ61+s!AV61*s!AY61+s!AW61*s!AX61)) -> 445.77362055094181 | AV62: =AE62+IF(s!AU61*s!AV61+s!AT61*s!AW61=0,0,E62*s!AU61*s!AV61/(s!AU61*s!AV61+s!AT61*s!AW61))+IF(s!AV61*s!AX61+s!AT61*s!AZ61=0,0,M62*s!AV61*s!AX61/(s!AV61*s!AX61+s!AT61*s!AZ61))+IF(s!AV61*s!BA61+s!AW61*s!AZ61=0,0,Q62*s!AV61*s!BA61/(s!AV61*s!BA61+s!AW61*s!AZ61))+IF(s!AT61*s!BA61+s!AU61*s!AZ61+s!AV61*s!AY61+s!AW61*s!AX61=0,0,N62*s!AV61*s!AY61/(s!AT61*s!BA61+s!AU61*s!AZ61+s!AV61*s!AY61+s!AW61*s!AX61)) -> 13.961447023474479 | AW62: =AF62+IF(s!AT61*s!AW61+s!AU61*s!AV61=0,0,E62*s!AT61*s!AW61/(s!AT61*s!AW61+s!AU61*s!AV61))+IF(s!AU61*s!BA61+s!AW61*s!AY61=0,0,O62*s!AW61*s!AY61/(s!AU61*s!BA61+s!AW61*s!AY61))+IF(s!AV61*s!BA61+s!AW61*s!AZ61=0,0,Q62*s!AW61*s!AZ61/(s!AV61*s!BA61+s!AW61*s!AZ61))+IF(s!AT61*s!BA61+s!AU61*s!AZ61+s!AV61*s!AY61+s!AW61*s!AX61=0,0,N62*s!AW61*s!AX61/(s!AT61*s!BA61+s!AU61*s!AZ61+s!AV61*s!AY61+s!AW61*s!AX61)) -> 9.606535489583008 | AX62: =AG62+IF(s!AT61*s!AY61+s!AU61*s!AX61=0,0,K62*s!AU61*s!AX61/(s!AT61*s!AY61+s!AU61*s!AX61))+IF(s!AV61*s!AX61+s!AT61*s!AZ61=0,0,M62*s!AV61*s!AX61/(s!AV61*s!AX61+s!AT61*s!AZ61))+IF(s!AX61*s!BA61+s!AY61*s!AZ61=0,0,W62*s!AX61*s!BA61/(s!AX61*s!BA61+s!AY61*s!AZ61))+IF(s!AT61*s!BA61+s!AU61*s!AZ61+s!AV61*s!AY61+s!AW61*s!AX61=0,0,N62*s!AW61*s!AX61/(s!AT61*s!BA61+s!AU61*s!AZ61+s!AV61*s!AY61+s!AW61*s!AX61)) -> 13.990720116150374 | AY62: =AH62+IF(s!AT61*s!AY61+s!AU61*s!AX61=0,0,K62*s!AT61*s!AY61/(s!AT61*s!AY61+s!AU61*s!AX61))+IF(s!AU61*s!BA61+s!AW61*s!AY61=0,0,O62*s!AW61*s!AY61/(s!AU61*s!BA61+s!AW61*s!AY61))+IF(s!AX61*s!BA61+s!AY61*s!AZ61=0,0,W62*s!AY61*s!AZ61/(s!AX61*s!BA61+s!AY61*s!AZ61))+IF(s!AT61*s!BA61+s!AU61*s!AZ61+s!AV61*s!AY61+s!AW61*s!AX61=0,0,N62*s!AV61*s!AY61/(s!AT61*s!BA61+s!AU61*s!AZ61+s!AV61*s!AY61+s!AW61*s!AX61)) -> 10.577262396907113 | AZ62: =AI62+IF(s!AT61*s!AZ61+s!AV61*s!AX61=0,0,M62*s!AT61*s!AZ61/(s!AT61*s!AZ61+s!AV61*s!AX61))+IF(s!AV61*s!BA61+s!AW61*s!AZ61=0,0,Q62*s!AW61*s!AZ61/(s!AV61*s!BA61+s!AW61*s!AZ61))+IF(s!AX61*s!BA61+s!AY61*s!AZ61=0,0,W62*s!AY61*s!AZ61/(s!AX61*s!BA61+s!AY61*s!AZ61))+IF(s!AT61*s!BA61+s!AU61*s!AZ61+s!AV61*s!AY61+s!AW61*s!AX61=0,0,N62*s!AU61*s!AZ61/(s!AT61*s!BA61+s!AU61*s!AZ61+s!AV61*s!AY61+s!AW61*s!AX61)) -> 17.389435924374471 | BA62: =AJ62+IF(s!AU61*s!BA61+s!AW61*s!AY61=0,0,O62*s!AU61*s!BA61/(s!AU61*s!BA61+s!AW61*s!AY61))+IF(s!AV61*s!BA61+s!AW61*s!AZ61=0,0,Q62*s!AV61*s!BA61/(s!AV61*s!BA61+s!AW61*s!AZ61))+IF(s!AX61*s!BA61+s!AY61*s!AZ61=0,0,W62*s!AX61*s!BA61/(s!AX61*s!BA61+s!AY61*s!AZ61))+IF(s!AT61*s!BA61+s!AU61*s!AZ61+s!AV61*s!AY61+s!AW61*s!AX61=0,0,N62*s!AT61*s!BA61/(s!AT61*s!BA61+s!AU61*s!AZ61+s!AV61*s!AY61+s!AW61*s!AX61)) -> 22.042581562568042 | BJ62: =SUM(AT62:BA62) -> 778
A63: =A62 -> 100 | B63: =B62 -> 30 | C63: =C62 -> 200 | D63: =D62 -> 2 | E63: =E62 -> 4 | F63: =F62 -> 1 | G63: =G62 -> 1 | H63: =H62 -> 2 | I63: =I62 -> 1 | J63: =J62 -> 2 | K63: =K62 -> 4 | L63: =L62 -> 2 | M63: =M62 -> 4 | N63: =N62 -> 8 | O63: =O62 -> 4 | P63: =P62 -> 2 | Q63: =Q62 -> 4 | R63: =R62 -> 2 | S63: =S62 -> 1 | T63: =T62 -> 2 | U63: =U62 -> 1 | V63: =V62 -> 2 | W63: =W62 -> 4 | X63: =X62 -> 2 | Y63: =Y62 -> 1 | Z63: =Z62 -> 2 | AA63: =AA62 -> 1 | AB63: =AB62 -> 389 | AC63: =AC62 -> 234 | AD63: =AD62 -> 433 | AE63: =AE62 -> 8 | AF63: =AF62 -> 7 | AG63: =AG62 -> 8 | AH63: =AH62 -> 8 | AI63: =AI62 -> 8 | AJ63: =AJ62 -> 8 | AS63: =AS62 -> 714 | AT63: =AC63+IF(s!AT62*s!AW62+s!AU62*s!AV62=0,0,E63*s!AT62*s!AW62/(s!AT62*s!AW62+s!AU62*s!AV62))+IF(s!AT62*s!AY62+s!AU62*s!AX62=0,0,K63*s!AT62*s!AY62/(s!AT62*s!AY62+s!AU62*s!AX62))+IF(s!AT62*s!AZ62+s!AV62*s!AX62=0,0,M63*s!AT62*s!AZ62/(s!AT62*s!AZ62+s!AV62*s!AX62))+IF(s!AT62*s!BA62+s!AU62*s!AZ62+s!AV62*s!AY62+s!AW62*s!AX62=0,0,N63*s!AT62*s!BA62/(s!AT62*s!BA62+s!AU62*s!AZ62+s!AV62*s!AY62+s!AW62*s!AX62)) -> 244.65839693609851 | AU63: =AD63+IF(s!AU62*s!AV62+s!AT62*s!AW62=0,0,E63*s!AU62*s!AV62/(s!AU62*s!AV62+s!AT62*s!AW62))+IF(s!AT62*s!AY62+s!AU62*s!AX62=0,0,K63*s!AU62*s!AX62/(s!AT62*s!AY62+s!AU62*s!AX62))+IF(s!AU62*s!BA62+s!AW62*s!AY62=0,0,O63*s!AU62*s!BA62/(s!AU62*s!BA62+s!AW62*s!AY62))+IF(s!AT62*s!BA62+s!AU62*s!AZ62+s!AV62*s!AY62+s!AW62*s!AX62=0,0,N63*s!AU62*s!AZ62/(s!AT62*s!BA62+s!AU62*s!AZ62+s!AV62*s!AY62+s!AW62*s!AX62)) -> 445.77362055078322 | AV63: =AE63+IF(s!AU62*s!AV62+s!AT62*s!AW62=0,0,E63*s!AU62*s!AV62/(s!AU62*s!AV62+s!AT62*s!AW62))+IF(s!AV62*s!AX62+s!AT62*s!AZ62=0,0,M63*s!AV62*s!AX62/(s!AV62*s!AX62+s!AT62*s!AZ62))+IF(s!AV62*s!BA62+s!AW62*s!AZ62=0,0,Q63*s!AV62*s!BA62/(s!AV62*s!BA62+s!AW62*s!AZ62))+IF(s!AT62*s!BA62+s!AU62*s!AZ62+s!AV62*s!AY62+s!AW62*s!AX62=0,0,N63*s!AV62*s!AY62/(s!AT62*s!BA62+s!AU62*s!AZ62+s!AV62*s!AY62+s!AW62*s!AX62)) -> 13.961447024371315 | AW63: =AF63+IF(s!AT62*s!AW62+s!AU62*s!AV62=0,0,E63*s!AT62*s!AW62/(s!AT62*s!AW62+s!AU62*s!AV62))+IF(s!AU62*s!BA62+s!AW62*s!AY62=0,0,O63*s!AW62*s!AY62/(s!AU62*s!BA62+s!AW62*s!AY62))+IF(s!AV62*s!BA62+s!AW62*s!AZ62=0,0,Q63*s!AW62*s!AZ62/(s!AV62*s!BA62+s!AW62*s!AZ62))+IF(s!AT62*s!BA62+s!AU62*s!AZ62+s!AV62*s!AY62+s!AW62*s!AX62=0,0,N63*s!AW62*s!AX62/(s!AT62*s!BA62+s!AU62*s!AZ62+s!AV62*s!AY62+s!AW62*s!AX62)) -> 9.6065354887469407 | AX63: =AG63+IF(s!AT62*s!AY62+s!AU62*s!AX62=0,0,K63*s!AU62*s!AX62/(s!AT62*s!AY62+s!AU62*s!AX62))+IF(s!AV62*s!AX62+s!AT62*s!AZ62=0,0,M63*s!AV62*s!AX62/(s!AV62*s!AX62+s!AT62*s!AZ62))+IF(s!AX62*s!BA62+s!AY62*s!AZ62=0,0,W63*s!AX62*s!BA62/(s!AX62*s!BA62+s!AY62*s!AZ62))+IF(s!AT62*s!BA62+s!AU62*s!AZ62+s!AV62*s!AY62+s!AW62*s!AX62=0,0,N63*s!AW62*s!AX62/(s!AT62*s!BA62+s!AU62*s!AZ62+s!AV62*s!AY62+s!AW62*s!AX62)) -> 13.990720116963258 | AY63: =AH63+IF(s!AT62*s!AY62+s!AU62*s!AX62=0,0,K63*s!AT62*s!AY62/(s!AT62*s!AY62+s!AU62*s!AX62))+IF(s!AU62*s!BA62+s!AW62*s!AY62=0,0,O63*s!AW62*s!AY62/(s!AU62*s!BA62+s!AW62*s!AY62))+IF(s!AX62*s!BA62+s!AY62*s!AZ62=0,0,W63*s!AY62*s!AZ62/(s!AX62*s!BA62+s!AY62*s!AZ62))+IF(s!AT62*s!BA62+s!AU62*s!AZ62+s!AV62*s!AY62+s!AW62*s!AX62=0,0,N63*s!AV62*s!AY62/(s!AT62*s!BA62+s!AU62*s!AZ62+s!AV62*s!AY62+s!AW62*s!AX62)) -> 10.577262396155 | AZ63: =AI63+IF(s!AT62*s!AZ62+s!AV62*s!AX62=0,0,M63*s!AT62*s!AZ62/(s!AT62*s!AZ62+s!AV62*s!AX62))+IF(s!AV62*s!BA62+s!AW62*s!AZ62=0,0,Q63*s!AW62*s!AZ62/(s!AV62*s!BA62+s!AW62*s!AZ62))+IF(s!AX62*s!BA62+s!AY62*s!AZ62=0,0,W63*s!AY62*s!AZ62/(s!AX62*s!BA62+s!AY62*s!AZ62))+IF(s!AT62*s!BA62+s!AU62*s!AZ62+s!AV62*s!AY62+s!AW62*s!AX62=0,0,N63*s!AU62*s!AZ62/(s!AT62*s!BA62+s!AU62*s!AZ62+s!AV62*s!AY62+s!AW62*s!AX62)) -> 17.389435922566918 | BA63: =AJ63+IF(s!AU62*s!BA62+s!AW62*s!AY62=0,0,O63*s!AU62*s!BA62/(s!AU62*s!BA62+s!AW62*s!AY62))+IF(s!AV62*s!BA62+s!AW62*s!AZ62=0,0,Q63*s!AV62*s!BA62/(s!AV62*s!BA62+s!AW62*s!AZ62))+IF(s!AX62*s!BA62+s!AY62*s!AZ62=0,0,W63*s!AX62*s!BA62/(s!AX62*s!BA62+s!AY62*s!AZ62))+IF(s!AT62*s!BA62+s!AU62*s!AZ62+s!AV62*s!AY62+s!AW62*s!AX62=0,0,N63*s!AT62*s!BA62/(s!AT62*s!BA62+s!AU62*s!AZ62+s!AV62*s!AY62+s!AW62*s!AX62)) -> 22.04258156431483 | BJ63: =SUM(AT63:BA63) -> 778
A64: =A63 -> 100 | B64: =B63 -> 30 | C64: =C63 -> 200 | D64: =D63 -> 2 | E64: =E63 -> 4 | F64: =F63 -> 1 | G64: =G63 -> 1 | H64: =H63 -> 2 | I64: =I63 -> 1 | J64: =J63 -> 2 | K64: =K63 -> 4 | L64: =L63 -> 2 | M64: =M63 -> 4 | N64: =N63 -> 8 | O64: =O63 -> 4 | P64: =P63 -> 2 | Q64: =Q63 -> 4 | R64: =R63 -> 2 | S64: =S63 -> 1 | T64: =T63 -> 2 | U64: =U63 -> 1 | V64: =V63 -> 2 | W64: =W63 -> 4 | X64: =X63 -> 2 | Y64: =Y63 -> 1 | Z64: =Z63 -> 2 | AA64: =AA63 -> 1 | AB64: =AB63 -> 389 | AC64: =AC63 -> 234 | AD64: =AD63 -> 433 | AE64: =AE63 -> 8 | AF64: =AF63 -> 7 | AG64: =AG63 -> 8 | AH64: =AH63 -> 8 | AI64: =AI63 -> 8 | AJ64: =AJ63 -> 8 | AS64: =AS63 -> 714 | AT64: =AC64+IF(s!AT63*s!AW63+s!AU63*s!AV63=0,0,E64*s!AT63*s!AW63/(s!AT63*s!AW63+s!AU63*s!AV63))+IF(s!AT63*s!AY63+s!AU63*s!AX63=0,0,K64*s!AT63*s!AY63/(s!AT63*s!AY63+s!AU63*s!AX63))+IF(s!AT63*s!AZ63+s!AV63*s!AX63=0,0,M64*s!AT63*s!AZ63/(s!AT63*s!AZ63+s!AV63*s!AX63))+IF(s!AT63*s!BA63+s!AU63*s!AZ63+s!AV63*s!AY63+s!AW63*s!AX63=0,0,N64*s!AT63*s!BA63/(s!AT63*s!BA63+s!AU63*s!AZ63+s!AV63*s!AY63+s!AW63*s!AX63)) -> 244.65839693616849 | AU64: =AD64+IF(s!AU63*s!AV63+s!AT63*s!AW63=0,0,E64*s!AU63*s!AV63/(s!AU63*s!AV63+s!AT63*s!AW63))+IF(s!AT63*s!AY63+s!AU63*s!AX63=0,0,K64*s!AU63*s!AX63/(s!AT63*s!AY63+s!AU63*s!AX63))+IF(s!AU63*s!BA63+s!AW63*s!AY63=0,0,O64*s!AU63*s!BA63/(s!AU63*s!BA63+s!AW63*s!AY63))+IF(s!AT63*s!BA63+s!AU63*s!AZ63+s!AV63*s!AY63+s!AW63*s!AX63=0,0,N64*s!AU63*s!AZ63/(s!AT63*s!BA63+s!AU63*s!AZ63+s!AV63*s!AY63+s!AW63*s!AX63)) -> 445.77362055066976 | AV64: =AE64+IF(s!AU63*s!AV63+s!AT63*s!AW63=0,0,E64*s!AU63*s!AV63/(s!AU63*s!AV63+s!AT63*s!AW63))+IF(s!AV63*s!AX63+s!AT63*s!AZ63=0,0,M64*s!AV63*s!AX63/(s!AV63*s!AX63+s!AT63*s!AZ63))+IF(s!AV63*s!BA63+s!AW63*s!AZ63=0,0,Q64*s!AV63*s!BA63/(s!AV63*s!BA63+s!AW63*s!AZ63))+IF(s!AT63*s!BA63+s!AU63*s!AZ63+s!AV63*s!AY63+s!AW63*s!AX63=0,0,N64*s!AV63*s!AY63/(s!AT63*s!BA63+s!AU63*s!AZ63+s!AV63*s!AY63+s!AW63*s!AX63)) -> 13.961447025012921 | AW64: =AF64+IF(s!AT63*s!AW63+s!AU63*s!AV63=0,0,E64*s!AT63*s!AW63/(s!AT63*s!AW63+s!AU63*s!AV63))+IF(s!AU63*s!BA63+s!AW63*s!AY63=0,0,O64*s!AW63*s!AY63/(s!AU63*s!BA63+s!AW63*s!AY63))+IF(s!AV63*s!BA63+s!AW63*s!AZ63=0,0,Q64*s!AW63*s!AZ63/(s!AV63*s!BA63+s!AW63*s!AZ63))+IF(s!AT63*s!BA63+s!AU63*s!AZ63+s!AV63*s!AY63+s!AW63*s!AX63=0,0,N64*s!AW63*s!AX63/(s!AT63*s!BA63+s!AU63*s!AZ63+s!AV63*s!AY63+s!AW63*s!AX63)) -> 9.606535488148813 | AX64: =AG64+IF(s!AT63*s!AY63+s!AU63*s!AX63=0,0,K64*s!AU63*s!AX63/(s!AT63*s!AY63+s!AU63*s!AX63))+IF(s!AV63*s!AX63+s!AT63*s!AZ63=0,0,M64*s!AV63*s!AX63/(s!AV63*s!AX63+s!AT63*s!AZ63))+IF(s!AX63*s!BA63+s!AY63*s!AZ63=0,0,W64*s!AX63*s!BA63/(s!AX63*s!BA63+s!AY63*s!AZ63))+IF(s!AT63*s!BA63+s!AU63*s!AZ63+s!AV63*s!AY63+s!AW63*s!AX63=0,0,N64*s!AW63*s!AX63/(s!AT63*s!BA63+s!AU63*s!AZ63+s!AV63*s!AY63+s!AW63*s!AX63)) -> 13.990720117544807 | AY64: =AH64+IF(s!AT63*s!AY63+s!AU63*s!AX63=0,0,K64*s!AT63*s!AY63/(s!AT63*s!AY63+s!AU63*s!AX63))+IF(s!AU63*s!BA63+s!AW63*s!AY63=0,0,O64*s!AW63*s!AY63/(s!AU63*s!BA63+s!AW63*s!AY63))+IF(s!AX63*s!BA63+s!AY63*s!AZ63=0,0,W64*s!AY63*s!AZ63/(s!AX63*s!BA63+s!AY63*s!AZ63))+IF(s!AT63*s!BA63+s!AU63*s!AZ63+s!AV63*s!AY63+s!AW63*s!AX63=0,0,N64*s!AV63*s!AY63/(s!AT63*s!BA63+s!AU63*s!AZ63+s!AV63*s!AY63+s!AW63*s!AX63)) -> 10.577262395616925 | AZ64: =AI64+IF(s!AT63*s!AZ63+s!AV63*s!AX63=0,0,M64*s!AT63*s!AZ63/(s!AT63*s!AZ63+s!AV63*s!AX63))+IF(s!AV63*s!BA63+s!AW63*s!AZ63=0,0,Q64*s!AW63*s!AZ63/(s!AV63*s!BA63+s!AW63*s!AZ63))+IF(s!AX63*s!BA63+s!AY63*s!AZ63=0,0,W64*s!AY63*s!AZ63/(s!AX63*s!BA63+s!AY63*s!AZ63))+IF(s!AT63*s!BA63+s!AU63*s!AZ63+s!AV63*s!AY63+s!AW63*s!AX63=0,0,N64*s!AU63*s!AZ63/(s!AT63*s!BA63+s!AU63*s!AZ63+s!AV63*s!AY63+s!AW63*s!AX63)) -> 17.389435921273769 | BA64: =AJ64+IF(s!AU63*s!BA63+s!AW63*s!AY63=0,0,O64*s!AU63*s!BA63/(s!AU63*s!BA63+s!AW63*s!AY63))+IF(s!AV63*s!BA63+s!AW63*s!AZ63=0,0,Q64*s!AV63*s!BA63/(s!AV63*s!BA63+s!AW63*s!AZ63))+IF(s!AX63*s!BA63+s!AY63*s!AZ63=0,0,W64*s!AX63*s!BA63/(s!AX63*s!BA63+s!AY63*s!AZ63))+IF(s!AT63*s!BA63+s!AU63*s!AZ63+s!AV63*s!AY63+s!AW63*s!AX63=0,0,N64*s!AT63*s!BA63/(s!AT63*s!BA63+s!AU63*s!AZ63+s!AV63*s!AY63+s!AW63*s!AX63)) -> 22.042581565564497 | BJ64: =SUM(AT64:BA64) -> 778
A65: =A64 -> 100 | B65: =B64 -> 30 | C65: =C64 -> 200 | D65: =D64 -> 2 | E65: =E64 -> 4 | F65: =F64 -> 1 | G65: =G64 -> 1 | H65: =H64 -> 2 | I65: =I64 -> 1 | J65: =J64 -> 2 | K65: =K64 -> 4 | L65: =L64 -> 2 | M65: =M64 -> 4 | N65: =N64 -> 8 | O65: =O64 -> 4 | P65: =P64 -> 2 | Q65: =Q64 -> 4 | R65: =R64 -> 2 | S65: =S64 -> 1 | T65: =T64 -> 2 | U65: =U64 -> 1 | V65: =V64 -> 2 | W65: =W64 -> 4 | X65: =X64 -> 2 | Y65: =Y64 -> 1 | Z65: =Z64 -> 2 | AA65: =AA64 -> 1 | AB65: =AB64 -> 389 | AC65: =AC64 -> 234 | AD65: =AD64 -> 433 | AE65: =AE64 -> 8 | AF65: =AF64 -> 7 | AG65: =AG64 -> 8 | AH65: =AH64 -> 8 | AI65: =AI64 -> 8 | AJ65: =AJ64 -> 8 | AS65: =AS64 -> 714 | AT65: =AC65+IF(s!AT64*s!AW64+s!AU64*s!AV64=0,0,E65*s!AT64*s!AW64/(s!AT64*s!AW64+s!AU64*s!AV64))+IF(s!AT64*s!AY64+s!AU64*s!AX64=0,0,K65*s!AT64*s!AY64/(s!AT64*s!AY64+s!AU64*s!AX64))+IF(s!AT64*s!AZ64+s!AV64*s!AX64=0,0,M65*s!AT64*s!AZ64/(s!AT64*s!AZ64+s!AV64*s!AX64))+IF(s!AT64*s!BA64+s!AU64*s!AZ64+s!AV64*s!AY64+s!AW64*s!AX64=0,0,N65*s!AT64*s!BA64/(s!AT64*s!BA64+s!AU64*s!AZ64+s!AV64*s!AY64+s!AW64*s!AX64)) -> 244.65839693621857 | AU65: =AD65+IF(s!AU64*s!AV64+s!AT64*s!AW64=0,0,E65*s!AU64*s!AV64/(s!AU64*s!AV64+s!AT64*s!AW64))+IF(s!AT64*s!AY64+s!AU64*s!AX64=0,0,K65*s!AU64*s!AX64/(s!AT64*s!AY64+s!AU64*s!AX64))+IF(s!AU64*s!BA64+s!AW64*s!AY64=0,0,O65*s!AU64*s!BA64/(s!AU64*s!BA64+s!AW64*s!AY64))+IF(s!AT64*s!BA64+s!AU64*s!AZ64+s!AV64*s!AY64+s!AW64*s!AX64=0,0,N65*s!AU64*s!AZ64/(s!AT64*s!BA64+s!AU64*s!AZ64+s!AV64*s!AY64+s!AW64*s!AX64)) -> 445.77362055058859 | AV65: =AE65+IF(s!AU64*s!AV64+s!AT64*s!AW64=0,0,E65*s!AU64*s!AV64/(s!AU64*s!AV64+s!AT64*s!AW64))+IF(s!AV64*s!AX64+s!AT64*s!AZ64=0,0,M65*s!AV64*s!AX64/(s!AV64*s!AX64+s!AT64*s!AZ64))+IF(s!AV64*s!BA64+s!AW64*s!AZ64=0,0,Q65*s!AV64*s!BA64/(s!AV64*s!BA64+s!AW64*s!AZ64))+IF(s!AT64*s!BA64+s!AU64*s!AZ64+s!AV64*s!AY64+s!AW64*s!AX64=0,0,N65*s!AV64*s!AY64/(s!AT64*s!BA64+s!AU64*s!AZ64+s!AV64*s!AY64+s!AW64*s!AX64)) -> 13.961447025471935 | AW65: =AF65+IF(s!AT64*s!AW64+s!AU64*s!AV64=0,0,E65*s!AT64*s!AW64/(s!AT64*s!AW64+s!AU64*s!AV64))+IF(s!AU64*s!BA64+s!AW64*s!AY64=0,0,O65*s!AW64*s!AY64/(s!AU64*s!BA64+s!AW64*s!AY64))+IF(s!AV64*s!BA64+s!AW64*s!AZ64=0,0,Q65*s!AW64*s!AZ64/(s!AV64*s!BA64+s!AW64*s!AZ64))+IF(s!AT64*s!BA64+s!AU64*s!AZ64+s!AV64*s!AY64+s!AW64*s!AX64=0,0,N65*s!AW64*s!AX64/(s!AT64*s!BA64+s!AU64*s!AZ64+s!AV64*s!AY64+s!AW64*s!AX64)) -> 9.6065354877209028 | AX65: =AG65+IF(s!AT64*s!AY64+s!AU64*s!AX64=0,0,K65*s!AU64*s!AX64/(s!AT64*s!AY64+s!AU64*s!AX64))+IF(s!AV64*s!AX64+s!AT64*s!AZ64=0,0,M65*s!AV64*s!AX64/(s!AV64*s!AX64+s!AT64*s!AZ64))+IF(s!AX64*s!BA64+s!AY64*s!AZ64=0,0,W65*s!AX64*s!BA64/(s!AX64*s!BA64+s!AY64*s!AZ64))+IF(s!AT64*s!BA64+s!AU64*s!AZ64+s!AV64*s!AY64+s!AW64*s!AX64=0,0,N65*s!AW64*s!AX64/(s!AT64*s!BA64+s!AU64*s!AZ64+s!AV64*s!AY64+s!AW64*s!AX64)) -> 13.990720117960857 | AY65: =AH65+IF(s!AT64*s!AY64+s!AU64*s!AX64=0,0,K65*s!AT64*s!AY64/(s!AT64*s!AY64+s!AU64*s!AX64))+IF(s!AU64*s!BA64+s!AW64*s!AY64=0,0,O65*s!AW64*s!AY64/(s!AU64*s!BA64+s!AW64*s!AY64))+IF(s!AX64*s!BA64+s!AY64*s!AZ64=0,0,W65*s!AY64*s!AZ64/(s!AX64*s!BA64+s!AY64*s!AZ64))+IF(s!AT64*s!BA64+s!AU64*s!AZ64+s!AV64*s!AY64+s!AW64*s!AX64=0,0,N65*s!AV64*s!AY64/(s!AT64*s!BA64+s!AU64*s!AZ64+s!AV64*s!AY64+s!AW64*s!AX64)) -> 10.57726239523198 | AZ65: =AI65+IF(s!AT64*s!AZ64+s!AV64*s!AX64=0,0,M65*s!AT64*s!AZ64/(s!AT64*s!AZ64+s!AV64*s!AX64))+IF(s!AV64*s!BA64+s!AW64*s!AZ64=0,0,Q65*s!AW64*s!AZ64/(s!AV64*s!BA64+s!AW64*s!AZ64))+IF(s!AX64*s!BA64+s!AY64*s!AZ64=0,0,W65*s!AY64*s!AZ64/(s!AX64*s!BA64+s!AY64*s!AZ64))+IF(s!AT64*s!BA64+s!AU64*s!AZ64+s!AV64*s!AY64+s!AW64*s!AX64=0,0,N65*s!AU64*s!AZ64/(s!AT64*s!BA64+s!AU64*s!AZ64+s!AV64*s!AY64+s!AW64*s!AX64)) -> 17.389435920348632 | BA65: =AJ65+IF(s!AU64*s!BA64+s!AW64*s!AY64=0,0,O65*s!AU64*s!BA64/(s!AU64*s!BA64+s!AW64*s!AY64))+IF(s!AV64*s!BA64+s!AW64*s!AZ64=0,0,Q65*s!AV64*s!BA64/(s!AV64*s!BA64+s!AW64*s!AZ64))+IF(s!AX64*s!BA64+s!AY64*s!AZ64=0,0,W65*s!AX64*s!BA64/(s!AX64*s!BA64+s!AY64*s!AZ64))+IF(s!AT64*s!BA64+s!AU64*s!AZ64+s!AV64*s!AY64+s!AW64*s!AX64=0,0,N65*s!AT64*s!BA64/(s!AT64*s!BA64+s!AU64*s!AZ64+s!AV64*s!AY64+s!AW64*s!AX64)) -> 22.04258156645853 | BJ65: =SUM(AT65:BA65) -> 778
A66: =A65 -> 100 | B66: =B65 -> 30 | C66: =C65 -> 200 | D66: =D65 -> 2 | E66: =E65 -> 4 | F66: =F65 -> 1 | G66: =G65 -> 1 | H66: =H65 -> 2 | I66: =I65 -> 1 | J66: =J65 -> 2 | K66: =K65 -> 4 | L66: =L65 -> 2 | M66: =M65 -> 4 | N66: =N65 -> 8 | O66: =O65 -> 4 | P66: =P65 -> 2 | Q66: =Q65 -> 4 | R66: =R65 -> 2 | S66: =S65 -> 1 | T66: =T65 -> 2 | U66: =U65 -> 1 | V66: =V65 -> 2 | W66: =W65 -> 4 | X66: =X65 -> 2 | Y66: =Y65 -> 1 | Z66: =Z65 -> 2 | AA66: =AA65 -> 1 | AB66: =AB65 -> 389 | AC66: =AC65 -> 234 | AD66: =AD65 -> 433 | AE66: =AE65 -> 8 | AF66: =AF65 -> 7 | AG66: =AG65 -> 8 | AH66: =AH65 -> 8 | AI66: =AI65 -> 8 | AJ66: =AJ65 -> 8 | AS66: =AS65 -> 714 | AT66: =AC66+IF(s!AT65*s!AW65+s!AU65*s!AV65=0,0,E66*s!AT65*s!AW65/(s!AT65*s!AW65+s!AU65*s!AV65))+IF(s!AT65*s!AY65+s!AU65*s!AX65=0,0,K66*s!AT65*s!AY65/(s!AT65*s!AY65+s!AU65*s!AX65))+IF(s!AT65*s!AZ65+s!AV65*s!AX65=0,0,M66*s!AT65*s!AZ65/(s!AT65*s!AZ65+s!AV65*s!AX65))+IF(s!AT65*s!BA65+s!AU65*s!AZ65+s!AV65*s!AY65+s!AW65*s!AX65=0,0,N66*s!AT65*s!BA65/(s!AT65*s!BA65+s!AU65*s!AZ65+s!AV65*s!AY65+s!AW65*s!AX65)) -> 244.65839693625441 | AU66: =AD66+IF(s!AU65*s!AV65+s!AT65*s!AW65=0,0,E66*s!AU65*s!AV65/(s!AU65*s!AV65+s!AT65*s!AW65))+IF(s!AT65*s!AY65+s!AU65*s!AX65=0,0,K66*s!AU65*s!AX65/(s!AT65*s!AY65+s!AU65*s!AX65))+IF(s!AU65*s!BA65+s!AW65*s!AY65=0,0,O66*s!AU65*s!BA65/(s!AU65*s!BA65+s!AW65*s!AY65))+IF(s!AT65*s!BA65+s!AU65*s!AZ65+s!AV65*s!AY65+s!AW65*s!AX65=0,0,N66*s!AU65*s!AZ65/(s!AT65*s!BA65+s!AU65*s!AZ65+s!AV65*s!AY65+s!AW65*s!AX65)) -> 445.77362055053055 | AV66: =AE66+IF(s!AU65*s!AV65+s!AT65*s!AW65=0,0,E66*s!AU65*s!AV65/(s!AU65*s!AV65+s!AT65*s!AW65))+IF(s!AV65*s!AX65+s!AT65*s!AZ65=0,0,M66*s!AV65*s!AX65/(s!AV65*s!AX65+s!AT65*s!AZ65))+IF(s!AV65*s!BA65+s!AW65*s!AZ65=0,0,Q66*s!AV65*s!BA65/(s!AV65*s!BA65+s!AW65*s!AZ65))+IF(s!AT65*s!BA65+s!AU65*s!AZ65+s!AV65*s!AY65+s!AW65*s!AX65=0,0,N66*s!AV65*s!AY65/(s!AT65*s!BA65+s!AU65*s!AZ65+s!AV65*s!AY65+s!AW65*s!AX65)) -> 13.961447025800325 | AW66: =AF66+IF(s!AT65*s!AW65+s!AU65*s!AV65=0,0,E66*s!AT65*s!AW65/(s!AT65*s!AW65+s!AU65*s!AV65))+IF(s!AU65*s!BA65+s!AW65*s!AY65=0,0,O66*s!AW65*s!AY65/(s!AU65*s!BA65+s!AW65*s!AY65))+IF(s!AV65*s!BA65+s!AW65*s!AZ65=0,0,Q66*s!AW65*s!AZ65/(s!AV65*s!BA65+s!AW65*s!AZ65))+IF(s!AT65*s!BA65+s!AU65*s!AZ65+s!AV65*s!AY65+s!AW65*s!AX65=0,0,N66*s!AW65*s!AX65/(s!AT65*s!BA65+s!AU65*s!AZ65+s!AV65*s!AY65+s!AW65*s!AX65)) -> 9.6065354874147655 | AX66: =AG66+IF(s!AT65*s!AY65+s!AU65*s!AX65=0,0,K66*s!AU65*s!AX65/(s!AT65*s!AY65+s!AU65*s!AX65))+IF(s!AV65*s!AX65+s!AT65*s!AZ65=0,0,M66*s!AV65*s!AX65/(s!AV65*s!AX65+s!AT65*s!AZ65))+IF(s!AX65*s!BA65+s!AY65*s!AZ65=0,0,W66*s!AX65*s!BA65/(s!AX65*s!BA65+s!AY65*s!AZ65))+IF(s!AT65*s!BA65+s!AU65*s!AZ65+s!AV65*s!AY65+s!AW65*s!AX65=0,0,N66*s!AW65*s!AX65/(s!AT65*s!BA65+s!AU65*s!AZ65+s!AV65*s!AY65+s!AW65*s!AX65)) -> 13.990720118258507 | AY66: =AH66+IF(s!AT65*s!AY65+s!AU65*s!AX65=0,0,K66*s!AT65*s!AY65/(s!AT65*s!AY65+s!AU65*s!AX65))+IF(s!AU65*s!BA65+s!AW65*s!AY65=0,0,O66*s!AW65*s!AY65/(s!AU65*s!BA65+s!AW65*s!AY65))+IF(s!AX65*s!BA65+s!AY65*s!AZ65=0,0,W66*s!AY65*s!AZ65/(s!AX65*s!BA65+s!AY65*s!AZ65))+IF(s!AT65*s!BA65+s!AU65*s!AZ65+s!AV65*s!AY65+s!AW65*s!AX65=0,0,N66*s!AV65*s!AY65/(s!AT65*s!BA65+s!AU65*s!AZ65+s!AV65*s!AY65+s!AW65*s!AX65)) -> 10.577262394956584 | AZ66: =AI66+IF(s!AT65*s!AZ65+s!AV65*s!AX65=0,0,M66*s!AT65*s!AZ65/(s!AT65*s!AZ65+s!AV65*s!AX65))+IF(s!AV65*s!BA65+s!AW65*s!AZ65=0,0,Q66*s!AW65*s!AZ65/(s!AV65*s!BA65+s!AW65*s!AZ65))+IF(s!AX65*s!BA65+s!AY65*s!AZ65=0,0,W66*s!AY65*s!AZ65/(s!AX65*s!BA65+s!AY65*s!AZ65))+IF(s!AT65*s!BA65+s!AU65*s!AZ65+s!AV65*s!AY65+s!AW65*s!AX65=0,0,N66*s!AU65*s!AZ65/(s!AT65*s!BA65+s!AU65*s!AZ65+s!AV65*s!AY65+s!AW65*s!AX65)) -> 17.389435919686768 | BA66: =AJ66+IF(s!AU65*s!BA65+s!AW65*s!AY65=0,0,O66*s!AU65*s!BA65/(s!AU65*s!BA65+s!AW65*s!AY65))+IF(s!AV65*s!BA65+s!AW65*s!AZ65=0,0,Q66*s!AV65*s!BA65/(s!AV65*s!BA65+s!AW65*s!AZ65))+IF(s!AX65*s!BA65+s!AY65*s!AZ65=0,0,W66*s!AX65*s!BA65/(s!AX65*s!BA65+s!AY65*s!AZ65))+IF(s!AT65*s!BA65+s!AU65*s!AZ65+s!AV65*s!AY65+s!AW65*s!AX65=0,0,N66*s!AT65*s!BA65/(s!AT65*s!BA65+s!AU65*s!AZ65+s!AV65*s!AY65+s!AW65*s!AX65)) -> 22.042581567098136 | BJ66: =SUM(AT66:BA66) -> 778
A67: =A66 -> 100 | B67: =B66 -> 30 | C67: =C66 -> 200 | D67: =D66 -> 2 | E67: =E66 -> 4 | F67: =F66 -> 1 | G67: =G66 -> 1 | H67: =H66 -> 2 | I67: =I66 -> 1 | J67: =J66 -> 2 | K67: =K66 -> 4 | L67: =L66 -> 2 | M67: =M66 -> 4 | N67: =N66 -> 8 | O67: =O66 -> 4 | P67: =P66 -> 2 | Q67: =Q66 -> 4 | R67: =R66 -> 2 | S67: =S66 -> 1 | T67: =T66 -> 2 | U67: =U66 -> 1 | V67: =V66 -> 2 | W67: =W66 -> 4 | X67: =X66 -> 2 | Y67: =Y66 -> 1 | Z67: =Z66 -> 2 | AA67: =AA66 -> 1 | AB67: =AB66 -> 389 | AC67: =AC66 -> 234 | AD67: =AD66 -> 433 | AE67: =AE66 -> 8 | AF67: =AF66 -> 7 | AG67: =AG66 -> 8 | AH67: =AH66 -> 8 | AI67: =AI66 -> 8 | AJ67: =AJ66 -> 8 | AS67: =AS66 -> 714 | AT67: =AC67+IF(s!AT66*s!AW66+s!AU66*s!AV66=0,0,E67*s!AT66*s!AW66/(s!AT66*s!AW66+s!AU66*s!AV66))+IF(s!AT66*s!AY66+s!AU66*s!AX66=0,0,K67*s!AT66*s!AY66/(s!AT66*s!AY66+s!AU66*s!AX66))+IF(s!AT66*s!AZ66+s!AV66*s!AX66=0,0,M67*s!AT66*s!AZ66/(s!AT66*s!AZ66+s!AV66*s!AX66))+IF(s!AT66*s!BA66+s!AU66*s!AZ66+s!AV66*s!AY66+s!AW66*s!AX66=0,0,N67*s!AT66*s!BA66/(s!AT66*s!BA66+s!AU66*s!AZ66+s!AV66*s!AY66+s!AW66*s!AX66)) -> 244.65839693628001 | AU67: =AD67+IF(s!AU66*s!AV66+s!AT66*s!AW66=0,0,E67*s!AU66*s!AV66/(s!AU66*s!AV66+s!AT66*s!AW66))+IF(s!AT66*s!AY66+s!AU66*s!AX66=0,0,K67*s!AU66*s!AX66/(s!AT66*s!AY66+s!AU66*s!AX66))+IF(s!AU66*s!BA66+s!AW66*s!AY66=0,0,O67*s!AU66*s!BA66/(s!AU66*s!BA66+s!AW66*s!AY66))+IF(s!AT66*s!BA66+s!AU66*s!AZ66+s!AV66*s!AY66+s!AW66*s!AX66=0,0,N67*s!AU66*s!AZ66/(s!AT66*s!BA66+s!AU66*s!AZ66+s!AV66*s!AY66+s!AW66*s!AX66)) -> 445.773620550489 | AV67: =AE67+IF(s!AU66*s!AV66+s!AT66*s!AW66=0,0,E67*s!AU66*s!AV66/(s!AU66*s!AV66+s!AT66*s!AW66))+IF(s!AV66*s!AX66+s!AT66*s!AZ66=0,0,M67*s!AV66*s!AX66/(s!AV66*s!AX66+s!AT66*s!AZ66))+IF(s!AV66*s!BA66+s!AW66*s!AZ66=0,0,Q67*s!AV66*s!BA66/(s!AV66*s!BA66+s!AW66*s!AZ66))+IF(s!AT66*s!BA66+s!AU66*s!AZ66+s!AV66*s!AY66+s!AW66*s!AX66=0,0,N67*s!AV66*s!AY66/(s!AT66*s!BA66+s!AU66*s!AZ66+s!AV66*s!AY66+s!AW66*s!AX66)) -> 13.961447026035263 | AW67: =AF67+IF(s!AT66*s!AW66+s!AU66*s!AV66=0,0,E67*s!AT66*s!AW66/(s!AT66*s!AW66+s!AU66*s!AV66))+IF(s!AU66*s!BA66+s!AW66*s!AY66=0,0,O67*s!AW66*s!AY66/(s!AU66*s!BA66+s!AW66*s!AY66))+IF(s!AV66*s!BA66+s!AW66*s!AZ66=0,0,Q67*s!AW66*s!AZ66/(s!AV66*s!BA66+s!AW66*s!AZ66))+IF(s!AT66*s!BA66+s!AU66*s!AZ66+s!AV66*s!AY66+s!AW66*s!AX66=0,0,N67*s!AW66*s!AX66/(s!AT66*s!BA66+s!AU66*s!AZ66+s!AV66*s!AY66+s!AW66*s!AX66)) -> 9.6065354871957513 | AX67: =AG67+IF(s!AT66*s!AY66+s!AU66*s!AX66=0,0,K67*s!AU66*s!AX66/(s!AT66*s!AY66+s!AU66*s!AX66))+IF(s!AV66*s!AX66+s!AT66*s!AZ66=0,0,M67*s!AV66*s!AX66/(s!AV66*s!AX66+s!AT66*s!AZ66))+IF(s!AX66*s!BA66+s!AY66*s!AZ66=0,0,W67*s!AX66*s!BA66/(s!AX66*s!BA66+s!AY66*s!AZ66))+IF(s!AT66*s!BA66+s!AU66*s!AZ66+s!AV66*s!AY66+s!AW66*s!AX66=0,0,N67*s!AW66*s!AX66/(s!AT66*s!BA66+s!AU66*s!AZ66+s!AV66*s!AY66+s!AW66*s!AX66)) -> 13.990720118471454 | AY67: =AH67+IF(s!AT66*s!AY66+s!AU66*s!AX66=0,0,K67*s!AT66*s!AY66/(s!AT66*s!AY66+s!AU66*s!AX66))+IF(s!AU66*s!BA66+s!AW66*s!AY66=0,0,O67*s!AW66*s!AY66/(s!AU66*s!BA66+s!AW66*s!AY66))+IF(s!AX66*s!BA66+s!AY66*s!AZ66=0,0,W67*s!AY66*s!AZ66/(s!AX66*s!BA66+s!AY66*s!AZ66))+IF(s!AT66*s!BA66+s!AU66*s!AZ66+s!AV66*s!AY66+s!AW66*s!AX66=0,0,N67*s!AV66*s!AY66/(s!AT66*s!BA66+s!AU66*s!AZ66+s!AV66*s!AY66+s!AW66*s!AX66)) -> 10.577262394759561 | AZ67: =AI67+IF(s!AT66*s!AZ66+s!AV66*s!AX66=0,0,M67*s!AT66*s!AZ66/(s!AT66*s!AZ66+s!AV66*s!AX66))+IF(s!AV66*s!BA66+s!AW66*s!AZ66=0,0,Q67*s!AW66*s!AZ66/(s!AV66*s!BA66+s!AW66*s!AZ66))+IF(s!AX66*s!BA66+s!AY66*s!AZ66=0,0,W67*s!AY66*s!AZ66/(s!AX66*s!BA66+s!AY66*s!AZ66))+IF(s!AT66*s!BA66+s!AU66*s!AZ66+s!AV66*s!AY66+s!AW66*s!AX66=0,0,N67*s!AU66*s!AZ66/(s!AT66*s!BA66+s!AU66*s!AZ66+s!AV66*s!AY66+s!AW66*s!AX66)) -> 17.389435919213263 | BA67: =AJ67+IF(s!AU66*s!BA66+s!AW66*s!AY66=0,0,O67*s!AU66*s!BA66/(s!AU66*s!BA66+s!AW66*s!AY66))+IF(s!AV66*s!BA66+s!AW66*s!AZ66=0,0,Q67*s!AV66*s!BA66/(s!AV66*s!BA66+s!AW66*s!AZ66))+IF(s!AX66*s!BA66+s!AY66*s!AZ66=0,0,W67*s!AX66*s!BA66/(s!AX66*s!BA66+s!AY66*s!AZ66))+IF(s!AT66*s!BA66+s!AU66*s!AZ66+s!AV66*s!AY66+s!AW66*s!AX66=0,0,N67*s!AT66*s!BA66/(s!AT66*s!BA66+s!AU66*s!AZ66+s!AV66*s!AY66+s!AW66*s!AX66)) -> 22.042581567555729 | BJ67: =SUM(AT67:BA67) -> 778
A68: =A67 -> 100 | B68: =B67 -> 30 | C68: =C67 -> 200 | D68: =D67 -> 2 | E68: =E67 -> 4 | F68: =F67 -> 1 | G68: =G67 -> 1 | H68: =H67 -> 2 | I68: =I67 -> 1 | J68: =J67 -> 2 | K68: =K67 -> 4 | L68: =L67 -> 2 | M68: =M67 -> 4 | N68: =N67 -> 8 | O68: =O67 -> 4 | P68: =P67 -> 2 | Q68: =Q67 -> 4 | R68: =R67 -> 2 | S68: =S67 -> 1 | T68: =T67 -> 2 | U68: =U67 -> 1 | V68: =V67 -> 2 | W68: =W67 -> 4 | X68: =X67 -> 2 | Y68: =Y67 -> 1 | Z68: =Z67 -> 2 | AA68: =AA67 -> 1 | AB68: =AB67 -> 389 | AC68: =AC67 -> 234 | AD68: =AD67 -> 433 | AE68: =AE67 -> 8 | AF68: =AF67 -> 7 | AG68: =AG67 -> 8 | AH68: =AH67 -> 8 | AI68: =AI67 -> 8 | AJ68: =AJ67 -> 8 | AS68: =AS67 -> 714 | AT68: =AC68+IF(s!AT67*s!AW67+s!AU67*s!AV67=0,0,E68*s!AT67*s!AW67/(s!AT67*s!AW67+s!AU67*s!AV67))+IF(s!AT67*s!AY67+s!AU67*s!AX67=0,0,K68*s!AT67*s!AY67/(s!AT67*s!AY67+s!AU67*s!AX67))+IF(s!AT67*s!AZ67+s!AV67*s!AX67=0,0,M68*s!AT67*s!AZ67/(s!AT67*s!AZ67+s!AV67*s!AX67))+IF(s!AT67*s!BA67+s!AU67*s!AZ67+s!AV67*s!AY67+s!AW67*s!AX67=0,0,N68*s!AT67*s!BA67/(s!AT67*s!BA67+s!AU67*s!AZ67+s!AV67*s!AY67+s!AW67*s!AX67)) -> 244.65839693629837 | AU68: =AD68+IF(s!AU67*s!AV67+s!AT67*s!AW67=0,0,E68*s!AU67*s!AV67/(s!AU67*s!AV67+s!AT67*s!AW67))+IF(s!AT67*s!AY67+s!AU67*s!AX67=0,0,K68*s!AU67*s!AX67/(s!AT67*s!AY67+s!AU67*s!AX67))+IF(s!AU67*s!BA67+s!AW67*s!AY67=0,0,O68*s!AU67*s!BA67/(s!AU67*s!BA67+s!AW67*s!AY67))+IF(s!AT67*s!BA67+s!AU67*s!AZ67+s!AV67*s!AY67+s!AW67*s!AX67=0,0,N68*s!AU67*s!AZ67/(s!AT67*s!BA67+s!AU67*s!AZ67+s!AV67*s!AY67+s!AW67*s!AX67)) -> 445.77362055045927 | AV68: =AE68+IF(s!AU67*s!AV67+s!AT67*s!AW67=0,0,E68*s!AU67*s!AV67/(s!AU67*s!AV67+s!AT67*s!AW67))+IF(s!AV67*s!AX67+s!AT67*s!AZ67=0,0,M68*s!AV67*s!AX67/(s!AV67*s!AX67+s!AT67*s!AZ67))+IF(s!AV67*s!BA67+s!AW67*s!AZ67=0,0,Q68*s!AV67*s!BA67/(s!AV67*s!BA67+s!AW67*s!AZ67))+IF(s!AT67*s!BA67+s!AU67*s!AZ67+s!AV67*s!AY67+s!AW67*s!AX67=0,0,N68*s!AV67*s!AY67/(s!AT67*s!BA67+s!AU67*s!AZ67+s!AV67*s!AY67+s!AW67*s!AX67)) -> 13.961447026203341 | AW68: =AF68+IF(s!AT67*s!AW67+s!AU67*s!AV67=0,0,E68*s!AT67*s!AW67/(s!AT67*s!AW67+s!AU67*s!AV67))+IF(s!AU67*s!BA67+s!AW67*s!AY67=0,0,O68*s!AW67*s!AY67/(s!AU67*s!BA67+s!AW67*s!AY67))+IF(s!AV67*s!BA67+s!AW67*s!AZ67=0,0,Q68*s!AW67*s!AZ67/(s!AV67*s!BA67+s!AW67*s!AZ67))+IF(s!AT67*s!BA67+s!AU67*s!AZ67+s!AV67*s!AY67+s!AW67*s!AX67=0,0,N68*s!AW67*s!AX67/(s!AT67*s!BA67+s!AU67*s!AZ67+s!AV67*s!AY67+s!AW67*s!AX67)) -> 9.6065354870390642 | AX68: =AG68+IF(s!AT67*s!AY67+s!AU67*s!AX67=0,0,K68*s!AU67*s!AX67/(s!AT67*s!AY67+s!AU67*s!AX67))+IF(s!AV67*s!AX67+s!AT67*s!AZ67=0,0,M68*s!AV67*s!AX67/(s!AV67*s!AX67+s!AT67*s!AZ67))+IF(s!AX67*s!BA67+s!AY67*s!AZ67=0,0,W68*s!AX67*s!BA67/(s!AX67*s!BA67+s!AY67*s!AZ67))+IF(s!AT67*s!BA67+s!AU67*s!AZ67+s!AV67*s!AY67+s!AW67*s!AX67=0,0,N68*s!AW67*s!AX67/(s!AT67*s!BA67+s!AU67*s!AZ67+s!AV67*s!AY67+s!AW67*s!AX67)) -> 13.9907201186238 | AY68: =AH68+IF(s!AT67*s!AY67+s!AU67*s!AX67=0,0,K68*s!AT67*s!AY67/(s!AT67*s!AY67+s!AU67*s!AX67))+IF(s!AU67*s!BA67+s!AW67*s!AY67=0,0,O68*s!AW67*s!AY67/(s!AU67*s!BA67+s!AW67*s!AY67))+IF(s!AX67*s!BA67+s!AY67*s!AZ67=0,0,W68*s!AY67*s!AZ67/(s!AX67*s!BA67+s!AY67*s!AZ67))+IF(s!AT67*s!BA67+s!AU67*s!AZ67+s!AV67*s!AY67+s!AW67*s!AX67=0,0,N68*s!AV67*s!AY67/(s!AT67*s!BA67+s!AU67*s!AZ67+s!AV67*s!AY67+s!AW67*s!AX67)) -> 10.577262394618606 | AZ68: =AI68+IF(s!AT67*s!AZ67+s!AV67*s!AX67=0,0,M68*s!AT67*s!AZ67/(s!AT67*s!AZ67+s!AV67*s!AX67))+IF(s!AV67*s!BA67+s!AW67*s!AZ67=0,0,Q68*s!AW67*s!AZ67/(s!AV67*s!BA67+s!AW67*s!AZ67))+IF(s!AX67*s!BA67+s!AY67*s!AZ67=0,0,W68*s!AY67*s!AZ67/(s!AX67*s!BA67+s!AY67*s!AZ67))+IF(s!AT67*s!BA67+s!AU67*s!AZ67+s!AV67*s!AY67+s!AW67*s!AX67=0,0,N68*s!AU67*s!AZ67/(s!AT67*s!BA67+s!AU67*s!AZ67+s!AV67*s!AY67+s!AW67*s!AX67)) -> 17.389435918874501 | BA68: =AJ68+IF(s!AU67*s!BA67+s!AW67*s!AY67=0,0,O68*s!AU67*s!BA67/(s!AU67*s!BA67+s!AW67*s!AY67))+IF(s!AV67*s!BA67+s!AW67*s!AZ67=0,0,Q68*s!AV67*s!BA67/(s!AV67*s!BA67+s!AW67*s!AZ67))+IF(s!AX67*s!BA67+s!AY67*s!AZ67=0,0,W68*s!AX67*s!BA67/(s!AX67*s!BA67+s!AY67*s!AZ67))+IF(s!AT67*s!BA67+s!AU67*s!AZ67+s!AV67*s!AY67+s!AW67*s!AX67=0,0,N68*s!AT67*s!BA67/(s!AT67*s!BA67+s!AU67*s!AZ67+s!AV67*s!AY67+s!AW67*s!AX67)) -> 22.042581567883097 | BJ68: =SUM(AT68:BA68) -> 778
A69: =A68 -> 100 | B69: =B68 -> 30 | C69: =C68 -> 200 | D69: =D68 -> 2 | E69: =E68 -> 4 | F69: =F68 -> 1 | G69: =G68 -> 1 | H69: =H68 -> 2 | I69: =I68 -> 1 | J69: =J68 -> 2 | K69: =K68 -> 4 | L69: =L68 -> 2 | M69: =M68 -> 4 | N69: =N68 -> 8 | O69: =O68 -> 4 | P69: =P68 -> 2 | Q69: =Q68 -> 4 | R69: =R68 -> 2 | S69: =S68 -> 1 | T69: =T68 -> 2 | U69: =U68 -> 1 | V69: =V68 -> 2 | W69: =W68 -> 4 | X69: =X68 -> 2 | Y69: =Y68 -> 1 | Z69: =Z68 -> 2 | AA69: =AA68 -> 1 | AB69: =AB68 -> 389 | AC69: =AC68 -> 234 | AD69: =AD68 -> 433 | AE69: =AE68 -> 8 | AF69: =AF68 -> 7 | AG69: =AG68 -> 8 | AH69: =AH68 -> 8 | AI69: =AI68 -> 8 | AJ69: =AJ68 -> 8 | AS69: =AS68 -> 714 | AT69: =AC69+IF(s!AT68*s!AW68+s!AU68*s!AV68=0,0,E69*s!AT68*s!AW68/(s!AT68*s!AW68+s!AU68*s!AV68))+IF(s!AT68*s!AY68+s!AU68*s!AX68=0,0,K69*s!AT68*s!AY68/(s!AT68*s!AY68+s!AU68*s!AX68))+IF(s!AT68*s!AZ68+s!AV68*s!AX68=0,0,M69*s!AT68*s!AZ68/(s!AT68*s!AZ68+s!AV68*s!AX68))+IF(s!AT68*s!BA68+s!AU68*s!AZ68+s!AV68*s!AY68+s!AW68*s!AX68=0,0,N69*s!AT68*s!BA68/(s!AT68*s!BA68+s!AU68*s!AZ68+s!AV68*s!AY68+s!AW68*s!AX68)) -> 244.6583969363115 | AU69: =AD69+IF(s!AU68*s!AV68+s!AT68*s!AW68=0,0,E69*s!AU68*s!AV68/(s!AU68*s!AV68+s!AT68*s!AW68))+IF(s!AT68*s!AY68+s!AU68*s!AX68=0,0,K69*s!AU68*s!AX68/(s!AT68*s!AY68+s!AU68*s!AX68))+IF(s!AU68*s!BA68+s!AW68*s!AY68=0,0,O69*s!AU68*s!BA68/(s!AU68*s!BA68+s!AW68*s!AY68))+IF(s!AT68*s!BA68+s!AU68*s!AZ68+s!AV68*s!AY68+s!AW68*s!AX68=0,0,N69*s!AU68*s!AZ68/(s!AT68*s!BA68+s!AU68*s!AZ68+s!AV68*s!AY68+s!AW68*s!AX68)) -> 445.77362055043795 | AV69: =AE69+IF(s!AU68*s!AV68+s!AT68*s!AW68=0,0,E69*s!AU68*s!AV68/(s!AU68*s!AV68+s!AT68*s!AW68))+IF(s!AV68*s!AX68+s!AT68*s!AZ68=0,0,M69*s!AV68*s!AX68/(s!AV68*s!AX68+s!AT68*s!AZ68))+IF(s!AV68*s!BA68+s!AW68*s!AZ68=0,0,Q69*s!AV68*s!BA68/(s!AV68*s!BA68+s!AW68*s!AZ68))+IF(s!AT68*s!BA68+s!AU68*s!AZ68+s!AV68*s!AY68+s!AW68*s!AX68=0,0,N69*s!AV68*s!AY68/(s!AT68*s!BA68+s!AU68*s!AZ68+s!AV68*s!AY68+s!AW68*s!AX68)) -> 13.961447026323588 | AW69: =AF69+IF(s!AT68*s!AW68+s!AU68*s!AV68=0,0,E69*s!AT68*s!AW68/(s!AT68*s!AW68+s!AU68*s!AV68))+IF(s!AU68*s!BA68+s!AW68*s!AY68=0,0,O69*s!AW68*s!AY68/(s!AU68*s!BA68+s!AW68*s!AY68))+IF(s!AV68*s!BA68+s!AW68*s!AZ68=0,0,Q69*s!AW68*s!AZ68/(s!AV68*s!BA68+s!AW68*s!AZ68))+IF(s!AT68*s!BA68+s!AU68*s!AZ68+s!AV68*s!AY68+s!AW68*s!AX68=0,0,N69*s!AW68*s!AX68/(s!AT68*s!BA68+s!AU68*s!AZ68+s!AV68*s!AY68+s!AW68*s!AX68)) -> 9.6065354869269655 | AX69: =AG69+IF(s!AT68*s!AY68+s!AU68*s!AX68=0,0,K69*s!AU68*s!AX68/(s!AT68*s!AY68+s!AU68*s!AX68))+IF(s!AV68*s!AX68+s!AT68*s!AZ68=0,0,M69*s!AV68*s!AX68/(s!AV68*s!AX68+s!AT68*s!AZ68))+IF(s!AX68*s!BA68+s!AY68*s!AZ68=0,0,W69*s!AX68*s!BA68/(s!AX68*s!BA68+s!AY68*s!AZ68))+IF(s!AT68*s!BA68+s!AU68*s!AZ68+s!AV68*s!AY68+s!AW68*s!AX68=0,0,N69*s!AW68*s!AX68/(s!AT68*s!BA68+s!AU68*s!AZ68+s!AV68*s!AY68+s!AW68*s!AX68)) -> 13.990720118732792 | AY69: =AH69+IF(s!AT68*s!AY68+s!AU68*s!AX68=0,0,K69*s!AT68*s!AY68/(s!AT68*s!AY68+s!AU68*s!AX68))+IF(s!AU68*s!BA68+s!AW68*s!AY68=0,0,O69*s!AW68*s!AY68/(s!AU68*s!BA68+s!AW68*s!AY68))+IF(s!AX68*s!BA68+s!AY68*s!AZ68=0,0,W69*s!AY68*s!AZ68/(s!AX68*s!BA68+s!AY68*s!AZ68))+IF(s!AT68*s!BA68+s!AU68*s!AZ68+s!AV68*s!AY68+s!AW68*s!AX68=0,0,N69*s!AV68*s!AY68/(s!AT68*s!BA68+s!AU68*s!AZ68+s!AV68*s!AY68+s!AW68*s!AX68)) -> 10.577262394517762 | AZ69: =AI69+IF(s!AT68*s!AZ68+s!AV68*s!AX68=0,0,M69*s!AT68*s!AZ68/(s!AT68*s!AZ68+s!AV68*s!AX68))+IF(s!AV68*s!BA68+s!AW68*s!AZ68=0,0,Q69*s!AW68*s!AZ68/(s!AV68*s!BA68+s!AW68*s!AZ68))+IF(s!AX68*s!BA68+s!AY68*s!AZ68=0,0,W69*s!AY68*s!AZ68/(s!AX68*s!BA68+s!AY68*s!AZ68))+IF(s!AT68*s!BA68+s!AU68*s!AZ68+s!AV68*s!AY68+s!AW68*s!AX68=0,0,N69*s!AU68*s!AZ68/(s!AT68*s!BA68+s!AU68*s!AZ68+s!AV68*s!AY68+s!AW68*s!AX68)) -> 17.389435918632142 | BA69: =AJ69+IF(s!AU68*s!BA68+s!AW68*s!AY68=0,0,O69*s!AU68*s!BA68/(s!AU68*s!BA68+s!AW68*s!AY68))+IF(s!AV68*s!BA68+s!AW68*s!AZ68=0,0,Q69*s!AV68*s!BA68/(s!AV68*s!BA68+s!AW68*s!AZ68))+IF(s!AX68*s!BA68+s!AY68*s!AZ68=0,0,W69*s!AX68*s!BA68/(s!AX68*s!BA68+s!AY68*s!AZ68))+IF(s!AT68*s!BA68+s!AU68*s!AZ68+s!AV68*s!AY68+s!AW68*s!AX68=0,0,N69*s!AT68*s!BA68/(s!AT68*s!BA68+s!AU68*s!AZ68+s!AV68*s!AY68+s!AW68*s!AX68)) -> 22.042581568117306 | BJ69: =SUM(AT69:BA69) -> 778
A70: =A69 -> 100 | B70: =B69 -> 30 | C70: =C69 -> 200 | D70: =D69 -> 2 | E70: =E69 -> 4 | F70: =F69 -> 1 | G70: =G69 -> 1 | H70: =H69 -> 2 | I70: =I69 -> 1 | J70: =J69 -> 2 | K70: =K69 -> 4 | L70: =L69 -> 2 | M70: =M69 -> 4 | N70: =N69 -> 8 | O70: =O69 -> 4 | P70: =P69 -> 2 | Q70: =Q69 -> 4 | R70: =R69 -> 2 | S70: =S69 -> 1 | T70: =T69 -> 2 | U70: =U69 -> 1 | V70: =V69 -> 2 | W70: =W69 -> 4 | X70: =X69 -> 2 | Y70: =Y69 -> 1 | Z70: =Z69 -> 2 | AA70: =AA69 -> 1 | AB70: =AB69 -> 389 | AC70: =AC69 -> 234 | AD70: =AD69 -> 433 | AE70: =AE69 -> 8 | AF70: =AF69 -> 7 | AG70: =AG69 -> 8 | AH70: =AH69 -> 8 | AI70: =AI69 -> 8 | AJ70: =AJ69 -> 8 | AS70: =AS69 -> 714 | AT70: =AC70+IF(s!AT69*s!AW69+s!AU69*s!AV69=0,0,E70*s!AT69*s!AW69/(s!AT69*s!AW69+s!AU69*s!AV69))+IF(s!AT69*s!AY69+s!AU69*s!AX69=0,0,K70*s!AT69*s!AY69/(s!AT69*s!AY69+s!AU69*s!AX69))+IF(s!AT69*s!AZ69+s!AV69*s!AX69=0,0,M70*s!AT69*s!AZ69/(s!AT69*s!AZ69+s!AV69*s!AX69))+IF(s!AT69*s!BA69+s!AU69*s!AZ69+s!AV69*s!AY69+s!AW69*s!AX69=0,0,N70*s!AT69*s!BA69/(s!AT69*s!BA69+s!AU69*s!AZ69+s!AV69*s!AY69+s!AW69*s!AX69)) -> 244.65839693632086 | AU70: =AD70+IF(s!AU69*s!AV69+s!AT69*s!AW69=0,0,E70*s!AU69*s!AV69/(s!AU69*s!AV69+s!AT69*s!AW69))+IF(s!AT69*s!AY69+s!AU69*s!AX69=0,0,K70*s!AU69*s!AX69/(s!AT69*s!AY69+s!AU69*s!AX69))+IF(s!AU69*s!BA69+s!AW69*s!AY69=0,0,O70*s!AU69*s!BA69/(s!AU69*s!BA69+s!AW69*s!AY69))+IF(s!AT69*s!BA69+s!AU69*s!AZ69+s!AV69*s!AY69+s!AW69*s!AX69=0,0,N70*s!AU69*s!AZ69/(s!AT69*s!BA69+s!AU69*s!AZ69+s!AV69*s!AY69+s!AW69*s!AX69)) -> 445.77362055042272 | AV70: =AE70+IF(s!AU69*s!AV69+s!AT69*s!AW69=0,0,E70*s!AU69*s!AV69/(s!AU69*s!AV69+s!AT69*s!AW69))+IF(s!AV69*s!AX69+s!AT69*s!AZ69=0,0,M70*s!AV69*s!AX69/(s!AV69*s!AX69+s!AT69*s!AZ69))+IF(s!AV69*s!BA69+s!AW69*s!AZ69=0,0,Q70*s!AV69*s!BA69/(s!AV69*s!BA69+s!AW69*s!AZ69))+IF(s!AT69*s!BA69+s!AU69*s!AZ69+s!AV69*s!AY69+s!AW69*s!AX69=0,0,N70*s!AV69*s!AY69/(s!AT69*s!BA69+s!AU69*s!AZ69+s!AV69*s!AY69+s!AW69*s!AX69)) -> 13.961447026409617 | AW70: =AF70+IF(s!AT69*s!AW69+s!AU69*s!AV69=0,0,E70*s!AT69*s!AW69/(s!AT69*s!AW69+s!AU69*s!AV69))+IF(s!AU69*s!BA69+s!AW69*s!AY69=0,0,O70*s!AW69*s!AY69/(s!AU69*s!BA69+s!AW69*s!AY69))+IF(s!AV69*s!BA69+s!AW69*s!AZ69=0,0,Q70*s!AW69*s!AZ69/(s!AV69*s!BA69+s!AW69*s!AZ69))+IF(s!AT69*s!BA69+s!AU69*s!AZ69+s!AV69*s!AY69+s!AW69*s!AX69=0,0,N70*s!AW69*s!AX69/(s!AT69*s!BA69+s!AU69*s!AZ69+s!AV69*s!AY69+s!AW69*s!AX69)) -> 9.6065354868467683 | AX70: =AG70+IF(s!AT69*s!AY69+s!AU69*s!AX69=0,0,K70*s!AU69*s!AX69/(s!AT69*s!AY69+s!AU69*s!AX69))+IF(s!AV69*s!AX69+s!AT69*s!AZ69=0,0,M70*s!AV69*s!AX69/(s!AV69*s!AX69+s!AT69*s!AZ69))+IF(s!AX69*s!BA69+s!AY69*s!AZ69=0,0,W70*s!AX69*s!BA69/(s!AX69*s!BA69+s!AY69*s!AZ69))+IF(s!AT69*s!BA69+s!AU69*s!AZ69+s!AV69*s!AY69+s!AW69*s!AX69=0,0,N70*s!AW69*s!AX69/(s!AT69*s!BA69+s!AU69*s!AZ69+s!AV69*s!AY69+s!AW69*s!AX69)) -> 13.990720118810772 | AY70: =AH70+IF(s!AT69*s!AY69+s!AU69*s!AX69=0,0,K70*s!AT69*s!AY69/(s!AT69*s!AY69+s!AU69*s!AX69))+IF(s!AU69*s!BA69+s!AW69*s!AY69=0,0,O70*s!AW69*s!AY69/(s!AU69*s!BA69+s!AW69*s!AY69))+IF(s!AX69*s!BA69+s!AY69*s!AZ69=0,0,W70*s!AY69*s!AZ69/(s!AX69*s!BA69+s!AY69*s!AZ69))+IF(s!AT69*s!BA69+s!AU69*s!AZ69+s!AV69*s!AY69+s!AW69*s!AX69=0,0,N70*s!AV69*s!AY69/(s!AT69*s!BA69+s!AU69*s!AZ69+s!AV69*s!AY69+s!AW69*s!AX69)) -> 10.577262394445613 | AZ70: =AI70+IF(s!AT69*s!AZ69+s!AV69*s!AX69=0,0,M70*s!AT69*s!AZ69/(s!AT69*s!AZ69+s!AV69*s!AX69))+IF(s!AV69*s!BA69+s!AW69*s!AZ69=0,0,Q70*s!AW69*s!AZ69/(s!AV69*s!BA69+s!AW69*s!AZ69))+IF(s!AX69*s!BA69+s!AY69*s!AZ69=0,0,W70*s!AY69*s!AZ69/(s!AX69*s!BA69+s!AY69*s!AZ69))+IF(s!AT69*s!BA69+s!AU69*s!AZ69+s!AV69*s!AY69+s!AW69*s!AX69=0,0,N70*s!AU69*s!AZ69/(s!AT69*s!BA69+s!AU69*s!AZ69+s!AV69*s!AY69+s!AW69*s!AX69)) -> 17.389435918458748 | BA70: =AJ70+IF(s!AU69*s!BA69+s!AW69*s!AY69=0,0,O70*s!AU69*s!BA69/(s!AU69*s!BA69+s!AW69*s!AY69))+IF(s!AV69*s!BA69+s!AW69*s!AZ69=0,0,Q70*s!AV69*s!BA69/(s!AV69*s!BA69+s!AW69*s!AZ69))+IF(s!AX69*s!BA69+s!AY69*s!AZ69=0,0,W70*s!AX69*s!BA69/(s!AX69*s!BA69+s!AY69*s!AZ69))+IF(s!AT69*s!BA69+s!AU69*s!AZ69+s!AV69*s!AY69+s!AW69*s!AX69=0,0,N70*s!AT69*s!BA69/(s!AT69*s!BA69+s!AU69*s!AZ69+s!AV69*s!AY69+s!AW69*s!AX69)) -> 22.042581568284863 | BJ70: =SUM(AT70:BA70) -> 778
A71: =A70 -> 100 | B71: =B70 -> 30 | C71: =C70 -> 200 | D71: =D70 -> 2 | E71: =E70 -> 4 | F71: =F70 -> 1 | G71: =G70 -> 1 | H71: =H70 -> 2 | I71: =I70 -> 1 | J71: =J70 -> 2 | K71: =K70 -> 4 | L71: =L70 -> 2 | M71: =M70 -> 4 | N71: =N70 -> 8 | O71: =O70 -> 4 | P71: =P70 -> 2 | Q71: =Q70 -> 4 | R71: =R70 -> 2 | S71: =S70 -> 1 | T71: =T70 -> 2 | U71: =U70 -> 1 | V71: =V70 -> 2 | W71: =W70 -> 4 | X71: =X70 -> 2 | Y71: =Y70 -> 1 | Z71: =Z70 -> 2 | AA71: =AA70 -> 1 | AB71: =AB70 -> 389 | AC71: =AC70 -> 234 | AD71: =AD70 -> 433 | AE71: =AE70 -> 8 | AF71: =AF70 -> 7 | AG71: =AG70 -> 8 | AH71: =AH70 -> 8 | AI71: =AI70 -> 8 | AJ71: =AJ70 -> 8 | AS71: =AS70 -> 714 | AT71: =AC71+IF(s!AT70*s!AW70+s!AU70*s!AV70=0,0,E71*s!AT70*s!AW70/(s!AT70*s!AW70+s!AU70*s!AV70))+IF(s!AT70*s!AY70+s!AU70*s!AX70=0,0,K71*s!AT70*s!AY70/(s!AT70*s!AY70+s!AU70*s!AX70))+IF(s!AT70*s!AZ70+s!AV70*s!AX70=0,0,M71*s!AT70*s!AZ70/(s!AT70*s!AZ70+s!AV70*s!AX70))+IF(s!AT70*s!BA70+s!AU70*s!AZ70+s!AV70*s!AY70+s!AW70*s!AX70=0,0,N71*s!AT70*s!BA70/(s!AT70*s!BA70+s!AU70*s!AZ70+s!AV70*s!AY70+s!AW70*s!AX70)) -> 244.65839693632759 | AU71: =AD71+IF(s!AU70*s!AV70+s!AT70*s!AW70=0,0,E71*s!AU70*s!AV70/(s!AU70*s!AV70+s!AT70*s!AW70))+IF(s!AT70*s!AY70+s!AU70*s!AX70=0,0,K71*s!AU70*s!AX70/(s!AT70*s!AY70+s!AU70*s!AX70))+IF(s!AU70*s!BA70+s!AW70*s!AY70=0,0,O71*s!AU70*s!BA70/(s!AU70*s!BA70+s!AW70*s!AY70))+IF(s!AT70*s!BA70+s!AU70*s!AZ70+s!AV70*s!AY70+s!AW70*s!AX70=0,0,N71*s!AU70*s!AZ70/(s!AT70*s!BA70+s!AU70*s!AZ70+s!AV70*s!AY70+s!AW70*s!AX70)) -> 445.77362055041186 | AV71: =AE71+IF(s!AU70*s!AV70+s!AT70*s!AW70=0,0,E71*s!AU70*s!AV70/(s!AU70*s!AV70+s!AT70*s!AW70))+IF(s!AV70*s!AX70+s!AT70*s!AZ70=0,0,M71*s!AV70*s!AX70/(s!AV70*s!AX70+s!AT70*s!AZ70))+IF(s!AV70*s!BA70+s!AW70*s!AZ70=0,0,Q71*s!AV70*s!BA70/(s!AV70*s!BA70+s!AW70*s!AZ70))+IF(s!AT70*s!BA70+s!AU70*s!AZ70+s!AV70*s!AY70+s!AW70*s!AX70=0,0,N71*s!AV70*s!AY70/(s!AT70*s!BA70+s!AU70*s!AZ70+s!AV70*s!AY70+s!AW70*s!AX70)) -> 13.961447026471165 | AW71: =AF71+IF(s!AT70*s!AW70+s!AU70*s!AV70=0,0,E71*s!AT70*s!AW70/(s!AT70*s!AW70+s!AU70*s!AV70))+IF(s!AU70*s!BA70+s!AW70*s!AY70=0,0,O71*s!AW70*s!AY70/(s!AU70*s!BA70+s!AW70*s!AY70))+IF(s!AV70*s!BA70+s!AW70*s!AZ70=0,0,Q71*s!AW70*s!AZ70/(s!AV70*s!BA70+s!AW70*s!AZ70))+IF(s!AT70*s!BA70+s!AU70*s!AZ70+s!AV70*s!AY70+s!AW70*s!AX70=0,0,N71*s!AW70*s!AX70/(s!AT70*s!BA70+s!AU70*s!AZ70+s!AV70*s!AY70+s!AW70*s!AX70)) -> 9.606535486789392 | AX71: =AG71+IF(s!AT70*s!AY70+s!AU70*s!AX70=0,0,K71*s!AU70*s!AX70/(s!AT70*s!AY70+s!AU70*s!AX70))+IF(s!AV70*s!AX70+s!AT70*s!AZ70=0,0,M71*s!AV70*s!AX70/(s!AV70*s!AX70+s!AT70*s!AZ70))+IF(s!AX70*s!BA70+s!AY70*s!AZ70=0,0,W71*s!AX70*s!BA70/(s!AX70*s!BA70+s!AY70*s!AZ70))+IF(s!AT70*s!BA70+s!AU70*s!AZ70+s!AV70*s!AY70+s!AW70*s!AX70=0,0,N71*s!AW70*s!AX70/(s!AT70*s!BA70+s!AU70*s!AZ70+s!AV70*s!AY70+s!AW70*s!AX70)) -> 13.990720118866559 | AY71: =AH71+IF(s!AT70*s!AY70+s!AU70*s!AX70=0,0,K71*s!AT70*s!AY70/(s!AT70*s!AY70+s!AU70*s!AX70))+IF(s!AU70*s!BA70+s!AW70*s!AY70=0,0,O71*s!AW70*s!AY70/(s!AU70*s!BA70+s!AW70*s!AY70))+IF(s!AX70*s!BA70+s!AY70*s!AZ70=0,0,W71*s!AY70*s!AZ70/(s!AX70*s!BA70+s!AY70*s!AZ70))+IF(s!AT70*s!BA70+s!AU70*s!AZ70+s!AV70*s!AY70+s!AW70*s!AX70=0,0,N71*s!AV70*s!AY70/(s!AT70*s!BA70+s!AU70*s!AZ70+s!AV70*s!AY70+s!AW70*s!AX70)) -> 10.577262394393998 | AZ71: =AI71+IF(s!AT70*s!AZ70+s!AV70*s!AX70=0,0,M71*s!AT70*s!AZ70/(s!AT70*s!AZ70+s!AV70*s!AX70))+IF(s!AV70*s!BA70+s!AW70*s!AZ70=0,0,Q71*s!AW70*s!AZ70/(s!AV70*s!BA70+s!AW70*s!AZ70))+IF(s!AX70*s!BA70+s!AY70*s!AZ70=0,0,W71*s!AY70*s!AZ70/(s!AX70*s!BA70+s!AY70*s!AZ70))+IF(s!AT70*s!BA70+s!AU70*s!AZ70+s!AV70*s!AY70+s!AW70*s!AX70=0,0,N71*s!AU70*s!AZ70/(s!AT70*s!BA70+s!AU70*s!AZ70+s!AV70*s!AY70+s!AW70*s!AX70)) -> 17.389435918334701 | BA71: =AJ71+IF(s!AU70*s!BA70+s!AW70*s!AY70=0,0,O71*s!AU70*s!BA70/(s!AU70*s!BA70+s!AW70*s!AY70))+IF(s!AV70*s!BA70+s!AW70*s!AZ70=0,0,Q71*s!AV70*s!BA70/(s!AV70*s!BA70+s!AW70*s!AZ70))+IF(s!AX70*s!BA70+s!AY70*s!AZ70=0,0,W71*s!AX70*s!BA70/(s!AX70*s!BA70+s!AY70*s!AZ70))+IF(s!AT70*s!BA70+s!AU70*s!AZ70+s!AV70*s!AY70+s!AW70*s!AX70=0,0,N71*s!AT70*s!BA70/(s!AT70*s!BA70+s!AU70*s!AZ70+s!AV70*s!AY70+s!AW70*s!AX70)) -> 22.042581568404742 | BJ71: =SUM(AT71:BA71) -> 778
A72: =A71 -> 100 | B72: =B71 -> 30 | C72: =C71 -> 200 | D72: =D71 -> 2 | E72: =E71 -> 4 | F72: =F71 -> 1 | G72: =G71 -> 1 | H72: =H71 -> 2 | I72: =I71 -> 1 | J72: =J71 -> 2 | K72: =K71 -> 4 | L72: =L71 -> 2 | M72: =M71 -> 4 | N72: =N71 -> 8 | O72: =O71 -> 4 | P72: =P71 -> 2 | Q72: =Q71 -> 4 | R72: =R71 -> 2 | S72: =S71 -> 1 | T72: =T71 -> 2 | U72: =U71 -> 1 | V72: =V71 -> 2 | W72: =W71 -> 4 | X72: =X71 -> 2 | Y72: =Y71 -> 1 | Z72: =Z71 -> 2 | AA72: =AA71 -> 1 | AB72: =AB71 -> 389 | AC72: =AC71 -> 234 | AD72: =AD71 -> 433 | AE72: =AE71 -> 8 | AF72: =AF71 -> 7 | AG72: =AG71 -> 8 | AH72: =AH71 -> 8 | AI72: =AI71 -> 8 | AJ72: =AJ71 -> 8 | AS72: =AS71 -> 714 | AT72: =AC72+IF(s!AT71*s!AW71+s!AU71*s!AV71=0,0,E72*s!AT71*s!AW71/(s!AT71*s!AW71+s!AU71*s!AV71))+IF(s!AT71*s!AY71+s!AU71*s!AX71=0,0,K72*s!AT71*s!AY71/(s!AT71*s!AY71+s!AU71*s!AX71))+IF(s!AT71*s!AZ71+s!AV71*s!AX71=0,0,M72*s!AT71*s!AZ71/(s!AT71*s!AZ71+s!AV71*s!AX71))+IF(s!AT71*s!BA71+s!AU71*s!AZ71+s!AV71*s!AY71+s!AW71*s!AX71=0,0,N72*s!AT71*s!BA71/(s!AT71*s!BA71+s!AU71*s!AZ71+s!AV71*s!AY71+s!AW71*s!AX71)) -> 244.65839693633239 | AU72: =AD72+IF(s!AU71*s!AV71+s!AT71*s!AW71=0,0,E72*s!AU71*s!AV71/(s!AU71*s!AV71+s!AT71*s!AW71))+IF(s!AT71*s!AY71+s!AU71*s!AX71=0,0,K72*s!AU71*s!AX71/(s!AT71*s!AY71+s!AU71*s!AX71))+IF(s!AU71*s!BA71+s!AW71*s!AY71=0,0,O72*s!AU71*s!BA71/(s!AU71*s!BA71+s!AW71*s!AY71))+IF(s!AT71*s!BA71+s!AU71*s!AZ71+s!AV71*s!AY71+s!AW71*s!AX71=0,0,N72*s!AU71*s!AZ71/(s!AT71*s!BA71+s!AU71*s!AZ71+s!AV71*s!AY71+s!AW71*s!AX71)) -> 445.77362055040402 | AV72: =AE72+IF(s!AU71*s!AV71+s!AT71*s!AW71=0,0,E72*s!AU71*s!AV71/(s!AU71*s!AV71+s!AT71*s!AW71))+IF(s!AV71*s!AX71+s!AT71*s!AZ71=0,0,M72*s!AV71*s!AX71/(s!AV71*s!AX71+s!AT71*s!AZ71))+IF(s!AV71*s!BA71+s!AW71*s!AZ71=0,0,Q72*s!AV71*s!BA71/(s!AV71*s!BA71+s!AW71*s!AZ71))+IF(s!AT71*s!BA71+s!AU71*s!AZ71+s!AV71*s!AY71+s!AW71*s!AX71=0,0,N72*s!AV71*s!AY71/(s!AT71*s!BA71+s!AU71*s!AZ71+s!AV71*s!AY71+s!AW71*s!AX71)) -> 13.961447026515199 | AW72: =AF72+IF(s!AT71*s!AW71+s!AU71*s!AV71=0,0,E72*s!AT71*s!AW71/(s!AT71*s!AW71+s!AU71*s!AV71))+IF(s!AU71*s!BA71+s!AW71*s!AY71=0,0,O72*s!AW71*s!AY71/(s!AU71*s!BA71+s!AW71*s!AY71))+IF(s!AV71*s!BA71+s!AW71*s!AZ71=0,0,Q72*s!AW71*s!AZ71/(s!AV71*s!BA71+s!AW71*s!AZ71))+IF(s!AT71*s!BA71+s!AU71*s!AZ71+s!AV71*s!AY71+s!AW71*s!AX71=0,0,N72*s!AW71*s!AX71/(s!AT71*s!BA71+s!AU71*s!AZ71+s!AV71*s!AY71+s!AW71*s!AX71)) -> 9.6065354867483421 | AX72: =AG72+IF(s!AT71*s!AY71+s!AU71*s!AX71=0,0,K72*s!AU71*s!AX71/(s!AT71*s!AY71+s!AU71*s!AX71))+IF(s!AV71*s!AX71+s!AT71*s!AZ71=0,0,M72*s!AV71*s!AX71/(s!AV71*s!AX71+s!AT71*s!AZ71))+IF(s!AX71*s!BA71+s!AY71*s!AZ71=0,0,W72*s!AX71*s!BA71/(s!AX71*s!BA71+s!AY71*s!AZ71))+IF(s!AT71*s!BA71+s!AU71*s!AZ71+s!AV71*s!AY71+s!AW71*s!AX71=0,0,N72*s!AW71*s!AX71/(s!AT71*s!BA71+s!AU71*s!AZ71+s!AV71*s!AY71+s!AW71*s!AX71)) -> 13.990720118906472 | AY72: =AH72+IF(s!AT71*s!AY71+s!AU71*s!AX71=0,0,K72*s!AT71*s!AY71/(s!AT71*s!AY71+s!AU71*s!AX71))+IF(s!AU71*s!BA71+s!AW71*s!AY71=0,0,O72*s!AW71*s!AY71/(s!AU71*s!BA71+s!AW71*s!AY71))+IF(s!AX71*s!BA71+s!AY71*s!AZ71=0,0,W72*s!AY71*s!AZ71/(s!AX71*s!BA71+s!AY71*s!AZ71))+IF(s!AT71*s!BA71+s!AU71*s!AZ71+s!AV71*s!AY71+s!AW71*s!AX71=0,0,N72*s!AV71*s!AY71/(s!AT71*s!BA71+s!AU71*s!AZ71+s!AV71*s!AY71+s!AW71*s!AX71)) -> 10.577262394357067 | AZ72: =AI72+IF(s!AT71*s!AZ71+s!AV71*s!AX71=0,0,M72*s!AT71*s!AZ71/(s!AT71*s!AZ71+s!AV71*s!AX71))+IF(s!AV71*s!BA71+s!AW71*s!AZ71=0,0,Q72*s!AW71*s!AZ71/(s!AV71*s!BA71+s!AW71*s!AZ71))+IF(s!AX71*s!BA71+s!AY71*s!AZ71=0,0,W72*s!AY71*s!AZ71/(s!AX71*s!BA71+s!AY71*s!AZ71))+IF(s!AT71*s!BA71+s!AU71*s!AZ71+s!AV71*s!AY71+s!AW71*s!AX71=0,0,N72*s!AU71*s!AZ71/(s!AT71*s!BA71+s!AU71*s!AZ71+s!AV71*s!AY71+s!AW71*s!AX71)) -> 17.389435918245951 | BA72: =AJ72+IF(s!AU71*s!BA71+s!AW71*s!AY71=0,0,O72*s!AU71*s!BA71/(s!AU71*s!BA71+s!AW71*s!AY71))+IF(s!AV71*s!BA71+s!AW71*s!AZ71=0,0,Q72*s!AV71*s!BA71/(s!AV71*s!BA71+s!AW71*s!AZ71))+IF(s!AX71*s!BA71+s!AY71*s!AZ71=0,0,W72*s!AX71*s!BA71/(s!AX71*s!BA71+s!AY71*s!AZ71))+IF(s!AT71*s!BA71+s!AU71*s!AZ71+s!AV71*s!AY71+s!AW71*s!AX71=0,0,N72*s!AT71*s!BA71/(s!AT71*s!BA71+s!AU71*s!AZ71+s!AV71*s!AY71+s!AW71*s!AX71)) -> 22.042581568490508 | BJ72: =SUM(AT72:BA72) -> 778
A73: =A72 -> 100 | B73: =B72 -> 30 | C73: =C72 -> 200 | D73: =D72 -> 2 | E73: =E72 -> 4 | F73: =F72 -> 1 | G73: =G72 -> 1 | H73: =H72 -> 2 | I73: =I72 -> 1 | J73: =J72 -> 2 | K73: =K72 -> 4 | L73: =L72 -> 2 | M73: =M72 -> 4 | N73: =N72 -> 8 | O73: =O72 -> 4 | P73: =P72 -> 2 | Q73: =Q72 -> 4 | R73: =R72 -> 2 | S73: =S72 -> 1 | T73: =T72 -> 2 | U73: =U72 -> 1 | V73: =V72 -> 2 | W73: =W72 -> 4 | X73: =X72 -> 2 | Y73: =Y72 -> 1 | Z73: =Z72 -> 2 | AA73: =AA72 -> 1 | AB73: =AB72 -> 389 | AC73: =AC72 -> 234 | AD73: =AD72 -> 433 | AE73: =AE72 -> 8 | AF73: =AF72 -> 7 | AG73: =AG72 -> 8 | AH73: =AH72 -> 8 | AI73: =AI72 -> 8 | AJ73: =AJ72 -> 8 | AS73: =AS72 -> 714 | AT73: =AC73+IF(s!AT72*s!AW72+s!AU72*s!AV72=0,0,E73*s!AT72*s!AW72/(s!AT72*s!AW72+s!AU72*s!AV72))+IF(s!AT72*s!AY72+s!AU72*s!AX72=0,0,K73*s!AT72*s!AY72/(s!AT72*s!AY72+s!AU72*s!AX72))+IF(s!AT72*s!AZ72+s!AV72*s!AX72=0,0,M73*s!AT72*s!AZ72/(s!AT72*s!AZ72+s!AV72*s!AX72))+IF(s!AT72*s!BA72+s!AU72*s!AZ72+s!AV72*s!AY72+s!AW72*s!AX72=0,0,N73*s!AT72*s!BA72/(s!AT72*s!BA72+s!AU72*s!AZ72+s!AV72*s!AY72+s!AW72*s!AX72)) -> 244.65839693633581 | AU73: =AD73+IF(s!AU72*s!AV72+s!AT72*s!AW72=0,0,E73*s!AU72*s!AV72/(s!AU72*s!AV72+s!AT72*s!AW72))+IF(s!AT72*s!AY72+s!AU72*s!AX72=0,0,K73*s!AU72*s!AX72/(s!AT72*s!AY72+s!AU72*s!AX72))+IF(s!AU72*s!BA72+s!AW72*s!AY72=0,0,O73*s!AU72*s!BA72/(s!AU72*s!BA72+s!AW72*s!AY72))+IF(s!AT72*s!BA72+s!AU72*s!AZ72+s!AV72*s!AY72+s!AW72*s!AX72=0,0,N73*s!AU72*s!AZ72/(s!AT72*s!BA72+s!AU72*s!AZ72+s!AV72*s!AY72+s!AW72*s!AX72)) -> 445.7736205503985 | AV73: =AE73+IF(s!AU72*s!AV72+s!AT72*s!AW72=0,0,E73*s!AU72*s!AV72/(s!AU72*s!AV72+s!AT72*s!AW72))+IF(s!AV72*s!AX72+s!AT72*s!AZ72=0,0,M73*s!AV72*s!AX72/(s!AV72*s!AX72+s!AT72*s!AZ72))+IF(s!AV72*s!BA72+s!AW72*s!AZ72=0,0,Q73*s!AV72*s!BA72/(s!AV72*s!BA72+s!AW72*s!AZ72))+IF(s!AT72*s!BA72+s!AU72*s!AZ72+s!AV72*s!AY72+s!AW72*s!AX72=0,0,N73*s!AV72*s!AY72/(s!AT72*s!BA72+s!AU72*s!AZ72+s!AV72*s!AY72+s!AW72*s!AX72)) -> 13.961447026546702 | AW73: =AF73+IF(s!AT72*s!AW72+s!AU72*s!AV72=0,0,E73*s!AT72*s!AW72/(s!AT72*s!AW72+s!AU72*s!AV72))+IF(s!AU72*s!BA72+s!AW72*s!AY72=0,0,O73*s!AW72*s!AY72/(s!AU72*s!BA72+s!AW72*s!AY72))+IF(s!AV72*s!BA72+s!AW72*s!AZ72=0,0,Q73*s!AW72*s!AZ72/(s!AV72*s!BA72+s!AW72*s!AZ72))+IF(s!AT72*s!BA72+s!AU72*s!AZ72+s!AV72*s!AY72+s!AW72*s!AX72=0,0,N73*s!AW72*s!AX72/(s!AT72*s!BA72+s!AU72*s!AZ72+s!AV72*s!AY72+s!AW72*s!AX72)) -> 9.6065354867189736 | AX73: =AG73+IF(s!AT72*s!AY72+s!AU72*s!AX72=0,0,K73*s!AU72*s!AX72/(s!AT72*s!AY72+s!AU72*s!AX72))+IF(s!AV72*s!AX72+s!AT72*s!AZ72=0,0,M73*s!AV72*s!AX72/(s!AV72*s!AX72+s!AT72*s!AZ72))+IF(s!AX72*s!BA72+s!AY72*s!AZ72=0,0,W73*s!AX72*s!BA72/(s!AX72*s!BA72+s!AY72*s!AZ72))+IF(s!AT72*s!BA72+s!AU72*s!AZ72+s!AV72*s!AY72+s!AW72*s!AX72=0,0,N73*s!AW72*s!AX72/(s!AT72*s!BA72+s!AU72*s!AZ72+s!AV72*s!AY72+s!AW72*s!AX72)) -> 13.990720118935027 | AY73: =AH73+IF(s!AT72*s!AY72+s!AU72*s!AX72=0,0,K73*s!AT72*s!AY72/(s!AT72*s!AY72+s!AU72*s!AX72))+IF(s!AU72*s!BA72+s!AW72*s!AY72=0,0,O73*s!AW72*s!AY72/(s!AU72*s!BA72+s!AW72*s!AY72))+IF(s!AX72*s!BA72+s!AY72*s!AZ72=0,0,W73*s!AY72*s!AZ72/(s!AX72*s!BA72+s!AY72*s!AZ72))+IF(s!AT72*s!BA72+s!AU72*s!AZ72+s!AV72*s!AY72+s!AW72*s!AX72=0,0,N73*s!AV72*s!AY72/(s!AT72*s!BA72+s!AU72*s!AZ72+s!AV72*s!AY72+s!AW72*s!AX72)) -> 10.577262394330651 | AZ73: =AI73+IF(s!AT72*s!AZ72+s!AV72*s!AX72=0,0,M73*s!AT72*s!AZ72/(s!AT72*s!AZ72+s!AV72*s!AX72))+IF(s!AV72*s!BA72+s!AW72*s!AZ72=0,0,Q73*s!AW72*s!AZ72/(s!AV72*s!BA72+s!AW72*s!AZ72))+IF(s!AX72*s!BA72+s!AY72*s!AZ72=0,0,W73*s!AY72*s!AZ72/(s!AX72*s!BA72+s!AY72*s!AZ72))+IF(s!AT72*s!BA72+s!AU72*s!AZ72+s!AV72*s!AY72+s!AW72*s!AX72=0,0,N73*s!AU72*s!AZ72/(s!AT72*s!BA72+s!AU72*s!AZ72+s!AV72*s!AY72+s!AW72*s!AX72)) -> 17.389435918182457 | BA73: =AJ73+IF(s!AU72*s!BA72+s!AW72*s!AY72=0,0,O73*s!AU72*s!BA72/(s!AU72*s!BA72+s!AW72*s!AY72))+IF(s!AV72*s!BA72+s!AW72*s!AZ72=0,0,Q73*s!AV72*s!BA72/(s!AV72*s!BA72+s!AW72*s!AZ72))+IF(s!AX72*s!BA72+s!AY72*s!AZ72=0,0,W73*s!AX72*s!BA72/(s!AX72*s!BA72+s!AY72*s!AZ72))+IF(s!AT72*s!BA72+s!AU72*s!AZ72+s!AV72*s!AY72+s!AW72*s!AX72=0,0,N73*s!AT72*s!BA72/(s!AT72*s!BA72+s!AU72*s!AZ72+s!AV72*s!AY72+s!AW72*s!AX72)) -> 22.042581568551867 | BJ73: =SUM(AT73:BA73) -> 778
A74: =A73 -> 100 | B74: =B73 -> 30 | C74: =C73 -> 200 | D74: =D73 -> 2 | E74: =E73 -> 4 | F74: =F73 -> 1 | G74: =G73 -> 1 | H74: =H73 -> 2 | I74: =I73 -> 1 | J74: =J73 -> 2 | K74: =K73 -> 4 | L74: =L73 -> 2 | M74: =M73 -> 4 | N74: =N73 -> 8 | O74: =O73 -> 4 | P74: =P73 -> 2 | Q74: =Q73 -> 4 | R74: =R73 -> 2 | S74: =S73 -> 1 | T74: =T73 -> 2 | U74: =U73 -> 1 | V74: =V73 -> 2 | W74: =W73 -> 4 | X74: =X73 -> 2 | Y74: =Y73 -> 1 | Z74: =Z73 -> 2 | AA74: =AA73 -> 1 | AB74: =AB73 -> 389 | AC74: =AC73 -> 234 | AD74: =AD73 -> 433 | AE74: =AE73 -> 8 | AF74: =AF73 -> 7 | AG74: =AG73 -> 8 | AH74: =AH73 -> 8 | AI74: =AI73 -> 8 | AJ74: =AJ73 -> 8 | AS74: =AS73 -> 714 | AT74: =AC74+IF(s!AT73*s!AW73+s!AU73*s!AV73=0,0,E74*s!AT73*s!AW73/(s!AT73*s!AW73+s!AU73*s!AV73))+IF(s!AT73*s!AY73+s!AU73*s!AX73=0,0,K74*s!AT73*s!AY73/(s!AT73*s!AY73+s!AU73*s!AX73))+IF(s!AT73*s!AZ73+s!AV73*s!AX73=0,0,M74*s!AT73*s!AZ73/(s!AT73*s!AZ73+s!AV73*s!AX73))+IF(s!AT73*s!BA73+s!AU73*s!AZ73+s!AV73*s!AY73+s!AW73*s!AX73=0,0,N74*s!AT73*s!BA73/(s!AT73*s!BA73+s!AU73*s!AZ73+s!AV73*s!AY73+s!AW73*s!AX73)) -> 244.65839693633825 | AU74: =AD74+IF(s!AU73*s!AV73+s!AT73*s!AW73=0,0,E74*s!AU73*s!AV73/(s!AU73*s!AV73+s!AT73*s!AW73))+IF(s!AT73*s!AY73+s!AU73*s!AX73=0,0,K74*s!AU73*s!AX73/(s!AT73*s!AY73+s!AU73*s!AX73))+IF(s!AU73*s!BA73+s!AW73*s!AY73=0,0,O74*s!AU73*s!BA73/(s!AU73*s!BA73+s!AW73*s!AY73))+IF(s!AT73*s!BA73+s!AU73*s!AZ73+s!AV73*s!AY73+s!AW73*s!AX73=0,0,N74*s!AU73*s!AZ73/(s!AT73*s!BA73+s!AU73*s!AZ73+s!AV73*s!AY73+s!AW73*s!AX73)) -> 445.77362055039453 | AV74: =AE74+IF(s!AU73*s!AV73+s!AT73*s!AW73=0,0,E74*s!AU73*s!AV73/(s!AU73*s!AV73+s!AT73*s!AW73))+IF(s!AV73*s!AX73+s!AT73*s!AZ73=0,0,M74*s!AV73*s!AX73/(s!AV73*s!AX73+s!AT73*s!AZ73))+IF(s!AV73*s!BA73+s!AW73*s!AZ73=0,0,Q74*s!AV73*s!BA73/(s!AV73*s!BA73+s!AW73*s!AZ73))+IF(s!AT73*s!BA73+s!AU73*s!AZ73+s!AV73*s!AY73+s!AW73*s!AX73=0,0,N74*s!AV73*s!AY73/(s!AT73*s!BA73+s!AU73*s!AZ73+s!AV73*s!AY73+s!AW73*s!AX73)) -> 13.961447026569241 | AW74: =AF74+IF(s!AT73*s!AW73+s!AU73*s!AV73=0,0,E74*s!AT73*s!AW73/(s!AT73*s!AW73+s!AU73*s!AV73))+IF(s!AU73*s!BA73+s!AW73*s!AY73=0,0,O74*s!AW73*s!AY73/(s!AU73*s!BA73+s!AW73*s!AY73))+IF(s!AV73*s!BA73+s!AW73*s!AZ73=0,0,Q74*s!AW73*s!AZ73/(s!AV73*s!BA73+s!AW73*s!AZ73))+IF(s!AT73*s!BA73+s!AU73*s!AZ73+s!AV73*s!AY73+s!AW73*s!AX73=0,0,N74*s!AW73*s!AX73/(s!AT73*s!BA73+s!AU73*s!AZ73+s!AV73*s!AY73+s!AW73*s!AX73)) -> 9.6065354866979629 | AX74: =AG74+IF(s!AT73*s!AY73+s!AU73*s!AX73=0,0,K74*s!AU73*s!AX73/(s!AT73*s!AY73+s!AU73*s!AX73))+IF(s!AV73*s!AX73+s!AT73*s!AZ73=0,0,M74*s!AV73*s!AX73/(s!AV73*s!AX73+s!AT73*s!AZ73))+IF(s!AX73*s!BA73+s!AY73*s!AZ73=0,0,W74*s!AX73*s!BA73/(s!AX73*s!BA73+s!AY73*s!AZ73))+IF(s!AT73*s!BA73+s!AU73*s!AZ73+s!AV73*s!AY73+s!AW73*s!AX73=0,0,N74*s!AW73*s!AX73/(s!AT73*s!BA73+s!AU73*s!AZ73+s!AV73*s!AY73+s!AW73*s!AX73)) -> 13.990720118955455 | AY74: =AH74+IF(s!AT73*s!AY73+s!AU73*s!AX73=0,0,K74*s!AT73*s!AY73/(s!AT73*s!AY73+s!AU73*s!AX73))+IF(s!AU73*s!BA73+s!AW73*s!AY73=0,0,O74*s!AW73*s!AY73/(s!AU73*s!BA73+s!AW73*s!AY73))+IF(s!AX73*s!BA73+s!AY73*s!AZ73=0,0,W74*s!AY73*s!AZ73/(s!AX73*s!BA73+s!AY73*s!AZ73))+IF(s!AT73*s!BA73+s!AU73*s!AZ73+s!AV73*s!AY73+s!AW73*s!AX73=0,0,N74*s!AV73*s!AY73/(s!AT73*s!BA73+s!AU73*s!AZ73+s!AV73*s!AY73+s!AW73*s!AX73)) -> 10.577262394311749 | AZ74: =AI74+IF(s!AT73*s!AZ73+s!AV73*s!AX73=0,0,M74*s!AT73*s!AZ73/(s!AT73*s!AZ73+s!AV73*s!AX73))+IF(s!AV73*s!BA73+s!AW73*s!AZ73=0,0,Q74*s!AW73*s!AZ73/(s!AV73*s!BA73+s!AW73*s!AZ73))+IF(s!AX73*s!BA73+s!AY73*s!AZ73=0,0,W74*s!AY73*s!AZ73/(s!AX73*s!BA73+s!AY73*s!AZ73))+IF(s!AT73*s!BA73+s!AU73*s!AZ73+s!AV73*s!AY73+s!AW73*s!AX73=0,0,N74*s!AU73*s!AZ73/(s!AT73*s!BA73+s!AU73*s!AZ73+s!AV73*s!AY73+s!AW73*s!AX73)) -> 17.389435918137032 | BA74: =AJ74+IF(s!AU73*s!BA73+s!AW73*s!AY73=0,0,O74*s!AU73*s!BA73/(s!AU73*s!BA73+s!AW73*s!AY73))+IF(s!AV73*s!BA73+s!AW73*s!AZ73=0,0,Q74*s!AV73*s!BA73/(s!AV73*s!BA73+s!AW73*s!AZ73))+IF(s!AX73*s!BA73+s!AY73*s!AZ73=0,0,W74*s!AX73*s!BA73/(s!AX73*s!BA73+s!AY73*s!AZ73))+IF(s!AT73*s!BA73+s!AU73*s!AZ73+s!AV73*s!AY73+s!AW73*s!AX73=0,0,N74*s!AT73*s!BA73/(s!AT73*s!BA73+s!AU73*s!AZ73+s!AV73*s!AY73+s!AW73*s!AX73)) -> 22.042581568595764 | BJ74: =SUM(AT74:BA74) -> 778
A75: =A74 -> 100 | B75: =B74 -> 30 | C75: =C74 -> 200 | D75: =D74 -> 2 | E75: =E74 -> 4 | F75: =F74 -> 1 | G75: =G74 -> 1 | H75: =H74 -> 2 | I75: =I74 -> 1 | J75: =J74 -> 2 | K75: =K74 -> 4 | L75: =L74 -> 2 | M75: =M74 -> 4 | N75: =N74 -> 8 | O75: =O74 -> 4 | P75: =P74 -> 2 | Q75: =Q74 -> 4 | R75: =R74 -> 2 | S75: =S74 -> 1 | T75: =T74 -> 2 | U75: =U74 -> 1 | V75: =V74 -> 2 | W75: =W74 -> 4 | X75: =X74 -> 2 | Y75: =Y74 -> 1 | Z75: =Z74 -> 2 | AA75: =AA74 -> 1 | AB75: =AB74 -> 389 | AC75: =AC74 -> 234 | AD75: =AD74 -> 433 | AE75: =AE74 -> 8 | AF75: =AF74 -> 7 | AG75: =AG74 -> 8 | AH75: =AH74 -> 8 | AI75: =AI74 -> 8 | AJ75: =AJ74 -> 8 | AS75: =AS74 -> 714 | AT75: =AC75+IF(s!AT74*s!AW74+s!AU74*s!AV74=0,0,E75*s!AT74*s!AW74/(s!AT74*s!AW74+s!AU74*s!AV74))+IF(s!AT74*s!AY74+s!AU74*s!AX74=0,0,K75*s!AT74*s!AY74/(s!AT74*s!AY74+s!AU74*s!AX74))+IF(s!AT74*s!AZ74+s!AV74*s!AX74=0,0,M75*s!AT74*s!AZ74/(s!AT74*s!AZ74+s!AV74*s!AX74))+IF(s!AT74*s!BA74+s!AU74*s!AZ74+s!AV74*s!AY74+s!AW74*s!AX74=0,0,N75*s!AT74*s!BA74/(s!AT74*s!BA74+s!AU74*s!AZ74+s!AV74*s!AY74+s!AW74*s!AX74)) -> 244.65839693634004 | AU75: =AD75+IF(s!AU74*s!AV74+s!AT74*s!AW74=0,0,E75*s!AU74*s!AV74/(s!AU74*s!AV74+s!AT74*s!AW74))+IF(s!AT74*s!AY74+s!AU74*s!AX74=0,0,K75*s!AU74*s!AX74/(s!AT74*s!AY74+s!AU74*s!AX74))+IF(s!AU74*s!BA74+s!AW74*s!AY74=0,0,O75*s!AU74*s!BA74/(s!AU74*s!BA74+s!AW74*s!AY74))+IF(s!AT74*s!BA74+s!AU74*s!AZ74+s!AV74*s!AY74+s!AW74*s!AX74=0,0,N75*s!AU74*s!AZ74/(s!AT74*s!BA74+s!AU74*s!AZ74+s!AV74*s!AY74+s!AW74*s!AX74)) -> 445.77362055039168 | AV75: =AE75+IF(s!AU74*s!AV74+s!AT74*s!AW74=0,0,E75*s!AU74*s!AV74/(s!AU74*s!AV74+s!AT74*s!AW74))+IF(s!AV74*s!AX74+s!AT74*s!AZ74=0,0,M75*s!AV74*s!AX74/(s!AV74*s!AX74+s!AT74*s!AZ74))+IF(s!AV74*s!BA74+s!AW74*s!AZ74=0,0,Q75*s!AV74*s!BA74/(s!AV74*s!BA74+s!AW74*s!AZ74))+IF(s!AT74*s!BA74+s!AU74*s!AZ74+s!AV74*s!AY74+s!AW74*s!AX74=0,0,N75*s!AV74*s!AY74/(s!AT74*s!BA74+s!AU74*s!AZ74+s!AV74*s!AY74+s!AW74*s!AX74)) -> 13.961447026585367 | AW75: =AF75+IF(s!AT74*s!AW74+s!AU74*s!AV74=0,0,E75*s!AT74*s!AW74/(s!AT74*s!AW74+s!AU74*s!AV74))+IF(s!AU74*s!BA74+s!AW74*s!AY74=0,0,O75*s!AW74*s!AY74/(s!AU74*s!BA74+s!AW74*s!AY74))+IF(s!AV74*s!BA74+s!AW74*s!AZ74=0,0,Q75*s!AW74*s!AZ74/(s!AV74*s!BA74+s!AW74*s!AZ74))+IF(s!AT74*s!BA74+s!AU74*s!AZ74+s!AV74*s!AY74+s!AW74*s!AX74=0,0,N75*s!AW74*s!AX74/(s!AT74*s!BA74+s!AU74*s!AZ74+s!AV74*s!AY74+s!AW74*s!AX74)) -> 9.6065354866829313 | AX75: =AG75+IF(s!AT74*s!AY74+s!AU74*s!AX74=0,0,K75*s!AU74*s!AX74/(s!AT74*s!AY74+s!AU74*s!AX74))+IF(s!AV74*s!AX74+s!AT74*s!AZ74=0,0,M75*s!AV74*s!AX74/(s!AV74*s!AX74+s!AT74*s!AZ74))+IF(s!AX74*s!BA74+s!AY74*s!AZ74=0,0,W75*s!AX74*s!BA74/(s!AX74*s!BA74+s!AY74*s!AZ74))+IF(s!AT74*s!BA74+s!AU74*s!AZ74+s!AV74*s!AY74+s!AW74*s!AX74=0,0,N75*s!AW74*s!AX74/(s!AT74*s!BA74+s!AU74*s!AZ74+s!AV74*s!AY74+s!AW74*s!AX74)) -> 13.990720118970071 | AY75: =AH75+IF(s!AT74*s!AY74+s!AU74*s!AX74=0,0,K75*s!AT74*s!AY74/(s!AT74*s!AY74+s!AU74*s!AX74))+IF(s!AU74*s!BA74+s!AW74*s!AY74=0,0,O75*s!AW74*s!AY74/(s!AU74*s!BA74+s!AW74*s!AY74))+IF(s!AX74*s!BA74+s!AY74*s!AZ74=0,0,W75*s!AY74*s!AZ74/(s!AX74*s!BA74+s!AY74*s!AZ74))+IF(s!AT74*s!BA74+s!AU74*s!AZ74+s!AV74*s!AY74+s!AW74*s!AX74=0,0,N75*s!AV74*s!AY74/(s!AT74*s!BA74+s!AU74*s!AZ74+s!AV74*s!AY74+s!AW74*s!AX74)) -> 10.577262394298227 | AZ75: =AI75+IF(s!AT74*s!AZ74+s!AV74*s!AX74=0,0,M75*s!AT74*s!AZ74/(s!AT74*s!AZ74+s!AV74*s!AX74))+IF(s!AV74*s!BA74+s!AW74*s!AZ74=0,0,Q75*s!AW74*s!AZ74/(s!AV74*s!BA74+s!AW74*s!AZ74))+IF(s!AX74*s!BA74+s!AY74*s!AZ74=0,0,W75*s!AY74*s!AZ74/(s!AX74*s!BA74+s!AY74*s!AZ74))+IF(s!AT74*s!BA74+s!AU74*s!AZ74+s!AV74*s!AY74+s!AW74*s!AX74=0,0,N75*s!AU74*s!AZ74/(s!AT74*s!BA74+s!AU74*s!AZ74+s!AV74*s!AY74+s!AW74*s!AX74)) -> 17.389435918104532 | BA75: =AJ75+IF(s!AU74*s!BA74+s!AW74*s!AY74=0,0,O75*s!AU74*s!BA74/(s!AU74*s!BA74+s!AW74*s!AY74))+IF(s!AV74*s!BA74+s!AW74*s!AZ74=0,0,Q75*s!AV74*s!BA74/(s!AV74*s!BA74+s!AW74*s!AZ74))+IF(s!AX74*s!BA74+s!AY74*s!AZ74=0,0,W75*s!AX74*s!BA74/(s!AX74*s!BA74+s!AY74*s!AZ74))+IF(s!AT74*s!BA74+s!AU74*s!AZ74+s!AV74*s!AY74+s!AW74*s!AX74=0,0,N75*s!AT74*s!BA74/(s!AT74*s!BA74+s!AU74*s!AZ74+s!AV74*s!AY74+s!AW74*s!AX74)) -> 22.042581568627167 | BJ75: =SUM(AT75:BA75) -> 778
A76: =A75 -> 100 | B76: =B75 -> 30 | C76: =C75 -> 200 | D76: =D75 -> 2 | E76: =E75 -> 4 | F76: =F75 -> 1 | G76: =G75 -> 1 | H76: =H75 -> 2 | I76: =I75 -> 1 | J76: =J75 -> 2 | K76: =K75 -> 4 | L76: =L75 -> 2 | M76: =M75 -> 4 | N76: =N75 -> 8 | O76: =O75 -> 4 | P76: =P75 -> 2 | Q76: =Q75 -> 4 | R76: =R75 -> 2 | S76: =S75 -> 1 | T76: =T75 -> 2 | U76: =U75 -> 1 | V76: =V75 -> 2 | W76: =W75 -> 4 | X76: =X75 -> 2 | Y76: =Y75 -> 1 | Z76: =Z75 -> 2 | AA76: =AA75 -> 1 | AB76: =AB75 -> 389 | AC76: =AC75 -> 234 | AD76: =AD75 -> 433 | AE76: =AE75 -> 8 | AF76: =AF75 -> 7 | AG76: =AG75 -> 8 | AH76: =AH75 -> 8 | AI76: =AI75 -> 8 | AJ76: =AJ75 -> 8 | AS76: =AS75 -> 714 | AT76: =AC76+IF(s!AT75*s!AW75+s!AU75*s!AV75=0,0,E76*s!AT75*s!AW75/(s!AT75*s!AW75+s!AU75*s!AV75))+IF(s!AT75*s!AY75+s!AU75*s!AX75=0,0,K76*s!AT75*s!AY75/(s!AT75*s!AY75+s!AU75*s!AX75))+IF(s!AT75*s!AZ75+s!AV75*s!AX75=0,0,M76*s!AT75*s!AZ75/(s!AT75*s!AZ75+s!AV75*s!AX75))+IF(s!AT75*s!BA75+s!AU75*s!AZ75+s!AV75*s!AY75+s!AW75*s!AX75=0,0,N76*s!AT75*s!BA75/(s!AT75*s!BA75+s!AU75*s!AZ75+s!AV75*s!AY75+s!AW75*s!AX75)) -> 244.65839693634129 | AU76: =AD76+IF(s!AU75*s!AV75+s!AT75*s!AW75=0,0,E76*s!AU75*s!AV75/(s!AU75*s!AV75+s!AT75*s!AW75))+IF(s!AT75*s!AY75+s!AU75*s!AX75=0,0,K76*s!AU75*s!AX75/(s!AT75*s!AY75+s!AU75*s!AX75))+IF(s!AU75*s!BA75+s!AW75*s!AY75=0,0,O76*s!AU75*s!BA75/(s!AU75*s!BA75+s!AW75*s!AY75))+IF(s!AT75*s!BA75+s!AU75*s!AZ75+s!AV75*s!AY75+s!AW75*s!AX75=0,0,N76*s!AU75*s!AZ75/(s!AT75*s!BA75+s!AU75*s!AZ75+s!AV75*s!AY75+s!AW75*s!AX75)) -> 445.77362055038964 | AV76: =AE76+IF(s!AU75*s!AV75+s!AT75*s!AW75=0,0,E76*s!AU75*s!AV75/(s!AU75*s!AV75+s!AT75*s!AW75))+IF(s!AV75*s!AX75+s!AT75*s!AZ75=0,0,M76*s!AV75*s!AX75/(s!AV75*s!AX75+s!AT75*s!AZ75))+IF(s!AV75*s!BA75+s!AW75*s!AZ75=0,0,Q76*s!AV75*s!BA75/(s!AV75*s!BA75+s!AW75*s!AZ75))+IF(s!AT75*s!BA75+s!AU75*s!AZ75+s!AV75*s!AY75+s!AW75*s!AX75=0,0,N76*s!AV75*s!AY75/(s!AT75*s!BA75+s!AU75*s!AZ75+s!AV75*s!AY75+s!AW75*s!AX75)) -> 13.9614470265969 | AW76: =AF76+IF(s!AT75*s!AW75+s!AU75*s!AV75=0,0,E76*s!AT75*s!AW75/(s!AT75*s!AW75+s!AU75*s!AV75))+IF(s!AU75*s!BA75+s!AW75*s!AY75=0,0,O76*s!AW75*s!AY75/(s!AU75*s!BA75+s!AW75*s!AY75))+IF(s!AV75*s!BA75+s!AW75*s!AZ75=0,0,Q76*s!AW75*s!AZ75/(s!AV75*s!BA75+s!AW75*s!AZ75))+IF(s!AT75*s!BA75+s!AU75*s!AZ75+s!AV75*s!AY75+s!AW75*s!AX75=0,0,N76*s!AW75*s!AX75/(s!AT75*s!BA75+s!AU75*s!AZ75+s!AV75*s!AY75+s!AW75*s!AX75)) -> 9.6065354866721773 | AX76: =AG76+IF(s!AT75*s!AY75+s!AU75*s!AX75=0,0,K76*s!AU75*s!AX75/(s!AT75*s!AY75+s!AU75*s!AX75))+IF(s!AV75*s!AX75+s!AT75*s!AZ75=0,0,M76*s!AV75*s!AX75/(s!AV75*s!AX75+s!AT75*s!AZ75))+IF(s!AX75*s!BA75+s!AY75*s!AZ75=0,0,W76*s!AX75*s!BA75/(s!AX75*s!BA75+s!AY75*s!AZ75))+IF(s!AT75*s!BA75+s!AU75*s!AZ75+s!AV75*s!AY75+s!AW75*s!AX75=0,0,N76*s!AW75*s!AX75/(s!AT75*s!BA75+s!AU75*s!AZ75+s!AV75*s!AY75+s!AW75*s!AX75)) -> 13.990720118980526 | AY76: =AH76+IF(s!AT75*s!AY75+s!AU75*s!AX75=0,0,K76*s!AT75*s!AY75/(s!AT75*s!AY75+s!AU75*s!AX75))+IF(s!AU75*s!BA75+s!AW75*s!AY75=0,0,O76*s!AW75*s!AY75/(s!AU75*s!BA75+s!AW75*s!AY75))+IF(s!AX75*s!BA75+s!AY75*s!AZ75=0,0,W76*s!AY75*s!AZ75/(s!AX75*s!BA75+s!AY75*s!AZ75))+IF(s!AT75*s!BA75+s!AU75*s!AZ75+s!AV75*s!AY75+s!AW75*s!AX75=0,0,N76*s!AV75*s!AY75/(s!AT75*s!BA75+s!AU75*s!AZ75+s!AV75*s!AY75+s!AW75*s!AX75)) -> 10.577262394288551 | AZ76: =AI76+IF(s!AT75*s!AZ75+s!AV75*s!AX75=0,0,M76*s!AT75*s!AZ75/(s!AT75*s!AZ75+s!AV75*s!AX75))+IF(s!AV75*s!BA75+s!AW75*s!AZ75=0,0,Q76*s!AW75*s!AZ75/(s!AV75*s!BA75+s!AW75*s!AZ75))+IF(s!AX75*s!BA75+s!AY75*s!AZ75=0,0,W76*s!AY75*s!AZ75/(s!AX75*s!BA75+s!AY75*s!AZ75))+IF(s!AT75*s!BA75+s!AU75*s!AZ75+s!AV75*s!AY75+s!AW75*s!AX75=0,0,N76*s!AU75*s!AZ75/(s!AT75*s!BA75+s!AU75*s!AZ75+s!AV75*s!AY75+s!AW75*s!AX75)) -> 17.389435918081283 | BA76: =AJ76+IF(s!AU75*s!BA75+s!AW75*s!AY75=0,0,O76*s!AU75*s!BA75/(s!AU75*s!BA75+s!AW75*s!AY75))+IF(s!AV75*s!BA75+s!AW75*s!AZ75=0,0,Q76*s!AV75*s!BA75/(s!AV75*s!BA75+s!AW75*s!AZ75))+IF(s!AX75*s!BA75+s!AY75*s!AZ75=0,0,W76*s!AX75*s!BA75/(s!AX75*s!BA75+s!AY75*s!AZ75))+IF(s!AT75*s!BA75+s!AU75*s!AZ75+s!AV75*s!AY75+s!AW75*s!AX75=0,0,N76*s!AT75*s!BA75/(s!AT75*s!BA75+s!AU75*s!AZ75+s!AV75*s!AY75+s!AW75*s!AX75)) -> 22.042581568649638 | BJ76: =SUM(AT76:BA76) -> 778
A77: =A76 -> 100 | B77: =B76 -> 30 | C77: =C76 -> 200 | D77: =D76 -> 2 | E77: =E76 -> 4 | F77: =F76 -> 1 | G77: =G76 -> 1 | H77: =H76 -> 2 | I77: =I76 -> 1 | J77: =J76 -> 2 | K77: =K76 -> 4 | L77: =L76 -> 2 | M77: =M76 -> 4 | N77: =N76 -> 8 | O77: =O76 -> 4 | P77: =P76 -> 2 | Q77: =Q76 -> 4 | R77: =R76 -> 2 | S77: =S76 -> 1 | T77: =T76 -> 2 | U77: =U76 -> 1 | V77: =V76 -> 2 | W77: =W76 -> 4 | X77: =X76 -> 2 | Y77: =Y76 -> 1 | Z77: =Z76 -> 2 | AA77: =AA76 -> 1 | AB77: =AB76 -> 389 | AC77: =AC76 -> 234 | AD77: =AD76 -> 433 | AE77: =AE76 -> 8 | AF77: =AF76 -> 7 | AG77: =AG76 -> 8 | AH77: =AH76 -> 8 | AI77: =AI76 -> 8 | AJ77: =AJ76 -> 8 | AS77: =AS76 -> 714 | AT77: =AC77+IF(s!AT76*s!AW76+s!AU76*s!AV76=0,0,E77*s!AT76*s!AW76/(s!AT76*s!AW76+s!AU76*s!AV76))+IF(s!AT76*s!AY76+s!AU76*s!AX76=0,0,K77*s!AT76*s!AY76/(s!AT76*s!AY76+s!AU76*s!AX76))+IF(s!AT76*s!AZ76+s!AV76*s!AX76=0,0,M77*s!AT76*s!AZ76/(s!AT76*s!AZ76+s!AV76*s!AX76))+IF(s!AT76*s!BA76+s!AU76*s!AZ76+s!AV76*s!AY76+s!AW76*s!AX76=0,0,N77*s!AT76*s!BA76/(s!AT76*s!BA76+s!AU76*s!AZ76+s!AV76*s!AY76+s!AW76*s!AX76)) -> 244.6583969363422 | AU77: =AD77+IF(s!AU76*s!AV76+s!AT76*s!AW76=0,0,E77*s!AU76*s!AV76/(s!AU76*s!AV76+s!AT76*s!AW76))+IF(s!AT76*s!AY76+s!AU76*s!AX76=0,0,K77*s!AU76*s!AX76/(s!AT76*s!AY76+s!AU76*s!AX76))+IF(s!AU76*s!BA76+s!AW76*s!AY76=0,0,O77*s!AU76*s!BA76/(s!AU76*s!BA76+s!AW76*s!AY76))+IF(s!AT76*s!BA76+s!AU76*s!AZ76+s!AV76*s!AY76+s!AW76*s!AX76=0,0,N77*s!AU76*s!AZ76/(s!AT76*s!BA76+s!AU76*s!AZ76+s!AV76*s!AY76+s!AW76*s!AX76)) -> 445.77362055038822 | AV77: =AE77+IF(s!AU76*s!AV76+s!AT76*s!AW76=0,0,E77*s!AU76*s!AV76/(s!AU76*s!AV76+s!AT76*s!AW76))+IF(s!AV76*s!AX76+s!AT76*s!AZ76=0,0,M77*s!AV76*s!AX76/(s!AV76*s!AX76+s!AT76*s!AZ76))+IF(s!AV76*s!BA76+s!AW76*s!AZ76=0,0,Q77*s!AV76*s!BA76/(s!AV76*s!BA76+s!AW76*s!AZ76))+IF(s!AT76*s!BA76+s!AU76*s!AZ76+s!AV76*s!AY76+s!AW76*s!AX76=0,0,N77*s!AV76*s!AY76/(s!AT76*s!BA76+s!AU76*s!AZ76+s!AV76*s!AY76+s!AW76*s!AX76)) -> 13.961447026605155 | AW77: =AF77+IF(s!AT76*s!AW76+s!AU76*s!AV76=0,0,E77*s!AT76*s!AW76/(s!AT76*s!AW76+s!AU76*s!AV76))+IF(s!AU76*s!BA76+s!AW76*s!AY76=0,0,O77*s!AW76*s!AY76/(s!AU76*s!BA76+s!AW76*s!AY76))+IF(s!AV76*s!BA76+s!AW76*s!AZ76=0,0,Q77*s!AW76*s!AZ76/(s!AV76*s!BA76+s!AW76*s!AZ76))+IF(s!AT76*s!BA76+s!AU76*s!AZ76+s!AV76*s!AY76+s!AW76*s!AX76=0,0,N77*s!AW76*s!AX76/(s!AT76*s!BA76+s!AU76*s!AZ76+s!AV76*s!AY76+s!AW76*s!AX76)) -> 9.6065354866644821 | AX77: =AG77+IF(s!AT76*s!AY76+s!AU76*s!AX76=0,0,K77*s!AU76*s!AX76/(s!AT76*s!AY76+s!AU76*s!AX76))+IF(s!AV76*s!AX76+s!AT76*s!AZ76=0,0,M77*s!AV76*s!AX76/(s!AV76*s!AX76+s!AT76*s!AZ76))+IF(s!AX76*s!BA76+s!AY76*s!AZ76=0,0,W77*s!AX76*s!BA76/(s!AX76*s!BA76+s!AY76*s!AZ76))+IF(s!AT76*s!BA76+s!AU76*s!AZ76+s!AV76*s!AY76+s!AW76*s!AX76=0,0,N77*s!AW76*s!AX76/(s!AT76*s!BA76+s!AU76*s!AZ76+s!AV76*s!AY76+s!AW76*s!AX76)) -> 13.99072011898801 | AY77: =AH77+IF(s!AT76*s!AY76+s!AU76*s!AX76=0,0,K77*s!AT76*s!AY76/(s!AT76*s!AY76+s!AU76*s!AX76))+IF(s!AU76*s!BA76+s!AW76*s!AY76=0,0,O77*s!AW76*s!AY76/(s!AU76*s!BA76+s!AW76*s!AY76))+IF(s!AX76*s!BA76+s!AY76*s!AZ76=0,0,W77*s!AY76*s!AZ76/(s!AX76*s!BA76+s!AY76*s!AZ76))+IF(s!AT76*s!BA76+s!AU76*s!AZ76+s!AV76*s!AY76+s!AW76*s!AX76=0,0,N77*s!AV76*s!AY76/(s!AT76*s!BA76+s!AU76*s!AZ76+s!AV76*s!AY76+s!AW76*s!AX76)) -> 10.577262394281631 | AZ77: =AI77+IF(s!AT76*s!AZ76+s!AV76*s!AX76=0,0,M77*s!AT76*s!AZ76/(s!AT76*s!AZ76+s!AV76*s!AX76))+IF(s!AV76*s!BA76+s!AW76*s!AZ76=0,0,Q77*s!AW76*s!AZ76/(s!AV76*s!BA76+s!AW76*s!AZ76))+IF(s!AX76*s!BA76+s!AY76*s!AZ76=0,0,W77*s!AY76*s!AZ76/(s!AX76*s!BA76+s!AY76*s!AZ76))+IF(s!AT76*s!BA76+s!AU76*s!AZ76+s!AV76*s!AY76+s!AW76*s!AX76=0,0,N77*s!AU76*s!AZ76/(s!AT76*s!BA76+s!AU76*s!AZ76+s!AV76*s!AY76+s!AW76*s!AX76)) -> 17.389435918064649 | BA77: =AJ77+IF(s!AU76*s!BA76+s!AW76*s!AY76=0,0,O77*s!AU76*s!BA76/(s!AU76*s!BA76+s!AW76*s!AY76))+IF(s!AV76*s!BA76+s!AW76*s!AZ76=0,0,Q77*s!AV76*s!BA76/(s!AV76*s!BA76+s!AW76*s!AZ76))+IF(s!AX76*s!BA76+s!AY76*s!AZ76=0,0,W77*s!AX76*s!BA76/(s!AX76*s!BA76+s!AY76*s!AZ76))+IF(s!AT76*s!BA76+s!AU76*s!AZ76+s!AV76*s!AY76+s!AW76*s!AX76=0,0,N77*s!AT76*s!BA76/(s!AT76*s!BA76+s!AU76*s!AZ76+s!AV76*s!AY76+s!AW76*s!AX76)) -> 22.04258156866571 | BJ77: =SUM(AT77:BA77) -> 778
A78: =A77 -> 100 | B78: =B77 -> 30 | C78: =C77 -> 200 | D78: =D77 -> 2 | E78: =E77 -> 4 | F78: =F77 -> 1 | G78: =G77 -> 1 | H78: =H77 -> 2 | I78: =I77 -> 1 | J78: =J77 -> 2 | K78: =K77 -> 4 | L78: =L77 -> 2 | M78: =M77 -> 4 | N78: =N77 -> 8 | O78: =O77 -> 4 | P78: =P77 -> 2 | Q78: =Q77 -> 4 | R78: =R77 -> 2 | S78: =S77 -> 1 | T78: =T77 -> 2 | U78: =U77 -> 1 | V78: =V77 -> 2 | W78: =W77 -> 4 | X78: =X77 -> 2 | Y78: =Y77 -> 1 | Z78: =Z77 -> 2 | AA78: =AA77 -> 1 | AB78: =AB77 -> 389 | AC78: =AC77 -> 234 | AD78: =AD77 -> 433 | AE78: =AE77 -> 8 | AF78: =AF77 -> 7 | AG78: =AG77 -> 8 | AH78: =AH77 -> 8 | AI78: =AI77 -> 8 | AJ78: =AJ77 -> 8 | AS78: =AS77 -> 714 | AT78: =AC78+IF(s!AT77*s!AW77+s!AU77*s!AV77=0,0,E78*s!AT77*s!AW77/(s!AT77*s!AW77+s!AU77*s!AV77))+IF(s!AT77*s!AY77+s!AU77*s!AX77=0,0,K78*s!AT77*s!AY77/(s!AT77*s!AY77+s!AU77*s!AX77))+IF(s!AT77*s!AZ77+s!AV77*s!AX77=0,0,M78*s!AT77*s!AZ77/(s!AT77*s!AZ77+s!AV77*s!AX77))+IF(s!AT77*s!BA77+s!AU77*s!AZ77+s!AV77*s!AY77+s!AW77*s!AX77=0,0,N78*s!AT77*s!BA77/(s!AT77*s!BA77+s!AU77*s!AZ77+s!AV77*s!AY77+s!AW77*s!AX77)) -> 244.65839693634283 | AU78: =AD78+IF(s!AU77*s!AV77+s!AT77*s!AW77=0,0,E78*s!AU77*s!AV77/(s!AU77*s!AV77+s!AT77*s!AW77))+IF(s!AT77*s!AY77+s!AU77*s!AX77=0,0,K78*s!AU77*s!AX77/(s!AT77*s!AY77+s!AU77*s!AX77))+IF(s!AU77*s!BA77+s!AW77*s!AY77=0,0,O78*s!AU77*s!BA77/(s!AU77*s!BA77+s!AW77*s!AY77))+IF(s!AT77*s!BA77+s!AU77*s!AZ77+s!AV77*s!AY77+s!AW77*s!AX77=0,0,N78*s!AU77*s!AZ77/(s!AT77*s!BA77+s!AU77*s!AZ77+s!AV77*s!AY77+s!AW77*s!AX77)) -> 445.77362055038714 | AV78: =AE78+IF(s!AU77*s!AV77+s!AT77*s!AW77=0,0,E78*s!AU77*s!AV77/(s!AU77*s!AV77+s!AT77*s!AW77))+IF(s!AV77*s!AX77+s!AT77*s!AZ77=0,0,M78*s!AV77*s!AX77/(s!AV77*s!AX77+s!AT77*s!AZ77))+IF(s!AV77*s!BA77+s!AW77*s!AZ77=0,0,Q78*s!AV77*s!BA77/(s!AV77*s!BA77+s!AW77*s!AZ77))+IF(s!AT77*s!BA77+s!AU77*s!AZ77+s!AV77*s!AY77+s!AW77*s!AX77=0,0,N78*s!AV77*s!AY77/(s!AT77*s!BA77+s!AU77*s!AZ77+s!AV77*s!AY77+s!AW77*s!AX77)) -> 13.96144702661106 | AW78: =AF78+IF(s!AT77*s!AW77+s!AU77*s!AV77=0,0,E78*s!AT77*s!AW77/(s!AT77*s!AW77+s!AU77*s!AV77))+IF(s!AU77*s!BA77+s!AW77*s!AY77=0,0,O78*s!AW77*s!AY77/(s!AU77*s!BA77+s!AW77*s!AY77))+IF(s!AV77*s!BA77+s!AW77*s!AZ77=0,0,Q78*s!AW77*s!AZ77/(s!AV77*s!BA77+s!AW77*s!AZ77))+IF(s!AT77*s!BA77+s!AU77*s!AZ77+s!AV77*s!AY77+s!AW77*s!AX77=0,0,N78*s!AW77*s!AX77/(s!AT77*s!BA77+s!AU77*s!AZ77+s!AV77*s!AY77+s!AW77*s!AX77)) -> 9.6065354866589789 | AX78: =AG78+IF(s!AT77*s!AY77+s!AU77*s!AX77=0,0,K78*s!AU77*s!AX77/(s!AT77*s!AY77+s!AU77*s!AX77))+IF(s!AV77*s!AX77+s!AT77*s!AZ77=0,0,M78*s!AV77*s!AX77/(s!AV77*s!AX77+s!AT77*s!AZ77))+IF(s!AX77*s!BA77+s!AY77*s!AZ77=0,0,W78*s!AX77*s!BA77/(s!AX77*s!BA77+s!AY77*s!AZ77))+IF(s!AT77*s!BA77+s!AU77*s!AZ77+s!AV77*s!AY77+s!AW77*s!AX77=0,0,N78*s!AW77*s!AX77/(s!AT77*s!BA77+s!AU77*s!AZ77+s!AV77*s!AY77+s!AW77*s!AX77)) -> 13.990720118993361 | AY78: =AH78+IF(s!AT77*s!AY77+s!AU77*s!AX77=0,0,K78*s!AT77*s!AY77/(s!AT77*s!AY77+s!AU77*s!AX77))+IF(s!AU77*s!BA77+s!AW77*s!AY77=0,0,O78*s!AW77*s!AY77/(s!AU77*s!BA77+s!AW77*s!AY77))+IF(s!AX77*s!BA77+s!AY77*s!AZ77=0,0,W78*s!AY77*s!AZ77/(s!AX77*s!BA77+s!AY77*s!AZ77))+IF(s!AT77*s!BA77+s!AU77*s!AZ77+s!AV77*s!AY77+s!AW77*s!AX77=0,0,N78*s!AV77*s!AY77/(s!AT77*s!BA77+s!AU77*s!AZ77+s!AV77*s!AY77+s!AW77*s!AX77)) -> 10.577262394276678 | AZ78: =AI78+IF(s!AT77*s!AZ77+s!AV77*s!AX77=0,0,M78*s!AT77*s!AZ77/(s!AT77*s!AZ77+s!AV77*s!AX77))+IF(s!AV77*s!BA77+s!AW77*s!AZ77=0,0,Q78*s!AW77*s!AZ77/(s!AV77*s!BA77+s!AW77*s!AZ77))+IF(s!AX77*s!BA77+s!AY77*s!AZ77=0,0,W78*s!AY77*s!AZ77/(s!AX77*s!BA77+s!AY77*s!AZ77))+IF(s!AT77*s!BA77+s!AU77*s!AZ77+s!AV77*s!AY77+s!AW77*s!AX77=0,0,N78*s!AU77*s!AZ77/(s!AT77*s!BA77+s!AU77*s!AZ77+s!AV77*s!AY77+s!AW77*s!AX77)) -> 17.389435918052747 | BA78: =AJ78+IF(s!AU77*s!BA77+s!AW77*s!AY77=0,0,O78*s!AU77*s!BA77/(s!AU77*s!BA77+s!AW77*s!AY77))+IF(s!AV77*s!BA77+s!AW77*s!AZ77=0,0,Q78*s!AV77*s!BA77/(s!AV77*s!BA77+s!AW77*s!AZ77))+IF(s!AX77*s!BA77+s!AY77*s!AZ77=0,0,W78*s!AX77*s!BA77/(s!AX77*s!BA77+s!AY77*s!AZ77))+IF(s!AT77*s!BA77+s!AU77*s!AZ77+s!AV77*s!AY77+s!AW77*s!AX77=0,0,N78*s!AT77*s!BA77/(s!AT77*s!BA77+s!AU77*s!AZ77+s!AV77*s!AY77+s!AW77*s!AX77)) -> 22.042581568677214 | BJ78: =SUM(AT78:BA78) -> 778
A79: =A78 -> 100 | B79: =B78 -> 30 | C79: =C78 -> 200 | D79: =D78 -> 2 | E79: =E78 -> 4 | F79: =F78 -> 1 | G79: =G78 -> 1 | H79: =H78 -> 2 | I79: =I78 -> 1 | J79: =J78 -> 2 | K79: =K78 -> 4 | L79: =L78 -> 2 | M79: =M78 -> 4 | N79: =N78 -> 8 | O79: =O78 -> 4 | P79: =P78 -> 2 | Q79: =Q78 -> 4 | R79: =R78 -> 2 | S79: =S78 -> 1 | T79: =T78 -> 2 | U79: =U78 -> 1 | V79: =V78 -> 2 | W79: =W78 -> 4 | X79: =X78 -> 2 | Y79: =Y78 -> 1 | Z79: =Z78 -> 2 | AA79: =AA78 -> 1 | AB79: =AB78 -> 389 | AC79: =AC78 -> 234 | AD79: =AD78 -> 433 | AE79: =AE78 -> 8 | AF79: =AF78 -> 7 | AG79: =AG78 -> 8 | AH79: =AH78 -> 8 | AI79: =AI78 -> 8 | AJ79: =AJ78 -> 8 | AS79: =AS78 -> 714 | AT79: =AC79+IF(s!AT78*s!AW78+s!AU78*s!AV78=0,0,E79*s!AT78*s!AW78/(s!AT78*s!AW78+s!AU78*s!AV78))+IF(s!AT78*s!AY78+s!AU78*s!AX78=0,0,K79*s!AT78*s!AY78/(s!AT78*s!AY78+s!AU78*s!AX78))+IF(s!AT78*s!AZ78+s!AV78*s!AX78=0,0,M79*s!AT78*s!AZ78/(s!AT78*s!AZ78+s!AV78*s!AX78))+IF(s!AT78*s!BA78+s!AU78*s!AZ78+s!AV78*s!AY78+s!AW78*s!AX78=0,0,N79*s!AT78*s!BA78/(s!AT78*s!BA78+s!AU78*s!AZ78+s!AV78*s!AY78+s!AW78*s!AX78)) -> 244.65839693634331 | AU79: =AD79+IF(s!AU78*s!AV78+s!AT78*s!AW78=0,0,E79*s!AU78*s!AV78/(s!AU78*s!AV78+s!AT78*s!AW78))+IF(s!AT78*s!AY78+s!AU78*s!AX78=0,0,K79*s!AU78*s!AX78/(s!AT78*s!AY78+s!AU78*s!AX78))+IF(s!AU78*s!BA78+s!AW78*s!AY78=0,0,O79*s!AU78*s!BA78/(s!AU78*s!BA78+s!AW78*s!AY78))+IF(s!AT78*s!BA78+s!AU78*s!AZ78+s!AV78*s!AY78+s!AW78*s!AX78=0,0,N79*s!AU78*s!AZ78/(s!AT78*s!BA78+s!AU78*s!AZ78+s!AV78*s!AY78+s!AW78*s!AX78)) -> 445.7736205503864 | AV79: =AE79+IF(s!AU78*s!AV78+s!AT78*s!AW78=0,0,E79*s!AU78*s!AV78/(s!AU78*s!AV78+s!AT78*s!AW78))+IF(s!AV78*s!AX78+s!AT78*s!AZ78=0,0,M79*s!AV78*s!AX78/(s!AV78*s!AX78+s!AT78*s!AZ78))+IF(s!AV78*s!BA78+s!AW78*s!AZ78=0,0,Q79*s!AV78*s!BA78/(s!AV78*s!BA78+s!AW78*s!AZ78))+IF(s!AT78*s!BA78+s!AU78*s!AZ78+s!AV78*s!AY78+s!AW78*s!AX78=0,0,N79*s!AV78*s!AY78/(s!AT78*s!BA78+s!AU78*s!AZ78+s!AV78*s!AY78+s!AW78*s!AX78)) -> 13.961447026615286 | AW79: =AF79+IF(s!AT78*s!AW78+s!AU78*s!AV78=0,0,E79*s!AT78*s!AW78/(s!AT78*s!AW78+s!AU78*s!AV78))+IF(s!AU78*s!BA78+s!AW78*s!AY78=0,0,O79*s!AW78*s!AY78/(s!AU78*s!BA78+s!AW78*s!AY78))+IF(s!AV78*s!BA78+s!AW78*s!AZ78=0,0,Q79*s!AW78*s!AZ78/(s!AV78*s!BA78+s!AW78*s!AZ78))+IF(s!AT78*s!BA78+s!AU78*s!AZ78+s!AV78*s!AY78+s!AW78*s!AX78=0,0,N79*s!AW78*s!AX78/(s!AT78*s!BA78+s!AU78*s!AZ78+s!AV78*s!AY78+s!AW78*s!AX78)) -> 9.6065354866550408 | AX79: =AG79+IF(s!AT78*s!AY78+s!AU78*s!AX78=0,0,K79*s!AU78*s!AX78/(s!AT78*s!AY78+s!AU78*s!AX78))+IF(s!AV78*s!AX78+s!AT78*s!AZ78=0,0,M79*s!AV78*s!AX78/(s!AV78*s!AX78+s!AT78*s!AZ78))+IF(s!AX78*s!BA78+s!AY78*s!AZ78=0,0,W79*s!AX78*s!BA78/(s!AX78*s!BA78+s!AY78*s!AZ78))+IF(s!AT78*s!BA78+s!AU78*s!AZ78+s!AV78*s!AY78+s!AW78*s!AX78=0,0,N79*s!AW78*s!AX78/(s!AT78*s!BA78+s!AU78*s!AZ78+s!AV78*s!AY78+s!AW78*s!AX78)) -> 13.990720118997189 | AY79: =AH79+IF(s!AT78*s!AY78+s!AU78*s!AX78=0,0,K79*s!AT78*s!AY78/(s!AT78*s!AY78+s!AU78*s!AX78))+IF(s!AU78*s!BA78+s!AW78*s!AY78=0,0,O79*s!AW78*s!AY78/(s!AU78*s!BA78+s!AW78*s!AY78))+IF(s!AX78*s!BA78+s!AY78*s!AZ78=0,0,W79*s!AY78*s!AZ78/(s!AX78*s!BA78+s!AY78*s!AZ78))+IF(s!AT78*s!BA78+s!AU78*s!AZ78+s!AV78*s!AY78+s!AW78*s!AX78=0,0,N79*s!AV78*s!AY78/(s!AT78*s!BA78+s!AU78*s!AZ78+s!AV78*s!AY78+s!AW78*s!AX78)) -> 10.577262394273134 | AZ79: =AI79+IF(s!AT78*s!AZ78+s!AV78*s!AX78=0,0,M79*s!AT78*s!AZ78/(s!AT78*s!AZ78+s!AV78*s!AX78))+IF(s!AV78*s!BA78+s!AW78*s!AZ78=0,0,Q79*s!AW78*s!AZ78/(s!AV78*s!BA78+s!AW78*s!AZ78))+IF(s!AX78*s!BA78+s!AY78*s!AZ78=0,0,W79*s!AY78*s!AZ78/(s!AX78*s!BA78+s!AY78*s!AZ78))+IF(s!AT78*s!BA78+s!AU78*s!AZ78+s!AV78*s!AY78+s!AW78*s!AX78=0,0,N79*s!AU78*s!AZ78/(s!AT78*s!BA78+s!AU78*s!AZ78+s!AV78*s!AY78+s!AW78*s!AX78)) -> 17.389435918044231 | BA79: =AJ79+IF(s!AU78*s!BA78+s!AW78*s!AY78=0,0,O79*s!AU78*s!BA78/(s!AU78*s!BA78+s!AW78*s!AY78))+IF(s!AV78*s!BA78+s!AW78*s!AZ78=0,0,Q79*s!AV78*s!BA78/(s!AV78*s!BA78+s!AW78*s!AZ78))+IF(s!AX78*s!BA78+s!AY78*s!AZ78=0,0,W79*s!AX78*s!BA78/(s!AX78*s!BA78+s!AY78*s!AZ78))+IF(s!AT78*s!BA78+s!AU78*s!AZ78+s!AV78*s!AY78+s!AW78*s!AX78=0,0,N79*s!AT78*s!BA78/(s!AT78*s!BA78+s!AU78*s!AZ78+s!AV78*s!AY78+s!AW78*s!AX78)) -> 22.042581568685442 | BJ79: =SUM(AT79:BA79) -> 778
A80: =A79 -> 100 | B80: =B79 -> 30 | C80: =C79 -> 200 | D80: =D79 -> 2 | E80: =E79 -> 4 | F80: =F79 -> 1 | G80: =G79 -> 1 | H80: =H79 -> 2 | I80: =I79 -> 1 | J80: =J79 -> 2 | K80: =K79 -> 4 | L80: =L79 -> 2 | M80: =M79 -> 4 | N80: =N79 -> 8 | O80: =O79 -> 4 | P80: =P79 -> 2 | Q80: =Q79 -> 4 | R80: =R79 -> 2 | S80: =S79 -> 1 | T80: =T79 -> 2 | U80: =U79 -> 1 | V80: =V79 -> 2 | W80: =W79 -> 4 | X80: =X79 -> 2 | Y80: =Y79 -> 1 | Z80: =Z79 -> 2 | AA80: =AA79 -> 1 | AB80: =AB79 -> 389 | AC80: =AC79 -> 234 | AD80: =AD79 -> 433 | AE80: =AE79 -> 8 | AF80: =AF79 -> 7 | AG80: =AG79 -> 8 | AH80: =AH79 -> 8 | AI80: =AI79 -> 8 | AJ80: =AJ79 -> 8 | AS80: =AS79 -> 714 | AT80: =AC80+IF(s!AT79*s!AW79+s!AU79*s!AV79=0,0,E80*s!AT79*s!AW79/(s!AT79*s!AW79+s!AU79*s!AV79))+IF(s!AT79*s!AY79+s!AU79*s!AX79=0,0,K80*s!AT79*s!AY79/(s!AT79*s!AY79+s!AU79*s!AX79))+IF(s!AT79*s!AZ79+s!AV79*s!AX79=0,0,M80*s!AT79*s!AZ79/(s!AT79*s!AZ79+s!AV79*s!AX79))+IF(s!AT79*s!BA79+s!AU79*s!AZ79+s!AV79*s!AY79+s!AW79*s!AX79=0,0,N80*s!AT79*s!BA79/(s!AT79*s!BA79+s!AU79*s!AZ79+s!AV79*s!AY79+s!AW79*s!AX79)) -> 244.65839693634362 | AU80: =AD80+IF(s!AU79*s!AV79+s!AT79*s!AW79=0,0,E80*s!AU79*s!AV79/(s!AU79*s!AV79+s!AT79*s!AW79))+IF(s!AT79*s!AY79+s!AU79*s!AX79=0,0,K80*s!AU79*s!AX79/(s!AT79*s!AY79+s!AU79*s!AX79))+IF(s!AU79*s!BA79+s!AW79*s!AY79=0,0,O80*s!AU79*s!BA79/(s!AU79*s!BA79+s!AW79*s!AY79))+IF(s!AT79*s!BA79+s!AU79*s!AZ79+s!AV79*s!AY79+s!AW79*s!AX79=0,0,N80*s!AU79*s!AZ79/(s!AT79*s!BA79+s!AU79*s!AZ79+s!AV79*s!AY79+s!AW79*s!AX79)) -> 445.77362055038589 | AV80: =AE80+IF(s!AU79*s!AV79+s!AT79*s!AW79=0,0,E80*s!AU79*s!AV79/(s!AU79*s!AV79+s!AT79*s!AW79))+IF(s!AV79*s!AX79+s!AT79*s!AZ79=0,0,M80*s!AV79*s!AX79/(s!AV79*s!AX79+s!AT79*s!AZ79))+IF(s!AV79*s!BA79+s!AW79*s!AZ79=0,0,Q80*s!AV79*s!BA79/(s!AV79*s!BA79+s!AW79*s!AZ79))+IF(s!AT79*s!BA79+s!AU79*s!AZ79+s!AV79*s!AY79+s!AW79*s!AX79=0,0,N80*s!AV79*s!AY79/(s!AT79*s!BA79+s!AU79*s!AZ79+s!AV79*s!AY79+s!AW79*s!AX79)) -> 13.961447026618306 | AW80: =AF80+IF(s!AT79*s!AW79+s!AU79*s!AV79=0,0,E80*s!AT79*s!AW79/(s!AT79*s!AW79+s!AU79*s!AV79))+IF(s!AU79*s!BA79+s!AW79*s!AY79=0,0,O80*s!AW79*s!AY79/(s!AU79*s!BA79+s!AW79*s!AY79))+IF(s!AV79*s!BA79+s!AW79*s!AZ79=0,0,Q80*s!AW79*s!AZ79/(s!AV79*s!BA79+s!AW79*s!AZ79))+IF(s!AT79*s!BA79+s!AU79*s!AZ79+s!AV79*s!AY79+s!AW79*s!AX79=0,0,N80*s!AW79*s!AX79/(s!AT79*s!BA79+s!AU79*s!AZ79+s!AV79*s!AY79+s!AW79*s!AX79)) -> 9.6065354866522235 | AX80: =AG80+IF(s!AT79*s!AY79+s!AU79*s!AX79=0,0,K80*s!AU79*s!AX79/(s!AT79*s!AY79+s!AU79*s!AX79))+IF(s!AV79*s!AX79+s!AT79*s!AZ79=0,0,M80*s!AV79*s!AX79/(s!AV79*s!AX79+s!AT79*s!AZ79))+IF(s!AX79*s!BA79+s!AY79*s!AZ79=0,0,W80*s!AX79*s!BA79/(s!AX79*s!BA79+s!AY79*s!AZ79))+IF(s!AT79*s!BA79+s!AU79*s!AZ79+s!AV79*s!AY79+s!AW79*s!AX79=0,0,N80*s!AW79*s!AX79/(s!AT79*s!BA79+s!AU79*s!AZ79+s!AV79*s!AY79+s!AW79*s!AX79)) -> 13.99072011899993 | AY80: =AH80+IF(s!AT79*s!AY79+s!AU79*s!AX79=0,0,K80*s!AT79*s!AY79/(s!AT79*s!AY79+s!AU79*s!AX79))+IF(s!AU79*s!BA79+s!AW79*s!AY79=0,0,O80*s!AW79*s!AY79/(s!AU79*s!BA79+s!AW79*s!AY79))+IF(s!AX79*s!BA79+s!AY79*s!AZ79=0,0,W80*s!AY79*s!AZ79/(s!AX79*s!BA79+s!AY79*s!AZ79))+IF(s!AT79*s!BA79+s!AU79*s!AZ79+s!AV79*s!AY79+s!AW79*s!AX79=0,0,N80*s!AV79*s!AY79/(s!AT79*s!BA79+s!AU79*s!AZ79+s!AV79*s!AY79+s!AW79*s!AX79)) -> 10.577262394270601 | AZ80: =AI80+IF(s!AT79*s!AZ79+s!AV79*s!AX79=0,0,M80*s!AT79*s!AZ79/(s!AT79*s!AZ79+s!AV79*s!AX79))+IF(s!AV79*s!BA79+s!AW79*s!AZ79=0,0,Q80*s!AW79*s!AZ79/(s!AV79*s!BA79+s!AW79*s!AZ79))+IF(s!AX79*s!BA79+s!AY79*s!AZ79=0,0,W80*s!AY79*s!AZ79/(s!AX79*s!BA79+s!AY79*s!AZ79))+IF(s!AT79*s!BA79+s!AU79*s!AZ79+s!AV79*s!AY79+s!AW79*s!AX79=0,0,N80*s!AU79*s!AZ79/(s!AT79*s!BA79+s!AU79*s!AZ79+s!AV79*s!AY79+s!AW79*s!AX79)) -> 17.389435918038142 | BA80: =AJ80+IF(s!AU79*s!BA79+s!AW79*s!AY79=0,0,O80*s!AU79*s!BA79/(s!AU79*s!BA79+s!AW79*s!AY79))+IF(s!AV79*s!BA79+s!AW79*s!AZ79=0,0,Q80*s!AV79*s!BA79/(s!AV79*s!BA79+s!AW79*s!AZ79))+IF(s!AX79*s!BA79+s!AY79*s!AZ79=0,0,W80*s!AX79*s!BA79/(s!AX79*s!BA79+s!AY79*s!AZ79))+IF(s!AT79*s!BA79+s!AU79*s!AZ79+s!AV79*s!AY79+s!AW79*s!AX79=0,0,N80*s!AT79*s!BA79/(s!AT79*s!BA79+s!AU79*s!AZ79+s!AV79*s!AY79+s!AW79*s!AX79)) -> 22.042581568691329 | BJ80: =SUM(AT80:BA80) -> 778
A81: =A80 -> 100 | B81: =B80 -> 30 | C81: =C80 -> 200 | D81: =D80 -> 2 | E81: =E80 -> 4 | F81: =F80 -> 1 | G81: =G80 -> 1 | H81: =H80 -> 2 | I81: =I80 -> 1 | J81: =J80 -> 2 | K81: =K80 -> 4 | L81: =L80 -> 2 | M81: =M80 -> 4 | N81: =N80 -> 8 | O81: =O80 -> 4 | P81: =P80 -> 2 | Q81: =Q80 -> 4 | R81: =R80 -> 2 | S81: =S80 -> 1 | T81: =T80 -> 2 | U81: =U80 -> 1 | V81: =V80 -> 2 | W81: =W80 -> 4 | X81: =X80 -> 2 | Y81: =Y80 -> 1 | Z81: =Z80 -> 2 | AA81: =AA80 -> 1 | AB81: =AB80 -> 389 | AC81: =AC80 -> 234 | AD81: =AD80 -> 433 | AE81: =AE80 -> 8 | AF81: =AF80 -> 7 | AG81: =AG80 -> 8 | AH81: =AH80 -> 8 | AI81: =AI80 -> 8 | AJ81: =AJ80 -> 8 | AS81: =AS80 -> 714 | AT81: =AC81+IF(s!AT80*s!AW80+s!AU80*s!AV80=0,0,E81*s!AT80*s!AW80/(s!AT80*s!AW80+s!AU80*s!AV80))+IF(s!AT80*s!AY80+s!AU80*s!AX80=0,0,K81*s!AT80*s!AY80/(s!AT80*s!AY80+s!AU80*s!AX80))+IF(s!AT80*s!AZ80+s!AV80*s!AX80=0,0,M81*s!AT80*s!AZ80/(s!AT80*s!AZ80+s!AV80*s!AX80))+IF(s!AT80*s!BA80+s!AU80*s!AZ80+s!AV80*s!AY80+s!AW80*s!AX80=0,0,N81*s!AT80*s!BA80/(s!AT80*s!BA80+s!AU80*s!AZ80+s!AV80*s!AY80+s!AW80*s!AX80)) -> 244.65839693634382 | AU81: =AD81+IF(s!AU80*s!AV80+s!AT80*s!AW80=0,0,E81*s!AU80*s!AV80/(s!AU80*s!AV80+s!AT80*s!AW80))+IF(s!AT80*s!AY80+s!AU80*s!AX80=0,0,K81*s!AU80*s!AX80/(s!AT80*s!AY80+s!AU80*s!AX80))+IF(s!AU80*s!BA80+s!AW80*s!AY80=0,0,O81*s!AU80*s!BA80/(s!AU80*s!BA80+s!AW80*s!AY80))+IF(s!AT80*s!BA80+s!AU80*s!AZ80+s!AV80*s!AY80+s!AW80*s!AX80=0,0,N81*s!AU80*s!AZ80/(s!AT80*s!BA80+s!AU80*s!AZ80+s!AV80*s!AY80+s!AW80*s!AX80)) -> 445.77362055038549 | AV81: =AE81+IF(s!AU80*s!AV80+s!AT80*s!AW80=0,0,E81*s!AU80*s!AV80/(s!AU80*s!AV80+s!AT80*s!AW80))+IF(s!AV80*s!AX80+s!AT80*s!AZ80=0,0,M81*s!AV80*s!AX80/(s!AV80*s!AX80+s!AT80*s!AZ80))+IF(s!AV80*s!BA80+s!AW80*s!AZ80=0,0,Q81*s!AV80*s!BA80/(s!AV80*s!BA80+s!AW80*s!AZ80))+IF(s!AT80*s!BA80+s!AU80*s!AZ80+s!AV80*s!AY80+s!AW80*s!AX80=0,0,N81*s!AV80*s!AY80/(s!AT80*s!BA80+s!AU80*s!AZ80+s!AV80*s!AY80+s!AW80*s!AX80)) -> 13.961447026620469 | AW81: =AF81+IF(s!AT80*s!AW80+s!AU80*s!AV80=0,0,E81*s!AT80*s!AW80/(s!AT80*s!AW80+s!AU80*s!AV80))+IF(s!AU80*s!BA80+s!AW80*s!AY80=0,0,O81*s!AW80*s!AY80/(s!AU80*s!BA80+s!AW80*s!AY80))+IF(s!AV80*s!BA80+s!AW80*s!AZ80=0,0,Q81*s!AW80*s!AZ80/(s!AV80*s!BA80+s!AW80*s!AZ80))+IF(s!AT80*s!BA80+s!AU80*s!AZ80+s!AV80*s!AY80+s!AW80*s!AX80=0,0,N81*s!AW80*s!AX80/(s!AT80*s!BA80+s!AU80*s!AZ80+s!AV80*s!AY80+s!AW80*s!AX80)) -> 9.6065354866502091 | AX81: =AG81+IF(s!AT80*s!AY80+s!AU80*s!AX80=0,0,K81*s!AU80*s!AX80/(s!AT80*s!AY80+s!AU80*s!AX80))+IF(s!AV80*s!AX80+s!AT80*s!AZ80=0,0,M81*s!AV80*s!AX80/(s!AV80*s!AX80+s!AT80*s!AZ80))+IF(s!AX80*s!BA80+s!AY80*s!AZ80=0,0,W81*s!AX80*s!BA80/(s!AX80*s!BA80+s!AY80*s!AZ80))+IF(s!AT80*s!BA80+s!AU80*s!AZ80+s!AV80*s!AY80+s!AW80*s!AX80=0,0,N81*s!AW80*s!AX80/(s!AT80*s!BA80+s!AU80*s!AZ80+s!AV80*s!AY80+s!AW80*s!AX80)) -> 13.990720119001889 | AY81: =AH81+IF(s!AT80*s!AY80+s!AU80*s!AX80=0,0,K81*s!AT80*s!AY80/(s!AT80*s!AY80+s!AU80*s!AX80))+IF(s!AU80*s!BA80+s!AW80*s!AY80=0,0,O81*s!AW80*s!AY80/(s!AU80*s!BA80+s!AW80*s!AY80))+IF(s!AX80*s!BA80+s!AY80*s!AZ80=0,0,W81*s!AY80*s!AZ80/(s!AX80*s!BA80+s!AY80*s!AZ80))+IF(s!AT80*s!BA80+s!AU80*s!AZ80+s!AV80*s!AY80+s!AW80*s!AX80=0,0,N81*s!AV80*s!AY80/(s!AT80*s!BA80+s!AU80*s!AZ80+s!AV80*s!AY80+s!AW80*s!AX80)) -> 10.577262394268789 | AZ81: =AI81+IF(s!AT80*s!AZ80+s!AV80*s!AX80=0,0,M81*s!AT80*s!AZ80/(s!AT80*s!AZ80+s!AV80*s!AX80))+IF(s!AV80*s!BA80+s!AW80*s!AZ80=0,0,Q81*s!AW80*s!AZ80/(s!AV80*s!BA80+s!AW80*s!AZ80))+IF(s!AX80*s!BA80+s!AY80*s!AZ80=0,0,W81*s!AY80*s!AZ80/(s!AX80*s!BA80+s!AY80*s!AZ80))+IF(s!AT80*s!BA80+s!AU80*s!AZ80+s!AV80*s!AY80+s!AW80*s!AX80=0,0,N81*s!AU80*s!AZ80/(s!AT80*s!BA80+s!AU80*s!AZ80+s!AV80*s!AY80+s!AW80*s!AX80)) -> 17.389435918033783 | BA81: =AJ81+IF(s!AU80*s!BA80+s!AW80*s!AY80=0,0,O81*s!AU80*s!BA80/(s!AU80*s!BA80+s!AW80*s!AY80))+IF(s!AV80*s!BA80+s!AW80*s!AZ80=0,0,Q81*s!AV80*s!BA80/(s!AV80*s!BA80+s!AW80*s!AZ80))+IF(s!AX80*s!BA80+s!AY80*s!AZ80=0,0,W81*s!AX80*s!BA80/(s!AX80*s!BA80+s!AY80*s!AZ80))+IF(s!AT80*s!BA80+s!AU80*s!AZ80+s!AV80*s!AY80+s!AW80*s!AX80=0,0,N81*s!AT80*s!BA80/(s!AT80*s!BA80+s!AU80*s!AZ80+s!AV80*s!AY80+s!AW80*s!AX80)) -> 22.042581568695539 | BJ81: =SUM(AT81:BA81) -> 778
A82: =A81 -> 100 | B82: =B81 -> 30 | C82: =C81 -> 200 | D82: =D81 -> 2 | E82: =E81 -> 4 | F82: =F81 -> 1 | G82: =G81 -> 1 | H82: =H81 -> 2 | I82: =I81 -> 1 | J82: =J81 -> 2 | K82: =K81 -> 4 | L82: =L81 -> 2 | M82: =M81 -> 4 | N82: =N81 -> 8 | O82: =O81 -> 4 | P82: =P81 -> 2 | Q82: =Q81 -> 4 | R82: =R81 -> 2 | S82: =S81 -> 1 | T82: =T81 -> 2 | U82: =U81 -> 1 | V82: =V81 -> 2 | W82: =W81 -> 4 | X82: =X81 -> 2 | Y82: =Y81 -> 1 | Z82: =Z81 -> 2 | AA82: =AA81 -> 1 | AB82: =AB81 -> 389 | AC82: =AC81 -> 234 | AD82: =AD81 -> 433 | AE82: =AE81 -> 8 | AF82: =AF81 -> 7 | AG82: =AG81 -> 8 | AH82: =AH81 -> 8 | AI82: =AI81 -> 8 | AJ82: =AJ81 -> 8 | AS82: =AS81 -> 714 | AT82: =AC82+IF(s!AT81*s!AW81+s!AU81*s!AV81=0,0,E82*s!AT81*s!AW81/(s!AT81*s!AW81+s!AU81*s!AV81))+IF(s!AT81*s!AY81+s!AU81*s!AX81=0,0,K82*s!AT81*s!AY81/(s!AT81*s!AY81+s!AU81*s!AX81))+IF(s!AT81*s!AZ81+s!AV81*s!AX81=0,0,M82*s!AT81*s!AZ81/(s!AT81*s!AZ81+s!AV81*s!AX81))+IF(s!AT81*s!BA81+s!AU81*s!AZ81+s!AV81*s!AY81+s!AW81*s!AX81=0,0,N82*s!AT81*s!BA81/(s!AT81*s!BA81+s!AU81*s!AZ81+s!AV81*s!AY81+s!AW81*s!AX81)) -> 244.65839693634402 | AU82: =AD82+IF(s!AU81*s!AV81+s!AT81*s!AW81=0,0,E82*s!AU81*s!AV81/(s!AU81*s!AV81+s!AT81*s!AW81))+IF(s!AT81*s!AY81+s!AU81*s!AX81=0,0,K82*s!AU81*s!AX81/(s!AT81*s!AY81+s!AU81*s!AX81))+IF(s!AU81*s!BA81+s!AW81*s!AY81=0,0,O82*s!AU81*s!BA81/(s!AU81*s!BA81+s!AW81*s!AY81))+IF(s!AT81*s!BA81+s!AU81*s!AZ81+s!AV81*s!AY81+s!AW81*s!AX81=0,0,N82*s!AU81*s!AZ81/(s!AT81*s!BA81+s!AU81*s!AZ81+s!AV81*s!AY81+s!AW81*s!AX81)) -> 445.77362055038515 | AV82: =AE82+IF(s!AU81*s!AV81+s!AT81*s!AW81=0,0,E82*s!AU81*s!AV81/(s!AU81*s!AV81+s!AT81*s!AW81))+IF(s!AV81*s!AX81+s!AT81*s!AZ81=0,0,M82*s!AV81*s!AX81/(s!AV81*s!AX81+s!AT81*s!AZ81))+IF(s!AV81*s!BA81+s!AW81*s!AZ81=0,0,Q82*s!AV81*s!BA81/(s!AV81*s!BA81+s!AW81*s!AZ81))+IF(s!AT81*s!BA81+s!AU81*s!AZ81+s!AV81*s!AY81+s!AW81*s!AX81=0,0,N82*s!AV81*s!AY81/(s!AT81*s!BA81+s!AU81*s!AZ81+s!AV81*s!AY81+s!AW81*s!AX81)) -> 13.961447026622013 | AW82: =AF82+IF(s!AT81*s!AW81+s!AU81*s!AV81=0,0,E82*s!AT81*s!AW81/(s!AT81*s!AW81+s!AU81*s!AV81))+IF(s!AU81*s!BA81+s!AW81*s!AY81=0,0,O82*s!AW81*s!AY81/(s!AU81*s!BA81+s!AW81*s!AY81))+IF(s!AV81*s!BA81+s!AW81*s!AZ81=0,0,Q82*s!AW81*s!AZ81/(s!AV81*s!BA81+s!AW81*s!AZ81))+IF(s!AT81*s!BA81+s!AU81*s!AZ81+s!AV81*s!AY81+s!AW81*s!AX81=0,0,N82*s!AW81*s!AX81/(s!AT81*s!BA81+s!AU81*s!AZ81+s!AV81*s!AY81+s!AW81*s!AX81)) -> 9.6065354866487667 | AX82: =AG82+IF(s!AT81*s!AY81+s!AU81*s!AX81=0,0,K82*s!AU81*s!AX81/(s!AT81*s!AY81+s!AU81*s!AX81))+IF(s!AV81*s!AX81+s!AT81*s!AZ81=0,0,M82*s!AV81*s!AX81/(s!AV81*s!AX81+s!AT81*s!AZ81))+IF(s!AX81*s!BA81+s!AY81*s!AZ81=0,0,W82*s!AX81*s!BA81/(s!AX81*s!BA81+s!AY81*s!AZ81))+IF(s!AT81*s!BA81+s!AU81*s!AZ81+s!AV81*s!AY81+s!AW81*s!AX81=0,0,N82*s!AW81*s!AX81/(s!AT81*s!BA81+s!AU81*s!AZ81+s!AV81*s!AY81+s!AW81*s!AX81)) -> 13.99072011900329 | AY82: =AH82+IF(s!AT81*s!AY81+s!AU81*s!AX81=0,0,K82*s!AT81*s!AY81/(s!AT81*s!AY81+s!AU81*s!AX81))+IF(s!AU81*s!BA81+s!AW81*s!AY81=0,0,O82*s!AW81*s!AY81/(s!AU81*s!BA81+s!AW81*s!AY81))+IF(s!AX81*s!BA81+s!AY81*s!AZ81=0,0,W82*s!AY81*s!AZ81/(s!AX81*s!BA81+s!AY81*s!AZ81))+IF(s!AT81*s!BA81+s!AU81*s!AZ81+s!AV81*s!AY81+s!AW81*s!AX81=0,0,N82*s!AV81*s!AY81/(s!AT81*s!BA81+s!AU81*s!AZ81+s!AV81*s!AY81+s!AW81*s!AX81)) -> 10.577262394267491 | AZ82: =AI82+IF(s!AT81*s!AZ81+s!AV81*s!AX81=0,0,M82*s!AT81*s!AZ81/(s!AT81*s!AZ81+s!AV81*s!AX81))+IF(s!AV81*s!BA81+s!AW81*s!AZ81=0,0,Q82*s!AW81*s!AZ81/(s!AV81*s!BA81+s!AW81*s!AZ81))+IF(s!AX81*s!BA81+s!AY81*s!AZ81=0,0,W82*s!AY81*s!AZ81/(s!AX81*s!BA81+s!AY81*s!AZ81))+IF(s!AT81*s!BA81+s!AU81*s!AZ81+s!AV81*s!AY81+s!AW81*s!AX81=0,0,N82*s!AU81*s!AZ81/(s!AT81*s!BA81+s!AU81*s!AZ81+s!AV81*s!AY81+s!AW81*s!AX81)) -> 17.389435918030664 | BA82: =AJ82+IF(s!AU81*s!BA81+s!AW81*s!AY81=0,0,O82*s!AU81*s!BA81/(s!AU81*s!BA81+s!AW81*s!AY81))+IF(s!AV81*s!BA81+s!AW81*s!AZ81=0,0,Q82*s!AV81*s!BA81/(s!AV81*s!BA81+s!AW81*s!AZ81))+IF(s!AX81*s!BA81+s!AY81*s!AZ81=0,0,W82*s!AX81*s!BA81/(s!AX81*s!BA81+s!AY81*s!AZ81))+IF(s!AT81*s!BA81+s!AU81*s!AZ81+s!AV81*s!AY81+s!AW81*s!AX81=0,0,N82*s!AT81*s!BA81/(s!AT81*s!BA81+s!AU81*s!AZ81+s!AV81*s!AY81+s!AW81*s!AX81)) -> 22.042581568698552 | BJ82: =SUM(AT82:BA82) -> 778
A83: =A82 -> 100 | B83: =B82 -> 30 | C83: =C82 -> 200 | D83: =D82 -> 2 | E83: =E82 -> 4 | F83: =F82 -> 1 | G83: =G82 -> 1 | H83: =H82 -> 2 | I83: =I82 -> 1 | J83: =J82 -> 2 | K83: =K82 -> 4 | L83: =L82 -> 2 | M83: =M82 -> 4 | N83: =N82 -> 8 | O83: =O82 -> 4 | P83: =P82 -> 2 | Q83: =Q82 -> 4 | R83: =R82 -> 2 | S83: =S82 -> 1 | T83: =T82 -> 2 | U83: =U82 -> 1 | V83: =V82 -> 2 | W83: =W82 -> 4 | X83: =X82 -> 2 | Y83: =Y82 -> 1 | Z83: =Z82 -> 2 | AA83: =AA82 -> 1 | AB83: =AB82 -> 389 | AC83: =AC82 -> 234 | AD83: =AD82 -> 433 | AE83: =AE82 -> 8 | AF83: =AF82 -> 7 | AG83: =AG82 -> 8 | AH83: =AH82 -> 8 | AI83: =AI82 -> 8 | AJ83: =AJ82 -> 8 | AS83: =AS82 -> 714 | AT83: =AC83+IF(s!AT82*s!AW82+s!AU82*s!AV82=0,0,E83*s!AT82*s!AW82/(s!AT82*s!AW82+s!AU82*s!AV82))+IF(s!AT82*s!AY82+s!AU82*s!AX82=0,0,K83*s!AT82*s!AY82/(s!AT82*s!AY82+s!AU82*s!AX82))+IF(s!AT82*s!AZ82+s!AV82*s!AX82=0,0,M83*s!AT82*s!AZ82/(s!AT82*s!AZ82+s!AV82*s!AX82))+IF(s!AT82*s!BA82+s!AU82*s!AZ82+s!AV82*s!AY82+s!AW82*s!AX82=0,0,N83*s!AT82*s!BA82/(s!AT82*s!BA82+s!AU82*s!AZ82+s!AV82*s!AY82+s!AW82*s!AX82)) -> 244.65839693634416 | AU83: =AD83+IF(s!AU82*s!AV82+s!AT82*s!AW82=0,0,E83*s!AU82*s!AV82/(s!AU82*s!AV82+s!AT82*s!AW82))+IF(s!AT82*s!AY82+s!AU82*s!AX82=0,0,K83*s!AU82*s!AX82/(s!AT82*s!AY82+s!AU82*s!AX82))+IF(s!AU82*s!BA82+s!AW82*s!AY82=0,0,O83*s!AU82*s!BA82/(s!AU82*s!BA82+s!AW82*s!AY82))+IF(s!AT82*s!BA82+s!AU82*s!AZ82+s!AV82*s!AY82+s!AW82*s!AX82=0,0,N83*s!AU82*s!AZ82/(s!AT82*s!BA82+s!AU82*s!AZ82+s!AV82*s!AY82+s!AW82*s!AX82)) -> 445.77362055038498 | AV83: =AE83+IF(s!AU82*s!AV82+s!AT82*s!AW82=0,0,E83*s!AU82*s!AV82/(s!AU82*s!AV82+s!AT82*s!AW82))+IF(s!AV82*s!AX82+s!AT82*s!AZ82=0,0,M83*s!AV82*s!AX82/(s!AV82*s!AX82+s!AT82*s!AZ82))+IF(s!AV82*s!BA82+s!AW82*s!AZ82=0,0,Q83*s!AV82*s!BA82/(s!AV82*s!BA82+s!AW82*s!AZ82))+IF(s!AT82*s!BA82+s!AU82*s!AZ82+s!AV82*s!AY82+s!AW82*s!AX82=0,0,N83*s!AV82*s!AY82/(s!AT82*s!BA82+s!AU82*s!AZ82+s!AV82*s!AY82+s!AW82*s!AX82)) -> 13.961447026623123 | AW83: =AF83+IF(s!AT82*s!AW82+s!AU82*s!AV82=0,0,E83*s!AT82*s!AW82/(s!AT82*s!AW82+s!AU82*s!AV82))+IF(s!AU82*s!BA82+s!AW82*s!AY82=0,0,O83*s!AW82*s!AY82/(s!AU82*s!BA82+s!AW82*s!AY82))+IF(s!AV82*s!BA82+s!AW82*s!AZ82=0,0,Q83*s!AW82*s!AZ82/(s!AV82*s!BA82+s!AW82*s!AZ82))+IF(s!AT82*s!BA82+s!AU82*s!AZ82+s!AV82*s!AY82+s!AW82*s!AX82=0,0,N83*s!AW82*s!AX82/(s!AT82*s!BA82+s!AU82*s!AZ82+s!AV82*s!AY82+s!AW82*s!AX82)) -> 9.6065354866477364 | AX83: =AG83+IF(s!AT82*s!AY82+s!AU82*s!AX82=0,0,K83*s!AU82*s!AX82/(s!AT82*s!AY82+s!AU82*s!AX82))+IF(s!AV82*s!AX82+s!AT82*s!AZ82=0,0,M83*s!AV82*s!AX82/(s!AV82*s!AX82+s!AT82*s!AZ82))+IF(s!AX82*s!BA82+s!AY82*s!AZ82=0,0,W83*s!AX82*s!BA82/(s!AX82*s!BA82+s!AY82*s!AZ82))+IF(s!AT82*s!BA82+s!AU82*s!AZ82+s!AV82*s!AY82+s!AW82*s!AX82=0,0,N83*s!AW82*s!AX82/(s!AT82*s!BA82+s!AU82*s!AZ82+s!AV82*s!AY82+s!AW82*s!AX82)) -> 13.990720119004294 | AY83: =AH83+IF(s!AT82*s!AY82+s!AU82*s!AX82=0,0,K83*s!AT82*s!AY82/(s!AT82*s!AY82+s!AU82*s!AX82))+IF(s!AU82*s!BA82+s!AW82*s!AY82=0,0,O83*s!AW82*s!AY82/(s!AU82*s!BA82+s!AW82*s!AY82))+IF(s!AX82*s!BA82+s!AY82*s!AZ82=0,0,W83*s!AY82*s!AZ82/(s!AX82*s!BA82+s!AY82*s!AZ82))+IF(s!AT82*s!BA82+s!AU82*s!AZ82+s!AV82*s!AY82+s!AW82*s!AX82=0,0,N83*s!AV82*s!AY82/(s!AT82*s!BA82+s!AU82*s!AZ82+s!AV82*s!AY82+s!AW82*s!AX82)) -> 10.577262394266562 | AZ83: =AI83+IF(s!AT82*s!AZ82+s!AV82*s!AX82=0,0,M83*s!AT82*s!AZ82/(s!AT82*s!AZ82+s!AV82*s!AX82))+IF(s!AV82*s!BA82+s!AW82*s!AZ82=0,0,Q83*s!AW82*s!AZ82/(s!AV82*s!BA82+s!AW82*s!AZ82))+IF(s!AX82*s!BA82+s!AY82*s!AZ82=0,0,W83*s!AY82*s!AZ82/(s!AX82*s!BA82+s!AY82*s!AZ82))+IF(s!AT82*s!BA82+s!AU82*s!AZ82+s!AV82*s!AY82+s!AW82*s!AX82=0,0,N83*s!AU82*s!AZ82/(s!AT82*s!BA82+s!AU82*s!AZ82+s!AV82*s!AY82+s!AW82*s!AX82)) -> 17.389435918028433 | BA83: =AJ83+IF(s!AU82*s!BA82+s!AW82*s!AY82=0,0,O83*s!AU82*s!BA82/(s!AU82*s!BA82+s!AW82*s!AY82))+IF(s!AV82*s!BA82+s!AW82*s!AZ82=0,0,Q83*s!AV82*s!BA82/(s!AV82*s!BA82+s!AW82*s!AZ82))+IF(s!AX82*s!BA82+s!AY82*s!AZ82=0,0,W83*s!AX82*s!BA82/(s!AX82*s!BA82+s!AY82*s!AZ82))+IF(s!AT82*s!BA82+s!AU82*s!AZ82+s!AV82*s!AY82+s!AW82*s!AX82=0,0,N83*s!AT82*s!BA82/(s!AT82*s!BA82+s!AU82*s!AZ82+s!AV82*s!AY82+s!AW82*s!AX82)) -> 22.042581568700708 | BJ83: =SUM(AT83:BA83) -> 778
A84: =A83 -> 100 | B84: =B83 -> 30 | C84: =C83 -> 200 | D84: =D83 -> 2 | E84: =E83 -> 4 | F84: =F83 -> 1 | G84: =G83 -> 1 | H84: =H83 -> 2 | I84: =I83 -> 1 | J84: =J83 -> 2 | K84: =K83 -> 4 | L84: =L83 -> 2 | M84: =M83 -> 4 | N84: =N83 -> 8 | O84: =O83 -> 4 | P84: =P83 -> 2 | Q84: =Q83 -> 4 | R84: =R83 -> 2 | S84: =S83 -> 1 | T84: =T83 -> 2 | U84: =U83 -> 1 | V84: =V83 -> 2 | W84: =W83 -> 4 | X84: =X83 -> 2 | Y84: =Y83 -> 1 | Z84: =Z83 -> 2 | AA84: =AA83 -> 1 | AB84: =AB83 -> 389 | AC84: =AC83 -> 234 | AD84: =AD83 -> 433 | AE84: =AE83 -> 8 | AF84: =AF83 -> 7 | AG84: =AG83 -> 8 | AH84: =AH83 -> 8 | AI84: =AI83 -> 8 | AJ84: =AJ83 -> 8 | AS84: =AS83 -> 714 | AT84: =AC84+IF(s!AT83*s!AW83+s!AU83*s!AV83=0,0,E84*s!AT83*s!AW83/(s!AT83*s!AW83+s!AU83*s!AV83))+IF(s!AT83*s!AY83+s!AU83*s!AX83=0,0,K84*s!AT83*s!AY83/(s!AT83*s!AY83+s!AU83*s!AX83))+IF(s!AT83*s!AZ83+s!AV83*s!AX83=0,0,M84*s!AT83*s!AZ83/(s!AT83*s!AZ83+s!AV83*s!AX83))+IF(s!AT83*s!BA83+s!AU83*s!AZ83+s!AV83*s!AY83+s!AW83*s!AX83=0,0,N84*s!AT83*s!BA83/(s!AT83*s!BA83+s!AU83*s!AZ83+s!AV83*s!AY83+s!AW83*s!AX83)) -> 244.65839693634422 | AU84: =AD84+IF(s!AU83*s!AV83+s!AT83*s!AW83=0,0,E84*s!AU83*s!AV83/(s!AU83*s!AV83+s!AT83*s!AW83))+IF(s!AT83*s!AY83+s!AU83*s!AX83=0,0,K84*s!AU83*s!AX83/(s!AT83*s!AY83+s!AU83*s!AX83))+IF(s!AU83*s!BA83+s!AW83*s!AY83=0,0,O84*s!AU83*s!BA83/(s!AU83*s!BA83+s!AW83*s!AY83))+IF(s!AT83*s!BA83+s!AU83*s!AZ83+s!AV83*s!AY83+s!AW83*s!AX83=0,0,N84*s!AU83*s!AZ83/(s!AT83*s!BA83+s!AU83*s!AZ83+s!AV83*s!AY83+s!AW83*s!AX83)) -> 445.77362055038486 | AV84: =AE84+IF(s!AU83*s!AV83+s!AT83*s!AW83=0,0,E84*s!AU83*s!AV83/(s!AU83*s!AV83+s!AT83*s!AW83))+IF(s!AV83*s!AX83+s!AT83*s!AZ83=0,0,M84*s!AV83*s!AX83/(s!AV83*s!AX83+s!AT83*s!AZ83))+IF(s!AV83*s!BA83+s!AW83*s!AZ83=0,0,Q84*s!AV83*s!BA83/(s!AV83*s!BA83+s!AW83*s!AZ83))+IF(s!AT83*s!BA83+s!AU83*s!AZ83+s!AV83*s!AY83+s!AW83*s!AX83=0,0,N84*s!AV83*s!AY83/(s!AT83*s!BA83+s!AU83*s!AZ83+s!AV83*s!AY83+s!AW83*s!AX83)) -> 13.961447026623915 | AW84: =AF84+IF(s!AT83*s!AW83+s!AU83*s!AV83=0,0,E84*s!AT83*s!AW83/(s!AT83*s!AW83+s!AU83*s!AV83))+IF(s!AU83*s!BA83+s!AW83*s!AY83=0,0,O84*s!AW83*s!AY83/(s!AU83*s!BA83+s!AW83*s!AY83))+IF(s!AV83*s!BA83+s!AW83*s!AZ83=0,0,Q84*s!AW83*s!AZ83/(s!AV83*s!BA83+s!AW83*s!AZ83))+IF(s!AT83*s!BA83+s!AU83*s!AZ83+s!AV83*s!AY83+s!AW83*s!AX83=0,0,N84*s!AW83*s!AX83/(s!AT83*s!BA83+s!AU83*s!AZ83+s!AV83*s!AY83+s!AW83*s!AX83)) -> 9.6065354866469956 | AX84: =AG84+IF(s!AT83*s!AY83+s!AU83*s!AX83=0,0,K84*s!AU83*s!AX83/(s!AT83*s!AY83+s!AU83*s!AX83))+IF(s!AV83*s!AX83+s!AT83*s!AZ83=0,0,M84*s!AV83*s!AX83/(s!AV83*s!AX83+s!AT83*s!AZ83))+IF(s!AX83*s!BA83+s!AY83*s!AZ83=0,0,W84*s!AX83*s!BA83/(s!AX83*s!BA83+s!AY83*s!AZ83))+IF(s!AT83*s!BA83+s!AU83*s!AZ83+s!AV83*s!AY83+s!AW83*s!AX83=0,0,N84*s!AW83*s!AX83/(s!AT83*s!BA83+s!AU83*s!AZ83+s!AV83*s!AY83+s!AW83*s!AX83)) -> 13.99072011900501 | AY84: =AH84+IF(s!AT83*s!AY83+s!AU83*s!AX83=0,0,K84*s!AT83*s!AY83/(s!AT83*s!AY83+s!AU83*s!AX83))+IF(s!AU83*s!BA83+s!AW83*s!AY83=0,0,O84*s!AW83*s!AY83/(s!AU83*s!BA83+s!AW83*s!AY83))+IF(s!AX83*s!BA83+s!AY83*s!AZ83=0,0,W84*s!AY83*s!AZ83/(s!AX83*s!BA83+s!AY83*s!AZ83))+IF(s!AT83*s!BA83+s!AU83*s!AZ83+s!AV83*s!AY83+s!AW83*s!AX83=0,0,N84*s!AV83*s!AY83/(s!AT83*s!BA83+s!AU83*s!AZ83+s!AV83*s!AY83+s!AW83*s!AX83)) -> 10.577262394265899 | AZ84: =AI84+IF(s!AT83*s!AZ83+s!AV83*s!AX83=0,0,M84*s!AT83*s!AZ83/(s!AT83*s!AZ83+s!AV83*s!AX83))+IF(s!AV83*s!BA83+s!AW83*s!AZ83=0,0,Q84*s!AW83*s!AZ83/(s!AV83*s!BA83+s!AW83*s!AZ83))+IF(s!AX83*s!BA83+s!AY83*s!AZ83=0,0,W84*s!AY83*s!AZ83/(s!AX83*s!BA83+s!AY83*s!AZ83))+IF(s!AT83*s!BA83+s!AU83*s!AZ83+s!AV83*s!AY83+s!AW83*s!AX83=0,0,N84*s!AU83*s!AZ83/(s!AT83*s!BA83+s!AU83*s!AZ83+s!AV83*s!AY83+s!AW83*s!AX83)) -> 17.389435918026837 | BA84: =AJ84+IF(s!AU83*s!BA83+s!AW83*s!AY83=0,0,O84*s!AU83*s!BA83/(s!AU83*s!BA83+s!AW83*s!AY83))+IF(s!AV83*s!BA83+s!AW83*s!AZ83=0,0,Q84*s!AV83*s!BA83/(s!AV83*s!BA83+s!AW83*s!AZ83))+IF(s!AX83*s!BA83+s!AY83*s!AZ83=0,0,W84*s!AX83*s!BA83/(s!AX83*s!BA83+s!AY83*s!AZ83))+IF(s!AT83*s!BA83+s!AU83*s!AZ83+s!AV83*s!AY83+s!AW83*s!AX83=0,0,N84*s!AT83*s!BA83/(s!AT83*s!BA83+s!AU83*s!AZ83+s!AV83*s!AY83+s!AW83*s!AX83)) -> 22.042581568702253 | BJ84: =SUM(AT84:BA84) -> 778
A85: =A84 -> 100 | B85: =B84 -> 30 | C85: =C84 -> 200 | D85: =D84 -> 2 | E85: =E84 -> 4 | F85: =F84 -> 1 | G85: =G84 -> 1 | H85: =H84 -> 2 | I85: =I84 -> 1 | J85: =J84 -> 2 | K85: =K84 -> 4 | L85: =L84 -> 2 | M85: =M84 -> 4 | N85: =N84 -> 8 | O85: =O84 -> 4 | P85: =P84 -> 2 | Q85: =Q84 -> 4 | R85: =R84 -> 2 | S85: =S84 -> 1 | T85: =T84 -> 2 | U85: =U84 -> 1 | V85: =V84 -> 2 | W85: =W84 -> 4 | X85: =X84 -> 2 | Y85: =Y84 -> 1 | Z85: =Z84 -> 2 | AA85: =AA84 -> 1 | AB85: =AB84 -> 389 | AC85: =AC84 -> 234 | AD85: =AD84 -> 433 | AE85: =AE84 -> 8 | AF85: =AF84 -> 7 | AG85: =AG84 -> 8 | AH85: =AH84 -> 8 | AI85: =AI84 -> 8 | AJ85: =AJ84 -> 8 | AS85: =AS84 -> 714 | AT85: =AC85+IF(s!AT84*s!AW84+s!AU84*s!AV84=0,0,E85*s!AT84*s!AW84/(s!AT84*s!AW84+s!AU84*s!AV84))+IF(s!AT84*s!AY84+s!AU84*s!AX84=0,0,K85*s!AT84*s!AY84/(s!AT84*s!AY84+s!AU84*s!AX84))+IF(s!AT84*s!AZ84+s!AV84*s!AX84=0,0,M85*s!AT84*s!AZ84/(s!AT84*s!AZ84+s!AV84*s!AX84))+IF(s!AT84*s!BA84+s!AU84*s!AZ84+s!AV84*s!AY84+s!AW84*s!AX84=0,0,N85*s!AT84*s!BA84/(s!AT84*s!BA84+s!AU84*s!AZ84+s!AV84*s!AY84+s!AW84*s!AX84)) -> 244.6583969363443 | AU85: =AD85+IF(s!AU84*s!AV84+s!AT84*s!AW84=0,0,E85*s!AU84*s!AV84/(s!AU84*s!AV84+s!AT84*s!AW84))+IF(s!AT84*s!AY84+s!AU84*s!AX84=0,0,K85*s!AU84*s!AX84/(s!AT84*s!AY84+s!AU84*s!AX84))+IF(s!AU84*s!BA84+s!AW84*s!AY84=0,0,O85*s!AU84*s!BA84/(s!AU84*s!BA84+s!AW84*s!AY84))+IF(s!AT84*s!BA84+s!AU84*s!AZ84+s!AV84*s!AY84+s!AW84*s!AX84=0,0,N85*s!AU84*s!AZ84/(s!AT84*s!BA84+s!AU84*s!AZ84+s!AV84*s!AY84+s!AW84*s!AX84)) -> 445.77362055038475 | AV85: =AE85+IF(s!AU84*s!AV84+s!AT84*s!AW84=0,0,E85*s!AU84*s!AV84/(s!AU84*s!AV84+s!AT84*s!AW84))+IF(s!AV84*s!AX84+s!AT84*s!AZ84=0,0,M85*s!AV84*s!AX84/(s!AV84*s!AX84+s!AT84*s!AZ84))+IF(s!AV84*s!BA84+s!AW84*s!AZ84=0,0,Q85*s!AV84*s!BA84/(s!AV84*s!BA84+s!AW84*s!AZ84))+IF(s!AT84*s!BA84+s!AU84*s!AZ84+s!AV84*s!AY84+s!AW84*s!AX84=0,0,N85*s!AV84*s!AY84/(s!AT84*s!BA84+s!AU84*s!AZ84+s!AV84*s!AY84+s!AW84*s!AX84)) -> 13.961447026624482 | AW85: =AF85+IF(s!AT84*s!AW84+s!AU84*s!AV84=0,0,E85*s!AT84*s!AW84/(s!AT84*s!AW84+s!AU84*s!AV84))+IF(s!AU84*s!BA84+s!AW84*s!AY84=0,0,O85*s!AW84*s!AY84/(s!AU84*s!BA84+s!AW84*s!AY84))+IF(s!AV84*s!BA84+s!AW84*s!AZ84=0,0,Q85*s!AW84*s!AZ84/(s!AV84*s!BA84+s!AW84*s!AZ84))+IF(s!AT84*s!BA84+s!AU84*s!AZ84+s!AV84*s!AY84+s!AW84*s!AX84=0,0,N85*s!AW84*s!AX84/(s!AT84*s!BA84+s!AU84*s!AZ84+s!AV84*s!AY84+s!AW84*s!AX84)) -> 9.6065354866464663 | AX85: =AG85+IF(s!AT84*s!AY84+s!AU84*s!AX84=0,0,K85*s!AU84*s!AX84/(s!AT84*s!AY84+s!AU84*s!AX84))+IF(s!AV84*s!AX84+s!AT84*s!AZ84=0,0,M85*s!AV84*s!AX84/(s!AV84*s!AX84+s!AT84*s!AZ84))+IF(s!AX84*s!BA84+s!AY84*s!AZ84=0,0,W85*s!AX84*s!BA84/(s!AX84*s!BA84+s!AY84*s!AZ84))+IF(s!AT84*s!BA84+s!AU84*s!AZ84+s!AV84*s!AY84+s!AW84*s!AX84=0,0,N85*s!AW84*s!AX84/(s!AT84*s!BA84+s!AU84*s!AZ84+s!AV84*s!AY84+s!AW84*s!AX84)) -> 13.990720119005525 | AY85: =AH85+IF(s!AT84*s!AY84+s!AU84*s!AX84=0,0,K85*s!AT84*s!AY84/(s!AT84*s!AY84+s!AU84*s!AX84))+IF(s!AU84*s!BA84+s!AW84*s!AY84=0,0,O85*s!AW84*s!AY84/(s!AU84*s!BA84+s!AW84*s!AY84))+IF(s!AX84*s!BA84+s!AY84*s!AZ84=0,0,W85*s!AY84*s!AZ84/(s!AX84*s!BA84+s!AY84*s!AZ84))+IF(s!AT84*s!BA84+s!AU84*s!AZ84+s!AV84*s!AY84+s!AW84*s!AX84=0,0,N85*s!AV84*s!AY84/(s!AT84*s!BA84+s!AU84*s!AZ84+s!AV84*s!AY84+s!AW84*s!AX84)) -> 10.577262394265423 | AZ85: =AI85+IF(s!AT84*s!AZ84+s!AV84*s!AX84=0,0,M85*s!AT84*s!AZ84/(s!AT84*s!AZ84+s!AV84*s!AX84))+IF(s!AV84*s!BA84+s!AW84*s!AZ84=0,0,Q85*s!AW84*s!AZ84/(s!AV84*s!BA84+s!AW84*s!AZ84))+IF(s!AX84*s!BA84+s!AY84*s!AZ84=0,0,W85*s!AY84*s!AZ84/(s!AX84*s!BA84+s!AY84*s!AZ84))+IF(s!AT84*s!BA84+s!AU84*s!AZ84+s!AV84*s!AY84+s!AW84*s!AX84=0,0,N85*s!AU84*s!AZ84/(s!AT84*s!BA84+s!AU84*s!AZ84+s!AV84*s!AY84+s!AW84*s!AX84)) -> 17.389435918025697 | BA85: =AJ85+IF(s!AU84*s!BA84+s!AW84*s!AY84=0,0,O85*s!AU84*s!BA84/(s!AU84*s!BA84+s!AW84*s!AY84))+IF(s!AV84*s!BA84+s!AW84*s!AZ84=0,0,Q85*s!AV84*s!BA84/(s!AV84*s!BA84+s!AW84*s!AZ84))+IF(s!AX84*s!BA84+s!AY84*s!AZ84=0,0,W85*s!AX84*s!BA84/(s!AX84*s!BA84+s!AY84*s!AZ84))+IF(s!AT84*s!BA84+s!AU84*s!AZ84+s!AV84*s!AY84+s!AW84*s!AX84=0,0,N85*s!AT84*s!BA84/(s!AT84*s!BA84+s!AU84*s!AZ84+s!AV84*s!AY84+s!AW84*s!AX84)) -> 22.042581568703355 | BJ85: =SUM(AT85:BA85) -> 778
A86: =A85 -> 100 | B86: =B85 -> 30 | C86: =C85 -> 200 | D86: =D85 -> 2 | E86: =E85 -> 4 | F86: =F85 -> 1 | G86: =G85 -> 1 | H86: =H85 -> 2 | I86: =I85 -> 1 | J86: =J85 -> 2 | K86: =K85 -> 4 | L86: =L85 -> 2 | M86: =M85 -> 4 | N86: =N85 -> 8 | O86: =O85 -> 4 | P86: =P85 -> 2 | Q86: =Q85 -> 4 | R86: =R85 -> 2 | S86: =S85 -> 1 | T86: =T85 -> 2 | U86: =U85 -> 1 | V86: =V85 -> 2 | W86: =W85 -> 4 | X86: =X85 -> 2 | Y86: =Y85 -> 1 | Z86: =Z85 -> 2 | AA86: =AA85 -> 1 | AB86: =AB85 -> 389 | AC86: =AC85 -> 234 | AD86: =AD85 -> 433 | AE86: =AE85 -> 8 | AF86: =AF85 -> 7 | AG86: =AG85 -> 8 | AH86: =AH85 -> 8 | AI86: =AI85 -> 8 | AJ86: =AJ85 -> 8 | AS86: =AS85 -> 714 | AT86: =AC86+IF(s!AT85*s!AW85+s!AU85*s!AV85=0,0,E86*s!AT85*s!AW85/(s!AT85*s!AW85+s!AU85*s!AV85))+IF(s!AT85*s!AY85+s!AU85*s!AX85=0,0,K86*s!AT85*s!AY85/(s!AT85*s!AY85+s!AU85*s!AX85))+IF(s!AT85*s!AZ85+s!AV85*s!AX85=0,0,M86*s!AT85*s!AZ85/(s!AT85*s!AZ85+s!AV85*s!AX85))+IF(s!AT85*s!BA85+s!AU85*s!AZ85+s!AV85*s!AY85+s!AW85*s!AX85=0,0,N86*s!AT85*s!BA85/(s!AT85*s!BA85+s!AU85*s!AZ85+s!AV85*s!AY85+s!AW85*s!AX85)) -> 244.65839693634433 | AU86: =AD86+IF(s!AU85*s!AV85+s!AT85*s!AW85=0,0,E86*s!AU85*s!AV85/(s!AU85*s!AV85+s!AT85*s!AW85))+IF(s!AT85*s!AY85+s!AU85*s!AX85=0,0,K86*s!AU85*s!AX85/(s!AT85*s!AY85+s!AU85*s!AX85))+IF(s!AU85*s!BA85+s!AW85*s!AY85=0,0,O86*s!AU85*s!BA85/(s!AU85*s!BA85+s!AW85*s!AY85))+IF(s!AT85*s!BA85+s!AU85*s!AZ85+s!AV85*s!AY85+s!AW85*s!AX85=0,0,N86*s!AU85*s!AZ85/(s!AT85*s!BA85+s!AU85*s!AZ85+s!AV85*s!AY85+s!AW85*s!AX85)) -> 445.77362055038469 | AV86: =AE86+IF(s!AU85*s!AV85+s!AT85*s!AW85=0,0,E86*s!AU85*s!AV85/(s!AU85*s!AV85+s!AT85*s!AW85))+IF(s!AV85*s!AX85+s!AT85*s!AZ85=0,0,M86*s!AV85*s!AX85/(s!AV85*s!AX85+s!AT85*s!AZ85))+IF(s!AV85*s!BA85+s!AW85*s!AZ85=0,0,Q86*s!AV85*s!BA85/(s!AV85*s!BA85+s!AW85*s!AZ85))+IF(s!AT85*s!BA85+s!AU85*s!AZ85+s!AV85*s!AY85+s!AW85*s!AX85=0,0,N86*s!AV85*s!AY85/(s!AT85*s!BA85+s!AU85*s!AZ85+s!AV85*s!AY85+s!AW85*s!AX85)) -> 13.961447026624889 | AW86: =AF86+IF(s!AT85*s!AW85+s!AU85*s!AV85=0,0,E86*s!AT85*s!AW85/(s!AT85*s!AW85+s!AU85*s!AV85))+IF(s!AU85*s!BA85+s!AW85*s!AY85=0,0,O86*s!AW85*s!AY85/(s!AU85*s!BA85+s!AW85*s!AY85))+IF(s!AV85*s!BA85+s!AW85*s!AZ85=0,0,Q86*s!AW85*s!AZ85/(s!AV85*s!BA85+s!AW85*s!AZ85))+IF(s!AT85*s!BA85+s!AU85*s!AZ85+s!AV85*s!AY85+s!AW85*s!AX85=0,0,N86*s!AW85*s!AX85/(s!AT85*s!BA85+s!AU85*s!AZ85+s!AV85*s!AY85+s!AW85*s!AX85)) -> 9.6065354866460879 | AX86: =AG86+IF(s!AT85*s!AY85+s!AU85*s!AX85=0,0,K86*s!AU85*s!AX85/(s!AT85*s!AY85+s!AU85*s!AX85))+IF(s!AV85*s!AX85+s!AT85*s!AZ85=0,0,M86*s!AV85*s!AX85/(s!AV85*s!AX85+s!AT85*s!AZ85))+IF(s!AX85*s!BA85+s!AY85*s!AZ85=0,0,W86*s!AX85*s!BA85/(s!AX85*s!BA85+s!AY85*s!AZ85))+IF(s!AT85*s!BA85+s!AU85*s!AZ85+s!AV85*s!AY85+s!AW85*s!AX85=0,0,N86*s!AW85*s!AX85/(s!AT85*s!BA85+s!AU85*s!AZ85+s!AV85*s!AY85+s!AW85*s!AX85)) -> 13.990720119005893 | AY86: =AH86+IF(s!AT85*s!AY85+s!AU85*s!AX85=0,0,K86*s!AT85*s!AY85/(s!AT85*s!AY85+s!AU85*s!AX85))+IF(s!AU85*s!BA85+s!AW85*s!AY85=0,0,O86*s!AW85*s!AY85/(s!AU85*s!BA85+s!AW85*s!AY85))+IF(s!AX85*s!BA85+s!AY85*s!AZ85=0,0,W86*s!AY85*s!AZ85/(s!AX85*s!BA85+s!AY85*s!AZ85))+IF(s!AT85*s!BA85+s!AU85*s!AZ85+s!AV85*s!AY85+s!AW85*s!AX85=0,0,N86*s!AV85*s!AY85/(s!AT85*s!BA85+s!AU85*s!AZ85+s!AV85*s!AY85+s!AW85*s!AX85)) -> 10.57726239426508 | AZ86: =AI86+IF(s!AT85*s!AZ85+s!AV85*s!AX85=0,0,M86*s!AT85*s!AZ85/(s!AT85*s!AZ85+s!AV85*s!AX85))+IF(s!AV85*s!BA85+s!AW85*s!AZ85=0,0,Q86*s!AW85*s!AZ85/(s!AV85*s!BA85+s!AW85*s!AZ85))+IF(s!AX85*s!BA85+s!AY85*s!AZ85=0,0,W86*s!AY85*s!AZ85/(s!AX85*s!BA85+s!AY85*s!AZ85))+IF(s!AT85*s!BA85+s!AU85*s!AZ85+s!AV85*s!AY85+s!AW85*s!AX85=0,0,N86*s!AU85*s!AZ85/(s!AT85*s!BA85+s!AU85*s!AZ85+s!AV85*s!AY85+s!AW85*s!AX85)) -> 17.389435918024876 | BA86: =AJ86+IF(s!AU85*s!BA85+s!AW85*s!AY85=0,0,O86*s!AU85*s!BA85/(s!AU85*s!BA85+s!AW85*s!AY85))+IF(s!AV85*s!BA85+s!AW85*s!AZ85=0,0,Q86*s!AV85*s!BA85/(s!AV85*s!BA85+s!AW85*s!AZ85))+IF(s!AX85*s!BA85+s!AY85*s!AZ85=0,0,W86*s!AX85*s!BA85/(s!AX85*s!BA85+s!AY85*s!AZ85))+IF(s!AT85*s!BA85+s!AU85*s!AZ85+s!AV85*s!AY85+s!AW85*s!AX85=0,0,N86*s!AT85*s!BA85/(s!AT85*s!BA85+s!AU85*s!AZ85+s!AV85*s!AY85+s!AW85*s!AX85)) -> 22.042581568704144 | BJ86: =SUM(AT86:BA86) -> 778
A87: =A86 -> 100 | B87: =B86 -> 30 | C87: =C86 -> 200 | D87: =D86 -> 2 | E87: =E86 -> 4 | F87: =F86 -> 1 | G87: =G86 -> 1 | H87: =H86 -> 2 | I87: =I86 -> 1 | J87: =J86 -> 2 | K87: =K86 -> 4 | L87: =L86 -> 2 | M87: =M86 -> 4 | N87: =N86 -> 8 | O87: =O86 -> 4 | P87: =P86 -> 2 | Q87: =Q86 -> 4 | R87: =R86 -> 2 | S87: =S86 -> 1 | T87: =T86 -> 2 | U87: =U86 -> 1 | V87: =V86 -> 2 | W87: =W86 -> 4 | X87: =X86 -> 2 | Y87: =Y86 -> 1 | Z87: =Z86 -> 2 | AA87: =AA86 -> 1 | AB87: =AB86 -> 389 | AC87: =AC86 -> 234 | AD87: =AD86 -> 433 | AE87: =AE86 -> 8 | AF87: =AF86 -> 7 | AG87: =AG86 -> 8 | AH87: =AH86 -> 8 | AI87: =AI86 -> 8 | AJ87: =AJ86 -> 8 | AS87: =AS86 -> 714 | AT87: =AC87+IF(s!AT86*s!AW86+s!AU86*s!AV86=0,0,E87*s!AT86*s!AW86/(s!AT86*s!AW86+s!AU86*s!AV86))+IF(s!AT86*s!AY86+s!AU86*s!AX86=0,0,K87*s!AT86*s!AY86/(s!AT86*s!AY86+s!AU86*s!AX86))+IF(s!AT86*s!AZ86+s!AV86*s!AX86=0,0,M87*s!AT86*s!AZ86/(s!AT86*s!AZ86+s!AV86*s!AX86))+IF(s!AT86*s!BA86+s!AU86*s!AZ86+s!AV86*s!AY86+s!AW86*s!AX86=0,0,N87*s!AT86*s!BA86/(s!AT86*s!BA86+s!AU86*s!AZ86+s!AV86*s!AY86+s!AW86*s!AX86)) -> 244.65839693634439 | AU87: =AD87+IF(s!AU86*s!AV86+s!AT86*s!AW86=0,0,E87*s!AU86*s!AV86/(s!AU86*s!AV86+s!AT86*s!AW86))+IF(s!AT86*s!AY86+s!AU86*s!AX86=0,0,K87*s!AU86*s!AX86/(s!AT86*s!AY86+s!AU86*s!AX86))+IF(s!AU86*s!BA86+s!AW86*s!AY86=0,0,O87*s!AU86*s!BA86/(s!AU86*s!BA86+s!AW86*s!AY86))+IF(s!AT86*s!BA86+s!AU86*s!AZ86+s!AV86*s!AY86+s!AW86*s!AX86=0,0,N87*s!AU86*s!AZ86/(s!AT86*s!BA86+s!AU86*s!AZ86+s!AV86*s!AY86+s!AW86*s!AX86)) -> 445.77362055038463 | AV87: =AE87+IF(s!AU86*s!AV86+s!AT86*s!AW86=0,0,E87*s!AU86*s!AV86/(s!AU86*s!AV86+s!AT86*s!AW86))+IF(s!AV86*s!AX86+s!AT86*s!AZ86=0,0,M87*s!AV86*s!AX86/(s!AV86*s!AX86+s!AT86*s!AZ86))+IF(s!AV86*s!BA86+s!AW86*s!AZ86=0,0,Q87*s!AV86*s!BA86/(s!AV86*s!BA86+s!AW86*s!AZ86))+IF(s!AT86*s!BA86+s!AU86*s!AZ86+s!AV86*s!AY86+s!AW86*s!AX86=0,0,N87*s!AV86*s!AY86/(s!AT86*s!BA86+s!AU86*s!AZ86+s!AV86*s!AY86+s!AW86*s!AX86)) -> 13.961447026625176 | AW87: =AF87+IF(s!AT86*s!AW86+s!AU86*s!AV86=0,0,E87*s!AT86*s!AW86/(s!AT86*s!AW86+s!AU86*s!AV86))+IF(s!AU86*s!BA86+s!AW86*s!AY86=0,0,O87*s!AW86*s!AY86/(s!AU86*s!BA86+s!AW86*s!AY86))+IF(s!AV86*s!BA86+s!AW86*s!AZ86=0,0,Q87*s!AW86*s!AZ86/(s!AV86*s!BA86+s!AW86*s!AZ86))+IF(s!AT86*s!BA86+s!AU86*s!AZ86+s!AV86*s!AY86+s!AW86*s!AX86=0,0,N87*s!AW86*s!AX86/(s!AT86*s!BA86+s!AU86*s!AZ86+s!AV86*s!AY86+s!AW86*s!AX86)) -> 9.6065354866458179 | AX87: =AG87+IF(s!AT86*s!AY86+s!AU86*s!AX86=0,0,K87*s!AU86*s!AX86/(s!AT86*s!AY86+s!AU86*s!AX86))+IF(s!AV86*s!AX86+s!AT86*s!AZ86=0,0,M87*s!AV86*s!AX86/(s!AV86*s!AX86+s!AT86*s!AZ86))+IF(s!AX86*s!BA86+s!AY86*s!AZ86=0,0,W87*s!AX86*s!BA86/(s!AX86*s!BA86+s!AY86*s!AZ86))+IF(s!AT86*s!BA86+s!AU86*s!AZ86+s!AV86*s!AY86+s!AW86*s!AX86=0,0,N87*s!AW86*s!AX86/(s!AT86*s!BA86+s!AU86*s!AZ86+s!AV86*s!AY86+s!AW86*s!AX86)) -> 13.990720119006156 | AY87: =AH87+IF(s!AT86*s!AY86+s!AU86*s!AX86=0,0,K87*s!AT86*s!AY86/(s!AT86*s!AY86+s!AU86*s!AX86))+IF(s!AU86*s!BA86+s!AW86*s!AY86=0,0,O87*s!AW86*s!AY86/(s!AU86*s!BA86+s!AW86*s!AY86))+IF(s!AX86*s!BA86+s!AY86*s!AZ86=0,0,W87*s!AY86*s!AZ86/(s!AX86*s!BA86+s!AY86*s!AZ86))+IF(s!AT86*s!BA86+s!AU86*s!AZ86+s!AV86*s!AY86+s!AW86*s!AX86=0,0,N87*s!AV86*s!AY86/(s!AT86*s!BA86+s!AU86*s!AZ86+s!AV86*s!AY86+s!AW86*s!AX86)) -> 10.577262394264839 | AZ87: =AI87+IF(s!AT86*s!AZ86+s!AV86*s!AX86=0,0,M87*s!AT86*s!AZ86/(s!AT86*s!AZ86+s!AV86*s!AX86))+IF(s!AV86*s!BA86+s!AW86*s!AZ86=0,0,Q87*s!AW86*s!AZ86/(s!AV86*s!BA86+s!AW86*s!AZ86))+IF(s!AX86*s!BA86+s!AY86*s!AZ86=0,0,W87*s!AY86*s!AZ86/(s!AX86*s!BA86+s!AY86*s!AZ86))+IF(s!AT86*s!BA86+s!AU86*s!AZ86+s!AV86*s!AY86+s!AW86*s!AX86=0,0,N87*s!AU86*s!AZ86/(s!AT86*s!BA86+s!AU86*s!AZ86+s!AV86*s!AY86+s!AW86*s!AX86)) -> 17.389435918024294 | BA87: =AJ87+IF(s!AU86*s!BA86+s!AW86*s!AY86=0,0,O87*s!AU86*s!BA86/(s!AU86*s!BA86+s!AW86*s!AY86))+IF(s!AV86*s!BA86+s!AW86*s!AZ86=0,0,Q87*s!AV86*s!BA86/(s!AV86*s!BA86+s!AW86*s!AZ86))+IF(s!AX86*s!BA86+s!AY86*s!AZ86=0,0,W87*s!AX86*s!BA86/(s!AX86*s!BA86+s!AY86*s!AZ86))+IF(s!AT86*s!BA86+s!AU86*s!AZ86+s!AV86*s!AY86+s!AW86*s!AX86=0,0,N87*s!AT86*s!BA86/(s!AT86*s!BA86+s!AU86*s!AZ86+s!AV86*s!AY86+s!AW86*s!AX86)) -> 22.042581568704712 | BJ87: =SUM(AT87:BA87) -> 778
A88: =A87 -> 100 | B88: =B87 -> 30 | C88: =C87 -> 200 | D88: =D87 -> 2 | E88: =E87 -> 4 | F88: =F87 -> 1 | G88: =G87 -> 1 | H88: =H87 -> 2 | I88: =I87 -> 1 | J88: =J87 -> 2 | K88: =K87 -> 4 | L88: =L87 -> 2 | M88: =M87 -> 4 | N88: =N87 -> 8 | O88: =O87 -> 4 | P88: =P87 -> 2 | Q88: =Q87 -> 4 | R88: =R87 -> 2 | S88: =S87 -> 1 | T88: =T87 -> 2 | U88: =U87 -> 1 | V88: =V87 -> 2 | W88: =W87 -> 4 | X88: =X87 -> 2 | Y88: =Y87 -> 1 | Z88: =Z87 -> 2 | AA88: =AA87 -> 1 | AB88: =AB87 -> 389 | AC88: =AC87 -> 234 | AD88: =AD87 -> 433 | AE88: =AE87 -> 8 | AF88: =AF87 -> 7 | AG88: =AG87 -> 8 | AH88: =AH87 -> 8 | AI88: =AI87 -> 8 | AJ88: =AJ87 -> 8 | AS88: =AS87 -> 714 | AT88: =AC88+IF(s!AT87*s!AW87+s!AU87*s!AV87=0,0,E88*s!AT87*s!AW87/(s!AT87*s!AW87+s!AU87*s!AV87))+IF(s!AT87*s!AY87+s!AU87*s!AX87=0,0,K88*s!AT87*s!AY87/(s!AT87*s!AY87+s!AU87*s!AX87))+IF(s!AT87*s!AZ87+s!AV87*s!AX87=0,0,M88*s!AT87*s!AZ87/(s!AT87*s!AZ87+s!AV87*s!AX87))+IF(s!AT87*s!BA87+s!AU87*s!AZ87+s!AV87*s!AY87+s!AW87*s!AX87=0,0,N88*s!AT87*s!BA87/(s!AT87*s!BA87+s!AU87*s!AZ87+s!AV87*s!AY87+s!AW87*s!AX87)) -> 244.65839693634439 | AU88: =AD88+IF(s!AU87*s!AV87+s!AT87*s!AW87=0,0,E88*s!AU87*s!AV87/(s!AU87*s!AV87+s!AT87*s!AW87))+IF(s!AT87*s!AY87+s!AU87*s!AX87=0,0,K88*s!AU87*s!AX87/(s!AT87*s!AY87+s!AU87*s!AX87))+IF(s!AU87*s!BA87+s!AW87*s!AY87=0,0,O88*s!AU87*s!BA87/(s!AU87*s!BA87+s!AW87*s!AY87))+IF(s!AT87*s!BA87+s!AU87*s!AZ87+s!AV87*s!AY87+s!AW87*s!AX87=0,0,N88*s!AU87*s!AZ87/(s!AT87*s!BA87+s!AU87*s!AZ87+s!AV87*s!AY87+s!AW87*s!AX87)) -> 445.77362055038458 | AV88: =AE88+IF(s!AU87*s!AV87+s!AT87*s!AW87=0,0,E88*s!AU87*s!AV87/(s!AU87*s!AV87+s!AT87*s!AW87))+IF(s!AV87*s!AX87+s!AT87*s!AZ87=0,0,M88*s!AV87*s!AX87/(s!AV87*s!AX87+s!AT87*s!AZ87))+IF(s!AV87*s!BA87+s!AW87*s!AZ87=0,0,Q88*s!AV87*s!BA87/(s!AV87*s!BA87+s!AW87*s!AZ87))+IF(s!AT87*s!BA87+s!AU87*s!AZ87+s!AV87*s!AY87+s!AW87*s!AX87=0,0,N88*s!AV87*s!AY87/(s!AT87*s!BA87+s!AU87*s!AZ87+s!AV87*s!AY87+s!AW87*s!AX87)) -> 13.961447026625386 | AW88: =AF88+IF(s!AT87*s!AW87+s!AU87*s!AV87=0,0,E88*s!AT87*s!AW87/(s!AT87*s!AW87+s!AU87*s!AV87))+IF(s!AU87*s!BA87+s!AW87*s!AY87=0,0,O88*s!AW87*s!AY87/(s!AU87*s!BA87+s!AW87*s!AY87))+IF(s!AV87*s!BA87+s!AW87*s!AZ87=0,0,Q88*s!AW87*s!AZ87/(s!AV87*s!BA87+s!AW87*s!AZ87))+IF(s!AT87*s!BA87+s!AU87*s!AZ87+s!AV87*s!AY87+s!AW87*s!AX87=0,0,N88*s!AW87*s!AX87/(s!AT87*s!BA87+s!AU87*s!AZ87+s!AV87*s!AY87+s!AW87*s!AX87)) -> 9.6065354866456243 | AX88: =AG88+IF(s!AT87*s!AY87+s!AU87*s!AX87=0,0,K88*s!AU87*s!AX87/(s!AT87*s!AY87+s!AU87*s!AX87))+IF(s!AV87*s!AX87+s!AT87*s!AZ87=0,0,M88*s!AV87*s!AX87/(s!AV87*s!AX87+s!AT87*s!AZ87))+IF(s!AX87*s!BA87+s!AY87*s!AZ87=0,0,W88*s!AX87*s!BA87/(s!AX87*s!BA87+s!AY87*s!AZ87))+IF(s!AT87*s!BA87+s!AU87*s!AZ87+s!AV87*s!AY87+s!AW87*s!AX87=0,0,N88*s!AW87*s!AX87/(s!AT87*s!BA87+s!AU87*s!AZ87+s!AV87*s!AY87+s!AW87*s!AX87)) -> 13.990720119006344 | AY88: =AH88+IF(s!AT87*s!AY87+s!AU87*s!AX87=0,0,K88*s!AT87*s!AY87/(s!AT87*s!AY87+s!AU87*s!AX87))+IF(s!AU87*s!BA87+s!AW87*s!AY87=0,0,O88*s!AW87*s!AY87/(s!AU87*s!BA87+s!AW87*s!AY87))+IF(s!AX87*s!BA87+s!AY87*s!AZ87=0,0,W88*s!AY87*s!AZ87/(s!AX87*s!BA87+s!AY87*s!AZ87))+IF(s!AT87*s!BA87+s!AU87*s!AZ87+s!AV87*s!AY87+s!AW87*s!AX87=0,0,N88*s!AV87*s!AY87/(s!AT87*s!BA87+s!AU87*s!AZ87+s!AV87*s!AY87+s!AW87*s!AX87)) -> 10.577262394264666 | AZ88: =AI88+IF(s!AT87*s!AZ87+s!AV87*s!AX87=0,0,M88*s!AT87*s!AZ87/(s!AT87*s!AZ87+s!AV87*s!AX87))+IF(s!AV87*s!BA87+s!AW87*s!AZ87=0,0,Q88*s!AW87*s!AZ87/(s!AV87*s!BA87+s!AW87*s!AZ87))+IF(s!AX87*s!BA87+s!AY87*s!AZ87=0,0,W88*s!AY87*s!AZ87/(s!AX87*s!BA87+s!AY87*s!AZ87))+IF(s!AT87*s!BA87+s!AU87*s!AZ87+s!AV87*s!AY87+s!AW87*s!AX87=0,0,N88*s!AU87*s!AZ87/(s!AT87*s!BA87+s!AU87*s!AZ87+s!AV87*s!AY87+s!AW87*s!AX87)) -> 17.389435918023874 | BA88: =AJ88+IF(s!AU87*s!BA87+s!AW87*s!AY87=0,0,O88*s!AU87*s!BA87/(s!AU87*s!BA87+s!AW87*s!AY87))+IF(s!AV87*s!BA87+s!AW87*s!AZ87=0,0,Q88*s!AV87*s!BA87/(s!AV87*s!BA87+s!AW87*s!AZ87))+IF(s!AX87*s!BA87+s!AY87*s!AZ87=0,0,W88*s!AX87*s!BA87/(s!AX87*s!BA87+s!AY87*s!AZ87))+IF(s!AT87*s!BA87+s!AU87*s!AZ87+s!AV87*s!AY87+s!AW87*s!AX87=0,0,N88*s!AT87*s!BA87/(s!AT87*s!BA87+s!AU87*s!AZ87+s!AV87*s!AY87+s!AW87*s!AX87)) -> 22.042581568705113 | BJ88: =SUM(AT88:BA88) -> 778
A89: =A88 -> 100 | B89: =B88 -> 30 | C89: =C88 -> 200 | D89: =D88 -> 2 | E89: =E88 -> 4 | F89: =F88 -> 1 | G89: =G88 -> 1 | H89: =H88 -> 2 | I89: =I88 -> 1 | J89: =J88 -> 2 | K89: =K88 -> 4 | L89: =L88 -> 2 | M89: =M88 -> 4 | N89: =N88 -> 8 | O89: =O88 -> 4 | P89: =P88 -> 2 | Q89: =Q88 -> 4 | R89: =R88 -> 2 | S89: =S88 -> 1 | T89: =T88 -> 2 | U89: =U88 -> 1 | V89: =V88 -> 2 | W89: =W88 -> 4 | X89: =X88 -> 2 | Y89: =Y88 -> 1 | Z89: =Z88 -> 2 | AA89: =AA88 -> 1 | AB89: =AB88 -> 389 | AC89: =AC88 -> 234 | AD89: =AD88 -> 433 | AE89: =AE88 -> 8 | AF89: =AF88 -> 7 | AG89: =AG88 -> 8 | AH89: =AH88 -> 8 | AI89: =AI88 -> 8 | AJ89: =AJ88 -> 8 | AS89: =AS88 -> 714 | AT89: =AC89+IF(s!AT88*s!AW88+s!AU88*s!AV88=0,0,E89*s!AT88*s!AW88/(s!AT88*s!AW88+s!AU88*s!AV88))+IF(s!AT88*s!AY88+s!AU88*s!AX88=0,0,K89*s!AT88*s!AY88/(s!AT88*s!AY88+s!AU88*s!AX88))+IF(s!AT88*s!AZ88+s!AV88*s!AX88=0,0,M89*s!AT88*s!AZ88/(s!AT88*s!AZ88+s!AV88*s!AX88))+IF(s!AT88*s!BA88+s!AU88*s!AZ88+s!AV88*s!AY88+s!AW88*s!AX88=0,0,N89*s!AT88*s!BA88/(s!AT88*s!BA88+s!AU88*s!AZ88+s!AV88*s!AY88+s!AW88*s!AX88)) -> 244.65839693634439 | AU89: =AD89+IF(s!AU88*s!AV88+s!AT88*s!AW88=0,0,E89*s!AU88*s!AV88/(s!AU88*s!AV88+s!AT88*s!AW88))+IF(s!AT88*s!AY88+s!AU88*s!AX88=0,0,K89*s!AU88*s!AX88/(s!AT88*s!AY88+s!AU88*s!AX88))+IF(s!AU88*s!BA88+s!AW88*s!AY88=0,0,O89*s!AU88*s!BA88/(s!AU88*s!BA88+s!AW88*s!AY88))+IF(s!AT88*s!BA88+s!AU88*s!AZ88+s!AV88*s!AY88+s!AW88*s!AX88=0,0,N89*s!AU88*s!AZ88/(s!AT88*s!BA88+s!AU88*s!AZ88+s!AV88*s!AY88+s!AW88*s!AX88)) -> 445.77362055038452 | AV89: =AE89+IF(s!AU88*s!AV88+s!AT88*s!AW88=0,0,E89*s!AU88*s!AV88/(s!AU88*s!AV88+s!AT88*s!AW88))+IF(s!AV88*s!AX88+s!AT88*s!AZ88=0,0,M89*s!AV88*s!AX88/(s!AV88*s!AX88+s!AT88*s!AZ88))+IF(s!AV88*s!BA88+s!AW88*s!AZ88=0,0,Q89*s!AV88*s!BA88/(s!AV88*s!BA88+s!AW88*s!AZ88))+IF(s!AT88*s!BA88+s!AU88*s!AZ88+s!AV88*s!AY88+s!AW88*s!AX88=0,0,N89*s!AV88*s!AY88/(s!AT88*s!BA88+s!AU88*s!AZ88+s!AV88*s!AY88+s!AW88*s!AX88)) -> 13.961447026625532 | AW89: =AF89+IF(s!AT88*s!AW88+s!AU88*s!AV88=0,0,E89*s!AT88*s!AW88/(s!AT88*s!AW88+s!AU88*s!AV88))+IF(s!AU88*s!BA88+s!AW88*s!AY88=0,0,O89*s!AW88*s!AY88/(s!AU88*s!BA88+s!AW88*s!AY88))+IF(s!AV88*s!BA88+s!AW88*s!AZ88=0,0,Q89*s!AW88*s!AZ88/(s!AV88*s!BA88+s!AW88*s!AZ88))+IF(s!AT88*s!BA88+s!AU88*s!AZ88+s!AV88*s!AY88+s!AW88*s!AX88=0,0,N89*s!AW88*s!AX88/(s!AT88*s!BA88+s!AU88*s!AZ88+s!AV88*s!AY88+s!AW88*s!AX88)) -> 9.6065354866454875 | AX89: =AG89+IF(s!AT88*s!AY88+s!AU88*s!AX88=0,0,K89*s!AU88*s!AX88/(s!AT88*s!AY88+s!AU88*s!AX88))+IF(s!AV88*s!AX88+s!AT88*s!AZ88=0,0,M89*s!AV88*s!AX88/(s!AV88*s!AX88+s!AT88*s!AZ88))+IF(s!AX88*s!BA88+s!AY88*s!AZ88=0,0,W89*s!AX88*s!BA88/(s!AX88*s!BA88+s!AY88*s!AZ88))+IF(s!AT88*s!BA88+s!AU88*s!AZ88+s!AV88*s!AY88+s!AW88*s!AX88=0,0,N89*s!AW88*s!AX88/(s!AT88*s!BA88+s!AU88*s!AZ88+s!AV88*s!AY88+s!AW88*s!AX88)) -> 13.990720119006479 | AY89: =AH89+IF(s!AT88*s!AY88+s!AU88*s!AX88=0,0,K89*s!AT88*s!AY88/(s!AT88*s!AY88+s!AU88*s!AX88))+IF(s!AU88*s!BA88+s!AW88*s!AY88=0,0,O89*s!AW88*s!AY88/(s!AU88*s!BA88+s!AW88*s!AY88))+IF(s!AX88*s!BA88+s!AY88*s!AZ88=0,0,W89*s!AY88*s!AZ88/(s!AX88*s!BA88+s!AY88*s!AZ88))+IF(s!AT88*s!BA88+s!AU88*s!AZ88+s!AV88*s!AY88+s!AW88*s!AX88=0,0,N89*s!AV88*s!AY88/(s!AT88*s!BA88+s!AU88*s!AZ88+s!AV88*s!AY88+s!AW88*s!AX88)) -> 10.57726239426454 | AZ89: =AI89+IF(s!AT88*s!AZ88+s!AV88*s!AX88=0,0,M89*s!AT88*s!AZ88/(s!AT88*s!AZ88+s!AV88*s!AX88))+IF(s!AV88*s!BA88+s!AW88*s!AZ88=0,0,Q89*s!AW88*s!AZ88/(s!AV88*s!BA88+s!AW88*s!AZ88))+IF(s!AX88*s!BA88+s!AY88*s!AZ88=0,0,W89*s!AY88*s!AZ88/(s!AX88*s!BA88+s!AY88*s!AZ88))+IF(s!AT88*s!BA88+s!AU88*s!AZ88+s!AV88*s!AY88+s!AW88*s!AX88=0,0,N89*s!AU88*s!AZ88/(s!AT88*s!BA88+s!AU88*s!AZ88+s!AV88*s!AY88+s!AW88*s!AX88)) -> 17.389435918023576 | BA89: =AJ89+IF(s!AU88*s!BA88+s!AW88*s!AY88=0,0,O89*s!AU88*s!BA88/(s!AU88*s!BA88+s!AW88*s!AY88))+IF(s!AV88*s!BA88+s!AW88*s!AZ88=0,0,Q89*s!AV88*s!BA88/(s!AV88*s!BA88+s!AW88*s!AZ88))+IF(s!AX88*s!BA88+s!AY88*s!AZ88=0,0,W89*s!AX88*s!BA88/(s!AX88*s!BA88+s!AY88*s!AZ88))+IF(s!AT88*s!BA88+s!AU88*s!AZ88+s!AV88*s!AY88+s!AW88*s!AX88=0,0,N89*s!AT88*s!BA88/(s!AT88*s!BA88+s!AU88*s!AZ88+s!AV88*s!AY88+s!AW88*s!AX88)) -> 22.042581568705401 | BJ89: =SUM(AT89:BA89) -> 778
A90: =A89 -> 100 | B90: =B89 -> 30 | C90: =C89 -> 200 | D90: =D89 -> 2 | E90: =E89 -> 4 | F90: =F89 -> 1 | G90: =G89 -> 1 | H90: =H89 -> 2 | I90: =I89 -> 1 | J90: =J89 -> 2 | K90: =K89 -> 4 | L90: =L89 -> 2 | M90: =M89 -> 4 | N90: =N89 -> 8 | O90: =O89 -> 4 | P90: =P89 -> 2 | Q90: =Q89 -> 4 | R90: =R89 -> 2 | S90: =S89 -> 1 | T90: =T89 -> 2 | U90: =U89 -> 1 | V90: =V89 -> 2 | W90: =W89 -> 4 | X90: =X89 -> 2 | Y90: =Y89 -> 1 | Z90: =Z89 -> 2 | AA90: =AA89 -> 1 | AB90: =AB89 -> 389 | AC90: =AC89 -> 234 | AD90: =AD89 -> 433 | AE90: =AE89 -> 8 | AF90: =AF89 -> 7 | AG90: =AG89 -> 8 | AH90: =AH89 -> 8 | AI90: =AI89 -> 8 | AJ90: =AJ89 -> 8 | AS90: =AS89 -> 714 | AT90: =AC90+IF(s!AT89*s!AW89+s!AU89*s!AV89=0,0,E90*s!AT89*s!AW89/(s!AT89*s!AW89+s!AU89*s!AV89))+IF(s!AT89*s!AY89+s!AU89*s!AX89=0,0,K90*s!AT89*s!AY89/(s!AT89*s!AY89+s!AU89*s!AX89))+IF(s!AT89*s!AZ89+s!AV89*s!AX89=0,0,M90*s!AT89*s!AZ89/(s!AT89*s!AZ89+s!AV89*s!AX89))+IF(s!AT89*s!BA89+s!AU89*s!AZ89+s!AV89*s!AY89+s!AW89*s!AX89=0,0,N90*s!AT89*s!BA89/(s!AT89*s!BA89+s!AU89*s!AZ89+s!AV89*s!AY89+s!AW89*s!AX89)) -> 244.65839693634442 | AU90: =AD90+IF(s!AU89*s!AV89+s!AT89*s!AW89=0,0,E90*s!AU89*s!AV89/(s!AU89*s!AV89+s!AT89*s!AW89))+IF(s!AT89*s!AY89+s!AU89*s!AX89=0,0,K90*s!AU89*s!AX89/(s!AT89*s!AY89+s!AU89*s!AX89))+IF(s!AU89*s!BA89+s!AW89*s!AY89=0,0,O90*s!AU89*s!BA89/(s!AU89*s!BA89+s!AW89*s!AY89))+IF(s!AT89*s!BA89+s!AU89*s!AZ89+s!AV89*s!AY89+s!AW89*s!AX89=0,0,N90*s!AU89*s!AZ89/(s!AT89*s!BA89+s!AU89*s!AZ89+s!AV89*s!AY89+s!AW89*s!AX89)) -> 445.77362055038452 | AV90: =AE90+IF(s!AU89*s!AV89+s!AT89*s!AW89=0,0,E90*s!AU89*s!AV89/(s!AU89*s!AV89+s!AT89*s!AW89))+IF(s!AV89*s!AX89+s!AT89*s!AZ89=0,0,M90*s!AV89*s!AX89/(s!AV89*s!AX89+s!AT89*s!AZ89))+IF(s!AV89*s!BA89+s!AW89*s!AZ89=0,0,Q90*s!AV89*s!BA89/(s!AV89*s!BA89+s!AW89*s!AZ89))+IF(s!AT89*s!BA89+s!AU89*s!AZ89+s!AV89*s!AY89+s!AW89*s!AX89=0,0,N90*s!AV89*s!AY89/(s!AT89*s!BA89+s!AU89*s!AZ89+s!AV89*s!AY89+s!AW89*s!AX89)) -> 13.96144702662564 | AW90: =AF90+IF(s!AT89*s!AW89+s!AU89*s!AV89=0,0,E90*s!AT89*s!AW89/(s!AT89*s!AW89+s!AU89*s!AV89))+IF(s!AU89*s!BA89+s!AW89*s!AY89=0,0,O90*s!AW89*s!AY89/(s!AU89*s!BA89+s!AW89*s!AY89))+IF(s!AV89*s!BA89+s!AW89*s!AZ89=0,0,Q90*s!AW89*s!AZ89/(s!AV89*s!BA89+s!AW89*s!AZ89))+IF(s!AT89*s!BA89+s!AU89*s!AZ89+s!AV89*s!AY89+s!AW89*s!AX89=0,0,N90*s!AW89*s!AX89/(s!AT89*s!BA89+s!AU89*s!AZ89+s!AV89*s!AY89+s!AW89*s!AX89)) -> 9.6065354866453863 | AX90: =AG90+IF(s!AT89*s!AY89+s!AU89*s!AX89=0,0,K90*s!AU89*s!AX89/(s!AT89*s!AY89+s!AU89*s!AX89))+IF(s!AV89*s!AX89+s!AT89*s!AZ89=0,0,M90*s!AV89*s!AX89/(s!AV89*s!AX89+s!AT89*s!AZ89))+IF(s!AX89*s!BA89+s!AY89*s!AZ89=0,0,W90*s!AX89*s!BA89/(s!AX89*s!BA89+s!AY89*s!AZ89))+IF(s!AT89*s!BA89+s!AU89*s!AZ89+s!AV89*s!AY89+s!AW89*s!AX89=0,0,N90*s!AW89*s!AX89/(s!AT89*s!BA89+s!AU89*s!AZ89+s!AV89*s!AY89+s!AW89*s!AX89)) -> 13.990720119006575 | AY90: =AH90+IF(s!AT89*s!AY89+s!AU89*s!AX89=0,0,K90*s!AT89*s!AY89/(s!AT89*s!AY89+s!AU89*s!AX89))+IF(s!AU89*s!BA89+s!AW89*s!AY89=0,0,O90*s!AW89*s!AY89/(s!AU89*s!BA89+s!AW89*s!AY89))+IF(s!AX89*s!BA89+s!AY89*s!AZ89=0,0,W90*s!AY89*s!AZ89/(s!AX89*s!BA89+s!AY89*s!AZ89))+IF(s!AT89*s!BA89+s!AU89*s!AZ89+s!AV89*s!AY89+s!AW89*s!AX89=0,0,N90*s!AV89*s!AY89/(s!AT89*s!BA89+s!AU89*s!AZ89+s!AV89*s!AY89+s!AW89*s!AX89)) -> 10.57726239426445 | AZ90: =AI90+IF(s!AT89*s!AZ89+s!AV89*s!AX89=0,0,M90*s!AT89*s!AZ89/(s!AT89*s!AZ89+s!AV89*s!AX89))+IF(s!AV89*s!BA89+s!AW89*s!AZ89=0,0,Q90*s!AW89*s!AZ89/(s!AV89*s!BA89+s!AW89*s!AZ89))+IF(s!AX89*s!BA89+s!AY89*s!AZ89=0,0,W90*s!AY89*s!AZ89/(s!AX89*s!BA89+s!AY89*s!AZ89))+IF(s!AT89*s!BA89+s!AU89*s!AZ89+s!AV89*s!AY89+s!AW89*s!AX89=0,0,N90*s!AU89*s!AZ89/(s!AT89*s!BA89+s!AU89*s!AZ89+s!AV89*s!AY89+s!AW89*s!AX89)) -> 17.389435918023359 | BA90: =AJ90+IF(s!AU89*s!BA89+s!AW89*s!AY89=0,0,O90*s!AU89*s!BA89/(s!AU89*s!BA89+s!AW89*s!AY89))+IF(s!AV89*s!BA89+s!AW89*s!AZ89=0,0,Q90*s!AV89*s!BA89/(s!AV89*s!BA89+s!AW89*s!AZ89))+IF(s!AX89*s!BA89+s!AY89*s!AZ89=0,0,W90*s!AX89*s!BA89/(s!AX89*s!BA89+s!AY89*s!AZ89))+IF(s!AT89*s!BA89+s!AU89*s!AZ89+s!AV89*s!AY89+s!AW89*s!AX89=0,0,N90*s!AT89*s!BA89/(s!AT89*s!BA89+s!AU89*s!AZ89+s!AV89*s!AY89+s!AW89*s!AX89)) -> 22.042581568705611 | BJ90: =SUM(AT90:BA90) -> 778
A91: =A90 -> 100 | B91: =B90 -> 30 | C91: =C90 -> 200 | D91: =D90 -> 2 | E91: =E90 -> 4 | F91: =F90 -> 1 | G91: =G90 -> 1 | H91: =H90 -> 2 | I91: =I90 -> 1 | J91: =J90 -> 2 | K91: =K90 -> 4 | L91: =L90 -> 2 | M91: =M90 -> 4 | N91: =N90 -> 8 | O91: =O90 -> 4 | P91: =P90 -> 2 | Q91: =Q90 -> 4 | R91: =R90 -> 2 | S91: =S90 -> 1 | T91: =T90 -> 2 | U91: =U90 -> 1 | V91: =V90 -> 2 | W91: =W90 -> 4 | X91: =X90 -> 2 | Y91: =Y90 -> 1 | Z91: =Z90 -> 2 | AA91: =AA90 -> 1 | AB91: =AB90 -> 389 | AC91: =AC90 -> 234 | AD91: =AD90 -> 433 | AE91: =AE90 -> 8 | AF91: =AF90 -> 7 | AG91: =AG90 -> 8 | AH91: =AH90 -> 8 | AI91: =AI90 -> 8 | AJ91: =AJ90 -> 8 | AS91: =AS90 -> 714 | AT91: =AC91+IF(s!AT90*s!AW90+s!AU90*s!AV90=0,0,E91*s!AT90*s!AW90/(s!AT90*s!AW90+s!AU90*s!AV90))+IF(s!AT90*s!AY90+s!AU90*s!AX90=0,0,K91*s!AT90*s!AY90/(s!AT90*s!AY90+s!AU90*s!AX90))+IF(s!AT90*s!AZ90+s!AV90*s!AX90=0,0,M91*s!AT90*s!AZ90/(s!AT90*s!AZ90+s!AV90*s!AX90))+IF(s!AT90*s!BA90+s!AU90*s!AZ90+s!AV90*s!AY90+s!AW90*s!AX90=0,0,N91*s!AT90*s!BA90/(s!AT90*s!BA90+s!AU90*s!AZ90+s!AV90*s!AY90+s!AW90*s!AX90)) -> 244.65839693634442 | AU91: =AD91+IF(s!AU90*s!AV90+s!AT90*s!AW90=0,0,E91*s!AU90*s!AV90/(s!AU90*s!AV90+s!AT90*s!AW90))+IF(s!AT90*s!AY90+s!AU90*s!AX90=0,0,K91*s!AU90*s!AX90/(s!AT90*s!AY90+s!AU90*s!AX90))+IF(s!AU90*s!BA90+s!AW90*s!AY90=0,0,O91*s!AU90*s!BA90/(s!AU90*s!BA90+s!AW90*s!AY90))+IF(s!AT90*s!BA90+s!AU90*s!AZ90+s!AV90*s!AY90+s!AW90*s!AX90=0,0,N91*s!AU90*s!AZ90/(s!AT90*s!BA90+s!AU90*s!AZ90+s!AV90*s!AY90+s!AW90*s!AX90)) -> 445.77362055038452 | AV91: =AE91+IF(s!AU90*s!AV90+s!AT90*s!AW90=0,0,E91*s!AU90*s!AV90/(s!AU90*s!AV90+s!AT90*s!AW90))+IF(s!AV90*s!AX90+s!AT90*s!AZ90=0,0,M91*s!AV90*s!AX90/(s!AV90*s!AX90+s!AT90*s!AZ90))+IF(s!AV90*s!BA90+s!AW90*s!AZ90=0,0,Q91*s!AV90*s!BA90/(s!AV90*s!BA90+s!AW90*s!AZ90))+IF(s!AT90*s!BA90+s!AU90*s!AZ90+s!AV90*s!AY90+s!AW90*s!AX90=0,0,N91*s!AV90*s!AY90/(s!AT90*s!BA90+s!AU90*s!AZ90+s!AV90*s!AY90+s!AW90*s!AX90)) -> 13.961447026625716 | AW91: =AF91+IF(s!AT90*s!AW90+s!AU90*s!AV90=0,0,E91*s!AT90*s!AW90/(s!AT90*s!AW90+s!AU90*s!AV90))+IF(s!AU90*s!BA90+s!AW90*s!AY90=0,0,O91*s!AW90*s!AY90/(s!AU90*s!BA90+s!AW90*s!AY90))+IF(s!AV90*s!BA90+s!AW90*s!AZ90=0,0,Q91*s!AW90*s!AZ90/(s!AV90*s!BA90+s!AW90*s!AZ90))+IF(s!AT90*s!BA90+s!AU90*s!AZ90+s!AV90*s!AY90+s!AW90*s!AX90=0,0,N91*s!AW90*s!AX90/(s!AT90*s!BA90+s!AU90*s!AZ90+s!AV90*s!AY90+s!AW90*s!AX90)) -> 9.606535486645317 | AX91: =AG91+IF(s!AT90*s!AY90+s!AU90*s!AX90=0,0,K91*s!AU90*s!AX90/(s!AT90*s!AY90+s!AU90*s!AX90))+IF(s!AV90*s!AX90+s!AT90*s!AZ90=0,0,M91*s!AV90*s!AX90/(s!AV90*s!AX90+s!AT90*s!AZ90))+IF(s!AX90*s!BA90+s!AY90*s!AZ90=0,0,W91*s!AX90*s!BA90/(s!AX90*s!BA90+s!AY90*s!AZ90))+IF(s!AT90*s!BA90+s!AU90*s!AZ90+s!AV90*s!AY90+s!AW90*s!AX90=0,0,N91*s!AW90*s!AX90/(s!AT90*s!BA90+s!AU90*s!AZ90+s!AV90*s!AY90+s!AW90*s!AX90)) -> 13.990720119006644 | AY91: =AH91+IF(s!AT90*s!AY90+s!AU90*s!AX90=0,0,K91*s!AT90*s!AY90/(s!AT90*s!AY90+s!AU90*s!AX90))+IF(s!AU90*s!BA90+s!AW90*s!AY90=0,0,O91*s!AW90*s!AY90/(s!AU90*s!BA90+s!AW90*s!AY90))+IF(s!AX90*s!BA90+s!AY90*s!AZ90=0,0,W91*s!AY90*s!AZ90/(s!AX90*s!BA90+s!AY90*s!AZ90))+IF(s!AT90*s!BA90+s!AU90*s!AZ90+s!AV90*s!AY90+s!AW90*s!AX90=0,0,N91*s!AV90*s!AY90/(s!AT90*s!BA90+s!AU90*s!AZ90+s!AV90*s!AY90+s!AW90*s!AX90)) -> 10.577262394264389 | AZ91: =AI91+IF(s!AT90*s!AZ90+s!AV90*s!AX90=0,0,M91*s!AT90*s!AZ90/(s!AT90*s!AZ90+s!AV90*s!AX90))+IF(s!AV90*s!BA90+s!AW90*s!AZ90=0,0,Q91*s!AW90*s!AZ90/(s!AV90*s!BA90+s!AW90*s!AZ90))+IF(s!AX90*s!BA90+s!AY90*s!AZ90=0,0,W91*s!AY90*s!AZ90/(s!AX90*s!BA90+s!AY90*s!AZ90))+IF(s!AT90*s!BA90+s!AU90*s!AZ90+s!AV90*s!AY90+s!AW90*s!AX90=0,0,N91*s!AU90*s!AZ90/(s!AT90*s!BA90+s!AU90*s!AZ90+s!AV90*s!AY90+s!AW90*s!AX90)) -> 17.38943591802321 | BA91: =AJ91+IF(s!AU90*s!BA90+s!AW90*s!AY90=0,0,O91*s!AU90*s!BA90/(s!AU90*s!BA90+s!AW90*s!AY90))+IF(s!AV90*s!BA90+s!AW90*s!AZ90=0,0,Q91*s!AV90*s!BA90/(s!AV90*s!BA90+s!AW90*s!AZ90))+IF(s!AX90*s!BA90+s!AY90*s!AZ90=0,0,W91*s!AX90*s!BA90/(s!AX90*s!BA90+s!AY90*s!AZ90))+IF(s!AT90*s!BA90+s!AU90*s!AZ90+s!AV90*s!AY90+s!AW90*s!AX90=0,0,N91*s!AT90*s!BA90/(s!AT90*s!BA90+s!AU90*s!AZ90+s!AV90*s!AY90+s!AW90*s!AX90)) -> 22.042581568705756 | BJ91: =SUM(AT91:BA91) -> 778
A92: =A91 -> 100 | B92: =B91 -> 30 | C92: =C91 -> 200 | D92: =D91 -> 2 | E92: =E91 -> 4 | F92: =F91 -> 1 | G92: =G91 -> 1 | H92: =H91 -> 2 | I92: =I91 -> 1 | J92: =J91 -> 2 | K92: =K91 -> 4 | L92: =L91 -> 2 | M92: =M91 -> 4 | N92: =N91 -> 8 | O92: =O91 -> 4 | P92: =P91 -> 2 | Q92: =Q91 -> 4 | R92: =R91 -> 2 | S92: =S91 -> 1 | T92: =T91 -> 2 | U92: =U91 -> 1 | V92: =V91 -> 2 | W92: =W91 -> 4 | X92: =X91 -> 2 | Y92: =Y91 -> 1 | Z92: =Z91 -> 2 | AA92: =AA91 -> 1 | AB92: =AB91 -> 389 | AC92: =AC91 -> 234 | AD92: =AD91 -> 433 | AE92: =AE91 -> 8 | AF92: =AF91 -> 7 | AG92: =AG91 -> 8 | AH92: =AH91 -> 8 | AI92: =AI91 -> 8 | AJ92: =AJ91 -> 8 | AS92: =AS91 -> 714 | AT92: =AC92+IF(s!AT91*s!AW91+s!AU91*s!AV91=0,0,E92*s!AT91*s!AW91/(s!AT91*s!AW91+s!AU91*s!AV91))+IF(s!AT91*s!AY91+s!AU91*s!AX91=0,0,K92*s!AT91*s!AY91/(s!AT91*s!AY91+s!AU91*s!AX91))+IF(s!AT91*s!AZ91+s!AV91*s!AX91=0,0,M92*s!AT91*s!AZ91/(s!AT91*s!AZ91+s!AV91*s!AX91))+IF(s!AT91*s!BA91+s!AU91*s!AZ91+s!AV91*s!AY91+s!AW91*s!AX91=0,0,N92*s!AT91*s!BA91/(s!AT91*s!BA91+s!AU91*s!AZ91+s!AV91*s!AY91+s!AW91*s!AX91)) -> 244.65839693634445 | AU92: =AD92+IF(s!AU91*s!AV91+s!AT91*s!AW91=0,0,E92*s!AU91*s!AV91/(s!AU91*s!AV91+s!AT91*s!AW91))+IF(s!AT91*s!AY91+s!AU91*s!AX91=0,0,K92*s!AU91*s!AX91/(s!AT91*s!AY91+s!AU91*s!AX91))+IF(s!AU91*s!BA91+s!AW91*s!AY91=0,0,O92*s!AU91*s!BA91/(s!AU91*s!BA91+s!AW91*s!AY91))+IF(s!AT91*s!BA91+s!AU91*s!AZ91+s!AV91*s!AY91+s!AW91*s!AX91=0,0,N92*s!AU91*s!AZ91/(s!AT91*s!BA91+s!AU91*s!AZ91+s!AV91*s!AY91+s!AW91*s!AX91)) -> 445.77362055038452 | AV92: =AE92+IF(s!AU91*s!AV91+s!AT91*s!AW91=0,0,E92*s!AU91*s!AV91/(s!AU91*s!AV91+s!AT91*s!AW91))+IF(s!AV91*s!AX91+s!AT91*s!AZ91=0,0,M92*s!AV91*s!AX91/(s!AV91*s!AX91+s!AT91*s!AZ91))+IF(s!AV91*s!BA91+s!AW91*s!AZ91=0,0,Q92*s!AV91*s!BA91/(s!AV91*s!BA91+s!AW91*s!AZ91))+IF(s!AT91*s!BA91+s!AU91*s!AZ91+s!AV91*s!AY91+s!AW91*s!AX91=0,0,N92*s!AV91*s!AY91/(s!AT91*s!BA91+s!AU91*s!AZ91+s!AV91*s!AY91+s!AW91*s!AX91)) -> 13.961447026625768 | AW92: =AF92+IF(s!AT91*s!AW91+s!AU91*s!AV91=0,0,E92*s!AT91*s!AW91/(s!AT91*s!AW91+s!AU91*s!AV91))+IF(s!AU91*s!BA91+s!AW91*s!AY91=0,0,O92*s!AW91*s!AY91/(s!AU91*s!BA91+s!AW91*s!AY91))+IF(s!AV91*s!BA91+s!AW91*s!AZ91=0,0,Q92*s!AW91*s!AZ91/(s!AV91*s!BA91+s!AW91*s!AZ91))+IF(s!AT91*s!BA91+s!AU91*s!AZ91+s!AV91*s!AY91+s!AW91*s!AX91=0,0,N92*s!AW91*s!AX91/(s!AT91*s!BA91+s!AU91*s!AZ91+s!AV91*s!AY91+s!AW91*s!AX91)) -> 9.6065354866452655 | AX92: =AG92+IF(s!AT91*s!AY91+s!AU91*s!AX91=0,0,K92*s!AU91*s!AX91/(s!AT91*s!AY91+s!AU91*s!AX91))+IF(s!AV91*s!AX91+s!AT91*s!AZ91=0,0,M92*s!AV91*s!AX91/(s!AV91*s!AX91+s!AT91*s!AZ91))+IF(s!AX91*s!BA91+s!AY91*s!AZ91=0,0,W92*s!AX91*s!BA91/(s!AX91*s!BA91+s!AY91*s!AZ91))+IF(s!AT91*s!BA91+s!AU91*s!AZ91+s!AV91*s!AY91+s!AW91*s!AX91=0,0,N92*s!AW91*s!AX91/(s!AT91*s!BA91+s!AU91*s!AZ91+s!AV91*s!AY91+s!AW91*s!AX91)) -> 13.990720119006692 | AY92: =AH92+IF(s!AT91*s!AY91+s!AU91*s!AX91=0,0,K92*s!AT91*s!AY91/(s!AT91*s!AY91+s!AU91*s!AX91))+IF(s!AU91*s!BA91+s!AW91*s!AY91=0,0,O92*s!AW91*s!AY91/(s!AU91*s!BA91+s!AW91*s!AY91))+IF(s!AX91*s!BA91+s!AY91*s!AZ91=0,0,W92*s!AY91*s!AZ91/(s!AX91*s!BA91+s!AY91*s!AZ91))+IF(s!AT91*s!BA91+s!AU91*s!AZ91+s!AV91*s!AY91+s!AW91*s!AX91=0,0,N92*s!AV91*s!AY91/(s!AT91*s!BA91+s!AU91*s!AZ91+s!AV91*s!AY91+s!AW91*s!AX91)) -> 10.577262394264341 | AZ92: =AI92+IF(s!AT91*s!AZ91+s!AV91*s!AX91=0,0,M92*s!AT91*s!AZ91/(s!AT91*s!AZ91+s!AV91*s!AX91))+IF(s!AV91*s!BA91+s!AW91*s!AZ91=0,0,Q92*s!AW91*s!AZ91/(s!AV91*s!BA91+s!AW91*s!AZ91))+IF(s!AX91*s!BA91+s!AY91*s!AZ91=0,0,W92*s!AY91*s!AZ91/(s!AX91*s!BA91+s!AY91*s!AZ91))+IF(s!AT91*s!BA91+s!AU91*s!AZ91+s!AV91*s!AY91+s!AW91*s!AX91=0,0,N92*s!AU91*s!AZ91/(s!AT91*s!BA91+s!AU91*s!AZ91+s!AV91*s!AY91+s!AW91*s!AX91)) -> 17.3894359180231 | BA92: =AJ92+IF(s!AU91*s!BA91+s!AW91*s!AY91=0,0,O92*s!AU91*s!BA91/(s!AU91*s!BA91+s!AW91*s!AY91))+IF(s!AV91*s!BA91+s!AW91*s!AZ91=0,0,Q92*s!AV91*s!BA91/(s!AV91*s!BA91+s!AW91*s!AZ91))+IF(s!AX91*s!BA91+s!AY91*s!AZ91=0,0,W92*s!AX91*s!BA91/(s!AX91*s!BA91+s!AY91*s!AZ91))+IF(s!AT91*s!BA91+s!AU91*s!AZ91+s!AV91*s!AY91+s!AW91*s!AX91=0,0,N92*s!AT91*s!BA91/(s!AT91*s!BA91+s!AU91*s!AZ91+s!AV91*s!AY91+s!AW91*s!AX91)) -> 22.042581568705863 | BJ92: =SUM(AT92:BA92) -> 778
A93: =A92 -> 100 | B93: =B92 -> 30 | C93: =C92 -> 200 | D93: =D92 -> 2 | E93: =E92 -> 4 | F93: =F92 -> 1 | G93: =G92 -> 1 | H93: =H92 -> 2 | I93: =I92 -> 1 | J93: =J92 -> 2 | K93: =K92 -> 4 | L93: =L92 -> 2 | M93: =M92 -> 4 | N93: =N92 -> 8 | O93: =O92 -> 4 | P93: =P92 -> 2 | Q93: =Q92 -> 4 | R93: =R92 -> 2 | S93: =S92 -> 1 | T93: =T92 -> 2 | U93: =U92 -> 1 | V93: =V92 -> 2 | W93: =W92 -> 4 | X93: =X92 -> 2 | Y93: =Y92 -> 1 | Z93: =Z92 -> 2 | AA93: =AA92 -> 1 | AB93: =AB92 -> 389 | AC93: =AC92 -> 234 | AD93: =AD92 -> 433 | AE93: =AE92 -> 8 | AF93: =AF92 -> 7 | AG93: =AG92 -> 8 | AH93: =AH92 -> 8 | AI93: =AI92 -> 8 | AJ93: =AJ92 -> 8 | AS93: =AS92 -> 714 | AT93: =AC93+IF(s!AT92*s!AW92+s!AU92*s!AV92=0,0,E93*s!AT92*s!AW92/(s!AT92*s!AW92+s!AU92*s!AV92))+IF(s!AT92*s!AY92+s!AU92*s!AX92=0,0,K93*s!AT92*s!AY92/(s!AT92*s!AY92+s!AU92*s!AX92))+IF(s!AT92*s!AZ92+s!AV92*s!AX92=0,0,M93*s!AT92*s!AZ92/(s!AT92*s!AZ92+s!AV92*s!AX92))+IF(s!AT92*s!BA92+s!AU92*s!AZ92+s!AV92*s!AY92+s!AW92*s!AX92=0,0,N93*s!AT92*s!BA92/(s!AT92*s!BA92+s!AU92*s!AZ92+s!AV92*s!AY92+s!AW92*s!AX92)) -> 244.65839693634445 | AU93: =AD93+IF(s!AU92*s!AV92+s!AT92*s!AW92=0,0,E93*s!AU92*s!AV92/(s!AU92*s!AV92+s!AT92*s!AW92))+IF(s!AT92*s!AY92+s!AU92*s!AX92=0,0,K93*s!AU92*s!AX92/(s!AT92*s!AY92+s!AU92*s!AX92))+IF(s!AU92*s!BA92+s!AW92*s!AY92=0,0,O93*s!AU92*s!BA92/(s!AU92*s!BA92+s!AW92*s!AY92))+IF(s!AT92*s!BA92+s!AU92*s!AZ92+s!AV92*s!AY92+s!AW92*s!AX92=0,0,N93*s!AU92*s!AZ92/(s!AT92*s!BA92+s!AU92*s!AZ92+s!AV92*s!AY92+s!AW92*s!AX92)) -> 445.77362055038452 | AV93: =AE93+IF(s!AU92*s!AV92+s!AT92*s!AW92=0,0,E93*s!AU92*s!AV92/(s!AU92*s!AV92+s!AT92*s!AW92))+IF(s!AV92*s!AX92+s!AT92*s!AZ92=0,0,M93*s!AV92*s!AX92/(s!AV92*s!AX92+s!AT92*s!AZ92))+IF(s!AV92*s!BA92+s!AW92*s!AZ92=0,0,Q93*s!AV92*s!BA92/(s!AV92*s!BA92+s!AW92*s!AZ92))+IF(s!AT92*s!BA92+s!AU92*s!AZ92+s!AV92*s!AY92+s!AW92*s!AX92=0,0,N93*s!AV92*s!AY92/(s!AT92*s!BA92+s!AU92*s!AZ92+s!AV92*s!AY92+s!AW92*s!AX92)) -> 13.961447026625807 | AW93: =AF93+IF(s!AT92*s!AW92+s!AU92*s!AV92=0,0,E93*s!AT92*s!AW92/(s!AT92*s!AW92+s!AU92*s!AV92))+IF(s!AU92*s!BA92+s!AW92*s!AY92=0,0,O93*s!AW92*s!AY92/(s!AU92*s!BA92+s!AW92*s!AY92))+IF(s!AV92*s!BA92+s!AW92*s!AZ92=0,0,Q93*s!AW92*s!AZ92/(s!AV92*s!BA92+s!AW92*s!AZ92))+IF(s!AT92*s!BA92+s!AU92*s!AZ92+s!AV92*s!AY92+s!AW92*s!AX92=0,0,N93*s!AW92*s!AX92/(s!AT92*s!BA92+s!AU92*s!AZ92+s!AV92*s!AY92+s!AW92*s!AX92)) -> 9.6065354866452317 | AX93: =AG93+IF(s!AT92*s!AY92+s!AU92*s!AX92=0,0,K93*s!AU92*s!AX92/(s!AT92*s!AY92+s!AU92*s!AX92))+IF(s!AV92*s!AX92+s!AT92*s!AZ92=0,0,M93*s!AV92*s!AX92/(s!AV92*s!AX92+s!AT92*s!AZ92))+IF(s!AX92*s!BA92+s!AY92*s!AZ92=0,0,W93*s!AX92*s!BA92/(s!AX92*s!BA92+s!AY92*s!AZ92))+IF(s!AT92*s!BA92+s!AU92*s!AZ92+s!AV92*s!AY92+s!AW92*s!AX92=0,0,N93*s!AW92*s!AX92/(s!AT92*s!BA92+s!AU92*s!AZ92+s!AV92*s!AY92+s!AW92*s!AX92)) -> 13.990720119006729 | AY93: =AH93+IF(s!AT92*s!AY92+s!AU92*s!AX92=0,0,K93*s!AT92*s!AY92/(s!AT92*s!AY92+s!AU92*s!AX92))+IF(s!AU92*s!BA92+s!AW92*s!AY92=0,0,O93*s!AW92*s!AY92/(s!AU92*s!BA92+s!AW92*s!AY92))+IF(s!AX92*s!BA92+s!AY92*s!AZ92=0,0,W93*s!AY92*s!AZ92/(s!AX92*s!BA92+s!AY92*s!AZ92))+IF(s!AT92*s!BA92+s!AU92*s!AZ92+s!AV92*s!AY92+s!AW92*s!AX92=0,0,N93*s!AV92*s!AY92/(s!AT92*s!BA92+s!AU92*s!AZ92+s!AV92*s!AY92+s!AW92*s!AX92)) -> 10.577262394264309 | AZ93: =AI93+IF(s!AT92*s!AZ92+s!AV92*s!AX92=0,0,M93*s!AT92*s!AZ92/(s!AT92*s!AZ92+s!AV92*s!AX92))+IF(s!AV92*s!BA92+s!AW92*s!AZ92=0,0,Q93*s!AW92*s!AZ92/(s!AV92*s!BA92+s!AW92*s!AZ92))+IF(s!AX92*s!BA92+s!AY92*s!AZ92=0,0,W93*s!AY92*s!AZ92/(s!AX92*s!BA92+s!AY92*s!AZ92))+IF(s!AT92*s!BA92+s!AU92*s!AZ92+s!AV92*s!AY92+s!AW92*s!AX92=0,0,N93*s!AU92*s!AZ92/(s!AT92*s!BA92+s!AU92*s!AZ92+s!AV92*s!AY92+s!AW92*s!AX92)) -> 17.389435918023022 | BA93: =AJ93+IF(s!AU92*s!BA92+s!AW92*s!AY92=0,0,O93*s!AU92*s!BA92/(s!AU92*s!BA92+s!AW92*s!AY92))+IF(s!AV92*s!BA92+s!AW92*s!AZ92=0,0,Q93*s!AV92*s!BA92/(s!AV92*s!BA92+s!AW92*s!AZ92))+IF(s!AX92*s!BA92+s!AY92*s!AZ92=0,0,W93*s!AX92*s!BA92/(s!AX92*s!BA92+s!AY92*s!AZ92))+IF(s!AT92*s!BA92+s!AU92*s!AZ92+s!AV92*s!AY92+s!AW92*s!AX92=0,0,N93*s!AT92*s!BA92/(s!AT92*s!BA92+s!AU92*s!AZ92+s!AV92*s!AY92+s!AW92*s!AX92)) -> 22.042581568705938 | BJ93: =SUM(AT93:BA93) -> 778
A94: =A93 -> 100 | B94: =B93 -> 30 | C94: =C93 -> 200 | D94: =D93 -> 2 | E94: =E93 -> 4 | F94: =F93 -> 1 | G94: =G93 -> 1 | H94: =H93 -> 2 | I94: =I93 -> 1 | J94: =J93 -> 2 | K94: =K93 -> 4 | L94: =L93 -> 2 | M94: =M93 -> 4 | N94: =N93 -> 8 | O94: =O93 -> 4 | P94: =P93 -> 2 | Q94: =Q93 -> 4 | R94: =R93 -> 2 | S94: =S93 -> 1 | T94: =T93 -> 2 | U94: =U93 -> 1 | V94: =V93 -> 2 | W94: =W93 -> 4 | X94: =X93 -> 2 | Y94: =Y93 -> 1 | Z94: =Z93 -> 2 | AA94: =AA93 -> 1 | AB94: =AB93 -> 389 | AC94: =AC93 -> 234 | AD94: =AD93 -> 433 | AE94: =AE93 -> 8 | AF94: =AF93 -> 7 | AG94: =AG93 -> 8 | AH94: =AH93 -> 8 | AI94: =AI93 -> 8 | AJ94: =AJ93 -> 8 | AS94: =AS93 -> 714 | AT94: =AC94+IF(s!AT93*s!AW93+s!AU93*s!AV93=0,0,E94*s!AT93*s!AW93/(s!AT93*s!AW93+s!AU93*s!AV93))+IF(s!AT93*s!AY93+s!AU93*s!AX93=0,0,K94*s!AT93*s!AY93/(s!AT93*s!AY93+s!AU93*s!AX93))+IF(s!AT93*s!AZ93+s!AV93*s!AX93=0,0,M94*s!AT93*s!AZ93/(s!AT93*s!AZ93+s!AV93*s!AX93))+IF(s!AT93*s!BA93+s!AU93*s!AZ93+s!AV93*s!AY93+s!AW93*s!AX93=0,0,N94*s!AT93*s!BA93/(s!AT93*s!BA93+s!AU93*s!AZ93+s!AV93*s!AY93+s!AW93*s!AX93)) -> 244.65839693634447 | AU94: =AD94+IF(s!AU93*s!AV93+s!AT93*s!AW93=0,0,E94*s!AU93*s!AV93/(s!AU93*s!AV93+s!AT93*s!AW93))+IF(s!AT93*s!AY93+s!AU93*s!AX93=0,0,K94*s!AU93*s!AX93/(s!AT93*s!AY93+s!AU93*s!AX93))+IF(s!AU93*s!BA93+s!AW93*s!AY93=0,0,O94*s!AU93*s!BA93/(s!AU93*s!BA93+s!AW93*s!AY93))+IF(s!AT93*s!BA93+s!AU93*s!AZ93+s!AV93*s!AY93+s!AW93*s!AX93=0,0,N94*s!AU93*s!AZ93/(s!AT93*s!BA93+s!AU93*s!AZ93+s!AV93*s!AY93+s!AW93*s!AX93)) -> 445.77362055038446 | AV94: =AE94+IF(s!AU93*s!AV93+s!AT93*s!AW93=0,0,E94*s!AU93*s!AV93/(s!AU93*s!AV93+s!AT93*s!AW93))+IF(s!AV93*s!AX93+s!AT93*s!AZ93=0,0,M94*s!AV93*s!AX93/(s!AV93*s!AX93+s!AT93*s!AZ93))+IF(s!AV93*s!BA93+s!AW93*s!AZ93=0,0,Q94*s!AV93*s!BA93/(s!AV93*s!BA93+s!AW93*s!AZ93))+IF(s!AT93*s!BA93+s!AU93*s!AZ93+s!AV93*s!AY93+s!AW93*s!AX93=0,0,N94*s!AV93*s!AY93/(s!AT93*s!BA93+s!AU93*s!AZ93+s!AV93*s!AY93+s!AW93*s!AX93)) -> 13.961447026625837 | AW94: =AF94+IF(s!AT93*s!AW93+s!AU93*s!AV93=0,0,E94*s!AT93*s!AW93/(s!AT93*s!AW93+s!AU93*s!AV93))+IF(s!AU93*s!BA93+s!AW93*s!AY93=0,0,O94*s!AW93*s!AY93/(s!AU93*s!BA93+s!AW93*s!AY93))+IF(s!AV93*s!BA93+s!AW93*s!AZ93=0,0,Q94*s!AW93*s!AZ93/(s!AV93*s!BA93+s!AW93*s!AZ93))+IF(s!AT93*s!BA93+s!AU93*s!AZ93+s!AV93*s!AY93+s!AW93*s!AX93=0,0,N94*s!AW93*s!AX93/(s!AT93*s!BA93+s!AU93*s!AZ93+s!AV93*s!AY93+s!AW93*s!AX93)) -> 9.6065354866452051 | AX94: =AG94+IF(s!AT93*s!AY93+s!AU93*s!AX93=0,0,K94*s!AU93*s!AX93/(s!AT93*s!AY93+s!AU93*s!AX93))+IF(s!AV93*s!AX93+s!AT93*s!AZ93=0,0,M94*s!AV93*s!AX93/(s!AV93*s!AX93+s!AT93*s!AZ93))+IF(s!AX93*s!BA93+s!AY93*s!AZ93=0,0,W94*s!AX93*s!BA93/(s!AX93*s!BA93+s!AY93*s!AZ93))+IF(s!AT93*s!BA93+s!AU93*s!AZ93+s!AV93*s!AY93+s!AW93*s!AX93=0,0,N94*s!AW93*s!AX93/(s!AT93*s!BA93+s!AU93*s!AZ93+s!AV93*s!AY93+s!AW93*s!AX93)) -> 13.990720119006752 | AY94: =AH94+IF(s!AT93*s!AY93+s!AU93*s!AX93=0,0,K94*s!AT93*s!AY93/(s!AT93*s!AY93+s!AU93*s!AX93))+IF(s!AU93*s!BA93+s!AW93*s!AY93=0,0,O94*s!AW93*s!AY93/(s!AU93*s!BA93+s!AW93*s!AY93))+IF(s!AX93*s!BA93+s!AY93*s!AZ93=0,0,W94*s!AY93*s!AZ93/(s!AX93*s!BA93+s!AY93*s!AZ93))+IF(s!AT93*s!BA93+s!AU93*s!AZ93+s!AV93*s!AY93+s!AW93*s!AX93=0,0,N94*s!AV93*s!AY93/(s!AT93*s!BA93+s!AU93*s!AZ93+s!AV93*s!AY93+s!AW93*s!AX93)) -> 10.577262394264284 | AZ94: =AI94+IF(s!AT93*s!AZ93+s!AV93*s!AX93=0,0,M94*s!AT93*s!AZ93/(s!AT93*s!AZ93+s!AV93*s!AX93))+IF(s!AV93*s!BA93+s!AW93*s!AZ93=0,0,Q94*s!AW93*s!AZ93/(s!AV93*s!BA93+s!AW93*s!AZ93))+IF(s!AX93*s!BA93+s!AY93*s!AZ93=0,0,W94*s!AY93*s!AZ93/(s!AX93*s!BA93+s!AY93*s!AZ93))+IF(s!AT93*s!BA93+s!AU93*s!AZ93+s!AV93*s!AY93+s!AW93*s!AX93=0,0,N94*s!AU93*s!AZ93/(s!AT93*s!BA93+s!AU93*s!AZ93+s!AV93*s!AY93+s!AW93*s!AX93)) -> 17.389435918022969 | BA94: =AJ94+IF(s!AU93*s!BA93+s!AW93*s!AY93=0,0,O94*s!AU93*s!BA93/(s!AU93*s!BA93+s!AW93*s!AY93))+IF(s!AV93*s!BA93+s!AW93*s!AZ93=0,0,Q94*s!AV93*s!BA93/(s!AV93*s!BA93+s!AW93*s!AZ93))+IF(s!AX93*s!BA93+s!AY93*s!AZ93=0,0,W94*s!AX93*s!BA93/(s!AX93*s!BA93+s!AY93*s!AZ93))+IF(s!AT93*s!BA93+s!AU93*s!AZ93+s!AV93*s!AY93+s!AW93*s!AX93=0,0,N94*s!AT93*s!BA93/(s!AT93*s!BA93+s!AU93*s!AZ93+s!AV93*s!AY93+s!AW93*s!AX93)) -> 22.042581568705991 | BJ94: =SUM(AT94:BA94) -> 778
A95: =A94 -> 100 | B95: =B94 -> 30 | C95: =C94 -> 200 | D95: =D94 -> 2 | E95: =E94 -> 4 | F95: =F94 -> 1 | G95: =G94 -> 1 | H95: =H94 -> 2 | I95: =I94 -> 1 | J95: =J94 -> 2 | K95: =K94 -> 4 | L95: =L94 -> 2 | M95: =M94 -> 4 | N95: =N94 -> 8 | O95: =O94 -> 4 | P95: =P94 -> 2 | Q95: =Q94 -> 4 | R95: =R94 -> 2 | S95: =S94 -> 1 | T95: =T94 -> 2 | U95: =U94 -> 1 | V95: =V94 -> 2 | W95: =W94 -> 4 | X95: =X94 -> 2 | Y95: =Y94 -> 1 | Z95: =Z94 -> 2 | AA95: =AA94 -> 1 | AB95: =AB94 -> 389 | AC95: =AC94 -> 234 | AD95: =AD94 -> 433 | AE95: =AE94 -> 8 | AF95: =AF94 -> 7 | AG95: =AG94 -> 8 | AH95: =AH94 -> 8 | AI95: =AI94 -> 8 | AJ95: =AJ94 -> 8 | AS95: =AS94 -> 714 | AT95: =AC95+IF(s!AT94*s!AW94+s!AU94*s!AV94=0,0,E95*s!AT94*s!AW94/(s!AT94*s!AW94+s!AU94*s!AV94))+IF(s!AT94*s!AY94+s!AU94*s!AX94=0,0,K95*s!AT94*s!AY94/(s!AT94*s!AY94+s!AU94*s!AX94))+IF(s!AT94*s!AZ94+s!AV94*s!AX94=0,0,M95*s!AT94*s!AZ94/(s!AT94*s!AZ94+s!AV94*s!AX94))+IF(s!AT94*s!BA94+s!AU94*s!AZ94+s!AV94*s!AY94+s!AW94*s!AX94=0,0,N95*s!AT94*s!BA94/(s!AT94*s!BA94+s!AU94*s!AZ94+s!AV94*s!AY94+s!AW94*s!AX94)) -> 244.65839693634447 | AU95: =AD95+IF(s!AU94*s!AV94+s!AT94*s!AW94=0,0,E95*s!AU94*s!AV94/(s!AU94*s!AV94+s!AT94*s!AW94))+IF(s!AT94*s!AY94+s!AU94*s!AX94=0,0,K95*s!AU94*s!AX94/(s!AT94*s!AY94+s!AU94*s!AX94))+IF(s!AU94*s!BA94+s!AW94*s!AY94=0,0,O95*s!AU94*s!BA94/(s!AU94*s!BA94+s!AW94*s!AY94))+IF(s!AT94*s!BA94+s!AU94*s!AZ94+s!AV94*s!AY94+s!AW94*s!AX94=0,0,N95*s!AU94*s!AZ94/(s!AT94*s!BA94+s!AU94*s!AZ94+s!AV94*s!AY94+s!AW94*s!AX94)) -> 445.77362055038446 | AV95: =AE95+IF(s!AU94*s!AV94+s!AT94*s!AW94=0,0,E95*s!AU94*s!AV94/(s!AU94*s!AV94+s!AT94*s!AW94))+IF(s!AV94*s!AX94+s!AT94*s!AZ94=0,0,M95*s!AV94*s!AX94/(s!AV94*s!AX94+s!AT94*s!AZ94))+IF(s!AV94*s!BA94+s!AW94*s!AZ94=0,0,Q95*s!AV94*s!BA94/(s!AV94*s!BA94+s!AW94*s!AZ94))+IF(s!AT94*s!BA94+s!AU94*s!AZ94+s!AV94*s!AY94+s!AW94*s!AX94=0,0,N95*s!AV94*s!AY94/(s!AT94*s!BA94+s!AU94*s!AZ94+s!AV94*s!AY94+s!AW94*s!AX94)) -> 13.961447026625855 | AW95: =AF95+IF(s!AT94*s!AW94+s!AU94*s!AV94=0,0,E95*s!AT94*s!AW94/(s!AT94*s!AW94+s!AU94*s!AV94))+IF(s!AU94*s!BA94+s!AW94*s!AY94=0,0,O95*s!AW94*s!AY94/(s!AU94*s!BA94+s!AW94*s!AY94))+IF(s!AV94*s!BA94+s!AW94*s!AZ94=0,0,Q95*s!AW94*s!AZ94/(s!AV94*s!BA94+s!AW94*s!AZ94))+IF(s!AT94*s!BA94+s!AU94*s!AZ94+s!AV94*s!AY94+s!AW94*s!AX94=0,0,N95*s!AW94*s!AX94/(s!AT94*s!BA94+s!AU94*s!AZ94+s!AV94*s!AY94+s!AW94*s!AX94)) -> 9.6065354866451873 | AX95: =AG95+IF(s!AT94*s!AY94+s!AU94*s!AX94=0,0,K95*s!AU94*s!AX94/(s!AT94*s!AY94+s!AU94*s!AX94))+IF(s!AV94*s!AX94+s!AT94*s!AZ94=0,0,M95*s!AV94*s!AX94/(s!AV94*s!AX94+s!AT94*s!AZ94))+IF(s!AX94*s!BA94+s!AY94*s!AZ94=0,0,W95*s!AX94*s!BA94/(s!AX94*s!BA94+s!AY94*s!AZ94))+IF(s!AT94*s!BA94+s!AU94*s!AZ94+s!AV94*s!AY94+s!AW94*s!AX94=0,0,N95*s!AW94*s!AX94/(s!AT94*s!BA94+s!AU94*s!AZ94+s!AV94*s!AY94+s!AW94*s!AX94)) -> 13.990720119006772 | AY95: =AH95+IF(s!AT94*s!AY94+s!AU94*s!AX94=0,0,K95*s!AT94*s!AY94/(s!AT94*s!AY94+s!AU94*s!AX94))+IF(s!AU94*s!BA94+s!AW94*s!AY94=0,0,O95*s!AW94*s!AY94/(s!AU94*s!BA94+s!AW94*s!AY94))+IF(s!AX94*s!BA94+s!AY94*s!AZ94=0,0,W95*s!AY94*s!AZ94/(s!AX94*s!BA94+s!AY94*s!AZ94))+IF(s!AT94*s!BA94+s!AU94*s!AZ94+s!AV94*s!AY94+s!AW94*s!AX94=0,0,N95*s!AV94*s!AY94/(s!AT94*s!BA94+s!AU94*s!AZ94+s!AV94*s!AY94+s!AW94*s!AX94)) -> 10.57726239426427 | AZ95: =AI95+IF(s!AT94*s!AZ94+s!AV94*s!AX94=0,0,M95*s!AT94*s!AZ94/(s!AT94*s!AZ94+s!AV94*s!AX94))+IF(s!AV94*s!BA94+s!AW94*s!AZ94=0,0,Q95*s!AW94*s!AZ94/(s!AV94*s!BA94+s!AW94*s!AZ94))+IF(s!AX94*s!BA94+s!AY94*s!AZ94=0,0,W95*s!AY94*s!AZ94/(s!AX94*s!BA94+s!AY94*s!AZ94))+IF(s!AT94*s!BA94+s!AU94*s!AZ94+s!AV94*s!AY94+s!AW94*s!AX94=0,0,N95*s!AU94*s!AZ94/(s!AT94*s!BA94+s!AU94*s!AZ94+s!AV94*s!AY94+s!AW94*s!AX94)) -> 17.389435918022926 | BA95: =AJ95+IF(s!AU94*s!BA94+s!AW94*s!AY94=0,0,O95*s!AU94*s!BA94/(s!AU94*s!BA94+s!AW94*s!AY94))+IF(s!AV94*s!BA94+s!AW94*s!AZ94=0,0,Q95*s!AV94*s!BA94/(s!AV94*s!BA94+s!AW94*s!AZ94))+IF(s!AX94*s!BA94+s!AY94*s!AZ94=0,0,W95*s!AX94*s!BA94/(s!AX94*s!BA94+s!AY94*s!AZ94))+IF(s!AT94*s!BA94+s!AU94*s!AZ94+s!AV94*s!AY94+s!AW94*s!AX94=0,0,N95*s!AT94*s!BA94/(s!AT94*s!BA94+s!AU94*s!AZ94+s!AV94*s!AY94+s!AW94*s!AX94)) -> 22.042581568706034 | BJ95: =SUM(AT95:BA95) -> 778
A96: =A95 -> 100 | B96: =B95 -> 30 | C96: =C95 -> 200 | D96: =D95 -> 2 | E96: =E95 -> 4 | F96: =F95 -> 1 | G96: =G95 -> 1 | H96: =H95 -> 2 | I96: =I95 -> 1 | J96: =J95 -> 2 | K96: =K95 -> 4 | L96: =L95 -> 2 | M96: =M95 -> 4 | N96: =N95 -> 8 | O96: =O95 -> 4 | P96: =P95 -> 2 | Q96: =Q95 -> 4 | R96: =R95 -> 2 | S96: =S95 -> 1 | T96: =T95 -> 2 | U96: =U95 -> 1 | V96: =V95 -> 2 | W96: =W95 -> 4 | X96: =X95 -> 2 | Y96: =Y95 -> 1 | Z96: =Z95 -> 2 | AA96: =AA95 -> 1 | AB96: =AB95 -> 389 | AC96: =AC95 -> 234 | AD96: =AD95 -> 433 | AE96: =AE95 -> 8 | AF96: =AF95 -> 7 | AG96: =AG95 -> 8 | AH96: =AH95 -> 8 | AI96: =AI95 -> 8 | AJ96: =AJ95 -> 8 | AS96: =AS95 -> 714 | AT96: =AC96+IF(s!AT95*s!AW95+s!AU95*s!AV95=0,0,E96*s!AT95*s!AW95/(s!AT95*s!AW95+s!AU95*s!AV95))+IF(s!AT95*s!AY95+s!AU95*s!AX95=0,0,K96*s!AT95*s!AY95/(s!AT95*s!AY95+s!AU95*s!AX95))+IF(s!AT95*s!AZ95+s!AV95*s!AX95=0,0,M96*s!AT95*s!AZ95/(s!AT95*s!AZ95+s!AV95*s!AX95))+IF(s!AT95*s!BA95+s!AU95*s!AZ95+s!AV95*s!AY95+s!AW95*s!AX95=0,0,N96*s!AT95*s!BA95/(s!AT95*s!BA95+s!AU95*s!AZ95+s!AV95*s!AY95+s!AW95*s!AX95)) -> 244.65839693634442 | AU96: =AD96+IF(s!AU95*s!AV95+s!AT95*s!AW95=0,0,E96*s!AU95*s!AV95/(s!AU95*s!AV95+s!AT95*s!AW95))+IF(s!AT95*s!AY95+s!AU95*s!AX95=0,0,K96*s!AU95*s!AX95/(s!AT95*s!AY95+s!AU95*s!AX95))+IF(s!AU95*s!BA95+s!AW95*s!AY95=0,0,O96*s!AU95*s!BA95/(s!AU95*s!BA95+s!AW95*s!AY95))+IF(s!AT95*s!BA95+s!AU95*s!AZ95+s!AV95*s!AY95+s!AW95*s!AX95=0,0,N96*s!AU95*s!AZ95/(s!AT95*s!BA95+s!AU95*s!AZ95+s!AV95*s!AY95+s!AW95*s!AX95)) -> 445.77362055038446 | AV96: =AE96+IF(s!AU95*s!AV95+s!AT95*s!AW95=0,0,E96*s!AU95*s!AV95/(s!AU95*s!AV95+s!AT95*s!AW95))+IF(s!AV95*s!AX95+s!AT95*s!AZ95=0,0,M96*s!AV95*s!AX95/(s!AV95*s!AX95+s!AT95*s!AZ95))+IF(s!AV95*s!BA95+s!AW95*s!AZ95=0,0,Q96*s!AV95*s!BA95/(s!AV95*s!BA95+s!AW95*s!AZ95))+IF(s!AT95*s!BA95+s!AU95*s!AZ95+s!AV95*s!AY95+s!AW95*s!AX95=0,0,N96*s!AV95*s!AY95/(s!AT95*s!BA95+s!AU95*s!AZ95+s!AV95*s!AY95+s!AW95*s!AX95)) -> 13.961447026625871 | AW96: =AF96+IF(s!AT95*s!AW95+s!AU95*s!AV95=0,0,E96*s!AT95*s!AW95/(s!AT95*s!AW95+s!AU95*s!AV95))+IF(s!AU95*s!BA95+s!AW95*s!AY95=0,0,O96*s!AW95*s!AY95/(s!AU95*s!BA95+s!AW95*s!AY95))+IF(s!AV95*s!BA95+s!AW95*s!AZ95=0,0,Q96*s!AW95*s!AZ95/(s!AV95*s!BA95+s!AW95*s!AZ95))+IF(s!AT95*s!BA95+s!AU95*s!AZ95+s!AV95*s!AY95+s!AW95*s!AX95=0,0,N96*s!AW95*s!AX95/(s!AT95*s!BA95+s!AU95*s!AZ95+s!AV95*s!AY95+s!AW95*s!AX95)) -> 9.6065354866451749 | AX96: =AG96+IF(s!AT95*s!AY95+s!AU95*s!AX95=0,0,K96*s!AU95*s!AX95/(s!AT95*s!AY95+s!AU95*s!AX95))+IF(s!AV95*s!AX95+s!AT95*s!AZ95=0,0,M96*s!AV95*s!AX95/(s!AV95*s!AX95+s!AT95*s!AZ95))+IF(s!AX95*s!BA95+s!AY95*s!AZ95=0,0,W96*s!AX95*s!BA95/(s!AX95*s!BA95+s!AY95*s!AZ95))+IF(s!AT95*s!BA95+s!AU95*s!AZ95+s!AV95*s!AY95+s!AW95*s!AX95=0,0,N96*s!AW95*s!AX95/(s!AT95*s!BA95+s!AU95*s!AZ95+s!AV95*s!AY95+s!AW95*s!AX95)) -> 13.990720119006784 | AY96: =AH96+IF(s!AT95*s!AY95+s!AU95*s!AX95=0,0,K96*s!AT95*s!AY95/(s!AT95*s!AY95+s!AU95*s!AX95))+IF(s!AU95*s!BA95+s!AW95*s!AY95=0,0,O96*s!AW95*s!AY95/(s!AU95*s!BA95+s!AW95*s!AY95))+IF(s!AX95*s!BA95+s!AY95*s!AZ95=0,0,W96*s!AY95*s!AZ95/(s!AX95*s!BA95+s!AY95*s!AZ95))+IF(s!AT95*s!BA95+s!AU95*s!AZ95+s!AV95*s!AY95+s!AW95*s!AX95=0,0,N96*s!AV95*s!AY95/(s!AT95*s!BA95+s!AU95*s!AZ95+s!AV95*s!AY95+s!AW95*s!AX95)) -> 10.57726239426426 | AZ96: =AI96+IF(s!AT95*s!AZ95+s!AV95*s!AX95=0,0,M96*s!AT95*s!AZ95/(s!AT95*s!AZ95+s!AV95*s!AX95))+IF(s!AV95*s!BA95+s!AW95*s!AZ95=0,0,Q96*s!AW95*s!AZ95/(s!AV95*s!BA95+s!AW95*s!AZ95))+IF(s!AX95*s!BA95+s!AY95*s!AZ95=0,0,W96*s!AY95*s!AZ95/(s!AX95*s!BA95+s!AY95*s!AZ95))+IF(s!AT95*s!BA95+s!AU95*s!AZ95+s!AV95*s!AY95+s!AW95*s!AX95=0,0,N96*s!AU95*s!AZ95/(s!AT95*s!BA95+s!AU95*s!AZ95+s!AV95*s!AY95+s!AW95*s!AX95)) -> 17.389435918022897 | BA96: =AJ96+IF(s!AU95*s!BA95+s!AW95*s!AY95=0,0,O96*s!AU95*s!BA95/(s!AU95*s!BA95+s!AW95*s!AY95))+IF(s!AV95*s!BA95+s!AW95*s!AZ95=0,0,Q96*s!AV95*s!BA95/(s!AV95*s!BA95+s!AW95*s!AZ95))+IF(s!AX95*s!BA95+s!AY95*s!AZ95=0,0,W96*s!AX95*s!BA95/(s!AX95*s!BA95+s!AY95*s!AZ95))+IF(s!AT95*s!BA95+s!AU95*s!AZ95+s!AV95*s!AY95+s!AW95*s!AX95=0,0,N96*s!AT95*s!BA95/(s!AT95*s!BA95+s!AU95*s!AZ95+s!AV95*s!AY95+s!AW95*s!AX95)) -> 22.042581568706062 | BJ96: =SUM(AT96:BA96) -> 778
A97: =A96 -> 100 | B97: =B96 -> 30 | C97: =C96 -> 200 | D97: =D96 -> 2 | E97: =E96 -> 4 | F97: =F96 -> 1 | G97: =G96 -> 1 | H97: =H96 -> 2 | I97: =I96 -> 1 | J97: =J96 -> 2 | K97: =K96 -> 4 | L97: =L96 -> 2 | M97: =M96 -> 4 | N97: =N96 -> 8 | O97: =O96 -> 4 | P97: =P96 -> 2 | Q97: =Q96 -> 4 | R97: =R96 -> 2 | S97: =S96 -> 1 | T97: =T96 -> 2 | U97: =U96 -> 1 | V97: =V96 -> 2 | W97: =W96 -> 4 | X97: =X96 -> 2 | Y97: =Y96 -> 1 | Z97: =Z96 -> 2 | AA97: =AA96 -> 1 | AB97: =AB96 -> 389 | AC97: =AC96 -> 234 | AD97: =AD96 -> 433 | AE97: =AE96 -> 8 | AF97: =AF96 -> 7 | AG97: =AG96 -> 8 | AH97: =AH96 -> 8 | AI97: =AI96 -> 8 | AJ97: =AJ96 -> 8 | AS97: =AS96 -> 714 | AT97: =AC97+IF(s!AT96*s!AW96+s!AU96*s!AV96=0,0,E97*s!AT96*s!AW96/(s!AT96*s!AW96+s!AU96*s!AV96))+IF(s!AT96*s!AY96+s!AU96*s!AX96=0,0,K97*s!AT96*s!AY96/(s!AT96*s!AY96+s!AU96*s!AX96))+IF(s!AT96*s!AZ96+s!AV96*s!AX96=0,0,M97*s!AT96*s!AZ96/(s!AT96*s!AZ96+s!AV96*s!AX96))+IF(s!AT96*s!BA96+s!AU96*s!AZ96+s!AV96*s!AY96+s!AW96*s!AX96=0,0,N97*s!AT96*s!BA96/(s!AT96*s!BA96+s!AU96*s!AZ96+s!AV96*s!AY96+s!AW96*s!AX96)) -> 244.65839693634445 | AU97: =AD97+IF(s!AU96*s!AV96+s!AT96*s!AW96=0,0,E97*s!AU96*s!AV96/(s!AU96*s!AV96+s!AT96*s!AW96))+IF(s!AT96*s!AY96+s!AU96*s!AX96=0,0,K97*s!AU96*s!AX96/(s!AT96*s!AY96+s!AU96*s!AX96))+IF(s!AU96*s!BA96+s!AW96*s!AY96=0,0,O97*s!AU96*s!BA96/(s!AU96*s!BA96+s!AW96*s!AY96))+IF(s!AT96*s!BA96+s!AU96*s!AZ96+s!AV96*s!AY96+s!AW96*s!AX96=0,0,N97*s!AU96*s!AZ96/(s!AT96*s!BA96+s!AU96*s!AZ96+s!AV96*s!AY96+s!AW96*s!AX96)) -> 445.77362055038446 | AV97: =AE97+IF(s!AU96*s!AV96+s!AT96*s!AW96=0,0,E97*s!AU96*s!AV96/(s!AU96*s!AV96+s!AT96*s!AW96))+IF(s!AV96*s!AX96+s!AT96*s!AZ96=0,0,M97*s!AV96*s!AX96/(s!AV96*s!AX96+s!AT96*s!AZ96))+IF(s!AV96*s!BA96+s!AW96*s!AZ96=0,0,Q97*s!AV96*s!BA96/(s!AV96*s!BA96+s!AW96*s!AZ96))+IF(s!AT96*s!BA96+s!AU96*s!AZ96+s!AV96*s!AY96+s!AW96*s!AX96=0,0,N97*s!AV96*s!AY96/(s!AT96*s!BA96+s!AU96*s!AZ96+s!AV96*s!AY96+s!AW96*s!AX96)) -> 13.961447026625878 | AW97: =AF97+IF(s!AT96*s!AW96+s!AU96*s!AV96=0,0,E97*s!AT96*s!AW96/(s!AT96*s!AW96+s!AU96*s!AV96))+IF(s!AU96*s!BA96+s!AW96*s!AY96=0,0,O97*s!AW96*s!AY96/(s!AU96*s!BA96+s!AW96*s!AY96))+IF(s!AV96*s!BA96+s!AW96*s!AZ96=0,0,Q97*s!AW96*s!AZ96/(s!AV96*s!BA96+s!AW96*s!AZ96))+IF(s!AT96*s!BA96+s!AU96*s!AZ96+s!AV96*s!AY96+s!AW96*s!AX96=0,0,N97*s!AW96*s!AX96/(s!AT96*s!BA96+s!AU96*s!AZ96+s!AV96*s!AY96+s!AW96*s!AX96)) -> 9.6065354866451642 | AX97: =AG97+IF(s!AT96*s!AY96+s!AU96*s!AX96=0,0,K97*s!AU96*s!AX96/(s!AT96*s!AY96+s!AU96*s!AX96))+IF(s!AV96*s!AX96+s!AT96*s!AZ96=0,0,M97*s!AV96*s!AX96/(s!AV96*s!AX96+s!AT96*s!AZ96))+IF(s!AX96*s!BA96+s!AY96*s!AZ96=0,0,W97*s!AX96*s!BA96/(s!AX96*s!BA96+s!AY96*s!AZ96))+IF(s!AT96*s!BA96+s!AU96*s!AZ96+s!AV96*s!AY96+s!AW96*s!AX96=0,0,N97*s!AW96*s!AX96/(s!AT96*s!BA96+s!AU96*s!AZ96+s!AV96*s!AY96+s!AW96*s!AX96)) -> 13.990720119006793 | AY97: =AH97+IF(s!AT96*s!AY96+s!AU96*s!AX96=0,0,K97*s!AT96*s!AY96/(s!AT96*s!AY96+s!AU96*s!AX96))+IF(s!AU96*s!BA96+s!AW96*s!AY96=0,0,O97*s!AW96*s!AY96/(s!AU96*s!BA96+s!AW96*s!AY96))+IF(s!AX96*s!BA96+s!AY96*s!AZ96=0,0,W97*s!AY96*s!AZ96/(s!AX96*s!BA96+s!AY96*s!AZ96))+IF(s!AT96*s!BA96+s!AU96*s!AZ96+s!AV96*s!AY96+s!AW96*s!AX96=0,0,N97*s!AV96*s!AY96/(s!AT96*s!BA96+s!AU96*s!AZ96+s!AV96*s!AY96+s!AW96*s!AX96)) -> 10.577262394264249 | AZ97: =AI97+IF(s!AT96*s!AZ96+s!AV96*s!AX96=0,0,M97*s!AT96*s!AZ96/(s!AT96*s!AZ96+s!AV96*s!AX96))+IF(s!AV96*s!BA96+s!AW96*s!AZ96=0,0,Q97*s!AW96*s!AZ96/(s!AV96*s!BA96+s!AW96*s!AZ96))+IF(s!AX96*s!BA96+s!AY96*s!AZ96=0,0,W97*s!AY96*s!AZ96/(s!AX96*s!BA96+s!AY96*s!AZ96))+IF(s!AT96*s!BA96+s!AU96*s!AZ96+s!AV96*s!AY96+s!AW96*s!AX96=0,0,N97*s!AU96*s!AZ96/(s!AT96*s!BA96+s!AU96*s!AZ96+s!AV96*s!AY96+s!AW96*s!AX96)) -> 17.38943591802288 | BA97: =AJ97+IF(s!AU96*s!BA96+s!AW96*s!AY96=0,0,O97*s!AU96*s!BA96/(s!AU96*s!BA96+s!AW96*s!AY96))+IF(s!AV96*s!BA96+s!AW96*s!AZ96=0,0,Q97*s!AV96*s!BA96/(s!AV96*s!BA96+s!AW96*s!AZ96))+IF(s!AX96*s!BA96+s!AY96*s!AZ96=0,0,W97*s!AX96*s!BA96/(s!AX96*s!BA96+s!AY96*s!AZ96))+IF(s!AT96*s!BA96+s!AU96*s!AZ96+s!AV96*s!AY96+s!AW96*s!AX96=0,0,N97*s!AT96*s!BA96/(s!AT96*s!BA96+s!AU96*s!AZ96+s!AV96*s!AY96+s!AW96*s!AX96)) -> 22.04258156870608 | BJ97: =SUM(AT97:BA97) -> 778
A98: =A97 -> 100 | B98: =B97 -> 30 | C98: =C97 -> 200 | D98: =D97 -> 2 | E98: =E97 -> 4 | F98: =F97 -> 1 | G98: =G97 -> 1 | H98: =H97 -> 2 | I98: =I97 -> 1 | J98: =J97 -> 2 | K98: =K97 -> 4 | L98: =L97 -> 2 | M98: =M97 -> 4 | N98: =N97 -> 8 | O98: =O97 -> 4 | P98: =P97 -> 2 | Q98: =Q97 -> 4 | R98: =R97 -> 2 | S98: =S97 -> 1 | T98: =T97 -> 2 | U98: =U97 -> 1 | V98: =V97 -> 2 | W98: =W97 -> 4 | X98: =X97 -> 2 | Y98: =Y97 -> 1 | Z98: =Z97 -> 2 | AA98: =AA97 -> 1 | AB98: =AB97 -> 389 | AC98: =AC97 -> 234 | AD98: =AD97 -> 433 | AE98: =AE97 -> 8 | AF98: =AF97 -> 7 | AG98: =AG97 -> 8 | AH98: =AH97 -> 8 | AI98: =AI97 -> 8 | AJ98: =AJ97 -> 8 | AS98: =AS97 -> 714 | AT98: =AC98+IF(s!AT97*s!AW97+s!AU97*s!AV97=0,0,E98*s!AT97*s!AW97/(s!AT97*s!AW97+s!AU97*s!AV97))+IF(s!AT97*s!AY97+s!AU97*s!AX97=0,0,K98*s!AT97*s!AY97/(s!AT97*s!AY97+s!AU97*s!AX97))+IF(s!AT97*s!AZ97+s!AV97*s!AX97=0,0,M98*s!AT97*s!AZ97/(s!AT97*s!AZ97+s!AV97*s!AX97))+IF(s!AT97*s!BA97+s!AU97*s!AZ97+s!AV97*s!AY97+s!AW97*s!AX97=0,0,N98*s!AT97*s!BA97/(s!AT97*s!BA97+s!AU97*s!AZ97+s!AV97*s!AY97+s!AW97*s!AX97)) -> 244.65839693634445 | AU98: =AD98+IF(s!AU97*s!AV97+s!AT97*s!AW97=0,0,E98*s!AU97*s!AV97/(s!AU97*s!AV97+s!AT97*s!AW97))+IF(s!AT97*s!AY97+s!AU97*s!AX97=0,0,K98*s!AU97*s!AX97/(s!AT97*s!AY97+s!AU97*s!AX97))+IF(s!AU97*s!BA97+s!AW97*s!AY97=0,0,O98*s!AU97*s!BA97/(s!AU97*s!BA97+s!AW97*s!AY97))+IF(s!AT97*s!BA97+s!AU97*s!AZ97+s!AV97*s!AY97+s!AW97*s!AX97=0,0,N98*s!AU97*s!AZ97/(s!AT97*s!BA97+s!AU97*s!AZ97+s!AV97*s!AY97+s!AW97*s!AX97)) -> 445.77362055038446 | AV98: =AE98+IF(s!AU97*s!AV97+s!AT97*s!AW97=0,0,E98*s!AU97*s!AV97/(s!AU97*s!AV97+s!AT97*s!AW97))+IF(s!AV97*s!AX97+s!AT97*s!AZ97=0,0,M98*s!AV97*s!AX97/(s!AV97*s!AX97+s!AT97*s!AZ97))+IF(s!AV97*s!BA97+s!AW97*s!AZ97=0,0,Q98*s!AV97*s!BA97/(s!AV97*s!BA97+s!AW97*s!AZ97))+IF(s!AT97*s!BA97+s!AU97*s!AZ97+s!AV97*s!AY97+s!AW97*s!AX97=0,0,N98*s!AV97*s!AY97/(s!AT97*s!BA97+s!AU97*s!AZ97+s!AV97*s!AY97+s!AW97*s!AX97)) -> 13.961447026625887 | AW98: =AF98+IF(s!AT97*s!AW97+s!AU97*s!AV97=0,0,E98*s!AT97*s!AW97/(s!AT97*s!AW97+s!AU97*s!AV97))+IF(s!AU97*s!BA97+s!AW97*s!AY97=0,0,O98*s!AW97*s!AY97/(s!AU97*s!BA97+s!AW97*s!AY97))+IF(s!AV97*s!BA97+s!AW97*s!AZ97=0,0,Q98*s!AW97*s!AZ97/(s!AV97*s!BA97+s!AW97*s!AZ97))+IF(s!AT97*s!BA97+s!AU97*s!AZ97+s!AV97*s!AY97+s!AW97*s!AX97=0,0,N98*s!AW97*s!AX97/(s!AT97*s!BA97+s!AU97*s!AZ97+s!AV97*s!AY97+s!AW97*s!AX97)) -> 9.6065354866451571 | AX98: =AG98+IF(s!AT97*s!AY97+s!AU97*s!AX97=0,0,K98*s!AU97*s!AX97/(s!AT97*s!AY97+s!AU97*s!AX97))+IF(s!AV97*s!AX97+s!AT97*s!AZ97=0,0,M98*s!AV97*s!AX97/(s!AV97*s!AX97+s!AT97*s!AZ97))+IF(s!AX97*s!BA97+s!AY97*s!AZ97=0,0,W98*s!AX97*s!BA97/(s!AX97*s!BA97+s!AY97*s!AZ97))+IF(s!AT97*s!BA97+s!AU97*s!AZ97+s!AV97*s!AY97+s!AW97*s!AX97=0,0,N98*s!AW97*s!AX97/(s!AT97*s!BA97+s!AU97*s!AZ97+s!AV97*s!AY97+s!AW97*s!AX97)) -> 13.990720119006799 | AY98: =AH98+IF(s!AT97*s!AY97+s!AU97*s!AX97=0,0,K98*s!AT97*s!AY97/(s!AT97*s!AY97+s!AU97*s!AX97))+IF(s!AU97*s!BA97+s!AW97*s!AY97=0,0,O98*s!AW97*s!AY97/(s!AU97*s!BA97+s!AW97*s!AY97))+IF(s!AX97*s!BA97+s!AY97*s!AZ97=0,0,W98*s!AY97*s!AZ97/(s!AX97*s!BA97+s!AY97*s!AZ97))+IF(s!AT97*s!BA97+s!AU97*s!AZ97+s!AV97*s!AY97+s!AW97*s!AX97=0,0,N98*s!AV97*s!AY97/(s!AT97*s!BA97+s!AU97*s!AZ97+s!AV97*s!AY97+s!AW97*s!AX97)) -> 10.577262394264244 | AZ98: =AI98+IF(s!AT97*s!AZ97+s!AV97*s!AX97=0,0,M98*s!AT97*s!AZ97/(s!AT97*s!AZ97+s!AV97*s!AX97))+IF(s!AV97*s!BA97+s!AW97*s!AZ97=0,0,Q98*s!AW97*s!AZ97/(s!AV97*s!BA97+s!AW97*s!AZ97))+IF(s!AX97*s!BA97+s!AY97*s!AZ97=0,0,W98*s!AY97*s!AZ97/(s!AX97*s!BA97+s!AY97*s!AZ97))+IF(s!AT97*s!BA97+s!AU97*s!AZ97+s!AV97*s!AY97+s!AW97*s!AX97=0,0,N98*s!AU97*s!AZ97/(s!AT97*s!BA97+s!AU97*s!AZ97+s!AV97*s!AY97+s!AW97*s!AX97)) -> 17.389435918022862 | BA98: =AJ98+IF(s!AU97*s!BA97+s!AW97*s!AY97=0,0,O98*s!AU97*s!BA97/(s!AU97*s!BA97+s!AW97*s!AY97))+IF(s!AV97*s!BA97+s!AW97*s!AZ97=0,0,Q98*s!AV97*s!BA97/(s!AV97*s!BA97+s!AW97*s!AZ97))+IF(s!AX97*s!BA97+s!AY97*s!AZ97=0,0,W98*s!AX97*s!BA97/(s!AX97*s!BA97+s!AY97*s!AZ97))+IF(s!AT97*s!BA97+s!AU97*s!AZ97+s!AV97*s!AY97+s!AW97*s!AX97=0,0,N98*s!AT97*s!BA97/(s!AT97*s!BA97+s!AU97*s!AZ97+s!AV97*s!AY97+s!AW97*s!AX97)) -> 22.04258156870609 | BJ98: =SUM(AT98:BA98) -> 778
A99: =A98 -> 100 | B99: =B98 -> 30 | C99: =C98 -> 200 | D99: =D98 -> 2 | E99: =E98 -> 4 | F99: =F98 -> 1 | G99: =G98 -> 1 | H99: =H98 -> 2 | I99: =I98 -> 1 | J99: =J98 -> 2 | K99: =K98 -> 4 | L99: =L98 -> 2 | M99: =M98 -> 4 | N99: =N98 -> 8 | O99: =O98 -> 4 | P99: =P98 -> 2 | Q99: =Q98 -> 4 | R99: =R98 -> 2 | S99: =S98 -> 1 | T99: =T98 -> 2 | U99: =U98 -> 1 | V99: =V98 -> 2 | W99: =W98 -> 4 | X99: =X98 -> 2 | Y99: =Y98 -> 1 | Z99: =Z98 -> 2 | AA99: =AA98 -> 1 | AB99: =AB98 -> 389 | AC99: =AC98 -> 234 | AD99: =AD98 -> 433 | AE99: =AE98 -> 8 | AF99: =AF98 -> 7 | AG99: =AG98 -> 8 | AH99: =AH98 -> 8 | AI99: =AI98 -> 8 | AJ99: =AJ98 -> 8 | AS99: =AS98 -> 714 | AT99: =AC99+IF(s!AT98*s!AW98+s!AU98*s!AV98=0,0,E99*s!AT98*s!AW98/(s!AT98*s!AW98+s!AU98*s!AV98))+IF(s!AT98*s!AY98+s!AU98*s!AX98=0,0,K99*s!AT98*s!AY98/(s!AT98*s!AY98+s!AU98*s!AX98))+IF(s!AT98*s!AZ98+s!AV98*s!AX98=0,0,M99*s!AT98*s!AZ98/(s!AT98*s!AZ98+s!AV98*s!AX98))+IF(s!AT98*s!BA98+s!AU98*s!AZ98+s!AV98*s!AY98+s!AW98*s!AX98=0,0,N99*s!AT98*s!BA98/(s!AT98*s!BA98+s!AU98*s!AZ98+s!AV98*s!AY98+s!AW98*s!AX98)) -> 244.65839693634442 | AU99: =AD99+IF(s!AU98*s!AV98+s!AT98*s!AW98=0,0,E99*s!AU98*s!AV98/(s!AU98*s!AV98+s!AT98*s!AW98))+IF(s!AT98*s!AY98+s!AU98*s!AX98=0,0,K99*s!AU98*s!AX98/(s!AT98*s!AY98+s!AU98*s!AX98))+IF(s!AU98*s!BA98+s!AW98*s!AY98=0,0,O99*s!AU98*s!BA98/(s!AU98*s!BA98+s!AW98*s!AY98))+IF(s!AT98*s!BA98+s!AU98*s!AZ98+s!AV98*s!AY98+s!AW98*s!AX98=0,0,N99*s!AU98*s!AZ98/(s!AT98*s!BA98+s!AU98*s!AZ98+s!AV98*s!AY98+s!AW98*s!AX98)) -> 445.77362055038446 | AV99: =AE99+IF(s!AU98*s!AV98+s!AT98*s!AW98=0,0,E99*s!AU98*s!AV98/(s!AU98*s!AV98+s!AT98*s!AW98))+IF(s!AV98*s!AX98+s!AT98*s!AZ98=0,0,M99*s!AV98*s!AX98/(s!AV98*s!AX98+s!AT98*s!AZ98))+IF(s!AV98*s!BA98+s!AW98*s!AZ98=0,0,Q99*s!AV98*s!BA98/(s!AV98*s!BA98+s!AW98*s!AZ98))+IF(s!AT98*s!BA98+s!AU98*s!AZ98+s!AV98*s!AY98+s!AW98*s!AX98=0,0,N99*s!AV98*s!AY98/(s!AT98*s!BA98+s!AU98*s!AZ98+s!AV98*s!AY98+s!AW98*s!AX98)) -> 13.961447026625891 | AW99: =AF99+IF(s!AT98*s!AW98+s!AU98*s!AV98=0,0,E99*s!AT98*s!AW98/(s!AT98*s!AW98+s!AU98*s!AV98))+IF(s!AU98*s!BA98+s!AW98*s!AY98=0,0,O99*s!AW98*s!AY98/(s!AU98*s!BA98+s!AW98*s!AY98))+IF(s!AV98*s!BA98+s!AW98*s!AZ98=0,0,Q99*s!AW98*s!AZ98/(s!AV98*s!BA98+s!AW98*s!AZ98))+IF(s!AT98*s!BA98+s!AU98*s!AZ98+s!AV98*s!AY98+s!AW98*s!AX98=0,0,N99*s!AW98*s!AX98/(s!AT98*s!BA98+s!AU98*s!AZ98+s!AV98*s!AY98+s!AW98*s!AX98)) -> 9.6065354866451536 | AX99: =AG99+IF(s!AT98*s!AY98+s!AU98*s!AX98=0,0,K99*s!AU98*s!AX98/(s!AT98*s!AY98+s!AU98*s!AX98))+IF(s!AV98*s!AX98+s!AT98*s!AZ98=0,0,M99*s!AV98*s!AX98/(s!AV98*s!AX98+s!AT98*s!AZ98))+IF(s!AX98*s!BA98+s!AY98*s!AZ98=0,0,W99*s!AX98*s!BA98/(s!AX98*s!BA98+s!AY98*s!AZ98))+IF(s!AT98*s!BA98+s!AU98*s!AZ98+s!AV98*s!AY98+s!AW98*s!AX98=0,0,N99*s!AW98*s!AX98/(s!AT98*s!BA98+s!AU98*s!AZ98+s!AV98*s!AY98+s!AW98*s!AX98)) -> 13.990720119006806 | AY99: =AH99+IF(s!AT98*s!AY98+s!AU98*s!AX98=0,0,K99*s!AT98*s!AY98/(s!AT98*s!AY98+s!AU98*s!AX98))+IF(s!AU98*s!BA98+s!AW98*s!AY98=0,0,O99*s!AW98*s!AY98/(s!AU98*s!BA98+s!AW98*s!AY98))+IF(s!AX98*s!BA98+s!AY98*s!AZ98=0,0,W99*s!AY98*s!AZ98/(s!AX98*s!BA98+s!AY98*s!AZ98))+IF(s!AT98*s!BA98+s!AU98*s!AZ98+s!AV98*s!AY98+s!AW98*s!AX98=0,0,N99*s!AV98*s!AY98/(s!AT98*s!BA98+s!AU98*s!AZ98+s!AV98*s!AY98+s!AW98*s!AX98)) -> 10.577262394264238 | AZ99: =AI99+IF(s!AT98*s!AZ98+s!AV98*s!AX98=0,0,M99*s!AT98*s!AZ98/(s!AT98*s!AZ98+s!AV98*s!AX98))+IF(s!AV98*s!BA98+s!AW98*s!AZ98=0,0,Q99*s!AW98*s!AZ98/(s!AV98*s!BA98+s!AW98*s!AZ98))+IF(s!AX98*s!BA98+s!AY98*s!AZ98=0,0,W99*s!AY98*s!AZ98/(s!AX98*s!BA98+s!AY98*s!AZ98))+IF(s!AT98*s!BA98+s!AU98*s!AZ98+s!AV98*s!AY98+s!AW98*s!AX98=0,0,N99*s!AU98*s!AZ98/(s!AT98*s!BA98+s!AU98*s!AZ98+s!AV98*s!AY98+s!AW98*s!AX98)) -> 17.389435918022855 | BA99: =AJ99+IF(s!AU98*s!BA98+s!AW98*s!AY98=0,0,O99*s!AU98*s!BA98/(s!AU98*s!BA98+s!AW98*s!AY98))+IF(s!AV98*s!BA98+s!AW98*s!AZ98=0,0,Q99*s!AV98*s!BA98/(s!AV98*s!BA98+s!AW98*s!AZ98))+IF(s!AX98*s!BA98+s!AY98*s!AZ98=0,0,W99*s!AX98*s!BA98/(s!AX98*s!BA98+s!AY98*s!AZ98))+IF(s!AT98*s!BA98+s!AU98*s!AZ98+s!AV98*s!AY98+s!AW98*s!AX98=0,0,N99*s!AT98*s!BA98/(s!AT98*s!BA98+s!AU98*s!AZ98+s!AV98*s!AY98+s!AW98*s!AX98)) -> 22.042581568706105 | BJ99: =SUM(AT99:BA99) -> 778
A100: =A99 -> 100 | B100: =B99 -> 30 | C100: =C99 -> 200 | D100: =D99 -> 2 | E100: =E99 -> 4 | F100: =F99 -> 1 | G100: =G99 -> 1 | H100: =H99 -> 2 | I100: =I99 -> 1 | J100: =J99 -> 2 | K100: =K99 -> 4 | L100: =L99 -> 2 | M100: =M99 -> 4 | N100: =N99 -> 8 | O100: =O99 -> 4 | P100: =P99 -> 2 | Q100: =Q99 -> 4 | R100: =R99 -> 2 | S100: =S99 -> 1 | T100: =T99 -> 2 | U100: =U99 -> 1 | V100: =V99 -> 2 | W100: =W99 -> 4 | X100: =X99 -> 2 | Y100: =Y99 -> 1 | Z100: =Z99 -> 2 | AA100: =AA99 -> 1 | AB100: =AB99 -> 389 | AC100: =AC99 -> 234 | AD100: =AD99 -> 433 | AE100: =AE99 -> 8 | AF100: =AF99 -> 7 | AG100: =AG99 -> 8 | AH100: =AH99 -> 8 | AI100: =AI99 -> 8 | AJ100: =AJ99 -> 8 | AS100: =AS99 -> 714 | AT100: =AC100+IF(s!AT99*s!AW99+s!AU99*s!AV99=0,0,E100*s!AT99*s!AW99/(s!AT99*s!AW99+s!AU99*s!AV99))+IF(s!AT99*s!AY99+s!AU99*s!AX99=0,0,K100*s!AT99*s!AY99/(s!AT99*s!AY99+s!AU99*s!AX99))+IF(s!AT99*s!AZ99+s!AV99*s!AX99=0,0,M100*s!AT99*s!AZ99/(s!AT99*s!AZ99+s!AV99*s!AX99))+IF(s!AT99*s!BA99+s!AU99*s!AZ99+s!AV99*s!AY99+s!AW99*s!AX99=0,0,N100*s!AT99*s!BA99/(s!AT99*s!BA99+s!AU99*s!AZ99+s!AV99*s!AY99+s!AW99*s!AX99)) -> 244.65839693634442 | AU100: =AD100+IF(s!AU99*s!AV99+s!AT99*s!AW99=0,0,E100*s!AU99*s!AV99/(s!AU99*s!AV99+s!AT99*s!AW99))+IF(s!AT99*s!AY99+s!AU99*s!AX99=0,0,K100*s!AU99*s!AX99/(s!AT99*s!AY99+s!AU99*s!AX99))+IF(s!AU99*s!BA99+s!AW99*s!AY99=0,0,O100*s!AU99*s!BA99/(s!AU99*s!BA99+s!AW99*s!AY99))+IF(s!AT99*s!BA99+s!AU99*s!AZ99+s!AV99*s!AY99+s!AW99*s!AX99=0,0,N100*s!AU99*s!AZ99/(s!AT99*s!BA99+s!AU99*s!AZ99+s!AV99*s!AY99+s!AW99*s!AX99)) -> 445.77362055038446 | AV100: =AE100+IF(s!AU99*s!AV99+s!AT99*s!AW99=0,0,E100*s!AU99*s!AV99/(s!AU99*s!AV99+s!AT99*s!AW99))+IF(s!AV99*s!AX99+s!AT99*s!AZ99=0,0,M100*s!AV99*s!AX99/(s!AV99*s!AX99+s!AT99*s!AZ99))+IF(s!AV99*s!BA99+s!AW99*s!AZ99=0,0,Q100*s!AV99*s!BA99/(s!AV99*s!BA99+s!AW99*s!AZ99))+IF(s!AT99*s!BA99+s!AU99*s!AZ99+s!AV99*s!AY99+s!AW99*s!AX99=0,0,N100*s!AV99*s!AY99/(s!AT99*s!BA99+s!AU99*s!AZ99+s!AV99*s!AY99+s!AW99*s!AX99)) -> 13.961447026625894 | AW100: =AF100+IF(s!AT99*s!AW99+s!AU99*s!AV99=0,0,E100*s!AT99*s!AW99/(s!AT99*s!AW99+s!AU99*s!AV99))+IF(s!AU99*s!BA99+s!AW99*s!AY99=0,0,O100*s!AW99*s!AY99/(s!AU99*s!BA99+s!AW99*s!AY99))+IF(s!AV99*s!BA99+s!AW99*s!AZ99=0,0,Q100*s!AW99*s!AZ99/(s!AV99*s!BA99+s!AW99*s!AZ99))+IF(s!AT99*s!BA99+s!AU99*s!AZ99+s!AV99*s!AY99+s!AW99*s!AX99=0,0,N100*s!AW99*s!AX99/(s!AT99*s!BA99+s!AU99*s!AZ99+s!AV99*s!AY99+s!AW99*s!AX99)) -> 9.60653548664515 | AX100: =AG100+IF(s!AT99*s!AY99+s!AU99*s!AX99=0,0,K100*s!AU99*s!AX99/(s!AT99*s!AY99+s!AU99*s!AX99))+IF(s!AV99*s!AX99+s!AT99*s!AZ99=0,0,M100*s!AV99*s!AX99/(s!AV99*s!AX99+s!AT99*s!AZ99))+IF(s!AX99*s!BA99+s!AY99*s!AZ99=0,0,W100*s!AX99*s!BA99/(s!AX99*s!BA99+s!AY99*s!AZ99))+IF(s!AT99*s!BA99+s!AU99*s!AZ99+s!AV99*s!AY99+s!AW99*s!AX99=0,0,N100*s!AW99*s!AX99/(s!AT99*s!BA99+s!AU99*s!AZ99+s!AV99*s!AY99+s!AW99*s!AX99)) -> 13.990720119006808 | AY100: =AH100+IF(s!AT99*s!AY99+s!AU99*s!AX99=0,0,K100*s!AT99*s!AY99/(s!AT99*s!AY99+s!AU99*s!AX99))+IF(s!AU99*s!BA99+s!AW99*s!AY99=0,0,O100*s!AW99*s!AY99/(s!AU99*s!BA99+s!AW99*s!AY99))+IF(s!AX99*s!BA99+s!AY99*s!AZ99=0,0,W100*s!AY99*s!AZ99/(s!AX99*s!BA99+s!AY99*s!AZ99))+IF(s!AT99*s!BA99+s!AU99*s!AZ99+s!AV99*s!AY99+s!AW99*s!AX99=0,0,N100*s!AV99*s!AY99/(s!AT99*s!BA99+s!AU99*s!AZ99+s!AV99*s!AY99+s!AW99*s!AX99)) -> 10.577262394264237 | AZ100: =AI100+IF(s!AT99*s!AZ99+s!AV99*s!AX99=0,0,M100*s!AT99*s!AZ99/(s!AT99*s!AZ99+s!AV99*s!AX99))+IF(s!AV99*s!BA99+s!AW99*s!AZ99=0,0,Q100*s!AW99*s!AZ99/(s!AV99*s!BA99+s!AW99*s!AZ99))+IF(s!AX99*s!BA99+s!AY99*s!AZ99=0,0,W100*s!AY99*s!AZ99/(s!AX99*s!BA99+s!AY99*s!AZ99))+IF(s!AT99*s!BA99+s!AU99*s!AZ99+s!AV99*s!AY99+s!AW99*s!AX99=0,0,N100*s!AU99*s!AZ99/(s!AT99*s!BA99+s!AU99*s!AZ99+s!AV99*s!AY99+s!AW99*s!AX99)) -> 17.389435918022848 | BA100: =AJ100+IF(s!AU99*s!BA99+s!AW99*s!AY99=0,0,O100*s!AU99*s!BA99/(s!AU99*s!BA99+s!AW99*s!AY99))+IF(s!AV99*s!BA99+s!AW99*s!AZ99=0,0,Q100*s!AV99*s!BA99/(s!AV99*s!BA99+s!AW99*s!AZ99))+IF(s!AX99*s!BA99+s!AY99*s!AZ99=0,0,W100*s!AX99*s!BA99/(s!AX99*s!BA99+s!AY99*s!AZ99))+IF(s!AT99*s!BA99+s!AU99*s!AZ99+s!AV99*s!AY99+s!AW99*s!AX99=0,0,N100*s!AT99*s!BA99/(s!AT99*s!BA99+s!AU99*s!AZ99+s!AV99*s!AY99+s!AW99*s!AX99)) -> 22.042581568706112 | BJ100: =SUM(AT100:BA100) -> 778
A101: =A100 -> 100 | B101: =B100 -> 30 | C101: =C100 -> 200 | D101: =D100 -> 2 | E101: =E100 -> 4 | F101: =F100 -> 1 | G101: =G100 -> 1 | H101: =H100 -> 2 | I101: =I100 -> 1 | J101: =J100 -> 2 | K101: =K100 -> 4 | L101: =L100 -> 2 | M101: =M100 -> 4 | N101: =N100 -> 8 | O101: =O100 -> 4 | P101: =P100 -> 2 | Q101: =Q100 -> 4 | R101: =R100 -> 2 | S101: =S100 -> 1 | T101: =T100 -> 2 | U101: =U100 -> 1 | V101: =V100 -> 2 | W101: =W100 -> 4 | X101: =X100 -> 2 | Y101: =Y100 -> 1 | Z101: =Z100 -> 2 | AA101: =AA100 -> 1 | AB101: =AB100 -> 389 | AC101: =AC100 -> 234 | AD101: =AD100 -> 433 | AE101: =AE100 -> 8 | AF101: =AF100 -> 7 | AG101: =AG100 -> 8 | AH101: =AH100 -> 8 | AI101: =AI100 -> 8 | AJ101: =AJ100 -> 8 | AS101: =AS100 -> 714 | AT101: =AC101+IF(s!AT100*s!AW100+s!AU100*s!AV100=0,0,E101*s!AT100*s!AW100/(s!AT100*s!AW100+s!AU100*s!AV100))+IF(s!AT100*s!AY100+s!AU100*s!AX100=0,0,K101*s!AT100*s!AY100/(s!AT100*s!AY100+s!AU100*s!AX100))+IF(s!AT100*s!AZ100+s!AV100*s!AX100=0,0,M101*s!AT100*s!AZ100/(s!AT100*s!AZ100+s!AV100*s!AX100))+IF(s!AT100*s!BA100+s!AU100*s!AZ100+s!AV100*s!AY100+s!AW100*s!AX100=0,0,N101*s!AT100*s!BA100/(s!AT100*s!BA100+s!AU100*s!AZ100+s!AV100*s!AY100+s!AW100*s!AX100)) -> 244.65839693634442 | AU101: =AD101+IF(s!AU100*s!AV100+s!AT100*s!AW100=0,0,E101*s!AU100*s!AV100/(s!AU100*s!AV100+s!AT100*s!AW100))+IF(s!AT100*s!AY100+s!AU100*s!AX100=0,0,K101*s!AU100*s!AX100/(s!AT100*s!AY100+s!AU100*s!AX100))+IF(s!AU100*s!BA100+s!AW100*s!AY100=0,0,O101*s!AU100*s!BA100/(s!AU100*s!BA100+s!AW100*s!AY100))+IF(s!AT100*s!BA100+s!AU100*s!AZ100+s!AV100*s!AY100+s!AW100*s!AX100=0,0,N101*s!AU100*s!AZ100/(s!AT100*s!BA100+s!AU100*s!AZ100+s!AV100*s!AY100+s!AW100*s!AX100)) -> 445.77362055038446 | AV101: =AE101+IF(s!AU100*s!AV100+s!AT100*s!AW100=0,0,E101*s!AU100*s!AV100/(s!AU100*s!AV100+s!AT100*s!AW100))+IF(s!AV100*s!AX100+s!AT100*s!AZ100=0,0,M101*s!AV100*s!AX100/(s!AV100*s!AX100+s!AT100*s!AZ100))+IF(s!AV100*s!BA100+s!AW100*s!AZ100=0,0,Q101*s!AV100*s!BA100/(s!AV100*s!BA100+s!AW100*s!AZ100))+IF(s!AT100*s!BA100+s!AU100*s!AZ100+s!AV100*s!AY100+s!AW100*s!AX100=0,0,N101*s!AV100*s!AY100/(s!AT100*s!BA100+s!AU100*s!AZ100+s!AV100*s!AY100+s!AW100*s!AX100)) -> 13.961447026625899 | AW101: =AF101+IF(s!AT100*s!AW100+s!AU100*s!AV100=0,0,E101*s!AT100*s!AW100/(s!AT100*s!AW100+s!AU100*s!AV100))+IF(s!AU100*s!BA100+s!AW100*s!AY100=0,0,O101*s!AW100*s!AY100/(s!AU100*s!BA100+s!AW100*s!AY100))+IF(s!AV100*s!BA100+s!AW100*s!AZ100=0,0,Q101*s!AW100*s!AZ100/(s!AV100*s!BA100+s!AW100*s!AZ100))+IF(s!AT100*s!BA100+s!AU100*s!AZ100+s!AV100*s!AY100+s!AW100*s!AX100=0,0,N101*s!AW100*s!AX100/(s!AT100*s!BA100+s!AU100*s!AZ100+s!AV100*s!AY100+s!AW100*s!AX100)) -> 9.6065354866451482 | AX101: =AG101+IF(s!AT100*s!AY100+s!AU100*s!AX100=0,0,K101*s!AU100*s!AX100/(s!AT100*s!AY100+s!AU100*s!AX100))+IF(s!AV100*s!AX100+s!AT100*s!AZ100=0,0,M101*s!AV100*s!AX100/(s!AV100*s!AX100+s!AT100*s!AZ100))+IF(s!AX100*s!BA100+s!AY100*s!AZ100=0,0,W101*s!AX100*s!BA100/(s!AX100*s!BA100+s!AY100*s!AZ100))+IF(s!AT100*s!BA100+s!AU100*s!AZ100+s!AV100*s!AY100+s!AW100*s!AX100=0,0,N101*s!AW100*s!AX100/(s!AT100*s!BA100+s!AU100*s!AZ100+s!AV100*s!AY100+s!AW100*s!AX100)) -> 13.990720119006811 | AY101: =AH101+IF(s!AT100*s!AY100+s!AU100*s!AX100=0,0,K101*s!AT100*s!AY100/(s!AT100*s!AY100+s!AU100*s!AX100))+IF(s!AU100*s!BA100+s!AW100*s!AY100=0,0,O101*s!AW100*s!AY100/(s!AU100*s!BA100+s!AW100*s!AY100))+IF(s!AX100*s!BA100+s!AY100*s!AZ100=0,0,W101*s!AY100*s!AZ100/(s!AX100*s!BA100+s!AY100*s!AZ100))+IF(s!AT100*s!BA100+s!AU100*s!AZ100+s!AV100*s!AY100+s!AW100*s!AX100=0,0,N101*s!AV100*s!AY100/(s!AT100*s!BA100+s!AU100*s!AZ100+s!AV100*s!AY100+s!AW100*s!AX100)) -> 10.577262394264235 | AZ101: =AI101+IF(s!AT100*s!AZ100+s!AV100*s!AX100=0,0,M101*s!AT100*s!AZ100/(s!AT100*s!AZ100+s!AV100*s!AX100))+IF(s!AV100*s!BA100+s!AW100*s!AZ100=0,0,Q101*s!AW100*s!AZ100/(s!AV100*s!BA100+s!AW100*s!AZ100))+IF(s!AX100*s!BA100+s!AY100*s!AZ100=0,0,W101*s!AY100*s!AZ100/(s!AX100*s!BA100+s!AY100*s!AZ100))+IF(s!AT100*s!BA100+s!AU100*s!AZ100+s!AV100*s!AY100+s!AW100*s!AX100=0,0,N101*s!AU100*s!AZ100/(s!AT100*s!BA100+s!AU100*s!AZ100+s!AV100*s!AY100+s!AW100*s!AX100)) -> 17.389435918022841 | BA101: =AJ101+IF(s!AU100*s!BA100+s!AW100*s!AY100=0,0,O101*s!AU100*s!BA100/(s!AU100*s!BA100+s!AW100*s!AY100))+IF(s!AV100*s!BA100+s!AW100*s!AZ100=0,0,Q101*s!AV100*s!BA100/(s!AV100*s!BA100+s!AW100*s!AZ100))+IF(s!AX100*s!BA100+s!AY100*s!AZ100=0,0,W101*s!AX100*s!BA100/(s!AX100*s!BA100+s!AY100*s!AZ100))+IF(s!AT100*s!BA100+s!AU100*s!AZ100+s!AV100*s!AY100+s!AW100*s!AX100=0,0,N101*s!AT100*s!BA100/(s!AT100*s!BA100+s!AU100*s!AZ100+s!AV100*s!AY100+s!AW100*s!AX100)) -> 22.042581568706115 | BJ101: =SUM(AT101:BA101) -> 778
A102: =A101 -> 100 | B102: =B101 -> 30 | C102: =C101 -> 200 | D102: =D101 -> 2 | E102: =E101 -> 4 | F102: =F101 -> 1 | G102: =G101 -> 1 | H102: =H101 -> 2 | I102: =I101 -> 1 | J102: =J101 -> 2 | K102: =K101 -> 4 | L102: =L101 -> 2 | M102: =M101 -> 4 | N102: =N101 -> 8 | O102: =O101 -> 4 | P102: =P101 -> 2 | Q102: =Q101 -> 4 | R102: =R101 -> 2 | S102: =S101 -> 1 | T102: =T101 -> 2 | U102: =U101 -> 1 | V102: =V101 -> 2 | W102: =W101 -> 4 | X102: =X101 -> 2 | Y102: =Y101 -> 1 | Z102: =Z101 -> 2 | AA102: =AA101 -> 1 | AB102: =AB101 -> 389 | AC102: =AC101 -> 234 | AD102: =AD101 -> 433 | AE102: =AE101 -> 8 | AF102: =AF101 -> 7 | AG102: =AG101 -> 8 | AH102: =AH101 -> 8 | AI102: =AI101 -> 8 | AJ102: =AJ101 -> 8 | AS102: =AS101 -> 714 | AT102: =AC102+IF(s!AT101*s!AW101+s!AU101*s!AV101=0,0,E102*s!AT101*s!AW101/(s!AT101*s!AW101+s!AU101*s!AV101))+IF(s!AT101*s!AY101+s!AU101*s!AX101=0,0,K102*s!AT101*s!AY101/(s!AT101*s!AY101+s!AU101*s!AX101))+IF(s!AT101*s!AZ101+s!AV101*s!AX101=0,0,M102*s!AT101*s!AZ101/(s!AT101*s!AZ101+s!AV101*s!AX101))+IF(s!AT101*s!BA101+s!AU101*s!AZ101+s!AV101*s!AY101+s!AW101*s!AX101=0,0,N102*s!AT101*s!BA101/(s!AT101*s!BA101+s!AU101*s!AZ101+s!AV101*s!AY101+s!AW101*s!AX101)) -> 244.65839693634442 | AU102: =AD102+IF(s!AU101*s!AV101+s!AT101*s!AW101=0,0,E102*s!AU101*s!AV101/(s!AU101*s!AV101+s!AT101*s!AW101))+IF(s!AT101*s!AY101+s!AU101*s!AX101=0,0,K102*s!AU101*s!AX101/(s!AT101*s!AY101+s!AU101*s!AX101))+IF(s!AU101*s!BA101+s!AW101*s!AY101=0,0,O102*s!AU101*s!BA101/(s!AU101*s!BA101+s!AW101*s!AY101))+IF(s!AT101*s!BA101+s!AU101*s!AZ101+s!AV101*s!AY101+s!AW101*s!AX101=0,0,N102*s!AU101*s!AZ101/(s!AT101*s!BA101+s!AU101*s!AZ101+s!AV101*s!AY101+s!AW101*s!AX101)) -> 445.77362055038441 | AV102: =AE102+IF(s!AU101*s!AV101+s!AT101*s!AW101=0,0,E102*s!AU101*s!AV101/(s!AU101*s!AV101+s!AT101*s!AW101))+IF(s!AV101*s!AX101+s!AT101*s!AZ101=0,0,M102*s!AV101*s!AX101/(s!AV101*s!AX101+s!AT101*s!AZ101))+IF(s!AV101*s!BA101+s!AW101*s!AZ101=0,0,Q102*s!AV101*s!BA101/(s!AV101*s!BA101+s!AW101*s!AZ101))+IF(s!AT101*s!BA101+s!AU101*s!AZ101+s!AV101*s!AY101+s!AW101*s!AX101=0,0,N102*s!AV101*s!AY101/(s!AT101*s!BA101+s!AU101*s!AZ101+s!AV101*s!AY101+s!AW101*s!AX101)) -> 13.961447026625901 | AW102: =AF102+IF(s!AT101*s!AW101+s!AU101*s!AV101=0,0,E102*s!AT101*s!AW101/(s!AT101*s!AW101+s!AU101*s!AV101))+IF(s!AU101*s!BA101+s!AW101*s!AY101=0,0,O102*s!AW101*s!AY101/(s!AU101*s!BA101+s!AW101*s!AY101))+IF(s!AV101*s!BA101+s!AW101*s!AZ101=0,0,Q102*s!AW101*s!AZ101/(s!AV101*s!BA101+s!AW101*s!AZ101))+IF(s!AT101*s!BA101+s!AU101*s!AZ101+s!AV101*s!AY101+s!AW101*s!AX101=0,0,N102*s!AW101*s!AX101/(s!AT101*s!BA101+s!AU101*s!AZ101+s!AV101*s!AY101+s!AW101*s!AX101)) -> 9.6065354866451447 | AX102: =AG102+IF(s!AT101*s!AY101+s!AU101*s!AX101=0,0,K102*s!AU101*s!AX101/(s!AT101*s!AY101+s!AU101*s!AX101))+IF(s!AV101*s!AX101+s!AT101*s!AZ101=0,0,M102*s!AV101*s!AX101/(s!AV101*s!AX101+s!AT101*s!AZ101))+IF(s!AX101*s!BA101+s!AY101*s!AZ101=0,0,W102*s!AX101*s!BA101/(s!AX101*s!BA101+s!AY101*s!AZ101))+IF(s!AT101*s!BA101+s!AU101*s!AZ101+s!AV101*s!AY101+s!AW101*s!AX101=0,0,N102*s!AW101*s!AX101/(s!AT101*s!BA101+s!AU101*s!AZ101+s!AV101*s!AY101+s!AW101*s!AX101)) -> 13.990720119006813 | AY102: =AH102+IF(s!AT101*s!AY101+s!AU101*s!AX101=0,0,K102*s!AT101*s!AY101/(s!AT101*s!AY101+s!AU101*s!AX101))+IF(s!AU101*s!BA101+s!AW101*s!AY101=0,0,O102*s!AW101*s!AY101/(s!AU101*s!BA101+s!AW101*s!AY101))+IF(s!AX101*s!BA101+s!AY101*s!AZ101=0,0,W102*s!AY101*s!AZ101/(s!AX101*s!BA101+s!AY101*s!AZ101))+IF(s!AT101*s!BA101+s!AU101*s!AZ101+s!AV101*s!AY101+s!AW101*s!AX101=0,0,N102*s!AV101*s!AY101/(s!AT101*s!BA101+s!AU101*s!AZ101+s!AV101*s!AY101+s!AW101*s!AX101)) -> 10.577262394264231 | AZ102: =AI102+IF(s!AT101*s!AZ101+s!AV101*s!AX101=0,0,M102*s!AT101*s!AZ101/(s!AT101*s!AZ101+s!AV101*s!AX101))+IF(s!AV101*s!BA101+s!AW101*s!AZ101=0,0,Q102*s!AW101*s!AZ101/(s!AV101*s!BA101+s!AW101*s!AZ101))+IF(s!AX101*s!BA101+s!AY101*s!AZ101=0,0,W102*s!AY101*s!AZ101/(s!AX101*s!BA101+s!AY101*s!AZ101))+IF(s!AT101*s!BA101+s!AU101*s!AZ101+s!AV101*s!AY101+s!AW101*s!AX101=0,0,N102*s!AU101*s!AZ101/(s!AT101*s!BA101+s!AU101*s!AZ101+s!AV101*s!AY101+s!AW101*s!AX101)) -> 17.389435918022837 | BA102: =AJ102+IF(s!AU101*s!BA101+s!AW101*s!AY101=0,0,O102*s!AU101*s!BA101/(s!AU101*s!BA101+s!AW101*s!AY101))+IF(s!AV101*s!BA101+s!AW101*s!AZ101=0,0,Q102*s!AV101*s!BA101/(s!AV101*s!BA101+s!AW101*s!AZ101))+IF(s!AX101*s!BA101+s!AY101*s!AZ101=0,0,W102*s!AX101*s!BA101/(s!AX101*s!BA101+s!AY101*s!AZ101))+IF(s!AT101*s!BA101+s!AU101*s!AZ101+s!AV101*s!AY101+s!AW101*s!AX101=0,0,N102*s!AT101*s!BA101/(s!AT101*s!BA101+s!AU101*s!AZ101+s!AV101*s!AY101+s!AW101*s!AX101)) -> 22.042581568706119 | BJ102: =SUM(AT102:BA102) -> 778